B1: PRO | G1: Thru Peoria | J1: SUPER STOCK | P1: Thru Peoria
B2: Name | C2: City/State | D2: Eng | E2: NQS # | F2: Tractor | G2: Points Back | K2: Name | L2: City/State | M2: Eng. | N2: NQS # | O2: Tractor | P2: Points Back
A3: ='\\ser\Software\other\[POINTS NQS  2012.XLS]Pro Stock'!$A7 -> 1 | B3: ='\\ser\Software\other\[POINTS NQS  2012.XLS]Pro Stock'!$B7 -> Kelly Nichols | C3: ='\\ser\Software\other\[POINTS NQS  2012.XLS]Pro Stock'!$C7 -> Lore City, Oh | D3: =IF('\\ser\Software\other\[POINTS NQS  2012.XLS]Pro Stock'!$D7=0," ",'\\ser\Software\other\[POINTS NQS  2012.XLS]Pro Stock'!$D7) -> NP | E3: ='\\ser\Software\other\[POINTS NQS  2012.XLS]Pro Stock'!$E7 -> 70 | F3: =IF('\\ser\Software\other\[POINTS NQS  2012.XLS]Pro Stock'!$F7=0," ",'\\ser\Software\other\[POINTS NQS  2012.XLS]Pro Stock'!$F7) -> Wild One 2 | G3: ='\\ser\Software\other\[POINTS NQS  2012.XLS]Pro Stock'!$AA7 -> 0 | J3: ='\\ser\Software\other\[POINTS NQS  2012.XLS]Super Stock'!$A7 -> 1 | K3: ='\\ser\Software\other\[POINTS NQS  2012.XLS]Super Stock'!$B7 -> Greg Curtsinger | L3: ='\\ser\Software\other\[POINTS NQS  2012.XLS]Super Stock'!$C7 -> Carlilse, KY | M3: =IF('\\ser\Software\other\[POINTS NQS  2012.XLS]Super Stock'!$D7=0," ",'\\ser\Software\other\[POINTS NQS  2012.XLS]Super Stock'!$D7) -> NP | N3: ='\\ser\Software\other\[POINTS NQS  2012.XLS]Super Stock'!$E7 -> 8 | O3: =IF('\\ser\Software\other\[POINTS NQS  2012.XLS]Super Stock'!$F7=0," ",'\\ser\Software\other\[POINTS NQS  2012.XLS]Super Stock'!$F7) -> Wicked Deere | P3: ='\\ser\Software\other\[POINTS NQS  2012.XLS]Super Stock'!$AA7 -> 0
A4: ='\\ser\Software\other\[POINTS NQS  2012.XLS]Pro Stock'!$A8 -> 2 | B4: ='\\ser\Software\other\[POINTS NQS  2012.XLS]Pro Stock'!$B8 -> Jerry Skuta | C4: ='\\ser\Software\other\[POINTS NQS  2012.XLS]Pro Stock'!$C8 -> Kimball, Mich | D4: =IF('\\ser\Software\other\[POINTS NQS  2012.XLS]Pro Stock'!$D8=0," ",'\\ser\Software\other\[POINTS NQS  2012.XLS]Pro Stock'!$D8) -> NP | E4: ='\\ser\Software\other\[POINTS NQS  2012.XLS]Pro Stock'!$E8 -> 329 | F4: =IF('\\ser\Software\other\[POINTS NQS  2012.XLS]Pro Stock'!$F8=0," ",'\\ser\Software\other\[POINTS NQS  2012.XLS]Pro Stock'!$F8) -> Green Tractor | G4: ='\\ser\Software\other\[POINTS NQS  2012.XLS]Pro Stock'!$AA8 -> 10 | J4: ='\\ser\Software\other\[POINTS NQS  2012.XLS]Super Stock'!$A8 -> 2 | K4: ='\\ser\Software\other\[POINTS NQS  2012.XLS]Super Stock'!$B8 -> Kelly Nichols | L4: ='\\ser\Software\other\[POINTS NQS  2012.XLS]Super Stock'!$C8 -> Lore City, OH | M4: =IF('\\ser\Software\other\[POINTS NQS  2012.XLS]Super Stock'!$D8=0," ",'\\ser\Software\other\[POINTS NQS  2012.XLS]Super Stock'!$D8) -> NP | N4: ='\\ser\Software\other\[POINTS NQS  2012.XLS]Super Stock'!$E8 -> 70 | O4: =IF('\\ser\Software\other\[POINTS NQS  2012.XLS]Super Stock'!$F8=0," ",'\\ser\Software\other\[POINTS NQS  2012.XLS]Super Stock'!$F8) -> Wild One 2 | P4: ='\\ser\Software\other\[POINTS NQS  2012.XLS]Super Stock'!$AA8 -> 13
A5: ='\\ser\Software\other\[POINTS NQS  2012.XLS]Pro Stock'!$A9 -> 3 | B5: ='\\ser\Software\other\[POINTS NQS  2012.XLS]Pro Stock'!$B9 -> Drew Burton | C5: ='\\ser\Software\other\[POINTS NQS  2012.XLS]Pro Stock'!$C9 -> Brookston,Ill | D5: =IF('\\ser\Software\other\[POINTS NQS  2012.XLS]Pro Stock'!$D9=0," ",'\\ser\Software\other\[POINTS NQS  2012.XLS]Pro Stock'!$D9) -> NP | E5: ='\\ser\Software\other\[POINTS NQS  2012.XLS]Pro Stock'!$E9 -> 14 | F5: =IF('\\ser\Software\other\[POINTS NQS  2012.XLS]Pro Stock'!$F9=0," ",'\\ser\Software\other\[POINTS NQS  2012.XLS]Pro Stock'!$F9) -> Bad Company | G5: ='\\ser\Software\other\[POINTS NQS  2012.XLS]Pro Stock'!$AA9 -> 18 | J5: ='\\ser\Software\other\[POINTS NQS  2012.XLS]Super Stock'!$A9 -> 3 | K5: ='\\ser\Software\other\[POINTS NQS  2012.XLS]Super Stock'!$B9 -> Eli Zimmerman | L5: ='\\ser\Software\other\[POINTS NQS  2012.XLS]Super Stock'!$C9 -> Allentown, PA | M5: =IF('\\ser\Software\other\[POINTS NQS  2012.XLS]Super Stock'!$D9=0," ",'\\ser\Software\other\[POINTS NQS  2012.XLS]Super Stock'!$D9) -> NP | N5: ='\\ser\Software\other\[POINTS NQS  2012.XLS]Super Stock'!$E9 -> 456 | O5: =IF('\\ser\Software\other\[POINTS NQS  2012.XLS]Super Stock'!$F9=0," ",'\\ser\Software\other\[POINTS NQS  2012.XLS]Super Stock'!$F9) -> Lot of Nichols | P5: ='\\ser\Software\other\[POINTS NQS  2012.XLS]Super Stock'!$AA9 -> 13
A6: ='\\ser\Software\other\[POINTS NQS  2012.XLS]Pro Stock'!$A10 -> 4 | B6: ='\\ser\Software\other\[POINTS NQS  2012.XLS]Pro Stock'!$B10 -> Drew Burton | C6: ='\\ser\Software\other\[POINTS NQS  2012.XLS]Pro Stock'!$C10 -> Brookston, Ill | D6: =IF('\\ser\Software\other\[POINTS NQS  2012.XLS]Pro Stock'!$D10=0," ",'\\ser\Software\other\[POINTS NQS  2012.XLS]Pro Stock'!$D10) -> NP | E6: ='\\ser\Software\other\[POINTS NQS  2012.XLS]Pro Stock'!$E10 -> 15 | F6: =IF('\\ser\Software\other\[POINTS NQS  2012.XLS]Pro Stock'!$F10=0," ",'\\ser\Software\other\[POINTS NQS  2012.XLS]Pro Stock'!$F10) -> Plain Nuts | G6: ='\\ser\Software\other\[POINTS NQS  2012.XLS]Pro Stock'!$AA10 -> 32 | J6: ='\\ser\Software\other\[POINTS NQS  2012.XLS]Super Stock'!$A10 -> 4 | K6: ='\\ser\Software\other\[POINTS NQS  2012.XLS]Super Stock'!$B10 -> Larry Curtsinger | L6: ='\\ser\Software\other\[POINTS NQS  2012.XLS]Super Stock'!$C10 -> Carlilse, KY | M6: =IF('\\ser\Software\other\[POINTS NQS  2012.XLS]Super Stock'!$D10=0," ",'\\ser\Software\other\[POINTS NQS  2012.XLS]Super Stock'!$D10) -> NP | N6: ='\\ser\Software\other\[POINTS NQS  2012.XLS]Super Stock'!$E10 -> 9 | O6: =IF('\\ser\Software\other\[POINTS NQS  2012.XLS]Super Stock'!$F10=0," ",'\\ser\Software\other\[POINTS NQS  2012.XLS]Super Stock'!$F10) -> Runaway Deere | P6: ='\\ser\Software\other\[POINTS NQS  2012.XLS]Super Stock'!$AA10 -> 28
A7: ='\\ser\Software\other\[POINTS NQS  2012.XLS]Pro Stock'!$A11 -> 5 | B7: ='\\ser\Software\other\[POINTS NQS  2012.XLS]Pro Stock'!$B11 -> Greg Curtsinger | C7: ='\\ser\Software\other\[POINTS NQS  2012.XLS]Pro Stock'!$C11 -> Carlisle. Ky | D7: =IF('\\ser\Software\other\[POINTS NQS  2012.XLS]Pro Stock'!$D11=0," ",'\\ser\Software\other\[POINTS NQS  2012.XLS]Pro Stock'!$D11) -> NP | E7: ='\\ser\Software\other\[POINTS NQS  2012.XLS]Pro Stock'!$E11 -> 8 | F7: =IF('\\ser\Software\other\[POINTS NQS  2012.XLS]Pro Stock'!$F11=0," ",'\\ser\Software\other\[POINTS NQS  2012.XLS]Pro Stock'!$F11) -> Wicked Deere | G7: ='\\ser\Software\other\[POINTS NQS  2012.XLS]Pro Stock'!$AA11 -> 36 | J7: ='\\ser\Software\other\[POINTS NQS  2012.XLS]Super Stock'!$A11 -> 5 | K7: ='\\ser\Software\other\[POINTS NQS  2012.XLS]Super Stock'!$B11 -> Jerry Binkley | L7: ='\\ser\Software\other\[POINTS NQS  2012.XLS]Super Stock'!$C11 -> Jefferson City, MO | M7: =IF('\\ser\Software\other\[POINTS NQS  2012.XLS]Super Stock'!$D11=0," ",'\\ser\Software\other\[POINTS NQS  2012.XLS]Super Stock'!$D11) -> MVP | N7: ='\\ser\Software\other\[POINTS NQS  2012.XLS]Super Stock'!$E11 -> 92 | O7: =IF('\\ser\Software\other\[POINTS NQS  2012.XLS]Super Stock'!$F11=0," ",'\\ser\Software\other\[POINTS NQS  2012.XLS]Super Stock'!$F11) -> Grandpa's Toy | P7: ='\\ser\Software\other\[POINTS NQS  2012.XLS]Super Stock'!$AA11 -> 40
A8: ='\\ser\Software\other\[POINTS NQS  2012.XLS]Pro Stock'!$A12 -> 6 | B8: ='\\ser\Software\other\[POINTS NQS  2012.XLS]Pro Stock'!$B12 -> Cody Costa | C8: ='\\ser\Software\other\[POINTS NQS  2012.XLS]Pro Stock'!$C12 -> Greencastle,Pa | D8: =IF('\\ser\Software\other\[POINTS NQS  2012.XLS]Pro Stock'!$D12=0," ",'\\ser\Software\other\[POINTS NQS  2012.XLS]Pro Stock'!$D12) -> NP | E8: ='\\ser\Software\other\[POINTS NQS  2012.XLS]Pro Stock'!$E12 -> 397 | F8: =IF('\\ser\Software\other\[POINTS NQS  2012.XLS]Pro Stock'!$F12=0," ",'\\ser\Software\other\[POINTS NQS  2012.XLS]Pro Stock'!$F12) -> Crossthreaded | G8: ='\\ser\Software\other\[POINTS NQS  2012.XLS]Pro Stock'!$AA12 -> 37 | J8: ='\\ser\Software\other\[POINTS NQS  2012.XLS]Super Stock'!$A12 -> 6 | K8: ='\\ser\Software\other\[POINTS NQS  2012.XLS]Super Stock'!$B12 -> Jerry Skuta | L8: ='\\ser\Software\other\[POINTS NQS  2012.XLS]Super Stock'!$C12 -> Kimball, MI | M8: =IF('\\ser\Software\other\[POINTS NQS  2012.XLS]Super Stock'!$D12=0," ",'\\ser\Software\other\[POINTS NQS  2012.XLS]Super Stock'!$D12) -> NP | N8: ='\\ser\Software\other\[POINTS NQS  2012.XLS]Super Stock'!$E12 -> 330 | O8: =IF('\\ser\Software\other\[POINTS NQS  2012.XLS]Super Stock'!$F12=0," ",'\\ser\Software\other\[POINTS NQS  2012.XLS]Super Stock'!$F12) -> Mental Health 2 | P8: ='\\ser\Software\other\[POINTS NQS  2012.XLS]Super Stock'!$AA12 -> 44
A9: ='\\ser\Software\other\[POINTS NQS  2012.XLS]Pro Stock'!$A13 -> 7 | B9: ='\\ser\Software\other\[POINTS NQS  2012.XLS]Pro Stock'!$B13 -> Jerry Skuta | C9: ='\\ser\Software\other\[POINTS NQS  2012.XLS]Pro Stock'!$C13 -> Kimball, Mich | D9: =IF('\\ser\Software\other\[POINTS NQS  2012.XLS]Pro Stock'!$D13=0," ",'\\ser\Software\other\[POINTS NQS  2012.XLS]Pro Stock'!$D13) -> NP | E9: ='\\ser\Software\other\[POINTS NQS  2012.XLS]Pro Stock'!$E13 -> 330 | F9: =IF('\\ser\Software\other\[POINTS NQS  2012.XLS]Pro Stock'!$F13=0," ",'\\ser\Software\other\[POINTS NQS  2012.XLS]Pro Stock'!$F13) -> Mental Health | G9: ='\\ser\Software\other\[POINTS NQS  2012.XLS]Pro Stock'!$AA13 -> 46 | J9: ='\\ser\Software\other\[POINTS NQS  2012.XLS]Super Stock'!$A13 -> 7 | K9: ='\\ser\Software\other\[POINTS NQS  2012.XLS]Super Stock'!$B13 -> Cody Costa | L9: ='\\ser\Software\other\[POINTS NQS  2012.XLS]Super Stock'!$C13 -> Greencastle, PA | M9: =IF('\\ser\Software\other\[POINTS NQS  2012.XLS]Super Stock'!$D13=0," ",'\\ser\Software\other\[POINTS NQS  2012.XLS]Super Stock'!$D13) -> NP | N9: ='\\ser\Software\other\[POINTS NQS  2012.XLS]Super Stock'!$E13 -> 397 | O9: =IF('\\ser\Software\other\[POINTS NQS  2012.XLS]Super Stock'!$F13=0," ",'\\ser\Software\other\[POINTS NQS  2012.XLS]Super Stock'!$F13) -> Crossthreaded | P9: ='\\ser\Software\other\[POINTS NQS  2012.XLS]Super Stock'!$AA13 -> 47
A10: ='\\ser\Software\other\[POINTS NQS  2012.XLS]Pro Stock'!$A14 -> 8 | B10: ='\\ser\Software\other\[POINTS NQS  2012.XLS]Pro Stock'!$B14 -> Larry Fox | C10: ='\\ser\Software\other\[POINTS NQS  2012.XLS]Pro Stock'!$C14 -> Reynoldsburg, Oh | D10: =IF('\\ser\Software\other\[POINTS NQS  2012.XLS]Pro Stock'!$D14=0," ",'\\ser\Software\other\[POINTS NQS  2012.XLS]Pro Stock'!$D14) -> JRS | E10: ='\\ser\Software\other\[POINTS NQS  2012.XLS]Pro Stock'!$E14 -> 7 | F10: =IF('\\ser\Software\other\[POINTS NQS  2012.XLS]Pro Stock'!$F14=0," ",'\\ser\Software\other\[POINTS NQS  2012.XLS]Pro Stock'!$F14) -> Intimidation | G10: ='\\ser\Software\other\[POINTS NQS  2012.XLS]Pro Stock'!$AA14 -> 56 | J10: ='\\ser\Software\other\[POINTS NQS  2012.XLS]Super Stock'!$A14 -> 8 | K10: ='\\ser\Software\other\[POINTS NQS  2012.XLS]Super Stock'!$B14 -> Steve Williford | L10: ='\\ser\Software\other\[POINTS NQS  2012.XLS]Super Stock'!$C14 -> Engelhard, NC | M10: =IF('\\ser\Software\other\[POINTS NQS  2012.XLS]Super Stock'!$D14=0," ",'\\ser\Software\other\[POINTS NQS  2012.XLS]Super Stock'!$D14) -> MVP | N10: ='\\ser\Software\other\[POINTS NQS  2012.XLS]Super Stock'!$E14 -> 276 | O10: =IF('\\ser\Software\other\[POINTS NQS  2012.XLS]Super Stock'!$F14=0," ",'\\ser\Software\other\[POINTS NQS  2012.XLS]Super Stock'!$F14) -> IH Express #1 | P10: ='\\ser\Software\other\[POINTS NQS  2012.XLS]Super Stock'!$AA14 -> 52
A11: ='\\ser\Software\other\[POINTS NQS  2012.XLS]Pro Stock'!$A15 -> 9 | B11: ='\\ser\Software\other\[POINTS NQS  2012.XLS]Pro Stock'!$B15 -> Tyler Hackman | C11: ='\\ser\Software\other\[POINTS NQS  2012.XLS]Pro Stock'!$C15 -> Seymour, Ind | D11: =IF('\\ser\Software\other\[POINTS NQS  2012.XLS]Pro Stock'!$D15=0," ",'\\ser\Software\other\[POINTS NQS  2012.XLS]Pro Stock'!$D15) -> Hackman | E11: ='\\ser\Software\other\[POINTS NQS  2012.XLS]Pro Stock'!$E15 -> 507 | F11: =IF('\\ser\Software\other\[POINTS NQS  2012.XLS]Pro Stock'!$F15=0," ",'\\ser\Software\other\[POINTS NQS  2012.XLS]Pro Stock'!$F15) -> Mad Hatter | G11: ='\\ser\Software\other\[POINTS NQS  2012.XLS]Pro Stock'!$AA15 -> 56 | J11: ='\\ser\Software\other\[POINTS NQS  2012.XLS]Super Stock'!$A15 -> 9 | K11: ='\\ser\Software\other\[POINTS NQS  2012.XLS]Super Stock'!$B15 -> Jerry Skuta | L11: ='\\ser\Software\other\[POINTS NQS  2012.XLS]Super Stock'!$C15 -> Kimball, MI | M11: =IF('\\ser\Software\other\[POINTS NQS  2012.XLS]Super Stock'!$D15=0," ",'\\ser\Software\other\[POINTS NQS  2012.XLS]Super Stock'!$D15) -> NP | N11: ='\\ser\Software\other\[POINTS NQS  2012.XLS]Super Stock'!$E15 -> 329 | O11: =IF('\\ser\Software\other\[POINTS NQS  2012.XLS]Super Stock'!$F15=0," ",'\\ser\Software\other\[POINTS NQS  2012.XLS]Super Stock'!$F15) -> Green Tractor | P11: ='\\ser\Software\other\[POINTS NQS  2012.XLS]Super Stock'!$AA15 -> 53
A12: ='\\ser\Software\other\[POINTS NQS  2012.XLS]Pro Stock'!$A16 -> 10 | B12: ='\\ser\Software\other\[POINTS NQS  2012.XLS]Pro Stock'!$B16 -> Eli Zimmerman | C12: ='\\ser\Software\other\[POINTS NQS  2012.XLS]Pro Stock'!$C16 -> Allentown, Pa | D12: =IF('\\ser\Software\other\[POINTS NQS  2012.XLS]Pro Stock'!$D16=0," ",'\\ser\Software\other\[POINTS NQS  2012.XLS]Pro Stock'!$D16) -> NP | E12: ='\\ser\Software\other\[POINTS NQS  2012.XLS]Pro Stock'!$E16 -> 456 | F12: =IF('\\ser\Software\other\[POINTS NQS  2012.XLS]Pro Stock'!$F16=0," ",'\\ser\Software\other\[POINTS NQS  2012.XLS]Pro Stock'!$F16) -> Lots of Nichols | G12: ='\\ser\Software\other\[POINTS NQS  2012.XLS]Pro Stock'!$AA16 -> 60 | J12: ='\\ser\Software\other\[POINTS NQS  2012.XLS]Super Stock'!$A16 -> 10 | K12: ='\\ser\Software\other\[POINTS NQS  2012.XLS]Super Stock'!$B16 -> Drew Burton | L12: ='\\ser\Software\other\[POINTS NQS  2012.XLS]Super Stock'!$C16 -> Brookston, IN | M12: =IF('\\ser\Software\other\[POINTS NQS  2012.XLS]Super Stock'!$D16=0," ",'\\ser\Software\other\[POINTS NQS  2012.XLS]Super Stock'!$D16) -> NP | N12: ='\\ser\Software\other\[POINTS NQS  2012.XLS]Super Stock'!$E16 -> 14 | O12: =IF('\\ser\Software\other\[POINTS NQS  2012.XLS]Super Stock'!$F16=0," ",'\\ser\Software\other\[POINTS NQS  2012.XLS]Super Stock'!$F16) -> Bad Company | P12: ='\\ser\Software\other\[POINTS NQS  2012.XLS]Super Stock'!$AA16 -> 56
A13: ='\\ser\Software\other\[POINTS NQS  2012.XLS]Pro Stock'!$A17 -> 11 | B13: ='\\ser\Software\other\[POINTS NQS  2012.XLS]Pro Stock'!$B17 -> Daryl Musser | C13: ='\\ser\Software\other\[POINTS NQS  2012.XLS]Pro Stock'!$C17 -> Greencastle, Pa | D13: =IF('\\ser\Software\other\[POINTS NQS  2012.XLS]Pro Stock'!$D17=0," ",'\\ser\Software\other\[POINTS NQS  2012.XLS]Pro Stock'!$D17) -> NP | E13: ='\\ser\Software\other\[POINTS NQS  2012.XLS]Pro Stock'!$E17 -> 396 | F13: =IF('\\ser\Software\other\[POINTS NQS  2012.XLS]Pro Stock'!$F17=0," ",'\\ser\Software\other\[POINTS NQS  2012.XLS]Pro Stock'!$F17) -> 5 Cents | G13: ='\\ser\Software\other\[POINTS NQS  2012.XLS]Pro Stock'!$AA17 -> 68 | J13: ='\\ser\Software\other\[POINTS NQS  2012.XLS]Super Stock'!$A17 -> 11 | K13: ='\\ser\Software\other\[POINTS NQS  2012.XLS]Super Stock'!$B17 -> Drew Burton | L13: ='\\ser\Software\other\[POINTS NQS  2012.XLS]Super Stock'!$C17 -> Brookston, IN | M13: =IF('\\ser\Software\other\[POINTS NQS  2012.XLS]Super Stock'!$D17=0," ",'\\ser\Software\other\[POINTS NQS  2012.XLS]Super Stock'!$D17) -> NP | N13: ='\\ser\Software\other\[POINTS NQS  2012.XLS]Super Stock'!$E17 -> 15 | O13: =IF('\\ser\Software\other\[POINTS NQS  2012.XLS]Super Stock'!$F17=0," ",'\\ser\Software\other\[POINTS NQS  2012.XLS]Super Stock'!$F17) -> Plain Nuts | P13: ='\\ser\Software\other\[POINTS NQS  2012.XLS]Super Stock'!$AA17 -> 59
A14: ='\\ser\Software\other\[POINTS NQS  2012.XLS]Pro Stock'!$A18 -> 12 | B14: ='\\ser\Software\other\[POINTS NQS  2012.XLS]Pro Stock'!$B18 -> John Donavan | C14: ='\\ser\Software\other\[POINTS NQS  2012.XLS]Pro Stock'!$C18 -> Pataskala, Oh | D14: =IF('\\ser\Software\other\[POINTS NQS  2012.XLS]Pro Stock'!$D18=0," ",'\\ser\Software\other\[POINTS NQS  2012.XLS]Pro Stock'!$D18) -> JRS | E14: ='\\ser\Software\other\[POINTS NQS  2012.XLS]Pro Stock'!$E18 -> 6 | F14: =IF('\\ser\Software\other\[POINTS NQS  2012.XLS]Pro Stock'!$F18=0," ",'\\ser\Software\other\[POINTS NQS  2012.XLS]Pro Stock'!$F18) -> John's Deere | G14: ='\\ser\Software\other\[POINTS NQS  2012.XLS]Pro Stock'!$AA18 -> 72 | J14: ='\\ser\Software\other\[POINTS NQS  2012.XLS]Super Stock'!$A18 -> 12 | K14: ='\\ser\Software\other\[POINTS NQS  2012.XLS]Super Stock'!$B18 -> Steve Williford | L14: ='\\ser\Software\other\[POINTS NQS  2012.XLS]Super Stock'!$C18 -> Engelhard, NC | M14: =IF('\\ser\Software\other\[POINTS NQS  2012.XLS]Super Stock'!$D18=0," ",'\\ser\Software\other\[POINTS NQS  2012.XLS]Super Stock'!$D18) -> MVP | N14: ='\\ser\Software\other\[POINTS NQS  2012.XLS]Super Stock'!$E18 -> 337 | O14: =IF('\\ser\Software\other\[POINTS NQS  2012.XLS]Super Stock'!$F18=0," ",'\\ser\Software\other\[POINTS NQS  2012.XLS]Super Stock'!$F18) -> IH Express #2 | P14: ='\\ser\Software\other\[POINTS NQS  2012.XLS]Super Stock'!$AA18 -> 63
A15: ='\\ser\Software\other\[POINTS NQS  2012.XLS]Pro Stock'!$A19 -> 13 | B15: ='\\ser\Software\other\[POINTS NQS  2012.XLS]Pro Stock'!$B19 -> Eli Zimmerman | C15: ='\\ser\Software\other\[POINTS NQS  2012.XLS]Pro Stock'!$C19 -> Allentown, Pa | D15: =IF('\\ser\Software\other\[POINTS NQS  2012.XLS]Pro Stock'!$D19=0," ",'\\ser\Software\other\[POINTS NQS  2012.XLS]Pro Stock'!$D19) -> NP | E15: ='\\ser\Software\other\[POINTS NQS  2012.XLS]Pro Stock'!$E19 -> 74 | F15: =IF('\\ser\Software\other\[POINTS NQS  2012.XLS]Pro Stock'!$F19=0," ",'\\ser\Software\other\[POINTS NQS  2012.XLS]Pro Stock'!$F19) -> Red Fever | G15: ='\\ser\Software\other\[POINTS NQS  2012.XLS]Pro Stock'!$AA19 -> 73 | J15: ='\\ser\Software\other\[POINTS NQS  2012.XLS]Super Stock'!$A19 -> 13 | K15: ='\\ser\Software\other\[POINTS NQS  2012.XLS]Super Stock'!$B19 -> Eli Zimmerman | L15: ='\\ser\Software\other\[POINTS NQS  2012.XLS]Super Stock'!$C19 -> Allentown, PA | M15: =IF('\\ser\Software\other\[POINTS NQS  2012.XLS]Super Stock'!$D19=0," ",'\\ser\Software\other\[POINTS NQS  2012.XLS]Super Stock'!$D19) -> NP | N15: ='\\ser\Software\other\[POINTS NQS  2012.XLS]Super Stock'!$E19 -> 74 | O15: =IF('\\ser\Software\other\[POINTS NQS  2012.XLS]Super Stock'!$F19=0," ",'\\ser\Software\other\[POINTS NQS  2012.XLS]Super Stock'!$F19) -> Red Fever | P15: ='\\ser\Software\other\[POINTS NQS  2012.XLS]Super Stock'!$AA19 -> 68
A16: ='\\ser\Software\other\[POINTS NQS  2012.XLS]Pro Stock'!$A20 -> 14 | B16: ='\\ser\Software\other\[POINTS NQS  2012.XLS]Pro Stock'!$B20 -> Ed Nichols | C16: ='\\ser\Software\other\[POINTS NQS  2012.XLS]Pro Stock'!$C20 -> Salvisa, Ky | D16: =IF('\\ser\Software\other\[POINTS NQS  2012.XLS]Pro Stock'!$D20=0," ",'\\ser\Software\other\[POINTS NQS  2012.XLS]Pro Stock'!$D20) -> LR | E16: ='\\ser\Software\other\[POINTS NQS  2012.XLS]Pro Stock'!$E20 -> 124 | F16: =IF('\\ser\Software\other\[POINTS NQS  2012.XLS]Pro Stock'!$F20=0," ",'\\ser\Software\other\[POINTS NQS  2012.XLS]Pro Stock'!$F20) -> Track Attack | G16: ='\\ser\Software\other\[POINTS NQS  2012.XLS]Pro Stock'!$AA20 -> 73 | J16: ='\\ser\Software\other\[POINTS NQS  2012.XLS]Super Stock'!$A20 -> 14 | K16: ='\\ser\Software\other\[POINTS NQS  2012.XLS]Super Stock'!$B20 -> Mike Aschliman | L16: ='\\ser\Software\other\[POINTS NQS  2012.XLS]Super Stock'!$C20 -> Ridgeway, WI | M16: =IF('\\ser\Software\other\[POINTS NQS  2012.XLS]Super Stock'!$D20=0," ",'\\ser\Software\other\[POINTS NQS  2012.XLS]Super Stock'!$D20) -> MVP | N16: ='\\ser\Software\other\[POINTS NQS  2012.XLS]Super Stock'!$E20 -> 511 | O16: =IF('\\ser\Software\other\[POINTS NQS  2012.XLS]Super Stock'!$F20=0," ",'\\ser\Software\other\[POINTS NQS  2012.XLS]Super Stock'!$F20) -> Brother's Keeper | P16: ='\\ser\Software\other\[POINTS NQS  2012.XLS]Super Stock'!$AA20 -> 76
A17: ='\\ser\Software\other\[POINTS NQS  2012.XLS]Pro Stock'!$A21 -> 15 | B17: ='\\ser\Software\other\[POINTS NQS  2012.XLS]Pro Stock'!$B21 -> Tyler Hackman | C17: ='\\ser\Software\other\[POINTS NQS  2012.XLS]Pro Stock'!$C21 -> Seymour, Ind | D17: =IF('\\ser\Software\other\[POINTS NQS  2012.XLS]Pro Stock'!$D21=0," ",'\\ser\Software\other\[POINTS NQS  2012.XLS]Pro Stock'!$D21) -> Hackman | E17: ='\\ser\Software\other\[POINTS NQS  2012.XLS]Pro Stock'!$E21 -> 504 | F17: =IF('\\ser\Software\other\[POINTS NQS  2012.XLS]Pro Stock'!$F21=0," ",'\\ser\Software\other\[POINTS NQS  2012.XLS]Pro Stock'!$F21) -> Green | G17: ='\\ser\Software\other\[POINTS NQS  2012.XLS]Pro Stock'!$AA21 -> 77 | J17: ='\\ser\Software\other\[POINTS NQS  2012.XLS]Super Stock'!$A21 -> 15 | K17: ='\\ser\Software\other\[POINTS NQS  2012.XLS]Super Stock'!$B21 -> Larry Fox | L17: ='\\ser\Software\other\[POINTS NQS  2012.XLS]Super Stock'!$C21 -> Etna, OH | M17: =IF('\\ser\Software\other\[POINTS NQS  2012.XLS]Super Stock'!$D21=0," ",'\\ser\Software\other\[POINTS NQS  2012.XLS]Super Stock'!$D21) -> JRS | N17: ='\\ser\Software\other\[POINTS NQS  2012.XLS]Super Stock'!$E21 -> 7 | O17: =IF('\\ser\Software\other\[POINTS NQS  2012.XLS]Super Stock'!$F21=0," ",'\\ser\Software\other\[POINTS NQS  2012.XLS]Super Stock'!$F21) -> Intimidation | P17: ='\\ser\Software\other\[POINTS NQS  2012.XLS]Super Stock'!$AA21 -> 93
A18: ='\\ser\Software\other\[POINTS NQS  2012.XLS]Pro Stock'!$A22 -> 16 | B18: ='\\ser\Software\other\[POINTS NQS  2012.XLS]Pro Stock'!$B22 -> Jerry Binkley | C18: ='\\ser\Software\other\[POINTS NQS  2012.XLS]Pro Stock'!$C22 -> Jefferson City, Mo | D18: =IF('\\ser\Software\other\[POINTS NQS  2012.XLS]Pro Stock'!$D22=0," ",'\\ser\Software\other\[POINTS NQS  2012.XLS]Pro Stock'!$D22) -> MVP | E18: ='\\ser\Software\other\[POINTS NQS  2012.XLS]Pro Stock'!$E22 -> 92 | F18: =IF('\\ser\Software\other\[POINTS NQS  2012.XLS]Pro Stock'!$F22=0," ",'\\ser\Software\other\[POINTS NQS  2012.XLS]Pro Stock'!$F22) -> Grandpa's Toy | G18: ='\\ser\Software\other\[POINTS NQS  2012.XLS]Pro Stock'!$AA22 -> 91 | J18: ='\\ser\Software\other\[POINTS NQS  2012.XLS]Super Stock'!$A22 -> 16 | K18: ='\\ser\Software\other\[POINTS NQS  2012.XLS]Super Stock'!$B22 -> Randy Demers | L18: ='\\ser\Software\other\[POINTS NQS  2012.XLS]Super Stock'!$C22 -> Columbia, NJ | M18: =IF('\\ser\Software\other\[POINTS NQS  2012.XLS]Super Stock'!$D22=0," ",'\\ser\Software\other\[POINTS NQS  2012.XLS]Super Stock'!$D22) -> NP | N18: ='\\ser\Software\other\[POINTS NQS  2012.XLS]Super Stock'!$E22 -> 85 | O18: =IF('\\ser\Software\other\[POINTS NQS  2012.XLS]Super Stock'!$F22=0," ",'\\ser\Software\other\[POINTS NQS  2012.XLS]Super Stock'!$F22) -> Widowmaker | P18: ='\\ser\Software\other\[POINTS NQS  2012.XLS]Super Stock'!$AA22 -> 104
A19: ='\\ser\Software\other\[POINTS NQS  2012.XLS]Pro Stock'!$A23 -> 17 | B19: ='\\ser\Software\other\[POINTS NQS  2012.XLS]Pro Stock'!$B23 -> Nathan Nichols | C19: ='\\ser\Software\other\[POINTS NQS  2012.XLS]Pro Stock'!$C23 -> Lawrenceburg, Ky | D19: =IF('\\ser\Software\other\[POINTS NQS  2012.XLS]Pro Stock'!$D23=0," ",'\\ser\Software\other\[POINTS NQS  2012.XLS]Pro Stock'!$D23) -> LR | E19: ='\\ser\Software\other\[POINTS NQS  2012.XLS]Pro Stock'!$E23 -> 151 | F19: =IF('\\ser\Software\other\[POINTS NQS  2012.XLS]Pro Stock'!$F23=0," ",'\\ser\Software\other\[POINTS NQS  2012.XLS]Pro Stock'!$F23) -> Wild Streak | G19: ='\\ser\Software\other\[POINTS NQS  2012.XLS]Pro Stock'!$AA23 -> 92 | J19: ='\\ser\Software\other\[POINTS NQS  2012.XLS]Super Stock'!$A23 -> 17 | K19: ='\\ser\Software\other\[POINTS NQS  2012.XLS]Super Stock'!$B23 -> Elaine Fisher | L19: ='\\ser\Software\other\[POINTS NQS  2012.XLS]Super Stock'!$C23 -> Waterford, OH | M19: =IF('\\ser\Software\other\[POINTS NQS  2012.XLS]Super Stock'!$D23=0," ",'\\ser\Software\other\[POINTS NQS  2012.XLS]Super Stock'!$D23) -> VM | N19: ='\\ser\Software\other\[POINTS NQS  2012.XLS]Super Stock'!$E23 -> 80 | O19: =IF('\\ser\Software\other\[POINTS NQS  2012.XLS]Super Stock'!$F23=0," ",'\\ser\Software\other\[POINTS NQS  2012.XLS]Super Stock'!$F23) -> Blue Thunder | P19: ='\\ser\Software\other\[POINTS NQS  2012.XLS]Super Stock'!$AA23 -> 115
A20: ='\\ser\Software\other\[POINTS NQS  2012.XLS]Pro Stock'!$A24 -> 18 | B20: ='\\ser\Software\other\[POINTS NQS  2012.XLS]Pro Stock'!$B24 -> John Innerest | C20: ='\\ser\Software\other\[POINTS NQS  2012.XLS]Pro Stock'!$C24 -> Red Lion, Pa | D20: =IF('\\ser\Software\other\[POINTS NQS  2012.XLS]Pro Stock'!$D24=0," ",'\\ser\Software\other\[POINTS NQS  2012.XLS]Pro Stock'!$D24) -> NP | E20: ='\\ser\Software\other\[POINTS NQS  2012.XLS]Pro Stock'!$E24 -> 252 | F20: =IF('\\ser\Software\other\[POINTS NQS  2012.XLS]Pro Stock'!$F24=0," ",'\\ser\Software\other\[POINTS NQS  2012.XLS]Pro Stock'!$F24) -> Mean N Nasty | G20: ='\\ser\Software\other\[POINTS NQS  2012.XLS]Pro Stock'!$AA24 -> 99 | J20: ='\\ser\Software\other\[POINTS NQS  2012.XLS]Super Stock'!$A24 -> 18 | K20: ='\\ser\Software\other\[POINTS NQS  2012.XLS]Super Stock'!$B24 -> David Gawatz | L20: ='\\ser\Software\other\[POINTS NQS  2012.XLS]Super Stock'!$C24 -> St. Joseph, MO | M20: =IF('\\ser\Software\other\[POINTS NQS  2012.XLS]Super Stock'!$D24=0," ",'\\ser\Software\other\[POINTS NQS  2012.XLS]Super Stock'!$D24) -> JW | N20: ='\\ser\Software\other\[POINTS NQS  2012.XLS]Super Stock'!$E24 -> 184 | O20: =IF('\\ser\Software\other\[POINTS NQS  2012.XLS]Super Stock'!$F24=0," ",'\\ser\Software\other\[POINTS NQS  2012.XLS]Super Stock'!$F24) -> Low Hung Buck | P20: ='\\ser\Software\other\[POINTS NQS  2012.XLS]Super Stock'!$AA24 -> 117
A21: ='\\ser\Software\other\[POINTS NQS  2012.XLS]Pro Stock'!$A25 -> 19 | B21: ='\\ser\Software\other\[POINTS NQS  2012.XLS]Pro Stock'!$B25 -> Randy Demers | C21: ='\\ser\Software\other\[POINTS NQS  2012.XLS]Pro Stock'!$C25 -> Columbia, NJ | D21: =IF('\\ser\Software\other\[POINTS NQS  2012.XLS]Pro Stock'!$D25=0," ",'\\ser\Software\other\[POINTS NQS  2012.XLS]Pro Stock'!$D25) -> NP | E21: ='\\ser\Software\other\[POINTS NQS  2012.XLS]Pro Stock'!$E25 -> 85 | F21: =IF('\\ser\Software\other\[POINTS NQS  2012.XLS]Pro Stock'!$F25=0," ",'\\ser\Software\other\[POINTS NQS  2012.XLS]Pro Stock'!$F25) -> Widowmaker | G21: ='\\ser\Software\other\[POINTS NQS  2012.XLS]Pro Stock'!$AA25 -> 101 | J21: ='\\ser\Software\other\[POINTS NQS  2012.XLS]Super Stock'!$A25 -> 19 | K21: ='\\ser\Software\other\[POINTS NQS  2012.XLS]Super Stock'!$B25 -> Scott Bye | L21: ='\\ser\Software\other\[POINTS NQS  2012.XLS]Super Stock'!$C25 -> Savannah, MO | M21: =IF('\\ser\Software\other\[POINTS NQS  2012.XLS]Super Stock'!$D25=0," ",'\\ser\Software\other\[POINTS NQS  2012.XLS]Super Stock'!$D25) -> NP | N21: ='\\ser\Software\other\[POINTS NQS  2012.XLS]Super Stock'!$E25 -> 365 | O21: =IF('\\ser\Software\other\[POINTS NQS  2012.XLS]Super Stock'!$F25=0," ",'\\ser\Software\other\[POINTS NQS  2012.XLS]Super Stock'!$F25) -> Fired Up | P21: ='\\ser\Software\other\[POINTS NQS  2012.XLS]Super Stock'!$AA25 -> 117
A22: ='\\ser\Software\other\[POINTS NQS  2012.XLS]Pro Stock'!$A26 -> 20 | B22: ='\\ser\Software\other\[POINTS NQS  2012.XLS]Pro Stock'!$B26 -> Mike Aschliman | C22: ='\\ser\Software\other\[POINTS NQS  2012.XLS]Pro Stock'!$C26 -> Bridgeway, Wisc | D22: =IF('\\ser\Software\other\[POINTS NQS  2012.XLS]Pro Stock'!$D26=0," ",'\\ser\Software\other\[POINTS NQS  2012.XLS]Pro Stock'!$D26) -> MVP | E22: ='\\ser\Software\other\[POINTS NQS  2012.XLS]Pro Stock'!$E26 -> 511 | F22: =IF('\\ser\Software\other\[POINTS NQS  2012.XLS]Pro Stock'!$F26=0," ",'\\ser\Software\other\[POINTS NQS  2012.XLS]Pro Stock'!$F26) -> Brother's Keeper | G22: ='\\ser\Software\other\[POINTS NQS  2012.XLS]Pro Stock'!$AA26 -> 107 | J22: ='\\ser\Software\other\[POINTS NQS  2012.XLS]Super Stock'!$A26 -> 20 | K22: ='\\ser\Software\other\[POINTS NQS  2012.XLS]Super Stock'!$B26 -> Daryl Musser | L22: ='\\ser\Software\other\[POINTS NQS  2012.XLS]Super Stock'!$C26 -> Greencastle, PA | M22: =IF('\\ser\Software\other\[POINTS NQS  2012.XLS]Super Stock'!$D26=0," ",'\\ser\Software\other\[POINTS NQS  2012.XLS]Super Stock'!$D26) -> NP | N22: ='\\ser\Software\other\[POINTS NQS  2012.XLS]Super Stock'!$E26 -> 396 | O22: =IF('\\ser\Software\other\[POINTS NQS  2012.XLS]Super Stock'!$F26=0," ",'\\ser\Software\other\[POINTS NQS  2012.XLS]Super Stock'!$F26) -> 5 Cents | P22: ='\\ser\Software\other\[POINTS NQS  2012.XLS]Super Stock'!$AA26 -> 117
A23: ='\\ser\Software\other\[POINTS NQS  2012.XLS]Pro Stock'!$A27 -> 21 | B23: ='\\ser\Software\other\[POINTS NQS  2012.XLS]Pro Stock'!$B27 -> Steve Chrisman | C23: ='\\ser\Software\other\[POINTS NQS  2012.XLS]Pro Stock'!$C27 -> Edinburg, Ind | D23: =IF('\\ser\Software\other\[POINTS NQS  2012.XLS]Pro Stock'!$D27=0," ",'\\ser\Software\other\[POINTS NQS  2012.XLS]Pro Stock'!$D27) -> Hackman | E23: ='\\ser\Software\other\[POINTS NQS  2012.XLS]Pro Stock'!$E27 -> 26 | F23: =IF('\\ser\Software\other\[POINTS NQS  2012.XLS]Pro Stock'!$F27=0," ",'\\ser\Software\other\[POINTS NQS  2012.XLS]Pro Stock'!$F27) -> JD | G23: ='\\ser\Software\other\[POINTS NQS  2012.XLS]Pro Stock'!$AA27 -> 109 | J23: ='\\ser\Software\other\[POINTS NQS  2012.XLS]Super Stock'!$A27 -> 21 | K23: ='\\ser\Software\other\[POINTS NQS  2012.XLS]Super Stock'!$B27 -> Don Vogt | L23: ='\\ser\Software\other\[POINTS NQS  2012.XLS]Super Stock'!$C27 -> Campbellsport, WI | M23: =IF('\\ser\Software\other\[POINTS NQS  2012.XLS]Super Stock'!$D27=0," ",'\\ser\Software\other\[POINTS NQS  2012.XLS]Super Stock'!$D27) -> MVP | N23: ='\\ser\Software\other\[POINTS NQS  2012.XLS]Super Stock'!$E27 -> 90 | O23: =IF('\\ser\Software\other\[POINTS NQS  2012.XLS]Super Stock'!$F27=0," ",'\\ser\Software\other\[POINTS NQS  2012.XLS]Super Stock'!$F27) -> Not A Nuff | P23: ='\\ser\Software\other\[POINTS NQS  2012.XLS]Super Stock'!$AA27 -> 121
A24: ='\\ser\Software\other\[POINTS NQS  2012.XLS]Pro Stock'!$A28 -> 22 | B24: ='\\ser\Software\other\[POINTS NQS  2012.XLS]Pro Stock'!$B28 -> Scott Bye | C24: ='\\ser\Software\other\[POINTS NQS  2012.XLS]Pro Stock'!$C28 -> Savannah, Mo | D24: =IF('\\ser\Software\other\[POINTS NQS  2012.XLS]Pro Stock'!$D28=0," ",'\\ser\Software\other\[POINTS NQS  2012.XLS]Pro Stock'!$D28) -> NP | E24: ='\\ser\Software\other\[POINTS NQS  2012.XLS]Pro Stock'!$E28 -> 365 | F24: =IF('\\ser\Software\other\[POINTS NQS  2012.XLS]Pro Stock'!$F28=0," ",'\\ser\Software\other\[POINTS NQS  2012.XLS]Pro Stock'!$F28) -> Fired Up | G24: ='\\ser\Software\other\[POINTS NQS  2012.XLS]Pro Stock'!$AA28 -> 110 | J24: ='\\ser\Software\other\[POINTS NQS  2012.XLS]Super Stock'!$A28 -> 22 | K24: ='\\ser\Software\other\[POINTS NQS  2012.XLS]Super Stock'!$B28 -> Steve Chrisman | L24: ='\\ser\Software\other\[POINTS NQS  2012.XLS]Super Stock'!$C28 -> Edinburgh, IN | M24: =IF('\\ser\Software\other\[POINTS NQS  2012.XLS]Super Stock'!$D28=0," ",'\\ser\Software\other\[POINTS NQS  2012.XLS]Super Stock'!$D28) -> Hackman | N24: ='\\ser\Software\other\[POINTS NQS  2012.XLS]Super Stock'!$E28 -> 26 | O24: =IF('\\ser\Software\other\[POINTS NQS  2012.XLS]Super Stock'!$F28=0," ",'\\ser\Software\other\[POINTS NQS  2012.XLS]Super Stock'!$F28) -> JD 330 | P24: ='\\ser\Software\other\[POINTS NQS  2012.XLS]Super Stock'!$AA28 -> 130
A25: ='\\ser\Software\other\[POINTS NQS  2012.XLS]Pro Stock'!$A29 -> 23 | B25: ='\\ser\Software\other\[POINTS NQS  2012.XLS]Pro Stock'!$B29 -> David Gawatz | C25: ='\\ser\Software\other\[POINTS NQS  2012.XLS]Pro Stock'!$C29 -> St Joseph, Mo | D25: =IF('\\ser\Software\other\[POINTS NQS  2012.XLS]Pro Stock'!$D29=0," ",'\\ser\Software\other\[POINTS NQS  2012.XLS]Pro Stock'!$D29) -> JW | E25: ='\\ser\Software\other\[POINTS NQS  2012.XLS]Pro Stock'!$E29 -> 184 | F25: =IF('\\ser\Software\other\[POINTS NQS  2012.XLS]Pro Stock'!$F29=0," ",'\\ser\Software\other\[POINTS NQS  2012.XLS]Pro Stock'!$F29) -> Low Hung Buck | G25: ='\\ser\Software\other\[POINTS NQS  2012.XLS]Pro Stock'!$AA29 -> 115 | J25: ='\\ser\Software\other\[POINTS NQS  2012.XLS]Super Stock'!$A29 -> 23 | K25: ='\\ser\Software\other\[POINTS NQS  2012.XLS]Super Stock'!$B29 -> Tyler Hackman | L25: ='\\ser\Software\other\[POINTS NQS  2012.XLS]Super Stock'!$C29 -> Seymour, IN | M25: =IF('\\ser\Software\other\[POINTS NQS  2012.XLS]Super Stock'!$D29=0," ",'\\ser\Software\other\[POINTS NQS  2012.XLS]Super Stock'!$D29) -> Hackman | N25: ='\\ser\Software\other\[POINTS NQS  2012.XLS]Super Stock'!$E29 -> 507 | O25: =IF('\\ser\Software\other\[POINTS NQS  2012.XLS]Super Stock'!$F29=0," ",'\\ser\Software\other\[POINTS NQS  2012.XLS]Super Stock'!$F29) -> Mad Hatter | P25: ='\\ser\Software\other\[POINTS NQS  2012.XLS]Super Stock'!$AA29 -> 130
A26: ='\\ser\Software\other\[POINTS NQS  2012.XLS]Pro Stock'!$A30 -> 24 | B26: ='\\ser\Software\other\[POINTS NQS  2012.XLS]Pro Stock'!$B30 -> Greg Watson | C26: ='\\ser\Software\other\[POINTS NQS  2012.XLS]Pro Stock'!$C30 -> Batavia, OH | D26: =IF('\\ser\Software\other\[POINTS NQS  2012.XLS]Pro Stock'!$D30=0," ",'\\ser\Software\other\[POINTS NQS  2012.XLS]Pro Stock'!$D30) -> LR | E26: ='\\ser\Software\other\[POINTS NQS  2012.XLS]Pro Stock'!$E30 -> 79 | F26: =IF('\\ser\Software\other\[POINTS NQS  2012.XLS]Pro Stock'!$F30=0," ",'\\ser\Software\other\[POINTS NQS  2012.XLS]Pro Stock'!$F30) -> Bearly Legal | G26: ='\\ser\Software\other\[POINTS NQS  2012.XLS]Pro Stock'!$AA30 -> 118 | J26: ='\\ser\Software\other\[POINTS NQS  2012.XLS]Super Stock'!$A30 -> 24 | K26: ='\\ser\Software\other\[POINTS NQS  2012.XLS]Super Stock'!$B30 -> John Innerest | L26: ='\\ser\Software\other\[POINTS NQS  2012.XLS]Super Stock'!$C30 -> Red Lion, PA | M26: =IF('\\ser\Software\other\[POINTS NQS  2012.XLS]Super Stock'!$D30=0," ",'\\ser\Software\other\[POINTS NQS  2012.XLS]Super Stock'!$D30) -> NP | N26: ='\\ser\Software\other\[POINTS NQS  2012.XLS]Super Stock'!$E30 -> 252 | O26: =IF('\\ser\Software\other\[POINTS NQS  2012.XLS]Super Stock'!$F30=0," ",'\\ser\Software\other\[POINTS NQS  2012.XLS]Super Stock'!$F30) -> Mean N Nasty | P26: ='\\ser\Software\other\[POINTS NQS  2012.XLS]Super Stock'!$AA30 -> 132
A27: ='\\ser\Software\other\[POINTS NQS  2012.XLS]Pro Stock'!$A31 -> 25 | B27: ='\\ser\Software\other\[POINTS NQS  2012.XLS]Pro Stock'!$B31 -> Steve Williford | C27: ='\\ser\Software\other\[POINTS NQS  2012.XLS]Pro Stock'!$C31 -> Englehard, NC | D27: =IF('\\ser\Software\other\[POINTS NQS  2012.XLS]Pro Stock'!$D31=0," ",'\\ser\Software\other\[POINTS NQS  2012.XLS]Pro Stock'!$D31) -> MVP | E27: ='\\ser\Software\other\[POINTS NQS  2012.XLS]Pro Stock'!$E31 -> 337 | F27: =IF('\\ser\Software\other\[POINTS NQS  2012.XLS]Pro Stock'!$F31=0," ",'\\ser\Software\other\[POINTS NQS  2012.XLS]Pro Stock'!$F31) -> IH Express 2 | G27: ='\\ser\Software\other\[POINTS NQS  2012.XLS]Pro Stock'!$AA31 -> 122 | J27: ='\\ser\Software\other\[POINTS NQS  2012.XLS]Super Stock'!$A31 -> 25 | K27: ='\\ser\Software\other\[POINTS NQS  2012.XLS]Super Stock'!$B31 -> Nathan Nichols | L27: ='\\ser\Software\other\[POINTS NQS  2012.XLS]Super Stock'!$C31 -> Lawrenceburg, KY | M27: =IF('\\ser\Software\other\[POINTS NQS  2012.XLS]Super Stock'!$D31=0," ",'\\ser\Software\other\[POINTS NQS  2012.XLS]Super Stock'!$D31) -> LR | N27: ='\\ser\Software\other\[POINTS NQS  2012.XLS]Super Stock'!$E31 -> 151 | O27: =IF('\\ser\Software\other\[POINTS NQS  2012.XLS]Super Stock'!$F31=0," ",'\\ser\Software\other\[POINTS NQS  2012.XLS]Super Stock'!$F31) -> Wildstreak | P27: ='\\ser\Software\other\[POINTS NQS  2012.XLS]Super Stock'!$AA31 -> 136
A28: ='\\ser\Software\other\[POINTS NQS  2012.XLS]Pro Stock'!$A32 -> 26 | B28: ='\\ser\Software\other\[POINTS NQS  2012.XLS]Pro Stock'!$B32 -> Bruce Austin | C28: ='\\ser\Software\other\[POINTS NQS  2012.XLS]Pro Stock'!$C32 -> St Charles, IA | D28: =IF('\\ser\Software\other\[POINTS NQS  2012.XLS]Pro Stock'!$D32=0," ",'\\ser\Software\other\[POINTS NQS  2012.XLS]Pro Stock'!$D32) -> MVP | E28: ='\\ser\Software\other\[POINTS NQS  2012.XLS]Pro Stock'!$E32 -> 277 | F28: =IF('\\ser\Software\other\[POINTS NQS  2012.XLS]Pro Stock'!$F32=0," ",'\\ser\Software\other\[POINTS NQS  2012.XLS]Pro Stock'!$F32) -> Cap'N Crunch | G28: ='\\ser\Software\other\[POINTS NQS  2012.XLS]Pro Stock'!$AA32 -> 124 | J28: ='\\ser\Software\other\[POINTS NQS  2012.XLS]Super Stock'!$A32 -> 26 | K28: ='\\ser\Software\other\[POINTS NQS  2012.XLS]Super Stock'!$B32 -> Ed Nichols | L28: ='\\ser\Software\other\[POINTS NQS  2012.XLS]Super Stock'!$C32 -> Salvisa, KY | M28: =IF('\\ser\Software\other\[POINTS NQS  2012.XLS]Super Stock'!$D32=0," ",'\\ser\Software\other\[POINTS NQS  2012.XLS]Super Stock'!$D32) -> LR | N28: ='\\ser\Software\other\[POINTS NQS  2012.XLS]Super Stock'!$E32 -> 124 | O28: =IF('\\ser\Software\other\[POINTS NQS  2012.XLS]Super Stock'!$F32=0," ",'\\ser\Software\other\[POINTS NQS  2012.XLS]Super Stock'!$F32) -> Track Attack | P28: ='\\ser\Software\other\[POINTS NQS  2012.XLS]Super Stock'!$AA32 -> 139
A29: ='\\ser\Software\other\[POINTS NQS  2012.XLS]Pro Stock'!$A33 -> 27 | B29: ='\\ser\Software\other\[POINTS NQS  2012.XLS]Pro Stock'!$B33 -> Todd Hammond | C29: ='\\ser\Software\other\[POINTS NQS  2012.XLS]Pro Stock'!$C33 -> Fallng Waters, WV | D29: =IF('\\ser\Software\other\[POINTS NQS  2012.XLS]Pro Stock'!$D33=0," ",'\\ser\Software\other\[POINTS NQS  2012.XLS]Pro Stock'!$D33) -> JRS | E29: ='\\ser\Software\other\[POINTS NQS  2012.XLS]Pro Stock'!$E33 -> 301 | F29: =IF('\\ser\Software\other\[POINTS NQS  2012.XLS]Pro Stock'!$F33=0," ",'\\ser\Software\other\[POINTS NQS  2012.XLS]Pro Stock'!$F33) -> Punisher | G29: ='\\ser\Software\other\[POINTS NQS  2012.XLS]Pro Stock'!$AA33 -> 124 | J29: ='\\ser\Software\other\[POINTS NQS  2012.XLS]Super Stock'!$A33 -> 27 | K29: ='\\ser\Software\other\[POINTS NQS  2012.XLS]Super Stock'!$B33 -> Bruce Austin | L29: ='\\ser\Software\other\[POINTS NQS  2012.XLS]Super Stock'!$C33 -> St. Charles, IA | M29: =IF('\\ser\Software\other\[POINTS NQS  2012.XLS]Super Stock'!$D33=0," ",'\\ser\Software\other\[POINTS NQS  2012.XLS]Super Stock'!$D33) -> MVP | N29: ='\\ser\Software\other\[POINTS NQS  2012.XLS]Super Stock'!$E33 -> 338 | O29: =IF('\\ser\Software\other\[POINTS NQS  2012.XLS]Super Stock'!$F33=0," ",'\\ser\Software\other\[POINTS NQS  2012.XLS]Super Stock'!$F33) -> Hillbilly Headache | P29: ='\\ser\Software\other\[POINTS NQS  2012.XLS]Super Stock'!$AA33 -> 141
A30: ='\\ser\Software\other\[POINTS NQS  2012.XLS]Pro Stock'!$A34 -> 28 | B30: ='\\ser\Software\other\[POINTS NQS  2012.XLS]Pro Stock'!$B34 -> Clyde Mishler | C30: ='\\ser\Software\other\[POINTS NQS  2012.XLS]Pro Stock'!$C34 -> E Peoria, Ill | D30: =IF('\\ser\Software\other\[POINTS NQS  2012.XLS]Pro Stock'!$D34=0," ",'\\ser\Software\other\[POINTS NQS  2012.XLS]Pro Stock'!$D34) -> GTP | E30: ='\\ser\Software\other\[POINTS NQS  2012.XLS]Pro Stock'!$E34 -> 168 | F30: =IF('\\ser\Software\other\[POINTS NQS  2012.XLS]Pro Stock'!$F34=0," ",'\\ser\Software\other\[POINTS NQS  2012.XLS]Pro Stock'!$F34) ->  | G30: ='\\ser\Software\other\[POINTS NQS  2012.XLS]Pro Stock'!$AA34 -> 125 | J30: ='\\ser\Software\other\[POINTS NQS  2012.XLS]Super Stock'!$A34 -> 28 | K30: ='\\ser\Software\other\[POINTS NQS  2012.XLS]Super Stock'!$B34 -> John Donavon | L30: ='\\ser\Software\other\[POINTS NQS  2012.XLS]Super Stock'!$C34 -> Pataskala, OH | M30: =IF('\\ser\Software\other\[POINTS NQS  2012.XLS]Super Stock'!$D34=0," ",'\\ser\Software\other\[POINTS NQS  2012.XLS]Super Stock'!$D34) -> JRS | N30: ='\\ser\Software\other\[POINTS NQS  2012.XLS]Super Stock'!$E34 -> 6 | O30: =IF('\\ser\Software\other\[POINTS NQS  2012.XLS]Super Stock'!$F34=0," ",'\\ser\Software\other\[POINTS NQS  2012.XLS]Super Stock'!$F34) -> John's Deere | P30: ='\\ser\Software\other\[POINTS NQS  2012.XLS]Super Stock'!$AA34 -> 161
A31: ='\\ser\Software\other\[POINTS NQS  2012.XLS]Pro Stock'!$A35 -> 29 | B31: ='\\ser\Software\other\[POINTS NQS  2012.XLS]Pro Stock'!$B35 -> Larry Curtsinger | C31: ='\\ser\Software\other\[POINTS NQS  2012.XLS]Pro Stock'!$C35 -> Carlisle, KY | D31: =IF('\\ser\Software\other\[POINTS NQS  2012.XLS]Pro Stock'!$D35=0," ",'\\ser\Software\other\[POINTS NQS  2012.XLS]Pro Stock'!$D35) -> NP | E31: ='\\ser\Software\other\[POINTS NQS  2012.XLS]Pro Stock'!$E35 -> 9 | F31: =IF('\\ser\Software\other\[POINTS NQS  2012.XLS]Pro Stock'!$F35=0," ",'\\ser\Software\other\[POINTS NQS  2012.XLS]Pro Stock'!$F35) -> Runaway Deere | G31: ='\\ser\Software\other\[POINTS NQS  2012.XLS]Pro Stock'!$AA35 -> 133 | J31: ='\\ser\Software\other\[POINTS NQS  2012.XLS]Super Stock'!$A35 -> 29 | K31: ='\\ser\Software\other\[POINTS NQS  2012.XLS]Super Stock'!$B35 -> Alex Naffe | L31: ='\\ser\Software\other\[POINTS NQS  2012.XLS]Super Stock'!$C35 -> Seymour, IN | M31: =IF('\\ser\Software\other\[POINTS NQS  2012.XLS]Super Stock'!$D35=0," ",'\\ser\Software\other\[POINTS NQS  2012.XLS]Super Stock'!$D35) -> Hackman | N31: ='\\ser\Software\other\[POINTS NQS  2012.XLS]Super Stock'!$E35 -> 218 | O31: =IF('\\ser\Software\other\[POINTS NQS  2012.XLS]Super Stock'!$F35=0," ",'\\ser\Software\other\[POINTS NQS  2012.XLS]Super Stock'!$F35) -> Game On Purple | P31: ='\\ser\Software\other\[POINTS NQS  2012.XLS]Super Stock'!$AA35 -> 165
A32: ='\\ser\Software\other\[POINTS NQS  2012.XLS]Pro Stock'!$A36 -> 30 | B32: ='\\ser\Software\other\[POINTS NQS  2012.XLS]Pro Stock'!$B36 -> Alex Naffe | C32: ='\\ser\Software\other\[POINTS NQS  2012.XLS]Pro Stock'!$C36 -> Edinburg, Ind | D32: =IF('\\ser\Software\other\[POINTS NQS  2012.XLS]Pro Stock'!$D36=0," ",'\\ser\Software\other\[POINTS NQS  2012.XLS]Pro Stock'!$D36) -> Hackman | E32: ='\\ser\Software\other\[POINTS NQS  2012.XLS]Pro Stock'!$E36 -> 218 | F32: =IF('\\ser\Software\other\[POINTS NQS  2012.XLS]Pro Stock'!$F36=0," ",'\\ser\Software\other\[POINTS NQS  2012.XLS]Pro Stock'!$F36) -> Game On | G32: ='\\ser\Software\other\[POINTS NQS  2012.XLS]Pro Stock'!$AA36 -> 152 | J32: ='\\ser\Software\other\[POINTS NQS  2012.XLS]Super Stock'!$A36 -> 30 | K32: ='\\ser\Software\other\[POINTS NQS  2012.XLS]Super Stock'!$B36 -> Clyde Mishler | L32: ='\\ser\Software\other\[POINTS NQS  2012.XLS]Super Stock'!$C36 -> Washington, IL | M32: =IF('\\ser\Software\other\[POINTS NQS  2012.XLS]Super Stock'!$D36=0," ",'\\ser\Software\other\[POINTS NQS  2012.XLS]Super Stock'!$D36) -> GTP | N32: ='\\ser\Software\other\[POINTS NQS  2012.XLS]Super Stock'!$E36 -> 168 | O32: =IF('\\ser\Software\other\[POINTS NQS  2012.XLS]Super Stock'!$F36=0," ",'\\ser\Software\other\[POINTS NQS  2012.XLS]Super Stock'!$F36) ->  | P32: ='\\ser\Software\other\[POINTS NQS  2012.XLS]Super Stock'!$AA36 -> 171
A33: ='\\ser\Software\other\[POINTS NQS  2012.XLS]Pro Stock'!$A37 -> 31 | B33: ='\\ser\Software\other\[POINTS NQS  2012.XLS]Pro Stock'!$B37 -> Todd Hammond | C33: ='\\ser\Software\other\[POINTS NQS  2012.XLS]Pro Stock'!$C37 -> Fallng Waters, WV | D33: =IF('\\ser\Software\other\[POINTS NQS  2012.XLS]Pro Stock'!$D37=0," ",'\\ser\Software\other\[POINTS NQS  2012.XLS]Pro Stock'!$D37) -> JRS | E33: ='\\ser\Software\other\[POINTS NQS  2012.XLS]Pro Stock'!$E37 -> 241 | F33: =IF('\\ser\Software\other\[POINTS NQS  2012.XLS]Pro Stock'!$F37=0," ",'\\ser\Software\other\[POINTS NQS  2012.XLS]Pro Stock'!$F37) -> Problem Child | G33: ='\\ser\Software\other\[POINTS NQS  2012.XLS]Pro Stock'!$AA37 -> 155 | J33: ='\\ser\Software\other\[POINTS NQS  2012.XLS]Super Stock'!$A37 -> 31 | K33: ='\\ser\Software\other\[POINTS NQS  2012.XLS]Super Stock'!$B37 -> Bruce Austin | L33: ='\\ser\Software\other\[POINTS NQS  2012.XLS]Super Stock'!$C37 -> St. Charles, IA | M33: =IF('\\ser\Software\other\[POINTS NQS  2012.XLS]Super Stock'!$D37=0," ",'\\ser\Software\other\[POINTS NQS  2012.XLS]Super Stock'!$D37) -> MVP | N33: ='\\ser\Software\other\[POINTS NQS  2012.XLS]Super Stock'!$E37 -> 277 | O33: =IF('\\ser\Software\other\[POINTS NQS  2012.XLS]Super Stock'!$F37=0," ",'\\ser\Software\other\[POINTS NQS  2012.XLS]Super Stock'!$F37) -> Cap'n Crunch | P33: ='\\ser\Software\other\[POINTS NQS  2012.XLS]Super Stock'!$AA37 -> 173
A34: ='\\ser\Software\other\[POINTS NQS  2012.XLS]Pro Stock'!$A38 -> 32 | B34: ='\\ser\Software\other\[POINTS NQS  2012.XLS]Pro Stock'!$B38 -> Charlie Ciolino | C34: ='\\ser\Software\other\[POINTS NQS  2012.XLS]Pro Stock'!$C38 -> Hammond, LA | D34: =IF('\\ser\Software\other\[POINTS NQS  2012.XLS]Pro Stock'!$D38=0," ",'\\ser\Software\other\[POINTS NQS  2012.XLS]Pro Stock'!$D38) -> MVP | E34: ='\\ser\Software\other\[POINTS NQS  2012.XLS]Pro Stock'!$E38 -> 145 | F34: =IF('\\ser\Software\other\[POINTS NQS  2012.XLS]Pro Stock'!$F38=0," ",'\\ser\Software\other\[POINTS NQS  2012.XLS]Pro Stock'!$F38) -> Mechanical Nitemare | G34: ='\\ser\Software\other\[POINTS NQS  2012.XLS]Pro Stock'!$AA38 -> 157 | J34: ='\\ser\Software\other\[POINTS NQS  2012.XLS]Super Stock'!$A38 -> 48 | K34: ='\\ser\Software\other\[POINTS NQS  2012.XLS]Super Stock'!$B38 -> Todd Brest | L34: ='\\ser\Software\other\[POINTS NQS  2012.XLS]Super Stock'!$C38 -> Sharpsville, Pa | M34: =IF('\\ser\Software\other\[POINTS NQS  2012.XLS]Super Stock'!$D38=0," ",'\\ser\Software\other\[POINTS NQS  2012.XLS]Super Stock'!$D38) ->  | N34: ='\\ser\Software\other\[POINTS NQS  2012.XLS]Super Stock'!$E38 -> 272 | O34: =IF('\\ser\Software\other\[POINTS NQS  2012.XLS]Super Stock'!$F38=0," ",'\\ser\Software\other\[POINTS NQS  2012.XLS]Super Stock'!$F38) -> Cub | P34: ='\\ser\Software\other\[POINTS NQS  2012.XLS]Super Stock'!$AA38 -> 203
A35: ='\\ser\Software\other\[POINTS NQS  2012.XLS]Pro Stock'!$A39 -> 33 | B35: ='\\ser\Software\other\[POINTS NQS  2012.XLS]Pro Stock'!$B39 -> Bradley Corzine | C35: ='\\ser\Software\other\[POINTS NQS  2012.XLS]Pro Stock'!$C39 -> Dongola, ILL | D35: =IF('\\ser\Software\other\[POINTS NQS  2012.XLS]Pro Stock'!$D39=0," ",'\\ser\Software\other\[POINTS NQS  2012.XLS]Pro Stock'!$D39) -> JW | E35: ='\\ser\Software\other\[POINTS NQS  2012.XLS]Pro Stock'!$E39 -> 477 | F35: =IF('\\ser\Software\other\[POINTS NQS  2012.XLS]Pro Stock'!$F39=0," ",'\\ser\Software\other\[POINTS NQS  2012.XLS]Pro Stock'!$F39) -> Black Cat | G35: ='\\ser\Software\other\[POINTS NQS  2012.XLS]Pro Stock'!$AA39 -> 158 | J35: ='\\ser\Software\other\[POINTS NQS  2012.XLS]Super Stock'!$A39 -> 32 | K35: ='\\ser\Software\other\[POINTS NQS  2012.XLS]Super Stock'!$B39 -> Michael Ciolino | L35: ='\\ser\Software\other\[POINTS NQS  2012.XLS]Super Stock'!$C39 -> Peoria, IL | M35: =IF('\\ser\Software\other\[POINTS NQS  2012.XLS]Super Stock'!$D39=0," ",'\\ser\Software\other\[POINTS NQS  2012.XLS]Super Stock'!$D39) -> MVP | N35: ='\\ser\Software\other\[POINTS NQS  2012.XLS]Super Stock'!$E39 -> 146 | O35: =IF('\\ser\Software\other\[POINTS NQS  2012.XLS]Super Stock'!$F39=0," ",'\\ser\Software\other\[POINTS NQS  2012.XLS]Super Stock'!$F39) -> Mechanial Animal | P35: ='\\ser\Software\other\[POINTS NQS  2012.XLS]Super Stock'!$AA39 -> 182
A36: ='\\ser\Software\other\[POINTS NQS  2012.XLS]Pro Stock'!$A40 -> 34 | B36: ='\\ser\Software\other\[POINTS NQS  2012.XLS]Pro Stock'!$B40 -> Nick Mishler | C36: ='\\ser\Software\other\[POINTS NQS  2012.XLS]Pro Stock'!$C40 -> E Peoria, Ill | D36: =IF('\\ser\Software\other\[POINTS NQS  2012.XLS]Pro Stock'!$D40=0," ",'\\ser\Software\other\[POINTS NQS  2012.XLS]Pro Stock'!$D40) -> GTP | E36: ='\\ser\Software\other\[POINTS NQS  2012.XLS]Pro Stock'!$E40 -> 167 | F36: =IF('\\ser\Software\other\[POINTS NQS  2012.XLS]Pro Stock'!$F40=0," ",'\\ser\Software\other\[POINTS NQS  2012.XLS]Pro Stock'!$F40) -> Pulse | G36: ='\\ser\Software\other\[POINTS NQS  2012.XLS]Pro Stock'!$AA40 -> 160 | J36: ='\\ser\Software\other\[POINTS NQS  2012.XLS]Super Stock'!$A40 -> 34 | K36: ='\\ser\Software\other\[POINTS NQS  2012.XLS]Super Stock'!$B40 -> John Cress | L36: ='\\ser\Software\other\[POINTS NQS  2012.XLS]Super Stock'!$C40 -> Strasburg, IL | M36: =IF('\\ser\Software\other\[POINTS NQS  2012.XLS]Super Stock'!$D40=0," ",'\\ser\Software\other\[POINTS NQS  2012.XLS]Super Stock'!$D40) -> JW | N36: ='\\ser\Software\other\[POINTS NQS  2012.XLS]Super Stock'!$E40 -> 172 | O36: =IF('\\ser\Software\other\[POINTS NQS  2012.XLS]Super Stock'!$F40=0," ",'\\ser\Software\other\[POINTS NQS  2012.XLS]Super Stock'!$F40) -> Full Tilt | P36: ='\\ser\Software\other\[POINTS NQS  2012.XLS]Super Stock'!$AA40 -> 183
A37: ='\\ser\Software\other\[POINTS NQS  2012.XLS]Pro Stock'!$A41 -> 35 | B37: ='\\ser\Software\other\[POINTS NQS  2012.XLS]Pro Stock'!$B41 -> Steve Williford | C37: ='\\ser\Software\other\[POINTS NQS  2012.XLS]Pro Stock'!$C41 -> Englehard, NC | D37: =IF('\\ser\Software\other\[POINTS NQS  2012.XLS]Pro Stock'!$D41=0," ",'\\ser\Software\other\[POINTS NQS  2012.XLS]Pro Stock'!$D41) -> MVP | E37: ='\\ser\Software\other\[POINTS NQS  2012.XLS]Pro Stock'!$E41 -> 176 | F37: =IF('\\ser\Software\other\[POINTS NQS  2012.XLS]Pro Stock'!$F41=0," ",'\\ser\Software\other\[POINTS NQS  2012.XLS]Pro Stock'!$F41) -> International | G37: ='\\ser\Software\other\[POINTS NQS  2012.XLS]Pro Stock'!$AA41 -> 164 | J37: ='\\ser\Software\other\[POINTS NQS  2012.XLS]Super Stock'!$A41 -> 33 | K37: ='\\ser\Software\other\[POINTS NQS  2012.XLS]Super Stock'!$B41 -> Harrison Stahl | L37: ='\\ser\Software\other\[POINTS NQS  2012.XLS]Super Stock'!$C41 -> Dewitt, IA | M37: =IF('\\ser\Software\other\[POINTS NQS  2012.XLS]Super Stock'!$D41=0," ",'\\ser\Software\other\[POINTS NQS  2012.XLS]Super Stock'!$D41) -> MVP | N37: ='\\ser\Software\other\[POINTS NQS  2012.XLS]Super Stock'!$E41 -> 336 | O37: =IF('\\ser\Software\other\[POINTS NQS  2012.XLS]Super Stock'!$F41=0," ",'\\ser\Software\other\[POINTS NQS  2012.XLS]Super Stock'!$F41) -> MWSC # 4 | P37: ='\\ser\Software\other\[POINTS NQS  2012.XLS]Super Stock'!$AA41 -> 183
A38: ='\\ser\Software\other\[POINTS NQS  2012.XLS]Pro Stock'!$A42 -> 36 | B38: ='\\ser\Software\other\[POINTS NQS  2012.XLS]Pro Stock'!$B42 -> David Knapp | C38: ='\\ser\Software\other\[POINTS NQS  2012.XLS]Pro Stock'!$C42 -> Putnam, Ill | D38: =IF('\\ser\Software\other\[POINTS NQS  2012.XLS]Pro Stock'!$D42=0," ",'\\ser\Software\other\[POINTS NQS  2012.XLS]Pro Stock'!$D42) -> MVP | E38: ='\\ser\Software\other\[POINTS NQS  2012.XLS]Pro Stock'!$E42 -> 381 | F38: =IF('\\ser\Software\other\[POINTS NQS  2012.XLS]Pro Stock'!$F42=0," ",'\\ser\Software\other\[POINTS NQS  2012.XLS]Pro Stock'!$F42) -> Knapp Time | G38: ='\\ser\Software\other\[POINTS NQS  2012.XLS]Pro Stock'!$AA42 -> 166 | J38: ='\\ser\Software\other\[POINTS NQS  2012.XLS]Super Stock'!$A42 -> 35 | K38: ='\\ser\Software\other\[POINTS NQS  2012.XLS]Super Stock'!$B42 -> Steve Williford | L38: ='\\ser\Software\other\[POINTS NQS  2012.XLS]Super Stock'!$C42 -> Engelhard, NC | M38: =IF('\\ser\Software\other\[POINTS NQS  2012.XLS]Super Stock'!$D42=0," ",'\\ser\Software\other\[POINTS NQS  2012.XLS]Super Stock'!$D42) -> MVP | N38: ='\\ser\Software\other\[POINTS NQS  2012.XLS]Super Stock'!$E42 -> 177 | O38: =IF('\\ser\Software\other\[POINTS NQS  2012.XLS]Super Stock'!$F42=0," ",'\\ser\Software\other\[POINTS NQS  2012.XLS]Super Stock'!$F42) -> Williford Trucking IH | P38: ='\\ser\Software\other\[POINTS NQS  2012.XLS]Super Stock'!$AA42 -> 184
A39: ='\\ser\Software\other\[POINTS NQS  2012.XLS]Pro Stock'!$A43 -> 37 | B39: ='\\ser\Software\other\[POINTS NQS  2012.XLS]Pro Stock'!$B43 -> Larry Korff | C39: ='\\ser\Software\other\[POINTS NQS  2012.XLS]Pro Stock'!$C43 -> Evansville, Ind | D39: =IF('\\ser\Software\other\[POINTS NQS  2012.XLS]Pro Stock'!$D43=0," ",'\\ser\Software\other\[POINTS NQS  2012.XLS]Pro Stock'!$D43) -> TC | E39: ='\\ser\Software\other\[POINTS NQS  2012.XLS]Pro Stock'!$E43 -> 398 | F39: =IF('\\ser\Software\other\[POINTS NQS  2012.XLS]Pro Stock'!$F43=0," ",'\\ser\Software\other\[POINTS NQS  2012.XLS]Pro Stock'!$F43) -> Kryptonite | G39: ='\\ser\Software\other\[POINTS NQS  2012.XLS]Pro Stock'!$AA43 -> 167 | J39: ='\\ser\Software\other\[POINTS NQS  2012.XLS]Super Stock'!$A43 -> 36 | K39: ='\\ser\Software\other\[POINTS NQS  2012.XLS]Super Stock'!$B43 -> Bradley Corzine | L39: ='\\ser\Software\other\[POINTS NQS  2012.XLS]Super Stock'!$C43 -> Dongola, IL | M39: =IF('\\ser\Software\other\[POINTS NQS  2012.XLS]Super Stock'!$D43=0," ",'\\ser\Software\other\[POINTS NQS  2012.XLS]Super Stock'!$D43) -> JW | N39: ='\\ser\Software\other\[POINTS NQS  2012.XLS]Super Stock'!$E43 -> 477 | O39: =IF('\\ser\Software\other\[POINTS NQS  2012.XLS]Super Stock'!$F43=0," ",'\\ser\Software\other\[POINTS NQS  2012.XLS]Super Stock'!$F43) -> Black Cat's Revenge | P39: ='\\ser\Software\other\[POINTS NQS  2012.XLS]Super Stock'!$AA43 -> 184
A40: ='\\ser\Software\other\[POINTS NQS  2012.XLS]Pro Stock'!$A44 -> 38 | B40: ='\\ser\Software\other\[POINTS NQS  2012.XLS]Pro Stock'!$B44 -> Matt Kaster | C40: ='\\ser\Software\other\[POINTS NQS  2012.XLS]Pro Stock'!$C44 -> Burlington, Wisc | D40: =IF('\\ser\Software\other\[POINTS NQS  2012.XLS]Pro Stock'!$D44=0," ",'\\ser\Software\other\[POINTS NQS  2012.XLS]Pro Stock'!$D44) -> MVP | E40: ='\\ser\Software\other\[POINTS NQS  2012.XLS]Pro Stock'!$E44 -> 98 | F40: =IF('\\ser\Software\other\[POINTS NQS  2012.XLS]Pro Stock'!$F44=0," ",'\\ser\Software\other\[POINTS NQS  2012.XLS]Pro Stock'!$F44) -> Moose | G40: ='\\ser\Software\other\[POINTS NQS  2012.XLS]Pro Stock'!$AA44 -> 170 | J40: ='\\ser\Software\other\[POINTS NQS  2012.XLS]Super Stock'!$A44 -> 37 | K40: ='\\ser\Software\other\[POINTS NQS  2012.XLS]Super Stock'!$B44 -> John Cress | L40: ='\\ser\Software\other\[POINTS NQS  2012.XLS]Super Stock'!$C44 -> Strasburg, IL | M40: =IF('\\ser\Software\other\[POINTS NQS  2012.XLS]Super Stock'!$D44=0," ",'\\ser\Software\other\[POINTS NQS  2012.XLS]Super Stock'!$D44) -> JW | N40: ='\\ser\Software\other\[POINTS NQS  2012.XLS]Super Stock'!$E44 -> 170 | O40: =IF('\\ser\Software\other\[POINTS NQS  2012.XLS]Super Stock'!$F44=0," ",'\\ser\Software\other\[POINTS NQS  2012.XLS]Super Stock'!$F44) -> Blitzed | P40: ='\\ser\Software\other\[POINTS NQS  2012.XLS]Super Stock'!$AA44 -> 185
A41: ='\\ser\Software\other\[POINTS NQS  2012.XLS]Pro Stock'!$A45 -> 39 | B41: ='\\ser\Software\other\[POINTS NQS  2012.XLS]Pro Stock'!$B45 -> Michael Ciolino | C41: ='\\ser\Software\other\[POINTS NQS  2012.XLS]Pro Stock'!$C45 -> Hammond, LA | D41: =IF('\\ser\Software\other\[POINTS NQS  2012.XLS]Pro Stock'!$D45=0," ",'\\ser\Software\other\[POINTS NQS  2012.XLS]Pro Stock'!$D45) -> MVP | E41: ='\\ser\Software\other\[POINTS NQS  2012.XLS]Pro Stock'!$E45 -> 146 | F41: =IF('\\ser\Software\other\[POINTS NQS  2012.XLS]Pro Stock'!$F45=0," ",'\\ser\Software\other\[POINTS NQS  2012.XLS]Pro Stock'!$F45) -> Mechanical Animal | G41: ='\\ser\Software\other\[POINTS NQS  2012.XLS]Pro Stock'!$AA45 -> 172 | J41: ='\\ser\Software\other\[POINTS NQS  2012.XLS]Super Stock'!$A45 -> 38 | K41: ='\\ser\Software\other\[POINTS NQS  2012.XLS]Super Stock'!$B45 -> David Knapp | L41: ='\\ser\Software\other\[POINTS NQS  2012.XLS]Super Stock'!$C45 -> Hennepin, IL | M41: =IF('\\ser\Software\other\[POINTS NQS  2012.XLS]Super Stock'!$D45=0," ",'\\ser\Software\other\[POINTS NQS  2012.XLS]Super Stock'!$D45) -> MVP | N41: ='\\ser\Software\other\[POINTS NQS  2012.XLS]Super Stock'!$E45 -> 381 | O41: =IF('\\ser\Software\other\[POINTS NQS  2012.XLS]Super Stock'!$F45=0," ",'\\ser\Software\other\[POINTS NQS  2012.XLS]Super Stock'!$F45) -> Knapp Time | P41: ='\\ser\Software\other\[POINTS NQS  2012.XLS]Super Stock'!$AA45 -> 187
A42: ='\\ser\Software\other\[POINTS NQS  2012.XLS]Pro Stock'!$A46 -> 40 | B42: ='\\ser\Software\other\[POINTS NQS  2012.XLS]Pro Stock'!$B46 -> Steve Williford | C42: ='\\ser\Software\other\[POINTS NQS  2012.XLS]Pro Stock'!$C46 -> Englehard, NC | D42: =IF('\\ser\Software\other\[POINTS NQS  2012.XLS]Pro Stock'!$D46=0," ",'\\ser\Software\other\[POINTS NQS  2012.XLS]Pro Stock'!$D46) -> MVP | E42: ='\\ser\Software\other\[POINTS NQS  2012.XLS]Pro Stock'!$E46 -> 177 | F42: =IF('\\ser\Software\other\[POINTS NQS  2012.XLS]Pro Stock'!$F46=0," ",'\\ser\Software\other\[POINTS NQS  2012.XLS]Pro Stock'!$F46) -> Williford Trucking IH | G42: ='\\ser\Software\other\[POINTS NQS  2012.XLS]Pro Stock'!$AA46 -> 172 | J42: ='\\ser\Software\other\[POINTS NQS  2012.XLS]Super Stock'!$A46 -> 39 | K42: ='\\ser\Software\other\[POINTS NQS  2012.XLS]Super Stock'!$B46 -> Charlie Ciolino | L42: ='\\ser\Software\other\[POINTS NQS  2012.XLS]Super Stock'!$C46 -> Hammond, LA | M42: =IF('\\ser\Software\other\[POINTS NQS  2012.XLS]Super Stock'!$D46=0," ",'\\ser\Software\other\[POINTS NQS  2012.XLS]Super Stock'!$D46) -> MVP | N42: ='\\ser\Software\other\[POINTS NQS  2012.XLS]Super Stock'!$E46 -> 145 | O42: =IF('\\ser\Software\other\[POINTS NQS  2012.XLS]Super Stock'!$F46=0," ",'\\ser\Software\other\[POINTS NQS  2012.XLS]Super Stock'!$F46) -> Mechanical Nightmare | P42: ='\\ser\Software\other\[POINTS NQS  2012.XLS]Super Stock'!$AA46 -> 191
A43: ='\\ser\Software\other\[POINTS NQS  2012.XLS]Pro Stock'!$A47 -> 41 | B43: ='\\ser\Software\other\[POINTS NQS  2012.XLS]Pro Stock'!$B47 -> Ray Gentz | C43: ='\\ser\Software\other\[POINTS NQS  2012.XLS]Pro Stock'!$C47 -> Colon, Mich | D43: =IF('\\ser\Software\other\[POINTS NQS  2012.XLS]Pro Stock'!$D47=0," ",'\\ser\Software\other\[POINTS NQS  2012.XLS]Pro Stock'!$D47) -> JRS | E43: ='\\ser\Software\other\[POINTS NQS  2012.XLS]Pro Stock'!$E47 -> 262 | F43: =IF('\\ser\Software\other\[POINTS NQS  2012.XLS]Pro Stock'!$F47=0," ",'\\ser\Software\other\[POINTS NQS  2012.XLS]Pro Stock'!$F47) -> Chaos | G43: ='\\ser\Software\other\[POINTS NQS  2012.XLS]Pro Stock'!$AA47 -> 173 | J43: ='\\ser\Software\other\[POINTS NQS  2012.XLS]Super Stock'!$A47 -> 40 | K43: ='\\ser\Software\other\[POINTS NQS  2012.XLS]Super Stock'!$B47 -> Bill Nippe | L43: ='\\ser\Software\other\[POINTS NQS  2012.XLS]Super Stock'!$C47 -> Strasburg, IL | M43: =IF('\\ser\Software\other\[POINTS NQS  2012.XLS]Super Stock'!$D47=0," ",'\\ser\Software\other\[POINTS NQS  2012.XLS]Super Stock'!$D47) -> JW | N43: ='\\ser\Software\other\[POINTS NQS  2012.XLS]Super Stock'!$E47 -> 513 | O43: =IF('\\ser\Software\other\[POINTS NQS  2012.XLS]Super Stock'!$F47=0," ",'\\ser\Software\other\[POINTS NQS  2012.XLS]Super Stock'!$F47) -> Serious Business | P43: ='\\ser\Software\other\[POINTS NQS  2012.XLS]Super Stock'!$AA47 -> 191
A44: ='\\ser\Software\other\[POINTS NQS  2012.XLS]Pro Stock'!$A48 -> 42 | B44: ='\\ser\Software\other\[POINTS NQS  2012.XLS]Pro Stock'!$B48 -> Bruce Austin | C44: ='\\ser\Software\other\[POINTS NQS  2012.XLS]Pro Stock'!$C48 -> St Charles, IA | D44: =IF('\\ser\Software\other\[POINTS NQS  2012.XLS]Pro Stock'!$D48=0," ",'\\ser\Software\other\[POINTS NQS  2012.XLS]Pro Stock'!$D48) -> MVP | E44: ='\\ser\Software\other\[POINTS NQS  2012.XLS]Pro Stock'!$E48 -> 338 | F44: =IF('\\ser\Software\other\[POINTS NQS  2012.XLS]Pro Stock'!$F48=0," ",'\\ser\Software\other\[POINTS NQS  2012.XLS]Pro Stock'!$F48) -> Hillbilly Headache | G44: ='\\ser\Software\other\[POINTS NQS  2012.XLS]Pro Stock'!$AA48 -> 185 | J44: ='\\ser\Software\other\[POINTS NQS  2012.XLS]Super Stock'!$A48 -> 41 | K44: ='\\ser\Software\other\[POINTS NQS  2012.XLS]Super Stock'!$B48 -> Erik Pike | L44: ='\\ser\Software\other\[POINTS NQS  2012.XLS]Super Stock'!$C48 -> Effingham, IL | M44: =IF('\\ser\Software\other\[POINTS NQS  2012.XLS]Super Stock'!$D48=0," ",'\\ser\Software\other\[POINTS NQS  2012.XLS]Super Stock'!$D48) -> VM | N44: ='\\ser\Software\other\[POINTS NQS  2012.XLS]Super Stock'!$E48 -> 359 | O44: =IF('\\ser\Software\other\[POINTS NQS  2012.XLS]Super Stock'!$F48=0," ",'\\ser\Software\other\[POINTS NQS  2012.XLS]Super Stock'!$F48) -> Visual Expression | P44: ='\\ser\Software\other\[POINTS NQS  2012.XLS]Super Stock'!$AA48 -> 192
A45: ='\\ser\Software\other\[POINTS NQS  2012.XLS]Pro Stock'!$A49 -> 43 | B45: ='\\ser\Software\other\[POINTS NQS  2012.XLS]Pro Stock'!$B49 -> Tyler Hackman | C45: ='\\ser\Software\other\[POINTS NQS  2012.XLS]Pro Stock'!$C49 -> Seymour, Ind | D45: =IF('\\ser\Software\other\[POINTS NQS  2012.XLS]Pro Stock'!$D49=0," ",'\\ser\Software\other\[POINTS NQS  2012.XLS]Pro Stock'!$D49) -> Hackman | E45: ='\\ser\Software\other\[POINTS NQS  2012.XLS]Pro Stock'!$E49 -> 342 | F45: =IF('\\ser\Software\other\[POINTS NQS  2012.XLS]Pro Stock'!$F49=0," ",'\\ser\Software\other\[POINTS NQS  2012.XLS]Pro Stock'!$F49) -> Green | G45: ='\\ser\Software\other\[POINTS NQS  2012.XLS]Pro Stock'!$AA49 -> 186 | J45: ='\\ser\Software\other\[POINTS NQS  2012.XLS]Super Stock'!$A49 -> 42 | K45: ='\\ser\Software\other\[POINTS NQS  2012.XLS]Super Stock'!$B49 -> Steve Williford | L45: ='\\ser\Software\other\[POINTS NQS  2012.XLS]Super Stock'!$C49 -> Engelhard, NC | M45: =IF('\\ser\Software\other\[POINTS NQS  2012.XLS]Super Stock'!$D49=0," ",'\\ser\Software\other\[POINTS NQS  2012.XLS]Super Stock'!$D49) -> MVP | N45: ='\\ser\Software\other\[POINTS NQS  2012.XLS]Super Stock'!$E49 -> 176 | O45: =IF('\\ser\Software\other\[POINTS NQS  2012.XLS]Super Stock'!$F49=0," ",'\\ser\Software\other\[POINTS NQS  2012.XLS]Super Stock'!$F49) -> International | P45: ='\\ser\Software\other\[POINTS NQS  2012.XLS]Super Stock'!$AA49 -> 194
A46: ='\\ser\Software\other\[POINTS NQS  2012.XLS]Pro Stock'!$A50 -> 44 | B46: ='\\ser\Software\other\[POINTS NQS  2012.XLS]Pro Stock'!$B50 -> Logan Cessna | C46: ='\\ser\Software\other\[POINTS NQS  2012.XLS]Pro Stock'!$C50 -> Chambersburg, Pa | D46: =IF('\\ser\Software\other\[POINTS NQS  2012.XLS]Pro Stock'!$D50=0," ",'\\ser\Software\other\[POINTS NQS  2012.XLS]Pro Stock'!$D50) -> NP | E46: ='\\ser\Software\other\[POINTS NQS  2012.XLS]Pro Stock'!$E50 -> 389 | F46: =IF('\\ser\Software\other\[POINTS NQS  2012.XLS]Pro Stock'!$F50=0," ",'\\ser\Software\other\[POINTS NQS  2012.XLS]Pro Stock'!$F50) -> Adrenaline | G46: ='\\ser\Software\other\[POINTS NQS  2012.XLS]Pro Stock'!$AA50 -> 187 | J46: ='\\ser\Software\other\[POINTS NQS  2012.XLS]Super Stock'!$A50 -> 43 | K46: ='\\ser\Software\other\[POINTS NQS  2012.XLS]Super Stock'!$B50 -> Charlie Korff | L46: ='\\ser\Software\other\[POINTS NQS  2012.XLS]Super Stock'!$C50 -> Evansville, IN | M46: =IF('\\ser\Software\other\[POINTS NQS  2012.XLS]Super Stock'!$D50=0," ",'\\ser\Software\other\[POINTS NQS  2012.XLS]Super Stock'!$D50) -> TC | N46: ='\\ser\Software\other\[POINTS NQS  2012.XLS]Super Stock'!$E50 -> 400 | O46: =IF('\\ser\Software\other\[POINTS NQS  2012.XLS]Super Stock'!$F50=0," ",'\\ser\Software\other\[POINTS NQS  2012.XLS]Super Stock'!$F50) -> No Fear Deer | P46: ='\\ser\Software\other\[POINTS NQS  2012.XLS]Super Stock'!$AA50 -> 196
A47: ='\\ser\Software\other\[POINTS NQS  2012.XLS]Pro Stock'!$A51 -> 45 | B47: ='\\ser\Software\other\[POINTS NQS  2012.XLS]Pro Stock'!$B51 -> Bill Richerson | C47: ='\\ser\Software\other\[POINTS NQS  2012.XLS]Pro Stock'!$C51 -> Crittenden, Ky | D47: =IF('\\ser\Software\other\[POINTS NQS  2012.XLS]Pro Stock'!$D51=0," ",'\\ser\Software\other\[POINTS NQS  2012.XLS]Pro Stock'!$D51) -> JW | E47: ='\\ser\Software\other\[POINTS NQS  2012.XLS]Pro Stock'!$E51 -> 132 | F47: =IF('\\ser\Software\other\[POINTS NQS  2012.XLS]Pro Stock'!$F51=0," ",'\\ser\Software\other\[POINTS NQS  2012.XLS]Pro Stock'!$F51) -> Walk the Line29 | G47: ='\\ser\Software\other\[POINTS NQS  2012.XLS]Pro Stock'!$AA51 -> 189 | J47: ='\\ser\Software\other\[POINTS NQS  2012.XLS]Super Stock'!$A51 -> 44 | K47: ='\\ser\Software\other\[POINTS NQS  2012.XLS]Super Stock'!$B51 -> Zach Richerson | L47: ='\\ser\Software\other\[POINTS NQS  2012.XLS]Super Stock'!$C51 -> Crittenden, Ky | M47: =IF('\\ser\Software\other\[POINTS NQS  2012.XLS]Super Stock'!$D51=0," ",'\\ser\Software\other\[POINTS NQS  2012.XLS]Super Stock'!$D51) -> JW | N47: ='\\ser\Software\other\[POINTS NQS  2012.XLS]Super Stock'!$E51 -> 348 | O47: =IF('\\ser\Software\other\[POINTS NQS  2012.XLS]Super Stock'!$F51=0," ",'\\ser\Software\other\[POINTS NQS  2012.XLS]Super Stock'!$F51) -> Zach's Rat | P47: ='\\ser\Software\other\[POINTS NQS  2012.XLS]Super Stock'!$AA51 -> 198
A48: ='\\ser\Software\other\[POINTS NQS  2012.XLS]Pro Stock'!$A52 -> 46 | B48: ='\\ser\Software\other\[POINTS NQS  2012.XLS]Pro Stock'!$B52 -> Darlene Sample | C48: ='\\ser\Software\other\[POINTS NQS  2012.XLS]Pro Stock'!$C52 -> Carrolton, OH | D48: =IF('\\ser\Software\other\[POINTS NQS  2012.XLS]Pro Stock'!$D52=0," ",'\\ser\Software\other\[POINTS NQS  2012.XLS]Pro Stock'!$D52) -> LR | E48: ='\\ser\Software\other\[POINTS NQS  2012.XLS]Pro Stock'!$E52 -> 498 | F48: =IF('\\ser\Software\other\[POINTS NQS  2012.XLS]Pro Stock'!$F52=0," ",'\\ser\Software\other\[POINTS NQS  2012.XLS]Pro Stock'!$F52) -> Dr. Doom | G48: ='\\ser\Software\other\[POINTS NQS  2012.XLS]Pro Stock'!$AA52 -> 189 | J48: ='\\ser\Software\other\[POINTS NQS  2012.XLS]Super Stock'!$A52 -> 45 | K48: ='\\ser\Software\other\[POINTS NQS  2012.XLS]Super Stock'!$B52 -> Wes Kampeter | L48: ='\\ser\Software\other\[POINTS NQS  2012.XLS]Super Stock'!$C52 -> Freeburg, MO | M48: =IF('\\ser\Software\other\[POINTS NQS  2012.XLS]Super Stock'!$D52=0," ",'\\ser\Software\other\[POINTS NQS  2012.XLS]Super Stock'!$D52) -> NP | N48: ='\\ser\Software\other\[POINTS NQS  2012.XLS]Super Stock'!$E52 -> 583 | O48: =IF('\\ser\Software\other\[POINTS NQS  2012.XLS]Super Stock'!$F52=0," ",'\\ser\Software\other\[POINTS NQS  2012.XLS]Super Stock'!$F52) -> Torqued Up | P48: ='\\ser\Software\other\[POINTS NQS  2012.XLS]Super Stock'!$AA52 -> 200
A49: ='\\ser\Software\other\[POINTS NQS  2012.XLS]Pro Stock'!$A53 -> 47 | B49: ='\\ser\Software\other\[POINTS NQS  2012.XLS]Pro Stock'!$B53 -> Harrison Stahl | C49: ='\\ser\Software\other\[POINTS NQS  2012.XLS]Pro Stock'!$C53 -> Welton, IA | D49: =IF('\\ser\Software\other\[POINTS NQS  2012.XLS]Pro Stock'!$D53=0," ",'\\ser\Software\other\[POINTS NQS  2012.XLS]Pro Stock'!$D53) -> MVP | E49: ='\\ser\Software\other\[POINTS NQS  2012.XLS]Pro Stock'!$E53 -> 335 | F49: =IF('\\ser\Software\other\[POINTS NQS  2012.XLS]Pro Stock'!$F53=0," ",'\\ser\Software\other\[POINTS NQS  2012.XLS]Pro Stock'!$F53) -> MWSC #3 | G49: ='\\ser\Software\other\[POINTS NQS  2012.XLS]Pro Stock'!$AA53 -> 193 | J49: ='\\ser\Software\other\[POINTS NQS  2012.XLS]Super Stock'!$A53 -> 46 | K49: ='\\ser\Software\other\[POINTS NQS  2012.XLS]Super Stock'!$B53 -> Max Burkhart | L49: ='\\ser\Software\other\[POINTS NQS  2012.XLS]Super Stock'!$C53 -> Otwell, IN | M49: =IF('\\ser\Software\other\[POINTS NQS  2012.XLS]Super Stock'!$D53=0," ",'\\ser\Software\other\[POINTS NQS  2012.XLS]Super Stock'!$D53) -> TC | N49: ='\\ser\Software\other\[POINTS NQS  2012.XLS]Super Stock'!$E53 -> 78 | O49: =IF('\\ser\Software\other\[POINTS NQS  2012.XLS]Super Stock'!$F53=0," ",'\\ser\Software\other\[POINTS NQS  2012.XLS]Super Stock'!$F53) -> Ground Pounder | P49: ='\\ser\Software\other\[POINTS NQS  2012.XLS]Super Stock'!$AA53 -> 202
A50: ='\\ser\Software\other\[POINTS NQS  2012.XLS]Pro Stock'!$A54 -> 48 | B50: ='\\ser\Software\other\[POINTS NQS  2012.XLS]Pro Stock'!$B54 -> Jeremy Jaspering | C50: ='\\ser\Software\other\[POINTS NQS  2012.XLS]Pro Stock'!$C54 -> Perry, MO | D50: =IF('\\ser\Software\other\[POINTS NQS  2012.XLS]Pro Stock'!$D54=0," ",'\\ser\Software\other\[POINTS NQS  2012.XLS]Pro Stock'!$D54) -> LR | E50: ='\\ser\Software\other\[POINTS NQS  2012.XLS]Pro Stock'!$E54 -> 147 | F50: =IF('\\ser\Software\other\[POINTS NQS  2012.XLS]Pro Stock'!$F54=0," ",'\\ser\Software\other\[POINTS NQS  2012.XLS]Pro Stock'!$F54) -> Wicked | G50: ='\\ser\Software\other\[POINTS NQS  2012.XLS]Pro Stock'!$AA54 -> 194 | J50: ='\\ser\Software\other\[POINTS NQS  2012.XLS]Super Stock'!$A54 -> 47 | K50: ='\\ser\Software\other\[POINTS NQS  2012.XLS]Super Stock'!$B54 -> Matt Kaster | L50: ='\\ser\Software\other\[POINTS NQS  2012.XLS]Super Stock'!$C54 -> Burlington, WI | M50: =IF('\\ser\Software\other\[POINTS NQS  2012.XLS]Super Stock'!$D54=0," ",'\\ser\Software\other\[POINTS NQS  2012.XLS]Super Stock'!$D54) -> MVP | N50: ='\\ser\Software\other\[POINTS NQS  2012.XLS]Super Stock'!$E54 -> 98 | O50: =IF('\\ser\Software\other\[POINTS NQS  2012.XLS]Super Stock'!$F54=0," ",'\\ser\Software\other\[POINTS NQS  2012.XLS]Super Stock'!$F54) -> Moose on the Loose | P50: ='\\ser\Software\other\[POINTS NQS  2012.XLS]Super Stock'!$AA54 -> 202
A51: ='\\ser\Software\other\[POINTS NQS  2012.XLS]Pro Stock'!$A55 -> 49 | B51: ='\\ser\Software\other\[POINTS NQS  2012.XLS]Pro Stock'!$B55 -> Larry Hunter | C51: ='\\ser\Software\other\[POINTS NQS  2012.XLS]Pro Stock'!$C55 -> Blue Licks, Ky | D51: =IF('\\ser\Software\other\[POINTS NQS  2012.XLS]Pro Stock'!$D55=0," ",'\\ser\Software\other\[POINTS NQS  2012.XLS]Pro Stock'!$D55) ->  | E51: ='\\ser\Software\other\[POINTS NQS  2012.XLS]Pro Stock'!$E55 -> 220 | F51: =IF('\\ser\Software\other\[POINTS NQS  2012.XLS]Pro Stock'!$F55=0," ",'\\ser\Software\other\[POINTS NQS  2012.XLS]Pro Stock'!$F55) -> Bluelicker | G51: ='\\ser\Software\other\[POINTS NQS  2012.XLS]Pro Stock'!$AA55 -> 202 | J51: ='\\ser\Software\other\[POINTS NQS  2012.XLS]Super Stock'!$A55 -> 49 | K51: ='\\ser\Software\other\[POINTS NQS  2012.XLS]Super Stock'!$B55 -> Ray Gentz | L51: ='\\ser\Software\other\[POINTS NQS  2012.XLS]Super Stock'!$C55 -> Colon, MI | M51: =IF('\\ser\Software\other\[POINTS NQS  2012.XLS]Super Stock'!$D55=0," ",'\\ser\Software\other\[POINTS NQS  2012.XLS]Super Stock'!$D55) -> VM | N51: ='\\ser\Software\other\[POINTS NQS  2012.XLS]Super Stock'!$E55 -> 34 | O51: =IF('\\ser\Software\other\[POINTS NQS  2012.XLS]Super Stock'!$F55=0," ",'\\ser\Software\other\[POINTS NQS  2012.XLS]Super Stock'!$F55) ->  | P51: ='\\ser\Software\other\[POINTS NQS  2012.XLS]Super Stock'!$AA55 -> 203
A52: ='\\ser\Software\other\[POINTS NQS  2012.XLS]Pro Stock'!$A56 -> 50 | B52: ='\\ser\Software\other\[POINTS NQS  2012.XLS]Pro Stock'!$B56 -> Julian Stahl | C52: ='\\ser\Software\other\[POINTS NQS  2012.XLS]Pro Stock'!$C56 -> Welton, IA | D52: =IF('\\ser\Software\other\[POINTS NQS  2012.XLS]Pro Stock'!$D56=0," ",'\\ser\Software\other\[POINTS NQS  2012.XLS]Pro Stock'!$D56) -> MVP | E52: ='\\ser\Software\other\[POINTS NQS  2012.XLS]Pro Stock'!$E56 -> 1 | F52: =IF('\\ser\Software\other\[POINTS NQS  2012.XLS]Pro Stock'!$F56=0," ",'\\ser\Software\other\[POINTS NQS  2012.XLS]Pro Stock'!$F56) -> MWSC # 1 | G52: ='\\ser\Software\other\[POINTS NQS  2012.XLS]Pro Stock'!$AA56 -> 204 | J52: ='\\ser\Software\other\[POINTS NQS  2012.XLS]Super Stock'!$A56 -> 50 | K52: ='\\ser\Software\other\[POINTS NQS  2012.XLS]Super Stock'!$B56 -> Nick Mishler | L52: ='\\ser\Software\other\[POINTS NQS  2012.XLS]Super Stock'!$C56 -> East Peoria, IL | M52: =IF('\\ser\Software\other\[POINTS NQS  2012.XLS]Super Stock'!$D56=0," ",'\\ser\Software\other\[POINTS NQS  2012.XLS]Super Stock'!$D56) -> GTP | N52: ='\\ser\Software\other\[POINTS NQS  2012.XLS]Super Stock'!$E56 -> 167 | O52: =IF('\\ser\Software\other\[POINTS NQS  2012.XLS]Super Stock'!$F56=0," ",'\\ser\Software\other\[POINTS NQS  2012.XLS]Super Stock'!$F56) -> Pulse | P52: ='\\ser\Software\other\[POINTS NQS  2012.XLS]Super Stock'!$AA56 -> 203
A53: ='\\ser\Software\other\[POINTS NQS  2012.XLS]Pro Stock'!$A57 -> 51 | B53: ='\\ser\Software\other\[POINTS NQS  2012.XLS]Pro Stock'!$B57 -> Ron Scroggins | C53: ='\\ser\Software\other\[POINTS NQS  2012.XLS]Pro Stock'!$C57 -> Neosho, Mo | D53: =IF('\\ser\Software\other\[POINTS NQS  2012.XLS]Pro Stock'!$D57=0," ",'\\ser\Software\other\[POINTS NQS  2012.XLS]Pro Stock'!$D57) -> VM | E53: ='\\ser\Software\other\[POINTS NQS  2012.XLS]Pro Stock'!$E57 -> 110 | F53: =IF('\\ser\Software\other\[POINTS NQS  2012.XLS]Pro Stock'!$F57=0," ",'\\ser\Software\other\[POINTS NQS  2012.XLS]Pro Stock'!$F57) -> Dirt Dancer | G53: ='\\ser\Software\other\[POINTS NQS  2012.XLS]Pro Stock'!$AA57 -> 205 | J53: ='\\ser\Software\other\[POINTS NQS  2012.XLS]Super Stock'!$A57 -> 51 | K53: ='\\ser\Software\other\[POINTS NQS  2012.XLS]Super Stock'!$B57 -> Steve Chrisman | L53: ='\\ser\Software\other\[POINTS NQS  2012.XLS]Super Stock'!$C57 -> Edinburgh, IN | M53: =IF('\\ser\Software\other\[POINTS NQS  2012.XLS]Super Stock'!$D57=0," ",'\\ser\Software\other\[POINTS NQS  2012.XLS]Super Stock'!$D57) -> Hackman | N53: ='\\ser\Software\other\[POINTS NQS  2012.XLS]Super Stock'!$E57 -> 23 | O53: =IF('\\ser\Software\other\[POINTS NQS  2012.XLS]Super Stock'!$F57=0," ",'\\ser\Software\other\[POINTS NQS  2012.XLS]Super Stock'!$F57) -> Royal Pain | P53: ='\\ser\Software\other\[POINTS NQS  2012.XLS]Super Stock'!$AA57 -> 204
A54: ='\\ser\Software\other\[POINTS NQS  2012.XLS]Pro Stock'!$A58 -> 52 | B54: ='\\ser\Software\other\[POINTS NQS  2012.XLS]Pro Stock'!$B58 -> Zach Richerson | C54: ='\\ser\Software\other\[POINTS NQS  2012.XLS]Pro Stock'!$C58 -> Crittenden, Ky | D54: =IF('\\ser\Software\other\[POINTS NQS  2012.XLS]Pro Stock'!$D58=0," ",'\\ser\Software\other\[POINTS NQS  2012.XLS]Pro Stock'!$D58) -> JW | E54: ='\\ser\Software\other\[POINTS NQS  2012.XLS]Pro Stock'!$E58 -> 348 | F54: =IF('\\ser\Software\other\[POINTS NQS  2012.XLS]Pro Stock'!$F58=0," ",'\\ser\Software\other\[POINTS NQS  2012.XLS]Pro Stock'!$F58) -> Zach's Rat | G54: ='\\ser\Software\other\[POINTS NQS  2012.XLS]Pro Stock'!$AA58 -> 206 | J54: ='\\ser\Software\other\[POINTS NQS  2012.XLS]Super Stock'!$A58 -> 52 | K54: ='\\ser\Software\other\[POINTS NQS  2012.XLS]Super Stock'!$B58 -> Doug Diehl | L54: ='\\ser\Software\other\[POINTS NQS  2012.XLS]Super Stock'!$C58 -> Smithsburg, PA | M54: =IF('\\ser\Software\other\[POINTS NQS  2012.XLS]Super Stock'!$D58=0," ",'\\ser\Software\other\[POINTS NQS  2012.XLS]Super Stock'!$D58) -> NP | N54: ='\\ser\Software\other\[POINTS NQS  2012.XLS]Super Stock'!$E58 -> 441 | O54: =IF('\\ser\Software\other\[POINTS NQS  2012.XLS]Super Stock'!$F58=0," ",'\\ser\Software\other\[POINTS NQS  2012.XLS]Super Stock'!$F58) -> Excedrin | P54: ='\\ser\Software\other\[POINTS NQS  2012.XLS]Super Stock'!$AA58 -> 205
A55: ='\\ser\Software\other\[POINTS NQS  2012.XLS]Pro Stock'!$A59 -> 53 | B55: ='\\ser\Software\other\[POINTS NQS  2012.XLS]Pro Stock'!$B59 -> Charlie Korff | C55: ='\\ser\Software\other\[POINTS NQS  2012.XLS]Pro Stock'!$C59 -> Evansville, Ind | D55: =IF('\\ser\Software\other\[POINTS NQS  2012.XLS]Pro Stock'!$D59=0," ",'\\ser\Software\other\[POINTS NQS  2012.XLS]Pro Stock'!$D59) -> TC | E55: ='\\ser\Software\other\[POINTS NQS  2012.XLS]Pro Stock'!$E59 -> 400 | F55: =IF('\\ser\Software\other\[POINTS NQS  2012.XLS]Pro Stock'!$F59=0," ",'\\ser\Software\other\[POINTS NQS  2012.XLS]Pro Stock'!$F59) -> No Fear Deere | G55: ='\\ser\Software\other\[POINTS NQS  2012.XLS]Pro Stock'!$AA59 -> 206 | J55: ='\\ser\Software\other\[POINTS NQS  2012.XLS]Super Stock'!$A59 -> 53 | K55: ='\\ser\Software\other\[POINTS NQS  2012.XLS]Super Stock'!$B59 -> Darlene Sample | L55: ='\\ser\Software\other\[POINTS NQS  2012.XLS]Super Stock'!$C59 -> Carrollton, OH | M55: =IF('\\ser\Software\other\[POINTS NQS  2012.XLS]Super Stock'!$D59=0," ",'\\ser\Software\other\[POINTS NQS  2012.XLS]Super Stock'!$D59) -> LR | N55: ='\\ser\Software\other\[POINTS NQS  2012.XLS]Super Stock'!$E59 -> 498 | O55: =IF('\\ser\Software\other\[POINTS NQS  2012.XLS]Super Stock'!$F59=0," ",'\\ser\Software\other\[POINTS NQS  2012.XLS]Super Stock'!$F59) -> Dr. Doom | P55: ='\\ser\Software\other\[POINTS NQS  2012.XLS]Super Stock'!$AA59 -> 207
A56: ='\\ser\Software\other\[POINTS NQS  2012.XLS]Pro Stock'!$A60 -> 54 | B56: ='\\ser\Software\other\[POINTS NQS  2012.XLS]Pro Stock'!$B60 -> Ron Marcine | C56: ='\\ser\Software\other\[POINTS NQS  2012.XLS]Pro Stock'!$C60 -> Whitehouse Station, NJ | D56: =IF('\\ser\Software\other\[POINTS NQS  2012.XLS]Pro Stock'!$D60=0," ",'\\ser\Software\other\[POINTS NQS  2012.XLS]Pro Stock'!$D60) -> JRS | E56: ='\\ser\Software\other\[POINTS NQS  2012.XLS]Pro Stock'!$E60 -> 245 | F56: =IF('\\ser\Software\other\[POINTS NQS  2012.XLS]Pro Stock'!$F60=0," ",'\\ser\Software\other\[POINTS NQS  2012.XLS]Pro Stock'!$F60) -> No Pressure | G56: ='\\ser\Software\other\[POINTS NQS  2012.XLS]Pro Stock'!$AA60 -> 207 | J56: ='\\ser\Software\other\[POINTS NQS  2012.XLS]Super Stock'!$A60 -> 54 | K56: ='\\ser\Software\other\[POINTS NQS  2012.XLS]Super Stock'!$B60 -> Jake Gingerich | L56: ='\\ser\Software\other\[POINTS NQS  2012.XLS]Super Stock'!$C60 -> Montgomery, Ind | M56: =IF('\\ser\Software\other\[POINTS NQS  2012.XLS]Super Stock'!$D60=0," ",'\\ser\Software\other\[POINTS NQS  2012.XLS]Super Stock'!$D60) -> JW | N56: ='\\ser\Software\other\[POINTS NQS  2012.XLS]Super Stock'!$E60 -> 18 | O56: =IF('\\ser\Software\other\[POINTS NQS  2012.XLS]Super Stock'!$F60=0," ",'\\ser\Software\other\[POINTS NQS  2012.XLS]Super Stock'!$F60) -> Thumper | P56: ='\\ser\Software\other\[POINTS NQS  2012.XLS]Super Stock'!$AA60 -> 208
A57: ='\\ser\Software\other\[POINTS NQS  2012.XLS]Pro Stock'!$A61 -> 55 | B57: ='\\ser\Software\other\[POINTS NQS  2012.XLS]Pro Stock'!$B61 -> Morgan Cessna | C57: ='\\ser\Software\other\[POINTS NQS  2012.XLS]Pro Stock'!$C61 -> Chambersburg, Pa | D57: =IF('\\ser\Software\other\[POINTS NQS  2012.XLS]Pro Stock'!$D61=0," ",'\\ser\Software\other\[POINTS NQS  2012.XLS]Pro Stock'!$D61) -> NP | E57: ='\\ser\Software\other\[POINTS NQS  2012.XLS]Pro Stock'!$E61 -> 491 | F57: =IF('\\ser\Software\other\[POINTS NQS  2012.XLS]Pro Stock'!$F61=0," ",'\\ser\Software\other\[POINTS NQS  2012.XLS]Pro Stock'!$F61) -> Built for Business | G57: ='\\ser\Software\other\[POINTS NQS  2012.XLS]Pro Stock'!$AA61 -> 207 | J57: ='\\ser\Software\other\[POINTS NQS  2012.XLS]Super Stock'!$A61 -> 55 | K57: ='\\ser\Software\other\[POINTS NQS  2012.XLS]Super Stock'!$B61 -> Jake Gingerich | L57: ='\\ser\Software\other\[POINTS NQS  2012.XLS]Super Stock'!$C61 -> Montgomery, Ind | M57: =IF('\\ser\Software\other\[POINTS NQS  2012.XLS]Super Stock'!$D61=0," ",'\\ser\Software\other\[POINTS NQS  2012.XLS]Super Stock'!$D61) -> JW | N57: ='\\ser\Software\other\[POINTS NQS  2012.XLS]Super Stock'!$E61 -> 28 | O57: =IF('\\ser\Software\other\[POINTS NQS  2012.XLS]Super Stock'!$F61=0," ",'\\ser\Software\other\[POINTS NQS  2012.XLS]Super Stock'!$F61) -> Silver Fox | P57: ='\\ser\Software\other\[POINTS NQS  2012.XLS]Super Stock'!$AA61 -> 212
A58: ='\\ser\Software\other\[POINTS NQS  2012.XLS]Pro Stock'!$A62 -> 56 | B58: ='\\ser\Software\other\[POINTS NQS  2012.XLS]Pro Stock'!$B62 -> Mike Silco | C58: ='\\ser\Software\other\[POINTS NQS  2012.XLS]Pro Stock'!$C62 -> Pittsford, NY | D58: =IF('\\ser\Software\other\[POINTS NQS  2012.XLS]Pro Stock'!$D62=0," ",'\\ser\Software\other\[POINTS NQS  2012.XLS]Pro Stock'!$D62) -> LR | E58: ='\\ser\Software\other\[POINTS NQS  2012.XLS]Pro Stock'!$E62 -> 547 | F58: =IF('\\ser\Software\other\[POINTS NQS  2012.XLS]Pro Stock'!$F62=0," ",'\\ser\Software\other\[POINTS NQS  2012.XLS]Pro Stock'!$F62) -> 1466 Alcoholic | G58: ='\\ser\Software\other\[POINTS NQS  2012.XLS]Pro Stock'!$AA62 -> 209 | J58: ='\\ser\Software\other\[POINTS NQS  2012.XLS]Super Stock'!$A62 -> 56 | K58: ='\\ser\Software\other\[POINTS NQS  2012.XLS]Super Stock'!$B62 -> Carl Zimmermran | L58: ='\\ser\Software\other\[POINTS NQS  2012.XLS]Super Stock'!$C62 -> Earlville, Ill | M58: =IF('\\ser\Software\other\[POINTS NQS  2012.XLS]Super Stock'!$D62=0," ",'\\ser\Software\other\[POINTS NQS  2012.XLS]Super Stock'!$D62) -> JRS | N58: ='\\ser\Software\other\[POINTS NQS  2012.XLS]Super Stock'!$E62 -> 395 | O58: =IF('\\ser\Software\other\[POINTS NQS  2012.XLS]Super Stock'!$F62=0," ",'\\ser\Software\other\[POINTS NQS  2012.XLS]Super Stock'!$F62) -> Bragging Rights | P58: ='\\ser\Software\other\[POINTS NQS  2012.XLS]Super Stock'!$AA62 -> 212
A59: ='\\ser\Software\other\[POINTS NQS  2012.XLS]Pro Stock'!$A63 -> 57 | B59: ='\\ser\Software\other\[POINTS NQS  2012.XLS]Pro Stock'!$B63 -> Doug Rood | C59: ='\\ser\Software\other\[POINTS NQS  2012.XLS]Pro Stock'!$C63 -> Ypsilanti, Mi | D59: =IF('\\ser\Software\other\[POINTS NQS  2012.XLS]Pro Stock'!$D63=0," ",'\\ser\Software\other\[POINTS NQS  2012.XLS]Pro Stock'!$D63) -> NP | E59: ='\\ser\Software\other\[POINTS NQS  2012.XLS]Pro Stock'!$E63 -> 354 | F59: =IF('\\ser\Software\other\[POINTS NQS  2012.XLS]Pro Stock'!$F63=0," ",'\\ser\Software\other\[POINTS NQS  2012.XLS]Pro Stock'!$F63) -> Blue Dawg | G59: ='\\ser\Software\other\[POINTS NQS  2012.XLS]Pro Stock'!$AA63 -> 210 | J59: ='\\ser\Software\other\[POINTS NQS  2012.XLS]Super Stock'!$A63 -> 57 | K59: ='\\ser\Software\other\[POINTS NQS  2012.XLS]Super Stock'!$B63 -> Bradley Corzine | L59: ='\\ser\Software\other\[POINTS NQS  2012.XLS]Super Stock'!$C63 -> Dongola, IL | M59: =IF('\\ser\Software\other\[POINTS NQS  2012.XLS]Super Stock'!$D63=0," ",'\\ser\Software\other\[POINTS NQS  2012.XLS]Super Stock'!$D63) -> JW | N59: ='\\ser\Software\other\[POINTS NQS  2012.XLS]Super Stock'!$E63 -> 509 | O59: =IF('\\ser\Software\other\[POINTS NQS  2012.XLS]Super Stock'!$F63=0," ",'\\ser\Software\other\[POINTS NQS  2012.XLS]Super Stock'!$F63) -> Just Black | P59: ='\\ser\Software\other\[POINTS NQS  2012.XLS]Super Stock'!$AA63 -> 212
A60: ='\\ser\Software\other\[POINTS NQS  2012.XLS]Pro Stock'!$A64 -> 58 | B60: ='\\ser\Software\other\[POINTS NQS  2012.XLS]Pro Stock'!$B64 -> Mark Conover | C60: ='\\ser\Software\other\[POINTS NQS  2012.XLS]Pro Stock'!$C64 -> Edinburg, Ind | D60: =IF('\\ser\Software\other\[POINTS NQS  2012.XLS]Pro Stock'!$D64=0," ",'\\ser\Software\other\[POINTS NQS  2012.XLS]Pro Stock'!$D64) -> VM | E60: ='\\ser\Software\other\[POINTS NQS  2012.XLS]Pro Stock'!$E64 -> 360 | F60: =IF('\\ser\Software\other\[POINTS NQS  2012.XLS]Pro Stock'!$F64=0," ",'\\ser\Software\other\[POINTS NQS  2012.XLS]Pro Stock'!$F64) -> VuDoo Too | G60: ='\\ser\Software\other\[POINTS NQS  2012.XLS]Pro Stock'!$AA64 -> 210 | J60: ='\\ser\Software\other\[POINTS NQS  2012.XLS]Super Stock'!$A64 -> 58 | K60: ='\\ser\Software\other\[POINTS NQS  2012.XLS]Super Stock'!$B64 -> Jeremy Jaspering | L60: ='\\ser\Software\other\[POINTS NQS  2012.XLS]Super Stock'!$C64 -> Perry, MO | M60: =IF('\\ser\Software\other\[POINTS NQS  2012.XLS]Super Stock'!$D64=0," ",'\\ser\Software\other\[POINTS NQS  2012.XLS]Super Stock'!$D64) ->  | N60: ='\\ser\Software\other\[POINTS NQS  2012.XLS]Super Stock'!$E64 -> 147 | O60: =IF('\\ser\Software\other\[POINTS NQS  2012.XLS]Super Stock'!$F64=0," ",'\\ser\Software\other\[POINTS NQS  2012.XLS]Super Stock'!$F64) -> Wicked | P60: ='\\ser\Software\other\[POINTS NQS  2012.XLS]Super Stock'!$AA64 -> 214
A61: ='\\ser\Software\other\[POINTS NQS  2012.XLS]Pro Stock'!$A65 -> 59 | B61: ='\\ser\Software\other\[POINTS NQS  2012.XLS]Pro Stock'!$B65 -> Ron Scroggins | C61: ='\\ser\Software\other\[POINTS NQS  2012.XLS]Pro Stock'!$C65 -> Neosho, Mo | D61: =IF('\\ser\Software\other\[POINTS NQS  2012.XLS]Pro Stock'!$D65=0," ",'\\ser\Software\other\[POINTS NQS  2012.XLS]Pro Stock'!$D65) -> VM | E61: ='\\ser\Software\other\[POINTS NQS  2012.XLS]Pro Stock'!$E65 -> 111 | F61: =IF('\\ser\Software\other\[POINTS NQS  2012.XLS]Pro Stock'!$F65=0," ",'\\ser\Software\other\[POINTS NQS  2012.XLS]Pro Stock'!$F65) -> Black Out | G61: ='\\ser\Software\other\[POINTS NQS  2012.XLS]Pro Stock'!$AA65 -> 211 | J61: ='\\ser\Software\other\[POINTS NQS  2012.XLS]Super Stock'!$A65 -> 59 | K61: ='\\ser\Software\other\[POINTS NQS  2012.XLS]Super Stock'!$B65 -> Brian Titzer | L61: ='\\ser\Software\other\[POINTS NQS  2012.XLS]Super Stock'!$C65 -> Evansville, IN | M61: =IF('\\ser\Software\other\[POINTS NQS  2012.XLS]Super Stock'!$D65=0," ",'\\ser\Software\other\[POINTS NQS  2012.XLS]Super Stock'!$D65) -> TC | N61: ='\\ser\Software\other\[POINTS NQS  2012.XLS]Super Stock'!$E65 -> 364 | O61: =IF('\\ser\Software\other\[POINTS NQS  2012.XLS]Super Stock'!$F65=0," ",'\\ser\Software\other\[POINTS NQS  2012.XLS]Super Stock'!$F65) -> Single Boys Toy | P61: ='\\ser\Software\other\[POINTS NQS  2012.XLS]Super Stock'!$AA65 -> 214
A62: ='\\ser\Software\other\[POINTS NQS  2012.XLS]Pro Stock'!$A66 -> 60 | B62: ='\\ser\Software\other\[POINTS NQS  2012.XLS]Pro Stock'!$B66 -> Alex Naffe | C62: ='\\ser\Software\other\[POINTS NQS  2012.XLS]Pro Stock'!$C66 -> Seymour, Ind | D62: =IF('\\ser\Software\other\[POINTS NQS  2012.XLS]Pro Stock'!$D66=0," ",'\\ser\Software\other\[POINTS NQS  2012.XLS]Pro Stock'!$D66) -> GH | E62: ='\\ser\Software\other\[POINTS NQS  2012.XLS]Pro Stock'!$E66 -> 138 | F62: =IF('\\ser\Software\other\[POINTS NQS  2012.XLS]Pro Stock'!$F66=0," ",'\\ser\Software\other\[POINTS NQS  2012.XLS]Pro Stock'!$F66) -> Totally Frustrated | G62: ='\\ser\Software\other\[POINTS NQS  2012.XLS]Pro Stock'!$AA66 -> 212 | J62: ='\\ser\Software\other\[POINTS NQS  2012.XLS]Super Stock'!$A66 -> 60 | K62: ='\\ser\Software\other\[POINTS NQS  2012.XLS]Super Stock'!$B66 -> Mike Spencer | L62: ='\\ser\Software\other\[POINTS NQS  2012.XLS]Super Stock'!$C66 -> West Alexandria, OH | M62: =IF('\\ser\Software\other\[POINTS NQS  2012.XLS]Super Stock'!$D66=0," ",'\\ser\Software\other\[POINTS NQS  2012.XLS]Super Stock'!$D66) -> MVP | N62: ='\\ser\Software\other\[POINTS NQS  2012.XLS]Super Stock'!$E66 -> 517 | O62: =IF('\\ser\Software\other\[POINTS NQS  2012.XLS]Super Stock'!$F66=0," ",'\\ser\Software\other\[POINTS NQS  2012.XLS]Super Stock'!$F66) -> Half Pint | P62: ='\\ser\Software\other\[POINTS NQS  2012.XLS]Super Stock'!$AA66 -> 214
A63: ='\\ser\Software\other\[POINTS NQS  2012.XLS]Pro Stock'!$A67 -> 61 | B63: ='\\ser\Software\other\[POINTS NQS  2012.XLS]Pro Stock'!$B67 -> Joe Young | C63: ='\\ser\Software\other\[POINTS NQS  2012.XLS]Pro Stock'!$C67 -> Kimball, Mich | D63: =IF('\\ser\Software\other\[POINTS NQS  2012.XLS]Pro Stock'!$D67=0," ",'\\ser\Software\other\[POINTS NQS  2012.XLS]Pro Stock'!$D67) -> NP | E63: ='\\ser\Software\other\[POINTS NQS  2012.XLS]Pro Stock'!$E67 -> 479 | F63: =IF('\\ser\Software\other\[POINTS NQS  2012.XLS]Pro Stock'!$F67=0," ",'\\ser\Software\other\[POINTS NQS  2012.XLS]Pro Stock'!$F67) -> Mental Health | G63: ='\\ser\Software\other\[POINTS NQS  2012.XLS]Pro Stock'!$AA67 -> 212 | J63: ='\\ser\Software\other\[POINTS NQS  2012.XLS]Super Stock'!$A67 -> 61 | K63: ='\\ser\Software\other\[POINTS NQS  2012.XLS]Super Stock'!$B67 -> Ron Marcine | L63: ='\\ser\Software\other\[POINTS NQS  2012.XLS]Super Stock'!$C67 -> Whitehouse Station, NJ | M63: =IF('\\ser\Software\other\[POINTS NQS  2012.XLS]Super Stock'!$D67=0," ",'\\ser\Software\other\[POINTS NQS  2012.XLS]Super Stock'!$D67) -> MVP | N63: ='\\ser\Software\other\[POINTS NQS  2012.XLS]Super Stock'!$E67 -> 245 | O63: =IF('\\ser\Software\other\[POINTS NQS  2012.XLS]Super Stock'!$F67=0," ",'\\ser\Software\other\[POINTS NQS  2012.XLS]Super Stock'!$F67) -> No Pressure | P63: ='\\ser\Software\other\[POINTS NQS  2012.XLS]Super Stock'!$AA67 -> 215
A64: ='\\ser\Software\other\[POINTS NQS  2012.XLS]Pro Stock'!$A68 -> 62 | B64: ='\\ser\Software\other\[POINTS NQS  2012.XLS]Pro Stock'!$B68 -> Ray Gentz | C64: ='\\ser\Software\other\[POINTS NQS  2012.XLS]Pro Stock'!$C68 -> Colon, Mich | D64: =IF('\\ser\Software\other\[POINTS NQS  2012.XLS]Pro Stock'!$D68=0," ",'\\ser\Software\other\[POINTS NQS  2012.XLS]Pro Stock'!$D68) -> VM | E64: ='\\ser\Software\other\[POINTS NQS  2012.XLS]Pro Stock'!$E68 -> 34 | F64: =IF('\\ser\Software\other\[POINTS NQS  2012.XLS]Pro Stock'!$F68=0," ",'\\ser\Software\other\[POINTS NQS  2012.XLS]Pro Stock'!$F68) ->  | G64: ='\\ser\Software\other\[POINTS NQS  2012.XLS]Pro Stock'!$AA68 -> 213 | J64: ='\\ser\Software\other\[POINTS NQS  2012.XLS]Super Stock'!$A68 -> 62 | K64: ='\\ser\Software\other\[POINTS NQS  2012.XLS]Super Stock'!$B68 -> Bob Vogel | L64: ='\\ser\Software\other\[POINTS NQS  2012.XLS]Super Stock'!$C68 -> Altamont, Ill | M64: =IF('\\ser\Software\other\[POINTS NQS  2012.XLS]Super Stock'!$D68=0," ",'\\ser\Software\other\[POINTS NQS  2012.XLS]Super Stock'!$D68) -> VM | N64: ='\\ser\Software\other\[POINTS NQS  2012.XLS]Super Stock'!$E68 -> 361 | O64: =IF('\\ser\Software\other\[POINTS NQS  2012.XLS]Super Stock'!$F68=0," ",'\\ser\Software\other\[POINTS NQS  2012.XLS]Super Stock'!$F68) -> Diggers Farmall | P64: ='\\ser\Software\other\[POINTS NQS  2012.XLS]Super Stock'!$AA68 -> 218
A65: ='\\ser\Software\other\[POINTS NQS  2012.XLS]Pro Stock'!$A69 -> 63 | B65: ='\\ser\Software\other\[POINTS NQS  2012.XLS]Pro Stock'!$B69 -> Dan Schell | C65: ='\\ser\Software\other\[POINTS NQS  2012.XLS]Pro Stock'!$C69 -> Darien, WI | D65: =IF('\\ser\Software\other\[POINTS NQS  2012.XLS]Pro Stock'!$D69=0," ",'\\ser\Software\other\[POINTS NQS  2012.XLS]Pro Stock'!$D69) ->  | E65: ='\\ser\Software\other\[POINTS NQS  2012.XLS]Pro Stock'!$E69 -> 375 | F65: =IF('\\ser\Software\other\[POINTS NQS  2012.XLS]Pro Stock'!$F69=0," ",'\\ser\Software\other\[POINTS NQS  2012.XLS]Pro Stock'!$F69) -> Blind Ambition | G65: ='\\ser\Software\other\[POINTS NQS  2012.XLS]Pro Stock'!$AA69 -> 214 | J65: ='\\ser\Software\other\[POINTS NQS  2012.XLS]Super Stock'!$A69 -> 63 | K65: ='\\ser\Software\other\[POINTS NQS  2012.XLS]Super Stock'!$B69 -> Ron Scroggins | L65: ='\\ser\Software\other\[POINTS NQS  2012.XLS]Super Stock'!$C69 -> Neosho, MO | M65: =IF('\\ser\Software\other\[POINTS NQS  2012.XLS]Super Stock'!$D69=0," ",'\\ser\Software\other\[POINTS NQS  2012.XLS]Super Stock'!$D69) -> VM | N65: ='\\ser\Software\other\[POINTS NQS  2012.XLS]Super Stock'!$E69 -> 111 | O65: =IF('\\ser\Software\other\[POINTS NQS  2012.XLS]Super Stock'!$F69=0," ",'\\ser\Software\other\[POINTS NQS  2012.XLS]Super Stock'!$F69) -> Black out | P65: ='\\ser\Software\other\[POINTS NQS  2012.XLS]Super Stock'!$AA69 -> 219
A66: ='\\ser\Software\other\[POINTS NQS  2012.XLS]Pro Stock'!$A70 -> 64 | B66: ='\\ser\Software\other\[POINTS NQS  2012.XLS]Pro Stock'!$B70 -> Nevin Stitzer | C66: ='\\ser\Software\other\[POINTS NQS  2012.XLS]Pro Stock'!$C70 -> Spring Mills, PA | D66: =IF('\\ser\Software\other\[POINTS NQS  2012.XLS]Pro Stock'!$D70=0," ",'\\ser\Software\other\[POINTS NQS  2012.XLS]Pro Stock'!$D70) ->  | E66: ='\\ser\Software\other\[POINTS NQS  2012.XLS]Pro Stock'!$E70 -> 447 | F66: =IF('\\ser\Software\other\[POINTS NQS  2012.XLS]Pro Stock'!$F70=0," ",'\\ser\Software\other\[POINTS NQS  2012.XLS]Pro Stock'!$F70) -> Thunder Road II | G66: ='\\ser\Software\other\[POINTS NQS  2012.XLS]Pro Stock'!$AA70 -> 214 | J66: ='\\ser\Software\other\[POINTS NQS  2012.XLS]Super Stock'!$A70 -> 64 | K66: ='\\ser\Software\other\[POINTS NQS  2012.XLS]Super Stock'!$B70 -> Bill Richerson | L66: ='\\ser\Software\other\[POINTS NQS  2012.XLS]Super Stock'!$C70 -> Crittenden, Ky | M66: =IF('\\ser\Software\other\[POINTS NQS  2012.XLS]Super Stock'!$D70=0," ",'\\ser\Software\other\[POINTS NQS  2012.XLS]Super Stock'!$D70) -> JW | N66: ='\\ser\Software\other\[POINTS NQS  2012.XLS]Super Stock'!$E70 -> 132 | O66: =IF('\\ser\Software\other\[POINTS NQS  2012.XLS]Super Stock'!$F70=0," ",'\\ser\Software\other\[POINTS NQS  2012.XLS]Super Stock'!$F70) ->  | P66: ='\\ser\Software\other\[POINTS NQS  2012.XLS]Super Stock'!$AA70 -> 219
A67: ='\\ser\Software\other\[POINTS NQS  2012.XLS]Pro Stock'!$A71 -> 65 | B67: ='\\ser\Software\other\[POINTS NQS  2012.XLS]Pro Stock'!$B71 -> David Mascher SR | C67: ='\\ser\Software\other\[POINTS NQS  2012.XLS]Pro Stock'!$C71 -> Mooresville, Ind | D67: =IF('\\ser\Software\other\[POINTS NQS  2012.XLS]Pro Stock'!$D71=0," ",'\\ser\Software\other\[POINTS NQS  2012.XLS]Pro Stock'!$D71) -> Mascher | E67: ='\\ser\Software\other\[POINTS NQS  2012.XLS]Pro Stock'!$E71 -> 512 | F67: =IF('\\ser\Software\other\[POINTS NQS  2012.XLS]Pro Stock'!$F71=0," ",'\\ser\Software\other\[POINTS NQS  2012.XLS]Pro Stock'!$F71) ->  | G67: ='\\ser\Software\other\[POINTS NQS  2012.XLS]Pro Stock'!$AA71 -> 219 | J67: ='\\ser\Software\other\[POINTS NQS  2012.XLS]Super Stock'!$A71 -> 65 | K67: ='\\ser\Software\other\[POINTS NQS  2012.XLS]Super Stock'!$B71 -> Todd Hammond | L67: ='\\ser\Software\other\[POINTS NQS  2012.XLS]Super Stock'!$C71 -> Falling Waters, WV | M67: =IF('\\ser\Software\other\[POINTS NQS  2012.XLS]Super Stock'!$D71=0," ",'\\ser\Software\other\[POINTS NQS  2012.XLS]Super Stock'!$D71) -> JRS | N67: ='\\ser\Software\other\[POINTS NQS  2012.XLS]Super Stock'!$E71 -> 301 | O67: =IF('\\ser\Software\other\[POINTS NQS  2012.XLS]Super Stock'!$F71=0," ",'\\ser\Software\other\[POINTS NQS  2012.XLS]Super Stock'!$F71) -> Punisher | P67: ='\\ser\Software\other\[POINTS NQS  2012.XLS]Super Stock'!$AA71 -> 220
A68: ='\\ser\Software\other\[POINTS NQS  2012.XLS]Pro Stock'!$A72 -> 66 | B68: ='\\ser\Software\other\[POINTS NQS  2012.XLS]Pro Stock'!$B72 -> Kevin Root | C68: ='\\ser\Software\other\[POINTS NQS  2012.XLS]Pro Stock'!$C72 -> Inola, Okla | D68: =IF('\\ser\Software\other\[POINTS NQS  2012.XLS]Pro Stock'!$D72=0," ",'\\ser\Software\other\[POINTS NQS  2012.XLS]Pro Stock'!$D72) -> Root | E68: ='\\ser\Software\other\[POINTS NQS  2012.XLS]Pro Stock'!$E72 -> 117 | F68: =IF('\\ser\Software\other\[POINTS NQS  2012.XLS]Pro Stock'!$F72=0," ",'\\ser\Software\other\[POINTS NQS  2012.XLS]Pro Stock'!$F72) -> Right on the Money | G68: ='\\ser\Software\other\[POINTS NQS  2012.XLS]Pro Stock'!$AA72 -> 228 | J68: ='\\ser\Software\other\[POINTS NQS  2012.XLS]Super Stock'!$A72 -> 66 | K68: ='\\ser\Software\other\[POINTS NQS  2012.XLS]Super Stock'!$B72 -> Larry Korff | L68: ='\\ser\Software\other\[POINTS NQS  2012.XLS]Super Stock'!$C72 -> Evansville, IN | M68: =IF('\\ser\Software\other\[POINTS NQS  2012.XLS]Super Stock'!$D72=0," ",'\\ser\Software\other\[POINTS NQS  2012.XLS]Super Stock'!$D72) -> TC | N68: ='\\ser\Software\other\[POINTS NQS  2012.XLS]Super Stock'!$E72 -> 398 | O68: =IF('\\ser\Software\other\[POINTS NQS  2012.XLS]Super Stock'!$F72=0," ",'\\ser\Software\other\[POINTS NQS  2012.XLS]Super Stock'!$F72) -> Kryptonite | P68: ='\\ser\Software\other\[POINTS NQS  2012.XLS]Super Stock'!$AA72 -> 220
A69: ='\\ser\Software\other\[POINTS NQS  2012.XLS]Pro Stock'!$A73 -> 67 | B69: ='\\ser\Software\other\[POINTS NQS  2012.XLS]Pro Stock'!$B73 -> Dustin Blair | C69: ='\\ser\Software\other\[POINTS NQS  2012.XLS]Pro Stock'!$C73 -> Bonnieville, Ky | D69: =IF('\\ser\Software\other\[POINTS NQS  2012.XLS]Pro Stock'!$D73=0," ",'\\ser\Software\other\[POINTS NQS  2012.XLS]Pro Stock'!$D73) -> JW | E69: ='\\ser\Software\other\[POINTS NQS  2012.XLS]Pro Stock'!$E73 -> 380 | F69: =IF('\\ser\Software\other\[POINTS NQS  2012.XLS]Pro Stock'!$F73=0," ",'\\ser\Software\other\[POINTS NQS  2012.XLS]Pro Stock'!$F73) -> Armed and Dangerous | G69: ='\\ser\Software\other\[POINTS NQS  2012.XLS]Pro Stock'!$AA73 -> 228 | J69: ='\\ser\Software\other\[POINTS NQS  2012.XLS]Super Stock'!$A73 -> 67 | K69: ='\\ser\Software\other\[POINTS NQS  2012.XLS]Super Stock'!$B73 -> Todd Hammond | L69: ='\\ser\Software\other\[POINTS NQS  2012.XLS]Super Stock'!$C73 -> Falling Waters, WV | M69: =IF('\\ser\Software\other\[POINTS NQS  2012.XLS]Super Stock'!$D73=0," ",'\\ser\Software\other\[POINTS NQS  2012.XLS]Super Stock'!$D73) -> JRS | N69: ='\\ser\Software\other\[POINTS NQS  2012.XLS]Super Stock'!$E73 -> 241 | O69: =IF('\\ser\Software\other\[POINTS NQS  2012.XLS]Super Stock'!$F73=0," ",'\\ser\Software\other\[POINTS NQS  2012.XLS]Super Stock'!$F73) -> Problem Child | P69: ='\\ser\Software\other\[POINTS NQS  2012.XLS]Super Stock'!$AA73 -> 222
A70: ='\\ser\Software\other\[POINTS NQS  2012.XLS]Pro Stock'!$A74 -> 68 | B70: ='\\ser\Software\other\[POINTS NQS  2012.XLS]Pro Stock'!$B74 -> Nevin Stitzer | C70: ='\\ser\Software\other\[POINTS NQS  2012.XLS]Pro Stock'!$C74 -> Spring Mills, PA | D70: =IF('\\ser\Software\other\[POINTS NQS  2012.XLS]Pro Stock'!$D74=0," ",'\\ser\Software\other\[POINTS NQS  2012.XLS]Pro Stock'!$D74) ->  | E70: ='\\ser\Software\other\[POINTS NQS  2012.XLS]Pro Stock'!$E74 -> 446 | F70: =IF('\\ser\Software\other\[POINTS NQS  2012.XLS]Pro Stock'!$F74=0," ",'\\ser\Software\other\[POINTS NQS  2012.XLS]Pro Stock'!$F74) -> Thunder Road II | G70: ='\\ser\Software\other\[POINTS NQS  2012.XLS]Pro Stock'!$AA74 -> 228 | J70: ='\\ser\Software\other\[POINTS NQS  2012.XLS]Super Stock'!$A74 -> 68 | K70: ='\\ser\Software\other\[POINTS NQS  2012.XLS]Super Stock'!$B74 -> Ray Gentz | L70: ='\\ser\Software\other\[POINTS NQS  2012.XLS]Super Stock'!$C74 -> Colon, MI | M70: =IF('\\ser\Software\other\[POINTS NQS  2012.XLS]Super Stock'!$D74=0," ",'\\ser\Software\other\[POINTS NQS  2012.XLS]Super Stock'!$D74) -> JRS | N70: ='\\ser\Software\other\[POINTS NQS  2012.XLS]Super Stock'!$E74 -> 35 | O70: =IF('\\ser\Software\other\[POINTS NQS  2012.XLS]Super Stock'!$F74=0," ",'\\ser\Software\other\[POINTS NQS  2012.XLS]Super Stock'!$F74) -> B.U. Cub | P70: ='\\ser\Software\other\[POINTS NQS  2012.XLS]Super Stock'!$AA74 -> 223
A71: ='\\ser\Software\other\[POINTS NQS  2012.XLS]Pro Stock'!$A75 -> 69 | B71: ='\\ser\Software\other\[POINTS NQS  2012.XLS]Pro Stock'!$B75 -> Mike Dockhan | C71: ='\\ser\Software\other\[POINTS NQS  2012.XLS]Pro Stock'!$C75 -> Imlay City, Mich | D71: =IF('\\ser\Software\other\[POINTS NQS  2012.XLS]Pro Stock'!$D75=0," ",'\\ser\Software\other\[POINTS NQS  2012.XLS]Pro Stock'!$D75) ->  | E71: ='\\ser\Software\other\[POINTS NQS  2012.XLS]Pro Stock'!$E75 -> 530 | F71: =IF('\\ser\Software\other\[POINTS NQS  2012.XLS]Pro Stock'!$F75=0," ",'\\ser\Software\other\[POINTS NQS  2012.XLS]Pro Stock'!$F75) -> Plain Blue | G71: ='\\ser\Software\other\[POINTS NQS  2012.XLS]Pro Stock'!$AA75 -> 228 | J71: ='\\ser\Software\other\[POINTS NQS  2012.XLS]Super Stock'!$A75 -> 69 | K71: ='\\ser\Software\other\[POINTS NQS  2012.XLS]Super Stock'!$B75 -> Mark Davis | L71: ='\\ser\Software\other\[POINTS NQS  2012.XLS]Super Stock'!$C75 -> Lower Salem, Oh | M71: =IF('\\ser\Software\other\[POINTS NQS  2012.XLS]Super Stock'!$D75=0," ",'\\ser\Software\other\[POINTS NQS  2012.XLS]Super Stock'!$D75) -> JRS | N71: ='\\ser\Software\other\[POINTS NQS  2012.XLS]Super Stock'!$E75 -> 67 | O71: =IF('\\ser\Software\other\[POINTS NQS  2012.XLS]Super Stock'!$F75=0," ",'\\ser\Software\other\[POINTS NQS  2012.XLS]Super Stock'!$F75) -> No Limits | P71: ='\\ser\Software\other\[POINTS NQS  2012.XLS]Super Stock'!$AA75 -> 224
A72: ='\\ser\Software\other\[POINTS NQS  2012.XLS]Pro Stock'!$A76 -> 70 | B72: ='\\ser\Software\other\[POINTS NQS  2012.XLS]Pro Stock'!$B76 -> Ryan Forrett | C72: ='\\ser\Software\other\[POINTS NQS  2012.XLS]Pro Stock'!$C76 -> Preston, IA | D72: =IF('\\ser\Software\other\[POINTS NQS  2012.XLS]Pro Stock'!$D76=0," ",'\\ser\Software\other\[POINTS NQS  2012.XLS]Pro Stock'!$D76) -> MVP | E72: ='\\ser\Software\other\[POINTS NQS  2012.XLS]Pro Stock'!$E76 -> 568 | F72: =IF('\\ser\Software\other\[POINTS NQS  2012.XLS]Pro Stock'!$F76=0," ",'\\ser\Software\other\[POINTS NQS  2012.XLS]Pro Stock'!$F76) -> 6030 Deere | G72: ='\\ser\Software\other\[POINTS NQS  2012.XLS]Pro Stock'!$AA76 -> 228 | J72: ='\\ser\Software\other\[POINTS NQS  2012.XLS]Super Stock'!$A76 -> 70 | K72: ='\\ser\Software\other\[POINTS NQS  2012.XLS]Super Stock'!$B76 -> Doug Rood | L72: ='\\ser\Software\other\[POINTS NQS  2012.XLS]Super Stock'!$C76 -> Ypsilanti, Mi | M72: =IF('\\ser\Software\other\[POINTS NQS  2012.XLS]Super Stock'!$D76=0," ",'\\ser\Software\other\[POINTS NQS  2012.XLS]Super Stock'!$D76) -> NP | N72: ='\\ser\Software\other\[POINTS NQS  2012.XLS]Super Stock'!$E76 -> 354 | O72: =IF('\\ser\Software\other\[POINTS NQS  2012.XLS]Super Stock'!$F76=0," ",'\\ser\Software\other\[POINTS NQS  2012.XLS]Super Stock'!$F76) -> Blue Dawg | P72: ='\\ser\Software\other\[POINTS NQS  2012.XLS]Super Stock'!$AA76 -> 224
A73: ='\\ser\Software\other\[POINTS NQS  2012.XLS]Pro Stock'!$A77 -> 71 | B73: ='\\ser\Software\other\[POINTS NQS  2012.XLS]Pro Stock'!$B77 -> Justin Tuttle | C73: ='\\ser\Software\other\[POINTS NQS  2012.XLS]Pro Stock'!$C77 -> Greenview, Ill | D73: =IF('\\ser\Software\other\[POINTS NQS  2012.XLS]Pro Stock'!$D77=0," ",'\\ser\Software\other\[POINTS NQS  2012.XLS]Pro Stock'!$D77) ->  | E73: ='\\ser\Software\other\[POINTS NQS  2012.XLS]Pro Stock'!$E77 -> 574 | F73: =IF('\\ser\Software\other\[POINTS NQS  2012.XLS]Pro Stock'!$F77=0," ",'\\ser\Software\other\[POINTS NQS  2012.XLS]Pro Stock'!$F77) -> Dirt Devil | G73: ='\\ser\Software\other\[POINTS NQS  2012.XLS]Pro Stock'!$AA77 -> 228 | J73: ='\\ser\Software\other\[POINTS NQS  2012.XLS]Super Stock'!$A77 -> 71 | K73: ='\\ser\Software\other\[POINTS NQS  2012.XLS]Super Stock'!$B77 -> Dan Schell | L73: ='\\ser\Software\other\[POINTS NQS  2012.XLS]Super Stock'!$C77 -> Darien, WI | M73: =IF('\\ser\Software\other\[POINTS NQS  2012.XLS]Super Stock'!$D77=0," ",'\\ser\Software\other\[POINTS NQS  2012.XLS]Super Stock'!$D77) -> MVP | N73: ='\\ser\Software\other\[POINTS NQS  2012.XLS]Super Stock'!$E77 -> 375 | O73: =IF('\\ser\Software\other\[POINTS NQS  2012.XLS]Super Stock'!$F77=0," ",'\\ser\Software\other\[POINTS NQS  2012.XLS]Super Stock'!$F77) -> Blind Ambition | P73: ='\\ser\Software\other\[POINTS NQS  2012.XLS]Super Stock'!$AA77 -> 224
A74: ='\\ser\Software\other\[POINTS NQS  2012.XLS]Pro Stock'!$A78 -> 72 | B74: ='\\ser\Software\other\[POINTS NQS  2012.XLS]Pro Stock'!$B78 -> Gerald Kerber | C74: ='\\ser\Software\other\[POINTS NQS  2012.XLS]Pro Stock'!$C78 -> Greenfield, Ind | D74: =IF('\\ser\Software\other\[POINTS NQS  2012.XLS]Pro Stock'!$D78=0," ",'\\ser\Software\other\[POINTS NQS  2012.XLS]Pro Stock'!$D78) -> NP | E74: ='\\ser\Software\other\[POINTS NQS  2012.XLS]Pro Stock'!$E78 -> 175 | F74: =IF('\\ser\Software\other\[POINTS NQS  2012.XLS]Pro Stock'!$F78=0," ",'\\ser\Software\other\[POINTS NQS  2012.XLS]Pro Stock'!$F78) -> Wis Hooker | G74: ='\\ser\Software\other\[POINTS NQS  2012.XLS]Pro Stock'!$AA78 -> 229 | J74: ='\\ser\Software\other\[POINTS NQS  2012.XLS]Super Stock'!$A78 -> 72 | K74: ='\\ser\Software\other\[POINTS NQS  2012.XLS]Super Stock'!$B78 -> Ray Gentz | L74: ='\\ser\Software\other\[POINTS NQS  2012.XLS]Super Stock'!$C78 -> Colon, MI | M74: =IF('\\ser\Software\other\[POINTS NQS  2012.XLS]Super Stock'!$D78=0," ",'\\ser\Software\other\[POINTS NQS  2012.XLS]Super Stock'!$D78) -> JRS | N74: ='\\ser\Software\other\[POINTS NQS  2012.XLS]Super Stock'!$E78 -> 262 | O74: =IF('\\ser\Software\other\[POINTS NQS  2012.XLS]Super Stock'!$F78=0," ",'\\ser\Software\other\[POINTS NQS  2012.XLS]Super Stock'!$F78) -> Chaos | P74: ='\\ser\Software\other\[POINTS NQS  2012.XLS]Super Stock'!$AA78 -> 229
A75: ='\\ser\Software\other\[POINTS NQS  2012.XLS]Pro Stock'!$A79 -> 73 | B75: ='\\ser\Software\other\[POINTS NQS  2012.XLS]Pro Stock'!$B79 -> Steve Williford | C75: ='\\ser\Software\other\[POINTS NQS  2012.XLS]Pro Stock'!$C79 -> Englehard, NC | D75: =IF('\\ser\Software\other\[POINTS NQS  2012.XLS]Pro Stock'!$D79=0," ",'\\ser\Software\other\[POINTS NQS  2012.XLS]Pro Stock'!$D79) -> MVP | E75: ='\\ser\Software\other\[POINTS NQS  2012.XLS]Pro Stock'!$E79 -> 273 | F75: =IF('\\ser\Software\other\[POINTS NQS  2012.XLS]Pro Stock'!$F79=0," ",'\\ser\Software\other\[POINTS NQS  2012.XLS]Pro Stock'!$F79) -> IH Express | G75: ='\\ser\Software\other\[POINTS NQS  2012.XLS]Pro Stock'!$AA79 -> 229 | J75: ='\\ser\Software\other\[POINTS NQS  2012.XLS]Super Stock'!$A79 -> 73 | K75: ='\\ser\Software\other\[POINTS NQS  2012.XLS]Super Stock'!$B79 -> David Mascher Jr | L75: ='\\ser\Software\other\[POINTS NQS  2012.XLS]Super Stock'!$C79 -> Beech Grove, IN | M75: =IF('\\ser\Software\other\[POINTS NQS  2012.XLS]Super Stock'!$D79=0," ",'\\ser\Software\other\[POINTS NQS  2012.XLS]Super Stock'!$D79) -> Mascher | N75: ='\\ser\Software\other\[POINTS NQS  2012.XLS]Super Stock'!$E79 -> 163 | O75: =IF('\\ser\Software\other\[POINTS NQS  2012.XLS]Super Stock'!$F79=0," ",'\\ser\Software\other\[POINTS NQS  2012.XLS]Super Stock'!$F79) -> Thunder Pumpkin | P75: ='\\ser\Software\other\[POINTS NQS  2012.XLS]Super Stock'!$AA79 -> 230
A76: ='\\ser\Software\other\[POINTS NQS  2012.XLS]Pro Stock'!$A80 -> 74 | B76: ='\\ser\Software\other\[POINTS NQS  2012.XLS]Pro Stock'!$B80 -> Richard Lucanbaugh | C76: ='\\ser\Software\other\[POINTS NQS  2012.XLS]Pro Stock'!$C80 -> Glen Rock, Pa | D76: =IF('\\ser\Software\other\[POINTS NQS  2012.XLS]Pro Stock'!$D80=0," ",'\\ser\Software\other\[POINTS NQS  2012.XLS]Pro Stock'!$D80) -> NP | E76: ='\\ser\Software\other\[POINTS NQS  2012.XLS]Pro Stock'!$E80 -> 494 | F76: =IF('\\ser\Software\other\[POINTS NQS  2012.XLS]Pro Stock'!$F80=0," ",'\\ser\Software\other\[POINTS NQS  2012.XLS]Pro Stock'!$F80) -> Cub | G76: ='\\ser\Software\other\[POINTS NQS  2012.XLS]Pro Stock'!$AA80 -> 229 | J76: ='\\ser\Software\other\[POINTS NQS  2012.XLS]Super Stock'!$A80 -> 74 | K76: ='\\ser\Software\other\[POINTS NQS  2012.XLS]Super Stock'!$B80 -> Julian Stahl | L76: ='\\ser\Software\other\[POINTS NQS  2012.XLS]Super Stock'!$C80 -> Welton, IA | M76: =IF('\\ser\Software\other\[POINTS NQS  2012.XLS]Super Stock'!$D80=0," ",'\\ser\Software\other\[POINTS NQS  2012.XLS]Super Stock'!$D80) -> MVP | N76: ='\\ser\Software\other\[POINTS NQS  2012.XLS]Super Stock'!$E80 -> 1 | O76: =IF('\\ser\Software\other\[POINTS NQS  2012.XLS]Super Stock'!$F80=0," ",'\\ser\Software\other\[POINTS NQS  2012.XLS]Super Stock'!$F80) -> MWSC # 1 | P76: ='\\ser\Software\other\[POINTS NQS  2012.XLS]Super Stock'!$AA80 -> 238
A77: ='\\ser\Software\other\[POINTS NQS  2012.XLS]Pro Stock'!$A81 -> 75 | B77: ='\\ser\Software\other\[POINTS NQS  2012.XLS]Pro Stock'!$B81 -> Matt Dirksen | C77: ='\\ser\Software\other\[POINTS NQS  2012.XLS]Pro Stock'!$C81 -> Alma, Ont CDA | D77: =IF('\\ser\Software\other\[POINTS NQS  2012.XLS]Pro Stock'!$D81=0," ",'\\ser\Software\other\[POINTS NQS  2012.XLS]Pro Stock'!$D81) -> MVP | E77: ='\\ser\Software\other\[POINTS NQS  2012.XLS]Pro Stock'!$E81 -> 551 | F77: =IF('\\ser\Software\other\[POINTS NQS  2012.XLS]Pro Stock'!$F81=0," ",'\\ser\Software\other\[POINTS NQS  2012.XLS]Pro Stock'!$F81) -> Armed & Dangerous | G77: ='\\ser\Software\other\[POINTS NQS  2012.XLS]Pro Stock'!$AA81 -> 229 | J77: ='\\ser\Software\other\[POINTS NQS  2012.XLS]Super Stock'!$A81 -> 75 | K77: ='\\ser\Software\other\[POINTS NQS  2012.XLS]Super Stock'!$B81 -> Larry Frederick | L77: ='\\ser\Software\other\[POINTS NQS  2012.XLS]Super Stock'!$C81 -> New Castle, Pa | M77: =IF('\\ser\Software\other\[POINTS NQS  2012.XLS]Super Stock'!$D81=0," ",'\\ser\Software\other\[POINTS NQS  2012.XLS]Super Stock'!$D81) -> LR | N77: ='\\ser\Software\other\[POINTS NQS  2012.XLS]Super Stock'!$E81 -> 297 | O77: =IF('\\ser\Software\other\[POINTS NQS  2012.XLS]Super Stock'!$F81=0," ",'\\ser\Software\other\[POINTS NQS  2012.XLS]Super Stock'!$F81) -> Burnin U | P77: ='\\ser\Software\other\[POINTS NQS  2012.XLS]Super Stock'!$AA81 -> 238
A78: ='\\ser\Software\other\[POINTS NQS  2012.XLS]Pro Stock'!$A82 -> 76 | B78: ='\\ser\Software\other\[POINTS NQS  2012.XLS]Pro Stock'!$B82 -> Ryan Forrett | C78: ='\\ser\Software\other\[POINTS NQS  2012.XLS]Pro Stock'!$C82 -> Preston, IA | D78: =IF('\\ser\Software\other\[POINTS NQS  2012.XLS]Pro Stock'!$D82=0," ",'\\ser\Software\other\[POINTS NQS  2012.XLS]Pro Stock'!$D82) -> MVP | E78: ='\\ser\Software\other\[POINTS NQS  2012.XLS]Pro Stock'!$E82 -> 572 | F78: =IF('\\ser\Software\other\[POINTS NQS  2012.XLS]Pro Stock'!$F82=0," ",'\\ser\Software\other\[POINTS NQS  2012.XLS]Pro Stock'!$F82) -> D-21 | G78: ='\\ser\Software\other\[POINTS NQS  2012.XLS]Pro Stock'!$AA82 -> 229 | J78: ='\\ser\Software\other\[POINTS NQS  2012.XLS]Super Stock'!$A82 -> 76 | K78: ='\\ser\Software\other\[POINTS NQS  2012.XLS]Super Stock'!$B82 -> Rick Slade | L78: ='\\ser\Software\other\[POINTS NQS  2012.XLS]Super Stock'!$C82 -> Harveyville, KY | M78: =IF('\\ser\Software\other\[POINTS NQS  2012.XLS]Super Stock'!$D82=0," ",'\\ser\Software\other\[POINTS NQS  2012.XLS]Super Stock'!$D82) -> JRS | N78: ='\\ser\Software\other\[POINTS NQS  2012.XLS]Super Stock'!$E82 -> 467 | O78: =IF('\\ser\Software\other\[POINTS NQS  2012.XLS]Super Stock'!$F82=0," ",'\\ser\Software\other\[POINTS NQS  2012.XLS]Super Stock'!$F82) -> Ricochet | P78: ='\\ser\Software\other\[POINTS NQS  2012.XLS]Super Stock'!$AA82 -> 238
A79: ='\\ser\Software\other\[POINTS NQS  2012.XLS]Pro Stock'!$A83 -> 77 | B79: ='\\ser\Software\other\[POINTS NQS  2012.XLS]Pro Stock'!$B83 -> Julian Stahl | C79: ='\\ser\Software\other\[POINTS NQS  2012.XLS]Pro Stock'!$C83 -> Welton, IA | D79: =IF('\\ser\Software\other\[POINTS NQS  2012.XLS]Pro Stock'!$D83=0," ",'\\ser\Software\other\[POINTS NQS  2012.XLS]Pro Stock'!$D83) -> MVP | E79: ='\\ser\Software\other\[POINTS NQS  2012.XLS]Pro Stock'!$E83 -> 2 | F79: =IF('\\ser\Software\other\[POINTS NQS  2012.XLS]Pro Stock'!$F83=0," ",'\\ser\Software\other\[POINTS NQS  2012.XLS]Pro Stock'!$F83) -> MWSC #2 | G79: ='\\ser\Software\other\[POINTS NQS  2012.XLS]Pro Stock'!$AA83 -> 230 | J79: ='\\ser\Software\other\[POINTS NQS  2012.XLS]Super Stock'!$A83 -> 77 | K79: ='\\ser\Software\other\[POINTS NQS  2012.XLS]Super Stock'!$B83 -> Kevin Battefleld | L79: ='\\ser\Software\other\[POINTS NQS  2012.XLS]Super Stock'!$C83 -> Lewistown, IL | M79: =IF('\\ser\Software\other\[POINTS NQS  2012.XLS]Super Stock'!$D83=0," ",'\\ser\Software\other\[POINTS NQS  2012.XLS]Super Stock'!$D83) -> Mike Bat. | N79: ='\\ser\Software\other\[POINTS NQS  2012.XLS]Super Stock'!$E83 -> 581 | O79: =IF('\\ser\Software\other\[POINTS NQS  2012.XLS]Super Stock'!$F83=0," ",'\\ser\Software\other\[POINTS NQS  2012.XLS]Super Stock'!$F83) -> Fuelish Pleasure | P79: ='\\ser\Software\other\[POINTS NQS  2012.XLS]Super Stock'!$AA83 -> 238
A80: ='\\ser\Software\other\[POINTS NQS  2012.XLS]Pro Stock'!$A84 -> 78 | B80: ='\\ser\Software\other\[POINTS NQS  2012.XLS]Pro Stock'!$B84 -> Vicki Scroggins | C80: ='\\ser\Software\other\[POINTS NQS  2012.XLS]Pro Stock'!$C84 -> Neosho, Mo | D80: =IF('\\ser\Software\other\[POINTS NQS  2012.XLS]Pro Stock'!$D84=0," ",'\\ser\Software\other\[POINTS NQS  2012.XLS]Pro Stock'!$D84) -> VM | E80: ='\\ser\Software\other\[POINTS NQS  2012.XLS]Pro Stock'!$E84 -> 112 | F80: =IF('\\ser\Software\other\[POINTS NQS  2012.XLS]Pro Stock'!$F84=0," ",'\\ser\Software\other\[POINTS NQS  2012.XLS]Pro Stock'!$F84) -> Lil' American | G80: ='\\ser\Software\other\[POINTS NQS  2012.XLS]Pro Stock'!$AA84 -> 230 | J80: ='\\ser\Software\other\[POINTS NQS  2012.XLS]Super Stock'!$A84 -> 78 | K80: ='\\ser\Software\other\[POINTS NQS  2012.XLS]Super Stock'!$B84 -> Jake Gingerich | L80: ='\\ser\Software\other\[POINTS NQS  2012.XLS]Super Stock'!$C84 -> Montgomery, Ind | M80: =IF('\\ser\Software\other\[POINTS NQS  2012.XLS]Super Stock'!$D84=0," ",'\\ser\Software\other\[POINTS NQS  2012.XLS]Super Stock'!$D84) -> JW | N80: ='\\ser\Software\other\[POINTS NQS  2012.XLS]Super Stock'!$E84 -> 17 | O80: =IF('\\ser\Software\other\[POINTS NQS  2012.XLS]Super Stock'!$F84=0," ",'\\ser\Software\other\[POINTS NQS  2012.XLS]Super Stock'!$F84) -> Silver Rocket | P80: ='\\ser\Software\other\[POINTS NQS  2012.XLS]Super Stock'!$AA84 -> 239
A81: ='\\ser\Software\other\[POINTS NQS  2012.XLS]Pro Stock'!$A85 -> 79 | B81: ='\\ser\Software\other\[POINTS NQS  2012.XLS]Pro Stock'!$B85 -> Larry Frederick | C81: ='\\ser\Software\other\[POINTS NQS  2012.XLS]Pro Stock'!$C85 -> New Castle, Pa | D81: =IF('\\ser\Software\other\[POINTS NQS  2012.XLS]Pro Stock'!$D85=0," ",'\\ser\Software\other\[POINTS NQS  2012.XLS]Pro Stock'!$D85) -> LR | E81: ='\\ser\Software\other\[POINTS NQS  2012.XLS]Pro Stock'!$E85 -> 297 | F81: =IF('\\ser\Software\other\[POINTS NQS  2012.XLS]Pro Stock'!$F85=0," ",'\\ser\Software\other\[POINTS NQS  2012.XLS]Pro Stock'!$F85) -> Burning U | G81: ='\\ser\Software\other\[POINTS NQS  2012.XLS]Pro Stock'!$AA85 -> 230 | J81: ='\\ser\Software\other\[POINTS NQS  2012.XLS]Super Stock'!$A85 -> 79 | K81: ='\\ser\Software\other\[POINTS NQS  2012.XLS]Super Stock'!$B85 -> Tyler Hackman | L81: ='\\ser\Software\other\[POINTS NQS  2012.XLS]Super Stock'!$C85 -> Seymour, IN | M81: =IF('\\ser\Software\other\[POINTS NQS  2012.XLS]Super Stock'!$D85=0," ",'\\ser\Software\other\[POINTS NQS  2012.XLS]Super Stock'!$D85) -> Hackman | N81: ='\\ser\Software\other\[POINTS NQS  2012.XLS]Super Stock'!$E85 -> 342 | O81: =IF('\\ser\Software\other\[POINTS NQS  2012.XLS]Super Stock'!$F85=0," ",'\\ser\Software\other\[POINTS NQS  2012.XLS]Super Stock'!$F85) -> Green | P81: ='\\ser\Software\other\[POINTS NQS  2012.XLS]Super Stock'!$AA85 -> 239
A82: ='\\ser\Software\other\[POINTS NQS  2012.XLS]Pro Stock'!$A86 -> 80 | B82: ='\\ser\Software\other\[POINTS NQS  2012.XLS]Pro Stock'!$B86 -> Nick Ferguson | C82: ='\\ser\Software\other\[POINTS NQS  2012.XLS]Pro Stock'!$C86 -> Elkhorn, Wi | D82: =IF('\\ser\Software\other\[POINTS NQS  2012.XLS]Pro Stock'!$D86=0," ",'\\ser\Software\other\[POINTS NQS  2012.XLS]Pro Stock'!$D86) ->  | E82: ='\\ser\Software\other\[POINTS NQS  2012.XLS]Pro Stock'!$E86 -> 343 | F82: =IF('\\ser\Software\other\[POINTS NQS  2012.XLS]Pro Stock'!$F86=0," ",'\\ser\Software\other\[POINTS NQS  2012.XLS]Pro Stock'!$F86) -> Border Patrol | G82: ='\\ser\Software\other\[POINTS NQS  2012.XLS]Pro Stock'!$AA86 -> 230 | J82: ='\\ser\Software\other\[POINTS NQS  2012.XLS]Super Stock'!$A86 -> 80 | K82: ='\\ser\Software\other\[POINTS NQS  2012.XLS]Super Stock'!$B86 -> Mark Conover | L82: ='\\ser\Software\other\[POINTS NQS  2012.XLS]Super Stock'!$C86 -> Edinburgh, IN | M82: =IF('\\ser\Software\other\[POINTS NQS  2012.XLS]Super Stock'!$D86=0," ",'\\ser\Software\other\[POINTS NQS  2012.XLS]Super Stock'!$D86) -> VM | N82: ='\\ser\Software\other\[POINTS NQS  2012.XLS]Super Stock'!$E86 -> 360 | O82: =IF('\\ser\Software\other\[POINTS NQS  2012.XLS]Super Stock'!$F86=0," ",'\\ser\Software\other\[POINTS NQS  2012.XLS]Super Stock'!$F86) -> VuDoo Too | P82: ='\\ser\Software\other\[POINTS NQS  2012.XLS]Super Stock'!$AA86 -> 239
A83: ='\\ser\Software\other\[POINTS NQS  2012.XLS]Pro Stock'!$A87 -> 81 | B83: ='\\ser\Software\other\[POINTS NQS  2012.XLS]Pro Stock'!$B87 -> Doug Diehl | C83: ='\\ser\Software\other\[POINTS NQS  2012.XLS]Pro Stock'!$C87 -> Smithsburg, Md | D83: =IF('\\ser\Software\other\[POINTS NQS  2012.XLS]Pro Stock'!$D87=0," ",'\\ser\Software\other\[POINTS NQS  2012.XLS]Pro Stock'!$D87) -> NP | E83: ='\\ser\Software\other\[POINTS NQS  2012.XLS]Pro Stock'!$E87 -> 385 | F83: =IF('\\ser\Software\other\[POINTS NQS  2012.XLS]Pro Stock'!$F87=0," ",'\\ser\Software\other\[POINTS NQS  2012.XLS]Pro Stock'!$F87) -> Eliminator | G83: ='\\ser\Software\other\[POINTS NQS  2012.XLS]Pro Stock'!$AA87 -> 230 | J83: ='\\ser\Software\other\[POINTS NQS  2012.XLS]Super Stock'!$A87 -> 81 | K83: ='\\ser\Software\other\[POINTS NQS  2012.XLS]Super Stock'!$B87 -> Vicki Scroggins | L83: ='\\ser\Software\other\[POINTS NQS  2012.XLS]Super Stock'!$C87 -> Neosho, MO | M83: =IF('\\ser\Software\other\[POINTS NQS  2012.XLS]Super Stock'!$D87=0," ",'\\ser\Software\other\[POINTS NQS  2012.XLS]Super Stock'!$D87) -> VM | N83: ='\\ser\Software\other\[POINTS NQS  2012.XLS]Super Stock'!$E87 -> 112 | O83: =IF('\\ser\Software\other\[POINTS NQS  2012.XLS]Super Stock'!$F87=0," ",'\\ser\Software\other\[POINTS NQS  2012.XLS]Super Stock'!$F87) -> Lil" American | P83: ='\\ser\Software\other\[POINTS NQS  2012.XLS]Super Stock'!$AA87 -> 240
A84: ='\\ser\Software\other\[POINTS NQS  2012.XLS]Pro Stock'!$A88 -> 82 | B84: ='\\ser\Software\other\[POINTS NQS  2012.XLS]Pro Stock'!$B88 -> Doug Diehl | C84: ='\\ser\Software\other\[POINTS NQS  2012.XLS]Pro Stock'!$C88 -> Smithsburg, Md | D84: =IF('\\ser\Software\other\[POINTS NQS  2012.XLS]Pro Stock'!$D88=0," ",'\\ser\Software\other\[POINTS NQS  2012.XLS]Pro Stock'!$D88) -> NP | E84: ='\\ser\Software\other\[POINTS NQS  2012.XLS]Pro Stock'!$E88 -> 441 | F84: =IF('\\ser\Software\other\[POINTS NQS  2012.XLS]Pro Stock'!$F88=0," ",'\\ser\Software\other\[POINTS NQS  2012.XLS]Pro Stock'!$F88) -> Excedrin | G84: ='\\ser\Software\other\[POINTS NQS  2012.XLS]Pro Stock'!$AA88 -> 230 | J84: ='\\ser\Software\other\[POINTS NQS  2012.XLS]Super Stock'!$A88 -> 82 | K84: ='\\ser\Software\other\[POINTS NQS  2012.XLS]Super Stock'!$B88 -> Doug Diehl | L84: ='\\ser\Software\other\[POINTS NQS  2012.XLS]Super Stock'!$C88 -> Smithsburg, PA | M84: =IF('\\ser\Software\other\[POINTS NQS  2012.XLS]Super Stock'!$D88=0," ",'\\ser\Software\other\[POINTS NQS  2012.XLS]Super Stock'!$D88) -> NP | N84: ='\\ser\Software\other\[POINTS NQS  2012.XLS]Super Stock'!$E88 -> 385 | O84: =IF('\\ser\Software\other\[POINTS NQS  2012.XLS]Super Stock'!$F88=0," ",'\\ser\Software\other\[POINTS NQS  2012.XLS]Super Stock'!$F88) -> Eliminator | P84: ='\\ser\Software\other\[POINTS NQS  2012.XLS]Super Stock'!$AA88 -> 240
A85: ='\\ser\Software\other\[POINTS NQS  2012.XLS]Pro Stock'!$A89 -> 83 | B85: ='\\ser\Software\other\[POINTS NQS  2012.XLS]Pro Stock'!$B89 -> Mark Davis | C85: ='\\ser\Software\other\[POINTS NQS  2012.XLS]Pro Stock'!$C89 -> Lower Salem, Oh | D85: =IF('\\ser\Software\other\[POINTS NQS  2012.XLS]Pro Stock'!$D89=0," ",'\\ser\Software\other\[POINTS NQS  2012.XLS]Pro Stock'!$D89) -> JS | E85: ='\\ser\Software\other\[POINTS NQS  2012.XLS]Pro Stock'!$E89 -> 67 | F85: =IF('\\ser\Software\other\[POINTS NQS  2012.XLS]Pro Stock'!$F89=0," ",'\\ser\Software\other\[POINTS NQS  2012.XLS]Pro Stock'!$F89) -> No Limits | G85: ='\\ser\Software\other\[POINTS NQS  2012.XLS]Pro Stock'!$AA89 -> 231 | J85: ='\\ser\Software\other\[POINTS NQS  2012.XLS]Super Stock'!$A89 -> 83 | K85: ='\\ser\Software\other\[POINTS NQS  2012.XLS]Super Stock'!$B89 -> Joe Young | L85: ='\\ser\Software\other\[POINTS NQS  2012.XLS]Super Stock'!$C89 -> Kimball, MI | M85: =IF('\\ser\Software\other\[POINTS NQS  2012.XLS]Super Stock'!$D89=0," ",'\\ser\Software\other\[POINTS NQS  2012.XLS]Super Stock'!$D89) -> NP | N85: ='\\ser\Software\other\[POINTS NQS  2012.XLS]Super Stock'!$E89 -> 479 | O85: =IF('\\ser\Software\other\[POINTS NQS  2012.XLS]Super Stock'!$F89=0," ",'\\ser\Software\other\[POINTS NQS  2012.XLS]Super Stock'!$F89) -> Mental Health | P85: ='\\ser\Software\other\[POINTS NQS  2012.XLS]Super Stock'!$AA89 -> 240
A86: ='\\ser\Software\other\[POINTS NQS  2012.XLS]Pro Stock'!$A90 -> 84 | B86: ='\\ser\Software\other\[POINTS NQS  2012.XLS]Pro Stock'!$B90 -> Tooter Campbell | C86: ='\\ser\Software\other\[POINTS NQS  2012.XLS]Pro Stock'!$C90 -> Owensboro, Ky | D86: =IF('\\ser\Software\other\[POINTS NQS  2012.XLS]Pro Stock'!$D90=0," ",'\\ser\Software\other\[POINTS NQS  2012.XLS]Pro Stock'!$D90) -> TC | E86: ='\\ser\Software\other\[POINTS NQS  2012.XLS]Pro Stock'!$E90 -> 473 | F86: =IF('\\ser\Software\other\[POINTS NQS  2012.XLS]Pro Stock'!$F90=0," ",'\\ser\Software\other\[POINTS NQS  2012.XLS]Pro Stock'!$F90) -> Tractor Trash | G86: ='\\ser\Software\other\[POINTS NQS  2012.XLS]Pro Stock'!$AA90 -> 231 | J86: ='\\ser\Software\other\[POINTS NQS  2012.XLS]Super Stock'!$A90 -> 84 | K86: ='\\ser\Software\other\[POINTS NQS  2012.XLS]Super Stock'!$B90 -> Mike Sours | L86: ='\\ser\Software\other\[POINTS NQS  2012.XLS]Super Stock'!$C90 -> Jeromesville, Oh | M86: =IF('\\ser\Software\other\[POINTS NQS  2012.XLS]Super Stock'!$D90=0," ",'\\ser\Software\other\[POINTS NQS  2012.XLS]Super Stock'!$D90) -> TH | N86: ='\\ser\Software\other\[POINTS NQS  2012.XLS]Super Stock'!$E90 -> 543 | O86: =IF('\\ser\Software\other\[POINTS NQS  2012.XLS]Super Stock'!$F90=0," ",'\\ser\Software\other\[POINTS NQS  2012.XLS]Super Stock'!$F90) -> Another Addiction | P86: ='\\ser\Software\other\[POINTS NQS  2012.XLS]Super Stock'!$AA90 -> 240
A87: ='\\ser\Software\other\[POINTS NQS  2012.XLS]Pro Stock'!$A91 -> 85 | B87: ='\\ser\Software\other\[POINTS NQS  2012.XLS]Pro Stock'!$B91 -> Michael Sour | C87: ='\\ser\Software\other\[POINTS NQS  2012.XLS]Pro Stock'!$C91 -> Jeromesville, Oh | D87: =IF('\\ser\Software\other\[POINTS NQS  2012.XLS]Pro Stock'!$D91=0," ",'\\ser\Software\other\[POINTS NQS  2012.XLS]Pro Stock'!$D91) -> TH | E87: ='\\ser\Software\other\[POINTS NQS  2012.XLS]Pro Stock'!$E91 -> 543 | F87: =IF('\\ser\Software\other\[POINTS NQS  2012.XLS]Pro Stock'!$F91=0," ",'\\ser\Software\other\[POINTS NQS  2012.XLS]Pro Stock'!$F91) -> Another Addiction | G87: ='\\ser\Software\other\[POINTS NQS  2012.XLS]Pro Stock'!$AA91 -> 231 | J87: ='\\ser\Software\other\[POINTS NQS  2012.XLS]Super Stock'!$A91 -> 85 | K87: ='\\ser\Software\other\[POINTS NQS  2012.XLS]Super Stock'!$B91 -> Matt Dirksen | L87: ='\\ser\Software\other\[POINTS NQS  2012.XLS]Super Stock'!$C91 -> Alma, Ont CDA | M87: =IF('\\ser\Software\other\[POINTS NQS  2012.XLS]Super Stock'!$D91=0," ",'\\ser\Software\other\[POINTS NQS  2012.XLS]Super Stock'!$D91) -> MWSC | N87: ='\\ser\Software\other\[POINTS NQS  2012.XLS]Super Stock'!$E91 -> 551 | O87: =IF('\\ser\Software\other\[POINTS NQS  2012.XLS]Super Stock'!$F91=0," ",'\\ser\Software\other\[POINTS NQS  2012.XLS]Super Stock'!$F91) -> Armed & Dangerous | P87: ='\\ser\Software\other\[POINTS NQS  2012.XLS]Super Stock'!$AA91 -> 240
A88: ='\\ser\Software\other\[POINTS NQS  2012.XLS]Pro Stock'!$A92 -> 86 | B88: ='\\ser\Software\other\[POINTS NQS  2012.XLS]Pro Stock'!$B92 -> Brian Jones | C88: ='\\ser\Software\other\[POINTS NQS  2012.XLS]Pro Stock'!$C92 -> Sheridan, Ind | D88: =IF('\\ser\Software\other\[POINTS NQS  2012.XLS]Pro Stock'!$D92=0," ",'\\ser\Software\other\[POINTS NQS  2012.XLS]Pro Stock'!$D92) ->  | E88: ='\\ser\Software\other\[POINTS NQS  2012.XLS]Pro Stock'!$E92 -> 563 | F88: =IF('\\ser\Software\other\[POINTS NQS  2012.XLS]Pro Stock'!$F92=0," ",'\\ser\Software\other\[POINTS NQS  2012.XLS]Pro Stock'!$F92) -> Foolish Times | G88: ='\\ser\Software\other\[POINTS NQS  2012.XLS]Pro Stock'!$AA92 -> 231 | J88: ='\\ser\Software\other\[POINTS NQS  2012.XLS]Super Stock'!$A92 -> 86 | K88: ='\\ser\Software\other\[POINTS NQS  2012.XLS]Super Stock'!$B92 -> Kurt Dosland | L88: ='\\ser\Software\other\[POINTS NQS  2012.XLS]Super Stock'!$C92 -> Monmouth, IA | M88: =IF('\\ser\Software\other\[POINTS NQS  2012.XLS]Super Stock'!$D92=0," ",'\\ser\Software\other\[POINTS NQS  2012.XLS]Super Stock'!$D92) -> MVP | N88: ='\\ser\Software\other\[POINTS NQS  2012.XLS]Super Stock'!$E92 -> 570 | O88: =IF('\\ser\Software\other\[POINTS NQS  2012.XLS]Super Stock'!$F92=0," ",'\\ser\Software\other\[POINTS NQS  2012.XLS]Super Stock'!$F92) -> Thunderstruck | P88: ='\\ser\Software\other\[POINTS NQS  2012.XLS]Super Stock'!$AA92 -> 240
A89: ='\\ser\Software\other\[POINTS NQS  2012.XLS]Pro Stock'!$A93 -> 87 | B89: ='\\ser\Software\other\[POINTS NQS  2012.XLS]Pro Stock'!$B93 -> Gary McDonald | C89: ='\\ser\Software\other\[POINTS NQS  2012.XLS]Pro Stock'!$C93 -> Hope, Ind | D89: =IF('\\ser\Software\other\[POINTS NQS  2012.XLS]Pro Stock'!$D93=0," ",'\\ser\Software\other\[POINTS NQS  2012.XLS]Pro Stock'!$D93) ->  | E89: ='\\ser\Software\other\[POINTS NQS  2012.XLS]Pro Stock'!$E93 -> 93 | F89: =IF('\\ser\Software\other\[POINTS NQS  2012.XLS]Pro Stock'!$F93=0," ",'\\ser\Software\other\[POINTS NQS  2012.XLS]Pro Stock'!$F93) ->  | G89: ='\\ser\Software\other\[POINTS NQS  2012.XLS]Pro Stock'!$AA93 -> 232 | J89: ='\\ser\Software\other\[POINTS NQS  2012.XLS]Super Stock'!$A93 -> 87 | K89: ='\\ser\Software\other\[POINTS NQS  2012.XLS]Super Stock'!$B93 -> Wade Hopping | L89: ='\\ser\Software\other\[POINTS NQS  2012.XLS]Super Stock'!$C93 -> Ipava, IL | M89: =IF('\\ser\Software\other\[POINTS NQS  2012.XLS]Super Stock'!$D93=0," ",'\\ser\Software\other\[POINTS NQS  2012.XLS]Super Stock'!$D93) ->  | N89: ='\\ser\Software\other\[POINTS NQS  2012.XLS]Super Stock'!$E93 -> 575 | O89: =IF('\\ser\Software\other\[POINTS NQS  2012.XLS]Super Stock'!$F93=0," ",'\\ser\Software\other\[POINTS NQS  2012.XLS]Super Stock'!$F93) -> Xtreme | P89: ='\\ser\Software\other\[POINTS NQS  2012.XLS]Super Stock'!$AA93 -> 240
A90: ='\\ser\Software\other\[POINTS NQS  2012.XLS]Pro Stock'!$A94 -> 88 | B90: ='\\ser\Software\other\[POINTS NQS  2012.XLS]Pro Stock'!$B94 -> Mike Kyle | C90: ='\\ser\Software\other\[POINTS NQS  2012.XLS]Pro Stock'!$C94 -> Edinburg, Ind | D90: =IF('\\ser\Software\other\[POINTS NQS  2012.XLS]Pro Stock'!$D94=0," ",'\\ser\Software\other\[POINTS NQS  2012.XLS]Pro Stock'!$D94) -> VM | E90: ='\\ser\Software\other\[POINTS NQS  2012.XLS]Pro Stock'!$E94 -> 394 | F90: =IF('\\ser\Software\other\[POINTS NQS  2012.XLS]Pro Stock'!$F94=0," ",'\\ser\Software\other\[POINTS NQS  2012.XLS]Pro Stock'!$F94) ->  | G90: ='\\ser\Software\other\[POINTS NQS  2012.XLS]Pro Stock'!$AA94 -> 232 | J90: ='\\ser\Software\other\[POINTS NQS  2012.XLS]Super Stock'!$A94 -> 88 | K90: ='\\ser\Software\other\[POINTS NQS  2012.XLS]Super Stock'!$B94 -> Julian Stahl | L90: ='\\ser\Software\other\[POINTS NQS  2012.XLS]Super Stock'!$C94 -> Welton, IA | M90: =IF('\\ser\Software\other\[POINTS NQS  2012.XLS]Super Stock'!$D94=0," ",'\\ser\Software\other\[POINTS NQS  2012.XLS]Super Stock'!$D94) -> MVP | N90: ='\\ser\Software\other\[POINTS NQS  2012.XLS]Super Stock'!$E94 -> 2 | O90: =IF('\\ser\Software\other\[POINTS NQS  2012.XLS]Super Stock'!$F94=0," ",'\\ser\Software\other\[POINTS NQS  2012.XLS]Super Stock'!$F94) -> MWSC # 2 | P90: ='\\ser\Software\other\[POINTS NQS  2012.XLS]Super Stock'!$AA94 -> 241
A91: ='\\ser\Software\other\[POINTS NQS  2012.XLS]Pro Stock'!$A95 -> 89 | B91: ='\\ser\Software\other\[POINTS NQS  2012.XLS]Pro Stock'!$B95 -> Dean Dubach | C91: ='\\ser\Software\other\[POINTS NQS  2012.XLS]Pro Stock'!$C95 -> Decatur, Ind | D91: =IF('\\ser\Software\other\[POINTS NQS  2012.XLS]Pro Stock'!$D95=0," ",'\\ser\Software\other\[POINTS NQS  2012.XLS]Pro Stock'!$D95) -> LR | E91: ='\\ser\Software\other\[POINTS NQS  2012.XLS]Pro Stock'!$E95 -> 532 | F91: =IF('\\ser\Software\other\[POINTS NQS  2012.XLS]Pro Stock'!$F95=0," ",'\\ser\Software\other\[POINTS NQS  2012.XLS]Pro Stock'!$F95) -> Red Cub | G91: ='\\ser\Software\other\[POINTS NQS  2012.XLS]Pro Stock'!$AA95 -> 232 | J91: ='\\ser\Software\other\[POINTS NQS  2012.XLS]Super Stock'!$A95 -> 89 | K91: ='\\ser\Software\other\[POINTS NQS  2012.XLS]Super Stock'!$B95 -> Larry Hunter | L91: ='\\ser\Software\other\[POINTS NQS  2012.XLS]Super Stock'!$C95 -> Blue Licks, Ky | M91: =IF('\\ser\Software\other\[POINTS NQS  2012.XLS]Super Stock'!$D95=0," ",'\\ser\Software\other\[POINTS NQS  2012.XLS]Super Stock'!$D95) -> NP | N91: ='\\ser\Software\other\[POINTS NQS  2012.XLS]Super Stock'!$E95 -> 220 | O91: =IF('\\ser\Software\other\[POINTS NQS  2012.XLS]Super Stock'!$F95=0," ",'\\ser\Software\other\[POINTS NQS  2012.XLS]Super Stock'!$F95) -> Bluelicker | P91: ='\\ser\Software\other\[POINTS NQS  2012.XLS]Super Stock'!$AA95 -> 241
A92: ='\\ser\Software\other\[POINTS NQS  2012.XLS]Pro Stock'!$A96 -> 90 | B92: ='\\ser\Software\other\[POINTS NQS  2012.XLS]Pro Stock'!$B96 -> Corey Gerber | C92: ='\\ser\Software\other\[POINTS NQS  2012.XLS]Pro Stock'!$C96 -> Apple Creek, Oh | D92: =IF('\\ser\Software\other\[POINTS NQS  2012.XLS]Pro Stock'!$D96=0," ",'\\ser\Software\other\[POINTS NQS  2012.XLS]Pro Stock'!$D96) ->  | E92: ='\\ser\Software\other\[POINTS NQS  2012.XLS]Pro Stock'!$E96 -> 538 | F92: =IF('\\ser\Software\other\[POINTS NQS  2012.XLS]Pro Stock'!$F96=0," ",'\\ser\Software\other\[POINTS NQS  2012.XLS]Pro Stock'!$F96) -> Red Rascal | G92: ='\\ser\Software\other\[POINTS NQS  2012.XLS]Pro Stock'!$AA96 -> 232 | J92: ='\\ser\Software\other\[POINTS NQS  2012.XLS]Super Stock'!$A96 -> 90 | K92: ='\\ser\Software\other\[POINTS NQS  2012.XLS]Super Stock'!$B96 -> Mike Kyle | L92: ='\\ser\Software\other\[POINTS NQS  2012.XLS]Super Stock'!$C96 -> Edinburgh, IN | M92: =IF('\\ser\Software\other\[POINTS NQS  2012.XLS]Super Stock'!$D96=0," ",'\\ser\Software\other\[POINTS NQS  2012.XLS]Super Stock'!$D96) -> VM | N92: ='\\ser\Software\other\[POINTS NQS  2012.XLS]Super Stock'!$E96 -> 394 | O92: =IF('\\ser\Software\other\[POINTS NQS  2012.XLS]Super Stock'!$F96=0," ",'\\ser\Software\other\[POINTS NQS  2012.XLS]Super Stock'!$F96) ->  | P92: ='\\ser\Software\other\[POINTS NQS  2012.XLS]Super Stock'!$AA96 -> 241
A93: ='\\ser\Software\other\[POINTS NQS  2012.XLS]Pro Stock'!$A97 -> 91 | B93: ='\\ser\Software\other\[POINTS NQS  2012.XLS]Pro Stock'!$B97 -> Michael Hunter | C93: ='\\ser\Software\other\[POINTS NQS  2012.XLS]Pro Stock'!$C97 -> Catawissa, Pa | D93: =IF('\\ser\Software\other\[POINTS NQS  2012.XLS]Pro Stock'!$D97=0," ",'\\ser\Software\other\[POINTS NQS  2012.XLS]Pro Stock'!$D97) ->  | E93: ='\\ser\Software\other\[POINTS NQS  2012.XLS]Pro Stock'!$E97 -> 541 | F93: =IF('\\ser\Software\other\[POINTS NQS  2012.XLS]Pro Stock'!$F97=0," ",'\\ser\Software\other\[POINTS NQS  2012.XLS]Pro Stock'!$F97) ->  | G93: ='\\ser\Software\other\[POINTS NQS  2012.XLS]Pro Stock'!$AA97 -> 232 | J93: ='\\ser\Software\other\[POINTS NQS  2012.XLS]Super Stock'!$A97 -> 91 | K93: ='\\ser\Software\other\[POINTS NQS  2012.XLS]Super Stock'!$B97 -> Steven Johnson | L93: ='\\ser\Software\other\[POINTS NQS  2012.XLS]Super Stock'!$C97 -> Shelbyville, ILL | M93: =IF('\\ser\Software\other\[POINTS NQS  2012.XLS]Super Stock'!$D97=0," ",'\\ser\Software\other\[POINTS NQS  2012.XLS]Super Stock'!$D97) -> JW | N93: ='\\ser\Software\other\[POINTS NQS  2012.XLS]Super Stock'!$E97 -> 485 | O93: =IF('\\ser\Software\other\[POINTS NQS  2012.XLS]Super Stock'!$F97=0," ",'\\ser\Software\other\[POINTS NQS  2012.XLS]Super Stock'!$F97) -> Barely Green | P93: ='\\ser\Software\other\[POINTS NQS  2012.XLS]Super Stock'!$AA97 -> 241
A94: ='\\ser\Software\other\[POINTS NQS  2012.XLS]Pro Stock'!$A98 -> 92 | B94: ='\\ser\Software\other\[POINTS NQS  2012.XLS]Pro Stock'!$B98 -> Todd Brest | C94: ='\\ser\Software\other\[POINTS NQS  2012.XLS]Pro Stock'!$C98 -> Sharpsville, Pa | D94: =IF('\\ser\Software\other\[POINTS NQS  2012.XLS]Pro Stock'!$D98=0," ",'\\ser\Software\other\[POINTS NQS  2012.XLS]Pro Stock'!$D98) ->  | E94: ='\\ser\Software\other\[POINTS NQS  2012.XLS]Pro Stock'!$E98 -> 272 | F94: =IF('\\ser\Software\other\[POINTS NQS  2012.XLS]Pro Stock'!$F98=0," ",'\\ser\Software\other\[POINTS NQS  2012.XLS]Pro Stock'!$F98) -> Cub | G94: ='\\ser\Software\other\[POINTS NQS  2012.XLS]Pro Stock'!$AA98 -> 233 | J94: ='\\ser\Software\other\[POINTS NQS  2012.XLS]Super Stock'!$A98 -> 92 | K94: ='\\ser\Software\other\[POINTS NQS  2012.XLS]Super Stock'!$B98 -> Tyler Hackman | L94: ='\\ser\Software\other\[POINTS NQS  2012.XLS]Super Stock'!$C98 -> Seymour, IN | M94: =IF('\\ser\Software\other\[POINTS NQS  2012.XLS]Super Stock'!$D98=0," ",'\\ser\Software\other\[POINTS NQS  2012.XLS]Super Stock'!$D98) -> Hackman | N94: ='\\ser\Software\other\[POINTS NQS  2012.XLS]Super Stock'!$E98 -> 508 | O94: =IF('\\ser\Software\other\[POINTS NQS  2012.XLS]Super Stock'!$F98=0," ",'\\ser\Software\other\[POINTS NQS  2012.XLS]Super Stock'!$F98) -> Iron Will | P94: ='\\ser\Software\other\[POINTS NQS  2012.XLS]Super Stock'!$AA98 -> 241
A95: ='\\ser\Software\other\[POINTS NQS  2012.XLS]Pro Stock'!$A99 -> 93 | B95: ='\\ser\Software\other\[POINTS NQS  2012.XLS]Pro Stock'!$B99 -> Dave Fagin | C95: ='\\ser\Software\other\[POINTS NQS  2012.XLS]Pro Stock'!$C99 -> Sullivan, Oh | D95: =IF('\\ser\Software\other\[POINTS NQS  2012.XLS]Pro Stock'!$D99=0," ",'\\ser\Software\other\[POINTS NQS  2012.XLS]Pro Stock'!$D99) ->  | E95: ='\\ser\Software\other\[POINTS NQS  2012.XLS]Pro Stock'!$E99 -> 555 | F95: =IF('\\ser\Software\other\[POINTS NQS  2012.XLS]Pro Stock'!$F99=0," ",'\\ser\Software\other\[POINTS NQS  2012.XLS]Pro Stock'!$F99) -> Plum Crazy | G95: ='\\ser\Software\other\[POINTS NQS  2012.XLS]Pro Stock'!$AA99 -> 233 | J95: ='\\ser\Software\other\[POINTS NQS  2012.XLS]Super Stock'!$A99 -> 93 | K95: ='\\ser\Software\other\[POINTS NQS  2012.XLS]Super Stock'!$B99 -> Dean Dubach | L95: ='\\ser\Software\other\[POINTS NQS  2012.XLS]Super Stock'!$C99 -> Decatur, Ind | M95: =IF('\\ser\Software\other\[POINTS NQS  2012.XLS]Super Stock'!$D99=0," ",'\\ser\Software\other\[POINTS NQS  2012.XLS]Super Stock'!$D99) -> LR | N95: ='\\ser\Software\other\[POINTS NQS  2012.XLS]Super Stock'!$E99 -> 532 | O95: =IF('\\ser\Software\other\[POINTS NQS  2012.XLS]Super Stock'!$F99=0," ",'\\ser\Software\other\[POINTS NQS  2012.XLS]Super Stock'!$F99) -> Red Cub | P95: ='\\ser\Software\other\[POINTS NQS  2012.XLS]Super Stock'!$AA99 -> 241
A96: ='\\ser\Software\other\[POINTS NQS  2012.XLS]Pro Stock'!$A100 -> 94 | B96: ='\\ser\Software\other\[POINTS NQS  2012.XLS]Pro Stock'!$B100 -> Harrison Stahl | C96: ='\\ser\Software\other\[POINTS NQS  2012.XLS]Pro Stock'!$C100 -> Welton, IA | D96: =IF('\\ser\Software\other\[POINTS NQS  2012.XLS]Pro Stock'!$D100=0," ",'\\ser\Software\other\[POINTS NQS  2012.XLS]Pro Stock'!$D100) -> MVP | E96: ='\\ser\Software\other\[POINTS NQS  2012.XLS]Pro Stock'!$E100 -> 336 | F96: =IF('\\ser\Software\other\[POINTS NQS  2012.XLS]Pro Stock'!$F100=0," ",'\\ser\Software\other\[POINTS NQS  2012.XLS]Pro Stock'!$F100) -> MWSC # 4 | G96: ='\\ser\Software\other\[POINTS NQS  2012.XLS]Pro Stock'!$AA100 -> 234 | J96: ='\\ser\Software\other\[POINTS NQS  2012.XLS]Super Stock'!$A100 -> 95 | K96: ='\\ser\Software\other\[POINTS NQS  2012.XLS]Super Stock'!$B100 -> Kevin Battefeld | L96: ='\\ser\Software\other\[POINTS NQS  2012.XLS]Super Stock'!$C100 -> Lewistown, IL | M96: =IF('\\ser\Software\other\[POINTS NQS  2012.XLS]Super Stock'!$D100=0," ",'\\ser\Software\other\[POINTS NQS  2012.XLS]Super Stock'!$D100) -> Mike Bat. | N96: ='\\ser\Software\other\[POINTS NQS  2012.XLS]Super Stock'!$E100 -> 589 | O96: =IF('\\ser\Software\other\[POINTS NQS  2012.XLS]Super Stock'!$F100=0," ",'\\ser\Software\other\[POINTS NQS  2012.XLS]Super Stock'!$F100) -> Gotta Go Green | P96: ='\\ser\Software\other\[POINTS NQS  2012.XLS]Super Stock'!$AA100 -> 241
A97: ='\\ser\Software\other\[POINTS NQS  2012.XLS]Pro Stock'!$A101 -> 95 | B97: ='\\ser\Software\other\[POINTS NQS  2012.XLS]Pro Stock'!$B101 -> Brian Titzer | C97: ='\\ser\Software\other\[POINTS NQS  2012.XLS]Pro Stock'!$C101 -> Evansville, Ind | D97: =IF('\\ser\Software\other\[POINTS NQS  2012.XLS]Pro Stock'!$D101=0," ",'\\ser\Software\other\[POINTS NQS  2012.XLS]Pro Stock'!$D101) -> TC | E97: ='\\ser\Software\other\[POINTS NQS  2012.XLS]Pro Stock'!$E101 -> 364 | F97: =IF('\\ser\Software\other\[POINTS NQS  2012.XLS]Pro Stock'!$F101=0," ",'\\ser\Software\other\[POINTS NQS  2012.XLS]Pro Stock'!$F101) -> Single Boys Toy | G97: ='\\ser\Software\other\[POINTS NQS  2012.XLS]Pro Stock'!$AA101 -> 234 | J97: ='\\ser\Software\other\[POINTS NQS  2012.XLS]Super Stock'!$A101 -> 94 | K97: ='\\ser\Software\other\[POINTS NQS  2012.XLS]Super Stock'!$B101 -> Jim Morrison | L97: ='\\ser\Software\other\[POINTS NQS  2012.XLS]Super Stock'!$C101 -> Union, Ky | M97: =IF('\\ser\Software\other\[POINTS NQS  2012.XLS]Super Stock'!$D101=0," ",'\\ser\Software\other\[POINTS NQS  2012.XLS]Super Stock'!$D101) ->  | N97: ='\\ser\Software\other\[POINTS NQS  2012.XLS]Super Stock'!$E101 -> 0 | O97: =IF('\\ser\Software\other\[POINTS NQS  2012.XLS]Super Stock'!$F101=0," ",'\\ser\Software\other\[POINTS NQS  2012.XLS]Super Stock'!$F101) -> White | P97: ='\\ser\Software\other\[POINTS NQS  2012.XLS]Super Stock'!$AA101 -> 241
A98: ='\\ser\Software\other\[POINTS NQS  2012.XLS]Pro Stock'!$A102 -> 96 | B98: ='\\ser\Software\other\[POINTS NQS  2012.XLS]Pro Stock'!$B102 -> Mark Brest | C98: ='\\ser\Software\other\[POINTS NQS  2012.XLS]Pro Stock'!$C102 -> Sharpsville, Pa | D98: =IF('\\ser\Software\other\[POINTS NQS  2012.XLS]Pro Stock'!$D102=0," ",'\\ser\Software\other\[POINTS NQS  2012.XLS]Pro Stock'!$D102) -> MVP | E98: ='\\ser\Software\other\[POINTS NQS  2012.XLS]Pro Stock'!$E102 -> 404 | F98: =IF('\\ser\Software\other\[POINTS NQS  2012.XLS]Pro Stock'!$F102=0," ",'\\ser\Software\other\[POINTS NQS  2012.XLS]Pro Stock'!$F102) -> Stage IV | G98: ='\\ser\Software\other\[POINTS NQS  2012.XLS]Pro Stock'!$AA102 -> 234 | J98: ='\\ser\Software\other\[POINTS NQS  2012.XLS]Super Stock'!$A102 -> 96 | K98: ='\\ser\Software\other\[POINTS NQS  2012.XLS]Super Stock'!$B102 -> Harrison Stahl | L98: ='\\ser\Software\other\[POINTS NQS  2012.XLS]Super Stock'!$C102 -> Dewitt, IA | M98: =IF('\\ser\Software\other\[POINTS NQS  2012.XLS]Super Stock'!$D102=0," ",'\\ser\Software\other\[POINTS NQS  2012.XLS]Super Stock'!$D102) -> MVP | N98: ='\\ser\Software\other\[POINTS NQS  2012.XLS]Super Stock'!$E102 -> 335 | O98: =IF('\\ser\Software\other\[POINTS NQS  2012.XLS]Super Stock'!$F102=0," ",'\\ser\Software\other\[POINTS NQS  2012.XLS]Super Stock'!$F102) -> MWSC # 3 | P98: ='\\ser\Software\other\[POINTS NQS  2012.XLS]Super Stock'!$AA102 -> 242
A99: ='\\ser\Software\other\[POINTS NQS  2012.XLS]Pro Stock'!$A103 -> 97 | B99: ='\\ser\Software\other\[POINTS NQS  2012.XLS]Pro Stock'!$B103 -> Denns Chilcoat | C99: ='\\ser\Software\other\[POINTS NQS  2012.XLS]Pro Stock'!$C103 -> Seven Valley, Pa | D99: =IF('\\ser\Software\other\[POINTS NQS  2012.XLS]Pro Stock'!$D103=0," ",'\\ser\Software\other\[POINTS NQS  2012.XLS]Pro Stock'!$D103) ->  | E99: ='\\ser\Software\other\[POINTS NQS  2012.XLS]Pro Stock'!$E103 -> 528 | F99: =IF('\\ser\Software\other\[POINTS NQS  2012.XLS]Pro Stock'!$F103=0," ",'\\ser\Software\other\[POINTS NQS  2012.XLS]Pro Stock'!$F103) ->  | G99: ='\\ser\Software\other\[POINTS NQS  2012.XLS]Pro Stock'!$AA103 -> 234 | J99: ='\\ser\Software\other\[POINTS NQS  2012.XLS]Super Stock'!$A103 -> 97 | K99: ='\\ser\Software\other\[POINTS NQS  2012.XLS]Super Stock'!$B103 -> Nick Ferguson | L99: ='\\ser\Software\other\[POINTS NQS  2012.XLS]Super Stock'!$C103 -> Elkhorn, WI | M99: =IF('\\ser\Software\other\[POINTS NQS  2012.XLS]Super Stock'!$D103=0," ",'\\ser\Software\other\[POINTS NQS  2012.XLS]Super Stock'!$D103) ->  | N99: ='\\ser\Software\other\[POINTS NQS  2012.XLS]Super Stock'!$E103 -> 343 | O99: =IF('\\ser\Software\other\[POINTS NQS  2012.XLS]Super Stock'!$F103=0," ",'\\ser\Software\other\[POINTS NQS  2012.XLS]Super Stock'!$F103) -> Gorder Patrol | P99: ='\\ser\Software\other\[POINTS NQS  2012.XLS]Super Stock'!$AA103 -> 242
A100: ='\\ser\Software\other\[POINTS NQS  2012.XLS]Pro Stock'!$A104 -> 98 | B100: ='\\ser\Software\other\[POINTS NQS  2012.XLS]Pro Stock'!$B104 -> Ray Gentz | C100: ='\\ser\Software\other\[POINTS NQS  2012.XLS]Pro Stock'!$C104 -> Colon, Mich | D100: =IF('\\ser\Software\other\[POINTS NQS  2012.XLS]Pro Stock'!$D104=0," ",'\\ser\Software\other\[POINTS NQS  2012.XLS]Pro Stock'!$D104) -> JRS | E100: ='\\ser\Software\other\[POINTS NQS  2012.XLS]Pro Stock'!$E104 -> 35 | F100: =IF('\\ser\Software\other\[POINTS NQS  2012.XLS]Pro Stock'!$F104=0," ",'\\ser\Software\other\[POINTS NQS  2012.XLS]Pro Stock'!$F104) -> B.U. Cub | G100: ='\\ser\Software\other\[POINTS NQS  2012.XLS]Pro Stock'!$AA104 -> 235 | J100: ='\\ser\Software\other\[POINTS NQS  2012.XLS]Super Stock'!$A104 -> 98 | K100: ='\\ser\Software\other\[POINTS NQS  2012.XLS]Super Stock'!$B104 -> Glen Burge | L100: ='\\ser\Software\other\[POINTS NQS  2012.XLS]Super Stock'!$C104 -> W Alexandria, Oh | M100: =IF('\\ser\Software\other\[POINTS NQS  2012.XLS]Super Stock'!$D104=0," ",'\\ser\Software\other\[POINTS NQS  2012.XLS]Super Stock'!$D104) -> MVP | N100: ='\\ser\Software\other\[POINTS NQS  2012.XLS]Super Stock'!$E104 -> 380 | O100: =IF('\\ser\Software\other\[POINTS NQS  2012.XLS]Super Stock'!$F104=0," ",'\\ser\Software\other\[POINTS NQS  2012.XLS]Super Stock'!$F104) -> Armed & Dangerous | P100: ='\\ser\Software\other\[POINTS NQS  2012.XLS]Super Stock'!$AA104 -> 242
A101: ='\\ser\Software\other\[POINTS NQS  2012.XLS]Pro Stock'!$A105 -> 99 | B101: ='\\ser\Software\other\[POINTS NQS  2012.XLS]Pro Stock'!$B105 -> Kevin Root | C101: ='\\ser\Software\other\[POINTS NQS  2012.XLS]Pro Stock'!$C105 -> Inola, OKLA | D101: =IF('\\ser\Software\other\[POINTS NQS  2012.XLS]Pro Stock'!$D105=0," ",'\\ser\Software\other\[POINTS NQS  2012.XLS]Pro Stock'!$D105) -> Root | E101: ='\\ser\Software\other\[POINTS NQS  2012.XLS]Pro Stock'!$E105 -> 118 | F101: =IF('\\ser\Software\other\[POINTS NQS  2012.XLS]Pro Stock'!$F105=0," ",'\\ser\Software\other\[POINTS NQS  2012.XLS]Pro Stock'!$F105) -> Slap Shot | G101: ='\\ser\Software\other\[POINTS NQS  2012.XLS]Pro Stock'!$AA105 -> 235 | J101: ='\\ser\Software\other\[POINTS NQS  2012.XLS]Super Stock'!$A105 -> 99 | K101: ='\\ser\Software\other\[POINTS NQS  2012.XLS]Super Stock'!$B105 -> Logan Cessna | L101: ='\\ser\Software\other\[POINTS NQS  2012.XLS]Super Stock'!$C105 -> Chambersburg, Pa | M101: =IF('\\ser\Software\other\[POINTS NQS  2012.XLS]Super Stock'!$D105=0," ",'\\ser\Software\other\[POINTS NQS  2012.XLS]Super Stock'!$D105) -> NP | N101: ='\\ser\Software\other\[POINTS NQS  2012.XLS]Super Stock'!$E105 -> 388 | O101: =IF('\\ser\Software\other\[POINTS NQS  2012.XLS]Super Stock'!$F105=0," ",'\\ser\Software\other\[POINTS NQS  2012.XLS]Super Stock'!$F105) -> Adrenaline | P101: ='\\ser\Software\other\[POINTS NQS  2012.XLS]Super Stock'!$AA105 -> 242
A102: ='\\ser\Software\other\[POINTS NQS  2012.XLS]Pro Stock'!$A106 -> 100 | B102: ='\\ser\Software\other\[POINTS NQS  2012.XLS]Pro Stock'!$B106 -> Rick Slade | C102: ='\\ser\Software\other\[POINTS NQS  2012.XLS]Pro Stock'!$C106 -> Harveyville, KS | D102: =IF('\\ser\Software\other\[POINTS NQS  2012.XLS]Pro Stock'!$D106=0," ",'\\ser\Software\other\[POINTS NQS  2012.XLS]Pro Stock'!$D106) -> JRS | E102: ='\\ser\Software\other\[POINTS NQS  2012.XLS]Pro Stock'!$E106 -> 467 | F102: =IF('\\ser\Software\other\[POINTS NQS  2012.XLS]Pro Stock'!$F106=0," ",'\\ser\Software\other\[POINTS NQS  2012.XLS]Pro Stock'!$F106) -> Ricochet | G102: ='\\ser\Software\other\[POINTS NQS  2012.XLS]Pro Stock'!$AA106 -> 235 | J102: ='\\ser\Software\other\[POINTS NQS  2012.XLS]Super Stock'!$A106 -> 100 | K102: ='\\ser\Software\other\[POINTS NQS  2012.XLS]Super Stock'!$B106 -> Austin Goodman | L102: ='\\ser\Software\other\[POINTS NQS  2012.XLS]Super Stock'!$C106 -> Lincoln, Ill | M102: =IF('\\ser\Software\other\[POINTS NQS  2012.XLS]Super Stock'!$D106=0," ",'\\ser\Software\other\[POINTS NQS  2012.XLS]Super Stock'!$D106) ->  | N102: ='\\ser\Software\other\[POINTS NQS  2012.XLS]Super Stock'!$E106 -> 402 | O102: =IF('\\ser\Software\other\[POINTS NQS  2012.XLS]Super Stock'!$F106=0," ",'\\ser\Software\other\[POINTS NQS  2012.XLS]Super Stock'!$F106) -> The Mule | P102: ='\\ser\Software\other\[POINTS NQS  2012.XLS]Super Stock'!$AA106 -> 242
A103: ='\\ser\Software\other\[POINTS NQS  2012.XLS]Pro Stock'!$A107 -> 101 | B103: ='\\ser\Software\other\[POINTS NQS  2012.XLS]Pro Stock'!$B107 -> Shane Hadley | C103: ='\\ser\Software\other\[POINTS NQS  2012.XLS]Pro Stock'!$C107 -> Marion, KY | D103: =IF('\\ser\Software\other\[POINTS NQS  2012.XLS]Pro Stock'!$D107=0," ",'\\ser\Software\other\[POINTS NQS  2012.XLS]Pro Stock'!$D107) -> JRS | E103: ='\\ser\Software\other\[POINTS NQS  2012.XLS]Pro Stock'!$E107 -> 505 | F103: =IF('\\ser\Software\other\[POINTS NQS  2012.XLS]Pro Stock'!$F107=0," ",'\\ser\Software\other\[POINTS NQS  2012.XLS]Pro Stock'!$F107) ->  | G103: ='\\ser\Software\other\[POINTS NQS  2012.XLS]Pro Stock'!$AA107 -> 235 | J103: ='\\ser\Software\other\[POINTS NQS  2012.XLS]Super Stock'!$A107 -> 101 | K103: ='\\ser\Software\other\[POINTS NQS  2012.XLS]Super Stock'!$B107 -> Jim Spencer | L103: ='\\ser\Software\other\[POINTS NQS  2012.XLS]Super Stock'!$C107 -> Eaton, Oh | M103: =IF('\\ser\Software\other\[POINTS NQS  2012.XLS]Super Stock'!$D107=0," ",'\\ser\Software\other\[POINTS NQS  2012.XLS]Super Stock'!$D107) -> NP | N103: ='\\ser\Software\other\[POINTS NQS  2012.XLS]Super Stock'!$E107 -> 487 | O103: =IF('\\ser\Software\other\[POINTS NQS  2012.XLS]Super Stock'!$F107=0," ",'\\ser\Software\other\[POINTS NQS  2012.XLS]Super Stock'!$F107) -> Family Tradition | P103: ='\\ser\Software\other\[POINTS NQS  2012.XLS]Super Stock'!$AA107 -> 242
A104: ='\\ser\Software\other\[POINTS NQS  2012.XLS]Pro Stock'!$A108 -> 102 | B104: ='\\ser\Software\other\[POINTS NQS  2012.XLS]Pro Stock'!$B108 -> Brad Corzine | C104: ='\\ser\Software\other\[POINTS NQS  2012.XLS]Pro Stock'!$C108 -> Dongola, ILL | D104: =IF('\\ser\Software\other\[POINTS NQS  2012.XLS]Pro Stock'!$D108=0," ",'\\ser\Software\other\[POINTS NQS  2012.XLS]Pro Stock'!$D108) -> JW | E104: ='\\ser\Software\other\[POINTS NQS  2012.XLS]Pro Stock'!$E108 -> 509 | F104: =IF('\\ser\Software\other\[POINTS NQS  2012.XLS]Pro Stock'!$F108=0," ",'\\ser\Software\other\[POINTS NQS  2012.XLS]Pro Stock'!$F108) -> Just Black | G104: ='\\ser\Software\other\[POINTS NQS  2012.XLS]Pro Stock'!$AA108 -> 235 | J104: ='\\ser\Software\other\[POINTS NQS  2012.XLS]Super Stock'!$A108 -> 103 | K104: ='\\ser\Software\other\[POINTS NQS  2012.XLS]Super Stock'!$B108 -> Justin Tuttle | L104: ='\\ser\Software\other\[POINTS NQS  2012.XLS]Super Stock'!$C108 -> Greenview, IL | M104: =IF('\\ser\Software\other\[POINTS NQS  2012.XLS]Super Stock'!$D108=0," ",'\\ser\Software\other\[POINTS NQS  2012.XLS]Super Stock'!$D108) -> J&S | N104: ='\\ser\Software\other\[POINTS NQS  2012.XLS]Super Stock'!$E108 -> 574 | O104: =IF('\\ser\Software\other\[POINTS NQS  2012.XLS]Super Stock'!$F108=0," ",'\\ser\Software\other\[POINTS NQS  2012.XLS]Super Stock'!$F108) -> Dirt Devil | P104: ='\\ser\Software\other\[POINTS NQS  2012.XLS]Super Stock'!$AA108 -> 242
A105: ='\\ser\Software\other\[POINTS NQS  2012.XLS]Pro Stock'!$A109 -> 103 | B105: ='\\ser\Software\other\[POINTS NQS  2012.XLS]Pro Stock'!$B109 -> Kyle Hunter | C105: ='\\ser\Software\other\[POINTS NQS  2012.XLS]Pro Stock'!$C109 -> Montoursville, Pa | D105: =IF('\\ser\Software\other\[POINTS NQS  2012.XLS]Pro Stock'!$D109=0," ",'\\ser\Software\other\[POINTS NQS  2012.XLS]Pro Stock'!$D109) ->  | E105: ='\\ser\Software\other\[POINTS NQS  2012.XLS]Pro Stock'!$E109 -> 542 | F105: =IF('\\ser\Software\other\[POINTS NQS  2012.XLS]Pro Stock'!$F109=0," ",'\\ser\Software\other\[POINTS NQS  2012.XLS]Pro Stock'!$F109) ->  | G105: ='\\ser\Software\other\[POINTS NQS  2012.XLS]Pro Stock'!$AA109 -> 235 | J105: ='\\ser\Software\other\[POINTS NQS  2012.XLS]Super Stock'!$A109 -> 102 | K105: ='\\ser\Software\other\[POINTS NQS  2012.XLS]Super Stock'!$B109 -> Mark Cessna | L105: ='\\ser\Software\other\[POINTS NQS  2012.XLS]Super Stock'!$C109 -> Chambersburg, Pa | M105: =IF('\\ser\Software\other\[POINTS NQS  2012.XLS]Super Stock'!$D109=0," ",'\\ser\Software\other\[POINTS NQS  2012.XLS]Super Stock'!$D109) ->  | N105: ='\\ser\Software\other\[POINTS NQS  2012.XLS]Super Stock'!$E109 -> 0 | O105: =IF('\\ser\Software\other\[POINTS NQS  2012.XLS]Super Stock'!$F109=0," ",'\\ser\Software\other\[POINTS NQS  2012.XLS]Super Stock'!$F109) -> Built for Business | P105: ='\\ser\Software\other\[POINTS NQS  2012.XLS]Super Stock'!$AA109 -> 242
A106: ='\\ser\Software\other\[POINTS NQS  2012.XLS]Pro Stock'!$A110 -> 104 | B106: ='\\ser\Software\other\[POINTS NQS  2012.XLS]Pro Stock'!$B110 -> Brandon Lohwinow | C106: ='\\ser\Software\other\[POINTS NQS  2012.XLS]Pro Stock'!$C110 -> Feigus.Ont CDA | D106: =IF('\\ser\Software\other\[POINTS NQS  2012.XLS]Pro Stock'!$D110=0," ",'\\ser\Software\other\[POINTS NQS  2012.XLS]Pro Stock'!$D110) -> MVP | E106: ='\\ser\Software\other\[POINTS NQS  2012.XLS]Pro Stock'!$E110 -> 550 | F106: =IF('\\ser\Software\other\[POINTS NQS  2012.XLS]Pro Stock'!$F110=0," ",'\\ser\Software\other\[POINTS NQS  2012.XLS]Pro Stock'!$F110) -> Mistress | G106: ='\\ser\Software\other\[POINTS NQS  2012.XLS]Pro Stock'!$AA110 -> 235 | J106: ='\\ser\Software\other\[POINTS NQS  2012.XLS]Super Stock'!$A110 -> 104 | K106: ='\\ser\Software\other\[POINTS NQS  2012.XLS]Super Stock'!$B110 -> Corey Gerber | L106: ='\\ser\Software\other\[POINTS NQS  2012.XLS]Super Stock'!$C110 -> Apple Creek, Oh | M106: =IF('\\ser\Software\other\[POINTS NQS  2012.XLS]Super Stock'!$D110=0," ",'\\ser\Software\other\[POINTS NQS  2012.XLS]Super Stock'!$D110) ->  | N106: ='\\ser\Software\other\[POINTS NQS  2012.XLS]Super Stock'!$E110 -> 538 | O106: =IF('\\ser\Software\other\[POINTS NQS  2012.XLS]Super Stock'!$F110=0," ",'\\ser\Software\other\[POINTS NQS  2012.XLS]Super Stock'!$F110) -> Red Rascal | P106: ='\\ser\Software\other\[POINTS NQS  2012.XLS]Super Stock'!$AA110 -> 243
A107: ='\\ser\Software\other\[POINTS NQS  2012.XLS]Pro Stock'!$A111 -> 105 | B107: ='\\ser\Software\other\[POINTS NQS  2012.XLS]Pro Stock'!$B111 -> Tim Bowling | C107: ='\\ser\Software\other\[POINTS NQS  2012.XLS]Pro Stock'!$C111 -> Syracuse, Ind | D107: =IF('\\ser\Software\other\[POINTS NQS  2012.XLS]Pro Stock'!$D111=0," ",'\\ser\Software\other\[POINTS NQS  2012.XLS]Pro Stock'!$D111) -> LR | E107: ='\\ser\Software\other\[POINTS NQS  2012.XLS]Pro Stock'!$E111 -> 559 | F107: =IF('\\ser\Software\other\[POINTS NQS  2012.XLS]Pro Stock'!$F111=0," ",'\\ser\Software\other\[POINTS NQS  2012.XLS]Pro Stock'!$F111) -> Red Cub | G107: ='\\ser\Software\other\[POINTS NQS  2012.XLS]Pro Stock'!$AA111 -> 235 | J107: ='\\ser\Software\other\[POINTS NQS  2012.XLS]Super Stock'!$A111 -> 105 | K107: ='\\ser\Software\other\[POINTS NQS  2012.XLS]Super Stock'!$B111 -> Mike Silco | L107: ='\\ser\Software\other\[POINTS NQS  2012.XLS]Super Stock'!$C111 -> Pittsford, NY | M107: =IF('\\ser\Software\other\[POINTS NQS  2012.XLS]Super Stock'!$D111=0," ",'\\ser\Software\other\[POINTS NQS  2012.XLS]Super Stock'!$D111) -> LR | N107: ='\\ser\Software\other\[POINTS NQS  2012.XLS]Super Stock'!$E111 -> 547 | O107: =IF('\\ser\Software\other\[POINTS NQS  2012.XLS]Super Stock'!$F111=0," ",'\\ser\Software\other\[POINTS NQS  2012.XLS]Super Stock'!$F111) -> 1466 Alcoholic | P107: ='\\ser\Software\other\[POINTS NQS  2012.XLS]Super Stock'!$AA111 -> 243
A108: ='\\ser\Software\other\[POINTS NQS  2012.XLS]Pro Stock'!$A112 -> 106 | B108: ='\\ser\Software\other\[POINTS NQS  2012.XLS]Pro Stock'!$B112 -> Kevin Qeveselle | C108: ='\\ser\Software\other\[POINTS NQS  2012.XLS]Pro Stock'!$C112 -> Syracuse, Ind | D108: =IF('\\ser\Software\other\[POINTS NQS  2012.XLS]Pro Stock'!$D112=0," ",'\\ser\Software\other\[POINTS NQS  2012.XLS]Pro Stock'!$D112) -> LR | E108: ='\\ser\Software\other\[POINTS NQS  2012.XLS]Pro Stock'!$E112 -> 554 | F108: =IF('\\ser\Software\other\[POINTS NQS  2012.XLS]Pro Stock'!$F112=0," ",'\\ser\Software\other\[POINTS NQS  2012.XLS]Pro Stock'!$F112) -> Farmall A | G108: ='\\ser\Software\other\[POINTS NQS  2012.XLS]Pro Stock'!$AA112 -> 236 | J108: ='\\ser\Software\other\[POINTS NQS  2012.XLS]Super Stock'!$A112 -> 106 | K108: ='\\ser\Software\other\[POINTS NQS  2012.XLS]Super Stock'!$B112 -> Brandon Lohwinow | L108: ='\\ser\Software\other\[POINTS NQS  2012.XLS]Super Stock'!$C112 -> Feigus.Ont CDA | M108: =IF('\\ser\Software\other\[POINTS NQS  2012.XLS]Super Stock'!$D112=0," ",'\\ser\Software\other\[POINTS NQS  2012.XLS]Super Stock'!$D112) -> MWSC | N108: ='\\ser\Software\other\[POINTS NQS  2012.XLS]Super Stock'!$E112 -> 550 | O108: =IF('\\ser\Software\other\[POINTS NQS  2012.XLS]Super Stock'!$F112=0," ",'\\ser\Software\other\[POINTS NQS  2012.XLS]Super Stock'!$F112) -> Mistress | P108: ='\\ser\Software\other\[POINTS NQS  2012.XLS]Super Stock'!$AA112 -> 243
J109: ='\\ser\Software\other\[POINTS NQS  2012.XLS]Super Stock'!$A113 -> 107 | K109: ='\\ser\Software\other\[POINTS NQS  2012.XLS]Super Stock'!$B113 -> Brian Jones | L109: ='\\ser\Software\other\[POINTS NQS  2012.XLS]Super Stock'!$C113 -> Sheridan, Inc | M109: =IF('\\ser\Software\other\[POINTS NQS  2012.XLS]Super Stock'!$D113=0," ",'\\ser\Software\other\[POINTS NQS  2012.XLS]Super Stock'!$D113) ->  | N109: ='\\ser\Software\other\[POINTS NQS  2012.XLS]Super Stock'!$E113 -> 563 | O109: =IF('\\ser\Software\other\[POINTS NQS  2012.XLS]Super Stock'!$F113=0," ",'\\ser\Software\other\[POINTS NQS  2012.XLS]Super Stock'!$F113) ->  | P109: ='\\ser\Software\other\[POINTS NQS  2012.XLS]Super Stock'!$AA113 -> 243
J110: ='\\ser\Software\other\[POINTS NQS  2012.XLS]Super Stock'!$A114 -> 108 | K110: ='\\ser\Software\other\[POINTS NQS  2012.XLS]Super Stock'!$B114 -> Jim Morgenstern | L110: ='\\ser\Software\other\[POINTS NQS  2012.XLS]Super Stock'!$C114 -> Whipple, OH | M110: =IF('\\ser\Software\other\[POINTS NQS  2012.XLS]Super Stock'!$D114=0," ",'\\ser\Software\other\[POINTS NQS  2012.XLS]Super Stock'!$D114) ->  | N110: ='\\ser\Software\other\[POINTS NQS  2012.XLS]Super Stock'!$E114 -> 588 | O110: =IF('\\ser\Software\other\[POINTS NQS  2012.XLS]Super Stock'!$F114=0," ",'\\ser\Software\other\[POINTS NQS  2012.XLS]Super Stock'!$F114) -> High Maintenane | P110: ='\\ser\Software\other\[POINTS NQS  2012.XLS]Super Stock'!$AA114 -> 243
J111: ='\\ser\Software\other\[POINTS NQS  2012.XLS]Super Stock'!$A115 -> 109 | K111: ='\\ser\Software\other\[POINTS NQS  2012.XLS]Super Stock'!$B115 -> Jerry King | L111: ='\\ser\Software\other\[POINTS NQS  2012.XLS]Super Stock'!$C115 -> North Liberty, IN | M111: =IF('\\ser\Software\other\[POINTS NQS  2012.XLS]Super Stock'!$D115=0," ",'\\ser\Software\other\[POINTS NQS  2012.XLS]Super Stock'!$D115) -> Tate | N111: ='\\ser\Software\other\[POINTS NQS  2012.XLS]Super Stock'!$E115 -> 0 | O111: =IF('\\ser\Software\other\[POINTS NQS  2012.XLS]Super Stock'!$F115=0," ",'\\ser\Software\other\[POINTS NQS  2012.XLS]Super Stock'!$F115) -> Dollars and Dirt | P111: ='\\ser\Software\other\[POINTS NQS  2012.XLS]Super Stock'!$AA115 -> 243
J112: ='\\ser\Software\other\[POINTS NQS  2012.XLS]Super Stock'!$A116 -> 110 | K112: ='\\ser\Software\other\[POINTS NQS  2012.XLS]Super Stock'!$B116 -> Scott Larkins | L112: ='\\ser\Software\other\[POINTS NQS  2012.XLS]Super Stock'!$C116 -> Kearney, MO | M112: =IF('\\ser\Software\other\[POINTS NQS  2012.XLS]Super Stock'!$D116=0," ",'\\ser\Software\other\[POINTS NQS  2012.XLS]Super Stock'!$D116) -> JRS | N112: ='\\ser\Software\other\[POINTS NQS  2012.XLS]Super Stock'!$E116 -> 154 | O112: =IF('\\ser\Software\other\[POINTS NQS  2012.XLS]Super Stock'!$F116=0," ",'\\ser\Software\other\[POINTS NQS  2012.XLS]Super Stock'!$F116) -> Silver Sam | P112: ='\\ser\Software\other\[POINTS NQS  2012.XLS]Super Stock'!$AA116 -> 244
J113: ='\\ser\Software\other\[POINTS NQS  2012.XLS]Super Stock'!$A117 -> 111 | K113: ='\\ser\Software\other\[POINTS NQS  2012.XLS]Super Stock'!$B117 -> Tooter Campbell | L113: ='\\ser\Software\other\[POINTS NQS  2012.XLS]Super Stock'!$C117 -> Owensboro, KY | M113: =IF('\\ser\Software\other\[POINTS NQS  2012.XLS]Super Stock'!$D117=0," ",'\\ser\Software\other\[POINTS NQS  2012.XLS]Super Stock'!$D117) -> TC | N113: ='\\ser\Software\other\[POINTS NQS  2012.XLS]Super Stock'!$E117 -> 473 | O113: =IF('\\ser\Software\other\[POINTS NQS  2012.XLS]Super Stock'!$F117=0," ",'\\ser\Software\other\[POINTS NQS  2012.XLS]Super Stock'!$F117) -> Tractor Trash | P113: ='\\ser\Software\other\[POINTS NQS  2012.XLS]Super Stock'!$AA117 -> 244
J114: ='\\ser\Software\other\[POINTS NQS  2012.XLS]Super Stock'!$A118 -> 112 | K114: ='\\ser\Software\other\[POINTS NQS  2012.XLS]Super Stock'!$B118 -> Chad Vogler | L114: ='\\ser\Software\other\[POINTS NQS  2012.XLS]Super Stock'!$C118 -> Jasper, IN | M114: =IF('\\ser\Software\other\[POINTS NQS  2012.XLS]Super Stock'!$D118=0," ",'\\ser\Software\other\[POINTS NQS  2012.XLS]Super Stock'!$D118) -> JRS | N114: ='\\ser\Software\other\[POINTS NQS  2012.XLS]Super Stock'!$E118 -> 516 | O114: =IF('\\ser\Software\other\[POINTS NQS  2012.XLS]Super Stock'!$F118=0," ",'\\ser\Software\other\[POINTS NQS  2012.XLS]Super Stock'!$F118) -> Bandit | P114: ='\\ser\Software\other\[POINTS NQS  2012.XLS]Super Stock'!$AA118 -> 244
J115: ='\\ser\Software\other\[POINTS NQS  2012.XLS]Super Stock'!$A119 -> 113 | K115: ='\\ser\Software\other\[POINTS NQS  2012.XLS]Super Stock'!$B119 -> Michael Hunter | L115: ='\\ser\Software\other\[POINTS NQS  2012.XLS]Super Stock'!$C119 -> Catawissa, Pa | M115: =IF('\\ser\Software\other\[POINTS NQS  2012.XLS]Super Stock'!$D119=0," ",'\\ser\Software\other\[POINTS NQS  2012.XLS]Super Stock'!$D119) ->  | N115: ='\\ser\Software\other\[POINTS NQS  2012.XLS]Super Stock'!$E119 -> 541 | O115: =IF('\\ser\Software\other\[POINTS NQS  2012.XLS]Super Stock'!$F119=0," ",'\\ser\Software\other\[POINTS NQS  2012.XLS]Super Stock'!$F119) ->  | P115: ='\\ser\Software\other\[POINTS NQS  2012.XLS]Super Stock'!$AA119 -> 244
J116: ='\\ser\Software\other\[POINTS NQS  2012.XLS]Super Stock'!$A120 -> 114 | K116: ='\\ser\Software\other\[POINTS NQS  2012.XLS]Super Stock'!$B120 -> Doug Diehl | L116: ='\\ser\Software\other\[POINTS NQS  2012.XLS]Super Stock'!$C120 -> Smithsburg, PA | M116: =IF('\\ser\Software\other\[POINTS NQS  2012.XLS]Super Stock'!$D120=0," ",'\\ser\Software\other\[POINTS NQS  2012.XLS]Super Stock'!$D120) -> NP | N116: ='\\ser\Software\other\[POINTS NQS  2012.XLS]Super Stock'!$E120 -> 544 | O116: =IF('\\ser\Software\other\[POINTS NQS  2012.XLS]Super Stock'!$F120=0," ",'\\ser\Software\other\[POINTS NQS  2012.XLS]Super Stock'!$F120) -> 1 Bad MF | P116: ='\\ser\Software\other\[POINTS NQS  2012.XLS]Super Stock'!$AA120 -> 244
J117: ='\\ser\Software\other\[POINTS NQS  2012.XLS]Super Stock'!$A121 -> 115 | K117: ='\\ser\Software\other\[POINTS NQS  2012.XLS]Super Stock'!$B121 -> Ryan Forret | L117: ='\\ser\Software\other\[POINTS NQS  2012.XLS]Super Stock'!$C121 -> Preston, IA | M117: =IF('\\ser\Software\other\[POINTS NQS  2012.XLS]Super Stock'!$D121=0," ",'\\ser\Software\other\[POINTS NQS  2012.XLS]Super Stock'!$D121) -> MVP | N117: ='\\ser\Software\other\[POINTS NQS  2012.XLS]Super Stock'!$E121 -> 568 | O117: =IF('\\ser\Software\other\[POINTS NQS  2012.XLS]Super Stock'!$F121=0," ",'\\ser\Software\other\[POINTS NQS  2012.XLS]Super Stock'!$F121) -> 6030 Deere | P117: ='\\ser\Software\other\[POINTS NQS  2012.XLS]Super Stock'!$AA121 -> 244
J118: ='\\ser\Software\other\[POINTS NQS  2012.XLS]Super Stock'!$A122 -> 116 | K118: ='\\ser\Software\other\[POINTS NQS  2012.XLS]Super Stock'!$B122 -> Annette Sullivan | L118: ='\\ser\Software\other\[POINTS NQS  2012.XLS]Super Stock'!$C122 -> Welton, IA | M118: =IF('\\ser\Software\other\[POINTS NQS  2012.XLS]Super Stock'!$D122=0," ",'\\ser\Software\other\[POINTS NQS  2012.XLS]Super Stock'!$D122) -> MVP | N118: ='\\ser\Software\other\[POINTS NQS  2012.XLS]Super Stock'!$E122 -> 571 | O118: =IF('\\ser\Software\other\[POINTS NQS  2012.XLS]Super Stock'!$F122=0," ",'\\ser\Software\other\[POINTS NQS  2012.XLS]Super Stock'!$F122) -> Just Relax | P118: ='\\ser\Software\other\[POINTS NQS  2012.XLS]Super Stock'!$AA122 -> 244
J119: ='\\ser\Software\other\[POINTS NQS  2012.XLS]Super Stock'!$A123 -> 117 | K119: ='\\ser\Software\other\[POINTS NQS  2012.XLS]Super Stock'!$B123 -> Shaun Vogler | L119: ='\\ser\Software\other\[POINTS NQS  2012.XLS]Super Stock'!$C123 -> Jasper, IN | M119: =IF('\\ser\Software\other\[POINTS NQS  2012.XLS]Super Stock'!$D123=0," ",'\\ser\Software\other\[POINTS NQS  2012.XLS]Super Stock'!$D123) -> JRS | N119: ='\\ser\Software\other\[POINTS NQS  2012.XLS]Super Stock'!$E123 -> 129 | O119: =IF('\\ser\Software\other\[POINTS NQS  2012.XLS]Super Stock'!$F123=0," ",'\\ser\Software\other\[POINTS NQS  2012.XLS]Super Stock'!$F123) -> Renegade | P119: ='\\ser\Software\other\[POINTS NQS  2012.XLS]Super Stock'!$AA123 -> 245
J120: ='\\ser\Software\other\[POINTS NQS  2012.XLS]Super Stock'!$A124 -> 118 | K120: ='\\ser\Software\other\[POINTS NQS  2012.XLS]Super Stock'!$B124 -> Jeff Yager | L120: ='\\ser\Software\other\[POINTS NQS  2012.XLS]Super Stock'!$C124 -> Kokomo, IN | M120: =IF('\\ser\Software\other\[POINTS NQS  2012.XLS]Super Stock'!$D124=0," ",'\\ser\Software\other\[POINTS NQS  2012.XLS]Super Stock'!$D124) ->  | N120: ='\\ser\Software\other\[POINTS NQS  2012.XLS]Super Stock'!$E124 -> 451 | O120: =IF('\\ser\Software\other\[POINTS NQS  2012.XLS]Super Stock'!$F124=0," ",'\\ser\Software\other\[POINTS NQS  2012.XLS]Super Stock'!$F124) ->  | P120: ='\\ser\Software\other\[POINTS NQS  2012.XLS]Super Stock'!$AA124 -> 245
J121: ='\\ser\Software\other\[POINTS NQS  2012.XLS]Super Stock'!$A125 -> 119 | K121: ='\\ser\Software\other\[POINTS NQS  2012.XLS]Super Stock'!$B125 -> Steve Vogler | L121: ='\\ser\Software\other\[POINTS NQS  2012.XLS]Super Stock'!$C125 -> Jasper, IN | M121: =IF('\\ser\Software\other\[POINTS NQS  2012.XLS]Super Stock'!$D125=0," ",'\\ser\Software\other\[POINTS NQS  2012.XLS]Super Stock'!$D125) -> JRS | N121: ='\\ser\Software\other\[POINTS NQS  2012.XLS]Super Stock'!$E125 -> 476 | O121: =IF('\\ser\Software\other\[POINTS NQS  2012.XLS]Super Stock'!$F125=0," ",'\\ser\Software\other\[POINTS NQS  2012.XLS]Super Stock'!$F125) -> Outlaw Reloaded | P121: ='\\ser\Software\other\[POINTS NQS  2012.XLS]Super Stock'!$AA125 -> 245
J122: ='\\ser\Software\other\[POINTS NQS  2012.XLS]Super Stock'!$A126 -> 120 | K122: ='\\ser\Software\other\[POINTS NQS  2012.XLS]Super Stock'!$B126 -> Richard Lucabaugh | L122: ='\\ser\Software\other\[POINTS NQS  2012.XLS]Super Stock'!$C126 -> Glen Rock, PA | M122: =IF('\\ser\Software\other\[POINTS NQS  2012.XLS]Super Stock'!$D126=0," ",'\\ser\Software\other\[POINTS NQS  2012.XLS]Super Stock'!$D126) -> NP | N122: ='\\ser\Software\other\[POINTS NQS  2012.XLS]Super Stock'!$E126 -> 494 | O122: =IF('\\ser\Software\other\[POINTS NQS  2012.XLS]Super Stock'!$F126=0," ",'\\ser\Software\other\[POINTS NQS  2012.XLS]Super Stock'!$F126) -> Cub | P122: ='\\ser\Software\other\[POINTS NQS  2012.XLS]Super Stock'!$AA126 -> 245
J123: ='\\ser\Software\other\[POINTS NQS  2012.XLS]Super Stock'!$A127 -> 121 | K123: ='\\ser\Software\other\[POINTS NQS  2012.XLS]Super Stock'!$B127 -> Mike Dockhan | L123: ='\\ser\Software\other\[POINTS NQS  2012.XLS]Super Stock'!$C127 -> Imlay City, Mich | M123: =IF('\\ser\Software\other\[POINTS NQS  2012.XLS]Super Stock'!$D127=0," ",'\\ser\Software\other\[POINTS NQS  2012.XLS]Super Stock'!$D127) ->  | N123: ='\\ser\Software\other\[POINTS NQS  2012.XLS]Super Stock'!$E127 -> 530 | O123: =IF('\\ser\Software\other\[POINTS NQS  2012.XLS]Super Stock'!$F127=0," ",'\\ser\Software\other\[POINTS NQS  2012.XLS]Super Stock'!$F127) -> Plain Blue | P123: ='\\ser\Software\other\[POINTS NQS  2012.XLS]Super Stock'!$AA127 -> 245
J124: ='\\ser\Software\other\[POINTS NQS  2012.XLS]Super Stock'!$A128 -> 122 | K124: ='\\ser\Software\other\[POINTS NQS  2012.XLS]Super Stock'!$B128 -> Ryan Forret | L124: ='\\ser\Software\other\[POINTS NQS  2012.XLS]Super Stock'!$C128 -> Preston, IA | M124: =IF('\\ser\Software\other\[POINTS NQS  2012.XLS]Super Stock'!$D128=0," ",'\\ser\Software\other\[POINTS NQS  2012.XLS]Super Stock'!$D128) -> MVP | N124: ='\\ser\Software\other\[POINTS NQS  2012.XLS]Super Stock'!$E128 -> 572 | O124: =IF('\\ser\Software\other\[POINTS NQS  2012.XLS]Super Stock'!$F128=0," ",'\\ser\Software\other\[POINTS NQS  2012.XLS]Super Stock'!$F128) -> D-21 Allis Chalmers | P124: ='\\ser\Software\other\[POINTS NQS  2012.XLS]Super Stock'!$AA128 -> 245
J125: ='\\ser\Software\other\[POINTS NQS  2012.XLS]Super Stock'!$A129 -> 123 | K125: ='\\ser\Software\other\[POINTS NQS  2012.XLS]Super Stock'!$B129 -> Kevin Root | L125: ='\\ser\Software\other\[POINTS NQS  2012.XLS]Super Stock'!$C129 -> Inola, OK | M125: =IF('\\ser\Software\other\[POINTS NQS  2012.XLS]Super Stock'!$D129=0," ",'\\ser\Software\other\[POINTS NQS  2012.XLS]Super Stock'!$D129) -> Root | N125: ='\\ser\Software\other\[POINTS NQS  2012.XLS]Super Stock'!$E129 -> 117 | O125: =IF('\\ser\Software\other\[POINTS NQS  2012.XLS]Super Stock'!$F129=0," ",'\\ser\Software\other\[POINTS NQS  2012.XLS]Super Stock'!$F129) -> Right on the Money | P125: ='\\ser\Software\other\[POINTS NQS  2012.XLS]Super Stock'!$AA129 -> 246
J126: ='\\ser\Software\other\[POINTS NQS  2012.XLS]Super Stock'!$A130 -> 124 | K126: ='\\ser\Software\other\[POINTS NQS  2012.XLS]Super Stock'!$B130 -> Dave Gawatz | L126: ='\\ser\Software\other\[POINTS NQS  2012.XLS]Super Stock'!$C130 -> St. Joseph, MO | M126: =IF('\\ser\Software\other\[POINTS NQS  2012.XLS]Super Stock'!$D130=0," ",'\\ser\Software\other\[POINTS NQS  2012.XLS]Super Stock'!$D130) -> LR | N126: ='\\ser\Software\other\[POINTS NQS  2012.XLS]Super Stock'!$E130 -> 367 | O126: =IF('\\ser\Software\other\[POINTS NQS  2012.XLS]Super Stock'!$F130=0," ",'\\ser\Software\other\[POINTS NQS  2012.XLS]Super Stock'!$F130) -> Lil' Sprout | P126: ='\\ser\Software\other\[POINTS NQS  2012.XLS]Super Stock'!$AA130 -> 246
J127: ='\\ser\Software\other\[POINTS NQS  2012.XLS]Super Stock'!$A131 -> 125 | K127: ='\\ser\Software\other\[POINTS NQS  2012.XLS]Super Stock'!$B131 -> Denis Chilcoat | L127: ='\\ser\Software\other\[POINTS NQS  2012.XLS]Super Stock'!$C131 -> Seven Valley, PA | M127: =IF('\\ser\Software\other\[POINTS NQS  2012.XLS]Super Stock'!$D131=0," ",'\\ser\Software\other\[POINTS NQS  2012.XLS]Super Stock'!$D131) ->  | N127: ='\\ser\Software\other\[POINTS NQS  2012.XLS]Super Stock'!$E131 -> 528 | O127: =IF('\\ser\Software\other\[POINTS NQS  2012.XLS]Super Stock'!$F131=0," ",'\\ser\Software\other\[POINTS NQS  2012.XLS]Super Stock'!$F131) ->  | P127: ='\\ser\Software\other\[POINTS NQS  2012.XLS]Super Stock'!$AA131 -> 246
J128: ='\\ser\Software\other\[POINTS NQS  2012.XLS]Super Stock'!$A132 -> 126 | K128: ='\\ser\Software\other\[POINTS NQS  2012.XLS]Super Stock'!$B132 -> Ron Scroggins | L128: ='\\ser\Software\other\[POINTS NQS  2012.XLS]Super Stock'!$C132 -> Neosho, MO | M128: =IF('\\ser\Software\other\[POINTS NQS  2012.XLS]Super Stock'!$D132=0," ",'\\ser\Software\other\[POINTS NQS  2012.XLS]Super Stock'!$D132) -> VM | N128: ='\\ser\Software\other\[POINTS NQS  2012.XLS]Super Stock'!$E132 -> 110 | O128: =IF('\\ser\Software\other\[POINTS NQS  2012.XLS]Super Stock'!$F132=0," ",'\\ser\Software\other\[POINTS NQS  2012.XLS]Super Stock'!$F132) -> Dirt Dancer | P128: ='\\ser\Software\other\[POINTS NQS  2012.XLS]Super Stock'!$AA132 -> 247
J129: ='\\ser\Software\other\[POINTS NQS  2012.XLS]Super Stock'!$A133 -> 127 | K129: ='\\ser\Software\other\[POINTS NQS  2012.XLS]Super Stock'!$B133 -> Jeff Chrisman | L129: ='\\ser\Software\other\[POINTS NQS  2012.XLS]Super Stock'!$C133 -> Edinburgh, IN | M129: =IF('\\ser\Software\other\[POINTS NQS  2012.XLS]Super Stock'!$D133=0," ",'\\ser\Software\other\[POINTS NQS  2012.XLS]Super Stock'!$D133) -> VM | N129: ='\\ser\Software\other\[POINTS NQS  2012.XLS]Super Stock'!$E133 -> 180 | O129: =IF('\\ser\Software\other\[POINTS NQS  2012.XLS]Super Stock'!$F133=0," ",'\\ser\Software\other\[POINTS NQS  2012.XLS]Super Stock'!$F133) ->  | P129: ='\\ser\Software\other\[POINTS NQS  2012.XLS]Super Stock'!$AA133 -> 247
J130: ='\\ser\Software\other\[POINTS NQS  2012.XLS]Super Stock'!$A134 -> 128 | K130: ='\\ser\Software\other\[POINTS NQS  2012.XLS]Super Stock'!$B134 -> Phil Burton | L130: ='\\ser\Software\other\[POINTS NQS  2012.XLS]Super Stock'!$C134 -> Kokomo, IN | M130: =IF('\\ser\Software\other\[POINTS NQS  2012.XLS]Super Stock'!$D134=0," ",'\\ser\Software\other\[POINTS NQS  2012.XLS]Super Stock'!$D134) -> Jagerville | N130: ='\\ser\Software\other\[POINTS NQS  2012.XLS]Super Stock'!$E134 -> 519 | O130: =IF('\\ser\Software\other\[POINTS NQS  2012.XLS]Super Stock'!$F134=0," ",'\\ser\Software\other\[POINTS NQS  2012.XLS]Super Stock'!$F134) -> Goofy Express | P130: ='\\ser\Software\other\[POINTS NQS  2012.XLS]Super Stock'!$AA134 -> 247
J131: ='\\ser\Software\other\[POINTS NQS  2012.XLS]Super Stock'!$A135 -> 129 | K131: ='\\ser\Software\other\[POINTS NQS  2012.XLS]Super Stock'!$B135 -> Kyle Hunter | L131: ='\\ser\Software\other\[POINTS NQS  2012.XLS]Super Stock'!$C135 -> Montoursville, Pa | M131: =IF('\\ser\Software\other\[POINTS NQS  2012.XLS]Super Stock'!$D135=0," ",'\\ser\Software\other\[POINTS NQS  2012.XLS]Super Stock'!$D135) ->  | N131: ='\\ser\Software\other\[POINTS NQS  2012.XLS]Super Stock'!$E135 -> 542 | O131: =IF('\\ser\Software\other\[POINTS NQS  2012.XLS]Super Stock'!$F135=0," ",'\\ser\Software\other\[POINTS NQS  2012.XLS]Super Stock'!$F135) ->  | P131: ='\\ser\Software\other\[POINTS NQS  2012.XLS]Super Stock'!$AA135 -> 247
J132: ='\\ser\Software\other\[POINTS NQS  2012.XLS]Super Stock'!$A136 -> 130 | K132: ='\\ser\Software\other\[POINTS NQS  2012.XLS]Super Stock'!$B136 -> Lee Blesch | L132: ='\\ser\Software\other\[POINTS NQS  2012.XLS]Super Stock'!$C136 -> Holland, IN | M132: =IF('\\ser\Software\other\[POINTS NQS  2012.XLS]Super Stock'!$D136=0," ",'\\ser\Software\other\[POINTS NQS  2012.XLS]Super Stock'!$D136) -> TC | N132: ='\\ser\Software\other\[POINTS NQS  2012.XLS]Super Stock'!$E136 -> 344 | O132: =IF('\\ser\Software\other\[POINTS NQS  2012.XLS]Super Stock'!$F136=0," ",'\\ser\Software\other\[POINTS NQS  2012.XLS]Super Stock'!$F136) -> Orange Blossom Special | P132: ='\\ser\Software\other\[POINTS NQS  2012.XLS]Super Stock'!$AA136 -> 248
J133: ='\\ser\Software\other\[POINTS NQS  2012.XLS]Super Stock'!$A137 -> 131 | K133: ='\\ser\Software\other\[POINTS NQS  2012.XLS]Super Stock'!$B137 -> Scott DeFabritis | L133: ='\\ser\Software\other\[POINTS NQS  2012.XLS]Super Stock'!$C137 -> Kokomo, IN | M133: =IF('\\ser\Software\other\[POINTS NQS  2012.XLS]Super Stock'!$D137=0," ",'\\ser\Software\other\[POINTS NQS  2012.XLS]Super Stock'!$D137) -> Jagerville | N133: ='\\ser\Software\other\[POINTS NQS  2012.XLS]Super Stock'!$E137 -> 518 | O133: =IF('\\ser\Software\other\[POINTS NQS  2012.XLS]Super Stock'!$F137=0," ",'\\ser\Software\other\[POINTS NQS  2012.XLS]Super Stock'!$F137) -> Back Yard Banshee | P133: ='\\ser\Software\other\[POINTS NQS  2012.XLS]Super Stock'!$AA137 -> 248
J134: ='\\ser\Software\other\[POINTS NQS  2012.XLS]Super Stock'!$A138 -> 132 | K134: ='\\ser\Software\other\[POINTS NQS  2012.XLS]Super Stock'!$B138 -> Nick Moeller | L134: ='\\ser\Software\other\[POINTS NQS  2012.XLS]Super Stock'!$C138 -> Effingham, IL | M134: =IF('\\ser\Software\other\[POINTS NQS  2012.XLS]Super Stock'!$D138=0," ",'\\ser\Software\other\[POINTS NQS  2012.XLS]Super Stock'!$D138) -> Moeller | N134: ='\\ser\Software\other\[POINTS NQS  2012.XLS]Super Stock'!$E138 -> 520 | O134: =IF('\\ser\Software\other\[POINTS NQS  2012.XLS]Super Stock'!$F138=0," ",'\\ser\Software\other\[POINTS NQS  2012.XLS]Super Stock'!$F138) -> Bull on IX | P134: ='\\ser\Software\other\[POINTS NQS  2012.XLS]Super Stock'!$AA138 -> 248
J135: ='\\ser\Software\other\[POINTS NQS  2012.XLS]Super Stock'!$A139 -> 133 | K135: ='\\ser\Software\other\[POINTS NQS  2012.XLS]Super Stock'!$B139 -> Kevin Root | L135: ='\\ser\Software\other\[POINTS NQS  2012.XLS]Super Stock'!$C139 -> Inola, OK | M135: =IF('\\ser\Software\other\[POINTS NQS  2012.XLS]Super Stock'!$D139=0," ",'\\ser\Software\other\[POINTS NQS  2012.XLS]Super Stock'!$D139) -> Root | N135: ='\\ser\Software\other\[POINTS NQS  2012.XLS]Super Stock'!$E139 -> 118 | O135: =IF('\\ser\Software\other\[POINTS NQS  2012.XLS]Super Stock'!$F139=0," ",'\\ser\Software\other\[POINTS NQS  2012.XLS]Super Stock'!$F139) -> Slap Shot | P135: ='\\ser\Software\other\[POINTS NQS  2012.XLS]Super Stock'!$AA139 -> 249
J136: ='\\ser\Software\other\[POINTS NQS  2012.XLS]Super Stock'!$A140 -> 134 | K136: ='\\ser\Software\other\[POINTS NQS  2012.XLS]Super Stock'!$B140 -> Shane Hadley | L136: ='\\ser\Software\other\[POINTS NQS  2012.XLS]Super Stock'!$C140 -> Marion, NY | M136: =IF('\\ser\Software\other\[POINTS NQS  2012.XLS]Super Stock'!$D140=0," ",'\\ser\Software\other\[POINTS NQS  2012.XLS]Super Stock'!$D140) -> JRS | N136: ='\\ser\Software\other\[POINTS NQS  2012.XLS]Super Stock'!$E140 -> 505 | O136: =IF('\\ser\Software\other\[POINTS NQS  2012.XLS]Super Stock'!$F140=0," ",'\\ser\Software\other\[POINTS NQS  2012.XLS]Super Stock'!$F140) ->  | P136: ='\\ser\Software\other\[POINTS NQS  2012.XLS]Super Stock'!$AA140 -> 249
J137: ='\\ser\Software\other\[POINTS NQS  2012.XLS]Super Stock'!$A141 -> 135 | K137: ='\\ser\Software\other\[POINTS NQS  2012.XLS]Super Stock'!$B141 -> Rick Massey | L137: ='\\ser\Software\other\[POINTS NQS  2012.XLS]Super Stock'!$C141 -> Ava, MO | M137: =IF('\\ser\Software\other\[POINTS NQS  2012.XLS]Super Stock'!$D141=0," ",'\\ser\Software\other\[POINTS NQS  2012.XLS]Super Stock'!$D141) ->  | N137: ='\\ser\Software\other\[POINTS NQS  2012.XLS]Super Stock'!$E141 -> 420 | O137: =IF('\\ser\Software\other\[POINTS NQS  2012.XLS]Super Stock'!$F141=0," ",'\\ser\Software\other\[POINTS NQS  2012.XLS]Super Stock'!$F141) -> Special Addiction | P137: ='\\ser\Software\other\[POINTS NQS  2012.XLS]Super Stock'!$AA141 -> 251
M138: =IF('\\ser\Software\other\[POINTS NQS  2012.XLS]Super Stock'!$D142=0," ",'\\ser\Software\other\[POINTS NQS  2012.XLS]Super Stock'!$D142) -> 
M139: =IF('\\ser\Software\other\[POINTS NQS  2012.XLS]Super Stock'!$D143=0," ",'\\ser\Software\other\[POINTS NQS  2012.XLS]Super Stock'!$D143) -> 
M140: =IF('\\ser\Software\other\[POINTS NQS  2012.XLS]Super Stock'!$D144=0," ",'\\ser\Software\other\[POINTS NQS  2012.XLS]Super Stock'!$D144) -> 