B2: PRO OUTLAW | F2: Thru Peoria | J2: Lite Pro | N2: Thru Peoria
F3: Points Back | N3: Points Back
B4: Name | C4: City/State | D4: NQS # | E4: Tractor | J4: Name | K4: City/State | L4: NQS # | M4: Tractor
A5: ='\\ser\Software\other\[POINTS NQS  2012.XLS]Pro Outlaw'!A7 -> 1 | B5: ='\\ser\Software\other\[POINTS NQS  2012.XLS]Pro Outlaw'!B7 -> Russ Nichols | C5: ='\\ser\Software\other\[POINTS NQS  2012.XLS]Pro Outlaw'!C7 -> Lore city, OH | D5: ='\\ser\Software\other\[POINTS NQS  2012.XLS]Pro Outlaw'!D7 -> 70 | E5: =IF( '\\ser\Software\other\[POINTS NQS  2012.XLS]Pro Outlaw'!E7=0," ",'\\ser\Software\other\[POINTS NQS  2012.XLS]Pro Outlaw'!E7) -> Wild One II | F5: ='\\ser\Software\other\[POINTS NQS  2012.XLS]Pro Outlaw'!AA7 -> 0 | I5: ='\\ser\Software\other\[POINTS NQS  2012.XLS]Light Pro'!A7 -> 1 | J5: ='\\ser\Software\other\[POINTS NQS  2012.XLS]Light Pro'!B7 -> Lora Feldkamp | K5: ='\\ser\Software\other\[POINTS NQS  2012.XLS]Light Pro'!C7 -> Britton, MI | L5: ='\\ser\Software\other\[POINTS NQS  2012.XLS]Light Pro'!D7 -> 475 | M5: =IF('\\ser\Software\other\[POINTS NQS  2012.XLS]Light Pro'!E7=0," ",'\\ser\Software\other\[POINTS NQS  2012.XLS]Light Pro'!E7) ->  | N5: ='\\ser\Software\other\[POINTS NQS  2012.XLS]Light Pro'!AA7 -> 0
A6: ='\\ser\Software\other\[POINTS NQS  2012.XLS]Pro Outlaw'!A8 -> 2 | B6: ='\\ser\Software\other\[POINTS NQS  2012.XLS]Pro Outlaw'!B8 -> Russ Nichols | C6: ='\\ser\Software\other\[POINTS NQS  2012.XLS]Pro Outlaw'!C8 -> Lore City, OH | D6: ='\\ser\Software\other\[POINTS NQS  2012.XLS]Pro Outlaw'!D8 -> 8 | E6: =IF( '\\ser\Software\other\[POINTS NQS  2012.XLS]Pro Outlaw'!E8=0," ",'\\ser\Software\other\[POINTS NQS  2012.XLS]Pro Outlaw'!E8) -> Wicked Deere | F6: ='\\ser\Software\other\[POINTS NQS  2012.XLS]Pro Outlaw'!AA8 -> 3 | I6: ='\\ser\Software\other\[POINTS NQS  2012.XLS]Light Pro'!A8 -> 2 | J6: ='\\ser\Software\other\[POINTS NQS  2012.XLS]Light Pro'!B8 -> Gregory Vandevort | K6: ='\\ser\Software\other\[POINTS NQS  2012.XLS]Light Pro'!C8 -> Albion, PA | L6: ='\\ser\Software\other\[POINTS NQS  2012.XLS]Light Pro'!D8 -> 506 | M6: =IF('\\ser\Software\other\[POINTS NQS  2012.XLS]Light Pro'!E8=0," ",'\\ser\Software\other\[POINTS NQS  2012.XLS]Light Pro'!E8) -> Shockwave | N6: ='\\ser\Software\other\[POINTS NQS  2012.XLS]Light Pro'!AA8 -> 0
A7: ='\\ser\Software\other\[POINTS NQS  2012.XLS]Pro Outlaw'!A9 -> 3 | B7: ='\\ser\Software\other\[POINTS NQS  2012.XLS]Pro Outlaw'!B9 -> Daryl Musser | C7: ='\\ser\Software\other\[POINTS NQS  2012.XLS]Pro Outlaw'!C9 -> Greencastle, PA | D7: ='\\ser\Software\other\[POINTS NQS  2012.XLS]Pro Outlaw'!D9 -> 396 | E7: =IF( '\\ser\Software\other\[POINTS NQS  2012.XLS]Pro Outlaw'!E9=0," ",'\\ser\Software\other\[POINTS NQS  2012.XLS]Pro Outlaw'!E9) -> 5 Cents | F7: ='\\ser\Software\other\[POINTS NQS  2012.XLS]Pro Outlaw'!AA9 -> 29 | I7: ='\\ser\Software\other\[POINTS NQS  2012.XLS]Light Pro'!A9 -> 3 | J7: ='\\ser\Software\other\[POINTS NQS  2012.XLS]Light Pro'!B9 -> Matt Kaster | K7: ='\\ser\Software\other\[POINTS NQS  2012.XLS]Light Pro'!C9 -> Burlington, WI | L7: ='\\ser\Software\other\[POINTS NQS  2012.XLS]Light Pro'!D9 -> 332 | M7: =IF('\\ser\Software\other\[POINTS NQS  2012.XLS]Light Pro'!E9=0," ",'\\ser\Software\other\[POINTS NQS  2012.XLS]Light Pro'!E9) -> Hog Wash | N7: ='\\ser\Software\other\[POINTS NQS  2012.XLS]Light Pro'!AA9 -> 2
A8: ='\\ser\Software\other\[POINTS NQS  2012.XLS]Pro Outlaw'!A10 -> 4 | B8: ='\\ser\Software\other\[POINTS NQS  2012.XLS]Pro Outlaw'!B10 -> Elaine Fisher | C8: ='\\ser\Software\other\[POINTS NQS  2012.XLS]Pro Outlaw'!C10 -> Waterford, OH | D8: ='\\ser\Software\other\[POINTS NQS  2012.XLS]Pro Outlaw'!D10 -> 80 | E8: =IF( '\\ser\Software\other\[POINTS NQS  2012.XLS]Pro Outlaw'!E10=0," ",'\\ser\Software\other\[POINTS NQS  2012.XLS]Pro Outlaw'!E10) -> Blue Thunder | F8: ='\\ser\Software\other\[POINTS NQS  2012.XLS]Pro Outlaw'!AA10 -> 36 | I8: ='\\ser\Software\other\[POINTS NQS  2012.XLS]Light Pro'!A10 -> 4 | J8: ='\\ser\Software\other\[POINTS NQS  2012.XLS]Light Pro'!B10 -> Jerry Sweet | K8: ='\\ser\Software\other\[POINTS NQS  2012.XLS]Light Pro'!C10 -> Clymer, NY | L8: ='\\ser\Software\other\[POINTS NQS  2012.XLS]Light Pro'!D10 -> 284 | M8: =IF('\\ser\Software\other\[POINTS NQS  2012.XLS]Light Pro'!E10=0," ",'\\ser\Software\other\[POINTS NQS  2012.XLS]Light Pro'!E10) -> Phat Ride | N8: ='\\ser\Software\other\[POINTS NQS  2012.XLS]Light Pro'!AA10 -> 12
A9: ='\\ser\Software\other\[POINTS NQS  2012.XLS]Pro Outlaw'!A11 -> 5 | B9: ='\\ser\Software\other\[POINTS NQS  2012.XLS]Pro Outlaw'!B11 -> Harrision Stahl | C9: ='\\ser\Software\other\[POINTS NQS  2012.XLS]Pro Outlaw'!C11 -> Dewitt, IA | D9: ='\\ser\Software\other\[POINTS NQS  2012.XLS]Pro Outlaw'!D11 -> 4 | E9: =IF( '\\ser\Software\other\[POINTS NQS  2012.XLS]Pro Outlaw'!E11=0," ",'\\ser\Software\other\[POINTS NQS  2012.XLS]Pro Outlaw'!E11) -> Tons of Fun | F9: ='\\ser\Software\other\[POINTS NQS  2012.XLS]Pro Outlaw'!AA11 -> 48 | I9: ='\\ser\Software\other\[POINTS NQS  2012.XLS]Light Pro'!A11 -> 5 | J9: ='\\ser\Software\other\[POINTS NQS  2012.XLS]Light Pro'!B11 -> Bobby Feldkamp | K9: ='\\ser\Software\other\[POINTS NQS  2012.XLS]Light Pro'!C11 -> Milan, Mi | L9: ='\\ser\Software\other\[POINTS NQS  2012.XLS]Light Pro'!D11 -> 474 | M9: =IF('\\ser\Software\other\[POINTS NQS  2012.XLS]Light Pro'!E11=0," ",'\\ser\Software\other\[POINTS NQS  2012.XLS]Light Pro'!E11) -> Driftwod | N9: ='\\ser\Software\other\[POINTS NQS  2012.XLS]Light Pro'!AA11 -> 19
A10: ='\\ser\Software\other\[POINTS NQS  2012.XLS]Pro Outlaw'!A12 -> 6 | B10: ='\\ser\Software\other\[POINTS NQS  2012.XLS]Pro Outlaw'!B12 -> Drew Burton | C10: ='\\ser\Software\other\[POINTS NQS  2012.XLS]Pro Outlaw'!C12 -> Brookston, IN | D10: ='\\ser\Software\other\[POINTS NQS  2012.XLS]Pro Outlaw'!D12 -> 14 | E10: =IF( '\\ser\Software\other\[POINTS NQS  2012.XLS]Pro Outlaw'!E12=0," ",'\\ser\Software\other\[POINTS NQS  2012.XLS]Pro Outlaw'!E12) -> Bad Company | F10: ='\\ser\Software\other\[POINTS NQS  2012.XLS]Pro Outlaw'!AA12 -> 53 | I10: ='\\ser\Software\other\[POINTS NQS  2012.XLS]Light Pro'!A12 -> 6 | J10: ='\\ser\Software\other\[POINTS NQS  2012.XLS]Light Pro'!B12 -> David Gawatz | K10: ='\\ser\Software\other\[POINTS NQS  2012.XLS]Light Pro'!C12 -> St. Joseph, MO | L10: ='\\ser\Software\other\[POINTS NQS  2012.XLS]Light Pro'!D12 -> 462 | M10: =IF('\\ser\Software\other\[POINTS NQS  2012.XLS]Light Pro'!E12=0," ",'\\ser\Software\other\[POINTS NQS  2012.XLS]Light Pro'!E12) -> Fear The Deere | N10: ='\\ser\Software\other\[POINTS NQS  2012.XLS]Light Pro'!AA12 -> 34
A11: ='\\ser\Software\other\[POINTS NQS  2012.XLS]Pro Outlaw'!A13 -> 7 | B11: ='\\ser\Software\other\[POINTS NQS  2012.XLS]Pro Outlaw'!B13 -> Steve Williford | C11: ='\\ser\Software\other\[POINTS NQS  2012.XLS]Pro Outlaw'!C13 -> Engelhard, NC | D11: ='\\ser\Software\other\[POINTS NQS  2012.XLS]Pro Outlaw'!D13 -> 276 | E11: =IF( '\\ser\Software\other\[POINTS NQS  2012.XLS]Pro Outlaw'!E13=0," ",'\\ser\Software\other\[POINTS NQS  2012.XLS]Pro Outlaw'!E13) -> IH Express | F11: ='\\ser\Software\other\[POINTS NQS  2012.XLS]Pro Outlaw'!AA13 -> 55 | I11: ='\\ser\Software\other\[POINTS NQS  2012.XLS]Light Pro'!A13 -> 9 | J11: ='\\ser\Software\other\[POINTS NQS  2012.XLS]Light Pro'!B13 -> Nick Ferguson | K11: ='\\ser\Software\other\[POINTS NQS  2012.XLS]Light Pro'!C13 -> Elkhorn, WI | L11: ='\\ser\Software\other\[POINTS NQS  2012.XLS]Light Pro'!D13 -> 100 | M11: =IF('\\ser\Software\other\[POINTS NQS  2012.XLS]Light Pro'!E13=0," ",'\\ser\Software\other\[POINTS NQS  2012.XLS]Light Pro'!E13) -> Raisin Cane | N11: ='\\ser\Software\other\[POINTS NQS  2012.XLS]Light Pro'!AA13 -> 37
A12: ='\\ser\Software\other\[POINTS NQS  2012.XLS]Pro Outlaw'!A14 -> 8 | B12: ='\\ser\Software\other\[POINTS NQS  2012.XLS]Pro Outlaw'!B14 -> Drew Burton | C12: ='\\ser\Software\other\[POINTS NQS  2012.XLS]Pro Outlaw'!C14 -> Brookston, IN | D12: ='\\ser\Software\other\[POINTS NQS  2012.XLS]Pro Outlaw'!D14 -> 15 | E12: =IF( '\\ser\Software\other\[POINTS NQS  2012.XLS]Pro Outlaw'!E14=0," ",'\\ser\Software\other\[POINTS NQS  2012.XLS]Pro Outlaw'!E14) -> Plain Nuts | F12: ='\\ser\Software\other\[POINTS NQS  2012.XLS]Pro Outlaw'!AA14 -> 68 | I12: ='\\ser\Software\other\[POINTS NQS  2012.XLS]Light Pro'!A14 -> 7 | J12: ='\\ser\Software\other\[POINTS NQS  2012.XLS]Light Pro'!B14 -> Scott Bye | K12: ='\\ser\Software\other\[POINTS NQS  2012.XLS]Light Pro'!C14 -> Savannah, MO | L12: ='\\ser\Software\other\[POINTS NQS  2012.XLS]Light Pro'!D14 -> 187 | M12: =IF('\\ser\Software\other\[POINTS NQS  2012.XLS]Light Pro'!E14=0," ",'\\ser\Software\other\[POINTS NQS  2012.XLS]Light Pro'!E14) -> Revved Up | N12: ='\\ser\Software\other\[POINTS NQS  2012.XLS]Light Pro'!AA14 -> 37
A13: ='\\ser\Software\other\[POINTS NQS  2012.XLS]Pro Outlaw'!A15 -> 9 | B13: ='\\ser\Software\other\[POINTS NQS  2012.XLS]Pro Outlaw'!B15 -> Lowell Vis | C13: ='\\ser\Software\other\[POINTS NQS  2012.XLS]Pro Outlaw'!C15 -> Waupun, WI | D13: ='\\ser\Software\other\[POINTS NQS  2012.XLS]Pro Outlaw'!D15 -> 333 | E13: =IF( '\\ser\Software\other\[POINTS NQS  2012.XLS]Pro Outlaw'!E15=0," ",'\\ser\Software\other\[POINTS NQS  2012.XLS]Pro Outlaw'!E15) -> Skittles | F13: ='\\ser\Software\other\[POINTS NQS  2012.XLS]Pro Outlaw'!AA15 -> 70 | I13: ='\\ser\Software\other\[POINTS NQS  2012.XLS]Light Pro'!A15 -> 8 | J13: ='\\ser\Software\other\[POINTS NQS  2012.XLS]Light Pro'!B15 -> Eli Yurkovich | K13: ='\\ser\Software\other\[POINTS NQS  2012.XLS]Light Pro'!C15 -> Prosperty, Pa | L13: ='\\ser\Software\other\[POINTS NQS  2012.XLS]Light Pro'!D15 -> 556 | M13: =IF('\\ser\Software\other\[POINTS NQS  2012.XLS]Light Pro'!E15=0," ",'\\ser\Software\other\[POINTS NQS  2012.XLS]Light Pro'!E15) -> Covered Bridge | N13: ='\\ser\Software\other\[POINTS NQS  2012.XLS]Light Pro'!AA15 -> 45
A14: ='\\ser\Software\other\[POINTS NQS  2012.XLS]Pro Outlaw'!A16 -> 10 | B14: ='\\ser\Software\other\[POINTS NQS  2012.XLS]Pro Outlaw'!B16 -> Christopher Wise | C14: ='\\ser\Software\other\[POINTS NQS  2012.XLS]Pro Outlaw'!C16 -> Greensburg, PA | D14: ='\\ser\Software\other\[POINTS NQS  2012.XLS]Pro Outlaw'!D16 -> 209 | E14: =IF( '\\ser\Software\other\[POINTS NQS  2012.XLS]Pro Outlaw'!E16=0," ",'\\ser\Software\other\[POINTS NQS  2012.XLS]Pro Outlaw'!E16) -> Longshot | F14: ='\\ser\Software\other\[POINTS NQS  2012.XLS]Pro Outlaw'!AA16 -> 74 | I14: ='\\ser\Software\other\[POINTS NQS  2012.XLS]Light Pro'!A16 -> 10 | J14: ='\\ser\Software\other\[POINTS NQS  2012.XLS]Light Pro'!B16 -> Scott Bye | K14: ='\\ser\Software\other\[POINTS NQS  2012.XLS]Light Pro'!C16 -> Savannah, MO | L14: ='\\ser\Software\other\[POINTS NQS  2012.XLS]Light Pro'!D16 -> 539 | M14: =IF('\\ser\Software\other\[POINTS NQS  2012.XLS]Light Pro'!E16=0," ",'\\ser\Software\other\[POINTS NQS  2012.XLS]Light Pro'!E16) -> Jacked Up | N14: ='\\ser\Software\other\[POINTS NQS  2012.XLS]Light Pro'!AA16 -> 54
A15: ='\\ser\Software\other\[POINTS NQS  2012.XLS]Pro Outlaw'!A17 -> 11 | B15: ='\\ser\Software\other\[POINTS NQS  2012.XLS]Pro Outlaw'!B17 -> Jim Hull | C15: ='\\ser\Software\other\[POINTS NQS  2012.XLS]Pro Outlaw'!C17 -> Brandon, WI | D15: ='\\ser\Software\other\[POINTS NQS  2012.XLS]Pro Outlaw'!D17 -> 334 | E15: =IF( '\\ser\Software\other\[POINTS NQS  2012.XLS]Pro Outlaw'!E17=0," ",'\\ser\Software\other\[POINTS NQS  2012.XLS]Pro Outlaw'!E17) -> Simply Irresistable | F15: ='\\ser\Software\other\[POINTS NQS  2012.XLS]Pro Outlaw'!AA17 -> 74 | I15: ='\\ser\Software\other\[POINTS NQS  2012.XLS]Light Pro'!A17 -> 11 | J15: ='\\ser\Software\other\[POINTS NQS  2012.XLS]Light Pro'!B17 -> Wesley Briant | K15: ='\\ser\Software\other\[POINTS NQS  2012.XLS]Light Pro'!C17 -> Washington, Pa | L15: ='\\ser\Software\other\[POINTS NQS  2012.XLS]Light Pro'!D17 -> 553 | M15: =IF('\\ser\Software\other\[POINTS NQS  2012.XLS]Light Pro'!E17=0," ",'\\ser\Software\other\[POINTS NQS  2012.XLS]Light Pro'!E17) -> Cub n Debt | N15: ='\\ser\Software\other\[POINTS NQS  2012.XLS]Light Pro'!AA17 -> 54
A16: ='\\ser\Software\other\[POINTS NQS  2012.XLS]Pro Outlaw'!A18 -> 12 | B16: ='\\ser\Software\other\[POINTS NQS  2012.XLS]Pro Outlaw'!B18 -> Cody Costa | C16: ='\\ser\Software\other\[POINTS NQS  2012.XLS]Pro Outlaw'!C18 -> Greencastle, PA | D16: ='\\ser\Software\other\[POINTS NQS  2012.XLS]Pro Outlaw'!D18 -> 397 | E16: =IF( '\\ser\Software\other\[POINTS NQS  2012.XLS]Pro Outlaw'!E18=0," ",'\\ser\Software\other\[POINTS NQS  2012.XLS]Pro Outlaw'!E18) -> Crossthreaded | F16: ='\\ser\Software\other\[POINTS NQS  2012.XLS]Pro Outlaw'!AA18 -> 76 | I16: ='\\ser\Software\other\[POINTS NQS  2012.XLS]Light Pro'!A18 -> 12 | J16: ='\\ser\Software\other\[POINTS NQS  2012.XLS]Light Pro'!B18 -> Bob Jones Sr | K16: ='\\ser\Software\other\[POINTS NQS  2012.XLS]Light Pro'!C18 -> Hopewell, Oh | L16: ='\\ser\Software\other\[POINTS NQS  2012.XLS]Light Pro'!D18 -> 182 | M16: =IF('\\ser\Software\other\[POINTS NQS  2012.XLS]Light Pro'!E18=0," ",'\\ser\Software\other\[POINTS NQS  2012.XLS]Light Pro'!E18) -> Buckeye Binder | N16: ='\\ser\Software\other\[POINTS NQS  2012.XLS]Light Pro'!AA18 -> 56
A17: ='\\ser\Software\other\[POINTS NQS  2012.XLS]Pro Outlaw'!A19 -> 13 | B17: ='\\ser\Software\other\[POINTS NQS  2012.XLS]Pro Outlaw'!B19 -> Matt Kaster | C17: ='\\ser\Software\other\[POINTS NQS  2012.XLS]Pro Outlaw'!C19 -> Burlington, WI | D17: ='\\ser\Software\other\[POINTS NQS  2012.XLS]Pro Outlaw'!D19 -> 99 | E17: =IF( '\\ser\Software\other\[POINTS NQS  2012.XLS]Pro Outlaw'!E19=0," ",'\\ser\Software\other\[POINTS NQS  2012.XLS]Pro Outlaw'!E19) -> Sound of Madness | F17: ='\\ser\Software\other\[POINTS NQS  2012.XLS]Pro Outlaw'!AA19 -> 112 | I17: ='\\ser\Software\other\[POINTS NQS  2012.XLS]Light Pro'!A19 -> 13 | J17: ='\\ser\Software\other\[POINTS NQS  2012.XLS]Light Pro'!B19 -> Billy Black | K17: ='\\ser\Software\other\[POINTS NQS  2012.XLS]Light Pro'!C19 -> Dry Ridge, Ky | L17: ='\\ser\Software\other\[POINTS NQS  2012.XLS]Light Pro'!D19 -> 567 | M17: =IF('\\ser\Software\other\[POINTS NQS  2012.XLS]Light Pro'!E19=0," ",'\\ser\Software\other\[POINTS NQS  2012.XLS]Light Pro'!E19) -> Dry Ridge, Ky | N17: ='\\ser\Software\other\[POINTS NQS  2012.XLS]Light Pro'!AA19 -> 59
A18: ='\\ser\Software\other\[POINTS NQS  2012.XLS]Pro Outlaw'!A20 -> 14 | B18: ='\\ser\Software\other\[POINTS NQS  2012.XLS]Pro Outlaw'!B20 -> Don Vogt | C18: ='\\ser\Software\other\[POINTS NQS  2012.XLS]Pro Outlaw'!C20 -> Campbellsport, WI | D18: ='\\ser\Software\other\[POINTS NQS  2012.XLS]Pro Outlaw'!D20 -> 90 | E18: =IF( '\\ser\Software\other\[POINTS NQS  2012.XLS]Pro Outlaw'!E20=0," ",'\\ser\Software\other\[POINTS NQS  2012.XLS]Pro Outlaw'!E20) -> Not A Nuff | F18: ='\\ser\Software\other\[POINTS NQS  2012.XLS]Pro Outlaw'!AA20 -> 116 | I18: ='\\ser\Software\other\[POINTS NQS  2012.XLS]Light Pro'!A20 -> 29 | J18: ='\\ser\Software\other\[POINTS NQS  2012.XLS]Light Pro'!B20 -> Julian Stahl | K18: ='\\ser\Software\other\[POINTS NQS  2012.XLS]Light Pro'!C20 -> Welton, Ia | L18: ='\\ser\Software\other\[POINTS NQS  2012.XLS]Light Pro'!D20 -> 1 | M18: =IF('\\ser\Software\other\[POINTS NQS  2012.XLS]Light Pro'!E20=0," ",'\\ser\Software\other\[POINTS NQS  2012.XLS]Light Pro'!E20) -> MWSC#1 | N18: ='\\ser\Software\other\[POINTS NQS  2012.XLS]Light Pro'!AA20 -> 78
A19: ='\\ser\Software\other\[POINTS NQS  2012.XLS]Pro Outlaw'!A21 -> 15 | B19: ='\\ser\Software\other\[POINTS NQS  2012.XLS]Pro Outlaw'!B21 -> Kenny Cornelison | C19: ='\\ser\Software\other\[POINTS NQS  2012.XLS]Pro Outlaw'!C21 -> Richmond, KY | D19: ='\\ser\Software\other\[POINTS NQS  2012.XLS]Pro Outlaw'!D21 -> 149 | E19: =IF( '\\ser\Software\other\[POINTS NQS  2012.XLS]Pro Outlaw'!E21=0," ",'\\ser\Software\other\[POINTS NQS  2012.XLS]Pro Outlaw'!E21) -> Storm Alert | F19: ='\\ser\Software\other\[POINTS NQS  2012.XLS]Pro Outlaw'!AA21 -> 135 | I19: ='\\ser\Software\other\[POINTS NQS  2012.XLS]Light Pro'!A21 -> 14 | J19: ='\\ser\Software\other\[POINTS NQS  2012.XLS]Light Pro'!B21 -> Pat Roth | K19: ='\\ser\Software\other\[POINTS NQS  2012.XLS]Light Pro'!C21 -> Idaville, ind | L19: ='\\ser\Software\other\[POINTS NQS  2012.XLS]Light Pro'!D21 -> 450 | M19: =IF('\\ser\Software\other\[POINTS NQS  2012.XLS]Light Pro'!E21=0," ",'\\ser\Software\other\[POINTS NQS  2012.XLS]Light Pro'!E21) -> Alcohol Abuse | N19: ='\\ser\Software\other\[POINTS NQS  2012.XLS]Light Pro'!AA21 -> 78
A20: ='\\ser\Software\other\[POINTS NQS  2012.XLS]Pro Outlaw'!A22 -> 16 | B20: ='\\ser\Software\other\[POINTS NQS  2012.XLS]Pro Outlaw'!B22 -> Harrison Stahl | C20: ='\\ser\Software\other\[POINTS NQS  2012.XLS]Pro Outlaw'!C22 -> Dewitt, IA | D20: ='\\ser\Software\other\[POINTS NQS  2012.XLS]Pro Outlaw'!D22 -> 336 | E20: =IF( '\\ser\Software\other\[POINTS NQS  2012.XLS]Pro Outlaw'!E22=0," ",'\\ser\Software\other\[POINTS NQS  2012.XLS]Pro Outlaw'!E22) -> MWSC#4 | F20: ='\\ser\Software\other\[POINTS NQS  2012.XLS]Pro Outlaw'!AA22 -> 150 | I20: ='\\ser\Software\other\[POINTS NQS  2012.XLS]Light Pro'!A22 -> 15 | J20: ='\\ser\Software\other\[POINTS NQS  2012.XLS]Light Pro'!B22 -> Chris Gegg | K20: ='\\ser\Software\other\[POINTS NQS  2012.XLS]Light Pro'!C22 -> Greeneville, IL | L20: ='\\ser\Software\other\[POINTS NQS  2012.XLS]Light Pro'!D22 -> 410 | M20: =IF('\\ser\Software\other\[POINTS NQS  2012.XLS]Light Pro'!E22=0," ",'\\ser\Software\other\[POINTS NQS  2012.XLS]Light Pro'!E22) -> Insane | N20: ='\\ser\Software\other\[POINTS NQS  2012.XLS]Light Pro'!AA22 -> 83
A21: ='\\ser\Software\other\[POINTS NQS  2012.XLS]Pro Outlaw'!A23 -> 17 | B21: ='\\ser\Software\other\[POINTS NQS  2012.XLS]Pro Outlaw'!B23 -> Nick Mischler | C21: ='\\ser\Software\other\[POINTS NQS  2012.XLS]Pro Outlaw'!C23 -> Deer Creek, IL | D21: ='\\ser\Software\other\[POINTS NQS  2012.XLS]Pro Outlaw'!D23 -> 167 | E21: =IF( '\\ser\Software\other\[POINTS NQS  2012.XLS]Pro Outlaw'!E23=0," ",'\\ser\Software\other\[POINTS NQS  2012.XLS]Pro Outlaw'!E23) -> Pulse | F21: ='\\ser\Software\other\[POINTS NQS  2012.XLS]Pro Outlaw'!AA23 -> 154 | I21: ='\\ser\Software\other\[POINTS NQS  2012.XLS]Light Pro'!A23 -> 16 | J21: ='\\ser\Software\other\[POINTS NQS  2012.XLS]Light Pro'!B23 -> Keith Frueh | K21: ='\\ser\Software\other\[POINTS NQS  2012.XLS]Light Pro'!C23 -> Greenville, Ill | L21: ='\\ser\Software\other\[POINTS NQS  2012.XLS]Light Pro'!D23 -> 453 | M21: =IF('\\ser\Software\other\[POINTS NQS  2012.XLS]Light Pro'!E23=0," ",'\\ser\Software\other\[POINTS NQS  2012.XLS]Light Pro'!E23) -> Haulin Harvester | N21: ='\\ser\Software\other\[POINTS NQS  2012.XLS]Light Pro'!AA23 -> 83
A22: ='\\ser\Software\other\[POINTS NQS  2012.XLS]Pro Outlaw'!A24 -> 18 | B22: ='\\ser\Software\other\[POINTS NQS  2012.XLS]Pro Outlaw'!B24 -> David Knapp | C22: ='\\ser\Software\other\[POINTS NQS  2012.XLS]Pro Outlaw'!C24 -> Hennepin, IL | D22: ='\\ser\Software\other\[POINTS NQS  2012.XLS]Pro Outlaw'!D24 -> 381 | E22: =IF( '\\ser\Software\other\[POINTS NQS  2012.XLS]Pro Outlaw'!E24=0," ",'\\ser\Software\other\[POINTS NQS  2012.XLS]Pro Outlaw'!E24) -> Knapp Time | F22: ='\\ser\Software\other\[POINTS NQS  2012.XLS]Pro Outlaw'!AA24 -> 167 | I22: ='\\ser\Software\other\[POINTS NQS  2012.XLS]Light Pro'!A24 -> 17 | J22: ='\\ser\Software\other\[POINTS NQS  2012.XLS]Light Pro'!B24 -> Bob Cooper | K22: ='\\ser\Software\other\[POINTS NQS  2012.XLS]Light Pro'!C24 -> Westminster, Md | L22: ='\\ser\Software\other\[POINTS NQS  2012.XLS]Light Pro'!D24 -> 522 | M22: =IF('\\ser\Software\other\[POINTS NQS  2012.XLS]Light Pro'!E24=0," ",'\\ser\Software\other\[POINTS NQS  2012.XLS]Light Pro'!E24) -> Just Business | N22: ='\\ser\Software\other\[POINTS NQS  2012.XLS]Light Pro'!AA24 -> 83
A23: ='\\ser\Software\other\[POINTS NQS  2012.XLS]Pro Outlaw'!A25 -> 19 | B23: ='\\ser\Software\other\[POINTS NQS  2012.XLS]Pro Outlaw'!B25 -> Bradley Corzine | C23: ='\\ser\Software\other\[POINTS NQS  2012.XLS]Pro Outlaw'!C25 -> Dongola, IL | D23: ='\\ser\Software\other\[POINTS NQS  2012.XLS]Pro Outlaw'!D25 -> 509 | E23: =IF( '\\ser\Software\other\[POINTS NQS  2012.XLS]Pro Outlaw'!E25=0," ",'\\ser\Software\other\[POINTS NQS  2012.XLS]Pro Outlaw'!E25) -> Just Black | F23: ='\\ser\Software\other\[POINTS NQS  2012.XLS]Pro Outlaw'!AA25 -> 176 | I23: ='\\ser\Software\other\[POINTS NQS  2012.XLS]Light Pro'!A25 -> 18 | J23: ='\\ser\Software\other\[POINTS NQS  2012.XLS]Light Pro'!B25 -> Jim Waite | K23: ='\\ser\Software\other\[POINTS NQS  2012.XLS]Light Pro'!C25 -> Hopkinton, RI | L23: ='\\ser\Software\other\[POINTS NQS  2012.XLS]Light Pro'!D25 -> 562 | M23: =IF('\\ser\Software\other\[POINTS NQS  2012.XLS]Light Pro'!E25=0," ",'\\ser\Software\other\[POINTS NQS  2012.XLS]Light Pro'!E25) -> Wacky Five | N23: ='\\ser\Software\other\[POINTS NQS  2012.XLS]Light Pro'!AA25 -> 83
A24: ='\\ser\Software\other\[POINTS NQS  2012.XLS]Pro Outlaw'!A26 -> 20 | B24: ='\\ser\Software\other\[POINTS NQS  2012.XLS]Pro Outlaw'!B26 -> Kenny Cornelison | C24: ='\\ser\Software\other\[POINTS NQS  2012.XLS]Pro Outlaw'!C26 -> Richmond, KY | D24: ='\\ser\Software\other\[POINTS NQS  2012.XLS]Pro Outlaw'!D26 -> 536 | E24: =IF( '\\ser\Software\other\[POINTS NQS  2012.XLS]Pro Outlaw'!E26=0," ",'\\ser\Software\other\[POINTS NQS  2012.XLS]Pro Outlaw'!E26) -> Storm X | F24: ='\\ser\Software\other\[POINTS NQS  2012.XLS]Pro Outlaw'!AA26 -> 187 | I24: ='\\ser\Software\other\[POINTS NQS  2012.XLS]Light Pro'!A26 -> 19 | J24: ='\\ser\Software\other\[POINTS NQS  2012.XLS]Light Pro'!B26 -> Dave Wise | K24: ='\\ser\Software\other\[POINTS NQS  2012.XLS]Light Pro'!C26 -> New Stanton, Pa | L24: ='\\ser\Software\other\[POINTS NQS  2012.XLS]Light Pro'!D26 -> 403 | M24: =IF('\\ser\Software\other\[POINTS NQS  2012.XLS]Light Pro'!E26=0," ",'\\ser\Software\other\[POINTS NQS  2012.XLS]Light Pro'!E26) ->  | N24: ='\\ser\Software\other\[POINTS NQS  2012.XLS]Light Pro'!AA26 -> 84
A25: ='\\ser\Software\other\[POINTS NQS  2012.XLS]Pro Outlaw'!A27 -> 21 | B25: ='\\ser\Software\other\[POINTS NQS  2012.XLS]Pro Outlaw'!B27 -> Scott Bye | C25: ='\\ser\Software\other\[POINTS NQS  2012.XLS]Pro Outlaw'!C27 -> Savannah, Mo | D25: ='\\ser\Software\other\[POINTS NQS  2012.XLS]Pro Outlaw'!D27 -> 365 | E25: =IF( '\\ser\Software\other\[POINTS NQS  2012.XLS]Pro Outlaw'!E27=0," ",'\\ser\Software\other\[POINTS NQS  2012.XLS]Pro Outlaw'!E27) -> Fired Up | F25: ='\\ser\Software\other\[POINTS NQS  2012.XLS]Pro Outlaw'!AA27 -> 201 | I25: ='\\ser\Software\other\[POINTS NQS  2012.XLS]Light Pro'!A27 -> 20 | J25: ='\\ser\Software\other\[POINTS NQS  2012.XLS]Light Pro'!B27 -> Aaron Scroggins | K25: ='\\ser\Software\other\[POINTS NQS  2012.XLS]Light Pro'!C27 -> Neosho, MO | L25: ='\\ser\Software\other\[POINTS NQS  2012.XLS]Light Pro'!D27 -> 419 | M25: =IF('\\ser\Software\other\[POINTS NQS  2012.XLS]Light Pro'!E27=0," ",'\\ser\Software\other\[POINTS NQS  2012.XLS]Light Pro'!E27) -> Gambler | N25: ='\\ser\Software\other\[POINTS NQS  2012.XLS]Light Pro'!AA27 -> 84
A26: ='\\ser\Software\other\[POINTS NQS  2012.XLS]Pro Outlaw'!A28 -> 22 | B26: ='\\ser\Software\other\[POINTS NQS  2012.XLS]Pro Outlaw'!B28 -> Doug Diehl | C26: ='\\ser\Software\other\[POINTS NQS  2012.XLS]Pro Outlaw'!C28 -> Smithsburg, Md | D26: ='\\ser\Software\other\[POINTS NQS  2012.XLS]Pro Outlaw'!D28 -> 440 | E26: =IF( '\\ser\Software\other\[POINTS NQS  2012.XLS]Pro Outlaw'!E28=0," ",'\\ser\Software\other\[POINTS NQS  2012.XLS]Pro Outlaw'!E28) -> 1 Bad MF | F26: ='\\ser\Software\other\[POINTS NQS  2012.XLS]Pro Outlaw'!AA28 -> 211 | I26: ='\\ser\Software\other\[POINTS NQS  2012.XLS]Light Pro'!A28 -> 21 | J26: ='\\ser\Software\other\[POINTS NQS  2012.XLS]Light Pro'!B28 -> Neven Stitzer | K26: ='\\ser\Software\other\[POINTS NQS  2012.XLS]Light Pro'!C28 -> Spring Mills, Pa | L26: ='\\ser\Software\other\[POINTS NQS  2012.XLS]Light Pro'!D28 -> 448 | M26: =IF('\\ser\Software\other\[POINTS NQS  2012.XLS]Light Pro'!E28=0," ",'\\ser\Software\other\[POINTS NQS  2012.XLS]Light Pro'!E28) -> Thunder Road I | N26: ='\\ser\Software\other\[POINTS NQS  2012.XLS]Light Pro'!AA28 -> 86
A27: ='\\ser\Software\other\[POINTS NQS  2012.XLS]Pro Outlaw'!A29 -> 23 | B27: ='\\ser\Software\other\[POINTS NQS  2012.XLS]Pro Outlaw'!B29 -> Julian Stahl | C27: ='\\ser\Software\other\[POINTS NQS  2012.XLS]Pro Outlaw'!C29 -> Welton, IA | D27: ='\\ser\Software\other\[POINTS NQS  2012.XLS]Pro Outlaw'!D29 -> 1 | E27: =IF( '\\ser\Software\other\[POINTS NQS  2012.XLS]Pro Outlaw'!E29=0," ",'\\ser\Software\other\[POINTS NQS  2012.XLS]Pro Outlaw'!E29) -> MWSC#1 | F27: ='\\ser\Software\other\[POINTS NQS  2012.XLS]Pro Outlaw'!AA29 -> 212 | I27: ='\\ser\Software\other\[POINTS NQS  2012.XLS]Light Pro'!A29 -> 22 | J27: ='\\ser\Software\other\[POINTS NQS  2012.XLS]Light Pro'!B29 -> Annette Sullivan | K27: ='\\ser\Software\other\[POINTS NQS  2012.XLS]Light Pro'!C29 -> Welton, IA | L27: ='\\ser\Software\other\[POINTS NQS  2012.XLS]Light Pro'!D29 -> 576 | M27: =IF('\\ser\Software\other\[POINTS NQS  2012.XLS]Light Pro'!E29=0," ",'\\ser\Software\other\[POINTS NQS  2012.XLS]Light Pro'!E29) -> Ani't Playin Fair | N27: ='\\ser\Software\other\[POINTS NQS  2012.XLS]Light Pro'!AA29 -> 87
A28: ='\\ser\Software\other\[POINTS NQS  2012.XLS]Pro Outlaw'!A30 -> 24 | B28: ='\\ser\Software\other\[POINTS NQS  2012.XLS]Pro Outlaw'!B30 -> Larry Fox | C28: ='\\ser\Software\other\[POINTS NQS  2012.XLS]Pro Outlaw'!C30 -> Etna, Oh | D28: ='\\ser\Software\other\[POINTS NQS  2012.XLS]Pro Outlaw'!D30 -> 7 | E28: =IF( '\\ser\Software\other\[POINTS NQS  2012.XLS]Pro Outlaw'!E30=0," ",'\\ser\Software\other\[POINTS NQS  2012.XLS]Pro Outlaw'!E30) -> Intimidation | F28: ='\\ser\Software\other\[POINTS NQS  2012.XLS]Pro Outlaw'!AA30 -> 212 | I28: ='\\ser\Software\other\[POINTS NQS  2012.XLS]Light Pro'!A30 -> 23 | J28: ='\\ser\Software\other\[POINTS NQS  2012.XLS]Light Pro'!B30 -> Caleb Peters | K28: ='\\ser\Software\other\[POINTS NQS  2012.XLS]Light Pro'!C30 -> Kankakee, IL | L28: ='\\ser\Software\other\[POINTS NQS  2012.XLS]Light Pro'!D30 -> 584 | M28: =IF('\\ser\Software\other\[POINTS NQS  2012.XLS]Light Pro'!E30=0," ",'\\ser\Software\other\[POINTS NQS  2012.XLS]Light Pro'!E30) -> Shake,Rattle, & Roll | N28: ='\\ser\Software\other\[POINTS NQS  2012.XLS]Light Pro'!AA30 -> 88
A29: ='\\ser\Software\other\[POINTS NQS  2012.XLS]Pro Outlaw'!A31 -> 25 | B29: ='\\ser\Software\other\[POINTS NQS  2012.XLS]Pro Outlaw'!B31 -> Ryan Richter | C29: ='\\ser\Software\other\[POINTS NQS  2012.XLS]Pro Outlaw'!C31 -> Connellsville, PA | D29: ='\\ser\Software\other\[POINTS NQS  2012.XLS]Pro Outlaw'!D31 -> 502 | E29: =IF( '\\ser\Software\other\[POINTS NQS  2012.XLS]Pro Outlaw'!E31=0," ",'\\ser\Software\other\[POINTS NQS  2012.XLS]Pro Outlaw'!E31) -> Radical Rat | F29: ='\\ser\Software\other\[POINTS NQS  2012.XLS]Pro Outlaw'!AA31 -> 213 | I29: ='\\ser\Software\other\[POINTS NQS  2012.XLS]Light Pro'!A31 -> 24 | J29: ='\\ser\Software\other\[POINTS NQS  2012.XLS]Light Pro'!B31 -> Bob Jones Jr | K29: ='\\ser\Software\other\[POINTS NQS  2012.XLS]Light Pro'!C31 -> Dresden, Oh | L29: ='\\ser\Software\other\[POINTS NQS  2012.XLS]Light Pro'!D31 -> 183 | M29: =IF('\\ser\Software\other\[POINTS NQS  2012.XLS]Light Pro'!E31=0," ",'\\ser\Software\other\[POINTS NQS  2012.XLS]Light Pro'!E31) -> Playdough | N29: ='\\ser\Software\other\[POINTS NQS  2012.XLS]Light Pro'!AA31 -> 89
A30: ='\\ser\Software\other\[POINTS NQS  2012.XLS]Pro Outlaw'!A32 -> 26 | B30: ='\\ser\Software\other\[POINTS NQS  2012.XLS]Pro Outlaw'!B32 -> Mike Spencer | C30: ='\\ser\Software\other\[POINTS NQS  2012.XLS]Pro Outlaw'!C32 -> Weest Alex, OH | D30: ='\\ser\Software\other\[POINTS NQS  2012.XLS]Pro Outlaw'!D32 -> 278 | E30: =IF( '\\ser\Software\other\[POINTS NQS  2012.XLS]Pro Outlaw'!E32=0," ",'\\ser\Software\other\[POINTS NQS  2012.XLS]Pro Outlaw'!E32) -> Longshot | F30: ='\\ser\Software\other\[POINTS NQS  2012.XLS]Pro Outlaw'!AA32 -> 223 | I30: ='\\ser\Software\other\[POINTS NQS  2012.XLS]Light Pro'!A32 -> 25 | J30: ='\\ser\Software\other\[POINTS NQS  2012.XLS]Light Pro'!B32 -> Stephanie Locke | K30: ='\\ser\Software\other\[POINTS NQS  2012.XLS]Light Pro'!C32 -> Ialand Lake, IL | L30: ='\\ser\Software\other\[POINTS NQS  2012.XLS]Light Pro'!D32 -> 592 | M30: =IF('\\ser\Software\other\[POINTS NQS  2012.XLS]Light Pro'!E32=0," ",'\\ser\Software\other\[POINTS NQS  2012.XLS]Light Pro'!E32) -> Tyrant II | N30: ='\\ser\Software\other\[POINTS NQS  2012.XLS]Light Pro'!AA32 -> 89
A31: ='\\ser\Software\other\[POINTS NQS  2012.XLS]Pro Outlaw'!A33 -> 27 | B31: ='\\ser\Software\other\[POINTS NQS  2012.XLS]Pro Outlaw'!B33 -> David Mascher JR | C31: ='\\ser\Software\other\[POINTS NQS  2012.XLS]Pro Outlaw'!C33 -> Beech Grove, IN | D31: ='\\ser\Software\other\[POINTS NQS  2012.XLS]Pro Outlaw'!D33 -> 163 | E31: =IF( '\\ser\Software\other\[POINTS NQS  2012.XLS]Pro Outlaw'!E33=0," ",'\\ser\Software\other\[POINTS NQS  2012.XLS]Pro Outlaw'!E33) -> Thunder Pumpkin | F31: ='\\ser\Software\other\[POINTS NQS  2012.XLS]Pro Outlaw'!AA33 -> 226 | I31: ='\\ser\Software\other\[POINTS NQS  2012.XLS]Light Pro'!A33 -> 26 | J31: ='\\ser\Software\other\[POINTS NQS  2012.XLS]Light Pro'!B33 -> Doug Waugh | K31: ='\\ser\Software\other\[POINTS NQS  2012.XLS]Light Pro'!C33 -> King City, Mo | L31: ='\\ser\Software\other\[POINTS NQS  2012.XLS]Light Pro'!D33 -> 464 | M31: =IF('\\ser\Software\other\[POINTS NQS  2012.XLS]Light Pro'!E33=0," ",'\\ser\Software\other\[POINTS NQS  2012.XLS]Light Pro'!E33) -> King City, Mo | N31: ='\\ser\Software\other\[POINTS NQS  2012.XLS]Light Pro'!AA33 -> 90
A32: ='\\ser\Software\other\[POINTS NQS  2012.XLS]Pro Outlaw'!A34 -> 28 | B32: ='\\ser\Software\other\[POINTS NQS  2012.XLS]Pro Outlaw'!B34 -> Dan Schell | C32: ='\\ser\Software\other\[POINTS NQS  2012.XLS]Pro Outlaw'!C34 -> Darien, WI | D32: ='\\ser\Software\other\[POINTS NQS  2012.XLS]Pro Outlaw'!D34 -> 375 | E32: =IF( '\\ser\Software\other\[POINTS NQS  2012.XLS]Pro Outlaw'!E34=0," ",'\\ser\Software\other\[POINTS NQS  2012.XLS]Pro Outlaw'!E34) -> Blind Ambition | F32: ='\\ser\Software\other\[POINTS NQS  2012.XLS]Pro Outlaw'!AA34 -> 226 | I32: ='\\ser\Software\other\[POINTS NQS  2012.XLS]Light Pro'!A34 -> 27 | J32: ='\\ser\Software\other\[POINTS NQS  2012.XLS]Light Pro'!B34 -> Alex Thomas | K32: ='\\ser\Software\other\[POINTS NQS  2012.XLS]Light Pro'!C34 -> Apex, NC | L32: ='\\ser\Software\other\[POINTS NQS  2012.XLS]Light Pro'!D34 -> 0 | M32: =IF('\\ser\Software\other\[POINTS NQS  2012.XLS]Light Pro'!E34=0," ",'\\ser\Software\other\[POINTS NQS  2012.XLS]Light Pro'!E34) -> Copper Head | N32: ='\\ser\Software\other\[POINTS NQS  2012.XLS]Light Pro'!AA34 -> 90
A33: ='\\ser\Software\other\[POINTS NQS  2012.XLS]Pro Outlaw'!A35 -> 29 | B33: ='\\ser\Software\other\[POINTS NQS  2012.XLS]Pro Outlaw'!B35 -> Dave Gawatz | C33: ='\\ser\Software\other\[POINTS NQS  2012.XLS]Pro Outlaw'!C35 -> St. Joseph, MO | D33: ='\\ser\Software\other\[POINTS NQS  2012.XLS]Pro Outlaw'!D35 -> 367 | E33: =IF( '\\ser\Software\other\[POINTS NQS  2012.XLS]Pro Outlaw'!E35=0," ",'\\ser\Software\other\[POINTS NQS  2012.XLS]Pro Outlaw'!E35) -> Lil' Sprout | F33: ='\\ser\Software\other\[POINTS NQS  2012.XLS]Pro Outlaw'!AA35 -> 227 | I33: ='\\ser\Software\other\[POINTS NQS  2012.XLS]Light Pro'!A35 -> 28 | J33: ='\\ser\Software\other\[POINTS NQS  2012.XLS]Light Pro'!B35 -> Bud Casale | K33: ='\\ser\Software\other\[POINTS NQS  2012.XLS]Light Pro'!C35 -> New Castle, Pa | L33: ='\\ser\Software\other\[POINTS NQS  2012.XLS]Light Pro'!D35 -> 535 | M33: =IF('\\ser\Software\other\[POINTS NQS  2012.XLS]Light Pro'!E35=0," ",'\\ser\Software\other\[POINTS NQS  2012.XLS]Light Pro'!E35) -> Stanton, Pa | N33: ='\\ser\Software\other\[POINTS NQS  2012.XLS]Light Pro'!AA35 -> 91
A34: ='\\ser\Software\other\[POINTS NQS  2012.XLS]Pro Outlaw'!A36 -> 30 | B34: ='\\ser\Software\other\[POINTS NQS  2012.XLS]Pro Outlaw'!B36 -> Mike Kyle | C34: ='\\ser\Software\other\[POINTS NQS  2012.XLS]Pro Outlaw'!C36 -> Edinburgh, IN | D34: ='\\ser\Software\other\[POINTS NQS  2012.XLS]Pro Outlaw'!D36 -> 394 | E34: =IF( '\\ser\Software\other\[POINTS NQS  2012.XLS]Pro Outlaw'!E36=0," ",'\\ser\Software\other\[POINTS NQS  2012.XLS]Pro Outlaw'!E36) ->  | F34: ='\\ser\Software\other\[POINTS NQS  2012.XLS]Pro Outlaw'!AA36 -> 233 | I34: ='\\ser\Software\other\[POINTS NQS  2012.XLS]Light Pro'!A36 -> 30 | J34: ='\\ser\Software\other\[POINTS NQS  2012.XLS]Light Pro'!B36 -> Austin Yurkovich | K34: ='\\ser\Software\other\[POINTS NQS  2012.XLS]Light Pro'!C36 -> Prosperty, Pa | L34: ='\\ser\Software\other\[POINTS NQS  2012.XLS]Light Pro'!D36 -> 557 | M34: =IF('\\ser\Software\other\[POINTS NQS  2012.XLS]Light Pro'!E36=0," ",'\\ser\Software\other\[POINTS NQS  2012.XLS]Light Pro'!E36) -> Sled Stretcher | N34: ='\\ser\Software\other\[POINTS NQS  2012.XLS]Light Pro'!AA36 -> 93
A35: ='\\ser\Software\other\[POINTS NQS  2012.XLS]Pro Outlaw'!A37 -> 31 | B35: ='\\ser\Software\other\[POINTS NQS  2012.XLS]Pro Outlaw'!B37 -> Eric Varner | C35: ='\\ser\Software\other\[POINTS NQS  2012.XLS]Pro Outlaw'!C37 -> Versailles, KY | D35: ='\\ser\Software\other\[POINTS NQS  2012.XLS]Pro Outlaw'!D37 -> 482 | E35: =IF( '\\ser\Software\other\[POINTS NQS  2012.XLS]Pro Outlaw'!E37=0," ",'\\ser\Software\other\[POINTS NQS  2012.XLS]Pro Outlaw'!E37) -> Extreme Addiction | F35: ='\\ser\Software\other\[POINTS NQS  2012.XLS]Pro Outlaw'!AA37 -> 233 | I35: ='\\ser\Software\other\[POINTS NQS  2012.XLS]Light Pro'!A37 -> 31 | J35: ='\\ser\Software\other\[POINTS NQS  2012.XLS]Light Pro'!B37 -> Larry Frederick | K35: ='\\ser\Software\other\[POINTS NQS  2012.XLS]Light Pro'!C37 -> New Castle, Pa | L35: ='\\ser\Software\other\[POINTS NQS  2012.XLS]Light Pro'!D37 -> 526 | M35: =IF('\\ser\Software\other\[POINTS NQS  2012.XLS]Light Pro'!E37=0," ",'\\ser\Software\other\[POINTS NQS  2012.XLS]Light Pro'!E37) -> Burnin U2 | N35: ='\\ser\Software\other\[POINTS NQS  2012.XLS]Light Pro'!AA37 -> 94
A36: ='\\ser\Software\other\[POINTS NQS  2012.XLS]Pro Outlaw'!A38 -> 32 | B36: ='\\ser\Software\other\[POINTS NQS  2012.XLS]Pro Outlaw'!B38 -> Michael Ciolino | C36: ='\\ser\Software\other\[POINTS NQS  2012.XLS]Pro Outlaw'!C38 -> Peoria, IL | D36: ='\\ser\Software\other\[POINTS NQS  2012.XLS]Pro Outlaw'!D38 -> 146 | E36: =IF( '\\ser\Software\other\[POINTS NQS  2012.XLS]Pro Outlaw'!E38=0," ",'\\ser\Software\other\[POINTS NQS  2012.XLS]Pro Outlaw'!E38) -> Mechanical Animal | F36: ='\\ser\Software\other\[POINTS NQS  2012.XLS]Pro Outlaw'!AA38 -> 242
A37: ='\\ser\Software\other\[POINTS NQS  2012.XLS]Pro Outlaw'!A39 -> 33 | B37: ='\\ser\Software\other\[POINTS NQS  2012.XLS]Pro Outlaw'!B39 -> Nathan Nichols | C37: ='\\ser\Software\other\[POINTS NQS  2012.XLS]Pro Outlaw'!C39 -> Lawrenceburg, Ky | D37: ='\\ser\Software\other\[POINTS NQS  2012.XLS]Pro Outlaw'!D39 -> 151 | E37: =IF( '\\ser\Software\other\[POINTS NQS  2012.XLS]Pro Outlaw'!E39=0," ",'\\ser\Software\other\[POINTS NQS  2012.XLS]Pro Outlaw'!E39) -> Wild Streak | F37: ='\\ser\Software\other\[POINTS NQS  2012.XLS]Pro Outlaw'!AA39 -> 242
A38: ='\\ser\Software\other\[POINTS NQS  2012.XLS]Pro Outlaw'!A40 -> 34 | B38: ='\\ser\Software\other\[POINTS NQS  2012.XLS]Pro Outlaw'!B40 -> Annette Sullivan | C38: ='\\ser\Software\other\[POINTS NQS  2012.XLS]Pro Outlaw'!C40 -> Welton, IA | D38: ='\\ser\Software\other\[POINTS NQS  2012.XLS]Pro Outlaw'!D40 -> 571 | E38: =IF( '\\ser\Software\other\[POINTS NQS  2012.XLS]Pro Outlaw'!E40=0," ",'\\ser\Software\other\[POINTS NQS  2012.XLS]Pro Outlaw'!E40) -> Just Relax | F38: ='\\ser\Software\other\[POINTS NQS  2012.XLS]Pro Outlaw'!AA40 -> 242 | J38: Lite Outlaw | N38: Thru Peoria
A39: ='\\ser\Software\other\[POINTS NQS  2012.XLS]Pro Outlaw'!A41 -> 35 | B39: ='\\ser\Software\other\[POINTS NQS  2012.XLS]Pro Outlaw'!B41 -> Aaron Scroggins | C39: ='\\ser\Software\other\[POINTS NQS  2012.XLS]Pro Outlaw'!C41 -> Neosho, OH | D39: ='\\ser\Software\other\[POINTS NQS  2012.XLS]Pro Outlaw'!D41 -> 111 | E39: =IF( '\\ser\Software\other\[POINTS NQS  2012.XLS]Pro Outlaw'!E41=0," ",'\\ser\Software\other\[POINTS NQS  2012.XLS]Pro Outlaw'!E41) -> Blackout | F39: ='\\ser\Software\other\[POINTS NQS  2012.XLS]Pro Outlaw'!AA41 -> 243 | J39: Name | K39: City/State | L39: NQS # | M39: Tractor | N39: Points Back
A40: ='\\ser\Software\other\[POINTS NQS  2012.XLS]Pro Outlaw'!A42 -> 36 | B40: ='\\ser\Software\other\[POINTS NQS  2012.XLS]Pro Outlaw'!B42 -> Jeff Chrisman | C40: ='\\ser\Software\other\[POINTS NQS  2012.XLS]Pro Outlaw'!C42 -> Edinburgh, IN | D40: ='\\ser\Software\other\[POINTS NQS  2012.XLS]Pro Outlaw'!D42 -> 180 | E40: =IF( '\\ser\Software\other\[POINTS NQS  2012.XLS]Pro Outlaw'!E42=0," ",'\\ser\Software\other\[POINTS NQS  2012.XLS]Pro Outlaw'!E42) ->  | F40: ='\\ser\Software\other\[POINTS NQS  2012.XLS]Pro Outlaw'!AA42 -> 243 | I40: ='\\ser\Software\other\[POINTS NQS  2012.XLS]Lite Outlaw'!A7 -> 1 | J40: ='\\ser\Software\other\[POINTS NQS  2012.XLS]Lite Outlaw'!B7 -> Gregory Vandevort | K40: ='\\ser\Software\other\[POINTS NQS  2012.XLS]Lite Outlaw'!C7 -> Albion, PA | L40: ='\\ser\Software\other\[POINTS NQS  2012.XLS]Lite Outlaw'!D7 -> 506 | M40: =IF('\\ser\Software\other\[POINTS NQS  2012.XLS]Lite Outlaw'!E7=0," ",'\\ser\Software\other\[POINTS NQS  2012.XLS]Lite Outlaw'!E7) -> Shockwave | N40: ='\\ser\Software\other\[POINTS NQS  2012.XLS]Lite Outlaw'!AA7 -> 0
A41: ='\\ser\Software\other\[POINTS NQS  2012.XLS]Pro Outlaw'!A43 -> 37 | B41: ='\\ser\Software\other\[POINTS NQS  2012.XLS]Pro Outlaw'!B43 -> Jerry Skuta | C41: ='\\ser\Software\other\[POINTS NQS  2012.XLS]Pro Outlaw'!C43 -> Kimball, Mi | D41: ='\\ser\Software\other\[POINTS NQS  2012.XLS]Pro Outlaw'!D43 -> 329 | E41: =IF( '\\ser\Software\other\[POINTS NQS  2012.XLS]Pro Outlaw'!E43=0," ",'\\ser\Software\other\[POINTS NQS  2012.XLS]Pro Outlaw'!E43) -> Green Tractor | F41: ='\\ser\Software\other\[POINTS NQS  2012.XLS]Pro Outlaw'!AA43 -> 243 | I41: ='\\ser\Software\other\[POINTS NQS  2012.XLS]Lite Outlaw'!A8 -> 2 | J41: ='\\ser\Software\other\[POINTS NQS  2012.XLS]Lite Outlaw'!B8 -> Matt Kaster | K41: ='\\ser\Software\other\[POINTS NQS  2012.XLS]Lite Outlaw'!C8 -> Burlington, WI | L41: ='\\ser\Software\other\[POINTS NQS  2012.XLS]Lite Outlaw'!D8 -> 332 | M41: =IF('\\ser\Software\other\[POINTS NQS  2012.XLS]Lite Outlaw'!E8=0," ",'\\ser\Software\other\[POINTS NQS  2012.XLS]Lite Outlaw'!E8) -> Hog Wash | N41: ='\\ser\Software\other\[POINTS NQS  2012.XLS]Lite Outlaw'!AA8 -> 3
A42: ='\\ser\Software\other\[POINTS NQS  2012.XLS]Pro Outlaw'!A44 -> 38 | B42: ='\\ser\Software\other\[POINTS NQS  2012.XLS]Pro Outlaw'!B44 -> Scott Bye | C42: ='\\ser\Software\other\[POINTS NQS  2012.XLS]Pro Outlaw'!C44 -> Savannah, Mo | D42: ='\\ser\Software\other\[POINTS NQS  2012.XLS]Pro Outlaw'!D44 -> 365 | E42: =IF( '\\ser\Software\other\[POINTS NQS  2012.XLS]Pro Outlaw'!E44=0," ",'\\ser\Software\other\[POINTS NQS  2012.XLS]Pro Outlaw'!E44) -> Fired Up | F42: ='\\ser\Software\other\[POINTS NQS  2012.XLS]Pro Outlaw'!AA44 -> 243 | I42: ='\\ser\Software\other\[POINTS NQS  2012.XLS]Lite Outlaw'!A9 -> 3 | J42: ='\\ser\Software\other\[POINTS NQS  2012.XLS]Lite Outlaw'!B9 -> Lora Feldkamp | K42: ='\\ser\Software\other\[POINTS NQS  2012.XLS]Lite Outlaw'!C9 -> Britton, WI | L42: ='\\ser\Software\other\[POINTS NQS  2012.XLS]Lite Outlaw'!D9 -> 475 | M42: =IF('\\ser\Software\other\[POINTS NQS  2012.XLS]Lite Outlaw'!E9=0," ",'\\ser\Software\other\[POINTS NQS  2012.XLS]Lite Outlaw'!E9) ->  | N42: ='\\ser\Software\other\[POINTS NQS  2012.XLS]Lite Outlaw'!AA9 -> 5
A43: ='\\ser\Software\other\[POINTS NQS  2012.XLS]Pro Outlaw'!A45 -> 39 | B43: ='\\ser\Software\other\[POINTS NQS  2012.XLS]Pro Outlaw'!B45 -> Dean Dubach | C43: ='\\ser\Software\other\[POINTS NQS  2012.XLS]Pro Outlaw'!C45 -> Decatur, In | D43: ='\\ser\Software\other\[POINTS NQS  2012.XLS]Pro Outlaw'!D45 -> 532 | E43: =IF( '\\ser\Software\other\[POINTS NQS  2012.XLS]Pro Outlaw'!E45=0," ",'\\ser\Software\other\[POINTS NQS  2012.XLS]Pro Outlaw'!E45) -> Red Cub | F43: ='\\ser\Software\other\[POINTS NQS  2012.XLS]Pro Outlaw'!AA45 -> 243 | I43: ='\\ser\Software\other\[POINTS NQS  2012.XLS]Lite Outlaw'!A10 -> 4 | J43: ='\\ser\Software\other\[POINTS NQS  2012.XLS]Lite Outlaw'!B10 -> Jerry Sweet | K43: ='\\ser\Software\other\[POINTS NQS  2012.XLS]Lite Outlaw'!C10 -> Clymer, NY | L43: ='\\ser\Software\other\[POINTS NQS  2012.XLS]Lite Outlaw'!D10 -> 284 | M43: =IF('\\ser\Software\other\[POINTS NQS  2012.XLS]Lite Outlaw'!E10=0," ",'\\ser\Software\other\[POINTS NQS  2012.XLS]Lite Outlaw'!E10) -> Phat Ride | N43: ='\\ser\Software\other\[POINTS NQS  2012.XLS]Lite Outlaw'!AA10 -> 16
A44: ='\\ser\Software\other\[POINTS NQS  2012.XLS]Pro Outlaw'!A46 -> 40 | B44: ='\\ser\Software\other\[POINTS NQS  2012.XLS]Pro Outlaw'!B46 -> Wes Kampeter | C44: ='\\ser\Software\other\[POINTS NQS  2012.XLS]Pro Outlaw'!C46 -> Freeburg, MO | D44: ='\\ser\Software\other\[POINTS NQS  2012.XLS]Pro Outlaw'!D46 -> 583 | E44: =IF( '\\ser\Software\other\[POINTS NQS  2012.XLS]Pro Outlaw'!E46=0," ",'\\ser\Software\other\[POINTS NQS  2012.XLS]Pro Outlaw'!E46) -> Wes Kampeter | F44: ='\\ser\Software\other\[POINTS NQS  2012.XLS]Pro Outlaw'!AA46 -> 243 | I44: ='\\ser\Software\other\[POINTS NQS  2012.XLS]Lite Outlaw'!A11 -> 5 | J44: ='\\ser\Software\other\[POINTS NQS  2012.XLS]Lite Outlaw'!B11 -> Bobby Feldkamp | K44: ='\\ser\Software\other\[POINTS NQS  2012.XLS]Lite Outlaw'!C11 -> Milan, Mi | L44: ='\\ser\Software\other\[POINTS NQS  2012.XLS]Lite Outlaw'!D11 -> 474 | M44: =IF('\\ser\Software\other\[POINTS NQS  2012.XLS]Lite Outlaw'!E11=0," ",'\\ser\Software\other\[POINTS NQS  2012.XLS]Lite Outlaw'!E11) -> Driftwood | N44: ='\\ser\Software\other\[POINTS NQS  2012.XLS]Lite Outlaw'!AA11 -> 20
A45: ='\\ser\Software\other\[POINTS NQS  2012.XLS]Pro Outlaw'!A47 -> 41 | B45: ='\\ser\Software\other\[POINTS NQS  2012.XLS]Pro Outlaw'!B47 -> Jim Morgenstern | C45: ='\\ser\Software\other\[POINTS NQS  2012.XLS]Pro Outlaw'!C47 -> Whipple, Oh | D45: ='\\ser\Software\other\[POINTS NQS  2012.XLS]Pro Outlaw'!D47 -> 588 | E45: =IF( '\\ser\Software\other\[POINTS NQS  2012.XLS]Pro Outlaw'!E47=0," ",'\\ser\Software\other\[POINTS NQS  2012.XLS]Pro Outlaw'!E47) -> High Maintenance | F45: ='\\ser\Software\other\[POINTS NQS  2012.XLS]Pro Outlaw'!AA47 -> 243 | I45: ='\\ser\Software\other\[POINTS NQS  2012.XLS]Lite Outlaw'!A12 -> 6 | J45: ='\\ser\Software\other\[POINTS NQS  2012.XLS]Lite Outlaw'!B12 -> Scott Bye | K45: ='\\ser\Software\other\[POINTS NQS  2012.XLS]Lite Outlaw'!C12 -> Savannah, MO | L45: ='\\ser\Software\other\[POINTS NQS  2012.XLS]Lite Outlaw'!D12 -> 187 | M45: =IF('\\ser\Software\other\[POINTS NQS  2012.XLS]Lite Outlaw'!E12=0," ",'\\ser\Software\other\[POINTS NQS  2012.XLS]Lite Outlaw'!E12) -> Revved Up | N45: ='\\ser\Software\other\[POINTS NQS  2012.XLS]Lite Outlaw'!AA12 -> 39
A46: ='\\ser\Software\other\[POINTS NQS  2012.XLS]Pro Outlaw'!A48 -> 42 | B46: ='\\ser\Software\other\[POINTS NQS  2012.XLS]Pro Outlaw'!B48 -> Ed Nichols | C46: ='\\ser\Software\other\[POINTS NQS  2012.XLS]Pro Outlaw'!C48 -> Salvisa, Ky | D46: ='\\ser\Software\other\[POINTS NQS  2012.XLS]Pro Outlaw'!D48 -> 124 | E46: =IF( '\\ser\Software\other\[POINTS NQS  2012.XLS]Pro Outlaw'!E48=0," ",'\\ser\Software\other\[POINTS NQS  2012.XLS]Pro Outlaw'!E48) -> Track Attack | F46: ='\\ser\Software\other\[POINTS NQS  2012.XLS]Pro Outlaw'!AA48 -> 244 | I46: ='\\ser\Software\other\[POINTS NQS  2012.XLS]Lite Outlaw'!A13 -> 7 | J46: ='\\ser\Software\other\[POINTS NQS  2012.XLS]Lite Outlaw'!B13 -> Bob Jones Sr | K46: ='\\ser\Software\other\[POINTS NQS  2012.XLS]Lite Outlaw'!C13 -> Hopewell, Oh | L46: ='\\ser\Software\other\[POINTS NQS  2012.XLS]Lite Outlaw'!D13 -> 182 | M46: =IF('\\ser\Software\other\[POINTS NQS  2012.XLS]Lite Outlaw'!E13=0," ",'\\ser\Software\other\[POINTS NQS  2012.XLS]Lite Outlaw'!E13) -> Buckeye Binder | N46: ='\\ser\Software\other\[POINTS NQS  2012.XLS]Lite Outlaw'!AA13 -> 40
A47: ='\\ser\Software\other\[POINTS NQS  2012.XLS]Pro Outlaw'!A49 -> 43 | B47: ='\\ser\Software\other\[POINTS NQS  2012.XLS]Pro Outlaw'!B49 -> Darlene Sample | C47: ='\\ser\Software\other\[POINTS NQS  2012.XLS]Pro Outlaw'!C49 -> Carrollton, Oh | D47: ='\\ser\Software\other\[POINTS NQS  2012.XLS]Pro Outlaw'!D49 -> 498 | E47: =IF( '\\ser\Software\other\[POINTS NQS  2012.XLS]Pro Outlaw'!E49=0," ",'\\ser\Software\other\[POINTS NQS  2012.XLS]Pro Outlaw'!E49) -> Dr Doom | F47: ='\\ser\Software\other\[POINTS NQS  2012.XLS]Pro Outlaw'!AA49 -> 244 | I47: ='\\ser\Software\other\[POINTS NQS  2012.XLS]Lite Outlaw'!A14 -> 8 | J47: ='\\ser\Software\other\[POINTS NQS  2012.XLS]Lite Outlaw'!B14 -> David Gawatz | K47: ='\\ser\Software\other\[POINTS NQS  2012.XLS]Lite Outlaw'!C14 -> St. Joseph, MO | L47: ='\\ser\Software\other\[POINTS NQS  2012.XLS]Lite Outlaw'!D14 -> 462 | M47: =IF('\\ser\Software\other\[POINTS NQS  2012.XLS]Lite Outlaw'!E14=0," ",'\\ser\Software\other\[POINTS NQS  2012.XLS]Lite Outlaw'!E14) -> Fear The Deere | N47: ='\\ser\Software\other\[POINTS NQS  2012.XLS]Lite Outlaw'!AA14 -> 41
A48: ='\\ser\Software\other\[POINTS NQS  2012.XLS]Pro Outlaw'!A50 -> 44 | B48: ='\\ser\Software\other\[POINTS NQS  2012.XLS]Pro Outlaw'!B50 -> Kurt Dosland | C48: ='\\ser\Software\other\[POINTS NQS  2012.XLS]Pro Outlaw'!C50 -> Monmouth, IA | D48: ='\\ser\Software\other\[POINTS NQS  2012.XLS]Pro Outlaw'!D50 -> 570 | E48: =IF( '\\ser\Software\other\[POINTS NQS  2012.XLS]Pro Outlaw'!E50=0," ",'\\ser\Software\other\[POINTS NQS  2012.XLS]Pro Outlaw'!E50) -> Thunderstruck | F48: ='\\ser\Software\other\[POINTS NQS  2012.XLS]Pro Outlaw'!AA50 -> 244 | I48: ='\\ser\Software\other\[POINTS NQS  2012.XLS]Lite Outlaw'!A15 -> 9 | J48: ='\\ser\Software\other\[POINTS NQS  2012.XLS]Lite Outlaw'!B15 -> Nick Ferguson | K48: ='\\ser\Software\other\[POINTS NQS  2012.XLS]Lite Outlaw'!C15 -> Elkhorn, WI | L48: ='\\ser\Software\other\[POINTS NQS  2012.XLS]Lite Outlaw'!D15 -> 100 | M48: =IF('\\ser\Software\other\[POINTS NQS  2012.XLS]Lite Outlaw'!E15=0," ",'\\ser\Software\other\[POINTS NQS  2012.XLS]Lite Outlaw'!E15) -> Raisin Cane | N48: ='\\ser\Software\other\[POINTS NQS  2012.XLS]Lite Outlaw'!AA15 -> 47
A49: ='\\ser\Software\other\[POINTS NQS  2012.XLS]Pro Outlaw'!A51 -> 45 | B49: ='\\ser\Software\other\[POINTS NQS  2012.XLS]Pro Outlaw'!B51 -> Julian Stahl | C49: ='\\ser\Software\other\[POINTS NQS  2012.XLS]Pro Outlaw'!C51 -> Welton, IA | D49: ='\\ser\Software\other\[POINTS NQS  2012.XLS]Pro Outlaw'!D51 -> 2 | E49: =IF( '\\ser\Software\other\[POINTS NQS  2012.XLS]Pro Outlaw'!E51=0," ",'\\ser\Software\other\[POINTS NQS  2012.XLS]Pro Outlaw'!E51) -> MWSC#2 | F49: ='\\ser\Software\other\[POINTS NQS  2012.XLS]Pro Outlaw'!AA51 -> 245 | I49: ='\\ser\Software\other\[POINTS NQS  2012.XLS]Lite Outlaw'!A16 -> 10 | J49: ='\\ser\Software\other\[POINTS NQS  2012.XLS]Lite Outlaw'!B16 -> Scott Bye | K49: ='\\ser\Software\other\[POINTS NQS  2012.XLS]Lite Outlaw'!C16 -> Savannah, MO | L49: ='\\ser\Software\other\[POINTS NQS  2012.XLS]Lite Outlaw'!D16 -> 539 | M49: =IF('\\ser\Software\other\[POINTS NQS  2012.XLS]Lite Outlaw'!E16=0," ",'\\ser\Software\other\[POINTS NQS  2012.XLS]Lite Outlaw'!E16) -> Jacked Up | N49: ='\\ser\Software\other\[POINTS NQS  2012.XLS]Lite Outlaw'!AA16 -> 58
A50: ='\\ser\Software\other\[POINTS NQS  2012.XLS]Pro Outlaw'!A52 -> 46 | B50: ='\\ser\Software\other\[POINTS NQS  2012.XLS]Pro Outlaw'!B52 -> David Gawatz | C50: ='\\ser\Software\other\[POINTS NQS  2012.XLS]Pro Outlaw'!C52 -> St Joseph, Mo | D50: ='\\ser\Software\other\[POINTS NQS  2012.XLS]Pro Outlaw'!D52 -> 184 | E50: =IF( '\\ser\Software\other\[POINTS NQS  2012.XLS]Pro Outlaw'!E52=0," ",'\\ser\Software\other\[POINTS NQS  2012.XLS]Pro Outlaw'!E52) -> Low Hung Buck | F50: ='\\ser\Software\other\[POINTS NQS  2012.XLS]Pro Outlaw'!AA52 -> 245 | I50: ='\\ser\Software\other\[POINTS NQS  2012.XLS]Lite Outlaw'!A17 -> 11 | J50: ='\\ser\Software\other\[POINTS NQS  2012.XLS]Lite Outlaw'!B17 -> Wesley Briant | K50: ='\\ser\Software\other\[POINTS NQS  2012.XLS]Lite Outlaw'!C17 -> Washington, pa | L50: ='\\ser\Software\other\[POINTS NQS  2012.XLS]Lite Outlaw'!D17 -> 533 | M50: =IF('\\ser\Software\other\[POINTS NQS  2012.XLS]Lite Outlaw'!E17=0," ",'\\ser\Software\other\[POINTS NQS  2012.XLS]Lite Outlaw'!E17) -> Cub N Debt | N50: ='\\ser\Software\other\[POINTS NQS  2012.XLS]Lite Outlaw'!AA17 -> 69
A51: ='\\ser\Software\other\[POINTS NQS  2012.XLS]Pro Outlaw'!A53 -> 47 | B51: ='\\ser\Software\other\[POINTS NQS  2012.XLS]Pro Outlaw'!B53 -> Jerry Skuta | C51: ='\\ser\Software\other\[POINTS NQS  2012.XLS]Pro Outlaw'!C53 -> Kimball, Mi | D51: ='\\ser\Software\other\[POINTS NQS  2012.XLS]Pro Outlaw'!D53 -> 330 | E51: =IF( '\\ser\Software\other\[POINTS NQS  2012.XLS]Pro Outlaw'!E53=0," ",'\\ser\Software\other\[POINTS NQS  2012.XLS]Pro Outlaw'!E53) -> Mental Health 2 | F51: ='\\ser\Software\other\[POINTS NQS  2012.XLS]Pro Outlaw'!AA53 -> 245 | I51: ='\\ser\Software\other\[POINTS NQS  2012.XLS]Lite Outlaw'!A18 -> 12 | J51: ='\\ser\Software\other\[POINTS NQS  2012.XLS]Lite Outlaw'!B18 -> Billy Black | K51: ='\\ser\Software\other\[POINTS NQS  2012.XLS]Lite Outlaw'!C18 -> Dry Ridge, Ky | L51: ='\\ser\Software\other\[POINTS NQS  2012.XLS]Lite Outlaw'!D18 -> 567 | M51: =IF('\\ser\Software\other\[POINTS NQS  2012.XLS]Lite Outlaw'!E18=0," ",'\\ser\Software\other\[POINTS NQS  2012.XLS]Lite Outlaw'!E18) ->  | N51: ='\\ser\Software\other\[POINTS NQS  2012.XLS]Lite Outlaw'!AA18 -> 69
A52: ='\\ser\Software\other\[POINTS NQS  2012.XLS]Pro Outlaw'!A54 -> 48 | B52: ='\\ser\Software\other\[POINTS NQS  2012.XLS]Pro Outlaw'!B54 -> Nick Ferguson | C52: ='\\ser\Software\other\[POINTS NQS  2012.XLS]Pro Outlaw'!C54 -> Elkhorn, Wi | D52: ='\\ser\Software\other\[POINTS NQS  2012.XLS]Pro Outlaw'!D54 -> 343 | E52: =IF( '\\ser\Software\other\[POINTS NQS  2012.XLS]Pro Outlaw'!E54=0," ",'\\ser\Software\other\[POINTS NQS  2012.XLS]Pro Outlaw'!E54) -> Border Patrol | F52: ='\\ser\Software\other\[POINTS NQS  2012.XLS]Pro Outlaw'!AA54 -> 245 | I52: ='\\ser\Software\other\[POINTS NQS  2012.XLS]Lite Outlaw'!A19 -> 13 | J52: ='\\ser\Software\other\[POINTS NQS  2012.XLS]Lite Outlaw'!B19 -> Austin Yurkovich | K52: ='\\ser\Software\other\[POINTS NQS  2012.XLS]Lite Outlaw'!C19 -> Prosperty, Pa | L52: ='\\ser\Software\other\[POINTS NQS  2012.XLS]Lite Outlaw'!D19 -> 557 | M52: =IF('\\ser\Software\other\[POINTS NQS  2012.XLS]Lite Outlaw'!E19=0," ",'\\ser\Software\other\[POINTS NQS  2012.XLS]Lite Outlaw'!E19) -> Sled Stretcher | N52: ='\\ser\Software\other\[POINTS NQS  2012.XLS]Lite Outlaw'!AA19 -> 70
A53: ='\\ser\Software\other\[POINTS NQS  2012.XLS]Pro Outlaw'!A55 -> 49 | B53: ='\\ser\Software\other\[POINTS NQS  2012.XLS]Pro Outlaw'!B55 -> Carl Zimmerman | C53: ='\\ser\Software\other\[POINTS NQS  2012.XLS]Pro Outlaw'!C55 -> Earlville, Il | D53: ='\\ser\Software\other\[POINTS NQS  2012.XLS]Pro Outlaw'!D55 -> 582 | E53: =IF( '\\ser\Software\other\[POINTS NQS  2012.XLS]Pro Outlaw'!E55=0," ",'\\ser\Software\other\[POINTS NQS  2012.XLS]Pro Outlaw'!E55) -> Bragging Rights | F53: ='\\ser\Software\other\[POINTS NQS  2012.XLS]Pro Outlaw'!AA55 -> 245 | I53: ='\\ser\Software\other\[POINTS NQS  2012.XLS]Lite Outlaw'!A20 -> 14 | J53: ='\\ser\Software\other\[POINTS NQS  2012.XLS]Lite Outlaw'!B20 -> Eli Yurkovich | K53: ='\\ser\Software\other\[POINTS NQS  2012.XLS]Lite Outlaw'!C20 -> Prosperty, Pa | L53: ='\\ser\Software\other\[POINTS NQS  2012.XLS]Lite Outlaw'!D20 -> 556 | M53: =IF('\\ser\Software\other\[POINTS NQS  2012.XLS]Lite Outlaw'!E20=0," ",'\\ser\Software\other\[POINTS NQS  2012.XLS]Lite Outlaw'!E20) -> Covered Bridge Exp | N53: ='\\ser\Software\other\[POINTS NQS  2012.XLS]Lite Outlaw'!AA20 -> 78
A54: ='\\ser\Software\other\[POINTS NQS  2012.XLS]Pro Outlaw'!A56 -> 50 | B54: ='\\ser\Software\other\[POINTS NQS  2012.XLS]Pro Outlaw'!B56 -> Greg Watson | C54: ='\\ser\Software\other\[POINTS NQS  2012.XLS]Pro Outlaw'!C56 -> Batavia, Oh | D54: ='\\ser\Software\other\[POINTS NQS  2012.XLS]Pro Outlaw'!D56 -> 78 | E54: =IF( '\\ser\Software\other\[POINTS NQS  2012.XLS]Pro Outlaw'!E56=0," ",'\\ser\Software\other\[POINTS NQS  2012.XLS]Pro Outlaw'!E56) -> Barely Legal | F54: ='\\ser\Software\other\[POINTS NQS  2012.XLS]Pro Outlaw'!AA56 -> 246 | I54: ='\\ser\Software\other\[POINTS NQS  2012.XLS]Lite Outlaw'!A21 -> 15 | J54: ='\\ser\Software\other\[POINTS NQS  2012.XLS]Lite Outlaw'!B21 -> Bob Cooper | K54: ='\\ser\Software\other\[POINTS NQS  2012.XLS]Lite Outlaw'!C21 -> Westminster, Md | L54: ='\\ser\Software\other\[POINTS NQS  2012.XLS]Lite Outlaw'!D21 -> 522 | M54: =IF('\\ser\Software\other\[POINTS NQS  2012.XLS]Lite Outlaw'!E21=0," ",'\\ser\Software\other\[POINTS NQS  2012.XLS]Lite Outlaw'!E21) -> Just Business | N54: ='\\ser\Software\other\[POINTS NQS  2012.XLS]Lite Outlaw'!AA21 -> 81
A55: ='\\ser\Software\other\[POINTS NQS  2012.XLS]Pro Outlaw'!A57 -> 51 | B55: ='\\ser\Software\other\[POINTS NQS  2012.XLS]Pro Outlaw'!B57 -> Steve Vogler | C55: ='\\ser\Software\other\[POINTS NQS  2012.XLS]Pro Outlaw'!C57 -> Jasper, IN | D55: ='\\ser\Software\other\[POINTS NQS  2012.XLS]Pro Outlaw'!D57 -> 476 | E55: =IF( '\\ser\Software\other\[POINTS NQS  2012.XLS]Pro Outlaw'!E57=0," ",'\\ser\Software\other\[POINTS NQS  2012.XLS]Pro Outlaw'!E57) -> Outlaw Reloaded | F55: ='\\ser\Software\other\[POINTS NQS  2012.XLS]Pro Outlaw'!AA57 -> 246 | I55: ='\\ser\Software\other\[POINTS NQS  2012.XLS]Lite Outlaw'!A22 -> 16 | J55: ='\\ser\Software\other\[POINTS NQS  2012.XLS]Lite Outlaw'!B22 -> Chris Gegg | K55: ='\\ser\Software\other\[POINTS NQS  2012.XLS]Lite Outlaw'!C22 -> Greenville, IL | L55: ='\\ser\Software\other\[POINTS NQS  2012.XLS]Lite Outlaw'!D22 -> 410 | M55: =IF('\\ser\Software\other\[POINTS NQS  2012.XLS]Lite Outlaw'!E22=0," ",'\\ser\Software\other\[POINTS NQS  2012.XLS]Lite Outlaw'!E22) -> Insane | N55: ='\\ser\Software\other\[POINTS NQS  2012.XLS]Lite Outlaw'!AA22 -> 84
A56: ='\\ser\Software\other\[POINTS NQS  2012.XLS]Pro Outlaw'!A58 -> 52 | B56: ='\\ser\Software\other\[POINTS NQS  2012.XLS]Pro Outlaw'!B58 -> Tyler Hackman | C56: ='\\ser\Software\other\[POINTS NQS  2012.XLS]Pro Outlaw'!C58 -> Seymour, ind | D56: ='\\ser\Software\other\[POINTS NQS  2012.XLS]Pro Outlaw'!D58 -> 508 | E56: =IF( '\\ser\Software\other\[POINTS NQS  2012.XLS]Pro Outlaw'!E58=0," ",'\\ser\Software\other\[POINTS NQS  2012.XLS]Pro Outlaw'!E58) -> Iron Will | F56: ='\\ser\Software\other\[POINTS NQS  2012.XLS]Pro Outlaw'!AA58 -> 246 | I56: ='\\ser\Software\other\[POINTS NQS  2012.XLS]Lite Outlaw'!A23 -> 17 | J56: ='\\ser\Software\other\[POINTS NQS  2012.XLS]Lite Outlaw'!B23 -> Aaron Scroggins | K56: ='\\ser\Software\other\[POINTS NQS  2012.XLS]Lite Outlaw'!C23 -> Neosho, MO | L56: ='\\ser\Software\other\[POINTS NQS  2012.XLS]Lite Outlaw'!D23 -> 419 | M56: =IF('\\ser\Software\other\[POINTS NQS  2012.XLS]Lite Outlaw'!E23=0," ",'\\ser\Software\other\[POINTS NQS  2012.XLS]Lite Outlaw'!E23) -> Gambler | N56: ='\\ser\Software\other\[POINTS NQS  2012.XLS]Lite Outlaw'!AA23 -> 85
A57: ='\\ser\Software\other\[POINTS NQS  2012.XLS]Pro Outlaw'!A59 -> 53 | B57: ='\\ser\Software\other\[POINTS NQS  2012.XLS]Pro Outlaw'!B59 -> Ed Locke Jr. | C57: ='\\ser\Software\other\[POINTS NQS  2012.XLS]Pro Outlaw'!C59 -> Island Lake, Ill | D57: ='\\ser\Software\other\[POINTS NQS  2012.XLS]Pro Outlaw'!D59 -> 577 | E57: =IF( '\\ser\Software\other\[POINTS NQS  2012.XLS]Pro Outlaw'!E59=0," ",'\\ser\Software\other\[POINTS NQS  2012.XLS]Pro Outlaw'!E59) -> Thor | F57: ='\\ser\Software\other\[POINTS NQS  2012.XLS]Pro Outlaw'!AA59 -> 246 | I57: ='\\ser\Software\other\[POINTS NQS  2012.XLS]Lite Outlaw'!A24 -> 18 | J57: ='\\ser\Software\other\[POINTS NQS  2012.XLS]Lite Outlaw'!B24 -> Jim Waite | K57: ='\\ser\Software\other\[POINTS NQS  2012.XLS]Lite Outlaw'!C24 -> Hopkington RI | L57: ='\\ser\Software\other\[POINTS NQS  2012.XLS]Lite Outlaw'!D24 -> 0 | M57: =IF('\\ser\Software\other\[POINTS NQS  2012.XLS]Lite Outlaw'!E24=0," ",'\\ser\Software\other\[POINTS NQS  2012.XLS]Lite Outlaw'!E24) -> Wacky Five | N57: ='\\ser\Software\other\[POINTS NQS  2012.XLS]Lite Outlaw'!AA24 -> 86
A58: ='\\ser\Software\other\[POINTS NQS  2012.XLS]Pro Outlaw'!A60 -> 54 | B58: ='\\ser\Software\other\[POINTS NQS  2012.XLS]Pro Outlaw'!B60 -> Larry Hunter | C58: ='\\ser\Software\other\[POINTS NQS  2012.XLS]Pro Outlaw'!C60 -> Blue Licks, Ky | D58: ='\\ser\Software\other\[POINTS NQS  2012.XLS]Pro Outlaw'!D60 -> 9 | E58: =IF( '\\ser\Software\other\[POINTS NQS  2012.XLS]Pro Outlaw'!E60=0," ",'\\ser\Software\other\[POINTS NQS  2012.XLS]Pro Outlaw'!E60) -> Runaway Deere | F58: ='\\ser\Software\other\[POINTS NQS  2012.XLS]Pro Outlaw'!AA60 -> 247 | I58: ='\\ser\Software\other\[POINTS NQS  2012.XLS]Lite Outlaw'!A25 -> 19 | J58: ='\\ser\Software\other\[POINTS NQS  2012.XLS]Lite Outlaw'!B25 -> Julian Stahl | K58: ='\\ser\Software\other\[POINTS NQS  2012.XLS]Lite Outlaw'!C25 -> Welton, Ia | L58: ='\\ser\Software\other\[POINTS NQS  2012.XLS]Lite Outlaw'!D25 -> 1 | M58: =IF('\\ser\Software\other\[POINTS NQS  2012.XLS]Lite Outlaw'!E25=0," ",'\\ser\Software\other\[POINTS NQS  2012.XLS]Lite Outlaw'!E25) -> MWCS #1 | N58: ='\\ser\Software\other\[POINTS NQS  2012.XLS]Lite Outlaw'!AA25 -> 86
A59: ='\\ser\Software\other\[POINTS NQS  2012.XLS]Pro Outlaw'!A61 -> 55 | B59: ='\\ser\Software\other\[POINTS NQS  2012.XLS]Pro Outlaw'!B61 -> Ryan Shafer | C59: ='\\ser\Software\other\[POINTS NQS  2012.XLS]Pro Outlaw'!C61 -> Confluence, pa | D59: ='\\ser\Software\other\[POINTS NQS  2012.XLS]Pro Outlaw'!D61 -> 445 | E59: =IF( '\\ser\Software\other\[POINTS NQS  2012.XLS]Pro Outlaw'!E61=0," ",'\\ser\Software\other\[POINTS NQS  2012.XLS]Pro Outlaw'!E61) -> LabRat | F59: ='\\ser\Software\other\[POINTS NQS  2012.XLS]Pro Outlaw'!AA61 -> 247 | I59: ='\\ser\Software\other\[POINTS NQS  2012.XLS]Lite Outlaw'!A26 -> 20 | J59: ='\\ser\Software\other\[POINTS NQS  2012.XLS]Lite Outlaw'!B26 -> Dave Wise | K59: ='\\ser\Software\other\[POINTS NQS  2012.XLS]Lite Outlaw'!C26 -> Hunker, Pa | L59: ='\\ser\Software\other\[POINTS NQS  2012.XLS]Lite Outlaw'!D26 -> 403 | M59: =IF('\\ser\Software\other\[POINTS NQS  2012.XLS]Lite Outlaw'!E26=0," ",'\\ser\Software\other\[POINTS NQS  2012.XLS]Lite Outlaw'!E26) ->  | N59: ='\\ser\Software\other\[POINTS NQS  2012.XLS]Lite Outlaw'!AA26 -> 88
A60: ='\\ser\Software\other\[POINTS NQS  2012.XLS]Pro Outlaw'!A62 -> 56 | B60: ='\\ser\Software\other\[POINTS NQS  2012.XLS]Pro Outlaw'!B62 -> Jerry Everhart | C60: ='\\ser\Software\other\[POINTS NQS  2012.XLS]Pro Outlaw'!C62 -> Springfield, OH | D60: ='\\ser\Software\other\[POINTS NQS  2012.XLS]Pro Outlaw'!D62 -> 483 | E60: =IF( '\\ser\Software\other\[POINTS NQS  2012.XLS]Pro Outlaw'!E62=0," ",'\\ser\Software\other\[POINTS NQS  2012.XLS]Pro Outlaw'!E62) -> Orange Cart | F60: ='\\ser\Software\other\[POINTS NQS  2012.XLS]Pro Outlaw'!AA62 -> 247 | I60: ='\\ser\Software\other\[POINTS NQS  2012.XLS]Lite Outlaw'!A27 -> 21 | J60: ='\\ser\Software\other\[POINTS NQS  2012.XLS]Lite Outlaw'!B27 -> Biana Miller | K60: ='\\ser\Software\other\[POINTS NQS  2012.XLS]Lite Outlaw'!C27 -> Browning, Ill | L60: ='\\ser\Software\other\[POINTS NQS  2012.XLS]Lite Outlaw'!D27 -> 0 | M60: =IF('\\ser\Software\other\[POINTS NQS  2012.XLS]Lite Outlaw'!E27=0," ",'\\ser\Software\other\[POINTS NQS  2012.XLS]Lite Outlaw'!E27) -> Miss Behain | N60: ='\\ser\Software\other\[POINTS NQS  2012.XLS]Lite Outlaw'!AA27 -> 88
A61: ='\\ser\Software\other\[POINTS NQS  2012.XLS]Pro Outlaw'!A63 -> 57 | B61: ='\\ser\Software\other\[POINTS NQS  2012.XLS]Pro Outlaw'!B63 -> Kevin Root | C61: ='\\ser\Software\other\[POINTS NQS  2012.XLS]Pro Outlaw'!C63 -> Inola, OK | D61: ='\\ser\Software\other\[POINTS NQS  2012.XLS]Pro Outlaw'!D63 -> 118 | E61: =IF( '\\ser\Software\other\[POINTS NQS  2012.XLS]Pro Outlaw'!E63=0," ",'\\ser\Software\other\[POINTS NQS  2012.XLS]Pro Outlaw'!E63) -> Slapshot | F61: ='\\ser\Software\other\[POINTS NQS  2012.XLS]Pro Outlaw'!AA63 -> 248 | I61: ='\\ser\Software\other\[POINTS NQS  2012.XLS]Lite Outlaw'!A28 -> 22 | J61: ='\\ser\Software\other\[POINTS NQS  2012.XLS]Lite Outlaw'!B28 -> Nevin Stitzer | K61: ='\\ser\Software\other\[POINTS NQS  2012.XLS]Lite Outlaw'!C28 -> Springs Mill, Pa | L61: ='\\ser\Software\other\[POINTS NQS  2012.XLS]Lite Outlaw'!D28 -> 448 | M61: =IF('\\ser\Software\other\[POINTS NQS  2012.XLS]Lite Outlaw'!E28=0," ",'\\ser\Software\other\[POINTS NQS  2012.XLS]Lite Outlaw'!E28) -> Thunder Road I | N61: ='\\ser\Software\other\[POINTS NQS  2012.XLS]Lite Outlaw'!AA28 -> 90
A62: ='\\ser\Software\other\[POINTS NQS  2012.XLS]Pro Outlaw'!A64 -> 58 | B62: ='\\ser\Software\other\[POINTS NQS  2012.XLS]Pro Outlaw'!B64 -> Bill Richerson | C62: ='\\ser\Software\other\[POINTS NQS  2012.XLS]Pro Outlaw'!C64 -> Crittenden, Ky | D62: ='\\ser\Software\other\[POINTS NQS  2012.XLS]Pro Outlaw'!D64 -> 132 | E62: =IF( '\\ser\Software\other\[POINTS NQS  2012.XLS]Pro Outlaw'!E64=0," ",'\\ser\Software\other\[POINTS NQS  2012.XLS]Pro Outlaw'!E64) -> Walk the Line | F62: ='\\ser\Software\other\[POINTS NQS  2012.XLS]Pro Outlaw'!AA64 -> 248 | I62: ='\\ser\Software\other\[POINTS NQS  2012.XLS]Lite Outlaw'!A29 -> 23 | J62: ='\\ser\Software\other\[POINTS NQS  2012.XLS]Lite Outlaw'!B29 -> Dough Waugh | K62: ='\\ser\Software\other\[POINTS NQS  2012.XLS]Lite Outlaw'!C29 -> King City, Mo | L62: ='\\ser\Software\other\[POINTS NQS  2012.XLS]Lite Outlaw'!D29 -> 464 | M62: =IF('\\ser\Software\other\[POINTS NQS  2012.XLS]Lite Outlaw'!E29=0," ",'\\ser\Software\other\[POINTS NQS  2012.XLS]Lite Outlaw'!E29) ->  | N62: ='\\ser\Software\other\[POINTS NQS  2012.XLS]Lite Outlaw'!AA29 -> 92
A63: ='\\ser\Software\other\[POINTS NQS  2012.XLS]Pro Outlaw'!A65 -> 59 | B63: ='\\ser\Software\other\[POINTS NQS  2012.XLS]Pro Outlaw'!B65 -> Scott Larkins | C63: ='\\ser\Software\other\[POINTS NQS  2012.XLS]Pro Outlaw'!C65 -> Kearney, MO | D63: ='\\ser\Software\other\[POINTS NQS  2012.XLS]Pro Outlaw'!D65 -> 154 | E63: =IF( '\\ser\Software\other\[POINTS NQS  2012.XLS]Pro Outlaw'!E65=0," ",'\\ser\Software\other\[POINTS NQS  2012.XLS]Pro Outlaw'!E65) -> Silver Sam | F63: ='\\ser\Software\other\[POINTS NQS  2012.XLS]Pro Outlaw'!AA65 -> 249
A64: ='\\ser\Software\other\[POINTS NQS  2012.XLS]Pro Outlaw'!A66 -> 60 | B64: ='\\ser\Software\other\[POINTS NQS  2012.XLS]Pro Outlaw'!B66 -> Jim Waite | C64: ='\\ser\Software\other\[POINTS NQS  2012.XLS]Pro Outlaw'!C66 -> Hopkinton, RI | D64: ='\\ser\Software\other\[POINTS NQS  2012.XLS]Pro Outlaw'!D66 -> 480 | E64: =IF( '\\ser\Software\other\[POINTS NQS  2012.XLS]Pro Outlaw'!E66=0," ",'\\ser\Software\other\[POINTS NQS  2012.XLS]Pro Outlaw'!E66) -> John Deere | F64: ='\\ser\Software\other\[POINTS NQS  2012.XLS]Pro Outlaw'!AA66 -> 249
A65: ='\\ser\Software\other\[POINTS NQS  2012.XLS]Pro Outlaw'!A67 -> 61 | B65: ='\\ser\Software\other\[POINTS NQS  2012.XLS]Pro Outlaw'!B67 -> Kevin Root | C65: ='\\ser\Software\other\[POINTS NQS  2012.XLS]Pro Outlaw'!C67 -> Inola, OK | D65: ='\\ser\Software\other\[POINTS NQS  2012.XLS]Pro Outlaw'!D67 -> 117 | E65: =IF( '\\ser\Software\other\[POINTS NQS  2012.XLS]Pro Outlaw'!E67=0," ",'\\ser\Software\other\[POINTS NQS  2012.XLS]Pro Outlaw'!E67) -> Right on the Money | F65: ='\\ser\Software\other\[POINTS NQS  2012.XLS]Pro Outlaw'!AA67 -> 250
A66: ='\\ser\Software\other\[POINTS NQS  2012.XLS]Pro Outlaw'!A68 -> 62 | B66: ='\\ser\Software\other\[POINTS NQS  2012.XLS]Pro Outlaw'!B68 -> Charlie Ciolino | C66: ='\\ser\Software\other\[POINTS NQS  2012.XLS]Pro Outlaw'!C68 -> Hammond, LA | D66: ='\\ser\Software\other\[POINTS NQS  2012.XLS]Pro Outlaw'!D68 -> 145 | E66: =IF( '\\ser\Software\other\[POINTS NQS  2012.XLS]Pro Outlaw'!E68=0," ",'\\ser\Software\other\[POINTS NQS  2012.XLS]Pro Outlaw'!E68) -> Mechanical Nightmare | F66: ='\\ser\Software\other\[POINTS NQS  2012.XLS]Pro Outlaw'!AA68 -> 250
A67: ='\\ser\Software\other\[POINTS NQS  2012.XLS]Pro Outlaw'!A69 -> 63 | B67: ='\\ser\Software\other\[POINTS NQS  2012.XLS]Pro Outlaw'!B69 -> Zach Richerson | C67: ='\\ser\Software\other\[POINTS NQS  2012.XLS]Pro Outlaw'!C69 -> Crittenden, Ky | D67: ='\\ser\Software\other\[POINTS NQS  2012.XLS]Pro Outlaw'!D69 -> 348 | E67: =IF( '\\ser\Software\other\[POINTS NQS  2012.XLS]Pro Outlaw'!E69=0," ",'\\ser\Software\other\[POINTS NQS  2012.XLS]Pro Outlaw'!E69) -> Zach's Rat | F67: ='\\ser\Software\other\[POINTS NQS  2012.XLS]Pro Outlaw'!AA69 -> 250 | M67: =IF('\\ser\Software\other\[POINTS NQS  2012.XLS]Lite Outlaw'!E36=0," ",'\\ser\Software\other\[POINTS NQS  2012.XLS]Lite Outlaw'!E36) -> 
A68: ='\\ser\Software\other\[POINTS NQS  2012.XLS]Pro Outlaw'!A70 -> 64 | B68: ='\\ser\Software\other\[POINTS NQS  2012.XLS]Pro Outlaw'!B70 -> Mike Spencer | C68: ='\\ser\Software\other\[POINTS NQS  2012.XLS]Pro Outlaw'!C70 -> W Alexandia, Oh | D68: ='\\ser\Software\other\[POINTS NQS  2012.XLS]Pro Outlaw'!D70 -> 517 | E68: =IF( '\\ser\Software\other\[POINTS NQS  2012.XLS]Pro Outlaw'!E70=0," ",'\\ser\Software\other\[POINTS NQS  2012.XLS]Pro Outlaw'!E70) ->  | F68: ='\\ser\Software\other\[POINTS NQS  2012.XLS]Pro Outlaw'!AA70 -> 251
A69: ='\\ser\Software\other\[POINTS NQS  2012.XLS]Pro Outlaw'!A71 -> 65 | B69: ='\\ser\Software\other\[POINTS NQS  2012.XLS]Pro Outlaw'!B71 -> Harrison Stahl | C69: ='\\ser\Software\other\[POINTS NQS  2012.XLS]Pro Outlaw'!C71 -> Dewitt, IA | D69: ='\\ser\Software\other\[POINTS NQS  2012.XLS]Pro Outlaw'!D71 -> 335 | E69: =IF( '\\ser\Software\other\[POINTS NQS  2012.XLS]Pro Outlaw'!E71=0," ",'\\ser\Software\other\[POINTS NQS  2012.XLS]Pro Outlaw'!E71) -> MWSC#3 | F69: ='\\ser\Software\other\[POINTS NQS  2012.XLS]Pro Outlaw'!AA71 -> 253
B72: BUILDERS CUP
B73: PRO/SS ENGINE BUILDERS | E73: SA ENGINE BUILDERS
B75: ='\\ser\Software\other\[POINTS NQS  2012.XLS]Builders Cup'!A4 -> NP = NICHOLS PERFORMANCE | D75: ='\\ser\Software\other\[POINTS NQS  2012.XLS]Builders Cup'!U4 -> 319 | E75: ='\\ser\Software\other\[POINTS NQS  2012.XLS]Builders Cup'!A19 -> TV = TODD VORHEES | F75: ='\\ser\Software\other\[POINTS NQS  2012.XLS]Builders Cup'!U19 -> 320
B76: ='\\ser\Software\other\[POINTS NQS  2012.XLS]Builders Cup'!A5 -> MVP = MVP RACING | D76: ='\\ser\Software\other\[POINTS NQS  2012.XLS]Builders Cup'!U5 -> 276 | E76: ='\\ser\Software\other\[POINTS NQS  2012.XLS]Builders Cup'!A20 -> NP = NICHOLS PERFORMANCE | F76: ='\\ser\Software\other\[POINTS NQS  2012.XLS]Builders Cup'!U20 -> 287
B77: ='\\ser\Software\other\[POINTS NQS  2012.XLS]Builders Cup'!A6 -> HACKMAN = GREG HACKMAN | D77: ='\\ser\Software\other\[POINTS NQS  2012.XLS]Builders Cup'!U6 -> 265 | E77: ='\\ser\Software\other\[POINTS NQS  2012.XLS]Builders Cup'!A21 -> JRS = JIM MORGANSTERN | F77: ='\\ser\Software\other\[POINTS NQS  2012.XLS]Builders Cup'!U21 -> 285
B78: ='\\ser\Software\other\[POINTS NQS  2012.XLS]Builders Cup'!A7 -> JRS = JIM MORGANSTERN | D78: ='\\ser\Software\other\[POINTS NQS  2012.XLS]Builders Cup'!U7 -> 243 | E78: ='\\ser\Software\other\[POINTS NQS  2012.XLS]Builders Cup'!A22 -> BJ = BOB JONES | F78: ='\\ser\Software\other\[POINTS NQS  2012.XLS]Builders Cup'!U22 -> 231
B79: ='\\ser\Software\other\[POINTS NQS  2012.XLS]Builders Cup'!A8 -> JW = JOE WHITWORTH | D79: ='\\ser\Software\other\[POINTS NQS  2012.XLS]Builders Cup'!U8 -> 224 | E79: ='\\ser\Software\other\[POINTS NQS  2012.XLS]Builders Cup'!A23 -> WOODS = DAVE WOODS | F79: ='\\ser\Software\other\[POINTS NQS  2012.XLS]Builders Cup'!U23 -> 193
B80: ='\\ser\Software\other\[POINTS NQS  2012.XLS]Builders Cup'!A9 -> LR = LAKOTA RACING | D80: ='\\ser\Software\other\[POINTS NQS  2012.XLS]Builders Cup'!U9 -> 155 | E80: ='\\ser\Software\other\[POINTS NQS  2012.XLS]Builders Cup'!A24 -> LR = LAKOTA RACING | F80: ='\\ser\Software\other\[POINTS NQS  2012.XLS]Builders Cup'!U24 -> 117
B81: ='\\ser\Software\other\[POINTS NQS  2012.XLS]Builders Cup'!A10 -> VM = VOGEL MFG | D81: ='\\ser\Software\other\[POINTS NQS  2012.XLS]Builders Cup'!U10 -> 113 | E81: ='\\ser\Software\other\[POINTS NQS  2012.XLS]Builders Cup'!A25 -> RPM = RADER | F81: ='\\ser\Software\other\[POINTS NQS  2012.XLS]Builders Cup'!U25 -> 113
B82: ='\\ser\Software\other\[POINTS NQS  2012.XLS]Builders Cup'!A12 -> GTP = MISHLER | D82: ='\\ser\Software\other\[POINTS NQS  2012.XLS]Builders Cup'!U12 -> 79 | E82: ='\\ser\Software\other\[POINTS NQS  2012.XLS]Builders Cup'!A26 -> JW = JOE WHITWORTH | F82: ='\\ser\Software\other\[POINTS NQS  2012.XLS]Builders Cup'!U26 -> 81
B83: ='\\ser\Software\other\[POINTS NQS  2012.XLS]Builders Cup'!A11 -> TC = TOOTER CAMPBELL | D83: ='\\ser\Software\other\[POINTS NQS  2012.XLS]Builders Cup'!U11 -> 55 | E83: ='\\ser\Software\other\[POINTS NQS  2012.XLS]Builders Cup'!A27 -> VM = VOGEL MFG | F83: ='\\ser\Software\other\[POINTS NQS  2012.XLS]Builders Cup'!U27 -> 22
E84: ='\\ser\Software\other\[POINTS NQS  2012.XLS]Builders Cup'!A28 -> TH = TONY HEIFNER | F84: ='\\ser\Software\other\[POINTS NQS  2012.XLS]Builders Cup'!U28 -> 52