A1: STOCK ALTERED 1050 | G1: Thru Peoria | I1: STOCK ALTERED 1100 | O1: Thru Peoria
B2: Name | C2: City/State | D2: Eng | E2: NQS # | F2: Tractor | G2: Points Back | J2: Name | K2: City | L2: Eng | M2: NQS# | N2: Tractor | O2: Points Back
A3: ='\\ser\Software\other\[POINTS NQS  2012.XLS]Stock Altered 1050'!$A6 -> 1 | B3: ='\\ser\Software\other\[POINTS NQS  2012.XLS]Stock Altered 1050'!$B6 -> Ron Hodge | C3: ='\\ser\Software\other\[POINTS NQS  2012.XLS]Stock Altered 1050'!$C6 -> Hillsboro, OH | D3: =IF('\\ser\Software\other\[POINTS NQS  2012.XLS]Stock Altered 1050'!$D6=0," ",'\\ser\Software\other\[POINTS NQS  2012.XLS]Stock Altered 1050'!$D6) -> TV | E3: ='\\ser\Software\other\[POINTS NQS  2012.XLS]Stock Altered 1050'!$E6 -> 71 | F3: =IF('\\ser\Software\other\[POINTS NQS  2012.XLS]Stock Altered 1050'!$F6=0," ",'\\ser\Software\other\[POINTS NQS  2012.XLS]Stock Altered 1050'!$F6) -> Take-N-Names | G3: ='\\ser\Software\other\[POINTS NQS  2012.XLS]Stock Altered 1050'!AA6 -> 0 | I3: ='\\ser\Software\other\[POINTS NQS  2012.XLS]Stock Altered 1100'!$A6 -> 1 | J3: ='\\ser\Software\other\[POINTS NQS  2012.XLS]Stock Altered 1100'!$B6 -> Matt Ronnebaum | K3: ='\\ser\Software\other\[POINTS NQS  2012.XLS]Stock Altered 1100'!$C6 -> Celina, OH | L3: =IF('\\ser\Software\other\[POINTS NQS  2012.XLS]Stock Altered 1100'!$D6=0," ",'\\ser\Software\other\[POINTS NQS  2012.XLS]Stock Altered 1100'!$D6) -> TV | M3: ='\\ser\Software\other\[POINTS NQS  2012.XLS]Stock Altered 1100'!$E6 -> 89 | N3: =IF('\\ser\Software\other\[POINTS NQS  2012.XLS]Stock Altered 1100'!$F6=0," ",'\\ser\Software\other\[POINTS NQS  2012.XLS]Stock Altered 1100'!$F6) -> Boys & Their Toys | O3: ='\\ser\Software\other\[POINTS NQS  2012.XLS]Stock Altered 1100'!AA6 -> 0
A4: ='\\ser\Software\other\[POINTS NQS  2012.XLS]Stock Altered 1050'!$A7 -> 2 | B4: ='\\ser\Software\other\[POINTS NQS  2012.XLS]Stock Altered 1050'!$B7 -> Gary Cunningham | C4: ='\\ser\Software\other\[POINTS NQS  2012.XLS]Stock Altered 1050'!$C7 -> Brooksville, KY | D4: =IF('\\ser\Software\other\[POINTS NQS  2012.XLS]Stock Altered 1050'!$D7=0," ",'\\ser\Software\other\[POINTS NQS  2012.XLS]Stock Altered 1050'!$D7) -> NP | E4: ='\\ser\Software\other\[POINTS NQS  2012.XLS]Stock Altered 1050'!$E7 -> 162 | F4: =IF('\\ser\Software\other\[POINTS NQS  2012.XLS]Stock Altered 1050'!$F7=0," ",'\\ser\Software\other\[POINTS NQS  2012.XLS]Stock Altered 1050'!$F7) -> High Voltage | G4: ='\\ser\Software\other\[POINTS NQS  2012.XLS]Stock Altered 1050'!AA7 -> 18 | I4: ='\\ser\Software\other\[POINTS NQS  2012.XLS]Stock Altered 1100'!$A7 -> 2 | J4: ='\\ser\Software\other\[POINTS NQS  2012.XLS]Stock Altered 1100'!$B7 -> Mark Peters | K4: ='\\ser\Software\other\[POINTS NQS  2012.XLS]Stock Altered 1100'!$C7 -> McArthur, PA | L4: =IF('\\ser\Software\other\[POINTS NQS  2012.XLS]Stock Altered 1100'!$D7=0," ",'\\ser\Software\other\[POINTS NQS  2012.XLS]Stock Altered 1100'!$D7) -> JRS | M4: ='\\ser\Software\other\[POINTS NQS  2012.XLS]Stock Altered 1100'!$E7 -> 469 | N4: =IF('\\ser\Software\other\[POINTS NQS  2012.XLS]Stock Altered 1100'!$F7=0," ",'\\ser\Software\other\[POINTS NQS  2012.XLS]Stock Altered 1100'!$F7) -> American Ride | O4: ='\\ser\Software\other\[POINTS NQS  2012.XLS]Stock Altered 1100'!AA7 -> 11
A5: ='\\ser\Software\other\[POINTS NQS  2012.XLS]Stock Altered 1050'!$A8 -> 3 | B5: ='\\ser\Software\other\[POINTS NQS  2012.XLS]Stock Altered 1050'!$B8 -> Gregory Vandervort | C5: ='\\ser\Software\other\[POINTS NQS  2012.XLS]Stock Altered 1050'!$C8 -> Albion, PA | D5: =IF('\\ser\Software\other\[POINTS NQS  2012.XLS]Stock Altered 1050'!$D8=0," ",'\\ser\Software\other\[POINTS NQS  2012.XLS]Stock Altered 1050'!$D8) -> TV | E5: ='\\ser\Software\other\[POINTS NQS  2012.XLS]Stock Altered 1050'!$E8 -> 346 | F5: =IF('\\ser\Software\other\[POINTS NQS  2012.XLS]Stock Altered 1050'!$F8=0," ",'\\ser\Software\other\[POINTS NQS  2012.XLS]Stock Altered 1050'!$F8) -> Yellow Cub | G5: ='\\ser\Software\other\[POINTS NQS  2012.XLS]Stock Altered 1050'!AA8 -> 24 | I5: ='\\ser\Software\other\[POINTS NQS  2012.XLS]Stock Altered 1100'!$A8 -> 3 | J5: ='\\ser\Software\other\[POINTS NQS  2012.XLS]Stock Altered 1100'!$B8 -> Donnie Herring | K5: ='\\ser\Software\other\[POINTS NQS  2012.XLS]Stock Altered 1100'!$C8 -> Rockbridge, OH | L5: =IF('\\ser\Software\other\[POINTS NQS  2012.XLS]Stock Altered 1100'!$D8=0," ",'\\ser\Software\other\[POINTS NQS  2012.XLS]Stock Altered 1100'!$D8) -> TV | M5: ='\\ser\Software\other\[POINTS NQS  2012.XLS]Stock Altered 1100'!$E8 -> 331 | N5: =IF('\\ser\Software\other\[POINTS NQS  2012.XLS]Stock Altered 1100'!$F8=0," ",'\\ser\Software\other\[POINTS NQS  2012.XLS]Stock Altered 1100'!$F8) -> Pasttime | O5: ='\\ser\Software\other\[POINTS NQS  2012.XLS]Stock Altered 1100'!AA8 -> 36
A6: ='\\ser\Software\other\[POINTS NQS  2012.XLS]Stock Altered 1050'!$A9 -> 4 | B6: ='\\ser\Software\other\[POINTS NQS  2012.XLS]Stock Altered 1050'!$B9 -> Matt Ronnebaum | C6: ='\\ser\Software\other\[POINTS NQS  2012.XLS]Stock Altered 1050'!$C9 -> Celina, OH | D6: =IF('\\ser\Software\other\[POINTS NQS  2012.XLS]Stock Altered 1050'!$D9=0," ",'\\ser\Software\other\[POINTS NQS  2012.XLS]Stock Altered 1050'!$D9) -> TV | E6: ='\\ser\Software\other\[POINTS NQS  2012.XLS]Stock Altered 1050'!$E9 -> 89 | F6: =IF('\\ser\Software\other\[POINTS NQS  2012.XLS]Stock Altered 1050'!$F9=0," ",'\\ser\Software\other\[POINTS NQS  2012.XLS]Stock Altered 1050'!$F9) -> Boys & Their Toys | G6: ='\\ser\Software\other\[POINTS NQS  2012.XLS]Stock Altered 1050'!AA9 -> 36 | I6: ='\\ser\Software\other\[POINTS NQS  2012.XLS]Stock Altered 1100'!$A9 -> 4 | J6: ='\\ser\Software\other\[POINTS NQS  2012.XLS]Stock Altered 1100'!$B9 -> Doug Seaman | K6: ='\\ser\Software\other\[POINTS NQS  2012.XLS]Stock Altered 1100'!$C9 -> Vincent, OH | L6: =IF('\\ser\Software\other\[POINTS NQS  2012.XLS]Stock Altered 1100'!$D9=0," ",'\\ser\Software\other\[POINTS NQS  2012.XLS]Stock Altered 1100'!$D9) -> BJ | M6: ='\\ser\Software\other\[POINTS NQS  2012.XLS]Stock Altered 1100'!$E9 -> 192 | N6: =IF('\\ser\Software\other\[POINTS NQS  2012.XLS]Stock Altered 1100'!$F9=0," ",'\\ser\Software\other\[POINTS NQS  2012.XLS]Stock Altered 1100'!$F9) -> Massey Ferguson | O6: ='\\ser\Software\other\[POINTS NQS  2012.XLS]Stock Altered 1100'!AA9 -> 50
A7: ='\\ser\Software\other\[POINTS NQS  2012.XLS]Stock Altered 1050'!$A10 -> 5 | B7: ='\\ser\Software\other\[POINTS NQS  2012.XLS]Stock Altered 1050'!$B10 -> Kelly Nichols | C7: ='\\ser\Software\other\[POINTS NQS  2012.XLS]Stock Altered 1050'!$C10 -> Lore City, OH | D7: =IF('\\ser\Software\other\[POINTS NQS  2012.XLS]Stock Altered 1050'!$D10=0," ",'\\ser\Software\other\[POINTS NQS  2012.XLS]Stock Altered 1050'!$D10) -> NP | E7: ='\\ser\Software\other\[POINTS NQS  2012.XLS]Stock Altered 1050'!$E10 -> 358 | F7: =IF('\\ser\Software\other\[POINTS NQS  2012.XLS]Stock Altered 1050'!$F10=0," ",'\\ser\Software\other\[POINTS NQS  2012.XLS]Stock Altered 1050'!$F10) -> Maxx'd Out | G7: ='\\ser\Software\other\[POINTS NQS  2012.XLS]Stock Altered 1050'!AA10 -> 45 | I7: ='\\ser\Software\other\[POINTS NQS  2012.XLS]Stock Altered 1100'!$A10 -> 5 | J7: ='\\ser\Software\other\[POINTS NQS  2012.XLS]Stock Altered 1100'!$B10 -> Colt Vorhees | K7: ='\\ser\Software\other\[POINTS NQS  2012.XLS]Stock Altered 1100'!$C10 -> Rockbridge, OH | L7: =IF('\\ser\Software\other\[POINTS NQS  2012.XLS]Stock Altered 1100'!$D10=0," ",'\\ser\Software\other\[POINTS NQS  2012.XLS]Stock Altered 1100'!$D10) -> TV | M7: ='\\ser\Software\other\[POINTS NQS  2012.XLS]Stock Altered 1100'!$E10 -> 313 | N7: =IF('\\ser\Software\other\[POINTS NQS  2012.XLS]Stock Altered 1100'!$F10=0," ",'\\ser\Software\other\[POINTS NQS  2012.XLS]Stock Altered 1100'!$F10) -> Red Cadet | O7: ='\\ser\Software\other\[POINTS NQS  2012.XLS]Stock Altered 1100'!AA10 -> 53
A8: ='\\ser\Software\other\[POINTS NQS  2012.XLS]Stock Altered 1050'!$A11 -> 6 | B8: ='\\ser\Software\other\[POINTS NQS  2012.XLS]Stock Altered 1050'!$B11 -> Wayne Sams | C8: ='\\ser\Software\other\[POINTS NQS  2012.XLS]Stock Altered 1050'!$C11 -> Rockbridge, OH | D8: =IF('\\ser\Software\other\[POINTS NQS  2012.XLS]Stock Altered 1050'!$D11=0," ",'\\ser\Software\other\[POINTS NQS  2012.XLS]Stock Altered 1050'!$D11) -> TV | E8: ='\\ser\Software\other\[POINTS NQS  2012.XLS]Stock Altered 1050'!$E11 -> 82 | F8: =IF('\\ser\Software\other\[POINTS NQS  2012.XLS]Stock Altered 1050'!$F11=0," ",'\\ser\Software\other\[POINTS NQS  2012.XLS]Stock Altered 1050'!$F11) -> Gold Digger | G8: ='\\ser\Software\other\[POINTS NQS  2012.XLS]Stock Altered 1050'!AA11 -> 52 | I8: ='\\ser\Software\other\[POINTS NQS  2012.XLS]Stock Altered 1100'!$A11 -> 6 | J8: ='\\ser\Software\other\[POINTS NQS  2012.XLS]Stock Altered 1100'!$B11 -> Wayne Sams | K8: ='\\ser\Software\other\[POINTS NQS  2012.XLS]Stock Altered 1100'!$C11 -> Rockbridge, OH | L8: =IF('\\ser\Software\other\[POINTS NQS  2012.XLS]Stock Altered 1100'!$D11=0," ",'\\ser\Software\other\[POINTS NQS  2012.XLS]Stock Altered 1100'!$D11) -> TV | M8: ='\\ser\Software\other\[POINTS NQS  2012.XLS]Stock Altered 1100'!$E11 -> 82 | N8: =IF('\\ser\Software\other\[POINTS NQS  2012.XLS]Stock Altered 1100'!$F11=0," ",'\\ser\Software\other\[POINTS NQS  2012.XLS]Stock Altered 1100'!$F11) -> Gold Digger | O8: ='\\ser\Software\other\[POINTS NQS  2012.XLS]Stock Altered 1100'!AA11 -> 59
A9: ='\\ser\Software\other\[POINTS NQS  2012.XLS]Stock Altered 1050'!$A12 -> 7 | B9: ='\\ser\Software\other\[POINTS NQS  2012.XLS]Stock Altered 1050'!$B12 -> Jamie Lewis | C9: ='\\ser\Software\other\[POINTS NQS  2012.XLS]Stock Altered 1050'!$C12 -> Cincinnati, Oh | D9: =IF('\\ser\Software\other\[POINTS NQS  2012.XLS]Stock Altered 1050'!$D12=0," ",'\\ser\Software\other\[POINTS NQS  2012.XLS]Stock Altered 1050'!$D12) -> TV | E9: ='\\ser\Software\other\[POINTS NQS  2012.XLS]Stock Altered 1050'!$E12 -> 19 | F9: =IF('\\ser\Software\other\[POINTS NQS  2012.XLS]Stock Altered 1050'!$F12=0," ",'\\ser\Software\other\[POINTS NQS  2012.XLS]Stock Altered 1050'!$F12) -> Oh So Orange | G9: ='\\ser\Software\other\[POINTS NQS  2012.XLS]Stock Altered 1050'!AA12 -> 55 | I9: ='\\ser\Software\other\[POINTS NQS  2012.XLS]Stock Altered 1100'!$A12 -> 7 | J9: ='\\ser\Software\other\[POINTS NQS  2012.XLS]Stock Altered 1100'!$B12 -> Tim Shaw | K9: ='\\ser\Software\other\[POINTS NQS  2012.XLS]Stock Altered 1100'!$C12 -> Rockbridge, OH | L9: =IF('\\ser\Software\other\[POINTS NQS  2012.XLS]Stock Altered 1100'!$D12=0," ",'\\ser\Software\other\[POINTS NQS  2012.XLS]Stock Altered 1100'!$D12) -> TV | M9: ='\\ser\Software\other\[POINTS NQS  2012.XLS]Stock Altered 1100'!$E12 -> 454 | N9: =IF('\\ser\Software\other\[POINTS NQS  2012.XLS]Stock Altered 1100'!$F12=0," ",'\\ser\Software\other\[POINTS NQS  2012.XLS]Stock Altered 1100'!$F12) -> Heavy Hauler | O9: ='\\ser\Software\other\[POINTS NQS  2012.XLS]Stock Altered 1100'!AA12 -> 63
A10: ='\\ser\Software\other\[POINTS NQS  2012.XLS]Stock Altered 1050'!$A13 -> 8 | B10: ='\\ser\Software\other\[POINTS NQS  2012.XLS]Stock Altered 1050'!$B13 -> Ed Kerner | C10: ='\\ser\Software\other\[POINTS NQS  2012.XLS]Stock Altered 1050'!$C13 -> Kimball, MI | D10: =IF('\\ser\Software\other\[POINTS NQS  2012.XLS]Stock Altered 1050'!$D13=0," ",'\\ser\Software\other\[POINTS NQS  2012.XLS]Stock Altered 1050'!$D13) -> NP | E10: ='\\ser\Software\other\[POINTS NQS  2012.XLS]Stock Altered 1050'!$E13 -> 303 | F10: =IF('\\ser\Software\other\[POINTS NQS  2012.XLS]Stock Altered 1050'!$F13=0," ",'\\ser\Software\other\[POINTS NQS  2012.XLS]Stock Altered 1050'!$F13) -> Along for the Ride | G10: ='\\ser\Software\other\[POINTS NQS  2012.XLS]Stock Altered 1050'!AA13 -> 55 | I10: ='\\ser\Software\other\[POINTS NQS  2012.XLS]Stock Altered 1100'!$A13 -> 8 | J10: ='\\ser\Software\other\[POINTS NQS  2012.XLS]Stock Altered 1100'!$B13 -> Lonnie Lewis | K10: ='\\ser\Software\other\[POINTS NQS  2012.XLS]Stock Altered 1100'!$C13 -> Milford, OH | L10: =IF('\\ser\Software\other\[POINTS NQS  2012.XLS]Stock Altered 1100'!$D13=0," ",'\\ser\Software\other\[POINTS NQS  2012.XLS]Stock Altered 1100'!$D13) -> TV | M10: ='\\ser\Software\other\[POINTS NQS  2012.XLS]Stock Altered 1100'!$E13 -> 24 | N10: =IF('\\ser\Software\other\[POINTS NQS  2012.XLS]Stock Altered 1100'!$F13=0," ",'\\ser\Software\other\[POINTS NQS  2012.XLS]Stock Altered 1100'!$F13) -> Deuces Wild | O10: ='\\ser\Software\other\[POINTS NQS  2012.XLS]Stock Altered 1100'!AA13 -> 70
A11: ='\\ser\Software\other\[POINTS NQS  2012.XLS]Stock Altered 1050'!$A14 -> 9 | B11: ='\\ser\Software\other\[POINTS NQS  2012.XLS]Stock Altered 1050'!$B14 -> Colt Vorhees | C11: ='\\ser\Software\other\[POINTS NQS  2012.XLS]Stock Altered 1050'!$C14 -> Rockbridge, OH | D11: =IF('\\ser\Software\other\[POINTS NQS  2012.XLS]Stock Altered 1050'!$D14=0," ",'\\ser\Software\other\[POINTS NQS  2012.XLS]Stock Altered 1050'!$D14) -> TV | E11: ='\\ser\Software\other\[POINTS NQS  2012.XLS]Stock Altered 1050'!$E14 -> 313 | F11: =IF('\\ser\Software\other\[POINTS NQS  2012.XLS]Stock Altered 1050'!$F14=0," ",'\\ser\Software\other\[POINTS NQS  2012.XLS]Stock Altered 1050'!$F14) -> Red Cadet | G11: ='\\ser\Software\other\[POINTS NQS  2012.XLS]Stock Altered 1050'!AA14 -> 57 | I11: ='\\ser\Software\other\[POINTS NQS  2012.XLS]Stock Altered 1100'!$A14 -> 9 | J11: ='\\ser\Software\other\[POINTS NQS  2012.XLS]Stock Altered 1100'!$B14 -> Eli Zimmerman | K11: ='\\ser\Software\other\[POINTS NQS  2012.XLS]Stock Altered 1100'!$C14 -> Allentown, PA | L11: =IF('\\ser\Software\other\[POINTS NQS  2012.XLS]Stock Altered 1100'!$D14=0," ",'\\ser\Software\other\[POINTS NQS  2012.XLS]Stock Altered 1100'!$D14) -> NP | M11: ='\\ser\Software\other\[POINTS NQS  2012.XLS]Stock Altered 1100'!$E14 -> 75 | N11: =IF('\\ser\Software\other\[POINTS NQS  2012.XLS]Stock Altered 1100'!$F14=0," ",'\\ser\Software\other\[POINTS NQS  2012.XLS]Stock Altered 1100'!$F14) -> Red Fever | O11: ='\\ser\Software\other\[POINTS NQS  2012.XLS]Stock Altered 1100'!AA14 -> 72
A12: ='\\ser\Software\other\[POINTS NQS  2012.XLS]Stock Altered 1050'!$A15 -> 10 | B12: ='\\ser\Software\other\[POINTS NQS  2012.XLS]Stock Altered 1050'!$B15 -> Lonnie Lewis | C12: ='\\ser\Software\other\[POINTS NQS  2012.XLS]Stock Altered 1050'!$C15 -> Milford, OH | D12: =IF('\\ser\Software\other\[POINTS NQS  2012.XLS]Stock Altered 1050'!$D15=0," ",'\\ser\Software\other\[POINTS NQS  2012.XLS]Stock Altered 1050'!$D15) -> TV | E12: ='\\ser\Software\other\[POINTS NQS  2012.XLS]Stock Altered 1050'!$E15 -> 24 | F12: =IF('\\ser\Software\other\[POINTS NQS  2012.XLS]Stock Altered 1050'!$F15=0," ",'\\ser\Software\other\[POINTS NQS  2012.XLS]Stock Altered 1050'!$F15) -> Deuces Wild | G12: ='\\ser\Software\other\[POINTS NQS  2012.XLS]Stock Altered 1050'!AA15 -> 63 | I12: ='\\ser\Software\other\[POINTS NQS  2012.XLS]Stock Altered 1100'!$A15 -> 10 | J12: ='\\ser\Software\other\[POINTS NQS  2012.XLS]Stock Altered 1100'!$B15 -> Randy Demers | K12: ='\\ser\Software\other\[POINTS NQS  2012.XLS]Stock Altered 1100'!$C15 -> Columbia, NJ | L12: =IF('\\ser\Software\other\[POINTS NQS  2012.XLS]Stock Altered 1100'!$D15=0," ",'\\ser\Software\other\[POINTS NQS  2012.XLS]Stock Altered 1100'!$D15) -> NP | M12: ='\\ser\Software\other\[POINTS NQS  2012.XLS]Stock Altered 1100'!$E15 -> 84 | N12: =IF('\\ser\Software\other\[POINTS NQS  2012.XLS]Stock Altered 1100'!$F15=0," ",'\\ser\Software\other\[POINTS NQS  2012.XLS]Stock Altered 1100'!$F15) -> Bounty Hunter | O12: ='\\ser\Software\other\[POINTS NQS  2012.XLS]Stock Altered 1100'!AA15 -> 79
A13: ='\\ser\Software\other\[POINTS NQS  2012.XLS]Stock Altered 1050'!$A16 -> 11 | B13: ='\\ser\Software\other\[POINTS NQS  2012.XLS]Stock Altered 1050'!$B16 -> Judy Lowe | C13: ='\\ser\Software\other\[POINTS NQS  2012.XLS]Stock Altered 1050'!$C16 -> Urbana, OH | D13: =IF('\\ser\Software\other\[POINTS NQS  2012.XLS]Stock Altered 1050'!$D16=0," ",'\\ser\Software\other\[POINTS NQS  2012.XLS]Stock Altered 1050'!$D16) -> TV | E13: ='\\ser\Software\other\[POINTS NQS  2012.XLS]Stock Altered 1050'!$E16 -> 10 | F13: =IF('\\ser\Software\other\[POINTS NQS  2012.XLS]Stock Altered 1050'!$F16=0," ",'\\ser\Software\other\[POINTS NQS  2012.XLS]Stock Altered 1050'!$F16) -> SlowMotion | G13: ='\\ser\Software\other\[POINTS NQS  2012.XLS]Stock Altered 1050'!AA16 -> 64 | I13: ='\\ser\Software\other\[POINTS NQS  2012.XLS]Stock Altered 1100'!$A16 -> 11 | J13: ='\\ser\Software\other\[POINTS NQS  2012.XLS]Stock Altered 1100'!$B16 -> Judy Lowe | K13: ='\\ser\Software\other\[POINTS NQS  2012.XLS]Stock Altered 1100'!$C16 -> Urbana, OH | L13: =IF('\\ser\Software\other\[POINTS NQS  2012.XLS]Stock Altered 1100'!$D16=0," ",'\\ser\Software\other\[POINTS NQS  2012.XLS]Stock Altered 1100'!$D16) -> TV | M13: ='\\ser\Software\other\[POINTS NQS  2012.XLS]Stock Altered 1100'!$E16 -> 10 | N13: =IF('\\ser\Software\other\[POINTS NQS  2012.XLS]Stock Altered 1100'!$F16=0," ",'\\ser\Software\other\[POINTS NQS  2012.XLS]Stock Altered 1100'!$F16) -> SlowMotion | O13: ='\\ser\Software\other\[POINTS NQS  2012.XLS]Stock Altered 1100'!AA16 -> 82
A14: ='\\ser\Software\other\[POINTS NQS  2012.XLS]Stock Altered 1050'!$A17 -> 12 | B14: ='\\ser\Software\other\[POINTS NQS  2012.XLS]Stock Altered 1050'!$B17 -> Donnie Herring | C14: ='\\ser\Software\other\[POINTS NQS  2012.XLS]Stock Altered 1050'!$C17 -> Rockbridge, OH | D14: =IF('\\ser\Software\other\[POINTS NQS  2012.XLS]Stock Altered 1050'!$D17=0," ",'\\ser\Software\other\[POINTS NQS  2012.XLS]Stock Altered 1050'!$D17) -> TV | E14: ='\\ser\Software\other\[POINTS NQS  2012.XLS]Stock Altered 1050'!$E17 -> 331 | F14: =IF('\\ser\Software\other\[POINTS NQS  2012.XLS]Stock Altered 1050'!$F17=0," ",'\\ser\Software\other\[POINTS NQS  2012.XLS]Stock Altered 1050'!$F17) -> Pasttime | G14: ='\\ser\Software\other\[POINTS NQS  2012.XLS]Stock Altered 1050'!AA17 -> 67 | I14: ='\\ser\Software\other\[POINTS NQS  2012.XLS]Stock Altered 1100'!$A17 -> 12 | J14: ='\\ser\Software\other\[POINTS NQS  2012.XLS]Stock Altered 1100'!$B17 -> Ron Hodge | K14: ='\\ser\Software\other\[POINTS NQS  2012.XLS]Stock Altered 1100'!$C17 -> Hillsboro, OH | L14: =IF('\\ser\Software\other\[POINTS NQS  2012.XLS]Stock Altered 1100'!$D17=0," ",'\\ser\Software\other\[POINTS NQS  2012.XLS]Stock Altered 1100'!$D17) -> TV | M14: ='\\ser\Software\other\[POINTS NQS  2012.XLS]Stock Altered 1100'!$E17 -> 71 | N14: =IF('\\ser\Software\other\[POINTS NQS  2012.XLS]Stock Altered 1100'!$F17=0," ",'\\ser\Software\other\[POINTS NQS  2012.XLS]Stock Altered 1100'!$F17) -> Take-N-Names | O14: ='\\ser\Software\other\[POINTS NQS  2012.XLS]Stock Altered 1100'!AA17 -> 85
A15: ='\\ser\Software\other\[POINTS NQS  2012.XLS]Stock Altered 1050'!$A18 -> 13 | B15: ='\\ser\Software\other\[POINTS NQS  2012.XLS]Stock Altered 1050'!$B18 -> Lee Dewald | C15: ='\\ser\Software\other\[POINTS NQS  2012.XLS]Stock Altered 1050'!$C18 -> Tiffon, OH | D15: =IF('\\ser\Software\other\[POINTS NQS  2012.XLS]Stock Altered 1050'!$D18=0," ",'\\ser\Software\other\[POINTS NQS  2012.XLS]Stock Altered 1050'!$D18) -> NP | E15: ='\\ser\Software\other\[POINTS NQS  2012.XLS]Stock Altered 1050'!$E18 -> 465 | F15: =IF('\\ser\Software\other\[POINTS NQS  2012.XLS]Stock Altered 1050'!$F18=0," ",'\\ser\Software\other\[POINTS NQS  2012.XLS]Stock Altered 1050'!$F18) -> Barnyard Bandit | G15: ='\\ser\Software\other\[POINTS NQS  2012.XLS]Stock Altered 1050'!AA18 -> 67 | I15: ='\\ser\Software\other\[POINTS NQS  2012.XLS]Stock Altered 1100'!$A18 -> 13 | J15: ='\\ser\Software\other\[POINTS NQS  2012.XLS]Stock Altered 1100'!$B18 -> Gregory Vandervort | K15: ='\\ser\Software\other\[POINTS NQS  2012.XLS]Stock Altered 1100'!$C18 -> Albion, PA | L15: =IF('\\ser\Software\other\[POINTS NQS  2012.XLS]Stock Altered 1100'!$D18=0," ",'\\ser\Software\other\[POINTS NQS  2012.XLS]Stock Altered 1100'!$D18) -> TV | M15: ='\\ser\Software\other\[POINTS NQS  2012.XLS]Stock Altered 1100'!$E18 -> 346 | N15: =IF('\\ser\Software\other\[POINTS NQS  2012.XLS]Stock Altered 1100'!$F18=0," ",'\\ser\Software\other\[POINTS NQS  2012.XLS]Stock Altered 1100'!$F18) -> Yellow Cub | O15: ='\\ser\Software\other\[POINTS NQS  2012.XLS]Stock Altered 1100'!AA18 -> 86
A16: ='\\ser\Software\other\[POINTS NQS  2012.XLS]Stock Altered 1050'!$A19 -> 14 | B16: ='\\ser\Software\other\[POINTS NQS  2012.XLS]Stock Altered 1050'!$B19 -> William Hart | C16: ='\\ser\Software\other\[POINTS NQS  2012.XLS]Stock Altered 1050'!$C19 -> Athens, Oh | D16: =IF('\\ser\Software\other\[POINTS NQS  2012.XLS]Stock Altered 1050'!$D19=0," ",'\\ser\Software\other\[POINTS NQS  2012.XLS]Stock Altered 1050'!$D19) -> JRS | E16: ='\\ser\Software\other\[POINTS NQS  2012.XLS]Stock Altered 1050'!$E19 -> 470 | F16: =IF('\\ser\Software\other\[POINTS NQS  2012.XLS]Stock Altered 1050'!$F19=0," ",'\\ser\Software\other\[POINTS NQS  2012.XLS]Stock Altered 1050'!$F19) -> Marie La Veau | G16: ='\\ser\Software\other\[POINTS NQS  2012.XLS]Stock Altered 1050'!AA19 -> 68 | I16: ='\\ser\Software\other\[POINTS NQS  2012.XLS]Stock Altered 1100'!$A19 -> 14 | J16: ='\\ser\Software\other\[POINTS NQS  2012.XLS]Stock Altered 1100'!$B19 -> Rick James | K16: ='\\ser\Software\other\[POINTS NQS  2012.XLS]Stock Altered 1100'!$C19 -> Lancaster, OH | L16: =IF('\\ser\Software\other\[POINTS NQS  2012.XLS]Stock Altered 1100'!$D19=0," ",'\\ser\Software\other\[POINTS NQS  2012.XLS]Stock Altered 1100'!$D19) -> BJ | M16: ='\\ser\Software\other\[POINTS NQS  2012.XLS]Stock Altered 1100'!$E19 -> 427 | N16: =IF('\\ser\Software\other\[POINTS NQS  2012.XLS]Stock Altered 1100'!$F19=0," ",'\\ser\Software\other\[POINTS NQS  2012.XLS]Stock Altered 1100'!$F19) -> James Gang III | O16: ='\\ser\Software\other\[POINTS NQS  2012.XLS]Stock Altered 1100'!AA19 -> 89
A17: ='\\ser\Software\other\[POINTS NQS  2012.XLS]Stock Altered 1050'!$A20 -> 15 | B17: ='\\ser\Software\other\[POINTS NQS  2012.XLS]Stock Altered 1050'!$B20 -> Roger McKinney | C17: ='\\ser\Software\other\[POINTS NQS  2012.XLS]Stock Altered 1050'!$C20 -> Lake Ariel, PA | D17: =IF('\\ser\Software\other\[POINTS NQS  2012.XLS]Stock Altered 1050'!$D20=0," ",'\\ser\Software\other\[POINTS NQS  2012.XLS]Stock Altered 1050'!$D20) -> JRS | E17: ='\\ser\Software\other\[POINTS NQS  2012.XLS]Stock Altered 1050'!$E20 -> 83 | F17: =IF('\\ser\Software\other\[POINTS NQS  2012.XLS]Stock Altered 1050'!$F20=0," ",'\\ser\Software\other\[POINTS NQS  2012.XLS]Stock Altered 1050'!$F20) -> Blue Thunder | G17: ='\\ser\Software\other\[POINTS NQS  2012.XLS]Stock Altered 1050'!AA20 -> 69 | I17: ='\\ser\Software\other\[POINTS NQS  2012.XLS]Stock Altered 1100'!$A20 -> 15 | J17: ='\\ser\Software\other\[POINTS NQS  2012.XLS]Stock Altered 1100'!$B20 -> Kelly Nichols | K17: ='\\ser\Software\other\[POINTS NQS  2012.XLS]Stock Altered 1100'!$C20 -> Lore City, OH | L17: =IF('\\ser\Software\other\[POINTS NQS  2012.XLS]Stock Altered 1100'!$D20=0," ",'\\ser\Software\other\[POINTS NQS  2012.XLS]Stock Altered 1100'!$D20) -> NP | M17: ='\\ser\Software\other\[POINTS NQS  2012.XLS]Stock Altered 1100'!$E20 -> 358 | N17: =IF('\\ser\Software\other\[POINTS NQS  2012.XLS]Stock Altered 1100'!$F20=0," ",'\\ser\Software\other\[POINTS NQS  2012.XLS]Stock Altered 1100'!$F20) -> Maxx'd Out | O17: ='\\ser\Software\other\[POINTS NQS  2012.XLS]Stock Altered 1100'!AA20 -> 91
A18: ='\\ser\Software\other\[POINTS NQS  2012.XLS]Stock Altered 1050'!$A21 -> 16 | B18: ='\\ser\Software\other\[POINTS NQS  2012.XLS]Stock Altered 1050'!$B21 -> Ron Finch | C18: ='\\ser\Software\other\[POINTS NQS  2012.XLS]Stock Altered 1050'!$C21 -> Milan, MI | D18: =IF('\\ser\Software\other\[POINTS NQS  2012.XLS]Stock Altered 1050'!$D21=0," ",'\\ser\Software\other\[POINTS NQS  2012.XLS]Stock Altered 1050'!$D21) -> Woods | E18: ='\\ser\Software\other\[POINTS NQS  2012.XLS]Stock Altered 1050'!$E21 -> 142 | F18: =IF('\\ser\Software\other\[POINTS NQS  2012.XLS]Stock Altered 1050'!$F21=0," ",'\\ser\Software\other\[POINTS NQS  2012.XLS]Stock Altered 1050'!$F21) -> Top Notch | G18: ='\\ser\Software\other\[POINTS NQS  2012.XLS]Stock Altered 1050'!AA21 -> 70 | I18: ='\\ser\Software\other\[POINTS NQS  2012.XLS]Stock Altered 1100'!$A21 -> 16 | J18: ='\\ser\Software\other\[POINTS NQS  2012.XLS]Stock Altered 1100'!$B21 -> Cody Costa | K18: ='\\ser\Software\other\[POINTS NQS  2012.XLS]Stock Altered 1100'!$C21 -> Greencastle, PA | L18: =IF('\\ser\Software\other\[POINTS NQS  2012.XLS]Stock Altered 1100'!$D21=0," ",'\\ser\Software\other\[POINTS NQS  2012.XLS]Stock Altered 1100'!$D21) -> NP | M18: ='\\ser\Software\other\[POINTS NQS  2012.XLS]Stock Altered 1100'!$E21 -> 135 | N18: =IF('\\ser\Software\other\[POINTS NQS  2012.XLS]Stock Altered 1100'!$F21=0," ",'\\ser\Software\other\[POINTS NQS  2012.XLS]Stock Altered 1100'!$F21) -> Wild Child | O18: ='\\ser\Software\other\[POINTS NQS  2012.XLS]Stock Altered 1100'!AA21 -> 92
A19: ='\\ser\Software\other\[POINTS NQS  2012.XLS]Stock Altered 1050'!$A22 -> 17 | B19: ='\\ser\Software\other\[POINTS NQS  2012.XLS]Stock Altered 1050'!$B22 -> Bob Jones JR | C19: ='\\ser\Software\other\[POINTS NQS  2012.XLS]Stock Altered 1050'!$C22 -> Hopewell, OH | D19: =IF('\\ser\Software\other\[POINTS NQS  2012.XLS]Stock Altered 1050'!$D22=0," ",'\\ser\Software\other\[POINTS NQS  2012.XLS]Stock Altered 1050'!$D22) -> BJ | E19: ='\\ser\Software\other\[POINTS NQS  2012.XLS]Stock Altered 1050'!$E22 -> 183 | F19: =IF('\\ser\Software\other\[POINTS NQS  2012.XLS]Stock Altered 1050'!$F22=0," ",'\\ser\Software\other\[POINTS NQS  2012.XLS]Stock Altered 1050'!$F22) -> Playdough | G19: ='\\ser\Software\other\[POINTS NQS  2012.XLS]Stock Altered 1050'!AA22 -> 70 | I19: ='\\ser\Software\other\[POINTS NQS  2012.XLS]Stock Altered 1100'!$A22 -> 17 | J19: ='\\ser\Software\other\[POINTS NQS  2012.XLS]Stock Altered 1100'!$B22 -> Gary Seaman | K19: ='\\ser\Software\other\[POINTS NQS  2012.XLS]Stock Altered 1100'!$C22 -> Fleming, OH | L19: =IF('\\ser\Software\other\[POINTS NQS  2012.XLS]Stock Altered 1100'!$D22=0," ",'\\ser\Software\other\[POINTS NQS  2012.XLS]Stock Altered 1100'!$D22) -> BJ | M19: ='\\ser\Software\other\[POINTS NQS  2012.XLS]Stock Altered 1100'!$E22 -> 191 | N19: =IF('\\ser\Software\other\[POINTS NQS  2012.XLS]Stock Altered 1100'!$F22=0," ",'\\ser\Software\other\[POINTS NQS  2012.XLS]Stock Altered 1100'!$F22) -> Farmers Money | O19: ='\\ser\Software\other\[POINTS NQS  2012.XLS]Stock Altered 1100'!AA22 -> 95
A20: ='\\ser\Software\other\[POINTS NQS  2012.XLS]Stock Altered 1050'!$A23 -> 18 | B20: ='\\ser\Software\other\[POINTS NQS  2012.XLS]Stock Altered 1050'!$B23 -> Eli Zimmerman | C20: ='\\ser\Software\other\[POINTS NQS  2012.XLS]Stock Altered 1050'!$C23 -> Allentown, PA | D20: =IF('\\ser\Software\other\[POINTS NQS  2012.XLS]Stock Altered 1050'!$D23=0," ",'\\ser\Software\other\[POINTS NQS  2012.XLS]Stock Altered 1050'!$D23) -> NP | E20: ='\\ser\Software\other\[POINTS NQS  2012.XLS]Stock Altered 1050'!$E23 -> 75 | F20: =IF('\\ser\Software\other\[POINTS NQS  2012.XLS]Stock Altered 1050'!$F23=0," ",'\\ser\Software\other\[POINTS NQS  2012.XLS]Stock Altered 1050'!$F23) -> Red Fever | G20: ='\\ser\Software\other\[POINTS NQS  2012.XLS]Stock Altered 1050'!AA23 -> 78 | I20: ='\\ser\Software\other\[POINTS NQS  2012.XLS]Stock Altered 1100'!$A23 -> 18 | J20: ='\\ser\Software\other\[POINTS NQS  2012.XLS]Stock Altered 1100'!$B23 -> Jamie Lewis | K20: ='\\ser\Software\other\[POINTS NQS  2012.XLS]Stock Altered 1100'!$C23 -> Cincinnati, oh | L20: =IF('\\ser\Software\other\[POINTS NQS  2012.XLS]Stock Altered 1100'!$D23=0," ",'\\ser\Software\other\[POINTS NQS  2012.XLS]Stock Altered 1100'!$D23) -> TV | M20: ='\\ser\Software\other\[POINTS NQS  2012.XLS]Stock Altered 1100'!$E23 -> 19 | N20: =IF('\\ser\Software\other\[POINTS NQS  2012.XLS]Stock Altered 1100'!$F23=0," ",'\\ser\Software\other\[POINTS NQS  2012.XLS]Stock Altered 1100'!$F23) -> Oh So Orange | O20: ='\\ser\Software\other\[POINTS NQS  2012.XLS]Stock Altered 1100'!AA23 -> 97
A21: ='\\ser\Software\other\[POINTS NQS  2012.XLS]Stock Altered 1050'!$A24 -> 19 | B21: ='\\ser\Software\other\[POINTS NQS  2012.XLS]Stock Altered 1050'!$B24 -> Tim Shaw | C21: ='\\ser\Software\other\[POINTS NQS  2012.XLS]Stock Altered 1050'!$C24 -> Rockbridge, OH | D21: =IF('\\ser\Software\other\[POINTS NQS  2012.XLS]Stock Altered 1050'!$D24=0," ",'\\ser\Software\other\[POINTS NQS  2012.XLS]Stock Altered 1050'!$D24) -> TV | E21: ='\\ser\Software\other\[POINTS NQS  2012.XLS]Stock Altered 1050'!$E24 -> 454 | F21: =IF('\\ser\Software\other\[POINTS NQS  2012.XLS]Stock Altered 1050'!$F24=0," ",'\\ser\Software\other\[POINTS NQS  2012.XLS]Stock Altered 1050'!$F24) -> Heavy Hauler | G21: ='\\ser\Software\other\[POINTS NQS  2012.XLS]Stock Altered 1050'!AA24 -> 83 | I21: ='\\ser\Software\other\[POINTS NQS  2012.XLS]Stock Altered 1100'!$A24 -> 19 | J21: ='\\ser\Software\other\[POINTS NQS  2012.XLS]Stock Altered 1100'!$B24 -> John Dewald | K21: ='\\ser\Software\other\[POINTS NQS  2012.XLS]Stock Altered 1100'!$C24 -> Tiffon, OH | L21: =IF('\\ser\Software\other\[POINTS NQS  2012.XLS]Stock Altered 1100'!$D24=0," ",'\\ser\Software\other\[POINTS NQS  2012.XLS]Stock Altered 1100'!$D24) -> RPM | M21: ='\\ser\Software\other\[POINTS NQS  2012.XLS]Stock Altered 1100'!$E24 -> 484 | N21: =IF('\\ser\Software\other\[POINTS NQS  2012.XLS]Stock Altered 1100'!$F24=0," ",'\\ser\Software\other\[POINTS NQS  2012.XLS]Stock Altered 1100'!$F24) -> Patience | O21: ='\\ser\Software\other\[POINTS NQS  2012.XLS]Stock Altered 1100'!AA24 -> 97
A22: ='\\ser\Software\other\[POINTS NQS  2012.XLS]Stock Altered 1050'!$A25 -> 20 | B22: ='\\ser\Software\other\[POINTS NQS  2012.XLS]Stock Altered 1050'!$B25 -> Greg Watson | C22: ='\\ser\Software\other\[POINTS NQS  2012.XLS]Stock Altered 1050'!$C25 -> Batavia, OH | D22: =IF('\\ser\Software\other\[POINTS NQS  2012.XLS]Stock Altered 1050'!$D25=0," ",'\\ser\Software\other\[POINTS NQS  2012.XLS]Stock Altered 1050'!$D25) -> NP | E22: ='\\ser\Software\other\[POINTS NQS  2012.XLS]Stock Altered 1050'!$E25 -> 327 | F22: =IF('\\ser\Software\other\[POINTS NQS  2012.XLS]Stock Altered 1050'!$F25=0," ",'\\ser\Software\other\[POINTS NQS  2012.XLS]Stock Altered 1050'!$F25) -> Road Warrior | G22: ='\\ser\Software\other\[POINTS NQS  2012.XLS]Stock Altered 1050'!AA25 -> 93 | I22: ='\\ser\Software\other\[POINTS NQS  2012.XLS]Stock Altered 1100'!$A25 -> 20 | J22: ='\\ser\Software\other\[POINTS NQS  2012.XLS]Stock Altered 1100'!$B25 -> Shane Hadley | K22: ='\\ser\Software\other\[POINTS NQS  2012.XLS]Stock Altered 1100'!$C25 -> Marion, NY | L22: =IF('\\ser\Software\other\[POINTS NQS  2012.XLS]Stock Altered 1100'!$D25=0," ",'\\ser\Software\other\[POINTS NQS  2012.XLS]Stock Altered 1100'!$D25) -> LR | M22: ='\\ser\Software\other\[POINTS NQS  2012.XLS]Stock Altered 1100'!$E25 -> 442 | N22: =IF('\\ser\Software\other\[POINTS NQS  2012.XLS]Stock Altered 1100'!$F25=0," ",'\\ser\Software\other\[POINTS NQS  2012.XLS]Stock Altered 1100'!$F25) -> Foot Finder | O22: ='\\ser\Software\other\[POINTS NQS  2012.XLS]Stock Altered 1100'!AA25 -> 101
A23: ='\\ser\Software\other\[POINTS NQS  2012.XLS]Stock Altered 1050'!$A26 -> 21 | B23: ='\\ser\Software\other\[POINTS NQS  2012.XLS]Stock Altered 1050'!$B26 -> Mark Peters | C23: ='\\ser\Software\other\[POINTS NQS  2012.XLS]Stock Altered 1050'!$C26 -> McArthur, PA | D23: =IF('\\ser\Software\other\[POINTS NQS  2012.XLS]Stock Altered 1050'!$D26=0," ",'\\ser\Software\other\[POINTS NQS  2012.XLS]Stock Altered 1050'!$D26) -> JRS | E23: ='\\ser\Software\other\[POINTS NQS  2012.XLS]Stock Altered 1050'!$E26 -> 469 | F23: =IF('\\ser\Software\other\[POINTS NQS  2012.XLS]Stock Altered 1050'!$F26=0," ",'\\ser\Software\other\[POINTS NQS  2012.XLS]Stock Altered 1050'!$F26) -> American Ride | G23: ='\\ser\Software\other\[POINTS NQS  2012.XLS]Stock Altered 1050'!AA26 -> 98 | I23: ='\\ser\Software\other\[POINTS NQS  2012.XLS]Stock Altered 1100'!$A26 -> 21 | J23: ='\\ser\Software\other\[POINTS NQS  2012.XLS]Stock Altered 1100'!$B26 -> Dave Washburn | K23: ='\\ser\Software\other\[POINTS NQS  2012.XLS]Stock Altered 1100'!$C26 -> Guysville, OH | L23: =IF('\\ser\Software\other\[POINTS NQS  2012.XLS]Stock Altered 1100'!$D26=0," ",'\\ser\Software\other\[POINTS NQS  2012.XLS]Stock Altered 1100'!$D26) -> BJ | M23: ='\\ser\Software\other\[POINTS NQS  2012.XLS]Stock Altered 1100'!$E26 -> 156 | N23: =IF('\\ser\Software\other\[POINTS NQS  2012.XLS]Stock Altered 1100'!$F26=0," ",'\\ser\Software\other\[POINTS NQS  2012.XLS]Stock Altered 1100'!$F26) -> Last Minute | O23: ='\\ser\Software\other\[POINTS NQS  2012.XLS]Stock Altered 1100'!AA26 -> 106
A24: ='\\ser\Software\other\[POINTS NQS  2012.XLS]Stock Altered 1050'!$A27 -> 22 | B24: ='\\ser\Software\other\[POINTS NQS  2012.XLS]Stock Altered 1050'!$B27 -> Doug Seaman | C24: ='\\ser\Software\other\[POINTS NQS  2012.XLS]Stock Altered 1050'!$C27 -> Vincent, OH | D24: =IF('\\ser\Software\other\[POINTS NQS  2012.XLS]Stock Altered 1050'!$D27=0," ",'\\ser\Software\other\[POINTS NQS  2012.XLS]Stock Altered 1050'!$D27) -> BJ | E24: ='\\ser\Software\other\[POINTS NQS  2012.XLS]Stock Altered 1050'!$E27 -> 192 | F24: =IF('\\ser\Software\other\[POINTS NQS  2012.XLS]Stock Altered 1050'!$F27=0," ",'\\ser\Software\other\[POINTS NQS  2012.XLS]Stock Altered 1050'!$F27) -> Massey Ferguson | G24: ='\\ser\Software\other\[POINTS NQS  2012.XLS]Stock Altered 1050'!AA27 -> 99 | I24: ='\\ser\Software\other\[POINTS NQS  2012.XLS]Stock Altered 1100'!$A27 -> 22 | J24: ='\\ser\Software\other\[POINTS NQS  2012.XLS]Stock Altered 1100'!$B27 -> Lee Dewald | K24: ='\\ser\Software\other\[POINTS NQS  2012.XLS]Stock Altered 1100'!$C27 -> Tiffon, OH | L24: =IF('\\ser\Software\other\[POINTS NQS  2012.XLS]Stock Altered 1100'!$D27=0," ",'\\ser\Software\other\[POINTS NQS  2012.XLS]Stock Altered 1100'!$D27) -> NP | M24: ='\\ser\Software\other\[POINTS NQS  2012.XLS]Stock Altered 1100'!$E27 -> 465 | N24: =IF('\\ser\Software\other\[POINTS NQS  2012.XLS]Stock Altered 1100'!$F27=0," ",'\\ser\Software\other\[POINTS NQS  2012.XLS]Stock Altered 1100'!$F27) -> Barnyard Bandit | O24: ='\\ser\Software\other\[POINTS NQS  2012.XLS]Stock Altered 1100'!AA27 -> 106
A25: ='\\ser\Software\other\[POINTS NQS  2012.XLS]Stock Altered 1050'!$A28 -> 23 | B25: ='\\ser\Software\other\[POINTS NQS  2012.XLS]Stock Altered 1050'!$B28 -> Cody Costa | C25: ='\\ser\Software\other\[POINTS NQS  2012.XLS]Stock Altered 1050'!$C28 -> Greencastle, PA | D25: =IF('\\ser\Software\other\[POINTS NQS  2012.XLS]Stock Altered 1050'!$D28=0," ",'\\ser\Software\other\[POINTS NQS  2012.XLS]Stock Altered 1050'!$D28) -> NP | E25: ='\\ser\Software\other\[POINTS NQS  2012.XLS]Stock Altered 1050'!$E28 -> 135 | F25: =IF('\\ser\Software\other\[POINTS NQS  2012.XLS]Stock Altered 1050'!$F28=0," ",'\\ser\Software\other\[POINTS NQS  2012.XLS]Stock Altered 1050'!$F28) -> Wild Child | G25: ='\\ser\Software\other\[POINTS NQS  2012.XLS]Stock Altered 1050'!AA28 -> 100 | I25: ='\\ser\Software\other\[POINTS NQS  2012.XLS]Stock Altered 1100'!$A28 -> 23 | J25: ='\\ser\Software\other\[POINTS NQS  2012.XLS]Stock Altered 1100'!$B28 -> Ron Finch | K25: ='\\ser\Software\other\[POINTS NQS  2012.XLS]Stock Altered 1100'!$C28 -> Milan, MI | L25: =IF('\\ser\Software\other\[POINTS NQS  2012.XLS]Stock Altered 1100'!$D28=0," ",'\\ser\Software\other\[POINTS NQS  2012.XLS]Stock Altered 1100'!$D28) -> Woods | M25: ='\\ser\Software\other\[POINTS NQS  2012.XLS]Stock Altered 1100'!$E28 -> 142 | N25: =IF('\\ser\Software\other\[POINTS NQS  2012.XLS]Stock Altered 1100'!$F28=0," ",'\\ser\Software\other\[POINTS NQS  2012.XLS]Stock Altered 1100'!$F28) -> Top Notch | O25: ='\\ser\Software\other\[POINTS NQS  2012.XLS]Stock Altered 1100'!AA28 -> 117
A26: ='\\ser\Software\other\[POINTS NQS  2012.XLS]Stock Altered 1050'!$A29 -> 24 | B26: ='\\ser\Software\other\[POINTS NQS  2012.XLS]Stock Altered 1050'!$B29 -> Dave Washburn | C26: ='\\ser\Software\other\[POINTS NQS  2012.XLS]Stock Altered 1050'!$C29 -> Guysville, OH | D26: =IF('\\ser\Software\other\[POINTS NQS  2012.XLS]Stock Altered 1050'!$D29=0," ",'\\ser\Software\other\[POINTS NQS  2012.XLS]Stock Altered 1050'!$D29) -> BJ | E26: ='\\ser\Software\other\[POINTS NQS  2012.XLS]Stock Altered 1050'!$E29 -> 156 | F26: =IF('\\ser\Software\other\[POINTS NQS  2012.XLS]Stock Altered 1050'!$F29=0," ",'\\ser\Software\other\[POINTS NQS  2012.XLS]Stock Altered 1050'!$F29) -> Last Minute | G26: ='\\ser\Software\other\[POINTS NQS  2012.XLS]Stock Altered 1050'!AA29 -> 102 | I26: ='\\ser\Software\other\[POINTS NQS  2012.XLS]Stock Altered 1100'!$A29 -> 24 | J26: ='\\ser\Software\other\[POINTS NQS  2012.XLS]Stock Altered 1100'!$B29 -> Ed Kerner | K26: ='\\ser\Software\other\[POINTS NQS  2012.XLS]Stock Altered 1100'!$C29 -> Kimball, MI | L26: =IF('\\ser\Software\other\[POINTS NQS  2012.XLS]Stock Altered 1100'!$D29=0," ",'\\ser\Software\other\[POINTS NQS  2012.XLS]Stock Altered 1100'!$D29) -> NP | M26: ='\\ser\Software\other\[POINTS NQS  2012.XLS]Stock Altered 1100'!$E29 -> 303 | N26: =IF('\\ser\Software\other\[POINTS NQS  2012.XLS]Stock Altered 1100'!$F29=0," ",'\\ser\Software\other\[POINTS NQS  2012.XLS]Stock Altered 1100'!$F29) -> Along for the Ride | O26: ='\\ser\Software\other\[POINTS NQS  2012.XLS]Stock Altered 1100'!AA29 -> 125
A27: ='\\ser\Software\other\[POINTS NQS  2012.XLS]Stock Altered 1050'!$A30 -> 25 | B27: ='\\ser\Software\other\[POINTS NQS  2012.XLS]Stock Altered 1050'!$B30 -> Shane Hadley | C27: ='\\ser\Software\other\[POINTS NQS  2012.XLS]Stock Altered 1050'!$C30 -> Marion, NY | D27: =IF('\\ser\Software\other\[POINTS NQS  2012.XLS]Stock Altered 1050'!$D30=0," ",'\\ser\Software\other\[POINTS NQS  2012.XLS]Stock Altered 1050'!$D30) -> LR | E27: ='\\ser\Software\other\[POINTS NQS  2012.XLS]Stock Altered 1050'!$E30 -> 442 | F27: =IF('\\ser\Software\other\[POINTS NQS  2012.XLS]Stock Altered 1050'!$F30=0," ",'\\ser\Software\other\[POINTS NQS  2012.XLS]Stock Altered 1050'!$F30) -> Foot Finder | G27: ='\\ser\Software\other\[POINTS NQS  2012.XLS]Stock Altered 1050'!AA30 -> 104 | I27: ='\\ser\Software\other\[POINTS NQS  2012.XLS]Stock Altered 1100'!$A30 -> 25 | J27: ='\\ser\Software\other\[POINTS NQS  2012.XLS]Stock Altered 1100'!$B30 -> William Hart | K27: ='\\ser\Software\other\[POINTS NQS  2012.XLS]Stock Altered 1100'!$C30 -> Athens, Oh | L27: =IF('\\ser\Software\other\[POINTS NQS  2012.XLS]Stock Altered 1100'!$D30=0," ",'\\ser\Software\other\[POINTS NQS  2012.XLS]Stock Altered 1100'!$D30) -> JRS | M27: ='\\ser\Software\other\[POINTS NQS  2012.XLS]Stock Altered 1100'!$E30 -> 470 | N27: =IF('\\ser\Software\other\[POINTS NQS  2012.XLS]Stock Altered 1100'!$F30=0," ",'\\ser\Software\other\[POINTS NQS  2012.XLS]Stock Altered 1100'!$F30) -> Marie LaVeau | O27: ='\\ser\Software\other\[POINTS NQS  2012.XLS]Stock Altered 1100'!AA30 -> 132
A28: ='\\ser\Software\other\[POINTS NQS  2012.XLS]Stock Altered 1050'!$A31 -> 26 | B28: ='\\ser\Software\other\[POINTS NQS  2012.XLS]Stock Altered 1050'!$B31 -> Gary Seaman | C28: ='\\ser\Software\other\[POINTS NQS  2012.XLS]Stock Altered 1050'!$C31 -> Fleming, OH | D28: =IF('\\ser\Software\other\[POINTS NQS  2012.XLS]Stock Altered 1050'!$D31=0," ",'\\ser\Software\other\[POINTS NQS  2012.XLS]Stock Altered 1050'!$D31) -> BJ | E28: ='\\ser\Software\other\[POINTS NQS  2012.XLS]Stock Altered 1050'!$E31 -> 191 | F28: =IF('\\ser\Software\other\[POINTS NQS  2012.XLS]Stock Altered 1050'!$F31=0," ",'\\ser\Software\other\[POINTS NQS  2012.XLS]Stock Altered 1050'!$F31) -> Farmer's Money | G28: ='\\ser\Software\other\[POINTS NQS  2012.XLS]Stock Altered 1050'!AA31 -> 105 | I28: ='\\ser\Software\other\[POINTS NQS  2012.XLS]Stock Altered 1100'!$A31 -> 26 | J28: ='\\ser\Software\other\[POINTS NQS  2012.XLS]Stock Altered 1100'!$B31 -> Nevin Stitzer | K28: ='\\ser\Software\other\[POINTS NQS  2012.XLS]Stock Altered 1100'!$C31 -> Spring Mills, PA | L28: =IF('\\ser\Software\other\[POINTS NQS  2012.XLS]Stock Altered 1100'!$D31=0," ",'\\ser\Software\other\[POINTS NQS  2012.XLS]Stock Altered 1100'!$D31) -> BJ | M28: ='\\ser\Software\other\[POINTS NQS  2012.XLS]Stock Altered 1100'!$E31 -> 447 | N28: =IF('\\ser\Software\other\[POINTS NQS  2012.XLS]Stock Altered 1100'!$F31=0," ",'\\ser\Software\other\[POINTS NQS  2012.XLS]Stock Altered 1100'!$F31) -> Thunder Road | O28: ='\\ser\Software\other\[POINTS NQS  2012.XLS]Stock Altered 1100'!AA31 -> 135
A29: ='\\ser\Software\other\[POINTS NQS  2012.XLS]Stock Altered 1050'!$A32 -> 27 | B29: ='\\ser\Software\other\[POINTS NQS  2012.XLS]Stock Altered 1050'!$B32 -> Les Salyers | C29: ='\\ser\Software\other\[POINTS NQS  2012.XLS]Stock Altered 1050'!$C32 -> Sidney, OH | D29: =IF('\\ser\Software\other\[POINTS NQS  2012.XLS]Stock Altered 1050'!$D32=0," ",'\\ser\Software\other\[POINTS NQS  2012.XLS]Stock Altered 1050'!$D32) -> TV | E29: ='\\ser\Software\other\[POINTS NQS  2012.XLS]Stock Altered 1050'!$E32 -> 444 | F29: =IF('\\ser\Software\other\[POINTS NQS  2012.XLS]Stock Altered 1050'!$F32=0," ",'\\ser\Software\other\[POINTS NQS  2012.XLS]Stock Altered 1050'!$F32) -> Unfinished Business | G29: ='\\ser\Software\other\[POINTS NQS  2012.XLS]Stock Altered 1050'!AA32 -> 106 | I29: ='\\ser\Software\other\[POINTS NQS  2012.XLS]Stock Altered 1100'!$A32 -> 27 | J29: ='\\ser\Software\other\[POINTS NQS  2012.XLS]Stock Altered 1100'!$B32 -> Keith Frueh | K29: ='\\ser\Software\other\[POINTS NQS  2012.XLS]Stock Altered 1100'!$C32 -> Greenville, IL | L29: =IF('\\ser\Software\other\[POINTS NQS  2012.XLS]Stock Altered 1100'!$D32=0," ",'\\ser\Software\other\[POINTS NQS  2012.XLS]Stock Altered 1100'!$D32) -> JRS | M29: ='\\ser\Software\other\[POINTS NQS  2012.XLS]Stock Altered 1100'!$E32 -> 453 | N29: =IF('\\ser\Software\other\[POINTS NQS  2012.XLS]Stock Altered 1100'!$F32=0," ",'\\ser\Software\other\[POINTS NQS  2012.XLS]Stock Altered 1100'!$F32) -> Haulin Harvester | O29: ='\\ser\Software\other\[POINTS NQS  2012.XLS]Stock Altered 1100'!AA32 -> 135
A30: ='\\ser\Software\other\[POINTS NQS  2012.XLS]Stock Altered 1050'!$A33 -> 28 | B30: ='\\ser\Software\other\[POINTS NQS  2012.XLS]Stock Altered 1050'!$B33 -> Kenneth Smith | C30: ='\\ser\Software\other\[POINTS NQS  2012.XLS]Stock Altered 1050'!$C33 -> Ashland, OH | D30: =IF('\\ser\Software\other\[POINTS NQS  2012.XLS]Stock Altered 1050'!$D33=0," ",'\\ser\Software\other\[POINTS NQS  2012.XLS]Stock Altered 1050'!$D33) -> JRS | E30: ='\\ser\Software\other\[POINTS NQS  2012.XLS]Stock Altered 1050'!$E33 -> 125 | F30: =IF('\\ser\Software\other\[POINTS NQS  2012.XLS]Stock Altered 1050'!$F33=0," ",'\\ser\Software\other\[POINTS NQS  2012.XLS]Stock Altered 1050'!$F33) -> Sidewinder | G30: ='\\ser\Software\other\[POINTS NQS  2012.XLS]Stock Altered 1050'!AA33 -> 108 | I30: ='\\ser\Software\other\[POINTS NQS  2012.XLS]Stock Altered 1100'!$A33 -> 28 | J30: ='\\ser\Software\other\[POINTS NQS  2012.XLS]Stock Altered 1100'!$B33 -> Roger McKinney | K30: ='\\ser\Software\other\[POINTS NQS  2012.XLS]Stock Altered 1100'!$C33 -> Greenville, IL | L30: =IF('\\ser\Software\other\[POINTS NQS  2012.XLS]Stock Altered 1100'!$D33=0," ",'\\ser\Software\other\[POINTS NQS  2012.XLS]Stock Altered 1100'!$D33) -> JRS | M30: ='\\ser\Software\other\[POINTS NQS  2012.XLS]Stock Altered 1100'!$E33 -> 83 | N30: =IF('\\ser\Software\other\[POINTS NQS  2012.XLS]Stock Altered 1100'!$F33=0," ",'\\ser\Software\other\[POINTS NQS  2012.XLS]Stock Altered 1100'!$F33) -> Blue Thunder | O30: ='\\ser\Software\other\[POINTS NQS  2012.XLS]Stock Altered 1100'!AA33 -> 136
A31: ='\\ser\Software\other\[POINTS NQS  2012.XLS]Stock Altered 1050'!$A34 -> 29 | B31: ='\\ser\Software\other\[POINTS NQS  2012.XLS]Stock Altered 1050'!$B34 -> Rick James | C31: ='\\ser\Software\other\[POINTS NQS  2012.XLS]Stock Altered 1050'!$C34 -> Lancaster, OH | D31: =IF('\\ser\Software\other\[POINTS NQS  2012.XLS]Stock Altered 1050'!$D34=0," ",'\\ser\Software\other\[POINTS NQS  2012.XLS]Stock Altered 1050'!$D34) -> BJ | E31: ='\\ser\Software\other\[POINTS NQS  2012.XLS]Stock Altered 1050'!$E34 -> 427 | F31: =IF('\\ser\Software\other\[POINTS NQS  2012.XLS]Stock Altered 1050'!$F34=0," ",'\\ser\Software\other\[POINTS NQS  2012.XLS]Stock Altered 1050'!$F34) -> James Gang III | G31: ='\\ser\Software\other\[POINTS NQS  2012.XLS]Stock Altered 1050'!AA34 -> 108 | I31: ='\\ser\Software\other\[POINTS NQS  2012.XLS]Stock Altered 1100'!$A34 -> 29 | J31: ='\\ser\Software\other\[POINTS NQS  2012.XLS]Stock Altered 1100'!$B34 -> Kenneth Smith | K31: ='\\ser\Software\other\[POINTS NQS  2012.XLS]Stock Altered 1100'!$C34 -> Ashland, OH | L31: =IF('\\ser\Software\other\[POINTS NQS  2012.XLS]Stock Altered 1100'!$D34=0," ",'\\ser\Software\other\[POINTS NQS  2012.XLS]Stock Altered 1100'!$D34) -> JRS | M31: ='\\ser\Software\other\[POINTS NQS  2012.XLS]Stock Altered 1100'!$E34 -> 125 | N31: =IF('\\ser\Software\other\[POINTS NQS  2012.XLS]Stock Altered 1100'!$F34=0," ",'\\ser\Software\other\[POINTS NQS  2012.XLS]Stock Altered 1100'!$F34) -> Sidewinder | O31: ='\\ser\Software\other\[POINTS NQS  2012.XLS]Stock Altered 1100'!AA34 -> 139
A32: ='\\ser\Software\other\[POINTS NQS  2012.XLS]Stock Altered 1050'!$A35 -> 30 | B32: ='\\ser\Software\other\[POINTS NQS  2012.XLS]Stock Altered 1050'!$B35 -> John Dewald | C32: ='\\ser\Software\other\[POINTS NQS  2012.XLS]Stock Altered 1050'!$C35 -> Tiffon, OH | D32: =IF('\\ser\Software\other\[POINTS NQS  2012.XLS]Stock Altered 1050'!$D35=0," ",'\\ser\Software\other\[POINTS NQS  2012.XLS]Stock Altered 1050'!$D35) -> RPM | E32: ='\\ser\Software\other\[POINTS NQS  2012.XLS]Stock Altered 1050'!$E35 -> 484 | F32: =IF('\\ser\Software\other\[POINTS NQS  2012.XLS]Stock Altered 1050'!$F35=0," ",'\\ser\Software\other\[POINTS NQS  2012.XLS]Stock Altered 1050'!$F35) -> Patience | G32: ='\\ser\Software\other\[POINTS NQS  2012.XLS]Stock Altered 1050'!AA35 -> 119 | I32: ='\\ser\Software\other\[POINTS NQS  2012.XLS]Stock Altered 1100'!$A35 -> 30 | J32: ='\\ser\Software\other\[POINTS NQS  2012.XLS]Stock Altered 1100'!$B35 -> Greg Watson | K32: ='\\ser\Software\other\[POINTS NQS  2012.XLS]Stock Altered 1100'!$C35 -> Batavia, OH | L32: =IF('\\ser\Software\other\[POINTS NQS  2012.XLS]Stock Altered 1100'!$D35=0," ",'\\ser\Software\other\[POINTS NQS  2012.XLS]Stock Altered 1100'!$D35) -> NP | M32: ='\\ser\Software\other\[POINTS NQS  2012.XLS]Stock Altered 1100'!$E35 -> 327 | N32: =IF('\\ser\Software\other\[POINTS NQS  2012.XLS]Stock Altered 1100'!$F35=0," ",'\\ser\Software\other\[POINTS NQS  2012.XLS]Stock Altered 1100'!$F35) -> Road Warrior | O32: ='\\ser\Software\other\[POINTS NQS  2012.XLS]Stock Altered 1100'!AA35 -> 146
A33: ='\\ser\Software\other\[POINTS NQS  2012.XLS]Stock Altered 1050'!$A36 -> 31 | B33: ='\\ser\Software\other\[POINTS NQS  2012.XLS]Stock Altered 1050'!$B36 -> Carl Frueh | C33: ='\\ser\Software\other\[POINTS NQS  2012.XLS]Stock Altered 1050'!$C36 -> Greenville, IL | D33: =IF('\\ser\Software\other\[POINTS NQS  2012.XLS]Stock Altered 1050'!$D36=0," ",'\\ser\Software\other\[POINTS NQS  2012.XLS]Stock Altered 1050'!$D36) -> JRS | E33: ='\\ser\Software\other\[POINTS NQS  2012.XLS]Stock Altered 1050'!$E36 -> 279 | F33: =IF('\\ser\Software\other\[POINTS NQS  2012.XLS]Stock Altered 1050'!$F36=0," ",'\\ser\Software\other\[POINTS NQS  2012.XLS]Stock Altered 1050'!$F36) -> Blue Thunder | G33: ='\\ser\Software\other\[POINTS NQS  2012.XLS]Stock Altered 1050'!AA36 -> 122 | I33: ='\\ser\Software\other\[POINTS NQS  2012.XLS]Stock Altered 1100'!$A36 -> 31 | J33: ='\\ser\Software\other\[POINTS NQS  2012.XLS]Stock Altered 1100'!$B36 -> Bob Jones JR | K33: ='\\ser\Software\other\[POINTS NQS  2012.XLS]Stock Altered 1100'!$C36 -> Hopewell, OH | L33: =IF('\\ser\Software\other\[POINTS NQS  2012.XLS]Stock Altered 1100'!$D36=0," ",'\\ser\Software\other\[POINTS NQS  2012.XLS]Stock Altered 1100'!$D36) -> BJ | M33: ='\\ser\Software\other\[POINTS NQS  2012.XLS]Stock Altered 1100'!$E36 -> 183 | N33: =IF('\\ser\Software\other\[POINTS NQS  2012.XLS]Stock Altered 1100'!$F36=0," ",'\\ser\Software\other\[POINTS NQS  2012.XLS]Stock Altered 1100'!$F36) -> Playdough | O33: ='\\ser\Software\other\[POINTS NQS  2012.XLS]Stock Altered 1100'!AA36 -> 152
A34: ='\\ser\Software\other\[POINTS NQS  2012.XLS]Stock Altered 1050'!$A37 -> 32 | B34: ='\\ser\Software\other\[POINTS NQS  2012.XLS]Stock Altered 1050'!$B37 -> Gregory Heifner | C34: ='\\ser\Software\other\[POINTS NQS  2012.XLS]Stock Altered 1050'!$C37 -> Jeromesville, OH | D34: =IF('\\ser\Software\other\[POINTS NQS  2012.XLS]Stock Altered 1050'!$D37=0," ",'\\ser\Software\other\[POINTS NQS  2012.XLS]Stock Altered 1050'!$D37) -> TH | E34: ='\\ser\Software\other\[POINTS NQS  2012.XLS]Stock Altered 1050'!$E37 -> 231 | F34: =IF('\\ser\Software\other\[POINTS NQS  2012.XLS]Stock Altered 1050'!$F37=0," ",'\\ser\Software\other\[POINTS NQS  2012.XLS]Stock Altered 1050'!$F37) -> Instigator | G34: ='\\ser\Software\other\[POINTS NQS  2012.XLS]Stock Altered 1050'!AA37 -> 124 | I34: ='\\ser\Software\other\[POINTS NQS  2012.XLS]Stock Altered 1100'!$A37 -> 32 | J34: ='\\ser\Software\other\[POINTS NQS  2012.XLS]Stock Altered 1100'!$B37 -> Carl Frueh | K34: ='\\ser\Software\other\[POINTS NQS  2012.XLS]Stock Altered 1100'!$C37 -> Greenville, IL | L34: =IF('\\ser\Software\other\[POINTS NQS  2012.XLS]Stock Altered 1100'!$D37=0," ",'\\ser\Software\other\[POINTS NQS  2012.XLS]Stock Altered 1100'!$D37) -> JRS | M34: ='\\ser\Software\other\[POINTS NQS  2012.XLS]Stock Altered 1100'!$E37 -> 279 | N34: =IF('\\ser\Software\other\[POINTS NQS  2012.XLS]Stock Altered 1100'!$F37=0," ",'\\ser\Software\other\[POINTS NQS  2012.XLS]Stock Altered 1100'!$F37) -> Blue Thunder | O34: ='\\ser\Software\other\[POINTS NQS  2012.XLS]Stock Altered 1100'!AA37 -> 155
A35: ='\\ser\Software\other\[POINTS NQS  2012.XLS]Stock Altered 1050'!$A38 -> 33 | B35: ='\\ser\Software\other\[POINTS NQS  2012.XLS]Stock Altered 1050'!$B38 -> Nevin Stitzer | C35: ='\\ser\Software\other\[POINTS NQS  2012.XLS]Stock Altered 1050'!$C38 -> Spring Mills, PA | D35: =IF('\\ser\Software\other\[POINTS NQS  2012.XLS]Stock Altered 1050'!$D38=0," ",'\\ser\Software\other\[POINTS NQS  2012.XLS]Stock Altered 1050'!$D38) ->  | E35: ='\\ser\Software\other\[POINTS NQS  2012.XLS]Stock Altered 1050'!$E38 -> 447 | F35: =IF('\\ser\Software\other\[POINTS NQS  2012.XLS]Stock Altered 1050'!$F38=0," ",'\\ser\Software\other\[POINTS NQS  2012.XLS]Stock Altered 1050'!$F38) -> Thunder Road | G35: ='\\ser\Software\other\[POINTS NQS  2012.XLS]Stock Altered 1050'!AA38 -> 132 | I35: ='\\ser\Software\other\[POINTS NQS  2012.XLS]Stock Altered 1100'!$A38 -> 33 | J35: ='\\ser\Software\other\[POINTS NQS  2012.XLS]Stock Altered 1100'!$B38 -> Gregory Heifner | K35: ='\\ser\Software\other\[POINTS NQS  2012.XLS]Stock Altered 1100'!$C38 -> Jeromesville, OH | L35: =IF('\\ser\Software\other\[POINTS NQS  2012.XLS]Stock Altered 1100'!$D38=0," ",'\\ser\Software\other\[POINTS NQS  2012.XLS]Stock Altered 1100'!$D38) -> TH | M35: ='\\ser\Software\other\[POINTS NQS  2012.XLS]Stock Altered 1100'!$E38 -> 231 | N35: =IF('\\ser\Software\other\[POINTS NQS  2012.XLS]Stock Altered 1100'!$F38=0," ",'\\ser\Software\other\[POINTS NQS  2012.XLS]Stock Altered 1100'!$F38) -> Instigator | O35: ='\\ser\Software\other\[POINTS NQS  2012.XLS]Stock Altered 1100'!AA38 -> 156
A36: ='\\ser\Software\other\[POINTS NQS  2012.XLS]Stock Altered 1050'!$A39 -> 34 | B36: ='\\ser\Software\other\[POINTS NQS  2012.XLS]Stock Altered 1050'!$B39 -> Keith Frueh | C36: ='\\ser\Software\other\[POINTS NQS  2012.XLS]Stock Altered 1050'!$C39 -> Greenville, IL | D36: =IF('\\ser\Software\other\[POINTS NQS  2012.XLS]Stock Altered 1050'!$D39=0," ",'\\ser\Software\other\[POINTS NQS  2012.XLS]Stock Altered 1050'!$D39) -> JRS | E36: ='\\ser\Software\other\[POINTS NQS  2012.XLS]Stock Altered 1050'!$E39 -> 86 | F36: =IF('\\ser\Software\other\[POINTS NQS  2012.XLS]Stock Altered 1050'!$F39=0," ",'\\ser\Software\other\[POINTS NQS  2012.XLS]Stock Altered 1050'!$F39) -> Fearless | G36: ='\\ser\Software\other\[POINTS NQS  2012.XLS]Stock Altered 1050'!AA39 -> 141 | I36: ='\\ser\Software\other\[POINTS NQS  2012.XLS]Stock Altered 1100'!$A39 -> 34 | J36: ='\\ser\Software\other\[POINTS NQS  2012.XLS]Stock Altered 1100'!$B39 -> John Elrod | K36: ='\\ser\Software\other\[POINTS NQS  2012.XLS]Stock Altered 1100'!$C39 -> Salem, IN | L36: =IF('\\ser\Software\other\[POINTS NQS  2012.XLS]Stock Altered 1100'!$D39=0," ",'\\ser\Software\other\[POINTS NQS  2012.XLS]Stock Altered 1100'!$D39) -> TV | M36: ='\\ser\Software\other\[POINTS NQS  2012.XLS]Stock Altered 1100'!$E39 -> 20 | N36: =IF('\\ser\Software\other\[POINTS NQS  2012.XLS]Stock Altered 1100'!$F39=0," ",'\\ser\Software\other\[POINTS NQS  2012.XLS]Stock Altered 1100'!$F39) -> Bad Habit | O36: ='\\ser\Software\other\[POINTS NQS  2012.XLS]Stock Altered 1100'!AA39 -> 160
A37: ='\\ser\Software\other\[POINTS NQS  2012.XLS]Stock Altered 1050'!$A40 -> 35 | B37: ='\\ser\Software\other\[POINTS NQS  2012.XLS]Stock Altered 1050'!$B40 -> Randy Demers | C37: ='\\ser\Software\other\[POINTS NQS  2012.XLS]Stock Altered 1050'!$C40 -> Columbia, NJ | D37: =IF('\\ser\Software\other\[POINTS NQS  2012.XLS]Stock Altered 1050'!$D40=0," ",'\\ser\Software\other\[POINTS NQS  2012.XLS]Stock Altered 1050'!$D40) -> NP | E37: ='\\ser\Software\other\[POINTS NQS  2012.XLS]Stock Altered 1050'!$E40 -> 84 | F37: =IF('\\ser\Software\other\[POINTS NQS  2012.XLS]Stock Altered 1050'!$F40=0," ",'\\ser\Software\other\[POINTS NQS  2012.XLS]Stock Altered 1050'!$F40) -> Bounty Hunter | G37: ='\\ser\Software\other\[POINTS NQS  2012.XLS]Stock Altered 1050'!AA40 -> 144 | I37: ='\\ser\Software\other\[POINTS NQS  2012.XLS]Stock Altered 1100'!$A40 -> 35 | J37: ='\\ser\Software\other\[POINTS NQS  2012.XLS]Stock Altered 1100'!$B40 -> Bobby Feldkamp | K37: ='\\ser\Software\other\[POINTS NQS  2012.XLS]Stock Altered 1100'!$C40 -> Milan, MI | L37: =IF('\\ser\Software\other\[POINTS NQS  2012.XLS]Stock Altered 1100'!$D40=0," ",'\\ser\Software\other\[POINTS NQS  2012.XLS]Stock Altered 1100'!$D40) -> Woods | M37: ='\\ser\Software\other\[POINTS NQS  2012.XLS]Stock Altered 1100'!$E40 -> 501 | N37: =IF('\\ser\Software\other\[POINTS NQS  2012.XLS]Stock Altered 1100'!$F40=0," ",'\\ser\Software\other\[POINTS NQS  2012.XLS]Stock Altered 1100'!$F40) -> Incognito | O37: ='\\ser\Software\other\[POINTS NQS  2012.XLS]Stock Altered 1100'!AA40 -> 160
A38: ='\\ser\Software\other\[POINTS NQS  2012.XLS]Stock Altered 1050'!$A41 -> 36 | B38: ='\\ser\Software\other\[POINTS NQS  2012.XLS]Stock Altered 1050'!$B41 -> Bud Casale | C38: ='\\ser\Software\other\[POINTS NQS  2012.XLS]Stock Altered 1050'!$C41 -> New Stanton, Pa | D38: =IF('\\ser\Software\other\[POINTS NQS  2012.XLS]Stock Altered 1050'!$D41=0," ",'\\ser\Software\other\[POINTS NQS  2012.XLS]Stock Altered 1050'!$D41) ->  | E38: ='\\ser\Software\other\[POINTS NQS  2012.XLS]Stock Altered 1050'!$E41 -> 403 | F38: =IF('\\ser\Software\other\[POINTS NQS  2012.XLS]Stock Altered 1050'!$F41=0," ",'\\ser\Software\other\[POINTS NQS  2012.XLS]Stock Altered 1050'!$F41) ->  | G38: ='\\ser\Software\other\[POINTS NQS  2012.XLS]Stock Altered 1050'!AA41 -> 147 | I38: ='\\ser\Software\other\[POINTS NQS  2012.XLS]Stock Altered 1100'!$A41 -> 36 | J38: ='\\ser\Software\other\[POINTS NQS  2012.XLS]Stock Altered 1100'!$B41 -> Bud Casale | K38: ='\\ser\Software\other\[POINTS NQS  2012.XLS]Stock Altered 1100'!$C41 -> Stanton, Pa | L38: =IF('\\ser\Software\other\[POINTS NQS  2012.XLS]Stock Altered 1100'!$D41=0," ",'\\ser\Software\other\[POINTS NQS  2012.XLS]Stock Altered 1100'!$D41) -> TV | M38: ='\\ser\Software\other\[POINTS NQS  2012.XLS]Stock Altered 1100'!$E41 -> 403 | N38: =IF('\\ser\Software\other\[POINTS NQS  2012.XLS]Stock Altered 1100'!$F41=0," ",'\\ser\Software\other\[POINTS NQS  2012.XLS]Stock Altered 1100'!$F41) ->  | O38: ='\\ser\Software\other\[POINTS NQS  2012.XLS]Stock Altered 1100'!AA41 -> 163
A39: ='\\ser\Software\other\[POINTS NQS  2012.XLS]Stock Altered 1050'!$A42 -> 37 | B39: ='\\ser\Software\other\[POINTS NQS  2012.XLS]Stock Altered 1050'!$B42 -> John Elrod | C39: ='\\ser\Software\other\[POINTS NQS  2012.XLS]Stock Altered 1050'!$C42 -> Salem, IN | D39: =IF('\\ser\Software\other\[POINTS NQS  2012.XLS]Stock Altered 1050'!$D42=0," ",'\\ser\Software\other\[POINTS NQS  2012.XLS]Stock Altered 1050'!$D42) -> TV | E39: ='\\ser\Software\other\[POINTS NQS  2012.XLS]Stock Altered 1050'!$E42 -> 20 | F39: =IF('\\ser\Software\other\[POINTS NQS  2012.XLS]Stock Altered 1050'!$F42=0," ",'\\ser\Software\other\[POINTS NQS  2012.XLS]Stock Altered 1050'!$F42) -> Bad Habit | G39: ='\\ser\Software\other\[POINTS NQS  2012.XLS]Stock Altered 1050'!AA42 -> 150 | I39: ='\\ser\Software\other\[POINTS NQS  2012.XLS]Stock Altered 1100'!$A42 -> 37 | J39: ='\\ser\Software\other\[POINTS NQS  2012.XLS]Stock Altered 1100'!$B42 -> Keith Frueh | K39: ='\\ser\Software\other\[POINTS NQS  2012.XLS]Stock Altered 1100'!$C42 -> Greenville, IL | L39: =IF('\\ser\Software\other\[POINTS NQS  2012.XLS]Stock Altered 1100'!$D42=0," ",'\\ser\Software\other\[POINTS NQS  2012.XLS]Stock Altered 1100'!$D42) -> JRS | M39: ='\\ser\Software\other\[POINTS NQS  2012.XLS]Stock Altered 1100'!$E42 -> 86 | N39: =IF('\\ser\Software\other\[POINTS NQS  2012.XLS]Stock Altered 1100'!$F42=0," ",'\\ser\Software\other\[POINTS NQS  2012.XLS]Stock Altered 1100'!$F42) -> Fearless | O39: ='\\ser\Software\other\[POINTS NQS  2012.XLS]Stock Altered 1100'!AA42 -> 169
A40: ='\\ser\Software\other\[POINTS NQS  2012.XLS]Stock Altered 1050'!$A43 -> 38 | B40: ='\\ser\Software\other\[POINTS NQS  2012.XLS]Stock Altered 1050'!$B43 -> Keith Frueh | C40: ='\\ser\Software\other\[POINTS NQS  2012.XLS]Stock Altered 1050'!$C43 -> Greenville, IL | D40: =IF('\\ser\Software\other\[POINTS NQS  2012.XLS]Stock Altered 1050'!$D43=0," ",'\\ser\Software\other\[POINTS NQS  2012.XLS]Stock Altered 1050'!$D43) -> JRS | E40: ='\\ser\Software\other\[POINTS NQS  2012.XLS]Stock Altered 1050'!$E43 -> 453 | F40: =IF('\\ser\Software\other\[POINTS NQS  2012.XLS]Stock Altered 1050'!$F43=0," ",'\\ser\Software\other\[POINTS NQS  2012.XLS]Stock Altered 1050'!$F43) -> Haulin Harvester | G40: ='\\ser\Software\other\[POINTS NQS  2012.XLS]Stock Altered 1050'!AA43 -> 164 | I40: ='\\ser\Software\other\[POINTS NQS  2012.XLS]Stock Altered 1100'!$A43 -> 38 | J40: ='\\ser\Software\other\[POINTS NQS  2012.XLS]Stock Altered 1100'!$B43 -> Tod Hinkle | K40: ='\\ser\Software\other\[POINTS NQS  2012.XLS]Stock Altered 1100'!$C43 -> Dongola, IA | L40: =IF('\\ser\Software\other\[POINTS NQS  2012.XLS]Stock Altered 1100'!$D43=0," ",'\\ser\Software\other\[POINTS NQS  2012.XLS]Stock Altered 1100'!$D43) -> JW | M40: ='\\ser\Software\other\[POINTS NQS  2012.XLS]Stock Altered 1100'!$E43 -> 370 | N40: =IF('\\ser\Software\other\[POINTS NQS  2012.XLS]Stock Altered 1100'!$F43=0," ",'\\ser\Software\other\[POINTS NQS  2012.XLS]Stock Altered 1100'!$F43) -> Disturbed | O40: ='\\ser\Software\other\[POINTS NQS  2012.XLS]Stock Altered 1100'!AA43 -> 172
A41: ='\\ser\Software\other\[POINTS NQS  2012.XLS]Stock Altered 1050'!$A44 -> 39 | B41: ='\\ser\Software\other\[POINTS NQS  2012.XLS]Stock Altered 1050'!$B44 -> Steve Chrisman | C41: ='\\ser\Software\other\[POINTS NQS  2012.XLS]Stock Altered 1050'!$C44 -> Edinburg, IN | D41: =IF('\\ser\Software\other\[POINTS NQS  2012.XLS]Stock Altered 1050'!$D44=0," ",'\\ser\Software\other\[POINTS NQS  2012.XLS]Stock Altered 1050'!$D44) -> Hackman | E41: ='\\ser\Software\other\[POINTS NQS  2012.XLS]Stock Altered 1050'!$E44 -> 69 | F41: =IF('\\ser\Software\other\[POINTS NQS  2012.XLS]Stock Altered 1050'!$F44=0," ",'\\ser\Software\other\[POINTS NQS  2012.XLS]Stock Altered 1050'!$F44) -> Razmitaz | G41: ='\\ser\Software\other\[POINTS NQS  2012.XLS]Stock Altered 1050'!AA44 -> 167 | I41: ='\\ser\Software\other\[POINTS NQS  2012.XLS]Stock Altered 1100'!$A44 -> 40 | J41: ='\\ser\Software\other\[POINTS NQS  2012.XLS]Stock Altered 1100'!$B44 -> Les Salyers | K41: ='\\ser\Software\other\[POINTS NQS  2012.XLS]Stock Altered 1100'!$C44 -> Sidney, OH | L41: =IF('\\ser\Software\other\[POINTS NQS  2012.XLS]Stock Altered 1100'!$D44=0," ",'\\ser\Software\other\[POINTS NQS  2012.XLS]Stock Altered 1100'!$D44) -> TV | M41: ='\\ser\Software\other\[POINTS NQS  2012.XLS]Stock Altered 1100'!$E44 -> 444 | N41: =IF('\\ser\Software\other\[POINTS NQS  2012.XLS]Stock Altered 1100'!$F44=0," ",'\\ser\Software\other\[POINTS NQS  2012.XLS]Stock Altered 1100'!$F44) -> Unfinished Business | O41: ='\\ser\Software\other\[POINTS NQS  2012.XLS]Stock Altered 1100'!AA44 -> 183
A42: ='\\ser\Software\other\[POINTS NQS  2012.XLS]Stock Altered 1050'!$A45 -> 40 | B42: ='\\ser\Software\other\[POINTS NQS  2012.XLS]Stock Altered 1050'!$B45 -> Tod Hinkle | C42: ='\\ser\Software\other\[POINTS NQS  2012.XLS]Stock Altered 1050'!$C45 -> Dongola, IA | D42: =IF('\\ser\Software\other\[POINTS NQS  2012.XLS]Stock Altered 1050'!$D45=0," ",'\\ser\Software\other\[POINTS NQS  2012.XLS]Stock Altered 1050'!$D45) -> JW | E42: ='\\ser\Software\other\[POINTS NQS  2012.XLS]Stock Altered 1050'!$E45 -> 370 | F42: =IF('\\ser\Software\other\[POINTS NQS  2012.XLS]Stock Altered 1050'!$F45=0," ",'\\ser\Software\other\[POINTS NQS  2012.XLS]Stock Altered 1050'!$F45) -> Disturbed | G42: ='\\ser\Software\other\[POINTS NQS  2012.XLS]Stock Altered 1050'!AA45 -> 170 | I42: ='\\ser\Software\other\[POINTS NQS  2012.XLS]Stock Altered 1100'!$A45 -> 41 | J42: ='\\ser\Software\other\[POINTS NQS  2012.XLS]Stock Altered 1100'!$B45 -> Randy Amstutz | K42: ='\\ser\Software\other\[POINTS NQS  2012.XLS]Stock Altered 1100'!$C45 -> Berne, Ind | L42: =IF('\\ser\Software\other\[POINTS NQS  2012.XLS]Stock Altered 1100'!$D45=0," ",'\\ser\Software\other\[POINTS NQS  2012.XLS]Stock Altered 1100'!$D45) -> Woods | M42: ='\\ser\Software\other\[POINTS NQS  2012.XLS]Stock Altered 1100'!$E45 -> 533 | N42: =IF('\\ser\Software\other\[POINTS NQS  2012.XLS]Stock Altered 1100'!$F45=0," ",'\\ser\Software\other\[POINTS NQS  2012.XLS]Stock Altered 1100'!$F45) ->  | O42: ='\\ser\Software\other\[POINTS NQS  2012.XLS]Stock Altered 1100'!AA45 -> 185
A43: ='\\ser\Software\other\[POINTS NQS  2012.XLS]Stock Altered 1050'!$A46 -> 41 | B43: ='\\ser\Software\other\[POINTS NQS  2012.XLS]Stock Altered 1050'!$B46 -> John Cress | C43: ='\\ser\Software\other\[POINTS NQS  2012.XLS]Stock Altered 1050'!$C46 -> Strasburg, IL | D43: =IF('\\ser\Software\other\[POINTS NQS  2012.XLS]Stock Altered 1050'!$D46=0," ",'\\ser\Software\other\[POINTS NQS  2012.XLS]Stock Altered 1050'!$D46) -> JRS | E43: ='\\ser\Software\other\[POINTS NQS  2012.XLS]Stock Altered 1050'!$E46 -> 514 | F43: =IF('\\ser\Software\other\[POINTS NQS  2012.XLS]Stock Altered 1050'!$F46=0," ",'\\ser\Software\other\[POINTS NQS  2012.XLS]Stock Altered 1050'!$F46) -> Mini Blitzed | G43: ='\\ser\Software\other\[POINTS NQS  2012.XLS]Stock Altered 1050'!AA46 -> 170 | I43: ='\\ser\Software\other\[POINTS NQS  2012.XLS]Stock Altered 1100'!$A46 -> 42 | J43: ='\\ser\Software\other\[POINTS NQS  2012.XLS]Stock Altered 1100'!$B46 -> Bill Elrod | K43: ='\\ser\Software\other\[POINTS NQS  2012.XLS]Stock Altered 1100'!$C46 -> Salem, IN | L43: =IF('\\ser\Software\other\[POINTS NQS  2012.XLS]Stock Altered 1100'!$D46=0," ",'\\ser\Software\other\[POINTS NQS  2012.XLS]Stock Altered 1100'!$D46) -> TV | M43: ='\\ser\Software\other\[POINTS NQS  2012.XLS]Stock Altered 1100'!$E46 -> 21 | N43: =IF('\\ser\Software\other\[POINTS NQS  2012.XLS]Stock Altered 1100'!$F46=0," ",'\\ser\Software\other\[POINTS NQS  2012.XLS]Stock Altered 1100'!$F46) -> Pa Paw Toy | O43: ='\\ser\Software\other\[POINTS NQS  2012.XLS]Stock Altered 1100'!AA46 -> 188
A44: ='\\ser\Software\other\[POINTS NQS  2012.XLS]Stock Altered 1050'!$A47 -> 42 | B44: ='\\ser\Software\other\[POINTS NQS  2012.XLS]Stock Altered 1050'!$B47 -> Ron Finch | C44: ='\\ser\Software\other\[POINTS NQS  2012.XLS]Stock Altered 1050'!$C47 -> Milan, MI | D44: =IF('\\ser\Software\other\[POINTS NQS  2012.XLS]Stock Altered 1050'!$D47=0," ",'\\ser\Software\other\[POINTS NQS  2012.XLS]Stock Altered 1050'!$D47) -> Woods | E44: ='\\ser\Software\other\[POINTS NQS  2012.XLS]Stock Altered 1050'!$E47 -> 143 | F44: =IF('\\ser\Software\other\[POINTS NQS  2012.XLS]Stock Altered 1050'!$F47=0," ",'\\ser\Software\other\[POINTS NQS  2012.XLS]Stock Altered 1050'!$F47) -> Keychain | G44: ='\\ser\Software\other\[POINTS NQS  2012.XLS]Stock Altered 1050'!AA47 -> 183 | I44: ='\\ser\Software\other\[POINTS NQS  2012.XLS]Stock Altered 1100'!$A47 -> 43 | J44: ='\\ser\Software\other\[POINTS NQS  2012.XLS]Stock Altered 1100'!$B47 -> John Cress | K44: ='\\ser\Software\other\[POINTS NQS  2012.XLS]Stock Altered 1100'!$C47 -> Strasburg, IL | L44: =IF('\\ser\Software\other\[POINTS NQS  2012.XLS]Stock Altered 1100'!$D47=0," ",'\\ser\Software\other\[POINTS NQS  2012.XLS]Stock Altered 1100'!$D47) -> JRS | M44: ='\\ser\Software\other\[POINTS NQS  2012.XLS]Stock Altered 1100'!$E47 -> 514 | N44: =IF('\\ser\Software\other\[POINTS NQS  2012.XLS]Stock Altered 1100'!$F47=0," ",'\\ser\Software\other\[POINTS NQS  2012.XLS]Stock Altered 1100'!$F47) -> Mini Blitzed | O44: ='\\ser\Software\other\[POINTS NQS  2012.XLS]Stock Altered 1100'!AA47 -> 194
A45: ='\\ser\Software\other\[POINTS NQS  2012.XLS]Stock Altered 1050'!$A48 -> 43 | B45: ='\\ser\Software\other\[POINTS NQS  2012.XLS]Stock Altered 1050'!$B48 -> Robin Cooper | C45: ='\\ser\Software\other\[POINTS NQS  2012.XLS]Stock Altered 1050'!$C48 -> Westminster, MD | D45: =IF('\\ser\Software\other\[POINTS NQS  2012.XLS]Stock Altered 1050'!$D48=0," ",'\\ser\Software\other\[POINTS NQS  2012.XLS]Stock Altered 1050'!$D48) -> JRS | E45: ='\\ser\Software\other\[POINTS NQS  2012.XLS]Stock Altered 1050'!$E48 -> 73 | F45: =IF('\\ser\Software\other\[POINTS NQS  2012.XLS]Stock Altered 1050'!$F48=0," ",'\\ser\Software\other\[POINTS NQS  2012.XLS]Stock Altered 1050'!$F48) ->  | G45: ='\\ser\Software\other\[POINTS NQS  2012.XLS]Stock Altered 1050'!AA48 -> 184 | I45: ='\\ser\Software\other\[POINTS NQS  2012.XLS]Stock Altered 1100'!$A48 -> 39 | J45: ='\\ser\Software\other\[POINTS NQS  2012.XLS]Stock Altered 1100'!$B48 -> Gary Cunningham | K45: ='\\ser\Software\other\[POINTS NQS  2012.XLS]Stock Altered 1100'!$C48 -> Brooksville, KY | L45: =IF('\\ser\Software\other\[POINTS NQS  2012.XLS]Stock Altered 1100'!$D48=0," ",'\\ser\Software\other\[POINTS NQS  2012.XLS]Stock Altered 1100'!$D48) -> NP | M45: ='\\ser\Software\other\[POINTS NQS  2012.XLS]Stock Altered 1100'!$E48 -> 162 | N45: =IF('\\ser\Software\other\[POINTS NQS  2012.XLS]Stock Altered 1100'!$F48=0," ",'\\ser\Software\other\[POINTS NQS  2012.XLS]Stock Altered 1100'!$F48) -> High Voltage | O45: ='\\ser\Software\other\[POINTS NQS  2012.XLS]Stock Altered 1100'!AA48 -> 201
A46: ='\\ser\Software\other\[POINTS NQS  2012.XLS]Stock Altered 1050'!$A49 -> 44 | B46: ='\\ser\Software\other\[POINTS NQS  2012.XLS]Stock Altered 1050'!$B49 -> Randy Amstutz | C46: ='\\ser\Software\other\[POINTS NQS  2012.XLS]Stock Altered 1050'!$C49 -> Berne, Ind | D46: =IF('\\ser\Software\other\[POINTS NQS  2012.XLS]Stock Altered 1050'!$D49=0," ",'\\ser\Software\other\[POINTS NQS  2012.XLS]Stock Altered 1050'!$D49) -> Woods | E46: ='\\ser\Software\other\[POINTS NQS  2012.XLS]Stock Altered 1050'!$E49 -> 533 | F46: =IF('\\ser\Software\other\[POINTS NQS  2012.XLS]Stock Altered 1050'!$F49=0," ",'\\ser\Software\other\[POINTS NQS  2012.XLS]Stock Altered 1050'!$F49) ->  | G46: ='\\ser\Software\other\[POINTS NQS  2012.XLS]Stock Altered 1050'!AA49 -> 186 | I46: ='\\ser\Software\other\[POINTS NQS  2012.XLS]Stock Altered 1100'!$A49 -> 44 | J46: ='\\ser\Software\other\[POINTS NQS  2012.XLS]Stock Altered 1100'!$B49 -> Mike Yeley | K46: ='\\ser\Software\other\[POINTS NQS  2012.XLS]Stock Altered 1100'!$C49 -> Hope, IN | L46: =IF('\\ser\Software\other\[POINTS NQS  2012.XLS]Stock Altered 1100'!$D49=0," ",'\\ser\Software\other\[POINTS NQS  2012.XLS]Stock Altered 1100'!$D49) -> JW | M46: ='\\ser\Software\other\[POINTS NQS  2012.XLS]Stock Altered 1100'!$E49 -> 55 | N46: =IF('\\ser\Software\other\[POINTS NQS  2012.XLS]Stock Altered 1100'!$F49=0," ",'\\ser\Software\other\[POINTS NQS  2012.XLS]Stock Altered 1100'!$F49) -> Outta Hope | O46: ='\\ser\Software\other\[POINTS NQS  2012.XLS]Stock Altered 1100'!AA49 -> 203
A47: ='\\ser\Software\other\[POINTS NQS  2012.XLS]Stock Altered 1050'!$A50 -> 45 | B47: ='\\ser\Software\other\[POINTS NQS  2012.XLS]Stock Altered 1050'!$B50 -> Jason Rogers | C47: ='\\ser\Software\other\[POINTS NQS  2012.XLS]Stock Altered 1050'!$C50 -> Richmond, Ky | D47: =IF('\\ser\Software\other\[POINTS NQS  2012.XLS]Stock Altered 1050'!$D50=0," ",'\\ser\Software\other\[POINTS NQS  2012.XLS]Stock Altered 1050'!$D50) -> NP | E47: ='\\ser\Software\other\[POINTS NQS  2012.XLS]Stock Altered 1050'!$E50 -> 561 | F47: =IF('\\ser\Software\other\[POINTS NQS  2012.XLS]Stock Altered 1050'!$F50=0," ",'\\ser\Software\other\[POINTS NQS  2012.XLS]Stock Altered 1050'!$F50) -> Tinker Toy | G47: ='\\ser\Software\other\[POINTS NQS  2012.XLS]Stock Altered 1050'!AA50 -> 188 | I47: ='\\ser\Software\other\[POINTS NQS  2012.XLS]Stock Altered 1100'!$A50 -> 45 | J47: ='\\ser\Software\other\[POINTS NQS  2012.XLS]Stock Altered 1100'!$B50 -> Steve Chrisman | K47: ='\\ser\Software\other\[POINTS NQS  2012.XLS]Stock Altered 1100'!$C50 -> Edinburg, IN | L47: =IF('\\ser\Software\other\[POINTS NQS  2012.XLS]Stock Altered 1100'!$D50=0," ",'\\ser\Software\other\[POINTS NQS  2012.XLS]Stock Altered 1100'!$D50) -> Hackman | M47: ='\\ser\Software\other\[POINTS NQS  2012.XLS]Stock Altered 1100'!$E50 -> 69 | N47: =IF('\\ser\Software\other\[POINTS NQS  2012.XLS]Stock Altered 1100'!$F50=0," ",'\\ser\Software\other\[POINTS NQS  2012.XLS]Stock Altered 1100'!$F50) -> Razzmatazz | O47: ='\\ser\Software\other\[POINTS NQS  2012.XLS]Stock Altered 1100'!AA50 -> 203
A48: ='\\ser\Software\other\[POINTS NQS  2012.XLS]Stock Altered 1050'!$A51 -> 46 | B48: ='\\ser\Software\other\[POINTS NQS  2012.XLS]Stock Altered 1050'!$B51 -> Chris Gegg | C48: ='\\ser\Software\other\[POINTS NQS  2012.XLS]Stock Altered 1050'!$C51 -> Greenville, IL | D48: =IF('\\ser\Software\other\[POINTS NQS  2012.XLS]Stock Altered 1050'!$D51=0," ",'\\ser\Software\other\[POINTS NQS  2012.XLS]Stock Altered 1050'!$D51) -> JRS | E48: ='\\ser\Software\other\[POINTS NQS  2012.XLS]Stock Altered 1050'!$E51 -> 410 | F48: =IF('\\ser\Software\other\[POINTS NQS  2012.XLS]Stock Altered 1050'!$F51=0," ",'\\ser\Software\other\[POINTS NQS  2012.XLS]Stock Altered 1050'!$F51) -> Insane | G48: ='\\ser\Software\other\[POINTS NQS  2012.XLS]Stock Altered 1050'!AA51 -> 197 | I48: ='\\ser\Software\other\[POINTS NQS  2012.XLS]Stock Altered 1100'!$A51 -> 46 | J48: ='\\ser\Software\other\[POINTS NQS  2012.XLS]Stock Altered 1100'!$B51 -> Gary Cunningham | K48: ='\\ser\Software\other\[POINTS NQS  2012.XLS]Stock Altered 1100'!$C51 -> Brooksville, KY | L48: =IF('\\ser\Software\other\[POINTS NQS  2012.XLS]Stock Altered 1100'!$D51=0," ",'\\ser\Software\other\[POINTS NQS  2012.XLS]Stock Altered 1100'!$D51) -> NP | M48: ='\\ser\Software\other\[POINTS NQS  2012.XLS]Stock Altered 1100'!$E51 -> 62 | N48: =IF('\\ser\Software\other\[POINTS NQS  2012.XLS]Stock Altered 1100'!$F51=0," ",'\\ser\Software\other\[POINTS NQS  2012.XLS]Stock Altered 1100'!$F51) -> High Voltage | O48: ='\\ser\Software\other\[POINTS NQS  2012.XLS]Stock Altered 1100'!AA51 -> 208
A49: ='\\ser\Software\other\[POINTS NQS  2012.XLS]Stock Altered 1050'!$A52 -> 47 | B49: ='\\ser\Software\other\[POINTS NQS  2012.XLS]Stock Altered 1050'!$B52 -> Gary Frank | C49: ='\\ser\Software\other\[POINTS NQS  2012.XLS]Stock Altered 1050'!$C52 -> Amanda, OH | D49: =IF('\\ser\Software\other\[POINTS NQS  2012.XLS]Stock Altered 1050'!$D52=0," ",'\\ser\Software\other\[POINTS NQS  2012.XLS]Stock Altered 1050'!$D52) -> TV | E49: ='\\ser\Software\other\[POINTS NQS  2012.XLS]Stock Altered 1050'!$E52 -> 233 | F49: =IF('\\ser\Software\other\[POINTS NQS  2012.XLS]Stock Altered 1050'!$F52=0," ",'\\ser\Software\other\[POINTS NQS  2012.XLS]Stock Altered 1050'!$F52) -> Katies Toy | G49: ='\\ser\Software\other\[POINTS NQS  2012.XLS]Stock Altered 1050'!AA52 -> 200 | I49: ='\\ser\Software\other\[POINTS NQS  2012.XLS]Stock Altered 1100'!$A52 -> 47 | J49: ='\\ser\Software\other\[POINTS NQS  2012.XLS]Stock Altered 1100'!$B52 -> Robin Cooper | K49: ='\\ser\Software\other\[POINTS NQS  2012.XLS]Stock Altered 1100'!$C52 -> Westminster, Md | L49: =IF('\\ser\Software\other\[POINTS NQS  2012.XLS]Stock Altered 1100'!$D52=0," ",'\\ser\Software\other\[POINTS NQS  2012.XLS]Stock Altered 1100'!$D52) -> JRS | M49: ='\\ser\Software\other\[POINTS NQS  2012.XLS]Stock Altered 1100'!$E52 -> 73 | N49: =IF('\\ser\Software\other\[POINTS NQS  2012.XLS]Stock Altered 1100'!$F52=0," ",'\\ser\Software\other\[POINTS NQS  2012.XLS]Stock Altered 1100'!$F52) ->  | O49: ='\\ser\Software\other\[POINTS NQS  2012.XLS]Stock Altered 1100'!AA52 -> 210
A50: ='\\ser\Software\other\[POINTS NQS  2012.XLS]Stock Altered 1050'!$A53 -> 48 | B50: ='\\ser\Software\other\[POINTS NQS  2012.XLS]Stock Altered 1050'!$B53 -> Mike Yeley | C50: ='\\ser\Software\other\[POINTS NQS  2012.XLS]Stock Altered 1050'!$C53 -> Hope, IN | D50: =IF('\\ser\Software\other\[POINTS NQS  2012.XLS]Stock Altered 1050'!$D53=0," ",'\\ser\Software\other\[POINTS NQS  2012.XLS]Stock Altered 1050'!$D53) -> JW | E50: ='\\ser\Software\other\[POINTS NQS  2012.XLS]Stock Altered 1050'!$E53 -> 55 | F50: =IF('\\ser\Software\other\[POINTS NQS  2012.XLS]Stock Altered 1050'!$F53=0," ",'\\ser\Software\other\[POINTS NQS  2012.XLS]Stock Altered 1050'!$F53) -> Outta Hope | G50: ='\\ser\Software\other\[POINTS NQS  2012.XLS]Stock Altered 1050'!AA53 -> 203 | I50: ='\\ser\Software\other\[POINTS NQS  2012.XLS]Stock Altered 1100'!$A53 -> 48 | J50: ='\\ser\Software\other\[POINTS NQS  2012.XLS]Stock Altered 1100'!$B53 -> Mark Rader | K50: ='\\ser\Software\other\[POINTS NQS  2012.XLS]Stock Altered 1100'!$C53 -> Pataskala, Oh | L50: =IF('\\ser\Software\other\[POINTS NQS  2012.XLS]Stock Altered 1100'!$D53=0," ",'\\ser\Software\other\[POINTS NQS  2012.XLS]Stock Altered 1100'!$D53) -> RPM | M50: ='\\ser\Software\other\[POINTS NQS  2012.XLS]Stock Altered 1100'!$E53 -> 213 | N50: =IF('\\ser\Software\other\[POINTS NQS  2012.XLS]Stock Altered 1100'!$F53=0," ",'\\ser\Software\other\[POINTS NQS  2012.XLS]Stock Altered 1100'!$F53) -> Lethal Weapon | O50: ='\\ser\Software\other\[POINTS NQS  2012.XLS]Stock Altered 1100'!AA53 -> 213
A51: ='\\ser\Software\other\[POINTS NQS  2012.XLS]Stock Altered 1050'!$A54 -> 49 | B51: ='\\ser\Software\other\[POINTS NQS  2012.XLS]Stock Altered 1050'!$B54 -> Roger Davis | C51: ='\\ser\Software\other\[POINTS NQS  2012.XLS]Stock Altered 1050'!$C54 -> Lower Salem, Oh | D51: =IF('\\ser\Software\other\[POINTS NQS  2012.XLS]Stock Altered 1050'!$D54=0," ",'\\ser\Software\other\[POINTS NQS  2012.XLS]Stock Altered 1050'!$D54) -> JRS | E51: ='\\ser\Software\other\[POINTS NQS  2012.XLS]Stock Altered 1050'!$E54 -> 68 | F51: =IF('\\ser\Software\other\[POINTS NQS  2012.XLS]Stock Altered 1050'!$F54=0," ",'\\ser\Software\other\[POINTS NQS  2012.XLS]Stock Altered 1050'!$F54) -> Dusty Lady | G51: ='\\ser\Software\other\[POINTS NQS  2012.XLS]Stock Altered 1050'!AA54 -> 206 | I51: ='\\ser\Software\other\[POINTS NQS  2012.XLS]Stock Altered 1100'!$A54 -> 49 | J51: ='\\ser\Software\other\[POINTS NQS  2012.XLS]Stock Altered 1100'!$B54 -> Shawn Garman | K51: ='\\ser\Software\other\[POINTS NQS  2012.XLS]Stock Altered 1100'!$C54 -> Jeromesville, OH | L51: =IF('\\ser\Software\other\[POINTS NQS  2012.XLS]Stock Altered 1100'!$D54=0," ",'\\ser\Software\other\[POINTS NQS  2012.XLS]Stock Altered 1100'!$D54) -> JRS | M51: ='\\ser\Software\other\[POINTS NQS  2012.XLS]Stock Altered 1100'!$E54 -> 391 | N51: =IF('\\ser\Software\other\[POINTS NQS  2012.XLS]Stock Altered 1100'!$F54=0," ",'\\ser\Software\other\[POINTS NQS  2012.XLS]Stock Altered 1100'!$F54) -> Jagmeister | O51: ='\\ser\Software\other\[POINTS NQS  2012.XLS]Stock Altered 1100'!AA54 -> 214
A52: ='\\ser\Software\other\[POINTS NQS  2012.XLS]Stock Altered 1050'!$A55 -> 50 | B52: ='\\ser\Software\other\[POINTS NQS  2012.XLS]Stock Altered 1050'!$B55 -> Brian Simpson | C52: ='\\ser\Software\other\[POINTS NQS  2012.XLS]Stock Altered 1050'!$C55 -> Danville, Oh | D52: =IF('\\ser\Software\other\[POINTS NQS  2012.XLS]Stock Altered 1050'!$D55=0," ",'\\ser\Software\other\[POINTS NQS  2012.XLS]Stock Altered 1050'!$D55) -> Woods | E52: ='\\ser\Software\other\[POINTS NQS  2012.XLS]Stock Altered 1050'!$E55 -> 525 | F52: =IF('\\ser\Software\other\[POINTS NQS  2012.XLS]Stock Altered 1050'!$F55=0," ",'\\ser\Software\other\[POINTS NQS  2012.XLS]Stock Altered 1050'!$F55) -> Ramp Door Express | G52: ='\\ser\Software\other\[POINTS NQS  2012.XLS]Stock Altered 1050'!AA55 -> 208 | I52: ='\\ser\Software\other\[POINTS NQS  2012.XLS]Stock Altered 1100'!$A55 -> 50 | J52: ='\\ser\Software\other\[POINTS NQS  2012.XLS]Stock Altered 1100'!$B55 -> Waylan Nelson | K52: ='\\ser\Software\other\[POINTS NQS  2012.XLS]Stock Altered 1100'!$C55 -> Shelby, IA | L52: =IF('\\ser\Software\other\[POINTS NQS  2012.XLS]Stock Altered 1100'!$D55=0," ",'\\ser\Software\other\[POINTS NQS  2012.XLS]Stock Altered 1100'!$D55) -> Woods | M52: ='\\ser\Software\other\[POINTS NQS  2012.XLS]Stock Altered 1100'!$E55 -> 500 | N52: =IF('\\ser\Software\other\[POINTS NQS  2012.XLS]Stock Altered 1100'!$F55=0," ",'\\ser\Software\other\[POINTS NQS  2012.XLS]Stock Altered 1100'!$F55) -> Butt Ugly | O52: ='\\ser\Software\other\[POINTS NQS  2012.XLS]Stock Altered 1100'!AA55 -> 215
A53: ='\\ser\Software\other\[POINTS NQS  2012.XLS]Stock Altered 1050'!$A56 -> 51 | B53: ='\\ser\Software\other\[POINTS NQS  2012.XLS]Stock Altered 1050'!$B56 -> Bill Elrod | C53: ='\\ser\Software\other\[POINTS NQS  2012.XLS]Stock Altered 1050'!$C56 -> Salem, IN | D53: =IF('\\ser\Software\other\[POINTS NQS  2012.XLS]Stock Altered 1050'!$D56=0," ",'\\ser\Software\other\[POINTS NQS  2012.XLS]Stock Altered 1050'!$D56) -> TV | E53: ='\\ser\Software\other\[POINTS NQS  2012.XLS]Stock Altered 1050'!$E56 -> 21 | F53: =IF('\\ser\Software\other\[POINTS NQS  2012.XLS]Stock Altered 1050'!$F56=0," ",'\\ser\Software\other\[POINTS NQS  2012.XLS]Stock Altered 1050'!$F56) -> Pa Paw Toy | G53: ='\\ser\Software\other\[POINTS NQS  2012.XLS]Stock Altered 1050'!AA56 -> 209 | I53: ='\\ser\Software\other\[POINTS NQS  2012.XLS]Stock Altered 1100'!$A56 -> 51 | J53: ='\\ser\Software\other\[POINTS NQS  2012.XLS]Stock Altered 1100'!$B56 -> Jerry Leonard | K53: ='\\ser\Software\other\[POINTS NQS  2012.XLS]Stock Altered 1100'!$C56 -> Charleston, IL | L53: =IF('\\ser\Software\other\[POINTS NQS  2012.XLS]Stock Altered 1100'!$D56=0," ",'\\ser\Software\other\[POINTS NQS  2012.XLS]Stock Altered 1100'!$D56) -> Vogel | M53: ='\\ser\Software\other\[POINTS NQS  2012.XLS]Stock Altered 1100'!$E56 -> 308 | N53: =IF('\\ser\Software\other\[POINTS NQS  2012.XLS]Stock Altered 1100'!$F56=0," ",'\\ser\Software\other\[POINTS NQS  2012.XLS]Stock Altered 1100'!$F56) -> Histrung | O53: ='\\ser\Software\other\[POINTS NQS  2012.XLS]Stock Altered 1100'!AA56 -> 218
A54: ='\\ser\Software\other\[POINTS NQS  2012.XLS]Stock Altered 1050'!$A57 -> 52 | B54: ='\\ser\Software\other\[POINTS NQS  2012.XLS]Stock Altered 1050'!$B57 -> Bobby Feldkamp | C54: ='\\ser\Software\other\[POINTS NQS  2012.XLS]Stock Altered 1050'!$C57 -> Milan, MI | D54: =IF('\\ser\Software\other\[POINTS NQS  2012.XLS]Stock Altered 1050'!$D57=0," ",'\\ser\Software\other\[POINTS NQS  2012.XLS]Stock Altered 1050'!$D57) -> Woods | E54: ='\\ser\Software\other\[POINTS NQS  2012.XLS]Stock Altered 1050'!$E57 -> 501 | F54: =IF('\\ser\Software\other\[POINTS NQS  2012.XLS]Stock Altered 1050'!$F57=0," ",'\\ser\Software\other\[POINTS NQS  2012.XLS]Stock Altered 1050'!$F57) -> Incognito | G54: ='\\ser\Software\other\[POINTS NQS  2012.XLS]Stock Altered 1050'!AA57 -> 209 | I54: ='\\ser\Software\other\[POINTS NQS  2012.XLS]Stock Altered 1100'!$A57 -> 52 | J54: ='\\ser\Software\other\[POINTS NQS  2012.XLS]Stock Altered 1100'!$B57 -> Chris Gegg | K54: ='\\ser\Software\other\[POINTS NQS  2012.XLS]Stock Altered 1100'!$C57 -> Greenville, IL | L54: =IF('\\ser\Software\other\[POINTS NQS  2012.XLS]Stock Altered 1100'!$D57=0," ",'\\ser\Software\other\[POINTS NQS  2012.XLS]Stock Altered 1100'!$D57) -> JRS | M54: ='\\ser\Software\other\[POINTS NQS  2012.XLS]Stock Altered 1100'!$E57 -> 410 | N54: =IF('\\ser\Software\other\[POINTS NQS  2012.XLS]Stock Altered 1100'!$F57=0," ",'\\ser\Software\other\[POINTS NQS  2012.XLS]Stock Altered 1100'!$F57) -> Insane | O54: ='\\ser\Software\other\[POINTS NQS  2012.XLS]Stock Altered 1100'!AA57 -> 218
A55: ='\\ser\Software\other\[POINTS NQS  2012.XLS]Stock Altered 1050'!$A58 -> 53 | B55: ='\\ser\Software\other\[POINTS NQS  2012.XLS]Stock Altered 1050'!$B58 -> Brian Bell | C55: ='\\ser\Software\other\[POINTS NQS  2012.XLS]Stock Altered 1050'!$C58 -> Cynthiene, KY | D55: =IF('\\ser\Software\other\[POINTS NQS  2012.XLS]Stock Altered 1050'!$D58=0," ",'\\ser\Software\other\[POINTS NQS  2012.XLS]Stock Altered 1050'!$D58) -> NP | E55: ='\\ser\Software\other\[POINTS NQS  2012.XLS]Stock Altered 1050'!$E58 -> 510 | F55: =IF('\\ser\Software\other\[POINTS NQS  2012.XLS]Stock Altered 1050'!$F58=0," ",'\\ser\Software\other\[POINTS NQS  2012.XLS]Stock Altered 1050'!$F58) -> Grim Reaper | G55: ='\\ser\Software\other\[POINTS NQS  2012.XLS]Stock Altered 1050'!AA58 -> 209 | I55: ='\\ser\Software\other\[POINTS NQS  2012.XLS]Stock Altered 1100'!$A58 -> 53 | J55: ='\\ser\Software\other\[POINTS NQS  2012.XLS]Stock Altered 1100'!$B58 -> Jason Rogers | K55: ='\\ser\Software\other\[POINTS NQS  2012.XLS]Stock Altered 1100'!$C58 -> Richmond, Ky | L55: =IF('\\ser\Software\other\[POINTS NQS  2012.XLS]Stock Altered 1100'!$D58=0," ",'\\ser\Software\other\[POINTS NQS  2012.XLS]Stock Altered 1100'!$D58) -> NP | M55: ='\\ser\Software\other\[POINTS NQS  2012.XLS]Stock Altered 1100'!$E58 -> 561 | N55: =IF('\\ser\Software\other\[POINTS NQS  2012.XLS]Stock Altered 1100'!$F58=0," ",'\\ser\Software\other\[POINTS NQS  2012.XLS]Stock Altered 1100'!$F58) -> Tinker Toy | O55: ='\\ser\Software\other\[POINTS NQS  2012.XLS]Stock Altered 1100'!AA58 -> 223
A56: ='\\ser\Software\other\[POINTS NQS  2012.XLS]Stock Altered 1050'!$A59 -> 54 | B56: ='\\ser\Software\other\[POINTS NQS  2012.XLS]Stock Altered 1050'!$B59 -> Mike Hall | C56: ='\\ser\Software\other\[POINTS NQS  2012.XLS]Stock Altered 1050'!$C59 -> Perrysburg, Oh | D56: =IF('\\ser\Software\other\[POINTS NQS  2012.XLS]Stock Altered 1050'!$D59=0," ",'\\ser\Software\other\[POINTS NQS  2012.XLS]Stock Altered 1050'!$D59) -> RPM | E56: ='\\ser\Software\other\[POINTS NQS  2012.XLS]Stock Altered 1050'!$E59 -> 248 | F56: =IF('\\ser\Software\other\[POINTS NQS  2012.XLS]Stock Altered 1050'!$F59=0," ",'\\ser\Software\other\[POINTS NQS  2012.XLS]Stock Altered 1050'!$F59) -> Lethal Injection | G56: ='\\ser\Software\other\[POINTS NQS  2012.XLS]Stock Altered 1050'!AA59 -> 210 | I56: ='\\ser\Software\other\[POINTS NQS  2012.XLS]Stock Altered 1100'!$A59 -> 54 | J56: ='\\ser\Software\other\[POINTS NQS  2012.XLS]Stock Altered 1100'!$B59 -> Randy Hazelbaker | K56: ='\\ser\Software\other\[POINTS NQS  2012.XLS]Stock Altered 1100'!$C59 -> Winchester, Oh | L56: =IF('\\ser\Software\other\[POINTS NQS  2012.XLS]Stock Altered 1100'!$D59=0," ",'\\ser\Software\other\[POINTS NQS  2012.XLS]Stock Altered 1100'!$D59) -> TV | M56: ='\\ser\Software\other\[POINTS NQS  2012.XLS]Stock Altered 1100'!$E59 -> 87 | N56: =IF('\\ser\Software\other\[POINTS NQS  2012.XLS]Stock Altered 1100'!$F59=0," ",'\\ser\Software\other\[POINTS NQS  2012.XLS]Stock Altered 1100'!$F59) -> One Bad Buck | O56: ='\\ser\Software\other\[POINTS NQS  2012.XLS]Stock Altered 1100'!AA59 -> 226
A57: ='\\ser\Software\other\[POINTS NQS  2012.XLS]Stock Altered 1050'!$A60 -> 55 | B57: ='\\ser\Software\other\[POINTS NQS  2012.XLS]Stock Altered 1050'!$B60 -> Mike McGaha | C57: ='\\ser\Software\other\[POINTS NQS  2012.XLS]Stock Altered 1050'!$C60 -> Hope, IN | D57: =IF('\\ser\Software\other\[POINTS NQS  2012.XLS]Stock Altered 1050'!$D60=0," ",'\\ser\Software\other\[POINTS NQS  2012.XLS]Stock Altered 1050'!$D60) -> JW | E57: ='\\ser\Software\other\[POINTS NQS  2012.XLS]Stock Altered 1050'!$E60 -> 288 | F57: =IF('\\ser\Software\other\[POINTS NQS  2012.XLS]Stock Altered 1050'!$F60=0," ",'\\ser\Software\other\[POINTS NQS  2012.XLS]Stock Altered 1050'!$F60) -> Company Time | G57: ='\\ser\Software\other\[POINTS NQS  2012.XLS]Stock Altered 1050'!AA60 -> 212 | I57: ='\\ser\Software\other\[POINTS NQS  2012.XLS]Stock Altered 1100'!$A60 -> 55 | J57: ='\\ser\Software\other\[POINTS NQS  2012.XLS]Stock Altered 1100'!$B60 -> Ron Feldkamp | K57: ='\\ser\Software\other\[POINTS NQS  2012.XLS]Stock Altered 1100'!$C60 -> Saline, Mi | L57: =IF('\\ser\Software\other\[POINTS NQS  2012.XLS]Stock Altered 1100'!$D60=0," ",'\\ser\Software\other\[POINTS NQS  2012.XLS]Stock Altered 1100'!$D60) -> Woods | M57: ='\\ser\Software\other\[POINTS NQS  2012.XLS]Stock Altered 1100'!$E60 -> 143 | N57: =IF('\\ser\Software\other\[POINTS NQS  2012.XLS]Stock Altered 1100'!$F60=0," ",'\\ser\Software\other\[POINTS NQS  2012.XLS]Stock Altered 1100'!$F60) -> Key Chain | O57: ='\\ser\Software\other\[POINTS NQS  2012.XLS]Stock Altered 1100'!AA60 -> 226
A58: ='\\ser\Software\other\[POINTS NQS  2012.XLS]Stock Altered 1050'!$A61 -> 56 | B58: ='\\ser\Software\other\[POINTS NQS  2012.XLS]Stock Altered 1050'!$B61 -> Roger McKinney 3rd | C58: ='\\ser\Software\other\[POINTS NQS  2012.XLS]Stock Altered 1050'!$C61 -> Lake Ariel, PA | D58: =IF('\\ser\Software\other\[POINTS NQS  2012.XLS]Stock Altered 1050'!$D61=0," ",'\\ser\Software\other\[POINTS NQS  2012.XLS]Stock Altered 1050'!$D61) ->  | E58: ='\\ser\Software\other\[POINTS NQS  2012.XLS]Stock Altered 1050'!$E61 -> 540 | F58: =IF('\\ser\Software\other\[POINTS NQS  2012.XLS]Stock Altered 1050'!$F61=0," ",'\\ser\Software\other\[POINTS NQS  2012.XLS]Stock Altered 1050'!$F61) -> Fireball | G58: ='\\ser\Software\other\[POINTS NQS  2012.XLS]Stock Altered 1050'!AA61 -> 212 | I58: ='\\ser\Software\other\[POINTS NQS  2012.XLS]Stock Altered 1100'!$A61 -> 56 | J58: ='\\ser\Software\other\[POINTS NQS  2012.XLS]Stock Altered 1100'!$B61 -> Herb Houck | K58: ='\\ser\Software\other\[POINTS NQS  2012.XLS]Stock Altered 1100'!$C61 -> Spruce Creek, Pa | L58: =IF('\\ser\Software\other\[POINTS NQS  2012.XLS]Stock Altered 1100'!$D61=0," ",'\\ser\Software\other\[POINTS NQS  2012.XLS]Stock Altered 1100'!$D61) -> LR | M58: ='\\ser\Software\other\[POINTS NQS  2012.XLS]Stock Altered 1100'!$E61 -> 545 | N58: =IF('\\ser\Software\other\[POINTS NQS  2012.XLS]Stock Altered 1100'!$F61=0," ",'\\ser\Software\other\[POINTS NQS  2012.XLS]Stock Altered 1100'!$F61) -> IH Express | O58: ='\\ser\Software\other\[POINTS NQS  2012.XLS]Stock Altered 1100'!AA61 -> 229
A59: ='\\ser\Software\other\[POINTS NQS  2012.XLS]Stock Altered 1050'!$A62 -> 57 | B59: ='\\ser\Software\other\[POINTS NQS  2012.XLS]Stock Altered 1050'!$B62 -> Jared Riddle | C59: ='\\ser\Software\other\[POINTS NQS  2012.XLS]Stock Altered 1050'!$C62 -> Montgomery City, PA | D59: =IF('\\ser\Software\other\[POINTS NQS  2012.XLS]Stock Altered 1050'!$D62=0," ",'\\ser\Software\other\[POINTS NQS  2012.XLS]Stock Altered 1050'!$D62) ->  | E59: ='\\ser\Software\other\[POINTS NQS  2012.XLS]Stock Altered 1050'!$E62 -> 471 | F59: =IF('\\ser\Software\other\[POINTS NQS  2012.XLS]Stock Altered 1050'!$F62=0," ",'\\ser\Software\other\[POINTS NQS  2012.XLS]Stock Altered 1050'!$F62) -> Williemakit | G59: ='\\ser\Software\other\[POINTS NQS  2012.XLS]Stock Altered 1050'!AA62 -> 214 | I59: ='\\ser\Software\other\[POINTS NQS  2012.XLS]Stock Altered 1100'!$A62 -> 57 | J59: ='\\ser\Software\other\[POINTS NQS  2012.XLS]Stock Altered 1100'!$B62 -> Jared Riddle | K59: ='\\ser\Software\other\[POINTS NQS  2012.XLS]Stock Altered 1100'!$C62 -> Montgomery City, PA | L59: =IF('\\ser\Software\other\[POINTS NQS  2012.XLS]Stock Altered 1100'!$D62=0," ",'\\ser\Software\other\[POINTS NQS  2012.XLS]Stock Altered 1100'!$D62) ->  | M59: ='\\ser\Software\other\[POINTS NQS  2012.XLS]Stock Altered 1100'!$E62 -> 471 | N59: =IF('\\ser\Software\other\[POINTS NQS  2012.XLS]Stock Altered 1100'!$F62=0," ",'\\ser\Software\other\[POINTS NQS  2012.XLS]Stock Altered 1100'!$F62) -> Williemakit | O59: ='\\ser\Software\other\[POINTS NQS  2012.XLS]Stock Altered 1100'!AA62 -> 230
A60: ='\\ser\Software\other\[POINTS NQS  2012.XLS]Stock Altered 1050'!$A63 -> 58 | B60: ='\\ser\Software\other\[POINTS NQS  2012.XLS]Stock Altered 1050'!$B63 -> Gordon Lloyd | C60: ='\\ser\Software\other\[POINTS NQS  2012.XLS]Stock Altered 1050'!$C63 -> Circleville, Oh | D60: =IF('\\ser\Software\other\[POINTS NQS  2012.XLS]Stock Altered 1050'!$D63=0," ",'\\ser\Software\other\[POINTS NQS  2012.XLS]Stock Altered 1050'!$D63) ->  | E60: ='\\ser\Software\other\[POINTS NQS  2012.XLS]Stock Altered 1050'!$E63 -> 549 | F60: =IF('\\ser\Software\other\[POINTS NQS  2012.XLS]Stock Altered 1050'!$F63=0," ",'\\ser\Software\other\[POINTS NQS  2012.XLS]Stock Altered 1050'!$F63) -> Project X | G60: ='\\ser\Software\other\[POINTS NQS  2012.XLS]Stock Altered 1050'!AA63 -> 228 | I60: ='\\ser\Software\other\[POINTS NQS  2012.XLS]Stock Altered 1100'!$A63 -> 58 | J60: ='\\ser\Software\other\[POINTS NQS  2012.XLS]Stock Altered 1100'!$B63 -> Bob Jones SR | K60: ='\\ser\Software\other\[POINTS NQS  2012.XLS]Stock Altered 1100'!$C63 -> Hopewell, OH | L60: =IF('\\ser\Software\other\[POINTS NQS  2012.XLS]Stock Altered 1100'!$D63=0," ",'\\ser\Software\other\[POINTS NQS  2012.XLS]Stock Altered 1100'!$D63) -> BJ | M60: ='\\ser\Software\other\[POINTS NQS  2012.XLS]Stock Altered 1100'!$E63 -> 182 | N60: =IF('\\ser\Software\other\[POINTS NQS  2012.XLS]Stock Altered 1100'!$F63=0," ",'\\ser\Software\other\[POINTS NQS  2012.XLS]Stock Altered 1100'!$F63) -> Buckeye Binder | O60: ='\\ser\Software\other\[POINTS NQS  2012.XLS]Stock Altered 1100'!AA63 -> 243
A61: ='\\ser\Software\other\[POINTS NQS  2012.XLS]Stock Altered 1050'!$A64 -> 59 | B61: ='\\ser\Software\other\[POINTS NQS  2012.XLS]Stock Altered 1050'!$B64 -> Shawn Garman | C61: ='\\ser\Software\other\[POINTS NQS  2012.XLS]Stock Altered 1050'!$C64 -> Jeromesville, OH | D61: =IF('\\ser\Software\other\[POINTS NQS  2012.XLS]Stock Altered 1050'!$D64=0," ",'\\ser\Software\other\[POINTS NQS  2012.XLS]Stock Altered 1050'!$D64) -> JRS | E61: ='\\ser\Software\other\[POINTS NQS  2012.XLS]Stock Altered 1050'!$E64 -> 391 | F61: =IF('\\ser\Software\other\[POINTS NQS  2012.XLS]Stock Altered 1050'!$F64=0," ",'\\ser\Software\other\[POINTS NQS  2012.XLS]Stock Altered 1050'!$F64) -> Jagmeister | G61: ='\\ser\Software\other\[POINTS NQS  2012.XLS]Stock Altered 1050'!AA64 -> 229 | I61: ='\\ser\Software\other\[POINTS NQS  2012.XLS]Stock Altered 1100'!$A64 -> 59 | J61: ='\\ser\Software\other\[POINTS NQS  2012.XLS]Stock Altered 1100'!$B64 -> Mike McGaha | K61: ='\\ser\Software\other\[POINTS NQS  2012.XLS]Stock Altered 1100'!$C64 -> Hope, IN | L61: =IF('\\ser\Software\other\[POINTS NQS  2012.XLS]Stock Altered 1100'!$D64=0," ",'\\ser\Software\other\[POINTS NQS  2012.XLS]Stock Altered 1100'!$D64) -> JW | M61: ='\\ser\Software\other\[POINTS NQS  2012.XLS]Stock Altered 1100'!$E64 -> 288 | N61: =IF('\\ser\Software\other\[POINTS NQS  2012.XLS]Stock Altered 1100'!$F64=0," ",'\\ser\Software\other\[POINTS NQS  2012.XLS]Stock Altered 1100'!$F64) -> Company Time | O61: ='\\ser\Software\other\[POINTS NQS  2012.XLS]Stock Altered 1100'!AA64 -> 243
A62: ='\\ser\Software\other\[POINTS NQS  2012.XLS]Stock Altered 1050'!$A65 -> 60 | B62: ='\\ser\Software\other\[POINTS NQS  2012.XLS]Stock Altered 1050'!$B65 -> Lawrence Davenport | C62: ='\\ser\Software\other\[POINTS NQS  2012.XLS]Stock Altered 1050'!$C65 -> Mexico, MO | D62: =IF('\\ser\Software\other\[POINTS NQS  2012.XLS]Stock Altered 1050'!$D65=0," ",'\\ser\Software\other\[POINTS NQS  2012.XLS]Stock Altered 1050'!$D65) -> TV | E62: ='\\ser\Software\other\[POINTS NQS  2012.XLS]Stock Altered 1050'!$E65 -> 573 | F62: =IF('\\ser\Software\other\[POINTS NQS  2012.XLS]Stock Altered 1050'!$F65=0," ",'\\ser\Software\other\[POINTS NQS  2012.XLS]Stock Altered 1050'!$F65) -> Black Magic | G62: ='\\ser\Software\other\[POINTS NQS  2012.XLS]Stock Altered 1050'!AA65 -> 229 | I62: ='\\ser\Software\other\[POINTS NQS  2012.XLS]Stock Altered 1100'!$A65 -> 60 | J62: ='\\ser\Software\other\[POINTS NQS  2012.XLS]Stock Altered 1100'!$B65 -> Jeff Jager | K62: ='\\ser\Software\other\[POINTS NQS  2012.XLS]Stock Altered 1100'!$C65 -> Sussex, NJ | L62: =IF('\\ser\Software\other\[POINTS NQS  2012.XLS]Stock Altered 1100'!$D65=0," ",'\\ser\Software\other\[POINTS NQS  2012.XLS]Stock Altered 1100'!$D65) -> JRS | M62: ='\\ser\Software\other\[POINTS NQS  2012.XLS]Stock Altered 1100'!$E65 -> 529 | N62: =IF('\\ser\Software\other\[POINTS NQS  2012.XLS]Stock Altered 1100'!$F65=0," ",'\\ser\Software\other\[POINTS NQS  2012.XLS]Stock Altered 1100'!$F65) -> Orange Crush | O62: ='\\ser\Software\other\[POINTS NQS  2012.XLS]Stock Altered 1100'!AA65 -> 243
A63: ='\\ser\Software\other\[POINTS NQS  2012.XLS]Stock Altered 1050'!$A66 -> 61 | B63: ='\\ser\Software\other\[POINTS NQS  2012.XLS]Stock Altered 1050'!$B66 -> Gina McGaha | C63: ='\\ser\Software\other\[POINTS NQS  2012.XLS]Stock Altered 1050'!$C66 -> Hope, IN | D63: =IF('\\ser\Software\other\[POINTS NQS  2012.XLS]Stock Altered 1050'!$D66=0," ",'\\ser\Software\other\[POINTS NQS  2012.XLS]Stock Altered 1050'!$D66) -> JW | E63: ='\\ser\Software\other\[POINTS NQS  2012.XLS]Stock Altered 1050'!$E66 -> 161 | F63: =IF('\\ser\Software\other\[POINTS NQS  2012.XLS]Stock Altered 1050'!$F66=0," ",'\\ser\Software\other\[POINTS NQS  2012.XLS]Stock Altered 1050'!$F66) -> Betty Stalker | G63: ='\\ser\Software\other\[POINTS NQS  2012.XLS]Stock Altered 1050'!AA66 -> 230 | I63: ='\\ser\Software\other\[POINTS NQS  2012.XLS]Stock Altered 1100'!$A66 -> 61 | J63: ='\\ser\Software\other\[POINTS NQS  2012.XLS]Stock Altered 1100'!$B66 -> Greg Myers | K63: ='\\ser\Software\other\[POINTS NQS  2012.XLS]Stock Altered 1100'!$C66 -> Circleville, Oh | L63: =IF('\\ser\Software\other\[POINTS NQS  2012.XLS]Stock Altered 1100'!$D66=0," ",'\\ser\Software\other\[POINTS NQS  2012.XLS]Stock Altered 1100'!$D66) ->  | M63: ='\\ser\Software\other\[POINTS NQS  2012.XLS]Stock Altered 1100'!$E66 -> 496 | N63: =IF('\\ser\Software\other\[POINTS NQS  2012.XLS]Stock Altered 1100'!$F66=0," ",'\\ser\Software\other\[POINTS NQS  2012.XLS]Stock Altered 1100'!$F66) -> Gang Green | O63: ='\\ser\Software\other\[POINTS NQS  2012.XLS]Stock Altered 1100'!AA66 -> 244
A64: ='\\ser\Software\other\[POINTS NQS  2012.XLS]Stock Altered 1050'!$A67 -> 62 | B64: ='\\ser\Software\other\[POINTS NQS  2012.XLS]Stock Altered 1050'!$B67 -> Mark Rader | C64: ='\\ser\Software\other\[POINTS NQS  2012.XLS]Stock Altered 1050'!$C67 -> Pataskala, Oh | D64: =IF('\\ser\Software\other\[POINTS NQS  2012.XLS]Stock Altered 1050'!$D67=0," ",'\\ser\Software\other\[POINTS NQS  2012.XLS]Stock Altered 1050'!$D67) -> RPM | E64: ='\\ser\Software\other\[POINTS NQS  2012.XLS]Stock Altered 1050'!$E67 -> 213 | F64: =IF('\\ser\Software\other\[POINTS NQS  2012.XLS]Stock Altered 1050'!$F67=0," ",'\\ser\Software\other\[POINTS NQS  2012.XLS]Stock Altered 1050'!$F67) -> Lethal Weapon | G64: ='\\ser\Software\other\[POINTS NQS  2012.XLS]Stock Altered 1050'!AA67 -> 230 | I64: ='\\ser\Software\other\[POINTS NQS  2012.XLS]Stock Altered 1100'!$A67 -> 62 | J64: ='\\ser\Software\other\[POINTS NQS  2012.XLS]Stock Altered 1100'!$B67 -> Brian Bell | K64: ='\\ser\Software\other\[POINTS NQS  2012.XLS]Stock Altered 1100'!$C67 -> Cynthiene, KY | L64: =IF('\\ser\Software\other\[POINTS NQS  2012.XLS]Stock Altered 1100'!$D67=0," ",'\\ser\Software\other\[POINTS NQS  2012.XLS]Stock Altered 1100'!$D67) -> NP | M64: ='\\ser\Software\other\[POINTS NQS  2012.XLS]Stock Altered 1100'!$E67 -> 510 | N64: =IF('\\ser\Software\other\[POINTS NQS  2012.XLS]Stock Altered 1100'!$F67=0," ",'\\ser\Software\other\[POINTS NQS  2012.XLS]Stock Altered 1100'!$F67) -> Grim Reaper | O64: ='\\ser\Software\other\[POINTS NQS  2012.XLS]Stock Altered 1100'!AA67 -> 244
A65: ='\\ser\Software\other\[POINTS NQS  2012.XLS]Stock Altered 1050'!$A68 -> 63 | B65: ='\\ser\Software\other\[POINTS NQS  2012.XLS]Stock Altered 1050'!$B68 -> Austin Ernest | C65: ='\\ser\Software\other\[POINTS NQS  2012.XLS]Stock Altered 1050'!$C68 -> Elesmere, Ky | D65: =IF('\\ser\Software\other\[POINTS NQS  2012.XLS]Stock Altered 1050'!$D68=0," ",'\\ser\Software\other\[POINTS NQS  2012.XLS]Stock Altered 1050'!$D68) ->  | E65: ='\\ser\Software\other\[POINTS NQS  2012.XLS]Stock Altered 1050'!$E68 -> 224 | F65: =IF('\\ser\Software\other\[POINTS NQS  2012.XLS]Stock Altered 1050'!$F68=0," ",'\\ser\Software\other\[POINTS NQS  2012.XLS]Stock Altered 1050'!$F68) ->  | G65: ='\\ser\Software\other\[POINTS NQS  2012.XLS]Stock Altered 1050'!AA68 -> 230 | I65: ='\\ser\Software\other\[POINTS NQS  2012.XLS]Stock Altered 1100'!$A68 -> 63 | J65: ='\\ser\Software\other\[POINTS NQS  2012.XLS]Stock Altered 1100'!$B68 -> Brian Simpson | K65: ='\\ser\Software\other\[POINTS NQS  2012.XLS]Stock Altered 1100'!$C68 -> Danville, Oh | L65: =IF('\\ser\Software\other\[POINTS NQS  2012.XLS]Stock Altered 1100'!$D68=0," ",'\\ser\Software\other\[POINTS NQS  2012.XLS]Stock Altered 1100'!$D68) -> Woods | M65: ='\\ser\Software\other\[POINTS NQS  2012.XLS]Stock Altered 1100'!$E68 -> 525 | N65: =IF('\\ser\Software\other\[POINTS NQS  2012.XLS]Stock Altered 1100'!$F68=0," ",'\\ser\Software\other\[POINTS NQS  2012.XLS]Stock Altered 1100'!$F68) -> Ramp Door Express | O65: ='\\ser\Software\other\[POINTS NQS  2012.XLS]Stock Altered 1100'!AA68 -> 244
A66: ='\\ser\Software\other\[POINTS NQS  2012.XLS]Stock Altered 1050'!$A69 -> 64 | B66: ='\\ser\Software\other\[POINTS NQS  2012.XLS]Stock Altered 1050'!$B69 -> Suzanne McClain | C66: ='\\ser\Software\other\[POINTS NQS  2012.XLS]Stock Altered 1050'!$C69 -> Hope, IN | D66: =IF('\\ser\Software\other\[POINTS NQS  2012.XLS]Stock Altered 1050'!$D69=0," ",'\\ser\Software\other\[POINTS NQS  2012.XLS]Stock Altered 1050'!$D69) ->  | E66: ='\\ser\Software\other\[POINTS NQS  2012.XLS]Stock Altered 1050'!$E69 -> 376 | F66: =IF('\\ser\Software\other\[POINTS NQS  2012.XLS]Stock Altered 1050'!$F69=0," ",'\\ser\Software\other\[POINTS NQS  2012.XLS]Stock Altered 1050'!$F69) ->  | G66: ='\\ser\Software\other\[POINTS NQS  2012.XLS]Stock Altered 1050'!AA69 -> 230 | I66: ='\\ser\Software\other\[POINTS NQS  2012.XLS]Stock Altered 1100'!$A69 -> 64 | J66: ='\\ser\Software\other\[POINTS NQS  2012.XLS]Stock Altered 1100'!$B69 -> Alex Thomas | K66: ='\\ser\Software\other\[POINTS NQS  2012.XLS]Stock Altered 1100'!$C69 -> Apex, NC | L66: =IF('\\ser\Software\other\[POINTS NQS  2012.XLS]Stock Altered 1100'!$D69=0," ",'\\ser\Software\other\[POINTS NQS  2012.XLS]Stock Altered 1100'!$D69) -> JRS | M66: ='\\ser\Software\other\[POINTS NQS  2012.XLS]Stock Altered 1100'!$E69 -> 0 | N66: =IF('\\ser\Software\other\[POINTS NQS  2012.XLS]Stock Altered 1100'!$F69=0," ",'\\ser\Software\other\[POINTS NQS  2012.XLS]Stock Altered 1100'!$F69) -> Copper Head | O66: ='\\ser\Software\other\[POINTS NQS  2012.XLS]Stock Altered 1100'!AA69 -> 244
A67: ='\\ser\Software\other\[POINTS NQS  2012.XLS]Stock Altered 1050'!$A70 -> 65 | B67: ='\\ser\Software\other\[POINTS NQS  2012.XLS]Stock Altered 1050'!$B70 -> Clarence Bell | C67: ='\\ser\Software\other\[POINTS NQS  2012.XLS]Stock Altered 1050'!$C70 -> West Salem, IL | D67: =IF('\\ser\Software\other\[POINTS NQS  2012.XLS]Stock Altered 1050'!$D70=0," ",'\\ser\Software\other\[POINTS NQS  2012.XLS]Stock Altered 1050'!$D70) -> TC | E67: ='\\ser\Software\other\[POINTS NQS  2012.XLS]Stock Altered 1050'!$E70 -> 466 | F67: =IF('\\ser\Software\other\[POINTS NQS  2012.XLS]Stock Altered 1050'!$F70=0," ",'\\ser\Software\other\[POINTS NQS  2012.XLS]Stock Altered 1050'!$F70) -> Money Pit | G67: ='\\ser\Software\other\[POINTS NQS  2012.XLS]Stock Altered 1050'!AA70 -> 230 | I67: ='\\ser\Software\other\[POINTS NQS  2012.XLS]Stock Altered 1100'!$A70 -> 65 | J67: ='\\ser\Software\other\[POINTS NQS  2012.XLS]Stock Altered 1100'!$B70 -> Gina McGaha | K67: ='\\ser\Software\other\[POINTS NQS  2012.XLS]Stock Altered 1100'!$C70 -> Hope, IN | L67: =IF('\\ser\Software\other\[POINTS NQS  2012.XLS]Stock Altered 1100'!$D70=0," ",'\\ser\Software\other\[POINTS NQS  2012.XLS]Stock Altered 1100'!$D70) -> JW | M67: ='\\ser\Software\other\[POINTS NQS  2012.XLS]Stock Altered 1100'!$E70 -> 161 | N67: =IF('\\ser\Software\other\[POINTS NQS  2012.XLS]Stock Altered 1100'!$F70=0," ",'\\ser\Software\other\[POINTS NQS  2012.XLS]Stock Altered 1100'!$F70) -> Betty Stalker | O67: ='\\ser\Software\other\[POINTS NQS  2012.XLS]Stock Altered 1100'!AA70 -> 245
A68: ='\\ser\Software\other\[POINTS NQS  2012.XLS]Stock Altered 1050'!$A71 -> 66 | B68: ='\\ser\Software\other\[POINTS NQS  2012.XLS]Stock Altered 1050'!$B71 -> Greg Myers | C68: ='\\ser\Software\other\[POINTS NQS  2012.XLS]Stock Altered 1050'!$C71 -> Circleville, Oh | D68: =IF('\\ser\Software\other\[POINTS NQS  2012.XLS]Stock Altered 1050'!$D71=0," ",'\\ser\Software\other\[POINTS NQS  2012.XLS]Stock Altered 1050'!$D71) ->  | E68: ='\\ser\Software\other\[POINTS NQS  2012.XLS]Stock Altered 1050'!$E71 -> 496 | F68: =IF('\\ser\Software\other\[POINTS NQS  2012.XLS]Stock Altered 1050'!$F71=0," ",'\\ser\Software\other\[POINTS NQS  2012.XLS]Stock Altered 1050'!$F71) -> Gang Green | G68: ='\\ser\Software\other\[POINTS NQS  2012.XLS]Stock Altered 1050'!AA71 -> 230 | I68: ='\\ser\Software\other\[POINTS NQS  2012.XLS]Stock Altered 1100'!$A71 -> 66 | J68: ='\\ser\Software\other\[POINTS NQS  2012.XLS]Stock Altered 1100'!$B71 -> Gary Frank | K68: ='\\ser\Software\other\[POINTS NQS  2012.XLS]Stock Altered 1100'!$C71 -> Amanda, OH | L68: =IF('\\ser\Software\other\[POINTS NQS  2012.XLS]Stock Altered 1100'!$D71=0," ",'\\ser\Software\other\[POINTS NQS  2012.XLS]Stock Altered 1100'!$D71) -> TV | M68: ='\\ser\Software\other\[POINTS NQS  2012.XLS]Stock Altered 1100'!$E71 -> 233 | N68: =IF('\\ser\Software\other\[POINTS NQS  2012.XLS]Stock Altered 1100'!$F71=0," ",'\\ser\Software\other\[POINTS NQS  2012.XLS]Stock Altered 1100'!$F71) -> Katies Toy | O68: ='\\ser\Software\other\[POINTS NQS  2012.XLS]Stock Altered 1100'!AA71 -> 245
A69: ='\\ser\Software\other\[POINTS NQS  2012.XLS]Stock Altered 1050'!$A72 -> 67 | B69: ='\\ser\Software\other\[POINTS NQS  2012.XLS]Stock Altered 1050'!$B72 -> Bob Jones SR | C69: ='\\ser\Software\other\[POINTS NQS  2012.XLS]Stock Altered 1050'!$C72 -> Hopewell, OH | D69: =IF('\\ser\Software\other\[POINTS NQS  2012.XLS]Stock Altered 1050'!$D72=0," ",'\\ser\Software\other\[POINTS NQS  2012.XLS]Stock Altered 1050'!$D72) -> BJ | E69: ='\\ser\Software\other\[POINTS NQS  2012.XLS]Stock Altered 1050'!$E72 -> 182 | F69: =IF('\\ser\Software\other\[POINTS NQS  2012.XLS]Stock Altered 1050'!$F72=0," ",'\\ser\Software\other\[POINTS NQS  2012.XLS]Stock Altered 1050'!$F72) -> Buckeye Binder | G69: ='\\ser\Software\other\[POINTS NQS  2012.XLS]Stock Altered 1050'!AA72 -> 231 | I69: ='\\ser\Software\other\[POINTS NQS  2012.XLS]Stock Altered 1100'!$A72 -> 67 | J69: ='\\ser\Software\other\[POINTS NQS  2012.XLS]Stock Altered 1100'!$B72 -> Waylan Nelson | K69: ='\\ser\Software\other\[POINTS NQS  2012.XLS]Stock Altered 1100'!$C72 -> Shelby, IA | L69: =IF('\\ser\Software\other\[POINTS NQS  2012.XLS]Stock Altered 1100'!$D72=0," ",'\\ser\Software\other\[POINTS NQS  2012.XLS]Stock Altered 1100'!$D72) -> Woods | M69: ='\\ser\Software\other\[POINTS NQS  2012.XLS]Stock Altered 1100'!$E72 -> 499 | N69: =IF('\\ser\Software\other\[POINTS NQS  2012.XLS]Stock Altered 1100'!$F72=0," ",'\\ser\Software\other\[POINTS NQS  2012.XLS]Stock Altered 1100'!$F72) -> Close E Nuff | O69: ='\\ser\Software\other\[POINTS NQS  2012.XLS]Stock Altered 1100'!AA72 -> 245
A70: ='\\ser\Software\other\[POINTS NQS  2012.XLS]Stock Altered 1050'!$A73 -> 68 | B70: ='\\ser\Software\other\[POINTS NQS  2012.XLS]Stock Altered 1050'!$B73 -> Waylan Nelson | C70: ='\\ser\Software\other\[POINTS NQS  2012.XLS]Stock Altered 1050'!$C73 -> Shelby, IA | D70: =IF('\\ser\Software\other\[POINTS NQS  2012.XLS]Stock Altered 1050'!$D73=0," ",'\\ser\Software\other\[POINTS NQS  2012.XLS]Stock Altered 1050'!$D73) -> Woods | E70: ='\\ser\Software\other\[POINTS NQS  2012.XLS]Stock Altered 1050'!$E73 -> 500 | F70: =IF('\\ser\Software\other\[POINTS NQS  2012.XLS]Stock Altered 1050'!$F73=0," ",'\\ser\Software\other\[POINTS NQS  2012.XLS]Stock Altered 1050'!$F73) -> Butt Ugly | G70: ='\\ser\Software\other\[POINTS NQS  2012.XLS]Stock Altered 1050'!AA73 -> 231 | I70: ='\\ser\Software\other\[POINTS NQS  2012.XLS]Stock Altered 1100'!$A73 -> 68 | J70: ='\\ser\Software\other\[POINTS NQS  2012.XLS]Stock Altered 1100'!$B73 -> Roger McKinney 3rd | K70: ='\\ser\Software\other\[POINTS NQS  2012.XLS]Stock Altered 1100'!$C73 -> Lake Ariel, PA | L70: =IF('\\ser\Software\other\[POINTS NQS  2012.XLS]Stock Altered 1100'!$D73=0," ",'\\ser\Software\other\[POINTS NQS  2012.XLS]Stock Altered 1100'!$D73) ->  | M70: ='\\ser\Software\other\[POINTS NQS  2012.XLS]Stock Altered 1100'!$E73 -> 540 | N70: =IF('\\ser\Software\other\[POINTS NQS  2012.XLS]Stock Altered 1100'!$F73=0," ",'\\ser\Software\other\[POINTS NQS  2012.XLS]Stock Altered 1100'!$F73) -> Fireball | O70: ='\\ser\Software\other\[POINTS NQS  2012.XLS]Stock Altered 1100'!AA73 -> 245
A71: ='\\ser\Software\other\[POINTS NQS  2012.XLS]Stock Altered 1050'!$A74 -> 69 | B71: ='\\ser\Software\other\[POINTS NQS  2012.XLS]Stock Altered 1050'!$B74 -> Mark Vaughn | C71: ='\\ser\Software\other\[POINTS NQS  2012.XLS]Stock Altered 1050'!$C74 -> Loudonville, Oh | D71: =IF('\\ser\Software\other\[POINTS NQS  2012.XLS]Stock Altered 1050'!$D74=0," ",'\\ser\Software\other\[POINTS NQS  2012.XLS]Stock Altered 1050'!$D74) -> Woods | E71: ='\\ser\Software\other\[POINTS NQS  2012.XLS]Stock Altered 1050'!$E74 -> 523 | F71: =IF('\\ser\Software\other\[POINTS NQS  2012.XLS]Stock Altered 1050'!$F74=0," ",'\\ser\Software\other\[POINTS NQS  2012.XLS]Stock Altered 1050'!$F74) -> Cowen Truck Lines | G71: ='\\ser\Software\other\[POINTS NQS  2012.XLS]Stock Altered 1050'!AA74 -> 231 | I71: ='\\ser\Software\other\[POINTS NQS  2012.XLS]Stock Altered 1100'!$A74 -> 69 | J71: ='\\ser\Software\other\[POINTS NQS  2012.XLS]Stock Altered 1100'!$B74 -> Roger Davis | K71: ='\\ser\Software\other\[POINTS NQS  2012.XLS]Stock Altered 1100'!$C74 -> Whipple, Oh | L71: =IF('\\ser\Software\other\[POINTS NQS  2012.XLS]Stock Altered 1100'!$D74=0," ",'\\ser\Software\other\[POINTS NQS  2012.XLS]Stock Altered 1100'!$D74) -> JRS | M71: ='\\ser\Software\other\[POINTS NQS  2012.XLS]Stock Altered 1100'!$E74 -> 68 | N71: =IF('\\ser\Software\other\[POINTS NQS  2012.XLS]Stock Altered 1100'!$F74=0," ",'\\ser\Software\other\[POINTS NQS  2012.XLS]Stock Altered 1100'!$F74) -> Dusty Lady | O71: ='\\ser\Software\other\[POINTS NQS  2012.XLS]Stock Altered 1100'!AA74 -> 246
A72: ='\\ser\Software\other\[POINTS NQS  2012.XLS]Stock Altered 1050'!$A75 -> 70 | B72: ='\\ser\Software\other\[POINTS NQS  2012.XLS]Stock Altered 1050'!$B75 -> Alex Thomas | C72: ='\\ser\Software\other\[POINTS NQS  2012.XLS]Stock Altered 1050'!$C75 -> 0 | D72: =IF('\\ser\Software\other\[POINTS NQS  2012.XLS]Stock Altered 1050'!$D75=0," ",'\\ser\Software\other\[POINTS NQS  2012.XLS]Stock Altered 1050'!$D75) ->  | E72: ='\\ser\Software\other\[POINTS NQS  2012.XLS]Stock Altered 1050'!$E75 -> 0 | F72: =IF('\\ser\Software\other\[POINTS NQS  2012.XLS]Stock Altered 1050'!$F75=0," ",'\\ser\Software\other\[POINTS NQS  2012.XLS]Stock Altered 1050'!$F75) -> Copper Head | G72: ='\\ser\Software\other\[POINTS NQS  2012.XLS]Stock Altered 1050'!AA75 -> 231 | I72: ='\\ser\Software\other\[POINTS NQS  2012.XLS]Stock Altered 1100'!$A75 -> 70 | J72: ='\\ser\Software\other\[POINTS NQS  2012.XLS]Stock Altered 1100'!$B75 -> Mark Vaughn | K72: ='\\ser\Software\other\[POINTS NQS  2012.XLS]Stock Altered 1100'!$C75 -> Loudonville, Oh | L72: =IF('\\ser\Software\other\[POINTS NQS  2012.XLS]Stock Altered 1100'!$D75=0," ",'\\ser\Software\other\[POINTS NQS  2012.XLS]Stock Altered 1100'!$D75) -> Woods | M72: ='\\ser\Software\other\[POINTS NQS  2012.XLS]Stock Altered 1100'!$E75 -> 523 | N72: =IF('\\ser\Software\other\[POINTS NQS  2012.XLS]Stock Altered 1100'!$F75=0," ",'\\ser\Software\other\[POINTS NQS  2012.XLS]Stock Altered 1100'!$F75) -> Cowen Truck Lines | O72: ='\\ser\Software\other\[POINTS NQS  2012.XLS]Stock Altered 1100'!AA75 -> 246
A73: ='\\ser\Software\other\[POINTS NQS  2012.XLS]Stock Altered 1050'!$A76 -> 71 | B73: ='\\ser\Software\other\[POINTS NQS  2012.XLS]Stock Altered 1050'!$B76 -> Jerry Leonard | C73: ='\\ser\Software\other\[POINTS NQS  2012.XLS]Stock Altered 1050'!$C76 -> Charleston, IL | D73: =IF('\\ser\Software\other\[POINTS NQS  2012.XLS]Stock Altered 1050'!$D76=0," ",'\\ser\Software\other\[POINTS NQS  2012.XLS]Stock Altered 1050'!$D76) -> Vogel | E73: ='\\ser\Software\other\[POINTS NQS  2012.XLS]Stock Altered 1050'!$E76 -> 308 | F73: =IF('\\ser\Software\other\[POINTS NQS  2012.XLS]Stock Altered 1050'!$F76=0," ",'\\ser\Software\other\[POINTS NQS  2012.XLS]Stock Altered 1050'!$F76) -> Histrung | G73: ='\\ser\Software\other\[POINTS NQS  2012.XLS]Stock Altered 1050'!AA76 -> 232 | I73: ='\\ser\Software\other\[POINTS NQS  2012.XLS]Stock Altered 1100'!$A76 -> 71 | J73: ='\\ser\Software\other\[POINTS NQS  2012.XLS]Stock Altered 1100'!$B76 -> Jeremy Pierce | K73: ='\\ser\Software\other\[POINTS NQS  2012.XLS]Stock Altered 1100'!$C76 -> Flat Rock, IN | L73: =IF('\\ser\Software\other\[POINTS NQS  2012.XLS]Stock Altered 1100'!$D76=0," ",'\\ser\Software\other\[POINTS NQS  2012.XLS]Stock Altered 1100'!$D76) -> JP | M73: ='\\ser\Software\other\[POINTS NQS  2012.XLS]Stock Altered 1100'!$E76 -> 362 | N73: =IF('\\ser\Software\other\[POINTS NQS  2012.XLS]Stock Altered 1100'!$F76=0," ",'\\ser\Software\other\[POINTS NQS  2012.XLS]Stock Altered 1100'!$F76) -> LunchMoney | O73: ='\\ser\Software\other\[POINTS NQS  2012.XLS]Stock Altered 1100'!AA76 -> 247
A74: ='\\ser\Software\other\[POINTS NQS  2012.XLS]Stock Altered 1050'!$A77 -> 72 | B74: ='\\ser\Software\other\[POINTS NQS  2012.XLS]Stock Altered 1050'!$B77 -> Waylan Nelson | C74: ='\\ser\Software\other\[POINTS NQS  2012.XLS]Stock Altered 1050'!$C77 -> Shelby, IA | D74: =IF('\\ser\Software\other\[POINTS NQS  2012.XLS]Stock Altered 1050'!$D77=0," ",'\\ser\Software\other\[POINTS NQS  2012.XLS]Stock Altered 1050'!$D77) -> Woods | E74: ='\\ser\Software\other\[POINTS NQS  2012.XLS]Stock Altered 1050'!$E77 -> 499 | F74: =IF('\\ser\Software\other\[POINTS NQS  2012.XLS]Stock Altered 1050'!$F77=0," ",'\\ser\Software\other\[POINTS NQS  2012.XLS]Stock Altered 1050'!$F77) -> Close E Nuff | G74: ='\\ser\Software\other\[POINTS NQS  2012.XLS]Stock Altered 1050'!AA77 -> 232 | I74: ='\\ser\Software\other\[POINTS NQS  2012.XLS]Stock Altered 1100'!$A77 -> 72 | J74: ='\\ser\Software\other\[POINTS NQS  2012.XLS]Stock Altered 1100'!$B77 -> Jim Hill | K74: ='\\ser\Software\other\[POINTS NQS  2012.XLS]Stock Altered 1100'!$C77 -> Indianapolis, IN | L74: =IF('\\ser\Software\other\[POINTS NQS  2012.XLS]Stock Altered 1100'!$D77=0," ",'\\ser\Software\other\[POINTS NQS  2012.XLS]Stock Altered 1100'!$D77) -> JW | M74: ='\\ser\Software\other\[POINTS NQS  2012.XLS]Stock Altered 1100'!$E77 -> 515 | N74: =IF('\\ser\Software\other\[POINTS NQS  2012.XLS]Stock Altered 1100'!$F77=0," ",'\\ser\Software\other\[POINTS NQS  2012.XLS]Stock Altered 1100'!$F77) -> Run-N-Hot | O74: ='\\ser\Software\other\[POINTS NQS  2012.XLS]Stock Altered 1100'!AA77 -> 247
A75: ='\\ser\Software\other\[POINTS NQS  2012.XLS]Stock Altered 1050'!$A78 -> 73 | B75: ='\\ser\Software\other\[POINTS NQS  2012.XLS]Stock Altered 1050'!$B78 -> Herb Houck | C75: ='\\ser\Software\other\[POINTS NQS  2012.XLS]Stock Altered 1050'!$C78 -> Spruce Creek, Pa | D75: =IF('\\ser\Software\other\[POINTS NQS  2012.XLS]Stock Altered 1050'!$D78=0," ",'\\ser\Software\other\[POINTS NQS  2012.XLS]Stock Altered 1050'!$D78) -> LR | E75: ='\\ser\Software\other\[POINTS NQS  2012.XLS]Stock Altered 1050'!$E78 -> 545 | F75: =IF('\\ser\Software\other\[POINTS NQS  2012.XLS]Stock Altered 1050'!$F78=0," ",'\\ser\Software\other\[POINTS NQS  2012.XLS]Stock Altered 1050'!$F78) -> IH Express | G75: ='\\ser\Software\other\[POINTS NQS  2012.XLS]Stock Altered 1050'!AA78 -> 232 | I75: ='\\ser\Software\other\[POINTS NQS  2012.XLS]Stock Altered 1100'!$A78 -> 73 | J75: ='\\ser\Software\other\[POINTS NQS  2012.XLS]Stock Altered 1100'!$B78 -> Bob Strawser | K75: ='\\ser\Software\other\[POINTS NQS  2012.XLS]Stock Altered 1100'!$C78 -> Stoutsville, Oh | L75: =IF('\\ser\Software\other\[POINTS NQS  2012.XLS]Stock Altered 1100'!$D78=0," ",'\\ser\Software\other\[POINTS NQS  2012.XLS]Stock Altered 1100'!$D78) ->  | M75: ='\\ser\Software\other\[POINTS NQS  2012.XLS]Stock Altered 1100'!$E78 -> 548 | N75: =IF('\\ser\Software\other\[POINTS NQS  2012.XLS]Stock Altered 1100'!$F78=0," ",'\\ser\Software\other\[POINTS NQS  2012.XLS]Stock Altered 1100'!$F78) -> Funny Farmall | O75: ='\\ser\Software\other\[POINTS NQS  2012.XLS]Stock Altered 1100'!AA78 -> 247
A76: ='\\ser\Software\other\[POINTS NQS  2012.XLS]Stock Altered 1050'!$A79 -> 74 | B76: ='\\ser\Software\other\[POINTS NQS  2012.XLS]Stock Altered 1050'!$B79 -> Tim Bowling | C76: ='\\ser\Software\other\[POINTS NQS  2012.XLS]Stock Altered 1050'!$C79 -> Syracuse, Ind | D76: =IF('\\ser\Software\other\[POINTS NQS  2012.XLS]Stock Altered 1050'!$D79=0," ",'\\ser\Software\other\[POINTS NQS  2012.XLS]Stock Altered 1050'!$D79) -> LR | E76: ='\\ser\Software\other\[POINTS NQS  2012.XLS]Stock Altered 1050'!$E79 -> 0 | F76: =IF('\\ser\Software\other\[POINTS NQS  2012.XLS]Stock Altered 1050'!$F79=0," ",'\\ser\Software\other\[POINTS NQS  2012.XLS]Stock Altered 1050'!$F79) -> Orange Cub | G76: ='\\ser\Software\other\[POINTS NQS  2012.XLS]Stock Altered 1050'!AA79 -> 232 | I76: ='\\ser\Software\other\[POINTS NQS  2012.XLS]Stock Altered 1100'!$A79 -> 74 | J76: ='\\ser\Software\other\[POINTS NQS  2012.XLS]Stock Altered 1100'!$B79 -> Gordon Lloyd | K76: ='\\ser\Software\other\[POINTS NQS  2012.XLS]Stock Altered 1100'!$C79 -> Circleville, Oh | L76: =IF('\\ser\Software\other\[POINTS NQS  2012.XLS]Stock Altered 1100'!$D79=0," ",'\\ser\Software\other\[POINTS NQS  2012.XLS]Stock Altered 1100'!$D79) ->  | M76: ='\\ser\Software\other\[POINTS NQS  2012.XLS]Stock Altered 1100'!$E79 -> 549 | N76: =IF('\\ser\Software\other\[POINTS NQS  2012.XLS]Stock Altered 1100'!$F79=0," ",'\\ser\Software\other\[POINTS NQS  2012.XLS]Stock Altered 1100'!$F79) -> Project X | O76: ='\\ser\Software\other\[POINTS NQS  2012.XLS]Stock Altered 1100'!AA79 -> 247
A77: ='\\ser\Software\other\[POINTS NQS  2012.XLS]Stock Altered 1050'!$A80 -> 75 | B77: ='\\ser\Software\other\[POINTS NQS  2012.XLS]Stock Altered 1050'!$B80 -> Jeff Jager | C77: ='\\ser\Software\other\[POINTS NQS  2012.XLS]Stock Altered 1050'!$C80 -> Sussex, NJ | D77: =IF('\\ser\Software\other\[POINTS NQS  2012.XLS]Stock Altered 1050'!$D80=0," ",'\\ser\Software\other\[POINTS NQS  2012.XLS]Stock Altered 1050'!$D80) -> JRS | E77: ='\\ser\Software\other\[POINTS NQS  2012.XLS]Stock Altered 1050'!$E80 -> 529 | F77: =IF('\\ser\Software\other\[POINTS NQS  2012.XLS]Stock Altered 1050'!$F80=0," ",'\\ser\Software\other\[POINTS NQS  2012.XLS]Stock Altered 1050'!$F80) -> Orange Crush | G77: ='\\ser\Software\other\[POINTS NQS  2012.XLS]Stock Altered 1050'!AA80 -> 233 | I77: ='\\ser\Software\other\[POINTS NQS  2012.XLS]Stock Altered 1100'!$A80 -> 75 | J77: ='\\ser\Software\other\[POINTS NQS  2012.XLS]Stock Altered 1100'!$B80 -> Lawrence Davenport | K77: ='\\ser\Software\other\[POINTS NQS  2012.XLS]Stock Altered 1100'!$C80 -> Mexico, MO | L77: =IF('\\ser\Software\other\[POINTS NQS  2012.XLS]Stock Altered 1100'!$D80=0," ",'\\ser\Software\other\[POINTS NQS  2012.XLS]Stock Altered 1100'!$D80) -> TV | M77: ='\\ser\Software\other\[POINTS NQS  2012.XLS]Stock Altered 1100'!$E80 -> 573 | N77: =IF('\\ser\Software\other\[POINTS NQS  2012.XLS]Stock Altered 1100'!$F80=0," ",'\\ser\Software\other\[POINTS NQS  2012.XLS]Stock Altered 1100'!$F80) -> Black Magic | O77: ='\\ser\Software\other\[POINTS NQS  2012.XLS]Stock Altered 1100'!AA80 -> 247
A78: ='\\ser\Software\other\[POINTS NQS  2012.XLS]Stock Altered 1050'!$A81 -> 76 | B78: ='\\ser\Software\other\[POINTS NQS  2012.XLS]Stock Altered 1050'!$B81 -> Gaylord Strine | C78: ='\\ser\Software\other\[POINTS NQS  2012.XLS]Stock Altered 1050'!$C81 -> Ashland, OH | D78: =IF('\\ser\Software\other\[POINTS NQS  2012.XLS]Stock Altered 1050'!$D81=0," ",'\\ser\Software\other\[POINTS NQS  2012.XLS]Stock Altered 1050'!$D81) -> JRS | E78: ='\\ser\Software\other\[POINTS NQS  2012.XLS]Stock Altered 1050'!$E81 -> 492 | F78: =IF('\\ser\Software\other\[POINTS NQS  2012.XLS]Stock Altered 1050'!$F81=0," ",'\\ser\Software\other\[POINTS NQS  2012.XLS]Stock Altered 1050'!$F81) -> Giddy Up Go | G78: ='\\ser\Software\other\[POINTS NQS  2012.XLS]Stock Altered 1050'!AA81 -> 234 | I78: ='\\ser\Software\other\[POINTS NQS  2012.XLS]Stock Altered 1100'!$A81 -> 76 | J78: ='\\ser\Software\other\[POINTS NQS  2012.XLS]Stock Altered 1100'!$B81 -> Mark Hymes | K78: ='\\ser\Software\other\[POINTS NQS  2012.XLS]Stock Altered 1100'!$C81 -> St Paul, Ia | L78: =IF('\\ser\Software\other\[POINTS NQS  2012.XLS]Stock Altered 1100'!$D81=0," ",'\\ser\Software\other\[POINTS NQS  2012.XLS]Stock Altered 1100'!$D81) ->  | M78: ='\\ser\Software\other\[POINTS NQS  2012.XLS]Stock Altered 1100'!$E81 -> 586 | N78: =IF('\\ser\Software\other\[POINTS NQS  2012.XLS]Stock Altered 1100'!$F81=0," ",'\\ser\Software\other\[POINTS NQS  2012.XLS]Stock Altered 1100'!$F81) -> Case IH | O78: ='\\ser\Software\other\[POINTS NQS  2012.XLS]Stock Altered 1100'!AA81 -> 247
A79: ='\\ser\Software\other\[POINTS NQS  2012.XLS]Stock Altered 1050'!$A82 -> 77 | B79: ='\\ser\Software\other\[POINTS NQS  2012.XLS]Stock Altered 1050'!$B82 -> Bob Strawser | C79: ='\\ser\Software\other\[POINTS NQS  2012.XLS]Stock Altered 1050'!$C82 -> Stoutsville, Oh | D79: =IF('\\ser\Software\other\[POINTS NQS  2012.XLS]Stock Altered 1050'!$D82=0," ",'\\ser\Software\other\[POINTS NQS  2012.XLS]Stock Altered 1050'!$D82) ->  | E79: ='\\ser\Software\other\[POINTS NQS  2012.XLS]Stock Altered 1050'!$E82 -> 548 | F79: =IF('\\ser\Software\other\[POINTS NQS  2012.XLS]Stock Altered 1050'!$F82=0," ",'\\ser\Software\other\[POINTS NQS  2012.XLS]Stock Altered 1050'!$F82) -> Funny Farmall | G79: ='\\ser\Software\other\[POINTS NQS  2012.XLS]Stock Altered 1050'!AA82 -> 235 | I79: ='\\ser\Software\other\[POINTS NQS  2012.XLS]Stock Altered 1100'!$A82 -> 77 | J79: ='\\ser\Software\other\[POINTS NQS  2012.XLS]Stock Altered 1100'!$B82 -> Gaylord Strine | K79: ='\\ser\Software\other\[POINTS NQS  2012.XLS]Stock Altered 1100'!$C82 -> Ashland, OH | L79: =IF('\\ser\Software\other\[POINTS NQS  2012.XLS]Stock Altered 1100'!$D82=0," ",'\\ser\Software\other\[POINTS NQS  2012.XLS]Stock Altered 1100'!$D82) -> JRS | M79: ='\\ser\Software\other\[POINTS NQS  2012.XLS]Stock Altered 1100'!$E82 -> 492 | N79: =IF('\\ser\Software\other\[POINTS NQS  2012.XLS]Stock Altered 1100'!$F82=0," ",'\\ser\Software\other\[POINTS NQS  2012.XLS]Stock Altered 1100'!$F82) -> Giddy Up Go | O79: ='\\ser\Software\other\[POINTS NQS  2012.XLS]Stock Altered 1100'!AA82 -> 248
I80: ='\\ser\Software\other\[POINTS NQS  2012.XLS]Stock Altered 1100'!$A83 -> 78 | J80: ='\\ser\Software\other\[POINTS NQS  2012.XLS]Stock Altered 1100'!$B83 -> Austin Goodman | K80: ='\\ser\Software\other\[POINTS NQS  2012.XLS]Stock Altered 1100'!$C83 -> Lincol, Il | L80: =IF('\\ser\Software\other\[POINTS NQS  2012.XLS]Stock Altered 1100'!$D83=0," ",'\\ser\Software\other\[POINTS NQS  2012.XLS]Stock Altered 1100'!$D83) ->  | M80: ='\\ser\Software\other\[POINTS NQS  2012.XLS]Stock Altered 1100'!$E83 -> 0 | N80: =IF('\\ser\Software\other\[POINTS NQS  2012.XLS]Stock Altered 1100'!$F83=0," ",'\\ser\Software\other\[POINTS NQS  2012.XLS]Stock Altered 1100'!$F83) -> Speed | O80: ='\\ser\Software\other\[POINTS NQS  2012.XLS]Stock Altered 1100'!AA83 -> 248