B1: 30 Cube | F1: Thru Peoria | I1: Pro V Twin | N1: Thru Peoria
B2: Name | C2: City/State | D2: NQS # | E2: Tractor | F2: Points Back | J2: Name | K2: City/State | L2: NQS # | M2: Tractor | N2: Points Back
A3: ='\\ser\Software\other\[POINTS NQS  2012.XLS]30 Cube'!$A7 -> 1 | B3: ='\\ser\Software\other\[POINTS NQS  2012.XLS]30 Cube'!$B7 -> Greg Heifner | C3: ='\\ser\Software\other\[POINTS NQS  2012.XLS]30 Cube'!$C7 -> Jeromesville, OH | D3: ='\\ser\Software\other\[POINTS NQS  2012.XLS]30 Cube'!$D7 -> 114 | E3: =IF('\\ser\Software\other\[POINTS NQS  2012.XLS]30 Cube'!$E7=0," ",'\\ser\Software\other\[POINTS NQS  2012.XLS]30 Cube'!$E7) -> Twisted | F3: ='\\ser\Software\other\[POINTS NQS  2012.XLS]30 Cube'!$AA7 -> 0 | I3: ='\\ser\Software\other\[POINTS NQS  2012.XLS]Pro V Twin'!$A7 -> 1 | J3: ='\\ser\Software\other\[POINTS NQS  2012.XLS]Pro V Twin'!$B7 -> Kenny Cornelison | K3: ='\\ser\Software\other\[POINTS NQS  2012.XLS]Pro V Twin'!$C7 -> Richmond, KY | L3: ='\\ser\Software\other\[POINTS NQS  2012.XLS]Pro V Twin'!$D7 -> 149 | M3: =IF('\\ser\Software\other\[POINTS NQS  2012.XLS]Pro V Twin'!$E7=0," ",'\\ser\Software\other\[POINTS NQS  2012.XLS]Pro V Twin'!$E7) -> Storm Alert | N3: ='\\ser\Software\other\[POINTS NQS  2012.XLS]Pro V Twin'!$AA7 -> 0
A4: ='\\ser\Software\other\[POINTS NQS  2012.XLS]30 Cube'!$A8 -> 2 | B4: ='\\ser\Software\other\[POINTS NQS  2012.XLS]30 Cube'!$B8 -> Tony Heifner | C4: ='\\ser\Software\other\[POINTS NQS  2012.XLS]30 Cube'!$C8 -> Jeromesville, OH | D4: ='\\ser\Software\other\[POINTS NQS  2012.XLS]30 Cube'!$D8 -> 116 | E4: =IF('\\ser\Software\other\[POINTS NQS  2012.XLS]30 Cube'!$E8=0," ",'\\ser\Software\other\[POINTS NQS  2012.XLS]30 Cube'!$E8) -> Heartbeat | F4: ='\\ser\Software\other\[POINTS NQS  2012.XLS]30 Cube'!$AA8 -> 5 | I4: ='\\ser\Software\other\[POINTS NQS  2012.XLS]Pro V Twin'!$A8 -> 2 | J4: ='\\ser\Software\other\[POINTS NQS  2012.XLS]Pro V Twin'!$B8 -> Harrison Stahl | K4: ='\\ser\Software\other\[POINTS NQS  2012.XLS]Pro V Twin'!$C8 -> Dewitt,IA | L4: ='\\ser\Software\other\[POINTS NQS  2012.XLS]Pro V Twin'!$D8 -> 4 | M4: =IF('\\ser\Software\other\[POINTS NQS  2012.XLS]Pro V Twin'!$E8=0," ",'\\ser\Software\other\[POINTS NQS  2012.XLS]Pro V Twin'!$E8) -> Tons of Fun | N4: ='\\ser\Software\other\[POINTS NQS  2012.XLS]Pro V Twin'!$AA8 -> 3
A5: ='\\ser\Software\other\[POINTS NQS  2012.XLS]30 Cube'!$A9 -> 3 | B5: ='\\ser\Software\other\[POINTS NQS  2012.XLS]30 Cube'!$B9 -> Tony Lewis | C5: ='\\ser\Software\other\[POINTS NQS  2012.XLS]30 Cube'!$C9 -> Edinburgh, IN | D5: ='\\ser\Software\other\[POINTS NQS  2012.XLS]30 Cube'!$D9 -> 345 | E5: =IF('\\ser\Software\other\[POINTS NQS  2012.XLS]30 Cube'!$E9=0," ",'\\ser\Software\other\[POINTS NQS  2012.XLS]30 Cube'!$E9) -> Plain Jane | F5: ='\\ser\Software\other\[POINTS NQS  2012.XLS]30 Cube'!$AA9 -> 9 | I5: ='\\ser\Software\other\[POINTS NQS  2012.XLS]Pro V Twin'!$A9 -> 3 | J5: ='\\ser\Software\other\[POINTS NQS  2012.XLS]Pro V Twin'!$B9 -> Jim Hull | K5: ='\\ser\Software\other\[POINTS NQS  2012.XLS]Pro V Twin'!$C9 -> Brandon, WI | L5: ='\\ser\Software\other\[POINTS NQS  2012.XLS]Pro V Twin'!$D9 -> 334 | M5: =IF('\\ser\Software\other\[POINTS NQS  2012.XLS]Pro V Twin'!$E9=0," ",'\\ser\Software\other\[POINTS NQS  2012.XLS]Pro V Twin'!$E9) -> Simply Irresistable | N5: ='\\ser\Software\other\[POINTS NQS  2012.XLS]Pro V Twin'!$AA9 -> 5
A6: ='\\ser\Software\other\[POINTS NQS  2012.XLS]30 Cube'!$A10 -> 4 | B6: ='\\ser\Software\other\[POINTS NQS  2012.XLS]30 Cube'!$B10 -> Pat Roth | C6: ='\\ser\Software\other\[POINTS NQS  2012.XLS]30 Cube'!$C10 -> Idaville, IN | D6: ='\\ser\Software\other\[POINTS NQS  2012.XLS]30 Cube'!$D10 -> 61 | E6: =IF('\\ser\Software\other\[POINTS NQS  2012.XLS]30 Cube'!$E10=0," ",'\\ser\Software\other\[POINTS NQS  2012.XLS]30 Cube'!$E10) ->  | F6: ='\\ser\Software\other\[POINTS NQS  2012.XLS]30 Cube'!$AA10 -> 13 | I6: ='\\ser\Software\other\[POINTS NQS  2012.XLS]Pro V Twin'!$A10 -> 4 | J6: ='\\ser\Software\other\[POINTS NQS  2012.XLS]Pro V Twin'!$B10 -> Rob Wise | K6: ='\\ser\Software\other\[POINTS NQS  2012.XLS]Pro V Twin'!$C10 -> Greensburg, PA | L6: ='\\ser\Software\other\[POINTS NQS  2012.XLS]Pro V Twin'!$D10 -> 209 | M6: =IF('\\ser\Software\other\[POINTS NQS  2012.XLS]Pro V Twin'!$E10=0," ",'\\ser\Software\other\[POINTS NQS  2012.XLS]Pro V Twin'!$E10) -> Long Shot | N6: ='\\ser\Software\other\[POINTS NQS  2012.XLS]Pro V Twin'!$AA10 -> 6
A7: ='\\ser\Software\other\[POINTS NQS  2012.XLS]30 Cube'!$A11 -> 5 | B7: ='\\ser\Software\other\[POINTS NQS  2012.XLS]30 Cube'!$B11 -> Randy Amstutz | C7: ='\\ser\Software\other\[POINTS NQS  2012.XLS]30 Cube'!$C11 -> Berne, In | D7: ='\\ser\Software\other\[POINTS NQS  2012.XLS]30 Cube'!$D11 -> 534 | E7: =IF('\\ser\Software\other\[POINTS NQS  2012.XLS]30 Cube'!$E11=0," ",'\\ser\Software\other\[POINTS NQS  2012.XLS]30 Cube'!$E11) ->  | F7: ='\\ser\Software\other\[POINTS NQS  2012.XLS]30 Cube'!$AA11 -> 62 | I7: ='\\ser\Software\other\[POINTS NQS  2012.XLS]Pro V Twin'!$A11 -> 5 | J7: ='\\ser\Software\other\[POINTS NQS  2012.XLS]Pro V Twin'!$B11 -> Lowell Vis | K7: ='\\ser\Software\other\[POINTS NQS  2012.XLS]Pro V Twin'!$C11 -> Waupun, WI | L7: ='\\ser\Software\other\[POINTS NQS  2012.XLS]Pro V Twin'!$D11 -> 333 | M7: =IF('\\ser\Software\other\[POINTS NQS  2012.XLS]Pro V Twin'!$E11=0," ",'\\ser\Software\other\[POINTS NQS  2012.XLS]Pro V Twin'!$E11) -> Skittles | N7: ='\\ser\Software\other\[POINTS NQS  2012.XLS]Pro V Twin'!$AA11 -> 6
A8: ='\\ser\Software\other\[POINTS NQS  2012.XLS]30 Cube'!$A12 -> 6 | B8: ='\\ser\Software\other\[POINTS NQS  2012.XLS]30 Cube'!$B12 -> Greg Block | C8: ='\\ser\Software\other\[POINTS NQS  2012.XLS]30 Cube'!$C12 -> Jefferson City, MO | D8: ='\\ser\Software\other\[POINTS NQS  2012.XLS]30 Cube'!$D12 -> 435 | E8: =IF('\\ser\Software\other\[POINTS NQS  2012.XLS]30 Cube'!$E12=0," ",'\\ser\Software\other\[POINTS NQS  2012.XLS]30 Cube'!$E12) -> Pocket Change | F8: ='\\ser\Software\other\[POINTS NQS  2012.XLS]30 Cube'!$AA12 -> 65 | I8: ='\\ser\Software\other\[POINTS NQS  2012.XLS]Pro V Twin'!$A12 -> 6 | J8: ='\\ser\Software\other\[POINTS NQS  2012.XLS]Pro V Twin'!$B12 -> Ryan Richter | K8: ='\\ser\Software\other\[POINTS NQS  2012.XLS]Pro V Twin'!$C12 -> Connellsville, PA | L8: ='\\ser\Software\other\[POINTS NQS  2012.XLS]Pro V Twin'!$D12 -> 502 | M8: =IF('\\ser\Software\other\[POINTS NQS  2012.XLS]Pro V Twin'!$E12=0," ",'\\ser\Software\other\[POINTS NQS  2012.XLS]Pro V Twin'!$E12) -> Radical Rat | N8: ='\\ser\Software\other\[POINTS NQS  2012.XLS]Pro V Twin'!$AA12 -> 38
A9: ='\\ser\Software\other\[POINTS NQS  2012.XLS]30 Cube'!$A13 -> 7 | B9: ='\\ser\Software\other\[POINTS NQS  2012.XLS]30 Cube'!$B13 -> Wes Kampeter | C9: ='\\ser\Software\other\[POINTS NQS  2012.XLS]30 Cube'!$C13 -> Freesburg, Mo | D9: ='\\ser\Software\other\[POINTS NQS  2012.XLS]30 Cube'!$D13 -> 578 | E9: =IF('\\ser\Software\other\[POINTS NQS  2012.XLS]30 Cube'!$E13=0," ",'\\ser\Software\other\[POINTS NQS  2012.XLS]30 Cube'!$E13) -> Wasted Money | F9: ='\\ser\Software\other\[POINTS NQS  2012.XLS]30 Cube'!$AA13 -> 86 | I9: ='\\ser\Software\other\[POINTS NQS  2012.XLS]Pro V Twin'!$A13 -> 7 | J9: ='\\ser\Software\other\[POINTS NQS  2012.XLS]Pro V Twin'!$B13 -> Mike Spencer | K9: ='\\ser\Software\other\[POINTS NQS  2012.XLS]Pro V Twin'!$C13 -> West Alexandria, WI | L9: ='\\ser\Software\other\[POINTS NQS  2012.XLS]Pro V Twin'!$D13 -> 278 | M9: =IF('\\ser\Software\other\[POINTS NQS  2012.XLS]Pro V Twin'!$E13=0," ",'\\ser\Software\other\[POINTS NQS  2012.XLS]Pro V Twin'!$E13) -> Long Shot | N9: ='\\ser\Software\other\[POINTS NQS  2012.XLS]Pro V Twin'!$AA13 -> 64
A10: ='\\ser\Software\other\[POINTS NQS  2012.XLS]30 Cube'!$A14 -> 8 | B10: ='\\ser\Software\other\[POINTS NQS  2012.XLS]30 Cube'!$B14 -> Shawn Garman | C10: ='\\ser\Software\other\[POINTS NQS  2012.XLS]30 Cube'!$C14 -> Perrysville, Oh | D10: ='\\ser\Software\other\[POINTS NQS  2012.XLS]30 Cube'!$D14 -> 230 | E10: =IF('\\ser\Software\other\[POINTS NQS  2012.XLS]30 Cube'!$E14=0," ",'\\ser\Software\other\[POINTS NQS  2012.XLS]30 Cube'!$E14) -> Gun Slinger | F10: ='\\ser\Software\other\[POINTS NQS  2012.XLS]30 Cube'!$AA14 -> 88 | I10: ='\\ser\Software\other\[POINTS NQS  2012.XLS]Pro V Twin'!$A14 -> 8 | J10: ='\\ser\Software\other\[POINTS NQS  2012.XLS]Pro V Twin'!$B14 -> Kenny Cornelison | K10: ='\\ser\Software\other\[POINTS NQS  2012.XLS]Pro V Twin'!$C14 -> Richmond, KY | L10: ='\\ser\Software\other\[POINTS NQS  2012.XLS]Pro V Twin'!$D14 -> 536 | M10: =IF('\\ser\Software\other\[POINTS NQS  2012.XLS]Pro V Twin'!$E14=0," ",'\\ser\Software\other\[POINTS NQS  2012.XLS]Pro V Twin'!$E14) -> Storm X | N10: ='\\ser\Software\other\[POINTS NQS  2012.XLS]Pro V Twin'!$AA14 -> 65
A11: ='\\ser\Software\other\[POINTS NQS  2012.XLS]30 Cube'!$A15 -> 9 | B11: ='\\ser\Software\other\[POINTS NQS  2012.XLS]30 Cube'!$B15 -> Doug Rood | C11: ='\\ser\Software\other\[POINTS NQS  2012.XLS]30 Cube'!$C15 -> Ypsilanti, MI | D11: ='\\ser\Software\other\[POINTS NQS  2012.XLS]30 Cube'!$D15 -> 354 | E11: =IF('\\ser\Software\other\[POINTS NQS  2012.XLS]30 Cube'!$E15=0," ",'\\ser\Software\other\[POINTS NQS  2012.XLS]30 Cube'!$E15) -> Blue Dawg | F11: ='\\ser\Software\other\[POINTS NQS  2012.XLS]30 Cube'!$AA15 -> 88 | I11: ='\\ser\Software\other\[POINTS NQS  2012.XLS]Pro V Twin'!$A15 -> 9 | J11: ='\\ser\Software\other\[POINTS NQS  2012.XLS]Pro V Twin'!$B15 -> Ed Locke | K11: ='\\ser\Software\other\[POINTS NQS  2012.XLS]Pro V Twin'!$C15 -> Island Lake, Ill | L11: ='\\ser\Software\other\[POINTS NQS  2012.XLS]Pro V Twin'!$D15 -> 577 | M11: =IF('\\ser\Software\other\[POINTS NQS  2012.XLS]Pro V Twin'!$E15=0," ",'\\ser\Software\other\[POINTS NQS  2012.XLS]Pro V Twin'!$E15) -> Thor | N11: ='\\ser\Software\other\[POINTS NQS  2012.XLS]Pro V Twin'!$AA15 -> 87
A12: ='\\ser\Software\other\[POINTS NQS  2012.XLS]30 Cube'!$A16 -> 10 | B12: ='\\ser\Software\other\[POINTS NQS  2012.XLS]30 Cube'!$B16 -> Rick Massey | C12: ='\\ser\Software\other\[POINTS NQS  2012.XLS]30 Cube'!$C16 -> Ava, MO | D12: ='\\ser\Software\other\[POINTS NQS  2012.XLS]30 Cube'!$D16 -> 421 | E12: =IF('\\ser\Software\other\[POINTS NQS  2012.XLS]30 Cube'!$E16=0," ",'\\ser\Software\other\[POINTS NQS  2012.XLS]30 Cube'!$E16) -> Spare Parts | F12: ='\\ser\Software\other\[POINTS NQS  2012.XLS]30 Cube'!$AA16 -> 89 | I12: ='\\ser\Software\other\[POINTS NQS  2012.XLS]Pro V Twin'!$A16 -> 10 | J12: ='\\ser\Software\other\[POINTS NQS  2012.XLS]Pro V Twin'!$B16 -> Jim Waite | L12: ='\\ser\Software\other\[POINTS NQS  2012.XLS]Pro V Twin'!$D16 -> 480 | M12: =IF('\\ser\Software\other\[POINTS NQS  2012.XLS]Pro V Twin'!$E16=0," ",'\\ser\Software\other\[POINTS NQS  2012.XLS]Pro V Twin'!$E16) -> John Deere | N12: ='\\ser\Software\other\[POINTS NQS  2012.XLS]Pro V Twin'!$AA16 -> 88
A13: ='\\ser\Software\other\[POINTS NQS  2012.XLS]30 Cube'!$A17 -> 11 | B13: ='\\ser\Software\other\[POINTS NQS  2012.XLS]30 Cube'!$B17 -> Dave Hummel | C13: ='\\ser\Software\other\[POINTS NQS  2012.XLS]30 Cube'!$C17 -> Lewiston,Ill | D13: ='\\ser\Software\other\[POINTS NQS  2012.XLS]30 Cube'!$D17 -> 580 | E13: =IF('\\ser\Software\other\[POINTS NQS  2012.XLS]30 Cube'!$E17=0," ",'\\ser\Software\other\[POINTS NQS  2012.XLS]30 Cube'!$E17) -> All Jacked Up | F13: ='\\ser\Software\other\[POINTS NQS  2012.XLS]30 Cube'!$AA17 -> 90 | I13: ='\\ser\Software\other\[POINTS NQS  2012.XLS]Pro V Twin'!$A17 -> 11 | J13: ='\\ser\Software\other\[POINTS NQS  2012.XLS]Pro V Twin'!$B17 -> Eric Varner | L13: ='\\ser\Software\other\[POINTS NQS  2012.XLS]Pro V Twin'!$D17 -> 482 | M13: =IF('\\ser\Software\other\[POINTS NQS  2012.XLS]Pro V Twin'!$E17=0," ",'\\ser\Software\other\[POINTS NQS  2012.XLS]Pro V Twin'!$E17) -> Extreme Addiction | N13: ='\\ser\Software\other\[POINTS NQS  2012.XLS]Pro V Twin'!$AA17 -> 89
A14: ='\\ser\Software\other\[POINTS NQS  2012.XLS]30 Cube'!$A18 -> 12 | B14: ='\\ser\Software\other\[POINTS NQS  2012.XLS]30 Cube'!$B18 -> George Bax | C14: ='\\ser\Software\other\[POINTS NQS  2012.XLS]30 Cube'!$C18 -> St. Thomas, MO | D14: ='\\ser\Software\other\[POINTS NQS  2012.XLS]30 Cube'!$D18 -> 422 | E14: =IF('\\ser\Software\other\[POINTS NQS  2012.XLS]30 Cube'!$E18=0," ",'\\ser\Software\other\[POINTS NQS  2012.XLS]30 Cube'!$E18) -> Plum Crazy | F14: ='\\ser\Software\other\[POINTS NQS  2012.XLS]30 Cube'!$AA18 -> 92 | I14: ='\\ser\Software\other\[POINTS NQS  2012.XLS]Pro V Twin'!$A18 -> 12 | J14: ='\\ser\Software\other\[POINTS NQS  2012.XLS]Pro V Twin'!$B18 -> Jerry Everhart | K14: ='\\ser\Software\other\[POINTS NQS  2012.XLS]Pro V Twin'!$C18 -> Springfield, OH | L14: ='\\ser\Software\other\[POINTS NQS  2012.XLS]Pro V Twin'!$D18 -> 483 | M14: =IF('\\ser\Software\other\[POINTS NQS  2012.XLS]Pro V Twin'!$E18=0," ",'\\ser\Software\other\[POINTS NQS  2012.XLS]Pro V Twin'!$E18) -> Orange Cart | N14: ='\\ser\Software\other\[POINTS NQS  2012.XLS]Pro V Twin'!$AA18 -> 89
A15: ='\\ser\Software\other\[POINTS NQS  2012.XLS]30 Cube'!$A19 -> 13 | B15: ='\\ser\Software\other\[POINTS NQS  2012.XLS]30 Cube'!$B19 -> Chad Watkins | C15: ='\\ser\Software\other\[POINTS NQS  2012.XLS]30 Cube'!$C19 -> Plymouth, Ind | D15: ='\\ser\Software\other\[POINTS NQS  2012.XLS]30 Cube'!$D19 -> 591 | E15: =IF('\\ser\Software\other\[POINTS NQS  2012.XLS]30 Cube'!$E19=0," ",'\\ser\Software\other\[POINTS NQS  2012.XLS]30 Cube'!$E19) -> Never Satisfied | F15: ='\\ser\Software\other\[POINTS NQS  2012.XLS]30 Cube'!$AA19 -> 92 | I15: ='\\ser\Software\other\[POINTS NQS  2012.XLS]Pro V Twin'!$A19 -> 13 | J15: ='\\ser\Software\other\[POINTS NQS  2012.XLS]Pro V Twin'!$B19 -> Dave Draker | K15: ='\\ser\Software\other\[POINTS NQS  2012.XLS]Pro V Twin'!$C19 -> Robbins, Ia | L15: ='\\ser\Software\other\[POINTS NQS  2012.XLS]Pro V Twin'!$D19 -> 585 | M15: =IF('\\ser\Software\other\[POINTS NQS  2012.XLS]Pro V Twin'!$E19=0," ",'\\ser\Software\other\[POINTS NQS  2012.XLS]Pro V Twin'!$E19) -> Lightning #4 | N15: ='\\ser\Software\other\[POINTS NQS  2012.XLS]Pro V Twin'!$AA19 -> 89
A16: ='\\ser\Software\other\[POINTS NQS  2012.XLS]30 Cube'!$A20 -> 14 | B16: ='\\ser\Software\other\[POINTS NQS  2012.XLS]30 Cube'!$B20 -> Kole Larkins | C16: ='\\ser\Software\other\[POINTS NQS  2012.XLS]30 Cube'!$C20 -> Kearney, MO | D16: ='\\ser\Software\other\[POINTS NQS  2012.XLS]30 Cube'!$D20 -> 372 | E16: =IF('\\ser\Software\other\[POINTS NQS  2012.XLS]30 Cube'!$E20=0," ",'\\ser\Software\other\[POINTS NQS  2012.XLS]30 Cube'!$E20) -> Wound Up | F16: ='\\ser\Software\other\[POINTS NQS  2012.XLS]30 Cube'!$AA20 -> 94 | I16: ='\\ser\Software\other\[POINTS NQS  2012.XLS]Pro V Twin'!$A20 -> 14 | J16: ='\\ser\Software\other\[POINTS NQS  2012.XLS]Pro V Twin'!$B20 -> Shawn Dukes | K16: ='\\ser\Software\other\[POINTS NQS  2012.XLS]Pro V Twin'!$C20 -> Cavert City, KY | L16: ='\\ser\Software\other\[POINTS NQS  2012.XLS]Pro V Twin'!$D20 -> 521 | M16: =IF('\\ser\Software\other\[POINTS NQS  2012.XLS]Pro V Twin'!$E20=0," ",'\\ser\Software\other\[POINTS NQS  2012.XLS]Pro V Twin'!$E20) -> Blown | N16: ='\\ser\Software\other\[POINTS NQS  2012.XLS]Pro V Twin'!$AA20 -> 90
A17: ='\\ser\Software\other\[POINTS NQS  2012.XLS]30 Cube'!$A21 -> 15 | B17: ='\\ser\Software\other\[POINTS NQS  2012.XLS]30 Cube'!$B21 -> Ben Larkins | C17: ='\\ser\Software\other\[POINTS NQS  2012.XLS]30 Cube'!$C21 -> Kearney, MO | D17: ='\\ser\Software\other\[POINTS NQS  2012.XLS]30 Cube'!$D21 -> 137 | E17: =IF('\\ser\Software\other\[POINTS NQS  2012.XLS]30 Cube'!$E21=0," ",'\\ser\Software\other\[POINTS NQS  2012.XLS]30 Cube'!$E21) -> Indian Outlaw | F17: ='\\ser\Software\other\[POINTS NQS  2012.XLS]30 Cube'!$AA21 -> 95 | I17: ='\\ser\Software\other\[POINTS NQS  2012.XLS]Pro V Twin'!$A21 -> 15 | J17: ='\\ser\Software\other\[POINTS NQS  2012.XLS]Pro V Twin'!$B21 -> Bobby Knight | K17: ='\\ser\Software\other\[POINTS NQS  2012.XLS]Pro V Twin'!$C21 -> Mohawk, Tn | L17: ='\\ser\Software\other\[POINTS NQS  2012.XLS]Pro V Twin'!$D21 -> 566 | M17: =IF('\\ser\Software\other\[POINTS NQS  2012.XLS]Pro V Twin'!$E21=0," ",'\\ser\Software\other\[POINTS NQS  2012.XLS]Pro V Twin'!$E21) -> Quick Silver | N17: ='\\ser\Software\other\[POINTS NQS  2012.XLS]Pro V Twin'!$AA21 -> 90
I18: ='\\ser\Software\other\[POINTS NQS  2012.XLS]Pro V Twin'!$A22 -> 16 | J18: ='\\ser\Software\other\[POINTS NQS  2012.XLS]Pro V Twin'!$B22 -> Matt Kaster | K18: ='\\ser\Software\other\[POINTS NQS  2012.XLS]Pro V Twin'!$C22 -> Burlington, IA | L18: ='\\ser\Software\other\[POINTS NQS  2012.XLS]Pro V Twin'!$D22 -> 99 | M18: =IF('\\ser\Software\other\[POINTS NQS  2012.XLS]Pro V Twin'!$E22=0," ",'\\ser\Software\other\[POINTS NQS  2012.XLS]Pro V Twin'!$E22) -> Sound of Madness | N18: ='\\ser\Software\other\[POINTS NQS  2012.XLS]Pro V Twin'!$AA22 -> 91
I19: ='\\ser\Software\other\[POINTS NQS  2012.XLS]Pro V Twin'!$A23 -> 17 | J19: ='\\ser\Software\other\[POINTS NQS  2012.XLS]Pro V Twin'!$B23 -> Ryan Shafer | K19: ='\\ser\Software\other\[POINTS NQS  2012.XLS]Pro V Twin'!$C23 -> Confluence, Pa | L19: ='\\ser\Software\other\[POINTS NQS  2012.XLS]Pro V Twin'!$D23 -> 445 | M19: =IF('\\ser\Software\other\[POINTS NQS  2012.XLS]Pro V Twin'!$E23=0," ",'\\ser\Software\other\[POINTS NQS  2012.XLS]Pro V Twin'!$E23) -> LabRat | N19: ='\\ser\Software\other\[POINTS NQS  2012.XLS]Pro V Twin'!$AA23 -> 91
I20: ='\\ser\Software\other\[POINTS NQS  2012.XLS]Pro V Twin'!$A24 -> 18 | J20: ='\\ser\Software\other\[POINTS NQS  2012.XLS]Pro V Twin'!$B24 -> Travis Cobble | K20: ='\\ser\Software\other\[POINTS NQS  2012.XLS]Pro V Twin'!$C24 -> Bullgap, TN | L20: ='\\ser\Software\other\[POINTS NQS  2012.XLS]Pro V Twin'!$D24 -> 565 | M20: =IF('\\ser\Software\other\[POINTS NQS  2012.XLS]Pro V Twin'!$E24=0," ",'\\ser\Software\other\[POINTS NQS  2012.XLS]Pro V Twin'!$E24) -> Papaws Nightmare | N20: ='\\ser\Software\other\[POINTS NQS  2012.XLS]Pro V Twin'!$AA24 -> 91
B23: OPEN SUPER STOCK | F23: Thru Peoria
B24: Name | C24: City/State | D24: NQS # | E24: Tractor | F24: Points Back
A25: ='\\ser\Software\other\[POINTS NQS  2012.XLS]Open Super Stock'!$A7 -> 1 | B25: ='\\ser\Software\other\[POINTS NQS  2012.XLS]Open Super Stock'!$B7 -> Julian Stahl | C25: ='\\ser\Software\other\[POINTS NQS  2012.XLS]Open Super Stock'!$C7 -> Welton, IA | D25: ='\\ser\Software\other\[POINTS NQS  2012.XLS]Open Super Stock'!$D7 -> 5 | E25: =IF('\\ser\Software\other\[POINTS NQS  2012.XLS]Open Super Stock'!$E7=0," ",'\\ser\Software\other\[POINTS NQS  2012.XLS]Open Super Stock'!$E7) -> Midwest Express | F25: ='\\ser\Software\other\[POINTS NQS  2012.XLS]Open Super Stock'!$AA7 -> 0
A26: ='\\ser\Software\other\[POINTS NQS  2012.XLS]Open Super Stock'!$A8 -> 2 | B26: ='\\ser\Software\other\[POINTS NQS  2012.XLS]Open Super Stock'!$B8 -> Harrison Stahl | C26: ='\\ser\Software\other\[POINTS NQS  2012.XLS]Open Super Stock'!$C8 -> Dewitt, IA | D26: ='\\ser\Software\other\[POINTS NQS  2012.XLS]Open Super Stock'!$D8 -> 4 | E26: =IF('\\ser\Software\other\[POINTS NQS  2012.XLS]Open Super Stock'!$E8=0," ",'\\ser\Software\other\[POINTS NQS  2012.XLS]Open Super Stock'!$E8) -> Ton of Fun | F26: ='\\ser\Software\other\[POINTS NQS  2012.XLS]Open Super Stock'!$AA8 -> 12
A27: ='\\ser\Software\other\[POINTS NQS  2012.XLS]Open Super Stock'!$A9 -> 3 | B27: ='\\ser\Software\other\[POINTS NQS  2012.XLS]Open Super Stock'!$B9 -> Julian Stahl | C27: ='\\ser\Software\other\[POINTS NQS  2012.XLS]Open Super Stock'!$C9 -> Welton, IA | D27: ='\\ser\Software\other\[POINTS NQS  2012.XLS]Open Super Stock'!$D9 -> 433 | E27: =IF('\\ser\Software\other\[POINTS NQS  2012.XLS]Open Super Stock'!$E9=0," ",'\\ser\Software\other\[POINTS NQS  2012.XLS]Open Super Stock'!$E9) -> Fully Charged | F27: ='\\ser\Software\other\[POINTS NQS  2012.XLS]Open Super Stock'!$AA9 -> 18
A28: ='\\ser\Software\other\[POINTS NQS  2012.XLS]Open Super Stock'!$A10 -> 4 | B28: ='\\ser\Software\other\[POINTS NQS  2012.XLS]Open Super Stock'!$B10 -> Bruce Austin | C28: ='\\ser\Software\other\[POINTS NQS  2012.XLS]Open Super Stock'!$C10 -> St. Charles, IA | D28: ='\\ser\Software\other\[POINTS NQS  2012.XLS]Open Super Stock'!$D10 -> 169 | E28: =IF('\\ser\Software\other\[POINTS NQS  2012.XLS]Open Super Stock'!$E10=0," ",'\\ser\Software\other\[POINTS NQS  2012.XLS]Open Super Stock'!$E10) -> Thundertaker | F28: ='\\ser\Software\other\[POINTS NQS  2012.XLS]Open Super Stock'!$AA10 -> 74
A29: ='\\ser\Software\other\[POINTS NQS  2012.XLS]Open Super Stock'!$A11 -> 5 | B29: ='\\ser\Software\other\[POINTS NQS  2012.XLS]Open Super Stock'!$B11 -> Ryan Richter | C29: ='\\ser\Software\other\[POINTS NQS  2012.XLS]Open Super Stock'!$C11 -> Connellsville, PA | D29: ='\\ser\Software\other\[POINTS NQS  2012.XLS]Open Super Stock'!$D11 -> 502 | E29: =IF('\\ser\Software\other\[POINTS NQS  2012.XLS]Open Super Stock'!$E11=0," ",'\\ser\Software\other\[POINTS NQS  2012.XLS]Open Super Stock'!$E11) -> Radical Rat | F29: ='\\ser\Software\other\[POINTS NQS  2012.XLS]Open Super Stock'!$AA11 -> 82
A30: ='\\ser\Software\other\[POINTS NQS  2012.XLS]Open Super Stock'!$A12 -> 6 | B30: ='\\ser\Software\other\[POINTS NQS  2012.XLS]Open Super Stock'!$B12 -> Ryan Shafer | C30: ='\\ser\Software\other\[POINTS NQS  2012.XLS]Open Super Stock'!$C12 -> Confluence, PA | D30: ='\\ser\Software\other\[POINTS NQS  2012.XLS]Open Super Stock'!$D12 -> 445 | E30: =IF('\\ser\Software\other\[POINTS NQS  2012.XLS]Open Super Stock'!$E12=0," ",'\\ser\Software\other\[POINTS NQS  2012.XLS]Open Super Stock'!$E12) -> Labrat | F30: ='\\ser\Software\other\[POINTS NQS  2012.XLS]Open Super Stock'!$AA12 -> 96
A31: ='\\ser\Software\other\[POINTS NQS  2012.XLS]Open Super Stock'!$A13 -> 7 | B31: ='\\ser\Software\other\[POINTS NQS  2012.XLS]Open Super Stock'!$B13 -> Calvin Becker | C31: ='\\ser\Software\other\[POINTS NQS  2012.XLS]Open Super Stock'!$C13 -> Whipple, Oh | D31: ='\\ser\Software\other\[POINTS NQS  2012.XLS]Open Super Stock'!$D13 -> 113 | E31: =IF('\\ser\Software\other\[POINTS NQS  2012.XLS]Open Super Stock'!$E13=0," ",'\\ser\Software\other\[POINTS NQS  2012.XLS]Open Super Stock'!$E13) -> Spike | F31: ='\\ser\Software\other\[POINTS NQS  2012.XLS]Open Super Stock'!$AA13 -> 122
A32: ='\\ser\Software\other\[POINTS NQS  2012.XLS]Open Super Stock'!$A14 -> 8 | B32: ='\\ser\Software\other\[POINTS NQS  2012.XLS]Open Super Stock'!$B14 -> Jim Waite | C32: ='\\ser\Software\other\[POINTS NQS  2012.XLS]Open Super Stock'!$C14 -> Hopkinton, RI | D32: ='\\ser\Software\other\[POINTS NQS  2012.XLS]Open Super Stock'!$D14 -> 480 | E32: =IF('\\ser\Software\other\[POINTS NQS  2012.XLS]Open Super Stock'!$E14=0," ",'\\ser\Software\other\[POINTS NQS  2012.XLS]Open Super Stock'!$E14) -> John Deere | F32: ='\\ser\Software\other\[POINTS NQS  2012.XLS]Open Super Stock'!$AA14 -> 181
A33: ='\\ser\Software\other\[POINTS NQS  2012.XLS]Open Super Stock'!$A15 -> 9 | B33: ='\\ser\Software\other\[POINTS NQS  2012.XLS]Open Super Stock'!$B15 -> Bill Jacobson | C33: ='\\ser\Software\other\[POINTS NQS  2012.XLS]Open Super Stock'!$C15 -> Washington, Mi | D33: ='\\ser\Software\other\[POINTS NQS  2012.XLS]Open Super Stock'!$D15 -> 531 | E33: =IF('\\ser\Software\other\[POINTS NQS  2012.XLS]Open Super Stock'!$E15=0," ",'\\ser\Software\other\[POINTS NQS  2012.XLS]Open Super Stock'!$E15) -> Smoker 1 | F33: ='\\ser\Software\other\[POINTS NQS  2012.XLS]Open Super Stock'!$AA15 -> 182
A34: ='\\ser\Software\other\[POINTS NQS  2012.XLS]Open Super Stock'!$A16 -> 10 | B34: ='\\ser\Software\other\[POINTS NQS  2012.XLS]Open Super Stock'!$B16 -> Jerry Everhart | C34: ='\\ser\Software\other\[POINTS NQS  2012.XLS]Open Super Stock'!$C16 -> Springfield, OH | D34: ='\\ser\Software\other\[POINTS NQS  2012.XLS]Open Super Stock'!$D16 -> 483 | E34: =IF('\\ser\Software\other\[POINTS NQS  2012.XLS]Open Super Stock'!$E16=0," ",'\\ser\Software\other\[POINTS NQS  2012.XLS]Open Super Stock'!$E16) ->  | F34: ='\\ser\Software\other\[POINTS NQS  2012.XLS]Open Super Stock'!$AA16 -> 184
A35: ='\\ser\Software\other\[POINTS NQS  2012.XLS]Open Super Stock'!$A17 -> 11 | B35: ='\\ser\Software\other\[POINTS NQS  2012.XLS]Open Super Stock'!$B17 -> Tim Peters | C35: ='\\ser\Software\other\[POINTS NQS  2012.XLS]Open Super Stock'!$C17 -> Clifton Springs, NY | D35: ='\\ser\Software\other\[POINTS NQS  2012.XLS]Open Super Stock'!$D17 -> 569 | E35: =IF('\\ser\Software\other\[POINTS NQS  2012.XLS]Open Super Stock'!$E17=0," ",'\\ser\Software\other\[POINTS NQS  2012.XLS]Open Super Stock'!$E17) -> Fixation | F35: ='\\ser\Software\other\[POINTS NQS  2012.XLS]Open Super Stock'!$AA17 -> 184
A36: ='\\ser\Software\other\[POINTS NQS  2012.XLS]Open Super Stock'!$A18 -> 12 | B36: ='\\ser\Software\other\[POINTS NQS  2012.XLS]Open Super Stock'!$B18 -> Ken Lucious | C36: ='\\ser\Software\other\[POINTS NQS  2012.XLS]Open Super Stock'!$C18 -> Piro, Oh | D36: ='\\ser\Software\other\[POINTS NQS  2012.XLS]Open Super Stock'!$D18 -> 156 | E36: =IF('\\ser\Software\other\[POINTS NQS  2012.XLS]Open Super Stock'!$E18=0," ",'\\ser\Software\other\[POINTS NQS  2012.XLS]Open Super Stock'!$E18) ->  | F36: ='\\ser\Software\other\[POINTS NQS  2012.XLS]Open Super Stock'!$AA18 -> 188
A37: ='\\ser\Software\other\[POINTS NQS  2012.XLS]Open Super Stock'!$A19 -> 13 | B37: ='\\ser\Software\other\[POINTS NQS  2012.XLS]Open Super Stock'!$B19 -> Russ Nichols | C37: ='\\ser\Software\other\[POINTS NQS  2012.XLS]Open Super Stock'!$C19 -> Lore City, Oh | D37: ='\\ser\Software\other\[POINTS NQS  2012.XLS]Open Super Stock'!$D19 -> 552 | E37: =IF('\\ser\Software\other\[POINTS NQS  2012.XLS]Open Super Stock'!$E19=0," ",'\\ser\Software\other\[POINTS NQS  2012.XLS]Open Super Stock'!$E19) ->  | F37: ='\\ser\Software\other\[POINTS NQS  2012.XLS]Open Super Stock'!$AA19 -> 192
A38: ='\\ser\Software\other\[POINTS NQS  2012.XLS]Open Super Stock'!$A20 -> 14 | B38: ='\\ser\Software\other\[POINTS NQS  2012.XLS]Open Super Stock'!$B20 -> Greg Watson | C38: ='\\ser\Software\other\[POINTS NQS  2012.XLS]Open Super Stock'!$C20 -> Republic, Oh | D38: ='\\ser\Software\other\[POINTS NQS  2012.XLS]Open Super Stock'!$D20 -> 341 | E38: =IF('\\ser\Software\other\[POINTS NQS  2012.XLS]Open Super Stock'!$E20=0," ",'\\ser\Software\other\[POINTS NQS  2012.XLS]Open Super Stock'!$E20) -> Odd Couple | F38: ='\\ser\Software\other\[POINTS NQS  2012.XLS]Open Super Stock'!$AA20 -> 204
A39: ='\\ser\Software\other\[POINTS NQS  2012.XLS]Open Super Stock'!$A21 -> 15 | B39: ='\\ser\Software\other\[POINTS NQS  2012.XLS]Open Super Stock'!$B21 -> Shane Hadley | C39: ='\\ser\Software\other\[POINTS NQS  2012.XLS]Open Super Stock'!$C21 -> Marion, NY | D39: ='\\ser\Software\other\[POINTS NQS  2012.XLS]Open Super Stock'!$D21 -> 505 | E39: =IF('\\ser\Software\other\[POINTS NQS  2012.XLS]Open Super Stock'!$E21=0," ",'\\ser\Software\other\[POINTS NQS  2012.XLS]Open Super Stock'!$E21) ->  | F39: ='\\ser\Software\other\[POINTS NQS  2012.XLS]Open Super Stock'!$AA21 -> 207
A40: ='\\ser\Software\other\[POINTS NQS  2012.XLS]Open Super Stock'!$A22 -> 16 | B40: ='\\ser\Software\other\[POINTS NQS  2012.XLS]Open Super Stock'!$B22 -> Mike Spencer | C40: ='\\ser\Software\other\[POINTS NQS  2012.XLS]Open Super Stock'!$C22 -> West Alexandria, Oh | D40: ='\\ser\Software\other\[POINTS NQS  2012.XLS]Open Super Stock'!$D22 -> 278 | E40: =IF('\\ser\Software\other\[POINTS NQS  2012.XLS]Open Super Stock'!$E22=0," ",'\\ser\Software\other\[POINTS NQS  2012.XLS]Open Super Stock'!$E22) -> Longshot | F40: ='\\ser\Software\other\[POINTS NQS  2012.XLS]Open Super Stock'!$AA22 -> 209
A41: ='\\ser\Software\other\[POINTS NQS  2012.XLS]Open Super Stock'!$A23 -> 17 | B41: ='\\ser\Software\other\[POINTS NQS  2012.XLS]Open Super Stock'!$B23 -> Robert Kauffman | C41: ='\\ser\Software\other\[POINTS NQS  2012.XLS]Open Super Stock'!$C23 -> Ruffsdale, Pa | D41: ='\\ser\Software\other\[POINTS NQS  2012.XLS]Open Super Stock'!$D23 -> 560 | E41: =IF('\\ser\Software\other\[POINTS NQS  2012.XLS]Open Super Stock'!$E23=0," ",'\\ser\Software\other\[POINTS NQS  2012.XLS]Open Super Stock'!$E23) -> Red Blooded | F41: ='\\ser\Software\other\[POINTS NQS  2012.XLS]Open Super Stock'!$AA23 -> 212