B1: OUTLAW CLASS | F1: Thru Marietta | H1: Stock Altered Class | M1: Thru Marietta
B2: Name | C2: Eng. | D2: NQS # | E2: Tractor | F2: Points Back | I2: Name | J2: Eng. | K2: NQS # | L2: Tractor | M2: Points Back
A4: ='I:\[POINTS NQS  2011.XLS]Outlaw'!A7 -> 1 | B4: ='I:\[POINTS NQS  2011.XLS]Outlaw'!B7 -> Keith Frueh | C4: =IF('I:\[POINTS NQS  2011.XLS]Outlaw'!C7=0," ",'I:\[POINTS NQS  2011.XLS]Outlaw'!C7) -> JRS | D4: ='I:\[POINTS NQS  2011.XLS]Outlaw'!D7 -> 11-453 | E4: =IF('I:\[POINTS NQS  2011.XLS]Outlaw'!E7=0," ",'I:\[POINTS NQS  2011.XLS]Outlaw'!E7) -> Haulin Harvester | F4: ='I:\[POINTS NQS  2011.XLS]Outlaw'!Z7 -> 0 | H4: ='I:\[POINTS NQS  2011.XLS]Stock Altered'!A6 -> 1 | I4: ='I:\[POINTS NQS  2011.XLS]Stock Altered'!B6 -> Colt Vorhees | J4: =IF('I:\[POINTS NQS  2011.XLS]Stock Altered'!C6=0,"",'I:\[POINTS NQS  2011.XLS]Stock Altered'!C6) -> TV | K4: ='I:\[POINTS NQS  2011.XLS]Stock Altered'!D6 -> 11-313 | L4: =IF('I:\[POINTS NQS  2011.XLS]Stock Altered'!E6=0,"",'I:\[POINTS NQS  2011.XLS]Stock Altered'!E6) -> Red Cadet | M4: ='I:\[POINTS NQS  2011.XLS]Stock Altered'!Z6 -> 0
A5: ='I:\[POINTS NQS  2011.XLS]Outlaw'!A8 -> 2 | B5: ='I:\[POINTS NQS  2011.XLS]Outlaw'!B8 -> Gary Cunningham | C5: =IF('I:\[POINTS NQS  2011.XLS]Outlaw'!C8=0," ",'I:\[POINTS NQS  2011.XLS]Outlaw'!C8) -> NP | D5: ='I:\[POINTS NQS  2011.XLS]Outlaw'!D8 -> 11-162 | E5: =IF('I:\[POINTS NQS  2011.XLS]Outlaw'!E8=0," ",'I:\[POINTS NQS  2011.XLS]Outlaw'!E8) -> High Voltage | F5: ='I:\[POINTS NQS  2011.XLS]Outlaw'!Z8 -> 3 | H5: ='I:\[POINTS NQS  2011.XLS]Stock Altered'!A7 -> 2 | I5: ='I:\[POINTS NQS  2011.XLS]Stock Altered'!B7 -> Bob Jones JR | J5: =IF('I:\[POINTS NQS  2011.XLS]Stock Altered'!C7=0,"",'I:\[POINTS NQS  2011.XLS]Stock Altered'!C7) -> BJ | K5: ='I:\[POINTS NQS  2011.XLS]Stock Altered'!D7 -> 11-183 | L5: =IF('I:\[POINTS NQS  2011.XLS]Stock Altered'!E7=0,"",'I:\[POINTS NQS  2011.XLS]Stock Altered'!E7) -> Playdough | M5: ='I:\[POINTS NQS  2011.XLS]Stock Altered'!Z7 -> 11
A6: ='I:\[POINTS NQS  2011.XLS]Outlaw'!A9 -> 3 | B6: ='I:\[POINTS NQS  2011.XLS]Outlaw'!B9 -> Gary Frank | C6: =IF('I:\[POINTS NQS  2011.XLS]Outlaw'!C9=0," ",'I:\[POINTS NQS  2011.XLS]Outlaw'!C9) -> TV | D6: ='I:\[POINTS NQS  2011.XLS]Outlaw'!D9 -> 11-233 | E6: =IF('I:\[POINTS NQS  2011.XLS]Outlaw'!E9=0," ",'I:\[POINTS NQS  2011.XLS]Outlaw'!E9) -> Katies Toy | F6: ='I:\[POINTS NQS  2011.XLS]Outlaw'!Z9 -> 17 | H6: ='I:\[POINTS NQS  2011.XLS]Stock Altered'!A8 -> 3 | I6: ='I:\[POINTS NQS  2011.XLS]Stock Altered'!B8 -> Gregory Vandervort | J6: =IF('I:\[POINTS NQS  2011.XLS]Stock Altered'!C8=0,"",'I:\[POINTS NQS  2011.XLS]Stock Altered'!C8) -> TV | K6: ='I:\[POINTS NQS  2011.XLS]Stock Altered'!D8 -> 11-346 | L6: =IF('I:\[POINTS NQS  2011.XLS]Stock Altered'!E8=0,"",'I:\[POINTS NQS  2011.XLS]Stock Altered'!E8) -> Yellow Cub | M6: ='I:\[POINTS NQS  2011.XLS]Stock Altered'!Z8 -> 22
A7: ='I:\[POINTS NQS  2011.XLS]Outlaw'!A10 -> 4 | B7: ='I:\[POINTS NQS  2011.XLS]Outlaw'!B10 -> Mark Rader | C7: =IF('I:\[POINTS NQS  2011.XLS]Outlaw'!C10=0," ",'I:\[POINTS NQS  2011.XLS]Outlaw'!C10) -> RPM | D7: ='I:\[POINTS NQS  2011.XLS]Outlaw'!D10 -> 11-213 | E7: =IF('I:\[POINTS NQS  2011.XLS]Outlaw'!E10=0," ",'I:\[POINTS NQS  2011.XLS]Outlaw'!E10) -> Lethal Weapon | F7: ='I:\[POINTS NQS  2011.XLS]Outlaw'!Z10 -> 32 | H7: ='I:\[POINTS NQS  2011.XLS]Stock Altered'!A9 -> 4 | I7: ='I:\[POINTS NQS  2011.XLS]Stock Altered'!B9 -> Keith Frueh | J7: =IF('I:\[POINTS NQS  2011.XLS]Stock Altered'!C9=0,"",'I:\[POINTS NQS  2011.XLS]Stock Altered'!C9) -> JRS | K7: ='I:\[POINTS NQS  2011.XLS]Stock Altered'!D9 -> 11-453 | L7: =IF('I:\[POINTS NQS  2011.XLS]Stock Altered'!E9=0,"",'I:\[POINTS NQS  2011.XLS]Stock Altered'!E9) -> Haulin Harvester | M7: ='I:\[POINTS NQS  2011.XLS]Stock Altered'!Z9 -> 25
A8: ='I:\[POINTS NQS  2011.XLS]Outlaw'!A11 -> 5 | B8: ='I:\[POINTS NQS  2011.XLS]Outlaw'!B11 -> Kelly Nichols | C8: =IF('I:\[POINTS NQS  2011.XLS]Outlaw'!C11=0," ",'I:\[POINTS NQS  2011.XLS]Outlaw'!C11) -> NP | D8: ='I:\[POINTS NQS  2011.XLS]Outlaw'!D11 -> 11-358 | E8: =IF('I:\[POINTS NQS  2011.XLS]Outlaw'!E11=0," ",'I:\[POINTS NQS  2011.XLS]Outlaw'!E11) -> Maxx Out | F8: ='I:\[POINTS NQS  2011.XLS]Outlaw'!Z11 -> 41 | H8: ='I:\[POINTS NQS  2011.XLS]Stock Altered'!A10 -> 5 | I8: ='I:\[POINTS NQS  2011.XLS]Stock Altered'!B10 -> Tim Shaw | J8: =IF('I:\[POINTS NQS  2011.XLS]Stock Altered'!C10=0,"",'I:\[POINTS NQS  2011.XLS]Stock Altered'!C10) -> TV | K8: ='I:\[POINTS NQS  2011.XLS]Stock Altered'!D10 -> 11-454 | L8: =IF('I:\[POINTS NQS  2011.XLS]Stock Altered'!E10=0,"",'I:\[POINTS NQS  2011.XLS]Stock Altered'!E10) -> Heavy Hauler | M8: ='I:\[POINTS NQS  2011.XLS]Stock Altered'!Z10 -> 37
A9: ='I:\[POINTS NQS  2011.XLS]Outlaw'!A12 -> 6 | B9: ='I:\[POINTS NQS  2011.XLS]Outlaw'!B12 -> Carl Frueh | C9: =IF('I:\[POINTS NQS  2011.XLS]Outlaw'!C12=0," ",'I:\[POINTS NQS  2011.XLS]Outlaw'!C12) -> JRS | D9: ='I:\[POINTS NQS  2011.XLS]Outlaw'!D12 -> 11-279 | E9: =IF('I:\[POINTS NQS  2011.XLS]Outlaw'!E12=0," ",'I:\[POINTS NQS  2011.XLS]Outlaw'!E12) -> Blue Thunder 2 | F9: ='I:\[POINTS NQS  2011.XLS]Outlaw'!Z12 -> 43 | H9: ='I:\[POINTS NQS  2011.XLS]Stock Altered'!A11 -> 6 | I9: ='I:\[POINTS NQS  2011.XLS]Stock Altered'!B11 -> Wayne Sams | J9: =IF('I:\[POINTS NQS  2011.XLS]Stock Altered'!C11=0,"",'I:\[POINTS NQS  2011.XLS]Stock Altered'!C11) -> TV | K9: ='I:\[POINTS NQS  2011.XLS]Stock Altered'!D11 -> 11-082 | L9: =IF('I:\[POINTS NQS  2011.XLS]Stock Altered'!E11=0,"",'I:\[POINTS NQS  2011.XLS]Stock Altered'!E11) -> Gold Digger | M9: ='I:\[POINTS NQS  2011.XLS]Stock Altered'!Z11 -> 41
A10: ='I:\[POINTS NQS  2011.XLS]Outlaw'!A13 -> 7 | B10: ='I:\[POINTS NQS  2011.XLS]Outlaw'!B13 -> Wayne Sams | C10: =IF('I:\[POINTS NQS  2011.XLS]Outlaw'!C13=0," ",'I:\[POINTS NQS  2011.XLS]Outlaw'!C13) -> TV | D10: ='I:\[POINTS NQS  2011.XLS]Outlaw'!D13 -> 11-082 | E10: =IF('I:\[POINTS NQS  2011.XLS]Outlaw'!E13=0," ",'I:\[POINTS NQS  2011.XLS]Outlaw'!E13) -> Gold Digger | F10: ='I:\[POINTS NQS  2011.XLS]Outlaw'!Z13 -> 44 | H10: ='I:\[POINTS NQS  2011.XLS]Stock Altered'!A12 -> 7 | I10: ='I:\[POINTS NQS  2011.XLS]Stock Altered'!B12 -> Doug Seaman | J10: =IF('I:\[POINTS NQS  2011.XLS]Stock Altered'!C12=0,"",'I:\[POINTS NQS  2011.XLS]Stock Altered'!C12) -> BJ | K10: ='I:\[POINTS NQS  2011.XLS]Stock Altered'!D12 -> 11-192 | L10: =IF('I:\[POINTS NQS  2011.XLS]Stock Altered'!E12=0,"",'I:\[POINTS NQS  2011.XLS]Stock Altered'!E12) -> Massey Ferguson | M10: ='I:\[POINTS NQS  2011.XLS]Stock Altered'!Z12 -> 45
A11: ='I:\[POINTS NQS  2011.XLS]Outlaw'!A14 -> 8 | B11: ='I:\[POINTS NQS  2011.XLS]Outlaw'!B14 -> David Gawatz | C11: =IF('I:\[POINTS NQS  2011.XLS]Outlaw'!C14=0," ",'I:\[POINTS NQS  2011.XLS]Outlaw'!C14) -> LR | D11: ='I:\[POINTS NQS  2011.XLS]Outlaw'!D14 -> 11-462 | E11: =IF('I:\[POINTS NQS  2011.XLS]Outlaw'!E14=0," ",'I:\[POINTS NQS  2011.XLS]Outlaw'!E14) -> Fear the Deere | F11: ='I:\[POINTS NQS  2011.XLS]Outlaw'!Z14 -> 44 | H11: ='I:\[POINTS NQS  2011.XLS]Stock Altered'!A13 -> 8 | I11: ='I:\[POINTS NQS  2011.XLS]Stock Altered'!B13 -> Eli Zimmerman | J11: =IF('I:\[POINTS NQS  2011.XLS]Stock Altered'!C13=0,"",'I:\[POINTS NQS  2011.XLS]Stock Altered'!C13) -> NP | K11: ='I:\[POINTS NQS  2011.XLS]Stock Altered'!D13 -> 11-075 | L11: =IF('I:\[POINTS NQS  2011.XLS]Stock Altered'!E13=0,"",'I:\[POINTS NQS  2011.XLS]Stock Altered'!E13) -> Red Fever | M11: ='I:\[POINTS NQS  2011.XLS]Stock Altered'!Z13 -> 62
A12: ='I:\[POINTS NQS  2011.XLS]Outlaw'!A15 -> 9 | B12: ='I:\[POINTS NQS  2011.XLS]Outlaw'!B15 -> Colt Vorhees | C12: =IF('I:\[POINTS NQS  2011.XLS]Outlaw'!C15=0," ",'I:\[POINTS NQS  2011.XLS]Outlaw'!C15) -> TV | D12: ='I:\[POINTS NQS  2011.XLS]Outlaw'!D15 -> 11-313 | E12: =IF('I:\[POINTS NQS  2011.XLS]Outlaw'!E15=0," ",'I:\[POINTS NQS  2011.XLS]Outlaw'!E15) -> Red Cadet | F12: ='I:\[POINTS NQS  2011.XLS]Outlaw'!Z15 -> 46 | H12: ='I:\[POINTS NQS  2011.XLS]Stock Altered'!A14 -> 9 | I12: ='I:\[POINTS NQS  2011.XLS]Stock Altered'!B14 -> Kelly Nichols | J12: =IF('I:\[POINTS NQS  2011.XLS]Stock Altered'!C14=0,"",'I:\[POINTS NQS  2011.XLS]Stock Altered'!C14) -> NP | K12: ='I:\[POINTS NQS  2011.XLS]Stock Altered'!D14 -> 11-358 | L12: =IF('I:\[POINTS NQS  2011.XLS]Stock Altered'!E14=0,"",'I:\[POINTS NQS  2011.XLS]Stock Altered'!E14) -> Maxx'd Out | M12: ='I:\[POINTS NQS  2011.XLS]Stock Altered'!Z14 -> 62
A13: ='I:\[POINTS NQS  2011.XLS]Outlaw'!A16 -> 10 | B13: ='I:\[POINTS NQS  2011.XLS]Outlaw'!B16 -> Eli Zimmerman | C13: =IF('I:\[POINTS NQS  2011.XLS]Outlaw'!C16=0," ",'I:\[POINTS NQS  2011.XLS]Outlaw'!C16) -> NP | D13: ='I:\[POINTS NQS  2011.XLS]Outlaw'!D16 -> 11-075 | E13: =IF('I:\[POINTS NQS  2011.XLS]Outlaw'!E16=0," ",'I:\[POINTS NQS  2011.XLS]Outlaw'!E16) -> Red Fever | F13: ='I:\[POINTS NQS  2011.XLS]Outlaw'!Z16 -> 47 | H13: ='I:\[POINTS NQS  2011.XLS]Stock Altered'!A15 -> 10 | I13: ='I:\[POINTS NQS  2011.XLS]Stock Altered'!B15 -> Roger Davis | J13: =IF('I:\[POINTS NQS  2011.XLS]Stock Altered'!C15=0,"",'I:\[POINTS NQS  2011.XLS]Stock Altered'!C15) -> JRS | K13: ='I:\[POINTS NQS  2011.XLS]Stock Altered'!D15 -> 11-068 | L13: =IF('I:\[POINTS NQS  2011.XLS]Stock Altered'!E15=0,"",'I:\[POINTS NQS  2011.XLS]Stock Altered'!E15) -> Dusty Lady | M13: ='I:\[POINTS NQS  2011.XLS]Stock Altered'!Z15 -> 65
A14: ='I:\[POINTS NQS  2011.XLS]Outlaw'!A17 -> 11 | B14: ='I:\[POINTS NQS  2011.XLS]Outlaw'!B17 -> Ron Hodges | C14: =IF('I:\[POINTS NQS  2011.XLS]Outlaw'!C17=0," ",'I:\[POINTS NQS  2011.XLS]Outlaw'!C17) -> TV | D14: ='I:\[POINTS NQS  2011.XLS]Outlaw'!D17 -> 11-071 | E14: =IF('I:\[POINTS NQS  2011.XLS]Outlaw'!E17=0," ",'I:\[POINTS NQS  2011.XLS]Outlaw'!E17) -> Take-N-Names | F14: ='I:\[POINTS NQS  2011.XLS]Outlaw'!Z17 -> 51 | H14: ='I:\[POINTS NQS  2011.XLS]Stock Altered'!A16 -> 11 | I14: ='I:\[POINTS NQS  2011.XLS]Stock Altered'!B16 -> Gary Cunningham | J14: =IF('I:\[POINTS NQS  2011.XLS]Stock Altered'!C16=0,"",'I:\[POINTS NQS  2011.XLS]Stock Altered'!C16) -> NP | K14: ='I:\[POINTS NQS  2011.XLS]Stock Altered'!D16 -> 11-162 | L14: =IF('I:\[POINTS NQS  2011.XLS]Stock Altered'!E16=0,"",'I:\[POINTS NQS  2011.XLS]Stock Altered'!E16) -> High Voltage | M14: ='I:\[POINTS NQS  2011.XLS]Stock Altered'!Z16 -> 66
A15: ='I:\[POINTS NQS  2011.XLS]Outlaw'!A18 -> 12 | B15: ='I:\[POINTS NQS  2011.XLS]Outlaw'!B18 -> Mark Peters | C15: =IF('I:\[POINTS NQS  2011.XLS]Outlaw'!C18=0," ",'I:\[POINTS NQS  2011.XLS]Outlaw'!C18) -> JRS | D15: ='I:\[POINTS NQS  2011.XLS]Outlaw'!D18 -> 11-469 | E15: =IF('I:\[POINTS NQS  2011.XLS]Outlaw'!E18=0," ",'I:\[POINTS NQS  2011.XLS]Outlaw'!E18) -> American Ride | F15: ='I:\[POINTS NQS  2011.XLS]Outlaw'!Z18 -> 53 | H15: ='I:\[POINTS NQS  2011.XLS]Stock Altered'!A17 -> 12 | I15: ='I:\[POINTS NQS  2011.XLS]Stock Altered'!B17 -> Mark Rader | J15: =IF('I:\[POINTS NQS  2011.XLS]Stock Altered'!C17=0,"",'I:\[POINTS NQS  2011.XLS]Stock Altered'!C17) -> RPM | K15: ='I:\[POINTS NQS  2011.XLS]Stock Altered'!D17 -> 11-213 | L15: =IF('I:\[POINTS NQS  2011.XLS]Stock Altered'!E17=0,"",'I:\[POINTS NQS  2011.XLS]Stock Altered'!E17) -> Lethal Weapon | M15: ='I:\[POINTS NQS  2011.XLS]Stock Altered'!Z17 -> 69
A16: 13 | B16: ='I:\[POINTS NQS  2011.XLS]Outlaw'!B20 -> Mike Hall | C16: =IF('I:\[POINTS NQS  2011.XLS]Outlaw'!C20=0," ",'I:\[POINTS NQS  2011.XLS]Outlaw'!C20) -> RPM | D16: ='I:\[POINTS NQS  2011.XLS]Outlaw'!D20 -> 11-248 | E16: =IF('I:\[POINTS NQS  2011.XLS]Outlaw'!E20=0," ",'I:\[POINTS NQS  2011.XLS]Outlaw'!E20) -> Lethal Injection | F16: ='I:\[POINTS NQS  2011.XLS]Outlaw'!Z20 -> 54 | H16: ='I:\[POINTS NQS  2011.XLS]Stock Altered'!A18 -> 13 | I16: ='I:\[POINTS NQS  2011.XLS]Stock Altered'!B18 -> Jill Chrisman | J16: =IF('I:\[POINTS NQS  2011.XLS]Stock Altered'!C18=0,"",'I:\[POINTS NQS  2011.XLS]Stock Altered'!C18) -> VM | K16: ='I:\[POINTS NQS  2011.XLS]Stock Altered'!D18 -> 11-179 | L16: =IF('I:\[POINTS NQS  2011.XLS]Stock Altered'!E18=0,"",'I:\[POINTS NQS  2011.XLS]Stock Altered'!E18) ->  | M16: ='I:\[POINTS NQS  2011.XLS]Stock Altered'!Z18 -> 70
A17: 14 | B17: ='I:\[POINTS NQS  2011.XLS]Outlaw'!B19 -> Scott Bye | C17: =IF('I:\[POINTS NQS  2011.XLS]Outlaw'!C19=0," ",'I:\[POINTS NQS  2011.XLS]Outlaw'!C19) -> JW | D17: ='I:\[POINTS NQS  2011.XLS]Outlaw'!D19 -> 11-187 | E17: =IF('I:\[POINTS NQS  2011.XLS]Outlaw'!E19=0," ",'I:\[POINTS NQS  2011.XLS]Outlaw'!E19) -> Revved Up | F17: ='I:\[POINTS NQS  2011.XLS]Outlaw'!Z19 -> 54 | H17: ='I:\[POINTS NQS  2011.XLS]Stock Altered'!A19 -> 14 | I17: ='I:\[POINTS NQS  2011.XLS]Stock Altered'!B19 -> Matt Ronnebaum | J17: =IF('I:\[POINTS NQS  2011.XLS]Stock Altered'!C19=0,"",'I:\[POINTS NQS  2011.XLS]Stock Altered'!C19) -> TV | K17: ='I:\[POINTS NQS  2011.XLS]Stock Altered'!D19 -> 11-089 | L17: =IF('I:\[POINTS NQS  2011.XLS]Stock Altered'!E19=0,"",'I:\[POINTS NQS  2011.XLS]Stock Altered'!E19) -> Boys & Their Toys | M17: ='I:\[POINTS NQS  2011.XLS]Stock Altered'!Z19 -> 72
A18: ='I:\[POINTS NQS  2011.XLS]Outlaw'!A21 -> 15 | B18: ='I:\[POINTS NQS  2011.XLS]Outlaw'!B21 -> Lonnie Lewis | C18: =IF('I:\[POINTS NQS  2011.XLS]Outlaw'!C21=0," ",'I:\[POINTS NQS  2011.XLS]Outlaw'!C21) -> TV | D18: ='I:\[POINTS NQS  2011.XLS]Outlaw'!D21 -> 11-024 | E18: =IF('I:\[POINTS NQS  2011.XLS]Outlaw'!E21=0," ",'I:\[POINTS NQS  2011.XLS]Outlaw'!E21) -> Deuces Wild | F18: ='I:\[POINTS NQS  2011.XLS]Outlaw'!Z21 -> 60 | H18: ='I:\[POINTS NQS  2011.XLS]Stock Altered'!A20 -> 15 | I18: ='I:\[POINTS NQS  2011.XLS]Stock Altered'!B20 -> Randy Demers | J18: =IF('I:\[POINTS NQS  2011.XLS]Stock Altered'!C20=0,"",'I:\[POINTS NQS  2011.XLS]Stock Altered'!C20) -> NP | K18: ='I:\[POINTS NQS  2011.XLS]Stock Altered'!D20 -> 11-084 | L18: =IF('I:\[POINTS NQS  2011.XLS]Stock Altered'!E20=0,"",'I:\[POINTS NQS  2011.XLS]Stock Altered'!E20) -> Bounty Hunter | M18: ='I:\[POINTS NQS  2011.XLS]Stock Altered'!Z20 -> 74
A19: ='I:\[POINTS NQS  2011.XLS]Outlaw'!A22 -> 16 | B19: ='I:\[POINTS NQS  2011.XLS]Outlaw'!B22 -> Carl Frueh | C19: =IF('I:\[POINTS NQS  2011.XLS]Outlaw'!C22=0," ",'I:\[POINTS NQS  2011.XLS]Outlaw'!C22) -> JRS | D19: ='I:\[POINTS NQS  2011.XLS]Outlaw'!D22 -> 11-086 | E19: =IF('I:\[POINTS NQS  2011.XLS]Outlaw'!E22=0," ",'I:\[POINTS NQS  2011.XLS]Outlaw'!E22) -> Fearless | F19: ='I:\[POINTS NQS  2011.XLS]Outlaw'!Z22 -> 60 | H19: ='I:\[POINTS NQS  2011.XLS]Stock Altered'!A21 -> 16 | I19: ='I:\[POINTS NQS  2011.XLS]Stock Altered'!B21 -> Mark Peters | J19: =IF('I:\[POINTS NQS  2011.XLS]Stock Altered'!C21=0,"",'I:\[POINTS NQS  2011.XLS]Stock Altered'!C21) -> JRS | K19: ='I:\[POINTS NQS  2011.XLS]Stock Altered'!D21 -> 11-469 | L19: =IF('I:\[POINTS NQS  2011.XLS]Stock Altered'!E21=0,"",'I:\[POINTS NQS  2011.XLS]Stock Altered'!E21) -> American Ride | M19: ='I:\[POINTS NQS  2011.XLS]Stock Altered'!Z21 -> 76
A20: ='I:\[POINTS NQS  2011.XLS]Outlaw'!A23 -> 17 | B20: ='I:\[POINTS NQS  2011.XLS]Outlaw'!B23 -> Lora Feldkamp | C20: =IF('I:\[POINTS NQS  2011.XLS]Outlaw'!C23=0," ",'I:\[POINTS NQS  2011.XLS]Outlaw'!C23) -> Woods | D20: ='I:\[POINTS NQS  2011.XLS]Outlaw'!D23 -> 11-475 | E20: =IF('I:\[POINTS NQS  2011.XLS]Outlaw'!E23=0," ",'I:\[POINTS NQS  2011.XLS]Outlaw'!E23) ->  | F20: ='I:\[POINTS NQS  2011.XLS]Outlaw'!Z23 -> 63 | H20: ='I:\[POINTS NQS  2011.XLS]Stock Altered'!A22 -> 17 | I20: ='I:\[POINTS NQS  2011.XLS]Stock Altered'!B22 -> Tim Rankin | J20: =IF('I:\[POINTS NQS  2011.XLS]Stock Altered'!C22=0,"",'I:\[POINTS NQS  2011.XLS]Stock Altered'!C22) -> Woods | K20: ='I:\[POINTS NQS  2011.XLS]Stock Altered'!D22 -> 11-287 | L20: =IF('I:\[POINTS NQS  2011.XLS]Stock Altered'!E22=0,"",'I:\[POINTS NQS  2011.XLS]Stock Altered'!E22) -> Incognito | M20: ='I:\[POINTS NQS  2011.XLS]Stock Altered'!Z22 -> 78
A21: ='I:\[POINTS NQS  2011.XLS]Outlaw'!A24 -> 18 | B21: ='I:\[POINTS NQS  2011.XLS]Outlaw'!B24 -> Trent Evans | C21: =IF('I:\[POINTS NQS  2011.XLS]Outlaw'!C24=0," ",'I:\[POINTS NQS  2011.XLS]Outlaw'!C24) -> NP | D21: ='I:\[POINTS NQS  2011.XLS]Outlaw'!D24 -> 11-357 | E21: =IF('I:\[POINTS NQS  2011.XLS]Outlaw'!E24=0," ",'I:\[POINTS NQS  2011.XLS]Outlaw'!E24) -> Bad out of Boyd | F21: ='I:\[POINTS NQS  2011.XLS]Outlaw'!Z24 -> 64 | H21: ='I:\[POINTS NQS  2011.XLS]Stock Altered'!A23 -> 18 | I21: ='I:\[POINTS NQS  2011.XLS]Stock Altered'!B23 -> Judy Lowe | J21: =IF('I:\[POINTS NQS  2011.XLS]Stock Altered'!C23=0,"",'I:\[POINTS NQS  2011.XLS]Stock Altered'!C23) -> TV | K21: ='I:\[POINTS NQS  2011.XLS]Stock Altered'!D23 -> 11-010 | L21: =IF('I:\[POINTS NQS  2011.XLS]Stock Altered'!E23=0,"",'I:\[POINTS NQS  2011.XLS]Stock Altered'!E23) -> SlowMotion | M21: ='I:\[POINTS NQS  2011.XLS]Stock Altered'!Z23 -> 79
A22: ='I:\[POINTS NQS  2011.XLS]Outlaw'!A25 -> 19 | B22: ='I:\[POINTS NQS  2011.XLS]Outlaw'!B25 -> Matt Rader | C22: =IF('I:\[POINTS NQS  2011.XLS]Outlaw'!C25=0," ",'I:\[POINTS NQS  2011.XLS]Outlaw'!C25) -> RPM | D22: ='I:\[POINTS NQS  2011.XLS]Outlaw'!D25 -> 11-259 | E22: =IF('I:\[POINTS NQS  2011.XLS]Outlaw'!E25=0," ",'I:\[POINTS NQS  2011.XLS]Outlaw'!E25) -> Lethal Response | F22: ='I:\[POINTS NQS  2011.XLS]Outlaw'!Z25 -> 65 | H22: ='I:\[POINTS NQS  2011.XLS]Stock Altered'!A24 -> 19 | I22: ='I:\[POINTS NQS  2011.XLS]Stock Altered'!B24 -> Carl Frueh | J22: =IF('I:\[POINTS NQS  2011.XLS]Stock Altered'!C24=0,"",'I:\[POINTS NQS  2011.XLS]Stock Altered'!C24) -> JRS | K22: ='I:\[POINTS NQS  2011.XLS]Stock Altered'!D24 -> 11-279 | L22: =IF('I:\[POINTS NQS  2011.XLS]Stock Altered'!E24=0,"",'I:\[POINTS NQS  2011.XLS]Stock Altered'!E24) -> Blue Thunder | M22: ='I:\[POINTS NQS  2011.XLS]Stock Altered'!Z24 -> 80
A23: ='I:\[POINTS NQS  2011.XLS]Outlaw'!A26 -> 20 | B23: ='I:\[POINTS NQS  2011.XLS]Outlaw'!B26 -> Judy Lowe | C23: =IF('I:\[POINTS NQS  2011.XLS]Outlaw'!C26=0," ",'I:\[POINTS NQS  2011.XLS]Outlaw'!C26) -> TV | D23: ='I:\[POINTS NQS  2011.XLS]Outlaw'!D26 -> 11-010 | E23: =IF('I:\[POINTS NQS  2011.XLS]Outlaw'!E26=0," ",'I:\[POINTS NQS  2011.XLS]Outlaw'!E26) -> Slow Motion | F23: ='I:\[POINTS NQS  2011.XLS]Outlaw'!Z26 -> 71 | H23: ='I:\[POINTS NQS  2011.XLS]Stock Altered'!A25 -> 20 | I23: ='I:\[POINTS NQS  2011.XLS]Stock Altered'!B25 -> Gary Seaman | J23: =IF('I:\[POINTS NQS  2011.XLS]Stock Altered'!C25=0,"",'I:\[POINTS NQS  2011.XLS]Stock Altered'!C25) -> BJ | K23: ='I:\[POINTS NQS  2011.XLS]Stock Altered'!D25 -> 11-191 | L23: =IF('I:\[POINTS NQS  2011.XLS]Stock Altered'!E25=0,"",'I:\[POINTS NQS  2011.XLS]Stock Altered'!E25) -> Framers Money | M23: ='I:\[POINTS NQS  2011.XLS]Stock Altered'!Z25 -> 83
A24: ='I:\[POINTS NQS  2011.XLS]Outlaw'!A27 -> 21 | B24: ='I:\[POINTS NQS  2011.XLS]Outlaw'!B27 -> Jill Chrisman | C24: =IF('I:\[POINTS NQS  2011.XLS]Outlaw'!C27=0," ",'I:\[POINTS NQS  2011.XLS]Outlaw'!C27) -> VM | D24: ='I:\[POINTS NQS  2011.XLS]Outlaw'!D27 -> 11-179 | E24: =IF('I:\[POINTS NQS  2011.XLS]Outlaw'!E27=0," ",'I:\[POINTS NQS  2011.XLS]Outlaw'!E27) ->  | F24: ='I:\[POINTS NQS  2011.XLS]Outlaw'!Z27 -> 71 | H24: ='I:\[POINTS NQS  2011.XLS]Stock Altered'!A26 -> 21 | I24: ='I:\[POINTS NQS  2011.XLS]Stock Altered'!B26 -> Tod Hinkle | J24: =IF('I:\[POINTS NQS  2011.XLS]Stock Altered'!C26=0,"",'I:\[POINTS NQS  2011.XLS]Stock Altered'!C26) -> JW | K24: ='I:\[POINTS NQS  2011.XLS]Stock Altered'!D26 -> 11-370 | L24: =IF('I:\[POINTS NQS  2011.XLS]Stock Altered'!E26=0,"",'I:\[POINTS NQS  2011.XLS]Stock Altered'!E26) -> Disturbed | M24: ='I:\[POINTS NQS  2011.XLS]Stock Altered'!Z26 -> 87
A25: ='I:\[POINTS NQS  2011.XLS]Outlaw'!A28 -> 22 | B25: ='I:\[POINTS NQS  2011.XLS]Outlaw'!B28 -> Dave Washburn | C25: =IF('I:\[POINTS NQS  2011.XLS]Outlaw'!C28=0," ",'I:\[POINTS NQS  2011.XLS]Outlaw'!C28) -> BJ | D25: ='I:\[POINTS NQS  2011.XLS]Outlaw'!D28 -> 11-156 | E25: =IF('I:\[POINTS NQS  2011.XLS]Outlaw'!E28=0," ",'I:\[POINTS NQS  2011.XLS]Outlaw'!E28) -> Last Minute | F25: ='I:\[POINTS NQS  2011.XLS]Outlaw'!Z28 -> 72 | H25: ='I:\[POINTS NQS  2011.XLS]Stock Altered'!A27 -> 22 | I25: ='I:\[POINTS NQS  2011.XLS]Stock Altered'!B27 -> Donnie Herring | J25: =IF('I:\[POINTS NQS  2011.XLS]Stock Altered'!C27=0,"",'I:\[POINTS NQS  2011.XLS]Stock Altered'!C27) -> TV | K25: ='I:\[POINTS NQS  2011.XLS]Stock Altered'!D27 -> 11-331 | L25: =IF('I:\[POINTS NQS  2011.XLS]Stock Altered'!E27=0,"",'I:\[POINTS NQS  2011.XLS]Stock Altered'!E27) -> Pasttime | M25: ='I:\[POINTS NQS  2011.XLS]Stock Altered'!Z27 -> 91
A26: ='I:\[POINTS NQS  2011.XLS]Outlaw'!A29 -> 23 | B26: ='I:\[POINTS NQS  2011.XLS]Outlaw'!B29 -> Matt Ronnebaum | C26: =IF('I:\[POINTS NQS  2011.XLS]Outlaw'!C29=0," ",'I:\[POINTS NQS  2011.XLS]Outlaw'!C29) -> TV | D26: ='I:\[POINTS NQS  2011.XLS]Outlaw'!D29 -> 11-089 | E26: =IF('I:\[POINTS NQS  2011.XLS]Outlaw'!E29=0," ",'I:\[POINTS NQS  2011.XLS]Outlaw'!E29) -> Boys & Their Toys | F26: ='I:\[POINTS NQS  2011.XLS]Outlaw'!Z29 -> 83 | H26: ='I:\[POINTS NQS  2011.XLS]Stock Altered'!A28 -> 23 | I26: ='I:\[POINTS NQS  2011.XLS]Stock Altered'!B28 -> Jamie Lewis | J26: =IF('I:\[POINTS NQS  2011.XLS]Stock Altered'!C28=0,"",'I:\[POINTS NQS  2011.XLS]Stock Altered'!C28) -> TV | K26: ='I:\[POINTS NQS  2011.XLS]Stock Altered'!D28 -> 11-019 | L26: =IF('I:\[POINTS NQS  2011.XLS]Stock Altered'!E28=0,"",'I:\[POINTS NQS  2011.XLS]Stock Altered'!E28) -> O-So-Orange | M26: ='I:\[POINTS NQS  2011.XLS]Stock Altered'!Z28 -> 94
A27: ='I:\[POINTS NQS  2011.XLS]Outlaw'!A30 -> 24 | B27: ='I:\[POINTS NQS  2011.XLS]Outlaw'!B30 -> Bob Jones JR | C27: =IF('I:\[POINTS NQS  2011.XLS]Outlaw'!C30=0," ",'I:\[POINTS NQS  2011.XLS]Outlaw'!C30) -> BJ | D27: ='I:\[POINTS NQS  2011.XLS]Outlaw'!D30 -> 11-183 | E27: =IF('I:\[POINTS NQS  2011.XLS]Outlaw'!E30=0," ",'I:\[POINTS NQS  2011.XLS]Outlaw'!E30) -> Play Dough | F27: ='I:\[POINTS NQS  2011.XLS]Outlaw'!Z30 -> 85 | H27: ='I:\[POINTS NQS  2011.XLS]Stock Altered'!A29 -> 24 | I27: ='I:\[POINTS NQS  2011.XLS]Stock Altered'!B29 -> Les Slayer | J27: =IF('I:\[POINTS NQS  2011.XLS]Stock Altered'!C29=0,"",'I:\[POINTS NQS  2011.XLS]Stock Altered'!C29) -> TV | K27: ='I:\[POINTS NQS  2011.XLS]Stock Altered'!D29 -> 11-444 | L27: =IF('I:\[POINTS NQS  2011.XLS]Stock Altered'!E29=0,"",'I:\[POINTS NQS  2011.XLS]Stock Altered'!E29) -> Unfinished Business | M27: ='I:\[POINTS NQS  2011.XLS]Stock Altered'!Z29 -> 99
A28: ='I:\[POINTS NQS  2011.XLS]Outlaw'!A31 -> 25 | B28: ='I:\[POINTS NQS  2011.XLS]Outlaw'!B31 -> Matt Kaster | C28: =IF('I:\[POINTS NQS  2011.XLS]Outlaw'!C31=0," ",'I:\[POINTS NQS  2011.XLS]Outlaw'!C31) -> MVP | D28: ='I:\[POINTS NQS  2011.XLS]Outlaw'!D31 -> 11-332 | E28: =IF('I:\[POINTS NQS  2011.XLS]Outlaw'!E31=0," ",'I:\[POINTS NQS  2011.XLS]Outlaw'!E31) -> The Freak | F28: ='I:\[POINTS NQS  2011.XLS]Outlaw'!Z31 -> 85 | H28: ='I:\[POINTS NQS  2011.XLS]Stock Altered'!A30 -> 25 | I28: ='I:\[POINTS NQS  2011.XLS]Stock Altered'!B30 -> John Elrod | J28: =IF('I:\[POINTS NQS  2011.XLS]Stock Altered'!C30=0,"",'I:\[POINTS NQS  2011.XLS]Stock Altered'!C30) -> TV | K28: ='I:\[POINTS NQS  2011.XLS]Stock Altered'!D30 -> 11-020 | L28: =IF('I:\[POINTS NQS  2011.XLS]Stock Altered'!E30=0,"",'I:\[POINTS NQS  2011.XLS]Stock Altered'!E30) -> Bad Habit | M28: ='I:\[POINTS NQS  2011.XLS]Stock Altered'!Z30 -> 101
A29: ='I:\[POINTS NQS  2011.XLS]Outlaw'!A32 -> 26 | B29: ='I:\[POINTS NQS  2011.XLS]Outlaw'!B32 -> Tim Shaw | C29: =IF('I:\[POINTS NQS  2011.XLS]Outlaw'!C32=0," ",'I:\[POINTS NQS  2011.XLS]Outlaw'!C32) -> TV | D29: ='I:\[POINTS NQS  2011.XLS]Outlaw'!D32 -> 11-454 | E29: =IF('I:\[POINTS NQS  2011.XLS]Outlaw'!E32=0," ",'I:\[POINTS NQS  2011.XLS]Outlaw'!E32) -> Heavy Hauler | F29: ='I:\[POINTS NQS  2011.XLS]Outlaw'!Z32 -> 85 | H29: ='I:\[POINTS NQS  2011.XLS]Stock Altered'!A31 -> 26 | I29: ='I:\[POINTS NQS  2011.XLS]Stock Altered'!B31 -> Lonnie Lewis | J29: =IF('I:\[POINTS NQS  2011.XLS]Stock Altered'!C31=0,"",'I:\[POINTS NQS  2011.XLS]Stock Altered'!C31) -> TV | K29: ='I:\[POINTS NQS  2011.XLS]Stock Altered'!D31 -> 11-024 | L29: =IF('I:\[POINTS NQS  2011.XLS]Stock Altered'!E31=0,"",'I:\[POINTS NQS  2011.XLS]Stock Altered'!E31) -> Deuces Wild | M29: ='I:\[POINTS NQS  2011.XLS]Stock Altered'!Z31 -> 105
A30: ='I:\[POINTS NQS  2011.XLS]Outlaw'!A33 -> 27 | B30: ='I:\[POINTS NQS  2011.XLS]Outlaw'!B33 -> Willian Hart | C30: =IF('I:\[POINTS NQS  2011.XLS]Outlaw'!C33=0," ",'I:\[POINTS NQS  2011.XLS]Outlaw'!C33) -> JRS | D30: ='I:\[POINTS NQS  2011.XLS]Outlaw'!D33 -> 11-470 | E30: =IF('I:\[POINTS NQS  2011.XLS]Outlaw'!E33=0," ",'I:\[POINTS NQS  2011.XLS]Outlaw'!E33) -> Marie LaVeau | F30: ='I:\[POINTS NQS  2011.XLS]Outlaw'!Z33 -> 86 | H30: ='I:\[POINTS NQS  2011.XLS]Stock Altered'!A32 -> 27 | I30: ='I:\[POINTS NQS  2011.XLS]Stock Altered'!B32 -> William Hart | J30: =IF('I:\[POINTS NQS  2011.XLS]Stock Altered'!C32=0,"",'I:\[POINTS NQS  2011.XLS]Stock Altered'!C32) -> JRS | K30: ='I:\[POINTS NQS  2011.XLS]Stock Altered'!D32 -> 11-470 | L30: =IF('I:\[POINTS NQS  2011.XLS]Stock Altered'!E32=0,"",'I:\[POINTS NQS  2011.XLS]Stock Altered'!E32) -> Marie LaVeau | M30: ='I:\[POINTS NQS  2011.XLS]Stock Altered'!Z32 -> 105
A31: ='I:\[POINTS NQS  2011.XLS]Outlaw'!A34 -> 28 | B31: ='I:\[POINTS NQS  2011.XLS]Outlaw'!B34 -> Roger Davis | C31: =IF('I:\[POINTS NQS  2011.XLS]Outlaw'!C34=0," ",'I:\[POINTS NQS  2011.XLS]Outlaw'!C34) -> JRS | D31: ='I:\[POINTS NQS  2011.XLS]Outlaw'!D34 -> 11-068 | E31: =IF('I:\[POINTS NQS  2011.XLS]Outlaw'!E34=0," ",'I:\[POINTS NQS  2011.XLS]Outlaw'!E34) -> Dusty Lady | F31: ='I:\[POINTS NQS  2011.XLS]Outlaw'!Z34 -> 87 | H31: ='I:\[POINTS NQS  2011.XLS]Stock Altered'!A33 -> 28 | I31: ='I:\[POINTS NQS  2011.XLS]Stock Altered'!B33 -> Ron Hodge | J31: =IF('I:\[POINTS NQS  2011.XLS]Stock Altered'!C33=0,"",'I:\[POINTS NQS  2011.XLS]Stock Altered'!C33) -> TV | K31: ='I:\[POINTS NQS  2011.XLS]Stock Altered'!D33 -> 11-071 | L31: =IF('I:\[POINTS NQS  2011.XLS]Stock Altered'!E33=0,"",'I:\[POINTS NQS  2011.XLS]Stock Altered'!E33) -> Take-N-Names | M31: ='I:\[POINTS NQS  2011.XLS]Stock Altered'!Z33 -> 107
A32: ='I:\[POINTS NQS  2011.XLS]Outlaw'!A35 -> 29 | B32: ='I:\[POINTS NQS  2011.XLS]Outlaw'!B35 -> Randy Demers | C32: =IF('I:\[POINTS NQS  2011.XLS]Outlaw'!C35=0," ",'I:\[POINTS NQS  2011.XLS]Outlaw'!C35) -> NP | D32: ='I:\[POINTS NQS  2011.XLS]Outlaw'!D35 -> 11-084 | E32: =IF('I:\[POINTS NQS  2011.XLS]Outlaw'!E35=0," ",'I:\[POINTS NQS  2011.XLS]Outlaw'!E35) -> Bounty Hunter | F32: ='I:\[POINTS NQS  2011.XLS]Outlaw'!Z35 -> 92 | H32: ='I:\[POINTS NQS  2011.XLS]Stock Altered'!A34 -> 29 | I32: ='I:\[POINTS NQS  2011.XLS]Stock Altered'!B34 -> Cody Costa | J32: =IF('I:\[POINTS NQS  2011.XLS]Stock Altered'!C34=0,"",'I:\[POINTS NQS  2011.XLS]Stock Altered'!C34) -> NP | K32: ='I:\[POINTS NQS  2011.XLS]Stock Altered'!D34 -> 11-135 | L32: =IF('I:\[POINTS NQS  2011.XLS]Stock Altered'!E34=0,"",'I:\[POINTS NQS  2011.XLS]Stock Altered'!E34) -> Wild Child | M32: ='I:\[POINTS NQS  2011.XLS]Stock Altered'!Z34 -> 109
A33: ='I:\[POINTS NQS  2011.XLS]Outlaw'!A36 -> 30 | B33: ='I:\[POINTS NQS  2011.XLS]Outlaw'!B36 -> Doug Seaman | C33: =IF('I:\[POINTS NQS  2011.XLS]Outlaw'!C36=0," ",'I:\[POINTS NQS  2011.XLS]Outlaw'!C36) -> BJ | D33: ='I:\[POINTS NQS  2011.XLS]Outlaw'!D36 -> 11-192 | E33: =IF('I:\[POINTS NQS  2011.XLS]Outlaw'!E36=0," ",'I:\[POINTS NQS  2011.XLS]Outlaw'!E36) -> Massey Ferguson | F33: ='I:\[POINTS NQS  2011.XLS]Outlaw'!Z36 -> 92 | H33: ='I:\[POINTS NQS  2011.XLS]Stock Altered'!A35 -> 30 | I33: ='I:\[POINTS NQS  2011.XLS]Stock Altered'!B35 -> Dave Washburn | J33: =IF('I:\[POINTS NQS  2011.XLS]Stock Altered'!C35=0,"",'I:\[POINTS NQS  2011.XLS]Stock Altered'!C35) -> BJ | K33: ='I:\[POINTS NQS  2011.XLS]Stock Altered'!D35 -> 11-156 | L33: =IF('I:\[POINTS NQS  2011.XLS]Stock Altered'!E35=0,"",'I:\[POINTS NQS  2011.XLS]Stock Altered'!E35) -> Last Minute | M33: ='I:\[POINTS NQS  2011.XLS]Stock Altered'!Z35 -> 110
A34: ='I:\[POINTS NQS  2011.XLS]Outlaw'!A37 -> 31 | B34: ='I:\[POINTS NQS  2011.XLS]Outlaw'!B37 -> Danny Garmin | C34: =IF('I:\[POINTS NQS  2011.XLS]Outlaw'!C37=0," ",'I:\[POINTS NQS  2011.XLS]Outlaw'!C37) -> JRS | D34: ='I:\[POINTS NQS  2011.XLS]Outlaw'!D37 -> 11-391 | E34: =IF('I:\[POINTS NQS  2011.XLS]Outlaw'!E37=0," ",'I:\[POINTS NQS  2011.XLS]Outlaw'!E37) ->  | F34: ='I:\[POINTS NQS  2011.XLS]Outlaw'!Z37 -> 94 | H34: ='I:\[POINTS NQS  2011.XLS]Stock Altered'!A36 -> 31 | I34: ='I:\[POINTS NQS  2011.XLS]Stock Altered'!B36 -> Danny Garman | J34: =IF('I:\[POINTS NQS  2011.XLS]Stock Altered'!C36=0,"",'I:\[POINTS NQS  2011.XLS]Stock Altered'!C36) -> JRS | K34: ='I:\[POINTS NQS  2011.XLS]Stock Altered'!D36 -> 11-391 | L34: =IF('I:\[POINTS NQS  2011.XLS]Stock Altered'!E36=0,"",'I:\[POINTS NQS  2011.XLS]Stock Altered'!E36) -> Jag Master | M34: ='I:\[POINTS NQS  2011.XLS]Stock Altered'!Z36 -> 111
A35: ='I:\[POINTS NQS  2011.XLS]Outlaw'!A38 -> 32 | B35: ='I:\[POINTS NQS  2011.XLS]Outlaw'!B38 -> Lee Dewald | C35: =IF('I:\[POINTS NQS  2011.XLS]Outlaw'!C38=0," ",'I:\[POINTS NQS  2011.XLS]Outlaw'!C38) -> NP | D35: ='I:\[POINTS NQS  2011.XLS]Outlaw'!D38 -> 11-465 | E35: =IF('I:\[POINTS NQS  2011.XLS]Outlaw'!E38=0," ",'I:\[POINTS NQS  2011.XLS]Outlaw'!E38) -> Barnyard Bandit | F35: ='I:\[POINTS NQS  2011.XLS]Outlaw'!Z38 -> 94 | H35: ='I:\[POINTS NQS  2011.XLS]Stock Altered'!A37 -> 32 | I35: ='I:\[POINTS NQS  2011.XLS]Stock Altered'!B37 -> John Cress | J35: =IF('I:\[POINTS NQS  2011.XLS]Stock Altered'!C37=0,"",'I:\[POINTS NQS  2011.XLS]Stock Altered'!C37) -> VM | K35: ='I:\[POINTS NQS  2011.XLS]Stock Altered'!D37 -> 11-308 | L35: =IF('I:\[POINTS NQS  2011.XLS]Stock Altered'!E37=0,"",'I:\[POINTS NQS  2011.XLS]Stock Altered'!E37) -> HY Strung | M35: ='I:\[POINTS NQS  2011.XLS]Stock Altered'!Z37 -> 115
A36: ='I:\[POINTS NQS  2011.XLS]Outlaw'!A39 -> 33 | B36: ='I:\[POINTS NQS  2011.XLS]Outlaw'!B39 -> Nick Ferguson | C36: =IF('I:\[POINTS NQS  2011.XLS]Outlaw'!C39=0," ",'I:\[POINTS NQS  2011.XLS]Outlaw'!C39) -> MVP | D36: ='I:\[POINTS NQS  2011.XLS]Outlaw'!D39 -> 11-100 | E36: =IF('I:\[POINTS NQS  2011.XLS]Outlaw'!E39=0," ",'I:\[POINTS NQS  2011.XLS]Outlaw'!E39) -> Rasin Cane | F36: ='I:\[POINTS NQS  2011.XLS]Outlaw'!Z39 -> 95 | H36: ='I:\[POINTS NQS  2011.XLS]Stock Altered'!A38 -> 33 | I36: ='I:\[POINTS NQS  2011.XLS]Stock Altered'!B38 -> Rick James | J36: =IF('I:\[POINTS NQS  2011.XLS]Stock Altered'!C38=0,"",'I:\[POINTS NQS  2011.XLS]Stock Altered'!C38) -> BJ | K36: ='I:\[POINTS NQS  2011.XLS]Stock Altered'!D38 -> 11-427 | L36: =IF('I:\[POINTS NQS  2011.XLS]Stock Altered'!E38=0,"",'I:\[POINTS NQS  2011.XLS]Stock Altered'!E38) -> James Gang III | M36: ='I:\[POINTS NQS  2011.XLS]Stock Altered'!Z38 -> 117
A37: ='I:\[POINTS NQS  2011.XLS]Outlaw'!A40 -> 34 | B37: ='I:\[POINTS NQS  2011.XLS]Outlaw'!B40 -> Gregory Vandervort | C37: =IF('I:\[POINTS NQS  2011.XLS]Outlaw'!C40=0," ",'I:\[POINTS NQS  2011.XLS]Outlaw'!C40) -> TV | D37: ='I:\[POINTS NQS  2011.XLS]Outlaw'!D40 -> 11-346 | E37: =IF('I:\[POINTS NQS  2011.XLS]Outlaw'!E40=0," ",'I:\[POINTS NQS  2011.XLS]Outlaw'!E40) ->  | F37: ='I:\[POINTS NQS  2011.XLS]Outlaw'!Z40 -> 95 | H37: ='I:\[POINTS NQS  2011.XLS]Stock Altered'!A39 -> 34 | I37: ='I:\[POINTS NQS  2011.XLS]Stock Altered'!B39 -> Mike Hall | J37: =IF('I:\[POINTS NQS  2011.XLS]Stock Altered'!C39=0,"",'I:\[POINTS NQS  2011.XLS]Stock Altered'!C39) -> RPM | K37: ='I:\[POINTS NQS  2011.XLS]Stock Altered'!D39 -> 11-248 | L37: =IF('I:\[POINTS NQS  2011.XLS]Stock Altered'!E39=0,"",'I:\[POINTS NQS  2011.XLS]Stock Altered'!E39) -> Lethal Injection | M37: ='I:\[POINTS NQS  2011.XLS]Stock Altered'!Z39 -> 120
A38: ='I:\[POINTS NQS  2011.XLS]Outlaw'!A41 -> 35 | B38: ='I:\[POINTS NQS  2011.XLS]Outlaw'!B41 -> Gary Seaman | C38: =IF('I:\[POINTS NQS  2011.XLS]Outlaw'!C41=0," ",'I:\[POINTS NQS  2011.XLS]Outlaw'!C41) -> BJ | D38: ='I:\[POINTS NQS  2011.XLS]Outlaw'!D41 -> 11-191 | E38: =IF('I:\[POINTS NQS  2011.XLS]Outlaw'!E41=0," ",'I:\[POINTS NQS  2011.XLS]Outlaw'!E41) -> Framers Money | F38: ='I:\[POINTS NQS  2011.XLS]Outlaw'!Z41 -> 96 | H38: ='I:\[POINTS NQS  2011.XLS]Stock Altered'!A40 -> 35 | I38: ='I:\[POINTS NQS  2011.XLS]Stock Altered'!B40 -> Bob Jones SR | J38: =IF('I:\[POINTS NQS  2011.XLS]Stock Altered'!C40=0,"",'I:\[POINTS NQS  2011.XLS]Stock Altered'!C40) -> BJ | K38: ='I:\[POINTS NQS  2011.XLS]Stock Altered'!D40 -> 11-182 | L38: =IF('I:\[POINTS NQS  2011.XLS]Stock Altered'!E40=0,"",'I:\[POINTS NQS  2011.XLS]Stock Altered'!E40) -> Buck eye Binder | M38: ='I:\[POINTS NQS  2011.XLS]Stock Altered'!Z40 -> 124
A39: ='I:\[POINTS NQS  2011.XLS]Outlaw'!A42 -> 36 | B39: ='I:\[POINTS NQS  2011.XLS]Outlaw'!B42 -> Tim Rankin | C39: =IF('I:\[POINTS NQS  2011.XLS]Outlaw'!C42=0," ",'I:\[POINTS NQS  2011.XLS]Outlaw'!C42) -> Woods | D39: ='I:\[POINTS NQS  2011.XLS]Outlaw'!D42 -> 11-287 | E39: =IF('I:\[POINTS NQS  2011.XLS]Outlaw'!E42=0," ",'I:\[POINTS NQS  2011.XLS]Outlaw'!E42) -> Incognito | F39: ='I:\[POINTS NQS  2011.XLS]Outlaw'!Z42 -> 98 | H39: ='I:\[POINTS NQS  2011.XLS]Stock Altered'!A41 -> 36 | I39: ='I:\[POINTS NQS  2011.XLS]Stock Altered'!B41 -> Gina McGaha | J39: =IF('I:\[POINTS NQS  2011.XLS]Stock Altered'!C41=0,"",'I:\[POINTS NQS  2011.XLS]Stock Altered'!C41) -> JW | K39: ='I:\[POINTS NQS  2011.XLS]Stock Altered'!D41 -> 11-161 | L39: =IF('I:\[POINTS NQS  2011.XLS]Stock Altered'!E41=0,"",'I:\[POINTS NQS  2011.XLS]Stock Altered'!E41) -> Betty Stalker | M39: ='I:\[POINTS NQS  2011.XLS]Stock Altered'!Z41 -> 125
A40: ='I:\[POINTS NQS  2011.XLS]Outlaw'!A43 -> 37 | B40: ='I:\[POINTS NQS  2011.XLS]Outlaw'!B43 -> Bobby Feldkamp | C40: =IF('I:\[POINTS NQS  2011.XLS]Outlaw'!C43=0," ",'I:\[POINTS NQS  2011.XLS]Outlaw'!C43) -> Woods | D40: ='I:\[POINTS NQS  2011.XLS]Outlaw'!D43 -> 11-474 | E40: =IF('I:\[POINTS NQS  2011.XLS]Outlaw'!E43=0," ",'I:\[POINTS NQS  2011.XLS]Outlaw'!E43) -> Driftwood | F40: ='I:\[POINTS NQS  2011.XLS]Outlaw'!Z43 -> 98 | H40: ='I:\[POINTS NQS  2011.XLS]Stock Altered'!A42 -> 37 | I40: ='I:\[POINTS NQS  2011.XLS]Stock Altered'!B42 -> Bill Elrod | J40: =IF('I:\[POINTS NQS  2011.XLS]Stock Altered'!C42=0,"",'I:\[POINTS NQS  2011.XLS]Stock Altered'!C42) -> TV | K40: ='I:\[POINTS NQS  2011.XLS]Stock Altered'!D42 -> 11-021 | L40: =IF('I:\[POINTS NQS  2011.XLS]Stock Altered'!E42=0,"",'I:\[POINTS NQS  2011.XLS]Stock Altered'!E42) -> Pa Paw Toy | M40: ='I:\[POINTS NQS  2011.XLS]Stock Altered'!Z42 -> 131
A41: ='I:\[POINTS NQS  2011.XLS]Outlaw'!A44 -> 38 | B41: ='I:\[POINTS NQS  2011.XLS]Outlaw'!B44 -> Bob Jones SR | C41: =IF('I:\[POINTS NQS  2011.XLS]Outlaw'!C44=0," ",'I:\[POINTS NQS  2011.XLS]Outlaw'!C44) -> BJ | D41: ='I:\[POINTS NQS  2011.XLS]Outlaw'!D44 -> 11-182 | E41: =IF('I:\[POINTS NQS  2011.XLS]Outlaw'!E44=0," ",'I:\[POINTS NQS  2011.XLS]Outlaw'!E44) -> Buckeye Binder | F41: ='I:\[POINTS NQS  2011.XLS]Outlaw'!Z44 -> 99 | H41: ='I:\[POINTS NQS  2011.XLS]Stock Altered'!A43 -> 38 | I41: ='I:\[POINTS NQS  2011.XLS]Stock Altered'!B43 -> Mike McGaha | J41: =IF('I:\[POINTS NQS  2011.XLS]Stock Altered'!C43=0,"",'I:\[POINTS NQS  2011.XLS]Stock Altered'!C43) -> JW | K41: ='I:\[POINTS NQS  2011.XLS]Stock Altered'!D43 -> 11-288 | L41: =IF('I:\[POINTS NQS  2011.XLS]Stock Altered'!E43=0,"",'I:\[POINTS NQS  2011.XLS]Stock Altered'!E43) -> Company Time | M41: ='I:\[POINTS NQS  2011.XLS]Stock Altered'!Z43 -> 136
A42: ='I:\[POINTS NQS  2011.XLS]Outlaw'!A45 -> 39 | B42: ='I:\[POINTS NQS  2011.XLS]Outlaw'!B45 -> Kenneth Smith | C42: =IF('I:\[POINTS NQS  2011.XLS]Outlaw'!C45=0," ",'I:\[POINTS NQS  2011.XLS]Outlaw'!C45) -> JRS | D42: ='I:\[POINTS NQS  2011.XLS]Outlaw'!D45 -> 11-125 | E42: =IF('I:\[POINTS NQS  2011.XLS]Outlaw'!E45=0," ",'I:\[POINTS NQS  2011.XLS]Outlaw'!E45) -> Sidewinder | F42: ='I:\[POINTS NQS  2011.XLS]Outlaw'!Z45 -> 103 | H42: ='I:\[POINTS NQS  2011.XLS]Stock Altered'!A44 -> 39 | I42: ='I:\[POINTS NQS  2011.XLS]Stock Altered'!B44 -> Dave Shulko | J42: =IF('I:\[POINTS NQS  2011.XLS]Stock Altered'!C44=0,"",'I:\[POINTS NQS  2011.XLS]Stock Altered'!C44) ->  | K42: ='I:\[POINTS NQS  2011.XLS]Stock Altered'!D44 -> 0 | L42: =IF('I:\[POINTS NQS  2011.XLS]Stock Altered'!E44=0,"",'I:\[POINTS NQS  2011.XLS]Stock Altered'!E44) ->  | M42: ='I:\[POINTS NQS  2011.XLS]Stock Altered'!Z44 -> 138
A43: ='I:\[POINTS NQS  2011.XLS]Outlaw'!A46 -> 40 | B43: ='I:\[POINTS NQS  2011.XLS]Outlaw'!B46 -> Rick James | C43: =IF('I:\[POINTS NQS  2011.XLS]Outlaw'!C46=0," ",'I:\[POINTS NQS  2011.XLS]Outlaw'!C46) -> BJ | D43: ='I:\[POINTS NQS  2011.XLS]Outlaw'!D46 -> 11-427 | E43: =IF('I:\[POINTS NQS  2011.XLS]Outlaw'!E46=0," ",'I:\[POINTS NQS  2011.XLS]Outlaw'!E46) -> James Gang lll | F43: ='I:\[POINTS NQS  2011.XLS]Outlaw'!Z46 -> 106 | H43: ='I:\[POINTS NQS  2011.XLS]Stock Altered'!A45 -> 40 | I43: ='I:\[POINTS NQS  2011.XLS]Stock Altered'!B45 -> Gary Frank | J43: =IF('I:\[POINTS NQS  2011.XLS]Stock Altered'!C45=0,"",'I:\[POINTS NQS  2011.XLS]Stock Altered'!C45) -> TV | K43: ='I:\[POINTS NQS  2011.XLS]Stock Altered'!D45 -> 11-233 | L43: =IF('I:\[POINTS NQS  2011.XLS]Stock Altered'!E45=0,"",'I:\[POINTS NQS  2011.XLS]Stock Altered'!E45) -> Katies Toy | M43: ='I:\[POINTS NQS  2011.XLS]Stock Altered'!Z45 -> 140
A44: ='I:\[POINTS NQS  2011.XLS]Outlaw'!A47 -> 41 | B44: ='I:\[POINTS NQS  2011.XLS]Outlaw'!B47 -> Tony Heifner | C44: =IF('I:\[POINTS NQS  2011.XLS]Outlaw'!C47=0," ",'I:\[POINTS NQS  2011.XLS]Outlaw'!C47) -> TH | D44: ='I:\[POINTS NQS  2011.XLS]Outlaw'!D47 -> 11-116 | E44: =IF('I:\[POINTS NQS  2011.XLS]Outlaw'!E47=0," ",'I:\[POINTS NQS  2011.XLS]Outlaw'!E47) -> Heartbeat | F44: ='I:\[POINTS NQS  2011.XLS]Outlaw'!Z47 -> 109 | H44: ='I:\[POINTS NQS  2011.XLS]Stock Altered'!A46 -> 41 | I44: ='I:\[POINTS NQS  2011.XLS]Stock Altered'!B46 -> Trent Evans | J44: =IF('I:\[POINTS NQS  2011.XLS]Stock Altered'!C46=0,"",'I:\[POINTS NQS  2011.XLS]Stock Altered'!C46) -> NP | K44: ='I:\[POINTS NQS  2011.XLS]Stock Altered'!D46 -> 11-357 | L44: =IF('I:\[POINTS NQS  2011.XLS]Stock Altered'!E46=0,"",'I:\[POINTS NQS  2011.XLS]Stock Altered'!E46) -> Bad out of Boyd | M44: ='I:\[POINTS NQS  2011.XLS]Stock Altered'!Z46 -> 140
A45: ='I:\[POINTS NQS  2011.XLS]Outlaw'!A48 -> 42 | B45: ='I:\[POINTS NQS  2011.XLS]Outlaw'!B48 -> Greg Watson | C45: =IF('I:\[POINTS NQS  2011.XLS]Outlaw'!C48=0," ",'I:\[POINTS NQS  2011.XLS]Outlaw'!C48) -> NP | D45: ='I:\[POINTS NQS  2011.XLS]Outlaw'!D48 -> 11-327 | E45: =IF('I:\[POINTS NQS  2011.XLS]Outlaw'!E48=0," ",'I:\[POINTS NQS  2011.XLS]Outlaw'!E48) -> Road Warrior | F45: ='I:\[POINTS NQS  2011.XLS]Outlaw'!Z48 -> 109 | H45: ='I:\[POINTS NQS  2011.XLS]Stock Altered'!A47 -> 42 | I45: ='I:\[POINTS NQS  2011.XLS]Stock Altered'!B47 -> Ron FeldKamp | J45: =IF('I:\[POINTS NQS  2011.XLS]Stock Altered'!C47=0,"",'I:\[POINTS NQS  2011.XLS]Stock Altered'!C47) -> Woods | K45: ='I:\[POINTS NQS  2011.XLS]Stock Altered'!D47 -> 11-143 | L45: =IF('I:\[POINTS NQS  2011.XLS]Stock Altered'!E47=0,"",'I:\[POINTS NQS  2011.XLS]Stock Altered'!E47) -> Keychain | M45: ='I:\[POINTS NQS  2011.XLS]Stock Altered'!Z47 -> 142
A46: ='I:\[POINTS NQS  2011.XLS]Outlaw'!A49 -> 43 | B46: ='I:\[POINTS NQS  2011.XLS]Outlaw'!B49 -> Ed Jones | C46: =IF('I:\[POINTS NQS  2011.XLS]Outlaw'!C49=0," ",'I:\[POINTS NQS  2011.XLS]Outlaw'!C49) ->  | D46: ='I:\[POINTS NQS  2011.XLS]Outlaw'!D49 -> 11-271 | E46: =IF('I:\[POINTS NQS  2011.XLS]Outlaw'!E49=0," ",'I:\[POINTS NQS  2011.XLS]Outlaw'!E49) ->  | F46: ='I:\[POINTS NQS  2011.XLS]Outlaw'!Z49 -> 110 | H46: ='I:\[POINTS NQS  2011.XLS]Stock Altered'!A48 -> 43 | I46: ='I:\[POINTS NQS  2011.XLS]Stock Altered'!B48 -> Matt Rader | J46: =IF('I:\[POINTS NQS  2011.XLS]Stock Altered'!C48=0,"",'I:\[POINTS NQS  2011.XLS]Stock Altered'!C48) -> RPM | K46: ='I:\[POINTS NQS  2011.XLS]Stock Altered'!D48 -> 11-259 | L46: =IF('I:\[POINTS NQS  2011.XLS]Stock Altered'!E48=0,"",'I:\[POINTS NQS  2011.XLS]Stock Altered'!E48) -> Lethal Response | M46: ='I:\[POINTS NQS  2011.XLS]Stock Altered'!Z48 -> 143
A47: ='I:\[POINTS NQS  2011.XLS]Outlaw'!A50 -> 44 | B47: ='I:\[POINTS NQS  2011.XLS]Outlaw'!B50 -> Mike Yeley | C47: =IF('I:\[POINTS NQS  2011.XLS]Outlaw'!C50=0," ",'I:\[POINTS NQS  2011.XLS]Outlaw'!C50) -> JW | D47: ='I:\[POINTS NQS  2011.XLS]Outlaw'!D50 -> 11-055 | E47: =IF('I:\[POINTS NQS  2011.XLS]Outlaw'!E50=0," ",'I:\[POINTS NQS  2011.XLS]Outlaw'!E50) -> Papas Ride | F47: ='I:\[POINTS NQS  2011.XLS]Outlaw'!Z50 -> 118 | H47: ='I:\[POINTS NQS  2011.XLS]Stock Altered'!A49 -> 44 | I47: ='I:\[POINTS NQS  2011.XLS]Stock Altered'!B49 -> Keith Frueh | J47: =IF('I:\[POINTS NQS  2011.XLS]Stock Altered'!C49=0,"",'I:\[POINTS NQS  2011.XLS]Stock Altered'!C49) -> JRS | K47: ='I:\[POINTS NQS  2011.XLS]Stock Altered'!D49 -> 11-086 | L47: =IF('I:\[POINTS NQS  2011.XLS]Stock Altered'!E49=0,"",'I:\[POINTS NQS  2011.XLS]Stock Altered'!E49) -> Fearless | M47: ='I:\[POINTS NQS  2011.XLS]Stock Altered'!Z49 -> 151
A48: ='I:\[POINTS NQS  2011.XLS]Outlaw'!A51 -> 45 | B48: ='I:\[POINTS NQS  2011.XLS]Outlaw'!B51 -> Donnie Herring | C48: =IF('I:\[POINTS NQS  2011.XLS]Outlaw'!C51=0," ",'I:\[POINTS NQS  2011.XLS]Outlaw'!C51) -> TV | D48: ='I:\[POINTS NQS  2011.XLS]Outlaw'!D51 -> 11-331 | E48: =IF('I:\[POINTS NQS  2011.XLS]Outlaw'!E51=0," ",'I:\[POINTS NQS  2011.XLS]Outlaw'!E51) -> Pasttime | F48: ='I:\[POINTS NQS  2011.XLS]Outlaw'!Z51 -> 119 | H48: ='I:\[POINTS NQS  2011.XLS]Stock Altered'!A50 -> 45 | I48: ='I:\[POINTS NQS  2011.XLS]Stock Altered'!B50 -> Kenneth Smith | J48: =IF('I:\[POINTS NQS  2011.XLS]Stock Altered'!C50=0,"",'I:\[POINTS NQS  2011.XLS]Stock Altered'!C50) -> JRS | K48: ='I:\[POINTS NQS  2011.XLS]Stock Altered'!D50 -> 11-125 | L48: =IF('I:\[POINTS NQS  2011.XLS]Stock Altered'!E50=0,"",'I:\[POINTS NQS  2011.XLS]Stock Altered'!E50) -> Sidewinder | M48: ='I:\[POINTS NQS  2011.XLS]Stock Altered'!Z50 -> 152
A49: ='I:\[POINTS NQS  2011.XLS]Outlaw'!A52 -> 46 | B49: ='I:\[POINTS NQS  2011.XLS]Outlaw'!B52 -> Jim Morganstern | C49: =IF('I:\[POINTS NQS  2011.XLS]Outlaw'!C52=0," ",'I:\[POINTS NQS  2011.XLS]Outlaw'!C52) ->  | D49: ='I:\[POINTS NQS  2011.XLS]Outlaw'!D52 -> 0 | E49: =IF('I:\[POINTS NQS  2011.XLS]Outlaw'!E52=0," ",'I:\[POINTS NQS  2011.XLS]Outlaw'!E52) ->  | F49: ='I:\[POINTS NQS  2011.XLS]Outlaw'!Z52 -> 119 | H49: ='I:\[POINTS NQS  2011.XLS]Stock Altered'!A51 -> 46 | I49: ='I:\[POINTS NQS  2011.XLS]Stock Altered'!B51 -> Roger McKinney | J49: =IF('I:\[POINTS NQS  2011.XLS]Stock Altered'!C51=0,"",'I:\[POINTS NQS  2011.XLS]Stock Altered'!C51) -> JRS | K49: ='I:\[POINTS NQS  2011.XLS]Stock Altered'!D51 -> 11-083 | L49: =IF('I:\[POINTS NQS  2011.XLS]Stock Altered'!E51=0,"",'I:\[POINTS NQS  2011.XLS]Stock Altered'!E51) -> Blue Thunder | M49: ='I:\[POINTS NQS  2011.XLS]Stock Altered'!Z51 -> 154
A50: ='I:\[POINTS NQS  2011.XLS]Outlaw'!A53 -> 47 | B50: ='I:\[POINTS NQS  2011.XLS]Outlaw'!B53 -> Robin Cooper | C50: =IF('I:\[POINTS NQS  2011.XLS]Outlaw'!C53=0," ",'I:\[POINTS NQS  2011.XLS]Outlaw'!C53) ->  | D50: ='I:\[POINTS NQS  2011.XLS]Outlaw'!D53 -> 11-073 | E50: =IF('I:\[POINTS NQS  2011.XLS]Outlaw'!E53=0," ",'I:\[POINTS NQS  2011.XLS]Outlaw'!E53) ->  | F50: ='I:\[POINTS NQS  2011.XLS]Outlaw'!Z53 -> 121 | H50: ='I:\[POINTS NQS  2011.XLS]Stock Altered'!A52 -> 47 | I50: ='I:\[POINTS NQS  2011.XLS]Stock Altered'!B52 -> Ed Kerner | J50: =IF('I:\[POINTS NQS  2011.XLS]Stock Altered'!C52=0,"",'I:\[POINTS NQS  2011.XLS]Stock Altered'!C52) -> NP | K50: ='I:\[POINTS NQS  2011.XLS]Stock Altered'!D52 -> 11-303 | L50: =IF('I:\[POINTS NQS  2011.XLS]Stock Altered'!E52=0,"",'I:\[POINTS NQS  2011.XLS]Stock Altered'!E52) -> Along for the Ride | M50: ='I:\[POINTS NQS  2011.XLS]Stock Altered'!Z52 -> 160
A51: ='I:\[POINTS NQS  2011.XLS]Outlaw'!A54 -> 48 | B51: ='I:\[POINTS NQS  2011.XLS]Outlaw'!B54 -> Cody Costa | C51: =IF('I:\[POINTS NQS  2011.XLS]Outlaw'!C54=0," ",'I:\[POINTS NQS  2011.XLS]Outlaw'!C54) -> NP | D51: ='I:\[POINTS NQS  2011.XLS]Outlaw'!D54 -> 11-135 | E51: =IF('I:\[POINTS NQS  2011.XLS]Outlaw'!E54=0," ",'I:\[POINTS NQS  2011.XLS]Outlaw'!E54) -> Wild Child | F51: ='I:\[POINTS NQS  2011.XLS]Outlaw'!Z54 -> 128 | H51: ='I:\[POINTS NQS  2011.XLS]Stock Altered'!A53 -> 48 | I51: ='I:\[POINTS NQS  2011.XLS]Stock Altered'!B53 -> Shane Hadley | J51: =IF('I:\[POINTS NQS  2011.XLS]Stock Altered'!C53=0,"",'I:\[POINTS NQS  2011.XLS]Stock Altered'!C53) -> LR | K51: ='I:\[POINTS NQS  2011.XLS]Stock Altered'!D53 -> 11-442 | L51: =IF('I:\[POINTS NQS  2011.XLS]Stock Altered'!E53=0,"",'I:\[POINTS NQS  2011.XLS]Stock Altered'!E53) -> Foot Finder | M51: ='I:\[POINTS NQS  2011.XLS]Stock Altered'!Z53 -> 165
A52: ='I:\[POINTS NQS  2011.XLS]Outlaw'!A55 -> 49 | B52: ='I:\[POINTS NQS  2011.XLS]Outlaw'!B55 -> Tod Hinkle | C52: =IF('I:\[POINTS NQS  2011.XLS]Outlaw'!C55=0," ",'I:\[POINTS NQS  2011.XLS]Outlaw'!C55) -> JW | D52: ='I:\[POINTS NQS  2011.XLS]Outlaw'!D55 -> 11-370 | E52: =IF('I:\[POINTS NQS  2011.XLS]Outlaw'!E55=0," ",'I:\[POINTS NQS  2011.XLS]Outlaw'!E55) -> Disturbed | F52: ='I:\[POINTS NQS  2011.XLS]Outlaw'!Z55 -> 128 | H52: ='I:\[POINTS NQS  2011.XLS]Stock Altered'!A54 -> 49 | I52: ='I:\[POINTS NQS  2011.XLS]Stock Altered'!B54 -> Lee Dewald | J52: =IF('I:\[POINTS NQS  2011.XLS]Stock Altered'!C54=0,"",'I:\[POINTS NQS  2011.XLS]Stock Altered'!C54) -> NP | K52: ='I:\[POINTS NQS  2011.XLS]Stock Altered'!D54 -> 11-465 | L52: =IF('I:\[POINTS NQS  2011.XLS]Stock Altered'!E54=0,"",'I:\[POINTS NQS  2011.XLS]Stock Altered'!E54) -> Barnyard Bandit | M52: ='I:\[POINTS NQS  2011.XLS]Stock Altered'!Z54 -> 168
A53: ='I:\[POINTS NQS  2011.XLS]Outlaw'!A56 -> 50 | B53: ='I:\[POINTS NQS  2011.XLS]Outlaw'!B56 -> Doug Rood | C53: =IF('I:\[POINTS NQS  2011.XLS]Outlaw'!C56=0," ",'I:\[POINTS NQS  2011.XLS]Outlaw'!C56) -> JRS | D53: ='I:\[POINTS NQS  2011.XLS]Outlaw'!D56 -> 11-354 | E53: =IF('I:\[POINTS NQS  2011.XLS]Outlaw'!E56=0," ",'I:\[POINTS NQS  2011.XLS]Outlaw'!E56) -> Blue Dawg | F53: ='I:\[POINTS NQS  2011.XLS]Outlaw'!Z56 -> 134 | H53: ='I:\[POINTS NQS  2011.XLS]Stock Altered'!A55 -> 50 | I53: ='I:\[POINTS NQS  2011.XLS]Stock Altered'!B55 -> Greg Watson | J53: =IF('I:\[POINTS NQS  2011.XLS]Stock Altered'!C55=0,"",'I:\[POINTS NQS  2011.XLS]Stock Altered'!C55) -> NP | K53: ='I:\[POINTS NQS  2011.XLS]Stock Altered'!D55 -> 11-327 | L53: =IF('I:\[POINTS NQS  2011.XLS]Stock Altered'!E55=0,"",'I:\[POINTS NQS  2011.XLS]Stock Altered'!E55) -> Road Warrior | M53: ='I:\[POINTS NQS  2011.XLS]Stock Altered'!Z55 -> 169
A54: ='I:\[POINTS NQS  2011.XLS]Outlaw'!A57 -> 51 | B54: ='I:\[POINTS NQS  2011.XLS]Outlaw'!B57 -> Chris Gegg | C54: =IF('I:\[POINTS NQS  2011.XLS]Outlaw'!C57=0," ",'I:\[POINTS NQS  2011.XLS]Outlaw'!C57) ->  | D54: ='I:\[POINTS NQS  2011.XLS]Outlaw'!D57 -> 11-410 | E54: =IF('I:\[POINTS NQS  2011.XLS]Outlaw'!E57=0," ",'I:\[POINTS NQS  2011.XLS]Outlaw'!E57) -> Insane | F54: ='I:\[POINTS NQS  2011.XLS]Outlaw'!Z57 -> 135 | H54: ='I:\[POINTS NQS  2011.XLS]Stock Altered'!A56 -> 51 | I54: ='I:\[POINTS NQS  2011.XLS]Stock Altered'!B56 -> Jared Riddle | J54: =IF('I:\[POINTS NQS  2011.XLS]Stock Altered'!C56=0,"",'I:\[POINTS NQS  2011.XLS]Stock Altered'!C56) ->  | K54: ='I:\[POINTS NQS  2011.XLS]Stock Altered'!D56 -> 11-471 | L54: =IF('I:\[POINTS NQS  2011.XLS]Stock Altered'!E56=0,"",'I:\[POINTS NQS  2011.XLS]Stock Altered'!E56) -> Williemakit | M54: ='I:\[POINTS NQS  2011.XLS]Stock Altered'!Z56 -> 176
A55: ='I:\[POINTS NQS  2011.XLS]Outlaw'!A58 -> 52 | B55: ='I:\[POINTS NQS  2011.XLS]Outlaw'!B58 -> Jamie Lewis | C55: =IF('I:\[POINTS NQS  2011.XLS]Outlaw'!C58=0," ",'I:\[POINTS NQS  2011.XLS]Outlaw'!C58) -> TV | D55: ='I:\[POINTS NQS  2011.XLS]Outlaw'!D58 -> 11-019 | E55: =IF('I:\[POINTS NQS  2011.XLS]Outlaw'!E58=0," ",'I:\[POINTS NQS  2011.XLS]Outlaw'!E58) -> O-So-Orange | F55: ='I:\[POINTS NQS  2011.XLS]Outlaw'!Z58 -> 137 | H55: ='I:\[POINTS NQS  2011.XLS]Stock Altered'!A57 -> 52 | I55: ='I:\[POINTS NQS  2011.XLS]Stock Altered'!B57 -> Ron Finch | J55: =IF('I:\[POINTS NQS  2011.XLS]Stock Altered'!C57=0,"",'I:\[POINTS NQS  2011.XLS]Stock Altered'!C57) -> Woods | K55: ='I:\[POINTS NQS  2011.XLS]Stock Altered'!D57 -> 11-142 | L55: =IF('I:\[POINTS NQS  2011.XLS]Stock Altered'!E57=0,"",'I:\[POINTS NQS  2011.XLS]Stock Altered'!E57) -> Top Notch | M55: ='I:\[POINTS NQS  2011.XLS]Stock Altered'!Z57 -> 178
A56: ='I:\[POINTS NQS  2011.XLS]Outlaw'!A59 -> 53 | B56: ='I:\[POINTS NQS  2011.XLS]Outlaw'!B59 -> Tony Lewis | C56: =IF('I:\[POINTS NQS  2011.XLS]Outlaw'!C59=0," ",'I:\[POINTS NQS  2011.XLS]Outlaw'!C59) ->  | D56: ='I:\[POINTS NQS  2011.XLS]Outlaw'!D59 -> 11-345 | E56: =IF('I:\[POINTS NQS  2011.XLS]Outlaw'!E59=0," ",'I:\[POINTS NQS  2011.XLS]Outlaw'!E59) -> Plain Jane | F56: ='I:\[POINTS NQS  2011.XLS]Outlaw'!Z59 -> 137 | H56: ='I:\[POINTS NQS  2011.XLS]Stock Altered'!A58 -> 53 | I56: ='I:\[POINTS NQS  2011.XLS]Stock Altered'!B58 -> Lee Dewald | J56: =IF('I:\[POINTS NQS  2011.XLS]Stock Altered'!C58=0,"",'I:\[POINTS NQS  2011.XLS]Stock Altered'!C58) ->  | K56: ='I:\[POINTS NQS  2011.XLS]Stock Altered'!D58 -> 11-484 | L56: =IF('I:\[POINTS NQS  2011.XLS]Stock Altered'!E58=0,"",'I:\[POINTS NQS  2011.XLS]Stock Altered'!E58) -> Patience | M56: ='I:\[POINTS NQS  2011.XLS]Stock Altered'!Z58 -> 178
A57: ='I:\[POINTS NQS  2011.XLS]Outlaw'!A60 -> 54 | B57: ='I:\[POINTS NQS  2011.XLS]Outlaw'!B60 -> Roger Mckinney | C57: =IF('I:\[POINTS NQS  2011.XLS]Outlaw'!C60=0," ",'I:\[POINTS NQS  2011.XLS]Outlaw'!C60) -> JRS | D57: ='I:\[POINTS NQS  2011.XLS]Outlaw'!D60 -> 11-083 | E57: =IF('I:\[POINTS NQS  2011.XLS]Outlaw'!E60=0," ",'I:\[POINTS NQS  2011.XLS]Outlaw'!E60) -> Blue Thunder | F57: ='I:\[POINTS NQS  2011.XLS]Outlaw'!Z60 -> 139 | H57: ='I:\[POINTS NQS  2011.XLS]Stock Altered'!A59 -> 54 | I57: ='I:\[POINTS NQS  2011.XLS]Stock Altered'!B59 -> Steve Chrisman | J57: =IF('I:\[POINTS NQS  2011.XLS]Stock Altered'!C59=0,"",'I:\[POINTS NQS  2011.XLS]Stock Altered'!C59) -> Hackman | K57: ='I:\[POINTS NQS  2011.XLS]Stock Altered'!D59 -> 11-022 | L57: =IF('I:\[POINTS NQS  2011.XLS]Stock Altered'!E59=0,"",'I:\[POINTS NQS  2011.XLS]Stock Altered'!E59) -> Raz | M57: ='I:\[POINTS NQS  2011.XLS]Stock Altered'!Z59 -> 179
A58: ='I:\[POINTS NQS  2011.XLS]Outlaw'!A61 -> 55 | B58: ='I:\[POINTS NQS  2011.XLS]Outlaw'!B61 -> Gina McGaha | C58: =IF('I:\[POINTS NQS  2011.XLS]Outlaw'!C61=0," ",'I:\[POINTS NQS  2011.XLS]Outlaw'!C61) -> JW | D58: ='I:\[POINTS NQS  2011.XLS]Outlaw'!D61 -> 11-161 | E58: =IF('I:\[POINTS NQS  2011.XLS]Outlaw'!E61=0," ",'I:\[POINTS NQS  2011.XLS]Outlaw'!E61) -> Betty Stalker | F58: ='I:\[POINTS NQS  2011.XLS]Outlaw'!Z61 -> 141 | H58: ='I:\[POINTS NQS  2011.XLS]Stock Altered'!A60 -> 55 | I58: ='I:\[POINTS NQS  2011.XLS]Stock Altered'!B60 -> Bob Cooper | J58: =IF('I:\[POINTS NQS  2011.XLS]Stock Altered'!C60=0,"",'I:\[POINTS NQS  2011.XLS]Stock Altered'!C60) ->  | K58: ='I:\[POINTS NQS  2011.XLS]Stock Altered'!D60 -> 11-072 | L58: =IF('I:\[POINTS NQS  2011.XLS]Stock Altered'!E60=0,"",'I:\[POINTS NQS  2011.XLS]Stock Altered'!E60) ->  | M58: ='I:\[POINTS NQS  2011.XLS]Stock Altered'!Z60 -> 180
A59: ='I:\[POINTS NQS  2011.XLS]Outlaw'!A62 -> 56 | B59: ='I:\[POINTS NQS  2011.XLS]Outlaw'!B62 -> John Elrod | C59: =IF('I:\[POINTS NQS  2011.XLS]Outlaw'!C62=0," ",'I:\[POINTS NQS  2011.XLS]Outlaw'!C62) -> TV | D59: ='I:\[POINTS NQS  2011.XLS]Outlaw'!D62 -> 11-020 | E59: =IF('I:\[POINTS NQS  2011.XLS]Outlaw'!E62=0," ",'I:\[POINTS NQS  2011.XLS]Outlaw'!E62) -> Bad Habit | F59: ='I:\[POINTS NQS  2011.XLS]Outlaw'!Z62 -> 142 | H59: ='I:\[POINTS NQS  2011.XLS]Stock Altered'!A61 -> 56 | I59: ='I:\[POINTS NQS  2011.XLS]Stock Altered'!B61 -> Robin Cooper | J59: =IF('I:\[POINTS NQS  2011.XLS]Stock Altered'!C61=0,"",'I:\[POINTS NQS  2011.XLS]Stock Altered'!C61) ->  | K59: ='I:\[POINTS NQS  2011.XLS]Stock Altered'!D61 -> 11-073 | L59: =IF('I:\[POINTS NQS  2011.XLS]Stock Altered'!E61=0,"",'I:\[POINTS NQS  2011.XLS]Stock Altered'!E61) ->  | M59: ='I:\[POINTS NQS  2011.XLS]Stock Altered'!Z61 -> 181
A60: ='I:\[POINTS NQS  2011.XLS]Outlaw'!A63 -> 57 | B60: ='I:\[POINTS NQS  2011.XLS]Outlaw'!B63 -> Mike McGaha | C60: =IF('I:\[POINTS NQS  2011.XLS]Outlaw'!C63=0," ",'I:\[POINTS NQS  2011.XLS]Outlaw'!C63) -> JW | D60: ='I:\[POINTS NQS  2011.XLS]Outlaw'!D63 -> 11-288 | E60: =IF('I:\[POINTS NQS  2011.XLS]Outlaw'!E63=0," ",'I:\[POINTS NQS  2011.XLS]Outlaw'!E63) -> Company Time | F60: ='I:\[POINTS NQS  2011.XLS]Outlaw'!Z63 -> 142 | H60: ='I:\[POINTS NQS  2011.XLS]Stock Altered'!A62 -> 57 | I60: ='I:\[POINTS NQS  2011.XLS]Stock Altered'!B62 -> Mike Yeley | J60: =IF('I:\[POINTS NQS  2011.XLS]Stock Altered'!C62=0,"",'I:\[POINTS NQS  2011.XLS]Stock Altered'!C62) -> JW | K60: ='I:\[POINTS NQS  2011.XLS]Stock Altered'!D62 -> 11-055 | L60: =IF('I:\[POINTS NQS  2011.XLS]Stock Altered'!E62=0,"",'I:\[POINTS NQS  2011.XLS]Stock Altered'!E62) -> Papas Ride | M60: ='I:\[POINTS NQS  2011.XLS]Stock Altered'!Z62 -> 182
A61: ='I:\[POINTS NQS  2011.XLS]Outlaw'!A64 -> 58 | B61: ='I:\[POINTS NQS  2011.XLS]Outlaw'!B64 -> Shane Hadley | C61: =IF('I:\[POINTS NQS  2011.XLS]Outlaw'!C64=0," ",'I:\[POINTS NQS  2011.XLS]Outlaw'!C64) -> LR | D61: ='I:\[POINTS NQS  2011.XLS]Outlaw'!D64 -> 11-442 | E61: =IF('I:\[POINTS NQS  2011.XLS]Outlaw'!E64=0," ",'I:\[POINTS NQS  2011.XLS]Outlaw'!E64) -> Foot Finder | F61: ='I:\[POINTS NQS  2011.XLS]Outlaw'!Z64 -> 142 | H61: ='I:\[POINTS NQS  2011.XLS]Stock Altered'!A63 -> 58 | I61: ='I:\[POINTS NQS  2011.XLS]Stock Altered'!B63 -> Austin Ernest | J61: =IF('I:\[POINTS NQS  2011.XLS]Stock Altered'!C63=0,"",'I:\[POINTS NQS  2011.XLS]Stock Altered'!C63) ->  | K61: ='I:\[POINTS NQS  2011.XLS]Stock Altered'!D63 -> 11-224 | L61: =IF('I:\[POINTS NQS  2011.XLS]Stock Altered'!E63=0,"",'I:\[POINTS NQS  2011.XLS]Stock Altered'!E63) -> Not Deep Enough | M61: ='I:\[POINTS NQS  2011.XLS]Stock Altered'!Z63 -> 182
A62: ='I:\[POINTS NQS  2011.XLS]Outlaw'!A65 -> 59 | B62: ='I:\[POINTS NQS  2011.XLS]Outlaw'!B65 -> Ron Feldkamp | C62: =IF('I:\[POINTS NQS  2011.XLS]Outlaw'!C65=0," ",'I:\[POINTS NQS  2011.XLS]Outlaw'!C65) -> Woods | D62: ='I:\[POINTS NQS  2011.XLS]Outlaw'!D65 -> 11-143 | E62: =IF('I:\[POINTS NQS  2011.XLS]Outlaw'!E65=0," ",'I:\[POINTS NQS  2011.XLS]Outlaw'!E65) -> Key Chain | F62: ='I:\[POINTS NQS  2011.XLS]Outlaw'!Z65 -> 146 | H62: ='I:\[POINTS NQS  2011.XLS]Stock Altered'!A64 -> 59 | I62: ='I:\[POINTS NQS  2011.XLS]Stock Altered'!B64 -> Clerance Bell | J62: =IF('I:\[POINTS NQS  2011.XLS]Stock Altered'!C64=0,"",'I:\[POINTS NQS  2011.XLS]Stock Altered'!C64) -> TC | K62: ='I:\[POINTS NQS  2011.XLS]Stock Altered'!D64 -> 11-466 | L62: =IF('I:\[POINTS NQS  2011.XLS]Stock Altered'!E64=0,"",'I:\[POINTS NQS  2011.XLS]Stock Altered'!E64) -> Money Pit | M62: ='I:\[POINTS NQS  2011.XLS]Stock Altered'!Z64 -> 182
A63: ='I:\[POINTS NQS  2011.XLS]Outlaw'!A66 -> 60 | B63: ='I:\[POINTS NQS  2011.XLS]Outlaw'!B66 -> Greg Heifner | C63: =IF('I:\[POINTS NQS  2011.XLS]Outlaw'!C66=0," ",'I:\[POINTS NQS  2011.XLS]Outlaw'!C66) -> TH | D63: ='I:\[POINTS NQS  2011.XLS]Outlaw'!D66 -> 11-231 | E63: =IF('I:\[POINTS NQS  2011.XLS]Outlaw'!E66=0," ",'I:\[POINTS NQS  2011.XLS]Outlaw'!E66) -> Instigator | F63: ='I:\[POINTS NQS  2011.XLS]Outlaw'!Z66 -> 148 | H63: ='I:\[POINTS NQS  2011.XLS]Stock Altered'!A65 -> 60 | I63: ='I:\[POINTS NQS  2011.XLS]Stock Altered'!B65 -> Tyler Hemming | J63: =IF('I:\[POINTS NQS  2011.XLS]Stock Altered'!C65=0,"",'I:\[POINTS NQS  2011.XLS]Stock Altered'!C65) ->  | K63: ='I:\[POINTS NQS  2011.XLS]Stock Altered'!D65 -> 11-481 | L63: =IF('I:\[POINTS NQS  2011.XLS]Stock Altered'!E65=0,"",'I:\[POINTS NQS  2011.XLS]Stock Altered'!E65) ->  | M63: ='I:\[POINTS NQS  2011.XLS]Stock Altered'!Z65 -> 182
A64: ='I:\[POINTS NQS  2011.XLS]Outlaw'!A67 -> 61 | B64: ='I:\[POINTS NQS  2011.XLS]Outlaw'!B67 -> Lee Dewald | C64: =IF('I:\[POINTS NQS  2011.XLS]Outlaw'!C67=0," ",'I:\[POINTS NQS  2011.XLS]Outlaw'!C67) -> RPM | D64: ='I:\[POINTS NQS  2011.XLS]Outlaw'!D67 -> 11-484 | E64: =IF('I:\[POINTS NQS  2011.XLS]Outlaw'!E67=0," ",'I:\[POINTS NQS  2011.XLS]Outlaw'!E67) -> Patience | F64: ='I:\[POINTS NQS  2011.XLS]Outlaw'!Z67 -> 148 | H64: ='I:\[POINTS NQS  2011.XLS]Stock Altered'!A66 -> 61 | I64: ='I:\[POINTS NQS  2011.XLS]Stock Altered'!B66 -> Gaylord Strine | J64: =IF('I:\[POINTS NQS  2011.XLS]Stock Altered'!C66=0,"",'I:\[POINTS NQS  2011.XLS]Stock Altered'!C66) ->  | K64: ='I:\[POINTS NQS  2011.XLS]Stock Altered'!D66 -> 11-126 | L64: =IF('I:\[POINTS NQS  2011.XLS]Stock Altered'!E66=0,"",'I:\[POINTS NQS  2011.XLS]Stock Altered'!E66) ->  | M64: ='I:\[POINTS NQS  2011.XLS]Stock Altered'!Z66 -> 183
A65: ='I:\[POINTS NQS  2011.XLS]Outlaw'!A68 -> 62 | B65: ='I:\[POINTS NQS  2011.XLS]Outlaw'!B68 -> Bill Elrod | C65: =IF('I:\[POINTS NQS  2011.XLS]Outlaw'!C68=0," ",'I:\[POINTS NQS  2011.XLS]Outlaw'!C68) -> TV | D65: ='I:\[POINTS NQS  2011.XLS]Outlaw'!D68 -> 11-021 | E65: =IF('I:\[POINTS NQS  2011.XLS]Outlaw'!E68=0," ",'I:\[POINTS NQS  2011.XLS]Outlaw'!E68) -> PaPa Toy | F65: ='I:\[POINTS NQS  2011.XLS]Outlaw'!Z68 -> 149 | H65: ='I:\[POINTS NQS  2011.XLS]Stock Altered'!A67 -> 62 | I65: ='I:\[POINTS NQS  2011.XLS]Stock Altered'!B67 -> Paula Lapole | J65: =IF('I:\[POINTS NQS  2011.XLS]Stock Altered'!C67=0,"",'I:\[POINTS NQS  2011.XLS]Stock Altered'!C67) ->  | K65: ='I:\[POINTS NQS  2011.XLS]Stock Altered'!D67 -> 11-490 | L65: =IF('I:\[POINTS NQS  2011.XLS]Stock Altered'!E67=0,"",'I:\[POINTS NQS  2011.XLS]Stock Altered'!E67) -> Slow Ride | M65: ='I:\[POINTS NQS  2011.XLS]Stock Altered'!Z67 -> 184
A66: ='I:\[POINTS NQS  2011.XLS]Outlaw'!A69 -> 63 | B66: ='I:\[POINTS NQS  2011.XLS]Outlaw'!B69 -> Ron Finch | C66: =IF('I:\[POINTS NQS  2011.XLS]Outlaw'!C69=0," ",'I:\[POINTS NQS  2011.XLS]Outlaw'!C69) -> Woods | D66: ='I:\[POINTS NQS  2011.XLS]Outlaw'!D69 -> 11-142 | E66: =IF('I:\[POINTS NQS  2011.XLS]Outlaw'!E69=0," ",'I:\[POINTS NQS  2011.XLS]Outlaw'!E69) -> Top Notch | F66: ='I:\[POINTS NQS  2011.XLS]Outlaw'!Z69 -> 155 | H66: ='I:\[POINTS NQS  2011.XLS]Stock Altered'!A68 -> 63 | I66: ='I:\[POINTS NQS  2011.XLS]Stock Altered'!B68 -> Randy Hazelbaker | J66: =IF('I:\[POINTS NQS  2011.XLS]Stock Altered'!C68=0,"",'I:\[POINTS NQS  2011.XLS]Stock Altered'!C68) -> TV | K66: ='I:\[POINTS NQS  2011.XLS]Stock Altered'!D68 -> 11-087 | L66: =IF('I:\[POINTS NQS  2011.XLS]Stock Altered'!E68=0,"",'I:\[POINTS NQS  2011.XLS]Stock Altered'!E68) -> 1 Bad Buck | M66: ='I:\[POINTS NQS  2011.XLS]Stock Altered'!Z68 -> 185 | O66: 0
A67: ='I:\[POINTS NQS  2011.XLS]Outlaw'!A70 -> 64 | B67: ='I:\[POINTS NQS  2011.XLS]Outlaw'!B70 -> Ed Kenver | C67: =IF('I:\[POINTS NQS  2011.XLS]Outlaw'!C70=0," ",'I:\[POINTS NQS  2011.XLS]Outlaw'!C70) -> NP | D67: ='I:\[POINTS NQS  2011.XLS]Outlaw'!D70 -> 11-303 | E67: =IF('I:\[POINTS NQS  2011.XLS]Outlaw'!E70=0," ",'I:\[POINTS NQS  2011.XLS]Outlaw'!E70) -> Along for the Ride | F67: ='I:\[POINTS NQS  2011.XLS]Outlaw'!Z70 -> 144 | H67: ='I:\[POINTS NQS  2011.XLS]Stock Altered'!A69 -> 64 | I67: ='I:\[POINTS NQS  2011.XLS]Stock Altered'!B69 -> Kevin Stitzer | J67: =IF('I:\[POINTS NQS  2011.XLS]Stock Altered'!C69=0,"",'I:\[POINTS NQS  2011.XLS]Stock Altered'!C69) ->  | K67: ='I:\[POINTS NQS  2011.XLS]Stock Altered'!D69 -> 11-447 | L67: =IF('I:\[POINTS NQS  2011.XLS]Stock Altered'!E69=0,"",'I:\[POINTS NQS  2011.XLS]Stock Altered'!E69) -> Thunder Road | M67: ='I:\[POINTS NQS  2011.XLS]Stock Altered'!Z69 -> 185
A68: ='I:\[POINTS NQS  2011.XLS]Outlaw'!A71 -> 65 | B68: ='I:\[POINTS NQS  2011.XLS]Outlaw'!B71 -> Randy Hazelbaker | C68: =IF('I:\[POINTS NQS  2011.XLS]Outlaw'!C71=0," ",'I:\[POINTS NQS  2011.XLS]Outlaw'!C71) -> TV | D68: ='I:\[POINTS NQS  2011.XLS]Outlaw'!D71 -> 11-087 | E68: =IF('I:\[POINTS NQS  2011.XLS]Outlaw'!E71=0," ",'I:\[POINTS NQS  2011.XLS]Outlaw'!E71) -> 1 Bad Buck | F68: ='I:\[POINTS NQS  2011.XLS]Outlaw'!Z71 -> 158 | H68: ='I:\[POINTS NQS  2011.XLS]Stock Altered'!A70 -> 65 | I68: ='I:\[POINTS NQS  2011.XLS]Stock Altered'!B70 -> Ridge Pope | J68: =IF('I:\[POINTS NQS  2011.XLS]Stock Altered'!C70=0,"",'I:\[POINTS NQS  2011.XLS]Stock Altered'!C70) -> TV | K68: ='I:\[POINTS NQS  2011.XLS]Stock Altered'!D70 -> 11-488 | L68: =IF('I:\[POINTS NQS  2011.XLS]Stock Altered'!E70=0,"",'I:\[POINTS NQS  2011.XLS]Stock Altered'!E70) -> Ford 160 | M68: ='I:\[POINTS NQS  2011.XLS]Stock Altered'!Z70 -> 185
A69: ='I:\[POINTS NQS  2011.XLS]Outlaw'!A72 -> 66 | B69: ='I:\[POINTS NQS  2011.XLS]Outlaw'!B72 -> Shane Heits | C69: =IF('I:\[POINTS NQS  2011.XLS]Outlaw'!C72=0," ",'I:\[POINTS NQS  2011.XLS]Outlaw'!C72) -> Heitz | D69: ='I:\[POINTS NQS  2011.XLS]Outlaw'!D72 -> 11-463 | E69: =IF('I:\[POINTS NQS  2011.XLS]Outlaw'!E72=0," ",'I:\[POINTS NQS  2011.XLS]Outlaw'!E72) -> Dirt Fad | F69: ='I:\[POINTS NQS  2011.XLS]Outlaw'!Z72 -> 158 | H69: ='I:\[POINTS NQS  2011.XLS]Stock Altered'!A71 -> 66 | I69: ='I:\[POINTS NQS  2011.XLS]Stock Altered'!B71 -> Charlie Schultz | J69: =IF('I:\[POINTS NQS  2011.XLS]Stock Altered'!C71=0,"",'I:\[POINTS NQS  2011.XLS]Stock Altered'!C71) -> MVP | K69: ='I:\[POINTS NQS  2011.XLS]Stock Altered'!D71 -> 11-005 | L69: =IF('I:\[POINTS NQS  2011.XLS]Stock Altered'!E71=0,"",'I:\[POINTS NQS  2011.XLS]Stock Altered'!E71) -> Funky Chicken | M69: ='I:\[POINTS NQS  2011.XLS]Stock Altered'!Z71 -> 186
A70: ='I:\[POINTS NQS  2011.XLS]Outlaw'!A73 -> 67 | B70: ='I:\[POINTS NQS  2011.XLS]Outlaw'!B73 -> Doug Waugh | C70: =IF('I:\[POINTS NQS  2011.XLS]Outlaw'!C73=0," ",'I:\[POINTS NQS  2011.XLS]Outlaw'!C73) ->  | D70: ='I:\[POINTS NQS  2011.XLS]Outlaw'!D73 -> 11-464 | E70: =IF('I:\[POINTS NQS  2011.XLS]Outlaw'!E73=0," ",'I:\[POINTS NQS  2011.XLS]Outlaw'!E73) -> 4455 John Deere | F70: ='I:\[POINTS NQS  2011.XLS]Outlaw'!Z73 -> 158 | H70: ='I:\[POINTS NQS  2011.XLS]Stock Altered'!A72 -> 67 | I70: ='I:\[POINTS NQS  2011.XLS]Stock Altered'!B72 -> Jeremy Pierce | J70: =IF('I:\[POINTS NQS  2011.XLS]Stock Altered'!C72=0,"",'I:\[POINTS NQS  2011.XLS]Stock Altered'!C72) -> JM | K70: ='I:\[POINTS NQS  2011.XLS]Stock Altered'!D72 -> 11-362 | L70: =IF('I:\[POINTS NQS  2011.XLS]Stock Altered'!E72=0,"",'I:\[POINTS NQS  2011.XLS]Stock Altered'!E72) -> Lunch Money | M70: ='I:\[POINTS NQS  2011.XLS]Stock Altered'!Z72 -> 186
A71: ='I:\[POINTS NQS  2011.XLS]Outlaw'!A74 -> 68 | B71: ='I:\[POINTS NQS  2011.XLS]Outlaw'!B74 -> Bob Cooper | C71: =IF('I:\[POINTS NQS  2011.XLS]Outlaw'!C74=0," ",'I:\[POINTS NQS  2011.XLS]Outlaw'!C74) -> JRS | D71: ='I:\[POINTS NQS  2011.XLS]Outlaw'!D74 -> 11-072 | E71: =IF('I:\[POINTS NQS  2011.XLS]Outlaw'!E74=0," ",'I:\[POINTS NQS  2011.XLS]Outlaw'!E74) ->  | F71: ='I:\[POINTS NQS  2011.XLS]Outlaw'!Z74 -> 158 | H71: ='I:\[POINTS NQS  2011.XLS]Stock Altered'!A73 -> 68 | I71: ='I:\[POINTS NQS  2011.XLS]Stock Altered'!B73 -> Chris Gegg | J71: =IF('I:\[POINTS NQS  2011.XLS]Stock Altered'!C73=0,"",'I:\[POINTS NQS  2011.XLS]Stock Altered'!C73) -> JRS | K71: ='I:\[POINTS NQS  2011.XLS]Stock Altered'!D73 -> 11-410 | L71: =IF('I:\[POINTS NQS  2011.XLS]Stock Altered'!E73=0,"",'I:\[POINTS NQS  2011.XLS]Stock Altered'!E73) -> Insane | M71: ='I:\[POINTS NQS  2011.XLS]Stock Altered'!Z73 -> 187
A72: ='I:\[POINTS NQS  2011.XLS]Outlaw'!A75 -> 69 | B72: ='I:\[POINTS NQS  2011.XLS]Outlaw'!B75 -> George Bax | C72: =IF('I:\[POINTS NQS  2011.XLS]Outlaw'!C75=0," ",'I:\[POINTS NQS  2011.XLS]Outlaw'!C75) -> LR | D72: ='I:\[POINTS NQS  2011.XLS]Outlaw'!D75 -> 11-422 | E72: =IF('I:\[POINTS NQS  2011.XLS]Outlaw'!E75=0," ",'I:\[POINTS NQS  2011.XLS]Outlaw'!E75) -> Plum Crazy | F72: ='I:\[POINTS NQS  2011.XLS]Outlaw'!Z75 -> 160 | H72: ='I:\[POINTS NQS  2011.XLS]Stock Altered'!A74 -> 69 | I72: ='I:\[POINTS NQS  2011.XLS]Stock Altered'!B74 -> Suzanne McClain | J72: =IF('I:\[POINTS NQS  2011.XLS]Stock Altered'!C74=0,"",'I:\[POINTS NQS  2011.XLS]Stock Altered'!C74) -> LR | K72: ='I:\[POINTS NQS  2011.XLS]Stock Altered'!D74 -> 11-376 | L72: =IF('I:\[POINTS NQS  2011.XLS]Stock Altered'!E74=0,"",'I:\[POINTS NQS  2011.XLS]Stock Altered'!E74) -> Cadet | M72: ='I:\[POINTS NQS  2011.XLS]Stock Altered'!Z74 -> 188
A73: ='I:\[POINTS NQS  2011.XLS]Outlaw'!A76 -> 70 | B73: ='I:\[POINTS NQS  2011.XLS]Outlaw'!B76 -> Dave Shulko | C73: =IF('I:\[POINTS NQS  2011.XLS]Outlaw'!C76=0," ",'I:\[POINTS NQS  2011.XLS]Outlaw'!C76) ->  | D73: ='I:\[POINTS NQS  2011.XLS]Outlaw'!D76 -> 11-181 | E73: =IF('I:\[POINTS NQS  2011.XLS]Outlaw'!E76=0," ",'I:\[POINTS NQS  2011.XLS]Outlaw'!E76) ->  | F73: ='I:\[POINTS NQS  2011.XLS]Outlaw'!Z76 -> 160 | H73: ='I:\[POINTS NQS  2011.XLS]Stock Altered'!A75 -> 70 | I73: ='I:\[POINTS NQS  2011.XLS]Stock Altered'!B75 -> Kevin Bax | J73: =IF('I:\[POINTS NQS  2011.XLS]Stock Altered'!C75=0,"",'I:\[POINTS NQS  2011.XLS]Stock Altered'!C75) -> TV | K73: ='I:\[POINTS NQS  2011.XLS]Stock Altered'!D75 -> 11-104 | L73: =IF('I:\[POINTS NQS  2011.XLS]Stock Altered'!E75=0,"",'I:\[POINTS NQS  2011.XLS]Stock Altered'!E75) -> Black Jack | M73: ='I:\[POINTS NQS  2011.XLS]Stock Altered'!Z75 -> 189
A74: ='I:\[POINTS NQS  2011.XLS]Outlaw'!A77 -> 71 | B74: ='I:\[POINTS NQS  2011.XLS]Outlaw'!B77 -> Mark Davus | C74: =IF('I:\[POINTS NQS  2011.XLS]Outlaw'!C77=0," ",'I:\[POINTS NQS  2011.XLS]Outlaw'!C77) -> JRS | D74: ='I:\[POINTS NQS  2011.XLS]Outlaw'!D77 -> 11-066 | E74: =IF('I:\[POINTS NQS  2011.XLS]Outlaw'!E77=0," ",'I:\[POINTS NQS  2011.XLS]Outlaw'!E77) -> Domestic Diva | F74: ='I:\[POINTS NQS  2011.XLS]Outlaw'!Z77 -> 161
A75: ='I:\[POINTS NQS  2011.XLS]Outlaw'!A78 -> 72 | B75: ='I:\[POINTS NQS  2011.XLS]Outlaw'!B78 -> Steve Chrisman | C75: =IF('I:\[POINTS NQS  2011.XLS]Outlaw'!C78=0," ",'I:\[POINTS NQS  2011.XLS]Outlaw'!C78) -> Hackman | D75: ='I:\[POINTS NQS  2011.XLS]Outlaw'!D78 -> 11-022 | E75: =IF('I:\[POINTS NQS  2011.XLS]Outlaw'!E78=0," ",'I:\[POINTS NQS  2011.XLS]Outlaw'!E78) -> Razmitaz | F75: ='I:\[POINTS NQS  2011.XLS]Outlaw'!Z78 -> 162
A76: ='I:\[POINTS NQS  2011.XLS]Outlaw'!A79 -> 73 | B76: ='I:\[POINTS NQS  2011.XLS]Outlaw'!B79 -> Devin Spitzer | C76: =IF('I:\[POINTS NQS  2011.XLS]Outlaw'!C79=0," ",'I:\[POINTS NQS  2011.XLS]Outlaw'!C79) ->  | D76: ='I:\[POINTS NQS  2011.XLS]Outlaw'!D79 -> 11-447 | E76: =IF('I:\[POINTS NQS  2011.XLS]Outlaw'!E79=0," ",'I:\[POINTS NQS  2011.XLS]Outlaw'!E79) -> Thunder Road II | F76: ='I:\[POINTS NQS  2011.XLS]Outlaw'!Z79 -> 163
A77: ='I:\[POINTS NQS  2011.XLS]Outlaw'!A80 -> 74 | B77: ='I:\[POINTS NQS  2011.XLS]Outlaw'!B80 -> Aaron Mason | C77: =IF('I:\[POINTS NQS  2011.XLS]Outlaw'!C80=0," ",'I:\[POINTS NQS  2011.XLS]Outlaw'!C80) -> NP | D77: ='I:\[POINTS NQS  2011.XLS]Outlaw'!D80 -> 11-356 | E77: =IF('I:\[POINTS NQS  2011.XLS]Outlaw'!E80=0," ",'I:\[POINTS NQS  2011.XLS]Outlaw'!E80) -> Frustrated 2 | F77: ='I:\[POINTS NQS  2011.XLS]Outlaw'!Z80 -> 164
A78: ='I:\[POINTS NQS  2011.XLS]Outlaw'!A81 -> 75 | B78: ='I:\[POINTS NQS  2011.XLS]Outlaw'!B81 -> Gaylord Strine | C78: =IF('I:\[POINTS NQS  2011.XLS]Outlaw'!C81=0," ",'I:\[POINTS NQS  2011.XLS]Outlaw'!C81) -> JRS | D78: ='I:\[POINTS NQS  2011.XLS]Outlaw'!D81 -> 11-492 | E78: =IF('I:\[POINTS NQS  2011.XLS]Outlaw'!E81=0," ",'I:\[POINTS NQS  2011.XLS]Outlaw'!E81) -> Giddy Up Go | F78: ='I:\[POINTS NQS  2011.XLS]Outlaw'!Z81 -> 164
A79: ='I:\[POINTS NQS  2011.XLS]Outlaw'!A82 -> 76 | B79: ='I:\[POINTS NQS  2011.XLS]Outlaw'!B82 -> Jared Riddle | C79: =IF('I:\[POINTS NQS  2011.XLS]Outlaw'!C82=0," ",'I:\[POINTS NQS  2011.XLS]Outlaw'!C82) ->  | D79: ='I:\[POINTS NQS  2011.XLS]Outlaw'!D82 -> 11-471 | E79: =IF('I:\[POINTS NQS  2011.XLS]Outlaw'!E82=0," ",'I:\[POINTS NQS  2011.XLS]Outlaw'!E82) -> Williemakeit | F79: ='I:\[POINTS NQS  2011.XLS]Outlaw'!Z82 -> 165
A80: ='I:\[POINTS NQS  2011.XLS]Outlaw'!A83 -> 77 | B80: ='I:\[POINTS NQS  2011.XLS]Outlaw'!B83 -> Carly Manville | C80: =IF('I:\[POINTS NQS  2011.XLS]Outlaw'!C83=0," ",'I:\[POINTS NQS  2011.XLS]Outlaw'!C83) ->  | D80: ='I:\[POINTS NQS  2011.XLS]Outlaw'!D83 -> 11-235 | E80: =IF('I:\[POINTS NQS  2011.XLS]Outlaw'!E83=0," ",'I:\[POINTS NQS  2011.XLS]Outlaw'!E83) -> Sidewinder | F80: ='I:\[POINTS NQS  2011.XLS]Outlaw'!Z83 -> 165
A81: ='I:\[POINTS NQS  2011.XLS]Outlaw'!A84 -> 78 | B81: ='I:\[POINTS NQS  2011.XLS]Outlaw'!B84 -> Charlie Schultz | C81: =IF('I:\[POINTS NQS  2011.XLS]Outlaw'!C84=0," ",'I:\[POINTS NQS  2011.XLS]Outlaw'!C84) -> MVP | D81: ='I:\[POINTS NQS  2011.XLS]Outlaw'!D84 -> 11-005 | E81: =IF('I:\[POINTS NQS  2011.XLS]Outlaw'!E84=0," ",'I:\[POINTS NQS  2011.XLS]Outlaw'!E84) -> Funkey Chicken | F81: ='I:\[POINTS NQS  2011.XLS]Outlaw'!Z84 -> 166
A82: ='I:\[POINTS NQS  2011.XLS]Outlaw'!A85 -> 79 | B82: ='I:\[POINTS NQS  2011.XLS]Outlaw'!B85 -> Tyler Hemming | C82: =IF('I:\[POINTS NQS  2011.XLS]Outlaw'!C85=0," ",'I:\[POINTS NQS  2011.XLS]Outlaw'!C85) ->  | D82: ='I:\[POINTS NQS  2011.XLS]Outlaw'!D85 -> 11-481 | E82: =IF('I:\[POINTS NQS  2011.XLS]Outlaw'!E85=0," ",'I:\[POINTS NQS  2011.XLS]Outlaw'!E85) ->  | F82: ='I:\[POINTS NQS  2011.XLS]Outlaw'!Z85 -> 167
A83: ='I:\[POINTS NQS  2011.XLS]Outlaw'!A86 -> 80 | B83: ='I:\[POINTS NQS  2011.XLS]Outlaw'!B86 -> Gordy Lloyd | C83: =IF('I:\[POINTS NQS  2011.XLS]Outlaw'!C86=0," ",'I:\[POINTS NQS  2011.XLS]Outlaw'!C86) ->  | D83: ='I:\[POINTS NQS  2011.XLS]Outlaw'!D86 -> 11-205 | E83: =IF('I:\[POINTS NQS  2011.XLS]Outlaw'!E86=0," ",'I:\[POINTS NQS  2011.XLS]Outlaw'!E86) -> Buck Wild | F83: ='I:\[POINTS NQS  2011.XLS]Outlaw'!Z86 -> 167
A84: ='I:\[POINTS NQS  2011.XLS]Outlaw'!A87 -> 81 | B84: ='I:\[POINTS NQS  2011.XLS]Outlaw'!B87 -> Justin Wagler | C84: =IF('I:\[POINTS NQS  2011.XLS]Outlaw'!C87=0," ",'I:\[POINTS NQS  2011.XLS]Outlaw'!C87) -> TC | D84: ='I:\[POINTS NQS  2011.XLS]Outlaw'!D87 -> 11-127 | E84: =IF('I:\[POINTS NQS  2011.XLS]Outlaw'!E87=0," ",'I:\[POINTS NQS  2011.XLS]Outlaw'!E87) -> Samson | F84: ='I:\[POINTS NQS  2011.XLS]Outlaw'!Z87 -> 168
A85: ='I:\[POINTS NQS  2011.XLS]Outlaw'!A88 -> 82 | B85: ='I:\[POINTS NQS  2011.XLS]Outlaw'!B88 -> Ben Larkins | C85: =IF('I:\[POINTS NQS  2011.XLS]Outlaw'!C88=0," ",'I:\[POINTS NQS  2011.XLS]Outlaw'!C88) -> JW | D85: ='I:\[POINTS NQS  2011.XLS]Outlaw'!D88 -> 11-137 | E85: =IF('I:\[POINTS NQS  2011.XLS]Outlaw'!E88=0," ",'I:\[POINTS NQS  2011.XLS]Outlaw'!E88) -> Indian Outlaw | F85: ='I:\[POINTS NQS  2011.XLS]Outlaw'!Z88 -> 170
A86: ='I:\[POINTS NQS  2011.XLS]Outlaw'!A89 -> 83 | B86: ='I:\[POINTS NQS  2011.XLS]Outlaw'!B89 -> Austin Yurcovich | C86: =IF('I:\[POINTS NQS  2011.XLS]Outlaw'!C89=0," ",'I:\[POINTS NQS  2011.XLS]Outlaw'!C89) -> RPM | D86: ='I:\[POINTS NQS  2011.XLS]Outlaw'!D89 -> 11-495 | E86: =IF('I:\[POINTS NQS  2011.XLS]Outlaw'!E89=0," ",'I:\[POINTS NQS  2011.XLS]Outlaw'!E89) -> Sled Streatcher | F86: ='I:\[POINTS NQS  2011.XLS]Outlaw'!Z89 -> 170
A87: ='I:\[POINTS NQS  2011.XLS]Outlaw'!A90 -> 84 | B87: ='I:\[POINTS NQS  2011.XLS]Outlaw'!B90 -> Kole Larkins | C87: =IF('I:\[POINTS NQS  2011.XLS]Outlaw'!C90=0," ",'I:\[POINTS NQS  2011.XLS]Outlaw'!C90) -> JW | D87: ='I:\[POINTS NQS  2011.XLS]Outlaw'!D90 -> 11-372 | E87: =IF('I:\[POINTS NQS  2011.XLS]Outlaw'!E90=0," ",'I:\[POINTS NQS  2011.XLS]Outlaw'!E90) -> Wound Up | F87: ='I:\[POINTS NQS  2011.XLS]Outlaw'!Z90 -> 171
A88: ='I:\[POINTS NQS  2011.XLS]Outlaw'!A91 -> 85 | B88: ='I:\[POINTS NQS  2011.XLS]Outlaw'!B91 -> Gary McDonald | C88: =IF('I:\[POINTS NQS  2011.XLS]Outlaw'!C91=0," ",'I:\[POINTS NQS  2011.XLS]Outlaw'!C91) ->  | D88: ='I:\[POINTS NQS  2011.XLS]Outlaw'!D91 -> 11-376 | E88: =IF('I:\[POINTS NQS  2011.XLS]Outlaw'!E91=0," ",'I:\[POINTS NQS  2011.XLS]Outlaw'!E91) ->  | F88: ='I:\[POINTS NQS  2011.XLS]Outlaw'!Z91 -> 171
A89: ='I:\[POINTS NQS  2011.XLS]Outlaw'!A92 -> 86 | B89: ='I:\[POINTS NQS  2011.XLS]Outlaw'!B92 -> Greg Myers | C89: =IF('I:\[POINTS NQS  2011.XLS]Outlaw'!C92=0," ",'I:\[POINTS NQS  2011.XLS]Outlaw'!C92) ->  | D89: ='I:\[POINTS NQS  2011.XLS]Outlaw'!D92 -> 11-496 | E89: =IF('I:\[POINTS NQS  2011.XLS]Outlaw'!E92=0," ",'I:\[POINTS NQS  2011.XLS]Outlaw'!E92) -> Gang Green | F89: ='I:\[POINTS NQS  2011.XLS]Outlaw'!Z92 -> 171
A90: ='I:\[POINTS NQS  2011.XLS]Outlaw'!A93 -> 87 | B90: ='I:\[POINTS NQS  2011.XLS]Outlaw'!B93 -> Paula Lapole | C90: =IF('I:\[POINTS NQS  2011.XLS]Outlaw'!C93=0," ",'I:\[POINTS NQS  2011.XLS]Outlaw'!C93) ->  | D90: ='I:\[POINTS NQS  2011.XLS]Outlaw'!D93 -> 11-489 | E90: =IF('I:\[POINTS NQS  2011.XLS]Outlaw'!E93=0," ",'I:\[POINTS NQS  2011.XLS]Outlaw'!E93) -> Hillbilly Girl | F90: ='I:\[POINTS NQS  2011.XLS]Outlaw'!Z93 -> 171
A91: ='I:\[POINTS NQS  2011.XLS]Outlaw'!A94 -> 88 | B91: ='I:\[POINTS NQS  2011.XLS]Outlaw'!B94 -> Shawn Garman | C91: =IF('I:\[POINTS NQS  2011.XLS]Outlaw'!C94=0," ",'I:\[POINTS NQS  2011.XLS]Outlaw'!C94) -> JRS | D91: ='I:\[POINTS NQS  2011.XLS]Outlaw'!D94 -> 11-230 | E91: =IF('I:\[POINTS NQS  2011.XLS]Outlaw'!E94=0," ",'I:\[POINTS NQS  2011.XLS]Outlaw'!E94) -> Gun Slinger | F91: ='I:\[POINTS NQS  2011.XLS]Outlaw'!Z94 -> 172
A92: ='I:\[POINTS NQS  2011.XLS]Outlaw'!A95 -> 89 | B92: ='I:\[POINTS NQS  2011.XLS]Outlaw'!B95 -> Les Sayler | C92: =IF('I:\[POINTS NQS  2011.XLS]Outlaw'!C95=0," ",'I:\[POINTS NQS  2011.XLS]Outlaw'!C95) -> TV | D92: ='I:\[POINTS NQS  2011.XLS]Outlaw'!D95 -> 11-444 | E92: =IF('I:\[POINTS NQS  2011.XLS]Outlaw'!E95=0," ",'I:\[POINTS NQS  2011.XLS]Outlaw'!E95) -> Unfinished Business | F92: ='I:\[POINTS NQS  2011.XLS]Outlaw'!Z95 -> 172
A93: ='I:\[POINTS NQS  2011.XLS]Outlaw'!A96 -> 90 | B93: ='I:\[POINTS NQS  2011.XLS]Outlaw'!B96 -> Vicki Harman | C93: =IF('I:\[POINTS NQS  2011.XLS]Outlaw'!C96=0," ",'I:\[POINTS NQS  2011.XLS]Outlaw'!C96) ->  | D93: ='I:\[POINTS NQS  2011.XLS]Outlaw'!D96 -> 0 | E93: =IF('I:\[POINTS NQS  2011.XLS]Outlaw'!E96=0," ",'I:\[POINTS NQS  2011.XLS]Outlaw'!E96) ->  | F93: ='I:\[POINTS NQS  2011.XLS]Outlaw'!Z96 -> 172
A94: ='I:\[POINTS NQS  2011.XLS]Outlaw'!A97 -> 91 | B94: ='I:\[POINTS NQS  2011.XLS]Outlaw'!B97 -> Jeremy Pierce | C94: =IF('I:\[POINTS NQS  2011.XLS]Outlaw'!C97=0," ",'I:\[POINTS NQS  2011.XLS]Outlaw'!C97) -> JM | D94: ='I:\[POINTS NQS  2011.XLS]Outlaw'!D97 -> 11-362 | E94: =IF('I:\[POINTS NQS  2011.XLS]Outlaw'!E97=0," ",'I:\[POINTS NQS  2011.XLS]Outlaw'!E97) -> Lunch Money | F94: ='I:\[POINTS NQS  2011.XLS]Outlaw'!Z97 -> 173
A95: ='I:\[POINTS NQS  2011.XLS]Outlaw'!A98 -> 92 | B95: ='I:\[POINTS NQS  2011.XLS]Outlaw'!B98 -> John Cress | C95: =IF('I:\[POINTS NQS  2011.XLS]Outlaw'!C98=0," ",'I:\[POINTS NQS  2011.XLS]Outlaw'!C98) -> VM | D95: ='I:\[POINTS NQS  2011.XLS]Outlaw'!D98 -> 11-308 | E95: =IF('I:\[POINTS NQS  2011.XLS]Outlaw'!E98=0," ",'I:\[POINTS NQS  2011.XLS]Outlaw'!E98) -> Hy Strung | F95: ='I:\[POINTS NQS  2011.XLS]Outlaw'!Z98 -> 174