B1: 30 CUBE Class | E1: Thru Marietta | G1: Pro V Twin | K1: Thru Marietta
B2: Name | C2: NQS # | D2: Tractor | E2: Points Back | H2: Name | I2: NQS # | J2: Tractor | K2: Points Back
A3: ='I:\[POINTS NQS  2011.XLS]30 Cube'!A7 -> 1 | B3: ='I:\[POINTS NQS  2011.XLS]30 Cube'!B7 -> Lora Feldkamp | C3: ='I:\[POINTS NQS  2011.XLS]30 Cube'!D7 -> 11-475 | D3: =IF('I:\[POINTS NQS  2011.XLS]30 Cube'!E7=0," ",'I:\[POINTS NQS  2011.XLS]30 Cube'!E7) ->  | E3: ='I:\[POINTS NQS  2011.XLS]30 Cube'!Z7 -> 0 | G3: ='I:\[POINTS NQS  2011.XLS]Pro V Twin'!A7 -> 1 | H3: ='I:\[POINTS NQS  2011.XLS]Pro V Twin'!B7 -> Harrison Stahl | I3: ='I:\[POINTS NQS  2011.XLS]Pro V Twin'!D7 -> 11-004 | J3: ='I:\[POINTS NQS  2011.XLS]Pro V Twin'!E7 -> Tons of Fun | K3: ='I:\[POINTS NQS  2011.XLS]Pro V Twin'!Z7 -> 0
A4: ='I:\[POINTS NQS  2011.XLS]30 Cube'!A8 -> 2 | B4: ='I:\[POINTS NQS  2011.XLS]30 Cube'!B8 -> Nick Ferguson | C4: ='I:\[POINTS NQS  2011.XLS]30 Cube'!D8 -> 11-100 | D4: =IF('I:\[POINTS NQS  2011.XLS]30 Cube'!E8=0," ",'I:\[POINTS NQS  2011.XLS]30 Cube'!E8) -> Rasin Cane | E4: ='I:\[POINTS NQS  2011.XLS]30 Cube'!Z8 -> 5 | G4: ='I:\[POINTS NQS  2011.XLS]Pro V Twin'!A8 -> 2 | H4: ='I:\[POINTS NQS  2011.XLS]Pro V Twin'!B8 -> Matt Kaster | I4: ='I:\[POINTS NQS  2011.XLS]Pro V Twin'!D8 -> 11-099 | J4: ='I:\[POINTS NQS  2011.XLS]Pro V Twin'!E8 -> Super Freak | K4: ='I:\[POINTS NQS  2011.XLS]Pro V Twin'!Z8 -> 2
A5: ='I:\[POINTS NQS  2011.XLS]30 Cube'!A9 -> 3 | B5: ='I:\[POINTS NQS  2011.XLS]30 Cube'!B9 -> David Gawatz | C5: ='I:\[POINTS NQS  2011.XLS]30 Cube'!D9 -> 11-462 | D5: =IF('I:\[POINTS NQS  2011.XLS]30 Cube'!E9=0," ",'I:\[POINTS NQS  2011.XLS]30 Cube'!E9) -> Fear The Deere | E5: ='I:\[POINTS NQS  2011.XLS]30 Cube'!Z9 -> 8 | G5: ='I:\[POINTS NQS  2011.XLS]Pro V Twin'!A9 -> 3 | H5: ='I:\[POINTS NQS  2011.XLS]Pro V Twin'!B9 -> Jim Hull | I5: ='I:\[POINTS NQS  2011.XLS]Pro V Twin'!D9 -> 11-334 | J5: ='I:\[POINTS NQS  2011.XLS]Pro V Twin'!E9 -> Simply Irresistable | K5: ='I:\[POINTS NQS  2011.XLS]Pro V Twin'!Z9 -> 6
A6: ='I:\[POINTS NQS  2011.XLS]30 Cube'!A10 -> 4 | B6: ='I:\[POINTS NQS  2011.XLS]30 Cube'!B10 -> Scott Bye | C6: ='I:\[POINTS NQS  2011.XLS]30 Cube'!D10 -> 11-187 | D6: =IF('I:\[POINTS NQS  2011.XLS]30 Cube'!E10=0," ",'I:\[POINTS NQS  2011.XLS]30 Cube'!E10) -> Revved Up | E6: ='I:\[POINTS NQS  2011.XLS]30 Cube'!Z10 -> 10 | G6: ='I:\[POINTS NQS  2011.XLS]Pro V Twin'!A10 -> 4 | H6: ='I:\[POINTS NQS  2011.XLS]Pro V Twin'!B10 -> Lowell Vis | I6: ='I:\[POINTS NQS  2011.XLS]Pro V Twin'!D10 -> 11-333 | J6: ='I:\[POINTS NQS  2011.XLS]Pro V Twin'!E10 -> Skittles | K6: ='I:\[POINTS NQS  2011.XLS]Pro V Twin'!Z10 -> 11
A7: ='I:\[POINTS NQS  2011.XLS]30 Cube'!A11 -> 5 | B7: ='I:\[POINTS NQS  2011.XLS]30 Cube'!B11 -> Shane Heits | C7: ='I:\[POINTS NQS  2011.XLS]30 Cube'!D11 -> 11-463 | D7: =IF('I:\[POINTS NQS  2011.XLS]30 Cube'!E11=0," ",'I:\[POINTS NQS  2011.XLS]30 Cube'!E11) -> Dirt Fad | E7: ='I:\[POINTS NQS  2011.XLS]30 Cube'!Z11 -> 11 | G7: ='I:\[POINTS NQS  2011.XLS]Pro V Twin'!A11 -> 5 | H7: ='I:\[POINTS NQS  2011.XLS]Pro V Twin'!B11 -> Kenny Comelison | I7: ='I:\[POINTS NQS  2011.XLS]Pro V Twin'!D11 -> 11-149 | J7: ='I:\[POINTS NQS  2011.XLS]Pro V Twin'!E11 -> Strom Alert | K7: ='I:\[POINTS NQS  2011.XLS]Pro V Twin'!Z11 -> 29
A8: ='I:\[POINTS NQS  2011.XLS]30 Cube'!A12 -> 6 | B8: ='I:\[POINTS NQS  2011.XLS]30 Cube'!B12 -> Bobby Feldkamp | C8: ='I:\[POINTS NQS  2011.XLS]30 Cube'!D12 -> 11-474 | D8: =IF('I:\[POINTS NQS  2011.XLS]30 Cube'!E12=0," ",'I:\[POINTS NQS  2011.XLS]30 Cube'!E12) -> Driftwood | E8: ='I:\[POINTS NQS  2011.XLS]30 Cube'!Z12 -> 14 | G8: ='I:\[POINTS NQS  2011.XLS]Pro V Twin'!A12 -> 6 | H8: ='I:\[POINTS NQS  2011.XLS]Pro V Twin'!B12 -> Rob Wise | I8: ='I:\[POINTS NQS  2011.XLS]Pro V Twin'!D12 -> 11-209 | K8: ='I:\[POINTS NQS  2011.XLS]Pro V Twin'!Z12 -> 31
A9: ='I:\[POINTS NQS  2011.XLS]30 Cube'!A13 -> 7 | B9: ='I:\[POINTS NQS  2011.XLS]30 Cube'!B13 -> Doug Rood | C9: ='I:\[POINTS NQS  2011.XLS]30 Cube'!D13 -> 11-354 | D9: =IF('I:\[POINTS NQS  2011.XLS]30 Cube'!E13=0," ",'I:\[POINTS NQS  2011.XLS]30 Cube'!E13) -> Blue Dog | E9: ='I:\[POINTS NQS  2011.XLS]30 Cube'!Z13 -> 15 | G9: ='I:\[POINTS NQS  2011.XLS]Pro V Twin'!A13 -> 7 | H9: ='I:\[POINTS NQS  2011.XLS]Pro V Twin'!B13 -> Mike Spencer | I9: ='I:\[POINTS NQS  2011.XLS]Pro V Twin'!D13 -> 11-278 | J9: ='I:\[POINTS NQS  2011.XLS]Pro V Twin'!E13 -> Long Shot | K9: ='I:\[POINTS NQS  2011.XLS]Pro V Twin'!Z13 -> 33
A10: ='I:\[POINTS NQS  2011.XLS]30 Cube'!A14 -> 8 | B10: ='I:\[POINTS NQS  2011.XLS]30 Cube'!B14 -> Tony Lewis | C10: ='I:\[POINTS NQS  2011.XLS]30 Cube'!D14 -> 11-345 | D10: =IF('I:\[POINTS NQS  2011.XLS]30 Cube'!E14=0," ",'I:\[POINTS NQS  2011.XLS]30 Cube'!E14) -> Plain Jane | E10: ='I:\[POINTS NQS  2011.XLS]30 Cube'!Z14 -> 23 | G10: ='I:\[POINTS NQS  2011.XLS]Pro V Twin'!A14 -> 8 | H10: ='I:\[POINTS NQS  2011.XLS]Pro V Twin'!B14 -> Jamey Pierce | I10: ='I:\[POINTS NQS  2011.XLS]Pro V Twin'!D14 -> 11-031 | K10: ='I:\[POINTS NQS  2011.XLS]Pro V Twin'!Z14 -> 60
A11: ='I:\[POINTS NQS  2011.XLS]30 Cube'!A15 -> 9 | B11: ='I:\[POINTS NQS  2011.XLS]30 Cube'!B15 -> Matt Kaster | C11: ='I:\[POINTS NQS  2011.XLS]30 Cube'!D15 -> 11-332 | D11: =IF('I:\[POINTS NQS  2011.XLS]30 Cube'!E15=0," ",'I:\[POINTS NQS  2011.XLS]30 Cube'!E15) -> The Freak | E11: ='I:\[POINTS NQS  2011.XLS]30 Cube'!Z15 -> 25 | G11: ='I:\[POINTS NQS  2011.XLS]Pro V Twin'!A15 -> 9 | H11: ='I:\[POINTS NQS  2011.XLS]Pro V Twin'!B15 -> Jim Waite | I11: ='I:\[POINTS NQS  2011.XLS]Pro V Twin'!D15 -> 11-480 | J11: ='I:\[POINTS NQS  2011.XLS]Pro V Twin'!E15 -> 0 | K11: ='I:\[POINTS NQS  2011.XLS]Pro V Twin'!Z15 -> 60
A12: ='I:\[POINTS NQS  2011.XLS]30 Cube'!A16 -> 10 | B12: ='I:\[POINTS NQS  2011.XLS]30 Cube'!B16 -> Greg Heifner | C12: ='I:\[POINTS NQS  2011.XLS]30 Cube'!D16 -> 11-231 | D12: =IF('I:\[POINTS NQS  2011.XLS]30 Cube'!E16=0," ",'I:\[POINTS NQS  2011.XLS]30 Cube'!E16) -> Instigator | E12: ='I:\[POINTS NQS  2011.XLS]30 Cube'!Z16 -> 29 | G12: ='I:\[POINTS NQS  2011.XLS]Pro V Twin'!A16 -> 10 | H12: ='I:\[POINTS NQS  2011.XLS]Pro V Twin'!B16 -> Mike Spencer | I12: ='I:\[POINTS NQS  2011.XLS]Pro V Twin'!D16 -> 11-437 | J12: ='I:\[POINTS NQS  2011.XLS]Pro V Twin'!E16 -> Twin Addition | K12: ='I:\[POINTS NQS  2011.XLS]Pro V Twin'!Z16 -> 62
A13: ='I:\[POINTS NQS  2011.XLS]30 Cube'!A17 -> 11 | B13: ='I:\[POINTS NQS  2011.XLS]30 Cube'!B17 -> Tony Heifner | C13: ='I:\[POINTS NQS  2011.XLS]30 Cube'!D17 -> 11-116 | D13: =IF('I:\[POINTS NQS  2011.XLS]30 Cube'!E17=0," ",'I:\[POINTS NQS  2011.XLS]30 Cube'!E17) -> Heartbeat | E13: ='I:\[POINTS NQS  2011.XLS]30 Cube'!Z17 -> 39 | G13: ='I:\[POINTS NQS  2011.XLS]Pro V Twin'!A17 -> 11 | H13: ='I:\[POINTS NQS  2011.XLS]Pro V Twin'!B17 -> Eric Varner | I13: ='I:\[POINTS NQS  2011.XLS]Pro V Twin'!D17 -> 11-482 | J13: ='I:\[POINTS NQS  2011.XLS]Pro V Twin'!E17 -> Extreme Addiction | K13: ='I:\[POINTS NQS  2011.XLS]Pro V Twin'!Z17 -> 62
A14: ='I:\[POINTS NQS  2011.XLS]30 Cube'!A18 -> 12 | B14: ='I:\[POINTS NQS  2011.XLS]30 Cube'!B18 -> Doug Waugh | C14: ='I:\[POINTS NQS  2011.XLS]30 Cube'!D18 -> 11-464 | D14: =IF('I:\[POINTS NQS  2011.XLS]30 Cube'!E18=0," ",'I:\[POINTS NQS  2011.XLS]30 Cube'!E18) -> 4455 John Deere | E14: ='I:\[POINTS NQS  2011.XLS]30 Cube'!Z18 -> 51 | G14: ='I:\[POINTS NQS  2011.XLS]Pro V Twin'!A18 -> 12 | H14: ='I:\[POINTS NQS  2011.XLS]Pro V Twin'!B18 -> Jerry Everhart | I14: ='I:\[POINTS NQS  2011.XLS]Pro V Twin'!D18 -> 11-483 | J14: ='I:\[POINTS NQS  2011.XLS]Pro V Twin'!E18 -> Orange Cart | K14: ='I:\[POINTS NQS  2011.XLS]Pro V Twin'!Z18 -> 63
A15: ='I:\[POINTS NQS  2011.XLS]30 Cube'!A19 -> 13 | B15: ='I:\[POINTS NQS  2011.XLS]30 Cube'!B19 -> Gregory Vandervort | C15: ='I:\[POINTS NQS  2011.XLS]30 Cube'!D19 -> 11-346 | D15: =IF('I:\[POINTS NQS  2011.XLS]30 Cube'!E19=0," ",'I:\[POINTS NQS  2011.XLS]30 Cube'!E19) ->  | E15: ='I:\[POINTS NQS  2011.XLS]30 Cube'!Z19 -> 57 | G15: ='I:\[POINTS NQS  2011.XLS]Pro V Twin'!A19 -> 13 | H15: ='I:\[POINTS NQS  2011.XLS]Pro V Twin'!B19 -> Eric Varner | I15: ='I:\[POINTS NQS  2011.XLS]Pro V Twin'!D19 -> 11-482 | J15: ='I:\[POINTS NQS  2011.XLS]Pro V Twin'!E19 -> Extreme Addiction | K15: ='I:\[POINTS NQS  2011.XLS]Pro V Twin'!Z19 -> 63
A16: ='I:\[POINTS NQS  2011.XLS]30 Cube'!A20 -> 14 | B16: ='I:\[POINTS NQS  2011.XLS]30 Cube'!B20 -> Kole Larkins | C16: ='I:\[POINTS NQS  2011.XLS]30 Cube'!D20 -> 11-372 | D16: =IF('I:\[POINTS NQS  2011.XLS]30 Cube'!E20=0," ",'I:\[POINTS NQS  2011.XLS]30 Cube'!E20) -> Wound Up | E16: ='I:\[POINTS NQS  2011.XLS]30 Cube'!Z20 -> 61 | G16: ='I:\[POINTS NQS  2011.XLS]Pro V Twin'!A20 -> 14 | H16: ='I:\[POINTS NQS  2011.XLS]Pro V Twin'!B20 -> Ryan Shafer | I16: ='I:\[POINTS NQS  2011.XLS]Pro V Twin'!D20 -> 11-445 | J16: ='I:\[POINTS NQS  2011.XLS]Pro V Twin'!E20 -> Lab rat | K16: ='I:\[POINTS NQS  2011.XLS]Pro V Twin'!Z20 -> 64
A17: ='I:\[POINTS NQS  2011.XLS]30 Cube'!A21 -> 15 | B17: ='I:\[POINTS NQS  2011.XLS]30 Cube'!B21 -> Carly Manville | C17: ='I:\[POINTS NQS  2011.XLS]30 Cube'!D21 -> 11-235 | D17: =IF('I:\[POINTS NQS  2011.XLS]30 Cube'!E21=0," ",'I:\[POINTS NQS  2011.XLS]30 Cube'!E21) -> Sidewinder | E17: ='I:\[POINTS NQS  2011.XLS]30 Cube'!Z21 -> 65 | G17: ='I:\[POINTS NQS  2011.XLS]Pro V Twin'!A21 -> 15 | H17: ='I:\[POINTS NQS  2011.XLS]Pro V Twin'!B21 -> Everhart | I17: ='I:\[POINTS NQS  2011.XLS]Pro V Twin'!D21 -> 11-483 | J17: ='I:\[POINTS NQS  2011.XLS]Pro V Twin'!E21 -> Orange Cart | K17: ='I:\[POINTS NQS  2011.XLS]Pro V Twin'!Z21 -> 64
A18: ='I:\[POINTS NQS  2011.XLS]30 Cube'!A22 -> 16 | B18: ='I:\[POINTS NQS  2011.XLS]30 Cube'!B22 -> Chris Spellman | C18: ='I:\[POINTS NQS  2011.XLS]30 Cube'!D22 -> 11-030 | D18: =IF('I:\[POINTS NQS  2011.XLS]30 Cube'!E22=0," ",'I:\[POINTS NQS  2011.XLS]30 Cube'!E22) -> Stroker | E18: ='I:\[POINTS NQS  2011.XLS]30 Cube'!Z22 -> 67 | G18: ='I:\[POINTS NQS  2011.XLS]Pro V Twin'!A22 -> 16 | H18: ='I:\[POINTS NQS  2011.XLS]Pro V Twin'!B22 -> Sandy Hayes | I18: ='I:\[POINTS NQS  2011.XLS]Pro V Twin'!D22 -> 11-375 | J18: ='I:\[POINTS NQS  2011.XLS]Pro V Twin'!E22 -> Mad Dog I | K18: ='I:\[POINTS NQS  2011.XLS]Pro V Twin'!Z22 -> 65
A19: ='I:\[POINTS NQS  2011.XLS]30 Cube'!A23 -> 17 | B19: ='I:\[POINTS NQS  2011.XLS]30 Cube'!B23 -> Justin Wagler | C19: ='I:\[POINTS NQS  2011.XLS]30 Cube'!D23 -> 11-127 | D19: =IF('I:\[POINTS NQS  2011.XLS]30 Cube'!E23=0," ",'I:\[POINTS NQS  2011.XLS]30 Cube'!E23) -> Samson | E19: ='I:\[POINTS NQS  2011.XLS]30 Cube'!Z23 -> 68 | G19: ='I:\[POINTS NQS  2011.XLS]Pro V Twin'!A23 -> 17 | H19: ='I:\[POINTS NQS  2011.XLS]Pro V Twin'!B23 -> Tim Hayes | I19: ='I:\[POINTS NQS  2011.XLS]Pro V Twin'!D23 -> 11-374 | J19: ='I:\[POINTS NQS  2011.XLS]Pro V Twin'!E23 -> Mad Dog II | K19: ='I:\[POINTS NQS  2011.XLS]Pro V Twin'!Z23 -> 66
A20: ='I:\[POINTS NQS  2011.XLS]30 Cube'!A24 -> 18 | B20: ='I:\[POINTS NQS  2011.XLS]30 Cube'!B24 -> George Bax | C20: ='I:\[POINTS NQS  2011.XLS]30 Cube'!D24 -> 11-422 | D20: =IF('I:\[POINTS NQS  2011.XLS]30 Cube'!E24=0," ",'I:\[POINTS NQS  2011.XLS]30 Cube'!E24) -> Plum Crazy | E20: ='I:\[POINTS NQS  2011.XLS]30 Cube'!Z24 -> 69
A21: ='I:\[POINTS NQS  2011.XLS]30 Cube'!A25 -> 19 | B21: ='I:\[POINTS NQS  2011.XLS]30 Cube'!B25 -> Greg Block | C21: ='I:\[POINTS NQS  2011.XLS]30 Cube'!D25 -> 11-103 | D21: =IF('I:\[POINTS NQS  2011.XLS]30 Cube'!E25=0," ",'I:\[POINTS NQS  2011.XLS]30 Cube'!E25) -> Pocket Change | E21: ='I:\[POINTS NQS  2011.XLS]30 Cube'!Z25 -> 70
A22: ='I:\[POINTS NQS  2011.XLS]30 Cube'!A26 -> 20 | B22: ='I:\[POINTS NQS  2011.XLS]30 Cube'!B26 -> Paula Lapole | C22: ='I:\[POINTS NQS  2011.XLS]30 Cube'!D26 -> 11-489 | D22: =IF('I:\[POINTS NQS  2011.XLS]30 Cube'!E26=0," ",'I:\[POINTS NQS  2011.XLS]30 Cube'!E26) -> Hillbilly Girl | E22: ='I:\[POINTS NQS  2011.XLS]30 Cube'!Z26 -> 70
A23: ='I:\[POINTS NQS  2011.XLS]30 Cube'!A27 -> 21 | B23: ='I:\[POINTS NQS  2011.XLS]30 Cube'!B27 -> Vicki Harman | C23: ='I:\[POINTS NQS  2011.XLS]30 Cube'!D27 -> 0 | D23: =IF('I:\[POINTS NQS  2011.XLS]30 Cube'!E27=0," ",'I:\[POINTS NQS  2011.XLS]30 Cube'!E27) -> Broke Again | E23: ='I:\[POINTS NQS  2011.XLS]30 Cube'!Z27 -> 71
A24: ='I:\[POINTS NQS  2011.XLS]30 Cube'!A28 -> 22 | B24: ='I:\[POINTS NQS  2011.XLS]30 Cube'!B28 -> Bud Casale | C24: ='I:\[POINTS NQS  2011.XLS]30 Cube'!D28 -> 11-403 | D24: =IF('I:\[POINTS NQS  2011.XLS]30 Cube'!E28=0," ",'I:\[POINTS NQS  2011.XLS]30 Cube'!E28) ->  | E24: ='I:\[POINTS NQS  2011.XLS]30 Cube'!Z28 -> 72
A25: ='I:\[POINTS NQS  2011.XLS]30 Cube'!A29 -> 23 | B25: ='I:\[POINTS NQS  2011.XLS]30 Cube'!B29 -> Shawn Garman | C25: ='I:\[POINTS NQS  2011.XLS]30 Cube'!D29 -> 11-230 | D25: =IF('I:\[POINTS NQS  2011.XLS]30 Cube'!E29=0," ",'I:\[POINTS NQS  2011.XLS]30 Cube'!E29) -> Gun Slinger | E25: ='I:\[POINTS NQS  2011.XLS]30 Cube'!Z29 -> 73
A26: ='I:\[POINTS NQS  2011.XLS]30 Cube'!A30 -> 24 | B26: ='I:\[POINTS NQS  2011.XLS]30 Cube'!B30 -> Patrick Roth | C26: ='I:\[POINTS NQS  2011.XLS]30 Cube'!D30 -> 11-061 | D26: =IF('I:\[POINTS NQS  2011.XLS]30 Cube'!E30=0," ",'I:\[POINTS NQS  2011.XLS]30 Cube'!E30) -> Widowmaker | E26: ='I:\[POINTS NQS  2011.XLS]30 Cube'!Z30 -> 74 | G26: Open Super Stock | K26: Thru Marietta
A27: ='I:\[POINTS NQS  2011.XLS]30 Cube'!A31 -> 25 | B27: ='I:\[POINTS NQS  2011.XLS]30 Cube'!B31 -> Mike Wall | C27: ='I:\[POINTS NQS  2011.XLS]30 Cube'!D31 -> 11-478 | D27: =IF('I:\[POINTS NQS  2011.XLS]30 Cube'!E31=0," ",'I:\[POINTS NQS  2011.XLS]30 Cube'!E31) -> Mow Docker | E27: ='I:\[POINTS NQS  2011.XLS]30 Cube'!Z31 -> 75 | H27: Name | I27: NQS # | J27: Tractor | K27: Points Back
A28: ='I:\[POINTS NQS  2011.XLS]30 Cube'!A32 -> 26 | B28: ='I:\[POINTS NQS  2011.XLS]30 Cube'!B32 -> Ben Larkins | C28: ='I:\[POINTS NQS  2011.XLS]30 Cube'!D32 -> 11-137 | D28: =IF('I:\[POINTS NQS  2011.XLS]30 Cube'!E32=0," ",'I:\[POINTS NQS  2011.XLS]30 Cube'!E32) -> Indian Outlaw | E28: ='I:\[POINTS NQS  2011.XLS]30 Cube'!Z32 -> 78 | G28: ='I:\[POINTS NQS  2011.XLS]Open Super Stock'!A7 -> 1 | H28: ='I:\[POINTS NQS  2011.XLS]Open Super Stock'!B7 -> Calvin Becker | I28: ='I:\[POINTS NQS  2011.XLS]Open Super Stock'!D7 -> 11-113 | J28: =IF('I:\[POINTS NQS  2011.XLS]Open Super Stock'!E7=0,"",'I:\[POINTS NQS  2011.XLS]Open Super Stock'!E7) -> Spike | K28: ='I:\[POINTS NQS  2011.XLS]Open Super Stock'!Z7 -> 0
A29: ='I:\[POINTS NQS  2011.XLS]30 Cube'!A33 -> 27 | B29: ='I:\[POINTS NQS  2011.XLS]30 Cube'!B33 -> Bob Shultz | C29: ='I:\[POINTS NQS  2011.XLS]30 Cube'!D33 -> 11-458 | D29: =IF('I:\[POINTS NQS  2011.XLS]30 Cube'!E33=0," ",'I:\[POINTS NQS  2011.XLS]30 Cube'!E33) -> Earth Bound | E29: ='I:\[POINTS NQS  2011.XLS]30 Cube'!Z33 -> 78 | G29: ='I:\[POINTS NQS  2011.XLS]Open Super Stock'!A8 -> 2 | H29: ='I:\[POINTS NQS  2011.XLS]Open Super Stock'!B8 -> Julian Stahl | I29: ='I:\[POINTS NQS  2011.XLS]Open Super Stock'!D8 -> 11-433 | J29: =IF('I:\[POINTS NQS  2011.XLS]Open Super Stock'!E8=0,"",'I:\[POINTS NQS  2011.XLS]Open Super Stock'!E8) -> Fully Charged | K29: ='I:\[POINTS NQS  2011.XLS]Open Super Stock'!Z8 -> 15
A30: ='I:\[POINTS NQS  2011.XLS]30 Cube'!A34 -> 28 | B30: ='I:\[POINTS NQS  2011.XLS]30 Cube'!B34 -> Bob Shultz | C30: ='I:\[POINTS NQS  2011.XLS]30 Cube'!D34 -> 11-459 | D30: =IF('I:\[POINTS NQS  2011.XLS]30 Cube'!E34=0," ",'I:\[POINTS NQS  2011.XLS]30 Cube'!E34) -> Red | E30: ='I:\[POINTS NQS  2011.XLS]30 Cube'!Z34 -> 78 | G30: ='I:\[POINTS NQS  2011.XLS]Open Super Stock'!A9 -> 3 | H30: ='I:\[POINTS NQS  2011.XLS]Open Super Stock'!B9 -> Harrison Stahl | I30: ='I:\[POINTS NQS  2011.XLS]Open Super Stock'!D9 -> 11-004 | J30: =IF('I:\[POINTS NQS  2011.XLS]Open Super Stock'!E9=0,"",'I:\[POINTS NQS  2011.XLS]Open Super Stock'!E9) -> Ton of Fun | K30: ='I:\[POINTS NQS  2011.XLS]Open Super Stock'!Z9 -> 34
G31: ='I:\[POINTS NQS  2011.XLS]Open Super Stock'!A10 -> 4 | H31: ='I:\[POINTS NQS  2011.XLS]Open Super Stock'!B10 -> Bruce Austin | I31: ='I:\[POINTS NQS  2011.XLS]Open Super Stock'!D10 -> 11-169 | J31: =IF('I:\[POINTS NQS  2011.XLS]Open Super Stock'!E10=0,"",'I:\[POINTS NQS  2011.XLS]Open Super Stock'!E10) -> Thundertaker | K31: ='I:\[POINTS NQS  2011.XLS]Open Super Stock'!Z10 -> 63
G32: ='I:\[POINTS NQS  2011.XLS]Open Super Stock'!A11 -> 5 | H32: ='I:\[POINTS NQS  2011.XLS]Open Super Stock'!B11 -> Ken Lucius | I32: ='I:\[POINTS NQS  2011.XLS]Open Super Stock'!D11 -> 11-266 | J32: =IF('I:\[POINTS NQS  2011.XLS]Open Super Stock'!E11=0,"",'I:\[POINTS NQS  2011.XLS]Open Super Stock'!E11) -> Smokers | K32: ='I:\[POINTS NQS  2011.XLS]Open Super Stock'!Z11 -> 67
G33: ='I:\[POINTS NQS  2011.XLS]Open Super Stock'!A12 -> 6 | H33: ='I:\[POINTS NQS  2011.XLS]Open Super Stock'!B12 -> Mark Brown | I33: ='I:\[POINTS NQS  2011.XLS]Open Super Stock'!D12 -> 11-261 | J33: =IF('I:\[POINTS NQS  2011.XLS]Open Super Stock'!E12=0,"",'I:\[POINTS NQS  2011.XLS]Open Super Stock'!E12) -> Bad Ideal | K33: ='I:\[POINTS NQS  2011.XLS]Open Super Stock'!Z12 -> 68
G34: ='I:\[POINTS NQS  2011.XLS]Open Super Stock'!A13 -> 7 | H34: ='I:\[POINTS NQS  2011.XLS]Open Super Stock'!B13 -> Jim Morgenstern | I34: ='I:\[POINTS NQS  2011.XLS]Open Super Stock'!D13 -> 11-460 | J34: =IF('I:\[POINTS NQS  2011.XLS]Open Super Stock'!E13=0,"",'I:\[POINTS NQS  2011.XLS]Open Super Stock'!E13) -> Ragin Deere | K34: ='I:\[POINTS NQS  2011.XLS]Open Super Stock'!Z13 -> 89
G35: ='I:\[POINTS NQS  2011.XLS]Open Super Stock'!A14 -> 8 | H35: ='I:\[POINTS NQS  2011.XLS]Open Super Stock'!B14 -> Jim Waite | I35: ='I:\[POINTS NQS  2011.XLS]Open Super Stock'!D14 -> 11-480 | J35: =IF('I:\[POINTS NQS  2011.XLS]Open Super Stock'!E14=0,"",'I:\[POINTS NQS  2011.XLS]Open Super Stock'!E14) ->  | K35: ='I:\[POINTS NQS  2011.XLS]Open Super Stock'!Z14 -> 115
G36: ='I:\[POINTS NQS  2011.XLS]Open Super Stock'!A15 -> 9 | H36: ='I:\[POINTS NQS  2011.XLS]Open Super Stock'!B15 -> Jamey Pierce | I36: ='I:\[POINTS NQS  2011.XLS]Open Super Stock'!D15 -> 11-031 | J36: =IF('I:\[POINTS NQS  2011.XLS]Open Super Stock'!E15=0,"",'I:\[POINTS NQS  2011.XLS]Open Super Stock'!E15) -> Siamese Twin | K36: ='I:\[POINTS NQS  2011.XLS]Open Super Stock'!Z15 -> 117
B37: PRO OUTLAW | E37: Thru Marietta | G37: ='I:\[POINTS NQS  2011.XLS]Open Super Stock'!A16 -> 10 | H37: ='I:\[POINTS NQS  2011.XLS]Open Super Stock'!B16 -> Jim Hall | I37: ='I:\[POINTS NQS  2011.XLS]Open Super Stock'!D16 -> 11-334 | J37: =IF('I:\[POINTS NQS  2011.XLS]Open Super Stock'!E16=0,"",'I:\[POINTS NQS  2011.XLS]Open Super Stock'!E16) -> Simply Irresistable | K37: ='I:\[POINTS NQS  2011.XLS]Open Super Stock'!Z16 -> 123
B38: Name | C38: NQS # | D38: Tractor | E38: Points Back | G38: ='I:\[POINTS NQS  2011.XLS]Open Super Stock'!A17 -> 11 | H38: ='I:\[POINTS NQS  2011.XLS]Open Super Stock'!B17 -> Ryan Shafer | I38: ='I:\[POINTS NQS  2011.XLS]Open Super Stock'!D17 -> 11-445 | J38: =IF('I:\[POINTS NQS  2011.XLS]Open Super Stock'!E17=0,"",'I:\[POINTS NQS  2011.XLS]Open Super Stock'!E17) -> Labret | K38: ='I:\[POINTS NQS  2011.XLS]Open Super Stock'!Z17 -> 147
A39: ='I:\[POINTS NQS  2011.XLS]Pro Outlaw'!A7 -> 1 | B39: ='I:\[POINTS NQS  2011.XLS]Pro Outlaw'!B7 -> Drew Burton | C39: ='I:\[POINTS NQS  2011.XLS]Pro Outlaw'!D7 -> 11-014 | D39: =IF('I:\[POINTS NQS  2011.XLS]Pro Outlaw'!E7=0," ",'I:\[POINTS NQS  2011.XLS]Pro Outlaw'!E7) -> Bad Company | E39: ='I:\[POINTS NQS  2011.XLS]Pro Outlaw'!Z7 -> 0
A40: ='I:\[POINTS NQS  2011.XLS]Pro Outlaw'!A8 -> 2 | B40: ='I:\[POINTS NQS  2011.XLS]Pro Outlaw'!B8 -> Russ Nichols | C40: ='I:\[POINTS NQS  2011.XLS]Pro Outlaw'!D8 -> 11-008 | D40: =IF('I:\[POINTS NQS  2011.XLS]Pro Outlaw'!E8=0," ",'I:\[POINTS NQS  2011.XLS]Pro Outlaw'!E8) -> Wicked Deere | E40: ='I:\[POINTS NQS  2011.XLS]Pro Outlaw'!Z8 -> 9
A41: ='I:\[POINTS NQS  2011.XLS]Pro Outlaw'!A9 -> 3 | B41: ='I:\[POINTS NQS  2011.XLS]Pro Outlaw'!B9 -> Harrison Stahl | C41: ='I:\[POINTS NQS  2011.XLS]Pro Outlaw'!D9 -> 11-336 | D41: =IF('I:\[POINTS NQS  2011.XLS]Pro Outlaw'!E9=0," ",'I:\[POINTS NQS  2011.XLS]Pro Outlaw'!E9) -> MWSC#4 | E41: ='I:\[POINTS NQS  2011.XLS]Pro Outlaw'!Z9 -> 32
A42: ='I:\[POINTS NQS  2011.XLS]Pro Outlaw'!A10 -> 4 | B42: ='I:\[POINTS NQS  2011.XLS]Pro Outlaw'!B10 -> Drew Burton | C42: ='I:\[POINTS NQS  2011.XLS]Pro Outlaw'!D10 -> 11-015 | D42: =IF('I:\[POINTS NQS  2011.XLS]Pro Outlaw'!E10=0," ",'I:\[POINTS NQS  2011.XLS]Pro Outlaw'!E10) -> Plain Nuts | E42: ='I:\[POINTS NQS  2011.XLS]Pro Outlaw'!Z10 -> 47
A43: 5 | B43: ='I:\[POINTS NQS  2011.XLS]Pro Outlaw'!B12 -> Kenny Cornelison | C43: ='I:\[POINTS NQS  2011.XLS]Pro Outlaw'!D12 -> 11-149 | D43: =IF('I:\[POINTS NQS  2011.XLS]Pro Outlaw'!E12=0," ",'I:\[POINTS NQS  2011.XLS]Pro Outlaw'!E12) -> Storm Alert | E43: ='I:\[POINTS NQS  2011.XLS]Pro Outlaw'!Z12 -> 59
A44: 6 | B44: ='I:\[POINTS NQS  2011.XLS]Pro Outlaw'!B11 -> Elaine Fisher | C44: ='I:\[POINTS NQS  2011.XLS]Pro Outlaw'!D11 -> 11-080 | D44: =IF('I:\[POINTS NQS  2011.XLS]Pro Outlaw'!E11=0," ",'I:\[POINTS NQS  2011.XLS]Pro Outlaw'!E11) -> Blue Thunder | E44: ='I:\[POINTS NQS  2011.XLS]Pro Outlaw'!Z11 -> 59
A45: ='I:\[POINTS NQS  2011.XLS]Pro Outlaw'!A13 -> 7 | B45: ='I:\[POINTS NQS  2011.XLS]Pro Outlaw'!B13 -> Daryl Musser | C45: ='I:\[POINTS NQS  2011.XLS]Pro Outlaw'!D13 -> 11-396 | D45: =IF('I:\[POINTS NQS  2011.XLS]Pro Outlaw'!E13=0," ",'I:\[POINTS NQS  2011.XLS]Pro Outlaw'!E13) -> 5 Cents | E45: ='I:\[POINTS NQS  2011.XLS]Pro Outlaw'!Z13 -> 61
A46: ='I:\[POINTS NQS  2011.XLS]Pro Outlaw'!A14 -> 8 | B46: ='I:\[POINTS NQS  2011.XLS]Pro Outlaw'!B14 -> David Gawatz | C46: ='I:\[POINTS NQS  2011.XLS]Pro Outlaw'!D14 -> 11-184 | D46: =IF('I:\[POINTS NQS  2011.XLS]Pro Outlaw'!E14=0," ",'I:\[POINTS NQS  2011.XLS]Pro Outlaw'!E14) -> Low Hung Buck | E46: ='I:\[POINTS NQS  2011.XLS]Pro Outlaw'!Z14 -> 63
A47: ='I:\[POINTS NQS  2011.XLS]Pro Outlaw'!A15 -> 9 | B47: ='I:\[POINTS NQS  2011.XLS]Pro Outlaw'!B15 -> Matt Kaster | C47: ='I:\[POINTS NQS  2011.XLS]Pro Outlaw'!D15 -> 11-099 | D47: =IF('I:\[POINTS NQS  2011.XLS]Pro Outlaw'!E15=0," ",'I:\[POINTS NQS  2011.XLS]Pro Outlaw'!E15) -> Super Freak | E47: ='I:\[POINTS NQS  2011.XLS]Pro Outlaw'!Z15 -> 67
A48: ='I:\[POINTS NQS  2011.XLS]Pro Outlaw'!A16 -> 10 | B48: ='I:\[POINTS NQS  2011.XLS]Pro Outlaw'!B16 -> Julian Stahl | C48: ='I:\[POINTS NQS  2011.XLS]Pro Outlaw'!D16 -> 11-001 | D48: =IF('I:\[POINTS NQS  2011.XLS]Pro Outlaw'!E16=0," ",'I:\[POINTS NQS  2011.XLS]Pro Outlaw'!E16) -> MWSC#1 | E48: ='I:\[POINTS NQS  2011.XLS]Pro Outlaw'!Z16 -> 71
A49: ='I:\[POINTS NQS  2011.XLS]Pro Outlaw'!A17 -> 11 | B49: ='I:\[POINTS NQS  2011.XLS]Pro Outlaw'!B17 -> Steve Williford | C49: ='I:\[POINTS NQS  2011.XLS]Pro Outlaw'!D17 -> 11-337 | D49: =IF('I:\[POINTS NQS  2011.XLS]Pro Outlaw'!E17=0," ",'I:\[POINTS NQS  2011.XLS]Pro Outlaw'!E17) -> IH Express | E49: ='I:\[POINTS NQS  2011.XLS]Pro Outlaw'!Z17 -> 82
A50: ='I:\[POINTS NQS  2011.XLS]Pro Outlaw'!A18 -> 12 | B50: ='I:\[POINTS NQS  2011.XLS]Pro Outlaw'!B18 -> Jeff Chrisman | C50: ='I:\[POINTS NQS  2011.XLS]Pro Outlaw'!D18 -> 11-394 | D50: =IF('I:\[POINTS NQS  2011.XLS]Pro Outlaw'!E18=0," ",'I:\[POINTS NQS  2011.XLS]Pro Outlaw'!E18) ->  | E50: ='I:\[POINTS NQS  2011.XLS]Pro Outlaw'!Z18 -> 87
A51: ='I:\[POINTS NQS  2011.XLS]Pro Outlaw'!A19 -> 13 | B51: ='I:\[POINTS NQS  2011.XLS]Pro Outlaw'!B19 -> Harrison Stahl | C51: ='I:\[POINTS NQS  2011.XLS]Pro Outlaw'!D19 -> 11-335 | D51: =IF('I:\[POINTS NQS  2011.XLS]Pro Outlaw'!E19=0," ",'I:\[POINTS NQS  2011.XLS]Pro Outlaw'!E19) -> MWSC#3 | E51: ='I:\[POINTS NQS  2011.XLS]Pro Outlaw'!Z19 -> 93
A52: ='I:\[POINTS NQS  2011.XLS]Pro Outlaw'!A20 -> 14 | B52: ='I:\[POINTS NQS  2011.XLS]Pro Outlaw'!B20 -> Jim Hull | C52: ='I:\[POINTS NQS  2011.XLS]Pro Outlaw'!D20 -> 11-334 | D52: =IF('I:\[POINTS NQS  2011.XLS]Pro Outlaw'!E20=0," ",'I:\[POINTS NQS  2011.XLS]Pro Outlaw'!E20) -> Simply Irresistable | E52: ='I:\[POINTS NQS  2011.XLS]Pro Outlaw'!Z20 -> 96
A53: ='I:\[POINTS NQS  2011.XLS]Pro Outlaw'!A21 -> 15 | B53: ='I:\[POINTS NQS  2011.XLS]Pro Outlaw'!B21 -> Cody Costa | C53: ='I:\[POINTS NQS  2011.XLS]Pro Outlaw'!D21 -> 11-397 | D53: =IF('I:\[POINTS NQS  2011.XLS]Pro Outlaw'!E21=0," ",'I:\[POINTS NQS  2011.XLS]Pro Outlaw'!E21) -> Crossthreaded | E53: ='I:\[POINTS NQS  2011.XLS]Pro Outlaw'!Z21 -> 99
A54: ='I:\[POINTS NQS  2011.XLS]Pro Outlaw'!A22 -> 16 | B54: ='I:\[POINTS NQS  2011.XLS]Pro Outlaw'!B22 -> Dan Schell | C54: ='I:\[POINTS NQS  2011.XLS]Pro Outlaw'!D22 -> 11-375 | D54: =IF('I:\[POINTS NQS  2011.XLS]Pro Outlaw'!E22=0," ",'I:\[POINTS NQS  2011.XLS]Pro Outlaw'!E22) -> Blind Ambition | E54: ='I:\[POINTS NQS  2011.XLS]Pro Outlaw'!Z22 -> 100
A55: ='I:\[POINTS NQS  2011.XLS]Pro Outlaw'!A23 -> 17 | B55: ='I:\[POINTS NQS  2011.XLS]Pro Outlaw'!B23 -> Julian Stahl | C55: ='I:\[POINTS NQS  2011.XLS]Pro Outlaw'!D23 -> 11-002 | D55: =IF('I:\[POINTS NQS  2011.XLS]Pro Outlaw'!E23=0," ",'I:\[POINTS NQS  2011.XLS]Pro Outlaw'!E23) -> MWSC#2 | E55: ='I:\[POINTS NQS  2011.XLS]Pro Outlaw'!Z23 -> 102
A56: ='I:\[POINTS NQS  2011.XLS]Pro Outlaw'!A24 -> 18 | B56: ='I:\[POINTS NQS  2011.XLS]Pro Outlaw'!B24 -> Harrision Stahl | C56: ='I:\[POINTS NQS  2011.XLS]Pro Outlaw'!D24 -> 11-004 | D56: =IF('I:\[POINTS NQS  2011.XLS]Pro Outlaw'!E24=0," ",'I:\[POINTS NQS  2011.XLS]Pro Outlaw'!E24) -> Tons of Fun | E56: ='I:\[POINTS NQS  2011.XLS]Pro Outlaw'!Z24 -> 104
A57: ='I:\[POINTS NQS  2011.XLS]Pro Outlaw'!A25 -> 19 | B57: ='I:\[POINTS NQS  2011.XLS]Pro Outlaw'!B25 -> Scott Bye | C57: ='I:\[POINTS NQS  2011.XLS]Pro Outlaw'!D25 -> 11-365 | D57: =IF('I:\[POINTS NQS  2011.XLS]Pro Outlaw'!E25=0," ",'I:\[POINTS NQS  2011.XLS]Pro Outlaw'!E25) -> Fired Up | E57: ='I:\[POINTS NQS  2011.XLS]Pro Outlaw'!Z25 -> 107
A58: ='I:\[POINTS NQS  2011.XLS]Pro Outlaw'!A26 -> 20 | B58: ='I:\[POINTS NQS  2011.XLS]Pro Outlaw'!B26 -> Christopher Wise | C58: ='I:\[POINTS NQS  2011.XLS]Pro Outlaw'!D26 -> 11-209 | D58: =IF('I:\[POINTS NQS  2011.XLS]Pro Outlaw'!E26=0," ",'I:\[POINTS NQS  2011.XLS]Pro Outlaw'!E26) -> Longshot | E58: ='I:\[POINTS NQS  2011.XLS]Pro Outlaw'!Z26 -> 112
A59: ='I:\[POINTS NQS  2011.XLS]Pro Outlaw'!A27 -> 21 | B59: ='I:\[POINTS NQS  2011.XLS]Pro Outlaw'!B27 -> Steve Vogler | C59: ='I:\[POINTS NQS  2011.XLS]Pro Outlaw'!D27 -> 11-476 | D59: =IF('I:\[POINTS NQS  2011.XLS]Pro Outlaw'!E27=0," ",'I:\[POINTS NQS  2011.XLS]Pro Outlaw'!E27) -> Outlaw Reloaded | E59: ='I:\[POINTS NQS  2011.XLS]Pro Outlaw'!Z27 -> 119
A60: ='I:\[POINTS NQS  2011.XLS]Pro Outlaw'!A28 -> 22 | B60: ='I:\[POINTS NQS  2011.XLS]Pro Outlaw'!B28 -> Bradley Corzine | C60: ='I:\[POINTS NQS  2011.XLS]Pro Outlaw'!D28 -> 11-368 | D60: =IF('I:\[POINTS NQS  2011.XLS]Pro Outlaw'!E28=0," ",'I:\[POINTS NQS  2011.XLS]Pro Outlaw'!E28) -> Just Black | E60: ='I:\[POINTS NQS  2011.XLS]Pro Outlaw'!Z28 -> 120
A61: ='I:\[POINTS NQS  2011.XLS]Pro Outlaw'!A29 -> 23 | B61: ='I:\[POINTS NQS  2011.XLS]Pro Outlaw'!B29 -> David Knapp | C61: ='I:\[POINTS NQS  2011.XLS]Pro Outlaw'!D29 -> 11-381 | D61: =IF('I:\[POINTS NQS  2011.XLS]Pro Outlaw'!E29=0," ",'I:\[POINTS NQS  2011.XLS]Pro Outlaw'!E29) -> Knapp Time | E61: ='I:\[POINTS NQS  2011.XLS]Pro Outlaw'!Z29 -> 125
A62: ='I:\[POINTS NQS  2011.XLS]Pro Outlaw'!A30 -> 24 | B62: ='I:\[POINTS NQS  2011.XLS]Pro Outlaw'!B30 -> Lowell Vis | C62: ='I:\[POINTS NQS  2011.XLS]Pro Outlaw'!D30 -> 11-333 | D62: =IF('I:\[POINTS NQS  2011.XLS]Pro Outlaw'!E30=0," ",'I:\[POINTS NQS  2011.XLS]Pro Outlaw'!E30) -> Skittles | E62: ='I:\[POINTS NQS  2011.XLS]Pro Outlaw'!Z30 -> 128
A63: ='I:\[POINTS NQS  2011.XLS]Pro Outlaw'!A31 -> 25 | B63: ='I:\[POINTS NQS  2011.XLS]Pro Outlaw'!B31 -> Russ Nichols | C63: ='I:\[POINTS NQS  2011.XLS]Pro Outlaw'!D31 -> 11-070 | D63: =IF('I:\[POINTS NQS  2011.XLS]Pro Outlaw'!E31=0," ",'I:\[POINTS NQS  2011.XLS]Pro Outlaw'!E31) -> Wild One 2 | E63: ='I:\[POINTS NQS  2011.XLS]Pro Outlaw'!Z31 -> 130
A64: ='I:\[POINTS NQS  2011.XLS]Pro Outlaw'!A32 -> 26 | B64: ='I:\[POINTS NQS  2011.XLS]Pro Outlaw'!B32 -> Steve Chrisman | C64: ='I:\[POINTS NQS  2011.XLS]Pro Outlaw'!D32 -> 11-069 | D64: =IF('I:\[POINTS NQS  2011.XLS]Pro Outlaw'!E32=0," ",'I:\[POINTS NQS  2011.XLS]Pro Outlaw'!E32) -> Top Secret | E64: ='I:\[POINTS NQS  2011.XLS]Pro Outlaw'!Z32 -> 136
A65: ='I:\[POINTS NQS  2011.XLS]Pro Outlaw'!A33 -> 27 | B65: ='I:\[POINTS NQS  2011.XLS]Pro Outlaw'!B33 -> Kevin Root | C65: ='I:\[POINTS NQS  2011.XLS]Pro Outlaw'!D33 -> 11-117 | D65: =IF('I:\[POINTS NQS  2011.XLS]Pro Outlaw'!E33=0," ",'I:\[POINTS NQS  2011.XLS]Pro Outlaw'!E33) -> Right on the Money | E65: ='I:\[POINTS NQS  2011.XLS]Pro Outlaw'!Z33 -> 136
A66: ='I:\[POINTS NQS  2011.XLS]Pro Outlaw'!A34 -> 28 | B66: ='I:\[POINTS NQS  2011.XLS]Pro Outlaw'!B34 -> Mike Garringer | C66: ='I:\[POINTS NQS  2011.XLS]Pro Outlaw'!D34 -> 11-401 | D66: =IF('I:\[POINTS NQS  2011.XLS]Pro Outlaw'!E34=0," ",'I:\[POINTS NQS  2011.XLS]Pro Outlaw'!E34) ->  | E66: ='I:\[POINTS NQS  2011.XLS]Pro Outlaw'!Z34 -> 145
A67: ='I:\[POINTS NQS  2011.XLS]Pro Outlaw'!A35 -> 29 | B67: ='I:\[POINTS NQS  2011.XLS]Pro Outlaw'!B35 -> Kevfin Root | C67: ='I:\[POINTS NQS  2011.XLS]Pro Outlaw'!D35 -> 11-118 | D67: =IF('I:\[POINTS NQS  2011.XLS]Pro Outlaw'!E35=0," ",'I:\[POINTS NQS  2011.XLS]Pro Outlaw'!E35) -> Slapshot | E67: ='I:\[POINTS NQS  2011.XLS]Pro Outlaw'!Z35 -> 147
A68: ='I:\[POINTS NQS  2011.XLS]Pro Outlaw'!A36 -> 30 | B68: ='I:\[POINTS NQS  2011.XLS]Pro Outlaw'!B36 -> Torrey Ahrens | C68: ='I:\[POINTS NQS  2011.XLS]Pro Outlaw'!D36 -> 11-455 | D68: =IF('I:\[POINTS NQS  2011.XLS]Pro Outlaw'!E36=0," ",'I:\[POINTS NQS  2011.XLS]Pro Outlaw'!E36) -> Cubic Dollars | E68: ='I:\[POINTS NQS  2011.XLS]Pro Outlaw'!Z36 -> 151
A69: ='I:\[POINTS NQS  2011.XLS]Pro Outlaw'!A37 -> 31 | B69: ='I:\[POINTS NQS  2011.XLS]Pro Outlaw'!B37 -> Jerry Everhart | C69: ='I:\[POINTS NQS  2011.XLS]Pro Outlaw'!D37 -> 11-483 | D69: =IF('I:\[POINTS NQS  2011.XLS]Pro Outlaw'!E37=0," ",'I:\[POINTS NQS  2011.XLS]Pro Outlaw'!E37) -> Orange Cart | E69: ='I:\[POINTS NQS  2011.XLS]Pro Outlaw'!Z37 -> 151
A70: ='I:\[POINTS NQS  2011.XLS]Pro Outlaw'!A38 -> 32 | B70: ='I:\[POINTS NQS  2011.XLS]Pro Outlaw'!B38 -> Nick Ferguson | C70: ='I:\[POINTS NQS  2011.XLS]Pro Outlaw'!D38 -> 11-343 | D70: =IF('I:\[POINTS NQS  2011.XLS]Pro Outlaw'!E38=0," ",'I:\[POINTS NQS  2011.XLS]Pro Outlaw'!E38) -> Border Partol | E70: ='I:\[POINTS NQS  2011.XLS]Pro Outlaw'!Z38 -> 152
A71: ='I:\[POINTS NQS  2011.XLS]Pro Outlaw'!A39 -> 33 | B71: ='I:\[POINTS NQS  2011.XLS]Pro Outlaw'!B39 -> Rob Wise | C71: ='I:\[POINTS NQS  2011.XLS]Pro Outlaw'!D39 -> 11-209 | D71: =IF('I:\[POINTS NQS  2011.XLS]Pro Outlaw'!E39=0," ",'I:\[POINTS NQS  2011.XLS]Pro Outlaw'!E39) ->  | E71: ='I:\[POINTS NQS  2011.XLS]Pro Outlaw'!Z39 -> 160
A72: ='I:\[POINTS NQS  2011.XLS]Pro Outlaw'!A40 -> 34 | B72: ='I:\[POINTS NQS  2011.XLS]Pro Outlaw'!B40 -> Larry Fox | C72: ='I:\[POINTS NQS  2011.XLS]Pro Outlaw'!D40 -> 11-007 | D72: =IF('I:\[POINTS NQS  2011.XLS]Pro Outlaw'!E40=0," ",'I:\[POINTS NQS  2011.XLS]Pro Outlaw'!E40) -> Intimidation | E72: ='I:\[POINTS NQS  2011.XLS]Pro Outlaw'!Z40 -> 167
A73: ='I:\[POINTS NQS  2011.XLS]Pro Outlaw'!A41 -> 35 | B73: ='I:\[POINTS NQS  2011.XLS]Pro Outlaw'!B41 -> Kelly Nichols | C73: ='I:\[POINTS NQS  2011.XLS]Pro Outlaw'!D41 -> 11-009 | D73: =IF('I:\[POINTS NQS  2011.XLS]Pro Outlaw'!E41=0," ",'I:\[POINTS NQS  2011.XLS]Pro Outlaw'!E41) -> Runaway Deere | E73: ='I:\[POINTS NQS  2011.XLS]Pro Outlaw'!Z41 -> 167
A74: ='I:\[POINTS NQS  2011.XLS]Pro Outlaw'!A42 -> 36 | B74: ='I:\[POINTS NQS  2011.XLS]Pro Outlaw'!B42 -> Nathan Nichols | C74: ='I:\[POINTS NQS  2011.XLS]Pro Outlaw'!D42 -> 11-151 | D74: =IF('I:\[POINTS NQS  2011.XLS]Pro Outlaw'!E42=0," ",'I:\[POINTS NQS  2011.XLS]Pro Outlaw'!E42) -> Wild Streak | E74: ='I:\[POINTS NQS  2011.XLS]Pro Outlaw'!Z42 -> 167
A75: ='I:\[POINTS NQS  2011.XLS]Pro Outlaw'!A43 -> 37 | B75: ='I:\[POINTS NQS  2011.XLS]Pro Outlaw'!B43 -> Shane Heits | C75: ='I:\[POINTS NQS  2011.XLS]Pro Outlaw'!D43 -> 11-367 | D75: =IF('I:\[POINTS NQS  2011.XLS]Pro Outlaw'!E43=0," ",'I:\[POINTS NQS  2011.XLS]Pro Outlaw'!E43) -> Lil Sprout | E75: ='I:\[POINTS NQS  2011.XLS]Pro Outlaw'!Z43 -> 168
A76: ='I:\[POINTS NQS  2011.XLS]Pro Outlaw'!A44 -> 38 | B76: ='I:\[POINTS NQS  2011.XLS]Pro Outlaw'!B44 -> Dustin Blair | C76: ='I:\[POINTS NQS  2011.XLS]Pro Outlaw'!D44 -> 11-380 | D76: =IF('I:\[POINTS NQS  2011.XLS]Pro Outlaw'!E44=0," ",'I:\[POINTS NQS  2011.XLS]Pro Outlaw'!E44) -> Armed & Dangerous | E76: ='I:\[POINTS NQS  2011.XLS]Pro Outlaw'!Z44 -> 168
A77: ='I:\[POINTS NQS  2011.XLS]Pro Outlaw'!A45 -> 39 | B77: ='I:\[POINTS NQS  2011.XLS]Pro Outlaw'!B45 -> Zach Richerson | C77: ='I:\[POINTS NQS  2011.XLS]Pro Outlaw'!D45 -> 11-348 | D77: =IF('I:\[POINTS NQS  2011.XLS]Pro Outlaw'!E45=0," ",'I:\[POINTS NQS  2011.XLS]Pro Outlaw'!E45) -> Zach's Rat | E77: ='I:\[POINTS NQS  2011.XLS]Pro Outlaw'!Z45 -> 169
A78: ='I:\[POINTS NQS  2011.XLS]Pro Outlaw'!A46 -> 40 | B78: ='I:\[POINTS NQS  2011.XLS]Pro Outlaw'!B46 -> Eric Varner | C78: ='I:\[POINTS NQS  2011.XLS]Pro Outlaw'!D46 -> 11-482 | D78: =IF('I:\[POINTS NQS  2011.XLS]Pro Outlaw'!E46=0," ",'I:\[POINTS NQS  2011.XLS]Pro Outlaw'!E46) ->  | E78: ='I:\[POINTS NQS  2011.XLS]Pro Outlaw'!Z46 -> 170
A79: ='I:\[POINTS NQS  2011.XLS]Pro Outlaw'!A47 -> 41 | B79: ='I:\[POINTS NQS  2011.XLS]Pro Outlaw'!B47 -> Jamey Pierce | C79: ='I:\[POINTS NQS  2011.XLS]Pro Outlaw'!D47 -> 11-031 | D79: =IF('I:\[POINTS NQS  2011.XLS]Pro Outlaw'!E47=0," ",'I:\[POINTS NQS  2011.XLS]Pro Outlaw'!E47) -> Siamese Twin | E79: ='I:\[POINTS NQS  2011.XLS]Pro Outlaw'!Z47 -> 171
A80: ='I:\[POINTS NQS  2011.XLS]Pro Outlaw'!A48 -> 42 | B80: ='I:\[POINTS NQS  2011.XLS]Pro Outlaw'!B48 -> Jim Spencer | C80: ='I:\[POINTS NQS  2011.XLS]Pro Outlaw'!D48 -> 11-112 | D80: =IF('I:\[POINTS NQS  2011.XLS]Pro Outlaw'!E48=0," ",'I:\[POINTS NQS  2011.XLS]Pro Outlaw'!E48) ->  | E80: ='I:\[POINTS NQS  2011.XLS]Pro Outlaw'!Z48 -> 171
A81: ='I:\[POINTS NQS  2011.XLS]Pro Outlaw'!A49 -> 43 | B81: ='I:\[POINTS NQS  2011.XLS]Pro Outlaw'!B49 -> Colyn Hammond | C81: ='I:\[POINTS NQS  2011.XLS]Pro Outlaw'!D49 -> 11-301 | D81: =IF('I:\[POINTS NQS  2011.XLS]Pro Outlaw'!E49=0," ",'I:\[POINTS NQS  2011.XLS]Pro Outlaw'!E49) -> Punisher | E81: ='I:\[POINTS NQS  2011.XLS]Pro Outlaw'!Z49 -> 172
A82: ='I:\[POINTS NQS  2011.XLS]Pro Outlaw'!A50 -> 44 | B82: ='I:\[POINTS NQS  2011.XLS]Pro Outlaw'!B50 -> Ryan Shafer | C82: ='I:\[POINTS NQS  2011.XLS]Pro Outlaw'!D50 -> 11-445 | D82: =IF('I:\[POINTS NQS  2011.XLS]Pro Outlaw'!E50=0," ",'I:\[POINTS NQS  2011.XLS]Pro Outlaw'!E50) -> Labrat | E82: ='I:\[POINTS NQS  2011.XLS]Pro Outlaw'!Z50 -> 172
A83: ='I:\[POINTS NQS  2011.XLS]Pro Outlaw'!A51 -> 45 | B83: ='I:\[POINTS NQS  2011.XLS]Pro Outlaw'!B51 -> Jim Morrison | C83: ='I:\[POINTS NQS  2011.XLS]Pro Outlaw'!D51 -> 11-452 | D83: =IF('I:\[POINTS NQS  2011.XLS]Pro Outlaw'!E51=0," ",'I:\[POINTS NQS  2011.XLS]Pro Outlaw'!E51) -> White | E83: ='I:\[POINTS NQS  2011.XLS]Pro Outlaw'!Z51 -> 172
A84: ='I:\[POINTS NQS  2011.XLS]Pro Outlaw'!A52 -> 46 | B84: ='I:\[POINTS NQS  2011.XLS]Pro Outlaw'!B52 -> Jeff Chrisman | C84: ='I:\[POINTS NQS  2011.XLS]Pro Outlaw'!D52 -> 11-180 | D84: =IF('I:\[POINTS NQS  2011.XLS]Pro Outlaw'!E52=0," ",'I:\[POINTS NQS  2011.XLS]Pro Outlaw'!E52) ->  | E84: ='I:\[POINTS NQS  2011.XLS]Pro Outlaw'!Z52 -> 173
A85: ='I:\[POINTS NQS  2011.XLS]Pro Outlaw'!A53 -> 47 | B85: ='I:\[POINTS NQS  2011.XLS]Pro Outlaw'!B53 -> Mike Spencer | C85: ='I:\[POINTS NQS  2011.XLS]Pro Outlaw'!D53 -> 11-347 | D85: =IF('I:\[POINTS NQS  2011.XLS]Pro Outlaw'!E53=0," ",'I:\[POINTS NQS  2011.XLS]Pro Outlaw'!E53) -> Twin Addition | E85: ='I:\[POINTS NQS  2011.XLS]Pro Outlaw'!Z53 -> 173
A86: ='I:\[POINTS NQS  2011.XLS]Pro Outlaw'!A54 -> 48 | B86: ='I:\[POINTS NQS  2011.XLS]Pro Outlaw'!B54 -> Mike Spencer | C86: ='I:\[POINTS NQS  2011.XLS]Pro Outlaw'!D54 -> 11-278 | D86: =IF('I:\[POINTS NQS  2011.XLS]Pro Outlaw'!E54=0," ",'I:\[POINTS NQS  2011.XLS]Pro Outlaw'!E54) ->  | E86: ='I:\[POINTS NQS  2011.XLS]Pro Outlaw'!Z54 -> 173
A87: ='I:\[POINTS NQS  2011.XLS]Pro Outlaw'!A55 -> 49 | B87: ='I:\[POINTS NQS  2011.XLS]Pro Outlaw'!B55 -> Don Vogt | C87: ='I:\[POINTS NQS  2011.XLS]Pro Outlaw'!D55 -> 11-090 | D87: =IF('I:\[POINTS NQS  2011.XLS]Pro Outlaw'!E55=0," ",'I:\[POINTS NQS  2011.XLS]Pro Outlaw'!E55) -> Not A Nuff | E87: ='I:\[POINTS NQS  2011.XLS]Pro Outlaw'!Z55 -> 174
B88: BUILDERS CUP
B89: PRO/SS ENGINE BUILDERS | E89: SA/OUTLAW
B91: ='I:\[POINTS NQS  2011.XLS]Builders Cup'!A4 -> NP = NICHOLS PERFORMANCE | C91: ='I:\[POINTS NQS  2011.XLS]Builders Cup'!I4 -> 159 | E91: ='I:\[POINTS NQS  2011.XLS]Builders Cup'!A20 -> BJ = BOB JONES | F91: ='I:\[POINTS NQS  2011.XLS]Builders Cup'!M20 -> 298
B92: ='I:\[POINTS NQS  2011.XLS]Builders Cup'!A5 -> MVP = MVP RACING | C92: ='I:\[POINTS NQS  2011.XLS]Builders Cup'!I5 -> 147 | E92: ='I:\[POINTS NQS  2011.XLS]Builders Cup'!A22 -> NP = NICHOLS PERFORMANCE | F92: ='I:\[POINTS NQS  2011.XLS]Builders Cup'!M22 -> 294
B93: ='I:\[POINTS NQS  2011.XLS]Builders Cup'!A6 -> JRS = JIMS REPAIR SERVICE | C93: ='I:\[POINTS NQS  2011.XLS]Builders Cup'!I6 -> 138 | E93: ='I:\[POINTS NQS  2011.XLS]Builders Cup'!A23 -> TV = TODD VORHEES | F93: ='I:\[POINTS NQS  2011.XLS]Builders Cup'!M23 -> 270
B94: ='I:\[POINTS NQS  2011.XLS]Builders Cup'!A7 -> LR = LAKOTA RACING | C94: ='I:\[POINTS NQS  2011.XLS]Builders Cup'!I7 -> 122 | E94: ='I:\[POINTS NQS  2011.XLS]Builders Cup'!A21 -> JRS = JIMS REPAIR SERVICE | F94: ='I:\[POINTS NQS  2011.XLS]Builders Cup'!M21 -> 253
B95: ='I:\[POINTS NQS  2011.XLS]Builders Cup'!A8 -> JW = JOE WHITWORTH | C95: ='I:\[POINTS NQS  2011.XLS]Builders Cup'!I8 -> 110 | E95: ='I:\[POINTS NQS  2011.XLS]Builders Cup'!A24 -> RPM = RADER | F95: ='I:\[POINTS NQS  2011.XLS]Builders Cup'!M24 -> 243
B96: ='I:\[POINTS NQS  2011.XLS]Builders Cup'!A9 -> VM = VOGEL MFG | C96: ='I:\[POINTS NQS  2011.XLS]Builders Cup'!I9 -> 84 | E96: ='I:\[POINTS NQS  2011.XLS]Builders Cup'!A25 -> JW = JOE WHITWORTH | F96: ='I:\[POINTS NQS  2011.XLS]Builders Cup'!M25 -> 191
B97: ='I:\[POINTS NQS  2011.XLS]Builders Cup'!A10 -> TC = TOOTER CAMPBELL | C97: ='I:\[POINTS NQS  2011.XLS]Builders Cup'!I10 -> 82 | E97: ='I:\[POINTS NQS  2011.XLS]Builders Cup'!A26 -> WOODS = DAVE WOODS | F97: ='I:\[POINTS NQS  2011.XLS]Builders Cup'!M26 -> 166
B98: ='I:\[POINTS NQS  2011.XLS]Builders Cup'!A11 -> GTP = MISHLER | C98: ='I:\[POINTS NQS  2011.XLS]Builders Cup'!I11 -> 71 | E98: ='I:\[POINTS NQS  2011.XLS]Builders Cup'!A27 -> VM = VOGEL MFG | F98: ='I:\[POINTS NQS  2011.XLS]Builders Cup'!M27 -> 146
B99: ='I:\[POINTS NQS  2011.XLS]Builders Cup'!A12 -> ROOT = KEVIN ROOT | C99: ='I:\[POINTS NQS  2011.XLS]Builders Cup'!I12 -> 55 | E99: ='I:\[POINTS NQS  2011.XLS]Builders Cup'!A28 -> LR = LAKOTA RACING | F99: ='I:\[POINTS NQS  2011.XLS]Builders Cup'!M28 -> 100
B100: ='I:\[POINTS NQS  2011.XLS]Builders Cup'!A13 -> HACKMAN = GREG HACKMAN | C100: ='I:\[POINTS NQS  2011.XLS]Builders Cup'!I13 -> 52 | E100: ='I:\[POINTS NQS  2011.XLS]Builders Cup'!A29 -> MVP = MVP RACING | F100: ='I:\[POINTS NQS  2011.XLS]Builders Cup'!M29 -> 76