A1: PRO STOCK | E1: Thru Marietta | H1: SUPER STOCK | L1: Thru Marietta
B2: Name | D2: NQS # | E2: Tractor | F2: Points Back | I2: Name | J2: Eng. | K2: NQS# | L2: Tractor | M2: Points Back
A3: ='I:\[POINTS NQS  2011.XLS]Pro Stock'!A7 -> 1 | B3: ='I:\[POINTS NQS  2011.XLS]Pro Stock'!B7 -> Drew Burton | C3: =IF('I:\[POINTS NQS  2011.XLS]Pro Stock'!C7=0," ",'I:\[POINTS NQS  2011.XLS]Pro Stock'!C7) -> NP | D3: ='I:\[POINTS NQS  2011.XLS]Pro Stock'!D7 -> 11-015 | E3: =IF('I:\[POINTS NQS  2011.XLS]Pro Stock'!E7=0," ",'I:\[POINTS NQS  2011.XLS]Pro Stock'!E7) -> Plain Nuts | F3: ='I:\[POINTS NQS  2011.XLS]Pro Stock'!Z7 -> 0 | H3: ='I:\[POINTS NQS  2011.XLS]Super Stock'!A7 -> 1 | I3: ='I:\[POINTS NQS  2011.XLS]Super Stock'!B7 -> Greg Curtsinger | J3: =IF('I:\[POINTS NQS  2011.XLS]Super Stock'!C7=0," ",'I:\[POINTS NQS  2011.XLS]Super Stock'!C7) -> NP | K3: ='I:\[POINTS NQS  2011.XLS]Super Stock'!D7 -> 11-008 | L3: =IF('I:\[POINTS NQS  2011.XLS]Super Stock'!E7=0," ",'I:\[POINTS NQS  2011.XLS]Super Stock'!E7) -> Wicked Deere | M3: ='I:\[POINTS NQS  2011.XLS]Super Stock'!Z7 -> 0 | N3: ='I:\[POINTS NQS  2011.XLS]Super Stock'!A101 -> 95 | O3: ='I:\[POINTS NQS  2011.XLS]Super Stock'!B101 -> Jared Fellers | P3: =IF('I:\[POINTS NQS  2011.XLS]Super Stock'!C101=0," ",'I:\[POINTS NQS  2011.XLS]Super Stock'!C101) ->  | Q3: ='I:\[POINTS NQS  2011.XLS]Super Stock'!D101 -> 0 | R3: =IF('I:\[POINTS NQS  2011.XLS]Super Stock'!E101=0," ",'I:\[POINTS NQS  2011.XLS]Super Stock'!E101) -> Money Pit | S3: ='I:\[POINTS NQS  2011.XLS]Super Stock'!Z101 -> 186
A4: ='I:\[POINTS NQS  2011.XLS]Pro Stock'!A8 -> 2 | B4: ='I:\[POINTS NQS  2011.XLS]Pro Stock'!B8 -> Drew Burton | C4: =IF('I:\[POINTS NQS  2011.XLS]Pro Stock'!C8=0," ",'I:\[POINTS NQS  2011.XLS]Pro Stock'!C8) -> NP | D4: ='I:\[POINTS NQS  2011.XLS]Pro Stock'!D8 -> 11-014 | E4: =IF('I:\[POINTS NQS  2011.XLS]Pro Stock'!E8=0," ",'I:\[POINTS NQS  2011.XLS]Pro Stock'!E8) -> Bad Company | F4: ='I:\[POINTS NQS  2011.XLS]Pro Stock'!Z8 -> 21 | H4: ='I:\[POINTS NQS  2011.XLS]Super Stock'!A8 -> 2 | I4: ='I:\[POINTS NQS  2011.XLS]Super Stock'!B8 -> Steve Williford | J4: =IF('I:\[POINTS NQS  2011.XLS]Super Stock'!C8=0," ",'I:\[POINTS NQS  2011.XLS]Super Stock'!C8) -> MVP | K4: ='I:\[POINTS NQS  2011.XLS]Super Stock'!D8 -> 11-337 | L4: =IF('I:\[POINTS NQS  2011.XLS]Super Stock'!E8=0," ",'I:\[POINTS NQS  2011.XLS]Super Stock'!E8) -> IH Express #2 | M4: ='I:\[POINTS NQS  2011.XLS]Super Stock'!Z8 -> 11 | N4: ='I:\[POINTS NQS  2011.XLS]Super Stock'!A102 -> 96 | O4: ='I:\[POINTS NQS  2011.XLS]Super Stock'!B102 -> Jeremy Jaspering | P4: =IF('I:\[POINTS NQS  2011.XLS]Super Stock'!C102=0," ",'I:\[POINTS NQS  2011.XLS]Super Stock'!C102) -> MVP | Q4: ='I:\[POINTS NQS  2011.XLS]Super Stock'!D102 -> 11-147 | R4: =IF('I:\[POINTS NQS  2011.XLS]Super Stock'!E102=0," ",'I:\[POINTS NQS  2011.XLS]Super Stock'!E102) -> Wicked | S4: ='I:\[POINTS NQS  2011.XLS]Super Stock'!Z102 -> 187
A5: ='I:\[POINTS NQS  2011.XLS]Pro Stock'!A9 -> 3 | B5: ='I:\[POINTS NQS  2011.XLS]Pro Stock'!B9 -> Randy Demers | C5: =IF('I:\[POINTS NQS  2011.XLS]Pro Stock'!C9=0," ",'I:\[POINTS NQS  2011.XLS]Pro Stock'!C9) -> NP | D5: ='I:\[POINTS NQS  2011.XLS]Pro Stock'!D9 -> 11-085 | E5: =IF('I:\[POINTS NQS  2011.XLS]Pro Stock'!E9=0," ",'I:\[POINTS NQS  2011.XLS]Pro Stock'!E9) -> Widowmaker | F5: ='I:\[POINTS NQS  2011.XLS]Pro Stock'!Z9 -> 40 | H5: ='I:\[POINTS NQS  2011.XLS]Super Stock'!A9 -> 3 | I5: ='I:\[POINTS NQS  2011.XLS]Super Stock'!B9 -> Larry Curtsinger | J5: =IF('I:\[POINTS NQS  2011.XLS]Super Stock'!C9=0," ",'I:\[POINTS NQS  2011.XLS]Super Stock'!C9) -> NP | K5: ='I:\[POINTS NQS  2011.XLS]Super Stock'!D9 -> 11-009 | L5: =IF('I:\[POINTS NQS  2011.XLS]Super Stock'!E9=0," ",'I:\[POINTS NQS  2011.XLS]Super Stock'!E9) -> Runaway Deere | M5: ='I:\[POINTS NQS  2011.XLS]Super Stock'!Z9 -> 13 | N5: ='I:\[POINTS NQS  2011.XLS]Super Stock'!A103 -> 97 | O5: ='I:\[POINTS NQS  2011.XLS]Super Stock'!B103 -> Richard Lucabaugh | P5: =IF('I:\[POINTS NQS  2011.XLS]Super Stock'!C103=0," ",'I:\[POINTS NQS  2011.XLS]Super Stock'!C103) ->  | Q5: ='I:\[POINTS NQS  2011.XLS]Super Stock'!D103 -> 0 | R5: =IF('I:\[POINTS NQS  2011.XLS]Super Stock'!E103=0," ",'I:\[POINTS NQS  2011.XLS]Super Stock'!E103) -> Cub | S5: ='I:\[POINTS NQS  2011.XLS]Super Stock'!Z103 -> 187
A6: ='I:\[POINTS NQS  2011.XLS]Pro Stock'!A10 -> 4 | B6: ='I:\[POINTS NQS  2011.XLS]Pro Stock'!B10 -> Kelly Nichols | C6: =IF('I:\[POINTS NQS  2011.XLS]Pro Stock'!C10=0," ",'I:\[POINTS NQS  2011.XLS]Pro Stock'!C10) -> NP | D6: ='I:\[POINTS NQS  2011.XLS]Pro Stock'!D10 -> 11-070 | E6: =IF('I:\[POINTS NQS  2011.XLS]Pro Stock'!E10=0," ",'I:\[POINTS NQS  2011.XLS]Pro Stock'!E10) -> Wild One 2 | F6: ='I:\[POINTS NQS  2011.XLS]Pro Stock'!Z10 -> 41 | H6: ='I:\[POINTS NQS  2011.XLS]Super Stock'!A10 -> 4 | I6: ='I:\[POINTS NQS  2011.XLS]Super Stock'!B10 -> Drew Burton | J6: =IF('I:\[POINTS NQS  2011.XLS]Super Stock'!C10=0," ",'I:\[POINTS NQS  2011.XLS]Super Stock'!C10) -> NP | K6: ='I:\[POINTS NQS  2011.XLS]Super Stock'!D10 -> 11-014 | L6: =IF('I:\[POINTS NQS  2011.XLS]Super Stock'!E10=0," ",'I:\[POINTS NQS  2011.XLS]Super Stock'!E10) -> Bad Company | M6: ='I:\[POINTS NQS  2011.XLS]Super Stock'!Z10 -> 14 | N6: ='I:\[POINTS NQS  2011.XLS]Super Stock'!A104 -> 98 | O6: ='I:\[POINTS NQS  2011.XLS]Super Stock'!B104 -> Tyler Hackman | P6: =IF('I:\[POINTS NQS  2011.XLS]Super Stock'!C104=0," ",'I:\[POINTS NQS  2011.XLS]Super Stock'!C104) ->  | Q6: ='I:\[POINTS NQS  2011.XLS]Super Stock'!D104 -> 0 | R6: =IF('I:\[POINTS NQS  2011.XLS]Super Stock'!E105=0," ",'I:\[POINTS NQS  2011.XLS]Super Stock'!E105) -> Silver Rocket | S6: ='I:\[POINTS NQS  2011.XLS]Super Stock'!Z104 -> 187
A7: ='I:\[POINTS NQS  2011.XLS]Pro Stock'!A11 -> 5 | B7: ='I:\[POINTS NQS  2011.XLS]Pro Stock'!B11 -> Jerry Skuta | C7: =IF('I:\[POINTS NQS  2011.XLS]Pro Stock'!C11=0," ",'I:\[POINTS NQS  2011.XLS]Pro Stock'!C11) -> NP | D7: ='I:\[POINTS NQS  2011.XLS]Pro Stock'!D11 -> 11-330 | E7: =IF('I:\[POINTS NQS  2011.XLS]Pro Stock'!E11=0," ",'I:\[POINTS NQS  2011.XLS]Pro Stock'!E11) -> Mental Health | F7: ='I:\[POINTS NQS  2011.XLS]Pro Stock'!Z11 -> 43 | H7: ='I:\[POINTS NQS  2011.XLS]Super Stock'!A11 -> 5 | I7: ='I:\[POINTS NQS  2011.XLS]Super Stock'!B11 -> Drew Burton | J7: =IF('I:\[POINTS NQS  2011.XLS]Super Stock'!C11=0," ",'I:\[POINTS NQS  2011.XLS]Super Stock'!C11) -> NP | K7: ='I:\[POINTS NQS  2011.XLS]Super Stock'!D11 -> 11-015 | L7: =IF('I:\[POINTS NQS  2011.XLS]Super Stock'!E11=0," ",'I:\[POINTS NQS  2011.XLS]Super Stock'!E11) -> Plain Nuts | M7: ='I:\[POINTS NQS  2011.XLS]Super Stock'!Z11 -> 33 | N7: ='I:\[POINTS NQS  2011.XLS]Super Stock'!A105 -> 99 | O7: ='I:\[POINTS NQS  2011.XLS]Super Stock'!B105 -> Jake Gingerich | P7: =IF('I:\[POINTS NQS  2011.XLS]Super Stock'!C105=0," ",'I:\[POINTS NQS  2011.XLS]Super Stock'!C105) -> JW | Q7: ='I:\[POINTS NQS  2011.XLS]Super Stock'!D105 -> 11-017 | R7: =IF('I:\[POINTS NQS  2011.XLS]Super Stock'!E106=0," ",'I:\[POINTS NQS  2011.XLS]Super Stock'!E106) -> Silver Fox | S7: ='I:\[POINTS NQS  2011.XLS]Super Stock'!Z105 -> 188
A8: ='I:\[POINTS NQS  2011.XLS]Pro Stock'!A12 -> 6 | B8: ='I:\[POINTS NQS  2011.XLS]Pro Stock'!B12 -> Todd Hammond | C8: =IF('I:\[POINTS NQS  2011.XLS]Pro Stock'!C12=0," ",'I:\[POINTS NQS  2011.XLS]Pro Stock'!C12) -> JRS | D8: ='I:\[POINTS NQS  2011.XLS]Pro Stock'!D12 -> 11-301 | E8: =IF('I:\[POINTS NQS  2011.XLS]Pro Stock'!E12=0," ",'I:\[POINTS NQS  2011.XLS]Pro Stock'!E12) -> Punisher | F8: ='I:\[POINTS NQS  2011.XLS]Pro Stock'!Z12 -> 44 | H8: ='I:\[POINTS NQS  2011.XLS]Super Stock'!A12 -> 6 | I8: ='I:\[POINTS NQS  2011.XLS]Super Stock'!B12 -> Scott Larkins | J8: =IF('I:\[POINTS NQS  2011.XLS]Super Stock'!C12=0," ",'I:\[POINTS NQS  2011.XLS]Super Stock'!C12) -> JRS | K8: ='I:\[POINTS NQS  2011.XLS]Super Stock'!D12 -> 11-154 | L8: =IF('I:\[POINTS NQS  2011.XLS]Super Stock'!E12=0," ",'I:\[POINTS NQS  2011.XLS]Super Stock'!E12) -> Silver Sam | M8: ='I:\[POINTS NQS  2011.XLS]Super Stock'!Z12 -> 35 | N8: ='I:\[POINTS NQS  2011.XLS]Super Stock'!A106 -> 100 | O8: ='I:\[POINTS NQS  2011.XLS]Super Stock'!B106 -> Jake Gingerich | P8: =IF('I:\[POINTS NQS  2011.XLS]Super Stock'!C106=0," ",'I:\[POINTS NQS  2011.XLS]Super Stock'!C106) -> JW | Q8: ='I:\[POINTS NQS  2011.XLS]Super Stock'!D106 -> 11-028 | R8: =IF('I:\[POINTS NQS  2011.XLS]Super Stock'!E107=0," ",'I:\[POINTS NQS  2011.XLS]Super Stock'!E107) -> Ricohet | S8: ='I:\[POINTS NQS  2011.XLS]Super Stock'!Z106 -> 188
A9: ='I:\[POINTS NQS  2011.XLS]Pro Stock'!A13 -> 7 | B9: ='I:\[POINTS NQS  2011.XLS]Pro Stock'!B13 -> Daryl Musser | C9: =IF('I:\[POINTS NQS  2011.XLS]Pro Stock'!C13=0," ",'I:\[POINTS NQS  2011.XLS]Pro Stock'!C13) -> NP | D9: ='I:\[POINTS NQS  2011.XLS]Pro Stock'!D13 -> 11-396 | E9: =IF('I:\[POINTS NQS  2011.XLS]Pro Stock'!E13=0," ",'I:\[POINTS NQS  2011.XLS]Pro Stock'!E13) -> 5 Cents | F9: ='I:\[POINTS NQS  2011.XLS]Pro Stock'!Z13 -> 45 | H9: ='I:\[POINTS NQS  2011.XLS]Super Stock'!A13 -> 7 | I9: ='I:\[POINTS NQS  2011.XLS]Super Stock'!B13 -> Julian Stahl | J9: =IF('I:\[POINTS NQS  2011.XLS]Super Stock'!C13=0," ",'I:\[POINTS NQS  2011.XLS]Super Stock'!C13) -> MVP | K9: ='I:\[POINTS NQS  2011.XLS]Super Stock'!D13 -> 11-001 | L9: =IF('I:\[POINTS NQS  2011.XLS]Super Stock'!E13=0," ",'I:\[POINTS NQS  2011.XLS]Super Stock'!E13) -> MWSC # 1 | M9: ='I:\[POINTS NQS  2011.XLS]Super Stock'!Z13 -> 40 | N9: ='I:\[POINTS NQS  2011.XLS]Super Stock'!A107 -> 101 | O9: ='I:\[POINTS NQS  2011.XLS]Super Stock'!B107 -> Rick Slade | P9: =IF('I:\[POINTS NQS  2011.XLS]Super Stock'!C107=0," ",'I:\[POINTS NQS  2011.XLS]Super Stock'!C107) -> JRS | Q9: ='I:\[POINTS NQS  2011.XLS]Super Stock'!D107 -> 11-467 | R9: =IF('I:\[POINTS NQS  2011.XLS]Super Stock'!E108=0," ",'I:\[POINTS NQS  2011.XLS]Super Stock'!E108) -> Gambler | S9: ='I:\[POINTS NQS  2011.XLS]Super Stock'!Z107 -> 191
A10: ='I:\[POINTS NQS  2011.XLS]Pro Stock'!A14 -> 8 | B10: ='I:\[POINTS NQS  2011.XLS]Pro Stock'!B14 -> John Innerest | C10: =IF('I:\[POINTS NQS  2011.XLS]Pro Stock'!C14=0," ",'I:\[POINTS NQS  2011.XLS]Pro Stock'!C14) -> NP | D10: ='I:\[POINTS NQS  2011.XLS]Pro Stock'!D14 -> 11-252 | E10: =IF('I:\[POINTS NQS  2011.XLS]Pro Stock'!E14=0," ",'I:\[POINTS NQS  2011.XLS]Pro Stock'!E14) -> Mean N Nasty | F10: ='I:\[POINTS NQS  2011.XLS]Pro Stock'!Z14 -> 48 | H10: ='I:\[POINTS NQS  2011.XLS]Super Stock'!A14 -> 8 | I10: ='I:\[POINTS NQS  2011.XLS]Super Stock'!B14 -> Eli Zimmerman | J10: =IF('I:\[POINTS NQS  2011.XLS]Super Stock'!C14=0," ",'I:\[POINTS NQS  2011.XLS]Super Stock'!C14) -> NP | K10: ='I:\[POINTS NQS  2011.XLS]Super Stock'!D14 -> 11-456 | L10: =IF('I:\[POINTS NQS  2011.XLS]Super Stock'!E14=0," ",'I:\[POINTS NQS  2011.XLS]Super Stock'!E14) -> Lot of Nichols | M10: ='I:\[POINTS NQS  2011.XLS]Super Stock'!Z14 -> 41 | N10: ='I:\[POINTS NQS  2011.XLS]Super Stock'!A108 -> 102 | O10: ='I:\[POINTS NQS  2011.XLS]Super Stock'!B108 -> Ron Scroggins | P10: =IF('I:\[POINTS NQS  2011.XLS]Super Stock'!C108=0," ",'I:\[POINTS NQS  2011.XLS]Super Stock'!C108) -> VM | Q10: ='I:\[POINTS NQS  2011.XLS]Super Stock'!D108 -> 11-419 | R10: =IF('I:\[POINTS NQS  2011.XLS]Super Stock'!E109=0," ",'I:\[POINTS NQS  2011.XLS]Super Stock'!E109) -> Iron Deere | S10: ='I:\[POINTS NQS  2011.XLS]Super Stock'!Z108 -> 192
A11: ='I:\[POINTS NQS  2011.XLS]Pro Stock'!A15 -> 9 | B11: ='I:\[POINTS NQS  2011.XLS]Pro Stock'!B15 -> Cody Costa | C11: =IF('I:\[POINTS NQS  2011.XLS]Pro Stock'!C15=0," ",'I:\[POINTS NQS  2011.XLS]Pro Stock'!C15) -> NP | D11: ='I:\[POINTS NQS  2011.XLS]Pro Stock'!D15 -> 11-397 | E11: =IF('I:\[POINTS NQS  2011.XLS]Pro Stock'!E15=0," ",'I:\[POINTS NQS  2011.XLS]Pro Stock'!E15) -> Crossthreaded | F11: ='I:\[POINTS NQS  2011.XLS]Pro Stock'!Z15 -> 51 | H11: ='I:\[POINTS NQS  2011.XLS]Super Stock'!A15 -> 9 | I11: ='I:\[POINTS NQS  2011.XLS]Super Stock'!B15 -> Larry Fox | J11: =IF('I:\[POINTS NQS  2011.XLS]Super Stock'!C15=0," ",'I:\[POINTS NQS  2011.XLS]Super Stock'!C15) -> JRS | K11: ='I:\[POINTS NQS  2011.XLS]Super Stock'!D15 -> 11-007 | L11: =IF('I:\[POINTS NQS  2011.XLS]Super Stock'!E15=0," ",'I:\[POINTS NQS  2011.XLS]Super Stock'!E15) -> Intimidation | M11: ='I:\[POINTS NQS  2011.XLS]Super Stock'!Z15 -> 42 | N11: ='I:\[POINTS NQS  2011.XLS]Super Stock'!A109 -> 103 | O11: ='I:\[POINTS NQS  2011.XLS]Super Stock'!B109 -> Timmy Dickerson | P11: =IF('I:\[POINTS NQS  2011.XLS]Super Stock'!C109=0," ",'I:\[POINTS NQS  2011.XLS]Super Stock'!C109) -> TC | Q11: ='I:\[POINTS NQS  2011.XLS]Super Stock'!D109 -> 11-461 | R11: =IF('I:\[POINTS NQS  2011.XLS]Super Stock'!E110=0," ",'I:\[POINTS NQS  2011.XLS]Super Stock'!E110) -> Orange Blossem Spe | S11: ='I:\[POINTS NQS  2011.XLS]Super Stock'!Z109 -> 192
A12: ='I:\[POINTS NQS  2011.XLS]Pro Stock'!A16 -> 10 | B12: ='I:\[POINTS NQS  2011.XLS]Pro Stock'!B16 -> Greg Curtsinger | C12: =IF('I:\[POINTS NQS  2011.XLS]Pro Stock'!C16=0," ",'I:\[POINTS NQS  2011.XLS]Pro Stock'!C16) -> NP | D12: ='I:\[POINTS NQS  2011.XLS]Pro Stock'!D16 -> 11-008 | E12: =IF('I:\[POINTS NQS  2011.XLS]Pro Stock'!E16=0," ",'I:\[POINTS NQS  2011.XLS]Pro Stock'!E16) -> Wicked Deere | F12: ='I:\[POINTS NQS  2011.XLS]Pro Stock'!Z16 -> 52 | H12: ='I:\[POINTS NQS  2011.XLS]Super Stock'!A16 -> 10 | I12: ='I:\[POINTS NQS  2011.XLS]Super Stock'!B16 -> Scott Bye | J12: =IF('I:\[POINTS NQS  2011.XLS]Super Stock'!C16=0," ",'I:\[POINTS NQS  2011.XLS]Super Stock'!C16) -> NP | K12: ='I:\[POINTS NQS  2011.XLS]Super Stock'!D16 -> 11-365 | L12: =IF('I:\[POINTS NQS  2011.XLS]Super Stock'!E16=0," ",'I:\[POINTS NQS  2011.XLS]Super Stock'!E16) -> Fired Up | M12: ='I:\[POINTS NQS  2011.XLS]Super Stock'!Z16 -> 46 | N12: ='I:\[POINTS NQS  2011.XLS]Super Stock'!A110 -> 104 | O12: ='I:\[POINTS NQS  2011.XLS]Super Stock'!B110 -> Lee Blesch | P12: =IF('I:\[POINTS NQS  2011.XLS]Super Stock'!C110=0," ",'I:\[POINTS NQS  2011.XLS]Super Stock'!C110) -> TC | Q12: ='I:\[POINTS NQS  2011.XLS]Super Stock'!D110 -> 11-344 | R12: =IF('I:\[POINTS NQS  2011.XLS]Super Stock'!E111=0," ",'I:\[POINTS NQS  2011.XLS]Super Stock'!E111) -> Lil Sprout | S12: ='I:\[POINTS NQS  2011.XLS]Super Stock'!Z110 -> 193
A13: ='I:\[POINTS NQS  2011.XLS]Pro Stock'!A17 -> 11 | B13: ='I:\[POINTS NQS  2011.XLS]Pro Stock'!B17 -> Eli Zimmerman | C13: =IF('I:\[POINTS NQS  2011.XLS]Pro Stock'!C17=0," ",'I:\[POINTS NQS  2011.XLS]Pro Stock'!C17) -> NP | D13: ='I:\[POINTS NQS  2011.XLS]Pro Stock'!D17 -> 11-456 | E13: =IF('I:\[POINTS NQS  2011.XLS]Pro Stock'!E17=0," ",'I:\[POINTS NQS  2011.XLS]Pro Stock'!E17) -> Lots of Nichols | F13: ='I:\[POINTS NQS  2011.XLS]Pro Stock'!Z17 -> 53 | H13: ='I:\[POINTS NQS  2011.XLS]Super Stock'!A17 -> 11 | I13: ='I:\[POINTS NQS  2011.XLS]Super Stock'!B17 -> Don Vogt | J13: =IF('I:\[POINTS NQS  2011.XLS]Super Stock'!C17=0," ",'I:\[POINTS NQS  2011.XLS]Super Stock'!C17) -> MVP | K13: ='I:\[POINTS NQS  2011.XLS]Super Stock'!D17 -> 11-090 | L13: =IF('I:\[POINTS NQS  2011.XLS]Super Stock'!E17=0," ",'I:\[POINTS NQS  2011.XLS]Super Stock'!E17) -> Not A Nuff | M13: ='I:\[POINTS NQS  2011.XLS]Super Stock'!Z17 -> 47 | N13: ='I:\[POINTS NQS  2011.XLS]Super Stock'!A111 -> 105 | O13: ='I:\[POINTS NQS  2011.XLS]Super Stock'!B111 -> Shane Heits | P13: =IF('I:\[POINTS NQS  2011.XLS]Super Stock'!C111=0," ",'I:\[POINTS NQS  2011.XLS]Super Stock'!C111) -> LR | Q13: ='I:\[POINTS NQS  2011.XLS]Super Stock'!D111 -> 11-367 | R13: =IF('I:\[POINTS NQS  2011.XLS]Super Stock'!E112=0," ",'I:\[POINTS NQS  2011.XLS]Super Stock'!E112) -> Double Down Deere | S13: ='I:\[POINTS NQS  2011.XLS]Super Stock'!Z111 -> 193
A14: ='I:\[POINTS NQS  2011.XLS]Pro Stock'!A18 -> 12 | B14: ='I:\[POINTS NQS  2011.XLS]Pro Stock'!B18 -> Jerry Skuta | C14: =IF('I:\[POINTS NQS  2011.XLS]Pro Stock'!C18=0," ",'I:\[POINTS NQS  2011.XLS]Pro Stock'!C18) -> NP | D14: ='I:\[POINTS NQS  2011.XLS]Pro Stock'!D18 -> 11-329 | E14: =IF('I:\[POINTS NQS  2011.XLS]Pro Stock'!E18=0," ",'I:\[POINTS NQS  2011.XLS]Pro Stock'!E18) -> Green Tractor | F14: ='I:\[POINTS NQS  2011.XLS]Pro Stock'!Z18 -> 57 | H14: ='I:\[POINTS NQS  2011.XLS]Super Stock'!A18 -> 12 | I14: ='I:\[POINTS NQS  2011.XLS]Super Stock'!B18 -> Jerry Skuta | J14: =IF('I:\[POINTS NQS  2011.XLS]Super Stock'!C18=0," ",'I:\[POINTS NQS  2011.XLS]Super Stock'!C18) -> NP | K14: ='I:\[POINTS NQS  2011.XLS]Super Stock'!D18 -> 11-330 | L14: =IF('I:\[POINTS NQS  2011.XLS]Super Stock'!E18=0," ",'I:\[POINTS NQS  2011.XLS]Super Stock'!E18) -> Mental Health 2 | M14: ='I:\[POINTS NQS  2011.XLS]Super Stock'!Z18 -> 60 | N14: ='I:\[POINTS NQS  2011.XLS]Super Stock'!A112 -> 106 | O14: ='I:\[POINTS NQS  2011.XLS]Super Stock'!B112 -> Jack Jaspering | P14: =IF('I:\[POINTS NQS  2011.XLS]Super Stock'!C112=0," ",'I:\[POINTS NQS  2011.XLS]Super Stock'!C112) -> LR | Q14: ='I:\[POINTS NQS  2011.XLS]Super Stock'!D112 -> 11-148 | R14: =IF('I:\[POINTS NQS  2011.XLS]Super Stock'!E113=0," ",'I:\[POINTS NQS  2011.XLS]Super Stock'!E113) ->  | S14: ='I:\[POINTS NQS  2011.XLS]Super Stock'!Z112 -> 194
A15: ='I:\[POINTS NQS  2011.XLS]Pro Stock'!A19 -> 13 | B15: ='I:\[POINTS NQS  2011.XLS]Pro Stock'!B19 -> Ed Nichols | C15: =IF('I:\[POINTS NQS  2011.XLS]Pro Stock'!C19=0," ",'I:\[POINTS NQS  2011.XLS]Pro Stock'!C19) -> LR | D15: ='I:\[POINTS NQS  2011.XLS]Pro Stock'!D19 -> 11-124 | E15: =IF('I:\[POINTS NQS  2011.XLS]Pro Stock'!E19=0," ",'I:\[POINTS NQS  2011.XLS]Pro Stock'!E19) -> Track Attack | F15: ='I:\[POINTS NQS  2011.XLS]Pro Stock'!Z19 -> 63 | H15: ='I:\[POINTS NQS  2011.XLS]Super Stock'!A19 -> 13 | I15: ='I:\[POINTS NQS  2011.XLS]Super Stock'!B19 -> Daryl Musser | J15: =IF('I:\[POINTS NQS  2011.XLS]Super Stock'!C19=0," ",'I:\[POINTS NQS  2011.XLS]Super Stock'!C19) -> NP | K15: ='I:\[POINTS NQS  2011.XLS]Super Stock'!D19 -> 11-396 | L15: =IF('I:\[POINTS NQS  2011.XLS]Super Stock'!E19=0," ",'I:\[POINTS NQS  2011.XLS]Super Stock'!E19) -> 5 Cents | M15: ='I:\[POINTS NQS  2011.XLS]Super Stock'!Z19 -> 66
A16: ='I:\[POINTS NQS  2011.XLS]Pro Stock'!A20 -> 14 | B16: ='I:\[POINTS NQS  2011.XLS]Pro Stock'!B20 -> Greg Watson | C16: =IF('I:\[POINTS NQS  2011.XLS]Pro Stock'!C20=0," ",'I:\[POINTS NQS  2011.XLS]Pro Stock'!C20) -> LR | D16: ='I:\[POINTS NQS  2011.XLS]Pro Stock'!D20 -> 11-079 | E16: =IF('I:\[POINTS NQS  2011.XLS]Pro Stock'!E20=0," ",'I:\[POINTS NQS  2011.XLS]Pro Stock'!E20) -> Bearly Legal | F16: ='I:\[POINTS NQS  2011.XLS]Pro Stock'!Z20 -> 65 | H16: ='I:\[POINTS NQS  2011.XLS]Super Stock'!A20 -> 14 | I16: ='I:\[POINTS NQS  2011.XLS]Super Stock'!B20 -> Julian Stahl | J16: =IF('I:\[POINTS NQS  2011.XLS]Super Stock'!C20=0," ",'I:\[POINTS NQS  2011.XLS]Super Stock'!C20) -> MVP | K16: ='I:\[POINTS NQS  2011.XLS]Super Stock'!D20 -> 11-002 | L16: =IF('I:\[POINTS NQS  2011.XLS]Super Stock'!E20=0," ",'I:\[POINTS NQS  2011.XLS]Super Stock'!E20) -> MWSC # 2 | M16: ='I:\[POINTS NQS  2011.XLS]Super Stock'!Z20 -> 67
A17: ='I:\[POINTS NQS  2011.XLS]Pro Stock'!A21 -> 15 | B17: ='I:\[POINTS NQS  2011.XLS]Pro Stock'!B21 -> Gerald Gerber | C17: =IF('I:\[POINTS NQS  2011.XLS]Pro Stock'!C21=0," ",'I:\[POINTS NQS  2011.XLS]Pro Stock'!C21) -> NP | D17: ='I:\[POINTS NQS  2011.XLS]Pro Stock'!D21 -> 11-175 | E17: =IF('I:\[POINTS NQS  2011.XLS]Pro Stock'!E21=0," ",'I:\[POINTS NQS  2011.XLS]Pro Stock'!E21) -> Wisconsin Hooker | F17: ='I:\[POINTS NQS  2011.XLS]Pro Stock'!Z21 -> 65 | H17: ='I:\[POINTS NQS  2011.XLS]Super Stock'!A21 -> 15 | I17: ='I:\[POINTS NQS  2011.XLS]Super Stock'!B21 -> Randy Demers | J17: =IF('I:\[POINTS NQS  2011.XLS]Super Stock'!C21=0," ",'I:\[POINTS NQS  2011.XLS]Super Stock'!C21) -> NP | K17: ='I:\[POINTS NQS  2011.XLS]Super Stock'!D21 -> 11-085 | L17: =IF('I:\[POINTS NQS  2011.XLS]Super Stock'!E21=0," ",'I:\[POINTS NQS  2011.XLS]Super Stock'!E21) -> Widowmaker | M17: ='I:\[POINTS NQS  2011.XLS]Super Stock'!Z21 -> 75
A18: ='I:\[POINTS NQS  2011.XLS]Pro Stock'!A22 -> 16 | B18: ='I:\[POINTS NQS  2011.XLS]Pro Stock'!B22 -> Eli Zimmerman | C18: =IF('I:\[POINTS NQS  2011.XLS]Pro Stock'!C22=0," ",'I:\[POINTS NQS  2011.XLS]Pro Stock'!C22) -> NP | D18: ='I:\[POINTS NQS  2011.XLS]Pro Stock'!D22 -> 11-074 | E18: =IF('I:\[POINTS NQS  2011.XLS]Pro Stock'!E22=0," ",'I:\[POINTS NQS  2011.XLS]Pro Stock'!E22) -> Red Fever | F18: ='I:\[POINTS NQS  2011.XLS]Pro Stock'!Z22 -> 67 | H18: ='I:\[POINTS NQS  2011.XLS]Super Stock'!A22 -> 16 | I18: ='I:\[POINTS NQS  2011.XLS]Super Stock'!B22 -> Steve Williford | J18: =IF('I:\[POINTS NQS  2011.XLS]Super Stock'!C22=0," ",'I:\[POINTS NQS  2011.XLS]Super Stock'!C22) -> MVP | K18: ='I:\[POINTS NQS  2011.XLS]Super Stock'!D22 -> 11-276 | L18: =IF('I:\[POINTS NQS  2011.XLS]Super Stock'!E22=0," ",'I:\[POINTS NQS  2011.XLS]Super Stock'!E22) -> IH Express #1 | M18: ='I:\[POINTS NQS  2011.XLS]Super Stock'!Z22 -> 80
A19: ='I:\[POINTS NQS  2011.XLS]Pro Stock'!A23 -> 17 | B19: ='I:\[POINTS NQS  2011.XLS]Pro Stock'!B23 -> Jerry Binkley | C19: =IF('I:\[POINTS NQS  2011.XLS]Pro Stock'!C23=0," ",'I:\[POINTS NQS  2011.XLS]Pro Stock'!C23) -> MVP | D19: ='I:\[POINTS NQS  2011.XLS]Pro Stock'!D23 -> 11-092 | E19: =IF('I:\[POINTS NQS  2011.XLS]Pro Stock'!E23=0," ",'I:\[POINTS NQS  2011.XLS]Pro Stock'!E23) -> Grandpa's Toy | F19: ='I:\[POINTS NQS  2011.XLS]Pro Stock'!Z23 -> 67 | H19: ='I:\[POINTS NQS  2011.XLS]Super Stock'!A23 -> 17 | I19: ='I:\[POINTS NQS  2011.XLS]Super Stock'!B23 -> Mike Kyle | J19: =IF('I:\[POINTS NQS  2011.XLS]Super Stock'!C23=0," ",'I:\[POINTS NQS  2011.XLS]Super Stock'!C23) -> VM | K19: ='I:\[POINTS NQS  2011.XLS]Super Stock'!D23 -> 11-394 | L19: =IF('I:\[POINTS NQS  2011.XLS]Super Stock'!E23=0," ",'I:\[POINTS NQS  2011.XLS]Super Stock'!E23) ->  | M19: ='I:\[POINTS NQS  2011.XLS]Super Stock'!Z23 -> 81
A20: ='I:\[POINTS NQS  2011.XLS]Pro Stock'!A24 -> 18 | B20: ='I:\[POINTS NQS  2011.XLS]Pro Stock'!B24 -> Steve Williford | C20: =IF('I:\[POINTS NQS  2011.XLS]Pro Stock'!C24=0," ",'I:\[POINTS NQS  2011.XLS]Pro Stock'!C24) -> MVP | D20: ='I:\[POINTS NQS  2011.XLS]Pro Stock'!D24 -> 11-276 | E20: =IF('I:\[POINTS NQS  2011.XLS]Pro Stock'!E24=0," ",'I:\[POINTS NQS  2011.XLS]Pro Stock'!E24) -> IH Express | F20: ='I:\[POINTS NQS  2011.XLS]Pro Stock'!Z24 -> 67 | H20: ='I:\[POINTS NQS  2011.XLS]Super Stock'!A24 -> 18 | I20: ='I:\[POINTS NQS  2011.XLS]Super Stock'!B24 -> Ray Gentz | J20: =IF('I:\[POINTS NQS  2011.XLS]Super Stock'!C24=0," ",'I:\[POINTS NQS  2011.XLS]Super Stock'!C24) -> VM | K20: ='I:\[POINTS NQS  2011.XLS]Super Stock'!D24 -> 11-034 | L20: =IF('I:\[POINTS NQS  2011.XLS]Super Stock'!E24=0," ",'I:\[POINTS NQS  2011.XLS]Super Stock'!E24) -> Just Enough | M20: ='I:\[POINTS NQS  2011.XLS]Super Stock'!Z24 -> 83
A21: ='I:\[POINTS NQS  2011.XLS]Pro Stock'!A25 -> 19 | B21: ='I:\[POINTS NQS  2011.XLS]Pro Stock'!B25 -> Larry Fox | C21: =IF('I:\[POINTS NQS  2011.XLS]Pro Stock'!C25=0," ",'I:\[POINTS NQS  2011.XLS]Pro Stock'!C25) -> JRS | D21: ='I:\[POINTS NQS  2011.XLS]Pro Stock'!D25 -> 11-007 | E21: =IF('I:\[POINTS NQS  2011.XLS]Pro Stock'!E25=0," ",'I:\[POINTS NQS  2011.XLS]Pro Stock'!E25) -> Intimidation | F21: ='I:\[POINTS NQS  2011.XLS]Pro Stock'!Z25 -> 75 | H21: ='I:\[POINTS NQS  2011.XLS]Super Stock'!A25 -> 19 | I21: ='I:\[POINTS NQS  2011.XLS]Super Stock'!B25 -> Harrison Stahl | J21: =IF('I:\[POINTS NQS  2011.XLS]Super Stock'!C25=0," ",'I:\[POINTS NQS  2011.XLS]Super Stock'!C25) -> MVP | K21: ='I:\[POINTS NQS  2011.XLS]Super Stock'!D25 -> 11-335 | L21: =IF('I:\[POINTS NQS  2011.XLS]Super Stock'!E25=0," ",'I:\[POINTS NQS  2011.XLS]Super Stock'!E25) -> MWSC # 3 | M21: ='I:\[POINTS NQS  2011.XLS]Super Stock'!Z25 -> 84
A22: ='I:\[POINTS NQS  2011.XLS]Pro Stock'!A26 -> 20 | B22: ='I:\[POINTS NQS  2011.XLS]Pro Stock'!B26 -> Scott Larkins | C22: =IF('I:\[POINTS NQS  2011.XLS]Pro Stock'!C26=0," ",'I:\[POINTS NQS  2011.XLS]Pro Stock'!C26) -> JRS | D22: ='I:\[POINTS NQS  2011.XLS]Pro Stock'!D26 -> 11-154 | E22: =IF('I:\[POINTS NQS  2011.XLS]Pro Stock'!E26=0," ",'I:\[POINTS NQS  2011.XLS]Pro Stock'!E26) -> Silver Sam | F22: ='I:\[POINTS NQS  2011.XLS]Pro Stock'!Z26 -> 85 | H22: ='I:\[POINTS NQS  2011.XLS]Super Stock'!A26 -> 20 | I22: ='I:\[POINTS NQS  2011.XLS]Super Stock'!B26 -> Greg Watson | J22: =IF('I:\[POINTS NQS  2011.XLS]Super Stock'!C26=0," ",'I:\[POINTS NQS  2011.XLS]Super Stock'!C26) -> LR | K22: ='I:\[POINTS NQS  2011.XLS]Super Stock'!D26 -> 11-079 | L22: =IF('I:\[POINTS NQS  2011.XLS]Super Stock'!E26=0," ",'I:\[POINTS NQS  2011.XLS]Super Stock'!E26) -> Bearly Legal | M22: ='I:\[POINTS NQS  2011.XLS]Super Stock'!Z26 -> 93
A23: ='I:\[POINTS NQS  2011.XLS]Pro Stock'!A27 -> 21 | B23: ='I:\[POINTS NQS  2011.XLS]Pro Stock'!B27 -> Doug Diehl | C23: =IF('I:\[POINTS NQS  2011.XLS]Pro Stock'!C27=0," ",'I:\[POINTS NQS  2011.XLS]Pro Stock'!C27) -> NP | D23: ='I:\[POINTS NQS  2011.XLS]Pro Stock'!D27 -> 11-441 | E23: =IF('I:\[POINTS NQS  2011.XLS]Pro Stock'!E27=0," ",'I:\[POINTS NQS  2011.XLS]Pro Stock'!E27) -> Excedrin | F23: ='I:\[POINTS NQS  2011.XLS]Pro Stock'!Z27 -> 93 | H23: ='I:\[POINTS NQS  2011.XLS]Super Stock'!A27 -> 21 | I23: ='I:\[POINTS NQS  2011.XLS]Super Stock'!B27 -> John Cress | J23: =IF('I:\[POINTS NQS  2011.XLS]Super Stock'!C27=0," ",'I:\[POINTS NQS  2011.XLS]Super Stock'!C27) -> JW | K23: ='I:\[POINTS NQS  2011.XLS]Super Stock'!D27 -> 11-172 | L23: =IF('I:\[POINTS NQS  2011.XLS]Super Stock'!E27=0," ",'I:\[POINTS NQS  2011.XLS]Super Stock'!E27) -> Full Tilt | M23: ='I:\[POINTS NQS  2011.XLS]Super Stock'!Z27 -> 93
A24: ='I:\[POINTS NQS  2011.XLS]Pro Stock'!A28 -> 22 | B24: ='I:\[POINTS NQS  2011.XLS]Pro Stock'!B28 -> Kevin Root | C24: =IF('I:\[POINTS NQS  2011.XLS]Pro Stock'!C28=0," ",'I:\[POINTS NQS  2011.XLS]Pro Stock'!C28) -> Root | D24: ='I:\[POINTS NQS  2011.XLS]Pro Stock'!D28 -> 11-118 | E24: =IF('I:\[POINTS NQS  2011.XLS]Pro Stock'!E28=0," ",'I:\[POINTS NQS  2011.XLS]Pro Stock'!E28) -> Slap Shot | F24: ='I:\[POINTS NQS  2011.XLS]Pro Stock'!Z28 -> 95 | H24: ='I:\[POINTS NQS  2011.XLS]Super Stock'!A28 -> 22 | I24: ='I:\[POINTS NQS  2011.XLS]Super Stock'!B28 -> Harrison Stahl | J24: =IF('I:\[POINTS NQS  2011.XLS]Super Stock'!C28=0," ",'I:\[POINTS NQS  2011.XLS]Super Stock'!C28) -> MVP | K24: ='I:\[POINTS NQS  2011.XLS]Super Stock'!D28 -> 11-336 | L24: =IF('I:\[POINTS NQS  2011.XLS]Super Stock'!E28=0," ",'I:\[POINTS NQS  2011.XLS]Super Stock'!E28) -> MWSC # 4 | M24: ='I:\[POINTS NQS  2011.XLS]Super Stock'!Z28 -> 98
A25: ='I:\[POINTS NQS  2011.XLS]Pro Stock'!A29 -> 23 | B25: ='I:\[POINTS NQS  2011.XLS]Pro Stock'!B29 -> Mark Davis | C25: =IF('I:\[POINTS NQS  2011.XLS]Pro Stock'!C29=0," ",'I:\[POINTS NQS  2011.XLS]Pro Stock'!C29) -> JRS | D25: ='I:\[POINTS NQS  2011.XLS]Pro Stock'!D29 -> 11-067 | E25: =IF('I:\[POINTS NQS  2011.XLS]Pro Stock'!E29=0," ",'I:\[POINTS NQS  2011.XLS]Pro Stock'!E29) -> No Limits | F25: ='I:\[POINTS NQS  2011.XLS]Pro Stock'!Z29 -> 98 | H25: ='I:\[POINTS NQS  2011.XLS]Super Stock'!A29 -> 23 | I25: ='I:\[POINTS NQS  2011.XLS]Super Stock'!B29 -> Todd Hammond | J25: =IF('I:\[POINTS NQS  2011.XLS]Super Stock'!C29=0," ",'I:\[POINTS NQS  2011.XLS]Super Stock'!C29) -> JRS | K25: ='I:\[POINTS NQS  2011.XLS]Super Stock'!D29 -> 11-301 | L25: =IF('I:\[POINTS NQS  2011.XLS]Super Stock'!E29=0," ",'I:\[POINTS NQS  2011.XLS]Super Stock'!E29) -> Punisher | M25: ='I:\[POINTS NQS  2011.XLS]Super Stock'!Z29 -> 105
A26: ='I:\[POINTS NQS  2011.XLS]Pro Stock'!A30 -> 24 | B26: ='I:\[POINTS NQS  2011.XLS]Pro Stock'!B30 -> Nick Mishler | C26: =IF('I:\[POINTS NQS  2011.XLS]Pro Stock'!C30=0," ",'I:\[POINTS NQS  2011.XLS]Pro Stock'!C30) -> GTP | D26: ='I:\[POINTS NQS  2011.XLS]Pro Stock'!D30 -> 11-167 | E26: =IF('I:\[POINTS NQS  2011.XLS]Pro Stock'!E30=0," ",'I:\[POINTS NQS  2011.XLS]Pro Stock'!E30) -> Pulse | F26: ='I:\[POINTS NQS  2011.XLS]Pro Stock'!Z30 -> 98 | H26: ='I:\[POINTS NQS  2011.XLS]Super Stock'!A30 -> 24 | I26: ='I:\[POINTS NQS  2011.XLS]Super Stock'!B30 -> Matt Kaster | J26: =IF('I:\[POINTS NQS  2011.XLS]Super Stock'!C30=0," ",'I:\[POINTS NQS  2011.XLS]Super Stock'!C30) -> MVP | K26: ='I:\[POINTS NQS  2011.XLS]Super Stock'!D30 -> 11-098 | L26: =IF('I:\[POINTS NQS  2011.XLS]Super Stock'!E30=0," ",'I:\[POINTS NQS  2011.XLS]Super Stock'!E30) -> Moose | M26: ='I:\[POINTS NQS  2011.XLS]Super Stock'!Z30 -> 107
A27: ='I:\[POINTS NQS  2011.XLS]Pro Stock'!A31 -> 25 | B27: ='I:\[POINTS NQS  2011.XLS]Pro Stock'!B31 -> Clyde Mishler | C27: =IF('I:\[POINTS NQS  2011.XLS]Pro Stock'!C31=0," ",'I:\[POINTS NQS  2011.XLS]Pro Stock'!C31) -> GTP | D27: ='I:\[POINTS NQS  2011.XLS]Pro Stock'!D31 -> 11-168 | E27: =IF('I:\[POINTS NQS  2011.XLS]Pro Stock'!E31=0," ",'I:\[POINTS NQS  2011.XLS]Pro Stock'!E31) ->  | F27: ='I:\[POINTS NQS  2011.XLS]Pro Stock'!Z31 -> 98 | H27: ='I:\[POINTS NQS  2011.XLS]Super Stock'!A31 -> 25 | I27: ='I:\[POINTS NQS  2011.XLS]Super Stock'!B31 -> Ed Nichols | J27: =IF('I:\[POINTS NQS  2011.XLS]Super Stock'!C31=0," ",'I:\[POINTS NQS  2011.XLS]Super Stock'!C31) -> LR | K27: ='I:\[POINTS NQS  2011.XLS]Super Stock'!D31 -> 11-124 | L27: =IF('I:\[POINTS NQS  2011.XLS]Super Stock'!E31=0," ",'I:\[POINTS NQS  2011.XLS]Super Stock'!E31) -> Track Attack | M27: ='I:\[POINTS NQS  2011.XLS]Super Stock'!Z31 -> 107
A28: ='I:\[POINTS NQS  2011.XLS]Pro Stock'!A32 -> 26 | B28: ='I:\[POINTS NQS  2011.XLS]Pro Stock'!B32 -> Nathan Nichols | C28: =IF('I:\[POINTS NQS  2011.XLS]Pro Stock'!C32=0," ",'I:\[POINTS NQS  2011.XLS]Pro Stock'!C32) -> LR | D28: ='I:\[POINTS NQS  2011.XLS]Pro Stock'!D32 -> 11-151 | E28: =IF('I:\[POINTS NQS  2011.XLS]Pro Stock'!E32=0," ",'I:\[POINTS NQS  2011.XLS]Pro Stock'!E32) -> Wild Streak | F28: ='I:\[POINTS NQS  2011.XLS]Pro Stock'!Z32 -> 100 | H28: ='I:\[POINTS NQS  2011.XLS]Super Stock'!A32 -> 26 | I28: ='I:\[POINTS NQS  2011.XLS]Super Stock'!B32 -> Kevin Root | J28: =IF('I:\[POINTS NQS  2011.XLS]Super Stock'!C32=0," ",'I:\[POINTS NQS  2011.XLS]Super Stock'!C32) -> Root | K28: ='I:\[POINTS NQS  2011.XLS]Super Stock'!D32 -> 11-118 | L28: =IF('I:\[POINTS NQS  2011.XLS]Super Stock'!E32=0," ",'I:\[POINTS NQS  2011.XLS]Super Stock'!E32) -> Slap Shot | M28: ='I:\[POINTS NQS  2011.XLS]Super Stock'!Z32 -> 108
A29: ='I:\[POINTS NQS  2011.XLS]Pro Stock'!A33 -> 27 | B29: ='I:\[POINTS NQS  2011.XLS]Pro Stock'!B33 -> Ray Gentz | C29: =IF('I:\[POINTS NQS  2011.XLS]Pro Stock'!C33=0," ",'I:\[POINTS NQS  2011.XLS]Pro Stock'!C33) -> JRS | D29: ='I:\[POINTS NQS  2011.XLS]Pro Stock'!D33 -> 11-262 | E29: =IF('I:\[POINTS NQS  2011.XLS]Pro Stock'!E33=0," ",'I:\[POINTS NQS  2011.XLS]Pro Stock'!E33) -> Chaos | F29: ='I:\[POINTS NQS  2011.XLS]Pro Stock'!Z33 -> 103 | H29: ='I:\[POINTS NQS  2011.XLS]Super Stock'!A33 -> 27 | I29: ='I:\[POINTS NQS  2011.XLS]Super Stock'!B33 -> Eli Zimmerman | J29: =IF('I:\[POINTS NQS  2011.XLS]Super Stock'!C33=0," ",'I:\[POINTS NQS  2011.XLS]Super Stock'!C33) -> NP | K29: ='I:\[POINTS NQS  2011.XLS]Super Stock'!D33 -> 11-074 | L29: =IF('I:\[POINTS NQS  2011.XLS]Super Stock'!E33=0," ",'I:\[POINTS NQS  2011.XLS]Super Stock'!E33) -> Red Fever | M29: ='I:\[POINTS NQS  2011.XLS]Super Stock'!Z33 -> 109
A30: ='I:\[POINTS NQS  2011.XLS]Pro Stock'!A34 -> 28 | B30: ='I:\[POINTS NQS  2011.XLS]Pro Stock'!B34 -> Julian Stahl | C30: =IF('I:\[POINTS NQS  2011.XLS]Pro Stock'!C34=0," ",'I:\[POINTS NQS  2011.XLS]Pro Stock'!C34) -> MVP | D30: ='I:\[POINTS NQS  2011.XLS]Pro Stock'!D34 -> 11-001 | E30: =IF('I:\[POINTS NQS  2011.XLS]Pro Stock'!E34=0," ",'I:\[POINTS NQS  2011.XLS]Pro Stock'!E34) -> MWSC # 1 | F30: ='I:\[POINTS NQS  2011.XLS]Pro Stock'!Z34 -> 105 | H30: ='I:\[POINTS NQS  2011.XLS]Super Stock'!A34 -> 28 | I30: ='I:\[POINTS NQS  2011.XLS]Super Stock'!B34 -> Steve Williford | J30: =IF('I:\[POINTS NQS  2011.XLS]Super Stock'!C34=0," ",'I:\[POINTS NQS  2011.XLS]Super Stock'!C34) -> MVP | K30: ='I:\[POINTS NQS  2011.XLS]Super Stock'!D34 -> 11-177 | L30: =IF('I:\[POINTS NQS  2011.XLS]Super Stock'!E34=0," ",'I:\[POINTS NQS  2011.XLS]Super Stock'!E34) -> Williford Trucking IH | M30: ='I:\[POINTS NQS  2011.XLS]Super Stock'!Z34 -> 110
A31: ='I:\[POINTS NQS  2011.XLS]Pro Stock'!A35 -> 29 | B31: ='I:\[POINTS NQS  2011.XLS]Pro Stock'!B35 -> Ray Gentz | C31: =IF('I:\[POINTS NQS  2011.XLS]Pro Stock'!C35=0," ",'I:\[POINTS NQS  2011.XLS]Pro Stock'!C35) -> VM | D31: ='I:\[POINTS NQS  2011.XLS]Pro Stock'!D35 -> 11-034 | E31: =IF('I:\[POINTS NQS  2011.XLS]Pro Stock'!E35=0," ",'I:\[POINTS NQS  2011.XLS]Pro Stock'!E35) -> Just Enough | F31: ='I:\[POINTS NQS  2011.XLS]Pro Stock'!Z35 -> 105 | H31: ='I:\[POINTS NQS  2011.XLS]Super Stock'!A35 -> 29 | I31: ='I:\[POINTS NQS  2011.XLS]Super Stock'!B35 -> Cody Costa | J31: =IF('I:\[POINTS NQS  2011.XLS]Super Stock'!C35=0," ",'I:\[POINTS NQS  2011.XLS]Super Stock'!C35) -> NP | K31: ='I:\[POINTS NQS  2011.XLS]Super Stock'!D35 -> 11-397 | L31: =IF('I:\[POINTS NQS  2011.XLS]Super Stock'!E35=0," ",'I:\[POINTS NQS  2011.XLS]Super Stock'!E35) -> Crossthreaded | M31: ='I:\[POINTS NQS  2011.XLS]Super Stock'!Z35 -> 110
A32: ='I:\[POINTS NQS  2011.XLS]Pro Stock'!A36 -> 30 | B32: ='I:\[POINTS NQS  2011.XLS]Pro Stock'!B36 -> Steve Williford | C32: =IF('I:\[POINTS NQS  2011.XLS]Pro Stock'!C36=0," ",'I:\[POINTS NQS  2011.XLS]Pro Stock'!C36) -> MVP | D32: ='I:\[POINTS NQS  2011.XLS]Pro Stock'!D36 -> 11-337 | E32: =IF('I:\[POINTS NQS  2011.XLS]Pro Stock'!E36=0," ",'I:\[POINTS NQS  2011.XLS]Pro Stock'!E36) -> IH Express 2 | F32: ='I:\[POINTS NQS  2011.XLS]Pro Stock'!Z36 -> 105 | H32: ='I:\[POINTS NQS  2011.XLS]Super Stock'!A36 -> 30 | I32: ='I:\[POINTS NQS  2011.XLS]Super Stock'!B36 -> Larry Korff | J32: =IF('I:\[POINTS NQS  2011.XLS]Super Stock'!C36=0," ",'I:\[POINTS NQS  2011.XLS]Super Stock'!C36) -> TC | K32: ='I:\[POINTS NQS  2011.XLS]Super Stock'!D36 -> 11-398 | L32: =IF('I:\[POINTS NQS  2011.XLS]Super Stock'!E36=0," ",'I:\[POINTS NQS  2011.XLS]Super Stock'!E36) -> Kryptonite | M32: ='I:\[POINTS NQS  2011.XLS]Super Stock'!Z36 -> 110
A33: ='I:\[POINTS NQS  2011.XLS]Pro Stock'!A37 -> 31 | B33: ='I:\[POINTS NQS  2011.XLS]Pro Stock'!B37 -> Scott Bye | C33: =IF('I:\[POINTS NQS  2011.XLS]Pro Stock'!C37=0," ",'I:\[POINTS NQS  2011.XLS]Pro Stock'!C37) -> NP | D33: ='I:\[POINTS NQS  2011.XLS]Pro Stock'!D37 -> 11-365 | E33: =IF('I:\[POINTS NQS  2011.XLS]Pro Stock'!E37=0," ",'I:\[POINTS NQS  2011.XLS]Pro Stock'!E37) -> Fired Up | F33: ='I:\[POINTS NQS  2011.XLS]Pro Stock'!Z37 -> 107 | H33: ='I:\[POINTS NQS  2011.XLS]Super Stock'!A37 -> 31 | I33: ='I:\[POINTS NQS  2011.XLS]Super Stock'!B37 -> Steve Williford | J33: =IF('I:\[POINTS NQS  2011.XLS]Super Stock'!C37=0," ",'I:\[POINTS NQS  2011.XLS]Super Stock'!C37) -> MVP | K33: ='I:\[POINTS NQS  2011.XLS]Super Stock'!D37 -> 11-176 | L33: =IF('I:\[POINTS NQS  2011.XLS]Super Stock'!E37=0," ",'I:\[POINTS NQS  2011.XLS]Super Stock'!E37) -> International | M33: ='I:\[POINTS NQS  2011.XLS]Super Stock'!Z37 -> 111
A34: ='I:\[POINTS NQS  2011.XLS]Pro Stock'!A38 -> 32 | B34: ='I:\[POINTS NQS  2011.XLS]Pro Stock'!B38 -> Larry Curtsinger | C34: =IF('I:\[POINTS NQS  2011.XLS]Pro Stock'!C38=0," ",'I:\[POINTS NQS  2011.XLS]Pro Stock'!C38) -> NP | D34: ='I:\[POINTS NQS  2011.XLS]Pro Stock'!D38 -> 11-009 | E34: =IF('I:\[POINTS NQS  2011.XLS]Pro Stock'!E38=0," ",'I:\[POINTS NQS  2011.XLS]Pro Stock'!E38) -> Runaway Deere | F34: ='I:\[POINTS NQS  2011.XLS]Pro Stock'!Z38 -> 108 | H34: ='I:\[POINTS NQS  2011.XLS]Super Stock'!A38 -> 32 | I34: ='I:\[POINTS NQS  2011.XLS]Super Stock'!B38 -> Dave Mashler | J34: =IF('I:\[POINTS NQS  2011.XLS]Super Stock'!C38=0," ",'I:\[POINTS NQS  2011.XLS]Super Stock'!C38) -> Mashler | K34: ='I:\[POINTS NQS  2011.XLS]Super Stock'!D38 -> 11-163 | L34: =IF('I:\[POINTS NQS  2011.XLS]Super Stock'!E38=0," ",'I:\[POINTS NQS  2011.XLS]Super Stock'!E38) ->  | M34: ='I:\[POINTS NQS  2011.XLS]Super Stock'!Z38 -> 112
A35: ='I:\[POINTS NQS  2011.XLS]Pro Stock'!A39 -> 33 | B35: ='I:\[POINTS NQS  2011.XLS]Pro Stock'!B39 -> Bruce Austin | C35: =IF('I:\[POINTS NQS  2011.XLS]Pro Stock'!C39=0," ",'I:\[POINTS NQS  2011.XLS]Pro Stock'!C39) -> MVP | D35: ='I:\[POINTS NQS  2011.XLS]Pro Stock'!D39 -> 11-338 | E35: =IF('I:\[POINTS NQS  2011.XLS]Pro Stock'!E39=0," ",'I:\[POINTS NQS  2011.XLS]Pro Stock'!E39) -> Hillbilly Headache | F35: ='I:\[POINTS NQS  2011.XLS]Pro Stock'!Z39 -> 112 | H35: ='I:\[POINTS NQS  2011.XLS]Super Stock'!A39 -> 33 | I35: ='I:\[POINTS NQS  2011.XLS]Super Stock'!B39 -> Nick Mishler | J35: =IF('I:\[POINTS NQS  2011.XLS]Super Stock'!C39=0," ",'I:\[POINTS NQS  2011.XLS]Super Stock'!C39) -> GTP | K35: ='I:\[POINTS NQS  2011.XLS]Super Stock'!D39 -> 11-167 | L35: =IF('I:\[POINTS NQS  2011.XLS]Super Stock'!E39=0," ",'I:\[POINTS NQS  2011.XLS]Super Stock'!E39) -> Pulse | M35: ='I:\[POINTS NQS  2011.XLS]Super Stock'!Z39 -> 115
A36: ='I:\[POINTS NQS  2011.XLS]Pro Stock'!A40 -> 34 | B36: ='I:\[POINTS NQS  2011.XLS]Pro Stock'!B40 -> John Donavan | C36: =IF('I:\[POINTS NQS  2011.XLS]Pro Stock'!C40=0," ",'I:\[POINTS NQS  2011.XLS]Pro Stock'!C40) -> JRS | D36: ='I:\[POINTS NQS  2011.XLS]Pro Stock'!D40 -> 11-006 | E36: =IF('I:\[POINTS NQS  2011.XLS]Pro Stock'!E40=0," ",'I:\[POINTS NQS  2011.XLS]Pro Stock'!E40) -> John's Deere | F36: ='I:\[POINTS NQS  2011.XLS]Pro Stock'!Z40 -> 114 | H36: ='I:\[POINTS NQS  2011.XLS]Super Stock'!A40 -> 34 | I36: ='I:\[POINTS NQS  2011.XLS]Super Stock'!B40 -> Ray Gentz | J36: =IF('I:\[POINTS NQS  2011.XLS]Super Stock'!C40=0," ",'I:\[POINTS NQS  2011.XLS]Super Stock'!C40) -> JRS | K36: ='I:\[POINTS NQS  2011.XLS]Super Stock'!D40 -> 11-035 | L36: =IF('I:\[POINTS NQS  2011.XLS]Super Stock'!E40=0," ",'I:\[POINTS NQS  2011.XLS]Super Stock'!E40) -> B.U. Cub | M36: ='I:\[POINTS NQS  2011.XLS]Super Stock'!Z40 -> 116
A37: ='I:\[POINTS NQS  2011.XLS]Pro Stock'!A41 -> 35 | B37: ='I:\[POINTS NQS  2011.XLS]Pro Stock'!B41 -> David Knapp | C37: =IF('I:\[POINTS NQS  2011.XLS]Pro Stock'!C41=0," ",'I:\[POINTS NQS  2011.XLS]Pro Stock'!C41) -> MVP | D37: ='I:\[POINTS NQS  2011.XLS]Pro Stock'!D41 -> 11-381 | E37: =IF('I:\[POINTS NQS  2011.XLS]Pro Stock'!E41=0," ",'I:\[POINTS NQS  2011.XLS]Pro Stock'!E41) -> Knapp Time | F37: ='I:\[POINTS NQS  2011.XLS]Pro Stock'!Z41 -> 116 | H37: ='I:\[POINTS NQS  2011.XLS]Super Stock'!A41 -> 35 | I37: ='I:\[POINTS NQS  2011.XLS]Super Stock'!B41 -> John Cress | J37: =IF('I:\[POINTS NQS  2011.XLS]Super Stock'!C41=0," ",'I:\[POINTS NQS  2011.XLS]Super Stock'!C41) -> JW | K37: ='I:\[POINTS NQS  2011.XLS]Super Stock'!D41 -> 11-170 | L37: =IF('I:\[POINTS NQS  2011.XLS]Super Stock'!E41=0," ",'I:\[POINTS NQS  2011.XLS]Super Stock'!E41) -> Blitzed | M37: ='I:\[POINTS NQS  2011.XLS]Super Stock'!Z41 -> 117
A38: ='I:\[POINTS NQS  2011.XLS]Pro Stock'!A42 -> 36 | B38: ='I:\[POINTS NQS  2011.XLS]Pro Stock'!B42 -> Trent Evans | C38: =IF('I:\[POINTS NQS  2011.XLS]Pro Stock'!C42=0," ",'I:\[POINTS NQS  2011.XLS]Pro Stock'!C42) -> NP | D38: ='I:\[POINTS NQS  2011.XLS]Pro Stock'!D42 -> 11-223 | E38: =IF('I:\[POINTS NQS  2011.XLS]Pro Stock'!E42=0," ",'I:\[POINTS NQS  2011.XLS]Pro Stock'!E42) -> Hammer Down | F38: ='I:\[POINTS NQS  2011.XLS]Pro Stock'!Z42 -> 117 | H38: ='I:\[POINTS NQS  2011.XLS]Super Stock'!A42 -> 36 | I38: ='I:\[POINTS NQS  2011.XLS]Super Stock'!B42 -> Bradley Corzine | J38: =IF('I:\[POINTS NQS  2011.XLS]Super Stock'!C42=0," ",'I:\[POINTS NQS  2011.XLS]Super Stock'!C42) -> JW | K38: ='I:\[POINTS NQS  2011.XLS]Super Stock'!D42 -> 11-368 | L38: =IF('I:\[POINTS NQS  2011.XLS]Super Stock'!E42=0," ",'I:\[POINTS NQS  2011.XLS]Super Stock'!E42) -> Just Black | M38: ='I:\[POINTS NQS  2011.XLS]Super Stock'!Z42 -> 117
A39: ='I:\[POINTS NQS  2011.XLS]Pro Stock'!A43 -> 37 | B39: ='I:\[POINTS NQS  2011.XLS]Pro Stock'!B43 -> Keith Roberts | C39: =IF('I:\[POINTS NQS  2011.XLS]Pro Stock'!C43=0," ",'I:\[POINTS NQS  2011.XLS]Pro Stock'!C43) -> TC | D39: ='I:\[POINTS NQS  2011.XLS]Pro Stock'!D43 -> 11-193 | E39: =IF('I:\[POINTS NQS  2011.XLS]Pro Stock'!E43=0," ",'I:\[POINTS NQS  2011.XLS]Pro Stock'!E43) -> Instigator | F39: ='I:\[POINTS NQS  2011.XLS]Pro Stock'!Z43 -> 119 | H39: ='I:\[POINTS NQS  2011.XLS]Super Stock'!A43 -> 37 | I39: ='I:\[POINTS NQS  2011.XLS]Super Stock'!B43 -> Davis Gawatz | J39: =IF('I:\[POINTS NQS  2011.XLS]Super Stock'!C43=0," ",'I:\[POINTS NQS  2011.XLS]Super Stock'!C43) -> JW | K39: ='I:\[POINTS NQS  2011.XLS]Super Stock'!D43 -> 11-184 | L39: =IF('I:\[POINTS NQS  2011.XLS]Super Stock'!E43=0," ",'I:\[POINTS NQS  2011.XLS]Super Stock'!E43) -> Low Hung Buck | M39: ='I:\[POINTS NQS  2011.XLS]Super Stock'!Z43 -> 120
A40: ='I:\[POINTS NQS  2011.XLS]Pro Stock'!A44 -> 38 | B40: ='I:\[POINTS NQS  2011.XLS]Pro Stock'!B44 -> Greg Angell | C40: =IF('I:\[POINTS NQS  2011.XLS]Pro Stock'!C44=0," ",'I:\[POINTS NQS  2011.XLS]Pro Stock'!C44) -> NP | D40: ='I:\[POINTS NQS  2011.XLS]Pro Stock'!D44 -> 11-048 | E40: =IF('I:\[POINTS NQS  2011.XLS]Pro Stock'!E44=0," ",'I:\[POINTS NQS  2011.XLS]Pro Stock'!E44) -> Ford 9600 | F40: ='I:\[POINTS NQS  2011.XLS]Pro Stock'!Z44 -> 122 | H40: ='I:\[POINTS NQS  2011.XLS]Super Stock'!A44 -> 38 | I40: ='I:\[POINTS NQS  2011.XLS]Super Stock'!B44 -> John Donavon | J40: =IF('I:\[POINTS NQS  2011.XLS]Super Stock'!C44=0," ",'I:\[POINTS NQS  2011.XLS]Super Stock'!C44) -> JRS | K40: ='I:\[POINTS NQS  2011.XLS]Super Stock'!D44 -> 11-006 | L40: =IF('I:\[POINTS NQS  2011.XLS]Super Stock'!E44=0," ",'I:\[POINTS NQS  2011.XLS]Super Stock'!E44) -> John's Deere | M40: ='I:\[POINTS NQS  2011.XLS]Super Stock'!Z44 -> 121
A41: ='I:\[POINTS NQS  2011.XLS]Pro Stock'!A45 -> 39 | B41: ='I:\[POINTS NQS  2011.XLS]Pro Stock'!B45 -> Bradley Corzine | C41: =IF('I:\[POINTS NQS  2011.XLS]Pro Stock'!C45=0," ",'I:\[POINTS NQS  2011.XLS]Pro Stock'!C45) -> JW | D41: ='I:\[POINTS NQS  2011.XLS]Pro Stock'!D45 -> 11-477 | E41: =IF('I:\[POINTS NQS  2011.XLS]Pro Stock'!E45=0," ",'I:\[POINTS NQS  2011.XLS]Pro Stock'!E45) -> Black Cat | F41: ='I:\[POINTS NQS  2011.XLS]Pro Stock'!Z45 -> 125 | H41: ='I:\[POINTS NQS  2011.XLS]Super Stock'!A45 -> 39 | I41: ='I:\[POINTS NQS  2011.XLS]Super Stock'!B45 -> Jerry Binkley | J41: =IF('I:\[POINTS NQS  2011.XLS]Super Stock'!C45=0," ",'I:\[POINTS NQS  2011.XLS]Super Stock'!C45) -> MVP | K41: ='I:\[POINTS NQS  2011.XLS]Super Stock'!D45 -> 11-092 | L41: =IF('I:\[POINTS NQS  2011.XLS]Super Stock'!E45=0," ",'I:\[POINTS NQS  2011.XLS]Super Stock'!E45) -> Grandpa's Toy | M41: ='I:\[POINTS NQS  2011.XLS]Super Stock'!Z45 -> 121
A42: ='I:\[POINTS NQS  2011.XLS]Pro Stock'!A46 -> 40 | B42: ='I:\[POINTS NQS  2011.XLS]Pro Stock'!B46 -> Zach Richerson | C42: =IF('I:\[POINTS NQS  2011.XLS]Pro Stock'!C46=0," ",'I:\[POINTS NQS  2011.XLS]Pro Stock'!C46) -> JW | D42: ='I:\[POINTS NQS  2011.XLS]Pro Stock'!D46 -> 11-348 | E42: =IF('I:\[POINTS NQS  2011.XLS]Pro Stock'!E46=0," ",'I:\[POINTS NQS  2011.XLS]Pro Stock'!E46) -> Zach's Rat | F42: ='I:\[POINTS NQS  2011.XLS]Pro Stock'!Z46 -> 126 | H42: ='I:\[POINTS NQS  2011.XLS]Super Stock'!A46 -> 40 | I42: ='I:\[POINTS NQS  2011.XLS]Super Stock'!B46 -> Nathan Nichols | J42: =IF('I:\[POINTS NQS  2011.XLS]Super Stock'!C46=0," ",'I:\[POINTS NQS  2011.XLS]Super Stock'!C46) -> LR | K42: ='I:\[POINTS NQS  2011.XLS]Super Stock'!D46 -> 11-151 | L42: =IF('I:\[POINTS NQS  2011.XLS]Super Stock'!E46=0," ",'I:\[POINTS NQS  2011.XLS]Super Stock'!E46) -> Wildstreak | M42: ='I:\[POINTS NQS  2011.XLS]Super Stock'!Z46 -> 124
A43: ='I:\[POINTS NQS  2011.XLS]Pro Stock'!A47 -> 41 | B43: ='I:\[POINTS NQS  2011.XLS]Pro Stock'!B47 -> Steve Chrisman | C43: =IF('I:\[POINTS NQS  2011.XLS]Pro Stock'!C47=0," ",'I:\[POINTS NQS  2011.XLS]Pro Stock'!C47) -> HACK | D43: ='I:\[POINTS NQS  2011.XLS]Pro Stock'!D47 -> 11-218 | E43: =IF('I:\[POINTS NQS  2011.XLS]Pro Stock'!E47=0," ",'I:\[POINTS NQS  2011.XLS]Pro Stock'!E47) -> Game On | F43: ='I:\[POINTS NQS  2011.XLS]Pro Stock'!Z47 -> 129 | H43: ='I:\[POINTS NQS  2011.XLS]Super Stock'!A47 -> 41 | I43: ='I:\[POINTS NQS  2011.XLS]Super Stock'!B47 -> Doug Diehl | J43: =IF('I:\[POINTS NQS  2011.XLS]Super Stock'!C47=0," ",'I:\[POINTS NQS  2011.XLS]Super Stock'!C47) -> NP | K43: ='I:\[POINTS NQS  2011.XLS]Super Stock'!D47 -> 11-441 | L43: =IF('I:\[POINTS NQS  2011.XLS]Super Stock'!E47=0," ",'I:\[POINTS NQS  2011.XLS]Super Stock'!E47) -> Excedrin | M43: ='I:\[POINTS NQS  2011.XLS]Super Stock'!Z47 -> 124
A44: ='I:\[POINTS NQS  2011.XLS]Pro Stock'!A48 -> 42 | B44: ='I:\[POINTS NQS  2011.XLS]Pro Stock'!B48 -> Larry Korff | C44: =IF('I:\[POINTS NQS  2011.XLS]Pro Stock'!C48=0," ",'I:\[POINTS NQS  2011.XLS]Pro Stock'!C48) -> TC | D44: ='I:\[POINTS NQS  2011.XLS]Pro Stock'!D48 -> 11-398 | E44: =IF('I:\[POINTS NQS  2011.XLS]Pro Stock'!E48=0," ",'I:\[POINTS NQS  2011.XLS]Pro Stock'!E48) -> Kryptonite | F44: ='I:\[POINTS NQS  2011.XLS]Pro Stock'!Z48 -> 130 | H44: ='I:\[POINTS NQS  2011.XLS]Super Stock'!A48 -> 42 | I44: ='I:\[POINTS NQS  2011.XLS]Super Stock'!B48 -> Clyde Mishler | J44: =IF('I:\[POINTS NQS  2011.XLS]Super Stock'!C48=0," ",'I:\[POINTS NQS  2011.XLS]Super Stock'!C48) -> GTP | K44: ='I:\[POINTS NQS  2011.XLS]Super Stock'!D48 -> 11-168 | L44: =IF('I:\[POINTS NQS  2011.XLS]Super Stock'!E48=0," ",'I:\[POINTS NQS  2011.XLS]Super Stock'!E48) ->  | M44: ='I:\[POINTS NQS  2011.XLS]Super Stock'!Z48 -> 126
A45: ='I:\[POINTS NQS  2011.XLS]Pro Stock'!A49 -> 43 | B45: ='I:\[POINTS NQS  2011.XLS]Pro Stock'!B49 -> Mark Conover | C45: =IF('I:\[POINTS NQS  2011.XLS]Pro Stock'!C49=0," ",'I:\[POINTS NQS  2011.XLS]Pro Stock'!C49) -> VM | D45: ='I:\[POINTS NQS  2011.XLS]Pro Stock'!D49 -> 11-360 | E45: =IF('I:\[POINTS NQS  2011.XLS]Pro Stock'!E49=0," ",'I:\[POINTS NQS  2011.XLS]Pro Stock'!E49) -> VuDoo Too | F45: ='I:\[POINTS NQS  2011.XLS]Pro Stock'!Z49 -> 130 | H45: ='I:\[POINTS NQS  2011.XLS]Super Stock'!A49 -> 43 | I45: ='I:\[POINTS NQS  2011.XLS]Super Stock'!B49 -> Charlie Korff | J45: =IF('I:\[POINTS NQS  2011.XLS]Super Stock'!C49=0," ",'I:\[POINTS NQS  2011.XLS]Super Stock'!C49) -> TC | K45: ='I:\[POINTS NQS  2011.XLS]Super Stock'!D49 -> 11-400 | L45: =IF('I:\[POINTS NQS  2011.XLS]Super Stock'!E49=0," ",'I:\[POINTS NQS  2011.XLS]Super Stock'!E49) -> No fear Deere | M45: ='I:\[POINTS NQS  2011.XLS]Super Stock'!Z49 -> 127
A46: ='I:\[POINTS NQS  2011.XLS]Pro Stock'!A50 -> 44 | B46: ='I:\[POINTS NQS  2011.XLS]Pro Stock'!B50 -> Charlie Ciolino | C46: =IF('I:\[POINTS NQS  2011.XLS]Pro Stock'!C50=0," ",'I:\[POINTS NQS  2011.XLS]Pro Stock'!C50) -> MVP | D46: ='I:\[POINTS NQS  2011.XLS]Pro Stock'!D50 -> 11-145 | E46: =IF('I:\[POINTS NQS  2011.XLS]Pro Stock'!E50=0," ",'I:\[POINTS NQS  2011.XLS]Pro Stock'!E50) -> Mechanical Nitemare | F46: ='I:\[POINTS NQS  2011.XLS]Pro Stock'!Z50 -> 137 | H46: ='I:\[POINTS NQS  2011.XLS]Super Stock'!A50 -> 44 | I46: ='I:\[POINTS NQS  2011.XLS]Super Stock'!B50 -> Kelly Nichols | J46: =IF('I:\[POINTS NQS  2011.XLS]Super Stock'!C50=0," ",'I:\[POINTS NQS  2011.XLS]Super Stock'!C50) -> NP | K46: ='I:\[POINTS NQS  2011.XLS]Super Stock'!D50 -> 11-070 | L46: =IF('I:\[POINTS NQS  2011.XLS]Super Stock'!E50=0," ",'I:\[POINTS NQS  2011.XLS]Super Stock'!E50) -> Wild One 2 | M46: ='I:\[POINTS NQS  2011.XLS]Super Stock'!Z50 -> 128
A47: ='I:\[POINTS NQS  2011.XLS]Pro Stock'!A51 -> 45 | B47: ='I:\[POINTS NQS  2011.XLS]Pro Stock'!B51 -> Larry Hunter | C47: =IF('I:\[POINTS NQS  2011.XLS]Pro Stock'!C51=0," ",'I:\[POINTS NQS  2011.XLS]Pro Stock'!C51) -> NP | D47: ='I:\[POINTS NQS  2011.XLS]Pro Stock'!D51 -> 11-220 | E47: =IF('I:\[POINTS NQS  2011.XLS]Pro Stock'!E51=0," ",'I:\[POINTS NQS  2011.XLS]Pro Stock'!E51) -> Bluelicker | F47: ='I:\[POINTS NQS  2011.XLS]Pro Stock'!Z51 -> 137 | H47: ='I:\[POINTS NQS  2011.XLS]Super Stock'!A51 -> 45 | I47: ='I:\[POINTS NQS  2011.XLS]Super Stock'!B51 -> John Innerst | J47: =IF('I:\[POINTS NQS  2011.XLS]Super Stock'!C51=0," ",'I:\[POINTS NQS  2011.XLS]Super Stock'!C51) -> NP | K47: ='I:\[POINTS NQS  2011.XLS]Super Stock'!D51 -> 11-252 | L47: =IF('I:\[POINTS NQS  2011.XLS]Super Stock'!E51=0," ",'I:\[POINTS NQS  2011.XLS]Super Stock'!E51) -> Mean N Nasty | M47: ='I:\[POINTS NQS  2011.XLS]Super Stock'!Z51 -> 128
A48: ='I:\[POINTS NQS  2011.XLS]Pro Stock'!A52 -> 46 | B48: ='I:\[POINTS NQS  2011.XLS]Pro Stock'!B52 -> Michael Ciolino | C48: =IF('I:\[POINTS NQS  2011.XLS]Pro Stock'!C52=0," ",'I:\[POINTS NQS  2011.XLS]Pro Stock'!C52) -> MVP | D48: ='I:\[POINTS NQS  2011.XLS]Pro Stock'!D52 -> 11-146 | E48: =IF('I:\[POINTS NQS  2011.XLS]Pro Stock'!E52=0," ",'I:\[POINTS NQS  2011.XLS]Pro Stock'!E52) -> Mechanical Animal | F48: ='I:\[POINTS NQS  2011.XLS]Pro Stock'!Z52 -> 140 | H48: ='I:\[POINTS NQS  2011.XLS]Super Stock'!A52 -> 46 | I48: ='I:\[POINTS NQS  2011.XLS]Super Stock'!B52 -> Jerry Skuta | J48: =IF('I:\[POINTS NQS  2011.XLS]Super Stock'!C52=0," ",'I:\[POINTS NQS  2011.XLS]Super Stock'!C52) -> NP | K48: ='I:\[POINTS NQS  2011.XLS]Super Stock'!D52 -> 11-329 | L48: =IF('I:\[POINTS NQS  2011.XLS]Super Stock'!E52=0," ",'I:\[POINTS NQS  2011.XLS]Super Stock'!E52) -> Green Tractor | M48: ='I:\[POINTS NQS  2011.XLS]Super Stock'!Z52 -> 128
A49: ='I:\[POINTS NQS  2011.XLS]Pro Stock'!A53 -> 47 | B49: ='I:\[POINTS NQS  2011.XLS]Pro Stock'!B53 -> David Gawatz | C49: =IF('I:\[POINTS NQS  2011.XLS]Pro Stock'!C53=0," ",'I:\[POINTS NQS  2011.XLS]Pro Stock'!C53) -> JW | D49: ='I:\[POINTS NQS  2011.XLS]Pro Stock'!D53 -> 11-184 | E49: =IF('I:\[POINTS NQS  2011.XLS]Pro Stock'!E53=0," ",'I:\[POINTS NQS  2011.XLS]Pro Stock'!E53) -> Low Hung Buck | F49: ='I:\[POINTS NQS  2011.XLS]Pro Stock'!Z53 -> 141 | H49: ='I:\[POINTS NQS  2011.XLS]Super Stock'!A53 -> 47 | I49: ='I:\[POINTS NQS  2011.XLS]Super Stock'!B53 -> David Knapp | J49: =IF('I:\[POINTS NQS  2011.XLS]Super Stock'!C53=0," ",'I:\[POINTS NQS  2011.XLS]Super Stock'!C53) -> MVP | K49: ='I:\[POINTS NQS  2011.XLS]Super Stock'!D53 -> 11-381 | L49: =IF('I:\[POINTS NQS  2011.XLS]Super Stock'!E53=0," ",'I:\[POINTS NQS  2011.XLS]Super Stock'!E53) -> Knapp Time | M49: ='I:\[POINTS NQS  2011.XLS]Super Stock'!Z53 -> 129
A50: ='I:\[POINTS NQS  2011.XLS]Pro Stock'!A54 -> 48 | B50: ='I:\[POINTS NQS  2011.XLS]Pro Stock'!B54 -> Steve Chrisman | C50: =IF('I:\[POINTS NQS  2011.XLS]Pro Stock'!C54=0," ",'I:\[POINTS NQS  2011.XLS]Pro Stock'!C54) -> HACK | D50: ='I:\[POINTS NQS  2011.XLS]Pro Stock'!D54 -> 11-026 | E50: =IF('I:\[POINTS NQS  2011.XLS]Pro Stock'!E54=0," ",'I:\[POINTS NQS  2011.XLS]Pro Stock'!E54) -> John Deere | F50: ='I:\[POINTS NQS  2011.XLS]Pro Stock'!Z54 -> 142 | H50: ='I:\[POINTS NQS  2011.XLS]Super Stock'!A54 -> 48 | I50: ='I:\[POINTS NQS  2011.XLS]Super Stock'!B54 -> Bradley Corzine | J50: =IF('I:\[POINTS NQS  2011.XLS]Super Stock'!C54=0," ",'I:\[POINTS NQS  2011.XLS]Super Stock'!C54) -> JW | K50: ='I:\[POINTS NQS  2011.XLS]Super Stock'!D54 -> 11-477 | L50: =IF('I:\[POINTS NQS  2011.XLS]Super Stock'!E54=0," ",'I:\[POINTS NQS  2011.XLS]Super Stock'!E54) -> Black Cat | M50: ='I:\[POINTS NQS  2011.XLS]Super Stock'!Z54 -> 136
A51: ='I:\[POINTS NQS  2011.XLS]Pro Stock'!A55 -> 49 | B51: ='I:\[POINTS NQS  2011.XLS]Pro Stock'!B55 -> Don Vogt | C51: =IF('I:\[POINTS NQS  2011.XLS]Pro Stock'!C55=0," ",'I:\[POINTS NQS  2011.XLS]Pro Stock'!C55) -> MVP | D51: ='I:\[POINTS NQS  2011.XLS]Pro Stock'!D55 -> 11-090 | E51: =IF('I:\[POINTS NQS  2011.XLS]Pro Stock'!E55=0," ",'I:\[POINTS NQS  2011.XLS]Pro Stock'!E55) -> Not A Nuff | F51: ='I:\[POINTS NQS  2011.XLS]Pro Stock'!Z55 -> 142 | H51: ='I:\[POINTS NQS  2011.XLS]Super Stock'!A55 -> 49 | I51: ='I:\[POINTS NQS  2011.XLS]Super Stock'!B55 -> Steve Chrisman | J51: =IF('I:\[POINTS NQS  2011.XLS]Super Stock'!C55=0," ",'I:\[POINTS NQS  2011.XLS]Super Stock'!C55) -> Hackman | K51: ='I:\[POINTS NQS  2011.XLS]Super Stock'!D55 -> 11-218 | L51: =IF('I:\[POINTS NQS  2011.XLS]Super Stock'!E55=0," ",'I:\[POINTS NQS  2011.XLS]Super Stock'!E55) -> Game On Purple | M51: ='I:\[POINTS NQS  2011.XLS]Super Stock'!Z55 -> 138
A52: ='I:\[POINTS NQS  2011.XLS]Pro Stock'!A56 -> 50 | B52: ='I:\[POINTS NQS  2011.XLS]Pro Stock'!B56 -> Charlie Korff | C52: =IF('I:\[POINTS NQS  2011.XLS]Pro Stock'!C56=0," ",'I:\[POINTS NQS  2011.XLS]Pro Stock'!C56) -> TC | D52: ='I:\[POINTS NQS  2011.XLS]Pro Stock'!D56 -> 11-400 | E52: =IF('I:\[POINTS NQS  2011.XLS]Pro Stock'!E56=0," ",'I:\[POINTS NQS  2011.XLS]Pro Stock'!E56) -> No Fear Deere | F52: ='I:\[POINTS NQS  2011.XLS]Pro Stock'!Z56 -> 147 | H52: ='I:\[POINTS NQS  2011.XLS]Super Stock'!A56 -> 50 | I52: ='I:\[POINTS NQS  2011.XLS]Super Stock'!B56 -> Mark Deputy | J52: =IF('I:\[POINTS NQS  2011.XLS]Super Stock'!C56=0," ",'I:\[POINTS NQS  2011.XLS]Super Stock'!C56) -> TC | K52: ='I:\[POINTS NQS  2011.XLS]Super Stock'!D56 -> 11-347 | L52: =IF('I:\[POINTS NQS  2011.XLS]Super Stock'!E56=0," ",'I:\[POINTS NQS  2011.XLS]Super Stock'!E56) -> Greenstreak | M52: ='I:\[POINTS NQS  2011.XLS]Super Stock'!Z56 -> 138
A53: ='I:\[POINTS NQS  2011.XLS]Pro Stock'!A57 -> 51 | B53: ='I:\[POINTS NQS  2011.XLS]Pro Stock'!B57 -> Ray Gentz | C53: =IF('I:\[POINTS NQS  2011.XLS]Pro Stock'!C57=0," ",'I:\[POINTS NQS  2011.XLS]Pro Stock'!C57) -> JRS | D53: ='I:\[POINTS NQS  2011.XLS]Pro Stock'!D57 -> 11-035 | E53: =IF('I:\[POINTS NQS  2011.XLS]Pro Stock'!E57=0," ",'I:\[POINTS NQS  2011.XLS]Pro Stock'!E57) -> B.U. Cub | F53: ='I:\[POINTS NQS  2011.XLS]Pro Stock'!Z57 -> 149 | H53: ='I:\[POINTS NQS  2011.XLS]Super Stock'!A57 -> 51 | I53: ='I:\[POINTS NQS  2011.XLS]Super Stock'!B57 -> Elaine Fisher | J53: =IF('I:\[POINTS NQS  2011.XLS]Super Stock'!C57=0," ",'I:\[POINTS NQS  2011.XLS]Super Stock'!C57) -> VM | K53: ='I:\[POINTS NQS  2011.XLS]Super Stock'!D57 -> 11-080 | L53: =IF('I:\[POINTS NQS  2011.XLS]Super Stock'!E57=0," ",'I:\[POINTS NQS  2011.XLS]Super Stock'!E57) -> Blue Thunder | M53: ='I:\[POINTS NQS  2011.XLS]Super Stock'!Z57 -> 140
A54: ='I:\[POINTS NQS  2011.XLS]Pro Stock'!A58 -> 52 | B54: ='I:\[POINTS NQS  2011.XLS]Pro Stock'!B58 -> Richard Lucabaugh | C54: =IF('I:\[POINTS NQS  2011.XLS]Pro Stock'!C58=0," ",'I:\[POINTS NQS  2011.XLS]Pro Stock'!C58) -> NP | D54: ='I:\[POINTS NQS  2011.XLS]Pro Stock'!D58 -> 11-494 | E54: =IF('I:\[POINTS NQS  2011.XLS]Pro Stock'!E58=0," ",'I:\[POINTS NQS  2011.XLS]Pro Stock'!E58) -> Cub | F54: ='I:\[POINTS NQS  2011.XLS]Pro Stock'!Z58 -> 149 | H54: ='I:\[POINTS NQS  2011.XLS]Super Stock'!A58 -> 52 | I54: ='I:\[POINTS NQS  2011.XLS]Super Stock'!B58 -> Mark Conover | J54: =IF('I:\[POINTS NQS  2011.XLS]Super Stock'!C58=0," ",'I:\[POINTS NQS  2011.XLS]Super Stock'!C58) -> VM | K54: ='I:\[POINTS NQS  2011.XLS]Super Stock'!D58 -> 11-360 | L54: =IF('I:\[POINTS NQS  2011.XLS]Super Stock'!E58=0," ",'I:\[POINTS NQS  2011.XLS]Super Stock'!E58) -> VuDoo Too | M54: ='I:\[POINTS NQS  2011.XLS]Super Stock'!Z58 -> 140
A55: ='I:\[POINTS NQS  2011.XLS]Pro Stock'!A59 -> 53 | B55: ='I:\[POINTS NQS  2011.XLS]Pro Stock'!B59 -> Doug Giehl | C55: =IF('I:\[POINTS NQS  2011.XLS]Pro Stock'!C59=0," ",'I:\[POINTS NQS  2011.XLS]Pro Stock'!C59) -> NP | D55: ='I:\[POINTS NQS  2011.XLS]Pro Stock'!D59 -> 11-385 | E55: =IF('I:\[POINTS NQS  2011.XLS]Pro Stock'!E59=0," ",'I:\[POINTS NQS  2011.XLS]Pro Stock'!E59) -> Elininator | F55: ='I:\[POINTS NQS  2011.XLS]Pro Stock'!Z59 -> 150 | H55: ='I:\[POINTS NQS  2011.XLS]Super Stock'!A59 -> 53 | I55: ='I:\[POINTS NQS  2011.XLS]Super Stock'!B59 -> Jeff Chrisman | J55: =IF('I:\[POINTS NQS  2011.XLS]Super Stock'!C59=0," ",'I:\[POINTS NQS  2011.XLS]Super Stock'!C59) -> VM | K55: ='I:\[POINTS NQS  2011.XLS]Super Stock'!D59 -> 11-180 | L55: =IF('I:\[POINTS NQS  2011.XLS]Super Stock'!E59=0," ",'I:\[POINTS NQS  2011.XLS]Super Stock'!E59) ->  | M55: ='I:\[POINTS NQS  2011.XLS]Super Stock'!Z59 -> 146
A56: ='I:\[POINTS NQS  2011.XLS]Pro Stock'!A60 -> 54 | B56: ='I:\[POINTS NQS  2011.XLS]Pro Stock'!B60 -> Jake Gingerich | C56: =IF('I:\[POINTS NQS  2011.XLS]Pro Stock'!C60=0," ",'I:\[POINTS NQS  2011.XLS]Pro Stock'!C60) -> JW | D56: ='I:\[POINTS NQS  2011.XLS]Pro Stock'!D60 -> 11-017 | E56: =IF('I:\[POINTS NQS  2011.XLS]Pro Stock'!E60=0," ",'I:\[POINTS NQS  2011.XLS]Pro Stock'!E60) -> Silver Rocket | F56: ='I:\[POINTS NQS  2011.XLS]Pro Stock'!Z60 -> 151 | H56: ='I:\[POINTS NQS  2011.XLS]Super Stock'!A60 -> 54 | I56: ='I:\[POINTS NQS  2011.XLS]Super Stock'!B60 -> Tooter Campbell | J56: =IF('I:\[POINTS NQS  2011.XLS]Super Stock'!C60=0," ",'I:\[POINTS NQS  2011.XLS]Super Stock'!C60) -> TC | K56: ='I:\[POINTS NQS  2011.XLS]Super Stock'!D60 -> 11-473 | L56: =IF('I:\[POINTS NQS  2011.XLS]Super Stock'!E60=0," ",'I:\[POINTS NQS  2011.XLS]Super Stock'!E60) -> Tractor Trash | M56: ='I:\[POINTS NQS  2011.XLS]Super Stock'!Z60 -> 147
A57: ='I:\[POINTS NQS  2011.XLS]Pro Stock'!A61 -> 55 | B57: ='I:\[POINTS NQS  2011.XLS]Pro Stock'!B61 -> Steve Williford | C57: =IF('I:\[POINTS NQS  2011.XLS]Pro Stock'!C61=0," ",'I:\[POINTS NQS  2011.XLS]Pro Stock'!C61) -> MVP | D57: ='I:\[POINTS NQS  2011.XLS]Pro Stock'!D61 -> 11-176 | E57: =IF('I:\[POINTS NQS  2011.XLS]Pro Stock'!E61=0," ",'I:\[POINTS NQS  2011.XLS]Pro Stock'!E61) -> International | F57: ='I:\[POINTS NQS  2011.XLS]Pro Stock'!Z61 -> 151 | H57: ='I:\[POINTS NQS  2011.XLS]Super Stock'!A61 -> 55 | I57: ='I:\[POINTS NQS  2011.XLS]Super Stock'!B61 -> Dan Schell | J57: =IF('I:\[POINTS NQS  2011.XLS]Super Stock'!C61=0," ",'I:\[POINTS NQS  2011.XLS]Super Stock'!C61) -> MVP | K57: ='I:\[POINTS NQS  2011.XLS]Super Stock'!D61 -> 11-375 | L57: =IF('I:\[POINTS NQS  2011.XLS]Super Stock'!E61=0," ",'I:\[POINTS NQS  2011.XLS]Super Stock'!E61) -> Blind Ambition | M57: ='I:\[POINTS NQS  2011.XLS]Super Stock'!Z61 -> 148
A58: ='I:\[POINTS NQS  2011.XLS]Pro Stock'!A62 -> 56 | B58: ='I:\[POINTS NQS  2011.XLS]Pro Stock'!B62 -> Rudy Puskarich | C58: =IF('I:\[POINTS NQS  2011.XLS]Pro Stock'!C62=0," ",'I:\[POINTS NQS  2011.XLS]Pro Stock'!C62) -> NP | D58: ='I:\[POINTS NQS  2011.XLS]Pro Stock'!D62 -> 11-384 | E58: =IF('I:\[POINTS NQS  2011.XLS]Pro Stock'!E62=0," ",'I:\[POINTS NQS  2011.XLS]Pro Stock'!E62) -> English Bulldog | F58: ='I:\[POINTS NQS  2011.XLS]Pro Stock'!Z62 -> 151 | H58: ='I:\[POINTS NQS  2011.XLS]Super Stock'!A62 -> 56 | I58: ='I:\[POINTS NQS  2011.XLS]Super Stock'!B62 -> Charlie Ciolino | J58: =IF('I:\[POINTS NQS  2011.XLS]Super Stock'!C62=0," ",'I:\[POINTS NQS  2011.XLS]Super Stock'!C62) -> MVP | K58: ='I:\[POINTS NQS  2011.XLS]Super Stock'!D62 -> 11-145 | L58: =IF('I:\[POINTS NQS  2011.XLS]Super Stock'!E62=0," ",'I:\[POINTS NQS  2011.XLS]Super Stock'!E62) -> Mechanical Nitmare | M58: ='I:\[POINTS NQS  2011.XLS]Super Stock'!Z62 -> 149
A59: ='I:\[POINTS NQS  2011.XLS]Pro Stock'!A63 -> 57 | B59: ='I:\[POINTS NQS  2011.XLS]Pro Stock'!B63 -> Jeff Chrisman | C59: =IF('I:\[POINTS NQS  2011.XLS]Pro Stock'!C63=0," ",'I:\[POINTS NQS  2011.XLS]Pro Stock'!C63) -> VM | D59: ='I:\[POINTS NQS  2011.XLS]Pro Stock'!D63 -> 11-180 | E59: =IF('I:\[POINTS NQS  2011.XLS]Pro Stock'!E63=0," ",'I:\[POINTS NQS  2011.XLS]Pro Stock'!E63) ->  | F59: ='I:\[POINTS NQS  2011.XLS]Pro Stock'!Z63 -> 153 | H59: ='I:\[POINTS NQS  2011.XLS]Super Stock'!A63 -> 57 | I59: ='I:\[POINTS NQS  2011.XLS]Super Stock'!B63 -> Zach Richerson | J59: =IF('I:\[POINTS NQS  2011.XLS]Super Stock'!C63=0," ",'I:\[POINTS NQS  2011.XLS]Super Stock'!C63) -> JW | K59: ='I:\[POINTS NQS  2011.XLS]Super Stock'!D63 -> 11-348 | L59: =IF('I:\[POINTS NQS  2011.XLS]Super Stock'!E63=0," ",'I:\[POINTS NQS  2011.XLS]Super Stock'!E63) -> Zach's Rat | M59: ='I:\[POINTS NQS  2011.XLS]Super Stock'!Z63 -> 152
A60: ='I:\[POINTS NQS  2011.XLS]Pro Stock'!A64 -> 58 | B60: ='I:\[POINTS NQS  2011.XLS]Pro Stock'!B64 -> Bruce Austin | C60: =IF('I:\[POINTS NQS  2011.XLS]Pro Stock'!C64=0," ",'I:\[POINTS NQS  2011.XLS]Pro Stock'!C64) -> MVP | D60: ='I:\[POINTS NQS  2011.XLS]Pro Stock'!D64 -> 11-277 | E60: =IF('I:\[POINTS NQS  2011.XLS]Pro Stock'!E64=0," ",'I:\[POINTS NQS  2011.XLS]Pro Stock'!E64) -> Cap'N Crunch | F60: ='I:\[POINTS NQS  2011.XLS]Pro Stock'!Z64 -> 153 | H60: ='I:\[POINTS NQS  2011.XLS]Super Stock'!A64 -> 58 | I60: ='I:\[POINTS NQS  2011.XLS]Super Stock'!B64 -> Steve Chrisman | J60: =IF('I:\[POINTS NQS  2011.XLS]Super Stock'!C64=0," ",'I:\[POINTS NQS  2011.XLS]Super Stock'!C64) -> Hackman | K60: ='I:\[POINTS NQS  2011.XLS]Super Stock'!D64 -> 11-026 | L60: =IF('I:\[POINTS NQS  2011.XLS]Super Stock'!E64=0," ",'I:\[POINTS NQS  2011.XLS]Super Stock'!E64) -> John Deere | M60: ='I:\[POINTS NQS  2011.XLS]Super Stock'!Z64 -> 153
A61: ='I:\[POINTS NQS  2011.XLS]Pro Stock'!A65 -> 59 | B61: ='I:\[POINTS NQS  2011.XLS]Pro Stock'!B65 -> Ron Scroggins | C61: =IF('I:\[POINTS NQS  2011.XLS]Pro Stock'!C65=0," ",'I:\[POINTS NQS  2011.XLS]Pro Stock'!C65) -> VM | D61: ='I:\[POINTS NQS  2011.XLS]Pro Stock'!D65 -> 11-110 | E61: =IF('I:\[POINTS NQS  2011.XLS]Pro Stock'!E65=0," ",'I:\[POINTS NQS  2011.XLS]Pro Stock'!E65) -> Dirt Dancer | F61: ='I:\[POINTS NQS  2011.XLS]Pro Stock'!Z65 -> 158 | H61: ='I:\[POINTS NQS  2011.XLS]Super Stock'!A65 -> 59 | I61: ='I:\[POINTS NQS  2011.XLS]Super Stock'!B65 -> Mark Davis | J61: =IF('I:\[POINTS NQS  2011.XLS]Super Stock'!C65=0," ",'I:\[POINTS NQS  2011.XLS]Super Stock'!C65) -> JRS | K61: ='I:\[POINTS NQS  2011.XLS]Super Stock'!D65 -> 11-067 | L61: =IF('I:\[POINTS NQS  2011.XLS]Super Stock'!E65=0," ",'I:\[POINTS NQS  2011.XLS]Super Stock'!E65) -> No Limits 2 | M61: ='I:\[POINTS NQS  2011.XLS]Super Stock'!Z65 -> 154
A62: ='I:\[POINTS NQS  2011.XLS]Pro Stock'!A66 -> 60 | B62: ='I:\[POINTS NQS  2011.XLS]Pro Stock'!B66 -> Bill Richerson | C62: =IF('I:\[POINTS NQS  2011.XLS]Pro Stock'!C66=0," ",'I:\[POINTS NQS  2011.XLS]Pro Stock'!C66) -> JW | D62: ='I:\[POINTS NQS  2011.XLS]Pro Stock'!D66 -> 11-132 | E62: =IF('I:\[POINTS NQS  2011.XLS]Pro Stock'!E66=0," ",'I:\[POINTS NQS  2011.XLS]Pro Stock'!E66) -> Walk the Line | F62: ='I:\[POINTS NQS  2011.XLS]Pro Stock'!Z66 -> 158 | H62: ='I:\[POINTS NQS  2011.XLS]Super Stock'!A66 -> 60 | I62: ='I:\[POINTS NQS  2011.XLS]Super Stock'!B66 -> Kevin Root | J62: =IF('I:\[POINTS NQS  2011.XLS]Super Stock'!C66=0," ",'I:\[POINTS NQS  2011.XLS]Super Stock'!C66) -> Root | K62: ='I:\[POINTS NQS  2011.XLS]Super Stock'!D66 -> 11-117 | L62: =IF('I:\[POINTS NQS  2011.XLS]Super Stock'!E66=0," ",'I:\[POINTS NQS  2011.XLS]Super Stock'!E66) -> Right on the Money | M62: ='I:\[POINTS NQS  2011.XLS]Super Stock'!Z66 -> 154
A63: ='I:\[POINTS NQS  2011.XLS]Pro Stock'!A67 -> 61 | B63: ='I:\[POINTS NQS  2011.XLS]Pro Stock'!B67 -> Tyler Hackman | C63: =IF('I:\[POINTS NQS  2011.XLS]Pro Stock'!C67=0," ",'I:\[POINTS NQS  2011.XLS]Pro Stock'!C67) ->  | D63: ='I:\[POINTS NQS  2011.XLS]Pro Stock'!D67 -> 0 | E63: =IF('I:\[POINTS NQS  2011.XLS]Pro Stock'!E67=0," ",'I:\[POINTS NQS  2011.XLS]Pro Stock'!E67) ->  | F63: ='I:\[POINTS NQS  2011.XLS]Pro Stock'!Z67 -> 161 | H63: ='I:\[POINTS NQS  2011.XLS]Super Stock'!A67 -> 61 | I63: ='I:\[POINTS NQS  2011.XLS]Super Stock'!B67 -> Gerald Kerber | J63: =IF('I:\[POINTS NQS  2011.XLS]Super Stock'!C67=0," ",'I:\[POINTS NQS  2011.XLS]Super Stock'!C67) -> NP | K63: ='I:\[POINTS NQS  2011.XLS]Super Stock'!D67 -> 11-175 | L63: =IF('I:\[POINTS NQS  2011.XLS]Super Stock'!E67=0," ",'I:\[POINTS NQS  2011.XLS]Super Stock'!E67) -> Wisconsin Hooker | M63: ='I:\[POINTS NQS  2011.XLS]Super Stock'!Z67 -> 154
A64: ='I:\[POINTS NQS  2011.XLS]Pro Stock'!A68 -> 62 | B64: ='I:\[POINTS NQS  2011.XLS]Pro Stock'!B68 -> Steve Williford | C64: =IF('I:\[POINTS NQS  2011.XLS]Pro Stock'!C68=0," ",'I:\[POINTS NQS  2011.XLS]Pro Stock'!C68) -> MVP | D64: ='I:\[POINTS NQS  2011.XLS]Pro Stock'!D68 -> 11-177 | E64: =IF('I:\[POINTS NQS  2011.XLS]Pro Stock'!E68=0," ",'I:\[POINTS NQS  2011.XLS]Pro Stock'!E68) -> Williford Trucking IH | F64: ='I:\[POINTS NQS  2011.XLS]Pro Stock'!Z68 -> 163 | H64: ='I:\[POINTS NQS  2011.XLS]Super Stock'!A68 -> 62 | I64: ='I:\[POINTS NQS  2011.XLS]Super Stock'!B68 -> Trent Evans | J64: =IF('I:\[POINTS NQS  2011.XLS]Super Stock'!C68=0," ",'I:\[POINTS NQS  2011.XLS]Super Stock'!C68) -> NP | K64: ='I:\[POINTS NQS  2011.XLS]Super Stock'!D68 -> 11-223 | L64: =IF('I:\[POINTS NQS  2011.XLS]Super Stock'!E68=0," ",'I:\[POINTS NQS  2011.XLS]Super Stock'!E68) -> Hammer Down | M64: ='I:\[POINTS NQS  2011.XLS]Super Stock'!Z68 -> 156
A65: ='I:\[POINTS NQS  2011.XLS]Pro Stock'!A69 -> 63 | B65: ='I:\[POINTS NQS  2011.XLS]Pro Stock'!B69 -> Bradley Corzine | C65: =IF('I:\[POINTS NQS  2011.XLS]Pro Stock'!C69=0," ",'I:\[POINTS NQS  2011.XLS]Pro Stock'!C69) -> JW | D65: ='I:\[POINTS NQS  2011.XLS]Pro Stock'!D69 -> 11-368 | E65: =IF('I:\[POINTS NQS  2011.XLS]Pro Stock'!E69=0," ",'I:\[POINTS NQS  2011.XLS]Pro Stock'!E69) -> Just Black | F65: ='I:\[POINTS NQS  2011.XLS]Pro Stock'!Z69 -> 163 | H65: ='I:\[POINTS NQS  2011.XLS]Super Stock'!A69 -> 63 | I65: ='I:\[POINTS NQS  2011.XLS]Super Stock'!B69 -> Doug Diehl | J65: =IF('I:\[POINTS NQS  2011.XLS]Super Stock'!C69=0," ",'I:\[POINTS NQS  2011.XLS]Super Stock'!C69) -> NP | K65: ='I:\[POINTS NQS  2011.XLS]Super Stock'!D69 -> 11-385 | L65: =IF('I:\[POINTS NQS  2011.XLS]Super Stock'!E69=0," ",'I:\[POINTS NQS  2011.XLS]Super Stock'!E69) -> Eliminator | M65: ='I:\[POINTS NQS  2011.XLS]Super Stock'!Z69 -> 157
A66: ='I:\[POINTS NQS  2011.XLS]Pro Stock'!A70 -> 64 | B66: ='I:\[POINTS NQS  2011.XLS]Pro Stock'!B70 -> Tooter Campbell | C66: =IF('I:\[POINTS NQS  2011.XLS]Pro Stock'!C70=0," ",'I:\[POINTS NQS  2011.XLS]Pro Stock'!C70) -> TC | D66: ='I:\[POINTS NQS  2011.XLS]Pro Stock'!D70 -> 11-473 | E66: =IF('I:\[POINTS NQS  2011.XLS]Pro Stock'!E70=0," ",'I:\[POINTS NQS  2011.XLS]Pro Stock'!E70) -> Tractor Trash | F66: ='I:\[POINTS NQS  2011.XLS]Pro Stock'!Z70 -> 163 | H66: ='I:\[POINTS NQS  2011.XLS]Super Stock'!A70 -> 64 | I66: ='I:\[POINTS NQS  2011.XLS]Super Stock'!B70 -> Dustin Blair | J66: =IF('I:\[POINTS NQS  2011.XLS]Super Stock'!C70=0," ",'I:\[POINTS NQS  2011.XLS]Super Stock'!C70) ->  | K66: ='I:\[POINTS NQS  2011.XLS]Super Stock'!D70 -> 11-380 | L66: =IF('I:\[POINTS NQS  2011.XLS]Super Stock'!E70=0," ",'I:\[POINTS NQS  2011.XLS]Super Stock'!E70) -> Armed & Dangerous | M66: ='I:\[POINTS NQS  2011.XLS]Super Stock'!Z70 -> 158
A67: ='I:\[POINTS NQS  2011.XLS]Pro Stock'!A71 -> 65 | B67: ='I:\[POINTS NQS  2011.XLS]Pro Stock'!B71 -> Logan Cessna | C67: =IF('I:\[POINTS NQS  2011.XLS]Pro Stock'!C71=0," ",'I:\[POINTS NQS  2011.XLS]Pro Stock'!C71) -> NP | D67: ='I:\[POINTS NQS  2011.XLS]Pro Stock'!D71 -> 11-491 | E67: =IF('I:\[POINTS NQS  2011.XLS]Pro Stock'!E71=0," ",'I:\[POINTS NQS  2011.XLS]Pro Stock'!E71) -> Built for Business | F67: ='I:\[POINTS NQS  2011.XLS]Pro Stock'!Z71 -> 163 | H67: ='I:\[POINTS NQS  2011.XLS]Super Stock'!A71 -> 65 | I67: ='I:\[POINTS NQS  2011.XLS]Super Stock'!B71 -> Steve Chrisman | J67: =IF('I:\[POINTS NQS  2011.XLS]Super Stock'!C71=0," ",'I:\[POINTS NQS  2011.XLS]Super Stock'!C71) -> Hackman | K67: ='I:\[POINTS NQS  2011.XLS]Super Stock'!D71 -> 11-069 | L67: =IF('I:\[POINTS NQS  2011.XLS]Super Stock'!E71=0," ",'I:\[POINTS NQS  2011.XLS]Super Stock'!E71) -> Top Secret | M67: ='I:\[POINTS NQS  2011.XLS]Super Stock'!Z71 -> 160
A68: ='I:\[POINTS NQS  2011.XLS]Pro Stock'!A72 -> 66 | B68: ='I:\[POINTS NQS  2011.XLS]Pro Stock'!B72 -> Kevin Root | C68: =IF('I:\[POINTS NQS  2011.XLS]Pro Stock'!C72=0," ",'I:\[POINTS NQS  2011.XLS]Pro Stock'!C72) -> Root | D68: ='I:\[POINTS NQS  2011.XLS]Pro Stock'!D72 -> 11-117 | E68: =IF('I:\[POINTS NQS  2011.XLS]Pro Stock'!E72=0," ",'I:\[POINTS NQS  2011.XLS]Pro Stock'!E72) -> Right on the Money | F68: ='I:\[POINTS NQS  2011.XLS]Pro Stock'!Z72 -> 166 | H68: ='I:\[POINTS NQS  2011.XLS]Super Stock'!A72 -> 66 | I68: ='I:\[POINTS NQS  2011.XLS]Super Stock'!B72 -> Ray Gentz | J68: =IF('I:\[POINTS NQS  2011.XLS]Super Stock'!C72=0," ",'I:\[POINTS NQS  2011.XLS]Super Stock'!C72) -> JRS | K68: ='I:\[POINTS NQS  2011.XLS]Super Stock'!D72 -> 11-262 | L68: =IF('I:\[POINTS NQS  2011.XLS]Super Stock'!E72=0," ",'I:\[POINTS NQS  2011.XLS]Super Stock'!E72) -> Chaos | M68: ='I:\[POINTS NQS  2011.XLS]Super Stock'!Z72 -> 162
A69: ='I:\[POINTS NQS  2011.XLS]Pro Stock'!A73 -> 67 | B69: ='I:\[POINTS NQS  2011.XLS]Pro Stock'!B73 -> Jim Morrison | C69: =IF('I:\[POINTS NQS  2011.XLS]Pro Stock'!C73=0," ",'I:\[POINTS NQS  2011.XLS]Pro Stock'!C73) ->  | D69: ='I:\[POINTS NQS  2011.XLS]Pro Stock'!D73 -> 11-452 | E69: =IF('I:\[POINTS NQS  2011.XLS]Pro Stock'!E73=0," ",'I:\[POINTS NQS  2011.XLS]Pro Stock'!E73) -> White | F69: ='I:\[POINTS NQS  2011.XLS]Pro Stock'!Z73 -> 167 | H69: ='I:\[POINTS NQS  2011.XLS]Super Stock'!A73 -> 67 | I69: ='I:\[POINTS NQS  2011.XLS]Super Stock'!B73 -> Jake Gingerich | J69: =IF('I:\[POINTS NQS  2011.XLS]Super Stock'!C73=0," ",'I:\[POINTS NQS  2011.XLS]Super Stock'!C73) -> JW | K69: ='I:\[POINTS NQS  2011.XLS]Super Stock'!D73 -> 11-023 | L69: =IF('I:\[POINTS NQS  2011.XLS]Super Stock'!E73=0," ",'I:\[POINTS NQS  2011.XLS]Super Stock'!E73) -> Royal Pain | M69: ='I:\[POINTS NQS  2011.XLS]Super Stock'!Z73 -> 163
A70: ='I:\[POINTS NQS  2011.XLS]Pro Stock'!A74 -> 68 | B70: ='I:\[POINTS NQS  2011.XLS]Pro Stock'!B74 -> Ian Manlove | C70: =IF('I:\[POINTS NQS  2011.XLS]Pro Stock'!C74=0," ",'I:\[POINTS NQS  2011.XLS]Pro Stock'!C74) -> MVP | D70: ='I:\[POINTS NQS  2011.XLS]Pro Stock'!D74 -> 11-457 | E70: =IF('I:\[POINTS NQS  2011.XLS]Pro Stock'!E74=0," ",'I:\[POINTS NQS  2011.XLS]Pro Stock'!E74) -> Alcohol Abuse | F70: ='I:\[POINTS NQS  2011.XLS]Pro Stock'!Z74 -> 167 | H70: ='I:\[POINTS NQS  2011.XLS]Super Stock'!A74 -> 68 | I70: ='I:\[POINTS NQS  2011.XLS]Super Stock'!B74 -> Max Burkhart | J70: =IF('I:\[POINTS NQS  2011.XLS]Super Stock'!C74=0," ",'I:\[POINTS NQS  2011.XLS]Super Stock'!C74) -> TC | K70: ='I:\[POINTS NQS  2011.XLS]Super Stock'!D74 -> 11-078 | L70: =IF('I:\[POINTS NQS  2011.XLS]Super Stock'!E74=0," ",'I:\[POINTS NQS  2011.XLS]Super Stock'!E74) -> Ground Pounder | M70: ='I:\[POINTS NQS  2011.XLS]Super Stock'!Z74 -> 163
A71: ='I:\[POINTS NQS  2011.XLS]Pro Stock'!A75 -> 69 | B71: ='I:\[POINTS NQS  2011.XLS]Pro Stock'!B75 -> Harrison Stahl | C71: =IF('I:\[POINTS NQS  2011.XLS]Pro Stock'!C75=0," ",'I:\[POINTS NQS  2011.XLS]Pro Stock'!C75) -> MVP | D71: ='I:\[POINTS NQS  2011.XLS]Pro Stock'!D75 -> 11-336 | E71: =IF('I:\[POINTS NQS  2011.XLS]Pro Stock'!E75=0," ",'I:\[POINTS NQS  2011.XLS]Pro Stock'!E75) -> MWSC # 4 | F71: ='I:\[POINTS NQS  2011.XLS]Pro Stock'!Z75 -> 169 | H71: ='I:\[POINTS NQS  2011.XLS]Super Stock'!A75 -> 69 | I71: ='I:\[POINTS NQS  2011.XLS]Super Stock'!B75 -> Ron Marcine | J71: =IF('I:\[POINTS NQS  2011.XLS]Super Stock'!C75=0," ",'I:\[POINTS NQS  2011.XLS]Super Stock'!C75) ->  | K71: ='I:\[POINTS NQS  2011.XLS]Super Stock'!D75 -> 11-245 | L71: =IF('I:\[POINTS NQS  2011.XLS]Super Stock'!E75=0," ",'I:\[POINTS NQS  2011.XLS]Super Stock'!E75) ->  | M71: ='I:\[POINTS NQS  2011.XLS]Super Stock'!Z75 -> 163
A72: ='I:\[POINTS NQS  2011.XLS]Pro Stock'!A76 -> 70 | B72: ='I:\[POINTS NQS  2011.XLS]Pro Stock'!B76 -> Tyler Hackman | C72: =IF('I:\[POINTS NQS  2011.XLS]Pro Stock'!C76=0," ",'I:\[POINTS NQS  2011.XLS]Pro Stock'!C76) ->  | D72: ='I:\[POINTS NQS  2011.XLS]Pro Stock'!D76 -> 0 | E72: =IF('I:\[POINTS NQS  2011.XLS]Pro Stock'!E76=0," ",'I:\[POINTS NQS  2011.XLS]Pro Stock'!E76) -> Green | F72: ='I:\[POINTS NQS  2011.XLS]Pro Stock'!Z76 -> 177 | H72: ='I:\[POINTS NQS  2011.XLS]Super Stock'!A76 -> 70 | I72: ='I:\[POINTS NQS  2011.XLS]Super Stock'!B76 -> Bruce Austin | J72: =IF('I:\[POINTS NQS  2011.XLS]Super Stock'!C76=0," ",'I:\[POINTS NQS  2011.XLS]Super Stock'!C76) -> MVP | K72: ='I:\[POINTS NQS  2011.XLS]Super Stock'!D76 -> 11-338 | L72: =IF('I:\[POINTS NQS  2011.XLS]Super Stock'!E76=0," ",'I:\[POINTS NQS  2011.XLS]Super Stock'!E76) -> Hillbilly Headache | M72: ='I:\[POINTS NQS  2011.XLS]Super Stock'!Z76 -> 167
A73: ='I:\[POINTS NQS  2011.XLS]Pro Stock'!A77 -> 71 | B73: ='I:\[POINTS NQS  2011.XLS]Pro Stock'!B77 -> Ron Scroggins | C73: =IF('I:\[POINTS NQS  2011.XLS]Pro Stock'!C77=0," ",'I:\[POINTS NQS  2011.XLS]Pro Stock'!C77) -> VM | D73: ='I:\[POINTS NQS  2011.XLS]Pro Stock'!D77 -> 11-111 | E73: =IF('I:\[POINTS NQS  2011.XLS]Pro Stock'!E77=0," ",'I:\[POINTS NQS  2011.XLS]Pro Stock'!E77) -> Black Out | F73: ='I:\[POINTS NQS  2011.XLS]Pro Stock'!Z77 -> 179 | H73: ='I:\[POINTS NQS  2011.XLS]Super Stock'!A77 -> 71 | I73: ='I:\[POINTS NQS  2011.XLS]Super Stock'!B77 -> Greg Angell | J73: =IF('I:\[POINTS NQS  2011.XLS]Super Stock'!C77=0," ",'I:\[POINTS NQS  2011.XLS]Super Stock'!C77) -> NP | K73: ='I:\[POINTS NQS  2011.XLS]Super Stock'!D77 -> 11-048 | L73: =IF('I:\[POINTS NQS  2011.XLS]Super Stock'!E77=0," ",'I:\[POINTS NQS  2011.XLS]Super Stock'!E77) -> Ford 9600 | M73: ='I:\[POINTS NQS  2011.XLS]Super Stock'!Z77 -> 171
A74: ='I:\[POINTS NQS  2011.XLS]Pro Stock'!A78 -> 72 | B74: ='I:\[POINTS NQS  2011.XLS]Pro Stock'!B78 -> Rick Slade | C74: =IF('I:\[POINTS NQS  2011.XLS]Pro Stock'!C78=0," ",'I:\[POINTS NQS  2011.XLS]Pro Stock'!C78) -> JRS | D74: ='I:\[POINTS NQS  2011.XLS]Pro Stock'!D78 -> 11-467 | E74: =IF('I:\[POINTS NQS  2011.XLS]Pro Stock'!E78=0," ",'I:\[POINTS NQS  2011.XLS]Pro Stock'!E78) -> Ricohet | F74: ='I:\[POINTS NQS  2011.XLS]Pro Stock'!Z78 -> 179 | H74: ='I:\[POINTS NQS  2011.XLS]Super Stock'!A78 -> 72 | I74: ='I:\[POINTS NQS  2011.XLS]Super Stock'!B78 -> Bill Nipple | J74: =IF('I:\[POINTS NQS  2011.XLS]Super Stock'!C78=0," ",'I:\[POINTS NQS  2011.XLS]Super Stock'!C78) -> JW | K74: ='I:\[POINTS NQS  2011.XLS]Super Stock'!D78 -> 11-150 | L74: =IF('I:\[POINTS NQS  2011.XLS]Super Stock'!E78=0," ",'I:\[POINTS NQS  2011.XLS]Super Stock'!E78) -> Serious Business | M74: ='I:\[POINTS NQS  2011.XLS]Super Stock'!Z78 -> 171
A75: ='I:\[POINTS NQS  2011.XLS]Pro Stock'!A79 -> 73 | B75: ='I:\[POINTS NQS  2011.XLS]Pro Stock'!B79 -> Shaun Volger | C75: =IF('I:\[POINTS NQS  2011.XLS]Pro Stock'!C79=0," ",'I:\[POINTS NQS  2011.XLS]Pro Stock'!C79) -> JRS | D75: ='I:\[POINTS NQS  2011.XLS]Pro Stock'!D79 -> 11-129 | E75: =IF('I:\[POINTS NQS  2011.XLS]Pro Stock'!E79=0," ",'I:\[POINTS NQS  2011.XLS]Pro Stock'!E79) -> Renegade | F75: ='I:\[POINTS NQS  2011.XLS]Pro Stock'!Z79 -> 180 | H75: ='I:\[POINTS NQS  2011.XLS]Super Stock'!A79 -> 73 | I75: ='I:\[POINTS NQS  2011.XLS]Super Stock'!B79 -> Bruce Austin | J75: =IF('I:\[POINTS NQS  2011.XLS]Super Stock'!C79=0," ",'I:\[POINTS NQS  2011.XLS]Super Stock'!C79) -> MVP | K75: ='I:\[POINTS NQS  2011.XLS]Super Stock'!D79 -> 11-277 | L75: =IF('I:\[POINTS NQS  2011.XLS]Super Stock'!E79=0," ",'I:\[POINTS NQS  2011.XLS]Super Stock'!E79) -> Cap'n Crunch | M75: ='I:\[POINTS NQS  2011.XLS]Super Stock'!Z79 -> 171
A76: ='I:\[POINTS NQS  2011.XLS]Pro Stock'!A80 -> 74 | B76: ='I:\[POINTS NQS  2011.XLS]Pro Stock'!B80 -> Lee Blesch | C76: =IF('I:\[POINTS NQS  2011.XLS]Pro Stock'!C80=0," ",'I:\[POINTS NQS  2011.XLS]Pro Stock'!C80) -> TC | D76: ='I:\[POINTS NQS  2011.XLS]Pro Stock'!D80 -> 11-344 | E76: =IF('I:\[POINTS NQS  2011.XLS]Pro Stock'!E80=0," ",'I:\[POINTS NQS  2011.XLS]Pro Stock'!E80) -> Orange Blossom Special | F76: ='I:\[POINTS NQS  2011.XLS]Pro Stock'!Z80 -> 180 | H76: ='I:\[POINTS NQS  2011.XLS]Super Stock'!A80 -> 74 | I76: ='I:\[POINTS NQS  2011.XLS]Super Stock'!B80 -> Steve Vogler | J76: =IF('I:\[POINTS NQS  2011.XLS]Super Stock'!C80=0," ",'I:\[POINTS NQS  2011.XLS]Super Stock'!C80) -> JRS | K76: ='I:\[POINTS NQS  2011.XLS]Super Stock'!D80 -> 11-476 | L76: =IF('I:\[POINTS NQS  2011.XLS]Super Stock'!E80=0," ",'I:\[POINTS NQS  2011.XLS]Super Stock'!E80) -> Outlaw Reloaded | M76: ='I:\[POINTS NQS  2011.XLS]Super Stock'!Z80 -> 172
A77: ='I:\[POINTS NQS  2011.XLS]Pro Stock'!A81 -> 75 | B77: ='I:\[POINTS NQS  2011.XLS]Pro Stock'!B81 -> Mike Mason | C77: =IF('I:\[POINTS NQS  2011.XLS]Pro Stock'!C81=0," ",'I:\[POINTS NQS  2011.XLS]Pro Stock'!C81) -> NP | D77: ='I:\[POINTS NQS  2011.XLS]Pro Stock'!D81 -> 11-138 | E77: =IF('I:\[POINTS NQS  2011.XLS]Pro Stock'!E81=0," ",'I:\[POINTS NQS  2011.XLS]Pro Stock'!E81) -> Frustrated | F77: ='I:\[POINTS NQS  2011.XLS]Pro Stock'!Z81 -> 181 | H77: ='I:\[POINTS NQS  2011.XLS]Super Stock'!A81 -> 75 | I77: ='I:\[POINTS NQS  2011.XLS]Super Stock'!B81 -> Mike Garringer | J77: =IF('I:\[POINTS NQS  2011.XLS]Super Stock'!C81=0," ",'I:\[POINTS NQS  2011.XLS]Super Stock'!C81) -> RPM | K77: ='I:\[POINTS NQS  2011.XLS]Super Stock'!D81 -> 11-401 | L77: =IF('I:\[POINTS NQS  2011.XLS]Super Stock'!E81=0," ",'I:\[POINTS NQS  2011.XLS]Super Stock'!E81) -> Big Red | M77: ='I:\[POINTS NQS  2011.XLS]Super Stock'!Z81 -> 173
A78: ='I:\[POINTS NQS  2011.XLS]Pro Stock'!A82 -> 76 | B78: ='I:\[POINTS NQS  2011.XLS]Pro Stock'!B82 -> Ronald Marcine | C78: =IF('I:\[POINTS NQS  2011.XLS]Pro Stock'!C82=0," ",'I:\[POINTS NQS  2011.XLS]Pro Stock'!C82) -> MVP | D78: ='I:\[POINTS NQS  2011.XLS]Pro Stock'!D82 -> 11-245 | E78: =IF('I:\[POINTS NQS  2011.XLS]Pro Stock'!E82=0," ",'I:\[POINTS NQS  2011.XLS]Pro Stock'!E82) -> No Pressure | F78: ='I:\[POINTS NQS  2011.XLS]Pro Stock'!Z82 -> 181 | H78: ='I:\[POINTS NQS  2011.XLS]Super Stock'!A82 -> 76 | I78: ='I:\[POINTS NQS  2011.XLS]Super Stock'!B82 -> Michael Ciolino | J78: =IF('I:\[POINTS NQS  2011.XLS]Super Stock'!C82=0," ",'I:\[POINTS NQS  2011.XLS]Super Stock'!C82) -> MVP | K78: ='I:\[POINTS NQS  2011.XLS]Super Stock'!D82 -> 11-146 | L78: =IF('I:\[POINTS NQS  2011.XLS]Super Stock'!E82=0," ",'I:\[POINTS NQS  2011.XLS]Super Stock'!E82) -> Mechanial Animal | M78: ='I:\[POINTS NQS  2011.XLS]Super Stock'!Z82 -> 175
A79: ='I:\[POINTS NQS  2011.XLS]Pro Stock'!A83 -> 77 | B79: ='I:\[POINTS NQS  2011.XLS]Pro Stock'!B83 -> Jake Gingerich | C79: =IF('I:\[POINTS NQS  2011.XLS]Pro Stock'!C83=0," ",'I:\[POINTS NQS  2011.XLS]Pro Stock'!C83) -> JW | D79: ='I:\[POINTS NQS  2011.XLS]Pro Stock'!D83 -> 11-028 | E79: =IF('I:\[POINTS NQS  2011.XLS]Pro Stock'!E83=0," ",'I:\[POINTS NQS  2011.XLS]Pro Stock'!E83) -> Silver Fox | F79: ='I:\[POINTS NQS  2011.XLS]Pro Stock'!Z83 -> 182 | H79: ='I:\[POINTS NQS  2011.XLS]Super Stock'!A83 -> 77 | I79: ='I:\[POINTS NQS  2011.XLS]Super Stock'!B83 -> Nick Ferguson | J79: =IF('I:\[POINTS NQS  2011.XLS]Super Stock'!C83=0," ",'I:\[POINTS NQS  2011.XLS]Super Stock'!C83) -> MVP | K79: ='I:\[POINTS NQS  2011.XLS]Super Stock'!D83 -> 11-343 | L79: =IF('I:\[POINTS NQS  2011.XLS]Super Stock'!E83=0," ",'I:\[POINTS NQS  2011.XLS]Super Stock'!E83) -> Border Control | M79: ='I:\[POINTS NQS  2011.XLS]Super Stock'!Z83 -> 175
A80: ='I:\[POINTS NQS  2011.XLS]Pro Stock'!A84 -> 78 | B80: ='I:\[POINTS NQS  2011.XLS]Pro Stock'!B84 -> Colyn Hammond | C80: =IF('I:\[POINTS NQS  2011.XLS]Pro Stock'!C84=0," ",'I:\[POINTS NQS  2011.XLS]Pro Stock'!C84) ->  | D80: ='I:\[POINTS NQS  2011.XLS]Pro Stock'!D84 -> 11-241 | E80: =IF('I:\[POINTS NQS  2011.XLS]Pro Stock'!E84=0," ",'I:\[POINTS NQS  2011.XLS]Pro Stock'!E84) -> Problem Child | F80: ='I:\[POINTS NQS  2011.XLS]Pro Stock'!Z84 -> 182 | H80: ='I:\[POINTS NQS  2011.XLS]Super Stock'!A84 -> 78 | I80: ='I:\[POINTS NQS  2011.XLS]Super Stock'!B84 -> Ian Manlove | J80: =IF('I:\[POINTS NQS  2011.XLS]Super Stock'!C84=0," ",'I:\[POINTS NQS  2011.XLS]Super Stock'!C84) -> MVP | K80: ='I:\[POINTS NQS  2011.XLS]Super Stock'!D84 -> 11-457 | L80: =IF('I:\[POINTS NQS  2011.XLS]Super Stock'!E84=0," ",'I:\[POINTS NQS  2011.XLS]Super Stock'!E84) -> Alcohol Abuse | M80: ='I:\[POINTS NQS  2011.XLS]Super Stock'!Z84 -> 175
A81: ='I:\[POINTS NQS  2011.XLS]Pro Stock'!A85 -> 79 | B81: ='I:\[POINTS NQS  2011.XLS]Pro Stock'!B85 -> Carly Manville | C81: =IF('I:\[POINTS NQS  2011.XLS]Pro Stock'!C85=0," ",'I:\[POINTS NQS  2011.XLS]Pro Stock'!C85) ->  | D81: ='I:\[POINTS NQS  2011.XLS]Pro Stock'!D85 -> 11-234 | E81: =IF('I:\[POINTS NQS  2011.XLS]Pro Stock'!E85=0," ",'I:\[POINTS NQS  2011.XLS]Pro Stock'!E85) ->  | F81: ='I:\[POINTS NQS  2011.XLS]Pro Stock'!Z85 -> 182 | H81: ='I:\[POINTS NQS  2011.XLS]Super Stock'!A85 -> 79 | I81: ='I:\[POINTS NQS  2011.XLS]Super Stock'!B85 -> Jim Morrison | J81: =IF('I:\[POINTS NQS  2011.XLS]Super Stock'!C85=0," ",'I:\[POINTS NQS  2011.XLS]Super Stock'!C85) ->  | K81: ='I:\[POINTS NQS  2011.XLS]Super Stock'!D85 -> 11-452 | L81: =IF('I:\[POINTS NQS  2011.XLS]Super Stock'!E85=0," ",'I:\[POINTS NQS  2011.XLS]Super Stock'!E85) -> White | M81: ='I:\[POINTS NQS  2011.XLS]Super Stock'!Z85 -> 176
A82: ='I:\[POINTS NQS  2011.XLS]Pro Stock'!A86 -> 80 | B82: ='I:\[POINTS NQS  2011.XLS]Pro Stock'!B86 -> Carly Manville | C82: =IF('I:\[POINTS NQS  2011.XLS]Pro Stock'!C86=0," ",'I:\[POINTS NQS  2011.XLS]Pro Stock'!C86) ->  | D82: ='I:\[POINTS NQS  2011.XLS]Pro Stock'!D86 -> 11-235 | E82: =IF('I:\[POINTS NQS  2011.XLS]Pro Stock'!E86=0," ",'I:\[POINTS NQS  2011.XLS]Pro Stock'!E86) ->  | F82: ='I:\[POINTS NQS  2011.XLS]Pro Stock'!Z86 -> 181 | H82: ='I:\[POINTS NQS  2011.XLS]Super Stock'!A86 -> 80 | I82: ='I:\[POINTS NQS  2011.XLS]Super Stock'!B86 -> Torrey Ahrens | J82: =IF('I:\[POINTS NQS  2011.XLS]Super Stock'!C86=0," ",'I:\[POINTS NQS  2011.XLS]Super Stock'!C86) ->  | K82: ='I:\[POINTS NQS  2011.XLS]Super Stock'!D86 -> 11-455 | L82: =IF('I:\[POINTS NQS  2011.XLS]Super Stock'!E86=0," ",'I:\[POINTS NQS  2011.XLS]Super Stock'!E86) -> Cubic Dollars | M82: ='I:\[POINTS NQS  2011.XLS]Super Stock'!Z86 -> 177
A83: ='I:\[POINTS NQS  2011.XLS]Pro Stock'!A87 -> 81 | B83: ='I:\[POINTS NQS  2011.XLS]Pro Stock'!B87 -> Gary McDonald | C83: =IF('I:\[POINTS NQS  2011.XLS]Pro Stock'!C87=0," ",'I:\[POINTS NQS  2011.XLS]Pro Stock'!C87) -> LEF | D83: ='I:\[POINTS NQS  2011.XLS]Pro Stock'!D87 -> 11-093 | E83: =IF('I:\[POINTS NQS  2011.XLS]Pro Stock'!E87=0," ",'I:\[POINTS NQS  2011.XLS]Pro Stock'!E87) -> Plum Risky | F83: ='I:\[POINTS NQS  2011.XLS]Pro Stock'!Z87 -> 183 | H83: ='I:\[POINTS NQS  2011.XLS]Super Stock'!A87 -> 81 | I83: ='I:\[POINTS NQS  2011.XLS]Super Stock'!B87 -> Nathan Mann | J83: =IF('I:\[POINTS NQS  2011.XLS]Super Stock'!C87=0," ",'I:\[POINTS NQS  2011.XLS]Super Stock'!C87) -> TC | K83: ='I:\[POINTS NQS  2011.XLS]Super Stock'!D87 -> 11-468 | L83: =IF('I:\[POINTS NQS  2011.XLS]Super Stock'!E87=0," ",'I:\[POINTS NQS  2011.XLS]Super Stock'!E87) -> Barbwire | M83: ='I:\[POINTS NQS  2011.XLS]Super Stock'!Z87 -> 179
A84: ='I:\[POINTS NQS  2011.XLS]Pro Stock'!A88 -> 82 | B84: ='I:\[POINTS NQS  2011.XLS]Pro Stock'!B88 -> Charlie Schultz | C84: =IF('I:\[POINTS NQS  2011.XLS]Pro Stock'!C88=0," ",'I:\[POINTS NQS  2011.XLS]Pro Stock'!C88) -> MVP | D84: ='I:\[POINTS NQS  2011.XLS]Pro Stock'!D88 -> 11-101 | E84: =IF('I:\[POINTS NQS  2011.XLS]Pro Stock'!E88=0," ",'I:\[POINTS NQS  2011.XLS]Pro Stock'!E88) -> Alota Stones | F84: ='I:\[POINTS NQS  2011.XLS]Pro Stock'!Z88 -> 183 | H84: ='I:\[POINTS NQS  2011.XLS]Super Stock'!A88 -> 82 | I84: ='I:\[POINTS NQS  2011.XLS]Super Stock'!B88 -> Ron Scroggins | J84: =IF('I:\[POINTS NQS  2011.XLS]Super Stock'!C88=0," ",'I:\[POINTS NQS  2011.XLS]Super Stock'!C88) -> VM | K84: ='I:\[POINTS NQS  2011.XLS]Super Stock'!D88 -> 11-110 | L84: =IF('I:\[POINTS NQS  2011.XLS]Super Stock'!E88=0," ",'I:\[POINTS NQS  2011.XLS]Super Stock'!E88) -> Dirt Dancer | M84: ='I:\[POINTS NQS  2011.XLS]Super Stock'!Z88 -> 180
A85: ='I:\[POINTS NQS  2011.XLS]Pro Stock'!A89 -> 83 | B85: ='I:\[POINTS NQS  2011.XLS]Pro Stock'!B89 -> Mark Deputy | C85: =IF('I:\[POINTS NQS  2011.XLS]Pro Stock'!C89=0," ",'I:\[POINTS NQS  2011.XLS]Pro Stock'!C89) -> TC | D85: ='I:\[POINTS NQS  2011.XLS]Pro Stock'!D89 -> 11-347 | E85: =IF('I:\[POINTS NQS  2011.XLS]Pro Stock'!E89=0," ",'I:\[POINTS NQS  2011.XLS]Pro Stock'!E89) -> Green Streak | F85: ='I:\[POINTS NQS  2011.XLS]Pro Stock'!Z89 -> 183 | H85: ='I:\[POINTS NQS  2011.XLS]Super Stock'!A89 -> 83 | I85: ='I:\[POINTS NQS  2011.XLS]Super Stock'!B89 -> Bill Richerson | J85: =IF('I:\[POINTS NQS  2011.XLS]Super Stock'!C89=0," ",'I:\[POINTS NQS  2011.XLS]Super Stock'!C89) -> JW | K85: ='I:\[POINTS NQS  2011.XLS]Super Stock'!D89 -> 11-132 | L85: =IF('I:\[POINTS NQS  2011.XLS]Super Stock'!E89=0," ",'I:\[POINTS NQS  2011.XLS]Super Stock'!E89) -> Walk the Line | M85: ='I:\[POINTS NQS  2011.XLS]Super Stock'!Z89 -> 180
A86: ='I:\[POINTS NQS  2011.XLS]Pro Stock'!A90 -> 84 | B86: ='I:\[POINTS NQS  2011.XLS]Pro Stock'!B90 -> Max Burkhart | C86: =IF('I:\[POINTS NQS  2011.XLS]Pro Stock'!C90=0," ",'I:\[POINTS NQS  2011.XLS]Pro Stock'!C90) -> TC | D86: ='I:\[POINTS NQS  2011.XLS]Pro Stock'!D90 -> 11-078 | E86: =IF('I:\[POINTS NQS  2011.XLS]Pro Stock'!E90=0," ",'I:\[POINTS NQS  2011.XLS]Pro Stock'!E90) -> Ground Pounder | F86: ='I:\[POINTS NQS  2011.XLS]Pro Stock'!Z90 -> 184 | H86: ='I:\[POINTS NQS  2011.XLS]Super Stock'!A90 -> 84 | I86: ='I:\[POINTS NQS  2011.XLS]Super Stock'!B90 -> Mark Cessena | J86: =IF('I:\[POINTS NQS  2011.XLS]Super Stock'!C90=0," ",'I:\[POINTS NQS  2011.XLS]Super Stock'!C90) ->  | K86: ='I:\[POINTS NQS  2011.XLS]Super Stock'!D90 -> 0 | L86: =IF('I:\[POINTS NQS  2011.XLS]Super Stock'!E90=0," ",'I:\[POINTS NQS  2011.XLS]Super Stock'!E90) -> Built for Business | M86: ='I:\[POINTS NQS  2011.XLS]Super Stock'!Z90 -> 181
A87: ='I:\[POINTS NQS  2011.XLS]Pro Stock'!A91 -> 85 | B87: ='I:\[POINTS NQS  2011.XLS]Pro Stock'!B91 -> Joel Young | C87: =IF('I:\[POINTS NQS  2011.XLS]Pro Stock'!C91=0," ",'I:\[POINTS NQS  2011.XLS]Pro Stock'!C91) -> NP | D87: ='I:\[POINTS NQS  2011.XLS]Pro Stock'!D91 -> 11-479 | E87: =IF('I:\[POINTS NQS  2011.XLS]Pro Stock'!E91=0," ",'I:\[POINTS NQS  2011.XLS]Pro Stock'!E91) -> Mental Health 1 | F87: ='I:\[POINTS NQS  2011.XLS]Pro Stock'!Z91 -> 184 | H87: ='I:\[POINTS NQS  2011.XLS]Super Stock'!A91 -> 85 | I87: ='I:\[POINTS NQS  2011.XLS]Super Stock'!B91 -> Charlie Schultz | J87: =IF('I:\[POINTS NQS  2011.XLS]Super Stock'!C91=0," ",'I:\[POINTS NQS  2011.XLS]Super Stock'!C91) -> MVP | K87: ='I:\[POINTS NQS  2011.XLS]Super Stock'!D91 -> 11-101 | L87: =IF('I:\[POINTS NQS  2011.XLS]Super Stock'!E91=0," ",'I:\[POINTS NQS  2011.XLS]Super Stock'!E91) -> AllotaStones | M87: ='I:\[POINTS NQS  2011.XLS]Super Stock'!Z91 -> 182
A88: ='I:\[POINTS NQS  2011.XLS]Pro Stock'!A92 -> 86 | B88: ='I:\[POINTS NQS  2011.XLS]Pro Stock'!B92 -> Scott Slusher | C88: =IF('I:\[POINTS NQS  2011.XLS]Pro Stock'!C92=0," ",'I:\[POINTS NQS  2011.XLS]Pro Stock'!C92) ->  | D88: ='I:\[POINTS NQS  2011.XLS]Pro Stock'!D92 -> 0 | E88: =IF('I:\[POINTS NQS  2011.XLS]Pro Stock'!E92=0," ",'I:\[POINTS NQS  2011.XLS]Pro Stock'!E92) ->  | F88: ='I:\[POINTS NQS  2011.XLS]Pro Stock'!Z92 -> 184 | H88: ='I:\[POINTS NQS  2011.XLS]Super Stock'!A92 -> 86 | I88: ='I:\[POINTS NQS  2011.XLS]Super Stock'!B92 -> Rudy Puskarich | J88: =IF('I:\[POINTS NQS  2011.XLS]Super Stock'!C92=0," ",'I:\[POINTS NQS  2011.XLS]Super Stock'!C92) ->  | K88: ='I:\[POINTS NQS  2011.XLS]Super Stock'!D92 -> 0 | L88: =IF('I:\[POINTS NQS  2011.XLS]Super Stock'!E92=0," ",'I:\[POINTS NQS  2011.XLS]Super Stock'!E92) -> English Bulldog | M88: ='I:\[POINTS NQS  2011.XLS]Super Stock'!Z92 -> 182
A89: ='I:\[POINTS NQS  2011.XLS]Pro Stock'!A93 -> 87 | B89: ='I:\[POINTS NQS  2011.XLS]Pro Stock'!B93 -> Jake Gingerich | C89: =IF('I:\[POINTS NQS  2011.XLS]Pro Stock'!C93=0," ",'I:\[POINTS NQS  2011.XLS]Pro Stock'!C93) -> JW | D89: ='I:\[POINTS NQS  2011.XLS]Pro Stock'!D93 -> 11-023 | E89: =IF('I:\[POINTS NQS  2011.XLS]Pro Stock'!E93=0," ",'I:\[POINTS NQS  2011.XLS]Pro Stock'!E93) -> Royal Pain | F89: ='I:\[POINTS NQS  2011.XLS]Pro Stock'!Z93 -> 185 | H89: ='I:\[POINTS NQS  2011.XLS]Super Stock'!A93 -> 87 | I89: ='I:\[POINTS NQS  2011.XLS]Super Stock'!B93 -> Carly Manville | J89: =IF('I:\[POINTS NQS  2011.XLS]Super Stock'!C93=0," ",'I:\[POINTS NQS  2011.XLS]Super Stock'!C93) ->  | K89: ='I:\[POINTS NQS  2011.XLS]Super Stock'!D93 -> 0 | L89: =IF('I:\[POINTS NQS  2011.XLS]Super Stock'!E93=0," ",'I:\[POINTS NQS  2011.XLS]Super Stock'!E93) -> No Fluke | M89: ='I:\[POINTS NQS  2011.XLS]Super Stock'!Z93 -> 182
A90: ='I:\[POINTS NQS  2011.XLS]Pro Stock'!A94 -> 88 | B90: ='I:\[POINTS NQS  2011.XLS]Pro Stock'!B94 -> Rick Mann | C90: =IF('I:\[POINTS NQS  2011.XLS]Pro Stock'!C94=0," ",'I:\[POINTS NQS  2011.XLS]Pro Stock'!C94) -> TC | D90: ='I:\[POINTS NQS  2011.XLS]Pro Stock'!D94 -> 11-468 | E90: =IF('I:\[POINTS NQS  2011.XLS]Pro Stock'!E94=0," ",'I:\[POINTS NQS  2011.XLS]Pro Stock'!E94) -> Barbwire | F90: ='I:\[POINTS NQS  2011.XLS]Pro Stock'!Z94 -> 185 | H90: ='I:\[POINTS NQS  2011.XLS]Super Stock'!A94 -> 88 | I90: ='I:\[POINTS NQS  2011.XLS]Super Stock'!B94 -> Jake Gingerich | J90: =IF('I:\[POINTS NQS  2011.XLS]Super Stock'!C94=0," ",'I:\[POINTS NQS  2011.XLS]Super Stock'!C94) -> JW | K90: ='I:\[POINTS NQS  2011.XLS]Super Stock'!D94 -> 11-018 | L90: =IF('I:\[POINTS NQS  2011.XLS]Super Stock'!E94=0," ",'I:\[POINTS NQS  2011.XLS]Super Stock'!E94) -> Thumper | M90: ='I:\[POINTS NQS  2011.XLS]Super Stock'!Z94 -> 183
A91: ='I:\[POINTS NQS  2011.XLS]Pro Stock'!A95 -> 89 | B91: ='I:\[POINTS NQS  2011.XLS]Pro Stock'!B95 -> Todd Brest | C91: =IF('I:\[POINTS NQS  2011.XLS]Pro Stock'!C95=0," ",'I:\[POINTS NQS  2011.XLS]Pro Stock'!C95) ->  | D91: ='I:\[POINTS NQS  2011.XLS]Pro Stock'!D95 -> 11-272 | E91: =IF('I:\[POINTS NQS  2011.XLS]Pro Stock'!E95=0," ",'I:\[POINTS NQS  2011.XLS]Pro Stock'!E95) -> Cub | F91: ='I:\[POINTS NQS  2011.XLS]Pro Stock'!Z95 -> 185 | H91: ='I:\[POINTS NQS  2011.XLS]Super Stock'!A95 -> 89 | I91: ='I:\[POINTS NQS  2011.XLS]Super Stock'!B95 -> Ron Scroggins | J91: =IF('I:\[POINTS NQS  2011.XLS]Super Stock'!C95=0," ",'I:\[POINTS NQS  2011.XLS]Super Stock'!C95) -> VM | K91: ='I:\[POINTS NQS  2011.XLS]Super Stock'!D95 -> 11-111 | L91: =IF('I:\[POINTS NQS  2011.XLS]Super Stock'!E95=0," ",'I:\[POINTS NQS  2011.XLS]Super Stock'!E95) -> Black out | M91: ='I:\[POINTS NQS  2011.XLS]Super Stock'!Z95 -> 183
A92: ='I:\[POINTS NQS  2011.XLS]Pro Stock'!A96 -> 90 | B92: ='I:\[POINTS NQS  2011.XLS]Pro Stock'!B96 -> Mark Brest | C92: =IF('I:\[POINTS NQS  2011.XLS]Pro Stock'!C96=0," ",'I:\[POINTS NQS  2011.XLS]Pro Stock'!C96) ->  | D92: ='I:\[POINTS NQS  2011.XLS]Pro Stock'!D96 -> 11-404 | E92: =IF('I:\[POINTS NQS  2011.XLS]Pro Stock'!E96=0," ",'I:\[POINTS NQS  2011.XLS]Pro Stock'!E96) -> Stage 4 | F92: ='I:\[POINTS NQS  2011.XLS]Pro Stock'!Z96 -> 185 | H92: ='I:\[POINTS NQS  2011.XLS]Super Stock'!A96 -> 90 | I92: ='I:\[POINTS NQS  2011.XLS]Super Stock'!B96 -> Larry Hunter | J92: =IF('I:\[POINTS NQS  2011.XLS]Super Stock'!C96=0," ",'I:\[POINTS NQS  2011.XLS]Super Stock'!C96) ->  | K92: ='I:\[POINTS NQS  2011.XLS]Super Stock'!D96 -> 11-220 | L92: =IF('I:\[POINTS NQS  2011.XLS]Super Stock'!E96=0," ",'I:\[POINTS NQS  2011.XLS]Super Stock'!E96) -> Bluelicker | M92: ='I:\[POINTS NQS  2011.XLS]Super Stock'!Z96 -> 183
A93: ='I:\[POINTS NQS  2011.XLS]Pro Stock'!A97 -> 91 | B93: ='I:\[POINTS NQS  2011.XLS]Pro Stock'!B97 -> Kevin Stitzer | C93: =IF('I:\[POINTS NQS  2011.XLS]Pro Stock'!C97=0," ",'I:\[POINTS NQS  2011.XLS]Pro Stock'!C97) ->  | D93: ='I:\[POINTS NQS  2011.XLS]Pro Stock'!D97 -> 11-447 | E93: =IF('I:\[POINTS NQS  2011.XLS]Pro Stock'!E97=0," ",'I:\[POINTS NQS  2011.XLS]Pro Stock'!E97) -> Thunder Road II | F93: ='I:\[POINTS NQS  2011.XLS]Pro Stock'!Z97 -> 186 | H93: ='I:\[POINTS NQS  2011.XLS]Super Stock'!A97 -> 91 | I93: ='I:\[POINTS NQS  2011.XLS]Super Stock'!B97 -> John Cress | J93: =IF('I:\[POINTS NQS  2011.XLS]Super Stock'!C97=0," ",'I:\[POINTS NQS  2011.XLS]Super Stock'!C97) -> VM | K93: ='I:\[POINTS NQS  2011.XLS]Super Stock'!D97 -> 11-485 | L93: =IF('I:\[POINTS NQS  2011.XLS]Super Stock'!E97=0," ",'I:\[POINTS NQS  2011.XLS]Super Stock'!E97) ->  | M93: ='I:\[POINTS NQS  2011.XLS]Super Stock'!Z97 -> 183
A94: ='I:\[POINTS NQS  2011.XLS]Pro Stock'!A98 -> 92 | B94: ='I:\[POINTS NQS  2011.XLS]Pro Stock'!B98 -> Jared Fellers | C94: =IF('I:\[POINTS NQS  2011.XLS]Pro Stock'!C98=0," ",'I:\[POINTS NQS  2011.XLS]Pro Stock'!C98) -> LR | D94: ='I:\[POINTS NQS  2011.XLS]Pro Stock'!D98 -> 11-493 | E94: =IF('I:\[POINTS NQS  2011.XLS]Pro Stock'!E98=0," ",'I:\[POINTS NQS  2011.XLS]Pro Stock'!E98) -> Money Pit | F94: ='I:\[POINTS NQS  2011.XLS]Pro Stock'!Z98 -> 186 | H94: ='I:\[POINTS NQS  2011.XLS]Super Stock'!A98 -> 92 | I94: ='I:\[POINTS NQS  2011.XLS]Super Stock'!B98 -> Colyn Hammond | J94: =IF('I:\[POINTS NQS  2011.XLS]Super Stock'!C98=0," ",'I:\[POINTS NQS  2011.XLS]Super Stock'!C98) ->  | K94: ='I:\[POINTS NQS  2011.XLS]Super Stock'!D98 -> 0 | L94: =IF('I:\[POINTS NQS  2011.XLS]Super Stock'!E98=0," ",'I:\[POINTS NQS  2011.XLS]Super Stock'!E98) -> Problem Child | M94: ='I:\[POINTS NQS  2011.XLS]Super Stock'!Z98 -> 184
A95: ='I:\[POINTS NQS  2011.XLS]Pro Stock'!A99 -> 93 | B95: ='I:\[POINTS NQS  2011.XLS]Pro Stock'!B99 -> Wayne Lowry | C95: =IF('I:\[POINTS NQS  2011.XLS]Pro Stock'!C99=0," ",'I:\[POINTS NQS  2011.XLS]Pro Stock'!C99) -> NP | D95: ='I:\[POINTS NQS  2011.XLS]Pro Stock'!D99 -> 11-242 | E95: =IF('I:\[POINTS NQS  2011.XLS]Pro Stock'!E99=0," ",'I:\[POINTS NQS  2011.XLS]Pro Stock'!E99) -> Bad News | F95: ='I:\[POINTS NQS  2011.XLS]Pro Stock'!Z99 -> 186 | H95: ='I:\[POINTS NQS  2011.XLS]Super Stock'!A99 -> 93 | I95: ='I:\[POINTS NQS  2011.XLS]Super Stock'!B99 -> Wayne Lowry | J95: =IF('I:\[POINTS NQS  2011.XLS]Super Stock'!C99=0," ",'I:\[POINTS NQS  2011.XLS]Super Stock'!C99) ->  | K95: ='I:\[POINTS NQS  2011.XLS]Super Stock'!D99 -> 11-242 | L95: =IF('I:\[POINTS NQS  2011.XLS]Super Stock'!E99=0," ",'I:\[POINTS NQS  2011.XLS]Super Stock'!E99) -> Bad News | M95: ='I:\[POINTS NQS  2011.XLS]Super Stock'!Z99 -> 185
A96: ='I:\[POINTS NQS  2011.XLS]Pro Stock'!A100 -> 94 | B96: ='I:\[POINTS NQS  2011.XLS]Pro Stock'!B100 -> Jim Spencer | C96: =IF('I:\[POINTS NQS  2011.XLS]Pro Stock'!C100=0," ",'I:\[POINTS NQS  2011.XLS]Pro Stock'!C100) ->  | D96: ='I:\[POINTS NQS  2011.XLS]Pro Stock'!D100 -> 11-112 | E96: =IF('I:\[POINTS NQS  2011.XLS]Pro Stock'!E100=0," ",'I:\[POINTS NQS  2011.XLS]Pro Stock'!E100) -> Family Traditions | F96: ='I:\[POINTS NQS  2011.XLS]Pro Stock'!Z100 -> 187 | H96: ='I:\[POINTS NQS  2011.XLS]Super Stock'!A100 -> 94 | I96: ='I:\[POINTS NQS  2011.XLS]Super Stock'!B100 -> Tyler Hackman | J96: =IF('I:\[POINTS NQS  2011.XLS]Super Stock'!C100=0," ",'I:\[POINTS NQS  2011.XLS]Super Stock'!C100) ->  | K96: ='I:\[POINTS NQS  2011.XLS]Super Stock'!D100 -> 0 | L96: =IF('I:\[POINTS NQS  2011.XLS]Super Stock'!E100=0," ",'I:\[POINTS NQS  2011.XLS]Super Stock'!E100) -> Green | M96: ='I:\[POINTS NQS  2011.XLS]Super Stock'!Z100 -> 185