B2: 30 Cube
F5: Princeton, Ind | I5: Richmond,KY | L5: Marietta | O5: Kansas City | R5: Sturgis | U5: Tallmadge
B6: Name | C6: Eng. | D6: NQS # | E6: Tractor | F6: Qualifying Points | G6: Finals Points | I6: Qualifying Points | J6: Finals Points | L6: Qualifying Points | M6: Finals Points | O6: Qualifying Points | P6: Finals Points | R6: Qualifying Points | S6: Finals Points | U6: Qualifying Points | V6: Finals Points | X6: Total Points | Z6: Points Back | AB6: Teardown sticker check
A7: 1 | B7: Shawn Garman | C7: JRS | D7: 11-230 | E7: Gun Slinger | F7: 29 | I7: 24 | L7: 28 | O7: 23 | R7: 30 | X7: =SUM(+F7+G7+I7+J7+L7+M7+O7+P7+R7+S7+U7+V7) -> 134 | Z7: =SUM(AB7-X7) -> 0 | AB7: =SUM(X$7) -> 134
A8: 2 | B8: Ben Larkins | C8: JW | D8: 11-137 | E8: Indian Outlaw | F8: 28 | I8: 30 | L8: 27 | O8: 19 | R8: 18 | X8: =SUM(+F8+G8+I8+J8+L8+M8+O8+P8+R8+S8+U8+V8) -> 122 | Z8: =SUM(AB8-X8) -> 12 | AB8: =SUM(X$7) -> 134
A9: 3 | B9: Greg Heifner | C9: TH | D9: 11-231 | E9: Instigator | F9: 23 | I9: 28 | L9: 21 | O9: 25 | R9: 22 | X9: =SUM(+F9+G9+I9+J9+L9+M9+O9+P9+R9+S9+U9+V9) -> 119 | Z9: =SUM(AB9-X9) -> 15 | AB9: =SUM(X$7) -> 134
A10: 4 | B10: Andy Ferguson | C10: MVP | D10: 11-100 | E10: Rasin Cane | F10: 30 | I10: 27 | L10: 20 | O10: 17 | R10: 20 | X10: =SUM(+F10+G10+I10+J10+L10+M10+O10+P10+R10+S10+U10+V10) -> 114 | Z10: =SUM(AB10-X10) -> 20 | AB10: =SUM(X$7) -> 134
A11: 5 | B11: Kole Larkins | C11: JW | D11: 11-372 | E11: Wound Up | F11: 24 | I11: 15 | L11: 30 | O11: 18 | R11: 27 | X11: =SUM(+F11+G11+I11+J11+L11+M11+O11+P11+R11+S11+U11+V11) -> 114 | Z11: =SUM(AB11-X11) -> 20 | AB11: =SUM(X$7) -> 134
A12: 6 | B12: Doug Rood | C12: JW | D12: 11-354 | E12: Blue Dawg | F12: 19 | I12: 25 | L12: 26 | O12: 16 | R12: 24 | X12: =SUM(+F12+G12+I12+J12+L12+M12+O12+P12+R12+S12+U12+V12) -> 110 | Z12: =SUM(AB12-X12) -> 24 | AB12: =SUM(X$7) -> 134
A13: 7 | B13: Tony Heifner | C13: TH | D13: 11-116 | E13: Heartbeat | F13: 20 | I13: 23 | L13: 24 | O13: 21 | R13: 21 | X13: =SUM(+F13+G13+I13+J13+L13+M13+O13+P13+R13+S13+U13+V13) -> 109 | Z13: =SUM(AB13-X13) -> 25 | AB13: =SUM(X$7) -> 134
A14: 8 | B14: Charlie Schultz | C14: MVP | D14: 11-102 | E14: Silver Bullet | F14: 18 | I14: 26 | L14: 17 | O14: 30 | R14: 17 | X14: =SUM(+F14+G14+I14+J14+L14+M14+O14+P14+R14+S14+U14+V14) -> 108 | Z14: =SUM(AB14-X14) -> 26 | AB14: =SUM(X$7) -> 134
A15: 9 | B15: Tony Lewis | C15: Tel Tool | D15: 11-345 | E15: Plain Jane | F15: 25 | I15: 22 | L15: 25 | O15: 15 | R15: 19 | X15: =SUM(+F15+G15+I15+J15+L15+M15+O15+P15+R15+S15+U15+V15) -> 106 | Z15: =SUM(AB15-X15) -> 28 | AB15: =SUM(X$7) -> 134
A16: 10 | B16: Scott Bye | C16: JW | D16: 11-187 | E16: Splinter | I16: 18 | L16: 29 | O16: 30 | R16: 25 | X16: =SUM(+F16+G16+I16+J16+L16+M16+O16+P16+R16+S16+U16+V16) -> 102 | Z16: =SUM(AB16-X16) -> 32 | AB16: =SUM(X$7) -> 134
A17: 11 | B17: Darrell Tate | C17: Tate | D17: 11-060 | E17: Pink | F17: 26 | I17: 20 | L17: 18 | X17: =SUM(+F17+G17+I17+J17+L17+M17+O17+P17+R17+S17+U17+V17) -> 64 | Z17: =SUM(AB17-X17) -> 70 | AB17: =SUM(X$7) -> 134
A18: 12 | B18: Darrell Tate | C18: Tate | D18: 11-059 | E18: Orange | F18: 21 | I18: 19 | L18: 19 | X18: =SUM(+F18+G18+I18+J18+L18+M18+O18+P18+R18+S18+U18+V18) -> 59 | Z18: =SUM(AB18-X18) -> 75 | AB18: =SUM(X$7) -> 134
A19: 13 | B19: Dave Gawatz | D19: 11-408 | E19: Undertaker | O19: 30 | R19: 28 | X19: =SUM(+F19+G19+I19+J19+L19+M19+O19+P19+R19+S19+U19+V19) -> 58 | Z19: =SUM(AB19-X19) -> 76 | AB19: =SUM(X$7) -> 134
A20: 14 | B20: Patrick Roth | C20: Tate | D20: 11-061 | E20: Widowmaker | F20: 17 | I20: 16 | L20: 22 | X20: =SUM(+F20+G20+I20+J20+L20+M20+O20+P20+R20+S20+U20+V20) -> 55 | Z20: =SUM(AB20-X20) -> 79 | AB20: =SUM(X$7) -> 134
A21: 15 | B21: Greg Black | C21: JW | D21: 11-103 | E21: Pocket Change | O21: 30 | R21: 23 | X21: =SUM(+F21+G21+I21+J21+L21+M21+O21+P21+R21+S21+U21+V21) -> 53 | Z21: =SUM(AB21-X21) -> 81 | AB21: =SUM(X$7) -> 134
A22: 16 | B22: Wes Kempeter | D22: 11-424 | E22: Wasted Money | O22: 20 | R22: 29 | X22: =SUM(+F22+G22+I22+J22+L22+M22+O22+P22+R22+S22+U22+V22) -> 49 | Z22: =SUM(AB22-X22) -> 85 | AB22: =SUM(X$7) -> 134
A23: 17 | B23: Keith Roberts | C23: TC | D23: 11-194 | E23: Yellow Jacket | F23: 22 | R23: 26 | X23: =SUM(+F23+G23+I23+J23+L23+M23+O23+P23+R23+S23+U23+V23) -> 48 | Z23: =SUM(AB23-X23) -> 86 | AB23: =SUM(X$7) -> 134
A24: 18 | B24: Caleb Peters | C24: CT | D24: 11-371 | E24: Bernies Nitemare | F24: 27 | I24: 21 | X24: =SUM(+F24+G24+I24+J24+L24+M24+O24+P24+R24+S24+U24+V24) -> 48 | Z24: =SUM(AB24-X24) -> 86 | AB24: =SUM(X$7) -> 134
A25: 19 | B25: Bobby Feldkamp | C25: WOODS | D25: 11-144 | E25: Goin for Broke | F25: 14 | L25: 16 | R25: 15 | X25: =SUM(+F25+G25+I25+J25+L25+M25+O25+P25+R25+S25+U25+V25) -> 45 | Z25: =SUM(AB25-X25) -> 89 | AB25: =SUM(X$7) -> 134
A26: 20 | B26: George Bax | D26: 11-422 | E26: Plum Crazy | O26: 30 | X26: =SUM(+F26+G26+I26+J26+L26+M26+O26+P26+R26+S26+U26+V26) -> 30 | Z26: =SUM(AB26-X26) -> 104 | AB26: =SUM(X$7) -> 134
A27: 21 | B27: Justin Wagler | C27: WP | D27: 11-127 | E27: Samson | F27: 13 | R27: 16 | X27: =SUM(+F27+G27+I27+J27+L27+M27+O27+P27+R27+S27+U27+V27) -> 29 | Z27: =SUM(AB27-X27) -> 105 | AB27: =SUM(X$7) -> 134
A28: 22 | B28: Michele Amstutz | C28: TC | D28: 11-339 | E28: Cub Cadet | F28: 15 | I28: 14 | X28: =SUM(+F28+G28+I28+J28+L28+M28+O28+P28+R28+S28+U28+V28) -> 29 | Z28: =SUM(AB28-X28) -> 105 | AB28: =SUM(X$7) -> 134
A29: 23 | B29: Keith Roberts | C29: TC | D29: 11-350 | E29: Yellow Jacket | I29: 29 | X29: =SUM(+F29+G29+I29+J29+L29+M29+O29+P29+R29+S29+U29+V29) -> 29 | Z29: =SUM(AB29-X29) -> 105 | AB29: =SUM(X$7) -> 134
A30: 24 | B30: Haylee Heits | D30: 11-411 | E30: Full Throttle | O30: 24 | X30: =SUM(+F30+G30+I30+J30+L30+M30+O30+P30+R30+S30+U30+V30) -> 24 | Z30: =SUM(AB30-X30) -> 110 | AB30: =SUM(X$7) -> 134
A31: 25 | B31: Amanda Manville | C31: JRS | D31: 11-235 | E31: Sidewinder | L31: 23 | X31: =SUM(+F31+G31+I31+J31+L31+M31+O31+P31+R31+S31+U31+V31) -> 23 | Z31: =SUM(AB31-X31) -> 111 | AB31: =SUM(X$7) -> 134
A32: 26 | B32: Aaron Sloan | D32: 11-425 | E32: Insufficient Funds | O32: 22 | X32: =SUM(+F32+G32+I32+J32+L32+M32+O32+P32+R32+S32+U32+V32) -> 22 | Z32: =SUM(AB32-X32) -> 112 | AB32: =SUM(X$7) -> 134
A33: 27 | B33: Corey McClung | D33: 11-295 | E33: Zero | I33: 17 | X33: =SUM(+F33+G33+I33+J33+L33+M33+O33+P33+R33+S33+U33+V33) -> 17 | Z33: =SUM(AB33-X33) -> 117 | AB33: =SUM(X$7) -> 134
A34: 28 | B34: Annette Sullivan | C34: MVP | D34: 11-122 | E34: Just Relax | F34: 16 | X34: =SUM(+F34+G34+I34+J34+L34+M34+O34+P34+R34+S34+U34+V34) -> 16 | Z34: =SUM(AB34-X34) -> 118 | AB34: =SUM(X$7) -> 134
A35: 29 | B35: Bud Casale | D35: 11-403 | K35: 15 | L35: 15 | X35: =SUM(+F35+G35+I35+J35+L35+M35+O35+P35+R35+S35+U35+V35) -> 15 | Z35: =SUM(AB35-X35) -> 119 | AB35: =SUM(X$7) -> 134
A36: 30 | B36: Brian Peregrine | D36: 11-415 | E36: Wood Chipper | O36: 14 | X36: =SUM(+F36+G36+I36+J36+L36+M36+O36+P36+R36+S36+U36+V36) -> 14 | Z36: =SUM(AB36-X36) -> 120 | AB36: =SUM(X$7) -> 134
A37: 31 | B37: Rick Massey | D37: 11-421 | E37: Spare Parts | O37: 13 | X37: =SUM(+F37+G37+I37+J37+L37+M37+O37+P37+R37+S37+U37+V37) -> 13 | Z37: =SUM(AB37-X37) -> 121 | AB37: =SUM(X$7) -> 134
A38: 32 | B38: Mike Perry | D38: 11-426 | E38: Mac Attack | O38: 12 | X38: =SUM(+F38+G38+I38+J38+L38+M38+O38+P38+R38+S38+U38+V38) -> 12 | Z38: =SUM(AB38-X38) -> 122 | AB38: =SUM(X$7) -> 134
A39: 33 | B39: Leslie Sullivan | D39: 11-120 | E39: Joker | O39: 11 | X39: =SUM(+F39+G39+I39+J39+L39+M39+O39+P39+R39+S39+U39+V39) -> 11 | Z39: =SUM(AB39-X39) -> 123 | AB39: =SUM(X$7) -> 134