A3: PRO/SS ENGINE BUILDERS
C4: Princeton | D4: Princeton | F4: Richmond | G4: Richmond | J4: Marietta | K4: Marietta | N4: Kansas | O4: Kansas | R4: Sturgis | S4: Sturgis | V4: Tallmadge | W4: Tallmadge
C5: PRO | D5: SUPER | E5: TOTL | F5: PRO | G5: SUPER | H5: TOTL | I5: G TOTAL | J5: PRO | K5: SUPER | L5: TOTL | M5: G TOTAL | N5: PRO | O5: SUPER | P5: TOTL | Q5: G TOTAL | R5: PRO | S5: SUPER | T5: TOTL | U5: G TOTAL | V5: PRO | W5: SUPER | X5: TOTL | Y5: G TOTAL
A6: NP = NICHOLS PERFORMANCE | C6: 37 | D6: 38 | E6: 75 | F6: 40 | G6: 40 | H6: =SUM(F4:G4) -> 80 | I6: =E4+H4 -> 155 | J6: 40 | K6: 40 | L6: =SUM(J4:K4) -> 80 | M6: =I4+L4 -> 235 | N6: 35 | O6: 40 | P6: =SUM(N4:O4) -> 75 | Q6: =M4+P4 -> 310 | R6: 40 | S6: 38 | T6: =SUM(R4:S4) -> 78 | U6: =Q4+T4 -> 388 | X6: =SUM(V4:W4) -> 0
A7: MVP = MVP RACING | C7: 34 | D7: 40 | E7: 74 | F7: 33 | G7: 39 | H7: =SUM(F5:G5) -> 72 | I7: =E5+H5 -> 146 | J7: 38 | K7: 36 | L7: =SUM(J5:K5) -> 74 | M7: =I5+L5 -> 220 | N7: 40 | O7: 39 | P7: =SUM(N5:O5) -> 79 | Q7: =M5+P5 -> 299 | R7: 31 | S7: 40 | T7: =SUM(R5:S5) -> 71 | U7: =Q5+T5 -> 370 | X7: =SUM(V5:W5) -> 0
A8: LR = LAKOTA RACING | C8: 38 | D8: 39 | E8: 77 | F8: 29 | G8: 13 | H8: =SUM(F6:G6) -> 42 | I8: =E6+H6 -> 119 | K8: 31 | L8: =SUM(J6:K6) -> 31 | M8: =I6+L6 -> 150 | N8: 39 | O8: 38 | P8: =SUM(N6:O6) -> 77 | Q8: =M6+P6 -> 227 | R8: 35 | S8: 37 | T8: =SUM(R6:S6) -> 72 | U8: =Q6+T6 -> 299 | X8: =SUM(V6:W6) -> 0
A9: GTP = MISHLER | C9: 40 | D9: 14 | E9: 54 | F9: 36 | G9: 36 | H9: =SUM(F7:G7) -> 72 | I9: =E7+H7 -> 126 | J9: 31 | K9: 28 | L9: =SUM(J7:K7) -> 59 | M9: =I7+L7 -> 185 | N9: 37 | P9: =SUM(N7:O7) -> 37 | Q9: =M7+P7 -> 222 | R9: 32 | S9: 23 | T9: =SUM(R7:S7) -> 55 | U9: =Q7+T7 -> 277 | X9: =SUM(V7:W7) -> 0
A10: JRS = JIMS REPAIR SERVICE | C10: 30 | D10: 23 | E10: 53 | F10: 34 | G10: 22 | H10: =SUM(F8:G8) -> 56 | I10: =E8+H8 -> 109 | J10: 26 | K10: 17 | L10: =SUM(J8:K8) -> 43 | M10: =I8+L8 -> 152 | N10: 19 | O10: 8 | P10: =SUM(N8:O8) -> 27 | Q10: =M8+P8 -> 179 | R10: 39 | S10: 34 | T10: =SUM(R8:S8) -> 73 | U10: =Q8+T8 -> 252 | X10: =SUM(V8:W8) -> 0
A11: ROOT = KEVIN ROOT | C11: 39 | D11: 36 | E11: 75 | F11: 23 | G11: 34 | H11: =SUM(F9:G9) -> 57 | I11: =E9+H9 -> 132 | J11: 25 | K11: 34 | L11: =SUM(J9:K9) -> 59 | M11: =I9+L9 -> 191 | N11: 30 | O11: 15 | P11: =SUM(N9:O9) -> 45 | Q11: =M9+P9 -> 236 | R11: 7 | T11: =SUM(R9:S9) -> 7 | U11: =Q9+T9 -> 243 | X11: =SUM(V9:W9) -> 0
A12: HACKMAN = GREG HACKMAN | C12: 23 | D12: 33 | E12: 56 | F12: 37 | G12: 30 | H12: =SUM(F10:G10) -> 67 | I12: =E10+H10 -> 123 | J12: 20 | K12: 25 | L12: =SUM(J10:K10) -> 45 | M12: =I10+L10 -> 168 | P12: =SUM(N10:O10) -> 0 | Q12: =M10+P10 -> 168 | R12: 38 | T12: =SUM(R10:S10) -> 38 | U12: =Q10+T10 -> 206 | X12: =SUM(V10:W10) -> 0
A13: JW = JOE WHITWORTH | C13: 13 | D13: 29 | E13: 42 | G13: 24 | H13: =SUM(F11:G11) -> 24 | I13: =E11+H11 -> 66 | J13: 18 | K13: 24 | L13: =SUM(J11:K11) -> 42 | M13: =I11+L11 -> 108 | N13: 10 | O13: 30 | P13: =SUM(N11:O11) -> 40 | Q13: =M11+P11 -> 148 | S13: 35 | T13: =SUM(R11:S11) -> 35 | U13: =Q11+T11 -> 183 | X13: =SUM(V11:W11) -> 0
A14: VM = VOGEL MFG | D14: 32 | E14: 32 | F14: 22 | H14: =SUM(F12:G12) -> 22 | I14: =E12+H12 -> 54 | L14: =SUM(J12:K12) -> 0 | M14: =I12+L12 -> 54 | N14: 28 | O14: 36 | P14: =SUM(N12:O12) -> 64 | Q14: =M12+P12 -> 118 | S14: 18 | T14: =SUM(R12:S12) -> 18 | U14: =Q12+T12 -> 136 | X14: =SUM(V12:W12) -> 0
A15: TC = TOOTER CAMPBELL | C15: 8 | D15: 27 | E15: 35 | G15: 18 | H15: =SUM(F13:G13) -> 18 | I15: =E13+H13 -> 53 | J15: 16 | K15: 12 | L15: =SUM(J13:K13) -> 28 | M15: =I13+L13 -> 81 | O15: 21 | P15: =SUM(N13:O13) -> 21 | Q15: =M13+P13 -> 102 | R15: 8 | S15: 5 | T15: =SUM(R13:S13) -> 13 | U15: =Q13+T13 -> 115 | X15: =SUM(V13:W13) -> 0
A17: SA/OL ENGINE BUILDERS
C18: Princeton | D18: Princeton | F18: Richmond | G18: Richmond | J18: Marietta | K18: Marietta | N18: Kansas | O18: Kansas | R18: Sturgis | S18: Sturgis | V18: Tallmadge | W18: Tallmadge
C19: SA | D19: OL | E19: TOTL | F19: SA | G19: OL | H19: TOTL | I19: G TOTAL | J19: SA | K19: OL | L19: TOTL | M19: G TOTAL | N19: SA | O19: OL | P19: TOTL | Q19: G TOTAL | R19: SA | S19: OL | T19: TOTL | U19: G TOTAL | V19: SA | W19: OL | X19: TOTL | Y19: G TOTAL
A20: NP = NICHOLS PERFORMANCE | C20: 39 | D20: 37 | E20: =SUM(C20:D20) -> 76 | F20: 38 | G20: 36 | H20: =SUM(F20:G20) -> 74 | I20: =E20+H20 -> 150 | J20: 36 | K20: 39 | L20: =SUM(J20:K20) -> 75 | M20: =I20+L20 -> 225 | N20: 40 | O20: 40 | P20: =SUM(N20:O20) -> 80 | Q20: =M20+P20 -> 305 | R20: 40 | S20: 40 | T20: =SUM(R20:S20) -> 80 | U20: =Q20+T20 -> 385 | X20: =SUM(V20:W20) -> 0
A21: TV = TODD VORHEES | C21: 40 | D21: 35 | E21: =SUM(C21:D21) -> 75 | F21: 40 | G21: 35 | H21: =SUM(F21:G21) -> 75 | I21: =E21+H21 -> 150 | J21: 37 | K21: 38 | L21: =SUM(J21:K21) -> 75 | M21: =I21+L21 -> 225 | N21: 35 | O21: 37 | P21: =SUM(N21:O21) -> 72 | Q21: =M21+P21 -> 297 | R21: 37 | S21: 38 | T21: =SUM(R21:S21) -> 75 | U21: =Q21+T21 -> 372 | X21: =SUM(V21:W21) -> 0
A22: JRS = JIMS REPAIR SERVICE | C22: 31 | D22: 40 | E22: =SUM(C22:D22) -> 71 | F22: 39 | G22: 37 | H22: =SUM(F22:G22) -> 76 | I22: =E22+H22 -> 147 | J22: 40 | K22: 35 | L22: =SUM(J22:K22) -> 75 | M22: =I22+L22 -> 222 | N22: 24 | O22: 38 | P22: =SUM(N22:O22) -> 62 | Q22: =M22+P22 -> 284 | R22: 36 | S22: 34 | T22: =SUM(R22:S22) -> 70 | U22: =Q22+T22 -> 354 | X22: =SUM(V22:W22) -> 0
A23: JW = JOE WHITWORTH | C23: 38 | D23: 30 | E23: =SUM(C23:D23) -> 68 | F23: 35 | G23: 38 | H23: =SUM(F23:G23) -> 73 | I23: =E23+H23 -> 141 | J23: 23 | K23: 33 | L23: =SUM(J23:K23) -> 56 | M23: =I23+L23 -> 197 | N23: 28 | O23: 39 | P23: =SUM(N23:O23) -> 67 | Q23: =M23+P23 -> 264 | R23: 38 | S23: 37 | T23: =SUM(R23:S23) -> 75 | U23: =Q23+T23 -> 339 | X23: =SUM(V23:W23) -> 0
A24: BJ = BOB JONES | C24: 17 | D24: 38 | E24: =SUM(C24:D24) -> 55 | F24: 27 | G24: 40 | H24: =SUM(F24:G24) -> 67 | I24: =E24+H24 -> 122 | J24: 38 | K24: 37 | L24: =SUM(J24:K24) -> 75 | M24: =I24+L24 -> 197 | N24: 38 | O24: 34 | P24: =SUM(N24:O24) -> 72 | Q24: =M24+P24 -> 269 | R24: 39 | S24: 27 | T24: =SUM(R24:S24) -> 66 | U24: =Q24+T24 -> 335 | X24: =SUM(V24:W24) -> 0
A25: WOODS = DAVE WOODS | C25: 34 | D25: 34 | E25: =SUM(C25:D25) -> 68 | F25: 36 | G25: 39 | H25: =SUM(F25:G25) -> 75 | I25: =E25+H25 -> 143 | J25: 16 | K25: 17 | L25: =SUM(J25:K25) -> 33 | M25: =I25+L25 -> 176 | N25: 22 | O25: 31 | P25: =SUM(N25:O25) -> 53 | Q25: =M25+P25 -> 229 | S25: 32 | T25: =SUM(R25:S25) -> 32 | U25: =Q25+T25 -> 261 | X25: =SUM(V25:W25) -> 0
A26: LR = LAKOTA RACING | C26: 18 | D26: 19 | E26: =SUM(C26:D26) -> 37 | H26: =SUM(F26:G26) -> 0 | I26: =E26+H26 -> 37 | J26: 39 | K26: 29 | L26: =SUM(J26:K26) -> 68 | M26: =I26+L26 -> 105 | N26: 37 | O26: 28 | P26: =SUM(N26:O26) -> 65 | Q26: =M26+P26 -> 170 | R26: 24 | S26: 21 | T26: =SUM(R26:S26) -> 45 | U26: =Q26+T26 -> 215 | X26: =SUM(V26:W26) -> 0
A27: RPM = RADER | C27: 21 | D27: 32 | E27: =SUM(C27:D27) -> 53 | F27: 30 | H27: =SUM(F27:G27) -> 30 | I27: =E27+H27 -> 83 | J27: 28 | K27: 25 | L27: =SUM(J27:K27) -> 53 | M27: =I27+L27 -> 136 | P27: =SUM(N27:O27) -> 0 | Q27: =M27+P27 -> 136 | T27: =SUM(R27:S27) -> 0 | U27: =Q27+T27 -> 136 | X27: =SUM(V27:W27) -> 0
A28: VM = VOGEL MFG | D28: 39 | E28: =SUM(C28:D28) -> 39 | H28: =SUM(F28:G28) -> 0 | I28: =E28+H28 -> 39 | L28: =SUM(J28:K28) -> 0 | M28: =I28+L28 -> 39 | N28: 23 | O28: 33 | P28: =SUM(N28:O28) -> 56 | Q28: =M28+P28 -> 95 | R28: 15 | S28: 13 | T28: =SUM(R28:S28) -> 28 | U28: =Q28+T28 -> 123 | X28: =SUM(V28:W28) -> 0
A29: MVP = MVP RACING | D29: 31 | E29: =SUM(C29:D29) -> 31 | G29: 17 | H29: =SUM(F29:G29) -> 17 | I29: =E29+H29 -> 48 | K29: 18 | L29: =SUM(J29:K29) -> 18 | M29: =I29+L29 -> 66 | O29: 30 | P29: =SUM(N29:O29) -> 30 | Q29: =M29+P29 -> 96 | T29: =SUM(R29:S29) -> 0 | U29: =Q29+T29 -> 96 | X29: =SUM(V29:W29) -> 0
L30: =SUM(J30:K30) -> 0 | P30: =SUM(N30:O30) -> 0
L31: =SUM(J31:K31) -> 0 | P31: =SUM(N31:O31) -> 0
L32: =SUM(J32:K32) -> 0 | P32: =SUM(N32:O32) -> 0