B2: SUPER STOCK CLASS
F5: Princeton, Ind | I5: Richmond,KY | L5: Marietta | O5: Kansas City | R5: Sturgis | U5: Tallmadge
B6: Name | C6: Eng. | D6: NQS # | E6: Tractor | F6: Qualifying Points | G6: Finals Points | I6: Qualifying Points | J6: Finals Points | L6: Qualifying Points | M6: Finals Points | O6: Qualifying Points | P6: Finals Points | R6: Qualifying Points | S6: Finals Points | U6: Qualifying Points | V6: Finals Points | X6: Total Points | Z6: Points Back | AB6: Teardown sticker check
A7: 1 | B7: Kelly Nichols | C7: NP | D7: 11-070 | E7: Wild One 2 | F7: 30 | G7: 35 | I7: 30 | J7: 35 | L7: 30 | M7: 33 | O7: 30 | P7: 37 | R7: 27 | S7: 38 | X7: =SUM(+F7+G7+I7+J7+L7+M7+O7+P7+R7+S7+U7+V7) -> 325 | Z7: =SUM(AB7-X7) -> 0 | AB7: =SUM(X$7) -> 325
A8: 2 | B8: Harrison Stahl | C8: MVP | D8: 11-336 | E8: MWSC #4 | F8: 30 | G8: 31 | I8: 26 | J8: 37 | L8: 30 | M8: 35 | O8: 29 | P8: 39 | R8: 28 | S8: 40 | X8: =SUM(+F8+G8+I8+J8+L8+M8+O8+P8+R8+S8+U8+V8) -> 325 | Z8: =SUM(AB8-X8) -> 0 | AB8: =SUM(X$7) -> 325
A9: 3 | B9: Steve Burton | C9: NP | D9: 11-014 | E9: Bad Company | F9: 29 | G9: 34 | I9: 30 | J9: 40 | L9: 30 | M9: 39 | O9: 30 | P9: 35 | R9: 28 | S9: 22 | X9: =SUM(+F9+G9+I9+J9+L9+M9+O9+P9+R9+S9+U9+V9) -> 317 | Z9: =SUM(AB9-X9) -> 8 | AB9: =SUM(X$7) -> 325
A10: 4 | B10: Scott Bye | C10: NP | D10: 11-365 | E10: Fired Up | F10: 30 | G10: 37 | I10: 27 | J10: 6 | L10: 30 | M10: 38 | O10: 30 | P10: 34 | R10: 30 | S10: 36 | X10: =SUM(+F10+G10+I10+J10+L10+M10+O10+P10+R10+S10+U10+V10) -> 298 | Z10: =SUM(AB10-X10) -> 27 | AB10: =SUM(X$7) -> 325
A11: 5 | B11: Russ Nichols | C11: NP | D11: 11-069 | E11: Top Secret | F11: 26 | G11: 38 | I11: 23 | L11: 30 | M11: 40 | O11: 27 | P11: 40 | R11: 30 | S11: 32 | X11: =SUM(+F11+G11+I11+J11+L11+M11+O11+P11+R11+S11+U11+V11) -> 286 | Z11: =SUM(AB11-X11) -> 39 | AB11: =SUM(X$7) -> 325
A12: 6 | B12: Billy Black | C12: NP | D12: 11-044 | E12: Lots of Nichols | F12: 25 | G12: 30 | I12: 30 | J12: 31 | L12: 33 | M12: 27 | O12: 27 | P12: 26 | R12: 27 | S12: 19 | X12: =SUM(+F12+G12+I12+J12+L12+M12+O12+P12+R12+S12+U12+V12) -> 275 | Z12: =SUM(AB12-X12) -> 50 | AB12: =SUM(X$7) -> 325
A13: 7 | B13: Julian Stahl | C13: MVP | D13: 11-001 | E13: MWSC #1 | F13: 25 | G13: 26 | I13: 30 | J13: 19 | L13: 30 | M13: 21 | O13: 25 | P13: 27 | R13: 26 | S13: 28 | X13: =SUM(+F13+G13+I13+J13+L13+M13+O13+P13+R13+S13+U13+V13) -> 257 | Z13: =SUM(AB13-X13) -> 68 | AB13: =SUM(X$7) -> 325
A14: 8 | B14: Steve Williford | C14: MVP | D14: 11-276 | E14: International Express | F14: 30 | G14: 40 | I14: 30 | J14: 39 | L14: 30 | M14: 32 | O14: 23 | P14: 14 | R14: 17 | X14: =SUM(+F14+G14+I14+J14+L14+M14+O14+P14+R14+S14+U14+V14) -> 255 | Z14: =SUM(AB14-X14) -> 70 | AB14: =SUM(X$7) -> 325
A15: 9 | B15: Julian Stahl | C15: MVP | D15: 11-002 | E15: MWSC# 2 | F15: 30 | G15: 24 | I15: 27 | J15: 25 | L15: 27 | M15: 36 | O15: 29 | P15: 23 | R15: 26 | X15: =SUM(+F15+G15+I15+J15+L15+M15+O15+P15+R15+S15+U15+V15) -> 247 | Z15: =SUM(AB15-X15) -> 78 | AB15: =SUM(X$7) -> 325
A16: 10 | B16: Ed Nichols | C16: LR | D16: 11-124 | E16: Track Attack | F16: 29 | G16: 39 | I16: 18 | L16: 25 | M16: 31 | O16: 27 | P16: 38 | R16: 27 | S16: 4 | X16: =SUM(+F16+G16+I16+J16+L16+M16+O16+P16+R16+S16+U16+V16) -> 238 | Z16: =SUM(AB16-X16) -> 87 | AB16: =SUM(X$7) -> 325
A17: 11 | B17: Larry Curtsinger | C17: NP | D17: 11-009 | E17: Runaway Deere | F17: 14 | I17: 30 | J17: 38 | L17: 30 | M17: 6 | O17: 30 | P17: 31 | R17: 25 | S17: 27 | X17: =SUM(+F17+G17+I17+J17+L17+M17+O17+P17+R17+S17+U17+V17) -> 231 | Z17: =SUM(AB17-X17) -> 94 | AB17: =SUM(X$7) -> 325
A18: 12 | B18: Greg Curtsinger | C18: NP | D18: 11-008 | E18: Wicked Deere | F18: 15 | I18: 30 | J18: 33 | L18: 26 | M18: 37 | O18: 30 | P18: 18 | R18: 29 | S18: 9 | X18: =SUM(+F18+G18+I18+J18+L18+M18+O18+P18+R18+S18+U18+V18) -> 227 | Z18: =SUM(AB18-X18) -> 98 | AB18: =SUM(X$7) -> 325
A19: 13 | B19: Nick Mishler | C19: GTP | D19: 11-167 | E19: Pulse | F19: 27 | G19: 14 | I19: 30 | J19: 26 | L19: 27 | M19: 28 | O19: 17 | R19: 29 | S19: 23 | X19: =SUM(+F19+G19+I19+J19+L19+M19+O19+P19+R19+S19+U19+V19) -> 221 | Z19: =SUM(AB19-X19) -> 104 | AB19: =SUM(X$7) -> 325
A20: 14 | B20: Steve Christman | C20: Hackman | D20: 11-026 | E20: JD 330 | F20: 24 | G20: 33 | I20: 25 | J20: 30 | L20: 25 | M20: 25 | R20: 23 | S20: 29 | X20: =SUM(+F20+G20+I20+J20+L20+M20+O20+P20+R20+S20+U20+V20) -> 214 | Z20: =SUM(AB20-X20) -> 111 | AB20: =SUM(X$7) -> 325
A21: 15 | B21: Don Vogt | C21: MVP | D21: 11-090 | E21: Not A Nuff | F21: 21 | I21: 29 | J21: 20 | L21: 30 | M21: 16 | O21: 23 | R21: 30 | S21: 39 | X21: =SUM(+F21+G21+I21+J21+L21+M21+O21+P21+R21+S21+U21+V21) -> 208 | Z21: =SUM(AB21-X21) -> 117 | AB21: =SUM(X$7) -> 325
A22: 16 | B22: Larry Fox | C22: JRS | D22: 11-007 | E22: Intimidation | F22: 25 | G22: 19 | I22: 27 | J22: 14 | L22: 30 | M22: 11 | O22: 17 | R22: 25 | S22: 34 | X22: =SUM(+F22+G22+I22+J22+L22+M22+O22+P22+R22+S22+U22+V22) -> 202 | Z22: =SUM(AB22-X22) -> 123 | AB22: =SUM(X$7) -> 325
A23: 17 | B23: Matt Kaster | C23: MVP | D23: 11-332 | E23: Double XL | F23: 25 | G23: 21 | I23: 26 | J23: 11 | L23: 24 | M23: 14 | O23: 28 | P23: 25 | R23: 23 | X23: =SUM(+F23+G23+I23+J23+L23+M23+O23+P23+R23+S23+U23+V23) -> 197 | Z23: =SUM(AB23-X23) -> 128 | AB23: =SUM(X$7) -> 325
A24: 18 | B24: Steve Burton | C24: NP | D24: 11-015 | E24: 6 Shooter | F24: 17 | I24: 28 | J24: 10 | L24: 30 | M24: 30 | O24: 21 | R24: 30 | S24: 30 | X24: =SUM(+F24+G24+I24+J24+L24+M24+O24+P24+R24+S24+U24+V24) -> 196 | Z24: =SUM(AB24-X24) -> 129 | AB24: =SUM(X$7) -> 325
A25: 19 | B25: Charlie Ciolino | C25: MVP | D25: 11-145 | E25: Mechanical Nitemare | F25: 20 | I25: 30 | J25: 28 | L25: 23 | O25: 22 | R25: 30 | S25: 33 | X25: =SUM(+F25+G25+I25+J25+L25+M25+O25+P25+R25+S25+U25+V25) -> 186 | Z25: =SUM(AB25-X25) -> 139 | AB25: =SUM(X$7) -> 325
A26: 20 | B26: Kevin Root | C26: Root | D26: 11-118 | E26: Slapshot | F26: 15 | I26: 30 | J26: 34 | L26: 24 | M26: 20 | O26: 28 | P26: 15 | R26: 19 | X26: =SUM(+F26+G26+I26+J26+L26+M26+O26+P26+R26+S26+U26+V26) -> 185 | Z26: =SUM(AB26-X26) -> 140 | AB26: =SUM(X$7) -> 325
A27: 21 | B27: Harrison Stahl | C27: MVP | D27: 11-335 | E27: MWSC #3 | F27: 23 | I27: 21 | L27: 30 | M27: 23 | O27: 29 | P27: 24 | R27: 24 | S27: 6 | X27: =SUM(+F27+G27+I27+J27+L27+M27+O27+P27+R27+S27+U27+V27) -> 180 | Z27: =SUM(AB27-X27) -> 145 | AB27: =SUM(X$7) -> 325
A28: 22 | B28: Randy Demers | C28: NP | D28: 11-085 | E28: Widowmaker | F28: 18 | I28: 25 | J28: 6 | L28: 28 | M28: 22 | O28: 25 | P28: 9 | R28: 29 | S28: 16 | X28: =SUM(+F28+G28+I28+J28+L28+M28+O28+P28+R28+S28+U28+V28) -> 178 | Z28: =SUM(AB28-X28) -> 147 | AB28: =SUM(X$7) -> 325
A29: 23 | B29: Nathan Nichels | C29: LR | D29: 11-151 | E29: Wildstreak | F29: 24 | G29: 22 | I29: 21 | L29: 23 | O29: 20 | R29: 27 | S29: 37 | X29: =SUM(+F29+G29+I29+J29+L29+M29+O29+P29+R29+S29+U29+V29) -> 174 | Z29: =SUM(AB29-X29) -> 151 | AB29: =SUM(X$7) -> 325
A30: 24 | B30: Steve Williford | C30: MVP | D30: 11-176 | E30: International | F30: 27 | G30: 7 | I30: 25 | J30: 9 | L30: 22 | O30: 28 | P30: 10 | R30: 24 | S30: 13 | X30: =SUM(+F30+G30+I30+J30+L30+M30+O30+P30+R30+S30+U30+V30) -> 165 | Z30: =SUM(AB30-X30) -> 160 | AB30: =SUM(X$7) -> 325
A31: 25 | B31: Steve Williford | C31: MVP | D31: 11-337 | E31: IH Express | F31: 23 | I31: 19 | L31: 27 | M31: 13 | O31: 28 | P31: 32 | R31: 21 | X31: =SUM(+F31+G31+I31+J31+L31+M31+O31+P31+R31+S31+U31+V31) -> 163 | Z31: =SUM(AB31-X31) -> 162 | AB31: =SUM(X$7) -> 325
A32: 26 | B32: Jerry Skuta | C32: NP | D32: 11-329 | E32: Green Tractor | F32: 20 | I32: 24 | J32: 29 | L32: 24 | M32: 26 | O32: 24 | R32: 14 | X32: =SUM(+F32+G32+I32+J32+L32+M32+O32+P32+R32+S32+U32+V32) -> 161 | Z32: =SUM(AB32-X32) -> 164 | AB32: =SUM(X$7) -> 325
A33: 27 | B33: Roger Davis | C33: JRS | D33: 11-067 | E33: NO LIMITS | F33: 29 | G33: 23 | I33: 23 | L33: 28 | M33: 17 | R33: 22 | S33: 18 | X33: =SUM(+F33+G33+I33+J33+L33+M33+O33+P33+R33+S33+U33+V33) -> 160 | Z33: =SUM(AB33-X33) -> 165 | AB33: =SUM(X$7) -> 325
A34: 28 | B34: Kevin Root | C34: Root | D34: 11-117 | E34: Right on the Money | F34: 26 | G34: 36 | L34: 27 | M34: 34 | O34: 20 | R34: 17 | X34: =SUM(+F34+G34+I34+J34+L34+M34+O34+P34+R34+S34+U34+V34) -> 160 | Z34: =SUM(AB34-X34) -> 165 | AB34: =SUM(X$7) -> 325
A35: 29 | B35: Clyde Mishler | C35: GTP | D35: 11-168 | F35: 16 | I35: 24 | J35: 36 | L35: 22 | O35: 17 | R35: 25 | S35: 20 | X35: =SUM(+F35+G35+I35+J35+L35+M35+O35+P35+R35+S35+U35+V35) -> 160 | Z35: =SUM(AB35-X35) -> 165 | AB35: =SUM(X$7) -> 325
A36: 30 | B36: Andy Ferguson | C36: MVP | D36: 11-343 | E36: Border Patrol | F36: 24 | G36: 25 | I36: 22 | L36: 23 | O36: 26 | P36: 6 | R36: 26 | S36: 8 | X36: =SUM(+F36+G36+I36+J36+L36+M36+O36+P36+R36+S36+U36+V36) -> 160 | Z36: =SUM(AB36-X36) -> 165 | AB36: =SUM(X$7) -> 325
A37: 31 | B37: Matt Kaster | C37: MVP | D37: 11-098 | E37: Moose On The Loose | F37: 18 | I37: 24 | J37: 32 | L37: 28 | M37: 15 | O37: 21 | R37: 19 | X37: =SUM(+F37+G37+I37+J37+L37+M37+O37+P37+R37+S37+U37+V37) -> 157 | Z37: =SUM(AB37-X37) -> 168 | AB37: =SUM(X$7) -> 325
A38: 32 | B38: Steve Williford | C38: MVP | D38: 11-177 | E38: IH Trucking | F38: 15 | I38: 22 | L38: 30 | M38: 18 | O38: 26 | P38: 17 | R38: 23 | X38: =SUM(+F38+G38+I38+J38+L38+M38+O38+P38+R38+S38+U38+V38) -> 151 | Z38: =SUM(AB38-X38) -> 174 | AB38: =SUM(X$7) -> 325
A39: 33 | B39: Steve Chrisman | C39: Hackman | D39: 11-218 | E39: Purple | F39: 22 | I39: 27 | J39: 23 | L39: 24 | M39: 19 | R39: 29 | S39: 7 | X39: =SUM(+F39+G39+I39+J39+L39+M39+O39+P39+R39+S39+U39+V39) -> 151 | Z39: =SUM(AB39-X39) -> 174 | AB39: =SUM(X$7) -> 325
A40: 34 | B40: Charles Aschliman | C40: MVP | D40: 11-352 | E40: Cub 122 | F40: 17 | I40: 30 | J40: 27 | L40: 30 | M40: 29 | O40: 18 | X40: =SUM(+F40+G40+I40+J40+L40+M40+O40+P40+R40+S40+U40+V40) -> 151 | Z40: =SUM(AB40-X40) -> 174 | AB40: =SUM(X$7) -> 325
A41: 35 | B41: Michael Ciolino | C41: MVP | D41: 11-146 | E41: Mechanical Animal | F41: 22 | I41: 22 | L41: 16 | O41: 24 | P41: 13 | R41: 25 | S41: 15 | X41: =SUM(+F41+G41+I41+J41+L41+M41+O41+P41+R41+S41+U41+V41) -> 137 | Z41: =SUM(AB41-X41) -> 188 | AB41: =SUM(X$7) -> 325
A42: 36 | B42: Bruce Austin | C42: MVP | D42: 11-338 | E42: Hillbilly Headache | F42: 18 | I42: 24 | J42: 6 | L42: 24 | M42: 10 | O42: 24 | P42: 12 | R42: 19 | X42: =SUM(+F42+G42+I42+J42+L42+M42+O42+P42+R42+S42+U42+V42) -> 137 | Z42: =SUM(AB42-X42) -> 188 | AB42: =SUM(X$7) -> 325
A43: 37 | B43: Dave Gawatz | C43: JW | D43: 11-184 | E43: Low Hung Buck | F43: 23 | I43: 17 | L43: 15 | O43: 19 | R43: 27 | S43: 35 | X43: =SUM(+F43+G43+I43+J43+L43+M43+O43+P43+R43+S43+U43+V43) -> 136 | Z43: =SUM(AB43-X43) -> 189 | AB43: =SUM(X$7) -> 325
A44: 38 | B44: Erik Pike | C44: VM | D44: 11-353 | E44: Too Blue | F44: 29 | G44: 32 | O44: 24 | P44: 36 | R44: 15 | X44: =SUM(+F44+G44+I44+J44+L44+M44+O44+P44+R44+S44+U44+V44) -> 136 | Z44: =SUM(AB44-X44) -> 189 | AB44: =SUM(X$7) -> 325
A45: 39 | B45: Bradley Corzine | C45: JW | D45: 11-368 | E45: Just Black | F45: 17 | I45: 22 | L45: 26 | M45: 24 | O45: 20 | R45: 23 | X45: =SUM(+F45+G45+I45+J45+L45+M45+O45+P45+R45+S45+U45+V45) -> 132 | Z45: =SUM(AB45-X45) -> 193 | AB45: =SUM(X$7) -> 325
A46: 40 | B46: Ray Gentz | C46: JRS | D46: 11-262 | E46: Chaos | F46: 19 | I46: 21 | L46: 14 | O46: 24 | P46: 8 | R46: 24 | S46: 21 | X46: =SUM(+F46+G46+I46+J46+L46+M46+O46+P46+R46+S46+U46+V46) -> 131 | Z46: =SUM(AB46-X46) -> 194 | AB46: =SUM(X$7) -> 325
A47: 41 | B47: Greg Watson | C47: LR | D47: 11-079 | E47: Bear-ly Legal | F47: 23 | I47: 30 | J47: 13 | L47: 19 | O47: 22 | R47: 19 | X47: =SUM(+F47+G47+I47+J47+L47+M47+O47+P47+R47+S47+U47+V47) -> 126 | Z47: =SUM(AB47-X47) -> 199 | AB47: =SUM(X$7) -> 325
A48: 42 | B48: Jerry Binkley | C48: MVP | D48: 11-092 | E48: Grandpa's Toy | F48: 25 | G48: 9 | I48: 26 | J48: 12 | L48: 15 | O48: 20 | R48: 19 | X48: =SUM(+F48+G48+I48+J48+L48+M48+O48+P48+R48+S48+U48+V48) -> 126 | Z48: =SUM(AB48-X48) -> 199 | AB48: =SUM(X$7) -> 325
A49: 43 | B49: Charlie Schultz | C49: MVP | D49: 11-101 | E49: Lotta Stones | F49: 28 | G49: 18 | I49: 20 | L49: 18 | O49: 20 | R49: 21 | X49: =SUM(+F49+G49+I49+J49+L49+M49+O49+P49+R49+S49+U49+V49) -> 125 | Z49: =SUM(AB49-X49) -> 200 | AB49: =SUM(X$7) -> 325
A50: 44 | B50: Jim Morgenstern | C50: JRS | D50: 11-063 | E50: Alky Hog | F50: 28 | G50: 6 | I50: 30 | J50: 17 | L50: 20 | O50: 23 | X50: =SUM(+F50+G50+I50+J50+L50+M50+O50+P50+R50+S50+U50+V50) -> 124 | Z50: =SUM(AB50-X50) -> 201 | AB50: =SUM(X$7) -> 325
A51: 45 | B51: Eli Zimmerman | C51: NP | D51: 11-074 | E51: Red Fever | F51: 23 | I51: 16 | L51: 22 | O51: 21 | R51: 29 | S51: 12 | X51: =SUM(+F51+G51+I51+J51+L51+M51+O51+P51+R51+S51+U51+V51) -> 123 | Z51: =SUM(AB51-X51) -> 202 | AB51: =SUM(X$7) -> 325
A52: 46 | B52: John Donavan | C52: JRS | D52: 11-006 | E52: Patience | F52: 19 | I52: 20 | L52: 17 | O52: 19 | R52: 18 | S52: 26 | X52: =SUM(+F52+G52+I52+J52+L52+M52+O52+P52+R52+S52+U52+V52) -> 119 | Z52: =SUM(AB52-X52) -> 206 | AB52: =SUM(X$7) -> 325
A53: 47 | B53: Scott Larkins | C53: JRS | D53: 11-154 | E53: Yosemite Sam | F53: 21 | I53: 21 | L53: 26 | M53: 8 | O53: 18 | R53: 22 | X53: =SUM(+F53+G53+I53+J53+L53+M53+O53+P53+R53+S53+U53+V53) -> 116 | Z53: =SUM(AB53-X53) -> 209 | AB53: =SUM(X$7) -> 325
A54: 48 | B54: Carla Morgenstern | C54: JRS | D54: 11-216 | E54: High Maintenance | F54: 28 | G54: 28 | I54: 24 | J54: 16 | L54: 20 | X54: =SUM(+F54+G54+I54+J54+L54+M54+O54+P54+R54+S54+U54+V54) -> 116 | Z54: =SUM(AB54-X54) -> 209 | AB54: =SUM(X$7) -> 325
A55: 49 | B55: Robert Vogel | C55: VM | D55: 11-361 | E55: Diggers Farmall Too | F55: 13 | O55: 29 | P55: 29 | R55: 28 | S55: 14 | X55: =SUM(+F55+G55+I55+J55+L55+M55+O55+P55+R55+S55+U55+V55) -> 113 | Z55: =SUM(AB55-X55) -> 212 | AB55: =SUM(X$7) -> 325
A56: 50 | B56: Tim Bristol | C56: MVP | D56: 11-363 | E56: John Deere | F56: 26 | G56: 8 | I56: 18 | L56: 14 | O56: 26 | R56: 21 | X56: =SUM(+F56+G56+I56+J56+L56+M56+O56+P56+R56+S56+U56+V56) -> 113 | Z56: =SUM(AB56-X56) -> 212 | AB56: =SUM(X$7) -> 325
A57: 51 | B57: David Mascher Sr | D57: 11-163 | I57: 22 | L57: 21 | O57: 25 | P57: 28 | R57: 16 | X57: =SUM(+F57+G57+I57+J57+L57+M57+O57+P57+R57+S57+U57+V57) -> 112 | Z57: =SUM(AB57-X57) -> 213 | AB57: =SUM(X$7) -> 325
A58: 52 | B58: Shane Heits | C58: Heits | D58: 11-366 | E58: Custom Cub | F58: 17 | L58: 17 | O58: 18 | R58: 28 | S58: 25 | X58: =SUM(+F58+G58+I58+J58+L58+M58+O58+P58+R58+S58+U58+V58) -> 105 | Z58: =SUM(AB58-X58) -> 220 | AB58: =SUM(X$7) -> 325
A59: 53 | B59: Jerry Skuta | C59: NP | D59: 11-330 | E59: Mental Health 2 | F59: 16 | I59: 19 | O59: 25 | P59: 22 | R59: 20 | X59: =SUM(+F59+G59+I59+J59+L59+M59+O59+P59+R59+S59+U59+V59) -> 102 | Z59: =SUM(AB59-X59) -> 223 | AB59: =SUM(X$7) -> 325
A60: 54 | B60: Bille Nippe | C60: JW | D60: 11-150 | E60: Serious Busness | F60: 24 | G60: 17 | R60: 28 | S60: 31 | X60: =SUM(+F60+G60+I60+J60+L60+M60+O60+P60+R60+S60+U60+V60) -> 100 | Z60: =SUM(AB60-X60) -> 225 | AB60: =SUM(X$7) -> 325
A61: 55 | B61: Jeff Chrisman | C61: VW | D61: 11-180 | F61: 21 | I61: 19 | L61: 18 | O61: 23 | R61: 18 | X61: =SUM(+F61+G61+I61+J61+L61+M61+O61+P61+R61+S61+U61+V61) -> 99 | Z61: =SUM(AB61-X61) -> 226 | AB61: =SUM(X$7) -> 325
A62: 56 | B62: Bruce Austin | C62: MVP | D62: 11-277 | E62: Cap'N Crunch | F62: 19 | I62: 20 | L62: 21 | O62: 19 | R62: 18 | X62: =SUM(+F62+G62+I62+J62+L62+M62+O62+P62+R62+S62+U62+V62) -> 97 | Z62: =SUM(AB62-X62) -> 228 | AB62: =SUM(X$7) -> 325
A63: 57 | B63: Mark Convoer | C63: VM | D63: 11-360 | F63: 24 | G63: 14 | I63: 15 | L63: 22 | R63: 22 | X63: =SUM(+F63+G63+I63+J63+L63+M63+O63+P63+R63+S63+U63+V63) -> 97 | Z63: =SUM(AB63-X63) -> 228 | AB63: =SUM(X$7) -> 325
A64: 58 | B64: Larry Karff | C64: TC | D64: 11-398 | E64: Kryptonite | L64: 16 | O64: 29 | P64: 21 | R64: 24 | S64: 5 | X64: =SUM(+F64+G64+I64+J64+L64+M64+O64+P64+R64+S64+U64+V64) -> 95 | Z64: =SUM(AB64-X64) -> 230 | AB64: =SUM(X$7) -> 325
A65: 59 | B65: Ray Gentz | C65: JW | D65: 11-034 | E65: Just Enough | L65: 16 | O65: 27 | P65: 30 | R65: 20 | X65: =SUM(+F65+G65+I65+J65+L65+M65+O65+P65+R65+S65+U65+V65) -> 93 | Z65: =SUM(AB65-X65) -> 232 | AB65: =SUM(X$7) -> 325
A66: 60 | B66: Ronald Marcine | C66: MVP | D66: 11-245 | E66: No Pressure | F66: 14 | I66: 18 | O66: 21 | R66: 26 | S66: 10 | X66: =SUM(+F66+G66+I66+J66+L66+M66+O66+P66+R66+S66+U66+V66) -> 89 | Z66: =SUM(AB66-X66) -> 236 | AB66: =SUM(X$7) -> 325
A67: 61 | B67: Keith Roberts | C67: TC | D67: 11-350 | E67: Instigator 2 | F67: 20 | I67: 29 | J67: 18 | R67: 20 | X67: =SUM(+F67+G67+I67+J67+L67+M67+O67+P67+R67+S67+U67+V67) -> 87 | Z67: =SUM(AB67-X67) -> 238 | AB67: =SUM(X$7) -> 325
A68: 62 | B68: Elain Fisher | C68: JW | D68: 11-080 | E68: Blue Thunder | F68: 18 | I68: 23 | L68: 23 | R68: 21 | X68: =SUM(+F68+G68+I68+J68+L68+M68+O68+P68+R68+S68+U68+V68) -> 85 | Z68: =SUM(AB68-X68) -> 240 | AB68: =SUM(X$7) -> 325
A69: 63 | B69: Gerald Kerber | C69: NP | D69: 11-175 | E69: Wisconsin Hooker | F69: 27 | G69: 15 | L69: 19 | O69: 19 | X69: =SUM(+F69+G69+I69+J69+L69+M69+O69+P69+R69+S69+U69+V69) -> 80 | Z69: =SUM(AB69-X69) -> 245 | AB69: =SUM(X$7) -> 325
A70: 64 | B70: Darlene Sample | C70: LR | D70: 11-202 | E70: Dr Doom | F70: 26 | G70: 10 | I70: 21 | R70: 22 | X70: =SUM(+F70+G70+I70+J70+L70+M70+O70+P70+R70+S70+U70+V70) -> 79 | Z70: =SUM(AB70-X70) -> 246 | AB70: =SUM(X$7) -> 325
A71: 65 | B71: Dan Schell | C71: MVP | D71: 11-375 | E71: Menace | I71: 18 | O71: 22 | R71: 26 | S71: 11 | X71: =SUM(+F71+G71+I71+J71+L71+M71+O71+P71+R71+S71+U71+V71) -> 77 | Z71: =SUM(AB71-X71) -> 248 | AB71: =SUM(X$7) -> 325
A72: 66 | B72: Charlie Karff | C72: TC | D72: 11-400 | E72: No Fear | L72: 25 | M72: 12 | O72: 19 | R72: 20 | X72: =SUM(+F72+G72+I72+J72+L72+M72+O72+P72+R72+S72+U72+V72) -> 76 | Z72: =SUM(AB72-X72) -> 249 | AB72: =SUM(X$7) -> 325
A73: 67 | B73: Jake Gingerich | C73: JW | D73: 11-017 | E73: Silver Rocket | F73: 28 | G73: 29 | R73: 17 | X73: =SUM(+F73+G73+I73+J73+L73+M73+O73+P73+R73+S73+U73+V73) -> 74 | Z73: =SUM(AB73-X73) -> 251 | AB73: =SUM(X$7) -> 325
A74: 68 | B74: David Knapp | C74: MVP | D74: 11-381 | E74: Knapp Time | I74: 17 | L74: 18 | O74: 22 | R74: 17 | X74: =SUM(+F74+G74+I74+J74+L74+M74+O74+P74+R74+S74+U74+V74) -> 74 | Z74: =SUM(AB74-X74) -> 251 | AB74: =SUM(X$7) -> 325
A75: 69 | B75: Dustin Blair | C75: JW | D75: 11-380 | E75: Armed and Dangerous | I75: 28 | J75: 24 | R75: 21 | X75: =SUM(+F75+G75+I75+J75+L75+M75+O75+P75+R75+S75+U75+V75) -> 73 | Z75: =SUM(AB75-X75) -> 252 | AB75: =SUM(X$7) -> 325
A76: 70 | B76: Max Burkhart | C76: TC | D76: 11-078 | E76: Gray Matter | F76: 29 | G76: 27 | R76: 15 | X76: =SUM(+F76+G76+I76+J76+L76+M76+O76+P76+R76+S76+U76+V76) -> 71 | Z76: =SUM(AB76-X76) -> 254 | AB76: =SUM(X$7) -> 325
A77: 71 | B77: Bill Richerson | C77: JW | D77: 11-132 | E77: Walk the Line | F77: 27 | G77: 20 | I77: 23 | X77: =SUM(+F77+G77+I77+J77+L77+M77+O77+P77+R77+S77+U77+V77) -> 70 | Z77: =SUM(AB77-X77) -> 255 | AB77: =SUM(X$7) -> 325
A78: 72 | B78: Shawn Vogler | C78: JRS | D78: 11-129 | E78: Renegade | F78: 18 | I78: 25 | J78: 22 | X78: =SUM(+F78+G78+I78+J78+L78+M78+O78+P78+R78+S78+U78+V78) -> 65 | Z78: =SUM(AB78-X78) -> 260 | AB78: =SUM(X$7) -> 325
A79: 73 | B79: Joe Gawatz | C79: LR | D79: 11-369 | E79: Obession | F79: 22 | O79: 26 | P79: 16 | X79: =SUM(+F79+G79+I79+J79+L79+M79+O79+P79+R79+S79+U79+V79) -> 64 | Z79: =SUM(AB79-X79) -> 261 | AB79: =SUM(X$7) -> 325
A80: 74 | B80: Jim Evans | C80: NP | D80: 11-223 | E80: Hammer Down | I80: 29 | J80: 15 | L80: 19 | X80: =SUM(+F80+G80+I80+J80+L80+M80+O80+P80+R80+S80+U80+V80) -> 63 | Z80: =SUM(AB80-X80) -> 262 | AB80: =SUM(X$7) -> 325
A81: 75 | B81: Matt Kaster | C81: MVP | D81: 11-097 | E81: Cruel Intentions | O81: 28 | P81: 33 | X81: =SUM(+F81+G81+I81+J81+L81+M81+O81+P81+R81+S81+U81+V81) -> 61 | Z81: =SUM(AB81-X81) -> 264 | AB81: =SUM(X$7) -> 325
A82: 76 | B82: Trampis Hamilton | C82: VM | D82: 11-359 | E82: Visual Express | F82: 21 | O82: 18 | R82: 22 | X82: =SUM(+F82+G82+I82+J82+L82+M82+O82+P82+R82+S82+U82+V82) -> 61 | Z82: =SUM(AB82-X82) -> 264 | AB82: =SUM(X$7) -> 325
A83: 77 | B83: Tooter Cambell | C83: TC | D83: 11-215 | E83: Pink | I83: 19 | L83: 21 | R83: 20 | X83: =SUM(+F83+G83+I83+J83+L83+M83+O83+P83+R83+S83+U83+V83) -> 60 | Z83: =SUM(AB83-X83) -> 265 | AB83: =SUM(X$7) -> 325
A84: 78 | B84: Lee Blesch | C84: TC | D84: 11-344 | E84: Orange Blossom Special | F84: 16 | I84: 20 | R84: 23 | X84: =SUM(+F84+G84+I84+J84+L84+M84+O84+P84+R84+S84+U84+V84) -> 59 | Z84: =SUM(AB84-X84) -> 266 | AB84: =SUM(X$7) -> 325
A85: 79 | B85: Ray Gentz | C85: JW | D85: 11-035 | E85: Cub | F85: 16 | I85: 20 | L85: 20 | X85: =SUM(+F85+G85+I85+J85+L85+M85+O85+P85+R85+S85+U85+V85) -> 56 | Z85: =SUM(AB85-X85) -> 269 | AB85: =SUM(X$7) -> 325
A86: 80 | B86: Dick Eldridge | C86: GTP | D86: 11-340 | E86: Haybaler | F86: 19 | L86: 19 | R86: 15 | X86: =SUM(+F86+G86+I86+J86+L86+M86+O86+P86+R86+S86+U86+V86) -> 53 | Z86: =SUM(AB86-X86) -> 272 | AB86: =SUM(X$7) -> 325
A87: 81 | B87: Wes Kampeter | C87: NP | D87: 11-423 | E87: Torqued Up | O87: 26 | P87: 7 | R87: 17 | X87: =SUM(+F87+G87+I87+J87+L87+M87+O87+P87+R87+S87+U87+V87) -> 50 | Z87: =SUM(AB87-X87) -> 275 | AB87: =SUM(X$7) -> 325
A88: 82 | B88: Mike Kyle | D88: 11-394 | L88: 14 | O88: 18 | R88: 16 | X88: =SUM(+F88+G88+I88+J88+L88+M88+O88+P88+R88+S88+U88+V88) -> 48 | Z88: =SUM(AB88-X88) -> 277 | AB88: =SUM(X$7) -> 325
A89: 83 | B89: Lamar Hagar | C89: JW | D89: 11-051 | E89: Bad Medicine | I89: 26 | J89: 21 | X89: =SUM(+F89+G89+I89+J89+L89+M89+O89+P89+R89+S89+U89+V89) -> 47 | Z89: =SUM(AB89-X89) -> 278 | AB89: =SUM(X$7) -> 325
A90: 84 | B90: Ron Scroggins | C90: VM | D90: 11-110 | E90: Dirt Dancer | O90: 27 | P90: 19 | X90: =SUM(+F90+G90+I90+J90+L90+M90+O90+P90+R90+S90+U90+V90) -> 46 | Z90: =SUM(AB90-X90) -> 279 | AB90: =SUM(X$7) -> 325
A91: 85 | B91: Mark Deputy | C91: TC | D91: 11-347 | F91: 26 | G91: 17 | X91: =SUM(+F91+G91+I91+J91+L91+M91+O91+P91+R91+S91+U91+V91) -> 43 | Z91: =SUM(AB91-X91) -> 282 | AB91: =SUM(X$7) -> 325
A92: 86 | B92: Tyler Hackman | C92: Hackman | D92: 11-342 | E92: Green | F92: 20 | L92: 21 | X92: =SUM(+F92+G92+I92+J92+L92+M92+O92+P92+R92+S92+U92+V92) -> 41 | Z92: =SUM(AB92-X92) -> 284 | AB92: =SUM(X$7) -> 325
A93: 87 | B93: John Cress | C93: JW | D93: 11-170 | E93: Blitzed | F93: 28 | G93: 12 | X93: =SUM(+F93+G93+I93+J93+L93+M93+O93+P93+R93+S93+U93+V93) -> 40 | Z93: =SUM(AB93-X93) -> 285 | AB93: =SUM(X$7) -> 325
A94: 88 | B94: Annette Sullivan | C94: NP | D94: 11-120 | E94: Joker | F94: 19 | L94: 19 | X94: =SUM(+F94+G94+I94+J94+L94+M94+O94+P94+R94+S94+U94+V94) -> 38 | Z94: =SUM(AB94-X94) -> 287 | AB94: =SUM(X$7) -> 325
A95: 89 | B95: Dave Gawatz | C95: JW | D95: 11-367 | E95: Lil Sprout | F95: 27 | G95: 11 | X95: =SUM(+F95+G95+I95+J95+L95+M95+O95+P95+R95+S95+U95+V95) -> 38 | Z95: =SUM(AB95-X95) -> 287 | AB95: =SUM(X$7) -> 325
A96: 90 | B96: Brian Titzer | C96: TC | D96: 11-364 | E96: Single Boys Toy | F96: 22 | R96: 15 | X96: =SUM(+F96+G96+I96+J96+L96+M96+O96+P96+R96+S96+U96+V96) -> 37 | Z96: =SUM(AB96-X96) -> 288 | AB96: =SUM(X$7) -> 325
A97: 91 | B97: Aaron Scroggins | C97: VM | D97: 11-111 | E97: Black Out | O97: 25 | P97: 11 | X97: =SUM(+F97+G97+I97+J97+L97+M97+O97+P97+R97+S97+U97+V97) -> 36 | Z97: =SUM(AB97-X97) -> 289 | AB97: =SUM(X$7) -> 325
A98: 92 | B98: Chad Vogler | C98: JRS | D98: 11-130 | E98: Bandit | F98: 17 | I98: 18 | X98: =SUM(+F98+G98+I98+J98+L98+M98+O98+P98+R98+S98+U98+V98) -> 35 | Z98: =SUM(AB98-X98) -> 290 | AB98: =SUM(X$7) -> 325
A99: 93 | B99: Zack Richerson | C99: JW | D99: 11-348 | E99: Zacks Rat | F99: 15 | I99: 19 | X99: =SUM(+F99+G99+I99+J99+L99+M99+O99+P99+R99+S99+U99+V99) -> 34 | Z99: =SUM(AB99-X99) -> 291 | AB99: =SUM(X$7) -> 325
A100: 94 | B100: Rudy Puskarich | D100: 11-384 | E100: English Bulldog | L100: 25 | M100: 9 | X100: =SUM(+F100+G100+I100+J100+L100+M100+O100+P100+R100+S100+U100+V100) -> 34 | Z100: =SUM(AB100-X100) -> 291 | AB100: =SUM(X$7) -> 325
A101: 95 | B101: Allison Manville | C101: JRS | D101: 11-234 | E101: No Fluke | L101: 26 | M101: 6 | X101: =SUM(+F101+G101+I101+J101+L101+M101+O101+P101+R101+S101+U101+V101) -> 32 | Z101: =SUM(AB101-X101) -> 293 | AB101: =SUM(X$7) -> 325
A102: 96 | B102: Jake Gingerich | C102: JW | D102: 11-023 | E102: Royal Pain | F102: 15 | R102: 16 | X102: =SUM(+F102+G102+I102+J102+L102+M102+O102+P102+R102+S102+U102+V102) -> 31 | Z102: =SUM(AB102-X102) -> 294 | AB102: =SUM(X$7) -> 325
A103: 97 | B103: Jeremy Jaspering | C103: LR | D103: 11-147 | E103: Wicked | F103: 14 | O103: 16 | X103: =SUM(+F103+G103+I103+J103+L103+M103+O103+P103+R103+S103+U103+V103) -> 30 | Z103: =SUM(AB103-X103) -> 295 | AB103: =SUM(X$7) -> 325
A104: 98 | B104: Bryan Angell | D104: 11-048 | E104: Ford 9600 | I104: 23 | X104: =SUM(+F104+G104+I104+J104+L104+M104+O104+P104+R104+S104+U104+V104) -> 23 | Z104: =SUM(AB104-X104) -> 302 | AB104: =SUM(X$7) -> 325
A105: 99 | B105: John Cress | C105: JW | D105: 11-172 | E105: Full Tilt | F105: 23 | X105: =SUM(+F105+G105+I105+J105+L105+M105+O105+P105+R105+S105+U105+V105) -> 23 | Z105: =SUM(AB105-X105) -> 302 | AB105: =SUM(X$7) -> 325
A106: 100 | B106: Carl Zimmerman | C106: JRS | D106: 11-395 | E106: Bragging Rights | L106: 23 | X106: =SUM(+F106+G106+I106+J106+L106+M106+O106+P106+R106+S106+U106+V106) -> 23 | Z106: =SUM(AB106-X106) -> 302 | AB106: =SUM(X$7) -> 325
A107: 101 | B107: Casey Schell | C107: MVP | D107: 11-407 | E107: H2O Head | O107: 23 | X107: =SUM(+F107+G107+I107+J107+L107+M107+O107+P107+R107+S107+U107+V107) -> 23 | Z107: =SUM(AB107-X107) -> 302 | AB107: =SUM(X$7) -> 325
A108: 102 | B108: Tooter Cambell | C108: TC | D108: 11-128 | E108: The Kentuckian | F108: 22 | X108: =SUM(+F108+G108+I108+J108+L108+M108+O108+P108+R108+S108+U108+V108) -> 22 | Z108: =SUM(AB108-X108) -> 303 | AB108: =SUM(X$7) -> 325
A109: 103 | B109: Scott Gearharadt | C109: JRS | D109: 11-157 | E109: Suspicious Minds | O109: 22 | X109: =SUM(+F109+G109+I109+J109+L109+M109+O109+P109+R109+S109+U109+V109) -> 22 | Z109: =SUM(AB109-X109) -> 303 | AB109: =SUM(X$7) -> 325
A110: 104 | B110: Daryl Musser | C110: NP | D110: 11-397 | E110: Cross Threaded | L110: 22 | X110: =SUM(+F110+G110+I110+J110+L110+M110+O110+P110+R110+S110+U110+V110) -> 22 | Z110: =SUM(AB110-X110) -> 303 | AB110: =SUM(X$7) -> 325
A111: 105 | B111: Vickie Scroggins | C111: VM | D111: 11-112 | E111: Little American | O111: 21 | X111: =SUM(+F111+G111+I111+J111+L111+M111+O111+P111+R111+S111+U111+V111) -> 21 | Z111: =SUM(AB111-X111) -> 304 | AB111: =SUM(X$7) -> 325
A112: 106 | B112: John Innerst | C112: NP | D112: 11-252 | E112: Mean-N-Nasty | L112: 21 | X112: =SUM(+F112+G112+I112+J112+L112+M112+O112+P112+R112+S112+U112+V112) -> 21 | Z112: =SUM(AB112-X112) -> 304 | AB112: =SUM(X$7) -> 325
A113: 107 | B113: Tyler Hackman | C113: Hackman | D113: 11-052 | E113: Yellow | L113: 20 | X113: =SUM(+F113+G113+I113+J113+L113+M113+O113+P113+R113+S113+U113+V113) -> 20 | Z113: =SUM(AB113-X113) -> 305 | AB113: =SUM(X$7) -> 325
A114: 108 | B114: Todd Hammond | C114: JRS | D114: 11-301 | E114: Punisher | L114: 20 | X114: =SUM(+F114+G114+I114+J114+L114+M114+O114+P114+R114+S114+U114+V114) -> 20 | Z114: =SUM(AB114-X114) -> 305 | AB114: =SUM(X$7) -> 325
A115: 109 | B115: Jeff Yager | C115: Yager | D115: 11-351 | F115: 20 | X115: =SUM(+F115+G115+I115+J115+L115+M115+O115+P115+R115+S115+U115+V115) -> 20 | Z115: =SUM(AB115-X115) -> 305 | AB115: =SUM(X$7) -> 325
A116: 110 | B116: Doug Diehl | C116: NP | D116: 11-042 | E116: Extra Wild | L116: 18 | X116: =SUM(+F116+G116+I116+J116+L116+M116+O116+P116+R116+S116+U116+V116) -> 18 | Z116: =SUM(AB116-X116) -> 307 | AB116: =SUM(X$7) -> 325
A117: 111 | B117: Doug Diehl | C117: NP | D117: 11-385 | E117: Eliminator | L117: 18 | X117: =SUM(+F117+G117+I117+J117+L117+M117+O117+P117+R117+S117+U117+V117) -> 18 | Z117: =SUM(AB117-X117) -> 307 | AB117: =SUM(X$7) -> 325
A118: 112 | B118: Corey McClung | D118: 11-036 | E118: Lil Sandhill Binder | I118: 17 | X118: =SUM(+F118+G118+I118+J118+L118+M118+O118+P118+R118+S118+U118+V118) -> 17 | Z118: =SUM(AB118-X118) -> 308 | AB118: =SUM(X$7) -> 325
A119: 113 | B119: Annette Sullivan | C119: MVP | D119: 11-122 | E119: Just Relax | O119: 17 | X119: =SUM(+F119+G119+I119+J119+L119+M119+O119+P119+R119+S119+U119+V119) -> 17 | Z119: =SUM(AB119-X119) -> 308 | AB119: =SUM(X$7) -> 325
A120: 114 | B120: Doug Maier | C120: JW | D120: 11-158 | E120: Thumper | O120: 17 | X120: =SUM(+F120+G120+I120+J120+L120+M120+O120+P120+R120+S120+U120+V120) -> 17 | Z120: =SUM(AB120-X120) -> 308 | AB120: =SUM(X$7) -> 325
A121: 115 | B121: Larry Hunter | D121: 11-220 | E121: Blue Licker | I121: 17 | X121: =SUM(+F121+G121+I121+J121+L121+M121+O121+P121+R121+S121+U121+V121) -> 17 | Z121: =SUM(AB121-X121) -> 308 | AB121: =SUM(X$7) -> 325
A122: 116 | B122: Mark Cessna | C122: NP | D122: 11-378 | E122: Time and Money | L122: 17 | X122: =SUM(+F122+G122+I122+J122+L122+M122+O122+P122+R122+S122+U122+V122) -> 17 | Z122: =SUM(AB122-X122) -> 308 | AB122: =SUM(X$7) -> 325
A123: 117 | B123: Morgan Cessna | C123: NP | D123: 11-390 | E123: Look Out | L123: 17 | X123: =SUM(+F123+G123+I123+J123+L123+M123+O123+P123+R123+S123+U123+V123) -> 17 | Z123: =SUM(AB123-X123) -> 308 | AB123: =SUM(X$7) -> 325
A124: 118 | B124: Scott Goodman | D124: 11-402 | E124: The Mule | L124: 17 | X124: =SUM(+F124+G124+I124+J124+L124+M124+O124+P124+R124+S124+U124+V124) -> 17 | Z124: =SUM(AB124-X124) -> 308 | AB124: =SUM(X$7) -> 325
A125: 119 | B125: Corey McClung | C125: JRS | D125: 11-038 | E125: Fuel Fire & Attitude | I125: 16 | X125: =SUM(+F125+G125+I125+J125+L125+M125+O125+P125+R125+S125+U125+V125) -> 16 | Z125: =SUM(AB125-X125) -> 309 | AB125: =SUM(X$7) -> 325
A126: 120 | B126: Gary McDonald | C126: Leffler | D126: 11-093 | E126: Plus Risky | F126: 16 | X126: =SUM(+F126+G126+I126+J126+L126+M126+O126+P126+R126+S126+U126+V126) -> 16 | Z126: =SUM(AB126-X126) -> 309 | AB126: =SUM(X$7) -> 325
A127: 121 | B127: Mike Mason | C127: NP | D127: 11-138 | E127: Totally Frustrated | I127: 16 | X127: =SUM(+F127+G127+I127+J127+L127+M127+O127+P127+R127+S127+U127+V127) -> 16 | Z127: =SUM(AB127-X127) -> 309 | AB127: =SUM(X$7) -> 325
A128: 122 | B128: Logan Cessna | C128: NP | D128: 11-389 | E128: Adrenaline | L128: 16 | X128: =SUM(+F128+G128+I128+J128+L128+M128+O128+P128+R128+S128+U128+V128) -> 16 | Z128: =SUM(AB128-X128) -> 309 | AB128: =SUM(X$7) -> 325
A129: 123 | B129: Aaron Scroggins | C129: VM | D129: 11-419 | E129: Gambler | O129: 16 | X129: =SUM(+F129+G129+I129+J129+L129+M129+O129+P129+R129+S129+U129+V129) -> 16 | Z129: =SUM(AB129-X129) -> 309 | AB129: =SUM(X$7) -> 325
A130: 124 | B130: Dalton Cassady | D130: 11-420 | E130: Special Addiction | O130: 16 | X130: =SUM(+F130+G130+I130+J130+L130+M130+O130+P130+R130+S130+U130+V130) -> 16 | Z130: =SUM(AB130-X130) -> 309 | AB130: =SUM(X$7) -> 325
A131: 125 | B131: Daryl Musser | C131: NP | D131: 11-396 | E131: 5 Cents | L131: 15 | X131: =SUM(+F131+G131+I131+J131+L131+M131+O131+P131+R131+S131+U131+V131) -> 15 | Z131: =SUM(AB131-X131) -> 310 | AB131: =SUM(X$7) -> 325
A132: 126 | B132: Todd Glover | C132: NP | D132: 11-386 | E132: TNT Express | L132: 14 | X132: =SUM(+F132+G132+I132+J132+L132+M132+O132+P132+R132+S132+U132+V132) -> 14 | Z132: =SUM(AB132-X132) -> 311 | AB132: =SUM(X$7) -> 325
A133: 127 | B133: William Lewis | C133: Hackman | D133: 11-392 | E133: Wide Open | L133: 14 | X133: =SUM(+F133+G133+I133+J133+L133+M133+O133+P133+R133+S133+U133+V133) -> 14 | Z133: =SUM(AB133-X133) -> 311 | AB133: =SUM(X$7) -> 325
A134: 128 | B134: Mike Hall | C134: RPM | D134: 11-401 | E134: Billet Binder | L134: 14 | X134: =SUM(+F134+G134+I134+J134+L134+M134+O134+P134+R134+S134+U134+V134) -> 14 | Z134: =SUM(AB134-X134) -> 311 | AB134: =SUM(X$7) -> 325
A135: 129 | B135: Matt Gingerich | C135: JW | D135: 11-018 | E135: Thumper | R135: 25 | S135: 24 | X135: =SUM(+F135+G135+I135+J135+L135+M135+O135+P135+R135+S135+U135+V135) -> 49 | Z135: =SUM(AB135-X135) -> 276 | AB135: =SUM(X$7) -> 325
A136: 130 | B136: Matt Gingerich | C136: JW | D136: 11-028 | E136: Silver Fox | R136: 24 | S136: 17 | X136: =SUM(+F136+G136+I136+J136+L136+M136+O136+P136+R136+S136+U136+V136) -> 41 | Z136: =SUM(AB136-X136) -> 284 | AB136: =SUM(X$7) -> 325
A137: 131 | B137: Rick Mann | C137: TC | D137: 11-077 | E137: Wildfire | R137: 16 | X137: =SUM(+F137+G137+I137+J137+L137+M137+O137+P137+R137+S137+U137+V137) -> 16 | Z137: =SUM(AB137-X137) -> 309 | AB137: =SUM(X$7) -> 325
A138: 132 | B138: Morris Kemp | C138: JW | D138: 11-429 | E138: Magnus Force | R138: 18 | X138: =SUM(+F138+G138+I138+J138+L138+M138+O138+P138+R138+S138+U138+V138) -> 18 | Z138: =SUM(AB138-X138) -> 307 | AB138: =SUM(X$7) -> 325
A139: 133 | B139: Morris Kemp | C139: JW | D139: 11-430 | E139: King Pin | R139: 18 | X139: =SUM(+F139+G139+I139+J139+L139+M139+O139+P139+R139+S139+U139+V139) -> 18 | Z139: =SUM(AB139-X139) -> 307 | AB139: =SUM(X$7) -> 325
A140: 134 | B140: Steve Cape | C140: MVP | D140: 11-432 | R140: 16 | X140: =SUM(+F140+G140+I140+J140+L140+M140+O140+P140+R140+S140+U140+V140) -> 16 | Z140: =SUM(AB140-X140) -> 309 | AB140: =SUM(X$7) -> 325
A141: 135 | B141: Phil Burton | C141: Yager | E141: Goofy Express | R141: 14 | X141: =SUM(+F141+G141+I141+J141+L141+M141+O141+P141+R141+S141+U141+V141) -> 14 | Z141: =SUM(AB141-X141) -> 311 | AB141: =SUM(X$7) -> 325