B1: 30 CUBE Class | E1: Thru Sturgis | G1: Pro V Twin | K1: Thru Sturgis
B2: Name | C2: NQS # | D2: Tractor | E2: Points Back | H2: Name | I2: NQS # | J2: Tractor | K2: Points Back
A3: ='30 Cube'!A7 -> 1 | B3: ='30 Cube'!B7 -> Shawn Garman | C3: ='30 Cube'!D7 -> 11-230 | D3: =IF('30 Cube'!E7=0," ",'30 Cube'!E7) -> Gun Slinger | E3: ='30 Cube'!Z7 -> 0 | G3: ='Pro V Twin'!A7 -> 1 | H3: ='Pro V Twin'!B7 -> Kenny Cornelison | I3: ='Pro V Twin'!D7 -> 11-149 | J3: ='Pro V Twin'!E7 -> Storm Alert | K3: ='Pro V Twin'!Z7 -> 0
A4: ='30 Cube'!A8 -> 2 | B4: ='30 Cube'!B8 -> Ben Larkins | C4: ='30 Cube'!D8 -> 11-137 | D4: =IF('30 Cube'!E8=0," ",'30 Cube'!E8) -> Indian Outlaw | E4: ='30 Cube'!Z8 -> 12 | G4: ='Pro V Twin'!A8 -> 2 | H4: ='Pro V Twin'!B8 -> Lowell Vis | I4: ='Pro V Twin'!D8 -> 11-333 | J4: ='Pro V Twin'!E8 -> Skittles | K4: ='Pro V Twin'!Z8 -> 2
A5: ='30 Cube'!A9 -> 3 | B5: ='30 Cube'!B9 -> Greg Heifner | C5: ='30 Cube'!D9 -> 11-231 | D5: =IF('30 Cube'!E9=0," ",'30 Cube'!E9) -> Instigator | E5: ='30 Cube'!Z9 -> 15 | G5: ='Pro V Twin'!A9 -> 3 | H5: ='Pro V Twin'!B9 -> Jim Hull | I5: ='Pro V Twin'!D9 -> 11-334 | J5: ='Pro V Twin'!E9 -> Simplicity | K5: ='Pro V Twin'!Z9 -> 12
A6: ='30 Cube'!A10 -> 4 | B6: ='30 Cube'!B10 -> Andy Ferguson | C6: ='30 Cube'!D10 -> 11-100 | D6: =IF('30 Cube'!E10=0," ",'30 Cube'!E10) -> Rasin Cane | E6: ='30 Cube'!Z10 -> 20 | G6: ='Pro V Twin'!A10 -> 4 | H6: ='Pro V Twin'!B10 -> Harrison Stahl | I6: ='Pro V Twin'!D10 -> 11-004 | J6: ='Pro V Twin'!E10 -> Tons of Fun | K6: ='Pro V Twin'!Z10 -> 13
A7: ='30 Cube'!A11 -> 5 | B7: ='30 Cube'!B11 -> Kole Larkins | C7: ='30 Cube'!D11 -> 11-372 | D7: =IF('30 Cube'!E11=0," ",'30 Cube'!E11) -> Wound Up | E7: ='30 Cube'!Z11 -> 20 | G7: ='Pro V Twin'!A11 -> 5 | H7: ='Pro V Twin'!B11 -> Matt Kaster | I7: ='Pro V Twin'!D11 -> 11-099 | J7: ='Pro V Twin'!E11 -> Super Freak | K7: ='Pro V Twin'!Z11 -> 17
A8: ='30 Cube'!A12 -> 6 | B8: ='30 Cube'!B12 -> Doug Rood | C8: ='30 Cube'!D12 -> 11-354 | D8: =IF('30 Cube'!E12=0," ",'30 Cube'!E12) -> Blue Dawg | E8: ='30 Cube'!Z12 -> 24 | G8: ='Pro V Twin'!A12 -> 6 | H8: ='Pro V Twin'!B12 -> Mike Spencer | I8: ='Pro V Twin'!D12 -> 11-278 | J8: ='Pro V Twin'!E12 -> Longshot | K8: ='Pro V Twin'!Z12 -> 55
A9: ='30 Cube'!A13 -> 7 | B9: ='30 Cube'!B13 -> Tony Heifner | C9: ='30 Cube'!D13 -> 11-116 | D9: =IF('30 Cube'!E13=0," ",'30 Cube'!E13) -> Heartbeat | E9: ='30 Cube'!Z13 -> 25 | G9: ='Pro V Twin'!A13 -> 7 | H9: ='Pro V Twin'!B13 -> Ryan Shafer | I9: ='Pro V Twin'!D13 -> 11-206 | J9: ='Pro V Twin'!E13 -> Roadrunner | K9: ='Pro V Twin'!Z13 -> 74
A10: ='30 Cube'!A14 -> 8 | B10: ='30 Cube'!B14 -> Charlie Schultz | C10: ='30 Cube'!D14 -> 11-102 | D10: =IF('30 Cube'!E14=0," ",'30 Cube'!E14) -> Silver Bullet | E10: ='30 Cube'!Z14 -> 26 | G10: ='Pro V Twin'!A14 -> 8 | H10: ='Pro V Twin'!B14 -> Dave Richter | I10: ='Pro V Twin'!D14 -> 11-207 | J10: ='Pro V Twin'!E14 -> Hustler | K10: ='Pro V Twin'!Z14 -> 95
A11: ='30 Cube'!A15 -> 9 | B11: ='30 Cube'!B15 -> Tony Lewis | C11: ='30 Cube'!D15 -> 11-345 | D11: =IF('30 Cube'!E15=0," ",'30 Cube'!E15) -> Plain Jane | E11: ='30 Cube'!Z15 -> 28 | G11: ='Pro V Twin'!A15 -> 9 | H11: ='Pro V Twin'!B15 -> Shane Stinson | I11: ='Pro V Twin'!D15 -> 11-200 | J11: ='Pro V Twin'!E15 -> Roller Kolher | K11: ='Pro V Twin'!Z15 -> 97
A12: ='30 Cube'!A16 -> 10 | B12: ='30 Cube'!B16 -> Scott Bye | C12: ='30 Cube'!D16 -> 11-187 | D12: =IF('30 Cube'!E16=0," ",'30 Cube'!E16) -> Splinter | E12: ='30 Cube'!Z16 -> 32 | G12: ='Pro V Twin'!A16 -> 10 | H12: ='Pro V Twin'!B16 -> Larry Dunlap | I12: ='Pro V Twin'!D16 -> 11-201 | J12: ='Pro V Twin'!E16 -> Renegade | K12: ='Pro V Twin'!Z16 -> 102
A13: ='30 Cube'!A17 -> 11 | B13: ='30 Cube'!B17 -> Darrell Tate | C13: ='30 Cube'!D17 -> 11-060 | D13: =IF('30 Cube'!E17=0," ",'30 Cube'!E17) -> Pink | E13: ='30 Cube'!Z17 -> 70 | G13: ='Pro V Twin'!A17 -> 11 | H13: ='Pro V Twin'!B17 -> Rob Wise | I13: ='Pro V Twin'!D17 -> 11-209 | J13: ='Pro V Twin'!E17 -> Longshot | K13: ='Pro V Twin'!Z17 -> 116
A14: ='30 Cube'!A18 -> 12 | B14: ='30 Cube'!B18 -> Darrell Tate | C14: ='30 Cube'!D18 -> 11-059 | D14: =IF('30 Cube'!E18=0," ",'30 Cube'!E18) -> Orange | E14: ='30 Cube'!Z18 -> 75 | G14: ='Pro V Twin'!A18 -> 12 | H14: ='Pro V Twin'!B18 -> Nick Hayes | I14: ='Pro V Twin'!D18 -> 11-436 | J14: ='Pro V Twin'!E18 -> Screaming Eagle | K14: ='Pro V Twin'!Z18 -> 119
A15: ='30 Cube'!A19 -> 13 | B15: ='30 Cube'!B19 -> Dave Gawatz | C15: ='30 Cube'!D19 -> 11-408 | D15: =IF('30 Cube'!E19=0," ",'30 Cube'!E19) -> Undertaker | E15: ='30 Cube'!Z19 -> 76 | G15: ='Pro V Twin'!A19 -> 13 | H15: ='Pro V Twin'!B19 -> Mark Sheetz | I15: ='Pro V Twin'!D19 -> 11-417 | J15: ='Pro V Twin'!E19 -> Sparky | K15: ='Pro V Twin'!Z19 -> 120
A16: ='30 Cube'!A20 -> 14 | B16: ='30 Cube'!B20 -> Patrick Roth | C16: ='30 Cube'!D20 -> 11-061 | D16: =IF('30 Cube'!E20=0," ",'30 Cube'!E20) -> Widowmaker | E16: ='30 Cube'!Z20 -> 79 | G16: ='Pro V Twin'!A20 -> 14 | H16: ='Pro V Twin'!B20 -> Eldon Wright | I16: ='Pro V Twin'!D20 -> 11-431 | J16: ='Pro V Twin'!E20 -> Willie | K16: ='Pro V Twin'!Z20 -> 120
A17: ='30 Cube'!A21 -> 15 | B17: ='30 Cube'!B21 -> Greg Black | C17: ='30 Cube'!D21 -> 11-103 | D17: =IF('30 Cube'!E21=0," ",'30 Cube'!E21) -> Pocket Change | E17: ='30 Cube'!Z21 -> 81 | G17: ='Pro V Twin'!A21 -> 15 | H17: ='Pro V Twin'!B21 -> Tim Hayes | I17: ='Pro V Twin'!D21 -> 11-374 | J17: ='Pro V Twin'!E21 -> Mad Dog 2 | K17: ='Pro V Twin'!Z21 -> 121
A18: ='30 Cube'!A22 -> 16 | B18: ='30 Cube'!B22 -> Wes Kempeter | C18: ='30 Cube'!D22 -> 11-424 | D18: =IF('30 Cube'!E22=0," ",'30 Cube'!E22) -> Wasted Money | E18: ='30 Cube'!Z22 -> 85 | G18: ='Pro V Twin'!A22 -> 16 | H18: ='Pro V Twin'!B22 -> John Norris | I18: ='Pro V Twin'!D22 -> 11-414 | J18: ='Pro V Twin'!E22 -> Back N Black | K18: ='Pro V Twin'!Z22 -> 121
A19: ='30 Cube'!A23 -> 17 | B19: ='30 Cube'!B23 -> Keith Roberts | C19: ='30 Cube'!D23 -> 11-194 | D19: =IF('30 Cube'!E23=0," ",'30 Cube'!E23) -> Yellow Jacket | E19: ='30 Cube'!Z23 -> 86 | G19: ='Pro V Twin'!A23 -> 17 | H19: ='Pro V Twin'!B23 -> Jamey Pierce | I19: ='Pro V Twin'!D23 -> 11-031 | J19: ='Pro V Twin'!E23 -> Siamese Twin | K19: ='Pro V Twin'!Z23 -> 122
A20: ='30 Cube'!A24 -> 18 | B20: ='30 Cube'!B24 -> Caleb Peters | C20: ='30 Cube'!D24 -> 11-371 | D20: =IF('30 Cube'!E24=0," ",'30 Cube'!E24) -> Bernies Nitemare | E20: ='30 Cube'!Z24 -> 86 | G20: ='Pro V Twin'!A24 -> 18 | H20: ='Pro V Twin'!B24 -> Tim Hammond | I20: ='Pro V Twin'!D24 -> 11-211 | J20: ='Pro V Twin'!E24 -> All Nighter | K20: ='Pro V Twin'!Z24 -> 122
A21: ='30 Cube'!A25 -> 19 | B21: ='30 Cube'!B25 -> Bobby Feldkamp | C21: ='30 Cube'!D25 -> 11-144 | D21: =IF('30 Cube'!E25=0," ",'30 Cube'!E25) -> Goin for Broke | E21: ='30 Cube'!Z25 -> 89 | G21: ='Pro V Twin'!A25 -> 19 | H21: ='Pro V Twin'!B25 -> Shawn Dukes | I21: ='Pro V Twin'!D25 -> 11- | K21: ='Pro V Twin'!Z25 -> 123
A22: ='30 Cube'!A26 -> 20 | B22: ='30 Cube'!B26 -> George Bax | C22: ='30 Cube'!D26 -> 11-422 | D22: =IF('30 Cube'!E26=0," ",'30 Cube'!E26) -> Plum Crazy | E22: ='30 Cube'!Z26 -> 104 | G22: ='Pro V Twin'!A26 -> 20 | H22: ='Pro V Twin'!B26 -> Sandy Hayes | I22: ='Pro V Twin'!D26 -> 11-373 | J22: ='Pro V Twin'!E26 -> Mad Dog 1 | K22: ='Pro V Twin'!Z26 -> 124
A23: ='30 Cube'!A27 -> 21 | B23: ='30 Cube'!B27 -> Justin Wagler | C23: ='30 Cube'!D27 -> 11-127 | D23: =IF('30 Cube'!E27=0," ",'30 Cube'!E27) -> Samson | E23: ='30 Cube'!Z27 -> 105 | G23: ='Pro V Twin'!A27 -> 21 | H23: ='Pro V Twin'!B27 -> Lindsey Wells | I23: ='Pro V Twin'!D27 -> 11-212 | J23: ='Pro V Twin'!E27 -> Clearly Crazy | K23: ='Pro V Twin'!Z27 -> 126
A24: ='30 Cube'!A28 -> 22 | B24: ='30 Cube'!B28 -> Michele Amstutz | C24: ='30 Cube'!D28 -> 11-339 | D24: =IF('30 Cube'!E28=0," ",'30 Cube'!E28) -> Cub Cadet | E24: ='30 Cube'!Z28 -> 105 | G24: ='Pro V Twin'!A28 -> 22 | H24: ='Pro V Twin'!B28 -> James Spencer | I24: ='Pro V Twin'!D28 -> 11- | K24: ='Pro V Twin'!Z28 -> 126
A25: ='30 Cube'!A29 -> 23 | B25: ='30 Cube'!B29 -> Keith Roberts | C25: ='30 Cube'!D29 -> 11-350 | D25: =IF('30 Cube'!E29=0," ",'30 Cube'!E29) -> Yellow Jacket | E25: ='30 Cube'!Z29 -> 105
A26: ='30 Cube'!A30 -> 24 | B26: ='30 Cube'!B30 -> Haylee Heits | C26: ='30 Cube'!D30 -> 11-411 | D26: =IF('30 Cube'!E30=0," ",'30 Cube'!E30) -> Full Throttle | E26: ='30 Cube'!Z30 -> 110
A27: ='30 Cube'!A31 -> 25 | B27: ='30 Cube'!B31 -> Amanda Manville | C27: ='30 Cube'!D31 -> 11-235 | D27: =IF('30 Cube'!E31=0," ",'30 Cube'!E31) -> Sidewinder | E27: ='30 Cube'!Z31 -> 111 | G27: Open Super Stock | K27: Thru Sturgis
A28: ='30 Cube'!A32 -> 26 | B28: ='30 Cube'!B32 -> Aaron Sloan | C28: ='30 Cube'!D32 -> 11-425 | D28: =IF('30 Cube'!E32=0," ",'30 Cube'!E32) -> Insufficient Funds | E28: ='30 Cube'!Z32 -> 112 | H28: Name | I28: NQS # | J28: Tractor | K28: Points Back
A29: ='30 Cube'!A33 -> 27 | B29: ='30 Cube'!B33 -> Corey McClung | C29: ='30 Cube'!D33 -> 11-295 | D29: =IF('30 Cube'!E33=0," ",'30 Cube'!E33) -> Zero | E29: ='30 Cube'!Z33 -> 117 | G29: ='Open Super Stock'!A7 -> 1 | H29: ='Open Super Stock'!B7 -> Bruce Austin | I29: ='Open Super Stock'!D7 -> 11-169 | J29: =IF('Open Super Stock'!E7=0,"",'Open Super Stock'!E7) -> Thundertaker | K29: ='Open Super Stock'!Z7 -> 0
A30: ='30 Cube'!A34 -> 28 | B30: ='30 Cube'!B34 -> Annette Sullivan | C30: ='30 Cube'!D34 -> 11-122 | D30: =IF('30 Cube'!E34=0," ",'30 Cube'!E34) -> Just Relax | E30: ='30 Cube'!Z34 -> 118 | G30: ='Open Super Stock'!A8 -> 2 | H30: ='Open Super Stock'!B8 -> Harrison Stahl | I30: ='Open Super Stock'!D8 -> 11-004 | J30: =IF('Open Super Stock'!E8=0,"",'Open Super Stock'!E8) -> Tons of Fun | K30: ='Open Super Stock'!Z8 -> 5
A31: ='30 Cube'!A35 -> 29 | B31: ='30 Cube'!B35 -> Bud Casale | C31: ='30 Cube'!D35 -> 11-403 | D31: =IF('30 Cube'!E35=0," ",'30 Cube'!E35) ->  | E31: ='30 Cube'!Z35 -> 119 | G31: ='Open Super Stock'!A9 -> 3 | H31: ='Open Super Stock'!B9 -> Calvin Becker | I31: ='Open Super Stock'!D9 -> 11-113 | J31: =IF('Open Super Stock'!E9=0,"",'Open Super Stock'!E9) -> Spike | K31: ='Open Super Stock'!Z9 -> 11
A32: ='30 Cube'!A36 -> 30 | B32: ='30 Cube'!B36 -> Brian Peregrine | C32: ='30 Cube'!D36 -> 11-415 | D32: =IF('30 Cube'!E36=0," ",'30 Cube'!E36) -> Wood Chipper | E32: ='30 Cube'!Z36 -> 120 | G32: ='Open Super Stock'!A10 -> 4 | H32: ='Open Super Stock'!B10 -> Kenny Cornelison | I32: ='Open Super Stock'!D10 -> 11-149 | J32: =IF('Open Super Stock'!E10=0,"",'Open Super Stock'!E10) -> Storm Alert | K32: ='Open Super Stock'!Z10 -> 18
A33: ='30 Cube'!A37 -> 31 | B33: ='30 Cube'!B37 -> Rick Massey | C33: ='30 Cube'!D37 -> 11-421 | D33: =IF('30 Cube'!E37=0," ",'30 Cube'!E37) -> Spare Parts | E33: ='30 Cube'!Z37 -> 121 | G33: ='Open Super Stock'!A11 -> 5 | H33: ='Open Super Stock'!B11 -> Julian Stahl | I33: ='Open Super Stock'!D11 -> 11-003 | J33: =IF('Open Super Stock'!E11=0,"",'Open Super Stock'!E11) -> Midwest Express | K33: ='Open Super Stock'!Z11 -> 20
A34: ='30 Cube'!A38 -> 32 | B34: ='30 Cube'!B38 -> Mike Perry | C34: ='30 Cube'!D38 -> 11-426 | D34: =IF('30 Cube'!E38=0," ",'30 Cube'!E38) -> Mac Attack | E34: ='30 Cube'!Z38 -> 122 | G34: ='Open Super Stock'!A12 -> 6 | H34: ='Open Super Stock'!B12 -> Mark Brown | I34: ='Open Super Stock'!D12 -> 11-261 | J34: =IF('Open Super Stock'!E12=0,"",'Open Super Stock'!E12) -> Badideal | K34: ='Open Super Stock'!Z12 -> 62
A35: ='30 Cube'!A39 -> 33 | B35: ='30 Cube'!B39 -> Leslie Sullivan | C35: ='30 Cube'!D39 -> 11-120 | D35: =IF('30 Cube'!E39=0," ",'30 Cube'!E39) -> Joker | E35: ='30 Cube'!Z39 -> 123 | G35: ='Open Super Stock'!A13 -> 7 | H35: ='Open Super Stock'!B13 -> Darlene Sample | I35: ='Open Super Stock'!D13 -> 11-349 | J35: =IF('Open Super Stock'!E13=0,"",'Open Super Stock'!E13) -> Oil Slick | K35: ='Open Super Stock'!Z13 -> 142
B36: PRO OUTLAW | E36: Thru Sturgis | G36: ='Open Super Stock'!A14 -> 8 | H36: ='Open Super Stock'!B14 -> Ryan Shafer | I36: ='Open Super Stock'!D14 -> 11-206 | J36: =IF('Open Super Stock'!E14=0,"",'Open Super Stock'!E14) -> Roadrunner | K36: ='Open Super Stock'!Z14 -> 163
B37: Name | C37: NQS # | D37: Tractor | E37: Points Back | G37: ='Open Super Stock'!A15 -> 9 | H37: ='Open Super Stock'!B15 -> Nick Laibe | I37: ='Open Super Stock'!D15 -> 11-341 | J37: =IF('Open Super Stock'!E15=0,"",'Open Super Stock'!E15) -> Odd Couple | K37: ='Open Super Stock'!Z15 -> 193
A38: ='Pro Outlaw'!A7 -> 1 | B38: ='Pro Outlaw'!B7 -> Steve Burton | C38: ='Pro Outlaw'!D7 -> 11-014 | D38: =IF('Pro Outlaw'!E7=0," ",'Pro Outlaw'!E7) -> Bad Company | E38: ='Pro Outlaw'!Z7 -> 0 | G38: ='Open Super Stock'!A16 -> 10 | H38: ='Open Super Stock'!B16 -> Rick Massey | I38: ='Open Super Stock'!D16 -> 11-420 | J38: =IF('Open Super Stock'!E16=0,"",'Open Super Stock'!E16) -> Special Addiction | K38: ='Open Super Stock'!Z16 -> 202
A39: ='Pro Outlaw'!A8 -> 2 | B39: ='Pro Outlaw'!B8 -> Scott Bye | C39: ='Pro Outlaw'!D8 -> 11-365 | D39: =IF('Pro Outlaw'!E8=0," ",'Pro Outlaw'!E8) -> Fired Up | E39: ='Pro Outlaw'!Z8 -> 8 | G39: ='Open Super Stock'!A17 -> 11 | H39: ='Open Super Stock'!B17 -> John Norris | I39: ='Open Super Stock'!D17 -> 11-414 | J39: =IF('Open Super Stock'!E17=0,"",'Open Super Stock'!E17) -> Back N Black | K39: ='Open Super Stock'!Z17 -> 203
A40: ='Pro Outlaw'!A9 -> 3 | B40: ='Pro Outlaw'!B9 -> Russ Nichols | C40: ='Pro Outlaw'!D9 -> 11-069 | D40: =IF('Pro Outlaw'!E9=0," ",'Pro Outlaw'!E9) -> Top Secret | E40: ='Pro Outlaw'!Z9 -> 18 | G40: ='Open Super Stock'!A18 -> 12 | H40: ='Open Super Stock'!B18 -> Julian Stahl | I40: ='Open Super Stock'!D18 -> 11-433 | J40: =IF('Open Super Stock'!E18=0,"",'Open Super Stock'!E18) -> Fully Charged | K40: ='Open Super Stock'!Z18 -> 205
A41: ='Pro Outlaw'!A10 -> 4 | B41: ='Pro Outlaw'!B10 -> Julian Stahl | C41: ='Pro Outlaw'!D10 -> 11-002 | D41: =IF('Pro Outlaw'!E10=0," ",'Pro Outlaw'!E10) -> MWSC #2 | E41: ='Pro Outlaw'!Z10 -> 22 | G41: ='Open Super Stock'!A19 -> 13 | H41: ='Open Super Stock'!B19 -> Mike Slaubaugh | I41: ='Open Super Stock'!D19 -> 11-382 | J41: =IF('Open Super Stock'!E19=0,"",'Open Super Stock'!E19) -> Fools Gold | K41: ='Open Super Stock'!Z19 -> 207
A42: ='Pro Outlaw'!A11 -> 5 | B42: ='Pro Outlaw'!B11 -> Harrison Stahl | C42: ='Pro Outlaw'!D11 -> 11-004 | D42: =IF('Pro Outlaw'!E11=0," ",'Pro Outlaw'!E11) -> Tons of Fun | E42: ='Pro Outlaw'!Z11 -> 49 | G42: ='Open Super Stock'!A21 -> 15 | H42: ='Open Super Stock'!B21 -> Ken Lucius | I42: ='Open Super Stock'!D21 -> 11-266 | J42: =IF('Open Super Stock'!E21=0,"",'Open Super Stock'!E21) -> Smoker | K42: ='Open Super Stock'!Z21 -> 209
A43: ='Pro Outlaw'!A12 -> 6 | B43: ='Pro Outlaw'!B12 -> Julian Stahl | C43: ='Pro Outlaw'!D12 -> 11-001 | D43: =IF('Pro Outlaw'!E12=0," ",'Pro Outlaw'!E12) -> MWSC #1 | E43: ='Pro Outlaw'!Z12 -> 50 | G43: ='Open Super Stock'!A22 -> 16 | H43: ='Open Super Stock'!B22 -> Nick Hayes | I43: ='Open Super Stock'!D22 -> 11-321 | J43: =IF('Open Super Stock'!E22=0,"",'Open Super Stock'!E22) -> Green | K43: ='Open Super Stock'!Z22 -> 209
A44: ='Pro Outlaw'!A13 -> 7 | B44: ='Pro Outlaw'!B13 -> Harrison Stahl | C44: ='Pro Outlaw'!D13 -> 11-336 | D44: =IF('Pro Outlaw'!E13=0," ",'Pro Outlaw'!E13) -> MWSC #4 | E44: ='Pro Outlaw'!Z13 -> 53 | G44: ='Open Super Stock'!A23 -> 17 | H44: ='Open Super Stock'!B23 -> Jeffrey Wilson | I44: ='Open Super Stock'!D23 -> 11-393 | J44: =IF('Open Super Stock'!E23=0,"",'Open Super Stock'!E23) -> My Addiction | K44: ='Open Super Stock'!Z23 -> 210
A45: ='Pro Outlaw'!A14 -> 8 | B45: ='Pro Outlaw'!B14 -> Harrison Stahl | C45: ='Pro Outlaw'!D14 -> 11-335 | D45: =IF('Pro Outlaw'!E14=0," ",'Pro Outlaw'!E14) -> MWSC #3 | E45: ='Pro Outlaw'!Z14 -> 62 | G45: ='Open Super Stock'!A24 -> 18 | H45: ='Open Super Stock'!B24 -> David Knapp | I45: ='Open Super Stock'!D24 -> 11-381 | J45: =IF('Open Super Stock'!E24=0,"",'Open Super Stock'!E24) -> Knapp Time | K45: ='Open Super Stock'!Z24 -> 211
A46: ='Pro Outlaw'!A15 -> 9 | B46: ='Pro Outlaw'!B15 -> Scott Larkins | C46: ='Pro Outlaw'!D15 -> 11-154 | D46: =IF('Pro Outlaw'!E15=0," ",'Pro Outlaw'!E15) -> Yosemite Sam | E46: ='Pro Outlaw'!Z15 -> 81 | G46: ='Open Super Stock'!A25 -> 19 | H46: ='Open Super Stock'!B25 -> David Gawatz | I46: ='Open Super Stock'!D25 -> 11-184 | J46: =IF('Open Super Stock'!E25=0,"",'Open Super Stock'!E25) ->  | K46: ='Open Super Stock'!Z25 -> 212
A47: ='Pro Outlaw'!A16 -> 10 | B47: ='Pro Outlaw'!B16 -> Jim Hall---DQ | C47: ='Pro Outlaw'!D16 -> 11-334 | D47: =IF('Pro Outlaw'!E16=0," ",'Pro Outlaw'!E16) -> Simplicity | E47: ='Pro Outlaw'!Z16 -> 94 | G47: ='Open Super Stock'!A26 -> 20 | H47: ='Open Super Stock'!B26 -> Matt Kaster | I47: ='Open Super Stock'!D26 -> 11-099 | J47: =IF('Open Super Stock'!E26=0,"",'Open Super Stock'!E26) -> Super Freak | K47: ='Open Super Stock'!Z26 -> 231
A48: ='Pro Outlaw'!A17 -> 11 | B48: ='Pro Outlaw'!B17 -> Matt Kaster | C48: ='Pro Outlaw'!D17 -> 11-098 | D48: =IF('Pro Outlaw'!E17=0," ",'Pro Outlaw'!E17) -> Moose | E48: ='Pro Outlaw'!Z17 -> 98 | G48: ='Open Super Stock'!A27 -> 21 | H48: ='Open Super Stock'!B27 -> Brad Corzine | I48: ='Open Super Stock'!D27 -> 11-368 | J48: =IF('Open Super Stock'!E27=0,"",'Open Super Stock'!E27) -> Just Black | K48: ='Open Super Stock'!Z27 -> 233
A49: ='Pro Outlaw'!A18 -> 12 | B49: ='Pro Outlaw'!B18 -> Kenny Cornelison | C49: ='Pro Outlaw'!D18 -> 11-149 | D49: =IF('Pro Outlaw'!E18=0," ",'Pro Outlaw'!E18) -> Storm Alert | E49: ='Pro Outlaw'!Z18 -> 125 | G49: ='Open Super Stock'!A28 -> 22 | H49: ='Open Super Stock'!B28 -> Scott Larkins | I49: ='Open Super Stock'!D28 -> 11-154 | J49: =IF('Open Super Stock'!E28=0,"",'Open Super Stock'!E28) -> Yosemite Sams | K49: ='Open Super Stock'!Z28 -> 234
A50: ='Pro Outlaw'!A19 -> 13 | B50: Jim Hall | C50: ='Pro Outlaw'!D19 -> 11-352 | D50: =IF('Pro Outlaw'!E19=0," ",'Pro Outlaw'!E19) -> Cub 122 | E50: ='Pro Outlaw'!Z19 -> 127 | G50: ='Open Super Stock'!A29 -> 23 | H50: ='Open Super Stock'!B29 -> Will Durstine | I50: ='Open Super Stock'!D29 -> 11-264 | J50: =IF('Open Super Stock'!E29=0,"",'Open Super Stock'!E29) -> Never Satisfied | K50: ='Open Super Stock'!Z29 -> 235
A51: ='Pro Outlaw'!A20 -> 14 | B51: ='Pro Outlaw'!B20 -> Matt Kaster | C51: ='Pro Outlaw'!D20 -> 11-099 | D51: =IF('Pro Outlaw'!E20=0," ",'Pro Outlaw'!E20) -> Super Freak | E51: ='Pro Outlaw'!Z20 -> 132 | G51: ='Open Super Stock'!A30 -> 24 | H51: ='Open Super Stock'!B30 -> Shane Heits | I51: ='Open Super Stock'!D30 -> 11-366 | J51: =IF('Open Super Stock'!E30=0,"",'Open Super Stock'!E30) -> Dirt Fed | K51: ='Open Super Stock'!Z30 -> 235
A52: ='Pro Outlaw'!A22 -> 16 | B52: ='Pro Outlaw'!B22 -> David Gawatz | C52: ='Pro Outlaw'!D22 -> 11-184 | D52: =IF('Pro Outlaw'!E22=0," ",'Pro Outlaw'!E22) -> Low Hung Buck | E52: ='Pro Outlaw'!Z22 -> 140 | G52: ='Open Super Stock'!A31 -> 25 | H52: ='Open Super Stock'!B31 -> Ken Mortimer | I52: ='Open Super Stock'!D31 -> 11-355 | J52: =IF('Open Super Stock'!E31=0,"",'Open Super Stock'!E31) -> Anger Management | K52: ='Open Super Stock'!Z31 -> 236
A53: ='Pro Outlaw'!A23 -> 17 | B53: ='Pro Outlaw'!B23 -> Elaine Fisher | C53: ='Pro Outlaw'!D23 -> 11-080 | D53: =IF('Pro Outlaw'!E23=0," ",'Pro Outlaw'!E23) -> Blue Thunder | E53: ='Pro Outlaw'!Z23 -> 154
A54: ='Pro Outlaw'!A24 -> 18 | B54: ='Pro Outlaw'!B24 -> Jeff Chrisman | C54: ='Pro Outlaw'!D24 -> 11-180 | D54: =IF('Pro Outlaw'!E24=0," ",'Pro Outlaw'!E24) ->  | E54: ='Pro Outlaw'!Z24 -> 158
A55: ='Pro Outlaw'!A25 -> 19 | B55: ='Pro Outlaw'!B25 -> Russ Nichols | C55: ='Pro Outlaw'!D25 -> 11-070 | D55: =IF('Pro Outlaw'!E25=0," ",'Pro Outlaw'!E25) -> Wild One Two | E55: ='Pro Outlaw'!Z25 -> 165
A56: ='Pro Outlaw'!A26 -> 20 | B56: ='Pro Outlaw'!B26 -> Lowell Vis | C56: ='Pro Outlaw'!D26 -> 11-333 | D56: =IF('Pro Outlaw'!E26=0," ",'Pro Outlaw'!E26) -> Skittles | E56: ='Pro Outlaw'!Z26 -> 166
A57: ='Pro Outlaw'!A27 -> 21 | B57: ='Pro Outlaw'!B27 -> Trampis Hamilton | C57: ='Pro Outlaw'!D27 -> 11-361 | D57: =IF('Pro Outlaw'!E27=0," ",'Pro Outlaw'!E27) -> Digger | E57: ='Pro Outlaw'!Z27 -> 175
A58: ='Pro Outlaw'!A28 -> 22 | B58: ='Pro Outlaw'!B28 -> Shane Stinson | C58: ='Pro Outlaw'!D28 -> 11-200 | D58: =IF('Pro Outlaw'!E28=0," ",'Pro Outlaw'!E28) -> Roller Kolher | E58: ='Pro Outlaw'!Z28 -> 179
A59: ='Pro Outlaw'!A29 -> 23 | B59: ='Pro Outlaw'!B29 -> Shane Heits | C59: ='Pro Outlaw'!D29 -> 11-366 | D59: =IF('Pro Outlaw'!E29=0," ",'Pro Outlaw'!E29) -> Dirt Fed | E59: ='Pro Outlaw'!Z29 -> 184
A60: ='Pro Outlaw'!A30 -> 24 | B60: ='Pro Outlaw'!B30 -> Mike Kyle | C60: ='Pro Outlaw'!D30 -> 11-394 | D60: =IF('Pro Outlaw'!E30=0," ",'Pro Outlaw'!E30) ->  | E60: ='Pro Outlaw'!Z30 -> 184
A61: ='Pro Outlaw'!A31 -> 25 | B61: ='Pro Outlaw'!B31 -> David Knapp | C61: ='Pro Outlaw'!D31 -> 11-381 | D61: =IF('Pro Outlaw'!E31=0," ",'Pro Outlaw'!E31) -> Knapp Time | E61: ='Pro Outlaw'!Z31 -> 189
A62: ='Pro Outlaw'!A32 -> 26 | B62: ='Pro Outlaw'!B32 -> Dan Schell | C62: ='Pro Outlaw'!D32 -> 11-375 | D62: =IF('Pro Outlaw'!E32=0," ",'Pro Outlaw'!E32) -> Menace | E62: ='Pro Outlaw'!Z32 -> 195
A63: ='Pro Outlaw'!A33 -> 27 | B63: ='Pro Outlaw'!B33 -> Carl Zimmerman | C63: ='Pro Outlaw'!D33 -> 11-395 | D63: =IF('Pro Outlaw'!E33=0," ",'Pro Outlaw'!E33) -> Bragging Rights | E63: ='Pro Outlaw'!Z33 -> 195
A64: ='Pro Outlaw'!A34 -> 28 | B64: ='Pro Outlaw'!B34 -> Mike Spencer | C64: ='Pro Outlaw'!D34 -> 11-278 | D64: =IF('Pro Outlaw'!E34=0," ",'Pro Outlaw'!E34) -> Longshot | E64: ='Pro Outlaw'!Z34 -> 198
A65: ='Pro Outlaw'!A35 -> 29 | B65: ='Pro Outlaw'!B35 -> Casey Schell | C65: ='Pro Outlaw'!D35 -> 11-407 | D65: =IF('Pro Outlaw'!E35=0," ",'Pro Outlaw'!E35) -> H2O Head | E65: ='Pro Outlaw'!Z35 -> 198
A66: ='Pro Outlaw'!A36 -> 30 | B66: ='Pro Outlaw'!B36 -> Dave Mascher Jr | C66: ='Pro Outlaw'!D36 -> 11-163 | D66: =IF('Pro Outlaw'!E36=0," ",'Pro Outlaw'!E36) ->  | E66: ='Pro Outlaw'!Z36 -> 199
A67: ='Pro Outlaw'!A37 -> 31 | B67: ='Pro Outlaw'!B37 -> Todd Hammond | C67: ='Pro Outlaw'!D37 -> 11-301 | D67: =IF('Pro Outlaw'!E37=0," ",'Pro Outlaw'!E37) -> Punisher | E67: ='Pro Outlaw'!Z37 -> 200
A68: ='Pro Outlaw'!A38 -> 32 | B68: ='Pro Outlaw'!B38 -> Carla Morgenstern | C68: ='Pro Outlaw'!D38 -> 11-216 | D68: =IF('Pro Outlaw'!E38=0," ",'Pro Outlaw'!E38) -> High Maintenance | E68: ='Pro Outlaw'!Z38 -> 202
A69: ='Pro Outlaw'!A39 -> 33 | B69: ='Pro Outlaw'!B39 -> Rob Wise | C69: ='Pro Outlaw'!D39 -> 11-209 | D69: =IF('Pro Outlaw'!E39=0," ",'Pro Outlaw'!E39) -> Longshot | E69: ='Pro Outlaw'!Z39 -> 209
A70: ='Pro Outlaw'!A40 -> 34 | B70: ='Pro Outlaw'!B40 -> Eric Pike | C70: ='Pro Outlaw'!D40 -> 11-353 | D70: =IF('Pro Outlaw'!E40=0," ",'Pro Outlaw'!E40) -> Too Blue | E70: ='Pro Outlaw'!Z40 -> 211
A71: ='Pro Outlaw'!A41 -> 35 | B71: ='Pro Outlaw'!B41 -> Dick Eldridge | C71: ='Pro Outlaw'!D41 -> 11-340 | D71: =IF('Pro Outlaw'!E41=0," ",'Pro Outlaw'!E41) -> Hay Baler | E71: ='Pro Outlaw'!Z41 -> 212
A72: ='Pro Outlaw'!A42 -> 36 | B72: ='Pro Outlaw'!B42 -> Aaron Scroggins | C72: ='Pro Outlaw'!D42 -> 11-111 | D72: =IF('Pro Outlaw'!E42=0," ",'Pro Outlaw'!E42) -> Black Out | E72: ='Pro Outlaw'!Z42 -> 213
A73: ='Pro Outlaw'!A43 -> 37 | B73: ='Pro Outlaw'!B43 -> Ryan Shafer | C73: ='Pro Outlaw'!D43 -> 11-206 | D73: =IF('Pro Outlaw'!E43=0," ",'Pro Outlaw'!E43) -> Roadrunner | E73: ='Pro Outlaw'!Z43 -> 213
A74: ='Pro Outlaw'!A44 -> 38 | B74: ='Pro Outlaw'!B44 -> Mark Conover | C74: ='Pro Outlaw'!D44 -> 11-360 | D74: =IF('Pro Outlaw'!E44=0," ",'Pro Outlaw'!E44) ->  | E74: ='Pro Outlaw'!Z44 -> 214
A75: ='Pro Outlaw'!A45 -> 39 | B75: ='Pro Outlaw'!B45 -> Dave Richter | C75: ='Pro Outlaw'!D45 -> 11-207 | D75: =IF('Pro Outlaw'!E45=0," ",'Pro Outlaw'!E45) -> Hustler | E75: ='Pro Outlaw'!Z45 -> 221
A76: ='Pro Outlaw'!A47 -> 41 | B76: ='Pro Outlaw'!B47 -> Larry Hunter | C76: ='Pro Outlaw'!D47 -> 11-009 | D76: =IF('Pro Outlaw'!E47=0," ",'Pro Outlaw'!E47) -> Runaway Deere | E76: ='Pro Outlaw'!Z47 -> 231
A77: ='Pro Outlaw'!A48 -> 42 | B77: ='Pro Outlaw'!B48 -> Bill Richerson | C77: ='Pro Outlaw'!D48 -> 11-132 | D77: =IF('Pro Outlaw'!E48=0," ",'Pro Outlaw'!E48) -> Walk the Line | E77: ='Pro Outlaw'!Z48 -> 231
A78: ='Pro Outlaw'!A49 -> 43 | B78: ='Pro Outlaw'!B49 -> Allison Manville | C78: ='Pro Outlaw'!D49 -> 11-234 | D78: =IF('Pro Outlaw'!E49=0," ",'Pro Outlaw'!E49) -> No Fluke | E78: ='Pro Outlaw'!Z49 -> 234
A79: ='Pro Outlaw'!A50 -> 44 | B79: ='Pro Outlaw'!B50 -> Eric Pike | C79: ='Pro Outlaw'!D50 -> 11-359 | D79: =IF('Pro Outlaw'!E50=0," ",'Pro Outlaw'!E50) -> Visual Expression | E79: ='Pro Outlaw'!Z50 -> 234
A80: ='Pro Outlaw'!A51 -> 45 | B80: ='Pro Outlaw'!B51 -> Dustin Blair | C80: ='Pro Outlaw'!D51 -> 11-380 | D80: =IF('Pro Outlaw'!E51=0," ",'Pro Outlaw'!E51) ->  | E80: ='Pro Outlaw'!Z51 -> 235
A81: ='Pro Outlaw'!A52 -> 46 | B81: ='Pro Outlaw'!B52 -> Kelly Nichols | C81: ='Pro Outlaw'!D52 -> 11-008 | D81: =IF('Pro Outlaw'!E52=0," ",'Pro Outlaw'!E52) -> Wicked Deere | E81: ='Pro Outlaw'!Z52 -> 236
A82: ='Pro Outlaw'!A53 -> 47 | B82: ='Pro Outlaw'!B53 -> Jeremy Jaspering | C82: ='Pro Outlaw'!D53 -> 11-147 | D82: =IF('Pro Outlaw'!E53=0," ",'Pro Outlaw'!E53) -> Wicked | E82: ='Pro Outlaw'!Z53 -> 236
A83: ='Pro Outlaw'!A54 -> 48 | B83: ='Pro Outlaw'!B54 -> Doug Diehl | C83: ='Pro Outlaw'!D54 -> 11-385 | D83: =IF('Pro Outlaw'!E54=0," ",'Pro Outlaw'!E54) -> Eliminator | E83: ='Pro Outlaw'!Z54 -> 237
A84: ='Pro Outlaw'!A55 -> 49 | B84: ='Pro Outlaw'!B55 -> Rick Massey | C84: ='Pro Outlaw'!D55 -> 11-420 | D84: =IF('Pro Outlaw'!E55=0," ",'Pro Outlaw'!E55) -> Special Addiction | E84: ='Pro Outlaw'!Z55 -> 237
A85: ='Pro Outlaw'!A56 -> 50 | B85: ='Pro Outlaw'!B56 -> Doug Diehl | C85: ='Pro Outlaw'!D56 -> 11-242 | D85: =IF('Pro Outlaw'!E56=0," ",'Pro Outlaw'!E56) -> Extra Wild | E85: ='Pro Outlaw'!Z56 -> 238
A86: ='Pro Outlaw'!A57 -> 51 | B86: ='Pro Outlaw'!B57 -> Mark Sheetz | C86: ='Pro Outlaw'!D57 -> 11-417 | D86: =IF('Pro Outlaw'!E57=0," ",'Pro Outlaw'!E57) -> Sparky | E86: ='Pro Outlaw'!Z57 -> 238
A87: ='Pro Outlaw'!A58 -> 52 | B87: ='Pro Outlaw'!B58 -> Eldon Wright | C87: ='Pro Outlaw'!D58 -> 11-431 | D87: =IF('Pro Outlaw'!E58=0," ",'Pro Outlaw'!E58) -> Willie | E87: ='Pro Outlaw'!Z58 -> 238
A88: ='Pro Outlaw'!A59 -> 53 | B88: ='Pro Outlaw'!B59 -> Zach Richerson | C88: ='Pro Outlaw'!D59 -> 11-348 | D88: =IF('Pro Outlaw'!E59=0," ",'Pro Outlaw'!E59) -> Zachs Rat | E88: ='Pro Outlaw'!Z59 -> 239
A89: ='Pro Outlaw'!A60 -> 54 | B89: ='Pro Outlaw'!B60 -> James Spencer | C89: ='Pro Outlaw'!D60 -> 11- | D89: =IF('Pro Outlaw'!E60=0," ",'Pro Outlaw'!E60) -> Twin Addiction | E89: ='Pro Outlaw'!Z60 -> 240
A90: ='Pro Outlaw'!A61 -> 55 | B90: ='Pro Outlaw'!B61 -> Jamey Pierce | C90: ='Pro Outlaw'!D61 -> 11-031 | D90: =IF('Pro Outlaw'!E61=0," ",'Pro Outlaw'!E61) -> Simese Twin | E90: ='Pro Outlaw'!Z61 -> 241
A91: ='Pro Outlaw'!A62 -> 56 | B91: ='Pro Outlaw'!B62 -> Wes Kampeter | C91: ='Pro Outlaw'!D62 -> 11-423 | D91: =IF('Pro Outlaw'!E62=0," ",'Pro Outlaw'!E62) -> Torqued Up | E91: ='Pro Outlaw'!Z62 -> 241
A92: ='Pro Outlaw'!A63 -> 57 | B92: ='Pro Outlaw'!B63 -> Will Durstine | C92: ='Pro Outlaw'!D63 -> 11-264 | D92: =IF('Pro Outlaw'!E63=0," ",'Pro Outlaw'!E63) -> Never Satisfied | E92: ='Pro Outlaw'!Z63 -> 243
B93: BUILDERS CUP
B94: PRO/SS ENGINE BUILDERS | E94: SA/OUTLAW
B96: ='Builders Cup'!A4 -> NP = NICHOLS PERFORMANCE | C96: ='Builders Cup'!U4 -> 388 | E96: ='Builders Cup'!A20 -> NP = NICHOLS PERFORMANCE | F96: ='Builders Cup'!U20 -> 385
B97: ='Builders Cup'!A5 -> MVP = MVP RACING | C97: ='Builders Cup'!U5 -> 370 | E97: ='Builders Cup'!A21 -> TV = TODD VORHEES | F97: ='Builders Cup'!U21 -> 372
B98: ='Builders Cup'!A6 -> LR = LAKOTA RACING | C98: ='Builders Cup'!U6 -> 299 | E98: ='Builders Cup'!A22 -> JRS = JIMS REPAIR SERVICE | F98: ='Builders Cup'!U22 -> 354
B99: ='Builders Cup'!A7 -> GTP = MISHLER | C99: ='Builders Cup'!U7 -> 277 | E99: ='Builders Cup'!A23 -> JW = JOE WHITWORTH | F99: ='Builders Cup'!U23 -> 339
B100: ='Builders Cup'!A8 -> JRS = JIMS REPAIR SERVICE | C100: ='Builders Cup'!U8 -> 252 | E100: ='Builders Cup'!A24 -> BJ = BOB JONES | F100: ='Builders Cup'!U24 -> 335
B101: ='Builders Cup'!A9 -> ROOT = KEVIN ROOT | C101: ='Builders Cup'!U9 -> 243 | E101: ='Builders Cup'!A25 -> WOODS = DAVE WOODS | F101: ='Builders Cup'!U25 -> 261
B102: ='Builders Cup'!A10 -> HACKMAN = GREG HACKMAN | C102: ='Builders Cup'!U10 -> 206 | E102: ='Builders Cup'!A26 -> LR = LAKOTA RACING | F102: ='Builders Cup'!U26 -> 215
B103: ='Builders Cup'!A11 -> JW = JOE WHITWORTH | C103: ='Builders Cup'!U11 -> 183 | E103: ='Builders Cup'!A27 -> RPM = RADER | F103: ='Builders Cup'!U27 -> 136
B104: ='Builders Cup'!A12 -> VM = VOGEL MFG | C104: ='Builders Cup'!U12 -> 136 | E104: ='Builders Cup'!A28 -> VM = VOGEL MFG | F104: ='Builders Cup'!U28 -> 123
B105: ='Builders Cup'!A13 -> TC = TOOTER CAMPBELL | C105: ='Builders Cup'!U13 -> 115 | E105: ='Builders Cup'!A29 -> MVP = MVP RACING | F105: ='Builders Cup'!U29 -> 96