A1: PRO STOCK | E1: Thru Sturgis | H1: SUPER STOCK | L1: Thru Sturgis | O1: SUPER STOCK | R1: Thru Sturgis
B2: Name | D2: NQS # | E2: Tractor | F2: Points Back | I2: Name | J2: Eng. | K2: NQS# | L2: Tractor | M2: Points Back | P2: Name | Q2: Eng. | R2: NQS# | S2: Tractor | T2: Points Back
A3: ='Pro Stock'!A7 -> 1 | B3: ='Pro Stock'!B7 -> Russ Nichols | C3: =IF('Pro Stock'!C7=0," ",'Pro Stock'!C7) -> NP | D3: ='Pro Stock'!D7 -> 11-069 | E3: =IF('Pro Stock'!E7=0," ",'Pro Stock'!E7) -> Top Secret | F3: ='Pro Stock'!Z7 -> 0 | H3: ='Super Stock'!A7 -> 1 | I3: ='Super Stock'!B7 -> Kelly Nichols | J3: =IF('Super Stock'!C7=0," ",'Super Stock'!C7) -> NP | K3: ='Super Stock'!D7 -> 11-070 | L3: =IF('Super Stock'!E7=0," ",'Super Stock'!E7) -> Wild One 2 | M3: ='Super Stock'!Z7 -> 0 | O3: 109 | P3: Doug Diehl | Q3: NP | R3: 11-042 | S3: Extra Wild | T3: 249
A4: ='Pro Stock'!A8 -> 2 | B4: ='Pro Stock'!B8 -> Julian Stahl | C4: =IF('Pro Stock'!C8=0," ",'Pro Stock'!C8) -> MVP | D4: ='Pro Stock'!D8 -> 11-001 | E4: =IF('Pro Stock'!E8=0," ",'Pro Stock'!E8) -> MWSC #1 | F4: ='Pro Stock'!Z8 -> 17 | H4: ='Super Stock'!A8 -> 2 | I4: ='Super Stock'!B8 -> Harrison Stahl | J4: =IF('Super Stock'!C8=0," ",'Super Stock'!C8) -> MVP | K4: ='Super Stock'!D8 -> 11-336 | L4: =IF('Super Stock'!E8=0," ",'Super Stock'!E8) -> MWSC #4 | M4: ='Super Stock'!Z8 -> 0 | O4: 110 | P4: Doug Diehl | Q4: NP | R4: 11-385 | S4: Eliminator | T4: 249
A5: ='Pro Stock'!A9 -> 3 | B5: ='Pro Stock'!B9 -> Kelly Nichols | C5: =IF('Pro Stock'!C9=0," ",'Pro Stock'!C9) -> NP | D5: ='Pro Stock'!D9 -> 11-070 | E5: =IF('Pro Stock'!E9=0," ",'Pro Stock'!E9) -> Wild One 2 | F5: ='Pro Stock'!Z9 -> 29 | H5: ='Super Stock'!A9 -> 3 | I5: ='Super Stock'!B9 -> Steve Burton | J5: =IF('Super Stock'!C9=0," ",'Super Stock'!C9) -> NP | K5: ='Super Stock'!D9 -> 11-014 | L5: =IF('Super Stock'!E9=0," ",'Super Stock'!E9) -> Bad Company | M5: ='Super Stock'!Z9 -> 8 | O5: 111 | P5: Corey McClung | R5: 11-036 | S5: Lil Sandhill Binder | T5: 250
A6: ='Pro Stock'!A10 -> 4 | B6: ='Pro Stock'!B10 -> Clyde Mishler | C6: =IF('Pro Stock'!C10=0," ",'Pro Stock'!C10) -> GTP | D6: ='Pro Stock'!D10 -> 11-168 | E6: =IF('Pro Stock'!E10=0," ",'Pro Stock'!E10) ->  | F6: ='Pro Stock'!Z10 -> 34 | H6: ='Super Stock'!A10 -> 4 | I6: ='Super Stock'!B10 -> Scott Bye | J6: =IF('Super Stock'!C10=0," ",'Super Stock'!C10) -> NP | K6: ='Super Stock'!D10 -> 11-365 | L6: =IF('Super Stock'!E10=0," ",'Super Stock'!E10) -> Fired Up | M6: ='Super Stock'!Z10 -> 27 | O6: 112 | P6: Annette Sullivan | Q6: MVP | R6: 11-122 | S6: Just Relax | T6: 250
A7: ='Pro Stock'!A11 -> 5 | B7: ='Pro Stock'!B11 -> Larry Fox | C7: =IF('Pro Stock'!C11=0," ",'Pro Stock'!C11) -> JRS | D7: ='Pro Stock'!D11 -> 11-007 | E7: =IF('Pro Stock'!E11=0," ",'Pro Stock'!E11) -> Intimidation | F7: ='Pro Stock'!Z11 -> 46 | H7: ='Super Stock'!A11 -> 5 | I7: ='Super Stock'!B11 -> Russ Nichols | J7: =IF('Super Stock'!C11=0," ",'Super Stock'!C11) -> NP | K7: ='Super Stock'!D11 -> 11-069 | L7: =IF('Super Stock'!E11=0," ",'Super Stock'!E11) -> Top Secret | M7: ='Super Stock'!Z11 -> 39 | O7: 113 | P7: Doug Maier | Q7: JW | R7: 11-158 | S7: Thumper | T7: 250
A8: ='Pro Stock'!A12 -> 6 | B8: ='Pro Stock'!B12 -> Randy Demers | C8: =IF('Pro Stock'!C12=0," ",'Pro Stock'!C12) -> NP | D8: ='Pro Stock'!D12 -> 11-085 | E8: =IF('Pro Stock'!E12=0," ",'Pro Stock'!E12) -> Widowmaker | F8: ='Pro Stock'!Z12 -> 58 | H8: ='Super Stock'!A12 -> 6 | I8: ='Super Stock'!B12 -> Billy Black | J8: =IF('Super Stock'!C12=0," ",'Super Stock'!C12) -> NP | K8: ='Super Stock'!D12 -> 11-044 | L8: =IF('Super Stock'!E12=0," ",'Super Stock'!E12) -> Lots of Nichols | M8: ='Super Stock'!Z12 -> 50 | O8: 114 | P8: Larry Hunter | R8: 11-220 | S8: Blue Licker | T8: 250
A9: ='Pro Stock'!A13 -> 7 | B9: ='Pro Stock'!B13 -> Julian Stahl | C9: =IF('Pro Stock'!C13=0," ",'Pro Stock'!C13) -> MVP | D9: ='Pro Stock'!D13 -> 11-002 | E9: =IF('Pro Stock'!E13=0," ",'Pro Stock'!E13) -> MWSC #2 | F9: ='Pro Stock'!Z13 -> 61 | H9: ='Super Stock'!A13 -> 7 | I9: ='Super Stock'!B13 -> Julian Stahl | J9: =IF('Super Stock'!C13=0," ",'Super Stock'!C13) -> MVP | K9: ='Super Stock'!D13 -> 11-001 | L9: =IF('Super Stock'!E13=0," ",'Super Stock'!E13) -> MWSC #1 | M9: ='Super Stock'!Z13 -> 68 | O9: 115 | P9: Mark Cessna | Q9: NP | R9: 11-378 | S9: Time and Money | T9: 250
A10: ='Pro Stock'!A14 -> 8 | B10: ='Pro Stock'!B14 -> Nick Mishler | C10: =IF('Pro Stock'!C14=0," ",'Pro Stock'!C14) -> GTP | D10: ='Pro Stock'!D14 -> 11-167 | E10: =IF('Pro Stock'!E14=0," ",'Pro Stock'!E14) -> Pulse | F10: ='Pro Stock'!Z14 -> 63 | H10: ='Super Stock'!A14 -> 8 | I10: ='Super Stock'!B14 -> Steve Williford | J10: =IF('Super Stock'!C14=0," ",'Super Stock'!C14) -> MVP | K10: ='Super Stock'!D14 -> 11-276 | L10: =IF('Super Stock'!E14=0," ",'Super Stock'!E14) -> International Express | M10: ='Super Stock'!Z14 -> 70 | O10: 116 | P10: Morgan Cessna | Q10: NP | R10: 11-390 | S10: Look Out | T10: 250
A11: ='Pro Stock'!A15 -> 9 | B11: ='Pro Stock'!B15 -> Billy Black | C11: =IF('Pro Stock'!C15=0," ",'Pro Stock'!C15) -> NP | D11: ='Pro Stock'!D15 -> 11-044 | E11: =IF('Pro Stock'!E15=0," ",'Pro Stock'!E15) -> Lots of Nichols | F11: ='Pro Stock'!Z15 -> 68 | H11: ='Super Stock'!A15 -> 9 | I11: ='Super Stock'!B15 -> Julian Stahl | J11: =IF('Super Stock'!C15=0," ",'Super Stock'!C15) -> MVP | K11: ='Super Stock'!D15 -> 11-002 | L11: =IF('Super Stock'!E15=0," ",'Super Stock'!E15) -> MWSC# 2 | M11: ='Super Stock'!Z15 -> 78 | O11: 117 | P11: Scott Goodman | R11: 11-402 | S11: The Mule | T11: 250
A12: ='Pro Stock'!A16 -> 10 | B12: ='Pro Stock'!B16 -> Nathan Nichols | C12: =IF('Pro Stock'!C16=0," ",'Pro Stock'!C16) -> LR | D12: ='Pro Stock'!D16 -> 11-151 | E12: =IF('Pro Stock'!E16=0," ",'Pro Stock'!E16) -> Wildstreak | F12: ='Pro Stock'!Z16 -> 72 | H12: ='Super Stock'!A16 -> 10 | I12: ='Super Stock'!B16 -> Ed Nichols | J12: =IF('Super Stock'!C16=0," ",'Super Stock'!C16) -> LR | K12: ='Super Stock'!D16 -> 11-124 | L12: =IF('Super Stock'!E16=0," ",'Super Stock'!E16) -> Track Attack | M12: ='Super Stock'!Z16 -> 87 | O12: 118 | P12: Corey McClung | Q12: JRS | R12: 11-038 | S12: Fuel Fire & Attitude | T12: 251
A13: ='Pro Stock'!A17 -> 11 | B13: ='Pro Stock'!B17 -> Jerry Skuta | C13: =IF('Pro Stock'!C17=0," ",'Pro Stock'!C17) -> NP | D13: ='Pro Stock'!D17 -> 11-329 | E13: =IF('Pro Stock'!E17=0," ",'Pro Stock'!E17) -> Green Tractor | F13: ='Pro Stock'!Z17 -> 75 | H13: ='Super Stock'!A17 -> 11 | I13: ='Super Stock'!B17 -> Larry Curtsinger | J13: =IF('Super Stock'!C17=0," ",'Super Stock'!C17) -> NP | K13: ='Super Stock'!D17 -> 11-009 | L13: =IF('Super Stock'!E17=0," ",'Super Stock'!E17) -> Runaway Deere | M13: ='Super Stock'!Z17 -> 94 | O13: 119 | P13: Gary McDonald | Q13: Leffler | R13: 11-093 | S13: Plus Risky | T13: 251
A14: ='Pro Stock'!A18 -> 12 | B14: ='Pro Stock'!B18 -> Steve Williford | C14: =IF('Pro Stock'!C18=0," ",'Pro Stock'!C18) -> MVP | D14: ='Pro Stock'!D18 -> 11-276 | E14: =IF('Pro Stock'!E18=0," ",'Pro Stock'!E18) -> International Express | F14: ='Pro Stock'!Z18 -> 76 | H14: ='Super Stock'!A18 -> 12 | I14: ='Super Stock'!B18 -> Greg Curtsinger | J14: =IF('Super Stock'!C18=0," ",'Super Stock'!C18) -> NP | K14: ='Super Stock'!D18 -> 11-008 | L14: =IF('Super Stock'!E18=0," ",'Super Stock'!E18) -> Wicked Deere | M14: ='Super Stock'!Z18 -> 98 | O14: 120 | P14: Mike Mason | Q14: NP | R14: 11-138 | S14: Totally Frustrated | T14: 251
A15: ='Pro Stock'!A19 -> 13 | B15: ='Pro Stock'!B19 -> Kevin Root | C15: =IF('Pro Stock'!C19=0," ",'Pro Stock'!C19) -> Roots | D15: ='Pro Stock'!D19 -> 11-118 | E15: =IF('Pro Stock'!E19=0," ",'Pro Stock'!E19) -> Slapshot | F15: ='Pro Stock'!Z19 -> 82 | H15: ='Super Stock'!A19 -> 13 | I15: ='Super Stock'!B19 -> Nick Mishler | J15: =IF('Super Stock'!C19=0," ",'Super Stock'!C19) -> GTP | K15: ='Super Stock'!D19 -> 11-167 | L15: =IF('Super Stock'!E19=0," ",'Super Stock'!E19) -> Pulse | M15: ='Super Stock'!Z19 -> 104 | O15: 121 | P15: Logan Cessna | Q15: NP | R15: 11-389 | S15: Adrenaline | T15: 251
A16: ='Pro Stock'!A20 -> 14 | B16: ='Pro Stock'!B20 -> Harrison Stahl | C16: =IF('Pro Stock'!C20=0," ",'Pro Stock'!C20) -> MVP | D16: ='Pro Stock'!D20 -> 11-335 | E16: =IF('Pro Stock'!E20=0," ",'Pro Stock'!E20) -> MWSC #3 | F16: ='Pro Stock'!Z20 -> 93 | H16: ='Super Stock'!A20 -> 14 | I16: ='Super Stock'!B20 -> Steve Christman | J16: =IF('Super Stock'!C20=0," ",'Super Stock'!C20) -> Hackman | K16: ='Super Stock'!D20 -> 11-026 | L16: =IF('Super Stock'!E20=0," ",'Super Stock'!E20) -> JD 330 | M16: ='Super Stock'!Z20 -> 111 | O16: 122 | P16: Aaron Scroggins | Q16: VM | R16: 11-419 | S16: Gambler | T16: 251
A17: ='Pro Stock'!A21 -> 15 | B17: ='Pro Stock'!B21 -> Greg Watson | C17: =IF('Pro Stock'!C21=0," ",'Pro Stock'!C21) -> LR | D17: ='Pro Stock'!D21 -> 11-079 | E17: =IF('Pro Stock'!E21=0," ",'Pro Stock'!E21) -> Bear-ly Legal | F17: ='Pro Stock'!Z21 -> 94 | H17: ='Super Stock'!A21 -> 15 | I17: ='Super Stock'!B21 -> Don Vogt | J17: =IF('Super Stock'!C21=0," ",'Super Stock'!C21) -> MVP | K17: ='Super Stock'!D21 -> 11-090 | L17: =IF('Super Stock'!E21=0," ",'Super Stock'!E21) -> Not A Nuff | M17: ='Super Stock'!Z21 -> 117 | O17: 123 | P17: Dalton Cassady | R17: 11-420 | S17: Special Addiction | T17: 251
A18: ='Pro Stock'!A22 -> 16 | B18: ='Pro Stock'!B22 -> Greg Curtsinger | C18: =IF('Pro Stock'!C22=0," ",'Pro Stock'!C22) -> NP | D18: ='Pro Stock'!D22 -> 11-008 | E18: =IF('Pro Stock'!E22=0," ",'Pro Stock'!E22) -> Wicked Deere | F18: ='Pro Stock'!Z22 -> 98 | H18: ='Super Stock'!A22 -> 16 | I18: ='Super Stock'!B22 -> Larry Fox | J18: =IF('Super Stock'!C22=0," ",'Super Stock'!C22) -> JRS | K18: ='Super Stock'!D22 -> 11-007 | L18: =IF('Super Stock'!E22=0," ",'Super Stock'!E22) -> Intimidation | M18: ='Super Stock'!Z22 -> 123 | O18: 124 | P18: Jake Gingerich | Q18: JW | R18: 11-023 | S18: Royal Pain | T18: 252
A19: ='Pro Stock'!A23 -> 17 | B19: ='Pro Stock'!B23 -> Steve Chrisman | C19: =IF('Pro Stock'!C23=0," ",'Pro Stock'!C23) -> Hackman | D19: ='Pro Stock'!D23 -> 11-026 | E19: =IF('Pro Stock'!E23=0," ",'Pro Stock'!E23) -> 330 Deere | F19: ='Pro Stock'!Z23 -> 101 | H19: ='Super Stock'!A23 -> 17 | I19: ='Super Stock'!B23 -> Matt Kaster | J19: =IF('Super Stock'!C23=0," ",'Super Stock'!C23) -> MVP | K19: ='Super Stock'!D23 -> 11-332 | L19: =IF('Super Stock'!E23=0," ",'Super Stock'!E23) -> Double XL | M19: ='Super Stock'!Z23 -> 128 | O19: 125 | P19: Daryl Musser | Q19: NP | R19: 11-396 | S19: 5 Cents | T19: 252
A20: ='Pro Stock'!A24 -> 18 | B20: ='Pro Stock'!B24 -> Eli Zimmerman | C20: =IF('Pro Stock'!C24=0," ",'Pro Stock'!C24) -> NP | D20: ='Pro Stock'!D24 -> 11-074 | E20: =IF('Pro Stock'!E24=0," ",'Pro Stock'!E24) -> Red Fever | F20: ='Pro Stock'!Z24 -> 105 | H20: ='Super Stock'!A24 -> 18 | I20: ='Super Stock'!B24 -> Steve Burton | J20: =IF('Super Stock'!C24=0," ",'Super Stock'!C24) -> NP | K20: ='Super Stock'!D24 -> 11-015 | L20: =IF('Super Stock'!E24=0," ",'Super Stock'!E24) -> 6 Shooter | M20: ='Super Stock'!Z24 -> 129 | O20: 126 | P20: Todd Glover | Q20: NP | R20: 11-386 | S20: TNT Express | T20: 253
A21: ='Pro Stock'!A25 -> 19 | B21: ='Pro Stock'!B25 -> Ed Nichols | C21: =IF('Pro Stock'!C25=0," ",'Pro Stock'!C25) -> LR | D21: ='Pro Stock'!D25 -> 11-124 | E21: =IF('Pro Stock'!E25=0," ",'Pro Stock'!E25) -> Track Attack | F21: ='Pro Stock'!Z25 -> 106 | H21: ='Super Stock'!A25 -> 19 | I21: ='Super Stock'!B25 -> Charlie Ciolino | J21: =IF('Super Stock'!C25=0," ",'Super Stock'!C25) -> MVP | K21: ='Super Stock'!D25 -> 11-145 | L21: =IF('Super Stock'!E25=0," ",'Super Stock'!E25) -> Mechanical Nitemare | M21: ='Super Stock'!Z25 -> 139 | O21: 127 | P21: William Lewis | Q21: Hackman | R21: 11-392 | S21: Wide Open | T21: 253
A22: ='Pro Stock'!A26 -> 20 | B22: ='Pro Stock'!B26 -> Steve Burton | C22: =IF('Pro Stock'!C26=0," ",'Pro Stock'!C26) -> NP | D22: ='Pro Stock'!D26 -> 11-015 | E22: =IF('Pro Stock'!E26=0," ",'Pro Stock'!E26) -> 6 Shooter | F22: ='Pro Stock'!Z26 -> 109 | H22: ='Super Stock'!A26 -> 20 | I22: ='Super Stock'!B26 -> Kevin Root | J22: =IF('Super Stock'!C26=0," ",'Super Stock'!C26) -> Root | K22: ='Super Stock'!D26 -> 11-118 | L22: =IF('Super Stock'!E26=0," ",'Super Stock'!E26) -> Slapshot | M22: ='Super Stock'!Z26 -> 140 | O22: 128 | P22: Mike Hall | Q22: RPM | R22: 11-401 | S22: Billet Binder | T22: 253
A23: ='Pro Stock'!A27 -> 21 | B23: ='Pro Stock'!B27 -> Steve Williford | C23: =IF('Pro Stock'!C27=0," ",'Pro Stock'!C27) -> MVP | D23: ='Pro Stock'!D27 -> 11-337 | E23: =IF('Pro Stock'!E27=0," ",'Pro Stock'!E27) -> IH Express | F23: ='Pro Stock'!Z27 -> 111 | H23: ='Super Stock'!A27 -> 21 | I23: ='Super Stock'!B27 -> Harrison Stahl | J23: =IF('Super Stock'!C27=0," ",'Super Stock'!C27) -> MVP | K23: ='Super Stock'!D27 -> 11-335 | L23: =IF('Super Stock'!E27=0," ",'Super Stock'!E27) -> MWSC #3 | M23: ='Super Stock'!Z27 -> 145 | O23: ='Super Stock'!A135 -> 129 | P23: ='Super Stock'!B135 -> Matt Gingerich | Q23: =IF('Super Stock'!C135=0," ",'Super Stock'!C135) -> JW | R23: ='Super Stock'!D135 -> 11-018 | S23: =IF('Super Stock'!E135=0," ",'Super Stock'!E135) -> Thumper | T23: ='Super Stock'!Z135 -> 276
A24: ='Pro Stock'!A28 -> 22 | B24: ='Pro Stock'!B28 -> Steve Burton | C24: =IF('Pro Stock'!C28=0," ",'Pro Stock'!C28) -> NP | D24: ='Pro Stock'!D28 -> 11-014 | E24: =IF('Pro Stock'!E28=0," ",'Pro Stock'!E28) -> Bad Company | F24: ='Pro Stock'!Z28 -> 117 | H24: ='Super Stock'!A28 -> 22 | I24: ='Super Stock'!B28 -> Randy Demers | J24: =IF('Super Stock'!C28=0," ",'Super Stock'!C28) -> NP | K24: ='Super Stock'!D28 -> 11-085 | L24: =IF('Super Stock'!E28=0," ",'Super Stock'!E28) -> Widowmaker | M24: ='Super Stock'!Z28 -> 147 | O24: ='Super Stock'!A136 -> 130 | P24: ='Super Stock'!B136 -> Matt Gingerich | Q24: =IF('Super Stock'!C136=0," ",'Super Stock'!C136) -> JW | R24: ='Super Stock'!D136 -> 11-028 | S24: =IF('Super Stock'!E136=0," ",'Super Stock'!E136) -> Silver Fox | T24: ='Super Stock'!Z136 -> 284
A25: ='Pro Stock'!A29 -> 23 | B25: ='Pro Stock'!B29 -> Larry Curtsinger | C25: =IF('Pro Stock'!C29=0," ",'Pro Stock'!C29) -> NP | D25: ='Pro Stock'!D29 -> 11-009 | E25: =IF('Pro Stock'!E29=0," ",'Pro Stock'!E29) -> Runaway Deere | F25: ='Pro Stock'!Z29 -> 118 | H25: ='Super Stock'!A29 -> 23 | I25: ='Super Stock'!B29 -> Nathan Nichels | J25: =IF('Super Stock'!C29=0," ",'Super Stock'!C29) -> LR | K25: ='Super Stock'!D29 -> 11-151 | L25: =IF('Super Stock'!E29=0," ",'Super Stock'!E29) -> Wildstreak | M25: ='Super Stock'!Z29 -> 151 | O25: ='Super Stock'!A137 -> 131 | P25: ='Super Stock'!B137 -> Rick Mann | Q25: =IF('Super Stock'!C137=0," ",'Super Stock'!C137) -> TC | R25: ='Super Stock'!D137 -> 11-077 | S25: =IF('Super Stock'!E137=0," ",'Super Stock'!E137) -> Wildfire | T25: ='Super Stock'!Z137 -> 309
A26: ='Pro Stock'!A30 -> 24 | B26: ='Pro Stock'!B30 -> Kevin Roots | C26: =IF('Pro Stock'!C30=0," ",'Pro Stock'!C30) -> Roots | D26: ='Pro Stock'!D30 -> 11-117 | E26: =IF('Pro Stock'!E30=0," ",'Pro Stock'!E30) -> Right on the Money | F26: ='Pro Stock'!Z30 -> 124 | H26: ='Super Stock'!A30 -> 24 | I26: ='Super Stock'!B30 -> Steve Williford | J26: =IF('Super Stock'!C30=0," ",'Super Stock'!C30) -> MVP | K26: ='Super Stock'!D30 -> 11-176 | L26: =IF('Super Stock'!E30=0," ",'Super Stock'!E30) -> International | M26: ='Super Stock'!Z30 -> 160 | O26: ='Super Stock'!A138 -> 132 | P26: ='Super Stock'!B138 -> Morris Kemp | Q26: =IF('Super Stock'!C138=0," ",'Super Stock'!C138) -> JW | R26: ='Super Stock'!D138 -> 11-429 | S26: =IF('Super Stock'!E138=0," ",'Super Stock'!E138) -> Magnus Force | T26: ='Super Stock'!Z138 -> 307
A27: ='Pro Stock'!A31 -> 25 | B27: ='Pro Stock'!B31 -> Harrison Stahl | C27: =IF('Pro Stock'!C31=0," ",'Pro Stock'!C31) -> MVP | D27: ='Pro Stock'!D31 -> 11-336 | E27: =IF('Pro Stock'!E31=0," ",'Pro Stock'!E31) -> MWSC #4 | F27: ='Pro Stock'!Z31 -> 132 | H27: ='Super Stock'!A31 -> 25 | I27: ='Super Stock'!B31 -> Steve Williford | J27: =IF('Super Stock'!C31=0," ",'Super Stock'!C31) -> MVP | K27: ='Super Stock'!D31 -> 11-337 | L27: =IF('Super Stock'!E31=0," ",'Super Stock'!E31) -> IH Express | M27: ='Super Stock'!Z31 -> 162 | O27: ='Super Stock'!A139 -> 133 | P27: ='Super Stock'!B139 -> Morris Kemp | Q27: =IF('Super Stock'!C139=0," ",'Super Stock'!C139) -> JW | R27: ='Super Stock'!D139 -> 11-430 | S27: =IF('Super Stock'!E139=0," ",'Super Stock'!E139) -> King Pin | T27: ='Super Stock'!Z139 -> 307
A28: ='Pro Stock'!A32 -> 26 | B28: ='Pro Stock'!B32 -> Darin Morgenstern | C28: =IF('Pro Stock'!C32=0," ",'Pro Stock'!C32) -> JRS | D28: ='Pro Stock'!D32 -> 11-063 | E28: =IF('Pro Stock'!E32=0," ",'Pro Stock'!E32) -> Alky Hog | F28: ='Pro Stock'!Z32 -> 149 | H28: ='Super Stock'!A32 -> 26 | I28: ='Super Stock'!B32 -> Jerry Skuta | J28: =IF('Super Stock'!C32=0," ",'Super Stock'!C32) -> NP | K28: ='Super Stock'!D32 -> 11-329 | L28: =IF('Super Stock'!E32=0," ",'Super Stock'!E32) -> Green Tractor | M28: ='Super Stock'!Z32 -> 164 | O28: ='Super Stock'!A140 -> 134 | P28: ='Super Stock'!B140 -> Steve Cape | Q28: =IF('Super Stock'!C140=0," ",'Super Stock'!C140) -> MVP | R28: ='Super Stock'!D140 -> 11-432 | S28: =IF('Super Stock'!E140=0," ",'Super Stock'!E140) ->  | T28: ='Super Stock'!Z140 -> 309
A29: ='Pro Stock'!A33 -> 27 | B29: ='Pro Stock'!B33 -> Ray Gentz | C29: =IF('Pro Stock'!C33=0," ",'Pro Stock'!C33) -> JRS | D29: ='Pro Stock'!D33 -> 11-262 | E29: =IF('Pro Stock'!E33=0," ",'Pro Stock'!E33) -> Chaos | F29: ='Pro Stock'!Z33 -> 149 | H29: ='Super Stock'!A33 -> 27 | I29: ='Super Stock'!B33 -> Roger Davis | J29: =IF('Super Stock'!C33=0," ",'Super Stock'!C33) -> JRS | K29: ='Super Stock'!D33 -> 11-067 | L29: =IF('Super Stock'!E33=0," ",'Super Stock'!E33) -> NO LIMITS | M29: ='Super Stock'!Z33 -> 165 | O29: ='Super Stock'!A141 -> 135 | P29: ='Super Stock'!B141 -> Phil Burton | Q29: =IF('Super Stock'!C141=0," ",'Super Stock'!C141) -> Yager | R29: ='Super Stock'!D141 -> 0 | S29: =IF('Super Stock'!E141=0," ",'Super Stock'!E141) -> Goofy Express | T29: ='Super Stock'!Z141 -> 311
A30: ='Pro Stock'!A34 -> 28 | B30: ='Pro Stock'!B34 -> Mike Aschliman | C30: =IF('Pro Stock'!C34=0," ",'Pro Stock'!C34) -> MVP | D30: ='Pro Stock'!D34 -> 11-352 | E30: =IF('Pro Stock'!E34=0," ",'Pro Stock'!E34) -> Cub 122 | F30: ='Pro Stock'!Z34 -> 150 | H30: ='Super Stock'!A34 -> 28 | I30: ='Super Stock'!B34 -> Kevin Root | J30: =IF('Super Stock'!C34=0," ",'Super Stock'!C34) -> Root | K30: ='Super Stock'!D34 -> 11-117 | L30: =IF('Super Stock'!E34=0," ",'Super Stock'!E34) -> Right on the Money | M30: ='Super Stock'!Z34 -> 165
A31: ='Pro Stock'!A35 -> 29 | B31: ='Pro Stock'!B35 -> Mark Davis | C31: =IF('Pro Stock'!C35=0," ",'Pro Stock'!C35) -> JRS | D31: ='Pro Stock'!D35 -> 11-067 | E31: =IF('Pro Stock'!E35=0," ",'Pro Stock'!E35) -> NoLimits 2 | F31: ='Pro Stock'!Z35 -> 151 | H31: ='Super Stock'!A35 -> 29 | I31: ='Super Stock'!B35 -> Clyde Mishler | J31: =IF('Super Stock'!C35=0," ",'Super Stock'!C35) -> GTP | K31: ='Super Stock'!D35 -> 11-168 | L31: =IF('Super Stock'!E35=0," ",'Super Stock'!E35) ->  | M31: ='Super Stock'!Z35 -> 165
A32: ='Pro Stock'!A36 -> 30 | B32: ='Pro Stock'!B36 -> Steve Williford | C32: =IF('Pro Stock'!C36=0," ",'Pro Stock'!C36) -> MVP | D32: ='Pro Stock'!D36 -> 11-176 | E32: =IF('Pro Stock'!E36=0," ",'Pro Stock'!E36) -> International | F32: ='Pro Stock'!Z36 -> 153 | H32: ='Super Stock'!A36 -> 30 | I32: ='Super Stock'!B36 -> Andy Ferguson | J32: =IF('Super Stock'!C36=0," ",'Super Stock'!C36) -> MVP | K32: ='Super Stock'!D36 -> 11-343 | L32: =IF('Super Stock'!E36=0," ",'Super Stock'!E36) -> Border Patrol | M32: ='Super Stock'!Z36 -> 165
A33: ='Pro Stock'!A37 -> 31 | B33: ='Pro Stock'!B37 -> Matt Kaster | C33: =IF('Pro Stock'!C37=0," ",'Pro Stock'!C37) -> MVP | D33: ='Pro Stock'!D37 -> 11-332 | E33: =IF('Pro Stock'!E37=0," ",'Pro Stock'!E37) -> Double XL | F33: ='Pro Stock'!Z37 -> 155 | H33: ='Super Stock'!A37 -> 31 | I33: ='Super Stock'!B37 -> Matt Kaster | J33: =IF('Super Stock'!C37=0," ",'Super Stock'!C37) -> MVP | K33: ='Super Stock'!D37 -> 11-098 | L33: =IF('Super Stock'!E37=0," ",'Super Stock'!E37) -> Moose On The Loose | M33: ='Super Stock'!Z37 -> 168
A34: ='Pro Stock'!A38 -> 32 | B34: ='Pro Stock'!B38 -> Darlene Sample | C34: =IF('Pro Stock'!C38=0," ",'Pro Stock'!C38) -> LR | D34: ='Pro Stock'!D38 -> 11-202 | E34: =IF('Pro Stock'!E38=0," ",'Pro Stock'!E38) -> Dr Doom | F34: ='Pro Stock'!Z38 -> 164 | H34: ='Super Stock'!A38 -> 32 | I34: ='Super Stock'!B38 -> Steve Williford | J34: =IF('Super Stock'!C38=0," ",'Super Stock'!C38) -> MVP | K34: ='Super Stock'!D38 -> 11-177 | L34: =IF('Super Stock'!E38=0," ",'Super Stock'!E38) -> IH Trucking | M34: ='Super Stock'!Z38 -> 174
A35: ='Pro Stock'!A39 -> 33 | B35: ='Pro Stock'!B39 -> Don Vogt | C35: =IF('Pro Stock'!C39=0," ",'Pro Stock'!C39) -> MVP | D35: ='Pro Stock'!D39 -> 11-090 | E35: =IF('Pro Stock'!E39=0," ",'Pro Stock'!E39) -> Not A Nuff | F35: ='Pro Stock'!Z39 -> 176 | H35: ='Super Stock'!A39 -> 33 | I35: ='Super Stock'!B39 -> Steve Chrisman | J35: =IF('Super Stock'!C39=0," ",'Super Stock'!C39) -> Hackman | K35: ='Super Stock'!D39 -> 11-218 | L35: =IF('Super Stock'!E39=0," ",'Super Stock'!E39) -> Purple | M35: ='Super Stock'!Z39 -> 174
A36: ='Pro Stock'!A40 -> 34 | B36: ='Pro Stock'!B40 -> Steve Williford | C36: =IF('Pro Stock'!C40=0," ",'Pro Stock'!C40) -> MVP | D36: ='Pro Stock'!D40 -> 11-177 | E36: =IF('Pro Stock'!E40=0," ",'Pro Stock'!E40) -> IH Trucking | F36: ='Pro Stock'!Z40 -> 178 | H36: ='Super Stock'!A40 -> 34 | I36: ='Super Stock'!B40 -> Charles Aschliman | J36: =IF('Super Stock'!C40=0," ",'Super Stock'!C40) -> MVP | K36: ='Super Stock'!D40 -> 11-352 | L36: =IF('Super Stock'!E40=0," ",'Super Stock'!E40) -> Cub 122 | M36: ='Super Stock'!Z40 -> 174
A37: ='Pro Stock'!A41 -> 35 | B37: ='Pro Stock'!B41 -> Tim Bristol | C37: =IF('Pro Stock'!C41=0," ",'Pro Stock'!C41) -> MVP | D37: ='Pro Stock'!D41 -> 11-363 | E37: =IF('Pro Stock'!E41=0," ",'Pro Stock'!E41) -> John Deere | F37: ='Pro Stock'!Z41 -> 179 | H37: ='Super Stock'!A41 -> 35 | I37: ='Super Stock'!B41 -> Michael Ciolino | J37: =IF('Super Stock'!C41=0," ",'Super Stock'!C41) -> MVP | K37: ='Super Stock'!D41 -> 11-146 | L37: =IF('Super Stock'!E41=0," ",'Super Stock'!E41) -> Mechanical Animal | M37: ='Super Stock'!Z41 -> 188
A38: ='Pro Stock'!A42 -> 36 | B38: ='Pro Stock'!B42 -> John Donavan | C38: =IF('Pro Stock'!C42=0," ",'Pro Stock'!C42) -> JRS | D38: ='Pro Stock'!D42 -> 11-006 | E38: =IF('Pro Stock'!E42=0," ",'Pro Stock'!E42) -> Patience | F38: ='Pro Stock'!Z42 -> 180 | H38: ='Super Stock'!A42 -> 36 | I38: ='Super Stock'!B42 -> Bruce Austin | J38: =IF('Super Stock'!C42=0," ",'Super Stock'!C42) -> MVP | K38: ='Super Stock'!D42 -> 11-338 | L38: =IF('Super Stock'!E42=0," ",'Super Stock'!E42) -> Hillbilly Headache | M38: ='Super Stock'!Z42 -> 188
A39: ='Pro Stock'!A43 -> 37 | B39: ='Pro Stock'!B43 -> Gerald Kerber | C39: =IF('Pro Stock'!C43=0," ",'Pro Stock'!C43) -> NP | D39: ='Pro Stock'!D43 -> 11-175 | E39: =IF('Pro Stock'!E43=0," ",'Pro Stock'!E43) -> Wisconsin Hooker | F39: ='Pro Stock'!Z43 -> 180 | H39: ='Super Stock'!A43 -> 37 | I39: ='Super Stock'!B43 -> Dave Gawatz | J39: =IF('Super Stock'!C43=0," ",'Super Stock'!C43) -> JW | K39: ='Super Stock'!D43 -> 11-184 | L39: =IF('Super Stock'!E43=0," ",'Super Stock'!E43) -> Low Hung Buck | M39: ='Super Stock'!Z43 -> 189
A40: ='Pro Stock'!A44 -> 38 | B40: ='Pro Stock'!B44 -> Tyler Hackman | C40: =IF('Pro Stock'!C44=0," ",'Pro Stock'!C44) -> Hackman | D40: ='Pro Stock'!D44 -> 11-342 | E40: =IF('Pro Stock'!E44=0," ",'Pro Stock'!E44) -> Green | F40: ='Pro Stock'!Z44 -> 180 | H40: ='Super Stock'!A44 -> 38 | I40: ='Super Stock'!B44 -> Erik Pike | J40: =IF('Super Stock'!C44=0," ",'Super Stock'!C44) -> VM | K40: ='Super Stock'!D44 -> 11-353 | L40: =IF('Super Stock'!E44=0," ",'Super Stock'!E44) -> Too Blue | M40: ='Super Stock'!Z44 -> 189
A41: ='Pro Stock'!A45 -> 39 | B41: ='Pro Stock'!B45 -> Jerry Skuta | C41: =IF('Pro Stock'!C45=0," ",'Pro Stock'!C45) -> NP | D41: ='Pro Stock'!D45 -> 11-330 | E41: =IF('Pro Stock'!E45=0," ",'Pro Stock'!E45) -> Mental Health 2 | F41: ='Pro Stock'!Z45 -> 182 | H41: ='Super Stock'!A45 -> 39 | I41: ='Super Stock'!B45 -> Bradley Corzine | J41: =IF('Super Stock'!C45=0," ",'Super Stock'!C45) -> JW | K41: ='Super Stock'!D45 -> 11-368 | L41: =IF('Super Stock'!E45=0," ",'Super Stock'!E45) -> Just Black | M41: ='Super Stock'!Z45 -> 193
A42: ='Pro Stock'!A46 -> 40 | B42: ='Pro Stock'!B46 -> Bruce Austin | C42: =IF('Pro Stock'!C46=0," ",'Pro Stock'!C46) -> MVP | D42: ='Pro Stock'!D46 -> 11-338 | E42: =IF('Pro Stock'!E46=0," ",'Pro Stock'!E46) -> Hillbilly Headache | F42: ='Pro Stock'!Z46 -> 195 | H42: ='Super Stock'!A46 -> 40 | I42: ='Super Stock'!B46 -> Ray Gentz | J42: =IF('Super Stock'!C46=0," ",'Super Stock'!C46) -> JRS | K42: ='Super Stock'!D46 -> 11-262 | L42: =IF('Super Stock'!E46=0," ",'Super Stock'!E46) -> Chaos | M42: ='Super Stock'!Z46 -> 194
A43: ='Pro Stock'!A47 -> 41 | B43: ='Pro Stock'!B47 -> Charlie Ciolino | C43: =IF('Pro Stock'!C47=0," ",'Pro Stock'!C47) -> MVP | D43: ='Pro Stock'!D47 -> 11-145 | E43: =IF('Pro Stock'!E47=0," ",'Pro Stock'!E47) -> Mechanical Nitemare | F43: ='Pro Stock'!Z47 -> 197 | H43: ='Super Stock'!A47 -> 41 | I43: ='Super Stock'!B47 -> Greg Watson | J43: =IF('Super Stock'!C47=0," ",'Super Stock'!C47) -> LR | K43: ='Super Stock'!D47 -> 11-079 | L43: =IF('Super Stock'!E47=0," ",'Super Stock'!E47) -> Bear-ly Legal | M43: ='Super Stock'!Z47 -> 199
A44: ='Pro Stock'!A48 -> 42 | B44: ='Pro Stock'!B48 -> Jerry Binkley | C44: =IF('Pro Stock'!C48=0," ",'Pro Stock'!C48) -> MVP | D44: ='Pro Stock'!D48 -> 11-092 | E44: =IF('Pro Stock'!E48=0," ",'Pro Stock'!E48) -> Grandpa's Toy | F44: ='Pro Stock'!Z48 -> 198 | H44: ='Super Stock'!A48 -> 42 | I44: ='Super Stock'!B48 -> Jerry Binkley | J44: =IF('Super Stock'!C48=0," ",'Super Stock'!C48) -> MVP | K44: ='Super Stock'!D48 -> 11-092 | L44: =IF('Super Stock'!E48=0," ",'Super Stock'!E48) -> Grandpa's Toy | M44: ='Super Stock'!Z48 -> 199
A45: ='Pro Stock'!A49 -> 43 | B45: ='Pro Stock'!B49 -> Dave Gawatz | C45: =IF('Pro Stock'!C49=0," ",'Pro Stock'!C49) -> JW | D45: ='Pro Stock'!D49 -> 11-184 | E45: =IF('Pro Stock'!E49=0," ",'Pro Stock'!E49) -> Low Hung Buck | F45: ='Pro Stock'!Z49 -> 202 | H45: ='Super Stock'!A49 -> 43 | I45: ='Super Stock'!B49 -> Charlie Schultz | J45: =IF('Super Stock'!C49=0," ",'Super Stock'!C49) -> MVP | K45: ='Super Stock'!D49 -> 11-101 | L45: =IF('Super Stock'!E49=0," ",'Super Stock'!E49) -> Lotta Stones | M45: ='Super Stock'!Z49 -> 200
A46: ='Pro Stock'!A50 -> 44 | B46: ='Pro Stock'!B50 -> Charlie Schultz | C46: =IF('Pro Stock'!C50=0," ",'Pro Stock'!C50) -> MVP | D46: ='Pro Stock'!D50 -> 11-101 | E46: =IF('Pro Stock'!E50=0," ",'Pro Stock'!E50) -> Alotta Stones | F46: ='Pro Stock'!Z50 -> 203 | H46: ='Super Stock'!A50 -> 44 | I46: ='Super Stock'!B50 -> Jim Morgenstern | J46: =IF('Super Stock'!C50=0," ",'Super Stock'!C50) -> JRS | K46: ='Super Stock'!D50 -> 11-063 | L46: =IF('Super Stock'!E50=0," ",'Super Stock'!E50) -> Alky Hog | M46: ='Super Stock'!Z50 -> 201
A47: ='Pro Stock'!A51 -> 45 | B47: ='Pro Stock'!B51 -> Shawn Vogler | C47: =IF('Pro Stock'!C51=0," ",'Pro Stock'!C51) -> JRS | D47: ='Pro Stock'!D51 -> 11-129 | E47: =IF('Pro Stock'!E51=0," ",'Pro Stock'!E51) -> Renegade | F47: ='Pro Stock'!Z51 -> 206 | H47: ='Super Stock'!A51 -> 45 | I47: ='Super Stock'!B51 -> Eli Zimmerman | J47: =IF('Super Stock'!C51=0," ",'Super Stock'!C51) -> NP | K47: ='Super Stock'!D51 -> 11-074 | L47: =IF('Super Stock'!E51=0," ",'Super Stock'!E51) -> Red Fever | M47: ='Super Stock'!Z51 -> 202
A48: ='Pro Stock'!A52 -> 46 | B48: ='Pro Stock'!B52 -> Michael Ciolino | C48: =IF('Pro Stock'!C52=0," ",'Pro Stock'!C52) -> MVP | D48: ='Pro Stock'!D52 -> 11-146 | E48: =IF('Pro Stock'!E52=0," ",'Pro Stock'!E52) -> Mechanical Animal | F48: ='Pro Stock'!Z52 -> 206 | H48: ='Super Stock'!A52 -> 46 | I48: ='Super Stock'!B52 -> John Donavan | J48: =IF('Super Stock'!C52=0," ",'Super Stock'!C52) -> JRS | K48: ='Super Stock'!D52 -> 11-006 | L48: =IF('Super Stock'!E52=0," ",'Super Stock'!E52) -> Patience | M48: ='Super Stock'!Z52 -> 206
A49: ='Pro Stock'!A53 -> 47 | B49: ='Pro Stock'!B53 -> Steve Chrisman | C49: =IF('Pro Stock'!C53=0," ",'Pro Stock'!C53) -> Hackman | D49: ='Pro Stock'!D53 -> 11-218 | E49: =IF('Pro Stock'!E53=0," ",'Pro Stock'!E53) ->  | F49: ='Pro Stock'!Z53 -> 208 | H49: ='Super Stock'!A53 -> 47 | I49: ='Super Stock'!B53 -> Scott Larkins | J49: =IF('Super Stock'!C53=0," ",'Super Stock'!C53) -> JRS | K49: ='Super Stock'!D53 -> 11-154 | L49: =IF('Super Stock'!E53=0," ",'Super Stock'!E53) -> Yosemite Sam | M49: ='Super Stock'!Z53 -> 209
A50: ='Pro Stock'!A54 -> 48 | B50: ='Pro Stock'!B54 -> Jeff Chrisman | C50: =IF('Pro Stock'!C54=0," ",'Pro Stock'!C54) -> JW | D50: ='Pro Stock'!D54 -> 11-180 | E50: =IF('Pro Stock'!E54=0," ",'Pro Stock'!E54) ->  | F50: ='Pro Stock'!Z54 -> 211 | H50: ='Super Stock'!A54 -> 48 | I50: ='Super Stock'!B54 -> Carla Morgenstern | J50: =IF('Super Stock'!C54=0," ",'Super Stock'!C54) -> JRS | K50: ='Super Stock'!D54 -> 11-216 | L50: =IF('Super Stock'!E54=0," ",'Super Stock'!E54) -> High Maintenance | M50: ='Super Stock'!Z54 -> 209
A51: ='Pro Stock'!A55 -> 49 | B51: ='Pro Stock'!B55 -> Tyler Hackman | C51: =IF('Pro Stock'!C55=0," ",'Pro Stock'!C55) -> Hackman | D51: ='Pro Stock'!D55 -> 11-052 | E51: =IF('Pro Stock'!E55=0," ",'Pro Stock'!E55) -> Yellow | F51: ='Pro Stock'!Z55 -> 212 | H51: ='Super Stock'!A55 -> 49 | I51: ='Super Stock'!B55 -> Robert Vogel | J51: =IF('Super Stock'!C55=0," ",'Super Stock'!C55) -> VM | K51: ='Super Stock'!D55 -> 11-361 | L51: =IF('Super Stock'!E55=0," ",'Super Stock'!E55) -> Diggers Farmall Too | M51: ='Super Stock'!Z55 -> 212
A52: ='Pro Stock'!A56 -> 50 | B52: ='Pro Stock'!B56 -> Andy Ferguson | C52: =IF('Pro Stock'!C56=0," ",'Pro Stock'!C56) -> MVP | D52: ='Pro Stock'!D56 -> 11-343 | E52: =IF('Pro Stock'!E56=0," ",'Pro Stock'!E56) -> Border Patrol | F52: ='Pro Stock'!Z56 -> 212 | H52: ='Super Stock'!A56 -> 50 | I52: ='Super Stock'!B56 -> Tim Bristol | J52: =IF('Super Stock'!C56=0," ",'Super Stock'!C56) -> MVP | K52: ='Super Stock'!D56 -> 11-363 | L52: =IF('Super Stock'!E56=0," ",'Super Stock'!E56) -> John Deere | M52: ='Super Stock'!Z56 -> 212
A53: ='Pro Stock'!A57 -> 51 | B53: ='Pro Stock'!B57 -> Bradley Corzine | C53: =IF('Pro Stock'!C57=0," ",'Pro Stock'!C57) -> JW | D53: ='Pro Stock'!D57 -> 11-368 | E53: =IF('Pro Stock'!E57=0," ",'Pro Stock'!E57) -> Just Black | F53: ='Pro Stock'!Z57 -> 217 | H53: ='Super Stock'!A57 -> 51 | I53: ='Super Stock'!B57 -> David Mascher Sr | J53: =IF('Super Stock'!C57=0," ",'Super Stock'!C57) ->  | K53: ='Super Stock'!D57 -> 11-163 | L53: =IF('Super Stock'!E57=0," ",'Super Stock'!E57) ->  | M53: ='Super Stock'!Z57 -> 213
A54: ='Pro Stock'!A58 -> 52 | B54: ='Pro Stock'!B58 -> Mark Conover | C54: =IF('Pro Stock'!C58=0," ",'Pro Stock'!C58) -> VM | D54: ='Pro Stock'!D58 -> 11-360 | E54: =IF('Pro Stock'!E58=0," ",'Pro Stock'!E58) ->  | F54: ='Pro Stock'!Z58 -> 219 | H54: ='Super Stock'!A58 -> 52 | I54: ='Super Stock'!B58 -> Shane Heits | J54: =IF('Super Stock'!C58=0," ",'Super Stock'!C58) -> Heits | K54: ='Super Stock'!D58 -> 11-366 | L54: =IF('Super Stock'!E58=0," ",'Super Stock'!E58) -> Custom Cub | M54: ='Super Stock'!Z58 -> 220
A55: ='Pro Stock'!A59 -> 53 | B55: ='Pro Stock'!B59 -> Bruce Austin | C55: =IF('Pro Stock'!C59=0," ",'Pro Stock'!C59) -> MVP | D55: ='Pro Stock'!D59 -> 11-277 | E55: =IF('Pro Stock'!E59=0," ",'Pro Stock'!E59) -> Cap'N Crunch | F55: ='Pro Stock'!Z59 -> 228 | H55: ='Super Stock'!A59 -> 53 | I55: ='Super Stock'!B59 -> Jerry Skuta | J55: =IF('Super Stock'!C59=0," ",'Super Stock'!C59) -> NP | K55: ='Super Stock'!D59 -> 11-330 | L55: =IF('Super Stock'!E59=0," ",'Super Stock'!E59) -> Mental Health 2 | M55: ='Super Stock'!Z59 -> 223
A56: ='Pro Stock'!A60 -> 54 | B56: ='Pro Stock'!B60 -> James Evans | C56: =IF('Pro Stock'!C60=0," ",'Pro Stock'!C60) -> NP | D56: ='Pro Stock'!D60 -> 11-223 | E56: =IF('Pro Stock'!E60=0," ",'Pro Stock'!E60) -> Hammer Down | F56: ='Pro Stock'!Z60 -> 229 | H56: ='Super Stock'!A60 -> 54 | I56: ='Super Stock'!B60 -> Bille Nippe | J56: =IF('Super Stock'!C60=0," ",'Super Stock'!C60) -> JW | K56: ='Super Stock'!D60 -> 11-150 | L56: =IF('Super Stock'!E60=0," ",'Super Stock'!E60) -> Serious Busness | M56: ='Super Stock'!Z60 -> 225
A57: ='Pro Stock'!A61 -> 55 | B57: ='Pro Stock'!B61 -> Ronald Marcine | C57: =IF('Pro Stock'!C61=0," ",'Pro Stock'!C61) -> MVP | D57: ='Pro Stock'!D61 -> 11-245 | E57: =IF('Pro Stock'!E61=0," ",'Pro Stock'!E61) -> No Pressure | F57: ='Pro Stock'!Z61 -> 231 | H57: ='Super Stock'!A61 -> 55 | I57: ='Super Stock'!B61 -> Jeff Chrisman | J57: =IF('Super Stock'!C61=0," ",'Super Stock'!C61) -> VW | K57: ='Super Stock'!D61 -> 11-180 | L57: =IF('Super Stock'!E61=0," ",'Super Stock'!E61) ->  | M57: ='Super Stock'!Z61 -> 226
A58: ='Pro Stock'!A62 -> 56 | B58: ='Pro Stock'!B62 -> Tooter Campbell | C58: =IF('Pro Stock'!C62=0," ",'Pro Stock'!C62) -> TC | D58: ='Pro Stock'!D62 -> 11-215 | E58: =IF('Pro Stock'!E62=0," ",'Pro Stock'!E62) -> Pink | F58: ='Pro Stock'!Z62 -> 247 | H58: ='Super Stock'!A62 -> 56 | I58: ='Super Stock'!B62 -> Bruce Austin | J58: =IF('Super Stock'!C62=0," ",'Super Stock'!C62) -> MVP | K58: ='Super Stock'!D62 -> 11-277 | L58: =IF('Super Stock'!E62=0," ",'Super Stock'!E62) -> Cap'N Crunch | M58: ='Super Stock'!Z62 -> 228
A59: ='Pro Stock'!A63 -> 57 | B59: ='Pro Stock'!B63 -> Larry Karff | C59: =IF('Pro Stock'!C63=0," ",'Pro Stock'!C63) -> MVP | D59: ='Pro Stock'!D63 -> 11-398 | E59: =IF('Pro Stock'!E63=0," ",'Pro Stock'!E63) -> Kryptonite | F59: ='Pro Stock'!Z63 -> 250 | H59: ='Super Stock'!A63 -> 57 | I59: ='Super Stock'!B63 -> Mark Convoer | J59: =IF('Super Stock'!C63=0," ",'Super Stock'!C63) -> VM | K59: ='Super Stock'!D63 -> 11-360 | L59: =IF('Super Stock'!E63=0," ",'Super Stock'!E63) ->  | M59: ='Super Stock'!Z63 -> 228
A60: ='Pro Stock'!A64 -> 58 | B60: ='Pro Stock'!B64 -> Gary McDonald | C60: =IF('Pro Stock'!C64=0," ",'Pro Stock'!C64) -> Leffler | D60: ='Pro Stock'!D64 -> 11-093 | E60: =IF('Pro Stock'!E64=0," ",'Pro Stock'!E64) -> Plum Risky | F60: ='Pro Stock'!Z64 -> 251 | H60: ='Super Stock'!A64 -> 58 | I60: ='Super Stock'!B64 -> Larry Karff | J60: =IF('Super Stock'!C64=0," ",'Super Stock'!C64) -> TC | K60: ='Super Stock'!D64 -> 11-398 | L60: =IF('Super Stock'!E64=0," ",'Super Stock'!E64) -> Kryptonite | M60: ='Super Stock'!Z64 -> 230
A61: ='Pro Stock'!A65 -> 59 | B61: ='Pro Stock'!B65 -> Chad Vogler | C61: =IF('Pro Stock'!C65=0," ",'Pro Stock'!C65) -> JRS | D61: ='Pro Stock'!D65 -> 11-130 | E61: =IF('Pro Stock'!E65=0," ",'Pro Stock'!E65) -> Bandit | F61: ='Pro Stock'!Z65 -> 256 | H61: ='Super Stock'!A65 -> 59 | I61: ='Super Stock'!B65 -> Ray Gentz | J61: =IF('Super Stock'!C65=0," ",'Super Stock'!C65) -> JW | K61: ='Super Stock'!D65 -> 11-034 | L61: =IF('Super Stock'!E65=0," ",'Super Stock'!E65) -> Just Enough | M61: ='Super Stock'!Z65 -> 232
A62: ='Pro Stock'!A66 -> 60 | B62: ='Pro Stock'!B66 -> Charlie Korff | C62: =IF('Pro Stock'!C66=0," ",'Pro Stock'!C66) -> TC | D62: ='Pro Stock'!D66 -> 11-400 | E62: =IF('Pro Stock'!E66=0," ",'Pro Stock'!E66) -> No Fear | F62: ='Pro Stock'!Z66 -> 257 | H62: ='Super Stock'!A66 -> 60 | I62: ='Super Stock'!B66 -> Ronald Marcine | J62: =IF('Super Stock'!C66=0," ",'Super Stock'!C66) -> MVP | K62: ='Super Stock'!D66 -> 11-245 | L62: =IF('Super Stock'!E66=0," ",'Super Stock'!E66) -> No Pressure | M62: ='Super Stock'!Z66 -> 236
A63: ='Pro Stock'!A67 -> 61 | B63: ='Pro Stock'!B67 -> Mike Mason | C63: =IF('Pro Stock'!C67=0," ",'Pro Stock'!C67) -> NP | D63: ='Pro Stock'!D67 -> 11-138 | E63: =IF('Pro Stock'!E67=0," ",'Pro Stock'!E67) -> Totally Frustrated | F63: ='Pro Stock'!Z67 -> 260 | H63: ='Super Stock'!A67 -> 61 | I63: ='Super Stock'!B67 -> Keith Roberts | J63: =IF('Super Stock'!C67=0," ",'Super Stock'!C67) -> TC | K63: ='Super Stock'!D67 -> 11-350 | L63: =IF('Super Stock'!E67=0," ",'Super Stock'!E67) -> Instigator 2 | M63: ='Super Stock'!Z67 -> 238
A64: ='Pro Stock'!A68 -> 62 | B64: ='Pro Stock'!B68 -> Lee Blesch | C64: =IF('Pro Stock'!C68=0," ",'Pro Stock'!C68) -> TC | D64: ='Pro Stock'!D68 -> 11-344 | E64: =IF('Pro Stock'!E68=0," ",'Pro Stock'!E68) -> Orange Blossom Special | F64: ='Pro Stock'!Z68 -> 262 | H64: ='Super Stock'!A68 -> 62 | I64: ='Super Stock'!B68 -> Elain Fisher | J64: =IF('Super Stock'!C68=0," ",'Super Stock'!C68) -> JW | K64: ='Super Stock'!D68 -> 11-080 | L64: =IF('Super Stock'!E68=0," ",'Super Stock'!E68) -> Blue Thunder | M64: ='Super Stock'!Z68 -> 240
A65: ='Pro Stock'!A69 -> 63 | B65: ='Pro Stock'!B69 -> Justin Gentz | C65: =IF('Pro Stock'!C69=0," ",'Pro Stock'!C69) -> JW | D65: ='Pro Stock'!D69 -> 11-035 | E65: =IF('Pro Stock'!E69=0," ",'Pro Stock'!E69) -> Cub | F65: ='Pro Stock'!Z69 -> 263 | H65: ='Super Stock'!A69 -> 63 | I65: ='Super Stock'!B69 -> Gerald Kerber | J65: =IF('Super Stock'!C69=0," ",'Super Stock'!C69) -> NP | K65: ='Super Stock'!D69 -> 11-175 | L65: =IF('Super Stock'!E69=0," ",'Super Stock'!E69) -> Wisconsin Hooker | M65: ='Super Stock'!Z69 -> 245
A66: ='Pro Stock'!A70 -> 64 | B66: ='Pro Stock'!B70 -> Scott Bye | C66: =IF('Pro Stock'!C70=0," ",'Pro Stock'!C70) -> LR | D66: ='Pro Stock'!D70 -> 11-369 | E66: =IF('Pro Stock'!E70=0," ",'Pro Stock'!E70) -> Obession | F66: ='Pro Stock'!Z70 -> 263 | H66: ='Super Stock'!A70 -> 64 | I66: ='Super Stock'!B70 -> Darlene Sample | J66: =IF('Super Stock'!C70=0," ",'Super Stock'!C70) -> LR | K66: ='Super Stock'!D70 -> 11-202 | L66: =IF('Super Stock'!E70=0," ",'Super Stock'!E70) -> Dr Doom | M66: ='Super Stock'!Z70 -> 246
A67: ='Pro Stock'!A71 -> 65 | B67: ='Pro Stock'!B71 -> Ray Gentz | C67: =IF('Pro Stock'!C71=0," ",'Pro Stock'!C71) -> JW | D67: ='Pro Stock'!D71 -> 11-034 | E67: =IF('Pro Stock'!E71=0," ",'Pro Stock'!E71) -> Just Enough | F67: ='Pro Stock'!Z71 -> 264 | H67: ='Super Stock'!A71 -> 65 | I67: ='Super Stock'!B71 -> Dan Schell | J67: =IF('Super Stock'!C71=0," ",'Super Stock'!C71) -> MVP | K67: ='Super Stock'!D71 -> 11-375 | L67: =IF('Super Stock'!E71=0," ",'Super Stock'!E71) -> Menace | M67: ='Super Stock'!Z71 -> 248
A68: ='Pro Stock'!A72 -> 66 | B68: ='Pro Stock'!B72 -> Jeremy Jaspering | C68: =IF('Pro Stock'!C72=0," ",'Pro Stock'!C72) -> LR | D68: ='Pro Stock'!D72 -> 11-147 | E68: =IF('Pro Stock'!E72=0," ",'Pro Stock'!E72) -> Wicked | F68: ='Pro Stock'!Z72 -> 265 | H68: ='Super Stock'!A72 -> 66 | I68: ='Super Stock'!B72 -> Charlie Karff | J68: =IF('Super Stock'!C72=0," ",'Super Stock'!C72) -> TC | K68: ='Super Stock'!D72 -> 11-400 | L68: =IF('Super Stock'!E72=0," ",'Super Stock'!E72) -> No Fear | M68: ='Super Stock'!Z72 -> 249
A69: ='Pro Stock'!A73 -> 67 | B69: ='Pro Stock'!B73 -> Keith Roberts | C69: =IF('Pro Stock'!C73=0," ",'Pro Stock'!C73) -> TC | D69: ='Pro Stock'!D73 -> 11-350 | E69: =IF('Pro Stock'!E73=0," ",'Pro Stock'!E73) -> Instigator 2 | F69: ='Pro Stock'!Z73 -> 266 | H69: ='Super Stock'!A73 -> 67 | I69: ='Super Stock'!B73 -> Jake Gingerich | J69: =IF('Super Stock'!C73=0," ",'Super Stock'!C73) -> JW | K69: ='Super Stock'!D73 -> 11-017 | L69: =IF('Super Stock'!E73=0," ",'Super Stock'!E73) -> Silver Rocket | M69: ='Super Stock'!Z73 -> 251
A70: ='Pro Stock'!A74 -> 68 | B70: ='Pro Stock'!B74 -> Annette Sullivan | C70: =IF('Pro Stock'!C74=0," ",'Pro Stock'!C74) -> MVP | D70: ='Pro Stock'!D74 -> 11-120 | E70: =IF('Pro Stock'!E74=0," ",'Pro Stock'!E74) ->  | F70: ='Pro Stock'!Z74 -> 268 | H70: ='Super Stock'!A74 -> 68 | I70: ='Super Stock'!B74 -> David Knapp | J70: =IF('Super Stock'!C74=0," ",'Super Stock'!C74) -> MVP | K70: ='Super Stock'!D74 -> 11-381 | L70: =IF('Super Stock'!E74=0," ",'Super Stock'!E74) -> Knapp Time | M70: ='Super Stock'!Z74 -> 251
A71: ='Pro Stock'!A75 -> 69 | B71: ='Pro Stock'!B75 -> Vicki Scroggins | C71: =IF('Pro Stock'!C75=0," ",'Pro Stock'!C75) -> VM | D71: ='Pro Stock'!D75 -> 11-112 | E71: =IF('Pro Stock'!E75=0," ",'Pro Stock'!E75) -> Little American | F71: ='Pro Stock'!Z75 -> 269 | H71: ='Super Stock'!A75 -> 69 | I71: ='Super Stock'!B75 -> Dustin Blair | J71: =IF('Super Stock'!C75=0," ",'Super Stock'!C75) -> JW | K71: ='Super Stock'!D75 -> 11-380 | L71: =IF('Super Stock'!E75=0," ",'Super Stock'!E75) -> Armed and Dangerous | M71: ='Super Stock'!Z75 -> 252
A72: ='Pro Stock'!A76 -> 70 | B72: ='Pro Stock'!B76 -> Bill Richerson | C72: =IF('Pro Stock'!C76=0," ",'Pro Stock'!C76) -> JW | D72: ='Pro Stock'!D76 -> 11-132 | E72: =IF('Pro Stock'!E76=0," ",'Pro Stock'!E76) -> Walk the line | F72: ='Pro Stock'!Z76 -> 270 | H72: ='Super Stock'!A76 -> 70 | I72: ='Super Stock'!B76 -> Max Burkhart | J72: =IF('Super Stock'!C76=0," ",'Super Stock'!C76) -> TC | K72: ='Super Stock'!D76 -> 11-078 | L72: =IF('Super Stock'!E76=0," ",'Super Stock'!E76) -> Gray Matter | M72: ='Super Stock'!Z76 -> 254
A73: ='Pro Stock'!A77 -> 71 | B73: ='Pro Stock'!B77 -> Rick Mann | C73: =IF('Pro Stock'!C77=0," ",'Pro Stock'!C77) -> TC | D73: ='Pro Stock'!D77 -> 11-077 | E73: =IF('Pro Stock'!E77=0," ",'Pro Stock'!E77) -> Wildfire | F73: ='Pro Stock'!Z77 -> 272 | H73: ='Super Stock'!A77 -> 71 | I73: ='Super Stock'!B77 -> Bill Richerson | J73: =IF('Super Stock'!C77=0," ",'Super Stock'!C77) -> JW | K73: ='Super Stock'!D77 -> 11-132 | L73: =IF('Super Stock'!E77=0," ",'Super Stock'!E77) -> Walk the Line | M73: ='Super Stock'!Z77 -> 255
A74: ='Pro Stock'!A78 -> 72 | B74: ='Pro Stock'!B78 -> Daryl Musser | C74: =IF('Pro Stock'!C78=0," ",'Pro Stock'!C78) -> NP | D74: ='Pro Stock'!D78 -> 11-397 | E74: =IF('Pro Stock'!E78=0," ",'Pro Stock'!E78) -> Cross Threaded | F74: ='Pro Stock'!Z78 -> 278 | H74: ='Super Stock'!A78 -> 72 | I74: ='Super Stock'!B78 -> Shawn Vogler | J74: =IF('Super Stock'!C78=0," ",'Super Stock'!C78) -> JRS | K74: ='Super Stock'!D78 -> 11-129 | L74: =IF('Super Stock'!E78=0," ",'Super Stock'!E78) -> Renegade | M74: ='Super Stock'!Z78 -> 260
A75: ='Pro Stock'!A79 -> 73 | B75: ='Pro Stock'!B79 -> Dave Knapp | C75: =IF('Pro Stock'!C79=0," ",'Pro Stock'!C79) -> MVP | D75: ='Pro Stock'!D79 -> 11-381 | E75: =IF('Pro Stock'!E79=0," ",'Pro Stock'!E79) -> Knapp Time | F75: ='Pro Stock'!Z79 -> 285 | H75: ='Super Stock'!A79 -> 73 | I75: ='Super Stock'!B79 -> Joe Gawatz | J75: =IF('Super Stock'!C79=0," ",'Super Stock'!C79) -> LR | K75: ='Super Stock'!D79 -> 11-369 | L75: =IF('Super Stock'!E79=0," ",'Super Stock'!E79) -> Obession | M75: ='Super Stock'!Z79 -> 261
A76: ='Pro Stock'!A80 -> 74 | B76: ='Pro Stock'!B80 -> Zack Richerson | C76: =IF('Pro Stock'!C80=0," ",'Pro Stock'!C80) -> JW | D76: ='Pro Stock'!D80 -> 11-348 | E76: =IF('Pro Stock'!E80=0," ",'Pro Stock'!E80) -> Zacks Rat | F76: ='Pro Stock'!Z80 -> 286 | H76: ='Super Stock'!A80 -> 74 | I76: ='Super Stock'!B80 -> Jim Evans | J76: =IF('Super Stock'!C80=0," ",'Super Stock'!C80) -> NP | K76: ='Super Stock'!D80 -> 11-223 | L76: =IF('Super Stock'!E80=0," ",'Super Stock'!E80) -> Hammer Down | M76: ='Super Stock'!Z80 -> 262
A77: ='Pro Stock'!A81 -> 75 | B77: ='Pro Stock'!B81 -> Allilson Manville | C77: =IF('Pro Stock'!C81=0," ",'Pro Stock'!C81) -> JRS | D77: ='Pro Stock'!D81 -> 11-234 | E77: =IF('Pro Stock'!E81=0," ",'Pro Stock'!E81) -> No Fluke | F77: ='Pro Stock'!Z81 -> 287 | H77: ='Super Stock'!A81 -> 75 | I77: ='Super Stock'!B81 -> Matt Kaster | J77: =IF('Super Stock'!C81=0," ",'Super Stock'!C81) -> MVP | K77: ='Super Stock'!D81 -> 11-097 | L77: =IF('Super Stock'!E81=0," ",'Super Stock'!E81) -> Cruel Intentions | M77: ='Super Stock'!Z81 -> 264
A78: ='Pro Stock'!A82 -> 76 | B78: ='Pro Stock'!B82 -> Mike Kyle | C78: =IF('Pro Stock'!C82=0," ",'Pro Stock'!C82) ->  | D78: ='Pro Stock'!D82 -> 11-394 | E78: =IF('Pro Stock'!E82=0," ",'Pro Stock'!E82) ->  | F78: ='Pro Stock'!Z82 -> 287 | H78: ='Super Stock'!A82 -> 76 | I78: ='Super Stock'!B82 -> Trampis Hamilton | J78: =IF('Super Stock'!C82=0," ",'Super Stock'!C82) -> VM | K78: ='Super Stock'!D82 -> 11-359 | L78: =IF('Super Stock'!E82=0," ",'Super Stock'!E82) -> Visual Express | M78: ='Super Stock'!Z82 -> 264
A79: ='Pro Stock'!A83 -> 77 | B79: ='Pro Stock'!B83 -> Nathan Hager | C79: =IF('Pro Stock'!C83=0," ",'Pro Stock'!C83) -> JW | D79: ='Pro Stock'!D83 -> 11-051 | E79: =IF('Pro Stock'!E83=0," ",'Pro Stock'!E83) -> Bad Medicine | F79: ='Pro Stock'!Z83 -> 288 | H79: ='Super Stock'!A83 -> 77 | I79: ='Super Stock'!B83 -> Tooter Cambell | J79: =IF('Super Stock'!C83=0," ",'Super Stock'!C83) -> TC | K79: ='Super Stock'!D83 -> 11-215 | L79: =IF('Super Stock'!E83=0," ",'Super Stock'!E83) -> Pink | M79: ='Super Stock'!Z83 -> 265
A80: ='Pro Stock'!A84 -> 78 | B80: ='Pro Stock'!B84 -> Carl Zimmerman | C80: =IF('Pro Stock'!C84=0," ",'Pro Stock'!C84) -> JRS | D80: ='Pro Stock'!D84 -> 11-395 | E80: =IF('Pro Stock'!E84=0," ",'Pro Stock'!E84) -> Bragging Rights | F80: ='Pro Stock'!Z84 -> 291 | H80: ='Super Stock'!A84 -> 78 | I80: ='Super Stock'!B84 -> Lee Blesch | J80: =IF('Super Stock'!C84=0," ",'Super Stock'!C84) -> TC | K80: ='Super Stock'!D84 -> 11-344 | L80: =IF('Super Stock'!E84=0," ",'Super Stock'!E84) -> Orange Blossom Special | M80: ='Super Stock'!Z84 -> 266
A81: ='Pro Stock'!A85 -> 79 | B81: ='Pro Stock'!B85 -> Eric Pike | C81: =IF('Pro Stock'!C85=0," ",'Pro Stock'!C85) -> VM | D81: ='Pro Stock'!D85 -> 11-359 | E81: =IF('Pro Stock'!E85=0," ",'Pro Stock'!E85) -> Visual Expression | F81: ='Pro Stock'!Z85 -> 292 | H81: ='Super Stock'!A85 -> 79 | I81: ='Super Stock'!B85 -> Ray Gentz | J81: =IF('Super Stock'!C85=0," ",'Super Stock'!C85) -> JW | K81: ='Super Stock'!D85 -> 11-035 | L81: =IF('Super Stock'!E85=0," ",'Super Stock'!E85) -> Cub | M81: ='Super Stock'!Z85 -> 269
A82: ='Pro Stock'!A86 -> 80 | B82: ='Pro Stock'!B86 -> Will Durstine | C82: =IF('Pro Stock'!C86=0," ",'Pro Stock'!C86) -> JRS | D82: ='Pro Stock'!D86 -> 11-264 | E82: =IF('Pro Stock'!E86=0," ",'Pro Stock'!E86) -> Never Satished | F82: ='Pro Stock'!Z86 -> 293 | H82: ='Super Stock'!A86 -> 80 | I82: ='Super Stock'!B86 -> Dick Eldridge | J82: =IF('Super Stock'!C86=0," ",'Super Stock'!C86) -> GTP | K82: ='Super Stock'!D86 -> 11-340 | L82: =IF('Super Stock'!E86=0," ",'Super Stock'!E86) -> Haybaler | M82: ='Super Stock'!Z86 -> 272
A83: ='Pro Stock'!A87 -> 81 | B83: ='Pro Stock'!B87 -> Ron Scroggins | C83: =IF('Pro Stock'!C87=0," ",'Pro Stock'!C87) -> VM | D83: ='Pro Stock'!D87 -> 11-110 | E83: =IF('Pro Stock'!E87=0," ",'Pro Stock'!E87) -> Dirt Dancer | F83: ='Pro Stock'!Z87 -> 294 | H83: ='Super Stock'!A87 -> 81 | I83: ='Super Stock'!B87 -> Wes Kampeter | J83: =IF('Super Stock'!C87=0," ",'Super Stock'!C87) -> NP | K83: ='Super Stock'!D87 -> 11-423 | L83: =IF('Super Stock'!E87=0," ",'Super Stock'!E87) -> Torqued Up | M83: ='Super Stock'!Z87 -> 275
A84: ='Pro Stock'!A88 -> 82 | B84: ='Pro Stock'!B88 -> Steve Chrisman | C84: =IF('Pro Stock'!C88=0," ",'Pro Stock'!C88) -> Hackman | D84: ='Pro Stock'!D88 -> 11-022 | E84: =IF('Pro Stock'!E88=0," ",'Pro Stock'!E88) -> Purple | F84: ='Pro Stock'!Z88 -> 301 | H84: ='Super Stock'!A88 -> 82 | I84: ='Super Stock'!B88 -> Mike Kyle | J84: =IF('Super Stock'!C88=0," ",'Super Stock'!C88) ->  | K84: ='Super Stock'!D88 -> 11-394 | L84: =IF('Super Stock'!E88=0," ",'Super Stock'!E88) ->  | M84: ='Super Stock'!Z88 -> 277
A85: ='Pro Stock'!A89 -> 83 | B85: ='Pro Stock'!B89 -> Aaron Scroggins | C85: =IF('Pro Stock'!C89=0," ",'Pro Stock'!C89) -> VM | D85: ='Pro Stock'!D89 -> 11-419 | E85: =IF('Pro Stock'!E89=0," ",'Pro Stock'!E89) -> Gambler | F85: ='Pro Stock'!Z89 -> 302 | H85: ='Super Stock'!A89 -> 83 | I85: ='Super Stock'!B89 -> Lamar Hagar | J85: =IF('Super Stock'!C89=0," ",'Super Stock'!C89) -> JW | K85: ='Super Stock'!D89 -> 11-051 | L85: =IF('Super Stock'!E89=0," ",'Super Stock'!E89) -> Bad Medicine | M85: ='Super Stock'!Z89 -> 278
A86: ='Pro Stock'!A90 -> 84 | B86: ='Pro Stock'!B90 -> Steve Cape | C86: =IF('Pro Stock'!C90=0," ",'Pro Stock'!C90) -> MVP | D86: ='Pro Stock'!D90 -> 11-432 | E86: =IF('Pro Stock'!E90=0," ",'Pro Stock'!E90) ->  | F86: ='Pro Stock'!Z90 -> 302 | H86: ='Super Stock'!A90 -> 84 | I86: ='Super Stock'!B90 -> Ron Scroggins | J86: =IF('Super Stock'!C90=0," ",'Super Stock'!C90) -> VM | K86: ='Super Stock'!D90 -> 11-110 | L86: =IF('Super Stock'!E90=0," ",'Super Stock'!E90) -> Dirt Dancer | M86: ='Super Stock'!Z90 -> 279
A87: ='Pro Stock'!A91 -> 85 | B87: ='Pro Stock'!B91 -> Mark Cessna | C87: =IF('Pro Stock'!C91=0," ",'Pro Stock'!C91) -> NP | D87: ='Pro Stock'!D91 -> 11-387 | E87: =IF('Pro Stock'!E91=0," ",'Pro Stock'!E91) -> Time and Money | F87: ='Pro Stock'!Z91 -> 303 | H87: ='Super Stock'!A91 -> 85 | I87: ='Super Stock'!B91 -> Mark Deputy | J87: =IF('Super Stock'!C91=0," ",'Super Stock'!C91) -> TC | K87: ='Super Stock'!D91 -> 11-347 | L87: =IF('Super Stock'!E91=0," ",'Super Stock'!E91) ->  | M87: ='Super Stock'!Z91 -> 282
A88: ='Pro Stock'!A92 -> 86 | B88: ='Pro Stock'!B92 -> Logan Cessna | C88: =IF('Pro Stock'!C92=0," ",'Pro Stock'!C92) -> NP | D88: ='Pro Stock'!D92 -> 11-389 | E88: =IF('Pro Stock'!E92=0," ",'Pro Stock'!E92) -> Adrenaline | F88: ='Pro Stock'!Z92 -> 303 | H88: ='Super Stock'!A92 -> 86 | I88: ='Super Stock'!B92 -> Tyler Hackman | J88: =IF('Super Stock'!C92=0," ",'Super Stock'!C92) -> Hackman | K88: ='Super Stock'!D92 -> 11-342 | L88: =IF('Super Stock'!E92=0," ",'Super Stock'!E92) -> Green | M88: ='Super Stock'!Z92 -> 284
A89: ='Pro Stock'!A93 -> 87 | B89: ='Pro Stock'!B93 -> Tooter Cambell | C89: =IF('Pro Stock'!C93=0," ",'Pro Stock'!C93) -> TC | D89: ='Pro Stock'!D93 -> 11-128 | E89: =IF('Pro Stock'!E93=0," ",'Pro Stock'!E93) -> The Kentuckian | F89: ='Pro Stock'!Z93 -> 304 | H89: ='Super Stock'!A93 -> 87 | I89: ='Super Stock'!B93 -> John Cress | J89: =IF('Super Stock'!C93=0," ",'Super Stock'!C93) -> JW | K89: ='Super Stock'!D93 -> 11-170 | L89: =IF('Super Stock'!E93=0," ",'Super Stock'!E93) -> Blitzed | M89: ='Super Stock'!Z93 -> 285
A90: ='Pro Stock'!A94 -> 88 | B90: ='Pro Stock'!B94 -> Doug Maier | C90: =IF('Pro Stock'!C94=0," ",'Pro Stock'!C94) -> JW | D90: ='Pro Stock'!D94 -> 11-158 | E90: =IF('Pro Stock'!E94=0," ",'Pro Stock'!E94) -> Thumper | F90: ='Pro Stock'!Z94 -> 304 | H90: ='Super Stock'!A94 -> 88 | I90: ='Super Stock'!B94 -> Annette Sullivan | J90: =IF('Super Stock'!C94=0," ",'Super Stock'!C94) -> NP | K90: ='Super Stock'!D94 -> 11-120 | L90: =IF('Super Stock'!E94=0," ",'Super Stock'!E94) -> Joker | M90: ='Super Stock'!Z94 -> 287
A91: ='Pro Stock'!A95 -> 89 | B91: ='Pro Stock'!B95 -> Brian Titzer | C91: =IF('Pro Stock'!C95=0," ",'Pro Stock'!C95) -> TC | D91: ='Pro Stock'!D95 -> 11-364 | E91: =IF('Pro Stock'!E95=0," ",'Pro Stock'!E95) -> Single Boys Toy | F91: ='Pro Stock'!Z95 -> 304 | H91: ='Super Stock'!A95 -> 89 | I91: ='Super Stock'!B95 -> Dave Gawatz | J91: =IF('Super Stock'!C95=0," ",'Super Stock'!C95) -> JW | K91: ='Super Stock'!D95 -> 11-367 | L91: =IF('Super Stock'!E95=0," ",'Super Stock'!E95) -> Lil Sprout | M91: ='Super Stock'!Z95 -> 287
A92: ='Pro Stock'!A96 -> 90 | B92: ='Pro Stock'!B96 -> William Lewis | C92: =IF('Pro Stock'!C96=0," ",'Pro Stock'!C96) -> Hackman | D92: ='Pro Stock'!D96 -> 11-392 | E92: =IF('Pro Stock'!E96=0," ",'Pro Stock'!E96) -> Wide Open | F92: ='Pro Stock'!Z96 -> 304 | H92: ='Super Stock'!A96 -> 90 | I92: ='Super Stock'!B96 -> Brian Titzer | J92: =IF('Super Stock'!C96=0," ",'Super Stock'!C96) -> TC | K92: ='Super Stock'!D96 -> 11-364 | L92: =IF('Super Stock'!E96=0," ",'Super Stock'!E96) -> Single Boys Toy | M92: ='Super Stock'!Z96 -> 288
A93: ='Pro Stock'!A97 -> 91 | B93: ='Pro Stock'!B97 -> Scott Gerhardt | C93: =IF('Pro Stock'!C97=0," ",'Pro Stock'!C97) -> JRS | D93: ='Pro Stock'!D97 -> 11-157 | E93: =IF('Pro Stock'!E97=0," ",'Pro Stock'!E97) -> Suspicious Minds | F93: ='Pro Stock'!Z97 -> 305 | H93: ='Super Stock'!A97 -> 91 | I93: ='Super Stock'!B97 -> Aaron Scroggins | J93: =IF('Super Stock'!C97=0," ",'Super Stock'!C97) -> VM | K93: ='Super Stock'!D97 -> 11-111 | L93: =IF('Super Stock'!E97=0," ",'Super Stock'!E97) -> Black Out | M93: ='Super Stock'!Z97 -> 289
A94: ='Pro Stock'!A98 -> 92 | B94: ='Pro Stock'!B98 -> Todd Brest | C94: =IF('Pro Stock'!C98=0," ",'Pro Stock'!C98) ->  | D94: ='Pro Stock'!D98 -> 11-272 | E94: =IF('Pro Stock'!E98=0," ",'Pro Stock'!E98) -> Cub | F94: ='Pro Stock'!Z98 -> 305 | H94: ='Super Stock'!A98 -> 92 | I94: ='Super Stock'!B98 -> Chad Vogler | J94: =IF('Super Stock'!C98=0," ",'Super Stock'!C98) -> JRS | K94: ='Super Stock'!D98 -> 11-130 | L94: =IF('Super Stock'!E98=0," ",'Super Stock'!E98) -> Bandit | M94: ='Super Stock'!Z98 -> 290
A95: ='Pro Stock'!A99 -> 93 | B95: ='Pro Stock'!B99 -> Dave Gawatz | C95: =IF('Pro Stock'!C99=0," ",'Pro Stock'!C99) -> JW | D95: ='Pro Stock'!D99 -> 11-367 | E95: =IF('Pro Stock'!E99=0," ",'Pro Stock'!E99) -> Little Sprout | F95: ='Pro Stock'!Z99 -> 305 | H95: ='Super Stock'!A99 -> 93 | I95: ='Super Stock'!B99 -> Zack Richerson | J95: =IF('Super Stock'!C99=0," ",'Super Stock'!C99) -> JW | K95: ='Super Stock'!D99 -> 11-348 | L95: =IF('Super Stock'!E99=0," ",'Super Stock'!E99) -> Zacks Rat | M95: ='Super Stock'!Z99 -> 291
A96: ='Pro Stock'!A100 -> 94 | B96: ='Pro Stock'!B100 -> Doug Diehl | C96: =IF('Pro Stock'!C100=0," ",'Pro Stock'!C100) -> NP | D96: ='Pro Stock'!D100 -> 11-385 | E96: =IF('Pro Stock'!E100=0," ",'Pro Stock'!E100) -> Eliminator | F96: ='Pro Stock'!Z100 -> 305 | H96: ='Super Stock'!A100 -> 94 | I96: ='Super Stock'!B100 -> Rudy Puskarich | J96: =IF('Super Stock'!C100=0," ",'Super Stock'!C100) ->  | K96: ='Super Stock'!D100 -> 11-384 | L96: =IF('Super Stock'!E100=0," ",'Super Stock'!E100) -> English Bulldog | M96: ='Super Stock'!Z100 -> 291
A97: ='Pro Stock'!A101 -> 95 | B97: ='Pro Stock'!B101 -> Greg Angell | C97: =IF('Pro Stock'!C101=0," ",'Pro Stock'!C101) ->  | D97: ='Pro Stock'!D101 -> 11-048 | E97: =IF('Pro Stock'!E101=0," ",'Pro Stock'!E101) -> Ford | F97: ='Pro Stock'!Z101 -> 306 | H97: ='Super Stock'!A101 -> 95 | I97: ='Super Stock'!B101 -> Allison Manville | J97: =IF('Super Stock'!C101=0," ",'Super Stock'!C101) -> JRS | K97: ='Super Stock'!D101 -> 11-234 | L97: =IF('Super Stock'!E101=0," ",'Super Stock'!E101) -> No Fluke | M97: ='Super Stock'!Z101 -> 293
A98: ='Pro Stock'!A102 -> 96 | B98: ='Pro Stock'!B102 -> Jim Morrison | C98: =IF('Pro Stock'!C102=0," ",'Pro Stock'!C102) ->  | D98: ='Pro Stock'!D102 -> 11-049 | E98: =IF('Pro Stock'!E102=0," ",'Pro Stock'!E102) -> Red Rock | F98: ='Pro Stock'!Z102 -> 306 | H98: ='Super Stock'!A102 -> 96 | I98: ='Super Stock'!B102 -> Jake Gingerich | J98: =IF('Super Stock'!C102=0," ",'Super Stock'!C102) -> JW | K98: ='Super Stock'!D102 -> 11-023 | L98: =IF('Super Stock'!E102=0," ",'Super Stock'!E102) -> Royal Pain | M98: ='Super Stock'!Z102 -> 294
A99: ='Pro Stock'!A103 -> 97 | B99: ='Pro Stock'!B103 -> Max Burkhart | C99: =IF('Pro Stock'!C103=0," ",'Pro Stock'!C103) -> TC | D99: ='Pro Stock'!D103 -> 11-078 | E99: =IF('Pro Stock'!E103=0," ",'Pro Stock'!E103) -> Gray Matter | F99: ='Pro Stock'!Z103 -> 306 | H99: ='Super Stock'!A103 -> 97 | I99: ='Super Stock'!B103 -> Jeremy Jaspering | J99: =IF('Super Stock'!C103=0," ",'Super Stock'!C103) -> LR | K99: ='Super Stock'!D103 -> 11-147 | L99: =IF('Super Stock'!E103=0," ",'Super Stock'!E103) -> Wicked | M99: ='Super Stock'!Z103 -> 295
A100: ='Pro Stock'!A104 -> 98 | B100: ='Pro Stock'!B104 -> Daryl Musser | C100: =IF('Pro Stock'!C104=0," ",'Pro Stock'!C104) -> NP | D100: ='Pro Stock'!D104 -> 11-396 | E100: =IF('Pro Stock'!E104=0," ",'Pro Stock'!E104) -> 5 Cents | F100: ='Pro Stock'!Z104 -> 306 | H100: ='Super Stock'!A104 -> 98 | I100: ='Super Stock'!B104 -> Bryan Angell | J100: =IF('Super Stock'!C104=0," ",'Super Stock'!C104) ->  | K100: ='Super Stock'!D104 -> 11-048 | L100: =IF('Super Stock'!E104=0," ",'Super Stock'!E104) -> Ford 9600 | M100: ='Super Stock'!Z104 -> 302
A101: ='Pro Stock'!A105 -> 99 | B101: ='Pro Stock'!B105 -> Bobby Feldkamp | C101: =IF('Pro Stock'!C105=0," ",'Pro Stock'!C105) -> Woods | D101: ='Pro Stock'!D105 -> 11-144 | E101: =IF('Pro Stock'!E105=0," ",'Pro Stock'!E105) -> Goin for Broke | F101: ='Pro Stock'!Z105 -> 307 | H101: ='Super Stock'!A105 -> 99 | I101: ='Super Stock'!B105 -> John Cress | J101: =IF('Super Stock'!C105=0," ",'Super Stock'!C105) -> JW | K101: ='Super Stock'!D105 -> 11-172 | L101: =IF('Super Stock'!E105=0," ",'Super Stock'!E105) -> Full Tilt | M101: ='Super Stock'!Z105 -> 302
A102: ='Pro Stock'!A106 -> 100 | B102: ='Pro Stock'!B106 -> Larry Hunter | C102: =IF('Pro Stock'!C106=0," ",'Pro Stock'!C106) -> Voit | D102: ='Pro Stock'!D106 -> 11-220 | E102: =IF('Pro Stock'!E106=0," ",'Pro Stock'!E106) -> Blue Licker | F102: ='Pro Stock'!Z106 -> 307 | H102: ='Super Stock'!A106 -> 100 | I102: ='Super Stock'!B106 -> Carl Zimmerman | J102: =IF('Super Stock'!C106=0," ",'Super Stock'!C106) -> JRS | K102: ='Super Stock'!D106 -> 11-395 | L102: =IF('Super Stock'!E106=0," ",'Super Stock'!E106) -> Bragging Rights | M102: ='Super Stock'!Z106 -> 302
A103: ='Pro Stock'!A107 -> 101 | B103: ='Pro Stock'!B107 -> Doug Diehl | C103: =IF('Pro Stock'!C107=0," ",'Pro Stock'!C107) -> NP | D103: ='Pro Stock'!D107 -> 11-242 | E103: =IF('Pro Stock'!E107=0," ",'Pro Stock'!E107) -> Extra Wild | F103: ='Pro Stock'!Z107 -> 307 | H103: ='Super Stock'!A107 -> 101 | I103: ='Super Stock'!B107 -> Casey Schell | J103: =IF('Super Stock'!C107=0," ",'Super Stock'!C107) -> MVP | K103: ='Super Stock'!D107 -> 11-407 | L103: =IF('Super Stock'!E107=0," ",'Super Stock'!E107) -> H2O Head | M103: ='Super Stock'!Z107 -> 302
A104: ='Pro Stock'!A108 -> 102 | B104: ='Pro Stock'!B108 -> Colyn Hammond | C104: =IF('Pro Stock'!C108=0," ",'Pro Stock'!C108) -> JRS | D104: ='Pro Stock'!D108 -> 11-301 | E104: =IF('Pro Stock'!E108=0," ",'Pro Stock'!E108) -> Punisher | F104: ='Pro Stock'!Z108 -> 307 | H104: ='Super Stock'!A108 -> 102 | I104: ='Super Stock'!B108 -> Tooter Cambell | J104: =IF('Super Stock'!C108=0," ",'Super Stock'!C108) -> TC | K104: ='Super Stock'!D108 -> 11-128 | L104: =IF('Super Stock'!E108=0," ",'Super Stock'!E108) -> The Kentuckian | M104: ='Super Stock'!Z108 -> 303
A105: ='Pro Stock'!A109 -> 103 | B105: ='Pro Stock'!B109 -> Casey Schell | C105: =IF('Pro Stock'!C109=0," ",'Pro Stock'!C109) -> MVP | D105: ='Pro Stock'!D109 -> 11-407 | E105: =IF('Pro Stock'!E109=0," ",'Pro Stock'!E109) -> H2O Head | F105: ='Pro Stock'!Z109 -> 307 | H105: ='Super Stock'!A109 -> 103 | I105: ='Super Stock'!B109 -> Scott Gearharadt | J105: =IF('Super Stock'!C109=0," ",'Super Stock'!C109) -> JRS | K105: ='Super Stock'!D109 -> 11-157 | L105: =IF('Super Stock'!E109=0," ",'Super Stock'!E109) -> Suspicious Minds | M105: ='Super Stock'!Z109 -> 303
A106: ='Pro Stock'!A110 -> 104 | B106: ='Pro Stock'!B110 -> John Innerst | C106: =IF('Pro Stock'!C110=0," ",'Pro Stock'!C110) -> NP | D106: ='Pro Stock'!D110 -> 11-252 | E106: =IF('Pro Stock'!E110=0," ",'Pro Stock'!E110) -> Mean-N-Nasty | F106: ='Pro Stock'!Z110 -> 308 | H106: ='Super Stock'!A110 -> 104 | I106: ='Super Stock'!B110 -> Daryl Musser | J106: =IF('Super Stock'!C110=0," ",'Super Stock'!C110) -> NP | K106: ='Super Stock'!D110 -> 11-397 | L106: =IF('Super Stock'!E110=0," ",'Super Stock'!E110) -> Cross Threaded | M106: ='Super Stock'!Z110 -> 303
A107: ='Pro Stock'!A111 -> 105 | B107: ='Pro Stock'!B111 -> Mark Brest | C107: =IF('Pro Stock'!C111=0," ",'Pro Stock'!C111) ->  | D107: ='Pro Stock'!D111 -> 11-404 | E107: =IF('Pro Stock'!E111=0," ",'Pro Stock'!E111) -> Stage 4 | F107: ='Pro Stock'!Z111 -> 308 | H107: ='Super Stock'!A111 -> 105 | I107: ='Super Stock'!B111 -> Vickie Scroggins | J107: =IF('Super Stock'!C111=0," ",'Super Stock'!C111) -> VM | K107: ='Super Stock'!D111 -> 11-112 | L107: =IF('Super Stock'!E111=0," ",'Super Stock'!E111) -> Little American | M107: ='Super Stock'!Z111 -> 304
A108: ='Pro Stock'!A112 -> 106 | B108: ='Pro Stock'!B112 -> Matt Kaster | C108: =IF('Pro Stock'!C112=0," ",'Pro Stock'!C112) -> MVP | D108: ='Pro Stock'!D112 -> 11-098 | E108: =IF('Pro Stock'!E112=0," ",'Pro Stock'!E112) -> Moose | F108: ='Pro Stock'!Z112 -> 309 | H108: ='Super Stock'!A112 -> 106 | I108: ='Super Stock'!B112 -> John Innerst | J108: =IF('Super Stock'!C112=0," ",'Super Stock'!C112) -> NP | K108: ='Super Stock'!D112 -> 11-252 | L108: =IF('Super Stock'!E112=0," ",'Super Stock'!E112) -> Mean-N-Nasty | M108: ='Super Stock'!Z112 -> 304
A109: ='Pro Stock'!A113 -> 107 | B109: ='Pro Stock'!B113 -> Rudy Puskarich | C109: =IF('Pro Stock'!C113=0," ",'Pro Stock'!C113) ->  | D109: ='Pro Stock'!D113 -> 11-384 | E109: =IF('Pro Stock'!E113=0," ",'Pro Stock'!E113) -> English Bulldog | F109: ='Pro Stock'!Z113 -> 309 | H109: ='Super Stock'!A113 -> 107 | I109: ='Super Stock'!B113 -> Tyler Hackman | J109: =IF('Super Stock'!C113=0," ",'Super Stock'!C113) -> Hackman | K109: ='Super Stock'!D113 -> 11-052 | L109: =IF('Super Stock'!E113=0," ",'Super Stock'!E113) -> Yellow | M109: ='Super Stock'!Z113 -> 305
A110: ='Pro Stock'!A114 -> 108 | B110: ='Pro Stock'!B114 -> Morgan Cessna | C110: =IF('Pro Stock'!C114=0," ",'Pro Stock'!C114) -> NP | D110: ='Pro Stock'!D114 -> 11-390 | E110: =IF('Pro Stock'!E114=0," ",'Pro Stock'!E114) -> Look Out | F110: ='Pro Stock'!Z114 -> 309 | H110: ='Super Stock'!A114 -> 108 | I110: ='Super Stock'!B114 -> Todd Hammond | J110: =IF('Super Stock'!C114=0," ",'Super Stock'!C114) -> JRS | K110: ='Super Stock'!D114 -> 11-301 | L110: =IF('Super Stock'!E114=0," ",'Super Stock'!E114) -> Punisher | M110: ='Super Stock'!Z114 -> 305