B2: PRO OUTLAW
F5: Princeton, Ind | I5: Richmond,KY | L5: Marietta | O5: Kansas City | R5: Sturgis | U5: Tallmadge
B6: Name | C6: Eng. | D6: NQS # | E6: Tractor | F6: Qualifying Points | G6: Finals Points | I6: Qualifying Points | J6: Finals Points | L6: Qualifying Points | M6: Finals Points | O6: Qualifying Points | P6: Finals Points | R6: Qualifying Points | S6: Finals Points | U6: Qualifying Points | V6: Finals Points | X6: Total Points | Z6: Points Back | AB6: Teardown sticker check
A7: 1 | B7: Steve Burton | C7: NP | D7: 11-014 | E7: Bad Company | F7: 24 | I7: 25 | L7: 30 | M7: 39 | O7: 30 | P7: 40 | R7: 30 | S7: 38 | X7: =SUM(+F7+G7+I7+J7+L7+M7+O7+P7+R7+S7+U7+V7) -> 256 | Z7: =SUM(AB7-X7) -> 0 | AB7: =SUM(X$7) -> 256
A8: 2 | B8: Scott Bye | C8: NP | D8: 11-365 | E8: Fired Up | F8: 26 | I8: 27 | L8: 30 | M8: 38 | O8: 24 | P8: 37 | R8: 27 | S8: 39 | X8: =SUM(+F8+G8+I8+J8+L8+M8+O8+P8+R8+S8+U8+V8) -> 248 | Z8: =SUM(AB8-X8) -> 8 | AB8: =SUM(X$7) -> 256
A9: 3 | B9: Russ Nichols | C9: NP | D9: 11-069 | E9: Top Secret | F9: 19 | I9: 28 | L9: 28 | M9: 36 | O9: 26 | P9: 38 | R9: 28 | S9: 35 | X9: =SUM(+F9+G9+I9+J9+L9+M9+O9+P9+R9+S9+U9+V9) -> 238 | Z9: =SUM(AB9-X9) -> 18 | AB9: =SUM(X$7) -> 256
A10: 4 | B10: Julian Stahl | C10: MVP | D10: 11-002 | E10: MWSC #2 | F10: 22 | I10: 29 | L10: 27 | M10: 37 | O10: 27 | P10: 30 | R10: 30 | S10: 32 | X10: =SUM(+F10+G10+I10+J10+L10+M10+O10+P10+R10+S10+U10+V10) -> 234 | Z10: =SUM(AB10-X10) -> 22 | AB10: =SUM(X$7) -> 256
A11: 5 | B11: Harrison Stahl | C11: MVP | D11: 11-004 | E11: Tons of Fun | F11: 25 | I11: 29 | L11: 30 | M11: 35 | O11: 23 | R11: 29 | S11: 36 | X11: =SUM(+F11+G11+I11+J11+L11+M11+O11+P11+R11+S11+U11+V11) -> 207 | Z11: =SUM(AB11-X11) -> 49 | AB11: =SUM(X$7) -> 256
A12: 6 | B12: Julian Stahl | C12: MVP | D12: 11-001 | E12: MWSC #1 | F12: 23 | I12: 28 | L12: 29 | M12: 40 | O12: 27 | P12: 36 | R12: 23 | X12: =SUM(+F12+G12+I12+J12+L12+M12+O12+P12+R12+S12+U12+V12) -> 206 | Z12: =SUM(AB12-X12) -> 50 | AB12: =SUM(X$7) -> 256
A13: 7 | B13: Harrison Stahl | C13: MVP | D13: 11-336 | E13: MWSC #4 | F13: 29 | I13: 30 | L13: 20 | O13: 29 | P13: 32 | R13: 26 | S13: 37 | X13: =SUM(+F13+G13+I13+J13+L13+M13+O13+P13+R13+S13+U13+V13) -> 203 | Z13: =SUM(AB13-X13) -> 53 | AB13: =SUM(X$7) -> 256
A14: 8 | B14: Harrison Stahl | C14: MVP | D14: 11-335 | E14: MWSC #3 | F14: 30 | I14: 27 | L14: 23 | O14: 28 | P14: 31 | R14: 24 | S14: 31 | X14: =SUM(+F14+G14+I14+J14+L14+M14+O14+P14+R14+S14+U14+V14) -> 194 | Z14: =SUM(AB14-X14) -> 62 | AB14: =SUM(X$7) -> 256
A15: 9 | B15: Scott Larkins | C15: JRS | D15: 11-154 | E15: Yosemite Sam | F15: 20 | I15: 15 | L15: 25 | M15: 31 | O15: 24 | P15: 39 | R15: 21 | X15: =SUM(+F15+G15+I15+J15+L15+M15+O15+P15+R15+S15+U15+V15) -> 175 | Z15: =SUM(AB15-X15) -> 81 | AB15: =SUM(X$7) -> 256
A16: 10 | B16: Jim Hall---DQ | C16: MVP | D16: 11-334 | E16: Simplicity | F16: 6 | I16: 24 | L16: 25 | M16: 32 | O16: 23 | R16: 25 | S16: 27 | X16: =SUM(+F16+G16+I16+J16+L16+M16+O16+P16+R16+S16+U16+V16) -> 162 | Z16: =SUM(AB16-X16) -> 94 | AB16: =SUM(X$7) -> 256
A17: 11 | B17: Matt Kaster | C17: MVP | D17: 11-098 | E17: Moose | F17: 28 | I17: 16 | L17: 26 | M17: 27 | O17: 28 | P17: 18 | R17: 15 | X17: =SUM(+F17+G17+I17+J17+L17+M17+O17+P17+R17+S17+U17+V17) -> 158 | Z17: =SUM(AB17-X17) -> 98 | AB17: =SUM(X$7) -> 256
A18: 12 | B18: Kenny Cornelison | C18: MVP | D18: 11-149 | E18: Storm Alert | F18: 21 | I18: 14 | L18: 15 | O18: 30 | P18: 34 | R18: 17 | X18: =SUM(+F18+G18+I18+J18+L18+M18+O18+P18+R18+S18+U18+V18) -> 131 | Z18: =SUM(AB18-X18) -> 125 | AB18: =SUM(X$7) -> 256
A19: 13 | B19: Mike Aschliman | C19: MVP | D19: 11-352 | E19: Cub 122 | F19: 27 | I19: 23 | L19: 24 | M19: 33 | O19: 22 | X19: =SUM(+F19+G19+I19+J19+L19+M19+O19+P19+R19+S19+U19+V19) -> 129 | Z19: =SUM(AB19-X19) -> 127 | AB19: =SUM(X$7) -> 256
A20: 14 | B20: Matt Kaster | C20: MVP | D20: 11-099 | E20: Super Freak | F20: 18 | I20: 16 | L20: 23 | O20: 29 | P20: 19 | R20: 19 | X20: =SUM(+F20+G20+I20+J20+L20+M20+O20+P20+R20+S20+U20+V20) -> 124 | Z20: =SUM(AB20-X20) -> 132 | AB20: =SUM(X$7) -> 256
A21: 15 | B21: Brad Corzine | C21: JW | D21: 11-368 | E21: Just Black | I21: 23 | L21: 22 | O21: 20 | R21: 24 | S21: 29 | X21: =SUM(+F21+G21+I21+J21+L21+M21+O21+P21+R21+S21+U21+V21) -> 118 | Z21: =SUM(AB21-X21) -> 138 | AB21: =SUM(X$7) -> 256
A22: 16 | B22: David Gawatz | C22: JW | D22: 11-184 | E22: Low Hung Buck | I22: 19 | L22: 21 | O22: 16 | R22: 26 | S22: 34 | X22: =SUM(+F22+G22+I22+J22+L22+M22+O22+P22+R22+S22+U22+V22) -> 116 | Z22: =SUM(AB22-X22) -> 140 | AB22: =SUM(X$7) -> 256
A23: 17 | B23: Elaine Fisher | C23: JW | D23: 11-080 | E23: Blue Thunder | F23: 9 | I23: 22 | L23: 24 | M23: 28 | R23: 19 | X23: =SUM(+F23+G23+I23+J23+L23+M23+O23+P23+R23+S23+U23+V23) -> 102 | Z23: =SUM(AB23-X23) -> 154 | AB23: =SUM(X$7) -> 256
A24: 18 | B24: Jeff Chrisman | C24: VM | D24: 11-180 | I24: 20 | O24: 19 | R24: 29 | S24: 30 | X24: =SUM(+F24+G24+I24+J24+L24+M24+O24+P24+R24+S24+U24+V24) -> 98 | Z24: =SUM(AB24-X24) -> 158 | AB24: =SUM(X$7) -> 256
A25: 19 | B25: Russ Nichols | C25: NP | D25: 11-070 | E25: Wild One Two | I25: 26 | R25: 25 | S25: 40 | X25: =SUM(+F25+G25+I25+J25+L25+M25+O25+P25+R25+S25+U25+V25) -> 91 | Z25: =SUM(AB25-X25) -> 165 | AB25: =SUM(X$7) -> 256
A26: 20 | B26: Lowell Vis | C26: MWSC | D26: 11-333 | E26: Skittles | F26: 10 | I26: 21 | L26: 19 | O26: 20 | R26: 20 | X26: =SUM(+F26+G26+I26+J26+L26+M26+O26+P26+R26+S26+U26+V26) -> 90 | Z26: =SUM(AB26-X26) -> 166 | AB26: =SUM(X$7) -> 256
A27: 21 | B27: Trampis Hamilton | C27: VM | D27: 11-361 | E27: Digger | O27: 25 | P27: 35 | R27: 21 | X27: =SUM(+F27+G27+I27+J27+L27+M27+O27+P27+R27+S27+U27+V27) -> 81 | Z27: =SUM(AB27-X27) -> 175 | AB27: =SUM(X$7) -> 256
A28: 22 | B28: Shane Stinson | C28: SS | D28: 11-200 | E28: Roller Kolher | F28: 16 | R28: 28 | S28: 33 | X28: =SUM(+F28+G28+I28+J28+L28+M28+O28+P28+R28+S28+U28+V28) -> 77 | Z28: =SUM(AB28-X28) -> 179 | AB28: =SUM(X$7) -> 256
A29: 23 | B29: Shane Heits | C29: Heits | D29: 11-366 | E29: Dirt Fed | F29: 8 | L29: 21 | O29: 21 | R29: 22 | X29: =SUM(+F29+G29+I29+J29+L29+M29+O29+P29+R29+S29+U29+V29) -> 72 | Z29: =SUM(AB29-X29) -> 184 | AB29: =SUM(X$7) -> 256
A30: 24 | B30: Mike Kyle | D30: 11-394 | O30: 17 | R30: 27 | S30: 28 | X30: =SUM(+F30+G30+I30+J30+L30+M30+O30+P30+R30+S30+U30+V30) -> 72 | Z30: =SUM(AB30-X30) -> 184 | AB30: =SUM(X$7) -> 256
A31: 25 | B31: David Knapp | C31: MVP | D31: 11-381 | E31: Knapp Time | I31: 18 | L31: 16 | O31: 19 | R31: 14 | X31: =SUM(+F31+G31+I31+J31+L31+M31+O31+P31+R31+S31+U31+V31) -> 67 | Z31: =SUM(AB31-X31) -> 189 | AB31: =SUM(X$7) -> 256
A32: 26 | B32: Dan Schell | C32: MVP | D32: 11-375 | E32: Menace | I32: 22 | O32: 21 | R32: 18 | X32: =SUM(+F32+G32+I32+J32+L32+M32+O32+P32+R32+S32+U32+V32) -> 61 | Z32: =SUM(AB32-X32) -> 195 | AB32: =SUM(X$7) -> 256
A33: 27 | B33: Carl Zimmerman | D33: 11-395 | E33: Bragging Rights | L33: 27 | M33: 34 | X33: =SUM(+F33+G33+I33+J33+L33+M33+O33+P33+R33+S33+U33+V33) -> 61 | Z33: =SUM(AB33-X33) -> 195 | AB33: =SUM(X$7) -> 256
A34: 28 | B34: Mike Spencer | C34: MVP | D34: 11-278 | E34: Longshot | F34: 14 | I34: 16 | L34: 15 | R34: 13 | X34: =SUM(+F34+G34+I34+J34+L34+M34+O34+P34+R34+S34+U34+V34) -> 58 | Z34: =SUM(AB34-X34) -> 198 | AB34: =SUM(X$7) -> 256
A35: 29 | B35: Casey Schell | D35: 11-407 | E35: H2O Head | O35: 25 | P35: 33 | X35: =SUM(+F35+G35+I35+J35+L35+M35+O35+P35+R35+S35+U35+V35) -> 58 | Z35: =SUM(AB35-X35) -> 198 | AB35: =SUM(X$7) -> 256
A36: 30 | B36: Dave Mascher Jr | C36: JW | D36: 11-163 | L36: 28 | M36: 29 | X36: =SUM(+F36+G36+I36+J36+L36+M36+O36+P36+R36+S36+U36+V36) -> 57 | Z36: =SUM(AB36-X36) -> 199 | AB36: =SUM(X$7) -> 256
A37: 31 | B37: Todd Hammond | C37: JRS | D37: 11-301 | E37: Punisher | L37: 26 | M37: 30 | X37: =SUM(+F37+G37+I37+J37+L37+M37+O37+P37+R37+S37+U37+V37) -> 56 | Z37: =SUM(AB37-X37) -> 200 | AB37: =SUM(X$7) -> 256
A38: 32 | B38: Carla Morgenstern | C38: JRS | D38: 11-216 | E38: High Maintenance | F38: 17 | I38: 19 | L38: 18 | X38: =SUM(+F38+G38+I38+J38+L38+M38+O38+P38+R38+S38+U38+V38) -> 54 | Z38: =SUM(AB38-X38) -> 202 | AB38: =SUM(X$7) -> 256
A39: 33 | B39: Rob Wise | C39: MVP | D39: 11-209 | E39: Longshot | I39: 30 | L39: 17 | X39: =SUM(+F39+G39+I39+J39+L39+M39+O39+P39+R39+S39+U39+V39) -> 47 | Z39: =SUM(AB39-X39) -> 209 | AB39: =SUM(X$7) -> 256
A40: 34 | B40: Eric Pike | C40: VM | D40: 11-353 | E40: Too Blue | O40: 22 | R40: 23 | X40: =SUM(+F40+G40+I40+J40+L40+M40+O40+P40+R40+S40+U40+V40) -> 45 | Z40: =SUM(AB40-X40) -> 211 | AB40: =SUM(X$7) -> 256
A41: 35 | B41: Dick Eldridge | C41: GTP | D41: 11-340 | E41: Hay Baler | F41: 7 | L41: 20 | R41: 17 | X41: =SUM(+F41+G41+I41+J41+L41+M41+O41+P41+R41+S41+U41+V41) -> 44 | Z41: =SUM(AB41-X41) -> 212 | AB41: =SUM(X$7) -> 256
A42: 36 | B42: Aaron Scroggins | C42: VM | D42: 11-111 | E42: Black Out | O42: 26 | P42: 17 | X42: =SUM(+F42+G42+I42+J42+L42+M42+O42+P42+R42+S42+U42+V42) -> 43 | Z42: =SUM(AB42-X42) -> 213 | AB42: =SUM(X$7) -> 256
A43: 37 | B43: Ryan Shafer | C43: Ryan | D43: 11-206 | E43: Roadrunner | F43: 11 | I43: 16 | L43: 16 | X43: =SUM(+F43+G43+I43+J43+L43+M43+O43+P43+R43+S43+U43+V43) -> 43 | Z43: =SUM(AB43-X43) -> 213 | AB43: =SUM(X$7) -> 256
A44: 38 | B44: Mark Conover | C44: VM | D44: 11-360 | I44: 26 | R44: 16 | X44: =SUM(+F44+G44+I44+J44+L44+M44+O44+P44+R44+S44+U44+V44) -> 42 | Z44: =SUM(AB44-X44) -> 214 | AB44: =SUM(X$7) -> 256
A45: 39 | B45: Dave Richter | D45: 11-207 | E45: Hustler | I45: 18 | L45: 17 | X45: =SUM(+F45+G45+I45+J45+L45+M45+O45+P45+R45+S45+U45+V45) -> 35 | Z45: =SUM(AB45-X45) -> 221 | AB45: =SUM(X$7) -> 256
A46: 40 | B46: Larry Dunlap | C46: S&S | D46: 11-201 | E46: Renegade | F46: 12 | R46: 14 | X46: =SUM(+F46+G46+I46+J46+L46+M46+O46+P46+R46+S46+U46+V46) -> 26 | Z46: =SUM(AB46-X46) -> 230 | AB46: =SUM(X$7) -> 256
A47: 41 | B47: Larry Hunter | D47: 11-009 | E47: Runaway Deere | I47: 25 | X47: =SUM(+F47+G47+I47+J47+L47+M47+O47+P47+R47+S47+U47+V47) -> 25 | Z47: =SUM(AB47-X47) -> 231 | AB47: =SUM(X$7) -> 256
A48: 42 | B48: Bill Richerson | C48: NP | D48: 11-132 | E48: Walk the Line | I48: 25 | X48: =SUM(+F48+G48+I48+J48+L48+M48+O48+P48+R48+S48+U48+V48) -> 25 | Z48: =SUM(AB48-X48) -> 231 | AB48: =SUM(X$7) -> 256
A49: 43 | B49: Allison Manville | C49: JRS | D49: 11-234 | E49: No Fluke | L49: 22 | X49: =SUM(+F49+G49+I49+J49+L49+M49+O49+P49+R49+S49+U49+V49) -> 22 | Z49: =SUM(AB49-X49) -> 234 | AB49: =SUM(X$7) -> 256
A50: 44 | B50: Eric Pike | C50: VM | D50: 11-359 | E50: Visual Expression | R50: 22 | X50: =SUM(+F50+G50+I50+J50+L50+M50+O50+P50+R50+S50+U50+V50) -> 22 | Z50: =SUM(AB50-X50) -> 234 | AB50: =SUM(X$7) -> 256
A51: 45 | B51: Dustin Blair | C51: JW | D51: 11-380 | I51: 21 | X51: =SUM(+F51+G51+I51+J51+L51+M51+O51+P51+R51+S51+U51+V51) -> 21 | Z51: =SUM(AB51-X51) -> 235 | AB51: =SUM(X$7) -> 256
A52: 46 | B52: Kelly Nichols | C52: NP | D52: 11-008 | E52: Wicked Deere | I52: 20 | X52: =SUM(+F52+G52+I52+J52+L52+M52+O52+P52+R52+S52+U52+V52) -> 20 | Z52: =SUM(AB52-X52) -> 236 | AB52: =SUM(X$7) -> 256
A53: 47 | B53: Jeremy Jaspering | C53: MVP | D53: 11-147 | E53: Wicked | R53: 20 | X53: =SUM(+F53+G53+I53+J53+L53+M53+O53+P53+R53+S53+U53+V53) -> 20 | Z53: =SUM(AB53-X53) -> 236 | AB53: =SUM(X$7) -> 256
A54: 48 | B54: Doug Diehl | C54: NP | D54: 11-385 | E54: Eliminator | L54: 19 | X54: =SUM(+F54+G54+I54+J54+L54+M54+O54+P54+R54+S54+U54+V54) -> 19 | Z54: =SUM(AB54-X54) -> 237 | AB54: =SUM(X$7) -> 256
A55: 49 | B55: Rick Massey | D55: 11-420 | E55: Special Addiction | O55: 19 | X55: =SUM(+F55+G55+I55+J55+L55+M55+O55+P55+R55+S55+U55+V55) -> 19 | Z55: =SUM(AB55-X55) -> 237 | AB55: =SUM(X$7) -> 256
A56: 50 | B56: Doug Diehl | C56: NP | D56: 11-242 | E56: Extra Wild | L56: 18 | X56: =SUM(+F56+G56+I56+J56+L56+M56+O56+P56+R56+S56+U56+V56) -> 18 | Z56: =SUM(AB56-X56) -> 238 | AB56: =SUM(X$7) -> 256
A57: 51 | B57: Mark Sheetz | C57: MVP | D57: 11-417 | E57: Sparky | O57: 18 | X57: =SUM(+F57+G57+I57+J57+L57+M57+O57+P57+R57+S57+U57+V57) -> 18 | Z57: =SUM(AB57-X57) -> 238 | AB57: =SUM(X$7) -> 256
A58: 52 | B58: Eldon Wright | C58: MVP | D58: 11-431 | E58: Willie | R58: 18 | X58: =SUM(+F58+G58+I58+J58+L58+M58+O58+P58+R58+S58+U58+V58) -> 18 | Z58: =SUM(AB58-X58) -> 238 | AB58: =SUM(X$7) -> 256
A59: 53 | B59: Zach Richerson | C59: JW | D59: 11-348 | E59: Zachs Rat | I59: 17 | X59: =SUM(+F59+G59+I59+J59+L59+M59+O59+P59+R59+S59+U59+V59) -> 17 | Z59: =SUM(AB59-X59) -> 239 | AB59: =SUM(X$7) -> 256
A60: 54 | B60: James Spencer | D60: 11- | E60: Twin Addiction | R60: 16 | X60: =SUM(+F60+G60+I60+J60+L60+M60+O60+P60+R60+S60+U60+V60) -> 16 | Z60: =SUM(AB60-X60) -> 240 | AB60: =SUM(X$7) -> 256
A61: 55 | B61: Jamey Pierce | C61: Pierce | D61: 11-031 | E61: Simese Twin | F61: 15 | X61: =SUM(+F61+G61+I61+J61+L61+M61+O61+P61+R61+S61+U61+V61) -> 15 | Z61: =SUM(AB61-X61) -> 241 | AB61: =SUM(X$7) -> 256
A62: 56 | B62: Wes Kampeter | C62: NP | D62: 11-423 | E62: Torqued Up | R62: 15 | X62: =SUM(+F62+G62+I62+J62+L62+M62+O62+P62+R62+S62+U62+V62) -> 15 | Z62: =SUM(AB62-X62) -> 241 | AB62: =SUM(X$7) -> 256
A63: 57 | B63: Will Durstine | C63: JRS | D63: 11-264 | E63: Never Satisfied | F63: 13 | X63: =SUM(+F63+G63+I63+J63+L63+M63+O63+P63+R63+S63+U63+V63) -> 13 | Z63: =SUM(AB63-X63) -> 243 | AB63: =SUM(X$7) -> 256