B1: OUTLAW CLASS | F1: Thru Sturgis | H1: Stock Altered Class | M1: Thru Sturgis
B2: Name | C2: Eng. | D2: NQS # | E2: Tractor | F2: Points Back | I2: Name | J2: Eng. | K2: NQS # | L2: Tractor | M2: Points Back
A3: =Outlaw!A6 -> 1 | B3: =Outlaw!B6 -> Mike Yeley | C3: =IF(Outlaw!C6=0," ",Outlaw!C6) -> JW | D3: =Outlaw!D6 -> 11-055 | E3: =IF(Outlaw!E6=0," ",Outlaw!E6) -> Papa's Ride | F3: =Outlaw!Z6 -> 0 | H3: ='Stock Altered'!A6 -> 1 | I3: ='Stock Altered'!B6 -> Todd Vorhees | J3: =IF('Stock Altered'!C6=0,"",'Stock Altered'!C6) -> TV | K3: ='Stock Altered'!D6 -> 11-313 | L3: =IF('Stock Altered'!E6=0,"",'Stock Altered'!E6) -> Red Cadet | M3: ='Stock Altered'!Z6 -> 0
A4: =Outlaw!A7 -> 2 | B4: =Outlaw!B7 -> Carl Frueh | C4: =IF(Outlaw!C7=0," ",Outlaw!C7) -> JRS | D4: =Outlaw!D7 -> 11-279 | E4: =IF(Outlaw!E7=0," ",Outlaw!E7) -> Blue Thunder 2 | F4: =Outlaw!Z7 -> 3 | H4: ='Stock Altered'!A7 -> 2 | I4: ='Stock Altered'!B7 -> Kelly Nichols | J4: =IF('Stock Altered'!C7=0,"",'Stock Altered'!C7) -> NP | K4: ='Stock Altered'!D7 -> 11-358 | L4: =IF('Stock Altered'!E7=0,"",'Stock Altered'!E7) -> Maxxed Out | M4: ='Stock Altered'!Z7 -> 5
A5: =Outlaw!A8 -> 3 | B5: =Outlaw!B8 -> Tyler Black | C5: =IF(Outlaw!C8=0," ",Outlaw!C8) -> NP | D5: =Outlaw!D8 -> 11-135 | E5: =IF(Outlaw!E8=0," ",Outlaw!E8) -> Wild Child | F5: =Outlaw!Z8 -> 10 | H5: ='Stock Altered'!A8 -> 3 | I5: ='Stock Altered'!B8 -> Eli Zimmerman | J5: =IF('Stock Altered'!C8=0,"",'Stock Altered'!C8) -> NP | K5: ='Stock Altered'!D8 -> 11-075 | L5: =IF('Stock Altered'!E8=0,"",'Stock Altered'!E8) -> Red Fever | M5: ='Stock Altered'!Z8 -> 30
A6: =Outlaw!A9 -> 4 | B6: =Outlaw!B9 -> Todd Vorhees | C6: =IF(Outlaw!C9=0," ",Outlaw!C9) -> TV | D6: =Outlaw!D9 -> 11-313 | E6: =IF(Outlaw!E9=0," ",Outlaw!E9) -> Red Cadet | F6: =Outlaw!Z9 -> 10 | H6: ='Stock Altered'!A9 -> 4 | I6: ='Stock Altered'!B9 -> Mitzi Brown | J6: =IF('Stock Altered'!C9=0,"",'Stock Altered'!C9) -> NP | K6: ='Stock Altered'!D9 -> 11-159 | L6: =IF('Stock Altered'!E9=0,"",'Stock Altered'!E9) -> Barnyard Bandit | M6: ='Stock Altered'!Z9 -> 42
A7: =Outlaw!A10 -> 5 | B7: =Outlaw!B10 -> Dave Washburn | C7: =IF(Outlaw!C10=0," ",Outlaw!C10) -> BJ | D7: =Outlaw!D10 -> 11-156 | E7: =IF(Outlaw!E10=0," ",Outlaw!E10) -> Last Minute | F7: =Outlaw!Z10 -> 15 | H7: ='Stock Altered'!A10 -> 5 | I7: ='Stock Altered'!B10 -> Mike Yeley | J7: =IF('Stock Altered'!C10=0,"",'Stock Altered'!C10) -> JW | K7: ='Stock Altered'!D10 -> 11-055 | L7: =IF('Stock Altered'!E10=0,"",'Stock Altered'!E10) -> Papa's Ride | M7: ='Stock Altered'!Z10 -> 49
A8: =Outlaw!A11 -> 6 | B8: =Outlaw!B11 -> Kelly Nichols | C8: =IF(Outlaw!C11=0," ",Outlaw!C11) -> NP | D8: =Outlaw!D11 -> 11-358 | E8: =IF(Outlaw!E11=0," ",Outlaw!E11) -> Maxxed Out | F8: =Outlaw!Z11 -> 17 | H8: ='Stock Altered'!A11 -> 6 | I8: ='Stock Altered'!B11 -> Gary Cunningham | J8: =IF('Stock Altered'!C11=0,"",'Stock Altered'!C11) -> NP | K8: ='Stock Altered'!D11 -> 11-162 | L8: =IF('Stock Altered'!E11=0,"",'Stock Altered'!E11) -> High Voltage | M8: ='Stock Altered'!Z11 -> 50
A9: =Outlaw!A12 -> 7 | B9: =Outlaw!B12 -> Eli Zimmerman | C9: =IF(Outlaw!C12=0," ",Outlaw!C12) -> NP | D9: =Outlaw!D12 -> 11-075 | E9: =IF(Outlaw!E12=0," ",Outlaw!E12) -> Red Fever | F9: =Outlaw!Z12 -> 42 | H9: ='Stock Altered'!A12 -> 7 | I9: ='Stock Altered'!B12 -> Tyler Spindler | J9: =IF('Stock Altered'!C12=0,"",'Stock Altered'!C12) -> TV | K9: ='Stock Altered'!D12 -> 11-005 | L9: =IF('Stock Altered'!E12=0,"",'Stock Altered'!E12) -> Funky Chicken | M9: ='Stock Altered'!Z12 -> 63
A10: =Outlaw!A13 -> 8 | B10: =Outlaw!B13 -> Dave Woods | C10: =IF(Outlaw!C13=0," ",Outlaw!C13) -> Woods | D10: =Outlaw!D13 -> 11-289 | E10: =IF(Outlaw!E13=0," ",Outlaw!E13) -> Smoke & Mirrors | F10: =Outlaw!Z13 -> 45 | H10: ='Stock Altered'!A13 -> 8 | I10: ='Stock Altered'!B13 -> Greg Watson | J10: =IF('Stock Altered'!C13=0,"",'Stock Altered'!C13) -> LR | K10: ='Stock Altered'!D13 -> 11-327 | L10: =IF('Stock Altered'!E13=0,"",'Stock Altered'!E13) -> Road Warrior | M10: ='Stock Altered'!Z13 -> 66
A11: =Outlaw!A14 -> 9 | B11: =Outlaw!B14 -> Matt Ronnebaum | C11: =IF(Outlaw!C14=0," ",Outlaw!C14) -> TV | D11: =Outlaw!D14 -> 11-089 | E11: =IF(Outlaw!E14=0," ",Outlaw!E14) -> Boy's & Their Toys | F11: =Outlaw!Z14 -> 46 | H11: ='Stock Altered'!A14 -> 9 | I11: ='Stock Altered'!B14 -> Matt Ronnebaum | J11: =IF('Stock Altered'!C14=0,"",'Stock Altered'!C14) -> TV | K11: ='Stock Altered'!D14 -> 11-089 | L11: =IF('Stock Altered'!E14=0,"",'Stock Altered'!E14) -> Boy's & Their Toys | M11: ='Stock Altered'!Z14 -> 69
A12: =Outlaw!A15 -> 10 | B12: =Outlaw!B15 -> Bob Jones Jr | C12: =IF(Outlaw!C15=0," ",Outlaw!C15) -> BJ | D12: =Outlaw!D15 -> 11-183 | E12: =IF(Outlaw!E15=0," ",Outlaw!E15) -> Playdough | F12: =Outlaw!Z15 -> 49 | H12: ='Stock Altered'!A15 -> 10 | I12: ='Stock Altered'!B15 -> Carl Frueh | J12: =IF('Stock Altered'!C15=0,"",'Stock Altered'!C15) -> JRS | K12: ='Stock Altered'!D15 -> 11-279 | L12: =IF('Stock Altered'!E15=0,"",'Stock Altered'!E15) -> Blue Thumper 2 | M12: ='Stock Altered'!Z15 -> 75
A13: =Outlaw!A16 -> 11 | B13: =Outlaw!B16 -> Gary Cunningham | C13: =IF(Outlaw!C16=0," ",Outlaw!C16) -> NP | D13: =Outlaw!D16 -> 11-162 | E13: =IF(Outlaw!E16=0," ",Outlaw!E16) -> High Voltage | F13: =Outlaw!Z16 -> 52 | H13: ='Stock Altered'!A16 -> 11 | I13: ='Stock Altered'!B16 -> Brian Simpson | J13: =IF('Stock Altered'!C16=0,"",'Stock Altered'!C16) -> Woods | K13: ='Stock Altered'!D16 -> 11-290 | L13: =IF('Stock Altered'!E16=0,"",'Stock Altered'!E16) -> Rampdoor Express | M13: ='Stock Altered'!Z16 -> 79
A14: =Outlaw!A17 -> 12 | B14: =Outlaw!B17 -> Scott Bye | C14: =IF(Outlaw!C17=0," ",Outlaw!C17) -> JW | D14: =Outlaw!D17 -> 11-187 | E14: =IF(Outlaw!E17=0," ",Outlaw!E17) -> Splinter | F14: =Outlaw!Z17 -> 61 | H14: ='Stock Altered'!A17 -> 12 | I14: ='Stock Altered'!B17 -> Keith Frueh | J14: =IF('Stock Altered'!C17=0,"",'Stock Altered'!C17) -> JRS | K14: ='Stock Altered'!D17 -> 11-086 | L14: =IF('Stock Altered'!E17=0,"",'Stock Altered'!E17) -> Fearless | M14: ='Stock Altered'!Z17 -> 82
A15: =Outlaw!A18 -> 13 | B15: =Outlaw!B18 -> Andy Ferguson | C15: =IF(Outlaw!C18=0," ",Outlaw!C18) -> MVP | D15: =Outlaw!D18 -> 11-100 | E15: =IF(Outlaw!E18=0," ",Outlaw!E18) -> Rasin Cane | F15: =Outlaw!Z18 -> 63 | H15: ='Stock Altered'!A18 -> 13 | I15: ='Stock Altered'!B18 -> Gary Seaman | J15: =IF('Stock Altered'!C18=0,"",'Stock Altered'!C18) -> BJ | K15: ='Stock Altered'!D18 -> 11-191 | L15: =IF('Stock Altered'!E18=0,"",'Stock Altered'!E18) -> Farmer's Money | M15: ='Stock Altered'!Z18 -> 94
A16: =Outlaw!A19 -> 14 | B16: =Outlaw!B19 -> Tyler Spindler | C16: =IF(Outlaw!C19=0," ",Outlaw!C19) -> TV | D16: =Outlaw!D19 -> 11-005 | E16: =IF(Outlaw!E19=0," ",Outlaw!E19) -> Funkey Chicken | F16: =Outlaw!Z19 -> 64 | H16: ='Stock Altered'!A19 -> 14 | I16: ='Stock Altered'!B19 -> Tyler Black | J16: =IF('Stock Altered'!C19=0,"",'Stock Altered'!C19) -> NP | K16: ='Stock Altered'!D19 -> 11-135 | L16: =IF('Stock Altered'!E19=0,"",'Stock Altered'!E19) -> Wild Child | M16: ='Stock Altered'!Z19 -> 95
A17: =Outlaw!A20 -> 15 | B17: =Outlaw!B20 -> Mike McGaha | C17: =IF(Outlaw!C20=0," ",Outlaw!C20) -> JW | D17: =Outlaw!D20 -> 11-288 | E17: =IF(Outlaw!E20=0," ",Outlaw!E20) -> Company Time | F17: =Outlaw!Z20 -> 65 | H17: ='Stock Altered'!A20 -> 15 | I17: ='Stock Altered'!B20 -> Mark Brown | J17: =IF('Stock Altered'!C20=0,"",'Stock Altered'!C20) -> NP | K17: ='Stock Altered'!D20 -> 11-160 | L17: =IF('Stock Altered'!E20=0,"",'Stock Altered'!E20) -> Buckshot | M17: ='Stock Altered'!Z20 -> 102
A18: =Outlaw!A21 -> 16 | B18: =Outlaw!B21 -> Donnie Herring | C18: =IF(Outlaw!C21=0," ",Outlaw!C21) -> TV | D18: =Outlaw!D21 -> 11-331 | E18: =IF(Outlaw!E21=0," ",Outlaw!E21) -> Pasttime | F18: =Outlaw!Z21 -> 74 | H18: ='Stock Altered'!A21 -> 16 | I18: ='Stock Altered'!B21 -> Tim Shaw | J18: =IF('Stock Altered'!C21=0,"",'Stock Altered'!C21) -> TV | K18: ='Stock Altered'!D21 -> 11-246 | L18: =IF('Stock Altered'!E21=0,"",'Stock Altered'!E21) -> No Outlet | M18: ='Stock Altered'!Z21 -> 102
A19: =Outlaw!A22 -> 17 | B19: =Outlaw!B22 -> Jamie Lewis | C19: =IF(Outlaw!C22=0," ",Outlaw!C22) -> TV | D19: =Outlaw!D22 -> 11-019 | E19: =IF(Outlaw!E22=0," ",Outlaw!E22) -> O-So-Orange | F19: =Outlaw!Z22 -> 75 | H19: ='Stock Altered'!A22 -> 17 | I19: ='Stock Altered'!B22 -> Dave Washburn | J19: =IF('Stock Altered'!C22=0,"",'Stock Altered'!C22) -> BJ | K19: ='Stock Altered'!D22 -> 11-156 | L19: =IF('Stock Altered'!E22=0,"",'Stock Altered'!E22) -> Last Minute | M19: ='Stock Altered'!Z22 -> 111
A20: =Outlaw!A23 -> 18 | B20: =Outlaw!B23 -> Ron Hodge | C20: =IF(Outlaw!C23=0," ",Outlaw!C23) -> TV | D20: =Outlaw!D23 -> 11-071 | E20: =IF(Outlaw!E23=0," ",Outlaw!E23) -> Take-N-Names | F20: =Outlaw!Z23 -> 80 | H20: ='Stock Altered'!A23 -> 18 | I20: ='Stock Altered'!B23 -> Lonnie Lewis | J20: =IF('Stock Altered'!C23=0,"",'Stock Altered'!C23) -> TV | K20: ='Stock Altered'!D23 -> 11-024 | L20: =IF('Stock Altered'!E23=0,"",'Stock Altered'!E23) -> Deuces Wild | M20: ='Stock Altered'!Z23 -> 113
A21: =Outlaw!A24 -> 19 | B21: =Outlaw!B24 -> Ben Larkins | C21: =IF(Outlaw!C24=0," ",Outlaw!C24) -> JW | D21: =Outlaw!D24 -> 11-137 | E21: =IF(Outlaw!E24=0," ",Outlaw!E24) -> Indian Outlaw | F21: =Outlaw!Z24 -> 81 | H21: ='Stock Altered'!A24 -> 19 | I21: ='Stock Altered'!B24 -> Mike McGaha | J21: =IF('Stock Altered'!C24=0,"",'Stock Altered'!C24) -> JW | K21: ='Stock Altered'!D24 -> 11-288 | L21: =IF('Stock Altered'!E24=0,"",'Stock Altered'!E24) -> Company Time | M21: ='Stock Altered'!Z24 -> 120
A22: =Outlaw!A25 -> 20 | B22: =Outlaw!B25 -> Doug Seaman | C22: =IF(Outlaw!C25=0," ",Outlaw!C25) -> BJ | D22: =Outlaw!D25 -> 11-192 | E22: =IF(Outlaw!E25=0," ",Outlaw!E25) -> Massey Ferguson | F22: =Outlaw!Z25 -> 82 | H22: ='Stock Altered'!A25 -> 20 | I22: ='Stock Altered'!B25 -> Donnie Herring | J22: =IF('Stock Altered'!C25=0,"",'Stock Altered'!C25) -> TV | K22: ='Stock Altered'!D25 -> 11-331 | L22: =IF('Stock Altered'!E25=0,"",'Stock Altered'!E25) -> Pasttime | M22: ='Stock Altered'!Z25 -> 122
A23: =Outlaw!A26 -> 21 | B23: =Outlaw!B26 -> Keith Frueh | C23: =IF(Outlaw!C26=0," ",Outlaw!C26) -> JRS | D23: =Outlaw!D26 -> 11-086 | E23: =IF(Outlaw!E26=0," ",Outlaw!E26) -> Fearless | F23: =Outlaw!Z26 -> 84 | H23: ='Stock Altered'!A26 -> 21 | I23: ='Stock Altered'!B26 -> Doug Seaman | J23: =IF('Stock Altered'!C26=0,"",'Stock Altered'!C26) -> BJ | K23: ='Stock Altered'!D26 -> 11-192 | L23: =IF('Stock Altered'!E26=0,"",'Stock Altered'!E26) -> Massey Ferguson | M23: ='Stock Altered'!Z26 -> 128
A24: =Outlaw!A27 -> 22 | B24: =Outlaw!B27 -> Jill Chrisman | C24: =IF(Outlaw!C27=0," ",Outlaw!C27) -> VM | D24: =Outlaw!D27 -> 11-179 | E24: =IF(Outlaw!E27=0," ",Outlaw!E27) ->  | F24: =Outlaw!Z27 -> 85 | H24: ='Stock Altered'!A27 -> 22 | I24: ='Stock Altered'!B27 -> Bob Jones Jr | J24: =IF('Stock Altered'!C27=0,"",'Stock Altered'!C27) -> BJ | K24: ='Stock Altered'!D27 -> 11-183 | L24: =IF('Stock Altered'!E27=0,"",'Stock Altered'!E27) -> Playdough | M24: ='Stock Altered'!Z27 -> 129
A25: =Outlaw!A28 -> 23 | B25: =Outlaw!B28 -> Greg Watson | C25: =IF(Outlaw!C28=0," ",Outlaw!C28) -> LR | D25: =Outlaw!D28 -> 11-327 | E25: =IF(Outlaw!E28=0," ",Outlaw!E28) -> Road Warrior | F25: =Outlaw!Z28 -> 85 | H25: ='Stock Altered'!A28 -> 23 | I25: ='Stock Altered'!B28 -> Kenneth Smith | J25: =IF('Stock Altered'!C28=0,"",'Stock Altered'!C28) -> JRS | K25: ='Stock Altered'!D28 -> 11-125 | L25: =IF('Stock Altered'!E28=0,"",'Stock Altered'!E28) -> Sidewinder | M25: ='Stock Altered'!Z28 -> 131
A26: =Outlaw!A29 -> 24 | B26: =Outlaw!B29 -> Lonnie Lewis | C26: =IF(Outlaw!C29=0," ",Outlaw!C29) -> TV | D26: =Outlaw!D29 -> 11-024 | E26: =IF(Outlaw!E29=0," ",Outlaw!E29) -> Deuces Wild | F26: =Outlaw!Z29 -> 88 | H26: ='Stock Altered'!A29 -> 24 | I26: ='Stock Altered'!B29 -> Randy Demers | J26: =IF('Stock Altered'!C29=0,"",'Stock Altered'!C29) -> NP | K26: ='Stock Altered'!D29 -> 11-084 | L26: =IF('Stock Altered'!E29=0,"",'Stock Altered'!E29) -> Bounty Hunter | M26: ='Stock Altered'!Z29 -> 133
A27: =Outlaw!A30 -> 25 | B27: =Outlaw!B30 -> Gary Seaman | C27: =IF(Outlaw!C30=0," ",Outlaw!C30) -> BJ | D27: =Outlaw!D30 -> 11-191 | E27: =IF(Outlaw!E30=0," ",Outlaw!E30) -> Farmer's Money | F27: =Outlaw!Z30 -> 94 | H27: ='Stock Altered'!A30 -> 25 | I27: ='Stock Altered'!B30 -> Roger Davis | J27: =IF('Stock Altered'!C30=0,"",'Stock Altered'!C30) -> JRS | K27: ='Stock Altered'!D30 -> 11-068 | L27: =IF('Stock Altered'!E30=0,"",'Stock Altered'!E30) -> Dusty Lady | M27: ='Stock Altered'!Z30 -> 137
A28: =Outlaw!A31 -> 26 | B28: =Outlaw!B31 -> Roger Davis | C28: =IF(Outlaw!C31=0," ",Outlaw!C31) -> JRS | D28: =Outlaw!D31 -> 11-068 | E28: =IF(Outlaw!E31=0," ",Outlaw!E31) -> Dusty Lady | F28: =Outlaw!Z31 -> 95 | H28: ='Stock Altered'!A32 -> 27 | I28: ='Stock Altered'!B32 -> Trent Evans | J28: =IF('Stock Altered'!C32=0,"",'Stock Altered'!C32) -> NP | K28: ='Stock Altered'!D32 -> 11-357 | L28: =IF('Stock Altered'!E32=0,"",'Stock Altered'!E32) -> Bad out of Boyd | M28: ='Stock Altered'!Z32 -> 142
A29: =Outlaw!A32 -> 27 | B29: =Outlaw!B32 -> Wayne Sams | C29: =IF(Outlaw!C32=0," ",Outlaw!C32) -> TV | D29: =Outlaw!D32 -> 11-082 | E29: =IF(Outlaw!E32=0," ",Outlaw!E32) -> Gold Digger | F29: =Outlaw!Z32 -> 102 | H29: ='Stock Altered'!A33 -> 28 | I29: ='Stock Altered'!B33 -> Dave Woods | J29: =IF('Stock Altered'!C33=0,"",'Stock Altered'!C33) -> Woods | K29: ='Stock Altered'!D33 -> 11-289 | L29: =IF('Stock Altered'!E33=0,"",'Stock Altered'!E33) -> Smoke & Mirrors | M29: ='Stock Altered'!Z33 -> 146
A30: =Outlaw!A33 -> 28 | B30: =Outlaw!B33 -> Ron Finch | C30: =IF(Outlaw!C33=0," ",Outlaw!C33) -> Woods | D30: =Outlaw!D33 -> 11-142 | E30: =IF(Outlaw!E33=0," ",Outlaw!E33) -> Top Notch | F30: =Outlaw!Z33 -> 116 | H30: ='Stock Altered'!A34 -> 29 | I30: ='Stock Altered'!B34 -> Judy Lowe | J30: =IF('Stock Altered'!C34=0,"",'Stock Altered'!C34) -> TV | K30: ='Stock Altered'!D34 -> 11-010 | L30: =IF('Stock Altered'!E34=0,"",'Stock Altered'!E34) -> Slow Motion | M30: ='Stock Altered'!Z34 -> 148
A31: =Outlaw!A34 -> 29 | B31: =Outlaw!B34 -> Mitz Brown | C31: =IF(Outlaw!C34=0," ",Outlaw!C34) -> NP | D31: =Outlaw!D34 -> 11-159 | E31: =IF(Outlaw!E34=0," ",Outlaw!E34) -> Barnyard Bandit | F31: =Outlaw!Z34 -> 125 | H31: ='Stock Altered'!A35 -> 30 | I31: ='Stock Altered'!B35 -> Jill Chrisman | J31: =IF('Stock Altered'!C35=0,"",'Stock Altered'!C35) -> VM | K31: ='Stock Altered'!D35 -> 11-179 | L31: =IF('Stock Altered'!E35=0,"",'Stock Altered'!E35) ->  | M31: ='Stock Altered'!Z35 -> 164
A32: =Outlaw!A35 -> 30 | B32: =Outlaw!B35 -> Tony Heifner | C32: =IF(Outlaw!C35=0," ",Outlaw!C35) -> TH | D32: =Outlaw!D35 -> 11-116 | E32: =IF(Outlaw!E35=0," ",Outlaw!E35) -> Heartbeat | F32: =Outlaw!Z35 -> 129 | H32: ='Stock Altered'!A36 -> 31 | I32: ='Stock Altered'!B36 -> Bob Jones Sr | J32: =IF('Stock Altered'!C36=0,"",'Stock Altered'!C36) -> BJ | K32: ='Stock Altered'!D36 -> 11-182 | L32: =IF('Stock Altered'!E36=0,"",'Stock Altered'!E36) -> Buckeye Binder | M32: ='Stock Altered'!Z36 -> 164
A33: =Outlaw!A36 -> 31 | B33: =Outlaw!B36 -> Tim Shaw | C33: =IF(Outlaw!C36=0," ",Outlaw!C36) -> TV | D33: =Outlaw!D36 -> 11-246 | E33: =IF(Outlaw!E36=0," ",Outlaw!E36) -> No Oulet | F33: =Outlaw!Z36 -> 135 | H33: ='Stock Altered'!A37 -> 32 | I33: ='Stock Altered'!B37 -> Ron Hodge | J33: =IF('Stock Altered'!C37=0,"",'Stock Altered'!C37) -> TV | K33: ='Stock Altered'!D37 -> 11-071 | L33: =IF('Stock Altered'!E37=0,"",'Stock Altered'!E37) -> Take-N-Names | M33: ='Stock Altered'!Z37 -> 170
A34: =Outlaw!A37 -> 32 | B34: =Outlaw!B37 -> Randy Demers | C34: =IF(Outlaw!C37=0," ",Outlaw!C37) -> NP | D34: =Outlaw!D37 -> 11-084 | E34: =IF(Outlaw!E37=0," ",Outlaw!E37) -> Bounty Hunter | F34: =Outlaw!Z37 -> 138 | H34: ='Stock Altered'!A38 -> 33 | I34: ='Stock Altered'!B38 -> Gary Frank | J34: =IF('Stock Altered'!C38=0,"",'Stock Altered'!C38) -> TV | K34: ='Stock Altered'!D38 -> 11-233 | L34: =IF('Stock Altered'!E38=0,"",'Stock Altered'!E38) -> Katies Toy | M34: ='Stock Altered'!Z38 -> 176
A35: =Outlaw!A38 -> 33 | B35: =Outlaw!B38 -> Shawn Garman | C35: =IF(Outlaw!C38=0," ",Outlaw!C38) -> JRS | D35: =Outlaw!D38 -> 11-230 | E35: =IF(Outlaw!E38=0," ",Outlaw!E38) -> Gun Slinger | F35: =Outlaw!Z38 -> 139 | H35: ='Stock Altered'!A39 -> 34 | I35: ='Stock Altered'!B39 -> Ron Finch | J35: =IF('Stock Altered'!C39=0,"",'Stock Altered'!C39) -> Woods | K35: ='Stock Altered'!D39 -> 11-142 | L35: =IF('Stock Altered'!E39=0,"",'Stock Altered'!E39) -> Top Notch | M35: ='Stock Altered'!Z39 -> 177
A36: =Outlaw!A39 -> 34 | B36: =Outlaw!B39 -> Kole Larkins | C36: =IF(Outlaw!C39=0," ",Outlaw!C39) -> JW | D36: =Outlaw!D39 -> 11-372 | E36: =IF(Outlaw!E39=0," ",Outlaw!E39) -> Wound Up | F36: =Outlaw!Z39 -> 141 | H36: ='Stock Altered'!A40 -> 35 | I36: ='Stock Altered'!B40 -> Jack Lowe | J36: =IF('Stock Altered'!C40=0,"",'Stock Altered'!C40) -> TV | K36: ='Stock Altered'!D40 -> 11-161 | L36: =IF('Stock Altered'!E40=0,"",'Stock Altered'!E40) -> Locomotion | M36: ='Stock Altered'!Z40 -> 183
A37: =Outlaw!A40 -> 35 | B37: =Outlaw!B40 -> Matt Rader | C37: =IF(Outlaw!C40=0," ",Outlaw!C40) -> RPM | D37: =Outlaw!D40 -> 11-259 | E37: =IF(Outlaw!E40=0," ",Outlaw!E40) -> Lethal Response | F37: =Outlaw!Z40 -> 144 | H37: ='Stock Altered'!A41 -> 36 | I37: ='Stock Altered'!B41 -> Todd Hinkle | J37: =IF('Stock Altered'!C41=0,"",'Stock Altered'!C41) -> RPM | K37: ='Stock Altered'!D41 -> 11-370 | L37: =IF('Stock Altered'!E41=0,"",'Stock Altered'!E41) -> Disturbed | M37: ='Stock Altered'!Z41 -> 184
A38: =Outlaw!A41 -> 36 | B38: =Outlaw!B41 -> Charlie Schultz | C38: =IF(Outlaw!C41=0," ",Outlaw!C41) -> MVP | D38: =Outlaw!D41 -> 11-102 | E38: =IF(Outlaw!E41=0," ",Outlaw!E41) -> Silver Bullet | F38: =Outlaw!Z41 -> 145 | H38: ='Stock Altered'!A42 -> 37 | I38: ='Stock Altered'!B42 -> Mark Rader | J38: =IF('Stock Altered'!C42=0,"",'Stock Altered'!C42) -> RPM | K38: ='Stock Altered'!D42 -> 11-213 | L38: =IF('Stock Altered'!E42=0,"",'Stock Altered'!E42) -> Lethal Weapon | M38: ='Stock Altered'!Z42 -> 186
A39: =Outlaw!A42 -> 37 | B39: =Outlaw!B42 -> Connie Morgenstern | C39: =IF(Outlaw!C42=0," ",Outlaw!C42) -> JRS | D39: =Outlaw!D42 -> 11-066 | E39: =IF(Outlaw!E42=0," ",Outlaw!E42) -> Domestic Diva | F39: =Outlaw!Z42 -> 149 | H39: ='Stock Altered'!A43 -> 38 | I39: ='Stock Altered'!B43 -> Ed Kerner | J39: =IF('Stock Altered'!C43=0,"",'Stock Altered'!C43) -> JRS | K39: ='Stock Altered'!D43 -> 11-303 | L39: =IF('Stock Altered'!E43=0,"",'Stock Altered'!E43) -> Along for the Ride | M39: ='Stock Altered'!Z43 -> 187
A40: =Outlaw!A43 -> 38 | B40: =Outlaw!B43 -> Mark Brown | C40: =IF(Outlaw!C43=0," ",Outlaw!C43) -> NP | D40: =Outlaw!D43 -> 11-160 | E40: =IF(Outlaw!E43=0," ",Outlaw!E43) -> Buckshot | F40: =Outlaw!Z43 -> 151 | H40: ='Stock Altered'!A44 -> 39 | I40: ='Stock Altered'!B44 -> Jamie Lewis | J40: =IF('Stock Altered'!C44=0,"",'Stock Altered'!C44) -> TV | K40: ='Stock Altered'!D44 -> 11-019 | L40: =IF('Stock Altered'!E44=0,"",'Stock Altered'!E44) -> O-So-Orange | M40: ='Stock Altered'!Z44 -> 190
A41: =Outlaw!A44 -> 39 | B41: =Outlaw!B44 -> Judy Lowe | C41: =IF(Outlaw!C44=0," ",Outlaw!C44) -> TV | D41: =Outlaw!D44 -> 11-010 | E41: =IF(Outlaw!E44=0," ",Outlaw!E44) -> Slow Motion | F41: =Outlaw!Z44 -> 160 | H41: ='Stock Altered'!A45 -> 40 | I41: ='Stock Altered'!B45 -> Danny Garman | J41: =IF('Stock Altered'!C45=0,"",'Stock Altered'!C45) -> JRS | K41: ='Stock Altered'!D45 -> 11-391 | L41: =IF('Stock Altered'!E45=0,"",'Stock Altered'!E45) -> Jag Master | M41: ='Stock Altered'!Z45 -> 192
A42: =Outlaw!A45 -> 40 | B42: =Outlaw!B45 -> Gary Frank | C42: =IF(Outlaw!C45=0," ",Outlaw!C45) -> TV | D42: =Outlaw!D45 -> 11-233 | E42: =IF(Outlaw!E45=0," ",Outlaw!E45) -> Katies Toy | F42: =Outlaw!Z45 -> 160 | H42: ='Stock Altered'!A46 -> 41 | I42: ='Stock Altered'!B46 -> Connie Morgenstern | J42: =IF('Stock Altered'!C46=0,"",'Stock Altered'!C46) -> JRS | K42: ='Stock Altered'!D46 -> 11-066 | L42: =IF('Stock Altered'!E46=0,"",'Stock Altered'!E46) -> Domestic Diva | M42: ='Stock Altered'!Z46 -> 197
A43: =Outlaw!A46 -> 41 | B43: =Outlaw!B46 -> Roger McKinney | C43: =IF(Outlaw!C46=0," ",Outlaw!C46) -> JRS | D43: =Outlaw!D46 -> 11-083 | E43: =IF(Outlaw!E46=0," ",Outlaw!E46) -> Blue Thunder | F43: =Outlaw!Z46 -> 162 | H43: ='Stock Altered'!A47 -> 42 | I43: ='Stock Altered'!B47 -> Steve Chrisman | J43: =IF('Stock Altered'!C47=0,"",'Stock Altered'!C47) -> Hackman | K43: ='Stock Altered'!D47 -> 11-022 | L43: =IF('Stock Altered'!E47=0,"",'Stock Altered'!E47) -> Raz ma Tazz | M43: ='Stock Altered'!Z47 -> 200
A44: =Outlaw!A47 -> 42 | B44: =Outlaw!B47 -> Ed Kenner | C44: =IF(Outlaw!C47=0," ",Outlaw!C47) -> JRS | D44: =Outlaw!D47 -> 11-303 | E44: =IF(Outlaw!E47=0," ",Outlaw!E47) -> Along for the Ride | F44: =Outlaw!Z47 -> 162 | H44: ='Stock Altered'!A48 -> 43 | I44: ='Stock Altered'!B48 -> Roger McKinney | J44: =IF('Stock Altered'!C48=0,"",'Stock Altered'!C48) -> JRS | K44: ='Stock Altered'!D48 -> 11-083 | L44: =IF('Stock Altered'!E48=0,"",'Stock Altered'!E48) -> Blue Thunder | M44: ='Stock Altered'!Z48 -> 202
A45: =Outlaw!A48 -> 43 | B45: =Outlaw!B48 -> John Elrod | C45: =IF(Outlaw!C48=0," ",Outlaw!C48) -> TV | D45: =Outlaw!D48 -> 11-020 | E45: =IF(Outlaw!E48=0," ",Outlaw!E48) -> Bad Habit | F45: =Outlaw!Z48 -> 166 | H45: ='Stock Altered'!A49 -> 44 | I45: ='Stock Altered'!B49 -> Bob Cooper | J45: =IF('Stock Altered'!C49=0,"",'Stock Altered'!C49) -> JRS | K45: ='Stock Altered'!D49 -> 11-072 | L45: =IF('Stock Altered'!E49=0,"",'Stock Altered'!E49) ->  | M45: ='Stock Altered'!Z49 -> 204
A46: =Outlaw!A49 -> 44 | B46: =Outlaw!B49 -> Bob Cooper | C46: =IF(Outlaw!C49=0," ",Outlaw!C49) -> JRS | D46: =Outlaw!D49 -> 11-072 | E46: =IF(Outlaw!E49=0," ",Outlaw!E49) ->  | F46: =Outlaw!Z49 -> 166 | H46: ='Stock Altered'!A50 -> 45 | I46: ='Stock Altered'!B50 -> John Elrod | J46: =IF('Stock Altered'!C50=0,"",'Stock Altered'!C50) -> TV | K46: ='Stock Altered'!D50 -> 11-020 | L46: =IF('Stock Altered'!E50=0,"",'Stock Altered'!E50) -> Bad Habit | M46: ='Stock Altered'!Z50 -> 207
A47: =Outlaw!A50 -> 45 | B47: =Outlaw!B50 -> Kenneth Smith | C47: =IF(Outlaw!C50=0," ",Outlaw!C50) -> JRS | D47: =Outlaw!D50 -> 11-125 | E47: =IF(Outlaw!E50=0," ",Outlaw!E50) -> Sidewinder | F47: =Outlaw!Z50 -> 167 | H47: ='Stock Altered'!A51 -> 46 | I47: ='Stock Altered'!B51 -> Bill Elrod | J47: =IF('Stock Altered'!C51=0,"",'Stock Altered'!C51) -> TV | K47: ='Stock Altered'!D51 -> 11-021 | L47: =IF('Stock Altered'!E51=0,"",'Stock Altered'!E51) -> PaPaws Toy | M47: ='Stock Altered'!Z51 -> 207
A48: =Outlaw!A51 -> 46 | B48: =Outlaw!B51 -> Mark Rader | C48: =IF(Outlaw!C51=0," ",Outlaw!C51) -> RPM | D48: =Outlaw!D51 -> 11-213 | E48: =IF(Outlaw!E51=0," ",Outlaw!E51) -> Lethal Weapon | F48: =Outlaw!Z51 -> 173 | H48: ='Stock Altered'!A52 -> 47 | I48: ='Stock Altered'!B52 -> Matt Rader | J48: =IF('Stock Altered'!C52=0,"",'Stock Altered'!C52) -> RPM | K48: ='Stock Altered'!D52 -> 11-259 | L48: =IF('Stock Altered'!E52=0,"",'Stock Altered'!E52) -> Lethal Response | M48: ='Stock Altered'!Z52 -> 226
A49: =Outlaw!A53 -> 48 | B49: =Outlaw!B53 -> Trent Evans | C49: =IF(Outlaw!C53=0," ",Outlaw!C53) -> NP | D49: =Outlaw!D53 -> 11-357 | E49: =IF(Outlaw!E53=0," ",Outlaw!E53) -> Bad out of Boyd | F49: =Outlaw!Z53 -> 174 | H49: ='Stock Altered'!A53 -> 48 | I49: ='Stock Altered'!B53 -> Gregory Vandervort | J49: =IF('Stock Altered'!C53=0,"",'Stock Altered'!C53) -> TV | K49: ='Stock Altered'!D53 -> 11-346 | L49: =IF('Stock Altered'!E53=0,"",'Stock Altered'!E53) -> Yellow Cub | M49: ='Stock Altered'!Z53 -> 236
A50: =Outlaw!A54 -> 49 | B50: =Outlaw!B54 -> Gaylord Strine | C50: =IF(Outlaw!C54=0," ",Outlaw!C54) -> JRS | D50: =Outlaw!D54 -> 11-126 | E50: =IF(Outlaw!E54=0," ",Outlaw!E54) ->  | F50: =Outlaw!Z54 -> 183 | H50: ='Stock Altered'!A54 -> 49 | I50: ='Stock Altered'!B54 -> Ron Feldkanmp | J50: =IF('Stock Altered'!C54=0,"",'Stock Altered'!C54) -> Woods | K50: ='Stock Altered'!D54 -> 11-143 | L50: =IF('Stock Altered'!E54=0,"",'Stock Altered'!E54) -> Key Chain | M50: ='Stock Altered'!Z54 -> 237
A51: =Outlaw!A55 -> 50 | B51: =Outlaw!B55 -> Tony Heifner | C51: =IF(Outlaw!C55=0," ",Outlaw!C55) -> TH | D51: =Outlaw!D55 -> 11-231 | E51: =IF(Outlaw!E55=0," ",Outlaw!E55) -> Instigator | F51: =Outlaw!Z55 -> 187 | H51: ='Stock Altered'!A55 -> 50 | I51: ='Stock Altered'!B55 -> Robin Cooper | J51: =IF('Stock Altered'!C55=0,"",'Stock Altered'!C55) -> JRS | K51: ='Stock Altered'!D55 -> 11-073 | L51: =IF('Stock Altered'!E55=0,"",'Stock Altered'!E55) ->  | M51: ='Stock Altered'!Z55 -> 250
A52: =Outlaw!A56 -> 51 | B52: =Outlaw!B56 -> Todd Hinkle | C52: =IF(Outlaw!C56=0," ",Outlaw!C56) -> RPM | D52: =Outlaw!D56 -> 11-370 | E52: =IF(Outlaw!E56=0," ",Outlaw!E56) -> Disturbed | F52: =Outlaw!Z56 -> 187 | H52: ='Stock Altered'!A56 -> 51 | I52: ='Stock Altered'!B56 -> Gaylord Strine | J52: =IF('Stock Altered'!C56=0,"",'Stock Altered'!C56) -> JRS | K52: ='Stock Altered'!D56 -> 11-126 | L52: =IF('Stock Altered'!E56=0,"",'Stock Altered'!E56) ->  | M52: ='Stock Altered'!Z56 -> 250
A53: =Outlaw!A57 -> 52 | B53: =Outlaw!B57 -> Jack Lowe | C53: =IF(Outlaw!C57=0," ",Outlaw!C57) -> TV | D53: =Outlaw!D57 -> 11-161 | E53: =IF(Outlaw!E57=0," ",Outlaw!E57) -> Locomotion | F53: =Outlaw!Z57 -> 189 | H53: ='Stock Altered'!A57 -> 52 | I53: ='Stock Altered'!B57 -> Randy Amstutz | J53: =IF('Stock Altered'!C57=0,"",'Stock Altered'!C57) -> Woods | K53: ='Stock Altered'!D57 -> 11-166 | L53: =IF('Stock Altered'!E57=0,"",'Stock Altered'!E57) -> Cub Cadet | M53: ='Stock Altered'!Z57 -> 257
A54: =Outlaw!A58 -> 53 | B54: =Outlaw!B58 -> Brian Simpson | C54: =IF(Outlaw!C58=0," ",Outlaw!C58) -> Woods | D54: =Outlaw!D58 -> 11-290 | E54: =IF(Outlaw!E58=0," ",Outlaw!E58) -> Rampdoor Express | F54: =Outlaw!Z58 -> 189 | H54: ='Stock Altered'!A58 -> 53 | I54: ='Stock Altered'!B58 -> Jack Bowlin | J54: =IF('Stock Altered'!C58=0,"",'Stock Altered'!C58) ->  | K54: ='Stock Altered'!D58 -> 11-418 | L54: =IF('Stock Altered'!E58=0,"",'Stock Altered'!E58) -> High Roller | M54: ='Stock Altered'!Z58 -> 257
A55: =Outlaw!A59 -> 54 | B55: =Outlaw!B59 -> Waylon Nelson | C55: =IF(Outlaw!C59=0," ",Outlaw!C59) ->  | D55: =Outlaw!D59 -> 11-413 | E55: =IF(Outlaw!E59=0," ",Outlaw!E59) -> But Ugly | F55: =Outlaw!Z59 -> 198 | H55: ='Stock Altered'!A59 -> 54 | I55: ='Stock Altered'!B59 -> Suzanne McClain | J55: =IF('Stock Altered'!C59=0,"",'Stock Altered'!C59) ->  | K55: ='Stock Altered'!D59 -> 11-376 | L55: =IF('Stock Altered'!E59=0,"",'Stock Altered'!E59) -> Cadet | M55: ='Stock Altered'!Z59 -> 262
A56: =Outlaw!A60 -> 55 | B56: =Outlaw!B60 -> Jack Bowlin | C56: =IF(Outlaw!C60=0," ",Outlaw!C60) -> VM | D56: =Outlaw!D60 -> 11-418 | E56: =IF(Outlaw!E60=0," ",Outlaw!E60) -> High Bender | F56: =Outlaw!Z60 -> 198 | H56: ='Stock Altered'!A60 -> 55 | I56: ='Stock Altered'!B60 -> Steve Clark | J56: =IF('Stock Altered'!C60=0,"",'Stock Altered'!C60) -> SC | K56: ='Stock Altered'!D60 -> 11-322 | L56: =IF('Stock Altered'!E60=0,"",'Stock Altered'!E60) -> Pullin for JESUS | M56: ='Stock Altered'!Z60 -> 263
A57: =Outlaw!A61 -> 56 | B57: =Outlaw!B61 -> Caleb Peters | C57: =IF(Outlaw!C61=0," ",Outlaw!C61) ->  | D57: =Outlaw!D61 -> 11-371 | E57: =IF(Outlaw!E61=0," ",Outlaw!E61) -> Bernies Nightmare | F57: =Outlaw!Z61 -> 199 | H57: ='Stock Altered'!A61 -> 56 | I57: ='Stock Altered'!B61 -> Mike Hall | J57: =IF('Stock Altered'!C61=0,"",'Stock Altered'!C61) -> RPM | K57: ='Stock Altered'!D61 -> 11-248 | L57: =IF('Stock Altered'!E61=0,"",'Stock Altered'!E61) -> Lethal Injection | M57: ='Stock Altered'!Z61 -> 265
A58: =Outlaw!A62 -> 57 | B58: =Outlaw!B62 -> Steve Chrisman | C58: =IF(Outlaw!C62=0," ",Outlaw!C62) -> Hackman | D58: =Outlaw!D62 -> 11-022 | E58: =IF(Outlaw!E62=0," ",Outlaw!E62) -> Razmatazz | F58: =Outlaw!Z62 -> 204 | H58: ='Stock Altered'!A62 -> 57 | I58: ='Stock Altered'!B62 -> Randy Hazelbaker | J58: =IF('Stock Altered'!C62=0,"",'Stock Altered'!C62) -> TV | K58: ='Stock Altered'!D62 -> 11-087 | L58: =IF('Stock Altered'!E62=0,"",'Stock Altered'!E62) -> One Bad Buck | M58: ='Stock Altered'!Z62 -> 272
A59: =Outlaw!A63 -> 58 | B59: =Outlaw!B63 -> Bill Elrod | C59: =IF(Outlaw!C63=0," ",Outlaw!C63) -> TV | D59: =Outlaw!D63 -> 11-021 | E59: =IF(Outlaw!E63=0," ",Outlaw!E63) -> Pa Paws Toy | F59: =Outlaw!Z63 -> 206 | H59: ='Stock Altered'!A63 -> 58 | I59: ='Stock Altered'!B63 -> Dave Shulko | J59: =IF('Stock Altered'!C63=0,"",'Stock Altered'!C63) -> BJ | K59: ='Stock Altered'!D63 -> 11-181 | L59: =IF('Stock Altered'!E63=0,"",'Stock Altered'!E63) ->  | M59: ='Stock Altered'!Z63 -> 272
A60: =Outlaw!A64 -> 59 | B60: =Outlaw!B64 -> Ed Jones | C60: =IF(Outlaw!C64=0," ",Outlaw!C64) ->  | D60: =Outlaw!D64 -> 11-271 | E60: =IF(Outlaw!E64=0," ",Outlaw!E64) ->  | F60: =Outlaw!Z64 -> 209 | H60: ='Stock Altered'!A64 -> 59 | I60: ='Stock Altered'!B64 -> Aaron Mason | J60: =IF('Stock Altered'!C64=0,"",'Stock Altered'!C64) -> NP | K60: ='Stock Altered'!D64 -> 11-356 | L60: =IF('Stock Altered'!E64=0,"",'Stock Altered'!E64) -> Frustrated | M60: ='Stock Altered'!Z64 -> 272
A61: =Outlaw!A65 -> 60 | B61: =Outlaw!B65 -> Dave Gawatz | C61: =IF(Outlaw!C65=0," ",Outlaw!C65) -> LR | D61: =Outlaw!D65 -> 11-408 | E61: =IF(Outlaw!E65=0," ",Outlaw!E65) -> Undertaker | F61: =Outlaw!Z65 -> 215 | H61: ='Stock Altered'!A65 -> 60 | I61: ='Stock Altered'!B65 -> Gordy Lloyd | J61: =IF('Stock Altered'!C65=0,"",'Stock Altered'!C65) ->  | K61: ='Stock Altered'!D65 -> 11-205 | L61: =IF('Stock Altered'!E65=0,"",'Stock Altered'!E65) -> Buck Wild | M61: ='Stock Altered'!Z65 -> 274
A62: =Outlaw!A66 -> 61 | B62: =Outlaw!B66 -> Randy Hazelbaker | C62: =IF(Outlaw!C66=0," ",Outlaw!C66) -> TV | D62: =Outlaw!D66 -> 11-087 | E62: =IF(Outlaw!E66=0," ",Outlaw!E66) -> One Bad Buck | F62: =Outlaw!Z66 -> 219 | H62: ='Stock Altered'!A66 -> 61 | I62: ='Stock Altered'!B66 -> Waylon Nelson | J62: =IF('Stock Altered'!C66=0,"",'Stock Altered'!C66) ->  | K62: ='Stock Altered'!D66 -> 11-413 | L62: =IF('Stock Altered'!E66=0,"",'Stock Altered'!E66) -> But Ugly | M62: ='Stock Altered'!Z66 -> 274
A63: =Outlaw!A67 -> 62 | B63: =Outlaw!B67 -> Bill Shreffler | C63: =IF(Outlaw!C67=0," ",Outlaw!C67) -> NP | D63: =Outlaw!D67 -> 11-379 | E63: =IF(Outlaw!E67=0," ",Outlaw!E67) -> Thunderstruck Deere | F63: =Outlaw!Z67 -> 219 | H63: ='Stock Altered'!A67 -> 62 | I63: ='Stock Altered'!B67 -> Spencer Richards | J63: =IF('Stock Altered'!C67=0,"",'Stock Altered'!C67) -> TV | K63: ='Stock Altered'!D67 -> 11-397 | L63: =IF('Stock Altered'!E67=0,"",'Stock Altered'!E67) ->  | M63: ='Stock Altered'!Z67 -> 277
A64: =Outlaw!A68 -> 63 | B64: =Outlaw!B68 -> George Bax | C64: =IF(Outlaw!C68=0," ",Outlaw!C68) -> LR | D64: =Outlaw!D68 -> 11-422 | E64: =IF(Outlaw!E68=0," ",Outlaw!E68) -> Plum Crazy | F64: =Outlaw!Z68 -> 222 | H64: ='Stock Altered'!A68 -> 63 | I64: ='Stock Altered'!B68 -> Tim Rankin | J64: =IF('Stock Altered'!C68=0,"",'Stock Altered'!C68) -> Woods | K64: ='Stock Altered'!D68 -> 11-287 | L64: =IF('Stock Altered'!E68=0,"",'Stock Altered'!E68) -> Incognito | M64: ='Stock Altered'!Z68 -> 283
A65: =Outlaw!A69 -> 64 | B65: =Outlaw!B69 -> Randy Amstutz | C65: =IF(Outlaw!C69=0," ",Outlaw!C69) -> Woods | D65: =Outlaw!D69 -> 11-166 | E65: =IF(Outlaw!E69=0," ",Outlaw!E69) -> Cub Cadet | F65: =Outlaw!Z69 -> 223 | H65: ='Stock Altered'!A69 -> 64 | I65: ='Stock Altered'!B69 -> Garrett Bye | J65: =IF('Stock Altered'!C69=0,"",'Stock Altered'!C69) ->  | K65: ='Stock Altered'!D69 -> 11-409 | L65: =IF('Stock Altered'!E69=0,"",'Stock Altered'!E69) -> Flame Burner | M65: ='Stock Altered'!Z69 -> 294
A66: =Outlaw!A70 -> 65 | B66: =Outlaw!B70 -> Tony Lewis | C66: =IF(Outlaw!C70=0," ",Outlaw!C70) -> Tel Tool | D66: =Outlaw!D70 -> 11-345 | E66: =IF(Outlaw!E70=0," ",Outlaw!E70) -> Plain Jane | F66: =Outlaw!Z70 -> 223 | H66: ='Stock Altered'!A70 -> 65 | I66: ='Stock Altered'!B70 -> Doug Frank | J66: =IF('Stock Altered'!C70=0,"",'Stock Altered'!C70) -> JRS | K66: ='Stock Altered'!D70 -> 11-249 | L66: =IF('Stock Altered'!E70=0,"",'Stock Altered'!E70) -> Aggravation | M66: ='Stock Altered'!Z70 -> 295 | O66: 0
A67: =Outlaw!A71 -> 66 | B67: =Outlaw!B71 -> Gregory Vandervort | C67: =IF(Outlaw!C71=0," ",Outlaw!C71) -> TV | D67: =Outlaw!D71 -> 11-346 | E67: =IF(Outlaw!E71=0," ",Outlaw!E71) -> Yellow Cub | F67: =Outlaw!Z71 -> 223 | H67: ='Stock Altered'!A71 -> 66 | I67: ='Stock Altered'!B71 -> Waylon Nelson | J67: =IF('Stock Altered'!C71=0,"",'Stock Altered'!C71) ->  | K67: ='Stock Altered'!D71 -> 11-412 | L67: =IF('Stock Altered'!E71=0,"",'Stock Altered'!E71) -> Close Enough | M67: ='Stock Altered'!Z71 -> 295
A68: =Outlaw!A72 -> 67 | B68: =Outlaw!B72 -> Ron Feldkamp | C68: =IF(Outlaw!C72=0," ",Outlaw!C72) -> Woods | D68: =Outlaw!D72 -> 11-143 | E68: =IF(Outlaw!E72=0," ",Outlaw!E72) -> Key Chain | F68: =Outlaw!Z72 -> 225 | H68: ='Stock Altered'!A72 -> 67 | I68: ='Stock Altered'!B72 -> Jerry Leonard | J68: =IF('Stock Altered'!C72=0,"",'Stock Altered'!C72) -> VM | K68: ='Stock Altered'!D72 -> 11-308 | L68: =IF('Stock Altered'!E72=0,"",'Stock Altered'!E72) -> Hy Strong | M68: ='Stock Altered'!Z72 -> 296
A69: =Outlaw!A73 -> 68 | B69: =Outlaw!B73 -> Danny Garman | C69: =IF(Outlaw!C73=0," ",Outlaw!C73) ->  | D69: =Outlaw!D73 -> 11-391 | E69: =IF(Outlaw!E73=0," ",Outlaw!E73) -> Jag Master | F69: =Outlaw!Z73 -> 225 | H69: ='Stock Altered'!A73 -> 68 | I69: ='Stock Altered'!B73 -> Dave Garrant | J69: =IF('Stock Altered'!C73=0,"",'Stock Altered'!C73) -> NP | K69: ='Stock Altered'!D73 -> 11-378 | L69: =IF('Stock Altered'!E73=0,"",'Stock Altered'!E73) -> Gambler II | M69: ='Stock Altered'!Z73 -> 296
A70: =Outlaw!A74 -> 69 | B70: =Outlaw!B74 -> Rick James | C70: =IF(Outlaw!C74=0," ",Outlaw!C74) -> BJ | D70: =Outlaw!D74 -> 11-427 | E70: =IF(Outlaw!E74=0," ",Outlaw!E74) -> James Gang III | F70: =Outlaw!Z74 -> 227 | H70: ='Stock Altered'!A74 -> 69 | I70: ='Stock Altered'!B74 -> Lawrence Davenport | J70: =IF('Stock Altered'!C74=0,"",'Stock Altered'!C74) ->  | K70: ='Stock Altered'!D74 -> 11-406 | L70: =IF('Stock Altered'!E74=0,"",'Stock Altered'!E74) -> Black Magic | M70: ='Stock Altered'!Z74 -> 296
A71: =Outlaw!A75 -> 70 | B71: =Outlaw!B75 -> Chris Gregg | C71: =IF(Outlaw!C75=0," ",Outlaw!C75) -> JRS | D71: =Outlaw!D75 -> 11-315 | E71: =IF(Outlaw!E75=0," ",Outlaw!E75) -> Insane | F71: =Outlaw!Z75 -> 230 | H71: ='Stock Altered'!A75 -> 70 | I71: ='Stock Altered'!B75 -> Kevin Bax | J71: =IF('Stock Altered'!C75=0,"",'Stock Altered'!C75) -> LR | K71: ='Stock Altered'!D75 -> 11-104 | L71: =IF('Stock Altered'!E75=0,"",'Stock Altered'!E75) -> Black Jack | M71: ='Stock Altered'!Z75 -> 297
A72: =Outlaw!A76 -> 71 | B72: =Outlaw!B76 -> Doug Frank | C72: =IF(Outlaw!C76=0," ",Outlaw!C76) -> JRS | D72: =Outlaw!D76 -> 11-249 | E72: =IF(Outlaw!E76=0," ",Outlaw!E76) -> Aggrevation | F72: =Outlaw!Z76 -> 234 | H72: ='Stock Altered'!A76 -> 71 | I72: ='Stock Altered'!B76 -> Bob Cooper | J72: =IF('Stock Altered'!C76=0,"",'Stock Altered'!C76) -> JRS | K72: ='Stock Altered'!D76 -> 11-383 | L72: =IF('Stock Altered'!E76=0,"",'Stock Altered'!E76) ->  | M72: ='Stock Altered'!Z76 -> 297
A73: =Outlaw!A77 -> 72 | B73: =Outlaw!B77 -> Steve Clark | C73: =IF(Outlaw!C77=0," ",Outlaw!C77) -> SC | D73: =Outlaw!D77 -> 11-322 | E73: =IF(Outlaw!E77=0," ",Outlaw!E77) -> Pullin for JESUS | F73: =Outlaw!Z77 -> 235 | H73: ='Stock Altered'!A77 -> 72 | I73: ='Stock Altered'!B77 -> Andy Ring | J73: =IF('Stock Altered'!C77=0,"",'Stock Altered'!C77) ->  | K73: ='Stock Altered'!D77 -> 11-416 | L73: =IF('Stock Altered'!E77=0,"",'Stock Altered'!E77) -> Money Pit | M73: ='Stock Altered'!Z77 -> 297
A74: =Outlaw!A78 -> 73 | B74: =Outlaw!B78 -> Garrett Bye | C74: =IF(Outlaw!C78=0," ",Outlaw!C78) -> Woods | D74: =Outlaw!D78 -> 11-409 | E74: =IF(Outlaw!E78=0," ",Outlaw!E78) -> Flame Burner | F74: =Outlaw!Z78 -> 236 | H74: ='Stock Altered'!A78 -> 73 | I74: ='Stock Altered'!B78 -> Dan Scott | J74: =IF('Stock Altered'!C78=0,"",'Stock Altered'!C78) -> JRS | K74: ='Stock Altered'!D78 -> 11-119 | L74: =IF('Stock Altered'!E78=0,"",'Stock Altered'!E78) -> Power of Prayer | M74: ='Stock Altered'!Z78 -> 298
A75: =Outlaw!A79 -> 74 | B75: =Outlaw!B79 -> Brian Peregrine | C75: =IF(Outlaw!C79=0," ",Outlaw!C79) ->  | D75: =Outlaw!D79 -> 11-415 | E75: =IF(Outlaw!E79=0," ",Outlaw!E79) -> Wood Chipper | F75: =Outlaw!Z79 -> 237 | H75: ='Stock Altered'!A79 -> 74 | I75: ='Stock Altered'!B79 -> James Hill | J75: =IF('Stock Altered'!C79=0,"",'Stock Altered'!C79) -> JW | K75: ='Stock Altered'!D79 -> 11-328 | L75: =IF('Stock Altered'!E79=0,"",'Stock Altered'!E79) ->  | M75: ='Stock Altered'!Z79 -> 298
A76: =Outlaw!A80 -> 75 | B76: =Outlaw!B80 -> Aaron Mason | C76: =IF(Outlaw!C80=0," ",Outlaw!C80) -> NP | D76: =Outlaw!D80 -> 11-356 | E76: =IF(Outlaw!E80=0," ",Outlaw!E80) -> Frustrated | F76: =Outlaw!Z80 -> 240 | H76: ='Stock Altered'!A80 -> 75 | I76: ='Stock Altered'!B80 -> Bill Shreffler | J76: =IF('Stock Altered'!C80=0,"",'Stock Altered'!C80) -> NP | K76: ='Stock Altered'!D80 -> 11-379 | L76: =IF('Stock Altered'!E80=0,"",'Stock Altered'!E80) -> Thunderstruck Deere | M76: ='Stock Altered'!Z80 -> 298
A77: =Outlaw!A81 -> 76 | B77: =Outlaw!B81 -> Tim Rankin | C77: =IF(Outlaw!C81=0," ",Outlaw!C81) -> Woods | D77: =Outlaw!D81 -> 11-287 | E77: =IF(Outlaw!E81=0," ",Outlaw!E81) -> Incognito | F77: =Outlaw!Z81 -> 244 | H77: ='Stock Altered'!A81 -> 76 | I77: ='Stock Altered'!B81 -> Jerry Sweet | J77: =IF('Stock Altered'!C81=0,"",'Stock Altered'!C81) -> LR | K77: ='Stock Altered'!D81 -> 11-284 | L77: =IF('Stock Altered'!E81=0,"",'Stock Altered'!E81) -> Phat Ride | M77: ='Stock Altered'!Z81 -> 299
A78: =Outlaw!A82 -> 77 | B78: =Outlaw!B82 -> Robin Cooper | C78: =IF(Outlaw!C82=0," ",Outlaw!C82) -> JRS | D78: =Outlaw!D82 -> 11-073 | E78: =IF(Outlaw!E82=0," ",Outlaw!E82) ->  | F78: =Outlaw!Z82 -> 248 | H78: ='Stock Altered'!A82 -> 77 | I78: ='Stock Altered'!B82 -> Jeremy Pierce | J78: =IF('Stock Altered'!C82=0,"",'Stock Altered'!C82) -> JP | K78: ='Stock Altered'!D82 -> 11-362 | L78: =IF('Stock Altered'!E82=0,"",'Stock Altered'!E82) -> Lunch Money | M78: ='Stock Altered'!Z82 -> 299
A79: =Outlaw!A83 -> 78 | B79: =Outlaw!B83 -> Doug Rood | C79: =IF(Outlaw!C83=0," ",Outlaw!C83) ->  | D79: =Outlaw!D83 -> 11-354 | E79: =IF(Outlaw!E83=0," ",Outlaw!E83) -> Blue Dawg | F79: =Outlaw!Z83 -> 256 | H79: ='Stock Altered'!A83 -> 78 | I79: ='Stock Altered'!B83 -> Larrry Hunter | J79: =IF('Stock Altered'!C83=0,"",'Stock Altered'!C83) -> JRS | K79: ='Stock Altered'!D83 -> 11-377 | L79: =IF('Stock Altered'!E83=0,"",'Stock Altered'!E83) -> Intimidator | M79: ='Stock Altered'!Z83 -> 299
A80: =Outlaw!A84 -> 79 | B80: =Outlaw!B84 -> Bob Cooper | C80: =IF(Outlaw!C84=0," ",Outlaw!C84) -> JRS | D80: =Outlaw!D84 -> 11-383 | E80: =IF(Outlaw!E84=0," ",Outlaw!E84) ->  | F80: =Outlaw!Z84 -> 256 | H80: ='Stock Altered'!A84 -> 79 | I80: ='Stock Altered'!B84 -> Austin Ernest | J80: =IF('Stock Altered'!C84=0,"",'Stock Altered'!C84) ->  | K80: ='Stock Altered'!D84 -> 11-224 | L80: =IF('Stock Altered'!E84=0,"",'Stock Altered'!E84) -> Not Deep Enough | M80: ='Stock Altered'!Z84 -> 300
A81: =Outlaw!A85 -> 80 | B81: =Outlaw!B85 -> Waylon Nelson | C81: =IF(Outlaw!C85=0," ",Outlaw!C85) ->  | D81: =Outlaw!D85 -> 11-412 | E81: =IF(Outlaw!E85=0," ",Outlaw!E85) -> Close Enough | F81: =Outlaw!Z85 -> 257 | H81: ='Stock Altered'!A85 -> 80 | I81: ='Stock Altered'!B85 -> Kevin Autle | J81: =IF('Stock Altered'!C85=0,"",'Stock Altered'!C85) ->  | K81: ='Stock Altered'!D85 -> 11-228 | L81: =IF('Stock Altered'!E85=0,"",'Stock Altered'!E85) ->  | M81: ='Stock Altered'!Z85 -> 300
A82: =Outlaw!A86 -> 81 | B82: =Outlaw!B86 -> Keith Roberts | C82: =IF(Outlaw!C86=0," ",Outlaw!C86) -> TC | D82: =Outlaw!D86 -> 11-194 | E82: =IF(Outlaw!E86=0," ",Outlaw!E86) -> Yellow Jacket | F82: =Outlaw!Z86 -> 259 | H82: ='Stock Altered'!A86 -> 81 | I82: ='Stock Altered'!B86 -> Ronald Marcine | J82: =IF('Stock Altered'!C86=0,"",'Stock Altered'!C86) -> JRS | K82: ='Stock Altered'!D86 -> 11-388 | L82: =IF('Stock Altered'!E86=0,"",'Stock Altered'!E86) -> Boogie Man | M82: ='Stock Altered'!Z86 -> 302
A83: =Outlaw!A87 -> 82 | B83: =Outlaw!B87 -> Mike Hall | C83: =IF(Outlaw!C87=0," ",Outlaw!C87) -> RPM | D83: =Outlaw!D87 -> 11-248 | E83: =IF(Outlaw!E87=0," ",Outlaw!E87) -> Lethal Injection | F83: =Outlaw!Z87 -> 259 | H83: ='Stock Altered'!A87 -> 82 | I83: ='Stock Altered'!B87 -> Bryan Dunn | J83: =IF('Stock Altered'!C87=0,"",'Stock Altered'!C87) -> JRS | K83: ='Stock Altered'!D87 -> 11-136 | L83: =IF('Stock Altered'!E87=0,"",'Stock Altered'!E87) -> Oh Snap | M83: ='Stock Altered'!Z87 -> 294
A84: =Outlaw!A88 -> 83 | B84: =Outlaw!B88 -> Larry Hunter | C84: =IF(Outlaw!C88=0," ",Outlaw!C88) -> JRS | D84: =Outlaw!D88 -> 11-377 | E84: =IF(Outlaw!E88=0," ",Outlaw!E88) -> Intimidator | F84: =Outlaw!Z88 -> 260 | H84: ='Stock Altered'!A88 -> 83 | I84: ='Stock Altered'!B88 -> Chris Gregg | J84: =IF('Stock Altered'!C88=0,"",'Stock Altered'!C88) -> JRS | K84: ='Stock Altered'!D88 -> 11-315 | L84: =IF('Stock Altered'!E88=0,"",'Stock Altered'!E88) -> Insane | M84: ='Stock Altered'!Z88 -> 267
A85: =Outlaw!A89 -> 84 | B85: =Outlaw!B89 -> Leslie Sullivan | C85: =IF(Outlaw!C89=0," ",Outlaw!C89) ->  | D85: =Outlaw!D89 -> 11-120 | E85: =IF(Outlaw!E89=0," ",Outlaw!E89) -> Joker | F85: =Outlaw!Z89 -> 261 | H85: ='Stock Altered'!A89 -> 84 | I85: ='Stock Altered'!B89 -> Rick James | J85: =IF('Stock Altered'!C89=0,"",'Stock Altered'!C89) -> BJ | K85: ='Stock Altered'!D89 -> 11-427 | L85: =IF('Stock Altered'!E89=0,"",'Stock Altered'!E89) -> James Gang III | M85: ='Stock Altered'!Z89 -> 274
A86: =Outlaw!A90 -> 85 | B86: =Outlaw!B90 -> Jerry Leonard | C86: =IF(Outlaw!C90=0," ",Outlaw!C90) -> VM | D86: =Outlaw!D90 -> 11-308 | E86: =IF(Outlaw!E90=0," ",Outlaw!E90) -> Hi-Strung | F86: =Outlaw!Z90 -> 261 | H86: ='Stock Altered'!A90 -> 85 | I86: ='Stock Altered'!B90 -> Brian Bell | J86: =IF('Stock Altered'!C90=0,"",'Stock Altered'!C90) -> NP | K86: ='Stock Altered'!D90 -> 11-428 | L86: =IF('Stock Altered'!E90=0,"",'Stock Altered'!E90) -> Grim Reaper | M86: ='Stock Altered'!Z90 -> 300
A87: =Outlaw!A91 -> 86 | B87: =Outlaw!B91 -> Annette Sullivan | C87: =IF(Outlaw!C91=0," ",Outlaw!C91) -> MVP | D87: =Outlaw!D91 -> 11-122 | E87: =IF(Outlaw!E91=0," ",Outlaw!E91) -> Just Relax | F87: =Outlaw!Z91 -> 262 | J87: =IF('Stock Altered'!C92=0,"",'Stock Altered'!C92) -> 
A88: =Outlaw!A92 -> 87 | B88: =Outlaw!B92 -> Haylee Heits | C88: =IF(Outlaw!C92=0," ",Outlaw!C92) ->  | D88: =Outlaw!D92 -> 11-411 | E88: =IF(Outlaw!E92=0," ",Outlaw!E92) -> Full Throttle | F88: =Outlaw!Z92 -> 262 | J88: =IF('Stock Altered'!C93=0,"",'Stock Altered'!C93) -> 
A89: =Outlaw!A93 -> 88 | B89: =Outlaw!B93 -> Andy Ring | C89: =IF(Outlaw!C93=0," ",Outlaw!C93) ->  | D89: =Outlaw!D93 -> 11-416 | E89: =IF(Outlaw!E93=0," ",Outlaw!E93) -> Money Pit | F89: =Outlaw!Z93 -> 262 | J89: =IF('Stock Altered'!C94=0,"",'Stock Altered'!C94) -> 
A90: =Outlaw!A94 -> 89 | B90: =Outlaw!B94 -> Greg Block | C90: =IF(Outlaw!C94=0," ",Outlaw!C94) -> JW | D90: =Outlaw!D94 -> 11-435 | E90: =IF(Outlaw!E94=0," ",Outlaw!E94) ->  | F90: =Outlaw!Z94 -> 262 | J90: =IF('Stock Altered'!C95=0,"",'Stock Altered'!C95) -> 
A91: =Outlaw!A95 -> 90 | B91: =Outlaw!B95 -> Justin Wagler | C91: =IF(Outlaw!C95=0," ",Outlaw!C95) -> WP | D91: =Outlaw!D95 -> 11-127 | E91: =IF(Outlaw!E95=0," ",Outlaw!E95) -> Samson | F91: =Outlaw!Z95 -> 263 | J91: =IF('Stock Altered'!C96=0,"",'Stock Altered'!C96) -> 
A92: =Outlaw!A96 -> 91 | B92: =Outlaw!B96 -> Jeremy Pierce | C92: =IF(Outlaw!C96=0," ",Outlaw!C96) -> JP | D92: =Outlaw!D96 -> 11-362 | E92: =IF(Outlaw!E96=0," ",Outlaw!E96) -> Lunch Money | F92: =Outlaw!Z96 -> 263
A93: =Outlaw!A97 -> 92 | B93: =Outlaw!B97 -> Dave Garrant | C93: =IF(Outlaw!C97=0," ",Outlaw!C97) -> NP | D93: =Outlaw!D97 -> 11-378 | E93: =IF(Outlaw!E97=0," ",Outlaw!E97) -> Gambler II | F93: =Outlaw!Z97 -> 263
A94: =Outlaw!A98 -> 93 | B94: =Outlaw!B98 -> Ronald Marcine | C94: =IF(Outlaw!C98=0," ",Outlaw!C98) -> JRS | D94: =Outlaw!D98 -> 11-388 | E94: =IF(Outlaw!E98=0," ",Outlaw!E98) -> Boogie Man | F94: =Outlaw!Z98 -> 263
A95: =Outlaw!A99 -> 94 | B95: =Outlaw!B99 -> Rick Massey | C95: =IF(Outlaw!C99=0," ",Outlaw!C99) ->  | D95: =Outlaw!D99 -> 11-421 | E95: =IF(Outlaw!E99=0," ",Outlaw!E99) -> Spare Parts | F95: =Outlaw!Z99 -> 263
A96: =Outlaw!A100 -> 95 | B96: =Outlaw!B100 -> Wes Kempeter | C96: =IF(Outlaw!C100=0," ",Outlaw!C100) ->  | D96: =Outlaw!D100 -> 11-424 | E96: =IF(Outlaw!E100=0," ",Outlaw!E100) -> Wasted Money | F96: =Outlaw!Z100 -> 263
A97: =Outlaw!A101 -> 96 | B97: =Outlaw!B101 -> Jim Hill | C97: =IF(Outlaw!C101=0," ",Outlaw!C101) -> JW | D97: =Outlaw!D101 -> 11-328 | E97: =IF(Outlaw!E101=0," ",Outlaw!E101) ->  | F97: =Outlaw!Z101 -> 264
A98: =Outlaw!A102 -> 97 | B98: =Outlaw!B102 -> Jeremy Jaspering | C98: =IF(Outlaw!C102=0," ",Outlaw!C102) ->  | D98: =Outlaw!D102 -> 11-405 | E98: =IF(Outlaw!E102=0," ",Outlaw!E102) -> Runnin Wild | F98: =Outlaw!Z102 -> 264
A99: =Outlaw!A103 -> 98 | B99: =Outlaw!B103 -> Dan Scott | C99: =IF(Outlaw!C103=0," ",Outlaw!C103) -> JRS | D99: =Outlaw!D103 -> 11-119 | E99: =IF(Outlaw!E103=0," ",Outlaw!E103) -> Power of Prayer | F99: =Outlaw!Z103 -> 265
A100: =Outlaw!A104 -> 99 | B100: =Outlaw!B104 -> Gordy Lloyd | C100: =IF(Outlaw!C104=0," ",Outlaw!C104) ->  | D100: =Outlaw!D104 -> 11-205 | E100: =IF(Outlaw!E104=0," ",Outlaw!E104) -> Buck Wild | F100: =Outlaw!Z104 -> 265
A101: =Outlaw!A105 -> 100 | B101: =Outlaw!B105 -> Amanda Manville | C101: =IF(Outlaw!C105=0," ",Outlaw!C105) -> JRS | D101: =Outlaw!D105 -> 11-235 | E101: =IF(Outlaw!E105=0," ",Outlaw!E105) -> Sidewinder | F101: =Outlaw!Z105 -> 265
A102: =Outlaw!A106 -> 101 | B102: =Outlaw!B106 -> Jessican Richter | C102: =IF(Outlaw!C106=0," ",Outlaw!C106) -> RPM | D102: =Outlaw!D106 -> 11-263 | E102: =IF(Outlaw!E106=0," ",Outlaw!E106) -> High Roller | F102: =Outlaw!Z106 -> 265