B2: PRO V TWIN
F5: Princeton, Ind | I5: Richmond,KY | L5: Marietta | O5: Kansas City | R5: Sturgis | U5: Tallmadge
B6: Name | C6: Eng. | D6: NQS # | E6: Tractor | F6: Qualifying Points | G6: Finals Points | I6: Qualifying Points | J6: Finals Points | L6: Qualifying Points | M6: Finals Points | O6: Qualifying Points | P6: Finals Points | R6: Qualifying Points | S6: Finals Points | U6: Qualifying Points | V6: Finals Points | X6: Total Points | Z6: Points Back | AB6: Teardown sticker check
A7: 1 | B7: Kenny Cornelison | C7: MVP | D7: 11-149 | E7: Storm Alert | F7: 27 | I7: 30 | L7: 30 | O7: 29 | R7: 29 | X7: =SUM(+F7+G7+I7+J7+L7+M7+O7+P7+R7+S7+U7+V7) -> 145 | Z7: =SUM(AB7-X7) -> 0 | AB7: =SUM(X$7) -> 145
A8: 2 | B8: Lowell Vis | C8: MWSC | D8: 11-333 | E8: Skittles | F8: 29 | I8: 27 | L8: 29 | O8: 30 | R8: 28 | X8: =SUM(+F8+G8+I8+J8+L8+M8+O8+P8+R8+S8+U8+V8) -> 143 | Z8: =SUM(AB8-X8) -> 2 | AB8: =SUM(X$7) -> 145
A9: 3 | B9: Jim Hull | C9: MVP | D9: 11-334 | E9: Simplicity | F9: 26 | I9: 28 | L9: 27 | O9: 28 | R9: 24 | X9: =SUM(+F9+G9+I9+J9+L9+M9+O9+P9+R9+S9+U9+V9) -> 133 | Z9: =SUM(AB9-X9) -> 12 | AB9: =SUM(X$7) -> 145
A10: 4 | B10: Harrison Stahl | C10: MVP | D10: 11-004 | E10: Tons of Fun | F10: 28 | I10: 22 | L10: 28 | O10: 27 | R10: 27 | X10: =SUM(+F10+G10+I10+J10+L10+M10+O10+P10+R10+S10+U10+V10) -> 132 | Z10: =SUM(AB10-X10) -> 13 | AB10: =SUM(X$7) -> 145
A11: 5 | B11: Matt Kaster | C11: MVP | D11: 11-099 | E11: Super Freak | F11: 30 | I11: 19 | L11: 23 | O11: 26 | R11: 30 | X11: =SUM(+F11+G11+I11+J11+L11+M11+O11+P11+R11+S11+U11+V11) -> 128 | Z11: =SUM(AB11-X11) -> 17 | AB11: =SUM(X$7) -> 145
A12: 6 | B12: Mike Spencer | C12: MVP | D12: 11-278 | E12: Longshot | F12: 24 | I12: 20 | L12: 26 | R12: 20 | X12: =SUM(+F12+G12+I12+J12+L12+M12+O12+P12+R12+S12+U12+V12) -> 90 | Z12: =SUM(AB12-X12) -> 55 | AB12: =SUM(X$7) -> 145
A13: 7 | B13: Ryan Shafer | C13: Ryan | D13: 11-206 | E13: Roadrunner | F13: 21 | I13: 25 | L13: 25 | X13: =SUM(+F13+G13+I13+J13+L13+M13+O13+P13+R13+S13+U13+V13) -> 71 | Z13: =SUM(AB13-X13) -> 74 | AB13: =SUM(X$7) -> 145
A14: 8 | B14: Dave Richter | D14: 11-207 | E14: Hustler | I14: 26 | L14: 24 | X14: =SUM(+F14+G14+I14+J14+L14+M14+O14+P14+R14+S14+U14+V14) -> 50 | Z14: =SUM(AB14-X14) -> 95 | AB14: =SUM(X$7) -> 145
A15: 9 | B15: Shane Stinson | C15: SS | D15: 11-200 | E15: Roller Kolher | F15: 25 | R15: 23 | X15: =SUM(+F15+G15+I15+J15+L15+M15+O15+P15+R15+S15+U15+V15) -> 48 | Z15: =SUM(AB15-X15) -> 97 | AB15: =SUM(X$7) -> 145
A16: 10 | B16: Larry Dunlap | C16: S&S | D16: 11-201 | E16: Renegade | F16: 22 | R16: 21 | X16: =SUM(+F16+G16+I16+J16+L16+M16+O16+P16+R16+S16+U16+V16) -> 43 | Z16: =SUM(AB16-X16) -> 102 | AB16: =SUM(X$7) -> 145
A17: 11 | B17: Rob Wise | D17: 11-209 | E17: Longshot | I17: 29 | X17: =SUM(+F17+G17+I17+J17+L17+M17+O17+P17+R17+S17+U17+V17) -> 29 | Z17: =SUM(AB17-X17) -> 116 | AB17: =SUM(X$7) -> 145
A18: 12 | B18: Nick Hayes | D18: 11-436 | E18: Screaming Eagle | R18: 26 | X18: =SUM(+F18+G18+I18+J18+L18+M18+O18+P18+R18+S18+U18+V18) -> 26 | Z18: =SUM(AB18-X18) -> 119 | AB18: =SUM(X$7) -> 145
A19: 13 | B19: Mark Sheetz | C19: MVP | D19: 11-417 | E19: Sparky | O19: 25 | X19: =SUM(+F19+G19+I19+J19+L19+M19+O19+P19+R19+S19+U19+V19) -> 25 | Z19: =SUM(AB19-X19) -> 120 | AB19: =SUM(X$7) -> 145
A20: 14 | B20: Eldon Wright | C20: MVP | D20: 11-431 | E20: Willie | R20: 25 | X20: =SUM(+F20+G20+I20+J20+L20+M20+O20+P20+R20+S20+U20+V20) -> 25 | Z20: =SUM(AB20-X20) -> 120 | AB20: =SUM(X$7) -> 145
A21: 15 | B21: Tim Hayes | D21: 11-374 | E21: Mad Dog 2 | I21: 24 | X21: =SUM(+F21+G21+I21+J21+L21+M21+O21+P21+R21+S21+U21+V21) -> 24 | Z21: =SUM(AB21-X21) -> 121 | AB21: =SUM(X$7) -> 145
A22: 16 | B22: John Norris | C22: MVP | D22: 11-414 | E22: Back N Black | O22: 24 | X22: =SUM(+F22+G22+I22+J22+L22+M22+O22+P22+R22+S22+U22+V22) -> 24 | Z22: =SUM(AB22-X22) -> 121 | AB22: =SUM(X$7) -> 145
A23: 17 | B23: Jamey Pierce | C23: JP | D23: 11-031 | E23: Siamese Twin | F23: 23 | X23: =SUM(+F23+G23+I23+J23+L23+M23+O23+P23+R23+S23+U23+V23) -> 23 | Z23: =SUM(AB23-X23) -> 122 | AB23: =SUM(X$7) -> 145
A24: 18 | B24: Tim Hammond | D24: 11-211 | E24: All Nighter | I24: 23 | X24: =SUM(+F24+G24+I24+J24+L24+M24+O24+P24+R24+S24+U24+V24) -> 23 | Z24: =SUM(AB24-X24) -> 122 | AB24: =SUM(X$7) -> 145
A25: 19 | B25: Shawn Dukes | D25: 11- | R25: 22 | X25: =SUM(+F25+G25+I25+J25+L25+M25+O25+P25+R25+S25+U25+V25) -> 22 | Z25: =SUM(AB25-X25) -> 123 | AB25: =SUM(X$7) -> 145
A26: 20 | B26: Sandy Hayes | D26: 11-373 | E26: Mad Dog 1 | I26: 21 | X26: =SUM(+F26+G26+I26+J26+L26+M26+O26+P26+R26+S26+U26+V26) -> 21 | Z26: =SUM(AB26-X26) -> 124 | AB26: =SUM(X$7) -> 145
A27: 21 | B27: Lindsey Wells | D27: 11-212 | E27: Clearly Crazy | I27: 19 | X27: =SUM(+F27+G27+I27+J27+L27+M27+O27+P27+R27+S27+U27+V27) -> 19 | Z27: =SUM(AB27-X27) -> 126 | AB27: =SUM(X$7) -> 145
A28: 22 | B28: James Spencer | D28: 11- | R28: 19 | X28: =SUM(+F28+G28+I28+J28+L28+M28+O28+P28+R28+S28+U28+V28) -> 19 | Z28: =SUM(AB28-X28) -> 126 | AB28: =SUM(X$7) -> 145