B2: OUTLAW
F4: Princeton, Ind | I4: Richmond,KY | L4: Marietta | O4: Kansas City | R4: Sturgis | U4: Tallmadge
B5: Name | C5: Eng. | D5: NQS # | E5: Tractor | F5: Qualifying Points | G5: Finals Points | I5: Qualifying Points | J5: Finals Points | L5: Qualifying Points | M5: Finals Points | O5: Qualifying Points | P5: Finals Points | R5: Qualifying Points | S5: Finals Points | U5: Qualifying Points | V5: Finals Points | X5: Total Points | Z5: Points Back | AB5: Teardown sticker check
A6: 1 | B6: Mike Yeley | C6: JW | D6: 11-055 | E6: Papa's Ride | F6: 29 | G6: 30 | I6: 27 | J6: 38 | L6: 22 | O6: 28 | P6: 39 | R6: 29 | S6: 37 | X6: =SUM(+F6+G6+I6+J6+L6+M6+O6+P6+R6+S6+U6+V6) -> 279 | Z6: =SUM(AB6-X6) -> 0 | AB6: =SUM(X$6) -> 279
A7: 2 | B7: Carl Frueh | C7: JRS | D7: 11-279 | E7: Blue Thunder 2 | F7: 27 | G7: 40 | I7: 23 | L7: 24 | M7: 35 | O7: 28 | P7: 38 | R7: 30 | S7: 31 | X7: =SUM(+F7+G7+I7+J7+L7+M7+O7+P7+R7+S7+U7+V7) -> 276 | Z7: =SUM(AB7-X7) -> 3 | AB7: =SUM(X$6) -> 279
A8: 3 | B8: Tyler Black | C8: NP | D8: 11-135 | E8: Wild Child | F8: 24 | G8: 33 | I8: 30 | J8: 29 | L8: 19 | O8: 27 | P8: 40 | R8: 27 | S8: 40 | X8: =SUM(+F8+G8+I8+J8+L8+M8+O8+P8+R8+S8+U8+V8) -> 269 | Z8: =SUM(AB8-X8) -> 10 | AB8: =SUM(X$6) -> 279
A9: 4 | B9: Todd Vorhees | C9: TV | D9: 11-313 | E9: Red Cadet | F9: 30 | G9: 26 | I9: 30 | J9: 30 | L9: 29 | M9: 38 | O9: 19 | R9: 29 | S9: 38 | X9: =SUM(+F9+G9+I9+J9+L9+M9+O9+P9+R9+S9+U9+V9) -> 269 | Z9: =SUM(AB9-X9) -> 10 | AB9: =SUM(X$6) -> 279
A10: 5 | B10: Dave Washburn | C10: BJ | D10: 11-156 | E10: Last Minute | F10: 26 | G10: 38 | I10: 29 | J10: 28 | L10: 28 | M10: 34 | O10: 30 | P10: 34 | R10: 17 | X10: =SUM(+F10+G10+I10+J10+L10+M10+O10+P10+R10+S10+U10+V10) -> 264 | Z10: =SUM(AB10-X10) -> 15 | AB10: =SUM(X$6) -> 279
A11: 6 | B11: Kelly Nichols | C11: NP | D11: 11-358 | E11: Maxxed Out | F11: 30 | G11: 22 | I11: 29 | J11: 13 | L11: 27 | M11: 28 | O11: 30 | P11: 14 | R11: 30 | S11: 39 | X11: =SUM(+F11+G11+I11+J11+L11+M11+O11+P11+R11+S11+U11+V11) -> 262 | Z11: =SUM(AB11-X11) -> 17 | AB11: =SUM(X$6) -> 279
A12: 7 | B12: Eli Zimmerman | C12: NP | D12: 11-075 | E12: Red Fever | F12: 25 | G12: 36 | I12: 28 | J12: 26 | L12: 27 | M12: 36 | O12: 19 | R12: 25 | S12: 15 | X12: =SUM(+F12+G12+I12+J12+L12+M12+O12+P12+R12+S12+U12+V12) -> 237 | Z12: =SUM(AB12-X12) -> 42 | AB12: =SUM(X$6) -> 279
A13: 8 | B13: Dave Woods | C13: Woods | D13: 11-289 | E13: Smoke & Mirrors | F13: 24 | G13: 34 | I13: 28 | J13: 39 | L13: 29 | M13: 17 | O13: 22 | R13: 27 | S13: 14 | X13: =SUM(+F13+G13+I13+J13+L13+M13+O13+P13+R13+S13+U13+V13) -> 234 | Z13: =SUM(AB13-X13) -> 45 | AB13: =SUM(X$6) -> 279
A14: 9 | B14: Matt Ronnebaum | C14: TV | D14: 11-089 | E14: Boy's & Their Toys | F14: 26 | G14: 28 | I14: 21 | L14: 29 | M14: 30 | O14: 25 | P14: 25 | R14: 26 | S14: 23 | X14: =SUM(+F14+G14+I14+J14+L14+M14+O14+P14+R14+S14+U14+V14) -> 233 | Z14: =SUM(AB14-X14) -> 46 | AB14: =SUM(X$6) -> 279
A15: 10 | B15: Bob Jones Jr | C15: BJ | D15: 11-183 | E15: Playdough | F15: 19 | I15: 28 | J15: 18 | L15: 26 | M15: 26 | O15: 30 | P15: 29 | R15: 27 | S15: 27 | X15: =SUM(+F15+G15+I15+J15+L15+M15+O15+P15+R15+S15+U15+V15) -> 230 | Z15: =SUM(AB15-X15) -> 49 | AB15: =SUM(X$6) -> 279
A16: 11 | B16: Gary Cunningham | C16: NP | D16: 11-162 | E16: High Voltage | F16: 27 | G16: 37 | I16: 25 | J16: 31 | L16: 28 | M16: 39 | O16: 17 | R16: 23 | X16: =SUM(+F16+G16+I16+J16+L16+M16+O16+P16+R16+S16+U16+V16) -> 227 | Z16: =SUM(AB16-X16) -> 52 | AB16: =SUM(X$6) -> 279
A17: 12 | B17: Scott Bye | C17: JW | D17: 11-187 | E17: Splinter | I17: 30 | J17: 13 | L17: 26 | M17: 22 | O17: 30 | P17: 32 | R17: 30 | S17: 35 | X17: =SUM(+F17+G17+I17+J17+L17+M17+O17+P17+R17+S17+U17+V17) -> 218 | Z17: =SUM(AB17-X17) -> 61 | AB17: =SUM(X$6) -> 279
A18: 13 | B18: Andy Ferguson | C18: MVP | D18: 11-100 | E18: Rasin Cane | F18: 28 | G18: 26 | I18: 27 | J18: 17 | L18: 24 | M18: 18 | O18: 27 | P18: 30 | R18: 19 | X18: =SUM(+F18+G18+I18+J18+L18+M18+O18+P18+R18+S18+U18+V18) -> 216 | Z18: =SUM(AB18-X18) -> 63 | AB18: =SUM(X$6) -> 279
A19: 14 | B19: Tyler Spindler | C19: TV | D19: 11-005 | E19: Funkey Chicken | F19: 21 | I19: 21 | L19: 26 | M19: 32 | O19: 24 | P19: 37 | R19: 25 | S19: 29 | X19: =SUM(+F19+G19+I19+J19+L19+M19+O19+P19+R19+S19+U19+V19) -> 215 | Z19: =SUM(AB19-X19) -> 64 | AB19: =SUM(X$6) -> 279
A20: 15 | B20: Mike McGaha | C20: JW | D20: 11-288 | E20: Company Time | F20: 21 | I20: 30 | J20: 33 | L20: 25 | M20: 31 | O20: 30 | P20: 21 | R20: 23 | X20: =SUM(+F20+G20+I20+J20+L20+M20+O20+P20+R20+S20+U20+V20) -> 214 | Z20: =SUM(AB20-X20) -> 65 | AB20: =SUM(X$6) -> 279
A21: 16 | B21: Donnie Herring | C21: TV | D21: 11-331 | E21: Pasttime | F21: 23 | I21: 30 | J21: 35 | L21: 21 | O21: 25 | P21: 15 | R21: 28 | S21: 28 | X21: =SUM(+F21+G21+I21+J21+L21+M21+O21+P21+R21+S21+U21+V21) -> 205 | Z21: =SUM(AB21-X21) -> 74 | AB21: =SUM(X$6) -> 279
A22: 17 | B22: Jamie Lewis | C22: TV | D22: 11-019 | E22: O-So-Orange | F22: 22 | I22: 25 | J22: 27 | L22: 26 | M22: 19 | O22: 21 | R22: 28 | S22: 36 | X22: =SUM(+F22+G22+I22+J22+L22+M22+O22+P22+R22+S22+U22+V22) -> 204 | Z22: =SUM(AB22-X22) -> 75 | AB22: =SUM(X$6) -> 279
A23: 18 | B23: Ron Hodge | C23: TV | D23: 11-071 | E23: Take-N-Names | F23: 28 | G23: 35 | I23: 23 | L23: 28 | M23: 27 | O23: 18 | R23: 24 | S23: 16 | X23: =SUM(+F23+G23+I23+J23+L23+M23+O23+P23+R23+S23+U23+V23) -> 199 | Z23: =SUM(AB23-X23) -> 80 | AB23: =SUM(X$6) -> 279
A24: 19 | B24: Ben Larkins | C24: JW | D24: 11-137 | E24: Indian Outlaw | F24: 19 | I24: 30 | J24: 24 | L24: 29 | M24: 33 | O24: 26 | P24: 17 | R24: 20 | X24: =SUM(+F24+G24+I24+J24+L24+M24+O24+P24+R24+S24+U24+V24) -> 198 | Z24: =SUM(AB24-X24) -> 81 | AB24: =SUM(X$6) -> 279
A25: 20 | B25: Doug Seaman | C25: BJ | D25: 11-192 | E25: Massey Ferguson | F25: 20 | I25: 27 | J25: 40 | L25: 30 | M25: 37 | O25: 20 | R25: 23 | X25: =SUM(+F25+G25+I25+J25+L25+M25+O25+P25+R25+S25+U25+V25) -> 197 | Z25: =SUM(AB25-X25) -> 82 | AB25: =SUM(X$6) -> 279
A26: 21 | B26: Keith Frueh | C26: JRS | D26: 11-086 | E26: Fearless | F26: 29 | G26: 23 | I26: 26 | J26: 13 | L26: 20 | O26: 27 | P26: 35 | R26: 22 | X26: =SUM(+F26+G26+I26+J26+L26+M26+O26+P26+R26+S26+U26+V26) -> 195 | Z26: =SUM(AB26-X26) -> 84 | AB26: =SUM(X$6) -> 279
A27: 22 | B27: Jill Chrisman | C27: VM | D27: 11-179 | F27: 26 | G27: 39 | I27: 21 | L27: 18 | O27: 26 | P27: 26 | R27: 25 | S27: 13 | X27: =SUM(+F27+G27+I27+J27+L27+M27+O27+P27+R27+S27+U27+V27) -> 194 | Z27: =SUM(AB27-X27) -> 85 | AB27: =SUM(X$6) -> 279
A28: 23 | B28: Greg Watson | C28: LR | D28: 11-327 | E28: Road Warrior | F28: 24 | G28: 19 | I28: 22 | L28: 30 | M28: 29 | O28: 23 | R28: 26 | S28: 21 | X28: =SUM(+F28+G28+I28+J28+L28+M28+O28+P28+R28+S28+U28+V28) -> 194 | Z28: =SUM(AB28-X28) -> 85 | AB28: =SUM(X$6) -> 279
A29: 24 | B29: Lonnie Lewis | C29: TV | D29: 11-024 | E29: Deuces Wild | F29: 20 | I29: 23 | L29: 23 | O29: 29 | P29: 36 | R29: 30 | S29: 30 | X29: =SUM(+F29+G29+I29+J29+L29+M29+O29+P29+R29+S29+U29+V29) -> 191 | Z29: =SUM(AB29-X29) -> 88 | AB29: =SUM(X$6) -> 279
A30: 25 | B30: Gary Seaman | C30: BJ | D30: 11-191 | E30: Farmer's Money | F30: 29 | G30: 29 | I30: 24 | J30: 19 | L30: 19 | O30: 20 | R30: 25 | S30: 20 | X30: =SUM(+F30+G30+I30+J30+L30+M30+O30+P30+R30+S30+U30+V30) -> 185 | Z30: =SUM(AB30-X30) -> 94 | AB30: =SUM(X$6) -> 279
A31: 26 | B31: Roger Davis | C31: JRS | D31: 11-068 | E31: Dusty Lady | F31: 18 | I31: 24 | J31: 34 | L31: 27 | M31: 23 | R31: 24 | S31: 34 | X31: =SUM(+F31+G31+I31+J31+L31+M31+O31+P31+R31+S31+U31+V31) -> 184 | Z31: =SUM(AB31-X31) -> 95 | AB31: =SUM(X$6) -> 279
A32: 27 | B32: Wayne Sams | C32: TV | D32: 11-082 | E32: Gold Digger | F32: 25 | G32: 16 | I32: 26 | J32: 24 | L32: 20 | O32: 30 | P32: 18 | R32: 18 | X32: =SUM(+F32+G32+I32+J32+L32+M32+O32+P32+R32+S32+U32+V32) -> 177 | Z32: =SUM(AB32-X32) -> 102 | AB32: =SUM(X$6) -> 279
A33: 28 | B33: Ron Finch | C33: Woods | D33: 11-142 | E33: Top Notch | F33: 21 | I33: 24 | J33: 25 | L33: 15 | O33: 28 | P33: 31 | R33: 19 | X33: =SUM(+F33+G33+I33+J33+L33+M33+O33+P33+R33+S33+U33+V33) -> 163 | Z33: =SUM(AB33-X33) -> 116 | AB33: =SUM(X$6) -> 279
A34: 29 | B34: Mitz Brown | C34: NP | D34: 11-159 | E34: Barnyard Bandit | F34: 17 | I34: 25 | J34: 20 | L34: 22 | O34: 25 | P34: 23 | R34: 22 | X34: =SUM(+F34+G34+I34+J34+L34+M34+O34+P34+R34+S34+U34+V34) -> 154 | Z34: =SUM(AB34-X34) -> 125 | AB34: =SUM(X$6) -> 279
A35: 30 | B35: Tony Heifner | C35: TH | D35: 11-116 | E35: Heartbeat | F35: 27 | G35: 17 | I35: 23 | L35: 17 | O35: 26 | P35: 22 | R35: 18 | X35: =SUM(+F35+G35+I35+J35+L35+M35+O35+P35+R35+S35+U35+V35) -> 150 | Z35: =SUM(AB35-X35) -> 129 | AB35: =SUM(X$6) -> 279
A36: 31 | B36: Tim Shaw | C36: TV | D36: 11-246 | E36: No Oulet | F36: 25 | G36: 14 | I36: 20 | L36: 24 | M36: 15 | O36: 23 | R36: 23 | X36: =SUM(+F36+G36+I36+J36+L36+M36+O36+P36+R36+S36+U36+V36) -> 144 | Z36: =SUM(AB36-X36) -> 135 | AB36: =SUM(X$6) -> 279
A37: 32 | B37: Randy Demers | C37: NP | D37: 11-084 | E37: Bounty Hunter | F37: 27 | G37: 21 | I37: 15 | L37: 16 | O37: 17 | R37: 26 | S37: 19 | X37: =SUM(+F37+G37+I37+J37+L37+M37+O37+P37+R37+S37+U37+V37) -> 141 | Z37: =SUM(AB37-X37) -> 138 | AB37: =SUM(X$6) -> 279
A38: 33 | B38: Shawn Garman | C38: JRS | D38: 11-230 | E38: Gun Slinger | F38: 30 | G38: 27 | I38: 20 | L38: 22 | O38: 19 | R38: 22 | X38: =SUM(+F38+G38+I38+J38+L38+M38+O38+P38+R38+S38+U38+V38) -> 140 | Z38: =SUM(AB38-X38) -> 139 | AB38: =SUM(X$6) -> 279
A39: 34 | B39: Kole Larkins | C39: JW | D39: 11-372 | E39: Wound Up | F39: 29 | G39: 15 | I39: 22 | L39: 18 | O39: 27 | P39: 27 | X39: =SUM(+F39+G39+I39+J39+L39+M39+O39+P39+R39+S39+U39+V39) -> 138 | Z39: =SUM(AB39-X39) -> 141 | AB39: =SUM(X$6) -> 279
A40: 35 | B40: Matt Rader | C40: RPM | D40: 11-259 | E40: Lethal Response | F40: 30 | G40: 32 | I40: 20 | L40: 28 | M40: 25 | X40: =SUM(+F40+G40+I40+J40+L40+M40+O40+P40+R40+S40+U40+V40) -> 135 | Z40: =SUM(AB40-X40) -> 144 | AB40: =SUM(X$6) -> 279
A41: 36 | B41: Charlie Schultz | C41: MVP | D41: 11-102 | E41: Silver Bullet | F41: 28 | G41: 31 | I41: 18 | L41: 20 | O41: 21 | R41: 16 | X41: =SUM(+F41+G41+I41+J41+L41+M41+O41+P41+R41+S41+U41+V41) -> 134 | Z41: =SUM(AB41-X41) -> 145 | AB41: =SUM(X$6) -> 279
A42: 37 | B42: Connie Morgenstern | C42: JRS | D42: 11-066 | E42: Domestic Diva | F42: 16 | I42: 26 | J42: 22 | L42: 22 | O42: 24 | P42: 20 | X42: =SUM(+F42+G42+I42+J42+L42+M42+O42+P42+R42+S42+U42+V42) -> 130 | Z42: =SUM(AB42-X42) -> 149 | AB42: =SUM(X$6) -> 279
A43: 38 | B43: Mark Brown | C43: NP | D43: 11-160 | E43: Buckshot | F43: 24 | G43: 24 | I43: 20 | L43: 21 | O43: 18 | R43: 21 | X43: =SUM(+F43+G43+I43+J43+L43+M43+O43+P43+R43+S43+U43+V43) -> 128 | Z43: =SUM(AB43-X43) -> 151 | AB43: =SUM(X$6) -> 279
A44: 39 | B44: Judy Lowe | C44: TV | D44: 11-010 | E44: Slow Motion | F44: 21 | I44: 24 | J44: 13 | L44: 19 | O44: 22 | R44: 20 | X44: =SUM(+F44+G44+I44+J44+L44+M44+O44+P44+R44+S44+U44+V44) -> 119 | Z44: =SUM(AB44-X44) -> 160 | AB44: =SUM(X$6) -> 279
A45: 40 | B45: Gary Frank | C45: TV | D45: 11-233 | E45: Katies Toy | F45: 28 | G45: 18 | I45: 29 | J45: 21 | L45: 23 | X45: =SUM(+F45+G45+I45+J45+L45+M45+O45+P45+R45+S45+U45+V45) -> 119 | Z45: =SUM(AB45-X45) -> 160 | AB45: =SUM(X$6) -> 279
A46: 41 | B46: Roger McKinney | C46: JRS | D46: 11-083 | E46: Blue Thunder | F46: 23 | I46: 18 | L46: 19 | O46: 24 | P46: 13 | R46: 20 | X46: =SUM(+F46+G46+I46+J46+L46+M46+O46+P46+R46+S46+U46+V46) -> 117 | Z46: =SUM(AB46-X46) -> 162 | AB46: =SUM(X$6) -> 279
A47: 42 | B47: Ed Kenner | C47: JRS | D47: 11-303 | E47: Along for the Ride | F47: 23 | I47: 26 | J47: 32 | L47: 15 | R47: 21 | X47: =SUM(+F47+G47+I47+J47+L47+M47+O47+P47+R47+S47+U47+V47) -> 117 | Z47: =SUM(AB47-X47) -> 162 | AB47: =SUM(X$6) -> 279
A48: 43 | B48: John Elrod | C48: TV | D48: 11-020 | E48: Bad Habit | F48: 25 | G48: 20 | I48: 18 | R48: 28 | S48: 22 | X48: =SUM(+F48+G48+I48+J48+L48+M48+O48+P48+R48+S48+U48+V48) -> 113 | Z48: =SUM(AB48-X48) -> 166 | AB48: =SUM(X$6) -> 279
A49: 44 | B49: Bob Cooper | C49: JRS | D49: 11-072 | I49: 25 | J49: 37 | L49: 30 | M49: 21 | X49: =SUM(+F49+G49+I49+J49+L49+M49+O49+P49+R49+S49+U49+V49) -> 113 | Z49: =SUM(AB49-X49) -> 166 | AB49: =SUM(X$6) -> 279
A50: 45 | B50: Kenneth Smith | C50: JRS | D50: 11-125 | E50: Sidewinder | F50: 16 | I50: 17 | L50: 15 | O50: 21 | R50: 25 | S50: 18 | X50: =SUM(+F50+G50+I50+J50+L50+M50+O50+P50+R50+S50+U50+V50) -> 112 | Z50: =SUM(AB50-X50) -> 167 | AB50: =SUM(X$6) -> 279
A51: 46 | B51: Mark Rader | C51: RPM | D51: 11-213 | E51: Lethal Weapon | F51: 26 | G51: 13 | I51: 19 | L51: 24 | M51: 24 | X51: =SUM(+F51+G51+I51+J51+L51+M51+O51+P51+R51+S51+U51+V51) -> 106 | Z51: =SUM(AB51-X51) -> 173 | AB51: =SUM(X$6) -> 279
A52: 47 | B52: Bob Jones Sr | C52: BJ | D52: 11-182 | E52: Buckeye Binder | F52: 19 | I52: 22 | O52: 20 | R52: 27 | S52: 17 | X52: =SUM(+F52+G52+I52+J52+L52+M52+O52+P52+R52+S52+U52+V52) -> 105 | Z52: =SUM(AB52-X52) -> 174 | AB52: =SUM(X$6) -> 279
A53: 48 | B53: Trent Evans | C53: NP | D53: 11-357 | E53: Bad out of Boyd | F53: 22 | I53: 30 | J53: 36 | L53: 17 | X53: =SUM(+F53+G53+I53+J53+L53+M53+O53+P53+R53+S53+U53+V53) -> 105 | Z53: =SUM(AB53-X53) -> 174 | AB53: =SUM(X$6) -> 279
A54: 49 | B54: Gaylord Strine | C54: JRS | D54: 11-126 | L54: 25 | M54: 16 | R54: 29 | S54: 26 | X54: =SUM(+F54+G54+I54+J54+L54+M54+O54+P54+R54+S54+U54+V54) -> 96 | Z54: =SUM(AB54-X54) -> 183 | AB54: =SUM(X$6) -> 279
A55: 50 | B55: Tony Heifner | C55: TH | D55: 11-231 | E55: Instigator | F55: 17 | I55: 20 | L55: 13 | O55: 21 | R55: 21 | X55: =SUM(+F55+G55+I55+J55+L55+M55+O55+P55+R55+S55+U55+V55) -> 92 | Z55: =SUM(AB55-X55) -> 187 | AB55: =SUM(X$6) -> 279
A56: 51 | B56: Todd Hinkle | C56: RPM | D56: 11-370 | E56: Disturbed | F56: 18 | I56: 17 | L56: 16 | O56: 22 | R56: 19 | X56: =SUM(+F56+G56+I56+J56+L56+M56+O56+P56+R56+S56+U56+V56) -> 92 | Z56: =SUM(AB56-X56) -> 187 | AB56: =SUM(X$6) -> 279
A57: 52 | B57: Jack Lowe | C57: TV | D57: 11-161 | E57: Locomotion | F57: 22 | I57: 15 | L57: 18 | O57: 16 | R57: 19 | X57: =SUM(+F57+G57+I57+J57+L57+M57+O57+P57+R57+S57+U57+V57) -> 90 | Z57: =SUM(AB57-X57) -> 189 | AB57: =SUM(X$6) -> 279
A58: 53 | B58: Brian Simpson | C58: Woods | D58: 11-290 | E58: Rampdoor Express | F58: 19 | I58: 16 | L58: 15 | O58: 18 | R58: 22 | X58: =SUM(+F58+G58+I58+J58+L58+M58+O58+P58+R58+S58+U58+V58) -> 90 | Z58: =SUM(AB58-X58) -> 189 | AB58: =SUM(X$6) -> 279
A59: 54 | B59: Waylon Nelson | D59: 11-413 | E59: But Ugly | O59: 23 | R59: 26 | S59: 32 | X59: =SUM(+F59+G59+I59+J59+L59+M59+O59+P59+R59+S59+U59+V59) -> 81 | Z59: =SUM(AB59-X59) -> 198 | AB59: =SUM(X$6) -> 279
A60: 55 | B60: Jack Bowlin | C60: VM | D60: 11-418 | E60: High Bender | O60: 30 | P60: 33 | R60: 18 | X60: =SUM(+F60+G60+I60+J60+L60+M60+O60+P60+R60+S60+U60+V60) -> 81 | Z60: =SUM(AB60-X60) -> 198 | AB60: =SUM(X$6) -> 279
A61: 56 | B61: Caleb Peters | D61: 11-371 | E61: Bernies Nightmare | I61: 18 | R61: 29 | S61: 33 | X61: =SUM(+F61+G61+I61+J61+L61+M61+O61+P61+R61+S61+U61+V61) -> 80 | Z61: =SUM(AB61-X61) -> 199 | AB61: =SUM(X$6) -> 279
A62: 57 | B62: Steve Chrisman | C62: Hackman | D62: 11-022 | E62: Razmatazz | F62: 20 | I62: 15 | L62: 23 | R62: 17 | X62: =SUM(+F62+G62+I62+J62+L62+M62+O62+P62+R62+S62+U62+V62) -> 75 | Z62: =SUM(AB62-X62) -> 204 | AB62: =SUM(X$6) -> 279
A63: 58 | B63: Bill Elrod | C63: TV | D63: 11-021 | E63: Pa Paws Toy | F63: 23 | I63: 16 | L63: 16 | R63: 18 | X63: =SUM(+F63+G63+I63+J63+L63+M63+O63+P63+R63+S63+U63+V63) -> 73 | Z63: =SUM(AB63-X63) -> 206 | AB63: =SUM(X$6) -> 279
A64: 59 | B64: Ed Jones | D64: 11-271 | L64: 30 | M64: 40 | X64: =SUM(+F64+G64+I64+J64+L64+M64+O64+P64+R64+S64+U64+V64) -> 70 | Z64: =SUM(AB64-X64) -> 209 | AB64: =SUM(X$6) -> 279
A65: 60 | B65: Dave Gawatz | C65: LR | D65: 11-408 | E65: Undertaker | O65: 25 | P65: 24 | R65: 15 | X65: =SUM(+F65+G65+I65+J65+L65+M65+O65+P65+R65+S65+U65+V65) -> 64 | Z65: =SUM(AB65-X65) -> 215 | AB65: =SUM(X$6) -> 279
A66: 61 | B66: Randy Hazelbaker | C66: TV | D66: 11-087 | E66: One Bad Buck | F66: 22 | L66: 25 | M66: 13 | X66: =SUM(+F66+G66+I66+J66+L66+M66+O66+P66+R66+S66+U66+V66) -> 60 | Z66: =SUM(AB66-X66) -> 219 | AB66: =SUM(X$6) -> 279
A67: 62 | B67: Bill Shreffler | C67: NP | D67: 11-379 | E67: Thunderstruck Deere | I67: 19 | L67: 27 | M67: 14 | X67: =SUM(+F67+G67+I67+J67+L67+M67+O67+P67+R67+S67+U67+V67) -> 60 | Z67: =SUM(AB67-X67) -> 219 | AB67: =SUM(X$6) -> 279
A68: 63 | B68: George Bax | C68: LR | D68: 11-422 | E68: Plum Crazy | O68: 29 | P68: 28 | X68: =SUM(+F68+G68+I68+J68+L68+M68+O68+P68+R68+S68+U68+V68) -> 57 | Z68: =SUM(AB68-X68) -> 222 | AB68: =SUM(X$6) -> 279
A69: 64 | B69: Randy Amstutz | C69: Woods | D69: 11-166 | E69: Cub Cadet | F69: 20 | I69: 15 | R69: 21 | X69: =SUM(+F69+G69+I69+J69+L69+M69+O69+P69+R69+S69+U69+V69) -> 56 | Z69: =SUM(AB69-X69) -> 223 | AB69: =SUM(X$6) -> 279
A70: 65 | B70: Tony Lewis | C70: Tel Tool | D70: 11-345 | E70: Plain Jane | F70: 21 | O70: 19 | R70: 16 | X70: =SUM(+F70+G70+I70+J70+L70+M70+O70+P70+R70+S70+U70+V70) -> 56 | Z70: =SUM(AB70-X70) -> 223 | AB70: =SUM(X$6) -> 279
A71: 66 | B71: Gregory Vandervort | C71: TV | D71: 11-346 | E71: Yellow Cub | F71: 17 | I71: 18 | L71: 21 | X71: =SUM(+F71+G71+I71+J71+L71+M71+O71+P71+R71+S71+U71+V71) -> 56 | Z71: =SUM(AB71-X71) -> 223 | AB71: =SUM(X$6) -> 279
A72: 67 | B72: Ron Feldkamp | C72: Woods | D72: 11-143 | E72: Key Chain | F72: 15 | I72: 22 | R72: 17 | X72: =SUM(+F72+G72+I72+J72+L72+M72+O72+P72+R72+S72+U72+V72) -> 54 | Z72: =SUM(AB72-X72) -> 225 | AB72: =SUM(X$6) -> 279
A73: 68 | B73: Danny Garman | D73: 11-391 | E73: Jag Master | L73: 17 | O73: 20 | R73: 17 | X73: =SUM(+F73+G73+I73+J73+L73+M73+O73+P73+R73+S73+U73+V73) -> 54 | Z73: =SUM(AB73-X73) -> 225 | AB73: =SUM(X$6) -> 279
A74: 69 | B74: Rick James | C74: BJ | D74: 11-427 | E74: James Gang III | R74: 28 | S74: 24 | X74: =SUM(+F74+G74+I74+J74+L74+M74+O74+P74+R74+S74+U74+V74) -> 52 | Z74: =SUM(AB74-X74) -> 227 | AB74: =SUM(X$6) -> 279
A75: 70 | B75: Chris Gregg | C75: JRS | D75: 11-315 | E75: Insane | R75: 24 | S75: 25 | X75: =SUM(+F75+G75+I75+J75+L75+M75+O75+P75+R75+S75+U75+V75) -> 49 | Z75: =SUM(AB75-X75) -> 230 | AB75: =SUM(X$6) -> 279
A76: 71 | B76: Doug Frank | C76: JRS | D76: 11-249 | E76: Aggrevation | L76: 25 | M76: 20 | X76: =SUM(+F76+G76+I76+J76+L76+M76+O76+P76+R76+S76+U76+V76) -> 45 | Z76: =SUM(AB76-X76) -> 234 | AB76: =SUM(X$6) -> 279
A77: 72 | B77: Steve Clark | C77: SC | D77: 11-322 | E77: Pullin for JESUS | F77: 15 | I77: 16 | L77: 13 | X77: =SUM(+F77+G77+I77+J77+L77+M77+O77+P77+R77+S77+U77+V77) -> 44 | Z77: =SUM(AB77-X77) -> 235 | AB77: =SUM(X$6) -> 279
A78: 73 | B78: Garrett Bye | C78: Woods | D78: 11-409 | E78: Flame Burner | O78: 24 | P78: 19 | X78: =SUM(+F78+G78+I78+J78+L78+M78+O78+P78+R78+S78+U78+V78) -> 43 | Z78: =SUM(AB78-X78) -> 236 | AB78: =SUM(X$6) -> 279
A79: 74 | B79: Brian Peregrine | D79: 11-415 | E79: Wood Chipper | O79: 26 | P79: 16 | X79: =SUM(+F79+G79+I79+J79+L79+M79+O79+P79+R79+S79+U79+V79) -> 42 | Z79: =SUM(AB79-X79) -> 237 | AB79: =SUM(X$6) -> 279
A80: 75 | B80: Aaron Mason | C80: NP | D80: 11-356 | E80: Frustrated | F80: 18 | I80: 21 | X80: =SUM(+F80+G80+I80+J80+L80+M80+O80+P80+R80+S80+U80+V80) -> 39 | Z80: =SUM(AB80-X80) -> 240 | AB80: =SUM(X$6) -> 279
A81: 76 | B81: Tim Rankin | C81: Woods | D81: 11-287 | E81: Incognito | I81: 17 | L81: 18 | X81: =SUM(+F81+G81+I81+J81+L81+M81+O81+P81+R81+S81+U81+V81) -> 35 | Z81: =SUM(AB81-X81) -> 244 | AB81: =SUM(X$6) -> 279
A82: 77 | B82: Robin Cooper | C82: JRS | D82: 11-073 | I82: 14 | L82: 17 | X82: =SUM(+F82+G82+I82+J82+L82+M82+O82+P82+R82+S82+U82+V82) -> 31 | Z82: =SUM(AB82-X82) -> 248 | AB82: =SUM(X$6) -> 279
A83: 78 | B83: Doug Rood | D83: 11-354 | E83: Blue Dawg | O83: 23 | X83: =SUM(+F83+G83+I83+J83+L83+M83+O83+P83+R83+S83+U83+V83) -> 23 | Z83: =SUM(AB83-X83) -> 256 | AB83: =SUM(X$6) -> 279
A84: 79 | B84: Bob Cooper | C84: JRS | D84: 11-383 | L84: 23 | X84: =SUM(+F84+G84+I84+J84+L84+M84+O84+P84+R84+S84+U84+V84) -> 23 | Z84: =SUM(AB84-X84) -> 256 | AB84: =SUM(X$6) -> 279
A85: 80 | B85: Waylon Nelson | D85: 11-412 | E85: Close Enough | O85: 22 | X85: =SUM(+F85+G85+I85+J85+L85+M85+O85+P85+R85+S85+U85+V85) -> 22 | Z85: =SUM(AB85-X85) -> 257 | AB85: =SUM(X$6) -> 279
A86: 81 | B86: Keith Roberts | C86: TC | D86: 11-194 | E86: Yellow Jacket | R86: 20 | X86: =SUM(+F86+G86+I86+J86+L86+M86+O86+P86+R86+S86+U86+V86) -> 20 | Z86: =SUM(AB86-X86) -> 259 | AB86: =SUM(X$6) -> 279
A87: 82 | B87: Mike Hall | C87: RPM | D87: 11-248 | E87: Lethal Injection | L87: 20 | X87: =SUM(+F87+G87+I87+J87+L87+M87+O87+P87+R87+S87+U87+V87) -> 20 | Z87: =SUM(AB87-X87) -> 259 | AB87: =SUM(X$6) -> 279
A88: 83 | B88: Larry Hunter | C88: JRS | D88: 11-377 | E88: Intimidator | I88: 19 | X88: =SUM(+F88+G88+I88+J88+L88+M88+O88+P88+R88+S88+U88+V88) -> 19 | Z88: =SUM(AB88-X88) -> 260 | AB88: =SUM(X$6) -> 279
A89: 84 | B89: Leslie Sullivan | D89: 11-120 | E89: Joker | O89: 18 | X89: =SUM(+F89+G89+I89+J89+L89+M89+O89+P89+R89+S89+U89+V89) -> 18 | Z89: =SUM(AB89-X89) -> 261 | AB89: =SUM(X$6) -> 279
A90: 85 | B90: Jerry Leonard | C90: VM | D90: 11-308 | E90: Hi-Strung | F90: 18 | X90: =SUM(+F90+G90+I90+J90+L90+M90+O90+P90+R90+S90+U90+V90) -> 18 | Z90: =SUM(AB90-X90) -> 261 | AB90: =SUM(X$6) -> 279
A91: 86 | B91: Annette Sullivan | C91: MVP | D91: 11-122 | E91: Just Relax | F91: 17 | X91: =SUM(+F91+G91+I91+J91+L91+M91+O91+P91+R91+S91+U91+V91) -> 17 | Z91: =SUM(AB91-X91) -> 262 | AB91: =SUM(X$6) -> 279
A92: 87 | B92: Haylee Heits | D92: 11-411 | E92: Full Throttle | O92: 17 | X92: =SUM(+F92+G92+I92+J92+L92+M92+O92+P92+R92+S92+U92+V92) -> 17 | Z92: =SUM(AB92-X92) -> 262 | AB92: =SUM(X$6) -> 279
A93: 88 | B93: Andy Ring | D93: 11-416 | E93: Money Pit | O93: 17 | X93: =SUM(+F93+G93+I93+J93+L93+M93+O93+P93+R93+S93+U93+V93) -> 17 | Z93: =SUM(AB93-X93) -> 262 | AB93: =SUM(X$6) -> 279
A94: 89 | B94: Greg Block | C94: JW | D94: 11-435 | R94: 17 | X94: =SUM(+F94+G94+I94+J94+L94+M94+O94+P94+R94+S94+U94+V94) -> 17 | Z94: =SUM(AB94-X94) -> 262 | AB94: =SUM(X$6) -> 279
A95: 90 | B95: Justin Wagler | C95: WP | D95: 11-127 | E95: Samson | F95: 16 | X95: =SUM(+F95+G95+I95+J95+L95+M95+O95+P95+R95+S95+U95+V95) -> 16 | Z95: =SUM(AB95-X95) -> 263 | AB95: =SUM(X$6) -> 279
A96: 91 | B96: Jeremy Pierce | C96: JP | D96: 11-362 | E96: Lunch Money | F96: 16 | X96: =SUM(+F96+G96+I96+J96+L96+M96+O96+P96+R96+S96+U96+V96) -> 16 | Z96: =SUM(AB96-X96) -> 263 | AB96: =SUM(X$6) -> 279
A97: 92 | B97: Dave Garrant | C97: NP | D97: 11-378 | E97: Gambler II | I97: 16 | X97: =SUM(+F97+G97+I97+J97+L97+M97+O97+P97+R97+S97+U97+V97) -> 16 | Z97: =SUM(AB97-X97) -> 263 | AB97: =SUM(X$6) -> 279
A98: 93 | B98: Ronald Marcine | C98: JRS | D98: 11-388 | E98: Boogie Man | L98: 16 | X98: =SUM(+F98+G98+I98+J98+L98+M98+O98+P98+R98+S98+U98+V98) -> 16 | Z98: =SUM(AB98-X98) -> 263 | AB98: =SUM(X$6) -> 279
A99: 94 | B99: Rick Massey | D99: 11-421 | E99: Spare Parts | O99: 16 | X99: =SUM(+F99+G99+I99+J99+L99+M99+O99+P99+R99+S99+U99+V99) -> 16 | Z99: =SUM(AB99-X99) -> 263 | AB99: =SUM(X$6) -> 279
A100: 95 | B100: Wes Kempeter | D100: 11-424 | E100: Wasted Money | R100: 16 | X100: =SUM(+F100+G100+I100+J100+L100+M100+O100+P100+R100+S100+U100+V100) -> 16 | Z100: =SUM(AB100-X100) -> 263 | AB100: =SUM(X$6) -> 279
A101: 96 | B101: Jim Hill | C101: JW | D101: 11-328 | F101: 15 | X101: =SUM(+F101+G101+I101+J101+L101+M101+O101+P101+R101+S101+U101+V101) -> 15 | Z101: =SUM(AB101-X101) -> 264 | AB101: =SUM(X$6) -> 279
A102: 97 | B102: Jeremy Jaspering | D102: 11-405 | E102: Runnin Wild | R102: 15 | X102: =SUM(+F102+G102+I102+J102+L102+M102+O102+P102+R102+S102+U102+V102) -> 15 | Z102: =SUM(AB102-X102) -> 264 | AB102: =SUM(X$6) -> 279
A103: 98 | B103: Dan Scott | C103: JRS | D103: 11-119 | E103: Power of Prayer | L103: 14 | X103: =SUM(+F103+G103+I103+J103+L103+M103+O103+P103+R103+S103+U103+V103) -> 14 | Z103: =SUM(AB103-X103) -> 265 | AB103: =SUM(X$6) -> 279
A104: 99 | B104: Gordy Lloyd | D104: 11-205 | E104: Buck Wild | L104: 14 | X104: =SUM(+F104+G104+I104+J104+L104+M104+O104+P104+R104+S104+U104+V104) -> 14 | Z104: =SUM(AB104-X104) -> 265 | AB104: =SUM(X$6) -> 279
A105: 100 | B105: Amanda Manville | C105: JRS | D105: 11-235 | E105: Sidewinder | L105: 14 | X105: =SUM(+F105+G105+I105+J105+L105+M105+O105+P105+R105+S105+U105+V105) -> 14 | Z105: =SUM(AB105-X105) -> 265 | AB105: =SUM(X$6) -> 279
A106: 101 | B106: Jessican Richter | C106: RPM | D106: 11-263 | E106: High Roller | L106: 14 | X106: =SUM(+F106+G106+I106+J106+L106+M106+O106+P106+R106+S106+U106+V106) -> 14 | Z106: =SUM(AB106-X106) -> 265 | AB106: =SUM(X$6) -> 279
A107: 102 | B107: Jerry Sweet | C107: LR | D107: 11-284 | E107: Phat Ride | I107: 14 | X107: =SUM(+F107+G107+I107+J107+L107+M107+O107+P107+R107+S107+U107+V107) -> 14 | Z107: =SUM(AB107-X107) -> 265 | AB107: =SUM(X$6) -> 279
A108: 103 | B108: Dave Shulko | C108: BJ | D108: 11-181 | L108: 13 | X108: =SUM(+F108+G108+I108+J108+L108+M108+O108+P108+R108+S108+U108+V108) -> 13 | Z108: =SUM(AB108-X108) -> 266 | AB108: =SUM(X$6) -> 279