B2: PRO STOCK CLASS
F5: Princeton, Ind | I5: Richmond,KY | L5: Marietta | O5: Kansas City | R5: Sturgis | U5: Tallmadge
B6: Name | C6: Eng. | D6: NQS # | E6: Tractor | F6: Qualifying Points | G6: Finals Points | I6: Qualifying Points | J6: Finals Points | L6: Qualifying Points | M6: Finals Points | O6: Qualifying Points | P6: Finals Points | R6: Qualifying Points | S6: Finals Points | U6: Qualifying Points | V6: Finals Points | X6: Total Points | Z6: Points Back | AB6: Teardown sticker check
A7: 1 | B7: Russ Nichols | C7: NP | D7: 11-069 | E7: Top Secret | F7: 30 | G7: 21 | I7: 30 | J7: 40 | L7: 30 | M7: 39 | O7: 30 | P7: 35 | R7: 30 | S7: 40 | X7: =SUM(+F7+G7+I7+J7+L7+M7+O7+P7++R7+S7+U7+V7) -> 325 | Z7: =SUM(AB7-X7) -> 0 | AB7: =SUM(X$7) -> 325
A8: 2 | B8: Julian Stahl | C8: MVP | D8: 11-001 | E8: MWSC #1 | F8: 28 | G8: 33 | I8: 26 | J8: 30 | L8: 29 | M8: 35 | O8: 29 | P8: 40 | R8: 27 | S8: 31 | X8: =SUM(+F8+G8+I8+J8+L8+M8+O8+P8++R8+S8+U8+V8) -> 308 | Z8: =SUM(AB8-X8) -> 17 | AB8: =SUM(X$7) -> 325
A9: 3 | B9: Kelly Nichols | C9: NP | D9: 11-070 | E9: Wild One 2 | F9: 26 | G9: 20 | I9: 30 | J9: 38 | L9: 27 | M9: 40 | O9: 29 | P9: 25 | R9: 28 | S9: 33 | X9: =SUM(+F9+G9+I9+J9+L9+M9+O9+P9++R9+S9+U9+V9) -> 296 | Z9: =SUM(AB9-X9) -> 29 | AB9: =SUM(X$7) -> 325
A10: 4 | B10: Clyde Mishler | C10: GTP | D10: 11-168 | F10: 30 | G10: 40 | I10: 30 | J10: 36 | L10: 30 | M10: 30 | O10: 26 | P10: 26 | R10: 27 | S10: 16 | X10: =SUM(+F10+G10+I10+J10+L10+M10+O10+P10++R10+S10+U10+V10) -> 291 | Z10: =SUM(AB10-X10) -> 34 | AB10: =SUM(X$7) -> 325
A11: 5 | B11: Larry Fox | C11: JRS | D11: 11-007 | E11: Intimidation | F11: 28 | G11: 24 | I11: 28 | J11: 34 | L11: 25 | M11: 26 | O11: 28 | P11: 19 | R11: 28 | S11: 39 | X11: =SUM(+F11+G11+I11+J11+L11+M11+O11+P11++R11+S11+U11+V11) -> 279 | Z11: =SUM(AB11-X11) -> 46 | AB11: =SUM(X$7) -> 325
A12: 6 | B12: Randy Demers | C12: NP | D12: 11-085 | E12: Widowmaker | F12: 16 | I12: 28 | J12: 39 | L12: 30 | M12: 36 | O12: 27 | P12: 27 | R12: 28 | S12: 36 | X12: =SUM(+F12+G12+I12+J12+L12+M12+O12+P12++R12+S12+U12+V12) -> 267 | Z12: =SUM(AB12-X12) -> 58 | AB12: =SUM(X$7) -> 325
A13: 7 | B13: Julian Stahl | C13: MVP | D13: 11-002 | E13: MWSC #2 | F13: 30 | G13: 27 | I13: 23 | L13: 27 | M13: 38 | O13: 27 | P13: 38 | R13: 28 | S13: 26 | X13: =SUM(+F13+G13+I13+J13+L13+M13+O13+P13++R13+S13+U13+V13) -> 264 | Z13: =SUM(AB13-X13) -> 61 | AB13: =SUM(X$7) -> 325
A14: 8 | B14: Nick Mishler | C14: GTP | D14: 11-167 | E14: Pulse | F14: 27 | G14: 29 | I14: 23 | L14: 27 | M14: 31 | O14: 27 | P14: 37 | R14: 29 | S14: 32 | X14: =SUM(+F14+G14+I14+J14+L14+M14+O14+P14++R14+S14+U14+V14) -> 262 | Z14: =SUM(AB14-X14) -> 63 | AB14: =SUM(X$7) -> 325
A15: 9 | B15: Billy Black | C15: NP | D15: 11-044 | E15: Lots of Nichols | F15: 23 | I15: 28 | J15: 35 | L15: 27 | M15: 34 | O15: 30 | P15: 29 | R15: 27 | S15: 24 | X15: =SUM(+F15+G15+I15+J15+L15+M15+O15+P15++R15+S15+U15+V15) -> 257 | Z15: =SUM(AB15-X15) -> 68 | AB15: =SUM(X$7) -> 325
A16: 10 | B16: Nathan Nichols | C16: LR | D16: 11-151 | E16: Wildstreak | F16: 29 | G16: 35 | I16: 24 | J16: 29 | L16: 23 | O16: 29 | P16: 36 | R16: 26 | S16: 22 | X16: =SUM(+F16+G16+I16+J16+L16+M16+O16+P16++R16+S16+U16+V16) -> 253 | Z16: =SUM(AB16-X16) -> 72 | AB16: =SUM(X$7) -> 325
A17: 11 | B17: Jerry Skuta | C17: NP | D17: 11-329 | E17: Green Tractor | F17: 29 | G17: 37 | I17: 26 | J17: 10 | L17: 30 | M17: 29 | O17: 23 | R17: 29 | S17: 37 | X17: =SUM(+F17+G17+I17+J17+L17+M17+O17+P17++R17+S17+U17+V17) -> 250 | Z17: =SUM(AB17-X17) -> 75 | AB17: =SUM(X$7) -> 325
A18: 12 | B18: Steve Williford | C18: MVP | D18: 11-276 | E18: International Express | F18: 20 | I18: 29 | J18: 26 | L18: 27 | M18: 37 | O18: 30 | P18: 22 | R18: 30 | S18: 28 | X18: =SUM(+F18+G18+I18+J18+L18+M18+O18+P18++R18+S18+U18+V18) -> 249 | Z18: =SUM(AB18-X18) -> 76 | AB18: =SUM(X$7) -> 325
A19: 13 | B19: Kevin Root | C19: Roots | D19: 11-118 | E19: Slapshot | F19: 25 | G19: 39 | I19: 30 | J19: 23 | L19: 28 | M19: 19 | O19: 30 | P19: 16 | R19: 26 | S19: 7 | X19: =SUM(+F19+G19+I19+J19+L19+M19+O19+P19++R19+S19+U19+V19) -> 243 | Z19: =SUM(AB19-X19) -> 82 | AB19: =SUM(X$7) -> 325
A20: 14 | B20: Harrison Stahl | C20: MVP | D20: 11-335 | E20: MWSC #3 | F20: 22 | I20: 26 | J20: 33 | L20: 29 | M20: 17 | O20: 25 | P20: 23 | R20: 30 | S20: 27 | X20: =SUM(+F20+G20+I20+J20+L20+M20+O20+P20++R20+S20+U20+V20) -> 232 | Z20: =SUM(AB20-X20) -> 93 | AB20: =SUM(X$7) -> 325
A21: 15 | B21: Greg Watson | C21: LR | D21: 11-079 | E21: Bear-ly Legal | F21: 25 | G21: 38 | I21: 27 | J21: 11 | L21: 22 | O21: 28 | P21: 34 | R21: 26 | S21: 20 | X21: =SUM(+F21+G21+I21+J21+L21+M21+O21+P21++R21+S21+U21+V21) -> 231 | Z21: =SUM(AB21-X21) -> 94 | AB21: =SUM(X$7) -> 325
A22: 16 | B22: Greg Curtsinger | C22: NP | D22: 11-008 | E22: Wicked Deere | F22: 27 | G22: 22 | I22: 27 | J22: 14 | L22: 28 | M22: 32 | O22: 26 | P22: 31 | R22: 20 | X22: =SUM(+F22+G22+I22+J22+L22+M22+O22+P22++R22+S22+U22+V22) -> 227 | Z22: =SUM(AB22-X22) -> 98 | AB22: =SUM(X$7) -> 325
A23: 17 | B23: Steve Chrisman | C23: Hackman | D23: 11-026 | E23: 330 Deere | F23: 25 | G23: 23 | I23: 30 | J23: 37 | L23: 25 | M23: 20 | R23: 26 | S23: 38 | X23: =SUM(+F23+G23+I23+J23+L23+M23+O23+P23++R23+S23+U23+V23) -> 224 | Z23: =SUM(AB23-X23) -> 101 | AB23: =SUM(X$7) -> 325
A24: 18 | B24: Eli Zimmerman | C24: NP | D24: 11-074 | E24: Red Fever | F24: 28 | G24: 31 | I24: 28 | J24: 18 | L24: 26 | M24: 15 | O24: 23 | R24: 26 | S24: 25 | X24: =SUM(+F24+G24+I24+J24+L24+M24+O24+P24++R24+S24+U24+V24) -> 220 | Z24: =SUM(AB24-X24) -> 105 | AB24: =SUM(X$7) -> 325
A25: 19 | B25: Ed Nichols | C25: LR | D25: 11-124 | E25: Track Attack | F25: 26 | G25: 36 | I25: 29 | J25: 21 | L25: 18 | O25: 28 | P25: 39 | R25: 22 | X25: =SUM(+F25+G25+I25+J25+L25+M25+O25+P25++R25+S25+U25+V25) -> 219 | Z25: =SUM(AB25-X25) -> 106 | AB25: =SUM(X$7) -> 325
A26: 20 | B26: Steve Burton | C26: NP | D26: 11-015 | E26: 6 Shooter | F26: 30 | G26: 32 | I26: 30 | J26: 19 | L26: 29 | M26: 6 | O26: 26 | P26: 24 | R26: 20 | X26: =SUM(+F26+G26+I26+J26+L26+M26+O26+P26++R26+S26+U26+V26) -> 216 | Z26: =SUM(AB26-X26) -> 109 | AB26: =SUM(X$7) -> 325
A27: 21 | B27: Steve Williford | C27: MVP | D27: 11-337 | E27: IH Express | F27: 29 | G27: 16 | I27: 25 | J27: 17 | L27: 26 | M27: 33 | O27: 24 | P27: 14 | R27: 24 | S27: 6 | X27: =SUM(+F27+G27+I27+J27+L27+M27+O27+P27++R27+S27+U27+V27) -> 214 | Z27: =SUM(AB27-X27) -> 111 | AB27: =SUM(X$7) -> 325
A28: 22 | B28: Steve Burton | C28: NP | D28: 11-014 | E28: Bad Company | F28: 24 | G28: 25 | I28: 29 | J28: 31 | L28: 23 | O28: 23 | R28: 30 | S28: 23 | X28: =SUM(+F28+G28+I28+J28+L28+M28+O28+P28++R28+S28+U28+V28) -> 208 | Z28: =SUM(AB28-X28) -> 117 | AB28: =SUM(X$7) -> 325
A29: 23 | B29: Larry Curtsinger | C29: NP | D29: 11-009 | E29: Runaway Deere | F29: 29 | G29: 18 | I29: 23 | L29: 26 | M29: 28 | O29: 27 | P29: 33 | R29: 23 | X29: =SUM(+F29+G29+I29+J29+L29+M29+O29+P29++R29+S29+U29+V29) -> 207 | Z29: =SUM(AB29-X29) -> 118 | AB29: =SUM(X$7) -> 325
A30: 24 | B30: Kevin Roots | C30: Roots | D30: 11-117 | E30: Right on the Money | F30: 26 | G30: 17 | I30: 24 | J30: 6 | L30: 30 | M30: 25 | O30: 24 | P30: 30 | R30: 19 | X30: =SUM(+F30+G30+I30+J30+L30+M30+O30+P30++R30+S30+U30+V30) -> 201 | Z30: =SUM(AB30-X30) -> 124 | AB30: =SUM(X$7) -> 325
A31: 25 | B31: Harrison Stahl | C31: MVP | D31: 11-336 | E31: MWSC #4 | F31: 26 | G31: 26 | I31: 24 | J31: 32 | L31: 23 | O31: 30 | P31: 11 | R31: 21 | X31: =SUM(+F31+G31+I31+J31+L31+M31+O31+P31++R31+S31+U31+V31) -> 193 | Z31: =SUM(AB31-X31) -> 132 | AB31: =SUM(X$7) -> 325
A32: 26 | B32: Darin Morgenstern | C32: JRS | D32: 11-063 | E32: Alky Hog | F32: 30 | G32: 9 | I32: 25 | J32: 20 | L32: 26 | M32: 24 | O32: 30 | P32: 12 | X32: =SUM(+F32+G32+I32+J32+L32+M32+O32+P32++R32+S32+U32+V32) -> 176 | Z32: =SUM(AB32-X32) -> 149 | AB32: =SUM(X$7) -> 325
A33: 27 | B33: Ray Gentz | C33: JRS | D33: 11-262 | E33: Chaos | F33: 21 | I33: 17 | L33: 28 | M33: 13 | O33: 24 | P33: 15 | R33: 29 | S33: 29 | X33: =SUM(+F33+G33+I33+J33+L33+M33+O33+P33++R33+S33+U33+V33) -> 176 | Z33: =SUM(AB33-X33) -> 149 | AB33: =SUM(X$7) -> 325
A34: 28 | B34: Mike Aschliman | C34: MVP | D34: 11-352 | E34: Cub 122 | F34: 29 | G34: 34 | I34: 29 | J34: 16 | L34: 24 | M34: 23 | O34: 20 | X34: =SUM(+F34+G34+I34+J34+L34+M34+O34+P34++R34+S34+U34+V34) -> 175 | Z34: =SUM(AB34-X34) -> 150 | AB34: =SUM(X$7) -> 325
A35: 29 | B35: Mark Davis | C35: JRS | D35: 11-067 | E35: NoLimits 2 | F35: 27 | G35: 30 | I35: 30 | J35: 28 | L35: 30 | M35: 6 | R35: 23 | X35: =SUM(+F35+G35+I35+J35+L35+M35+O35+P35++R35+S35+U35+V35) -> 174 | Z35: =SUM(AB35-X35) -> 151 | AB35: =SUM(X$7) -> 325
A36: 30 | B36: Steve Williford | C36: MVP | D36: 11-176 | E36: International | F36: 25 | G36: 14 | I36: 27 | J36: 7 | L36: 29 | M36: 9 | O36: 22 | R36: 29 | S36: 10 | X36: =SUM(+F36+G36+I36+J36+L36+M36+O36+P36++R36+S36+U36+V36) -> 172 | Z36: =SUM(AB36-X36) -> 153 | AB36: =SUM(X$7) -> 325
A37: 31 | B37: Matt Kaster | C37: MVP | D37: 11-332 | E37: Double XL | F37: 23 | I37: 25 | J37: 9 | L37: 22 | O37: 25 | P37: 20 | R37: 25 | S37: 21 | X37: =SUM(+F37+G37+I37+J37+L37+M37+O37+P37++R37+S37+U37+V37) -> 170 | Z37: =SUM(AB37-X37) -> 155 | AB37: =SUM(X$7) -> 325
A38: 32 | B38: Darlene Sample | C38: LR | D38: 11-202 | E38: Dr Doom | F38: 16 | I38: 24 | J38: 25 | O38: 25 | P38: 9 | R38: 27 | S38: 35 | X38: =SUM(+F38+G38+I38+J38+L38+M38+O38+P38++R38+S38+U38+V38) -> 161 | Z38: =SUM(AB38-X38) -> 164 | AB38: =SUM(X$7) -> 325
A39: 33 | B39: Don Vogt | C39: MVP | D39: 11-090 | E39: Not A Nuff | F39: 22 | I39: 20 | L39: 19 | O39: 24 | P39: 21 | R39: 24 | S39: 19 | X39: =SUM(+F39+G39+I39+J39+L39+M39+O39+P39++R39+S39+U39+V39) -> 149 | Z39: =SUM(AB39-X39) -> 176 | AB39: =SUM(X$7) -> 325
A40: 34 | B40: Steve Williford | C40: MVP | D40: 11-177 | E40: IH Trucking | F40: 19 | I40: 21 | L40: 20 | O40: 30 | P40: 32 | R40: 25 | X40: =SUM(+F40+G40+I40+J40+L40+M40+O40+P40++R40+S40+U40+V40) -> 147 | Z40: =SUM(AB40-X40) -> 178 | AB40: =SUM(X$7) -> 325
A41: 35 | B41: Tim Bristol | C41: MVP | D41: 11-363 | E41: John Deere | F41: 22 | I41: 19 | L41: 25 | M41: 11 | O41: 30 | P41: 17 | R41: 22 | X41: =SUM(+F41+G41+I41+J41+L41+M41+O41+P41++R41+S41+U41+V41) -> 146 | Z41: =SUM(AB41-X41) -> 179 | AB41: =SUM(X$7) -> 325
A42: 36 | B42: John Donavan | C42: JRS | D42: 11-006 | E42: Patience | F42: 19 | I42: 22 | L42: 20 | O42: 26 | P42: 18 | R42: 27 | S42: 13 | X42: =SUM(+F42+G42+I42+J42+L42+M42+O42+P42++R42+S42+U42+V42) -> 145 | Z42: =SUM(AB42-X42) -> 180 | AB42: =SUM(X$7) -> 325
A43: 37 | B43: Gerald Kerber | C43: NP | D43: 11-175 | E43: Wisconsin Hooker | F43: 28 | G43: 28 | L43: 28 | M43: 27 | O43: 20 | S43: 14 | X43: =SUM(+F43+G43+I43+J43+L43+M43+O43+P43++R43+S43+U43+V43) -> 145 | Z43: =SUM(AB43-X43) -> 180 | AB43: =SUM(X$7) -> 325
A44: 38 | B44: Tyler Hackman | C44: Hackman | D44: 11-342 | E44: Green | F44: 26 | G44: 15 | I44: 21 | L44: 23 | R44: 30 | S44: 30 | X44: =SUM(+F44+G44+I44+J44+L44+M44+O44+P44++R44+S44+U44+V44) -> 145 | Z44: =SUM(AB44-X44) -> 180 | AB44: =SUM(X$7) -> 325
A45: 39 | B45: Jerry Skuta | C45: NP | D45: 11-330 | E45: Mental Health 2 | F45: 20 | I45: 19 | L45: 19 | O45: 22 | R45: 29 | S45: 34 | X45: =SUM(+F45+G45+I45+J45+L45+M45+O45+P45++R45+S45+U45+V45) -> 143 | Z45: =SUM(AB45-X45) -> 182 | AB45: =SUM(X$7) -> 325
A46: 40 | B46: Bruce Austin | C46: MVP | D46: 11-338 | E46: Hillbilly Headache | F46: 18 | I46: 22 | L46: 24 | M46: 21 | O46: 22 | R46: 23 | X46: =SUM(+F46+G46+I46+J46+L46+M46+O46+P46++R46+S46+U46+V46) -> 130 | Z46: =SUM(AB46-X46) -> 195 | AB46: =SUM(X$7) -> 325
A47: 41 | B47: Charlie Ciolino | C47: MVP | D47: 11-145 | E47: Mechanical Nitemare | F47: 22 | I47: 23 | L47: 21 | O47: 19 | R47: 25 | S47: 18 | X47: =SUM(+F47+G47+I47+J47+L47+M47+O47+P47++R47+S47+U47+V47) -> 128 | Z47: =SUM(AB47-X47) -> 197 | AB47: =SUM(X$7) -> 325
A48: 42 | B48: Jerry Binkley | C48: MVP | D48: 11-092 | E48: Grandpa's Toy | F48: 17 | I48: 24 | J48: 12 | L48: 21 | O48: 24 | P48: 7 | R48: 22 | X48: =SUM(+F48+G48+I48+J48+L48+M48+O48+P48++R48+S48+U48+V48) -> 127 | Z48: =SUM(AB48-X48) -> 198 | AB48: =SUM(X$7) -> 325
A49: 43 | B49: Dave Gawatz | C49: JW | D49: 11-184 | E49: Low Hung Buck | F49: 17 | I49: 21 | L49: 24 | M49: 18 | O49: 22 | R49: 21 | X49: =SUM(+F49+G49+I49+J49+L49+M49+O49+P49++R49+S49+U49+V49) -> 123 | Z49: =SUM(AB49-X49) -> 202 | AB49: =SUM(X$7) -> 325
A50: 44 | B50: Charlie Schultz | C50: MVP | D50: 11-101 | E50: Alotta Stones | F50: 27 | G50: 7 | I50: 22 | L50: 22 | O50: 22 | R50: 22 | X50: =SUM(+F50+G50+I50+J50+L50+M50+O50+P50++R50+S50+U50+V50) -> 122 | Z50: =SUM(AB50-X50) -> 203 | AB50: =SUM(X$7) -> 325
A51: 45 | B51: Shawn Vogler | C51: JRS | D51: 11-129 | E51: Renegade | F51: 21 | I51: 30 | J51: 24 | R51: 28 | S51: 16 | X51: =SUM(+F51+G51+I51+J51+L51+M51+O51+P51++R51+S51+U51+V51) -> 119 | Z51: =SUM(AB51-X51) -> 206 | AB51: =SUM(X$7) -> 325
A52: 46 | B52: Michael Ciolino | C52: MVP | D52: 11-146 | E52: Mechanical Animal | F52: 21 | I52: 21 | L52: 21 | O52: 21 | R52: 24 | S52: 11 | X52: =SUM(+F52+G52+I52+J52+L52+M52+O52+P52++R52+S52+U52+V52) -> 119 | Z52: =SUM(AB52-X52) -> 206 | AB52: =SUM(X$7) -> 325
A53: 47 | B53: Steve Chrisman | C53: Hackman | D53: 11-218 | I53: 26 | J53: 27 | L53: 23 | R53: 24 | S53: 17 | X53: =SUM(+F53+G53+I53+J53+L53+M53+O53+P53++R53+S53+U53+V53) -> 117 | Z53: =SUM(AB53-X53) -> 208 | AB53: =SUM(X$7) -> 325
A54: 48 | B54: Jeff Chrisman | C54: JW | D54: 11-180 | F54: 24 | G54: 12 | I54: 17 | L54: 16 | O54: 23 | R54: 22 | X54: =SUM(+F54+G54+I54+J54+L54+M54+O54+P54++R54+S54+U54+V54) -> 114 | Z54: =SUM(AB54-X54) -> 211 | AB54: =SUM(X$7) -> 325
A55: 49 | B55: Tyler Hackman | C55: Hackman | D55: 11-052 | E55: Yellow | F55: 25 | G55: 19 | I55: 17 | L55: 24 | M55: 10 | R55: 18 | X55: =SUM(+F55+G55+I55+J55+L55+M55+O55+P55++R55+S55+U55+V55) -> 113 | Z55: =SUM(AB55-X55) -> 212 | AB55: =SUM(X$7) -> 325
A56: 50 | B56: Andy Ferguson | C56: MVP | D56: 11-343 | E56: Border Patrol | F56: 20 | I56: 20 | L56: 17 | O56: 19 | R56: 25 | S56: 12 | X56: =SUM(+F56+G56+I56+J56+L56+M56+O56+P56++R56+S56+U56+V56) -> 113 | Z56: =SUM(AB56-X56) -> 212 | AB56: =SUM(X$7) -> 325
A57: 51 | B57: Bradley Corzine | C57: JW | D57: 11-368 | E57: Just Black | F57: 19 | I57: 18 | L57: 16 | O57: 27 | P57: 10 | R57: 18 | X57: =SUM(+F57+G57+I57+J57+L57+M57+O57+P57++R57+S57+U57+V57) -> 108 | Z57: =SUM(AB57-X57) -> 217 | AB57: =SUM(X$7) -> 325
A58: 52 | B58: Mark Conover | C58: VM | D58: 11-360 | F58: 20 | I58: 25 | J58: 22 | L58: 20 | R58: 19 | X58: =SUM(+F58+G58+I58+J58+L58+M58+O58+P58++R58+S58+U58+V58) -> 106 | Z58: =SUM(AB58-X58) -> 219 | AB58: =SUM(X$7) -> 325
A59: 53 | B59: Bruce Austin | C59: MVP | D59: 11-277 | E59: Cap'N Crunch | F59: 18 | I59: 22 | L59: 18 | O59: 20 | R59: 19 | X59: =SUM(+F59+G59+I59+J59+L59+M59+O59+P59++R59+S59+U59+V59) -> 97 | Z59: =SUM(AB59-X59) -> 228 | AB59: =SUM(X$7) -> 325
A60: 54 | B60: James Evans | C60: NP | D60: 11-223 | E60: Hammer Down | F60: 28 | G60: 10 | I60: 26 | J60: 13 | L60: 19 | X60: =SUM(+F60+G60+I60+J60+L60+M60+O60+P60++R60+S60+U60+V60) -> 96 | Z60: =SUM(AB60-X60) -> 229 | AB60: =SUM(X$7) -> 325
A61: 55 | B61: Ronald Marcine | C61: MVP | D61: 11-245 | E61: No Pressure | F61: 22 | I61: 18 | O61: 21 | R61: 24 | S61: 9 | X61: =SUM(+F61+G61+I61+J61+L61+M61+O61+P61++R61+S61+U61+V61) -> 94 | Z61: =SUM(AB61-X61) -> 231 | AB61: =SUM(X$7) -> 325
A62: 56 | B62: Tooter Campbell | C62: TC | D62: 11-215 | E62: Pink | I62: 16 | L62: 25 | M62: 16 | R62: 21 | X62: =SUM(+F62+G62+I62+J62+L62+M62+O62+P62++R62+S62+U62+V62) -> 78 | Z62: =SUM(AB62-X62) -> 247 | AB62: =SUM(X$7) -> 325
A63: 57 | B63: Larry Karff | C63: MVP | D63: 11-398 | E63: Kryptonite | L63: 17 | O63: 26 | P63: 13 | R63: 19 | X63: =SUM(+F63+G63+I63+J63+L63+M63+O63+P63++R63+S63+U63+V63) -> 75 | Z63: =SUM(AB63-X63) -> 250 | AB63: =SUM(X$7) -> 325
A64: 58 | B64: Gary McDonald | C64: Leffler | D64: 11-093 | E64: Plum Risky | F64: 19 | I64: 18 | L64: 19 | R64: 18 | X64: =SUM(+F64+G64+I64+J64+L64+M64+O64+P64++R64+S64+U64+V64) -> 74 | Z64: =SUM(AB64-X64) -> 251 | AB64: =SUM(X$7) -> 325
A65: 59 | B65: Chad Vogler | C65: JRS | D65: 11-130 | E65: Bandit | F65: 18 | I65: 25 | J65: 8 | R65: 18 | X65: =SUM(+F65+G65+I65+J65+L65+M65+O65+P65++R65+S65+U65+V65) -> 69 | Z65: =SUM(AB65-X65) -> 256 | AB65: =SUM(X$7) -> 325
A66: 60 | B66: Charlie Korff | C66: TC | D66: 11-400 | E66: No Fear | L66: 17 | O66: 18 | R66: 25 | S66: 8 | X66: =SUM(+F66+G66+I66+J66+L66+M66+O66+P66++R66+S66+U66+V66) -> 68 | Z66: =SUM(AB66-X66) -> 257 | AB66: =SUM(X$7) -> 325
A67: 61 | B67: Mike Mason | C67: NP | D67: 11-138 | E67: Totally Frustrated | F67: 23 | I67: 27 | J67: 15 | X67: =SUM(+F67+G67+I67+J67+L67+M67+O67+P67++R67+S67+U67+V67) -> 65 | Z67: =SUM(AB67-X67) -> 260 | AB67: =SUM(X$7) -> 325
A68: 62 | B68: Lee Blesch | C68: TC | D68: 11-344 | E68: Orange Blossom Special | F68: 23 | I68: 20 | R68: 20 | X68: =SUM(+F68+G68+I68+J68+L68+M68+O68+P68++R68+S68+U68+V68) -> 63 | Z68: =SUM(AB68-X68) -> 262 | AB68: =SUM(X$7) -> 325
A69: 63 | B69: Justin Gentz | C69: JW | D69: 11-035 | E69: Cub | F69: 23 | I69: 21 | L69: 18 | X69: =SUM(+F69+G69+I69+J69+L69+M69+O69+P69++R69+S69+U69+V69) -> 62 | Z69: =SUM(AB69-X69) -> 263 | AB69: =SUM(X$7) -> 325
A70: 64 | B70: Scott Bye | C70: LR | D70: 11-369 | E70: Obession | F70: 18 | I70: 23 | O70: 21 | X70: =SUM(+F70+G70+I70+J70+L70+M70+O70+P70++R70+S70+U70+V70) -> 62 | Z70: =SUM(AB70-X70) -> 263 | AB70: =SUM(X$7) -> 325
A71: 65 | B71: Ray Gentz | C71: JW | D71: 11-034 | E71: Just Enough | L71: 21 | O71: 20 | R71: 20 | X71: =SUM(+F71+G71+I71+J71+L71+M71+O71+P71++R71+S71+U71+V71) -> 61 | Z71: =SUM(AB71-X71) -> 264 | AB71: =SUM(X$7) -> 325
A72: 66 | B72: Jeremy Jaspering | C72: LR | D72: 11-147 | E72: Wicked | F72: 18 | O72: 19 | R72: 23 | X72: =SUM(+F72+G72+I72+J72+L72+M72+O72+P72++R72+S72+U72+V72) -> 60 | Z72: =SUM(AB72-X72) -> 265 | AB72: =SUM(X$7) -> 325
A73: 67 | B73: Keith Roberts | C73: TC | D73: 11-350 | E73: Instigator 2 | F73: 19 | I73: 20 | R73: 20 | X73: =SUM(+F73+G73+I73+J73+L73+M73+O73+P73++R73+S73+U73+V73) -> 59 | Z73: =SUM(AB73-X73) -> 266 | AB73: =SUM(X$7) -> 325
A74: 68 | B74: Annette Sullivan | C74: MVP | D74: 11-120 | L74: 26 | M74: 12 | O74: 19 | X74: =SUM(+F74+G74+I74+J74+L74+M74+O74+P74++R74+S74+U74+V74) -> 57 | Z74: =SUM(AB74-X74) -> 268 | AB74: =SUM(X$7) -> 325
A75: 69 | B75: Vicki Scroggins | C75: VM | D75: 11-112 | E75: Little American | O75: 28 | P75: 28 | X75: =SUM(+F75+G75+I75+J75+L75+M75+O75+P75++R75+S75+U75+V75) -> 56 | Z75: =SUM(AB75-X75) -> 269 | AB75: =SUM(X$7) -> 325
A76: 70 | B76: Bill Richerson | C76: JW | D76: 11-132 | E76: Walk the line | F76: 27 | G76: 6 | I76: 22 | X76: =SUM(+F76+G76+I76+J76+L76+M76+O76+P76++R76+S76+U76+V76) -> 55 | Z76: =SUM(AB76-X76) -> 270 | AB76: =SUM(X$7) -> 325
A77: 71 | B77: Rick Mann | C77: TC | D77: 11-077 | E77: Wildfire | F77: 24 | G77: 8 | R77: 21 | X77: =SUM(+F77+G77+I77+J77+L77+M77+O77+P77++R77+S77+U77+V77) -> 53 | Z77: =SUM(AB77-X77) -> 272 | AB77: =SUM(X$7) -> 325
A78: 72 | B78: Daryl Musser | C78: NP | D78: 11-397 | E78: Cross Threaded | L78: 25 | M78: 22 | X78: =SUM(+F78+G78+I78+J78+L78+M78+O78+P78++R78+S78+U78+V78) -> 47 | Z78: =SUM(AB78-X78) -> 278 | AB78: =SUM(X$7) -> 325
A79: 73 | B79: Dave Knapp | C79: MVP | D79: 11-381 | E79: Knapp Time | O79: 19 | R79: 21 | X79: =SUM(+F79+G79+I79+J79+L79+M79+O79+P79++R79+S79+U79+V79) -> 40 | Z79: =SUM(AB79-X79) -> 285 | AB79: =SUM(X$7) -> 325
A80: 74 | B80: Zack Richerson | C80: JW | D80: 11-348 | E80: Zacks Rat | F80: 20 | I80: 19 | X80: =SUM(+F80+G80+I80+J80+L80+M80+O80+P80++R80+S80+U80+V80) -> 39 | Z80: =SUM(AB80-X80) -> 286 | AB80: =SUM(X$7) -> 325
A81: 75 | B81: Allilson Manville | C81: JRS | D81: 11-234 | E81: No Fluke | L81: 24 | M81: 14 | X81: =SUM(+F81+G81+I81+J81+L81+M81+O81+P81++R81+S81+U81+V81) -> 38 | Z81: =SUM(AB81-X81) -> 287 | AB81: =SUM(X$7) -> 325
A82: 76 | B82: Mike Kyle | D82: 11-394 | O82: 21 | R82: 17 | X82: =SUM(+F82+G82+I82+J82+L82+M82+O82+P82++R82+S82+U82+V82) -> 38 | Z82: =SUM(AB82-X82) -> 287 | AB82: =SUM(X$7) -> 325
A83: 77 | B83: Nathan Hager | C83: JW | D83: 11-051 | E83: Bad Medicine | F83: 24 | G83: 13 | X83: =SUM(+F83+G83+I83+J83+L83+M83+O83+P83++R83+S83+U83+V83) -> 37 | Z83: =SUM(AB83-X83) -> 288 | AB83: =SUM(X$7) -> 325
A84: 78 | B84: Carl Zimmerman | C84: JRS | D84: 11-395 | E84: Bragging Rights | L84: 28 | M84: 6 | X84: =SUM(+F84+G84+I84+J84+L84+M84+O84+P84++R84+S84+U84+V84) -> 34 | Z84: =SUM(AB84-X84) -> 291 | AB84: =SUM(X$7) -> 325
A85: 79 | B85: Eric Pike | C85: VM | D85: 11-359 | E85: Visual Expression | O85: 25 | P85: 8 | X85: =SUM(+F85+G85+I85+J85+L85+M85+O85+P85++R85+S85+U85+V85) -> 33 | Z85: =SUM(AB85-X85) -> 292 | AB85: =SUM(X$7) -> 325
A86: 80 | B86: Will Durstine | C86: JRS | D86: 11-264 | E86: Never Satished | F86: 17 | L86: 15 | X86: =SUM(+F86+G86+I86+J86+L86+M86+O86+P86++R86+S86+U86+V86) -> 32 | Z86: =SUM(AB86-X86) -> 293 | AB86: =SUM(X$7) -> 325
A87: 81 | B87: Ron Scroggins | C87: VM | D87: 11-110 | E87: Dirt Dancer | O87: 25 | P87: 6 | X87: =SUM(+F87+G87+I87+J87+L87+M87+O87+P87++R87+S87+U87+V87) -> 31 | Z87: =SUM(AB87-X87) -> 294 | AB87: =SUM(X$7) -> 325
A88: 82 | B88: Steve Chrisman | C88: Hackman | D88: 11-022 | E88: Purple | F88: 24 | X88: =SUM(+F88+G88+I88+J88+L88+M88+O88+P88++R88+S88+U88+V88) -> 24 | Z88: =SUM(AB88-X88) -> 301 | AB88: =SUM(X$7) -> 325
A89: 83 | B89: Aaron Scroggins | C89: VM | D89: 11-419 | E89: Gambler | O89: 23 | X89: =SUM(+F89+G89+I89+J89+L89+M89+O89+P89++R89+S89+U89+V89) -> 23 | Z89: =SUM(AB89-X89) -> 302 | AB89: =SUM(X$7) -> 325
A90: 84 | B90: Steve Cape | C90: MVP | D90: 11-432 | R90: 23 | X90: =SUM(+F90+G90+I90+J90+L90+M90+O90+P90++R90+S90+U90+V90) -> 23 | Z90: =SUM(AB90-X90) -> 302 | AB90: =SUM(X$7) -> 325
A91: 85 | B91: Mark Cessna | C91: NP | D91: 11-387 | E91: Time and Money | L91: 22 | X91: =SUM(+F91+G91+I91+J91+L91+M91+O91+P91++R91+S91+U91+V91) -> 22 | Z91: =SUM(AB91-X91) -> 303 | AB91: =SUM(X$7) -> 325
A92: 86 | B92: Logan Cessna | C92: NP | D92: 11-389 | E92: Adrenaline | L92: 22 | X92: =SUM(+F92+G92+I92+J92+L92+M92+O92+P92++R92+S92+U92+V92) -> 22 | Z92: =SUM(AB92-X92) -> 303 | AB92: =SUM(X$7) -> 325
A93: 87 | B93: Tooter Cambell | C93: TC | D93: 11-128 | E93: The Kentuckian | F93: 21 | X93: =SUM(+F93+G93+I93+J93+L93+M93+O93+P93++R93+S93+U93+V93) -> 21 | Z93: =SUM(AB93-X93) -> 304 | AB93: =SUM(X$7) -> 325
A94: 88 | B94: Doug Maier | C94: JW | D94: 11-158 | E94: Thumper | O94: 21 | X94: =SUM(+F94+G94+I94+J94+L94+M94+O94+P94++R94+S94+U94+V94) -> 21 | Z94: =SUM(AB94-X94) -> 304 | AB94: =SUM(X$7) -> 325
A95: 89 | B95: Brian Titzer | C95: TC | D95: 11-364 | E95: Single Boys Toy | F95: 21 | X95: =SUM(+F95+G95+I95+J95+L95+M95+O95+P95++R95+S95+U95+V95) -> 21 | Z95: =SUM(AB95-X95) -> 304 | AB95: =SUM(X$7) -> 325
A96: 90 | B96: William Lewis | C96: Hackman | D96: 11-392 | E96: Wide Open | L96: 21 | X96: =SUM(+F96+G96+I96+J96+L96+M96+O96+P96++R96+S96+U96+V96) -> 21 | Z96: =SUM(AB96-X96) -> 304 | AB96: =SUM(X$7) -> 325
A97: 91 | B97: Scott Gerhardt | C97: JRS | D97: 11-157 | E97: Suspicious Minds | O97: 20 | X97: =SUM(+F97+G97+I97+J97+L97+M97+O97+P97++R97+S97+U97+V97) -> 20 | Z97: =SUM(AB97-X97) -> 305 | AB97: =SUM(X$7) -> 325
A98: 92 | B98: Todd Brest | D98: 11-272 | E98: Cub | L98: 20 | X98: =SUM(+F98+G98+I98+J98+L98+M98+O98+P98++R98+S98+U98+V98) -> 20 | Z98: =SUM(AB98-X98) -> 305 | AB98: =SUM(X$7) -> 325
A99: 93 | B99: Dave Gawatz | C99: JW | D99: 11-367 | E99: Little Sprout | I99: 20 | X99: =SUM(+F99+G99+I99+J99+L99+M99+O99+P99++R99+S99+U99+V99) -> 20 | Z99: =SUM(AB99-X99) -> 305 | AB99: =SUM(X$7) -> 325
A100: 94 | B100: Doug Diehl | C100: NP | D100: 11-385 | E100: Eliminator | L100: 20 | X100: =SUM(+F100+G100+I100+J100+L100+M100+O100+P100++R100+S100+U100+V100) -> 20 | Z100: =SUM(AB100-X100) -> 305 | AB100: =SUM(X$7) -> 325
A101: 95 | B101: Greg Angell | D101: 11-048 | E101: Ford | I101: 19 | X101: =SUM(+F101+G101+I101+J101+L101+M101+O101+P101++R101+S101+U101+V101) -> 19 | Z101: =SUM(AB101-X101) -> 306 | AB101: =SUM(X$7) -> 325
A102: 96 | B102: Jim Morrison | D102: 11-049 | E102: Red Rock | I102: 19 | X102: =SUM(+F102+G102+I102+J102+L102+M102+O102+P102++R102+S102+U102+V102) -> 19 | Z102: =SUM(AB102-X102) -> 306 | AB102: =SUM(X$7) -> 325
A103: 97 | B103: Max Burkhart | C103: TC | D103: 11-078 | E103: Gray Matter | R103: 19 | X103: =SUM(+F103+G103+I103+J103+L103+M103+O103+P103++R103+S103+U103+V103) -> 19 | Z103: =SUM(AB103-X103) -> 306 | AB103: =SUM(X$7) -> 325
A104: 98 | B104: Daryl Musser | C104: NP | D104: 11-396 | E104: 5 Cents | L104: 19 | X104: =SUM(+F104+G104+I104+J104+L104+M104+O104+P104++R104+S104+U104+V104) -> 19 | Z104: =SUM(AB104-X104) -> 306 | AB104: =SUM(X$7) -> 325
A105: 99 | B105: Bobby Feldkamp | C105: Woods | D105: 11-144 | E105: Goin for Broke | I105: 18 | X105: =SUM(+F105+G105+I105+J105+L105+M105+O105+P105++R105+S105+U105+V105) -> 18 | Z105: =SUM(AB105-X105) -> 307 | AB105: =SUM(X$7) -> 325
A106: 100 | B106: Larry Hunter | C106: Voit | D106: 11-220 | E106: Blue Licker | I106: 18 | X106: =SUM(+F106+G106+I106+J106+L106+M106+O106+P106++R106+S106+U106+V106) -> 18 | Z106: =SUM(AB106-X106) -> 307 | AB106: =SUM(X$7) -> 325
A107: 101 | B107: Doug Diehl | C107: NP | D107: 11-242 | E107: Extra Wild | L107: 18 | X107: =SUM(+F107+G107+I107+J107+L107+M107+O107+P107++R107+S107+U107+V107) -> 18 | Z107: =SUM(AB107-X107) -> 307 | AB107: =SUM(X$7) -> 325
A108: 102 | B108: Colyn Hammond | C108: JRS | D108: 11-301 | E108: Punisher | L108: 18 | X108: =SUM(+F108+G108+I108+J108+L108+M108+O108+P108++R108+S108+U108+V108) -> 18 | Z108: =SUM(AB108-X108) -> 307 | AB108: =SUM(X$7) -> 325
A109: 103 | B109: Casey Schell | C109: MVP | D109: 11-407 | E109: H2O Head | O109: 18 | X109: =SUM(+F109+G109+I109+J109+L109+M109+O109+P109++R109+S109+U109+V109) -> 18 | Z109: =SUM(AB109-X109) -> 307 | AB109: =SUM(X$7) -> 325
A110: 104 | B110: John Innerst | C110: NP | D110: 11-252 | E110: Mean-N-Nasty | L110: 17 | X110: =SUM(+F110+G110+I110+J110+L110+M110+O110+P110++R110+S110+U110+V110) -> 17 | Z110: =SUM(AB110-X110) -> 308 | AB110: =SUM(X$7) -> 325
A111: 105 | B111: Mark Brest | D111: 11-404 | E111: Stage 4 | L111: 17 | X111: =SUM(+F111+G111+I111+J111+L111+M111+O111+P111++R111+S111+U111+V111) -> 17 | Z111: =SUM(AB111-X111) -> 308 | AB111: =SUM(X$7) -> 325
A112: 106 | B112: Matt Kaster | C112: MVP | D112: 11-098 | E112: Moose | F112: 16 | X112: =SUM(+F112+G112+I112+J112+L112+M112+O112+P112++R112+S112+U112+V112) -> 16 | Z112: =SUM(AB112-X112) -> 309 | AB112: =SUM(X$7) -> 325
A113: 107 | B113: Rudy Puskarich | D113: 11-384 | E113: English Bulldog | L113: 16 | X113: =SUM(+F113+G113+I113+J113+L113+M113+O113+P113++R113+S113+U113+V113) -> 16 | Z113: =SUM(AB113-X113) -> 309 | AB113: =SUM(X$7) -> 325
A114: 108 | B114: Morgan Cessna | C114: NP | D114: 11-390 | E114: Look Out | L114: 16 | X114: =SUM(+F114+G114+I114+J114+L114+M114+O114+P114++R114+S114+U114+V114) -> 16 | Z114: =SUM(AB114-X114) -> 309 | AB114: =SUM(X$7) -> 325