B2: STOCK ALTERED CLASS
F4: Princeton, Ind | I4: Richmond,KY | L4: Marietta | O4: Kansas City | R4: Sturgis | U4: Tallmadge
B5: Name | C5: Eng. | D5: NQS # | E5: Tractor | F5: Qualifying Points | G5: Finals Points | I5: Qualifying Points | J5: Finals Points | L5: Qualifying Points | M5: Finals Points | O5: Qualifying Points | P5: Finals Points | R5: Qualifying Points | S5: Finals Points | U5: Qualifying Points | V5: Finals Points | X5: Total Points | Z5: Points Back | AB5: Teardown sticker check
A6: 1 | B6: Todd Vorhees | C6: TV | D6: 11-313 | E6: Red Cadet | F6: 30 | G6: 40 | I6: 30 | J6: 40 | L6: 30 | M6: 27 | O6: 27 | P6: 29 | R6: 30 | S6: 34 | X6: =SUM(+F6+G6+I6+J6+L6+M6+O6+P6+R6+S6+U6+V6) -> 317 | Z6: =SUM(AB6-X6) -> 0 | AB6: =SUM(X$6) -> 317
A7: 2 | B7: Kelly Nichols | C7: NP | D7: 11-358 | E7: Maxxed Out | F7: 28 | G7: 35 | I7: 25 | J7: 35 | L7: 25 | M7: 33 | O7: 29 | P7: 32 | R7: 30 | S7: 40 | X7: =SUM(+F7+G7+I7+J7+L7+M7+O7+P7+R7+S7+U7+V7) -> 312 | Z7: =SUM(AB7-X7) -> 5 | AB7: =SUM(X$6) -> 317
A8: 3 | B8: Eli Zimmerman | C8: NP | D8: 11-075 | E8: Red Fever | F8: 26 | G8: 33 | I8: 26 | J8: 31 | L8: 29 | M8: 30 | O8: 30 | P8: 33 | R8: 28 | S8: 21 | X8: =SUM(+F8+G8+I8+J8+L8+M8+O8+P8+R8+S8+U8+V8) -> 287 | Z8: =SUM(AB8-X8) -> 30 | AB8: =SUM(X$6) -> 317
A9: 4 | B9: Mitzi Brown | C9: NP | D9: 11-159 | E9: Barnyard Bandit | F9: 30 | G9: 29 | I9: 25 | J9: 38 | L9: 23 | M9: 26 | O9: 28 | P9: 18 | R9: 26 | S9: 32 | X9: =SUM(+F9+G9+I9+J9+L9+M9+O9+P9+R9+S9+U9+V9) -> 275 | Z9: =SUM(AB9-X9) -> 42 | AB9: =SUM(X$6) -> 317
A10: 5 | B10: Mike Yeley | C10: JW | D10: 11-055 | E10: Papa's Ride | F10: 29 | G10: 38 | I10: 26 | J10: 35 | L10: 30 | M10: 22 | O10: 21 | R10: 29 | S10: 38 | X10: =SUM(+F10+G10+I10+J10+L10+M10+O10+P10+R10+S10+U10+V10) -> 268 | Z10: =SUM(AB10-X10) -> 49 | AB10: =SUM(X$6) -> 317
A11: 6 | B11: Gary Cunningham | C11: NP | D11: 11-162 | E11: High Voltage | F11: 23 | I11: 28 | J11: 37 | L11: 24 | M11: 36 | O11: 24 | P11: 39 | R11: 26 | S11: 30 | X11: =SUM(+F11+G11+I11+J11+L11+M11+O11+P11+R11+S11+U11+V11) -> 267 | Z11: =SUM(AB11-X11) -> 50 | AB11: =SUM(X$6) -> 317
A12: 7 | B12: Tyler Spindler | C12: TV | D12: 11-005 | E12: Funky Chicken | F12: 29 | G12: 19 | I12: 20 | L12: 28 | M12: 37 | O12: 30 | P12: 30 | R12: 30 | S12: 31 | X12: =SUM(+F12+G12+I12+J12+L12+M12+O12+P12+R12+S12+U12+V12) -> 254 | Z12: =SUM(AB12-X12) -> 63 | AB12: =SUM(X$6) -> 317
A13: 8 | B13: Greg Watson | C13: LR | D13: 11-327 | E13: Road Warrior | F13: 29 | G13: 18 | I13: 23 | L13: 26 | M13: 39 | O13: 30 | P13: 37 | R13: 25 | S13: 24 | X13: =SUM(+F13+G13+I13+J13+L13+M13+O13+P13+R13+S13+U13+V13) -> 251 | Z13: =SUM(AB13-X13) -> 66 | AB13: =SUM(X$6) -> 317
A14: 9 | B14: Matt Ronnebaum | C14: TV | D14: 11-089 | E14: Boy's & Their Toys | F14: 30 | G14: 37 | I14: 24 | J14: 28 | L14: 28 | M14: 32 | O14: 23 | R14: 27 | S14: 19 | X14: =SUM(+F14+G14+I14+J14+L14+M14+O14+P14+R14+S14+U14+V14) -> 248 | Z14: =SUM(AB14-X14) -> 69 | AB14: =SUM(X$6) -> 317
A15: 10 | B15: Carl Frueh | C15: JRS | D15: 11-279 | E15: Blue Thumper 2 | F15: 28 | G15: 27 | I15: 16 | L15: 27 | M15: 40 | O15: 26 | P15: 16 | R15: 27 | S15: 35 | X15: =SUM(+F15+G15+I15+J15+L15+M15+O15+P15+R15+S15+U15+V15) -> 242 | Z15: =SUM(AB15-X15) -> 75 | AB15: =SUM(X$6) -> 317
A16: 11 | B16: Brian Simpson | C16: Woods | D16: 11-290 | E16: Rampdoor Express | F16: 26 | G16: 34 | I16: 30 | J16: 36 | L16: 29 | M16: 16 | O16: 27 | P16: 21 | R16: 19 | X16: =SUM(+F16+G16+I16+J16+L16+M16+O16+P16+R16+S16+U16+V16) -> 238 | Z16: =SUM(AB16-X16) -> 79 | AB16: =SUM(X$6) -> 317
A17: 12 | B17: Keith Frueh | C17: JRS | D17: 11-086 | E17: Fearless | F17: 28 | G17: 31 | I17: 29 | J17: 19 | L17: 22 | O17: 25 | P17: 24 | R17: 29 | S17: 28 | X17: =SUM(+F17+G17+I17+J17+L17+M17+O17+P17+R17+S17+U17+V17) -> 235 | Z17: =SUM(AB17-X17) -> 82 | AB17: =SUM(X$6) -> 317
A18: 13 | B18: Gary Seaman | C18: BJ | D18: 11-191 | E18: Farmer's Money | F18: 22 | I18: 24 | J18: 14 | L18: 30 | M18: 35 | O18: 27 | P18: 27 | R18: 24 | S18: 20 | X18: =SUM(+F18+G18+I18+J18+L18+M18+O18+P18+R18+S18+U18+V18) -> 223 | Z18: =SUM(AB18-X18) -> 94 | AB18: =SUM(X$6) -> 317
A19: 14 | B19: Tyler Black | C19: NP | D19: 11-135 | E19: Wild Child | F19: 26 | G19: 32 | I19: 27 | J19: 33 | L19: 20 | O19: 30 | P19: 36 | R19: 18 | X19: =SUM(+F19+G19+I19+J19+L19+M19+O19+P19+R19+S19+U19+V19) -> 222 | Z19: =SUM(AB19-X19) -> 95 | AB19: =SUM(X$6) -> 317
A20: 15 | B20: Mark Brown | C20: NP | D20: 11-160 | E20: Buckshot | F20: 25 | G20: 25 | I20: 30 | J20: 25 | L20: 18 | O20: 24 | P20: 26 | R20: 26 | S20: 16 | X20: =SUM(+F20+G20+I20+J20+L20+M20+O20+P20+R20+S20+U20+V20) -> 215 | Z20: =SUM(AB20-X20) -> 102 | AB20: =SUM(X$6) -> 317
A21: 16 | B21: Tim Shaw | C21: TV | D21: 11-246 | E21: No Outlet | F21: 27 | G21: 26 | I21: 26 | J21: 18 | L21: 16 | O21: 24 | P21: 35 | R21: 25 | S21: 18 | X21: =SUM(+F21+G21+I21+J21+L21+M21+O21+P21+R21+S21+U21+V21) -> 215 | Z21: =SUM(AB21-X21) -> 102 | AB21: =SUM(X$6) -> 317
A22: 17 | B22: Dave Washburn | C22: BJ | D22: 11-156 | E22: Last Minute | F22: 22 | I22: 29 | J22: 16 | L22: 25 | M22: 29 | O22: 26 | P22: 38 | R22: 21 | X22: =SUM(+F22+G22+I22+J22+L22+M22+O22+P22+R22+S22+U22+V22) -> 206 | Z22: =SUM(AB22-X22) -> 111 | AB22: =SUM(X$6) -> 317
A23: 18 | B23: Lonnie Lewis | C23: TV | D23: 11-024 | E23: Deuces Wild | F23: 24 | G23: 28 | I23: 27 | J23: 21 | L23: 20 | O23: 30 | P23: 34 | R23: 20 | X23: =SUM(+F23+G23+I23+J23+L23+M23+O23+P23+R23+S23+U23+V23) -> 204 | Z23: =SUM(AB23-X23) -> 113 | AB23: =SUM(X$6) -> 317
A24: 19 | B24: Mike McGaha | C24: JW | D24: 11-288 | E24: Company Time | F24: 24 | G24: 22 | I24: 22 | L24: 28 | M24: 23 | O24: 29 | P24: 28 | R24: 21 | X24: =SUM(+F24+G24+I24+J24+L24+M24+O24+P24+R24+S24+U24+V24) -> 197 | Z24: =SUM(AB24-X24) -> 120 | AB24: =SUM(X$6) -> 317
A25: 20 | B25: Donnie Herring | C25: TV | D25: 11-331 | E25: Pasttime | F25: 28 | G25: 24 | I25: 28 | J25: 18 | L25: 21 | O25: 20 | R25: 27 | S25: 29 | X25: =SUM(+F25+G25+I25+J25+L25+M25+O25+P25+R25+S25+U25+V25) -> 195 | Z25: =SUM(AB25-X25) -> 122 | AB25: =SUM(X$6) -> 317
A26: 21 | B26: Doug Seaman | C26: BJ | D26: 11-192 | E26: Massey Ferguson | F26: 22 | I26: 30 | J26: 27 | L26: 27 | M26: 38 | O26: 23 | R26: 22 | X26: =SUM(+F26+G26+I26+J26+L26+M26+O26+P26+R26+S26+U26+V26) -> 189 | Z26: =SUM(AB26-X26) -> 128 | AB26: =SUM(X$6) -> 317
A27: 22 | B27: Bob Jones Jr | C27: BJ | D27: 11-183 | E27: Playdough | F27: 18 | I27: 20 | L27: 27 | M27: 34 | O27: 21 | R27: 29 | S27: 39 | X27: =SUM(+F27+G27+I27+J27+L27+M27+O27+P27+R27+S27+U27+V27) -> 188 | Z27: =SUM(AB27-X27) -> 129 | AB27: =SUM(X$6) -> 317
A28: 23 | B28: Kenneth Smith | C28: JRS | D28: 11-125 | E28: Sidewinder | F28: 20 | I28: 25 | J28: 29 | L28: 26 | M28: 19 | O28: 28 | P28: 19 | R28: 20 | X28: =SUM(+F28+G28+I28+J28+L28+M28+O28+P28+R28+S28+U28+V28) -> 186 | Z28: =SUM(AB28-X28) -> 131 | AB28: =SUM(X$6) -> 317
A29: 24 | B29: Randy Demers | C29: NP | D29: 11-084 | E29: Bounty Hunter | F29: 23 | I29: 21 | L29: 18 | O29: 27 | P29: 40 | R29: 28 | S29: 27 | X29: =SUM(+F29+G29+I29+J29+L29+M29+O29+P29+R29+S29+U29+V29) -> 184 | Z29: =SUM(AB29-X29) -> 133 | AB29: =SUM(X$6) -> 317
A30: 25 | B30: Roger Davis | C30: JRS | D30: 11-068 | E30: Dusty Lady | F30: 17 | I30: 27 | J30: 22 | L30: 30 | M30: 20 | R30: 28 | S30: 36 | X30: =SUM(+F30+G30+I30+J30+L30+M30+O30+P30+R30+S30+U30+V30) -> 180 | Z30: =SUM(AB30-X30) -> 137 | AB30: =SUM(X$6) -> 317
A31: 26 | B31: Wayne Sams | C31: TV | D31: 11-082 | E31: Gold Digger | F31: 25 | G31: 15 | I31: 26 | J31: 26 | L31: 15 | O31: 30 | P31: 15 | R31: 23 | X31: =SUM(+F31+G31+I31+J31+L31+M31+O31+P31+R31+S31+U31+V31) -> 175 | Z31: =SUM(AB31-X31) -> 142 | AB31: =SUM(X$6) -> 317
A32: 27 | B32: Trent Evans | C32: NP | D32: 11-357 | E32: Bad out of Boyd | F32: 26 | G32: 39 | I32: 28 | J32: 32 | L32: 26 | M32: 24 | X32: =SUM(+F32+G32+I32+J32+L32+M32+O32+P32+R32+S32+U32+V32) -> 175 | Z32: =SUM(AB32-X32) -> 142 | AB32: =SUM(X$6) -> 317
A33: 28 | B33: Dave Woods | C33: Woods | D33: 11-289 | E33: Smoke & Mirrors | F33: 17 | I33: 30 | J33: 20 | L33: 30 | M33: 12 | O33: 26 | P33: 13 | R33: 23 | X33: =SUM(+F33+G33+I33+J33+L33+M33+O33+P33+R33+S33+U33+V33) -> 171 | Z33: =SUM(AB33-X33) -> 146 | AB33: =SUM(X$6) -> 317
A34: 29 | B34: Judy Lowe | C34: TV | D34: 11-010 | E34: Slow Motion | F34: 21 | I34: 21 | L34: 21 | O34: 29 | P34: 25 | R34: 29 | S34: 23 | X34: =SUM(+F34+G34+I34+J34+L34+M34+O34+P34+R34+S34+U34+V34) -> 169 | Z34: =SUM(AB34-X34) -> 148 | AB34: =SUM(X$6) -> 317
A35: 30 | B35: Jill Chrisman | C35: VM | D35: 11-179 | F35: 20 | I35: 23 | L35: 21 | O35: 26 | P35: 23 | R35: 25 | S35: 15 | X35: =SUM(+F35+G35+I35+J35+L35+M35+O35+P35+R35+S35+U35+V35) -> 153 | Z35: =SUM(AB35-X35) -> 164 | AB35: =SUM(X$6) -> 317
A36: 31 | B36: Bob Jones Sr | C36: BJ | D36: 11-182 | E36: Buckeye Binder | F36: 27 | G36: 17 | I36: 24 | J36: 24 | L36: 18 | O36: 21 | R36: 22 | X36: =SUM(+F36+G36+I36+J36+L36+M36+O36+P36+R36+S36+U36+V36) -> 153 | Z36: =SUM(AB36-X36) -> 164 | AB36: =SUM(X$6) -> 317
A37: 32 | B37: Ron Hodge | C37: TV | D37: 11-071 | E37: Take-N-Names | F37: 21 | I37: 17 | L37: 20 | O37: 22 | R37: 30 | S37: 37 | X37: =SUM(+F37+G37+I37+J37+L37+M37+O37+P37+R37+S37+U37+V37) -> 147 | Z37: =SUM(AB37-X37) -> 170 | AB37: =SUM(X$6) -> 317
A38: 33 | B38: Gary Frank | C38: TV | D38: 11-233 | E38: Katies Toy | F38: 27 | G38: 36 | I38: 20 | L38: 27 | M38: 31 | X38: =SUM(+F38+G38+I38+J38+L38+M38+O38+P38+R38+S38+U38+V38) -> 141 | Z38: =SUM(AB38-X38) -> 176 | AB38: =SUM(X$6) -> 317
A39: 34 | B39: Ron Finch | C39: Woods | D39: 11-142 | E39: Top Notch | F39: 19 | I39: 27 | J39: 13 | L39: 16 | O39: 24 | P39: 22 | R39: 19 | X39: =SUM(+F39+G39+I39+J39+L39+M39+O39+P39+R39+S39+U39+V39) -> 140 | Z39: =SUM(AB39-X39) -> 177 | AB39: =SUM(X$6) -> 317
A40: 35 | B40: Jack Lowe | C40: TV | D40: 11-161 | E40: Locomotion | F40: 20 | I40: 16 | L40: 24 | M40: 17 | O40: 20 | R40: 24 | S40: 13 | X40: =SUM(+F40+G40+I40+J40+L40+M40+O40+P40+R40+S40+U40+V40) -> 134 | Z40: =SUM(AB40-X40) -> 183 | AB40: =SUM(X$6) -> 317
A41: 36 | B41: Todd Hinkle | C41: RPM | D41: 11-370 | E41: Disturbed | F41: 20 | I41: 24 | J41: 24 | L41: 23 | O41: 22 | R41: 20 | X41: =SUM(+F41+G41+I41+J41+L41+M41+O41+P41+R41+S41+U41+V41) -> 133 | Z41: =SUM(AB41-X41) -> 184 | AB41: =SUM(X$6) -> 317
A42: 37 | B42: Mark Rader | C42: RPM | D42: 11-213 | E42: Lethal Weapon | F42: 29 | G42: 21 | I42: 29 | J42: 30 | L42: 22 | X42: =SUM(+F42+G42+I42+J42+L42+M42+O42+P42+R42+S42+U42+V42) -> 131 | Z42: =SUM(AB42-X42) -> 186 | AB42: =SUM(X$6) -> 317
A43: 38 | B43: Ed Kerner | C43: JRS | D43: 11-303 | E43: Along for the Ride | F43: 27 | G43: 30 | I43: 25 | J43: 15 | L43: 15 | R43: 18 | X43: =SUM(+F43+G43+I43+J43+L43+M43+O43+P43+R43+S43+U43+V43) -> 130 | Z43: =SUM(AB43-X43) -> 187 | AB43: =SUM(X$6) -> 317
A44: 39 | B44: Jamie Lewis | C44: TV | D44: 11-019 | E44: O-So-Orange | F44: 30 | G44: 16 | I44: 19 | L44: 17 | O44: 22 | R44: 23 | X44: =SUM(+F44+G44+I44+J44+L44+M44+O44+P44+R44+S44+U44+V44) -> 127 | Z44: =SUM(AB44-X44) -> 190 | AB44: =SUM(X$6) -> 317
A45: 40 | B45: Danny Garman | C45: JRS | D45: 11-391 | E45: Jag Master | L45: 26 | M45: 13 | O45: 25 | P45: 20 | R45: 27 | S45: 14 | X45: =SUM(+F45+G45+I45+J45+L45+M45+O45+P45+R45+S45+U45+V45) -> 125 | Z45: =SUM(AB45-X45) -> 192 | AB45: =SUM(X$6) -> 317
A46: 41 | B46: Connie Morgenstern | C46: JRS | D46: 11-066 | E46: Domestic Diva | F46: 23 | I46: 21 | L46: 17 | O46: 28 | P46: 31 | X46: =SUM(+F46+G46+I46+J46+L46+M46+O46+P46+R46+S46+U46+V46) -> 120 | Z46: =SUM(AB46-X46) -> 197 | AB46: =SUM(X$6) -> 317
A47: 42 | B47: Steve Chrisman | C47: Hackman | D47: 11-022 | E47: Raz ma Tazz | F47: 21 | I47: 19 | L47: 19 | R47: 25 | S47: 33 | X47: =SUM(+F47+G47+I47+J47+L47+M47+O47+P47+R47+S47+U47+V47) -> 117 | Z47: =SUM(AB47-X47) -> 200 | AB47: =SUM(X$6) -> 317
A48: 43 | B48: Roger McKinney | C48: JRS | D48: 11-083 | E48: Blue Thunder | F48: 17 | I48: 18 | L48: 19 | O48: 25 | P48: 17 | R48: 19 | X48: =SUM(+F48+G48+I48+J48+L48+M48+O48+P48+R48+S48+U48+V48) -> 115 | Z48: =SUM(AB48-X48) -> 202 | AB48: =SUM(X$6) -> 317
A49: 44 | B49: Bob Cooper | C49: JRS | D49: 11-072 | I49: 28 | J49: 39 | L49: 28 | M49: 18 | X49: =SUM(+F49+G49+I49+J49+L49+M49+O49+P49+R49+S49+U49+V49) -> 113 | Z49: =SUM(AB49-X49) -> 204 | AB49: =SUM(X$6) -> 317
A50: 45 | B50: John Elrod | C50: TV | D50: 11-020 | E50: Bad Habit | F50: 25 | G50: 13 | I50: 22 | R50: 28 | S50: 22 | X50: =SUM(+F50+G50+I50+J50+L50+M50+O50+P50+R50+S50+U50+V50) -> 110 | Z50: =SUM(AB50-X50) -> 207 | AB50: =SUM(X$6) -> 317
A51: 46 | B51: Bill Elrod | C51: TV | D51: 11-021 | E51: PaPaws Toy | F51: 25 | G51: 23 | I51: 23 | L51: 17 | R51: 22 | X51: =SUM(+F51+G51+I51+J51+L51+M51+O51+P51+R51+S51+U51+V51) -> 110 | Z51: =SUM(AB51-X51) -> 207 | AB51: =SUM(X$6) -> 317
A52: 47 | B52: Matt Rader | C52: RPM | D52: 11-259 | E52: Lethal Response | F52: 25 | G52: 20 | I52: 23 | L52: 23 | X52: =SUM(+F52+G52+I52+J52+L52+M52+O52+P52+R52+S52+U52+V52) -> 91 | Z52: =SUM(AB52-X52) -> 226 | AB52: =SUM(X$6) -> 317
A53: 48 | B53: Gregory Vandervort | C53: TV | D53: 11-346 | E53: Yellow Cub | F53: 24 | G53: 14 | I53: 21 | L53: 22 | X53: =SUM(+F53+G53+I53+J53+L53+M53+O53+P53+R53+S53+U53+V53) -> 81 | Z53: =SUM(AB53-X53) -> 236 | AB53: =SUM(X$6) -> 317
A54: 49 | B54: Ron Feldkanmp | C54: Woods | D54: 11-143 | E54: Key Chain | F54: 18 | I54: 19 | L54: 21 | R54: 22 | X54: =SUM(+F54+G54+I54+J54+L54+M54+O54+P54+R54+S54+U54+V54) -> 80 | Z54: =SUM(AB54-X54) -> 237 | AB54: =SUM(X$6) -> 317
A55: 50 | B55: Robin Cooper | C55: JRS | D55: 11-073 | I55: 17 | L55: 25 | M55: 25 | X55: =SUM(+F55+G55+I55+J55+L55+M55+O55+P55+R55+S55+U55+V55) -> 67 | Z55: =SUM(AB55-X55) -> 250 | AB55: =SUM(X$6) -> 317
A56: 51 | B56: Gaylord Strine | C56: JRS | D56: 11-126 | L56: 18 | R56: 24 | S56: 25 | X56: =SUM(+F56+G56+I56+J56+L56+M56+O56+P56+R56+S56+U56+V56) -> 67 | Z56: =SUM(AB56-X56) -> 250 | AB56: =SUM(X$6) -> 317
A57: 52 | B57: Randy Amstutz | C57: Woods | D57: 11-166 | E57: Cub Cadet | F57: 20 | I57: 22 | R57: 18 | X57: =SUM(+F57+G57+I57+J57+L57+M57+O57+P57+R57+S57+U57+V57) -> 60 | Z57: =SUM(AB57-X57) -> 257 | AB57: =SUM(X$6) -> 317
A58: 53 | B58: Jack Bowlin | D58: 11-418 | E58: High Roller | O58: 25 | P58: 14 | R58: 21 | X58: =SUM(+F58+G58+I58+J58+L58+M58+O58+P58+R58+S58+U58+V58) -> 60 | Z58: =SUM(AB58-X58) -> 257 | AB58: =SUM(X$6) -> 317
A59: 54 | B59: Suzanne McClain | D59: 11-376 | E59: Cadet | I59: 18 | L59: 16 | R59: 21 | X59: =SUM(+F59+G59+I59+J59+L59+M59+O59+P59+R59+S59+U59+V59) -> 55 | Z59: =SUM(AB59-X59) -> 262 | AB59: =SUM(X$6) -> 317
A60: 55 | B60: Steve Clark | C60: SC | D60: 11-322 | E60: Pullin for JESUS | F60: 19 | I60: 19 | L60: 16 | X60: =SUM(+F60+G60+I60+J60+L60+M60+O60+P60+R60+S60+U60+V60) -> 54 | Z60: =SUM(AB60-X60) -> 263 | AB60: =SUM(X$6) -> 317
A61: 56 | B61: Mike Hall | C61: RPM | D61: 11-248 | E61: Lethal Injection | L61: 24 | M61: 28 | X61: =SUM(+F61+G61+I61+J61+L61+M61+O61+P61+R61+S61+U61+V61) -> 52 | Z61: =SUM(AB61-X61) -> 265 | AB61: =SUM(X$6) -> 317
A62: 57 | B62: Randy Hazelbaker | C62: TV | D62: 11-087 | E62: One Bad Buck | F62: 22 | L62: 23 | X62: =SUM(+F62+G62+I62+J62+L62+M62+O62+P62+R62+S62+U62+V62) -> 45 | Z62: =SUM(AB62-X62) -> 272 | AB62: =SUM(X$6) -> 317
A63: 58 | B63: Dave Shulko | C63: BJ | D63: 11-181 | L63: 24 | M63: 21 | X63: =SUM(+F63+G63+I63+J63+L63+M63+O63+P63+R63+S63+U63+V63) -> 45 | Z63: =SUM(AB63-X63) -> 272 | AB63: =SUM(X$6) -> 317
A64: 59 | B64: Aaron Mason | C64: NP | D64: 11-356 | E64: Frustrated | F64: 23 | I64: 22 | X64: =SUM(+F64+G64+I64+J64+L64+M64+O64+P64+R64+S64+U64+V64) -> 45 | Z64: =SUM(AB64-X64) -> 272 | AB64: =SUM(X$6) -> 317
A65: 60 | B65: Gordy Lloyd | D65: 11-205 | E65: Buck Wild | L65: 29 | M65: 14 | X65: =SUM(+F65+G65+I65+J65+L65+M65+O65+P65+R65+S65+U65+V65) -> 43 | Z65: =SUM(AB65-X65) -> 274 | AB65: =SUM(X$6) -> 317
A66: 61 | B66: Waylon Nelson | D66: 11-413 | E66: But Ugly | O66: 23 | R66: 20 | X66: =SUM(+F66+G66+I66+J66+L66+M66+O66+P66+R66+S66+U66+V66) -> 43 | Z66: =SUM(AB66-X66) -> 274 | AB66: =SUM(X$6) -> 317
A67: 62 | B67: Spencer Richards | C67: TV | D67: 11-397 | L67: 25 | M67: 15 | X67: =SUM(+F67+G67+I67+J67+L67+M67+O67+P67+R67+S67+U67+V67) -> 40 | Z67: =SUM(AB67-X67) -> 277 | AB67: =SUM(X$6) -> 317
A68: 63 | B68: Tim Rankin | C68: Woods | D68: 11-287 | E68: Incognito | I68: 17 | L68: 17 | X68: =SUM(+F68+G68+I68+J68+L68+M68+O68+P68+R68+S68+U68+V68) -> 34 | Z68: =SUM(AB68-X68) -> 283 | AB68: =SUM(X$6) -> 317
A69: 64 | B69: Garrett Bye | D69: 11-409 | E69: Flame Burner | O69: 23 | X69: =SUM(+F69+G69+I69+J69+L69+M69+O69+P69+R69+S69+U69+V69) -> 23 | Z69: =SUM(AB69-X69) -> 294 | AB69: =SUM(X$6) -> 317
A70: 65 | B70: Doug Frank | C70: JRS | D70: 11-249 | E70: Aggravation | L70: 22 | X70: =SUM(+F70+G70+I70+J70+L70+M70+O70+P70+R70+S70+U70+V70) -> 22 | Z70: =SUM(AB70-X70) -> 295 | AB70: =SUM(X$6) -> 317
A71: 66 | B71: Waylon Nelson | D71: 11-412 | E71: Close Enough | O71: 22 | X71: =SUM(+F71+G71+I71+J71+L71+M71+O71+P71+R71+S71+U71+V71) -> 22 | Z71: =SUM(AB71-X71) -> 295 | AB71: =SUM(X$6) -> 317
A72: 67 | B72: Jerry Leonard | C72: VM | D72: 11-308 | E72: Hy Strong | F72: 21 | X72: =SUM(+F72+G72+I72+J72+L72+M72+O72+P72+R72+S72+U72+V72) -> 21 | Z72: =SUM(AB72-X72) -> 296 | AB72: =SUM(X$6) -> 317
A73: 68 | B73: Dave Garrant | C73: NP | D73: 11-378 | E73: Gambler II | I73: 21 | X73: =SUM(+F73+G73+I73+J73+L73+M73+O73+P73+R73+S73+U73+V73) -> 21 | Z73: =SUM(AB73-X73) -> 296 | AB73: =SUM(X$6) -> 317
A74: 69 | B74: Lawrence Davenport | D74: 11-406 | E74: Black Magic | O74: 21 | X74: =SUM(+F74+G74+I74+J74+L74+M74+O74+P74+R74+S74+U74+V74) -> 21 | Z74: =SUM(AB74-X74) -> 296 | AB74: =SUM(X$6) -> 317
A75: 70 | B75: Kevin Bax | C75: LR | D75: 11-104 | E75: Black Jack | O75: 20 | X75: =SUM(+F75+G75+I75+J75+L75+M75+O75+P75+R75+S75+U75+V75) -> 20 | Z75: =SUM(AB75-X75) -> 297 | AB75: =SUM(X$6) -> 317
A76: 71 | B76: Bob Cooper | C76: JRS | D76: 11-383 | L76: 20 | X76: =SUM(+F76+G76+I76+J76+L76+M76+O76+P76+R76+S76+U76+V76) -> 20 | Z76: =SUM(AB76-X76) -> 297 | AB76: =SUM(X$6) -> 317
A77: 72 | B77: Andy Ring | D77: 11-416 | E77: Money Pit | O77: 20 | X77: =SUM(+F77+G77+I77+J77+L77+M77+O77+P77+R77+S77+U77+V77) -> 20 | Z77: =SUM(AB77-X77) -> 297 | AB77: =SUM(X$6) -> 317
A78: 73 | B78: Dan Scott | C78: JRS | D78: 11-119 | E78: Power of Prayer | L78: 19 | X78: =SUM(+F78+G78+I78+J78+L78+M78+O78+P78+R78+S78+U78+V78) -> 19 | Z78: =SUM(AB78-X78) -> 298 | AB78: =SUM(X$6) -> 317
A79: 74 | B79: James Hill | C79: JW | D79: 11-328 | F79: 19 | X79: =SUM(+F79+G79+I79+J79+L79+M79+O79+P79+R79+S79+U79+V79) -> 19 | Z79: =SUM(AB79-X79) -> 298 | AB79: =SUM(X$6) -> 317
A80: 75 | B80: Bill Shreffler | C80: NP | D80: 11-379 | E80: Thunderstruck Deere | L80: 19 | X80: =SUM(+F80+G80+I80+J80+L80+M80+O80+P80+R80+S80+U80+V80) -> 19 | Z80: =SUM(AB80-X80) -> 298 | AB80: =SUM(X$6) -> 317
A81: 76 | B81: Jerry Sweet | C81: LR | D81: 11-284 | E81: Phat Ride | I81: 18 | X81: =SUM(+F81+G81+I81+J81+L81+M81+O81+P81+R81+S81+U81+V81) -> 18 | Z81: =SUM(AB81-X81) -> 299 | AB81: =SUM(X$6) -> 317
A82: 77 | B82: Jeremy Pierce | C82: JP | D82: 11-362 | E82: Lunch Money | F82: 18 | X82: =SUM(+F82+G82+I82+J82+L82+M82+O82+P82+R82+S82+U82+V82) -> 18 | Z82: =SUM(AB82-X82) -> 299 | AB82: =SUM(X$6) -> 317
A83: 78 | B83: Larrry Hunter | C83: JRS | D83: 11-377 | E83: Intimidator | I83: 18 | X83: =SUM(+F83+G83+I83+J83+L83+M83+O83+P83+R83+S83+U83+V83) -> 18 | Z83: =SUM(AB83-X83) -> 299 | AB83: =SUM(X$6) -> 317
A84: 79 | B84: Austin Ernest | D84: 11-224 | E84: Not Deep Enough | I84: 17 | X84: =SUM(+F84+G84+I84+J84+L84+M84+O84+P84+R84+S84+U84+V84) -> 17 | Z84: =SUM(AB84-X84) -> 300 | AB84: =SUM(X$6) -> 317
A85: 80 | B85: Kevin Autle | D85: 11-228 | I85: 17 | X85: =SUM(+F85+G85+I85+J85+L85+M85+O85+P85+R85+S85+U85+V85) -> 17 | Z85: =SUM(AB85-X85) -> 300 | AB85: =SUM(X$6) -> 317
A86: 81 | B86: Ronald Marcine | C86: JRS | D86: 11-388 | E86: Boogie Man | L86: 15 | X86: =SUM(+F86+G86+I86+J86+L86+M86+O86+P86+R86+S86+U86+V86) -> 15 | Z86: =SUM(AB86-X86) -> 302 | AB86: =SUM(X$6) -> 317
A87: 82 | B87: Bryan Dunn | C87: JRS | D87: 11-136 | E87: Oh Snap | R87: 23 | X87: =SUM(+F87+G87+I87+J87+L87+M87+O87+P87+R87+S87+U87+V87) -> 23 | Z87: =SUM(AB87-X87) -> 294 | AB87: =SUM(X$6) -> 317
A88: 83 | B88: Chris Gregg | C88: JRS | D88: 11-315 | E88: Insane | R88: 24 | S88: 26 | X88: =SUM(+F88+G88+I88+J88+L88+M88+O88+P88+R88+S88+U88+V88) -> 50 | Z88: =SUM(AB88-X88) -> 267 | AB88: =SUM(X$6) -> 317
A89: 84 | B89: Rick James | C89: BJ | D89: 11-427 | E89: James Gang III | R89: 26 | S89: 17 | X89: =SUM(+F89+G89+I89+J89+L89+M89+O89+P89+R89+S89+U89+V89) -> 43 | Z89: =SUM(AB89-X89) -> 274 | AB89: =SUM(X$6) -> 317
A90: 85 | B90: Brian Bell | C90: NP | D90: 11-428 | E90: Grim Reaper | R90: 17 | X90: =SUM(+F90+G90+I90+J90+L90+M90+O90+P90+R90+S90+U90+V90) -> 17 | Z90: =SUM(AB90-X90) -> 300 | AB90: =SUM(X$6) -> 317