A1: 2010 - 2011 Points Payout to Date
B3: Pro Stock | C3: Super Stock | D3: Stock Altered | E3: 30 Cube | F3: Outlaw | G3: OSS | H3: Pro V Twin | I3: Pro Outlaw
A4: Princeton Fund | B4: =SUM(B13*J13) -> 355 | C4: =SUM(C13*J13) -> 420 | D4: =SUM(D13*K13) -> 270 | E4: =SUM(E13*L13) -> 90 | F4: =SUM(F13*M13) -> 315 | G4: =SUM(G13*N13) -> 70 | H4: =SUM(H13*O13) -> 50 | I4: =SUM(I13*P13) -> 125 | J4: =SUM(B4:I4) -> 1695
A5: Richmond Fund | B5: =SUM(B14*J14) -> 345 | C5: =SUM(C14*K14) -> 375 | D5: =SUM(D14*L14) -> 290 | E5: =SUM(E14*M14) -> 85 | F5: =SUM(F14*N14) -> 330 | G5: =SUM(G14*O14) -> 50 | H5: =SUM(H14*P14) -> 65 | I5: =SUM(I14*P14) -> 160 | J5: =SUM(B5:I5) -> 1700
A6: Marietta Fund | B6: =SUM(B15*J15) -> 375 | C6: =SUM(C15*K15) -> 415 | D6: =SUM(D15*L15) -> 315 | E6: =SUM(E15*M15) -> 80 | F6: =SUM(F15*N15) -> 355 | G6: =SUM(G15*O15) -> 70 | H6: =SUM(H15*P15) -> 40 | I6: =SUM(I15*P15) -> 160 | J6: =SUM(B6:I6) -> 1810
A7: Kansas City Fund | B7: =SUM(B16*J16) -> 315 | C7: =SUM(C16*K16) -> 365 | D7: =SUM(D16*L16) -> 220 | E7: =SUM(E16*M16) -> 110 | F7: =SUM(F16*N16) -> 290 | G7: =SUM(G16*O16) -> 40 | H7: =SUM(H16*P16) -> 35 | I7: =SUM(I16*P16) -> 140 | J7: =SUM(B7:I7) -> 1515
A8: Sturgis Fund | B8: =SUM(B17*J17) -> 325 | C8: =SUM(C17*K17) -> 405 | D8: =SUM(D17*L17) -> 255 | E8: =SUM(E17*M17) -> 80 | F8: =SUM(F17*N17) -> 310 | G8: =SUM(G17*O17) -> 40 | H8: =SUM(H17*P17) -> 60 | I8: =SUM(I17*P17) -> 180 | J8: =SUM(B8:I8) -> 1655
A9: Tallmadge Fund
A10: Total Prize Fund | B10: =SUM(B4:B8) -> 1715 | C10: =SUM(C4:C8) -> 1980 | D10: =SUM(D4:D8) -> 1350 | E10: =SUM(E4:E8) -> 445 | F10: =SUM(F4:F8) -> 1600 | G10: =SUM(G4:G8) -> 270 | H10: =SUM(H4:H8) -> 250 | I10: =SUM(I4:I8) -> 765 | J10: =SUM(B10:I10) -> 8375
A13: Princeton #s | B13: 71 | C13: 84 | D13: 54 | E13: 18 | F13: 63 | G13: 14 | H13: 10 | I13: 25 | J13: 5 | K13: 5 | L13: 5 | M13: 5 | N13: 5 | O13: 5 | P13: 5 | Q13: =SUM(B13:I13) -> 339
A14: Richmond #s | B14: 69 | C14: 75 | D14: 58 | E14: 17 | F14: 66 | G14: 10 | H14: 13 | I14: 32 | J14: 5 | K14: 5 | L14: 5 | M14: 5 | N14: 5 | O14: 5 | P14: 5 | Q14: =SUM(B14:I14) -> 340
A15: Marietta #s | B15: 75 | C15: 83 | D15: 63 | E15: 16 | F15: 71 | G15: 14 | H15: 8 | I15: 32 | J15: 5 | K15: 5 | L15: 5 | M15: 5 | N15: 5 | O15: 5 | P15: 5 | Q15: =SUM(B15:I15) -> 362
A16: Kansas City #'s | B16: 63 | C16: 73 | D16: 44 | E16: 22 | F16: 58 | G16: 8 | H16: 7 | I16: 28 | J16: 5 | K16: 5 | L16: 5 | M16: 5 | N16: 5 | O16: 5 | P16: 5 | Q16: =SUM(B16:I16) -> 303
A17: Sturgis #'s | B17: 65 | C17: 81 | D17: 51 | E17: 16 | F17: 62 | G17: 8 | H17: 12 | I17: 36 | J17: 5 | K17: 5 | L17: 5 | M17: 5 | N17: 5 | O17: 5 | P17: 5 | Q17: =SUM(B17:I17) -> 331
A18: Tallmadge #'s | J18: 5 | K18: 5 | L18: 5 | M18: 5 | N18: 5 | O18: 5 | P18: 5 | Q18: =SUM(B18:I18) -> 0
A19: Total | B19: =SUM(B13:B18) -> 343 | C19: =SUM(C13:C18) -> 396 | D19: =SUM(D13:D18) -> 270 | E19: =SUM(E13:E18) -> 89 | F19: =SUM(F13:F18) -> 320 | G19: =SUM(G13:G18) -> 54 | H19: =SUM(H13:H18) -> 50 | I19: =SUM(I13:I18) -> 153 | J19: =SUM(B19:I19) -> 1675 | Q19: =SUM(Q13:Q18) -> 1675
A20: Total Tractors | B20: =SUM(B13:B18) -> 343 | C20: =SUM(C13:C18) -> 396 | D20: =SUM(D13:D18) -> 270 | E20: =SUM(E13:E18) -> 89 | F20: =SUM(F13:F18) -> 320 | G20: =SUM(G13:G18) -> 54 | H20: =SUM(H13:H18) -> 50 | I20: =SUM(I13:I18) -> 153 | J20: =SUM(J13:J18) -> 30
A21: Payout to date
A22: 1 | B22: =SUM(B10*J22) -> 514.5 | C22: =SUM(C10*K22) -> 594 | D22: =SUM(D10*L22) -> 405 | E22: =SUM(E10*M22) -> 222.5 | F22: =SUM(F10*N22) -> 480 | G22: =SUM(G10*O22) -> 135 | H22: =SUM(H10*P22) -> 125 | I22: =SUM(I10*Q22) -> 229.5 | J22: 0.3 | K22: 0.3 | L22: 0.3 | M22: 0.5 | N22: 0.3 | O22: 0.5 | P22: 0.5 | Q22: 0.3
A23: 2 | B23: =SUM(B10*J23) -> 343 | C23: =SUM(C10*K23) -> 396 | D23: =SUM(D10*L23) -> 270 | E23: =SUM(E10*M23) -> 133.5 | F23: =SUM(F10*N23) -> 320 | G23: =SUM(G10*O23) -> 81 | H23: =SUM(H10*P23) -> 75 | I23: =SUM(I10*Q23) -> 191.25 | J23: 0.2 | K23: 0.2 | L23: 0.2 | M23: 0.3 | N23: 0.2 | O23: 0.3 | P23: 0.3 | Q23: 0.25
A24: 3 | B24: =SUM(B10*J24) -> 205.8 | C24: =SUM(C10*K24) -> 237.6 | D24: =SUM(D10*L24) -> 162 | E24: =SUM(E10*M24) -> 89 | F24: =SUM(F10*N24) -> 192 | G24: =SUM(G10*O24) -> 54 | H24: =SUM(H10*P24) -> 50 | I24: =SUM(I10*Q24) -> 153 | J24: 0.12 | K24: 0.12 | L24: 0.12 | M24: 0.2 | N24: 0.12 | O24: 0.2 | P24: 0.2 | Q24: 0.2
A25: 4 | B25: =SUM(B10*J25) -> 171.5 | C25: =SUM(C10*K25) -> 198 | D25: =SUM(D10*L25) -> 135 | E25: =SUM(E10*M25) -> 0 | F25: =SUM(F10*N25) -> 160 | G25: =SUM(G10*O25) -> 0 | H25: =SUM(H10*P25) -> 0 | I25: =SUM(I10*Q25) -> 114.75 | J25: 0.1 | K25: 0.1 | L25: 0.1 | M25: 0 | N25: 0.1 | O25: 0 | P25: 0 | Q25: 0.15
A26: 5 | B26: =SUM(B10*J26) -> 137.2 | C26: =SUM(C10*K26) -> 158.4 | D26: =SUM(D10*L26) -> 108 | E26: =SUM(E10*M26) -> 0 | F26: =SUM(F10*N26) -> 128 | G26: =SUM(G10*O26) -> 0 | H26: =SUM(H10*P26) -> 0 | I26: =SUM(I10*Q26) -> 76.5 | J26: 0.08 | K26: 0.08 | L26: 0.08 | M26: 0 | N26: 0.08 | O26: 0 | P26: 0 | Q26: 0.1
A27: 6 | B27: =SUM(B10*J27) -> 102.9 | C27: =SUM(C10*K27) -> 118.8 | D27: =SUM(D10*L27) -> 81 | E27: =SUM(E10*M27) -> 0 | F27: =SUM(F10*N27) -> 96 | G27: =SUM(G10*O27) -> 0 | H27: =SUM(H10*P27) -> 0 | I27: =SUM(I10*Q27) -> 0 | J27: 0.06 | K27: 0.06 | L27: 0.06 | M27: 0 | N27: 0.06 | O27: 0 | P27: 0 | Q27: 0
A28: 7 | B28: =SUM(B10*J28) -> 85.75 | C28: =SUM(C10*K28) -> 99 | D28: =SUM(D10*L28) -> 67.5 | E28: =SUM(E10*M28) -> 0 | F28: =SUM(F10*N28) -> 80 | G28: =SUM(G10*O28) -> 0 | H28: =SUM(H10*P28) -> 0 | I28: =SUM(I10*Q28) -> 0 | J28: 0.05 | K28: 0.05 | L28: 0.05 | M28: 0 | N28: 0.05 | O28: 0 | P28: 0 | Q28: 0
A29: 8 | B29: =SUM(B10*J29) -> 68.6 | C29: =SUM(C10*K29) -> 79.2 | D29: =SUM(D10*L29) -> 54 | E29: =SUM(E10*M29) -> 0 | F29: =SUM(F10*N29) -> 64 | G29: =SUM(G10*O29) -> 0 | H29: =SUM(H10*P29) -> 0 | I29: =SUM(I10*Q29) -> 0 | J29: 0.04 | K29: 0.04 | L29: 0.04 | M29: 0 | N29: 0.04 | O29: 0 | P29: 0 | Q29: 0
A30: 9 | B30: =SUM(B10*J30) -> 51.45 | C30: =SUM(C10*K30) -> 59.4 | D30: =SUM(D10*L30) -> 40.5 | E30: =SUM(E10*M30) -> 0 | F30: =SUM(F10*N30) -> 48 | G30: =SUM(G10*O30) -> 0 | H30: =SUM(H10*P30) -> 0 | I30: =SUM(I10*Q30) -> 0 | J30: 0.03 | K30: 0.03 | L30: 0.03 | M30: 0 | N30: 0.03 | O30: 0 | P30: 0 | Q30: 0
A31: 10 | B31: =SUM(B10*J31) -> 34.3 | C31: =SUM(C10*K31) -> 39.6 | D31: =SUM(D10*L31) -> 27 | E31: =SUM(E10*M31) -> 0 | F31: =SUM(F10*N31) -> 32 | G31: =SUM(G10*O31) -> 0 | H31: =SUM(H10*P31) -> 0 | I31: =SUM(I10*Q31) -> 0 | J31: 0.02 | K31: 0.02 | L31: 0.02 | M31: 0 | N31: 0.02 | O31: 0 | P31: 0 | Q31: 0
A32: Total | B32: =SUM(B22:B31) -> 1715 | C32: =SUM(C22:C31) -> 1980 | D32: =SUM(D22:D31) -> 1350 | E32: =SUM(E22:E31) -> 445 | F32: =SUM(F22:F31) -> 1600 | G32: =SUM(G22:G31) -> 270 | H32: =SUM(H22:H31) -> 250 | I32: =SUM(I22:I31) -> 765 | J32: =SUM(J22:J31) -> 1 | M32: =SUM(M22:M31) -> 1 | O32: =SUM(O22:O31) -> 1 | P32: =SUM(P22:P31) -> 1 | Q32: =SUM(Q22:Q31) -> 1