B1: OPEN SUPER STOCK
F5: Princeton, Ind | I5: Richmond,KY | L5: Marietta | O5: Kansas City | R5: Sturgis | U5: Tallmadge
B6: Name | C6: Eng. | D6: NQS # | E6: Tractor | F6: Qualifying Points | G6: Finals Points | I6: Qualifying Points | J6: Finals Points | L6: Qualifying Points | M6: Finals Points | O6: Qualifying Points | P6: Finals Points | R6: Qualifying Points | S6: Finals Points | U6: Qualifying Points | V6: Finals Points | X6: Total Points | Z6: Points Back | AB6: Teardown sticker check
A7: 1 | B7: Bruce Austin | C7: MVP | D7: 11-169 | E7: Thundertaker | F7: 27 | I7: =30+28 -> 58 | L7: =25+30 -> 55 | O7: =30+27 -> 57 | R7: =30+29 -> 59 | X7: =SUM(+F7+G7+I7+J7+L7+M7+O7+P7+R7+S7+U7+V7) -> 256 | Z7: =SUM(AB7-X7) -> 0 | AB7: =SUM(X$7) -> 256
A8: 2 | B8: Harrison Stahl | C8: MVP | D8: 11-004 | E8: Tons of Fun | F8: 30 | I8: =28+27 -> 55 | L8: =30+28 -> 58 | O8: =28+30 -> 58 | R8: =27+23 -> 50 | X8: =SUM(+F8+G8+I8+J8+L8+M8+O8+P8+R8+S8+U8+V8) -> 251 | Z8: =SUM(AB8-X8) -> 5 | AB8: =SUM(X$7) -> 256
A9: 3 | B9: Calvin Becker | C9: JRS | D9: 11-113 | E9: Spike | F9: 29 | I9: =26+26 -> 52 | L9: =28+27 -> 55 | O9: =29+28 -> 57 | R9: =29+23 -> 52 | X9: =SUM(+F9+G9+I9+J9+L9+M9+O9+P9+R9+S9+U9+V9) -> 245 | Z9: =SUM(AB9-X9) -> 11 | AB9: =SUM(X$7) -> 256
A10: 4 | B10: Kenny Cornelison | C10: MVP | D10: 11-149 | E10: Storm Alert | F10: 26 | I10: =27+25 -> 52 | L10: =29+29 -> 58 | O10: =24+27 -> 51 | R10: =23+28 -> 51 | X10: =SUM(+F10+G10+I10+J10+L10+M10+O10+P10+R10+S10+U10+V10) -> 238 | Z10: =SUM(AB10-X10) -> 18 | AB10: =SUM(X$7) -> 256
A11: 5 | B11: Julian Stahl | C11: MVP | D11: 11-003 | E11: Midwest Express | F11: 28 | I11: =29+30 -> 59 | L11: =19+21 -> 40 | O11: =24+27 -> 51 | R11: =28+30 -> 58 | X11: =SUM(+F11+G11+I11+J11+L11+M11+O11+P11+R11+S11+U11+V11) -> 236 | Z11: =SUM(AB11-X11) -> 20 | AB11: =SUM(X$7) -> 256
A12: 6 | B12: Mark Brown | C12: JRS | D12: 11-261 | E12: Badideal | F12: 18 | I12: 29 | L12: =19+21 -> 40 | O12: =25+29 -> 54 | R12: =26+27 -> 53 | X12: =SUM(+F12+G12+I12+J12+L12+M12+O12+P12+R12+S12+U12+V12) -> 194 | Z12: =SUM(AB12-X12) -> 62 | AB12: =SUM(X$7) -> 256
A13: 7 | B13: Darlene Sample | C13: LR | D13: 11-349 | E13: Oil Slick | F13: 24 | I13: =25+24 -> 49 | L13: =20+21 -> 41 | X13: =SUM(+F13+G13+I13+J13+L13+M13+O13+P13+R13+S13+U13+V13) -> 114 | Z13: =SUM(AB13-X13) -> 142 | AB13: =SUM(X$7) -> 256
A14: 8 | B14: Ryan Shafer | C14: Ryan | D14: 11-206 | E14: Roadrunner | F14: 17 | I14: 24 | L14: =26+26 -> 52 | X14: =SUM(+F14+G14+I14+J14+L14+M14+O14+P14+R14+S14+U14+V14) -> 93 | Z14: =SUM(AB14-X14) -> 163 | AB14: =SUM(X$7) -> 256
A15: 9 | B15: Nick Laibe | C15: WIT | D15: 11-341 | E15: Odd Couple | F15: 19 | I15: =21+23 -> 44 | X15: =SUM(+F15+G15+I15+J15+L15+M15+O15+P15+R15+S15+U15+V15) -> 63 | Z15: =SUM(AB15-X15) -> 193 | AB15: =SUM(X$7) -> 256
A16: 10 | B16: Rick Massey | D16: 11-420 | E16: Special Addiction | O16: =27+27 -> 54 | X16: =SUM(+F16+G16+I16+J16+L16+M16+O16+P16+R16+S16+U16+V16) -> 54 | Z16: =SUM(AB16-X16) -> 202 | AB16: =SUM(X$7) -> 256
A17: 11 | B17: John Norris | C17: MVP | D17: 11-414 | E17: Back N Black | O17: =26+27 -> 53 | X17: =SUM(+F17+G17+I17+J17+L17+M17+O17+P17+R17+S17+U17+V17) -> 53 | Z17: =SUM(AB17-X17) -> 203 | AB17: =SUM(X$7) -> 256
A18: 12 | B18: Julian Stahl | D18: 11-433 | E18: Fully Charged | R18: =25+26 -> 51 | X18: =SUM(+F18+G18+I18+J18+L18+M18+O18+P18+R18+S18+U18+V18) -> 51 | Z18: =SUM(AB18-X18) -> 205 | AB18: =SUM(X$7) -> 256
A19: 13 | B19: Mike Slaubaugh | D19: 11-382 | E19: Fools Gold | L19: =27+22 -> 49 | X19: =SUM(+F19+G19+I19+J19+L19+M19+O19+P19+R19+S19+U19+V19) -> 49 | Z19: =SUM(AB19-X19) -> 207 | AB19: =SUM(X$7) -> 256
A20: 14 | B20: Dave Richter | D20: 11-207 | E20: Hustler | I20: 22 | L20: 25 | X20: =SUM(+F20+G20+I20+J20+L20+M20+O20+P20+R20+S20+U20+V20) -> 47 | Z20: =SUM(AB20-X20) -> 209 | AB20: =SUM(X$7) -> 256
A21: 15 | B21: Ken Lucius | D21: 11-266 | E21: Smoker | L21: =24+23 -> 47 | X21: =SUM(+F21+G21+I21+J21+L21+M21+O21+P21+R21+S21+U21+V21) -> 47 | Z21: =SUM(AB21-X21) -> 209 | AB21: =SUM(X$7) -> 256
A22: 16 | B22: Nick Hayes | D22: 11-321 | E22: Green | R22: =24+23 -> 47 | X22: =SUM(+F22+G22+I22+J22+L22+M22+O22+P22+R22+S22+U22+V22) -> 47 | Z22: =SUM(AB22-X22) -> 209 | AB22: =SUM(X$7) -> 256
A23: 17 | B23: Jeffrey Wilson | D23: 11-393 | E23: My Addiction | L23: =22+24 -> 46 | X23: =SUM(+F23+G23+I23+J23+L23+M23+O23+P23+R23+S23+U23+V23) -> 46 | Z23: =SUM(AB23-X23) -> 210 | AB23: =SUM(X$7) -> 256
A24: 18 | B24: David Knapp | C24: MVP | D24: 11-381 | E24: Knapp Time | I24: =23+22 -> 45 | X24: =SUM(+F24+G24+I24+J24+L24+M24+O24+P24+R24+S24+U24+V24) -> 45 | Z24: =SUM(AB24-X24) -> 211 | AB24: =SUM(X$7) -> 256
A25: 19 | B25: David Gawatz | D25: 11-184 | L25: =23+21 -> 44 | X25: =SUM(+F25+G25+I25+J25+L25+M25+O25+P25+R25+S25+U25+V25) -> 44 | Z25: =SUM(AB25-X25) -> 212 | AB25: =SUM(X$7) -> 256
A26: 20 | B26: Matt Kaster | C26: MVP | D26: 11-099 | E26: Super Freak | F26: 25 | X26: =SUM(+F26+G26+I26+J26+L26+M26+O26+P26+R26+S26+U26+V26) -> 25 | Z26: =SUM(AB26-X26) -> 231 | AB26: =SUM(X$7) -> 256
A27: 21 | B27: Brad Corzine | C27: JW | D27: 11-368 | E27: Just Black | F27: 23 | X27: =SUM(+F27+G27+I27+J27+L27+M27+O27+P27+R27+S27+U27+V27) -> 23 | Z27: =SUM(AB27-X27) -> 233 | AB27: =SUM(X$7) -> 256
A28: 22 | B28: Scott Larkins | C28: JRS | D28: 11-154 | E28: Yosemite Sams | F28: 22 | X28: =SUM(+F28+G28+I28+J28+L28+M28+O28+P28+R28+S28+U28+V28) -> 22 | Z28: =SUM(AB28-X28) -> 234 | AB28: =SUM(X$7) -> 256
A29: 23 | B29: Will Durstine | D29: 11-264 | E29: Never Satisfied | L29: 21 | X29: =SUM(+F29+G29+I29+J29+L29+M29+O29+P29+R29+S29+U29+V29) -> 21 | Z29: =SUM(AB29-X29) -> 235 | AB29: =SUM(X$7) -> 256
A30: 24 | B30: Shane Heits | C30: Heits | D30: 11-366 | E30: Dirt Fed | F30: 21 | X30: =SUM(+F30+G30+I30+J30+L30+M30+O30+P30+R30+S30+U30+V30) -> 21 | Z30: =SUM(AB30-X30) -> 235 | AB30: =SUM(X$7) -> 256
A31: 25 | B31: Ken Mortimer | C31: Morts | D31: 11-355 | E31: Anger Management | F31: 20 | X31: =SUM(+F31+G31+I31+J31+L31+M31+O31+P31+R31+S31+U31+V31) -> 20 | Z31: =SUM(AB31-X31) -> 236 | AB31: =SUM(X$7) -> 256