B1: PRO | G1: Thru Richmond | I1: SUPER STOCK | O1: Thru Richmond
B2: Name | C2: City/State | D2: Eng | E2: NQS # | F2: Tractor | G2: Points Back | J2: Name | K2: City/State | L2: Eng. | M2: NQS # | N2: Tractor | O2: Points Back
A3: ='\\ser\software\other\[POINTS NQS  2012.XLS]Pro Stock'!$A7 -> 1 | B3: ='\\ser\software\other\[POINTS NQS  2012.XLS]Pro Stock'!$B7 -> Kelly Nichols | C3: ='\\ser\software\other\[POINTS NQS  2012.XLS]Pro Stock'!$C7 -> Lore City, Oh | D3: ='\\ser\software\other\[POINTS NQS  2012.XLS]Pro Stock'!$D7 -> NP | E3: ='\\ser\software\other\[POINTS NQS  2012.XLS]Pro Stock'!$E7 -> 70 | F3: =IF('\\ser\software\other\[POINTS NQS  2012.XLS]Pro Stock'!$F7=0," ",'\\ser\software\other\[POINTS NQS  2012.XLS]Pro Stock'!$F7) -> Wild One 2 | G3: ='\\ser\software\other\[POINTS NQS  2012.XLS]Pro Stock'!$AA7 -> 0 | I3: ='\\ser\software\other\[POINTS NQS  2012.XLS]Super Stock'!$A7 -> 1 | J3: ='\\ser\software\other\[POINTS NQS  2012.XLS]Super Stock'!$B7 -> Greg Curtsinger | K3: ='\\ser\software\other\[POINTS NQS  2012.XLS]Super Stock'!$C7 -> Carlilse, KY | L3: ='\\ser\software\other\[POINTS NQS  2012.XLS]Super Stock'!$D7 -> NP | M3: ='\\ser\software\other\[POINTS NQS  2012.XLS]Super Stock'!$E7 -> 8 | N3: =IF('\\ser\software\other\[POINTS NQS  2012.XLS]Super Stock'!$F7=0," ",'\\ser\software\other\[POINTS NQS  2012.XLS]Super Stock'!$F7) -> Wicked Deere | O3: ='\\ser\software\other\[POINTS NQS  2012.XLS]Super Stock'!$AA7 -> 0
A4: ='\\ser\software\other\[POINTS NQS  2012.XLS]Pro Stock'!$A8 -> 2 | B4: ='\\ser\software\other\[POINTS NQS  2012.XLS]Pro Stock'!$B8 -> Jerry Skuta | C4: ='\\ser\software\other\[POINTS NQS  2012.XLS]Pro Stock'!$C8 -> Kimball, Mich | D4: ='\\ser\software\other\[POINTS NQS  2012.XLS]Pro Stock'!$D8 -> NP | E4: ='\\ser\software\other\[POINTS NQS  2012.XLS]Pro Stock'!$E8 -> 329 | F4: =IF('\\ser\software\other\[POINTS NQS  2012.XLS]Pro Stock'!$F8=0," ",'\\ser\software\other\[POINTS NQS  2012.XLS]Pro Stock'!$F8) -> Green Tractor | G4: ='\\ser\software\other\[POINTS NQS  2012.XLS]Pro Stock'!$AA8 -> 5 | I4: ='\\ser\software\other\[POINTS NQS  2012.XLS]Super Stock'!$A8 -> 2 | J4: ='\\ser\software\other\[POINTS NQS  2012.XLS]Super Stock'!$B8 -> Eli Zimmerman | K4: ='\\ser\software\other\[POINTS NQS  2012.XLS]Super Stock'!$C8 -> Allentown, PA | L4: ='\\ser\software\other\[POINTS NQS  2012.XLS]Super Stock'!$D8 -> NP | M4: ='\\ser\software\other\[POINTS NQS  2012.XLS]Super Stock'!$E8 -> 456 | N4: =IF('\\ser\software\other\[POINTS NQS  2012.XLS]Super Stock'!$F8=0," ",'\\ser\software\other\[POINTS NQS  2012.XLS]Super Stock'!$F8) -> Lot of Nichols | O4: ='\\ser\software\other\[POINTS NQS  2012.XLS]Super Stock'!$AA8 -> 14
A5: ='\\ser\software\other\[POINTS NQS  2012.XLS]Pro Stock'!$A9 -> 3 | B5: ='\\ser\software\other\[POINTS NQS  2012.XLS]Pro Stock'!$B9 -> Tyler Hackman | C5: ='\\ser\software\other\[POINTS NQS  2012.XLS]Pro Stock'!$C9 -> Seymour, Ind | D5: ='\\ser\software\other\[POINTS NQS  2012.XLS]Pro Stock'!$D9 -> Hackman | E5: ='\\ser\software\other\[POINTS NQS  2012.XLS]Pro Stock'!$E9 -> 504 | F5: =IF('\\ser\software\other\[POINTS NQS  2012.XLS]Pro Stock'!$F9=0," ",'\\ser\software\other\[POINTS NQS  2012.XLS]Pro Stock'!$F9) -> Green | G5: ='\\ser\software\other\[POINTS NQS  2012.XLS]Pro Stock'!$AA9 -> 9 | I5: ='\\ser\software\other\[POINTS NQS  2012.XLS]Super Stock'!$A9 -> 3 | J5: ='\\ser\software\other\[POINTS NQS  2012.XLS]Super Stock'!$B9 -> Jerry Skuta | K5: ='\\ser\software\other\[POINTS NQS  2012.XLS]Super Stock'!$C9 -> Kimball, MI | L5: ='\\ser\software\other\[POINTS NQS  2012.XLS]Super Stock'!$D9 -> NP | M5: ='\\ser\software\other\[POINTS NQS  2012.XLS]Super Stock'!$E9 -> 329 | N5: =IF('\\ser\software\other\[POINTS NQS  2012.XLS]Super Stock'!$F9=0," ",'\\ser\software\other\[POINTS NQS  2012.XLS]Super Stock'!$F9) -> Green Tractor | O5: ='\\ser\software\other\[POINTS NQS  2012.XLS]Super Stock'!$AA9 -> 19
A6: ='\\ser\software\other\[POINTS NQS  2012.XLS]Pro Stock'!$A10 -> 4 | B6: ='\\ser\software\other\[POINTS NQS  2012.XLS]Pro Stock'!$B10 -> Drew Burton | C6: ='\\ser\software\other\[POINTS NQS  2012.XLS]Pro Stock'!$C10 -> Brookston,Ill | D6: ='\\ser\software\other\[POINTS NQS  2012.XLS]Pro Stock'!$D10 -> NP | E6: ='\\ser\software\other\[POINTS NQS  2012.XLS]Pro Stock'!$E10 -> 14 | F6: =IF('\\ser\software\other\[POINTS NQS  2012.XLS]Pro Stock'!$F10=0," ",'\\ser\software\other\[POINTS NQS  2012.XLS]Pro Stock'!$F10) -> Bad Company | G6: ='\\ser\software\other\[POINTS NQS  2012.XLS]Pro Stock'!$AA10 -> 12 | I6: ='\\ser\software\other\[POINTS NQS  2012.XLS]Super Stock'!$A10 -> 4 | J6: ='\\ser\software\other\[POINTS NQS  2012.XLS]Super Stock'!$B10 -> Larry Curtsinger | K6: ='\\ser\software\other\[POINTS NQS  2012.XLS]Super Stock'!$C10 -> Carlilse, KY | L6: ='\\ser\software\other\[POINTS NQS  2012.XLS]Super Stock'!$D10 -> NP | M6: ='\\ser\software\other\[POINTS NQS  2012.XLS]Super Stock'!$E10 -> 9 | N6: =IF('\\ser\software\other\[POINTS NQS  2012.XLS]Super Stock'!$F10=0," ",'\\ser\software\other\[POINTS NQS  2012.XLS]Super Stock'!$F10) -> Runaway Deere | O6: ='\\ser\software\other\[POINTS NQS  2012.XLS]Super Stock'!$AA10 -> 22
A7: ='\\ser\software\other\[POINTS NQS  2012.XLS]Pro Stock'!$A11 -> 5 | B7: ='\\ser\software\other\[POINTS NQS  2012.XLS]Pro Stock'!$B11 -> Greg Curtsinger | C7: ='\\ser\software\other\[POINTS NQS  2012.XLS]Pro Stock'!$C11 -> Carlisle. Ky | D7: ='\\ser\software\other\[POINTS NQS  2012.XLS]Pro Stock'!$D11 -> NP | E7: ='\\ser\software\other\[POINTS NQS  2012.XLS]Pro Stock'!$E11 -> 8 | F7: =IF('\\ser\software\other\[POINTS NQS  2012.XLS]Pro Stock'!$F11=0," ",'\\ser\software\other\[POINTS NQS  2012.XLS]Pro Stock'!$F11) -> Wicked Deere | G7: ='\\ser\software\other\[POINTS NQS  2012.XLS]Pro Stock'!$AA11 -> 18 | I7: ='\\ser\software\other\[POINTS NQS  2012.XLS]Super Stock'!$A11 -> 5 | J7: ='\\ser\software\other\[POINTS NQS  2012.XLS]Super Stock'!$B11 -> Kelly Nichols | K7: ='\\ser\software\other\[POINTS NQS  2012.XLS]Super Stock'!$C11 -> Lore City, OH | L7: ='\\ser\software\other\[POINTS NQS  2012.XLS]Super Stock'!$D11 -> NP | M7: ='\\ser\software\other\[POINTS NQS  2012.XLS]Super Stock'!$E11 -> 70 | N7: =IF('\\ser\software\other\[POINTS NQS  2012.XLS]Super Stock'!$F11=0," ",'\\ser\software\other\[POINTS NQS  2012.XLS]Super Stock'!$F11) -> Wild One 2 | O7: ='\\ser\software\other\[POINTS NQS  2012.XLS]Super Stock'!$AA11 -> 26
A8: ='\\ser\software\other\[POINTS NQS  2012.XLS]Pro Stock'!$A12 -> 6 | B8: ='\\ser\software\other\[POINTS NQS  2012.XLS]Pro Stock'!$B12 -> Cody Costa | C8: ='\\ser\software\other\[POINTS NQS  2012.XLS]Pro Stock'!$C12 -> Greencastle,Pa | D8: ='\\ser\software\other\[POINTS NQS  2012.XLS]Pro Stock'!$D12 -> NP | E8: ='\\ser\software\other\[POINTS NQS  2012.XLS]Pro Stock'!$E12 -> 397 | F8: =IF('\\ser\software\other\[POINTS NQS  2012.XLS]Pro Stock'!$F12=0," ",'\\ser\software\other\[POINTS NQS  2012.XLS]Pro Stock'!$F12) -> Crossthreaded | G8: ='\\ser\software\other\[POINTS NQS  2012.XLS]Pro Stock'!$AA12 -> 27 | I8: ='\\ser\software\other\[POINTS NQS  2012.XLS]Super Stock'!$A12 -> 6 | J8: ='\\ser\software\other\[POINTS NQS  2012.XLS]Super Stock'!$B12 -> Drew Burton | K8: ='\\ser\software\other\[POINTS NQS  2012.XLS]Super Stock'!$C12 -> Brookston, IN | L8: ='\\ser\software\other\[POINTS NQS  2012.XLS]Super Stock'!$D12 -> NP | M8: ='\\ser\software\other\[POINTS NQS  2012.XLS]Super Stock'!$E12 -> 15 | N8: =IF('\\ser\software\other\[POINTS NQS  2012.XLS]Super Stock'!$F12=0," ",'\\ser\software\other\[POINTS NQS  2012.XLS]Super Stock'!$F12) -> Plain Nuts | O8: ='\\ser\software\other\[POINTS NQS  2012.XLS]Super Stock'!$AA12 -> 39
A9: ='\\ser\software\other\[POINTS NQS  2012.XLS]Pro Stock'!$A13 -> 7 | B9: ='\\ser\software\other\[POINTS NQS  2012.XLS]Pro Stock'!$B13 -> Drew Burton | C9: ='\\ser\software\other\[POINTS NQS  2012.XLS]Pro Stock'!$C13 -> Brookston, Ill | D9: ='\\ser\software\other\[POINTS NQS  2012.XLS]Pro Stock'!$D13 -> NP | E9: ='\\ser\software\other\[POINTS NQS  2012.XLS]Pro Stock'!$E13 -> 15 | F9: =IF('\\ser\software\other\[POINTS NQS  2012.XLS]Pro Stock'!$F13=0," ",'\\ser\software\other\[POINTS NQS  2012.XLS]Pro Stock'!$F13) -> Plain Nuts | G9: ='\\ser\software\other\[POINTS NQS  2012.XLS]Pro Stock'!$AA13 -> 32 | I9: ='\\ser\software\other\[POINTS NQS  2012.XLS]Super Stock'!$A13 -> 7 | J9: ='\\ser\software\other\[POINTS NQS  2012.XLS]Super Stock'!$B13 -> Cody Costa | K9: ='\\ser\software\other\[POINTS NQS  2012.XLS]Super Stock'!$C13 -> Greencastle, PA | L9: ='\\ser\software\other\[POINTS NQS  2012.XLS]Super Stock'!$D13 -> NP | M9: ='\\ser\software\other\[POINTS NQS  2012.XLS]Super Stock'!$E13 -> 397 | N9: =IF('\\ser\software\other\[POINTS NQS  2012.XLS]Super Stock'!$F13=0," ",'\\ser\software\other\[POINTS NQS  2012.XLS]Super Stock'!$F13) -> Crossthreaded | O9: ='\\ser\software\other\[POINTS NQS  2012.XLS]Super Stock'!$AA13 -> 41
A10: ='\\ser\software\other\[POINTS NQS  2012.XLS]Pro Stock'!$A14 -> 8 | B10: ='\\ser\software\other\[POINTS NQS  2012.XLS]Pro Stock'!$B14 -> Jerry Skuta | C10: ='\\ser\software\other\[POINTS NQS  2012.XLS]Pro Stock'!$C14 -> Kimball, Mich | D10: ='\\ser\software\other\[POINTS NQS  2012.XLS]Pro Stock'!$D14 -> NP | E10: ='\\ser\software\other\[POINTS NQS  2012.XLS]Pro Stock'!$E14 -> 330 | F10: =IF('\\ser\software\other\[POINTS NQS  2012.XLS]Pro Stock'!$F14=0," ",'\\ser\software\other\[POINTS NQS  2012.XLS]Pro Stock'!$F14) -> Mental Health | G10: ='\\ser\software\other\[POINTS NQS  2012.XLS]Pro Stock'!$AA14 -> 36 | I10: ='\\ser\software\other\[POINTS NQS  2012.XLS]Super Stock'!$A14 -> 8 | J10: ='\\ser\software\other\[POINTS NQS  2012.XLS]Super Stock'!$B14 -> Jerry Binkley | K10: ='\\ser\software\other\[POINTS NQS  2012.XLS]Super Stock'!$C14 -> Jefferson City, MO | L10: ='\\ser\software\other\[POINTS NQS  2012.XLS]Super Stock'!$D14 -> MVP | M10: ='\\ser\software\other\[POINTS NQS  2012.XLS]Super Stock'!$E14 -> 92 | N10: =IF('\\ser\software\other\[POINTS NQS  2012.XLS]Super Stock'!$F14=0," ",'\\ser\software\other\[POINTS NQS  2012.XLS]Super Stock'!$F14) -> Grandpa's Toy | O10: ='\\ser\software\other\[POINTS NQS  2012.XLS]Super Stock'!$AA14 -> 42
A11: ='\\ser\software\other\[POINTS NQS  2012.XLS]Pro Stock'!$A15 -> 9 | B11: ='\\ser\software\other\[POINTS NQS  2012.XLS]Pro Stock'!$B15 -> Tyler Hackman | C11: ='\\ser\software\other\[POINTS NQS  2012.XLS]Pro Stock'!$C15 -> Seymour, Ind | D11: ='\\ser\software\other\[POINTS NQS  2012.XLS]Pro Stock'!$D15 -> Hackman | E11: ='\\ser\software\other\[POINTS NQS  2012.XLS]Pro Stock'!$E15 -> 507 | F11: =IF('\\ser\software\other\[POINTS NQS  2012.XLS]Pro Stock'!$F15=0," ",'\\ser\software\other\[POINTS NQS  2012.XLS]Pro Stock'!$F15) -> Mad Hatter | G11: ='\\ser\software\other\[POINTS NQS  2012.XLS]Pro Stock'!$AA15 -> 36 | I11: ='\\ser\software\other\[POINTS NQS  2012.XLS]Super Stock'!$A15 -> 9 | J11: ='\\ser\software\other\[POINTS NQS  2012.XLS]Super Stock'!$B15 -> Steve Williford | K11: ='\\ser\software\other\[POINTS NQS  2012.XLS]Super Stock'!$C15 -> Engelhard, NC | L11: ='\\ser\software\other\[POINTS NQS  2012.XLS]Super Stock'!$D15 -> MVP | M11: ='\\ser\software\other\[POINTS NQS  2012.XLS]Super Stock'!$E15 -> 276 | N11: =IF('\\ser\software\other\[POINTS NQS  2012.XLS]Super Stock'!$F15=0," ",'\\ser\software\other\[POINTS NQS  2012.XLS]Super Stock'!$F15) -> IH Express #1 | O11: ='\\ser\software\other\[POINTS NQS  2012.XLS]Super Stock'!$AA15 -> 47
A12: ='\\ser\software\other\[POINTS NQS  2012.XLS]Pro Stock'!$A16 -> 10 | B12: ='\\ser\software\other\[POINTS NQS  2012.XLS]Pro Stock'!$B16 -> Eli Zimmerman | C12: ='\\ser\software\other\[POINTS NQS  2012.XLS]Pro Stock'!$C16 -> Allentown, Pa | D12: ='\\ser\software\other\[POINTS NQS  2012.XLS]Pro Stock'!$D16 -> NP | E12: ='\\ser\software\other\[POINTS NQS  2012.XLS]Pro Stock'!$E16 -> 456 | F12: =IF('\\ser\software\other\[POINTS NQS  2012.XLS]Pro Stock'!$F16=0," ",'\\ser\software\other\[POINTS NQS  2012.XLS]Pro Stock'!$F16) -> Lots of Nichols | G12: ='\\ser\software\other\[POINTS NQS  2012.XLS]Pro Stock'!$AA16 -> 39 | I12: ='\\ser\software\other\[POINTS NQS  2012.XLS]Super Stock'!$A16 -> 10 | J12: ='\\ser\software\other\[POINTS NQS  2012.XLS]Super Stock'!$B16 -> Jerry Skuta | K12: ='\\ser\software\other\[POINTS NQS  2012.XLS]Super Stock'!$C16 -> Kimball, MI | L12: ='\\ser\software\other\[POINTS NQS  2012.XLS]Super Stock'!$D16 -> NP | M12: ='\\ser\software\other\[POINTS NQS  2012.XLS]Super Stock'!$E16 -> 330 | N12: =IF('\\ser\software\other\[POINTS NQS  2012.XLS]Super Stock'!$F16=0," ",'\\ser\software\other\[POINTS NQS  2012.XLS]Super Stock'!$F16) -> Mental Health 2 | O12: ='\\ser\software\other\[POINTS NQS  2012.XLS]Super Stock'!$AA16 -> 52
A13: ='\\ser\software\other\[POINTS NQS  2012.XLS]Pro Stock'!$A17 -> 11 | B13: ='\\ser\software\other\[POINTS NQS  2012.XLS]Pro Stock'!$B17 -> Steve Chrisman | C13: ='\\ser\software\other\[POINTS NQS  2012.XLS]Pro Stock'!$C17 -> Edinburg, Ind | D13: ='\\ser\software\other\[POINTS NQS  2012.XLS]Pro Stock'!$D17 -> Hackman | E13: ='\\ser\software\other\[POINTS NQS  2012.XLS]Pro Stock'!$E17 -> 26 | F13: =IF('\\ser\software\other\[POINTS NQS  2012.XLS]Pro Stock'!$F17=0," ",'\\ser\software\other\[POINTS NQS  2012.XLS]Pro Stock'!$F17) -> JD | G13: ='\\ser\software\other\[POINTS NQS  2012.XLS]Pro Stock'!$AA17 -> 41 | I13: ='\\ser\software\other\[POINTS NQS  2012.XLS]Super Stock'!$A17 -> 11 | J13: ='\\ser\software\other\[POINTS NQS  2012.XLS]Super Stock'!$B17 -> David Gawatz | K13: ='\\ser\software\other\[POINTS NQS  2012.XLS]Super Stock'!$C17 -> St. Joseph, MO | L13: ='\\ser\software\other\[POINTS NQS  2012.XLS]Super Stock'!$D17 -> JW | M13: ='\\ser\software\other\[POINTS NQS  2012.XLS]Super Stock'!$E17 -> 184 | N13: =IF('\\ser\software\other\[POINTS NQS  2012.XLS]Super Stock'!$F17=0," ",'\\ser\software\other\[POINTS NQS  2012.XLS]Super Stock'!$F17) -> Low Hung Buck | O13: ='\\ser\software\other\[POINTS NQS  2012.XLS]Super Stock'!$AA17 -> 60
A14: ='\\ser\software\other\[POINTS NQS  2012.XLS]Pro Stock'!$A18 -> 12 | B14: ='\\ser\software\other\[POINTS NQS  2012.XLS]Pro Stock'!$B18 -> Scott Bye | C14: ='\\ser\software\other\[POINTS NQS  2012.XLS]Pro Stock'!$C18 -> Savannah, Mo | D14: ='\\ser\software\other\[POINTS NQS  2012.XLS]Pro Stock'!$D18 -> NP | E14: ='\\ser\software\other\[POINTS NQS  2012.XLS]Pro Stock'!$E18 -> 365 | F14: =IF('\\ser\software\other\[POINTS NQS  2012.XLS]Pro Stock'!$F18=0," ",'\\ser\software\other\[POINTS NQS  2012.XLS]Pro Stock'!$F18) -> Fired Up | G14: ='\\ser\software\other\[POINTS NQS  2012.XLS]Pro Stock'!$AA18 -> 42 | I14: ='\\ser\software\other\[POINTS NQS  2012.XLS]Super Stock'!$A18 -> 12 | J14: ='\\ser\software\other\[POINTS NQS  2012.XLS]Super Stock'!$B18 -> Scott Bye | K14: ='\\ser\software\other\[POINTS NQS  2012.XLS]Super Stock'!$C18 -> Savannah, MO | L14: ='\\ser\software\other\[POINTS NQS  2012.XLS]Super Stock'!$D18 -> NP | M14: ='\\ser\software\other\[POINTS NQS  2012.XLS]Super Stock'!$E18 -> 365 | N14: =IF('\\ser\software\other\[POINTS NQS  2012.XLS]Super Stock'!$F18=0," ",'\\ser\software\other\[POINTS NQS  2012.XLS]Super Stock'!$F18) -> Fired Up | O14: ='\\ser\software\other\[POINTS NQS  2012.XLS]Super Stock'!$AA18 -> 60
A15: ='\\ser\software\other\[POINTS NQS  2012.XLS]Pro Stock'!$A19 -> 13 | B15: ='\\ser\software\other\[POINTS NQS  2012.XLS]Pro Stock'!$B19 -> David Gawatz | C15: ='\\ser\software\other\[POINTS NQS  2012.XLS]Pro Stock'!$C19 -> St Joseph, Mo | D15: ='\\ser\software\other\[POINTS NQS  2012.XLS]Pro Stock'!$D19 -> JW | E15: ='\\ser\software\other\[POINTS NQS  2012.XLS]Pro Stock'!$E19 -> 184 | F15: =IF('\\ser\software\other\[POINTS NQS  2012.XLS]Pro Stock'!$F19=0," ",'\\ser\software\other\[POINTS NQS  2012.XLS]Pro Stock'!$F19) -> Low Hung Buck | G15: ='\\ser\software\other\[POINTS NQS  2012.XLS]Pro Stock'!$AA19 -> 47 | I15: ='\\ser\software\other\[POINTS NQS  2012.XLS]Super Stock'!$A19 -> 13 | J15: ='\\ser\software\other\[POINTS NQS  2012.XLS]Super Stock'!$B19 -> Steve Williford | K15: ='\\ser\software\other\[POINTS NQS  2012.XLS]Super Stock'!$C19 -> Engelhard, NC | L15: ='\\ser\software\other\[POINTS NQS  2012.XLS]Super Stock'!$D19 -> MVP | M15: ='\\ser\software\other\[POINTS NQS  2012.XLS]Super Stock'!$E19 -> 337 | N15: =IF('\\ser\software\other\[POINTS NQS  2012.XLS]Super Stock'!$F19=0," ",'\\ser\software\other\[POINTS NQS  2012.XLS]Super Stock'!$F19) -> IH Express #2 | O15: ='\\ser\software\other\[POINTS NQS  2012.XLS]Super Stock'!$AA19 -> 63
A16: ='\\ser\software\other\[POINTS NQS  2012.XLS]Pro Stock'!$A20 -> 14 | B16: ='\\ser\software\other\[POINTS NQS  2012.XLS]Pro Stock'!$B20 -> Greg Watson | C16: ='\\ser\software\other\[POINTS NQS  2012.XLS]Pro Stock'!$C20 -> Batavia, OH | D16: ='\\ser\software\other\[POINTS NQS  2012.XLS]Pro Stock'!$D20 -> LR | E16: ='\\ser\software\other\[POINTS NQS  2012.XLS]Pro Stock'!$E20 -> 79 | F16: =IF('\\ser\software\other\[POINTS NQS  2012.XLS]Pro Stock'!$F20=0," ",'\\ser\software\other\[POINTS NQS  2012.XLS]Pro Stock'!$F20) -> Bearly Legal | G16: ='\\ser\software\other\[POINTS NQS  2012.XLS]Pro Stock'!$AA20 -> 50 | I16: ='\\ser\software\other\[POINTS NQS  2012.XLS]Super Stock'!$A20 -> 14 | J16: ='\\ser\software\other\[POINTS NQS  2012.XLS]Super Stock'!$B20 -> Drew Burton | K16: ='\\ser\software\other\[POINTS NQS  2012.XLS]Super Stock'!$C20 -> Brookston, IN | L16: ='\\ser\software\other\[POINTS NQS  2012.XLS]Super Stock'!$D20 -> NP | M16: ='\\ser\software\other\[POINTS NQS  2012.XLS]Super Stock'!$E20 -> 14 | N16: =IF('\\ser\software\other\[POINTS NQS  2012.XLS]Super Stock'!$F20=0," ",'\\ser\software\other\[POINTS NQS  2012.XLS]Super Stock'!$F20) -> Bad Company | O16: ='\\ser\software\other\[POINTS NQS  2012.XLS]Super Stock'!$AA20 -> 64
A17: ='\\ser\software\other\[POINTS NQS  2012.XLS]Pro Stock'!$A21 -> 15 | B17: ='\\ser\software\other\[POINTS NQS  2012.XLS]Pro Stock'!$B21 -> Larry Fox | C17: ='\\ser\software\other\[POINTS NQS  2012.XLS]Pro Stock'!$C21 -> Reynoldsburg, Oh | D17: ='\\ser\software\other\[POINTS NQS  2012.XLS]Pro Stock'!$D21 -> JRS | E17: ='\\ser\software\other\[POINTS NQS  2012.XLS]Pro Stock'!$E21 -> 7 | F17: =IF('\\ser\software\other\[POINTS NQS  2012.XLS]Pro Stock'!$F21=0," ",'\\ser\software\other\[POINTS NQS  2012.XLS]Pro Stock'!$F21) -> Intimidation | G17: ='\\ser\software\other\[POINTS NQS  2012.XLS]Pro Stock'!$AA21 -> 52 | I17: ='\\ser\software\other\[POINTS NQS  2012.XLS]Super Stock'!$A21 -> 15 | J17: ='\\ser\software\other\[POINTS NQS  2012.XLS]Super Stock'!$B21 -> Eli Zimmerman | K17: ='\\ser\software\other\[POINTS NQS  2012.XLS]Super Stock'!$C21 -> Allentown, PA | L17: ='\\ser\software\other\[POINTS NQS  2012.XLS]Super Stock'!$D21 -> NP | M17: ='\\ser\software\other\[POINTS NQS  2012.XLS]Super Stock'!$E21 -> 74 | N17: =IF('\\ser\software\other\[POINTS NQS  2012.XLS]Super Stock'!$F21=0," ",'\\ser\software\other\[POINTS NQS  2012.XLS]Super Stock'!$F21) -> Red Fever | O17: ='\\ser\software\other\[POINTS NQS  2012.XLS]Super Stock'!$AA21 -> 72
A18: ='\\ser\software\other\[POINTS NQS  2012.XLS]Pro Stock'!$A22 -> 16 | B18: ='\\ser\software\other\[POINTS NQS  2012.XLS]Pro Stock'!$B22 -> Steve Williford | C18: ='\\ser\software\other\[POINTS NQS  2012.XLS]Pro Stock'!$C22 -> Englehard, NC | D18: ='\\ser\software\other\[POINTS NQS  2012.XLS]Pro Stock'!$D22 -> MVP | E18: ='\\ser\software\other\[POINTS NQS  2012.XLS]Pro Stock'!$E22 -> 337 | F18: =IF('\\ser\software\other\[POINTS NQS  2012.XLS]Pro Stock'!$F22=0," ",'\\ser\software\other\[POINTS NQS  2012.XLS]Pro Stock'!$F22) -> IH Express 2 | G18: ='\\ser\software\other\[POINTS NQS  2012.XLS]Pro Stock'!$AA22 -> 54 | I18: ='\\ser\software\other\[POINTS NQS  2012.XLS]Super Stock'!$A22 -> 16 | J18: ='\\ser\software\other\[POINTS NQS  2012.XLS]Super Stock'!$B22 -> Steve Chrisman | K18: ='\\ser\software\other\[POINTS NQS  2012.XLS]Super Stock'!$C22 -> Edinburgh, IN | L18: ='\\ser\software\other\[POINTS NQS  2012.XLS]Super Stock'!$D22 -> Hackman | M18: ='\\ser\software\other\[POINTS NQS  2012.XLS]Super Stock'!$E22 -> 26 | N18: =IF('\\ser\software\other\[POINTS NQS  2012.XLS]Super Stock'!$F22=0," ",'\\ser\software\other\[POINTS NQS  2012.XLS]Super Stock'!$F22) -> JD 330 | O18: ='\\ser\software\other\[POINTS NQS  2012.XLS]Super Stock'!$AA22 -> 73
A19: ='\\ser\software\other\[POINTS NQS  2012.XLS]Pro Stock'!$A23 -> 17 | B19: ='\\ser\software\other\[POINTS NQS  2012.XLS]Pro Stock'!$B23 -> Eli Zimmerman | C19: ='\\ser\software\other\[POINTS NQS  2012.XLS]Pro Stock'!$C23 -> Allentown, Pa | D19: ='\\ser\software\other\[POINTS NQS  2012.XLS]Pro Stock'!$D23 -> NP | E19: ='\\ser\software\other\[POINTS NQS  2012.XLS]Pro Stock'!$E23 -> 74 | F19: =IF('\\ser\software\other\[POINTS NQS  2012.XLS]Pro Stock'!$F23=0," ",'\\ser\software\other\[POINTS NQS  2012.XLS]Pro Stock'!$F23) -> Red Fever | G19: ='\\ser\software\other\[POINTS NQS  2012.XLS]Pro Stock'!$AA23 -> 55 | I19: ='\\ser\software\other\[POINTS NQS  2012.XLS]Super Stock'!$A23 -> 17 | J19: ='\\ser\software\other\[POINTS NQS  2012.XLS]Super Stock'!$B23 -> Mike Aschliman | K19: ='\\ser\software\other\[POINTS NQS  2012.XLS]Super Stock'!$C23 -> Ridgeway, WI | L19: ='\\ser\software\other\[POINTS NQS  2012.XLS]Super Stock'!$D23 -> MVP | M19: ='\\ser\software\other\[POINTS NQS  2012.XLS]Super Stock'!$E23 -> 511 | N19: =IF('\\ser\software\other\[POINTS NQS  2012.XLS]Super Stock'!$F23=0," ",'\\ser\software\other\[POINTS NQS  2012.XLS]Super Stock'!$F23) -> Brother's Keeper | O19: ='\\ser\software\other\[POINTS NQS  2012.XLS]Super Stock'!$AA23 -> 74
A20: ='\\ser\software\other\[POINTS NQS  2012.XLS]Pro Stock'!$A24 -> 18 | B20: ='\\ser\software\other\[POINTS NQS  2012.XLS]Pro Stock'!$B24 -> Todd Hammond | C20: ='\\ser\software\other\[POINTS NQS  2012.XLS]Pro Stock'!$C24 -> Fallng Waters, WV | D20: ='\\ser\software\other\[POINTS NQS  2012.XLS]Pro Stock'!$D24 -> JRS | E20: ='\\ser\software\other\[POINTS NQS  2012.XLS]Pro Stock'!$E24 -> 301 | F20: =IF('\\ser\software\other\[POINTS NQS  2012.XLS]Pro Stock'!$F24=0," ",'\\ser\software\other\[POINTS NQS  2012.XLS]Pro Stock'!$F24) -> Punisher | G20: ='\\ser\software\other\[POINTS NQS  2012.XLS]Pro Stock'!$AA24 -> 56 | I20: ='\\ser\software\other\[POINTS NQS  2012.XLS]Super Stock'!$A24 -> 18 | J20: ='\\ser\software\other\[POINTS NQS  2012.XLS]Super Stock'!$B24 -> Elaine Fisher | K20: ='\\ser\software\other\[POINTS NQS  2012.XLS]Super Stock'!$C24 -> Waterford, OH | L20: ='\\ser\software\other\[POINTS NQS  2012.XLS]Super Stock'!$D24 -> VM | M20: ='\\ser\software\other\[POINTS NQS  2012.XLS]Super Stock'!$E24 -> 80 | N20: =IF('\\ser\software\other\[POINTS NQS  2012.XLS]Super Stock'!$F24=0," ",'\\ser\software\other\[POINTS NQS  2012.XLS]Super Stock'!$F24) -> Blue Thunder | O20: ='\\ser\software\other\[POINTS NQS  2012.XLS]Super Stock'!$AA24 -> 80
A21: ='\\ser\software\other\[POINTS NQS  2012.XLS]Pro Stock'!$A25 -> 19 | B21: ='\\ser\software\other\[POINTS NQS  2012.XLS]Pro Stock'!$B25 -> Daryl Musser | C21: ='\\ser\software\other\[POINTS NQS  2012.XLS]Pro Stock'!$C25 -> Greencastle, Pa | D21: ='\\ser\software\other\[POINTS NQS  2012.XLS]Pro Stock'!$D25 -> NP | E21: ='\\ser\software\other\[POINTS NQS  2012.XLS]Pro Stock'!$E25 -> 396 | F21: =IF('\\ser\software\other\[POINTS NQS  2012.XLS]Pro Stock'!$F25=0," ",'\\ser\software\other\[POINTS NQS  2012.XLS]Pro Stock'!$F25) -> 5 Cents | G21: ='\\ser\software\other\[POINTS NQS  2012.XLS]Pro Stock'!$AA25 -> 57 | I21: ='\\ser\software\other\[POINTS NQS  2012.XLS]Super Stock'!$A25 -> 19 | J21: ='\\ser\software\other\[POINTS NQS  2012.XLS]Super Stock'!$B25 -> Daryl Musser | K21: ='\\ser\software\other\[POINTS NQS  2012.XLS]Super Stock'!$C25 -> Greencastle, PA | L21: ='\\ser\software\other\[POINTS NQS  2012.XLS]Super Stock'!$D25 -> NP | M21: ='\\ser\software\other\[POINTS NQS  2012.XLS]Super Stock'!$E25 -> 396 | N21: =IF('\\ser\software\other\[POINTS NQS  2012.XLS]Super Stock'!$F25=0," ",'\\ser\software\other\[POINTS NQS  2012.XLS]Super Stock'!$F25) -> 5 Cents | O21: ='\\ser\software\other\[POINTS NQS  2012.XLS]Super Stock'!$AA25 -> 81
A22: ='\\ser\software\other\[POINTS NQS  2012.XLS]Pro Stock'!$A26 -> 20 | B22: ='\\ser\software\other\[POINTS NQS  2012.XLS]Pro Stock'!$B26 -> Ed Nichols | C22: ='\\ser\software\other\[POINTS NQS  2012.XLS]Pro Stock'!$C26 -> Salvisa, Ky | D22: ='\\ser\software\other\[POINTS NQS  2012.XLS]Pro Stock'!$D26 -> LR | E22: ='\\ser\software\other\[POINTS NQS  2012.XLS]Pro Stock'!$E26 -> 124 | F22: =IF('\\ser\software\other\[POINTS NQS  2012.XLS]Pro Stock'!$F26=0," ",'\\ser\software\other\[POINTS NQS  2012.XLS]Pro Stock'!$F26) -> Track Attack | G22: ='\\ser\software\other\[POINTS NQS  2012.XLS]Pro Stock'!$AA26 -> 59 | I22: ='\\ser\software\other\[POINTS NQS  2012.XLS]Super Stock'!$A26 -> 20 | J22: ='\\ser\software\other\[POINTS NQS  2012.XLS]Super Stock'!$B26 -> Randy Demers | K22: ='\\ser\software\other\[POINTS NQS  2012.XLS]Super Stock'!$C26 -> Columbia, NJ | L22: ='\\ser\software\other\[POINTS NQS  2012.XLS]Super Stock'!$D26 -> NP | M22: ='\\ser\software\other\[POINTS NQS  2012.XLS]Super Stock'!$E26 -> 85 | N22: =IF('\\ser\software\other\[POINTS NQS  2012.XLS]Super Stock'!$F26=0," ",'\\ser\software\other\[POINTS NQS  2012.XLS]Super Stock'!$F26) -> Widowmaker | O22: ='\\ser\software\other\[POINTS NQS  2012.XLS]Super Stock'!$AA26 -> 85
A23: ='\\ser\software\other\[POINTS NQS  2012.XLS]Pro Stock'!$A27 -> 21 | B23: ='\\ser\software\other\[POINTS NQS  2012.XLS]Pro Stock'!$B27 -> Mike Aschliman | C23: ='\\ser\software\other\[POINTS NQS  2012.XLS]Pro Stock'!$C27 -> Bridgeway, Wisc | D23: ='\\ser\software\other\[POINTS NQS  2012.XLS]Pro Stock'!$D27 -> MVP | E23: ='\\ser\software\other\[POINTS NQS  2012.XLS]Pro Stock'!$E27 -> 511 | F23: =IF('\\ser\software\other\[POINTS NQS  2012.XLS]Pro Stock'!$F27=0," ",'\\ser\software\other\[POINTS NQS  2012.XLS]Pro Stock'!$F27) -> Brother's Keeper | G23: ='\\ser\software\other\[POINTS NQS  2012.XLS]Pro Stock'!$AA27 -> 62 | I23: ='\\ser\software\other\[POINTS NQS  2012.XLS]Super Stock'!$A27 -> 21 | J23: ='\\ser\software\other\[POINTS NQS  2012.XLS]Super Stock'!$B27 -> Don Vogt | K23: ='\\ser\software\other\[POINTS NQS  2012.XLS]Super Stock'!$C27 -> Campbellsport, WI | L23: ='\\ser\software\other\[POINTS NQS  2012.XLS]Super Stock'!$D27 -> MVP | M23: ='\\ser\software\other\[POINTS NQS  2012.XLS]Super Stock'!$E27 -> 90 | N23: =IF('\\ser\software\other\[POINTS NQS  2012.XLS]Super Stock'!$F27=0," ",'\\ser\software\other\[POINTS NQS  2012.XLS]Super Stock'!$F27) -> Not A Nuff | O23: ='\\ser\software\other\[POINTS NQS  2012.XLS]Super Stock'!$AA27 -> 86
A24: ='\\ser\software\other\[POINTS NQS  2012.XLS]Pro Stock'!$A28 -> 22 | B24: ='\\ser\software\other\[POINTS NQS  2012.XLS]Pro Stock'!$B28 -> Larry Curtsinger | C24: ='\\ser\software\other\[POINTS NQS  2012.XLS]Pro Stock'!$C28 -> Carlisle, KY | D24: ='\\ser\software\other\[POINTS NQS  2012.XLS]Pro Stock'!$D28 -> NP | E24: ='\\ser\software\other\[POINTS NQS  2012.XLS]Pro Stock'!$E28 -> 9 | F24: =IF('\\ser\software\other\[POINTS NQS  2012.XLS]Pro Stock'!$F28=0," ",'\\ser\software\other\[POINTS NQS  2012.XLS]Pro Stock'!$F28) -> Runaway Deere | G24: ='\\ser\software\other\[POINTS NQS  2012.XLS]Pro Stock'!$AA28 -> 65 | I24: ='\\ser\software\other\[POINTS NQS  2012.XLS]Super Stock'!$A28 -> 22 | J24: ='\\ser\software\other\[POINTS NQS  2012.XLS]Super Stock'!$B28 -> John Innerest | K24: ='\\ser\software\other\[POINTS NQS  2012.XLS]Super Stock'!$C28 -> Red Lion, PA | L24: ='\\ser\software\other\[POINTS NQS  2012.XLS]Super Stock'!$D28 -> NP | M24: ='\\ser\software\other\[POINTS NQS  2012.XLS]Super Stock'!$E28 -> 252 | N24: =IF('\\ser\software\other\[POINTS NQS  2012.XLS]Super Stock'!$F28=0," ",'\\ser\software\other\[POINTS NQS  2012.XLS]Super Stock'!$F28) -> Mean N Nasty | O24: ='\\ser\software\other\[POINTS NQS  2012.XLS]Super Stock'!$AA28 -> 98
A25: ='\\ser\software\other\[POINTS NQS  2012.XLS]Pro Stock'!$A29 -> 23 | B25: ='\\ser\software\other\[POINTS NQS  2012.XLS]Pro Stock'!$B29 -> John Donavan | C25: ='\\ser\software\other\[POINTS NQS  2012.XLS]Pro Stock'!$C29 -> Pataskala, Oh | D25: ='\\ser\software\other\[POINTS NQS  2012.XLS]Pro Stock'!$D29 -> JRS | E25: ='\\ser\software\other\[POINTS NQS  2012.XLS]Pro Stock'!$E29 -> 6 | F25: =IF('\\ser\software\other\[POINTS NQS  2012.XLS]Pro Stock'!$F29=0," ",'\\ser\software\other\[POINTS NQS  2012.XLS]Pro Stock'!$F29) -> John's Deere | G25: ='\\ser\software\other\[POINTS NQS  2012.XLS]Pro Stock'!$AA29 -> 66 | I25: ='\\ser\software\other\[POINTS NQS  2012.XLS]Super Stock'!$A29 -> 23 | J25: ='\\ser\software\other\[POINTS NQS  2012.XLS]Super Stock'!$B29 -> Larry Fox | K25: ='\\ser\software\other\[POINTS NQS  2012.XLS]Super Stock'!$C29 -> Etna, OH | L25: ='\\ser\software\other\[POINTS NQS  2012.XLS]Super Stock'!$D29 -> JRS | M25: ='\\ser\software\other\[POINTS NQS  2012.XLS]Super Stock'!$E29 -> 7 | N25: =IF('\\ser\software\other\[POINTS NQS  2012.XLS]Super Stock'!$F29=0," ",'\\ser\software\other\[POINTS NQS  2012.XLS]Super Stock'!$F29) -> Intimidation | O25: ='\\ser\software\other\[POINTS NQS  2012.XLS]Super Stock'!$AA29 -> 99
A26: ='\\ser\software\other\[POINTS NQS  2012.XLS]Pro Stock'!$A30 -> 24 | B26: ='\\ser\software\other\[POINTS NQS  2012.XLS]Pro Stock'!$B30 -> Nathan Nichols | C26: ='\\ser\software\other\[POINTS NQS  2012.XLS]Pro Stock'!$C30 -> Lawrenceburg, Ky | D26: ='\\ser\software\other\[POINTS NQS  2012.XLS]Pro Stock'!$D30 -> LR | E26: ='\\ser\software\other\[POINTS NQS  2012.XLS]Pro Stock'!$E30 -> 151 | F26: =IF('\\ser\software\other\[POINTS NQS  2012.XLS]Pro Stock'!$F30=0," ",'\\ser\software\other\[POINTS NQS  2012.XLS]Pro Stock'!$F30) -> Wild Streak | G26: ='\\ser\software\other\[POINTS NQS  2012.XLS]Pro Stock'!$AA30 -> 66 | I26: ='\\ser\software\other\[POINTS NQS  2012.XLS]Super Stock'!$A30 -> 24 | J26: ='\\ser\software\other\[POINTS NQS  2012.XLS]Super Stock'!$B30 -> Ed Nichols | K26: ='\\ser\software\other\[POINTS NQS  2012.XLS]Super Stock'!$C30 -> Salvisa, KY | L26: ='\\ser\software\other\[POINTS NQS  2012.XLS]Super Stock'!$D30 -> LR | M26: ='\\ser\software\other\[POINTS NQS  2012.XLS]Super Stock'!$E30 -> 124 | N26: =IF('\\ser\software\other\[POINTS NQS  2012.XLS]Super Stock'!$F30=0," ",'\\ser\software\other\[POINTS NQS  2012.XLS]Super Stock'!$F30) -> Track Attack | O26: ='\\ser\software\other\[POINTS NQS  2012.XLS]Super Stock'!$AA30 -> 105
A27: ='\\ser\software\other\[POINTS NQS  2012.XLS]Pro Stock'!$A31 -> 25 | B27: ='\\ser\software\other\[POINTS NQS  2012.XLS]Pro Stock'!$B31 -> Jerry Binkley | C27: ='\\ser\software\other\[POINTS NQS  2012.XLS]Pro Stock'!$C31 -> Jefferson City, Mo | D27: ='\\ser\software\other\[POINTS NQS  2012.XLS]Pro Stock'!$D31 -> MVP | E27: ='\\ser\software\other\[POINTS NQS  2012.XLS]Pro Stock'!$E31 -> 92 | F27: =IF('\\ser\software\other\[POINTS NQS  2012.XLS]Pro Stock'!$F31=0," ",'\\ser\software\other\[POINTS NQS  2012.XLS]Pro Stock'!$F31) -> Grandpa's Toy | G27: ='\\ser\software\other\[POINTS NQS  2012.XLS]Pro Stock'!$AA31 -> 72 | I27: ='\\ser\software\other\[POINTS NQS  2012.XLS]Super Stock'!$A31 -> 25 | J27: ='\\ser\software\other\[POINTS NQS  2012.XLS]Super Stock'!$B31 -> Alex Naffe | K27: ='\\ser\software\other\[POINTS NQS  2012.XLS]Super Stock'!$C31 -> Seymour, IN | L27: ='\\ser\software\other\[POINTS NQS  2012.XLS]Super Stock'!$D31 -> Hackman | M27: ='\\ser\software\other\[POINTS NQS  2012.XLS]Super Stock'!$E31 -> 218 | N27: =IF('\\ser\software\other\[POINTS NQS  2012.XLS]Super Stock'!$F31=0," ",'\\ser\software\other\[POINTS NQS  2012.XLS]Super Stock'!$F31) -> Game On Purple | O27: ='\\ser\software\other\[POINTS NQS  2012.XLS]Super Stock'!$AA31 -> 108
A28: ='\\ser\software\other\[POINTS NQS  2012.XLS]Pro Stock'!$A32 -> 26 | B28: ='\\ser\software\other\[POINTS NQS  2012.XLS]Pro Stock'!$B32 -> John Innerest | C28: ='\\ser\software\other\[POINTS NQS  2012.XLS]Pro Stock'!$C32 -> Red Lion, Pa | D28: ='\\ser\software\other\[POINTS NQS  2012.XLS]Pro Stock'!$D32 -> NP | E28: ='\\ser\software\other\[POINTS NQS  2012.XLS]Pro Stock'!$E32 -> 252 | F28: =IF('\\ser\software\other\[POINTS NQS  2012.XLS]Pro Stock'!$F32=0," ",'\\ser\software\other\[POINTS NQS  2012.XLS]Pro Stock'!$F32) -> Mean N Nasty | G28: ='\\ser\software\other\[POINTS NQS  2012.XLS]Pro Stock'!$AA32 -> 77 | I28: ='\\ser\software\other\[POINTS NQS  2012.XLS]Super Stock'!$A32 -> 26 | J28: ='\\ser\software\other\[POINTS NQS  2012.XLS]Super Stock'!$B32 -> Bruce Austin | K28: ='\\ser\software\other\[POINTS NQS  2012.XLS]Super Stock'!$C32 -> St. Charles, IA | L28: ='\\ser\software\other\[POINTS NQS  2012.XLS]Super Stock'!$D32 -> MVP | M28: ='\\ser\software\other\[POINTS NQS  2012.XLS]Super Stock'!$E32 -> 338 | N28: =IF('\\ser\software\other\[POINTS NQS  2012.XLS]Super Stock'!$F32=0," ",'\\ser\software\other\[POINTS NQS  2012.XLS]Super Stock'!$F32) -> Hillbilly Headache | O28: ='\\ser\software\other\[POINTS NQS  2012.XLS]Super Stock'!$AA32 -> 110
A29: ='\\ser\software\other\[POINTS NQS  2012.XLS]Pro Stock'!$A33 -> 27 | B29: ='\\ser\software\other\[POINTS NQS  2012.XLS]Pro Stock'!$B33 -> Alex Naffe | C29: ='\\ser\software\other\[POINTS NQS  2012.XLS]Pro Stock'!$C33 -> Edinburg, Ind | D29: ='\\ser\software\other\[POINTS NQS  2012.XLS]Pro Stock'!$D33 -> Hackman | E29: ='\\ser\software\other\[POINTS NQS  2012.XLS]Pro Stock'!$E33 -> 218 | F29: =IF('\\ser\software\other\[POINTS NQS  2012.XLS]Pro Stock'!$F33=0," ",'\\ser\software\other\[POINTS NQS  2012.XLS]Pro Stock'!$F33) -> Game On | G29: ='\\ser\software\other\[POINTS NQS  2012.XLS]Pro Stock'!$AA33 -> 84 | I29: ='\\ser\software\other\[POINTS NQS  2012.XLS]Super Stock'!$A33 -> 27 | J29: ='\\ser\software\other\[POINTS NQS  2012.XLS]Super Stock'!$B33 -> Tyler Hackman | K29: ='\\ser\software\other\[POINTS NQS  2012.XLS]Super Stock'!$C33 -> Seymour, IN | L29: ='\\ser\software\other\[POINTS NQS  2012.XLS]Super Stock'!$D33 -> Hackman | M29: ='\\ser\software\other\[POINTS NQS  2012.XLS]Super Stock'!$E33 -> 507 | N29: =IF('\\ser\software\other\[POINTS NQS  2012.XLS]Super Stock'!$F33=0," ",'\\ser\software\other\[POINTS NQS  2012.XLS]Super Stock'!$F33) -> Mad Hatter | O29: ='\\ser\software\other\[POINTS NQS  2012.XLS]Super Stock'!$AA33 -> 119
A30: ='\\ser\software\other\[POINTS NQS  2012.XLS]Pro Stock'!$A34 -> 28 | B30: ='\\ser\software\other\[POINTS NQS  2012.XLS]Pro Stock'!$B34 -> Randy Demers | C30: ='\\ser\software\other\[POINTS NQS  2012.XLS]Pro Stock'!$C34 -> Columbia, NJ | D30: ='\\ser\software\other\[POINTS NQS  2012.XLS]Pro Stock'!$D34 -> NP | E30: ='\\ser\software\other\[POINTS NQS  2012.XLS]Pro Stock'!$E34 -> 85 | F30: =IF('\\ser\software\other\[POINTS NQS  2012.XLS]Pro Stock'!$F34=0," ",'\\ser\software\other\[POINTS NQS  2012.XLS]Pro Stock'!$F34) -> Widowmaker | G30: ='\\ser\software\other\[POINTS NQS  2012.XLS]Pro Stock'!$AA34 -> 86 | I30: ='\\ser\software\other\[POINTS NQS  2012.XLS]Super Stock'!$A34 -> 28 | J30: ='\\ser\software\other\[POINTS NQS  2012.XLS]Super Stock'!$B34 -> Todd Brest | K30: ='\\ser\software\other\[POINTS NQS  2012.XLS]Super Stock'!$C34 -> Sharpsville, Pa | L30: ='\\ser\software\other\[POINTS NQS  2012.XLS]Super Stock'!$D34 -> 0 | M30: ='\\ser\software\other\[POINTS NQS  2012.XLS]Super Stock'!$E34 -> 272 | N30: =IF('\\ser\software\other\[POINTS NQS  2012.XLS]Super Stock'!$F34=0," ",'\\ser\software\other\[POINTS NQS  2012.XLS]Super Stock'!$F34) -> Cub | O30: ='\\ser\software\other\[POINTS NQS  2012.XLS]Super Stock'!$AA34 -> 139
A31: ='\\ser\software\other\[POINTS NQS  2012.XLS]Pro Stock'!$A35 -> 29 | B31: ='\\ser\software\other\[POINTS NQS  2012.XLS]Pro Stock'!$B35 -> Todd Hammond | C31: ='\\ser\software\other\[POINTS NQS  2012.XLS]Pro Stock'!$C35 -> Fallng Waters, WV | D31: ='\\ser\software\other\[POINTS NQS  2012.XLS]Pro Stock'!$D35 -> JRS | E31: ='\\ser\software\other\[POINTS NQS  2012.XLS]Pro Stock'!$E35 -> 241 | F31: =IF('\\ser\software\other\[POINTS NQS  2012.XLS]Pro Stock'!$F35=0," ",'\\ser\software\other\[POINTS NQS  2012.XLS]Pro Stock'!$F35) -> Problem Child | G31: ='\\ser\software\other\[POINTS NQS  2012.XLS]Pro Stock'!$AA35 -> 87 | I31: ='\\ser\software\other\[POINTS NQS  2012.XLS]Super Stock'!$A35 -> 29 | J31: ='\\ser\software\other\[POINTS NQS  2012.XLS]Super Stock'!$B35 -> John Donavon | K31: ='\\ser\software\other\[POINTS NQS  2012.XLS]Super Stock'!$C35 -> Pataskala, OH | L31: ='\\ser\software\other\[POINTS NQS  2012.XLS]Super Stock'!$D35 -> JRS | M31: ='\\ser\software\other\[POINTS NQS  2012.XLS]Super Stock'!$E35 -> 6 | N31: =IF('\\ser\software\other\[POINTS NQS  2012.XLS]Super Stock'!$F35=0," ",'\\ser\software\other\[POINTS NQS  2012.XLS]Super Stock'!$F35) -> John's Deere | O31: ='\\ser\software\other\[POINTS NQS  2012.XLS]Super Stock'!$AA35 -> 124
A32: ='\\ser\software\other\[POINTS NQS  2012.XLS]Pro Stock'!$A36 -> 30 | B32: ='\\ser\software\other\[POINTS NQS  2012.XLS]Pro Stock'!$B36 -> Steve Williford | C32: ='\\ser\software\other\[POINTS NQS  2012.XLS]Pro Stock'!$C36 -> Englehard, NC | D32: ='\\ser\software\other\[POINTS NQS  2012.XLS]Pro Stock'!$D36 -> MVP | E32: ='\\ser\software\other\[POINTS NQS  2012.XLS]Pro Stock'!$E36 -> 176 | F32: =IF('\\ser\software\other\[POINTS NQS  2012.XLS]Pro Stock'!$F36=0," ",'\\ser\software\other\[POINTS NQS  2012.XLS]Pro Stock'!$F36) -> International | G32: ='\\ser\software\other\[POINTS NQS  2012.XLS]Pro Stock'!$AA36 -> 96 | I32: ='\\ser\software\other\[POINTS NQS  2012.XLS]Super Stock'!$A36 -> 30 | J32: ='\\ser\software\other\[POINTS NQS  2012.XLS]Super Stock'!$B36 -> Steve Williford | K32: ='\\ser\software\other\[POINTS NQS  2012.XLS]Super Stock'!$C36 -> Engelhard, NC | L32: ='\\ser\software\other\[POINTS NQS  2012.XLS]Super Stock'!$D36 -> MVP | M32: ='\\ser\software\other\[POINTS NQS  2012.XLS]Super Stock'!$E36 -> 177 | N32: =IF('\\ser\software\other\[POINTS NQS  2012.XLS]Super Stock'!$F36=0," ",'\\ser\software\other\[POINTS NQS  2012.XLS]Super Stock'!$F36) -> Williford Trucking IH | O32: ='\\ser\software\other\[POINTS NQS  2012.XLS]Super Stock'!$AA36 -> 127
A33: ='\\ser\software\other\[POINTS NQS  2012.XLS]Pro Stock'!$A37 -> 31 | B33: ='\\ser\software\other\[POINTS NQS  2012.XLS]Pro Stock'!$B37 -> Larry Korff | C33: ='\\ser\software\other\[POINTS NQS  2012.XLS]Pro Stock'!$C37 -> Evansville, Ind | D33: ='\\ser\software\other\[POINTS NQS  2012.XLS]Pro Stock'!$D37 -> TC | E33: ='\\ser\software\other\[POINTS NQS  2012.XLS]Pro Stock'!$E37 -> 398 | F33: =IF('\\ser\software\other\[POINTS NQS  2012.XLS]Pro Stock'!$F37=0," ",'\\ser\software\other\[POINTS NQS  2012.XLS]Pro Stock'!$F37) -> Kryptonite | G33: ='\\ser\software\other\[POINTS NQS  2012.XLS]Pro Stock'!$AA37 -> 99 | I33: ='\\ser\software\other\[POINTS NQS  2012.XLS]Super Stock'!$A37 -> 31 | J33: ='\\ser\software\other\[POINTS NQS  2012.XLS]Super Stock'!$B37 -> Steve Williford | K33: ='\\ser\software\other\[POINTS NQS  2012.XLS]Super Stock'!$C37 -> Engelhard, NC | L33: ='\\ser\software\other\[POINTS NQS  2012.XLS]Super Stock'!$D37 -> MVP | M33: ='\\ser\software\other\[POINTS NQS  2012.XLS]Super Stock'!$E37 -> 176 | N33: =IF('\\ser\software\other\[POINTS NQS  2012.XLS]Super Stock'!$F37=0," ",'\\ser\software\other\[POINTS NQS  2012.XLS]Super Stock'!$F37) -> International | O33: ='\\ser\software\other\[POINTS NQS  2012.XLS]Super Stock'!$AA37 -> 137
A34: ='\\ser\software\other\[POINTS NQS  2012.XLS]Pro Stock'!$A38 -> 32 | B34: ='\\ser\software\other\[POINTS NQS  2012.XLS]Pro Stock'!$B38 -> Matt Kaster | C34: ='\\ser\software\other\[POINTS NQS  2012.XLS]Pro Stock'!$C38 -> Burlington, Wisc | D34: ='\\ser\software\other\[POINTS NQS  2012.XLS]Pro Stock'!$D38 -> MVP | E34: ='\\ser\software\other\[POINTS NQS  2012.XLS]Pro Stock'!$E38 -> 98 | F34: =IF('\\ser\software\other\[POINTS NQS  2012.XLS]Pro Stock'!$F38=0," ",'\\ser\software\other\[POINTS NQS  2012.XLS]Pro Stock'!$F38) -> Moose | G34: ='\\ser\software\other\[POINTS NQS  2012.XLS]Pro Stock'!$AA38 -> 102 | I34: ='\\ser\software\other\[POINTS NQS  2012.XLS]Super Stock'!$A38 -> 32 | J34: ='\\ser\software\other\[POINTS NQS  2012.XLS]Super Stock'!$B38 -> Bruce Austin | K34: ='\\ser\software\other\[POINTS NQS  2012.XLS]Super Stock'!$C38 -> St. Charles, IA | L34: ='\\ser\software\other\[POINTS NQS  2012.XLS]Super Stock'!$D38 -> MVP | M34: ='\\ser\software\other\[POINTS NQS  2012.XLS]Super Stock'!$E38 -> 277 | N34: =IF('\\ser\software\other\[POINTS NQS  2012.XLS]Super Stock'!$F38=0," ",'\\ser\software\other\[POINTS NQS  2012.XLS]Super Stock'!$F38) -> Cap'n Crunch | O34: ='\\ser\software\other\[POINTS NQS  2012.XLS]Super Stock'!$AA38 -> 137
A35: ='\\ser\software\other\[POINTS NQS  2012.XLS]Pro Stock'!$A39 -> 33 | B35: ='\\ser\software\other\[POINTS NQS  2012.XLS]Pro Stock'!$B39 -> Steve Williford | C35: ='\\ser\software\other\[POINTS NQS  2012.XLS]Pro Stock'!$C39 -> Englehard, NC | D35: ='\\ser\software\other\[POINTS NQS  2012.XLS]Pro Stock'!$D39 -> MVP | E35: ='\\ser\software\other\[POINTS NQS  2012.XLS]Pro Stock'!$E39 -> 177 | F35: =IF('\\ser\software\other\[POINTS NQS  2012.XLS]Pro Stock'!$F39=0," ",'\\ser\software\other\[POINTS NQS  2012.XLS]Pro Stock'!$F39) -> Williford Trucking IH | G35: ='\\ser\software\other\[POINTS NQS  2012.XLS]Pro Stock'!$AA39 -> 104 | I35: ='\\ser\software\other\[POINTS NQS  2012.XLS]Super Stock'!$A39 -> 33 | J35: ='\\ser\software\other\[POINTS NQS  2012.XLS]Super Stock'!$B39 -> Charlie Korff | K35: ='\\ser\software\other\[POINTS NQS  2012.XLS]Super Stock'!$C39 -> Evansville, IN | L35: ='\\ser\software\other\[POINTS NQS  2012.XLS]Super Stock'!$D39 -> TC | M35: ='\\ser\software\other\[POINTS NQS  2012.XLS]Super Stock'!$E39 -> 400 | N35: =IF('\\ser\software\other\[POINTS NQS  2012.XLS]Super Stock'!$F39=0," ",'\\ser\software\other\[POINTS NQS  2012.XLS]Super Stock'!$F39) -> No Fear Deer | O35: ='\\ser\software\other\[POINTS NQS  2012.XLS]Super Stock'!$AA39 -> 139
A36: ='\\ser\software\other\[POINTS NQS  2012.XLS]Pro Stock'!$A40 -> 34 | B36: ='\\ser\software\other\[POINTS NQS  2012.XLS]Pro Stock'!$B40 -> Ray Gentz | C36: ='\\ser\software\other\[POINTS NQS  2012.XLS]Pro Stock'!$C40 -> Colon, Mich | D36: ='\\ser\software\other\[POINTS NQS  2012.XLS]Pro Stock'!$D40 -> JRS | E36: ='\\ser\software\other\[POINTS NQS  2012.XLS]Pro Stock'!$E40 -> 262 | F36: =IF('\\ser\software\other\[POINTS NQS  2012.XLS]Pro Stock'!$F40=0," ",'\\ser\software\other\[POINTS NQS  2012.XLS]Pro Stock'!$F40) -> Chaos | G36: ='\\ser\software\other\[POINTS NQS  2012.XLS]Pro Stock'!$AA40 -> 105 | I36: ='\\ser\software\other\[POINTS NQS  2012.XLS]Super Stock'!$A40 -> 34 | J36: ='\\ser\software\other\[POINTS NQS  2012.XLS]Super Stock'!$B40 -> Zach Richerson | K36: ='\\ser\software\other\[POINTS NQS  2012.XLS]Super Stock'!$C40 -> Crittenden, Ky | L36: ='\\ser\software\other\[POINTS NQS  2012.XLS]Super Stock'!$D40 -> JW | M36: ='\\ser\software\other\[POINTS NQS  2012.XLS]Super Stock'!$E40 -> 348 | N36: =IF('\\ser\software\other\[POINTS NQS  2012.XLS]Super Stock'!$F40=0," ",'\\ser\software\other\[POINTS NQS  2012.XLS]Super Stock'!$F40) -> Zach's Rat | O36: ='\\ser\software\other\[POINTS NQS  2012.XLS]Super Stock'!$AA40 -> 141
A37: ='\\ser\software\other\[POINTS NQS  2012.XLS]Pro Stock'!$A41 -> 35 | B37: ='\\ser\software\other\[POINTS NQS  2012.XLS]Pro Stock'!$B41 -> Clyde Mishler | C37: ='\\ser\software\other\[POINTS NQS  2012.XLS]Pro Stock'!$C41 -> E Peoria, Ill | D37: ='\\ser\software\other\[POINTS NQS  2012.XLS]Pro Stock'!$D41 -> GTP | E37: ='\\ser\software\other\[POINTS NQS  2012.XLS]Pro Stock'!$E41 -> 168 | F37: =IF('\\ser\software\other\[POINTS NQS  2012.XLS]Pro Stock'!$F41=0," ",'\\ser\software\other\[POINTS NQS  2012.XLS]Pro Stock'!$F41) ->  | G37: ='\\ser\software\other\[POINTS NQS  2012.XLS]Pro Stock'!$AA41 -> 115 | I37: ='\\ser\software\other\[POINTS NQS  2012.XLS]Super Stock'!$A41 -> 35 | J37: ='\\ser\software\other\[POINTS NQS  2012.XLS]Super Stock'!$B41 -> Michael Ciolino | K37: ='\\ser\software\other\[POINTS NQS  2012.XLS]Super Stock'!$C41 -> Peoria, IL | L37: ='\\ser\software\other\[POINTS NQS  2012.XLS]Super Stock'!$D41 -> MVP | M37: ='\\ser\software\other\[POINTS NQS  2012.XLS]Super Stock'!$E41 -> 146 | N37: =IF('\\ser\software\other\[POINTS NQS  2012.XLS]Super Stock'!$F41=0," ",'\\ser\software\other\[POINTS NQS  2012.XLS]Super Stock'!$F41) -> Mechanial Animal | O37: ='\\ser\software\other\[POINTS NQS  2012.XLS]Super Stock'!$AA41 -> 142
A38: ='\\ser\software\other\[POINTS NQS  2012.XLS]Pro Stock'!$A42 -> 36 | B38: ='\\ser\software\other\[POINTS NQS  2012.XLS]Pro Stock'!$B42 -> Bruce Austin | C38: ='\\ser\software\other\[POINTS NQS  2012.XLS]Pro Stock'!$C42 -> St Charles, IA | D38: ='\\ser\software\other\[POINTS NQS  2012.XLS]Pro Stock'!$D42 -> MVP | E38: ='\\ser\software\other\[POINTS NQS  2012.XLS]Pro Stock'!$E42 -> 277 | F38: =IF('\\ser\software\other\[POINTS NQS  2012.XLS]Pro Stock'!$F42=0," ",'\\ser\software\other\[POINTS NQS  2012.XLS]Pro Stock'!$F42) -> Cap'N Crunch | G38: ='\\ser\software\other\[POINTS NQS  2012.XLS]Pro Stock'!$AA42 -> 116 | I38: ='\\ser\software\other\[POINTS NQS  2012.XLS]Super Stock'!$A42 -> 36 | J38: ='\\ser\software\other\[POINTS NQS  2012.XLS]Super Stock'!$B42 -> Nathan Nichols | K38: ='\\ser\software\other\[POINTS NQS  2012.XLS]Super Stock'!$C42 -> Lawrenceburg, KY | L38: ='\\ser\software\other\[POINTS NQS  2012.XLS]Super Stock'!$D42 -> LR | M38: ='\\ser\software\other\[POINTS NQS  2012.XLS]Super Stock'!$E42 -> 151 | N38: =IF('\\ser\software\other\[POINTS NQS  2012.XLS]Super Stock'!$F42=0," ",'\\ser\software\other\[POINTS NQS  2012.XLS]Super Stock'!$F42) -> Wildstreak | O38: ='\\ser\software\other\[POINTS NQS  2012.XLS]Super Stock'!$AA42 -> 142
A39: ='\\ser\software\other\[POINTS NQS  2012.XLS]Pro Stock'!$A43 -> 37 | B39: ='\\ser\software\other\[POINTS NQS  2012.XLS]Pro Stock'!$B43 -> Logan Cessna | C39: ='\\ser\software\other\[POINTS NQS  2012.XLS]Pro Stock'!$C43 -> Chambersburg, Pa | D39: ='\\ser\software\other\[POINTS NQS  2012.XLS]Pro Stock'!$D43 -> NP | E39: ='\\ser\software\other\[POINTS NQS  2012.XLS]Pro Stock'!$E43 -> 389 | F39: =IF('\\ser\software\other\[POINTS NQS  2012.XLS]Pro Stock'!$F43=0," ",'\\ser\software\other\[POINTS NQS  2012.XLS]Pro Stock'!$F43) -> Adrenaline | G39: ='\\ser\software\other\[POINTS NQS  2012.XLS]Pro Stock'!$AA43 -> 119 | I39: ='\\ser\software\other\[POINTS NQS  2012.XLS]Super Stock'!$A43 -> 37 | J39: ='\\ser\software\other\[POINTS NQS  2012.XLS]Super Stock'!$B43 -> Max Burkhart | K39: ='\\ser\software\other\[POINTS NQS  2012.XLS]Super Stock'!$C43 -> Otwell, IN | L39: ='\\ser\software\other\[POINTS NQS  2012.XLS]Super Stock'!$D43 -> TC | M39: ='\\ser\software\other\[POINTS NQS  2012.XLS]Super Stock'!$E43 -> 78 | N39: =IF('\\ser\software\other\[POINTS NQS  2012.XLS]Super Stock'!$F43=0," ",'\\ser\software\other\[POINTS NQS  2012.XLS]Super Stock'!$F43) -> Ground Pounder | O39: ='\\ser\software\other\[POINTS NQS  2012.XLS]Super Stock'!$AA43 -> 145
A40: ='\\ser\software\other\[POINTS NQS  2012.XLS]Pro Stock'!$A44 -> 38 | B40: ='\\ser\software\other\[POINTS NQS  2012.XLS]Pro Stock'!$B44 -> Darlene Sample | C40: ='\\ser\software\other\[POINTS NQS  2012.XLS]Pro Stock'!$C44 -> Carrolton, OH | D40: ='\\ser\software\other\[POINTS NQS  2012.XLS]Pro Stock'!$D44 -> LR | E40: ='\\ser\software\other\[POINTS NQS  2012.XLS]Pro Stock'!$E44 -> 498 | F40: =IF('\\ser\software\other\[POINTS NQS  2012.XLS]Pro Stock'!$F44=0," ",'\\ser\software\other\[POINTS NQS  2012.XLS]Pro Stock'!$F44) -> Dr. Doom | G40: ='\\ser\software\other\[POINTS NQS  2012.XLS]Pro Stock'!$AA44 -> 121 | I40: ='\\ser\software\other\[POINTS NQS  2012.XLS]Super Stock'!$A44 -> 38 | J40: ='\\ser\software\other\[POINTS NQS  2012.XLS]Super Stock'!$B44 -> Ray Gentz | K40: ='\\ser\software\other\[POINTS NQS  2012.XLS]Super Stock'!$C44 -> Colon, MI | L40: ='\\ser\software\other\[POINTS NQS  2012.XLS]Super Stock'!$D44 -> VM | M40: ='\\ser\software\other\[POINTS NQS  2012.XLS]Super Stock'!$E44 -> 34 | N40: =IF('\\ser\software\other\[POINTS NQS  2012.XLS]Super Stock'!$F44=0," ",'\\ser\software\other\[POINTS NQS  2012.XLS]Super Stock'!$F44) ->  | O40: ='\\ser\software\other\[POINTS NQS  2012.XLS]Super Stock'!$AA44 -> 146
A41: ='\\ser\software\other\[POINTS NQS  2012.XLS]Pro Stock'!$A45 -> 39 | B41: ='\\ser\software\other\[POINTS NQS  2012.XLS]Pro Stock'!$B45 -> Harrison Stahl | C41: ='\\ser\software\other\[POINTS NQS  2012.XLS]Pro Stock'!$C45 -> Welton, IA | D41: ='\\ser\software\other\[POINTS NQS  2012.XLS]Pro Stock'!$D45 -> MVP | E41: ='\\ser\software\other\[POINTS NQS  2012.XLS]Pro Stock'!$E45 -> 335 | F41: =IF('\\ser\software\other\[POINTS NQS  2012.XLS]Pro Stock'!$F45=0," ",'\\ser\software\other\[POINTS NQS  2012.XLS]Pro Stock'!$F45) -> MWSC #3 | G41: ='\\ser\software\other\[POINTS NQS  2012.XLS]Pro Stock'!$AA45 -> 125 | I41: ='\\ser\software\other\[POINTS NQS  2012.XLS]Super Stock'!$A45 -> 39 | J41: ='\\ser\software\other\[POINTS NQS  2012.XLS]Super Stock'!$B45 -> Bradley Corzine | K41: ='\\ser\software\other\[POINTS NQS  2012.XLS]Super Stock'!$C45 -> Dongola, IL | L41: ='\\ser\software\other\[POINTS NQS  2012.XLS]Super Stock'!$D45 -> JW | M41: ='\\ser\software\other\[POINTS NQS  2012.XLS]Super Stock'!$E45 -> 477 | N41: =IF('\\ser\software\other\[POINTS NQS  2012.XLS]Super Stock'!$F45=0," ",'\\ser\software\other\[POINTS NQS  2012.XLS]Super Stock'!$F45) -> Black Cat's Revenge | O41: ='\\ser\software\other\[POINTS NQS  2012.XLS]Super Stock'!$AA45 -> 146
A42: ='\\ser\software\other\[POINTS NQS  2012.XLS]Pro Stock'!$A46 -> 40 | B42: ='\\ser\software\other\[POINTS NQS  2012.XLS]Pro Stock'!$B46 -> Julian Stahl | C42: ='\\ser\software\other\[POINTS NQS  2012.XLS]Pro Stock'!$C46 -> Welton, IA | D42: ='\\ser\software\other\[POINTS NQS  2012.XLS]Pro Stock'!$D46 -> MVP | E42: ='\\ser\software\other\[POINTS NQS  2012.XLS]Pro Stock'!$E46 -> 1 | F42: =IF('\\ser\software\other\[POINTS NQS  2012.XLS]Pro Stock'!$F46=0," ",'\\ser\software\other\[POINTS NQS  2012.XLS]Pro Stock'!$F46) -> MWSC # 1 | G42: ='\\ser\software\other\[POINTS NQS  2012.XLS]Pro Stock'!$AA46 -> 136 | I42: ='\\ser\software\other\[POINTS NQS  2012.XLS]Super Stock'!$A46 -> 40 | J42: ='\\ser\software\other\[POINTS NQS  2012.XLS]Super Stock'!$B46 -> Steve Chrisman | K42: ='\\ser\software\other\[POINTS NQS  2012.XLS]Super Stock'!$C46 -> Edinburgh, IN | L42: ='\\ser\software\other\[POINTS NQS  2012.XLS]Super Stock'!$D46 -> Hackman | M42: ='\\ser\software\other\[POINTS NQS  2012.XLS]Super Stock'!$E46 -> 23 | N42: =IF('\\ser\software\other\[POINTS NQS  2012.XLS]Super Stock'!$F46=0," ",'\\ser\software\other\[POINTS NQS  2012.XLS]Super Stock'!$F46) -> Royal Pain | O42: ='\\ser\software\other\[POINTS NQS  2012.XLS]Super Stock'!$AA46 -> 147
A43: ='\\ser\software\other\[POINTS NQS  2012.XLS]Pro Stock'!$A47 -> 41 | B43: ='\\ser\software\other\[POINTS NQS  2012.XLS]Pro Stock'!$B47 -> Ron Scroggins | C43: ='\\ser\software\other\[POINTS NQS  2012.XLS]Pro Stock'!$C47 -> Neosho, Mo | D43: ='\\ser\software\other\[POINTS NQS  2012.XLS]Pro Stock'!$D47 -> VM | E43: ='\\ser\software\other\[POINTS NQS  2012.XLS]Pro Stock'!$E47 -> 110 | F43: =IF('\\ser\software\other\[POINTS NQS  2012.XLS]Pro Stock'!$F47=0," ",'\\ser\software\other\[POINTS NQS  2012.XLS]Pro Stock'!$F47) -> Dirt Dancer | G43: ='\\ser\software\other\[POINTS NQS  2012.XLS]Pro Stock'!$AA47 -> 137 | I43: ='\\ser\software\other\[POINTS NQS  2012.XLS]Super Stock'!$A47 -> 41 | J43: ='\\ser\software\other\[POINTS NQS  2012.XLS]Super Stock'!$B47 -> David Knapp | K43: ='\\ser\software\other\[POINTS NQS  2012.XLS]Super Stock'!$C47 -> Hennepin, IL | L43: ='\\ser\software\other\[POINTS NQS  2012.XLS]Super Stock'!$D47 -> MVP | M43: ='\\ser\software\other\[POINTS NQS  2012.XLS]Super Stock'!$E47 -> 381 | N43: =IF('\\ser\software\other\[POINTS NQS  2012.XLS]Super Stock'!$F47=0," ",'\\ser\software\other\[POINTS NQS  2012.XLS]Super Stock'!$F47) -> Knapp Time | O43: ='\\ser\software\other\[POINTS NQS  2012.XLS]Super Stock'!$AA47 -> 147
A44: ='\\ser\software\other\[POINTS NQS  2012.XLS]Pro Stock'!$A48 -> 42 | B44: ='\\ser\software\other\[POINTS NQS  2012.XLS]Pro Stock'!$B48 -> Nick Mishler | C44: ='\\ser\software\other\[POINTS NQS  2012.XLS]Pro Stock'!$C48 -> E Peoria, Ill | D44: ='\\ser\software\other\[POINTS NQS  2012.XLS]Pro Stock'!$D48 -> GTP | E44: ='\\ser\software\other\[POINTS NQS  2012.XLS]Pro Stock'!$E48 -> 167 | F44: =IF('\\ser\software\other\[POINTS NQS  2012.XLS]Pro Stock'!$F48=0," ",'\\ser\software\other\[POINTS NQS  2012.XLS]Pro Stock'!$F48) -> Pulse | G44: ='\\ser\software\other\[POINTS NQS  2012.XLS]Pro Stock'!$AA48 -> 137 | I44: ='\\ser\software\other\[POINTS NQS  2012.XLS]Super Stock'!$A48 -> 42 | J44: ='\\ser\software\other\[POINTS NQS  2012.XLS]Super Stock'!$B48 -> Doug Diehl | K44: ='\\ser\software\other\[POINTS NQS  2012.XLS]Super Stock'!$C48 -> Smithsburg, PA | L44: ='\\ser\software\other\[POINTS NQS  2012.XLS]Super Stock'!$D48 -> NP | M44: ='\\ser\software\other\[POINTS NQS  2012.XLS]Super Stock'!$E48 -> 441 | N44: =IF('\\ser\software\other\[POINTS NQS  2012.XLS]Super Stock'!$F48=0," ",'\\ser\software\other\[POINTS NQS  2012.XLS]Super Stock'!$F48) -> Excedrin | O44: ='\\ser\software\other\[POINTS NQS  2012.XLS]Super Stock'!$AA48 -> 148
A45: ='\\ser\software\other\[POINTS NQS  2012.XLS]Pro Stock'!$A49 -> 43 | B45: ='\\ser\software\other\[POINTS NQS  2012.XLS]Pro Stock'!$B49 -> Charlie Korff | C45: ='\\ser\software\other\[POINTS NQS  2012.XLS]Pro Stock'!$C49 -> Evansville, Ind | D45: ='\\ser\software\other\[POINTS NQS  2012.XLS]Pro Stock'!$D49 -> TC | E45: ='\\ser\software\other\[POINTS NQS  2012.XLS]Pro Stock'!$E49 -> 400 | F45: =IF('\\ser\software\other\[POINTS NQS  2012.XLS]Pro Stock'!$F49=0," ",'\\ser\software\other\[POINTS NQS  2012.XLS]Pro Stock'!$F49) -> No Fear Deere | G45: ='\\ser\software\other\[POINTS NQS  2012.XLS]Pro Stock'!$AA49 -> 138 | I45: ='\\ser\software\other\[POINTS NQS  2012.XLS]Super Stock'!$A49 -> 43 | J45: ='\\ser\software\other\[POINTS NQS  2012.XLS]Super Stock'!$B49 -> Darlene Sample | K45: ='\\ser\software\other\[POINTS NQS  2012.XLS]Super Stock'!$C49 -> Carrollton, OH | L45: ='\\ser\software\other\[POINTS NQS  2012.XLS]Super Stock'!$D49 -> LR | M45: ='\\ser\software\other\[POINTS NQS  2012.XLS]Super Stock'!$E49 -> 498 | N45: =IF('\\ser\software\other\[POINTS NQS  2012.XLS]Super Stock'!$F49=0," ",'\\ser\software\other\[POINTS NQS  2012.XLS]Super Stock'!$F49) -> Dr. Doom | O45: ='\\ser\software\other\[POINTS NQS  2012.XLS]Super Stock'!$AA49 -> 150
A46: ='\\ser\software\other\[POINTS NQS  2012.XLS]Pro Stock'!$A50 -> 44 | B46: ='\\ser\software\other\[POINTS NQS  2012.XLS]Pro Stock'!$B50 -> Ron Marcine | C46: ='\\ser\software\other\[POINTS NQS  2012.XLS]Pro Stock'!$C50 -> Whitehouse Station, NJ | D46: ='\\ser\software\other\[POINTS NQS  2012.XLS]Pro Stock'!$D50 -> JRS | E46: ='\\ser\software\other\[POINTS NQS  2012.XLS]Pro Stock'!$E50 -> 245 | F46: =IF('\\ser\software\other\[POINTS NQS  2012.XLS]Pro Stock'!$F50=0," ",'\\ser\software\other\[POINTS NQS  2012.XLS]Pro Stock'!$F50) -> No Pressure | G46: ='\\ser\software\other\[POINTS NQS  2012.XLS]Pro Stock'!$AA50 -> 139 | I46: ='\\ser\software\other\[POINTS NQS  2012.XLS]Super Stock'!$A50 -> 44 | J46: ='\\ser\software\other\[POINTS NQS  2012.XLS]Super Stock'!$B50 -> Jake Gingerich | K46: ='\\ser\software\other\[POINTS NQS  2012.XLS]Super Stock'!$C50 -> Montgomery, Ind | L46: ='\\ser\software\other\[POINTS NQS  2012.XLS]Super Stock'!$D50 -> JW | M46: ='\\ser\software\other\[POINTS NQS  2012.XLS]Super Stock'!$E50 -> 18 | N46: =IF('\\ser\software\other\[POINTS NQS  2012.XLS]Super Stock'!$F50=0," ",'\\ser\software\other\[POINTS NQS  2012.XLS]Super Stock'!$F50) -> Thumper | O46: ='\\ser\software\other\[POINTS NQS  2012.XLS]Super Stock'!$AA50 -> 151
A47: ='\\ser\software\other\[POINTS NQS  2012.XLS]Pro Stock'!$A51 -> 45 | B47: ='\\ser\software\other\[POINTS NQS  2012.XLS]Pro Stock'!$B51 -> Bruce Austin | C47: ='\\ser\software\other\[POINTS NQS  2012.XLS]Pro Stock'!$C51 -> St Charles, IA | D47: ='\\ser\software\other\[POINTS NQS  2012.XLS]Pro Stock'!$D51 -> MVP | E47: ='\\ser\software\other\[POINTS NQS  2012.XLS]Pro Stock'!$E51 -> 338 | F47: =IF('\\ser\software\other\[POINTS NQS  2012.XLS]Pro Stock'!$F51=0," ",'\\ser\software\other\[POINTS NQS  2012.XLS]Pro Stock'!$F51) -> Hillbilly Headache | G47: ='\\ser\software\other\[POINTS NQS  2012.XLS]Pro Stock'!$AA51 -> 139 | I47: ='\\ser\software\other\[POINTS NQS  2012.XLS]Super Stock'!$A51 -> 45 | J47: ='\\ser\software\other\[POINTS NQS  2012.XLS]Super Stock'!$B51 -> Harrison Stahl | K47: ='\\ser\software\other\[POINTS NQS  2012.XLS]Super Stock'!$C51 -> Dewitt, IA | L47: ='\\ser\software\other\[POINTS NQS  2012.XLS]Super Stock'!$D51 -> MVP | M47: ='\\ser\software\other\[POINTS NQS  2012.XLS]Super Stock'!$E51 -> 336 | N47: =IF('\\ser\software\other\[POINTS NQS  2012.XLS]Super Stock'!$F51=0," ",'\\ser\software\other\[POINTS NQS  2012.XLS]Super Stock'!$F51) -> MWSC # 4 | O47: ='\\ser\software\other\[POINTS NQS  2012.XLS]Super Stock'!$AA51 -> 151
A48: ='\\ser\software\other\[POINTS NQS  2012.XLS]Pro Stock'!$A52 -> 46 | B48: ='\\ser\software\other\[POINTS NQS  2012.XLS]Pro Stock'!$B52 -> Morgan Cessna | C48: ='\\ser\software\other\[POINTS NQS  2012.XLS]Pro Stock'!$C52 -> Chambersburg, Pa | D48: ='\\ser\software\other\[POINTS NQS  2012.XLS]Pro Stock'!$D52 -> NP | E48: ='\\ser\software\other\[POINTS NQS  2012.XLS]Pro Stock'!$E52 -> 491 | F48: =IF('\\ser\software\other\[POINTS NQS  2012.XLS]Pro Stock'!$F52=0," ",'\\ser\software\other\[POINTS NQS  2012.XLS]Pro Stock'!$F52) -> Built for Business | G48: ='\\ser\software\other\[POINTS NQS  2012.XLS]Pro Stock'!$AA52 -> 139 | I48: ='\\ser\software\other\[POINTS NQS  2012.XLS]Super Stock'!$A52 -> 46 | J48: ='\\ser\software\other\[POINTS NQS  2012.XLS]Super Stock'!$B52 -> Jake Gingerich | K48: ='\\ser\software\other\[POINTS NQS  2012.XLS]Super Stock'!$C52 -> Montgomery, Ind | L48: ='\\ser\software\other\[POINTS NQS  2012.XLS]Super Stock'!$D52 -> JW | M48: ='\\ser\software\other\[POINTS NQS  2012.XLS]Super Stock'!$E52 -> 28 | N48: =IF('\\ser\software\other\[POINTS NQS  2012.XLS]Super Stock'!$F52=0," ",'\\ser\software\other\[POINTS NQS  2012.XLS]Super Stock'!$F52) -> Silver Fox | O48: ='\\ser\software\other\[POINTS NQS  2012.XLS]Super Stock'!$AA52 -> 155
A49: ='\\ser\software\other\[POINTS NQS  2012.XLS]Pro Stock'!$A53 -> 47 | B49: ='\\ser\software\other\[POINTS NQS  2012.XLS]Pro Stock'!$B53 -> Mike Silco | C49: ='\\ser\software\other\[POINTS NQS  2012.XLS]Pro Stock'!$C53 -> Pittsford, NY | D49: ='\\ser\software\other\[POINTS NQS  2012.XLS]Pro Stock'!$D53 -> LR | E49: ='\\ser\software\other\[POINTS NQS  2012.XLS]Pro Stock'!$E53 -> 547 | F49: =IF('\\ser\software\other\[POINTS NQS  2012.XLS]Pro Stock'!$F53=0," ",'\\ser\software\other\[POINTS NQS  2012.XLS]Pro Stock'!$F53) -> 1466 Alcoholic | G49: ='\\ser\software\other\[POINTS NQS  2012.XLS]Pro Stock'!$AA53 -> 141 | I49: ='\\ser\software\other\[POINTS NQS  2012.XLS]Super Stock'!$A53 -> 47 | J49: ='\\ser\software\other\[POINTS NQS  2012.XLS]Super Stock'!$B53 -> Charlie Ciolino | K49: ='\\ser\software\other\[POINTS NQS  2012.XLS]Super Stock'!$C53 -> Hammond, LA | L49: ='\\ser\software\other\[POINTS NQS  2012.XLS]Super Stock'!$D53 -> MVP | M49: ='\\ser\software\other\[POINTS NQS  2012.XLS]Super Stock'!$E53 -> 145 | N49: =IF('\\ser\software\other\[POINTS NQS  2012.XLS]Super Stock'!$F53=0," ",'\\ser\software\other\[POINTS NQS  2012.XLS]Super Stock'!$F53) -> Mechanical Nightmare | O49: ='\\ser\software\other\[POINTS NQS  2012.XLS]Super Stock'!$AA53 -> 156
A50: ='\\ser\software\other\[POINTS NQS  2012.XLS]Pro Stock'!$A54 -> 48 | B50: ='\\ser\software\other\[POINTS NQS  2012.XLS]Pro Stock'!$B54 -> Mark Conover | C50: ='\\ser\software\other\[POINTS NQS  2012.XLS]Pro Stock'!$C54 -> Edinburg, Ind | D50: ='\\ser\software\other\[POINTS NQS  2012.XLS]Pro Stock'!$D54 -> VM | E50: ='\\ser\software\other\[POINTS NQS  2012.XLS]Pro Stock'!$E54 -> 360 | F50: =IF('\\ser\software\other\[POINTS NQS  2012.XLS]Pro Stock'!$F54=0," ",'\\ser\software\other\[POINTS NQS  2012.XLS]Pro Stock'!$F54) -> VuDoo Too | G50: ='\\ser\software\other\[POINTS NQS  2012.XLS]Pro Stock'!$AA54 -> 142 | I50: ='\\ser\software\other\[POINTS NQS  2012.XLS]Super Stock'!$A54 -> 48 | J50: ='\\ser\software\other\[POINTS NQS  2012.XLS]Super Stock'!$B54 -> Brian Titzer | K50: ='\\ser\software\other\[POINTS NQS  2012.XLS]Super Stock'!$C54 -> Evansville, IN | L50: ='\\ser\software\other\[POINTS NQS  2012.XLS]Super Stock'!$D54 -> TC | M50: ='\\ser\software\other\[POINTS NQS  2012.XLS]Super Stock'!$E54 -> 364 | N50: =IF('\\ser\software\other\[POINTS NQS  2012.XLS]Super Stock'!$F54=0," ",'\\ser\software\other\[POINTS NQS  2012.XLS]Super Stock'!$F54) -> Single Boys Toy | O50: ='\\ser\software\other\[POINTS NQS  2012.XLS]Super Stock'!$AA54 -> 157
A51: ='\\ser\software\other\[POINTS NQS  2012.XLS]Pro Stock'!$A55 -> 49 | B51: ='\\ser\software\other\[POINTS NQS  2012.XLS]Pro Stock'!$B55 -> Ron Scroggins | C51: ='\\ser\software\other\[POINTS NQS  2012.XLS]Pro Stock'!$C55 -> Neosho, Mo | D51: ='\\ser\software\other\[POINTS NQS  2012.XLS]Pro Stock'!$D55 -> VM | E51: ='\\ser\software\other\[POINTS NQS  2012.XLS]Pro Stock'!$E55 -> 111 | F51: =IF('\\ser\software\other\[POINTS NQS  2012.XLS]Pro Stock'!$F55=0," ",'\\ser\software\other\[POINTS NQS  2012.XLS]Pro Stock'!$F55) -> Black Out | G51: ='\\ser\software\other\[POINTS NQS  2012.XLS]Pro Stock'!$AA55 -> 143 | I51: ='\\ser\software\other\[POINTS NQS  2012.XLS]Super Stock'!$A55 -> 49 | J51: ='\\ser\software\other\[POINTS NQS  2012.XLS]Super Stock'!$B55 -> Mike Spencer | K51: ='\\ser\software\other\[POINTS NQS  2012.XLS]Super Stock'!$C55 -> West Alexandria, OH | L51: ='\\ser\software\other\[POINTS NQS  2012.XLS]Super Stock'!$D55 -> MVP | M51: ='\\ser\software\other\[POINTS NQS  2012.XLS]Super Stock'!$E55 -> 517 | N51: =IF('\\ser\software\other\[POINTS NQS  2012.XLS]Super Stock'!$F55=0," ",'\\ser\software\other\[POINTS NQS  2012.XLS]Super Stock'!$F55) -> Half Pint | O51: ='\\ser\software\other\[POINTS NQS  2012.XLS]Super Stock'!$AA55 -> 157
A52: ='\\ser\software\other\[POINTS NQS  2012.XLS]Pro Stock'!$A56 -> 50 | B52: ='\\ser\software\other\[POINTS NQS  2012.XLS]Pro Stock'!$B56 -> David Knapp | C52: ='\\ser\software\other\[POINTS NQS  2012.XLS]Pro Stock'!$C56 -> Putnam, Ill | D52: ='\\ser\software\other\[POINTS NQS  2012.XLS]Pro Stock'!$D56 -> MVP | E52: ='\\ser\software\other\[POINTS NQS  2012.XLS]Pro Stock'!$E56 -> 381 | F52: =IF('\\ser\software\other\[POINTS NQS  2012.XLS]Pro Stock'!$F56=0," ",'\\ser\software\other\[POINTS NQS  2012.XLS]Pro Stock'!$F56) -> Knapp Time | G52: ='\\ser\software\other\[POINTS NQS  2012.XLS]Pro Stock'!$AA56 -> 143 | I52: ='\\ser\software\other\[POINTS NQS  2012.XLS]Super Stock'!$A56 -> 50 | J52: ='\\ser\software\other\[POINTS NQS  2012.XLS]Super Stock'!$B56 -> Ron Marcine | K52: ='\\ser\software\other\[POINTS NQS  2012.XLS]Super Stock'!$C56 -> Whitehouse Station, NJ | L52: ='\\ser\software\other\[POINTS NQS  2012.XLS]Super Stock'!$D56 -> MVP | M52: ='\\ser\software\other\[POINTS NQS  2012.XLS]Super Stock'!$E56 -> 245 | N52: =IF('\\ser\software\other\[POINTS NQS  2012.XLS]Super Stock'!$F56=0," ",'\\ser\software\other\[POINTS NQS  2012.XLS]Super Stock'!$F56) -> No Pressure | O52: ='\\ser\software\other\[POINTS NQS  2012.XLS]Super Stock'!$AA56 -> 158
A53: ='\\ser\software\other\[POINTS NQS  2012.XLS]Pro Stock'!$A57 -> 51 | B53: ='\\ser\software\other\[POINTS NQS  2012.XLS]Pro Stock'!$B57 -> Charlie Ciolino | C53: ='\\ser\software\other\[POINTS NQS  2012.XLS]Pro Stock'!$C57 -> Hammond, LA | D53: ='\\ser\software\other\[POINTS NQS  2012.XLS]Pro Stock'!$D57 -> MVP | E53: ='\\ser\software\other\[POINTS NQS  2012.XLS]Pro Stock'!$E57 -> 145 | F53: =IF('\\ser\software\other\[POINTS NQS  2012.XLS]Pro Stock'!$F57=0," ",'\\ser\software\other\[POINTS NQS  2012.XLS]Pro Stock'!$F57) -> Mechanical Nitemare | G53: ='\\ser\software\other\[POINTS NQS  2012.XLS]Pro Stock'!$AA57 -> 144 | I53: ='\\ser\software\other\[POINTS NQS  2012.XLS]Super Stock'!$A57 -> 51 | J53: ='\\ser\software\other\[POINTS NQS  2012.XLS]Super Stock'!$B57 -> Ron Scroggins | K53: ='\\ser\software\other\[POINTS NQS  2012.XLS]Super Stock'!$C57 -> Neosho, MO | L53: ='\\ser\software\other\[POINTS NQS  2012.XLS]Super Stock'!$D57 -> VM | M53: ='\\ser\software\other\[POINTS NQS  2012.XLS]Super Stock'!$E57 -> 111 | N53: =IF('\\ser\software\other\[POINTS NQS  2012.XLS]Super Stock'!$F57=0," ",'\\ser\software\other\[POINTS NQS  2012.XLS]Super Stock'!$F57) -> Black out | O53: ='\\ser\software\other\[POINTS NQS  2012.XLS]Super Stock'!$AA57 -> 162
A54: ='\\ser\software\other\[POINTS NQS  2012.XLS]Pro Stock'!$A58 -> 52 | B54: ='\\ser\software\other\[POINTS NQS  2012.XLS]Pro Stock'!$B58 -> Michael Ciolino | C54: ='\\ser\software\other\[POINTS NQS  2012.XLS]Pro Stock'!$C58 -> Hammond, LA | D54: ='\\ser\software\other\[POINTS NQS  2012.XLS]Pro Stock'!$D58 -> MVP | E54: ='\\ser\software\other\[POINTS NQS  2012.XLS]Pro Stock'!$E58 -> 146 | F54: =IF('\\ser\software\other\[POINTS NQS  2012.XLS]Pro Stock'!$F58=0," ",'\\ser\software\other\[POINTS NQS  2012.XLS]Pro Stock'!$F58) -> Mechanical Animal | G54: ='\\ser\software\other\[POINTS NQS  2012.XLS]Pro Stock'!$AA58 -> 144 | I54: ='\\ser\software\other\[POINTS NQS  2012.XLS]Super Stock'!$A58 -> 52 | J54: ='\\ser\software\other\[POINTS NQS  2012.XLS]Super Stock'!$B58 -> Bill Richerson | K54: ='\\ser\software\other\[POINTS NQS  2012.XLS]Super Stock'!$C58 -> Crittenden, Ky | L54: ='\\ser\software\other\[POINTS NQS  2012.XLS]Super Stock'!$D58 -> JW | M54: ='\\ser\software\other\[POINTS NQS  2012.XLS]Super Stock'!$E58 -> 132 | N54: =IF('\\ser\software\other\[POINTS NQS  2012.XLS]Super Stock'!$F58=0," ",'\\ser\software\other\[POINTS NQS  2012.XLS]Super Stock'!$F58) ->  | O54: ='\\ser\software\other\[POINTS NQS  2012.XLS]Super Stock'!$AA58 -> 162
A55: ='\\ser\software\other\[POINTS NQS  2012.XLS]Pro Stock'!$A59 -> 53 | B55: ='\\ser\software\other\[POINTS NQS  2012.XLS]Pro Stock'!$B59 -> Ray Gentz | C55: ='\\ser\software\other\[POINTS NQS  2012.XLS]Pro Stock'!$C59 -> Colon, Mich | D55: ='\\ser\software\other\[POINTS NQS  2012.XLS]Pro Stock'!$D59 -> VM | E55: ='\\ser\software\other\[POINTS NQS  2012.XLS]Pro Stock'!$E59 -> 34 | F55: =IF('\\ser\software\other\[POINTS NQS  2012.XLS]Pro Stock'!$F59=0," ",'\\ser\software\other\[POINTS NQS  2012.XLS]Pro Stock'!$F59) ->  | G55: ='\\ser\software\other\[POINTS NQS  2012.XLS]Pro Stock'!$AA59 -> 145 | I55: ='\\ser\software\other\[POINTS NQS  2012.XLS]Super Stock'!$A59 -> 53 | J55: ='\\ser\software\other\[POINTS NQS  2012.XLS]Super Stock'!$B59 -> Clyde Mishler | K55: ='\\ser\software\other\[POINTS NQS  2012.XLS]Super Stock'!$C59 -> Washington, IL | L55: ='\\ser\software\other\[POINTS NQS  2012.XLS]Super Stock'!$D59 -> GTP | M55: ='\\ser\software\other\[POINTS NQS  2012.XLS]Super Stock'!$E59 -> 168 | N55: =IF('\\ser\software\other\[POINTS NQS  2012.XLS]Super Stock'!$F59=0," ",'\\ser\software\other\[POINTS NQS  2012.XLS]Super Stock'!$F59) ->  | O55: ='\\ser\software\other\[POINTS NQS  2012.XLS]Super Stock'!$AA59 -> 162
A56: ='\\ser\software\other\[POINTS NQS  2012.XLS]Pro Stock'!$A60 -> 54 | B56: ='\\ser\software\other\[POINTS NQS  2012.XLS]Pro Stock'!$B60 -> Bradley Corzine | C56: ='\\ser\software\other\[POINTS NQS  2012.XLS]Pro Stock'!$C60 -> Dongola, ILL | D56: ='\\ser\software\other\[POINTS NQS  2012.XLS]Pro Stock'!$D60 -> JW | E56: ='\\ser\software\other\[POINTS NQS  2012.XLS]Pro Stock'!$E60 -> 477 | F56: =IF('\\ser\software\other\[POINTS NQS  2012.XLS]Pro Stock'!$F60=0," ",'\\ser\software\other\[POINTS NQS  2012.XLS]Pro Stock'!$F60) -> Black Cat | G56: ='\\ser\software\other\[POINTS NQS  2012.XLS]Pro Stock'!$AA60 -> 145 | I56: ='\\ser\software\other\[POINTS NQS  2012.XLS]Super Stock'!$A60 -> 54 | J56: ='\\ser\software\other\[POINTS NQS  2012.XLS]Super Stock'!$B60 -> Todd Hammond | K56: ='\\ser\software\other\[POINTS NQS  2012.XLS]Super Stock'!$C60 -> Falling Waters, WV | L56: ='\\ser\software\other\[POINTS NQS  2012.XLS]Super Stock'!$D60 -> JRS | M56: ='\\ser\software\other\[POINTS NQS  2012.XLS]Super Stock'!$E60 -> 301 | N56: =IF('\\ser\software\other\[POINTS NQS  2012.XLS]Super Stock'!$F60=0," ",'\\ser\software\other\[POINTS NQS  2012.XLS]Super Stock'!$F60) -> Punisher | O56: ='\\ser\software\other\[POINTS NQS  2012.XLS]Super Stock'!$AA60 -> 163
A57: ='\\ser\software\other\[POINTS NQS  2012.XLS]Pro Stock'!$A61 -> 55 | B57: ='\\ser\software\other\[POINTS NQS  2012.XLS]Pro Stock'!$B61 -> Nevin Stitzer | C57: ='\\ser\software\other\[POINTS NQS  2012.XLS]Pro Stock'!$C61 -> Spring Mills, PA | D57: ='\\ser\software\other\[POINTS NQS  2012.XLS]Pro Stock'!$D61 ->  | E57: ='\\ser\software\other\[POINTS NQS  2012.XLS]Pro Stock'!$E61 -> 447 | F57: =IF('\\ser\software\other\[POINTS NQS  2012.XLS]Pro Stock'!$F61=0," ",'\\ser\software\other\[POINTS NQS  2012.XLS]Pro Stock'!$F61) -> Thunder Road II | G57: ='\\ser\software\other\[POINTS NQS  2012.XLS]Pro Stock'!$AA61 -> 146 | I57: ='\\ser\software\other\[POINTS NQS  2012.XLS]Super Stock'!$A61 -> 55 | J57: ='\\ser\software\other\[POINTS NQS  2012.XLS]Super Stock'!$B61 -> Larry Korff | K57: ='\\ser\software\other\[POINTS NQS  2012.XLS]Super Stock'!$C61 -> Evansville, IN | L57: ='\\ser\software\other\[POINTS NQS  2012.XLS]Super Stock'!$D61 -> TC | M57: ='\\ser\software\other\[POINTS NQS  2012.XLS]Super Stock'!$E61 -> 398 | N57: =IF('\\ser\software\other\[POINTS NQS  2012.XLS]Super Stock'!$F61=0," ",'\\ser\software\other\[POINTS NQS  2012.XLS]Super Stock'!$F61) -> Kryptonite | O57: ='\\ser\software\other\[POINTS NQS  2012.XLS]Super Stock'!$AA61 -> 163
A58: ='\\ser\software\other\[POINTS NQS  2012.XLS]Pro Stock'!$A62 -> 56 | B58: ='\\ser\software\other\[POINTS NQS  2012.XLS]Pro Stock'!$B62 -> David Mascher SR | C58: ='\\ser\software\other\[POINTS NQS  2012.XLS]Pro Stock'!$C62 -> Mooresville, Ind | D58: ='\\ser\software\other\[POINTS NQS  2012.XLS]Pro Stock'!$D62 -> Mascher | E58: ='\\ser\software\other\[POINTS NQS  2012.XLS]Pro Stock'!$E62 -> 512 | F58: =IF('\\ser\software\other\[POINTS NQS  2012.XLS]Pro Stock'!$F62=0," ",'\\ser\software\other\[POINTS NQS  2012.XLS]Pro Stock'!$F62) ->  | G58: ='\\ser\software\other\[POINTS NQS  2012.XLS]Pro Stock'!$AA62 -> 151 | I58: ='\\ser\software\other\[POINTS NQS  2012.XLS]Super Stock'!$A62 -> 56 | J58: ='\\ser\software\other\[POINTS NQS  2012.XLS]Super Stock'!$B62 -> Nick Mishler | K58: ='\\ser\software\other\[POINTS NQS  2012.XLS]Super Stock'!$C62 -> East Peoria, IL | L58: ='\\ser\software\other\[POINTS NQS  2012.XLS]Super Stock'!$D62 -> GTP | M58: ='\\ser\software\other\[POINTS NQS  2012.XLS]Super Stock'!$E62 -> 167 | N58: =IF('\\ser\software\other\[POINTS NQS  2012.XLS]Super Stock'!$F62=0," ",'\\ser\software\other\[POINTS NQS  2012.XLS]Super Stock'!$F62) -> Pulse | O58: ='\\ser\software\other\[POINTS NQS  2012.XLS]Super Stock'!$AA62 -> 164
A59: ='\\ser\software\other\[POINTS NQS  2012.XLS]Pro Stock'!$A63 -> 57 | B59: ='\\ser\software\other\[POINTS NQS  2012.XLS]Pro Stock'!$B63 -> Kevin Root | C59: ='\\ser\software\other\[POINTS NQS  2012.XLS]Pro Stock'!$C63 -> Inola, Okla | D59: ='\\ser\software\other\[POINTS NQS  2012.XLS]Pro Stock'!$D63 -> Root | E59: ='\\ser\software\other\[POINTS NQS  2012.XLS]Pro Stock'!$E63 -> 117 | F59: =IF('\\ser\software\other\[POINTS NQS  2012.XLS]Pro Stock'!$F63=0," ",'\\ser\software\other\[POINTS NQS  2012.XLS]Pro Stock'!$F63) -> Right on the Money | G59: ='\\ser\software\other\[POINTS NQS  2012.XLS]Pro Stock'!$AA63 -> 160 | I59: ='\\ser\software\other\[POINTS NQS  2012.XLS]Super Stock'!$A63 -> 57 | J59: ='\\ser\software\other\[POINTS NQS  2012.XLS]Super Stock'!$B63 -> Matt Kaster | K59: ='\\ser\software\other\[POINTS NQS  2012.XLS]Super Stock'!$C63 -> Burlington, WI | L59: ='\\ser\software\other\[POINTS NQS  2012.XLS]Super Stock'!$D63 -> MVP | M59: ='\\ser\software\other\[POINTS NQS  2012.XLS]Super Stock'!$E63 -> 98 | N59: =IF('\\ser\software\other\[POINTS NQS  2012.XLS]Super Stock'!$F63=0," ",'\\ser\software\other\[POINTS NQS  2012.XLS]Super Stock'!$F63) -> Moose on the Loose | O59: ='\\ser\software\other\[POINTS NQS  2012.XLS]Super Stock'!$AA63 -> 165
A60: ='\\ser\software\other\[POINTS NQS  2012.XLS]Pro Stock'!$A64 -> 58 | B60: ='\\ser\software\other\[POINTS NQS  2012.XLS]Pro Stock'!$B64 -> Mike Dockhan | C60: ='\\ser\software\other\[POINTS NQS  2012.XLS]Pro Stock'!$C64 -> Imlay City, Mich | D60: ='\\ser\software\other\[POINTS NQS  2012.XLS]Pro Stock'!$D64 -> 0 | E60: ='\\ser\software\other\[POINTS NQS  2012.XLS]Pro Stock'!$E64 -> 530 | F60: =IF('\\ser\software\other\[POINTS NQS  2012.XLS]Pro Stock'!$F64=0," ",'\\ser\software\other\[POINTS NQS  2012.XLS]Pro Stock'!$F64) -> Plain Blue | G60: ='\\ser\software\other\[POINTS NQS  2012.XLS]Pro Stock'!$AA64 -> 160 | I60: ='\\ser\software\other\[POINTS NQS  2012.XLS]Super Stock'!$A64 -> 58 | J60: ='\\ser\software\other\[POINTS NQS  2012.XLS]Super Stock'!$B64 -> Todd Hammond | K60: ='\\ser\software\other\[POINTS NQS  2012.XLS]Super Stock'!$C64 -> Falling Waters, WV | L60: ='\\ser\software\other\[POINTS NQS  2012.XLS]Super Stock'!$D64 -> JRS | M60: ='\\ser\software\other\[POINTS NQS  2012.XLS]Super Stock'!$E64 -> 241 | N60: =IF('\\ser\software\other\[POINTS NQS  2012.XLS]Super Stock'!$F64=0," ",'\\ser\software\other\[POINTS NQS  2012.XLS]Super Stock'!$F64) -> Problem Child | O60: ='\\ser\software\other\[POINTS NQS  2012.XLS]Super Stock'!$AA64 -> 165
A61: ='\\ser\software\other\[POINTS NQS  2012.XLS]Pro Stock'!$A65 -> 59 | B61: ='\\ser\software\other\[POINTS NQS  2012.XLS]Pro Stock'!$B65 -> Steve Williford | C61: ='\\ser\software\other\[POINTS NQS  2012.XLS]Pro Stock'!$C65 -> Englehard, NC | D61: ='\\ser\software\other\[POINTS NQS  2012.XLS]Pro Stock'!$D65 -> MVP | E61: ='\\ser\software\other\[POINTS NQS  2012.XLS]Pro Stock'!$E65 -> 273 | F61: =IF('\\ser\software\other\[POINTS NQS  2012.XLS]Pro Stock'!$F65=0," ",'\\ser\software\other\[POINTS NQS  2012.XLS]Pro Stock'!$F65) -> IH Express | G61: ='\\ser\software\other\[POINTS NQS  2012.XLS]Pro Stock'!$AA65 -> 161 | I61: ='\\ser\software\other\[POINTS NQS  2012.XLS]Super Stock'!$A65 -> 59 | J61: ='\\ser\software\other\[POINTS NQS  2012.XLS]Super Stock'!$B65 -> Ray Gentz | K61: ='\\ser\software\other\[POINTS NQS  2012.XLS]Super Stock'!$C65 -> Colon, MI | L61: ='\\ser\software\other\[POINTS NQS  2012.XLS]Super Stock'!$D65 -> JRS | M61: ='\\ser\software\other\[POINTS NQS  2012.XLS]Super Stock'!$E65 -> 35 | N61: =IF('\\ser\software\other\[POINTS NQS  2012.XLS]Super Stock'!$F65=0," ",'\\ser\software\other\[POINTS NQS  2012.XLS]Super Stock'!$F65) -> B.U. Cub | O61: ='\\ser\software\other\[POINTS NQS  2012.XLS]Super Stock'!$AA65 -> 166
A62: ='\\ser\software\other\[POINTS NQS  2012.XLS]Pro Stock'!$A66 -> 60 | B62: ='\\ser\software\other\[POINTS NQS  2012.XLS]Pro Stock'!$B66 -> Richard Lucanbaugh | C62: ='\\ser\software\other\[POINTS NQS  2012.XLS]Pro Stock'!$C66 -> Glen Rock, Pa | D62: ='\\ser\software\other\[POINTS NQS  2012.XLS]Pro Stock'!$D66 -> NP | E62: ='\\ser\software\other\[POINTS NQS  2012.XLS]Pro Stock'!$E66 -> 494 | F62: =IF('\\ser\software\other\[POINTS NQS  2012.XLS]Pro Stock'!$F66=0," ",'\\ser\software\other\[POINTS NQS  2012.XLS]Pro Stock'!$F66) -> Cub | G62: ='\\ser\software\other\[POINTS NQS  2012.XLS]Pro Stock'!$AA66 -> 161 | I62: ='\\ser\software\other\[POINTS NQS  2012.XLS]Super Stock'!$A66 -> 60 | J62: ='\\ser\software\other\[POINTS NQS  2012.XLS]Super Stock'!$B66 -> Mark Davis | K62: ='\\ser\software\other\[POINTS NQS  2012.XLS]Super Stock'!$C66 -> Lower Salem, Oh | L62: ='\\ser\software\other\[POINTS NQS  2012.XLS]Super Stock'!$D66 -> JRS | M62: ='\\ser\software\other\[POINTS NQS  2012.XLS]Super Stock'!$E66 -> 67 | N62: =IF('\\ser\software\other\[POINTS NQS  2012.XLS]Super Stock'!$F66=0," ",'\\ser\software\other\[POINTS NQS  2012.XLS]Super Stock'!$F66) -> No Limits | O62: ='\\ser\software\other\[POINTS NQS  2012.XLS]Super Stock'!$AA66 -> 167
A63: ='\\ser\software\other\[POINTS NQS  2012.XLS]Pro Stock'!$A67 -> 61 | B63: ='\\ser\software\other\[POINTS NQS  2012.XLS]Pro Stock'!$B67 -> Matt Dirksen | C63: ='\\ser\software\other\[POINTS NQS  2012.XLS]Pro Stock'!$C67 -> Alma, Ont CDA | D63: ='\\ser\software\other\[POINTS NQS  2012.XLS]Pro Stock'!$D67 -> MVP | E63: ='\\ser\software\other\[POINTS NQS  2012.XLS]Pro Stock'!$E67 -> 551 | F63: =IF('\\ser\software\other\[POINTS NQS  2012.XLS]Pro Stock'!$F67=0," ",'\\ser\software\other\[POINTS NQS  2012.XLS]Pro Stock'!$F67) -> Armed & Dangerous | G63: ='\\ser\software\other\[POINTS NQS  2012.XLS]Pro Stock'!$AA67 -> 161 | I63: ='\\ser\software\other\[POINTS NQS  2012.XLS]Super Stock'!$A67 -> 61 | J63: ='\\ser\software\other\[POINTS NQS  2012.XLS]Super Stock'!$B67 -> Dan Schell | K63: ='\\ser\software\other\[POINTS NQS  2012.XLS]Super Stock'!$C67 -> Darien, WI | L63: ='\\ser\software\other\[POINTS NQS  2012.XLS]Super Stock'!$D67 -> MVP | M63: ='\\ser\software\other\[POINTS NQS  2012.XLS]Super Stock'!$E67 -> 375 | N63: =IF('\\ser\software\other\[POINTS NQS  2012.XLS]Super Stock'!$F67=0," ",'\\ser\software\other\[POINTS NQS  2012.XLS]Super Stock'!$F67) -> Blind Ambition | O63: ='\\ser\software\other\[POINTS NQS  2012.XLS]Super Stock'!$AA67 -> 167
A64: ='\\ser\software\other\[POINTS NQS  2012.XLS]Pro Stock'!$A68 -> 62 | B64: ='\\ser\software\other\[POINTS NQS  2012.XLS]Pro Stock'!$B68 -> Julian Stahl | C64: ='\\ser\software\other\[POINTS NQS  2012.XLS]Pro Stock'!$C68 -> Welton, IA | D64: ='\\ser\software\other\[POINTS NQS  2012.XLS]Pro Stock'!$D68 -> MVP | E64: ='\\ser\software\other\[POINTS NQS  2012.XLS]Pro Stock'!$E68 -> 2 | F64: =IF('\\ser\software\other\[POINTS NQS  2012.XLS]Pro Stock'!$F68=0," ",'\\ser\software\other\[POINTS NQS  2012.XLS]Pro Stock'!$F68) -> MWSC #2 | G64: ='\\ser\software\other\[POINTS NQS  2012.XLS]Pro Stock'!$AA68 -> 162 | I64: ='\\ser\software\other\[POINTS NQS  2012.XLS]Super Stock'!$A68 -> 62 | J64: ='\\ser\software\other\[POINTS NQS  2012.XLS]Super Stock'!$B68 -> Bradley Corzine | K64: ='\\ser\software\other\[POINTS NQS  2012.XLS]Super Stock'!$C68 -> Dongola, IL | L64: ='\\ser\software\other\[POINTS NQS  2012.XLS]Super Stock'!$D68 -> JW | M64: ='\\ser\software\other\[POINTS NQS  2012.XLS]Super Stock'!$E68 -> 509 | N64: =IF('\\ser\software\other\[POINTS NQS  2012.XLS]Super Stock'!$F68=0," ",'\\ser\software\other\[POINTS NQS  2012.XLS]Super Stock'!$F68) -> Just Black | O64: ='\\ser\software\other\[POINTS NQS  2012.XLS]Super Stock'!$AA68 -> 171
A65: ='\\ser\software\other\[POINTS NQS  2012.XLS]Pro Stock'!$A69 -> 63 | B65: ='\\ser\software\other\[POINTS NQS  2012.XLS]Pro Stock'!$B69 -> Vicki Scroggins | C65: ='\\ser\software\other\[POINTS NQS  2012.XLS]Pro Stock'!$C69 -> Neosho, Mo | D65: ='\\ser\software\other\[POINTS NQS  2012.XLS]Pro Stock'!$D69 -> VM | E65: ='\\ser\software\other\[POINTS NQS  2012.XLS]Pro Stock'!$E69 -> 112 | F65: =IF('\\ser\software\other\[POINTS NQS  2012.XLS]Pro Stock'!$F69=0," ",'\\ser\software\other\[POINTS NQS  2012.XLS]Pro Stock'!$F69) -> Lil' American | G65: ='\\ser\software\other\[POINTS NQS  2012.XLS]Pro Stock'!$AA69 -> 162 | I65: ='\\ser\software\other\[POINTS NQS  2012.XLS]Super Stock'!$A69 -> 63 | J65: ='\\ser\software\other\[POINTS NQS  2012.XLS]Super Stock'!$B69 -> Ray Gentz | K65: ='\\ser\software\other\[POINTS NQS  2012.XLS]Super Stock'!$C69 -> Colon, MI | L65: ='\\ser\software\other\[POINTS NQS  2012.XLS]Super Stock'!$D69 -> JRS | M65: ='\\ser\software\other\[POINTS NQS  2012.XLS]Super Stock'!$E69 -> 262 | N65: =IF('\\ser\software\other\[POINTS NQS  2012.XLS]Super Stock'!$F69=0," ",'\\ser\software\other\[POINTS NQS  2012.XLS]Super Stock'!$F69) -> Chaos | O65: ='\\ser\software\other\[POINTS NQS  2012.XLS]Super Stock'!$AA69 -> 172 | Q65: 0
A66: ='\\ser\software\other\[POINTS NQS  2012.XLS]Pro Stock'!$A70 -> 64 | B66: ='\\ser\software\other\[POINTS NQS  2012.XLS]Pro Stock'!$B70 -> Larry Frederick | C66: ='\\ser\software\other\[POINTS NQS  2012.XLS]Pro Stock'!$C70 -> New Castle, Pa | D66: ='\\ser\software\other\[POINTS NQS  2012.XLS]Pro Stock'!$D70 -> LR | E66: ='\\ser\software\other\[POINTS NQS  2012.XLS]Pro Stock'!$E70 -> 297 | F66: =IF('\\ser\software\other\[POINTS NQS  2012.XLS]Pro Stock'!$F70=0," ",'\\ser\software\other\[POINTS NQS  2012.XLS]Pro Stock'!$F70) -> Burning U | G66: ='\\ser\software\other\[POINTS NQS  2012.XLS]Pro Stock'!$AA70 -> 162 | I66: ='\\ser\software\other\[POINTS NQS  2012.XLS]Super Stock'!$A70 -> 64 | J66: ='\\ser\software\other\[POINTS NQS  2012.XLS]Super Stock'!$B70 -> David Mascher Jr | K66: ='\\ser\software\other\[POINTS NQS  2012.XLS]Super Stock'!$C70 -> Beech Grove, IN | L66: ='\\ser\software\other\[POINTS NQS  2012.XLS]Super Stock'!$D70 -> Mascher | M66: ='\\ser\software\other\[POINTS NQS  2012.XLS]Super Stock'!$E70 -> 163 | N66: =IF('\\ser\software\other\[POINTS NQS  2012.XLS]Super Stock'!$F70=0," ",'\\ser\software\other\[POINTS NQS  2012.XLS]Super Stock'!$F70) -> Thunder Pumpkin | O66: ='\\ser\software\other\[POINTS NQS  2012.XLS]Super Stock'!$AA70 -> 173
A67: ='\\ser\software\other\[POINTS NQS  2012.XLS]Pro Stock'!$A71 -> 65 | B67: ='\\ser\software\other\[POINTS NQS  2012.XLS]Pro Stock'!$B71 -> Doug Diehl | C67: ='\\ser\software\other\[POINTS NQS  2012.XLS]Pro Stock'!$C71 -> Smithsburg, Md | D67: ='\\ser\software\other\[POINTS NQS  2012.XLS]Pro Stock'!$D71 -> NP | E67: ='\\ser\software\other\[POINTS NQS  2012.XLS]Pro Stock'!$E71 -> 385 | F67: =IF('\\ser\software\other\[POINTS NQS  2012.XLS]Pro Stock'!$F71=0," ",'\\ser\software\other\[POINTS NQS  2012.XLS]Pro Stock'!$F71) -> Eliminator | G67: ='\\ser\software\other\[POINTS NQS  2012.XLS]Pro Stock'!$AA71 -> 162 | I67: ='\\ser\software\other\[POINTS NQS  2012.XLS]Super Stock'!$A71 -> 65 | J67: ='\\ser\software\other\[POINTS NQS  2012.XLS]Super Stock'!$B71 -> Julian Stahl | K67: ='\\ser\software\other\[POINTS NQS  2012.XLS]Super Stock'!$C71 -> Welton, IA | L67: ='\\ser\software\other\[POINTS NQS  2012.XLS]Super Stock'!$D71 -> MVP | M67: ='\\ser\software\other\[POINTS NQS  2012.XLS]Super Stock'!$E71 -> 1 | N67: =IF('\\ser\software\other\[POINTS NQS  2012.XLS]Super Stock'!$F71=0," ",'\\ser\software\other\[POINTS NQS  2012.XLS]Super Stock'!$F71) -> MWSC # 1 | O67: ='\\ser\software\other\[POINTS NQS  2012.XLS]Super Stock'!$AA71 -> 181
A68: ='\\ser\software\other\[POINTS NQS  2012.XLS]Pro Stock'!$A72 -> 66 | B68: ='\\ser\software\other\[POINTS NQS  2012.XLS]Pro Stock'!$B72 -> Doug Diehl | C68: ='\\ser\software\other\[POINTS NQS  2012.XLS]Pro Stock'!$C72 -> Smithsburg, Md | D68: ='\\ser\software\other\[POINTS NQS  2012.XLS]Pro Stock'!$D72 -> NP | E68: ='\\ser\software\other\[POINTS NQS  2012.XLS]Pro Stock'!$E72 -> 441 | F68: =IF('\\ser\software\other\[POINTS NQS  2012.XLS]Pro Stock'!$F72=0," ",'\\ser\software\other\[POINTS NQS  2012.XLS]Pro Stock'!$F72) -> Excedrin | G68: ='\\ser\software\other\[POINTS NQS  2012.XLS]Pro Stock'!$AA72 -> 162 | I68: ='\\ser\software\other\[POINTS NQS  2012.XLS]Super Stock'!$A72 -> 66 | J68: ='\\ser\software\other\[POINTS NQS  2012.XLS]Super Stock'!$B72 -> Larry Frederick | K68: ='\\ser\software\other\[POINTS NQS  2012.XLS]Super Stock'!$C72 -> New Castle, Pa | L68: ='\\ser\software\other\[POINTS NQS  2012.XLS]Super Stock'!$D72 -> LR | M68: ='\\ser\software\other\[POINTS NQS  2012.XLS]Super Stock'!$E72 -> 297 | N68: =IF('\\ser\software\other\[POINTS NQS  2012.XLS]Super Stock'!$F72=0," ",'\\ser\software\other\[POINTS NQS  2012.XLS]Super Stock'!$F72) -> Burnin U | O68: ='\\ser\software\other\[POINTS NQS  2012.XLS]Super Stock'!$AA72 -> 181
A69: ='\\ser\software\other\[POINTS NQS  2012.XLS]Pro Stock'!$A73 -> 67 | B69: ='\\ser\software\other\[POINTS NQS  2012.XLS]Pro Stock'!$B73 -> Mark Davis | C69: ='\\ser\software\other\[POINTS NQS  2012.XLS]Pro Stock'!$C73 -> Lower Salem, Oh | D69: ='\\ser\software\other\[POINTS NQS  2012.XLS]Pro Stock'!$D73 -> JS | E69: ='\\ser\software\other\[POINTS NQS  2012.XLS]Pro Stock'!$E73 -> 67 | F69: =IF('\\ser\software\other\[POINTS NQS  2012.XLS]Pro Stock'!$F73=0," ",'\\ser\software\other\[POINTS NQS  2012.XLS]Pro Stock'!$F73) -> No Limits | G69: ='\\ser\software\other\[POINTS NQS  2012.XLS]Pro Stock'!$AA73 -> 163 | I69: ='\\ser\software\other\[POINTS NQS  2012.XLS]Super Stock'!$A73 -> 67 | J69: ='\\ser\software\other\[POINTS NQS  2012.XLS]Super Stock'!$B73 -> Rick Slade | K69: ='\\ser\software\other\[POINTS NQS  2012.XLS]Super Stock'!$C73 -> Harveyville, KY | L69: ='\\ser\software\other\[POINTS NQS  2012.XLS]Super Stock'!$D73 -> JRS | M69: ='\\ser\software\other\[POINTS NQS  2012.XLS]Super Stock'!$E73 -> 467 | N69: =IF('\\ser\software\other\[POINTS NQS  2012.XLS]Super Stock'!$F73=0," ",'\\ser\software\other\[POINTS NQS  2012.XLS]Super Stock'!$F73) -> Ricochet | O69: ='\\ser\software\other\[POINTS NQS  2012.XLS]Super Stock'!$AA73 -> 181
A70: ='\\ser\software\other\[POINTS NQS  2012.XLS]Pro Stock'!$A74 -> 68 | B70: ='\\ser\software\other\[POINTS NQS  2012.XLS]Pro Stock'!$B74 -> Tooter Campbell | C70: ='\\ser\software\other\[POINTS NQS  2012.XLS]Pro Stock'!$C74 -> Owensboro, Ky | D70: ='\\ser\software\other\[POINTS NQS  2012.XLS]Pro Stock'!$D74 -> TC | E70: ='\\ser\software\other\[POINTS NQS  2012.XLS]Pro Stock'!$E74 -> 473 | F70: =IF('\\ser\software\other\[POINTS NQS  2012.XLS]Pro Stock'!$F74=0," ",'\\ser\software\other\[POINTS NQS  2012.XLS]Pro Stock'!$F74) -> Tractor Trash | G70: ='\\ser\software\other\[POINTS NQS  2012.XLS]Pro Stock'!$AA74 -> 163 | I70: ='\\ser\software\other\[POINTS NQS  2012.XLS]Super Stock'!$A74 -> 68 | J70: ='\\ser\software\other\[POINTS NQS  2012.XLS]Super Stock'!$B74 -> Bill Nippe | K70: ='\\ser\software\other\[POINTS NQS  2012.XLS]Super Stock'!$C74 -> Strasburg, IL | L70: ='\\ser\software\other\[POINTS NQS  2012.XLS]Super Stock'!$D74 -> JW | M70: ='\\ser\software\other\[POINTS NQS  2012.XLS]Super Stock'!$E74 -> 513 | N70: =IF('\\ser\software\other\[POINTS NQS  2012.XLS]Super Stock'!$F74=0," ",'\\ser\software\other\[POINTS NQS  2012.XLS]Super Stock'!$F74) -> Serious Business | O70: ='\\ser\software\other\[POINTS NQS  2012.XLS]Super Stock'!$AA74 -> 181
A71: ='\\ser\software\other\[POINTS NQS  2012.XLS]Pro Stock'!$A75 -> 69 | B71: ='\\ser\software\other\[POINTS NQS  2012.XLS]Pro Stock'!$B75 -> Michael Sour | C71: ='\\ser\software\other\[POINTS NQS  2012.XLS]Pro Stock'!$C75 -> Jeromesville, Oh | D71: ='\\ser\software\other\[POINTS NQS  2012.XLS]Pro Stock'!$D75 -> TH | E71: ='\\ser\software\other\[POINTS NQS  2012.XLS]Pro Stock'!$E75 -> 543 | F71: =IF('\\ser\software\other\[POINTS NQS  2012.XLS]Pro Stock'!$F75=0," ",'\\ser\software\other\[POINTS NQS  2012.XLS]Pro Stock'!$F75) -> Another Addiction | G71: ='\\ser\software\other\[POINTS NQS  2012.XLS]Pro Stock'!$AA75 -> 163 | I71: ='\\ser\software\other\[POINTS NQS  2012.XLS]Super Stock'!$A75 -> 69 | J71: ='\\ser\software\other\[POINTS NQS  2012.XLS]Super Stock'!$B75 -> Jake Gingerich | K71: ='\\ser\software\other\[POINTS NQS  2012.XLS]Super Stock'!$C75 -> Montgomery, Ind | L71: ='\\ser\software\other\[POINTS NQS  2012.XLS]Super Stock'!$D75 -> JW | M71: ='\\ser\software\other\[POINTS NQS  2012.XLS]Super Stock'!$E75 -> 17 | N71: =IF('\\ser\software\other\[POINTS NQS  2012.XLS]Super Stock'!$F75=0," ",'\\ser\software\other\[POINTS NQS  2012.XLS]Super Stock'!$F75) -> Silver Rocket | O71: ='\\ser\software\other\[POINTS NQS  2012.XLS]Super Stock'!$AA75 -> 182
A72: ='\\ser\software\other\[POINTS NQS  2012.XLS]Pro Stock'!$A76 -> 70 | B72: ='\\ser\software\other\[POINTS NQS  2012.XLS]Pro Stock'!$B76 -> Mike Kyle | C72: ='\\ser\software\other\[POINTS NQS  2012.XLS]Pro Stock'!$C76 -> Edinburg, Ind | D72: ='\\ser\software\other\[POINTS NQS  2012.XLS]Pro Stock'!$D76 -> VM | E72: ='\\ser\software\other\[POINTS NQS  2012.XLS]Pro Stock'!$E76 -> 394 | F72: =IF('\\ser\software\other\[POINTS NQS  2012.XLS]Pro Stock'!$F76=0," ",'\\ser\software\other\[POINTS NQS  2012.XLS]Pro Stock'!$F76) ->  | G72: ='\\ser\software\other\[POINTS NQS  2012.XLS]Pro Stock'!$AA76 -> 164 | I72: ='\\ser\software\other\[POINTS NQS  2012.XLS]Super Stock'!$A76 -> 70 | J72: ='\\ser\software\other\[POINTS NQS  2012.XLS]Super Stock'!$B76 -> John Cress | K72: ='\\ser\software\other\[POINTS NQS  2012.XLS]Super Stock'!$C76 -> Strasburg, IL | L72: ='\\ser\software\other\[POINTS NQS  2012.XLS]Super Stock'!$D76 -> JW | M72: ='\\ser\software\other\[POINTS NQS  2012.XLS]Super Stock'!$E76 -> 170 | N72: =IF('\\ser\software\other\[POINTS NQS  2012.XLS]Super Stock'!$F76=0," ",'\\ser\software\other\[POINTS NQS  2012.XLS]Super Stock'!$F76) -> Blitzed | O72: ='\\ser\software\other\[POINTS NQS  2012.XLS]Super Stock'!$AA76 -> 182
A73: ='\\ser\software\other\[POINTS NQS  2012.XLS]Pro Stock'!$A77 -> 71 | B73: ='\\ser\software\other\[POINTS NQS  2012.XLS]Pro Stock'!$B77 -> Dean Dubach | C73: ='\\ser\software\other\[POINTS NQS  2012.XLS]Pro Stock'!$C77 -> Decatur, Ind | D73: ='\\ser\software\other\[POINTS NQS  2012.XLS]Pro Stock'!$D77 -> LR | E73: ='\\ser\software\other\[POINTS NQS  2012.XLS]Pro Stock'!$E77 -> 532 | F73: =IF('\\ser\software\other\[POINTS NQS  2012.XLS]Pro Stock'!$F77=0," ",'\\ser\software\other\[POINTS NQS  2012.XLS]Pro Stock'!$F77) -> Red Cub | G73: ='\\ser\software\other\[POINTS NQS  2012.XLS]Pro Stock'!$AA77 -> 164 | I73: ='\\ser\software\other\[POINTS NQS  2012.XLS]Super Stock'!$A77 -> 71 | J73: ='\\ser\software\other\[POINTS NQS  2012.XLS]Super Stock'!$B77 -> John Cress | K73: ='\\ser\software\other\[POINTS NQS  2012.XLS]Super Stock'!$C77 -> Strasburg, IL | L73: ='\\ser\software\other\[POINTS NQS  2012.XLS]Super Stock'!$D77 -> JW | M73: ='\\ser\software\other\[POINTS NQS  2012.XLS]Super Stock'!$E77 -> 172 | N73: =IF('\\ser\software\other\[POINTS NQS  2012.XLS]Super Stock'!$F77=0," ",'\\ser\software\other\[POINTS NQS  2012.XLS]Super Stock'!$F77) -> Full Tilt | O73: ='\\ser\software\other\[POINTS NQS  2012.XLS]Super Stock'!$AA77 -> 182
A74: ='\\ser\software\other\[POINTS NQS  2012.XLS]Pro Stock'!$A78 -> 72 | B74: ='\\ser\software\other\[POINTS NQS  2012.XLS]Pro Stock'!$B78 -> Corey Gerber | C74: ='\\ser\software\other\[POINTS NQS  2012.XLS]Pro Stock'!$C78 -> Apple Creek, Oh | D74: ='\\ser\software\other\[POINTS NQS  2012.XLS]Pro Stock'!$D78 -> 0 | E74: ='\\ser\software\other\[POINTS NQS  2012.XLS]Pro Stock'!$E78 -> 538 | F74: =IF('\\ser\software\other\[POINTS NQS  2012.XLS]Pro Stock'!$F78=0," ",'\\ser\software\other\[POINTS NQS  2012.XLS]Pro Stock'!$F78) -> Red Rascal | G74: ='\\ser\software\other\[POINTS NQS  2012.XLS]Pro Stock'!$AA78 -> 164 | I74: ='\\ser\software\other\[POINTS NQS  2012.XLS]Super Stock'!$A78 -> 72 | J74: ='\\ser\software\other\[POINTS NQS  2012.XLS]Super Stock'!$B78 -> Mark Conover | K74: ='\\ser\software\other\[POINTS NQS  2012.XLS]Super Stock'!$C78 -> Edinburgh, IN | L74: ='\\ser\software\other\[POINTS NQS  2012.XLS]Super Stock'!$D78 -> VM | M74: ='\\ser\software\other\[POINTS NQS  2012.XLS]Super Stock'!$E78 -> 360 | N74: =IF('\\ser\software\other\[POINTS NQS  2012.XLS]Super Stock'!$F78=0," ",'\\ser\software\other\[POINTS NQS  2012.XLS]Super Stock'!$F78) -> VuDoo Too | O74: ='\\ser\software\other\[POINTS NQS  2012.XLS]Super Stock'!$AA78 -> 182
A75: ='\\ser\software\other\[POINTS NQS  2012.XLS]Pro Stock'!$A79 -> 73 | B75: ='\\ser\software\other\[POINTS NQS  2012.XLS]Pro Stock'!$B79 -> Michael Hunter | C75: ='\\ser\software\other\[POINTS NQS  2012.XLS]Pro Stock'!$C79 -> Catawissa, Pa | D75: ='\\ser\software\other\[POINTS NQS  2012.XLS]Pro Stock'!$D79 -> 0 | E75: ='\\ser\software\other\[POINTS NQS  2012.XLS]Pro Stock'!$E79 -> 541 | F75: =IF('\\ser\software\other\[POINTS NQS  2012.XLS]Pro Stock'!$F79=0," ",'\\ser\software\other\[POINTS NQS  2012.XLS]Pro Stock'!$F79) ->  | G75: ='\\ser\software\other\[POINTS NQS  2012.XLS]Pro Stock'!$AA79 -> 164 | I75: ='\\ser\software\other\[POINTS NQS  2012.XLS]Super Stock'!$A79 -> 73 | J75: ='\\ser\software\other\[POINTS NQS  2012.XLS]Super Stock'!$B79 -> Vicki Scroggins | K75: ='\\ser\software\other\[POINTS NQS  2012.XLS]Super Stock'!$C79 -> Neosho, MO | L75: ='\\ser\software\other\[POINTS NQS  2012.XLS]Super Stock'!$D79 -> VM | M75: ='\\ser\software\other\[POINTS NQS  2012.XLS]Super Stock'!$E79 -> 112 | N75: =IF('\\ser\software\other\[POINTS NQS  2012.XLS]Super Stock'!$F79=0," ",'\\ser\software\other\[POINTS NQS  2012.XLS]Super Stock'!$F79) -> Lil" American | O75: ='\\ser\software\other\[POINTS NQS  2012.XLS]Super Stock'!$AA79 -> 183
A76: ='\\ser\software\other\[POINTS NQS  2012.XLS]Pro Stock'!$A80 -> 74 | B76: ='\\ser\software\other\[POINTS NQS  2012.XLS]Pro Stock'!$B80 -> Todd Brest | C76: ='\\ser\software\other\[POINTS NQS  2012.XLS]Pro Stock'!$C80 -> Sharpsville, Pa | D76: ='\\ser\software\other\[POINTS NQS  2012.XLS]Pro Stock'!$D80 -> 0 | E76: ='\\ser\software\other\[POINTS NQS  2012.XLS]Pro Stock'!$E80 -> 272 | F76: =IF('\\ser\software\other\[POINTS NQS  2012.XLS]Pro Stock'!$F80=0," ",'\\ser\software\other\[POINTS NQS  2012.XLS]Pro Stock'!$F80) -> Cub | G76: ='\\ser\software\other\[POINTS NQS  2012.XLS]Pro Stock'!$AA80 -> 165 | I76: ='\\ser\software\other\[POINTS NQS  2012.XLS]Super Stock'!$A80 -> 74 | J76: ='\\ser\software\other\[POINTS NQS  2012.XLS]Super Stock'!$B80 -> Doug Diehl | K76: ='\\ser\software\other\[POINTS NQS  2012.XLS]Super Stock'!$C80 -> Smithsburg, PA | L76: ='\\ser\software\other\[POINTS NQS  2012.XLS]Super Stock'!$D80 -> NP | M76: ='\\ser\software\other\[POINTS NQS  2012.XLS]Super Stock'!$E80 -> 385 | N76: =IF('\\ser\software\other\[POINTS NQS  2012.XLS]Super Stock'!$F80=0," ",'\\ser\software\other\[POINTS NQS  2012.XLS]Super Stock'!$F80) -> Eliminator | O76: ='\\ser\software\other\[POINTS NQS  2012.XLS]Super Stock'!$AA80 -> 183
A77: ='\\ser\software\other\[POINTS NQS  2012.XLS]Pro Stock'!$A81 -> 75 | B77: ='\\ser\software\other\[POINTS NQS  2012.XLS]Pro Stock'!$B81 -> Dave Fagin | C77: ='\\ser\software\other\[POINTS NQS  2012.XLS]Pro Stock'!$C81 -> Sullivan, Oh | D77: ='\\ser\software\other\[POINTS NQS  2012.XLS]Pro Stock'!$D81 -> 0 | E77: ='\\ser\software\other\[POINTS NQS  2012.XLS]Pro Stock'!$E81 -> 555 | F77: =IF('\\ser\software\other\[POINTS NQS  2012.XLS]Pro Stock'!$F81=0," ",'\\ser\software\other\[POINTS NQS  2012.XLS]Pro Stock'!$F81) -> Plum Crazy | G77: ='\\ser\software\other\[POINTS NQS  2012.XLS]Pro Stock'!$AA81 -> 165 | I77: ='\\ser\software\other\[POINTS NQS  2012.XLS]Super Stock'!$A81 -> 75 | J77: ='\\ser\software\other\[POINTS NQS  2012.XLS]Super Stock'!$B81 -> Joe Young | K77: ='\\ser\software\other\[POINTS NQS  2012.XLS]Super Stock'!$C81 -> Kimball, MI | L77: ='\\ser\software\other\[POINTS NQS  2012.XLS]Super Stock'!$D81 -> NP | M77: ='\\ser\software\other\[POINTS NQS  2012.XLS]Super Stock'!$E81 -> 479 | N77: =IF('\\ser\software\other\[POINTS NQS  2012.XLS]Super Stock'!$F81=0," ",'\\ser\software\other\[POINTS NQS  2012.XLS]Super Stock'!$F81) -> Mental Health | O77: ='\\ser\software\other\[POINTS NQS  2012.XLS]Super Stock'!$AA81 -> 183
A78: ='\\ser\software\other\[POINTS NQS  2012.XLS]Pro Stock'!$A82 -> 76 | B78: ='\\ser\software\other\[POINTS NQS  2012.XLS]Pro Stock'!$B82 -> Jeremy Jaspering | C78: ='\\ser\software\other\[POINTS NQS  2012.XLS]Pro Stock'!$C82 -> Perry, MO | D78: ='\\ser\software\other\[POINTS NQS  2012.XLS]Pro Stock'!$D82 -> LR | E78: ='\\ser\software\other\[POINTS NQS  2012.XLS]Pro Stock'!$E82 -> 147 | F78: =IF('\\ser\software\other\[POINTS NQS  2012.XLS]Pro Stock'!$F82=0," ",'\\ser\software\other\[POINTS NQS  2012.XLS]Pro Stock'!$F82) -> Wicked | G78: ='\\ser\software\other\[POINTS NQS  2012.XLS]Pro Stock'!$AA82 -> 166 | I78: ='\\ser\software\other\[POINTS NQS  2012.XLS]Super Stock'!$A82 -> 76 | J78: ='\\ser\software\other\[POINTS NQS  2012.XLS]Super Stock'!$B82 -> Mike Sours | K78: ='\\ser\software\other\[POINTS NQS  2012.XLS]Super Stock'!$C82 -> Jeromesville, Oh | L78: ='\\ser\software\other\[POINTS NQS  2012.XLS]Super Stock'!$D82 -> TH | M78: ='\\ser\software\other\[POINTS NQS  2012.XLS]Super Stock'!$E82 -> 543 | N78: =IF('\\ser\software\other\[POINTS NQS  2012.XLS]Super Stock'!$F82=0," ",'\\ser\software\other\[POINTS NQS  2012.XLS]Super Stock'!$F82) -> Another Addiction | O78: ='\\ser\software\other\[POINTS NQS  2012.XLS]Super Stock'!$AA82 -> 183
A79: ='\\ser\software\other\[POINTS NQS  2012.XLS]Pro Stock'!$A83 -> 77 | B79: ='\\ser\software\other\[POINTS NQS  2012.XLS]Pro Stock'!$B83 -> Harrison Stahl | C79: ='\\ser\software\other\[POINTS NQS  2012.XLS]Pro Stock'!$C83 -> Welton, IA | D79: ='\\ser\software\other\[POINTS NQS  2012.XLS]Pro Stock'!$D83 -> MVP | E79: ='\\ser\software\other\[POINTS NQS  2012.XLS]Pro Stock'!$E83 -> 336 | F79: =IF('\\ser\software\other\[POINTS NQS  2012.XLS]Pro Stock'!$F83=0," ",'\\ser\software\other\[POINTS NQS  2012.XLS]Pro Stock'!$F83) -> MWSC # 4 | G79: ='\\ser\software\other\[POINTS NQS  2012.XLS]Pro Stock'!$AA83 -> 166 | I79: ='\\ser\software\other\[POINTS NQS  2012.XLS]Super Stock'!$A83 -> 77 | J79: ='\\ser\software\other\[POINTS NQS  2012.XLS]Super Stock'!$B83 -> Matt Dirksen | K79: ='\\ser\software\other\[POINTS NQS  2012.XLS]Super Stock'!$C83 -> Alma, Ont CDA | L79: ='\\ser\software\other\[POINTS NQS  2012.XLS]Super Stock'!$D83 -> MWSC | M79: ='\\ser\software\other\[POINTS NQS  2012.XLS]Super Stock'!$E83 -> 551 | N79: =IF('\\ser\software\other\[POINTS NQS  2012.XLS]Super Stock'!$F83=0," ",'\\ser\software\other\[POINTS NQS  2012.XLS]Super Stock'!$F83) -> Armed & Dangerous | O79: ='\\ser\software\other\[POINTS NQS  2012.XLS]Super Stock'!$AA83 -> 183
A80: ='\\ser\software\other\[POINTS NQS  2012.XLS]Pro Stock'!$A84 -> 78 | B80: ='\\ser\software\other\[POINTS NQS  2012.XLS]Pro Stock'!$B84 -> Brian Titzer | C80: ='\\ser\software\other\[POINTS NQS  2012.XLS]Pro Stock'!$C84 -> Evansville, Ind | D80: ='\\ser\software\other\[POINTS NQS  2012.XLS]Pro Stock'!$D84 -> TC | E80: ='\\ser\software\other\[POINTS NQS  2012.XLS]Pro Stock'!$E84 -> 364 | F80: =IF('\\ser\software\other\[POINTS NQS  2012.XLS]Pro Stock'!$F84=0," ",'\\ser\software\other\[POINTS NQS  2012.XLS]Pro Stock'!$F84) -> Single Boys Toy | G80: ='\\ser\software\other\[POINTS NQS  2012.XLS]Pro Stock'!$AA84 -> 166 | I80: ='\\ser\software\other\[POINTS NQS  2012.XLS]Super Stock'!$A84 -> 78 | J80: ='\\ser\software\other\[POINTS NQS  2012.XLS]Super Stock'!$B84 -> Julian Stahl | K80: ='\\ser\software\other\[POINTS NQS  2012.XLS]Super Stock'!$C84 -> Welton, IA | L80: ='\\ser\software\other\[POINTS NQS  2012.XLS]Super Stock'!$D84 -> MVP | M80: ='\\ser\software\other\[POINTS NQS  2012.XLS]Super Stock'!$E84 -> 2 | N80: =IF('\\ser\software\other\[POINTS NQS  2012.XLS]Super Stock'!$F84=0," ",'\\ser\software\other\[POINTS NQS  2012.XLS]Super Stock'!$F84) -> MWSC # 2 | O80: ='\\ser\software\other\[POINTS NQS  2012.XLS]Super Stock'!$AA84 -> 184
A81: ='\\ser\software\other\[POINTS NQS  2012.XLS]Pro Stock'!$A85 -> 79 | B81: ='\\ser\software\other\[POINTS NQS  2012.XLS]Pro Stock'!$B85 -> Mark Brest | C81: ='\\ser\software\other\[POINTS NQS  2012.XLS]Pro Stock'!$C85 -> Sharpsville, Pa | D81: ='\\ser\software\other\[POINTS NQS  2012.XLS]Pro Stock'!$D85 -> MVP | E81: ='\\ser\software\other\[POINTS NQS  2012.XLS]Pro Stock'!$E85 -> 404 | F81: =IF('\\ser\software\other\[POINTS NQS  2012.XLS]Pro Stock'!$F85=0," ",'\\ser\software\other\[POINTS NQS  2012.XLS]Pro Stock'!$F85) -> Stage IV | G81: ='\\ser\software\other\[POINTS NQS  2012.XLS]Pro Stock'!$AA85 -> 166 | I81: ='\\ser\software\other\[POINTS NQS  2012.XLS]Super Stock'!$A85 -> 79 | J81: ='\\ser\software\other\[POINTS NQS  2012.XLS]Super Stock'!$B85 -> Larry Hunter | K81: ='\\ser\software\other\[POINTS NQS  2012.XLS]Super Stock'!$C85 -> Blue Licks, Ky | L81: ='\\ser\software\other\[POINTS NQS  2012.XLS]Super Stock'!$D85 -> NP | M81: ='\\ser\software\other\[POINTS NQS  2012.XLS]Super Stock'!$E85 -> 220 | N81: =IF('\\ser\software\other\[POINTS NQS  2012.XLS]Super Stock'!$F85=0," ",'\\ser\software\other\[POINTS NQS  2012.XLS]Super Stock'!$F85) -> Bluelicker | O81: ='\\ser\software\other\[POINTS NQS  2012.XLS]Super Stock'!$AA85 -> 184
A82: ='\\ser\software\other\[POINTS NQS  2012.XLS]Pro Stock'!$A86 -> 80 | B82: ='\\ser\software\other\[POINTS NQS  2012.XLS]Pro Stock'!$B86 -> Denns Chilcoat | C82: ='\\ser\software\other\[POINTS NQS  2012.XLS]Pro Stock'!$C86 -> Seven Valley, Pa | D82: ='\\ser\software\other\[POINTS NQS  2012.XLS]Pro Stock'!$D86 -> 0 | E82: ='\\ser\software\other\[POINTS NQS  2012.XLS]Pro Stock'!$E86 -> 528 | F82: =IF('\\ser\software\other\[POINTS NQS  2012.XLS]Pro Stock'!$F86=0," ",'\\ser\software\other\[POINTS NQS  2012.XLS]Pro Stock'!$F86) ->  | G82: ='\\ser\software\other\[POINTS NQS  2012.XLS]Pro Stock'!$AA86 -> 166 | I82: ='\\ser\software\other\[POINTS NQS  2012.XLS]Super Stock'!$A86 -> 80 | J82: ='\\ser\software\other\[POINTS NQS  2012.XLS]Super Stock'!$B86 -> Mike Kyle | K82: ='\\ser\software\other\[POINTS NQS  2012.XLS]Super Stock'!$C86 -> Edinburgh, IN | L82: ='\\ser\software\other\[POINTS NQS  2012.XLS]Super Stock'!$D86 -> VM | M82: ='\\ser\software\other\[POINTS NQS  2012.XLS]Super Stock'!$E86 -> 394 | N82: =IF('\\ser\software\other\[POINTS NQS  2012.XLS]Super Stock'!$F86=0," ",'\\ser\software\other\[POINTS NQS  2012.XLS]Super Stock'!$F86) ->  | O82: ='\\ser\software\other\[POINTS NQS  2012.XLS]Super Stock'!$AA86 -> 184
A83: ='\\ser\software\other\[POINTS NQS  2012.XLS]Pro Stock'!$A87 -> 81 | B83: ='\\ser\software\other\[POINTS NQS  2012.XLS]Pro Stock'!$B87 -> Ray Gentz | C83: ='\\ser\software\other\[POINTS NQS  2012.XLS]Pro Stock'!$C87 -> Colon, Mich | D83: ='\\ser\software\other\[POINTS NQS  2012.XLS]Pro Stock'!$D87 -> JRS | E83: ='\\ser\software\other\[POINTS NQS  2012.XLS]Pro Stock'!$E87 -> 35 | F83: =IF('\\ser\software\other\[POINTS NQS  2012.XLS]Pro Stock'!$F87=0," ",'\\ser\software\other\[POINTS NQS  2012.XLS]Pro Stock'!$F87) -> B.U. Cub | G83: ='\\ser\software\other\[POINTS NQS  2012.XLS]Pro Stock'!$AA87 -> 167 | I83: ='\\ser\software\other\[POINTS NQS  2012.XLS]Super Stock'!$A87 -> 81 | J83: ='\\ser\software\other\[POINTS NQS  2012.XLS]Super Stock'!$B87 -> Tyler Hackman | K83: ='\\ser\software\other\[POINTS NQS  2012.XLS]Super Stock'!$C87 -> Seymour, IN | L83: ='\\ser\software\other\[POINTS NQS  2012.XLS]Super Stock'!$D87 -> Hackman | M83: ='\\ser\software\other\[POINTS NQS  2012.XLS]Super Stock'!$E87 -> 508 | N83: =IF('\\ser\software\other\[POINTS NQS  2012.XLS]Super Stock'!$F87=0," ",'\\ser\software\other\[POINTS NQS  2012.XLS]Super Stock'!$F87) -> Iron Will | O83: ='\\ser\software\other\[POINTS NQS  2012.XLS]Super Stock'!$AA87 -> 184
A84: ='\\ser\software\other\[POINTS NQS  2012.XLS]Pro Stock'!$A88 -> 82 | B84: ='\\ser\software\other\[POINTS NQS  2012.XLS]Pro Stock'!$B88 -> Kevin Root | C84: ='\\ser\software\other\[POINTS NQS  2012.XLS]Pro Stock'!$C88 -> Inola, OKLA | D84: ='\\ser\software\other\[POINTS NQS  2012.XLS]Pro Stock'!$D88 -> Root | E84: ='\\ser\software\other\[POINTS NQS  2012.XLS]Pro Stock'!$E88 -> 118 | F84: =IF('\\ser\software\other\[POINTS NQS  2012.XLS]Pro Stock'!$F88=0," ",'\\ser\software\other\[POINTS NQS  2012.XLS]Pro Stock'!$F88) -> Slap Shot | G84: ='\\ser\software\other\[POINTS NQS  2012.XLS]Pro Stock'!$AA88 -> 167 | I84: ='\\ser\software\other\[POINTS NQS  2012.XLS]Super Stock'!$A88 -> 82 | J84: ='\\ser\software\other\[POINTS NQS  2012.XLS]Super Stock'!$B88 -> Dean Dubach | K84: ='\\ser\software\other\[POINTS NQS  2012.XLS]Super Stock'!$C88 -> Decatur, Ind | L84: ='\\ser\software\other\[POINTS NQS  2012.XLS]Super Stock'!$D88 -> LR | M84: ='\\ser\software\other\[POINTS NQS  2012.XLS]Super Stock'!$E88 -> 532 | N84: =IF('\\ser\software\other\[POINTS NQS  2012.XLS]Super Stock'!$F88=0," ",'\\ser\software\other\[POINTS NQS  2012.XLS]Super Stock'!$F88) -> Red Cub | O84: ='\\ser\software\other\[POINTS NQS  2012.XLS]Super Stock'!$AA88 -> 184
A85: ='\\ser\software\other\[POINTS NQS  2012.XLS]Pro Stock'!$A89 -> 83 | B85: ='\\ser\software\other\[POINTS NQS  2012.XLS]Pro Stock'!$B89 -> Rick Slade | C85: ='\\ser\software\other\[POINTS NQS  2012.XLS]Pro Stock'!$C89 -> Harveyville, KS | D85: ='\\ser\software\other\[POINTS NQS  2012.XLS]Pro Stock'!$D89 -> JRS | E85: ='\\ser\software\other\[POINTS NQS  2012.XLS]Pro Stock'!$E89 -> 467 | F85: =IF('\\ser\software\other\[POINTS NQS  2012.XLS]Pro Stock'!$F89=0," ",'\\ser\software\other\[POINTS NQS  2012.XLS]Pro Stock'!$F89) -> Ricochet | G85: ='\\ser\software\other\[POINTS NQS  2012.XLS]Pro Stock'!$AA89 -> 167 | I85: ='\\ser\software\other\[POINTS NQS  2012.XLS]Super Stock'!$A89 -> 83 | J85: ='\\ser\software\other\[POINTS NQS  2012.XLS]Super Stock'!$B89 -> Jim Morrison | K85: ='\\ser\software\other\[POINTS NQS  2012.XLS]Super Stock'!$C89 -> Union, Ky | L85: ='\\ser\software\other\[POINTS NQS  2012.XLS]Super Stock'!$D89 -> 0 | M85: ='\\ser\software\other\[POINTS NQS  2012.XLS]Super Stock'!$E89 -> 0 | N85: =IF('\\ser\software\other\[POINTS NQS  2012.XLS]Super Stock'!$F89=0," ",'\\ser\software\other\[POINTS NQS  2012.XLS]Super Stock'!$F89) -> White | O85: ='\\ser\software\other\[POINTS NQS  2012.XLS]Super Stock'!$AA89 -> 184
A86: ='\\ser\software\other\[POINTS NQS  2012.XLS]Pro Stock'!$A90 -> 84 | B86: ='\\ser\software\other\[POINTS NQS  2012.XLS]Pro Stock'!$B90 -> Shane Hadley | C86: ='\\ser\software\other\[POINTS NQS  2012.XLS]Pro Stock'!$C90 -> Marion, KY | D86: ='\\ser\software\other\[POINTS NQS  2012.XLS]Pro Stock'!$D90 -> JRS | E86: ='\\ser\software\other\[POINTS NQS  2012.XLS]Pro Stock'!$E90 -> 505 | F86: =IF('\\ser\software\other\[POINTS NQS  2012.XLS]Pro Stock'!$F90=0," ",'\\ser\software\other\[POINTS NQS  2012.XLS]Pro Stock'!$F90) ->  | G86: ='\\ser\software\other\[POINTS NQS  2012.XLS]Pro Stock'!$AA90 -> 167 | I86: ='\\ser\software\other\[POINTS NQS  2012.XLS]Super Stock'!$A90 -> 84 | J86: ='\\ser\software\other\[POINTS NQS  2012.XLS]Super Stock'!$B90 -> Harrison Stahl | K86: ='\\ser\software\other\[POINTS NQS  2012.XLS]Super Stock'!$C90 -> Dewitt, IA | L86: ='\\ser\software\other\[POINTS NQS  2012.XLS]Super Stock'!$D90 -> MVP | M86: ='\\ser\software\other\[POINTS NQS  2012.XLS]Super Stock'!$E90 -> 335 | N86: =IF('\\ser\software\other\[POINTS NQS  2012.XLS]Super Stock'!$F90=0," ",'\\ser\software\other\[POINTS NQS  2012.XLS]Super Stock'!$F90) -> MWSC # 3 | O86: ='\\ser\software\other\[POINTS NQS  2012.XLS]Super Stock'!$AA90 -> 185
A87: ='\\ser\software\other\[POINTS NQS  2012.XLS]Pro Stock'!$A91 -> 85 | B87: ='\\ser\software\other\[POINTS NQS  2012.XLS]Pro Stock'!$B91 -> Brad Corzine | C87: ='\\ser\software\other\[POINTS NQS  2012.XLS]Pro Stock'!$C91 -> Dongola, ILL | D87: ='\\ser\software\other\[POINTS NQS  2012.XLS]Pro Stock'!$D91 -> JW | E87: ='\\ser\software\other\[POINTS NQS  2012.XLS]Pro Stock'!$E91 -> 509 | F87: =IF('\\ser\software\other\[POINTS NQS  2012.XLS]Pro Stock'!$F91=0," ",'\\ser\software\other\[POINTS NQS  2012.XLS]Pro Stock'!$F91) -> Just Black | G87: ='\\ser\software\other\[POINTS NQS  2012.XLS]Pro Stock'!$AA91 -> 167 | I87: ='\\ser\software\other\[POINTS NQS  2012.XLS]Super Stock'!$A91 -> 85 | J87: ='\\ser\software\other\[POINTS NQS  2012.XLS]Super Stock'!$B91 -> Doug Rood | K87: ='\\ser\software\other\[POINTS NQS  2012.XLS]Super Stock'!$C91 -> Ypsilanti, Mi | L87: ='\\ser\software\other\[POINTS NQS  2012.XLS]Super Stock'!$D91 -> NP | M87: ='\\ser\software\other\[POINTS NQS  2012.XLS]Super Stock'!$E91 -> 354 | N87: =IF('\\ser\software\other\[POINTS NQS  2012.XLS]Super Stock'!$F91=0," ",'\\ser\software\other\[POINTS NQS  2012.XLS]Super Stock'!$F91) -> Blue Dawg | O87: ='\\ser\software\other\[POINTS NQS  2012.XLS]Super Stock'!$AA91 -> 185
A88: ='\\ser\software\other\[POINTS NQS  2012.XLS]Pro Stock'!$A92 -> 86 | B88: ='\\ser\software\other\[POINTS NQS  2012.XLS]Pro Stock'!$B92 -> Kyle Hunter | C88: ='\\ser\software\other\[POINTS NQS  2012.XLS]Pro Stock'!$C92 -> Montoursville, Pa | D88: ='\\ser\software\other\[POINTS NQS  2012.XLS]Pro Stock'!$D92 -> 0 | E88: ='\\ser\software\other\[POINTS NQS  2012.XLS]Pro Stock'!$E92 -> 542 | F88: =IF('\\ser\software\other\[POINTS NQS  2012.XLS]Pro Stock'!$F92=0," ",'\\ser\software\other\[POINTS NQS  2012.XLS]Pro Stock'!$F92) ->  | G88: ='\\ser\software\other\[POINTS NQS  2012.XLS]Pro Stock'!$AA92 -> 167 | I88: ='\\ser\software\other\[POINTS NQS  2012.XLS]Super Stock'!$A92 -> 86 | J88: ='\\ser\software\other\[POINTS NQS  2012.XLS]Super Stock'!$B92 -> Glen Burge | K88: ='\\ser\software\other\[POINTS NQS  2012.XLS]Super Stock'!$C92 -> W Alexandria, Oh | L88: ='\\ser\software\other\[POINTS NQS  2012.XLS]Super Stock'!$D92 -> MVP | M88: ='\\ser\software\other\[POINTS NQS  2012.XLS]Super Stock'!$E92 -> 380 | N88: =IF('\\ser\software\other\[POINTS NQS  2012.XLS]Super Stock'!$F92=0," ",'\\ser\software\other\[POINTS NQS  2012.XLS]Super Stock'!$F92) -> Armed & Dangerous | O88: ='\\ser\software\other\[POINTS NQS  2012.XLS]Super Stock'!$AA92 -> 185
A89: ='\\ser\software\other\[POINTS NQS  2012.XLS]Pro Stock'!$A93 -> 87 | B89: ='\\ser\software\other\[POINTS NQS  2012.XLS]Pro Stock'!$B93 -> Brandon Lohwinow | C89: ='\\ser\software\other\[POINTS NQS  2012.XLS]Pro Stock'!$C93 -> Feigus.Ont CDA | D89: ='\\ser\software\other\[POINTS NQS  2012.XLS]Pro Stock'!$D93 -> MVP | E89: ='\\ser\software\other\[POINTS NQS  2012.XLS]Pro Stock'!$E93 -> 550 | F89: =IF('\\ser\software\other\[POINTS NQS  2012.XLS]Pro Stock'!$F93=0," ",'\\ser\software\other\[POINTS NQS  2012.XLS]Pro Stock'!$F93) -> Mistress | G89: ='\\ser\software\other\[POINTS NQS  2012.XLS]Pro Stock'!$AA93 -> 167 | I89: ='\\ser\software\other\[POINTS NQS  2012.XLS]Super Stock'!$A93 -> 87 | J89: ='\\ser\software\other\[POINTS NQS  2012.XLS]Super Stock'!$B93 -> Logan Cessna | K89: ='\\ser\software\other\[POINTS NQS  2012.XLS]Super Stock'!$C93 -> Chambersburg, Pa | L89: ='\\ser\software\other\[POINTS NQS  2012.XLS]Super Stock'!$D93 -> NP | M89: ='\\ser\software\other\[POINTS NQS  2012.XLS]Super Stock'!$E93 -> 388 | N89: =IF('\\ser\software\other\[POINTS NQS  2012.XLS]Super Stock'!$F93=0," ",'\\ser\software\other\[POINTS NQS  2012.XLS]Super Stock'!$F93) -> Adrenaline | O89: ='\\ser\software\other\[POINTS NQS  2012.XLS]Super Stock'!$AA93 -> 185
A90: ='\\ser\software\other\[POINTS NQS  2012.XLS]Pro Stock'!$A94 -> 88 | B90: ='\\ser\software\other\[POINTS NQS  2012.XLS]Pro Stock'!$B94 -> Tim Bowling | C90: ='\\ser\software\other\[POINTS NQS  2012.XLS]Pro Stock'!$C94 -> Syracuse, Ind | D90: ='\\ser\software\other\[POINTS NQS  2012.XLS]Pro Stock'!$D94 -> LR | E90: ='\\ser\software\other\[POINTS NQS  2012.XLS]Pro Stock'!$E94 -> 559 | F90: =IF('\\ser\software\other\[POINTS NQS  2012.XLS]Pro Stock'!$F94=0," ",'\\ser\software\other\[POINTS NQS  2012.XLS]Pro Stock'!$F94) -> Red Cub | G90: ='\\ser\software\other\[POINTS NQS  2012.XLS]Pro Stock'!$AA94 -> 167 | I90: ='\\ser\software\other\[POINTS NQS  2012.XLS]Super Stock'!$A94 -> 88 | J90: ='\\ser\software\other\[POINTS NQS  2012.XLS]Super Stock'!$B94 -> Jim Spencer | K90: ='\\ser\software\other\[POINTS NQS  2012.XLS]Super Stock'!$C94 -> Eaton, Oh | L90: ='\\ser\software\other\[POINTS NQS  2012.XLS]Super Stock'!$D94 -> NP | M90: ='\\ser\software\other\[POINTS NQS  2012.XLS]Super Stock'!$E94 -> 487 | N90: =IF('\\ser\software\other\[POINTS NQS  2012.XLS]Super Stock'!$F94=0," ",'\\ser\software\other\[POINTS NQS  2012.XLS]Super Stock'!$F94) -> Family Tradition | O90: ='\\ser\software\other\[POINTS NQS  2012.XLS]Super Stock'!$AA94 -> 185
A91: ='\\ser\software\other\[POINTS NQS  2012.XLS]Pro Stock'!$A95 -> 89 | B91: ='\\ser\software\other\[POINTS NQS  2012.XLS]Pro Stock'!$B95 -> Kevin Qeveselle | C91: ='\\ser\software\other\[POINTS NQS  2012.XLS]Pro Stock'!$C95 -> Syracuse, Ind | D91: ='\\ser\software\other\[POINTS NQS  2012.XLS]Pro Stock'!$D95 -> LR | E91: ='\\ser\software\other\[POINTS NQS  2012.XLS]Pro Stock'!$E95 -> 554 | F91: =IF('\\ser\software\other\[POINTS NQS  2012.XLS]Pro Stock'!$F95=0," ",'\\ser\software\other\[POINTS NQS  2012.XLS]Pro Stock'!$F95) -> Farmall A | G91: ='\\ser\software\other\[POINTS NQS  2012.XLS]Pro Stock'!$AA95 -> 168 | I91: ='\\ser\software\other\[POINTS NQS  2012.XLS]Super Stock'!$A95 -> 89 | J91: ='\\ser\software\other\[POINTS NQS  2012.XLS]Super Stock'!$B95 -> Mark Cessna | K91: ='\\ser\software\other\[POINTS NQS  2012.XLS]Super Stock'!$C95 -> Chambersburg, Pa | L91: ='\\ser\software\other\[POINTS NQS  2012.XLS]Super Stock'!$D95 -> 0 | M91: ='\\ser\software\other\[POINTS NQS  2012.XLS]Super Stock'!$E95 -> 0 | N91: =IF('\\ser\software\other\[POINTS NQS  2012.XLS]Super Stock'!$F95=0," ",'\\ser\software\other\[POINTS NQS  2012.XLS]Super Stock'!$F95) -> Built for Business | O91: ='\\ser\software\other\[POINTS NQS  2012.XLS]Super Stock'!$AA95 -> 185
A92: ='\\ser\software\other\[POINTS NQS  2012.XLS]Pro Stock'!$A96 -> 90 | B92: ='\\ser\software\other\[POINTS NQS  2012.XLS]Pro Stock'!$B96 -> Gary McDonald | C92: ='\\ser\software\other\[POINTS NQS  2012.XLS]Pro Stock'!$C96 -> Hope, Ind | D92: ='\\ser\software\other\[POINTS NQS  2012.XLS]Pro Stock'!$D96 -> 0 | E92: ='\\ser\software\other\[POINTS NQS  2012.XLS]Pro Stock'!$E96 -> 93 | F92: =IF('\\ser\software\other\[POINTS NQS  2012.XLS]Pro Stock'!$F96=0," ",'\\ser\software\other\[POINTS NQS  2012.XLS]Pro Stock'!$F96) ->  | G92: ='\\ser\software\other\[POINTS NQS  2012.XLS]Pro Stock'!$AA96 -> 0 | I92: ='\\ser\software\other\[POINTS NQS  2012.XLS]Super Stock'!$A96 -> 90 | J92: ='\\ser\software\other\[POINTS NQS  2012.XLS]Super Stock'!$B96 -> Corey Gerber | K92: ='\\ser\software\other\[POINTS NQS  2012.XLS]Super Stock'!$C96 -> Apple Creek, Oh | L92: ='\\ser\software\other\[POINTS NQS  2012.XLS]Super Stock'!$D96 -> 0 | M92: ='\\ser\software\other\[POINTS NQS  2012.XLS]Super Stock'!$E96 -> 538 | N92: =IF('\\ser\software\other\[POINTS NQS  2012.XLS]Super Stock'!$F96=0," ",'\\ser\software\other\[POINTS NQS  2012.XLS]Super Stock'!$F96) -> Red Rascal | O92: ='\\ser\software\other\[POINTS NQS  2012.XLS]Super Stock'!$AA96 -> 186
A93: ='\\ser\software\other\[POINTS NQS  2012.XLS]Pro Stock'!$A97 -> 91 | B93: ='\\ser\software\other\[POINTS NQS  2012.XLS]Pro Stock'!$B97 -> Bill Richerson | C93: ='\\ser\software\other\[POINTS NQS  2012.XLS]Pro Stock'!$C97 -> Crittenden, Ky | D93: ='\\ser\software\other\[POINTS NQS  2012.XLS]Pro Stock'!$D97 -> JW | E93: ='\\ser\software\other\[POINTS NQS  2012.XLS]Pro Stock'!$E97 -> 132 | F93: =IF('\\ser\software\other\[POINTS NQS  2012.XLS]Pro Stock'!$F97=0," ",'\\ser\software\other\[POINTS NQS  2012.XLS]Pro Stock'!$F97) -> Walk the Line29 | G93: ='\\ser\software\other\[POINTS NQS  2012.XLS]Pro Stock'!$AA97 -> 0 | I93: ='\\ser\software\other\[POINTS NQS  2012.XLS]Super Stock'!$A97 -> 91 | J93: ='\\ser\software\other\[POINTS NQS  2012.XLS]Super Stock'!$B97 -> Mike Silco | K93: ='\\ser\software\other\[POINTS NQS  2012.XLS]Super Stock'!$C97 -> Pittsford, NY | L93: ='\\ser\software\other\[POINTS NQS  2012.XLS]Super Stock'!$D97 -> LR | M93: ='\\ser\software\other\[POINTS NQS  2012.XLS]Super Stock'!$E97 -> 547 | N93: =IF('\\ser\software\other\[POINTS NQS  2012.XLS]Super Stock'!$F97=0," ",'\\ser\software\other\[POINTS NQS  2012.XLS]Super Stock'!$F97) -> 1466 Alcoholic | O93: ='\\ser\software\other\[POINTS NQS  2012.XLS]Super Stock'!$AA97 -> 186
A94: ='\\ser\software\other\[POINTS NQS  2012.XLS]Pro Stock'!$A98 -> 92 | B94: ='\\ser\software\other\[POINTS NQS  2012.XLS]Pro Stock'!$B98 -> Alex Naffe | C94: ='\\ser\software\other\[POINTS NQS  2012.XLS]Pro Stock'!$C98 -> Seymour, Ind | D94: ='\\ser\software\other\[POINTS NQS  2012.XLS]Pro Stock'!$D98 -> GH | E94: ='\\ser\software\other\[POINTS NQS  2012.XLS]Pro Stock'!$E98 -> 138 | F94: =IF('\\ser\software\other\[POINTS NQS  2012.XLS]Pro Stock'!$F98=0," ",'\\ser\software\other\[POINTS NQS  2012.XLS]Pro Stock'!$F98) -> Totally Frustrated | G94: ='\\ser\software\other\[POINTS NQS  2012.XLS]Pro Stock'!$AA98 -> 0 | I94: ='\\ser\software\other\[POINTS NQS  2012.XLS]Super Stock'!$A98 -> 92 | J94: ='\\ser\software\other\[POINTS NQS  2012.XLS]Super Stock'!$B98 -> Brandon Lohwinow | K94: ='\\ser\software\other\[POINTS NQS  2012.XLS]Super Stock'!$C98 -> Feigus.Ont CDA | L94: ='\\ser\software\other\[POINTS NQS  2012.XLS]Super Stock'!$D98 -> MWSC | M94: ='\\ser\software\other\[POINTS NQS  2012.XLS]Super Stock'!$E98 -> 550 | N94: =IF('\\ser\software\other\[POINTS NQS  2012.XLS]Super Stock'!$F98=0," ",'\\ser\software\other\[POINTS NQS  2012.XLS]Super Stock'!$F98) -> Mistress | O94: ='\\ser\software\other\[POINTS NQS  2012.XLS]Super Stock'!$AA98 -> 186
A95: ='\\ser\software\other\[POINTS NQS  2012.XLS]Pro Stock'!$A99 -> 93 | B95: ='\\ser\software\other\[POINTS NQS  2012.XLS]Pro Stock'!$B99 -> Larry Hunter | C95: ='\\ser\software\other\[POINTS NQS  2012.XLS]Pro Stock'!$C99 -> Blue Licks, Ky | D95: ='\\ser\software\other\[POINTS NQS  2012.XLS]Pro Stock'!$D99 -> 0 | E95: ='\\ser\software\other\[POINTS NQS  2012.XLS]Pro Stock'!$E99 -> 220 | F95: =IF('\\ser\software\other\[POINTS NQS  2012.XLS]Pro Stock'!$F99=0," ",'\\ser\software\other\[POINTS NQS  2012.XLS]Pro Stock'!$F99) -> Bluelicker | G95: ='\\ser\software\other\[POINTS NQS  2012.XLS]Pro Stock'!$AA99 -> 0 | I95: ='\\ser\software\other\[POINTS NQS  2012.XLS]Super Stock'!$A99 -> 93 | J95: ='\\ser\software\other\[POINTS NQS  2012.XLS]Super Stock'!$B99 -> Brian Jones | K95: ='\\ser\software\other\[POINTS NQS  2012.XLS]Super Stock'!$C99 -> Sheridan, Inc | L95: ='\\ser\software\other\[POINTS NQS  2012.XLS]Super Stock'!$D99 -> 0 | M95: ='\\ser\software\other\[POINTS NQS  2012.XLS]Super Stock'!$E99 -> 563 | N95: =IF('\\ser\software\other\[POINTS NQS  2012.XLS]Super Stock'!$F99=0," ",'\\ser\software\other\[POINTS NQS  2012.XLS]Super Stock'!$F99) ->  | O95: ='\\ser\software\other\[POINTS NQS  2012.XLS]Super Stock'!$AA99 -> 186
A96: ='\\ser\software\other\[POINTS NQS  2012.XLS]Pro Stock'!$A100 -> 94 | B96: ='\\ser\software\other\[POINTS NQS  2012.XLS]Pro Stock'!$B100 -> Zach Richerson | C96: ='\\ser\software\other\[POINTS NQS  2012.XLS]Pro Stock'!$C100 -> Crittenden, Ky | D96: ='\\ser\software\other\[POINTS NQS  2012.XLS]Pro Stock'!$D100 -> JW | E96: ='\\ser\software\other\[POINTS NQS  2012.XLS]Pro Stock'!$E100 -> 348 | F96: =IF('\\ser\software\other\[POINTS NQS  2012.XLS]Pro Stock'!$F100=0," ",'\\ser\software\other\[POINTS NQS  2012.XLS]Pro Stock'!$F100) -> Zach's Rat | G96: ='\\ser\software\other\[POINTS NQS  2012.XLS]Pro Stock'!$AA100 -> 0 | I96: ='\\ser\software\other\[POINTS NQS  2012.XLS]Super Stock'!$A100 -> 94 | J96: ='\\ser\software\other\[POINTS NQS  2012.XLS]Super Stock'!$B100 -> Scott Larkins | K96: ='\\ser\software\other\[POINTS NQS  2012.XLS]Super Stock'!$C100 -> Kearney, MO | L96: ='\\ser\software\other\[POINTS NQS  2012.XLS]Super Stock'!$D100 -> JRS | M96: ='\\ser\software\other\[POINTS NQS  2012.XLS]Super Stock'!$E100 -> 154 | N96: =IF('\\ser\software\other\[POINTS NQS  2012.XLS]Super Stock'!$F100=0," ",'\\ser\software\other\[POINTS NQS  2012.XLS]Super Stock'!$F100) -> Silver Sam | O96: ='\\ser\software\other\[POINTS NQS  2012.XLS]Super Stock'!$AA100 -> 187
A97: ='\\ser\software\other\[POINTS NQS  2012.XLS]Pro Stock'!$A101 -> 95 | B97: ='\\ser\software\other\[POINTS NQS  2012.XLS]Pro Stock'!$B101 -> Doug Rood | C97: ='\\ser\software\other\[POINTS NQS  2012.XLS]Pro Stock'!$C101 -> Ypsilanti, Mi | D97: ='\\ser\software\other\[POINTS NQS  2012.XLS]Pro Stock'!$D101 -> NP | E97: ='\\ser\software\other\[POINTS NQS  2012.XLS]Pro Stock'!$E101 -> 354 | F97: =IF('\\ser\software\other\[POINTS NQS  2012.XLS]Pro Stock'!$F101=0," ",'\\ser\software\other\[POINTS NQS  2012.XLS]Pro Stock'!$F101) -> Blue Dawg | G97: ='\\ser\software\other\[POINTS NQS  2012.XLS]Pro Stock'!$AA101 -> 0 | I97: ='\\ser\software\other\[POINTS NQS  2012.XLS]Super Stock'!$A101 -> 95 | J97: ='\\ser\software\other\[POINTS NQS  2012.XLS]Super Stock'!$B101 -> Tooter Campbell | K97: ='\\ser\software\other\[POINTS NQS  2012.XLS]Super Stock'!$C101 -> Owensboro, KY | L97: ='\\ser\software\other\[POINTS NQS  2012.XLS]Super Stock'!$D101 -> TC | M97: ='\\ser\software\other\[POINTS NQS  2012.XLS]Super Stock'!$E101 -> 473 | N97: =IF('\\ser\software\other\[POINTS NQS  2012.XLS]Super Stock'!$F101=0," ",'\\ser\software\other\[POINTS NQS  2012.XLS]Super Stock'!$F101) -> Tractor Trash | O97: ='\\ser\software\other\[POINTS NQS  2012.XLS]Super Stock'!$AA101 -> 187
A98: ='\\ser\software\other\[POINTS NQS  2012.XLS]Pro Stock'!$A102 -> 96 | B98: ='\\ser\software\other\[POINTS NQS  2012.XLS]Pro Stock'!$B102 -> Dustin Blair | C98: ='\\ser\software\other\[POINTS NQS  2012.XLS]Pro Stock'!$C102 -> Bonnieville, Ky | D98: ='\\ser\software\other\[POINTS NQS  2012.XLS]Pro Stock'!$D102 -> JW | E98: ='\\ser\software\other\[POINTS NQS  2012.XLS]Pro Stock'!$E102 -> 380 | F98: =IF('\\ser\software\other\[POINTS NQS  2012.XLS]Pro Stock'!$F102=0," ",'\\ser\software\other\[POINTS NQS  2012.XLS]Pro Stock'!$F102) -> Armed and Dangerous | G98: ='\\ser\software\other\[POINTS NQS  2012.XLS]Pro Stock'!$AA102 -> 0 | I98: ='\\ser\software\other\[POINTS NQS  2012.XLS]Super Stock'!$A102 -> 96 | J98: ='\\ser\software\other\[POINTS NQS  2012.XLS]Super Stock'!$B102 -> Chad Vogler | K98: ='\\ser\software\other\[POINTS NQS  2012.XLS]Super Stock'!$C102 -> Jasper, IN | L98: ='\\ser\software\other\[POINTS NQS  2012.XLS]Super Stock'!$D102 -> JRS | M98: ='\\ser\software\other\[POINTS NQS  2012.XLS]Super Stock'!$E102 -> 516 | N98: =IF('\\ser\software\other\[POINTS NQS  2012.XLS]Super Stock'!$F102=0," ",'\\ser\software\other\[POINTS NQS  2012.XLS]Super Stock'!$F102) -> Bandit | O98: ='\\ser\software\other\[POINTS NQS  2012.XLS]Super Stock'!$AA102 -> 187
A99: ='\\ser\software\other\[POINTS NQS  2012.XLS]Pro Stock'!$A103 -> 97 | B99: ='\\ser\software\other\[POINTS NQS  2012.XLS]Pro Stock'!$B103 -> Joe Young | C99: ='\\ser\software\other\[POINTS NQS  2012.XLS]Pro Stock'!$C103 -> Kimball, Mich | D99: ='\\ser\software\other\[POINTS NQS  2012.XLS]Pro Stock'!$D103 -> NP | E99: ='\\ser\software\other\[POINTS NQS  2012.XLS]Pro Stock'!$E103 -> 479 | F99: =IF('\\ser\software\other\[POINTS NQS  2012.XLS]Pro Stock'!$F103=0," ",'\\ser\software\other\[POINTS NQS  2012.XLS]Pro Stock'!$F103) -> Mental Health | G99: ='\\ser\software\other\[POINTS NQS  2012.XLS]Pro Stock'!$AA103 -> 0 | I99: ='\\ser\software\other\[POINTS NQS  2012.XLS]Super Stock'!$A103 -> 97 | J99: ='\\ser\software\other\[POINTS NQS  2012.XLS]Super Stock'!$B103 -> Michael Hunter | K99: ='\\ser\software\other\[POINTS NQS  2012.XLS]Super Stock'!$C103 -> Catawissa, Pa | L99: ='\\ser\software\other\[POINTS NQS  2012.XLS]Super Stock'!$D103 -> 0 | M99: ='\\ser\software\other\[POINTS NQS  2012.XLS]Super Stock'!$E103 -> 541 | N99: =IF('\\ser\software\other\[POINTS NQS  2012.XLS]Super Stock'!$F103=0," ",'\\ser\software\other\[POINTS NQS  2012.XLS]Super Stock'!$F103) ->  | O99: ='\\ser\software\other\[POINTS NQS  2012.XLS]Super Stock'!$AA103 -> 187
A100: ='\\ser\software\other\[POINTS NQS  2012.XLS]Pro Stock'!$A104 -> 98 | B100: ='\\ser\software\other\[POINTS NQS  2012.XLS]Pro Stock'!$B104 -> Brian Jones | C100: ='\\ser\software\other\[POINTS NQS  2012.XLS]Pro Stock'!$C104 -> Sheridan, Ind | D100: ='\\ser\software\other\[POINTS NQS  2012.XLS]Pro Stock'!$D104 -> 0 | E100: ='\\ser\software\other\[POINTS NQS  2012.XLS]Pro Stock'!$E104 -> 563 | F100: =IF('\\ser\software\other\[POINTS NQS  2012.XLS]Pro Stock'!$F104=0," ",'\\ser\software\other\[POINTS NQS  2012.XLS]Pro Stock'!$F104) -> Foolish Times | G100: ='\\ser\software\other\[POINTS NQS  2012.XLS]Pro Stock'!$AA104 -> 0 | I100: ='\\ser\software\other\[POINTS NQS  2012.XLS]Super Stock'!$A104 -> 98 | J100: ='\\ser\software\other\[POINTS NQS  2012.XLS]Super Stock'!$B104 -> Doug Diehl | K100: ='\\ser\software\other\[POINTS NQS  2012.XLS]Super Stock'!$C104 -> Smithsburg, PA | L100: ='\\ser\software\other\[POINTS NQS  2012.XLS]Super Stock'!$D104 -> NP | M100: ='\\ser\software\other\[POINTS NQS  2012.XLS]Super Stock'!$E104 -> 544 | N100: =IF('\\ser\software\other\[POINTS NQS  2012.XLS]Super Stock'!$F104=0," ",'\\ser\software\other\[POINTS NQS  2012.XLS]Super Stock'!$F104) -> 1 Bad MF | O100: ='\\ser\software\other\[POINTS NQS  2012.XLS]Super Stock'!$AA104 -> 187
I101: ='\\ser\software\other\[POINTS NQS  2012.XLS]Super Stock'!$A105 -> 99 | J101: ='\\ser\software\other\[POINTS NQS  2012.XLS]Super Stock'!$B105 -> Shaun Vogler | K101: ='\\ser\software\other\[POINTS NQS  2012.XLS]Super Stock'!$C105 -> Jasper, IN | L101: ='\\ser\software\other\[POINTS NQS  2012.XLS]Super Stock'!$D105 -> JRS | M101: ='\\ser\software\other\[POINTS NQS  2012.XLS]Super Stock'!$E105 -> 129 | N101: =IF('\\ser\software\other\[POINTS NQS  2012.XLS]Super Stock'!$F105=0," ",'\\ser\software\other\[POINTS NQS  2012.XLS]Super Stock'!$F105) -> Renegade | O101: ='\\ser\software\other\[POINTS NQS  2012.XLS]Super Stock'!$AA105 -> 188
I102: ='\\ser\software\other\[POINTS NQS  2012.XLS]Super Stock'!$A106 -> 100 | J102: ='\\ser\software\other\[POINTS NQS  2012.XLS]Super Stock'!$B106 -> Jeff Yager | K102: ='\\ser\software\other\[POINTS NQS  2012.XLS]Super Stock'!$C106 -> Kokomo, IN | L102: ='\\ser\software\other\[POINTS NQS  2012.XLS]Super Stock'!$D106 -> 0 | M102: ='\\ser\software\other\[POINTS NQS  2012.XLS]Super Stock'!$E106 -> 451 | N102: =IF('\\ser\software\other\[POINTS NQS  2012.XLS]Super Stock'!$F106=0," ",'\\ser\software\other\[POINTS NQS  2012.XLS]Super Stock'!$F106) ->  | O102: ='\\ser\software\other\[POINTS NQS  2012.XLS]Super Stock'!$AA106 -> 188
I103: ='\\ser\software\other\[POINTS NQS  2012.XLS]Super Stock'!$A107 -> 101 | J103: ='\\ser\software\other\[POINTS NQS  2012.XLS]Super Stock'!$B107 -> Steve Vogler | K103: ='\\ser\software\other\[POINTS NQS  2012.XLS]Super Stock'!$C107 -> Jasper, IN | L103: ='\\ser\software\other\[POINTS NQS  2012.XLS]Super Stock'!$D107 -> JRS | M103: ='\\ser\software\other\[POINTS NQS  2012.XLS]Super Stock'!$E107 -> 476 | N103: =IF('\\ser\software\other\[POINTS NQS  2012.XLS]Super Stock'!$F107=0," ",'\\ser\software\other\[POINTS NQS  2012.XLS]Super Stock'!$F107) -> Outlaw Reloaded | O103: ='\\ser\software\other\[POINTS NQS  2012.XLS]Super Stock'!$AA107 -> 188
I104: ='\\ser\software\other\[POINTS NQS  2012.XLS]Super Stock'!$A108 -> 102 | J104: ='\\ser\software\other\[POINTS NQS  2012.XLS]Super Stock'!$B108 -> Richard Lucabaugh | K104: ='\\ser\software\other\[POINTS NQS  2012.XLS]Super Stock'!$C108 -> Glen Rock, PA | L104: ='\\ser\software\other\[POINTS NQS  2012.XLS]Super Stock'!$D108 -> NP | M104: ='\\ser\software\other\[POINTS NQS  2012.XLS]Super Stock'!$E108 -> 494 | N104: =IF('\\ser\software\other\[POINTS NQS  2012.XLS]Super Stock'!$F108=0," ",'\\ser\software\other\[POINTS NQS  2012.XLS]Super Stock'!$F108) -> Cub | O104: ='\\ser\software\other\[POINTS NQS  2012.XLS]Super Stock'!$AA108 -> 188
I105: ='\\ser\software\other\[POINTS NQS  2012.XLS]Super Stock'!$A109 -> 103 | J105: ='\\ser\software\other\[POINTS NQS  2012.XLS]Super Stock'!$B109 -> Mike Dockhan | K105: ='\\ser\software\other\[POINTS NQS  2012.XLS]Super Stock'!$C109 -> Imlay City, Mich | L105: ='\\ser\software\other\[POINTS NQS  2012.XLS]Super Stock'!$D109 -> 0 | M105: ='\\ser\software\other\[POINTS NQS  2012.XLS]Super Stock'!$E109 -> 530 | N105: =IF('\\ser\software\other\[POINTS NQS  2012.XLS]Super Stock'!$F109=0," ",'\\ser\software\other\[POINTS NQS  2012.XLS]Super Stock'!$F109) -> Plain Blue | O105: ='\\ser\software\other\[POINTS NQS  2012.XLS]Super Stock'!$AA109 -> 188
I106: ='\\ser\software\other\[POINTS NQS  2012.XLS]Super Stock'!$A110 -> 104 | J106: ='\\ser\software\other\[POINTS NQS  2012.XLS]Super Stock'!$B110 -> Kevin Root | K106: ='\\ser\software\other\[POINTS NQS  2012.XLS]Super Stock'!$C110 -> Inola, OK | L106: ='\\ser\software\other\[POINTS NQS  2012.XLS]Super Stock'!$D110 -> Root | M106: ='\\ser\software\other\[POINTS NQS  2012.XLS]Super Stock'!$E110 -> 117 | N106: =IF('\\ser\software\other\[POINTS NQS  2012.XLS]Super Stock'!$F110=0," ",'\\ser\software\other\[POINTS NQS  2012.XLS]Super Stock'!$F110) -> Right on the Money | O106: ='\\ser\software\other\[POINTS NQS  2012.XLS]Super Stock'!$AA110 -> 189
I107: ='\\ser\software\other\[POINTS NQS  2012.XLS]Super Stock'!$A111 -> 105 | J107: ='\\ser\software\other\[POINTS NQS  2012.XLS]Super Stock'!$B111 -> Dave Gawatz | K107: ='\\ser\software\other\[POINTS NQS  2012.XLS]Super Stock'!$C111 -> St. Joseph, MO | L107: ='\\ser\software\other\[POINTS NQS  2012.XLS]Super Stock'!$D111 -> LR | M107: ='\\ser\software\other\[POINTS NQS  2012.XLS]Super Stock'!$E111 -> 367 | N107: =IF('\\ser\software\other\[POINTS NQS  2012.XLS]Super Stock'!$F111=0," ",'\\ser\software\other\[POINTS NQS  2012.XLS]Super Stock'!$F111) -> Lil' Sprout | O107: ='\\ser\software\other\[POINTS NQS  2012.XLS]Super Stock'!$AA111 -> 189
I108: ='\\ser\software\other\[POINTS NQS  2012.XLS]Super Stock'!$A112 -> 106 | J108: ='\\ser\software\other\[POINTS NQS  2012.XLS]Super Stock'!$B112 -> Denis Chilcoat | K108: ='\\ser\software\other\[POINTS NQS  2012.XLS]Super Stock'!$C112 -> Seven Valley, PA | L108: ='\\ser\software\other\[POINTS NQS  2012.XLS]Super Stock'!$D112 -> 0 | M108: ='\\ser\software\other\[POINTS NQS  2012.XLS]Super Stock'!$E112 -> 528 | N108: =IF('\\ser\software\other\[POINTS NQS  2012.XLS]Super Stock'!$F112=0," ",'\\ser\software\other\[POINTS NQS  2012.XLS]Super Stock'!$F112) ->  | O108: ='\\ser\software\other\[POINTS NQS  2012.XLS]Super Stock'!$AA112 -> 189
I109: ='\\ser\software\other\[POINTS NQS  2012.XLS]Super Stock'!$A113 -> 107 | J109: ='\\ser\software\other\[POINTS NQS  2012.XLS]Super Stock'!$B113 -> Ron Scroggins | K109: ='\\ser\software\other\[POINTS NQS  2012.XLS]Super Stock'!$C113 -> Neosho, MO | L109: ='\\ser\software\other\[POINTS NQS  2012.XLS]Super Stock'!$D113 -> VM | M109: ='\\ser\software\other\[POINTS NQS  2012.XLS]Super Stock'!$E113 -> 110 | N109: =IF('\\ser\software\other\[POINTS NQS  2012.XLS]Super Stock'!$F113=0," ",'\\ser\software\other\[POINTS NQS  2012.XLS]Super Stock'!$F113) -> Dirt Dancer | O109: ='\\ser\software\other\[POINTS NQS  2012.XLS]Super Stock'!$AA113 -> 190
I110: ='\\ser\software\other\[POINTS NQS  2012.XLS]Super Stock'!$A114 -> 108 | J110: ='\\ser\software\other\[POINTS NQS  2012.XLS]Super Stock'!$B114 -> Jeff Chrisman | K110: ='\\ser\software\other\[POINTS NQS  2012.XLS]Super Stock'!$C114 -> Edinburgh, IN | L110: ='\\ser\software\other\[POINTS NQS  2012.XLS]Super Stock'!$D114 -> VM | M110: ='\\ser\software\other\[POINTS NQS  2012.XLS]Super Stock'!$E114 -> 180 | N110: =IF('\\ser\software\other\[POINTS NQS  2012.XLS]Super Stock'!$F114=0," ",'\\ser\software\other\[POINTS NQS  2012.XLS]Super Stock'!$F114) ->  | O110: ='\\ser\software\other\[POINTS NQS  2012.XLS]Super Stock'!$AA114 -> 190
I111: ='\\ser\software\other\[POINTS NQS  2012.XLS]Super Stock'!$A115 -> 109 | J111: ='\\ser\software\other\[POINTS NQS  2012.XLS]Super Stock'!$B115 -> Phil Burton | K111: ='\\ser\software\other\[POINTS NQS  2012.XLS]Super Stock'!$C115 -> Kokomo, IN | L111: ='\\ser\software\other\[POINTS NQS  2012.XLS]Super Stock'!$D115 -> Jagerville | M111: ='\\ser\software\other\[POINTS NQS  2012.XLS]Super Stock'!$E115 -> 519 | N111: =IF('\\ser\software\other\[POINTS NQS  2012.XLS]Super Stock'!$F115=0," ",'\\ser\software\other\[POINTS NQS  2012.XLS]Super Stock'!$F115) -> Goofy Express | O111: ='\\ser\software\other\[POINTS NQS  2012.XLS]Super Stock'!$AA115 -> 190
I112: ='\\ser\software\other\[POINTS NQS  2012.XLS]Super Stock'!$A116 -> 110 | J112: ='\\ser\software\other\[POINTS NQS  2012.XLS]Super Stock'!$B116 -> Kyle Hunter | K112: ='\\ser\software\other\[POINTS NQS  2012.XLS]Super Stock'!$C116 -> Montoursville, Pa | L112: ='\\ser\software\other\[POINTS NQS  2012.XLS]Super Stock'!$D116 -> 0 | M112: ='\\ser\software\other\[POINTS NQS  2012.XLS]Super Stock'!$E116 -> 542 | N112: =IF('\\ser\software\other\[POINTS NQS  2012.XLS]Super Stock'!$F116=0," ",'\\ser\software\other\[POINTS NQS  2012.XLS]Super Stock'!$F116) ->  | O112: ='\\ser\software\other\[POINTS NQS  2012.XLS]Super Stock'!$AA116 -> 190
I113: ='\\ser\software\other\[POINTS NQS  2012.XLS]Super Stock'!$A117 -> 111 | J113: ='\\ser\software\other\[POINTS NQS  2012.XLS]Super Stock'!$B117 -> Lee Blesch | K113: ='\\ser\software\other\[POINTS NQS  2012.XLS]Super Stock'!$C117 -> Holland, IN | L113: ='\\ser\software\other\[POINTS NQS  2012.XLS]Super Stock'!$D117 -> TC | M113: ='\\ser\software\other\[POINTS NQS  2012.XLS]Super Stock'!$E117 -> 344 | N113: =IF('\\ser\software\other\[POINTS NQS  2012.XLS]Super Stock'!$F117=0," ",'\\ser\software\other\[POINTS NQS  2012.XLS]Super Stock'!$F117) -> Orange Blossom Special | O113: ='\\ser\software\other\[POINTS NQS  2012.XLS]Super Stock'!$AA117 -> 191
I114: ='\\ser\software\other\[POINTS NQS  2012.XLS]Super Stock'!$A118 -> 112 | J114: ='\\ser\software\other\[POINTS NQS  2012.XLS]Super Stock'!$B118 -> Scott DeFabritis | K114: ='\\ser\software\other\[POINTS NQS  2012.XLS]Super Stock'!$C118 -> Kokomo, IN | L114: ='\\ser\software\other\[POINTS NQS  2012.XLS]Super Stock'!$D118 -> Jagerville | M114: ='\\ser\software\other\[POINTS NQS  2012.XLS]Super Stock'!$E118 -> 518 | N114: =IF('\\ser\software\other\[POINTS NQS  2012.XLS]Super Stock'!$F118=0," ",'\\ser\software\other\[POINTS NQS  2012.XLS]Super Stock'!$F118) -> Back Yard Banshee | O114: ='\\ser\software\other\[POINTS NQS  2012.XLS]Super Stock'!$AA118 -> 191
I115: ='\\ser\software\other\[POINTS NQS  2012.XLS]Super Stock'!$A119 -> 113 | J115: ='\\ser\software\other\[POINTS NQS  2012.XLS]Super Stock'!$B119 -> Nick Moeller | K115: ='\\ser\software\other\[POINTS NQS  2012.XLS]Super Stock'!$C119 -> Effingham, IL | L115: ='\\ser\software\other\[POINTS NQS  2012.XLS]Super Stock'!$D119 -> Moeller | M115: ='\\ser\software\other\[POINTS NQS  2012.XLS]Super Stock'!$E119 -> 520 | N115: =IF('\\ser\software\other\[POINTS NQS  2012.XLS]Super Stock'!$F119=0," ",'\\ser\software\other\[POINTS NQS  2012.XLS]Super Stock'!$F119) -> Bull on IX | O115: ='\\ser\software\other\[POINTS NQS  2012.XLS]Super Stock'!$AA119 -> 191
I116: ='\\ser\software\other\[POINTS NQS  2012.XLS]Super Stock'!$A120 -> 114 | J116: ='\\ser\software\other\[POINTS NQS  2012.XLS]Super Stock'!$B120 -> Kevin Root | K116: ='\\ser\software\other\[POINTS NQS  2012.XLS]Super Stock'!$C120 -> Inola, OK | L116: ='\\ser\software\other\[POINTS NQS  2012.XLS]Super Stock'!$D120 -> Root | M116: ='\\ser\software\other\[POINTS NQS  2012.XLS]Super Stock'!$E120 -> 118 | N116: =IF('\\ser\software\other\[POINTS NQS  2012.XLS]Super Stock'!$F120=0," ",'\\ser\software\other\[POINTS NQS  2012.XLS]Super Stock'!$F120) -> Slap Shot | O116: ='\\ser\software\other\[POINTS NQS  2012.XLS]Super Stock'!$AA120 -> 192