B1: 30 Cube | F1: Thru Richmond | I1: Pro V Twin | N1: Thru Richmond
B2: Name | C2: City/State | D2: NQS # | E2: Tractor | F2: Points Back | J2: Name | K2: City/State | L2: NQS # | M2: Tractor | N2: Points Back
A3: ='\\ser\software\other\[POINTS NQS  2012.XLS]30 Cube'!$A7 -> 1 | B3: ='\\ser\software\other\[POINTS NQS  2012.XLS]30 Cube'!$B7 -> Greg Heifner | C3: ='\\ser\software\other\[POINTS NQS  2012.XLS]30 Cube'!$C7 -> Jeromesville, OH | D3: ='\\ser\software\other\[POINTS NQS  2012.XLS]30 Cube'!$D7 -> 114 | E3: =IF('\\ser\software\other\[POINTS NQS  2012.XLS]30 Cube'!$E7=0," ",'\\ser\software\other\[POINTS NQS  2012.XLS]30 Cube'!$E7) -> Twisted | F3: ='\\ser\software\other\[POINTS NQS  2012.XLS]30 Cube'!$AA7 -> 0 | I3: ='\\ser\software\other\[POINTS NQS  2012.XLS]Pro V Twin'!$A7 -> 1 | J3: ='\\ser\software\other\[POINTS NQS  2012.XLS]Pro V Twin'!$B7 -> Kenny Cornelison | K3: ='\\ser\software\other\[POINTS NQS  2012.XLS]Pro V Twin'!$C7 -> Richmond, KY | L3: ='\\ser\software\other\[POINTS NQS  2012.XLS]Pro V Twin'!$D7 -> 149 | M3: =IF('\\ser\software\other\[POINTS NQS  2012.XLS]Pro V Twin'!$E7=0," ",'\\ser\software\other\[POINTS NQS  2012.XLS]Pro V Twin'!$E7) -> Storm Alert | N3: ='\\ser\software\other\[POINTS NQS  2012.XLS]Pro V Twin'!$AA7 -> 0
A4: ='\\ser\software\other\[POINTS NQS  2012.XLS]30 Cube'!$A8 -> 2 | B4: ='\\ser\software\other\[POINTS NQS  2012.XLS]30 Cube'!$B8 -> Tony Heifner | C4: ='\\ser\software\other\[POINTS NQS  2012.XLS]30 Cube'!$C8 -> Jeromesville, OH | D4: ='\\ser\software\other\[POINTS NQS  2012.XLS]30 Cube'!$D8 -> 116 | E4: =IF('\\ser\software\other\[POINTS NQS  2012.XLS]30 Cube'!$E8=0," ",'\\ser\software\other\[POINTS NQS  2012.XLS]30 Cube'!$E8) -> Heartbeat | F4: ='\\ser\software\other\[POINTS NQS  2012.XLS]30 Cube'!$AA8 -> 3 | I4: ='\\ser\software\other\[POINTS NQS  2012.XLS]Pro V Twin'!$A8 -> 2 | J4: ='\\ser\software\other\[POINTS NQS  2012.XLS]Pro V Twin'!$B8 -> Rob Wise | K4: ='\\ser\software\other\[POINTS NQS  2012.XLS]Pro V Twin'!$C8 -> Greensburg, PA | L4: ='\\ser\software\other\[POINTS NQS  2012.XLS]Pro V Twin'!$D8 -> 209 | M4: =IF('\\ser\software\other\[POINTS NQS  2012.XLS]Pro V Twin'!$E8=0," ",'\\ser\software\other\[POINTS NQS  2012.XLS]Pro V Twin'!$E8) -> Long Shot | N4: ='\\ser\software\other\[POINTS NQS  2012.XLS]Pro V Twin'!$AA8 -> 3
A5: ='\\ser\software\other\[POINTS NQS  2012.XLS]30 Cube'!$A9 -> 3 | B5: ='\\ser\software\other\[POINTS NQS  2012.XLS]30 Cube'!$B9 -> Tony Lewis | C5: ='\\ser\software\other\[POINTS NQS  2012.XLS]30 Cube'!$C9 -> Edinburgh, IN | D5: ='\\ser\software\other\[POINTS NQS  2012.XLS]30 Cube'!$D9 -> 345 | E5: =IF('\\ser\software\other\[POINTS NQS  2012.XLS]30 Cube'!$E9=0," ",'\\ser\software\other\[POINTS NQS  2012.XLS]30 Cube'!$E9) -> Plain Jane | F5: ='\\ser\software\other\[POINTS NQS  2012.XLS]30 Cube'!$AA9 -> 5 | I5: ='\\ser\software\other\[POINTS NQS  2012.XLS]Pro V Twin'!$A9 -> 3 | J5: ='\\ser\software\other\[POINTS NQS  2012.XLS]Pro V Twin'!$B9 -> Jim Hull | K5: ='\\ser\software\other\[POINTS NQS  2012.XLS]Pro V Twin'!$C9 -> Brandon, WI | L5: ='\\ser\software\other\[POINTS NQS  2012.XLS]Pro V Twin'!$D9 -> 334 | M5: =IF('\\ser\software\other\[POINTS NQS  2012.XLS]Pro V Twin'!$E9=0," ",'\\ser\software\other\[POINTS NQS  2012.XLS]Pro V Twin'!$E9) -> Simply Irresistable | N5: ='\\ser\software\other\[POINTS NQS  2012.XLS]Pro V Twin'!$AA9 -> 4
A6: ='\\ser\software\other\[POINTS NQS  2012.XLS]30 Cube'!$A10 -> 4 | B6: ='\\ser\software\other\[POINTS NQS  2012.XLS]30 Cube'!$B10 -> Pat Roth | C6: ='\\ser\software\other\[POINTS NQS  2012.XLS]30 Cube'!$C10 -> Idaville, IN | D6: ='\\ser\software\other\[POINTS NQS  2012.XLS]30 Cube'!$D10 -> 61 | E6: =IF('\\ser\software\other\[POINTS NQS  2012.XLS]30 Cube'!$E10=0," ",'\\ser\software\other\[POINTS NQS  2012.XLS]30 Cube'!$E10) ->  | F6: ='\\ser\software\other\[POINTS NQS  2012.XLS]30 Cube'!$AA10 -> 7 | I6: ='\\ser\software\other\[POINTS NQS  2012.XLS]Pro V Twin'!$A10 -> 4 | J6: ='\\ser\software\other\[POINTS NQS  2012.XLS]Pro V Twin'!$B10 -> Harrison Stahl | K6: ='\\ser\software\other\[POINTS NQS  2012.XLS]Pro V Twin'!$C10 -> Dewitt,IA | L6: ='\\ser\software\other\[POINTS NQS  2012.XLS]Pro V Twin'!$D10 -> 4 | M6: =IF('\\ser\software\other\[POINTS NQS  2012.XLS]Pro V Twin'!$E10=0," ",'\\ser\software\other\[POINTS NQS  2012.XLS]Pro V Twin'!$E10) -> Tons of Fun | N6: ='\\ser\software\other\[POINTS NQS  2012.XLS]Pro V Twin'!$AA10 -> 5
A7: ='\\ser\software\other\[POINTS NQS  2012.XLS]30 Cube'!$A11 -> 5 | B7: ='\\ser\software\other\[POINTS NQS  2012.XLS]30 Cube'!$B11 -> Randy Amstutz | C7: ='\\ser\software\other\[POINTS NQS  2012.XLS]30 Cube'!$C11 -> Berne, In | D7: ='\\ser\software\other\[POINTS NQS  2012.XLS]30 Cube'!$D11 -> 534 | E7: =IF('\\ser\software\other\[POINTS NQS  2012.XLS]30 Cube'!$E11=0," ",'\\ser\software\other\[POINTS NQS  2012.XLS]30 Cube'!$E11) ->  | F7: ='\\ser\software\other\[POINTS NQS  2012.XLS]30 Cube'!$AA11 -> 33 | I7: ='\\ser\software\other\[POINTS NQS  2012.XLS]Pro V Twin'!$A11 -> 5 | J7: ='\\ser\software\other\[POINTS NQS  2012.XLS]Pro V Twin'!$B11 -> Lowell Vis | K7: ='\\ser\software\other\[POINTS NQS  2012.XLS]Pro V Twin'!$C11 -> Waupun, WI | L7: ='\\ser\software\other\[POINTS NQS  2012.XLS]Pro V Twin'!$D11 -> 333 | M7: =IF('\\ser\software\other\[POINTS NQS  2012.XLS]Pro V Twin'!$E11=0," ",'\\ser\software\other\[POINTS NQS  2012.XLS]Pro V Twin'!$E11) -> Skittles | N7: ='\\ser\software\other\[POINTS NQS  2012.XLS]Pro V Twin'!$AA11 -> 7
A8: ='\\ser\software\other\[POINTS NQS  2012.XLS]30 Cube'!$A12 -> 6 | B8: ='\\ser\software\other\[POINTS NQS  2012.XLS]30 Cube'!$B12 -> Shawn Garman | C8: ='\\ser\software\other\[POINTS NQS  2012.XLS]30 Cube'!$C12 -> Perrysville, Oh | D8: ='\\ser\software\other\[POINTS NQS  2012.XLS]30 Cube'!$D12 -> 230 | E8: =IF('\\ser\software\other\[POINTS NQS  2012.XLS]30 Cube'!$E12=0," ",'\\ser\software\other\[POINTS NQS  2012.XLS]30 Cube'!$E12) -> Gun Slinger | F8: ='\\ser\software\other\[POINTS NQS  2012.XLS]30 Cube'!$AA12 -> 59 | I8: ='\\ser\software\other\[POINTS NQS  2012.XLS]Pro V Twin'!$A12 -> 6 | J8: ='\\ser\software\other\[POINTS NQS  2012.XLS]Pro V Twin'!$B12 -> Ryan Richter | K8: ='\\ser\software\other\[POINTS NQS  2012.XLS]Pro V Twin'!$C12 -> Connellsville, PA | L8: ='\\ser\software\other\[POINTS NQS  2012.XLS]Pro V Twin'!$D12 -> 502 | M8: =IF('\\ser\software\other\[POINTS NQS  2012.XLS]Pro V Twin'!$E12=0," ",'\\ser\software\other\[POINTS NQS  2012.XLS]Pro V Twin'!$E12) -> Radical Rat | N8: ='\\ser\software\other\[POINTS NQS  2012.XLS]Pro V Twin'!$AA12 -> 10
A9: ='\\ser\software\other\[POINTS NQS  2012.XLS]30 Cube'!$A13 -> 7 | B9: ='\\ser\software\other\[POINTS NQS  2012.XLS]30 Cube'!$B13 -> Doug Rood | C9: ='\\ser\software\other\[POINTS NQS  2012.XLS]30 Cube'!$C13 -> Ypsilanti, MI | D9: ='\\ser\software\other\[POINTS NQS  2012.XLS]30 Cube'!$D13 -> 354 | E9: =IF('\\ser\software\other\[POINTS NQS  2012.XLS]30 Cube'!$E13=0," ",'\\ser\software\other\[POINTS NQS  2012.XLS]30 Cube'!$E13) -> Blue Dawg | F9: ='\\ser\software\other\[POINTS NQS  2012.XLS]30 Cube'!$AA13 -> 59 | I9: ='\\ser\software\other\[POINTS NQS  2012.XLS]Pro V Twin'!$A13 -> 7 | J9: ='\\ser\software\other\[POINTS NQS  2012.XLS]Pro V Twin'!$B13 -> Mike Spencer | K9: ='\\ser\software\other\[POINTS NQS  2012.XLS]Pro V Twin'!$C13 -> West Alexandria, WI | L9: ='\\ser\software\other\[POINTS NQS  2012.XLS]Pro V Twin'!$D13 -> 278 | M9: =IF('\\ser\software\other\[POINTS NQS  2012.XLS]Pro V Twin'!$E13=0," ",'\\ser\software\other\[POINTS NQS  2012.XLS]Pro V Twin'!$E13) -> Long Shot | N9: ='\\ser\software\other\[POINTS NQS  2012.XLS]Pro V Twin'!$AA13 -> 36
A10: ='\\ser\software\other\[POINTS NQS  2012.XLS]30 Cube'!$A14 -> 8 | B10: ='\\ser\software\other\[POINTS NQS  2012.XLS]30 Cube'!$B14 -> Rick Massey | C10: ='\\ser\software\other\[POINTS NQS  2012.XLS]30 Cube'!$C14 -> Ava, MO | D10: ='\\ser\software\other\[POINTS NQS  2012.XLS]30 Cube'!$D14 -> 421 | E10: =IF('\\ser\software\other\[POINTS NQS  2012.XLS]30 Cube'!$E14=0," ",'\\ser\software\other\[POINTS NQS  2012.XLS]30 Cube'!$E14) -> Spare Parts | F10: ='\\ser\software\other\[POINTS NQS  2012.XLS]30 Cube'!$AA14 -> 60 | I10: ='\\ser\software\other\[POINTS NQS  2012.XLS]Pro V Twin'!$A14 -> 8 | J10: ='\\ser\software\other\[POINTS NQS  2012.XLS]Pro V Twin'!$B14 -> Kenny Cornelison | K10: ='\\ser\software\other\[POINTS NQS  2012.XLS]Pro V Twin'!$C14 -> Richmond, KY | L10: ='\\ser\software\other\[POINTS NQS  2012.XLS]Pro V Twin'!$D14 -> 536 | M10: =IF('\\ser\software\other\[POINTS NQS  2012.XLS]Pro V Twin'!$E14=0," ",'\\ser\software\other\[POINTS NQS  2012.XLS]Pro V Twin'!$E14) -> Storm X | N10: ='\\ser\software\other\[POINTS NQS  2012.XLS]Pro V Twin'!$AA14 -> 37
A11: ='\\ser\software\other\[POINTS NQS  2012.XLS]30 Cube'!$A15 -> 9 | B11: ='\\ser\software\other\[POINTS NQS  2012.XLS]30 Cube'!$B15 -> George Bax | C11: ='\\ser\software\other\[POINTS NQS  2012.XLS]30 Cube'!$C15 -> St. Thomas, MO | D11: ='\\ser\software\other\[POINTS NQS  2012.XLS]30 Cube'!$D15 -> 422 | E11: =IF('\\ser\software\other\[POINTS NQS  2012.XLS]30 Cube'!$E15=0," ",'\\ser\software\other\[POINTS NQS  2012.XLS]30 Cube'!$E15) -> Plum Crazy | F11: ='\\ser\software\other\[POINTS NQS  2012.XLS]30 Cube'!$AA15 -> 63 | I11: ='\\ser\software\other\[POINTS NQS  2012.XLS]Pro V Twin'!$A15 -> 9 | J11: ='\\ser\software\other\[POINTS NQS  2012.XLS]Pro V Twin'!$B15 -> Jim Waite | K11: ='\\ser\software\other\[POINTS NQS  2012.XLS]Pro V Twin'!$C15 -> 0 | L11: ='\\ser\software\other\[POINTS NQS  2012.XLS]Pro V Twin'!$D15 -> 480 | M11: =IF('\\ser\software\other\[POINTS NQS  2012.XLS]Pro V Twin'!$E15=0," ",'\\ser\software\other\[POINTS NQS  2012.XLS]Pro V Twin'!$E15) -> John Deere | N11: ='\\ser\software\other\[POINTS NQS  2012.XLS]Pro V Twin'!$AA15 -> 60
A12: ='\\ser\software\other\[POINTS NQS  2012.XLS]30 Cube'!$A16 -> 10 | B12: ='\\ser\software\other\[POINTS NQS  2012.XLS]30 Cube'!$B16 -> Greg Block | C12: ='\\ser\software\other\[POINTS NQS  2012.XLS]30 Cube'!$C16 -> Jefferson City, MO | D12: ='\\ser\software\other\[POINTS NQS  2012.XLS]30 Cube'!$D16 -> 435 | E12: =IF('\\ser\software\other\[POINTS NQS  2012.XLS]30 Cube'!$E16=0," ",'\\ser\software\other\[POINTS NQS  2012.XLS]30 Cube'!$E16) -> Pocket Change | F12: ='\\ser\software\other\[POINTS NQS  2012.XLS]30 Cube'!$AA16 -> 64 | I12: ='\\ser\software\other\[POINTS NQS  2012.XLS]Pro V Twin'!$A16 -> 10 | J12: ='\\ser\software\other\[POINTS NQS  2012.XLS]Pro V Twin'!$B16 -> Eric Varner | K12: ='\\ser\software\other\[POINTS NQS  2012.XLS]Pro V Twin'!$C16 -> 0 | L12: ='\\ser\software\other\[POINTS NQS  2012.XLS]Pro V Twin'!$D16 -> 482 | M12: =IF('\\ser\software\other\[POINTS NQS  2012.XLS]Pro V Twin'!$E16=0," ",'\\ser\software\other\[POINTS NQS  2012.XLS]Pro V Twin'!$E16) -> Extreme Addiction | N12: ='\\ser\software\other\[POINTS NQS  2012.XLS]Pro V Twin'!$AA16 -> 61
A13: ='\\ser\software\other\[POINTS NQS  2012.XLS]30 Cube'!$A17 -> 11 | B13: ='\\ser\software\other\[POINTS NQS  2012.XLS]30 Cube'!$B17 -> Kole Larkins | C13: ='\\ser\software\other\[POINTS NQS  2012.XLS]30 Cube'!$C17 -> Kearney, MO | D13: ='\\ser\software\other\[POINTS NQS  2012.XLS]30 Cube'!$D17 -> 372 | E13: =IF('\\ser\software\other\[POINTS NQS  2012.XLS]30 Cube'!$E17=0," ",'\\ser\software\other\[POINTS NQS  2012.XLS]30 Cube'!$E17) -> Wound Up | F13: ='\\ser\software\other\[POINTS NQS  2012.XLS]30 Cube'!$AA17 -> 65 | I13: ='\\ser\software\other\[POINTS NQS  2012.XLS]Pro V Twin'!$A17 -> 11 | J13: ='\\ser\software\other\[POINTS NQS  2012.XLS]Pro V Twin'!$B17 -> Jerry Everhart | K13: ='\\ser\software\other\[POINTS NQS  2012.XLS]Pro V Twin'!$C17 -> Springfield, OH | L13: ='\\ser\software\other\[POINTS NQS  2012.XLS]Pro V Twin'!$D17 -> 483 | M13: =IF('\\ser\software\other\[POINTS NQS  2012.XLS]Pro V Twin'!$E17=0," ",'\\ser\software\other\[POINTS NQS  2012.XLS]Pro V Twin'!$E17) -> Orange Cart | N13: ='\\ser\software\other\[POINTS NQS  2012.XLS]Pro V Twin'!$AA17 -> 61
A14: ='\\ser\software\other\[POINTS NQS  2012.XLS]30 Cube'!$A18 -> 12 | B14: ='\\ser\software\other\[POINTS NQS  2012.XLS]30 Cube'!$B18 -> Ben Larkins | C14: ='\\ser\software\other\[POINTS NQS  2012.XLS]30 Cube'!$C18 -> Kearney, MO | D14: ='\\ser\software\other\[POINTS NQS  2012.XLS]30 Cube'!$D18 -> 137 | E14: =IF('\\ser\software\other\[POINTS NQS  2012.XLS]30 Cube'!$E18=0," ",'\\ser\software\other\[POINTS NQS  2012.XLS]30 Cube'!$E18) -> Indian Outlaw | F14: ='\\ser\software\other\[POINTS NQS  2012.XLS]30 Cube'!$AA18 -> 66 | I14: ='\\ser\software\other\[POINTS NQS  2012.XLS]Pro V Twin'!$A18 -> 12 | J14: ='\\ser\software\other\[POINTS NQS  2012.XLS]Pro V Twin'!$B18 -> Shawn Dukes | K14: ='\\ser\software\other\[POINTS NQS  2012.XLS]Pro V Twin'!$C18 -> Cavert City, KY | L14: ='\\ser\software\other\[POINTS NQS  2012.XLS]Pro V Twin'!$D18 -> 521 | M14: =IF('\\ser\software\other\[POINTS NQS  2012.XLS]Pro V Twin'!$E18=0," ",'\\ser\software\other\[POINTS NQS  2012.XLS]Pro V Twin'!$E18) -> Blown | N14: ='\\ser\software\other\[POINTS NQS  2012.XLS]Pro V Twin'!$AA18 -> 62
I15: ='\\ser\software\other\[POINTS NQS  2012.XLS]Pro V Twin'!$A19 -> 13 | J15: ='\\ser\software\other\[POINTS NQS  2012.XLS]Pro V Twin'!$B19 -> Bobby Knight | K15: ='\\ser\software\other\[POINTS NQS  2012.XLS]Pro V Twin'!$C19 -> Mohawk, Tn | L15: ='\\ser\software\other\[POINTS NQS  2012.XLS]Pro V Twin'!$D19 -> 566 | M15: =IF('\\ser\software\other\[POINTS NQS  2012.XLS]Pro V Twin'!$E19=0," ",'\\ser\software\other\[POINTS NQS  2012.XLS]Pro V Twin'!$E19) -> Quick Silver | N15: ='\\ser\software\other\[POINTS NQS  2012.XLS]Pro V Twin'!$AA19 -> 62
I16: ='\\ser\software\other\[POINTS NQS  2012.XLS]Pro V Twin'!$A20 -> 14 | J16: ='\\ser\software\other\[POINTS NQS  2012.XLS]Pro V Twin'!$B20 -> Matt Kaster | K16: ='\\ser\software\other\[POINTS NQS  2012.XLS]Pro V Twin'!$C20 -> Burlington, IA | L16: ='\\ser\software\other\[POINTS NQS  2012.XLS]Pro V Twin'!$D20 -> 99 | M16: =IF('\\ser\software\other\[POINTS NQS  2012.XLS]Pro V Twin'!$E20=0," ",'\\ser\software\other\[POINTS NQS  2012.XLS]Pro V Twin'!$E20) -> Sound of Madness | N16: ='\\ser\software\other\[POINTS NQS  2012.XLS]Pro V Twin'!$AA20 -> 63
I17: ='\\ser\software\other\[POINTS NQS  2012.XLS]Pro V Twin'!$A21 -> 15 | J17: ='\\ser\software\other\[POINTS NQS  2012.XLS]Pro V Twin'!$B21 -> Ryan Shafer | K17: ='\\ser\software\other\[POINTS NQS  2012.XLS]Pro V Twin'!$C21 -> Confluence, Pa | L17: ='\\ser\software\other\[POINTS NQS  2012.XLS]Pro V Twin'!$D21 -> 445 | M17: =IF('\\ser\software\other\[POINTS NQS  2012.XLS]Pro V Twin'!$E21=0," ",'\\ser\software\other\[POINTS NQS  2012.XLS]Pro V Twin'!$E21) -> LabRat | N17: ='\\ser\software\other\[POINTS NQS  2012.XLS]Pro V Twin'!$AA21 -> 63
I18: ='\\ser\software\other\[POINTS NQS  2012.XLS]Pro V Twin'!$A22 -> 16 | J18: ='\\ser\software\other\[POINTS NQS  2012.XLS]Pro V Twin'!$B22 -> Travis Cobble | K18: ='\\ser\software\other\[POINTS NQS  2012.XLS]Pro V Twin'!$C22 -> Bullgap, TN | L18: ='\\ser\software\other\[POINTS NQS  2012.XLS]Pro V Twin'!$D22 -> 565 | M18: =IF('\\ser\software\other\[POINTS NQS  2012.XLS]Pro V Twin'!$E22=0," ",'\\ser\software\other\[POINTS NQS  2012.XLS]Pro V Twin'!$E22) -> Papaws Nightmare | N18: ='\\ser\software\other\[POINTS NQS  2012.XLS]Pro V Twin'!$AA22 -> 63
B22: OPEN SUPER STOCK | F22: Thru Richmond
B23: Name | C23: City/State | D23: NQS # | E23: Tractor | F23: Points Back
A24: ='\\ser\software\other\[POINTS NQS  2012.XLS]Open Super Stock'!$A7 -> 1 | B24: ='\\ser\software\other\[POINTS NQS  2012.XLS]Open Super Stock'!$B7 -> Julian Stahl | C24: ='\\ser\software\other\[POINTS NQS  2012.XLS]Open Super Stock'!$C7 -> Welton, IA | D24: ='\\ser\software\other\[POINTS NQS  2012.XLS]Open Super Stock'!$D7 -> 5 | E24: =IF('\\ser\software\other\[POINTS NQS  2012.XLS]Open Super Stock'!$E7=0," ",'\\ser\software\other\[POINTS NQS  2012.XLS]Open Super Stock'!$E7) -> Midwest Express | F24: ='\\ser\software\other\[POINTS NQS  2012.XLS]Open Super Stock'!$AA7 -> 0
A25: ='\\ser\software\other\[POINTS NQS  2012.XLS]Open Super Stock'!$A8 -> 2 | B25: ='\\ser\software\other\[POINTS NQS  2012.XLS]Open Super Stock'!$B8 -> Harrison Stahl | C25: ='\\ser\software\other\[POINTS NQS  2012.XLS]Open Super Stock'!$C8 -> Dewitt, IA | D25: ='\\ser\software\other\[POINTS NQS  2012.XLS]Open Super Stock'!$D8 -> 4 | E25: =IF('\\ser\software\other\[POINTS NQS  2012.XLS]Open Super Stock'!$E8=0," ",'\\ser\software\other\[POINTS NQS  2012.XLS]Open Super Stock'!$E8) -> Ton of Fun | F25: ='\\ser\software\other\[POINTS NQS  2012.XLS]Open Super Stock'!$AA8 -> 10
A26: ='\\ser\software\other\[POINTS NQS  2012.XLS]Open Super Stock'!$A9 -> 3 | B26: ='\\ser\software\other\[POINTS NQS  2012.XLS]Open Super Stock'!$B9 -> Julian Stahl | C26: ='\\ser\software\other\[POINTS NQS  2012.XLS]Open Super Stock'!$C9 -> Welton, IA | D26: ='\\ser\software\other\[POINTS NQS  2012.XLS]Open Super Stock'!$D9 -> 433 | E26: =IF('\\ser\software\other\[POINTS NQS  2012.XLS]Open Super Stock'!$E9=0," ",'\\ser\software\other\[POINTS NQS  2012.XLS]Open Super Stock'!$E9) -> Fully Charged | F26: ='\\ser\software\other\[POINTS NQS  2012.XLS]Open Super Stock'!$AA9 -> 13
A27: ='\\ser\software\other\[POINTS NQS  2012.XLS]Open Super Stock'!$A10 -> 4 | B27: ='\\ser\software\other\[POINTS NQS  2012.XLS]Open Super Stock'!$B10 -> Ryan Richter | C27: ='\\ser\software\other\[POINTS NQS  2012.XLS]Open Super Stock'!$C10 -> Connellsville, PA | D27: ='\\ser\software\other\[POINTS NQS  2012.XLS]Open Super Stock'!$D10 -> 502 | E27: =IF('\\ser\software\other\[POINTS NQS  2012.XLS]Open Super Stock'!$E10=0," ",'\\ser\software\other\[POINTS NQS  2012.XLS]Open Super Stock'!$E10) -> Radical Rat | F27: ='\\ser\software\other\[POINTS NQS  2012.XLS]Open Super Stock'!$AA10 -> 24
A28: ='\\ser\software\other\[POINTS NQS  2012.XLS]Open Super Stock'!$A11 -> 5 | B28: ='\\ser\software\other\[POINTS NQS  2012.XLS]Open Super Stock'!$B11 -> Ryan Shafer | C28: ='\\ser\software\other\[POINTS NQS  2012.XLS]Open Super Stock'!$C11 -> Confluence, PA | D28: ='\\ser\software\other\[POINTS NQS  2012.XLS]Open Super Stock'!$D11 -> 445 | E28: =IF('\\ser\software\other\[POINTS NQS  2012.XLS]Open Super Stock'!$E11=0," ",'\\ser\software\other\[POINTS NQS  2012.XLS]Open Super Stock'!$E11) -> Labrat | F28: ='\\ser\software\other\[POINTS NQS  2012.XLS]Open Super Stock'!$AA11 -> 38
A29: ='\\ser\software\other\[POINTS NQS  2012.XLS]Open Super Stock'!$A12 -> 6 | B29: ='\\ser\software\other\[POINTS NQS  2012.XLS]Open Super Stock'!$B12 -> Bruce Austin | C29: ='\\ser\software\other\[POINTS NQS  2012.XLS]Open Super Stock'!$C12 -> St. Charles, IA | D29: ='\\ser\software\other\[POINTS NQS  2012.XLS]Open Super Stock'!$D12 -> 169 | E29: =IF('\\ser\software\other\[POINTS NQS  2012.XLS]Open Super Stock'!$E12=0," ",'\\ser\software\other\[POINTS NQS  2012.XLS]Open Super Stock'!$E12) -> Thundertaker | F29: ='\\ser\software\other\[POINTS NQS  2012.XLS]Open Super Stock'!$AA12 -> 74
A30: ='\\ser\software\other\[POINTS NQS  2012.XLS]Open Super Stock'!$A13 -> 7 | B30: ='\\ser\software\other\[POINTS NQS  2012.XLS]Open Super Stock'!$B13 -> Calvin Becker | C30: ='\\ser\software\other\[POINTS NQS  2012.XLS]Open Super Stock'!$C13 -> Whipple, Oh | D30: ='\\ser\software\other\[POINTS NQS  2012.XLS]Open Super Stock'!$D13 -> 113 | E30: =IF('\\ser\software\other\[POINTS NQS  2012.XLS]Open Super Stock'!$E13=0," ",'\\ser\software\other\[POINTS NQS  2012.XLS]Open Super Stock'!$E13) -> Spike | F30: ='\\ser\software\other\[POINTS NQS  2012.XLS]Open Super Stock'!$AA13 -> 119
A31: ='\\ser\software\other\[POINTS NQS  2012.XLS]Open Super Stock'!$A14 -> 8 | B31: ='\\ser\software\other\[POINTS NQS  2012.XLS]Open Super Stock'!$B14 -> Jim Waite | C31: ='\\ser\software\other\[POINTS NQS  2012.XLS]Open Super Stock'!$C14 -> Hopkinton, RI | D31: ='\\ser\software\other\[POINTS NQS  2012.XLS]Open Super Stock'!$D14 -> 480 | E31: =IF('\\ser\software\other\[POINTS NQS  2012.XLS]Open Super Stock'!$E14=0," ",'\\ser\software\other\[POINTS NQS  2012.XLS]Open Super Stock'!$E14) -> John Deere | F31: ='\\ser\software\other\[POINTS NQS  2012.XLS]Open Super Stock'!$AA14 -> 123
A32: ='\\ser\software\other\[POINTS NQS  2012.XLS]Open Super Stock'!$A15 -> 9 | B32: ='\\ser\software\other\[POINTS NQS  2012.XLS]Open Super Stock'!$B15 -> Bill Jacobson | C32: ='\\ser\software\other\[POINTS NQS  2012.XLS]Open Super Stock'!$C15 -> Washington, Mi | D32: ='\\ser\software\other\[POINTS NQS  2012.XLS]Open Super Stock'!$D15 -> 531 | E32: =IF('\\ser\software\other\[POINTS NQS  2012.XLS]Open Super Stock'!$E15=0," ",'\\ser\software\other\[POINTS NQS  2012.XLS]Open Super Stock'!$E15) -> Smoker 1 | F32: ='\\ser\software\other\[POINTS NQS  2012.XLS]Open Super Stock'!$AA15 -> 124
A33: ='\\ser\software\other\[POINTS NQS  2012.XLS]Open Super Stock'!$A16 -> 10 | B33: ='\\ser\software\other\[POINTS NQS  2012.XLS]Open Super Stock'!$B16 -> Jerry Everhart | C33: ='\\ser\software\other\[POINTS NQS  2012.XLS]Open Super Stock'!$C16 -> Springfield, OH | D33: ='\\ser\software\other\[POINTS NQS  2012.XLS]Open Super Stock'!$D16 -> 483 | E33: =IF('\\ser\software\other\[POINTS NQS  2012.XLS]Open Super Stock'!$E16=0," ",'\\ser\software\other\[POINTS NQS  2012.XLS]Open Super Stock'!$E16) ->  | F33: ='\\ser\software\other\[POINTS NQS  2012.XLS]Open Super Stock'!$AA16 -> 126
A34: ='\\ser\software\other\[POINTS NQS  2012.XLS]Open Super Stock'!$A17 -> 11 | B34: ='\\ser\software\other\[POINTS NQS  2012.XLS]Open Super Stock'!$B17 -> Ken Lucious | C34: ='\\ser\software\other\[POINTS NQS  2012.XLS]Open Super Stock'!$C17 -> Piro, Oh | D34: ='\\ser\software\other\[POINTS NQS  2012.XLS]Open Super Stock'!$D17 -> 156 | E34: =IF('\\ser\software\other\[POINTS NQS  2012.XLS]Open Super Stock'!$E17=0," ",'\\ser\software\other\[POINTS NQS  2012.XLS]Open Super Stock'!$E17) ->  | F34: ='\\ser\software\other\[POINTS NQS  2012.XLS]Open Super Stock'!$AA17 -> 130
A35: ='\\ser\software\other\[POINTS NQS  2012.XLS]Open Super Stock'!$A18 -> 12 | B35: ='\\ser\software\other\[POINTS NQS  2012.XLS]Open Super Stock'!$B18 -> Russ Nichols | C35: ='\\ser\software\other\[POINTS NQS  2012.XLS]Open Super Stock'!$C18 -> Lore City, Oh | D35: ='\\ser\software\other\[POINTS NQS  2012.XLS]Open Super Stock'!$D18 -> 552 | E35: =IF('\\ser\software\other\[POINTS NQS  2012.XLS]Open Super Stock'!$E18=0," ",'\\ser\software\other\[POINTS NQS  2012.XLS]Open Super Stock'!$E18) ->  | F35: ='\\ser\software\other\[POINTS NQS  2012.XLS]Open Super Stock'!$AA18 -> 134
A36: ='\\ser\software\other\[POINTS NQS  2012.XLS]Open Super Stock'!$A19 -> 13 | B36: ='\\ser\software\other\[POINTS NQS  2012.XLS]Open Super Stock'!$B19 -> Greg Watson | C36: ='\\ser\software\other\[POINTS NQS  2012.XLS]Open Super Stock'!$C19 -> Republic, Oh | D36: ='\\ser\software\other\[POINTS NQS  2012.XLS]Open Super Stock'!$D19 -> 341 | E36: =IF('\\ser\software\other\[POINTS NQS  2012.XLS]Open Super Stock'!$E19=0," ",'\\ser\software\other\[POINTS NQS  2012.XLS]Open Super Stock'!$E19) -> Odd Couple | F36: ='\\ser\software\other\[POINTS NQS  2012.XLS]Open Super Stock'!$AA19 -> 146
A37: ='\\ser\software\other\[POINTS NQS  2012.XLS]Open Super Stock'!$A20 -> 14 | B37: ='\\ser\software\other\[POINTS NQS  2012.XLS]Open Super Stock'!$B20 -> Shane Hadley | C37: ='\\ser\software\other\[POINTS NQS  2012.XLS]Open Super Stock'!$C20 -> Marion, NY | D37: ='\\ser\software\other\[POINTS NQS  2012.XLS]Open Super Stock'!$D20 -> 505 | E37: =IF('\\ser\software\other\[POINTS NQS  2012.XLS]Open Super Stock'!$E20=0," ",'\\ser\software\other\[POINTS NQS  2012.XLS]Open Super Stock'!$E20) ->  | F37: ='\\ser\software\other\[POINTS NQS  2012.XLS]Open Super Stock'!$AA20 -> 149
A38: ='\\ser\software\other\[POINTS NQS  2012.XLS]Open Super Stock'!$A21 -> 15 | B38: ='\\ser\software\other\[POINTS NQS  2012.XLS]Open Super Stock'!$B21 -> Mike Spencer | C38: ='\\ser\software\other\[POINTS NQS  2012.XLS]Open Super Stock'!$C21 -> West Alexandria, Oh | D38: ='\\ser\software\other\[POINTS NQS  2012.XLS]Open Super Stock'!$D21 -> 278 | E38: =IF('\\ser\software\other\[POINTS NQS  2012.XLS]Open Super Stock'!$E21=0," ",'\\ser\software\other\[POINTS NQS  2012.XLS]Open Super Stock'!$E21) -> Longshot | F38: ='\\ser\software\other\[POINTS NQS  2012.XLS]Open Super Stock'!$AA21 -> 151
A39: ='\\ser\software\other\[POINTS NQS  2012.XLS]Open Super Stock'!$A22 -> 16 | B39: ='\\ser\software\other\[POINTS NQS  2012.XLS]Open Super Stock'!$B22 -> Robert Kauffman | C39: ='\\ser\software\other\[POINTS NQS  2012.XLS]Open Super Stock'!$C22 -> Ruffsdale, Pa | D39: ='\\ser\software\other\[POINTS NQS  2012.XLS]Open Super Stock'!$D22 -> 560 | E39: =IF('\\ser\software\other\[POINTS NQS  2012.XLS]Open Super Stock'!$E22=0," ",'\\ser\software\other\[POINTS NQS  2012.XLS]Open Super Stock'!$E22) -> Red Blooded | F39: ='\\ser\software\other\[POINTS NQS  2012.XLS]Open Super Stock'!$AA22 -> 154