B1: PRO OUTLAW | F1: Thru Richmond | H1: LITE PRO | M1: Thru Richmond
B2: Name | C2: City | D2: NQS # | E2: Tractor | F2: Points Back | I2: Name | J2: City/State | K2: NQS # | L2: Tractor | M2: Points Back
A3: ='\\ser\software\other\[POINTS NQS  2012.XLS]Pro Outlaw'!$A7 -> 1 | B3: ='\\ser\software\other\[POINTS NQS  2012.XLS]Pro Outlaw'!$B7 -> Russ Nichols | C3: ='\\ser\software\other\[POINTS NQS  2012.XLS]Pro Outlaw'!$C7 -> Lore City, OH | D3: ='\\ser\software\other\[POINTS NQS  2012.XLS]Pro Outlaw'!$D7 -> 8 | E3: =IF('\\ser\software\other\[POINTS NQS  2012.XLS]Pro Outlaw'!E7=0," ",'\\ser\software\other\[POINTS NQS  2012.XLS]Pro Outlaw'!E7) -> Wicked Deere | F3: ='\\ser\software\other\[POINTS NQS  2012.XLS]Pro Outlaw'!$AA7 -> 0 | H3: ='\\ser\software\other\[POINTS NQS  2012.XLS]Light Pro'!$A7 -> 1 | I3: ='\\ser\software\other\[POINTS NQS  2012.XLS]Light Pro'!$B7 -> Lora Feldkamp | J3: ='\\ser\software\other\[POINTS NQS  2012.XLS]Light Pro'!$C7 -> Britton, MI | K3: ='\\ser\software\other\[POINTS NQS  2012.XLS]Light Pro'!$D7 -> 475 | L3: =IF('\\ser\software\other\[POINTS NQS  2012.XLS]Light Pro'!E7=0," ",'\\ser\software\other\[POINTS NQS  2012.XLS]Light Pro'!E7) ->  | M3: ='\\ser\software\other\[POINTS NQS  2012.XLS]Light Pro'!$AA7 -> 0
A4: ='\\ser\software\other\[POINTS NQS  2012.XLS]Pro Outlaw'!$A8 -> 2 | B4: ='\\ser\software\other\[POINTS NQS  2012.XLS]Pro Outlaw'!$B8 -> Russ Nichols | C4: ='\\ser\software\other\[POINTS NQS  2012.XLS]Pro Outlaw'!$C8 -> Lore city, OH | D4: ='\\ser\software\other\[POINTS NQS  2012.XLS]Pro Outlaw'!$D8 -> 70 | E4: =IF('\\ser\software\other\[POINTS NQS  2012.XLS]Pro Outlaw'!E8=0," ",'\\ser\software\other\[POINTS NQS  2012.XLS]Pro Outlaw'!E8) -> Wild One II | F4: ='\\ser\software\other\[POINTS NQS  2012.XLS]Pro Outlaw'!$AA8 -> 1 | H4: ='\\ser\software\other\[POINTS NQS  2012.XLS]Light Pro'!$A8 -> 2 | I4: ='\\ser\software\other\[POINTS NQS  2012.XLS]Light Pro'!$B8 -> Matt Kaster | J4: ='\\ser\software\other\[POINTS NQS  2012.XLS]Light Pro'!$C8 -> Burlington, WI | K4: ='\\ser\software\other\[POINTS NQS  2012.XLS]Light Pro'!$D8 -> 332 | L4: =IF('\\ser\software\other\[POINTS NQS  2012.XLS]Light Pro'!E8=0," ",'\\ser\software\other\[POINTS NQS  2012.XLS]Light Pro'!E8) -> Hog Wash | M4: ='\\ser\software\other\[POINTS NQS  2012.XLS]Light Pro'!$AA8 -> 6
A5: ='\\ser\software\other\[POINTS NQS  2012.XLS]Pro Outlaw'!$A9 -> 3 | B5: ='\\ser\software\other\[POINTS NQS  2012.XLS]Pro Outlaw'!$B9 -> Daryl Musser | C5: ='\\ser\software\other\[POINTS NQS  2012.XLS]Pro Outlaw'!$C9 -> Greencastle, PA | D5: ='\\ser\software\other\[POINTS NQS  2012.XLS]Pro Outlaw'!$D9 -> 396 | E5: =IF('\\ser\software\other\[POINTS NQS  2012.XLS]Pro Outlaw'!E9=0," ",'\\ser\software\other\[POINTS NQS  2012.XLS]Pro Outlaw'!E9) -> 5 Cents | F5: ='\\ser\software\other\[POINTS NQS  2012.XLS]Pro Outlaw'!$AA9 -> 22 | H5: ='\\ser\software\other\[POINTS NQS  2012.XLS]Light Pro'!$A9 -> 3 | I5: ='\\ser\software\other\[POINTS NQS  2012.XLS]Light Pro'!$B9 -> Gregory Vandevort | J5: ='\\ser\software\other\[POINTS NQS  2012.XLS]Light Pro'!$C9 -> Albion, PA | K5: ='\\ser\software\other\[POINTS NQS  2012.XLS]Light Pro'!$D9 -> 506 | L5: =IF('\\ser\software\other\[POINTS NQS  2012.XLS]Light Pro'!E9=0," ",'\\ser\software\other\[POINTS NQS  2012.XLS]Light Pro'!E9) -> Shockwave | M5: ='\\ser\software\other\[POINTS NQS  2012.XLS]Light Pro'!$AA9 -> 7
A6: ='\\ser\software\other\[POINTS NQS  2012.XLS]Pro Outlaw'!$A10 -> 4 | B6: ='\\ser\software\other\[POINTS NQS  2012.XLS]Pro Outlaw'!$B10 -> Elaine Fisher | C6: ='\\ser\software\other\[POINTS NQS  2012.XLS]Pro Outlaw'!$C10 -> Waterford, OH | D6: ='\\ser\software\other\[POINTS NQS  2012.XLS]Pro Outlaw'!$D10 -> 80 | E6: =IF('\\ser\software\other\[POINTS NQS  2012.XLS]Pro Outlaw'!E10=0," ",'\\ser\software\other\[POINTS NQS  2012.XLS]Pro Outlaw'!E10) -> Blue Thunder | F6: ='\\ser\software\other\[POINTS NQS  2012.XLS]Pro Outlaw'!$AA10 -> 24 | H6: ='\\ser\software\other\[POINTS NQS  2012.XLS]Light Pro'!$A10 -> 4 | I6: ='\\ser\software\other\[POINTS NQS  2012.XLS]Light Pro'!$B10 -> David Gawatz | J6: ='\\ser\software\other\[POINTS NQS  2012.XLS]Light Pro'!$C10 -> St. Joseph, MO | K6: ='\\ser\software\other\[POINTS NQS  2012.XLS]Light Pro'!$D10 -> 462 | L6: =IF('\\ser\software\other\[POINTS NQS  2012.XLS]Light Pro'!E10=0," ",'\\ser\software\other\[POINTS NQS  2012.XLS]Light Pro'!E10) -> Fear The Deere | M6: ='\\ser\software\other\[POINTS NQS  2012.XLS]Light Pro'!$AA10 -> 11
A7: ='\\ser\software\other\[POINTS NQS  2012.XLS]Pro Outlaw'!$A11 -> 5 | B7: ='\\ser\software\other\[POINTS NQS  2012.XLS]Pro Outlaw'!$B11 -> Christopher Wise | C7: ='\\ser\software\other\[POINTS NQS  2012.XLS]Pro Outlaw'!$C11 -> Greensburg, PA | D7: ='\\ser\software\other\[POINTS NQS  2012.XLS]Pro Outlaw'!$D11 -> 209 | E7: =IF('\\ser\software\other\[POINTS NQS  2012.XLS]Pro Outlaw'!E11=0," ",'\\ser\software\other\[POINTS NQS  2012.XLS]Pro Outlaw'!E11) -> Longshot | F7: ='\\ser\software\other\[POINTS NQS  2012.XLS]Pro Outlaw'!$AA11 -> 24 | H7: ='\\ser\software\other\[POINTS NQS  2012.XLS]Light Pro'!$A11 -> 5 | I7: ='\\ser\software\other\[POINTS NQS  2012.XLS]Light Pro'!$B11 -> Scott Bye | J7: ='\\ser\software\other\[POINTS NQS  2012.XLS]Light Pro'!$C11 -> Savannah, MO | K7: ='\\ser\software\other\[POINTS NQS  2012.XLS]Light Pro'!$D11 -> 187 | L7: =IF('\\ser\software\other\[POINTS NQS  2012.XLS]Light Pro'!E11=0," ",'\\ser\software\other\[POINTS NQS  2012.XLS]Light Pro'!E11) -> Revved Up | M7: ='\\ser\software\other\[POINTS NQS  2012.XLS]Light Pro'!$AA10 -> 11
A8: ='\\ser\software\other\[POINTS NQS  2012.XLS]Pro Outlaw'!$A12 -> 6 | B8: ='\\ser\software\other\[POINTS NQS  2012.XLS]Pro Outlaw'!$B12 -> Drew Burton | C8: ='\\ser\software\other\[POINTS NQS  2012.XLS]Pro Outlaw'!$C12 -> Brookston, IN | D8: ='\\ser\software\other\[POINTS NQS  2012.XLS]Pro Outlaw'!$D12 -> 14 | E8: =IF('\\ser\software\other\[POINTS NQS  2012.XLS]Pro Outlaw'!E12=0," ",'\\ser\software\other\[POINTS NQS  2012.XLS]Pro Outlaw'!E12) -> Bad Company | F8: ='\\ser\software\other\[POINTS NQS  2012.XLS]Pro Outlaw'!$AA12 -> 43 | H8: ='\\ser\software\other\[POINTS NQS  2012.XLS]Light Pro'!$A12 -> 6 | I8: ='\\ser\software\other\[POINTS NQS  2012.XLS]Light Pro'!$B12 -> Jerry Sweet | J8: ='\\ser\software\other\[POINTS NQS  2012.XLS]Light Pro'!$C12 -> Clymer, NY | K8: ='\\ser\software\other\[POINTS NQS  2012.XLS]Light Pro'!$D12 -> 284 | L8: =IF('\\ser\software\other\[POINTS NQS  2012.XLS]Light Pro'!E12=0," ",'\\ser\software\other\[POINTS NQS  2012.XLS]Light Pro'!E12) -> Phat Ride | M8: ='\\ser\software\other\[POINTS NQS  2012.XLS]Light Pro'!$AA11 -> 14
A9: ='\\ser\software\other\[POINTS NQS  2012.XLS]Pro Outlaw'!$A13 -> 7 | B9: ='\\ser\software\other\[POINTS NQS  2012.XLS]Pro Outlaw'!$B13 -> Harrision Stahl | C9: ='\\ser\software\other\[POINTS NQS  2012.XLS]Pro Outlaw'!$C13 -> Dewitt, IA | D9: ='\\ser\software\other\[POINTS NQS  2012.XLS]Pro Outlaw'!$D13 -> 4 | E9: =IF('\\ser\software\other\[POINTS NQS  2012.XLS]Pro Outlaw'!E13=0," ",'\\ser\software\other\[POINTS NQS  2012.XLS]Pro Outlaw'!E13) -> Tons of Fun | F9: ='\\ser\software\other\[POINTS NQS  2012.XLS]Pro Outlaw'!$AA13 -> 46 | H9: ='\\ser\software\other\[POINTS NQS  2012.XLS]Light Pro'!$A13 -> 7 | I9: ='\\ser\software\other\[POINTS NQS  2012.XLS]Light Pro'!$B13 -> Bobby Feldkamp | J9: ='\\ser\software\other\[POINTS NQS  2012.XLS]Light Pro'!$C13 -> Milan, Mi | K9: ='\\ser\software\other\[POINTS NQS  2012.XLS]Light Pro'!$D13 -> 474 | L9: =IF('\\ser\software\other\[POINTS NQS  2012.XLS]Light Pro'!E13=0," ",'\\ser\software\other\[POINTS NQS  2012.XLS]Light Pro'!E13) -> Driftwod | M9: ='\\ser\software\other\[POINTS NQS  2012.XLS]Light Pro'!$AA12 -> 14
A10: ='\\ser\software\other\[POINTS NQS  2012.XLS]Pro Outlaw'!$A14 -> 8 | B10: ='\\ser\software\other\[POINTS NQS  2012.XLS]Pro Outlaw'!$B14 -> Steve Williford | C10: ='\\ser\software\other\[POINTS NQS  2012.XLS]Pro Outlaw'!$C14 -> Engelhard, NC | D10: ='\\ser\software\other\[POINTS NQS  2012.XLS]Pro Outlaw'!$D14 -> 276 | E10: =IF('\\ser\software\other\[POINTS NQS  2012.XLS]Pro Outlaw'!E14=0," ",'\\ser\software\other\[POINTS NQS  2012.XLS]Pro Outlaw'!E14) -> IH Express | F10: ='\\ser\software\other\[POINTS NQS  2012.XLS]Pro Outlaw'!$AA14 -> 48 | H10: ='\\ser\software\other\[POINTS NQS  2012.XLS]Light Pro'!$A14 -> 8 | I10: ='\\ser\software\other\[POINTS NQS  2012.XLS]Light Pro'!$B14 -> Nick Ferguson | J10: ='\\ser\software\other\[POINTS NQS  2012.XLS]Light Pro'!$C14 -> Elkhorn, WI | K10: ='\\ser\software\other\[POINTS NQS  2012.XLS]Light Pro'!$D14 -> 100 | L10: =IF('\\ser\software\other\[POINTS NQS  2012.XLS]Light Pro'!E14=0," ",'\\ser\software\other\[POINTS NQS  2012.XLS]Light Pro'!E14) -> Raisin Cane | M10: ='\\ser\software\other\[POINTS NQS  2012.XLS]Light Pro'!$AA13 -> 24
A11: ='\\ser\software\other\[POINTS NQS  2012.XLS]Pro Outlaw'!$A15 -> 9 | B11: ='\\ser\software\other\[POINTS NQS  2012.XLS]Pro Outlaw'!$B15 -> Drew Burton | C11: ='\\ser\software\other\[POINTS NQS  2012.XLS]Pro Outlaw'!$C15 -> Brookston, IN | D11: ='\\ser\software\other\[POINTS NQS  2012.XLS]Pro Outlaw'!$D15 -> 15 | E11: =IF('\\ser\software\other\[POINTS NQS  2012.XLS]Pro Outlaw'!E15=0," ",'\\ser\software\other\[POINTS NQS  2012.XLS]Pro Outlaw'!E15) -> Plain Nuts | F11: ='\\ser\software\other\[POINTS NQS  2012.XLS]Pro Outlaw'!$AA15 -> 55 | H11: ='\\ser\software\other\[POINTS NQS  2012.XLS]Light Pro'!$A15 -> 9 | I11: ='\\ser\software\other\[POINTS NQS  2012.XLS]Light Pro'!$B15 -> Scott Bye | J11: ='\\ser\software\other\[POINTS NQS  2012.XLS]Light Pro'!$C15 -> Savannah, MO | K11: ='\\ser\software\other\[POINTS NQS  2012.XLS]Light Pro'!$D15 -> 539 | L11: =IF('\\ser\software\other\[POINTS NQS  2012.XLS]Light Pro'!E15=0," ",'\\ser\software\other\[POINTS NQS  2012.XLS]Light Pro'!E15) -> Jacked Up | M11: ='\\ser\software\other\[POINTS NQS  2012.XLS]Light Pro'!$AA14 -> 30
A12: ='\\ser\software\other\[POINTS NQS  2012.XLS]Pro Outlaw'!$A16 -> 10 | B12: ='\\ser\software\other\[POINTS NQS  2012.XLS]Pro Outlaw'!$B16 -> Jim Hull | C12: ='\\ser\software\other\[POINTS NQS  2012.XLS]Pro Outlaw'!$C16 -> Brandon, WI | D12: ='\\ser\software\other\[POINTS NQS  2012.XLS]Pro Outlaw'!$D16 -> 334 | E12: =IF('\\ser\software\other\[POINTS NQS  2012.XLS]Pro Outlaw'!E16=0," ",'\\ser\software\other\[POINTS NQS  2012.XLS]Pro Outlaw'!E16) -> Simply Irresistable | F12: ='\\ser\software\other\[POINTS NQS  2012.XLS]Pro Outlaw'!$AA16 -> 58 | H12: ='\\ser\software\other\[POINTS NQS  2012.XLS]Light Pro'!$A16 -> 10 | I12: ='\\ser\software\other\[POINTS NQS  2012.XLS]Light Pro'!$B16 -> Eli Yurkovich | J12: ='\\ser\software\other\[POINTS NQS  2012.XLS]Light Pro'!$C16 -> Prosperty, Pa | K12: ='\\ser\software\other\[POINTS NQS  2012.XLS]Light Pro'!$D16 -> 556 | L12: =IF('\\ser\software\other\[POINTS NQS  2012.XLS]Light Pro'!E16=0," ",'\\ser\software\other\[POINTS NQS  2012.XLS]Light Pro'!E16) -> Covered Bridge | M12: ='\\ser\software\other\[POINTS NQS  2012.XLS]Light Pro'!$AA15 -> 31
A13: ='\\ser\software\other\[POINTS NQS  2012.XLS]Pro Outlaw'!$A17 -> 11 | B13: ='\\ser\software\other\[POINTS NQS  2012.XLS]Pro Outlaw'!$B17 -> Cody Costa | C13: ='\\ser\software\other\[POINTS NQS  2012.XLS]Pro Outlaw'!$C17 -> Greencastle, PA | D13: ='\\ser\software\other\[POINTS NQS  2012.XLS]Pro Outlaw'!$D17 -> 397 | E13: =IF('\\ser\software\other\[POINTS NQS  2012.XLS]Pro Outlaw'!E17=0," ",'\\ser\software\other\[POINTS NQS  2012.XLS]Pro Outlaw'!E17) -> Crossthreaded | F13: ='\\ser\software\other\[POINTS NQS  2012.XLS]Pro Outlaw'!$AA17 -> 62 | H13: ='\\ser\software\other\[POINTS NQS  2012.XLS]Light Pro'!$A17 -> 11 | I13: ='\\ser\software\other\[POINTS NQS  2012.XLS]Light Pro'!$B17 -> Wesley Briant | J13: ='\\ser\software\other\[POINTS NQS  2012.XLS]Light Pro'!$C17 -> Washington, Pa | K13: ='\\ser\software\other\[POINTS NQS  2012.XLS]Light Pro'!$D17 -> 553 | L13: =IF('\\ser\software\other\[POINTS NQS  2012.XLS]Light Pro'!E17=0," ",'\\ser\software\other\[POINTS NQS  2012.XLS]Light Pro'!E17) -> Cub n Debt | M13: ='\\ser\software\other\[POINTS NQS  2012.XLS]Light Pro'!$AA16 -> 43
A14: ='\\ser\software\other\[POINTS NQS  2012.XLS]Pro Outlaw'!$A18 -> 12 | B14: ='\\ser\software\other\[POINTS NQS  2012.XLS]Pro Outlaw'!$B18 -> Lowell Vis | C14: ='\\ser\software\other\[POINTS NQS  2012.XLS]Pro Outlaw'!$C18 -> Waupun, WI | D14: ='\\ser\software\other\[POINTS NQS  2012.XLS]Pro Outlaw'!$D18 -> 333 | E14: =IF('\\ser\software\other\[POINTS NQS  2012.XLS]Pro Outlaw'!E18=0," ",'\\ser\software\other\[POINTS NQS  2012.XLS]Pro Outlaw'!E18) -> Skittles | F14: ='\\ser\software\other\[POINTS NQS  2012.XLS]Pro Outlaw'!$AA18 -> 63 | H14: ='\\ser\software\other\[POINTS NQS  2012.XLS]Light Pro'!$A18 -> 12 | I14: ='\\ser\software\other\[POINTS NQS  2012.XLS]Light Pro'!$B18 -> Pat Roth | J14: ='\\ser\software\other\[POINTS NQS  2012.XLS]Light Pro'!$C18 -> Idaville, ind | K14: ='\\ser\software\other\[POINTS NQS  2012.XLS]Light Pro'!$D18 -> 450 | L14: =IF('\\ser\software\other\[POINTS NQS  2012.XLS]Light Pro'!E18=0," ",'\\ser\software\other\[POINTS NQS  2012.XLS]Light Pro'!E18) -> Alcohol Abuse | M14: ='\\ser\software\other\[POINTS NQS  2012.XLS]Light Pro'!$AA17 -> 46
A15: ='\\ser\software\other\[POINTS NQS  2012.XLS]Pro Outlaw'!$A19 -> 13 | B15: ='\\ser\software\other\[POINTS NQS  2012.XLS]Pro Outlaw'!$B19 -> Don Vogt | C15: ='\\ser\software\other\[POINTS NQS  2012.XLS]Pro Outlaw'!$C19 -> Campbellsport, WI | D15: ='\\ser\software\other\[POINTS NQS  2012.XLS]Pro Outlaw'!$D19 -> 90 | E15: =IF('\\ser\software\other\[POINTS NQS  2012.XLS]Pro Outlaw'!E19=0," ",'\\ser\software\other\[POINTS NQS  2012.XLS]Pro Outlaw'!E19) -> Not A Nuff | F15: ='\\ser\software\other\[POINTS NQS  2012.XLS]Pro Outlaw'!$AA19 -> 70 | H15: ='\\ser\software\other\[POINTS NQS  2012.XLS]Light Pro'!$A19 -> 13 | I15: ='\\ser\software\other\[POINTS NQS  2012.XLS]Light Pro'!$B19 -> Billy Black | J15: ='\\ser\software\other\[POINTS NQS  2012.XLS]Light Pro'!$C19 -> Dry Ridge, Ky | K15: ='\\ser\software\other\[POINTS NQS  2012.XLS]Light Pro'!$D19 -> 567 | L15: =IF('\\ser\software\other\[POINTS NQS  2012.XLS]Light Pro'!E19=0," ",'\\ser\software\other\[POINTS NQS  2012.XLS]Light Pro'!E19) -> Dry Ridge, Ky | M15: ='\\ser\software\other\[POINTS NQS  2012.XLS]Light Pro'!$AA18 -> 55
A16: ='\\ser\software\other\[POINTS NQS  2012.XLS]Pro Outlaw'!$A20 -> 14 | B16: ='\\ser\software\other\[POINTS NQS  2012.XLS]Pro Outlaw'!$B20 -> Kenny Cornelison | C16: ='\\ser\software\other\[POINTS NQS  2012.XLS]Pro Outlaw'!$C20 -> Richmond, KY | D16: ='\\ser\software\other\[POINTS NQS  2012.XLS]Pro Outlaw'!$D20 -> 149 | E16: =IF('\\ser\software\other\[POINTS NQS  2012.XLS]Pro Outlaw'!E20=0," ",'\\ser\software\other\[POINTS NQS  2012.XLS]Pro Outlaw'!E20) -> Storm Alert | F16: ='\\ser\software\other\[POINTS NQS  2012.XLS]Pro Outlaw'!$AA20 -> 83 | H16: ='\\ser\software\other\[POINTS NQS  2012.XLS]Light Pro'!$A20 -> 14 | I16: ='\\ser\software\other\[POINTS NQS  2012.XLS]Light Pro'!$B20 -> Bob Jones Sr | J16: ='\\ser\software\other\[POINTS NQS  2012.XLS]Light Pro'!$C20 -> Hopewell, Oh | K16: ='\\ser\software\other\[POINTS NQS  2012.XLS]Light Pro'!$D20 -> 182 | L16: =IF('\\ser\software\other\[POINTS NQS  2012.XLS]Light Pro'!E20=0," ",'\\ser\software\other\[POINTS NQS  2012.XLS]Light Pro'!E20) -> Buckeye Binder | M16: ='\\ser\software\other\[POINTS NQS  2012.XLS]Light Pro'!$AA18 -> 55
A17: ='\\ser\software\other\[POINTS NQS  2012.XLS]Pro Outlaw'!$A21 -> 15 | B17: ='\\ser\software\other\[POINTS NQS  2012.XLS]Pro Outlaw'!$B21 -> Matt Kaster | C17: ='\\ser\software\other\[POINTS NQS  2012.XLS]Pro Outlaw'!$C21 -> Burlington, WI | D17: ='\\ser\software\other\[POINTS NQS  2012.XLS]Pro Outlaw'!$D21 -> 99 | E17: =IF('\\ser\software\other\[POINTS NQS  2012.XLS]Pro Outlaw'!E21=0," ",'\\ser\software\other\[POINTS NQS  2012.XLS]Pro Outlaw'!E21) -> Sound of Madness | F17: ='\\ser\software\other\[POINTS NQS  2012.XLS]Pro Outlaw'!$AA21 -> 111 | H17: ='\\ser\software\other\[POINTS NQS  2012.XLS]Light Pro'!$A21 -> 15 | I17: ='\\ser\software\other\[POINTS NQS  2012.XLS]Light Pro'!$B21 -> Chris Gegg | J17: ='\\ser\software\other\[POINTS NQS  2012.XLS]Light Pro'!$C21 -> Greeneville, IL | K17: ='\\ser\software\other\[POINTS NQS  2012.XLS]Light Pro'!$D21 -> 410 | L17: =IF('\\ser\software\other\[POINTS NQS  2012.XLS]Light Pro'!E21=0," ",'\\ser\software\other\[POINTS NQS  2012.XLS]Light Pro'!E21) -> Insane | M17: ='\\ser\software\other\[POINTS NQS  2012.XLS]Light Pro'!$AA20 -> 59
A18: ='\\ser\software\other\[POINTS NQS  2012.XLS]Pro Outlaw'!$A22 -> 16 | B18: ='\\ser\software\other\[POINTS NQS  2012.XLS]Pro Outlaw'!$B22 -> David Knapp | C18: ='\\ser\software\other\[POINTS NQS  2012.XLS]Pro Outlaw'!$C22 -> Hennepin, IL | D18: ='\\ser\software\other\[POINTS NQS  2012.XLS]Pro Outlaw'!$D22 -> 381 | E18: =IF('\\ser\software\other\[POINTS NQS  2012.XLS]Pro Outlaw'!E22=0," ",'\\ser\software\other\[POINTS NQS  2012.XLS]Pro Outlaw'!E22) -> Knapp Time | F18: ='\\ser\software\other\[POINTS NQS  2012.XLS]Pro Outlaw'!$AA22 -> 116 | H18: ='\\ser\software\other\[POINTS NQS  2012.XLS]Light Pro'!$A22 -> 16 | I18: ='\\ser\software\other\[POINTS NQS  2012.XLS]Light Pro'!$B22 -> Bob Cooper | J18: ='\\ser\software\other\[POINTS NQS  2012.XLS]Light Pro'!$C22 -> Westminster, Md | K18: ='\\ser\software\other\[POINTS NQS  2012.XLS]Light Pro'!$D22 -> 522 | L18: =IF('\\ser\software\other\[POINTS NQS  2012.XLS]Light Pro'!E22=0," ",'\\ser\software\other\[POINTS NQS  2012.XLS]Light Pro'!E22) -> Just Business | M18: ='\\ser\software\other\[POINTS NQS  2012.XLS]Light Pro'!$AA21 -> 60
A19: ='\\ser\software\other\[POINTS NQS  2012.XLS]Pro Outlaw'!$A23 -> 17 | B19: ='\\ser\software\other\[POINTS NQS  2012.XLS]Pro Outlaw'!$B23 -> Kenny Cornelison | C19: ='\\ser\software\other\[POINTS NQS  2012.XLS]Pro Outlaw'!$C23 -> Richmond, KY | D19: ='\\ser\software\other\[POINTS NQS  2012.XLS]Pro Outlaw'!$D23 -> 536 | E19: =IF('\\ser\software\other\[POINTS NQS  2012.XLS]Pro Outlaw'!E23=0," ",'\\ser\software\other\[POINTS NQS  2012.XLS]Pro Outlaw'!E23) -> Storm X | F19: ='\\ser\software\other\[POINTS NQS  2012.XLS]Pro Outlaw'!$AA23 -> 118 | H19: ='\\ser\software\other\[POINTS NQS  2012.XLS]Light Pro'!$A23 -> 17 | I19: ='\\ser\software\other\[POINTS NQS  2012.XLS]Light Pro'!$B23 -> Jim Waite | J19: ='\\ser\software\other\[POINTS NQS  2012.XLS]Light Pro'!$C23 -> Hopkinton, RI | K19: ='\\ser\software\other\[POINTS NQS  2012.XLS]Light Pro'!$D23 -> 562 | L19: =IF('\\ser\software\other\[POINTS NQS  2012.XLS]Light Pro'!E23=0," ",'\\ser\software\other\[POINTS NQS  2012.XLS]Light Pro'!E23) -> Wacky Five | M19: ='\\ser\software\other\[POINTS NQS  2012.XLS]Light Pro'!$AA22 -> 60
A20: ='\\ser\software\other\[POINTS NQS  2012.XLS]Pro Outlaw'!$A24 -> 18 | B20: ='\\ser\software\other\[POINTS NQS  2012.XLS]Pro Outlaw'!$B24 -> Bradley Corzine | C20: ='\\ser\software\other\[POINTS NQS  2012.XLS]Pro Outlaw'!$C24 -> Dongola, IL | D20: ='\\ser\software\other\[POINTS NQS  2012.XLS]Pro Outlaw'!$D24 -> 509 | E20: =IF('\\ser\software\other\[POINTS NQS  2012.XLS]Pro Outlaw'!E24=0," ",'\\ser\software\other\[POINTS NQS  2012.XLS]Pro Outlaw'!E24) -> Just Black | F20: ='\\ser\software\other\[POINTS NQS  2012.XLS]Pro Outlaw'!$AA24 -> 128 | H20: ='\\ser\software\other\[POINTS NQS  2012.XLS]Light Pro'!$A24 -> 18 | I20: ='\\ser\software\other\[POINTS NQS  2012.XLS]Light Pro'!$B24 -> Dave Wise | J20: ='\\ser\software\other\[POINTS NQS  2012.XLS]Light Pro'!$C24 -> New Stanton, Pa | K20: ='\\ser\software\other\[POINTS NQS  2012.XLS]Light Pro'!$D24 -> 403 | L20: =IF('\\ser\software\other\[POINTS NQS  2012.XLS]Light Pro'!E24=0," ",'\\ser\software\other\[POINTS NQS  2012.XLS]Light Pro'!E24) ->  | M20: ='\\ser\software\other\[POINTS NQS  2012.XLS]Light Pro'!$AA23 -> 60
A21: ='\\ser\software\other\[POINTS NQS  2012.XLS]Pro Outlaw'!$A25 -> 19 | B21: ='\\ser\software\other\[POINTS NQS  2012.XLS]Pro Outlaw'!$B25 -> Scott Bye | C21: ='\\ser\software\other\[POINTS NQS  2012.XLS]Pro Outlaw'!$C25 -> Savannah, Mo | D21: ='\\ser\software\other\[POINTS NQS  2012.XLS]Pro Outlaw'!$D25 -> 365 | E21: =IF('\\ser\software\other\[POINTS NQS  2012.XLS]Pro Outlaw'!E25=0," ",'\\ser\software\other\[POINTS NQS  2012.XLS]Pro Outlaw'!E25) -> Fired Up | F21: ='\\ser\software\other\[POINTS NQS  2012.XLS]Pro Outlaw'!$AA25 -> 132 | H21: ='\\ser\software\other\[POINTS NQS  2012.XLS]Light Pro'!$A25 -> 19 | I21: ='\\ser\software\other\[POINTS NQS  2012.XLS]Light Pro'!$B25 -> Aaron Scroggins | J21: ='\\ser\software\other\[POINTS NQS  2012.XLS]Light Pro'!$C25 -> Neosho, MO | K21: ='\\ser\software\other\[POINTS NQS  2012.XLS]Light Pro'!$D25 -> 419 | L21: =IF('\\ser\software\other\[POINTS NQS  2012.XLS]Light Pro'!E25=0," ",'\\ser\software\other\[POINTS NQS  2012.XLS]Light Pro'!E25) -> Gambler | M21: ='\\ser\software\other\[POINTS NQS  2012.XLS]Light Pro'!$AA24 -> 61
A22: ='\\ser\software\other\[POINTS NQS  2012.XLS]Pro Outlaw'!$A26 -> 20 | B22: ='\\ser\software\other\[POINTS NQS  2012.XLS]Pro Outlaw'!$B26 -> Harrison Stahl | C22: ='\\ser\software\other\[POINTS NQS  2012.XLS]Pro Outlaw'!$C26 -> Dewitt, IA | D22: ='\\ser\software\other\[POINTS NQS  2012.XLS]Pro Outlaw'!$D26 -> 336 | E22: =IF('\\ser\software\other\[POINTS NQS  2012.XLS]Pro Outlaw'!E26=0," ",'\\ser\software\other\[POINTS NQS  2012.XLS]Pro Outlaw'!E26) -> MWSC#4 | F22: ='\\ser\software\other\[POINTS NQS  2012.XLS]Pro Outlaw'!$AA26 -> 136 | H22: ='\\ser\software\other\[POINTS NQS  2012.XLS]Light Pro'!$A26 -> 20 | I22: ='\\ser\software\other\[POINTS NQS  2012.XLS]Light Pro'!$B26 -> Neven Stitzer | J22: ='\\ser\software\other\[POINTS NQS  2012.XLS]Light Pro'!$C26 -> Spring Mills, Pa | K22: ='\\ser\software\other\[POINTS NQS  2012.XLS]Light Pro'!$D26 -> 448 | L22: =IF('\\ser\software\other\[POINTS NQS  2012.XLS]Light Pro'!E26=0," ",'\\ser\software\other\[POINTS NQS  2012.XLS]Light Pro'!E26) -> Thunder Road I | M22: ='\\ser\software\other\[POINTS NQS  2012.XLS]Light Pro'!$AA24 -> 61
A23: ='\\ser\software\other\[POINTS NQS  2012.XLS]Pro Outlaw'!$A27 -> 21 | B23: ='\\ser\software\other\[POINTS NQS  2012.XLS]Pro Outlaw'!$B27 -> Nick Mischler | C23: ='\\ser\software\other\[POINTS NQS  2012.XLS]Pro Outlaw'!$C27 -> Deer Creek, IL | D23: ='\\ser\software\other\[POINTS NQS  2012.XLS]Pro Outlaw'!$D27 -> 167 | E23: =IF('\\ser\software\other\[POINTS NQS  2012.XLS]Pro Outlaw'!E27=0," ",'\\ser\software\other\[POINTS NQS  2012.XLS]Pro Outlaw'!E27) -> Pulse | F23: ='\\ser\software\other\[POINTS NQS  2012.XLS]Pro Outlaw'!$AA27 -> 140 | H23: ='\\ser\software\other\[POINTS NQS  2012.XLS]Light Pro'!$A27 -> 21 | I23: ='\\ser\software\other\[POINTS NQS  2012.XLS]Light Pro'!$B27 -> Bob Jones Jr | J23: ='\\ser\software\other\[POINTS NQS  2012.XLS]Light Pro'!$C27 -> Dresden, Oh | K23: ='\\ser\software\other\[POINTS NQS  2012.XLS]Light Pro'!$D27 -> 183 | L23: =IF('\\ser\software\other\[POINTS NQS  2012.XLS]Light Pro'!E27=0," ",'\\ser\software\other\[POINTS NQS  2012.XLS]Light Pro'!E27) -> Playdough | M23: ='\\ser\software\other\[POINTS NQS  2012.XLS]Light Pro'!$AA26 -> 63
A24: ='\\ser\software\other\[POINTS NQS  2012.XLS]Pro Outlaw'!$A28 -> 22 | B24: ='\\ser\software\other\[POINTS NQS  2012.XLS]Pro Outlaw'!$B28 -> Doug Diehl | C24: ='\\ser\software\other\[POINTS NQS  2012.XLS]Pro Outlaw'!$C28 -> Smithsburg, Md | D24: ='\\ser\software\other\[POINTS NQS  2012.XLS]Pro Outlaw'!$D28 -> 440 | E24: =IF('\\ser\software\other\[POINTS NQS  2012.XLS]Pro Outlaw'!E28=0," ",'\\ser\software\other\[POINTS NQS  2012.XLS]Pro Outlaw'!E28) -> 1 Bad MF | F24: ='\\ser\software\other\[POINTS NQS  2012.XLS]Pro Outlaw'!$AA28 -> 142 | H24: ='\\ser\software\other\[POINTS NQS  2012.XLS]Light Pro'!$A28 -> 22 | I24: ='\\ser\software\other\[POINTS NQS  2012.XLS]Light Pro'!$B28 -> Doug Waugh | J24: ='\\ser\software\other\[POINTS NQS  2012.XLS]Light Pro'!$C28 -> King City, Mo | K24: ='\\ser\software\other\[POINTS NQS  2012.XLS]Light Pro'!$D28 -> 464 | L24: =IF('\\ser\software\other\[POINTS NQS  2012.XLS]Light Pro'!E28=0," ",'\\ser\software\other\[POINTS NQS  2012.XLS]Light Pro'!E28) -> King City, Mo | M24: ='\\ser\software\other\[POINTS NQS  2012.XLS]Light Pro'!$AA27 -> 66
A25: ='\\ser\software\other\[POINTS NQS  2012.XLS]Pro Outlaw'!$A29 -> 23 | B25: ='\\ser\software\other\[POINTS NQS  2012.XLS]Pro Outlaw'!$B29 -> Julian Stahl | C25: ='\\ser\software\other\[POINTS NQS  2012.XLS]Pro Outlaw'!$C29 -> Welton, IA | D25: ='\\ser\software\other\[POINTS NQS  2012.XLS]Pro Outlaw'!$D29 -> 1 | E25: =IF('\\ser\software\other\[POINTS NQS  2012.XLS]Pro Outlaw'!E29=0," ",'\\ser\software\other\[POINTS NQS  2012.XLS]Pro Outlaw'!E29) -> MWSC#1 | F25: ='\\ser\software\other\[POINTS NQS  2012.XLS]Pro Outlaw'!$AA29 -> 143 | H25: ='\\ser\software\other\[POINTS NQS  2012.XLS]Light Pro'!$A29 -> 23 | I25: ='\\ser\software\other\[POINTS NQS  2012.XLS]Light Pro'!$B29 -> Bud Casale | J25: ='\\ser\software\other\[POINTS NQS  2012.XLS]Light Pro'!$C29 -> New Castle, Pa | K25: ='\\ser\software\other\[POINTS NQS  2012.XLS]Light Pro'!$D29 -> 535 | L25: =IF('\\ser\software\other\[POINTS NQS  2012.XLS]Light Pro'!E29=0," ",'\\ser\software\other\[POINTS NQS  2012.XLS]Light Pro'!E29) -> Stanton, Pa | M25: ='\\ser\software\other\[POINTS NQS  2012.XLS]Light Pro'!$AA28 -> 67
A26: ='\\ser\software\other\[POINTS NQS  2012.XLS]Pro Outlaw'!$A30 -> 24 | B26: ='\\ser\software\other\[POINTS NQS  2012.XLS]Pro Outlaw'!$B30 -> Larry Fox | C26: ='\\ser\software\other\[POINTS NQS  2012.XLS]Pro Outlaw'!$C30 -> Etna, Oh | D26: ='\\ser\software\other\[POINTS NQS  2012.XLS]Pro Outlaw'!$D30 -> 7 | E26: =IF('\\ser\software\other\[POINTS NQS  2012.XLS]Pro Outlaw'!E30=0," ",'\\ser\software\other\[POINTS NQS  2012.XLS]Pro Outlaw'!E30) -> Intimidation | F26: ='\\ser\software\other\[POINTS NQS  2012.XLS]Pro Outlaw'!$AA30 -> 143 | H26: ='\\ser\software\other\[POINTS NQS  2012.XLS]Light Pro'!$A30 -> 24 | I26: ='\\ser\software\other\[POINTS NQS  2012.XLS]Light Pro'!$B30 -> Austin Yurkovich | J26: ='\\ser\software\other\[POINTS NQS  2012.XLS]Light Pro'!$C30 -> Prosperty, Pa | K26: ='\\ser\software\other\[POINTS NQS  2012.XLS]Light Pro'!$D30 -> 557 | L26: =IF('\\ser\software\other\[POINTS NQS  2012.XLS]Light Pro'!E30=0," ",'\\ser\software\other\[POINTS NQS  2012.XLS]Light Pro'!E30) -> Sled Stretcher | M26: ='\\ser\software\other\[POINTS NQS  2012.XLS]Light Pro'!$AA29 -> 68
A27: ='\\ser\software\other\[POINTS NQS  2012.XLS]Pro Outlaw'!$A31 -> 25 | B27: ='\\ser\software\other\[POINTS NQS  2012.XLS]Pro Outlaw'!$B31 -> Ryan Richter | C27: ='\\ser\software\other\[POINTS NQS  2012.XLS]Pro Outlaw'!$C31 -> Connellsville, PA | D27: ='\\ser\software\other\[POINTS NQS  2012.XLS]Pro Outlaw'!$D31 -> 502 | E27: =IF('\\ser\software\other\[POINTS NQS  2012.XLS]Pro Outlaw'!E31=0," ",'\\ser\software\other\[POINTS NQS  2012.XLS]Pro Outlaw'!E31) -> Radical Rat | F27: ='\\ser\software\other\[POINTS NQS  2012.XLS]Pro Outlaw'!$AA31 -> 144 | H27: ='\\ser\software\other\[POINTS NQS  2012.XLS]Light Pro'!$A31 -> 25 | I27: ='\\ser\software\other\[POINTS NQS  2012.XLS]Light Pro'!$B31 -> Larry Frederick | J27: ='\\ser\software\other\[POINTS NQS  2012.XLS]Light Pro'!$C31 -> New Castle, Pa | K27: ='\\ser\software\other\[POINTS NQS  2012.XLS]Light Pro'!$D31 -> 526 | L27: =IF('\\ser\software\other\[POINTS NQS  2012.XLS]Light Pro'!E31=0," ",'\\ser\software\other\[POINTS NQS  2012.XLS]Light Pro'!E31) -> Burnin U2 | M27: ='\\ser\software\other\[POINTS NQS  2012.XLS]Light Pro'!$AA30 -> 70
A28: ='\\ser\software\other\[POINTS NQS  2012.XLS]Pro Outlaw'!$A32 -> 26 | B28: ='\\ser\software\other\[POINTS NQS  2012.XLS]Pro Outlaw'!$B32 -> Mike Spencer | C28: ='\\ser\software\other\[POINTS NQS  2012.XLS]Pro Outlaw'!$C32 -> Weest Alex, OH | D28: ='\\ser\software\other\[POINTS NQS  2012.XLS]Pro Outlaw'!$D32 -> 278 | E28: =IF('\\ser\software\other\[POINTS NQS  2012.XLS]Pro Outlaw'!E32=0," ",'\\ser\software\other\[POINTS NQS  2012.XLS]Pro Outlaw'!E32) -> Longshot | F28: ='\\ser\software\other\[POINTS NQS  2012.XLS]Pro Outlaw'!$AA32 -> 154
A29: ='\\ser\software\other\[POINTS NQS  2012.XLS]Pro Outlaw'!$A33 -> 27 | B29: ='\\ser\software\other\[POINTS NQS  2012.XLS]Pro Outlaw'!$B33 -> David Mascher JR | C29: ='\\ser\software\other\[POINTS NQS  2012.XLS]Pro Outlaw'!$C33 -> Beech Grove, IN | D29: ='\\ser\software\other\[POINTS NQS  2012.XLS]Pro Outlaw'!$D33 -> 163 | E29: =IF('\\ser\software\other\[POINTS NQS  2012.XLS]Pro Outlaw'!E33=0," ",'\\ser\software\other\[POINTS NQS  2012.XLS]Pro Outlaw'!E33) -> Thunder Pumpkin | F29: ='\\ser\software\other\[POINTS NQS  2012.XLS]Pro Outlaw'!$AA33 -> 157
A30: ='\\ser\software\other\[POINTS NQS  2012.XLS]Pro Outlaw'!$A34 -> 28 | B30: ='\\ser\software\other\[POINTS NQS  2012.XLS]Pro Outlaw'!$B34 -> Dan Schell | C30: ='\\ser\software\other\[POINTS NQS  2012.XLS]Pro Outlaw'!$C34 -> Darien, WI | D30: ='\\ser\software\other\[POINTS NQS  2012.XLS]Pro Outlaw'!$D34 -> 375 | E30: =IF('\\ser\software\other\[POINTS NQS  2012.XLS]Pro Outlaw'!E34=0," ",'\\ser\software\other\[POINTS NQS  2012.XLS]Pro Outlaw'!E34) -> Blind Ambition | F30: ='\\ser\software\other\[POINTS NQS  2012.XLS]Pro Outlaw'!$AA34 -> 157
A31: ='\\ser\software\other\[POINTS NQS  2012.XLS]Pro Outlaw'!$A35 -> 29 | B31: ='\\ser\software\other\[POINTS NQS  2012.XLS]Pro Outlaw'!$B35 -> Dave Gawatz | C31: ='\\ser\software\other\[POINTS NQS  2012.XLS]Pro Outlaw'!$C35 -> St. Joseph, MO | D31: ='\\ser\software\other\[POINTS NQS  2012.XLS]Pro Outlaw'!$D35 -> 367 | E31: =IF('\\ser\software\other\[POINTS NQS  2012.XLS]Pro Outlaw'!E35=0," ",'\\ser\software\other\[POINTS NQS  2012.XLS]Pro Outlaw'!E35) -> Lil' Sprout | F31: ='\\ser\software\other\[POINTS NQS  2012.XLS]Pro Outlaw'!$AA35 -> 158
A32: ='\\ser\software\other\[POINTS NQS  2012.XLS]Pro Outlaw'!$A36 -> 30 | B32: ='\\ser\software\other\[POINTS NQS  2012.XLS]Pro Outlaw'!$B36 -> Mike Kyle | C32: ='\\ser\software\other\[POINTS NQS  2012.XLS]Pro Outlaw'!$C36 -> Edinburgh, IN | D32: ='\\ser\software\other\[POINTS NQS  2012.XLS]Pro Outlaw'!$D36 -> 394 | E32: =IF('\\ser\software\other\[POINTS NQS  2012.XLS]Pro Outlaw'!E36=0," ",'\\ser\software\other\[POINTS NQS  2012.XLS]Pro Outlaw'!E36) ->  | F32: ='\\ser\software\other\[POINTS NQS  2012.XLS]Pro Outlaw'!$AA36 -> 164
A33: ='\\ser\software\other\[POINTS NQS  2012.XLS]Pro Outlaw'!$A37 -> 31 | B33: ='\\ser\software\other\[POINTS NQS  2012.XLS]Pro Outlaw'!$B37 -> Eric Varner | C33: ='\\ser\software\other\[POINTS NQS  2012.XLS]Pro Outlaw'!$C37 -> Versailles, KY | D33: ='\\ser\software\other\[POINTS NQS  2012.XLS]Pro Outlaw'!$D37 -> 482 | E33: =IF('\\ser\software\other\[POINTS NQS  2012.XLS]Pro Outlaw'!E37=0," ",'\\ser\software\other\[POINTS NQS  2012.XLS]Pro Outlaw'!E37) -> Extreme Addiction | F33: ='\\ser\software\other\[POINTS NQS  2012.XLS]Pro Outlaw'!$AA37 -> 164 | H33: LITE OUTLAW
A34: ='\\ser\software\other\[POINTS NQS  2012.XLS]Pro Outlaw'!$A38 -> 32 | B34: ='\\ser\software\other\[POINTS NQS  2012.XLS]Pro Outlaw'!$B38 -> Michael Ciolino | C34: ='\\ser\software\other\[POINTS NQS  2012.XLS]Pro Outlaw'!$C38 -> Peoria, IL | D34: ='\\ser\software\other\[POINTS NQS  2012.XLS]Pro Outlaw'!$D38 -> 146 | E34: =IF('\\ser\software\other\[POINTS NQS  2012.XLS]Pro Outlaw'!E38=0," ",'\\ser\software\other\[POINTS NQS  2012.XLS]Pro Outlaw'!E38) -> Mechanical Animal | F34: ='\\ser\software\other\[POINTS NQS  2012.XLS]Pro Outlaw'!$AA38 -> 173 | I34: Name | J34: City | K34: NQS # | L34: Tractor | M34: Thru Richmond
A35: ='\\ser\software\other\[POINTS NQS  2012.XLS]Pro Outlaw'!$A39 -> 33 | B35: ='\\ser\software\other\[POINTS NQS  2012.XLS]Pro Outlaw'!$B39 -> Nathan Nichols | C35: ='\\ser\software\other\[POINTS NQS  2012.XLS]Pro Outlaw'!$C39 -> Lawrenceburg, Ky | D35: ='\\ser\software\other\[POINTS NQS  2012.XLS]Pro Outlaw'!$D39 -> 151 | E35: =IF('\\ser\software\other\[POINTS NQS  2012.XLS]Pro Outlaw'!E39=0," ",'\\ser\software\other\[POINTS NQS  2012.XLS]Pro Outlaw'!E39) -> Wild Streak | F35: ='\\ser\software\other\[POINTS NQS  2012.XLS]Pro Outlaw'!$AA39 -> 173 | H35: ='\\ser\software\other\[POINTS NQS  2012.XLS]Lite Outlaw'!$A7 -> 1 | I35: ='\\ser\software\other\[POINTS NQS  2012.XLS]Lite Outlaw'!$B7 -> Gregory Vandevort | J35: ='\\ser\software\other\[POINTS NQS  2012.XLS]Lite Outlaw'!$C7 -> Albion, PA | K35: ='\\ser\software\other\[POINTS NQS  2012.XLS]Lite Outlaw'!$D7 -> 506 | L35: =IF('\\ser\software\other\[POINTS NQS  2012.XLS]Lite Outlaw'!E7=0," ",'\\ser\software\other\[POINTS NQS  2012.XLS]Lite Outlaw'!E7) -> Shockwave | M35: Points Back
A36: ='\\ser\software\other\[POINTS NQS  2012.XLS]Pro Outlaw'!$A40 -> 34 | B36: ='\\ser\software\other\[POINTS NQS  2012.XLS]Pro Outlaw'!$B40 -> Aaron Scroggins | C36: ='\\ser\software\other\[POINTS NQS  2012.XLS]Pro Outlaw'!$C40 -> Neosho, OH | D36: ='\\ser\software\other\[POINTS NQS  2012.XLS]Pro Outlaw'!$D40 -> 111 | E36: =IF('\\ser\software\other\[POINTS NQS  2012.XLS]Pro Outlaw'!E40=0," ",'\\ser\software\other\[POINTS NQS  2012.XLS]Pro Outlaw'!E40) -> Blackout | F36: ='\\ser\software\other\[POINTS NQS  2012.XLS]Pro Outlaw'!$AA40 -> 174 | H36: ='\\ser\software\other\[POINTS NQS  2012.XLS]Lite Outlaw'!$A8 -> 2 | I36: ='\\ser\software\other\[POINTS NQS  2012.XLS]Lite Outlaw'!$B8 -> Matt Kaster | J36: ='\\ser\software\other\[POINTS NQS  2012.XLS]Lite Outlaw'!$C8 -> Burlington, WI | K36: ='\\ser\software\other\[POINTS NQS  2012.XLS]Lite Outlaw'!$D8 -> 332 | L36: =IF('\\ser\software\other\[POINTS NQS  2012.XLS]Lite Outlaw'!E8=0," ",'\\ser\software\other\[POINTS NQS  2012.XLS]Lite Outlaw'!E8) -> Hog Wash | M36: ='\\ser\software\other\[POINTS NQS  2012.XLS]Lite Outlaw'!$AA7 -> 0
A37: ='\\ser\software\other\[POINTS NQS  2012.XLS]Pro Outlaw'!$A41 -> 35 | B37: ='\\ser\software\other\[POINTS NQS  2012.XLS]Pro Outlaw'!$B41 -> Jeff Chrisman | C37: ='\\ser\software\other\[POINTS NQS  2012.XLS]Pro Outlaw'!$C41 -> Edinburgh, IN | D37: ='\\ser\software\other\[POINTS NQS  2012.XLS]Pro Outlaw'!$D41 -> 180 | E37: =IF('\\ser\software\other\[POINTS NQS  2012.XLS]Pro Outlaw'!E41=0," ",'\\ser\software\other\[POINTS NQS  2012.XLS]Pro Outlaw'!E41) ->  | F37: ='\\ser\software\other\[POINTS NQS  2012.XLS]Pro Outlaw'!$AA41 -> 174 | H37: ='\\ser\software\other\[POINTS NQS  2012.XLS]Lite Outlaw'!$A9 -> 3 | I37: ='\\ser\software\other\[POINTS NQS  2012.XLS]Lite Outlaw'!$B9 -> Lora Feldkamp | J37: ='\\ser\software\other\[POINTS NQS  2012.XLS]Lite Outlaw'!$C9 -> Britton, WI | K37: ='\\ser\software\other\[POINTS NQS  2012.XLS]Lite Outlaw'!$D9 -> 475 | L37: =IF('\\ser\software\other\[POINTS NQS  2012.XLS]Lite Outlaw'!E9=0," ",'\\ser\software\other\[POINTS NQS  2012.XLS]Lite Outlaw'!E9) ->  | M37: ='\\ser\software\other\[POINTS NQS  2012.XLS]Lite Outlaw'!$AA8 -> 1
A38: ='\\ser\software\other\[POINTS NQS  2012.XLS]Pro Outlaw'!$A42 -> 36 | B38: ='\\ser\software\other\[POINTS NQS  2012.XLS]Pro Outlaw'!$B42 -> Jerry Skuta | C38: ='\\ser\software\other\[POINTS NQS  2012.XLS]Pro Outlaw'!$C42 -> Kimball, Mi | D38: ='\\ser\software\other\[POINTS NQS  2012.XLS]Pro Outlaw'!$D42 -> 329 | E38: =IF('\\ser\software\other\[POINTS NQS  2012.XLS]Pro Outlaw'!E42=0," ",'\\ser\software\other\[POINTS NQS  2012.XLS]Pro Outlaw'!E42) -> Green Tractor | F38: ='\\ser\software\other\[POINTS NQS  2012.XLS]Pro Outlaw'!$AA42 -> 174 | H38: ='\\ser\software\other\[POINTS NQS  2012.XLS]Lite Outlaw'!$A10 -> 4 | I38: ='\\ser\software\other\[POINTS NQS  2012.XLS]Lite Outlaw'!$B10 -> Jerry Sweet | J38: ='\\ser\software\other\[POINTS NQS  2012.XLS]Lite Outlaw'!$C10 -> Clymer, NY | K38: ='\\ser\software\other\[POINTS NQS  2012.XLS]Lite Outlaw'!$D10 -> 284 | L38: =IF('\\ser\software\other\[POINTS NQS  2012.XLS]Lite Outlaw'!E10=0," ",'\\ser\software\other\[POINTS NQS  2012.XLS]Lite Outlaw'!E10) -> Phat Ride | M38: ='\\ser\software\other\[POINTS NQS  2012.XLS]Lite Outlaw'!$AA9 -> 6
A39: ='\\ser\software\other\[POINTS NQS  2012.XLS]Pro Outlaw'!$A43 -> 37 | B39: ='\\ser\software\other\[POINTS NQS  2012.XLS]Pro Outlaw'!$B43 -> Scott Bye | C39: ='\\ser\software\other\[POINTS NQS  2012.XLS]Pro Outlaw'!$C43 -> Savannah, Mo | D39: ='\\ser\software\other\[POINTS NQS  2012.XLS]Pro Outlaw'!$D43 -> 365 | E39: =IF('\\ser\software\other\[POINTS NQS  2012.XLS]Pro Outlaw'!E43=0," ",'\\ser\software\other\[POINTS NQS  2012.XLS]Pro Outlaw'!E43) -> Fired Up | F39: ='\\ser\software\other\[POINTS NQS  2012.XLS]Pro Outlaw'!$AA43 -> 174 | H39: ='\\ser\software\other\[POINTS NQS  2012.XLS]Lite Outlaw'!$A11 -> 5 | I39: ='\\ser\software\other\[POINTS NQS  2012.XLS]Lite Outlaw'!$B11 -> Scott Bye | J39: ='\\ser\software\other\[POINTS NQS  2012.XLS]Lite Outlaw'!$C11 -> Savannah, MO | K39: ='\\ser\software\other\[POINTS NQS  2012.XLS]Lite Outlaw'!$D11 -> 187 | L39: =IF('\\ser\software\other\[POINTS NQS  2012.XLS]Lite Outlaw'!E11=0," ",'\\ser\software\other\[POINTS NQS  2012.XLS]Lite Outlaw'!E11) -> Revved Up | M39: ='\\ser\software\other\[POINTS NQS  2012.XLS]Lite Outlaw'!$AA10 -> 9
A40: ='\\ser\software\other\[POINTS NQS  2012.XLS]Pro Outlaw'!$A44 -> 38 | B40: ='\\ser\software\other\[POINTS NQS  2012.XLS]Pro Outlaw'!$B44 -> Dean Dubach | C40: ='\\ser\software\other\[POINTS NQS  2012.XLS]Pro Outlaw'!$C44 -> Decatur, In | D40: ='\\ser\software\other\[POINTS NQS  2012.XLS]Pro Outlaw'!$D44 -> 532 | E40: =IF('\\ser\software\other\[POINTS NQS  2012.XLS]Pro Outlaw'!E44=0," ",'\\ser\software\other\[POINTS NQS  2012.XLS]Pro Outlaw'!E44) -> Red Cub | F40: ='\\ser\software\other\[POINTS NQS  2012.XLS]Pro Outlaw'!$AA44 -> 174 | H40: ='\\ser\software\other\[POINTS NQS  2012.XLS]Lite Outlaw'!$A12 -> 6 | I40: ='\\ser\software\other\[POINTS NQS  2012.XLS]Lite Outlaw'!$B12 -> David Gawatz | J40: ='\\ser\software\other\[POINTS NQS  2012.XLS]Lite Outlaw'!$C12 -> St. Joseph, MO | K40: ='\\ser\software\other\[POINTS NQS  2012.XLS]Lite Outlaw'!$D12 -> 462 | L40: =IF('\\ser\software\other\[POINTS NQS  2012.XLS]Lite Outlaw'!E12=0," ",'\\ser\software\other\[POINTS NQS  2012.XLS]Lite Outlaw'!E12) -> Fear The Deere | M40: ='\\ser\software\other\[POINTS NQS  2012.XLS]Lite Outlaw'!$AA11 -> 11
A41: ='\\ser\software\other\[POINTS NQS  2012.XLS]Pro Outlaw'!$A45 -> 39 | B41: ='\\ser\software\other\[POINTS NQS  2012.XLS]Pro Outlaw'!$B45 -> Ed Nichols | C41: ='\\ser\software\other\[POINTS NQS  2012.XLS]Pro Outlaw'!$C45 -> Salvisa, Ky | D41: ='\\ser\software\other\[POINTS NQS  2012.XLS]Pro Outlaw'!$D45 -> 124 | E41: =IF('\\ser\software\other\[POINTS NQS  2012.XLS]Pro Outlaw'!E45=0," ",'\\ser\software\other\[POINTS NQS  2012.XLS]Pro Outlaw'!E45) -> Track Attack | F41: ='\\ser\software\other\[POINTS NQS  2012.XLS]Pro Outlaw'!$AA45 -> 175 | H41: ='\\ser\software\other\[POINTS NQS  2012.XLS]Lite Outlaw'!$A13 -> 7 | I41: ='\\ser\software\other\[POINTS NQS  2012.XLS]Lite Outlaw'!$B13 -> Nick Ferguson | J41: ='\\ser\software\other\[POINTS NQS  2012.XLS]Lite Outlaw'!$C13 -> Elkhorn, WI | K41: ='\\ser\software\other\[POINTS NQS  2012.XLS]Lite Outlaw'!$D13 -> 100 | L41: =IF('\\ser\software\other\[POINTS NQS  2012.XLS]Lite Outlaw'!E13=0," ",'\\ser\software\other\[POINTS NQS  2012.XLS]Lite Outlaw'!E13) -> Raisin Cane | M41: ='\\ser\software\other\[POINTS NQS  2012.XLS]Lite Outlaw'!$AA12 -> 13
A42: ='\\ser\software\other\[POINTS NQS  2012.XLS]Pro Outlaw'!$A46 -> 40 | B42: ='\\ser\software\other\[POINTS NQS  2012.XLS]Pro Outlaw'!$B46 -> Darlene Sample | C42: ='\\ser\software\other\[POINTS NQS  2012.XLS]Pro Outlaw'!$C46 -> Carrollton, Oh | D42: ='\\ser\software\other\[POINTS NQS  2012.XLS]Pro Outlaw'!$D46 -> 498 | E42: =IF('\\ser\software\other\[POINTS NQS  2012.XLS]Pro Outlaw'!E46=0," ",'\\ser\software\other\[POINTS NQS  2012.XLS]Pro Outlaw'!E46) -> Dr Doom | F42: ='\\ser\software\other\[POINTS NQS  2012.XLS]Pro Outlaw'!$AA46 -> 175 | H42: ='\\ser\software\other\[POINTS NQS  2012.XLS]Lite Outlaw'!$A14 -> 8 | I42: ='\\ser\software\other\[POINTS NQS  2012.XLS]Lite Outlaw'!$B14 -> Bobby Feldkamp | J42: ='\\ser\software\other\[POINTS NQS  2012.XLS]Lite Outlaw'!$C14 -> Milan, Mi | K42: ='\\ser\software\other\[POINTS NQS  2012.XLS]Lite Outlaw'!$D14 -> 474 | L42: =IF('\\ser\software\other\[POINTS NQS  2012.XLS]Lite Outlaw'!E14=0," ",'\\ser\software\other\[POINTS NQS  2012.XLS]Lite Outlaw'!E14) -> Driftwood | M42: ='\\ser\software\other\[POINTS NQS  2012.XLS]Lite Outlaw'!$AA13 -> 19
A43: ='\\ser\software\other\[POINTS NQS  2012.XLS]Pro Outlaw'!$A47 -> 41 | B43: ='\\ser\software\other\[POINTS NQS  2012.XLS]Pro Outlaw'!$B47 -> Julian Stahl | C43: ='\\ser\software\other\[POINTS NQS  2012.XLS]Pro Outlaw'!$C47 -> Welton, IA | D43: ='\\ser\software\other\[POINTS NQS  2012.XLS]Pro Outlaw'!$D47 -> 2 | E43: =IF('\\ser\software\other\[POINTS NQS  2012.XLS]Pro Outlaw'!E47=0," ",'\\ser\software\other\[POINTS NQS  2012.XLS]Pro Outlaw'!E47) -> MWSC#2 | F43: ='\\ser\software\other\[POINTS NQS  2012.XLS]Pro Outlaw'!$AA47 -> 176 | H43: ='\\ser\software\other\[POINTS NQS  2012.XLS]Lite Outlaw'!$A15 -> 9 | I43: ='\\ser\software\other\[POINTS NQS  2012.XLS]Lite Outlaw'!$B15 -> Scott Bye | J43: ='\\ser\software\other\[POINTS NQS  2012.XLS]Lite Outlaw'!$C15 -> Savannah, MO | K43: ='\\ser\software\other\[POINTS NQS  2012.XLS]Lite Outlaw'!$D15 -> 539 | L43: =IF('\\ser\software\other\[POINTS NQS  2012.XLS]Lite Outlaw'!E15=0," ",'\\ser\software\other\[POINTS NQS  2012.XLS]Lite Outlaw'!E15) -> Jacked Up | M43: ='\\ser\software\other\[POINTS NQS  2012.XLS]Lite Outlaw'!$AA14 -> 22
A44: ='\\ser\software\other\[POINTS NQS  2012.XLS]Pro Outlaw'!$A48 -> 42 | B44: ='\\ser\software\other\[POINTS NQS  2012.XLS]Pro Outlaw'!$B48 -> David Gawatz | C44: ='\\ser\software\other\[POINTS NQS  2012.XLS]Pro Outlaw'!$C48 -> St Joseph, Mo | D44: ='\\ser\software\other\[POINTS NQS  2012.XLS]Pro Outlaw'!$D48 -> 184 | E44: =IF('\\ser\software\other\[POINTS NQS  2012.XLS]Pro Outlaw'!E48=0," ",'\\ser\software\other\[POINTS NQS  2012.XLS]Pro Outlaw'!E48) -> Low Hung Buck | F44: ='\\ser\software\other\[POINTS NQS  2012.XLS]Pro Outlaw'!$AA48 -> 176 | H44: ='\\ser\software\other\[POINTS NQS  2012.XLS]Lite Outlaw'!$A16 -> 10 | I44: ='\\ser\software\other\[POINTS NQS  2012.XLS]Lite Outlaw'!$B16 -> Bob Jones Sr | J44: ='\\ser\software\other\[POINTS NQS  2012.XLS]Lite Outlaw'!$C16 -> Hopewell, Oh | K44: ='\\ser\software\other\[POINTS NQS  2012.XLS]Lite Outlaw'!$D16 -> 182 | L44: =IF('\\ser\software\other\[POINTS NQS  2012.XLS]Lite Outlaw'!E16=0," ",'\\ser\software\other\[POINTS NQS  2012.XLS]Lite Outlaw'!E16) -> Buckeye Binder | M44: ='\\ser\software\other\[POINTS NQS  2012.XLS]Lite Outlaw'!$AA14 -> 22
A45: ='\\ser\software\other\[POINTS NQS  2012.XLS]Pro Outlaw'!$A49 -> 43 | B45: ='\\ser\software\other\[POINTS NQS  2012.XLS]Pro Outlaw'!$B49 -> Jerry Skuta | C45: ='\\ser\software\other\[POINTS NQS  2012.XLS]Pro Outlaw'!$C49 -> Kimball, Mi | D45: ='\\ser\software\other\[POINTS NQS  2012.XLS]Pro Outlaw'!$D49 -> 330 | E45: =IF('\\ser\software\other\[POINTS NQS  2012.XLS]Pro Outlaw'!E49=0," ",'\\ser\software\other\[POINTS NQS  2012.XLS]Pro Outlaw'!E49) -> Mental Health 2 | F45: ='\\ser\software\other\[POINTS NQS  2012.XLS]Pro Outlaw'!$AA49 -> 176 | H45: ='\\ser\software\other\[POINTS NQS  2012.XLS]Lite Outlaw'!$A17 -> 11 | I45: ='\\ser\software\other\[POINTS NQS  2012.XLS]Lite Outlaw'!$B17 -> Wesley Briant | J45: ='\\ser\software\other\[POINTS NQS  2012.XLS]Lite Outlaw'!$C17 -> Washington, pa | K45: ='\\ser\software\other\[POINTS NQS  2012.XLS]Lite Outlaw'!$D17 -> 533 | L45: =IF('\\ser\software\other\[POINTS NQS  2012.XLS]Lite Outlaw'!E17=0," ",'\\ser\software\other\[POINTS NQS  2012.XLS]Lite Outlaw'!E17) -> Cub N Debt | M45: ='\\ser\software\other\[POINTS NQS  2012.XLS]Lite Outlaw'!$AA15 -> 30
A46: ='\\ser\software\other\[POINTS NQS  2012.XLS]Pro Outlaw'!$A50 -> 44 | B46: ='\\ser\software\other\[POINTS NQS  2012.XLS]Pro Outlaw'!$B50 -> Greg Watson | C46: ='\\ser\software\other\[POINTS NQS  2012.XLS]Pro Outlaw'!$C50 -> Batavia, Oh | D46: ='\\ser\software\other\[POINTS NQS  2012.XLS]Pro Outlaw'!$D50 -> 78 | E46: =IF('\\ser\software\other\[POINTS NQS  2012.XLS]Pro Outlaw'!E50=0," ",'\\ser\software\other\[POINTS NQS  2012.XLS]Pro Outlaw'!E50) -> Barely Legal | F46: ='\\ser\software\other\[POINTS NQS  2012.XLS]Pro Outlaw'!$AA50 -> 177 | H46: ='\\ser\software\other\[POINTS NQS  2012.XLS]Lite Outlaw'!$A18 -> 12 | I46: ='\\ser\software\other\[POINTS NQS  2012.XLS]Lite Outlaw'!$B18 -> Eli Yurkovich | J46: ='\\ser\software\other\[POINTS NQS  2012.XLS]Lite Outlaw'!$C18 -> Prosperty, Pa | K46: ='\\ser\software\other\[POINTS NQS  2012.XLS]Lite Outlaw'!$D18 -> 556 | L46: =IF('\\ser\software\other\[POINTS NQS  2012.XLS]Lite Outlaw'!E18=0," ",'\\ser\software\other\[POINTS NQS  2012.XLS]Lite Outlaw'!E18) -> Covered Bridge Exp | M46: ='\\ser\software\other\[POINTS NQS  2012.XLS]Lite Outlaw'!$AA16 -> 39
A47: ='\\ser\software\other\[POINTS NQS  2012.XLS]Pro Outlaw'!$A51 -> 45 | B47: ='\\ser\software\other\[POINTS NQS  2012.XLS]Pro Outlaw'!$B51 -> Steve Vogler | C47: ='\\ser\software\other\[POINTS NQS  2012.XLS]Pro Outlaw'!$C51 -> Jasper, IN | D47: ='\\ser\software\other\[POINTS NQS  2012.XLS]Pro Outlaw'!$D51 -> 476 | E47: =IF('\\ser\software\other\[POINTS NQS  2012.XLS]Pro Outlaw'!E51=0," ",'\\ser\software\other\[POINTS NQS  2012.XLS]Pro Outlaw'!E51) -> Outlaw Reloaded | F47: ='\\ser\software\other\[POINTS NQS  2012.XLS]Pro Outlaw'!$AA51 -> 177 | H47: ='\\ser\software\other\[POINTS NQS  2012.XLS]Lite Outlaw'!$A19 -> 13 | I47: ='\\ser\software\other\[POINTS NQS  2012.XLS]Lite Outlaw'!$B19 -> Bob Cooper | J47: ='\\ser\software\other\[POINTS NQS  2012.XLS]Lite Outlaw'!$C19 -> Westminster, Md | K47: ='\\ser\software\other\[POINTS NQS  2012.XLS]Lite Outlaw'!$D19 -> 522 | L47: =IF('\\ser\software\other\[POINTS NQS  2012.XLS]Lite Outlaw'!E19=0," ",'\\ser\software\other\[POINTS NQS  2012.XLS]Lite Outlaw'!E19) -> Just Business | M47: ='\\ser\software\other\[POINTS NQS  2012.XLS]Lite Outlaw'!$AA18 -> 50
A48: ='\\ser\software\other\[POINTS NQS  2012.XLS]Pro Outlaw'!$A52 -> 46 | B48: ='\\ser\software\other\[POINTS NQS  2012.XLS]Pro Outlaw'!$B52 -> Tyler Hackman | C48: ='\\ser\software\other\[POINTS NQS  2012.XLS]Pro Outlaw'!$C52 -> Seymour, ind | D48: ='\\ser\software\other\[POINTS NQS  2012.XLS]Pro Outlaw'!$D52 -> 508 | E48: =IF('\\ser\software\other\[POINTS NQS  2012.XLS]Pro Outlaw'!E52=0," ",'\\ser\software\other\[POINTS NQS  2012.XLS]Pro Outlaw'!E52) -> Iron Will | F48: ='\\ser\software\other\[POINTS NQS  2012.XLS]Pro Outlaw'!$AA52 -> 177 | H48: ='\\ser\software\other\[POINTS NQS  2012.XLS]Lite Outlaw'!$A20 -> 14 | I48: ='\\ser\software\other\[POINTS NQS  2012.XLS]Lite Outlaw'!$B20 -> Chris Gegg | J48: ='\\ser\software\other\[POINTS NQS  2012.XLS]Lite Outlaw'!$C20 -> Greenville, IL | K48: ='\\ser\software\other\[POINTS NQS  2012.XLS]Lite Outlaw'!$D20 -> 410 | L48: =IF('\\ser\software\other\[POINTS NQS  2012.XLS]Lite Outlaw'!E20=0," ",'\\ser\software\other\[POINTS NQS  2012.XLS]Lite Outlaw'!E20) -> Insane | M48: ='\\ser\software\other\[POINTS NQS  2012.XLS]Lite Outlaw'!$AA19 -> 53
A49: ='\\ser\software\other\[POINTS NQS  2012.XLS]Pro Outlaw'!$A53 -> 47 | B49: ='\\ser\software\other\[POINTS NQS  2012.XLS]Pro Outlaw'!$B53 -> Larry Hunter | C49: ='\\ser\software\other\[POINTS NQS  2012.XLS]Pro Outlaw'!$C53 -> Blue Licks, Ky | D49: ='\\ser\software\other\[POINTS NQS  2012.XLS]Pro Outlaw'!$D53 -> 9 | E49: =IF('\\ser\software\other\[POINTS NQS  2012.XLS]Pro Outlaw'!E53=0," ",'\\ser\software\other\[POINTS NQS  2012.XLS]Pro Outlaw'!E53) -> Runaway Deere | F49: ='\\ser\software\other\[POINTS NQS  2012.XLS]Pro Outlaw'!$AA53 -> 178 | H49: ='\\ser\software\other\[POINTS NQS  2012.XLS]Lite Outlaw'!$A21 -> 15 | I49: ='\\ser\software\other\[POINTS NQS  2012.XLS]Lite Outlaw'!$B21 -> Aaron Scroggins | J49: ='\\ser\software\other\[POINTS NQS  2012.XLS]Lite Outlaw'!$C21 -> Neosho, MO | K49: ='\\ser\software\other\[POINTS NQS  2012.XLS]Lite Outlaw'!$D21 -> 419 | L49: =IF('\\ser\software\other\[POINTS NQS  2012.XLS]Lite Outlaw'!E21=0," ",'\\ser\software\other\[POINTS NQS  2012.XLS]Lite Outlaw'!E21) -> Gambler | M49: ='\\ser\software\other\[POINTS NQS  2012.XLS]Lite Outlaw'!$AA20 -> 56
A50: ='\\ser\software\other\[POINTS NQS  2012.XLS]Pro Outlaw'!$A54 -> 48 | B50: ='\\ser\software\other\[POINTS NQS  2012.XLS]Pro Outlaw'!$B54 -> Ryan Shafer | C50: ='\\ser\software\other\[POINTS NQS  2012.XLS]Pro Outlaw'!$C54 -> Confluence, pa | D50: ='\\ser\software\other\[POINTS NQS  2012.XLS]Pro Outlaw'!$D54 -> 445 | E50: =IF('\\ser\software\other\[POINTS NQS  2012.XLS]Pro Outlaw'!E54=0," ",'\\ser\software\other\[POINTS NQS  2012.XLS]Pro Outlaw'!E54) -> LabRat | F50: ='\\ser\software\other\[POINTS NQS  2012.XLS]Pro Outlaw'!$AA54 -> 178 | H50: ='\\ser\software\other\[POINTS NQS  2012.XLS]Lite Outlaw'!$A22 -> 16 | I50: ='\\ser\software\other\[POINTS NQS  2012.XLS]Lite Outlaw'!$B22 -> Jim Waite | J50: ='\\ser\software\other\[POINTS NQS  2012.XLS]Lite Outlaw'!$C22 -> Hopkington RI | K50: ='\\ser\software\other\[POINTS NQS  2012.XLS]Lite Outlaw'!$D22 -> 0 | L50: =IF('\\ser\software\other\[POINTS NQS  2012.XLS]Lite Outlaw'!E22=0," ",'\\ser\software\other\[POINTS NQS  2012.XLS]Lite Outlaw'!E22) -> Wacky Five | M50: ='\\ser\software\other\[POINTS NQS  2012.XLS]Lite Outlaw'!$AA21 -> 57
A51: ='\\ser\software\other\[POINTS NQS  2012.XLS]Pro Outlaw'!$A55 -> 49 | B51: ='\\ser\software\other\[POINTS NQS  2012.XLS]Pro Outlaw'!$B55 -> Jerry Everhart | C51: ='\\ser\software\other\[POINTS NQS  2012.XLS]Pro Outlaw'!$C55 -> Springfield, OH | D51: ='\\ser\software\other\[POINTS NQS  2012.XLS]Pro Outlaw'!$D55 -> 483 | E51: =IF('\\ser\software\other\[POINTS NQS  2012.XLS]Pro Outlaw'!E55=0," ",'\\ser\software\other\[POINTS NQS  2012.XLS]Pro Outlaw'!E55) -> Orange Cart | F51: ='\\ser\software\other\[POINTS NQS  2012.XLS]Pro Outlaw'!$AA55 -> 178 | H51: ='\\ser\software\other\[POINTS NQS  2012.XLS]Lite Outlaw'!$A23 -> 17 | I51: ='\\ser\software\other\[POINTS NQS  2012.XLS]Lite Outlaw'!$B23 -> Dave Wise | J51: ='\\ser\software\other\[POINTS NQS  2012.XLS]Lite Outlaw'!$C23 -> Hunker, Pa | K51: ='\\ser\software\other\[POINTS NQS  2012.XLS]Lite Outlaw'!$D23 -> 403 | L51: =IF('\\ser\software\other\[POINTS NQS  2012.XLS]Lite Outlaw'!E23=0," ",'\\ser\software\other\[POINTS NQS  2012.XLS]Lite Outlaw'!E23) ->  | M51: ='\\ser\software\other\[POINTS NQS  2012.XLS]Lite Outlaw'!$AA22 -> 58
A52: ='\\ser\software\other\[POINTS NQS  2012.XLS]Pro Outlaw'!$A56 -> 50 | B52: ='\\ser\software\other\[POINTS NQS  2012.XLS]Pro Outlaw'!$B56 -> Kevin Root | C52: ='\\ser\software\other\[POINTS NQS  2012.XLS]Pro Outlaw'!$C56 -> Inola, OK | D52: ='\\ser\software\other\[POINTS NQS  2012.XLS]Pro Outlaw'!$D56 -> 118 | E52: =IF('\\ser\software\other\[POINTS NQS  2012.XLS]Pro Outlaw'!E56=0," ",'\\ser\software\other\[POINTS NQS  2012.XLS]Pro Outlaw'!E56) -> Slapshot | F52: ='\\ser\software\other\[POINTS NQS  2012.XLS]Pro Outlaw'!$AA56 -> 179 | H52: ='\\ser\software\other\[POINTS NQS  2012.XLS]Lite Outlaw'!$A24 -> 18 | I52: ='\\ser\software\other\[POINTS NQS  2012.XLS]Lite Outlaw'!$B24 -> Nevin Stitzer | J52: ='\\ser\software\other\[POINTS NQS  2012.XLS]Lite Outlaw'!$C24 -> Springs Mill, Pa | K52: ='\\ser\software\other\[POINTS NQS  2012.XLS]Lite Outlaw'!$D24 -> 448 | L52: =IF('\\ser\software\other\[POINTS NQS  2012.XLS]Lite Outlaw'!E24=0," ",'\\ser\software\other\[POINTS NQS  2012.XLS]Lite Outlaw'!E24) -> Thunder Road I | M52: ='\\ser\software\other\[POINTS NQS  2012.XLS]Lite Outlaw'!$AA23 -> 60
A53: ='\\ser\software\other\[POINTS NQS  2012.XLS]Pro Outlaw'!$A57 -> 51 | B53: ='\\ser\software\other\[POINTS NQS  2012.XLS]Pro Outlaw'!$B57 -> Bill Richerson | C53: ='\\ser\software\other\[POINTS NQS  2012.XLS]Pro Outlaw'!$C57 -> Crittenden, Ky | D53: ='\\ser\software\other\[POINTS NQS  2012.XLS]Pro Outlaw'!$D57 -> 132 | E53: =IF('\\ser\software\other\[POINTS NQS  2012.XLS]Pro Outlaw'!E57=0," ",'\\ser\software\other\[POINTS NQS  2012.XLS]Pro Outlaw'!E57) -> Walk the Line | F53: ='\\ser\software\other\[POINTS NQS  2012.XLS]Pro Outlaw'!$AA57 -> 179 | H53: ='\\ser\software\other\[POINTS NQS  2012.XLS]Lite Outlaw'!$A25 -> 19 | I53: ='\\ser\software\other\[POINTS NQS  2012.XLS]Lite Outlaw'!$B25 -> Dough Waugh | J53: ='\\ser\software\other\[POINTS NQS  2012.XLS]Lite Outlaw'!$C25 -> King City, Mo | K53: ='\\ser\software\other\[POINTS NQS  2012.XLS]Lite Outlaw'!$D25 -> 464 | L53: =IF('\\ser\software\other\[POINTS NQS  2012.XLS]Lite Outlaw'!E25=0," ",'\\ser\software\other\[POINTS NQS  2012.XLS]Lite Outlaw'!E25) ->  | M53: ='\\ser\software\other\[POINTS NQS  2012.XLS]Lite Outlaw'!$AA24 -> 62
A54: ='\\ser\software\other\[POINTS NQS  2012.XLS]Pro Outlaw'!$A58 -> 52 | B54: ='\\ser\software\other\[POINTS NQS  2012.XLS]Pro Outlaw'!$B58 -> Scott Larkins | C54: ='\\ser\software\other\[POINTS NQS  2012.XLS]Pro Outlaw'!$C58 -> Kearney, MO | D54: ='\\ser\software\other\[POINTS NQS  2012.XLS]Pro Outlaw'!$D58 -> 154 | E54: =IF('\\ser\software\other\[POINTS NQS  2012.XLS]Pro Outlaw'!E58=0," ",'\\ser\software\other\[POINTS NQS  2012.XLS]Pro Outlaw'!E58) -> Silver Sam | F54: ='\\ser\software\other\[POINTS NQS  2012.XLS]Pro Outlaw'!$AA58 -> 180 | H54: ='\\ser\software\other\[POINTS NQS  2012.XLS]Lite Outlaw'!$A26 -> 20 | I54: ='\\ser\software\other\[POINTS NQS  2012.XLS]Lite Outlaw'!$B26 -> Austin Yurkovich | J54: ='\\ser\software\other\[POINTS NQS  2012.XLS]Lite Outlaw'!$C26 -> Prosperty, Pa | K54: ='\\ser\software\other\[POINTS NQS  2012.XLS]Lite Outlaw'!$D26 -> 557 | L54: =IF('\\ser\software\other\[POINTS NQS  2012.XLS]Lite Outlaw'!E26=0," ",'\\ser\software\other\[POINTS NQS  2012.XLS]Lite Outlaw'!E26) -> Sled Stretcher | M54: ='\\ser\software\other\[POINTS NQS  2012.XLS]Lite Outlaw'!$AA25 -> 64
A55: ='\\ser\software\other\[POINTS NQS  2012.XLS]Pro Outlaw'!$A59 -> 53 | B55: ='\\ser\software\other\[POINTS NQS  2012.XLS]Pro Outlaw'!$B59 -> Jim Waite | C55: ='\\ser\software\other\[POINTS NQS  2012.XLS]Pro Outlaw'!$C59 -> Hopkinton, RI | D55: ='\\ser\software\other\[POINTS NQS  2012.XLS]Pro Outlaw'!$D59 -> 480 | E55: =IF('\\ser\software\other\[POINTS NQS  2012.XLS]Pro Outlaw'!E59=0," ",'\\ser\software\other\[POINTS NQS  2012.XLS]Pro Outlaw'!E59) -> John Deere | F55: ='\\ser\software\other\[POINTS NQS  2012.XLS]Pro Outlaw'!$AA59 -> 180 | H55: ='\\ser\software\other\[POINTS NQS  2012.XLS]Lite Outlaw'!$A27 -> 21 | I55: ='\\ser\software\other\[POINTS NQS  2012.XLS]Lite Outlaw'!$B27 -> Billy Black | J55: ='\\ser\software\other\[POINTS NQS  2012.XLS]Lite Outlaw'!$C27 -> Dry Ridge, Ky | K55: ='\\ser\software\other\[POINTS NQS  2012.XLS]Lite Outlaw'!$D27 -> 567 | L55: =IF('\\ser\software\other\[POINTS NQS  2012.XLS]Lite Outlaw'!E27=0," ",'\\ser\software\other\[POINTS NQS  2012.XLS]Lite Outlaw'!E27) ->  | M55: ='\\ser\software\other\[POINTS NQS  2012.XLS]Lite Outlaw'!$AA26 -> 65
A56: ='\\ser\software\other\[POINTS NQS  2012.XLS]Pro Outlaw'!$A60 -> 54 | B56: ='\\ser\software\other\[POINTS NQS  2012.XLS]Pro Outlaw'!$B60 -> Kevin Root | C56: ='\\ser\software\other\[POINTS NQS  2012.XLS]Pro Outlaw'!$C60 -> Inola, OK | D56: ='\\ser\software\other\[POINTS NQS  2012.XLS]Pro Outlaw'!$D60 -> 117 | E56: =IF('\\ser\software\other\[POINTS NQS  2012.XLS]Pro Outlaw'!E60=0," ",'\\ser\software\other\[POINTS NQS  2012.XLS]Pro Outlaw'!E60) -> Right on the Money | F56: ='\\ser\software\other\[POINTS NQS  2012.XLS]Pro Outlaw'!$AA60 -> 181
A57: ='\\ser\software\other\[POINTS NQS  2012.XLS]Pro Outlaw'!$A61 -> 55 | B57: ='\\ser\software\other\[POINTS NQS  2012.XLS]Pro Outlaw'!$B61 -> Charlie Ciolino | C57: ='\\ser\software\other\[POINTS NQS  2012.XLS]Pro Outlaw'!$C61 -> Hammond, LA | D57: ='\\ser\software\other\[POINTS NQS  2012.XLS]Pro Outlaw'!$D61 -> 145 | E57: =IF('\\ser\software\other\[POINTS NQS  2012.XLS]Pro Outlaw'!E61=0," ",'\\ser\software\other\[POINTS NQS  2012.XLS]Pro Outlaw'!E61) -> Mechanical Nightmare | F57: ='\\ser\software\other\[POINTS NQS  2012.XLS]Pro Outlaw'!$AA61 -> 181
A58: ='\\ser\software\other\[POINTS NQS  2012.XLS]Pro Outlaw'!$A62 -> 56 | B58: ='\\ser\software\other\[POINTS NQS  2012.XLS]Pro Outlaw'!$B62 -> Zach Richerson | C58: ='\\ser\software\other\[POINTS NQS  2012.XLS]Pro Outlaw'!$C62 -> Crittenden, Ky | D58: ='\\ser\software\other\[POINTS NQS  2012.XLS]Pro Outlaw'!$D62 -> 348 | E58: =IF('\\ser\software\other\[POINTS NQS  2012.XLS]Pro Outlaw'!E62=0," ",'\\ser\software\other\[POINTS NQS  2012.XLS]Pro Outlaw'!E62) -> Zach's Rat | F58: ='\\ser\software\other\[POINTS NQS  2012.XLS]Pro Outlaw'!$AA62 -> 181
A59: ='\\ser\software\other\[POINTS NQS  2012.XLS]Pro Outlaw'!$A63 -> 57 | B59: ='\\ser\software\other\[POINTS NQS  2012.XLS]Pro Outlaw'!$B63 -> Mike Spencer | C59: ='\\ser\software\other\[POINTS NQS  2012.XLS]Pro Outlaw'!$C63 -> W Alexandia, Oh | D59: ='\\ser\software\other\[POINTS NQS  2012.XLS]Pro Outlaw'!$D63 -> 517 | E59: =IF('\\ser\software\other\[POINTS NQS  2012.XLS]Pro Outlaw'!E63=0," ",'\\ser\software\other\[POINTS NQS  2012.XLS]Pro Outlaw'!E63) ->  | F59: ='\\ser\software\other\[POINTS NQS  2012.XLS]Pro Outlaw'!$AA63 -> 182
A60: ='\\ser\software\other\[POINTS NQS  2012.XLS]Pro Outlaw'!$A64 -> 58 | B60: ='\\ser\software\other\[POINTS NQS  2012.XLS]Pro Outlaw'!$B64 -> Harrison Stahl | C60: ='\\ser\software\other\[POINTS NQS  2012.XLS]Pro Outlaw'!$C64 -> Dewitt, IA | D60: ='\\ser\software\other\[POINTS NQS  2012.XLS]Pro Outlaw'!$D64 -> 335 | E60: =IF('\\ser\software\other\[POINTS NQS  2012.XLS]Pro Outlaw'!E64=0," ",'\\ser\software\other\[POINTS NQS  2012.XLS]Pro Outlaw'!E64) -> MWSC#3 | F60: ='\\ser\software\other\[POINTS NQS  2012.XLS]Pro Outlaw'!$AA64 -> 184
B64: BUILDERS CUP
B65: PRO/SS ENGINE BUILDERS | E65: SA ENGINE BUILDERS
B67: ='\\ser\software\other\[POINTS NQS  2012.XLS]Builders Cup'!A4 -> NP = NICHOLS PERFORMANCE | C67: ='\\ser\software\other\[POINTS NQS  2012.XLS]Builders Cup'!U4 -> 239 | E67: ='\\ser\software\other\[POINTS NQS  2012.XLS]Builders Cup'!A19 -> TV = TODD VORHEES | F67: ='\\ser\software\other\[POINTS NQS  2012.XLS]Builders Cup'!U19 -> 240
B68: ='\\ser\software\other\[POINTS NQS  2012.XLS]Builders Cup'!A5 -> MVP = MVP RACING | C68: ='\\ser\software\other\[POINTS NQS  2012.XLS]Builders Cup'!U5 -> 209 | E68: ='\\ser\software\other\[POINTS NQS  2012.XLS]Builders Cup'!A20 -> NP = NICHOLS PERFORMANCE | F68: ='\\ser\software\other\[POINTS NQS  2012.XLS]Builders Cup'!U20 -> 214
B69: ='\\ser\software\other\[POINTS NQS  2012.XLS]Builders Cup'!A6 -> HACKMAN = GREG HACKMAN | C69: ='\\ser\software\other\[POINTS NQS  2012.XLS]Builders Cup'!U6 -> 207 | E69: ='\\ser\software\other\[POINTS NQS  2012.XLS]Builders Cup'!A21 -> JRS = JIM MORGANSTERN | F69: ='\\ser\software\other\[POINTS NQS  2012.XLS]Builders Cup'!U21 -> 209
B70: ='\\ser\software\other\[POINTS NQS  2012.XLS]Builders Cup'!A7 -> JRS = JIM MORGANSTERN | C70: ='\\ser\software\other\[POINTS NQS  2012.XLS]Builders Cup'!U7 -> 170 | E70: ='\\ser\software\other\[POINTS NQS  2012.XLS]Builders Cup'!A22 -> BJ = BOB JONES | F70: ='\\ser\software\other\[POINTS NQS  2012.XLS]Builders Cup'!U22 -> 181
B71: ='\\ser\software\other\[POINTS NQS  2012.XLS]Builders Cup'!A8 -> JW = JOE WHITWORTH | C71: ='\\ser\software\other\[POINTS NQS  2012.XLS]Builders Cup'!U8 -> 170 | E71: ='\\ser\software\other\[POINTS NQS  2012.XLS]Builders Cup'!A23 -> WOODS = DAVE WOODS | F71: ='\\ser\software\other\[POINTS NQS  2012.XLS]Builders Cup'!U23 -> 149
B72: ='\\ser\software\other\[POINTS NQS  2012.XLS]Builders Cup'!A9 -> LR = LAKOTA RACING | C72: ='\\ser\software\other\[POINTS NQS  2012.XLS]Builders Cup'!U9 -> 93 | E72: ='\\ser\software\other\[POINTS NQS  2012.XLS]Builders Cup'!A24 -> LR = LAKOTA RACING | F72: ='\\ser\software\other\[POINTS NQS  2012.XLS]Builders Cup'!U24 -> 117
B73: ='\\ser\software\other\[POINTS NQS  2012.XLS]Builders Cup'!A10 -> VM = VOGEL MFG | C73: ='\\ser\software\other\[POINTS NQS  2012.XLS]Builders Cup'!U10 -> 74 | E73: ='\\ser\software\other\[POINTS NQS  2012.XLS]Builders Cup'!A25 -> RPM = RADER | F73: ='\\ser\software\other\[POINTS NQS  2012.XLS]Builders Cup'!U25 -> 113
B74: ='\\ser\software\other\[POINTS NQS  2012.XLS]Builders Cup'!A11 -> TC = TOOTER CAMPBELL | C74: ='\\ser\software\other\[POINTS NQS  2012.XLS]Builders Cup'!U11 -> 55 | E74: ='\\ser\software\other\[POINTS NQS  2012.XLS]Builders Cup'!A26 -> JW = JOE WHITWORTH | F74: ='\\ser\software\other\[POINTS NQS  2012.XLS]Builders Cup'!U26 -> 48
E75: ='\\ser\software\other\[POINTS NQS  2012.XLS]Builders Cup'!A27 -> VM = VOGEL MFG | F75: ='\\ser\software\other\[POINTS NQS  2012.XLS]Builders Cup'!U27 -> 22