A1: STOCK ALTERED 1050 | G1: Thru Richmond | I1: STOCK ALTERED 1100 | O1: Thru Richmond
B2: Name | C2: City/State | D2: Eng | E2: NQS # | F2: Tractor | G2: Points Back | J2: Name | K2: City | L2: Eng | M2: NQS# | N2: Tractor | O2: Points Back
A3: ='\\ser\software\other\[POINTS NQS  2012.XLS]Stock Altered 1050'!$A6 -> 1 | B3: ='\\ser\software\other\[POINTS NQS  2012.XLS]Stock Altered 1050'!$B6 -> Gary Cunningham | C3: ='\\ser\software\other\[POINTS NQS  2012.XLS]Stock Altered 1050'!$C6 -> Brooksville, KY | D3: ='\\ser\software\other\[POINTS NQS  2012.XLS]Stock Altered 1050'!$D6 -> NP | E3: ='\\ser\software\other\[POINTS NQS  2012.XLS]Stock Altered 1050'!$E6 -> 162 | F3: =IF('\\ser\software\other\[POINTS NQS  2012.XLS]Stock Altered 1050'!$F6=0," ",'\\ser\software\other\[POINTS NQS  2012.XLS]Stock Altered 1050'!$F6) -> High Voltage | G3: ='\\ser\software\other\[POINTS NQS  2012.XLS]Stock Altered 1050'!AA6 -> 0 | I3: ='\\ser\software\other\[POINTS NQS  2012.XLS]Stock Altered 1100'!$A6 -> 1 | J3: ='\\ser\software\other\[POINTS NQS  2012.XLS]Stock Altered 1100'!$B6 -> Matt Ronnebaum | K3: ='\\ser\software\other\[POINTS NQS  2012.XLS]Stock Altered 1100'!$C6 -> Celina, OH | L3: ='\\ser\software\other\[POINTS NQS  2012.XLS]Stock Altered 1100'!$D6 -> TV | M3: ='\\ser\software\other\[POINTS NQS  2012.XLS]Stock Altered 1100'!$E6 -> 89 | N3: =IF('\\ser\software\other\[POINTS NQS  2012.XLS]Stock Altered 1100'!$F6=0," ",'\\ser\software\other\[POINTS NQS  2012.XLS]Stock Altered 1100'!$F6) -> Boys & Their Toys | O3: ='\\ser\software\other\[POINTS NQS  2012.XLS]Stock Altered 1100'!AA6 -> 0
A4: ='\\ser\software\other\[POINTS NQS  2012.XLS]Stock Altered 1050'!$A7 -> 2 | B4: ='\\ser\software\other\[POINTS NQS  2012.XLS]Stock Altered 1050'!$B7 -> Ron Hodge | C4: ='\\ser\software\other\[POINTS NQS  2012.XLS]Stock Altered 1050'!$C7 -> Hillsboro, OH | D4: ='\\ser\software\other\[POINTS NQS  2012.XLS]Stock Altered 1050'!$D7 -> TV | E4: ='\\ser\software\other\[POINTS NQS  2012.XLS]Stock Altered 1050'!$E7 -> 71 | F4: =IF('\\ser\software\other\[POINTS NQS  2012.XLS]Stock Altered 1050'!$F7=0," ",'\\ser\software\other\[POINTS NQS  2012.XLS]Stock Altered 1050'!$F7) -> Take-N-Names | G4: ='\\ser\software\other\[POINTS NQS  2012.XLS]Stock Altered 1050'!AA7 -> 4 | I4: ='\\ser\software\other\[POINTS NQS  2012.XLS]Stock Altered 1100'!$A7 -> 2 | J4: ='\\ser\software\other\[POINTS NQS  2012.XLS]Stock Altered 1100'!$B7 -> Mark Peters | K4: ='\\ser\software\other\[POINTS NQS  2012.XLS]Stock Altered 1100'!$C7 -> McArthur, PA | L4: ='\\ser\software\other\[POINTS NQS  2012.XLS]Stock Altered 1100'!$D7 -> JRS | M4: ='\\ser\software\other\[POINTS NQS  2012.XLS]Stock Altered 1100'!$E7 -> 469 | N4: =IF('\\ser\software\other\[POINTS NQS  2012.XLS]Stock Altered 1100'!$F7=0," ",'\\ser\software\other\[POINTS NQS  2012.XLS]Stock Altered 1100'!$F7) -> American Ride | O4: ='\\ser\software\other\[POINTS NQS  2012.XLS]Stock Altered 1100'!AA7 -> 11
A5: ='\\ser\software\other\[POINTS NQS  2012.XLS]Stock Altered 1050'!$A8 -> 3 | B5: ='\\ser\software\other\[POINTS NQS  2012.XLS]Stock Altered 1050'!$B8 -> Wayne Sams | C5: ='\\ser\software\other\[POINTS NQS  2012.XLS]Stock Altered 1050'!$C8 -> Rockbridge, OH | D5: ='\\ser\software\other\[POINTS NQS  2012.XLS]Stock Altered 1050'!$D8 -> TV | E5: ='\\ser\software\other\[POINTS NQS  2012.XLS]Stock Altered 1050'!$E8 -> 82 | F5: =IF('\\ser\software\other\[POINTS NQS  2012.XLS]Stock Altered 1050'!$F8=0," ",'\\ser\software\other\[POINTS NQS  2012.XLS]Stock Altered 1050'!$F8) -> Gold Digger | G5: ='\\ser\software\other\[POINTS NQS  2012.XLS]Stock Altered 1050'!AA8 -> 6 | I5: ='\\ser\software\other\[POINTS NQS  2012.XLS]Stock Altered 1100'!$A8 -> 3 | J5: ='\\ser\software\other\[POINTS NQS  2012.XLS]Stock Altered 1100'!$B8 -> Wayne Sams | K5: ='\\ser\software\other\[POINTS NQS  2012.XLS]Stock Altered 1100'!$C8 -> Rockbridge, OH | L5: ='\\ser\software\other\[POINTS NQS  2012.XLS]Stock Altered 1100'!$D8 -> TV | M5: ='\\ser\software\other\[POINTS NQS  2012.XLS]Stock Altered 1100'!$E8 -> 82 | N5: =IF('\\ser\software\other\[POINTS NQS  2012.XLS]Stock Altered 1100'!$F8=0," ",'\\ser\software\other\[POINTS NQS  2012.XLS]Stock Altered 1100'!$F8) -> Gold Digger | O5: ='\\ser\software\other\[POINTS NQS  2012.XLS]Stock Altered 1100'!AA8 -> 15
A6: ='\\ser\software\other\[POINTS NQS  2012.XLS]Stock Altered 1050'!$A9 -> 4 | B6: ='\\ser\software\other\[POINTS NQS  2012.XLS]Stock Altered 1050'!$B9 -> Colt Vorhees | C6: ='\\ser\software\other\[POINTS NQS  2012.XLS]Stock Altered 1050'!$C9 -> Rockbridge, OH | D6: ='\\ser\software\other\[POINTS NQS  2012.XLS]Stock Altered 1050'!$D9 -> TV | E6: ='\\ser\software\other\[POINTS NQS  2012.XLS]Stock Altered 1050'!$E9 -> 313 | F6: =IF('\\ser\software\other\[POINTS NQS  2012.XLS]Stock Altered 1050'!$F9=0," ",'\\ser\software\other\[POINTS NQS  2012.XLS]Stock Altered 1050'!$F9) -> Red Cadet | G6: ='\\ser\software\other\[POINTS NQS  2012.XLS]Stock Altered 1050'!AA9 -> 11 | I6: ='\\ser\software\other\[POINTS NQS  2012.XLS]Stock Altered 1100'!$A9 -> 4 | J6: ='\\ser\software\other\[POINTS NQS  2012.XLS]Stock Altered 1100'!$B9 -> Doug Seaman | K6: ='\\ser\software\other\[POINTS NQS  2012.XLS]Stock Altered 1100'!$C9 -> Vincent, OH | L6: ='\\ser\software\other\[POINTS NQS  2012.XLS]Stock Altered 1100'!$D9 -> BJ | M6: ='\\ser\software\other\[POINTS NQS  2012.XLS]Stock Altered 1100'!$E9 -> 192 | N6: =IF('\\ser\software\other\[POINTS NQS  2012.XLS]Stock Altered 1100'!$F9=0," ",'\\ser\software\other\[POINTS NQS  2012.XLS]Stock Altered 1100'!$F9) -> Massey Ferguson | O6: ='\\ser\software\other\[POINTS NQS  2012.XLS]Stock Altered 1100'!AA9 -> 34
A7: ='\\ser\software\other\[POINTS NQS  2012.XLS]Stock Altered 1050'!$A10 -> 5 | B7: ='\\ser\software\other\[POINTS NQS  2012.XLS]Stock Altered 1050'!$B10 -> Gregory Vandervort | C7: ='\\ser\software\other\[POINTS NQS  2012.XLS]Stock Altered 1050'!$C10 -> Albion, PA | D7: ='\\ser\software\other\[POINTS NQS  2012.XLS]Stock Altered 1050'!$D10 -> TV | E7: ='\\ser\software\other\[POINTS NQS  2012.XLS]Stock Altered 1050'!$E10 -> 346 | F7: =IF('\\ser\software\other\[POINTS NQS  2012.XLS]Stock Altered 1050'!$F10=0," ",'\\ser\software\other\[POINTS NQS  2012.XLS]Stock Altered 1050'!$F10) -> Yellow Cub | G7: ='\\ser\software\other\[POINTS NQS  2012.XLS]Stock Altered 1050'!AA10 -> 13 | I7: ='\\ser\software\other\[POINTS NQS  2012.XLS]Stock Altered 1100'!$A10 -> 5 | J7: ='\\ser\software\other\[POINTS NQS  2012.XLS]Stock Altered 1100'!$B10 -> Donnie Herring | K7: ='\\ser\software\other\[POINTS NQS  2012.XLS]Stock Altered 1100'!$C10 -> Rockbridge, OH | L7: ='\\ser\software\other\[POINTS NQS  2012.XLS]Stock Altered 1100'!$D10 -> TV | M7: ='\\ser\software\other\[POINTS NQS  2012.XLS]Stock Altered 1100'!$E10 -> 331 | N7: =IF('\\ser\software\other\[POINTS NQS  2012.XLS]Stock Altered 1100'!$F10=0," ",'\\ser\software\other\[POINTS NQS  2012.XLS]Stock Altered 1100'!$F10) -> Pasttime | O7: ='\\ser\software\other\[POINTS NQS  2012.XLS]Stock Altered 1100'!AA10 -> 40
A8: ='\\ser\software\other\[POINTS NQS  2012.XLS]Stock Altered 1050'!$A11 -> 6 | B8: ='\\ser\software\other\[POINTS NQS  2012.XLS]Stock Altered 1050'!$B11 -> Greg Watson | C8: ='\\ser\software\other\[POINTS NQS  2012.XLS]Stock Altered 1050'!$C11 -> Batavia, OH | D8: ='\\ser\software\other\[POINTS NQS  2012.XLS]Stock Altered 1050'!$D11 -> NP | E8: ='\\ser\software\other\[POINTS NQS  2012.XLS]Stock Altered 1050'!$E11 -> 327 | F8: =IF('\\ser\software\other\[POINTS NQS  2012.XLS]Stock Altered 1050'!$F11=0," ",'\\ser\software\other\[POINTS NQS  2012.XLS]Stock Altered 1050'!$F11) -> Road Warrior | G8: ='\\ser\software\other\[POINTS NQS  2012.XLS]Stock Altered 1050'!AA11 -> 27 | I8: ='\\ser\software\other\[POINTS NQS  2012.XLS]Stock Altered 1100'!$A11 -> 6 | J8: ='\\ser\software\other\[POINTS NQS  2012.XLS]Stock Altered 1100'!$B11 -> Ron Hodge | K8: ='\\ser\software\other\[POINTS NQS  2012.XLS]Stock Altered 1100'!$C11 -> Hillsboro, OH | L8: ='\\ser\software\other\[POINTS NQS  2012.XLS]Stock Altered 1100'!$D11 -> TV | M8: ='\\ser\software\other\[POINTS NQS  2012.XLS]Stock Altered 1100'!$E11 -> 71 | N8: =IF('\\ser\software\other\[POINTS NQS  2012.XLS]Stock Altered 1100'!$F11=0," ",'\\ser\software\other\[POINTS NQS  2012.XLS]Stock Altered 1100'!$F11) -> Take-N-Names | O8: ='\\ser\software\other\[POINTS NQS  2012.XLS]Stock Altered 1100'!AA11 -> 42
A9: ='\\ser\software\other\[POINTS NQS  2012.XLS]Stock Altered 1050'!$A12 -> 7 | B9: ='\\ser\software\other\[POINTS NQS  2012.XLS]Stock Altered 1050'!$B12 -> Matt Ronnebaum | C9: ='\\ser\software\other\[POINTS NQS  2012.XLS]Stock Altered 1050'!$C12 -> Celina, OH | D9: ='\\ser\software\other\[POINTS NQS  2012.XLS]Stock Altered 1050'!$D12 -> TV | E9: ='\\ser\software\other\[POINTS NQS  2012.XLS]Stock Altered 1050'!$E12 -> 89 | F9: =IF('\\ser\software\other\[POINTS NQS  2012.XLS]Stock Altered 1050'!$F12=0," ",'\\ser\software\other\[POINTS NQS  2012.XLS]Stock Altered 1050'!$F12) -> Boys & Their Toys | G9: ='\\ser\software\other\[POINTS NQS  2012.XLS]Stock Altered 1050'!AA12 -> 38 | I9: ='\\ser\software\other\[POINTS NQS  2012.XLS]Stock Altered 1100'!$A12 -> 7 | J9: ='\\ser\software\other\[POINTS NQS  2012.XLS]Stock Altered 1100'!$B12 -> Cody Costa | K9: ='\\ser\software\other\[POINTS NQS  2012.XLS]Stock Altered 1100'!$C12 -> Greencastle, PA | L9: ='\\ser\software\other\[POINTS NQS  2012.XLS]Stock Altered 1100'!$D12 -> NP | M9: ='\\ser\software\other\[POINTS NQS  2012.XLS]Stock Altered 1100'!$E12 -> 135 | N9: =IF('\\ser\software\other\[POINTS NQS  2012.XLS]Stock Altered 1100'!$F12=0," ",'\\ser\software\other\[POINTS NQS  2012.XLS]Stock Altered 1100'!$F12) -> Wild Child | O9: ='\\ser\software\other\[POINTS NQS  2012.XLS]Stock Altered 1100'!AA12 -> 50
A10: ='\\ser\software\other\[POINTS NQS  2012.XLS]Stock Altered 1050'!$A13 -> 8 | B10: ='\\ser\software\other\[POINTS NQS  2012.XLS]Stock Altered 1050'!$B13 -> Tim Shaw | C10: ='\\ser\software\other\[POINTS NQS  2012.XLS]Stock Altered 1050'!$C13 -> Rockbridge, OH | D10: ='\\ser\software\other\[POINTS NQS  2012.XLS]Stock Altered 1050'!$D13 -> TV | E10: ='\\ser\software\other\[POINTS NQS  2012.XLS]Stock Altered 1050'!$E13 -> 454 | F10: =IF('\\ser\software\other\[POINTS NQS  2012.XLS]Stock Altered 1050'!$F13=0," ",'\\ser\software\other\[POINTS NQS  2012.XLS]Stock Altered 1050'!$F13) -> Heavy Hauler | G10: ='\\ser\software\other\[POINTS NQS  2012.XLS]Stock Altered 1050'!AA13 -> 40 | I10: ='\\ser\software\other\[POINTS NQS  2012.XLS]Stock Altered 1100'!$A13 -> 8 | J10: ='\\ser\software\other\[POINTS NQS  2012.XLS]Stock Altered 1100'!$B13 -> Eli Zimmerman | K10: ='\\ser\software\other\[POINTS NQS  2012.XLS]Stock Altered 1100'!$C13 -> Allentown, PA | L10: ='\\ser\software\other\[POINTS NQS  2012.XLS]Stock Altered 1100'!$D13 -> NP | M10: ='\\ser\software\other\[POINTS NQS  2012.XLS]Stock Altered 1100'!$E13 -> 75 | N10: =IF('\\ser\software\other\[POINTS NQS  2012.XLS]Stock Altered 1100'!$F13=0," ",'\\ser\software\other\[POINTS NQS  2012.XLS]Stock Altered 1100'!$F13) -> Red Fever | O10: ='\\ser\software\other\[POINTS NQS  2012.XLS]Stock Altered 1100'!AA13 -> 53
A11: ='\\ser\software\other\[POINTS NQS  2012.XLS]Stock Altered 1050'!$A14 -> 9 | B11: ='\\ser\software\other\[POINTS NQS  2012.XLS]Stock Altered 1050'!$B14 -> Lonnie Lewis | C11: ='\\ser\software\other\[POINTS NQS  2012.XLS]Stock Altered 1050'!$C14 -> Milford, OH | D11: ='\\ser\software\other\[POINTS NQS  2012.XLS]Stock Altered 1050'!$D14 -> TV | E11: ='\\ser\software\other\[POINTS NQS  2012.XLS]Stock Altered 1050'!$E14 -> 24 | F11: =IF('\\ser\software\other\[POINTS NQS  2012.XLS]Stock Altered 1050'!$F14=0," ",'\\ser\software\other\[POINTS NQS  2012.XLS]Stock Altered 1050'!$F14) -> Deuces Wild | G11: ='\\ser\software\other\[POINTS NQS  2012.XLS]Stock Altered 1050'!AA14 -> 42 | I11: ='\\ser\software\other\[POINTS NQS  2012.XLS]Stock Altered 1100'!$A14 -> 9 | J11: ='\\ser\software\other\[POINTS NQS  2012.XLS]Stock Altered 1100'!$B14 -> Gary Seaman | K11: ='\\ser\software\other\[POINTS NQS  2012.XLS]Stock Altered 1100'!$C14 -> Fleming, OH | L11: ='\\ser\software\other\[POINTS NQS  2012.XLS]Stock Altered 1100'!$D14 -> BJ | M11: ='\\ser\software\other\[POINTS NQS  2012.XLS]Stock Altered 1100'!$E14 -> 191 | N11: =IF('\\ser\software\other\[POINTS NQS  2012.XLS]Stock Altered 1100'!$F14=0," ",'\\ser\software\other\[POINTS NQS  2012.XLS]Stock Altered 1100'!$F14) -> Farmers Money | O11: ='\\ser\software\other\[POINTS NQS  2012.XLS]Stock Altered 1100'!AA14 -> 54
A12: ='\\ser\software\other\[POINTS NQS  2012.XLS]Stock Altered 1050'!$A15 -> 10 | B12: ='\\ser\software\other\[POINTS NQS  2012.XLS]Stock Altered 1050'!$B15 -> Bob Jones JR | C12: ='\\ser\software\other\[POINTS NQS  2012.XLS]Stock Altered 1050'!$C15 -> Hopewell, OH | D12: ='\\ser\software\other\[POINTS NQS  2012.XLS]Stock Altered 1050'!$D15 -> BJ | E12: ='\\ser\software\other\[POINTS NQS  2012.XLS]Stock Altered 1050'!$E15 -> 183 | F12: =IF('\\ser\software\other\[POINTS NQS  2012.XLS]Stock Altered 1050'!$F15=0," ",'\\ser\software\other\[POINTS NQS  2012.XLS]Stock Altered 1050'!$F15) -> Playdough | G12: ='\\ser\software\other\[POINTS NQS  2012.XLS]Stock Altered 1050'!AA15 -> 46 | I12: ='\\ser\software\other\[POINTS NQS  2012.XLS]Stock Altered 1100'!$A15 -> 10 | J12: ='\\ser\software\other\[POINTS NQS  2012.XLS]Stock Altered 1100'!$B15 -> John Dewald | K12: ='\\ser\software\other\[POINTS NQS  2012.XLS]Stock Altered 1100'!$C15 -> Tiffon, OH | L12: ='\\ser\software\other\[POINTS NQS  2012.XLS]Stock Altered 1100'!$D15 -> RPM | M12: ='\\ser\software\other\[POINTS NQS  2012.XLS]Stock Altered 1100'!$E15 -> 484 | N12: =IF('\\ser\software\other\[POINTS NQS  2012.XLS]Stock Altered 1100'!$F15=0," ",'\\ser\software\other\[POINTS NQS  2012.XLS]Stock Altered 1100'!$F15) -> Patience | O12: ='\\ser\software\other\[POINTS NQS  2012.XLS]Stock Altered 1100'!AA15 -> 54
A13: ='\\ser\software\other\[POINTS NQS  2012.XLS]Stock Altered 1050'!$A16 -> 11 | B13: ='\\ser\software\other\[POINTS NQS  2012.XLS]Stock Altered 1050'!$B16 -> Lee Dewald | C13: ='\\ser\software\other\[POINTS NQS  2012.XLS]Stock Altered 1050'!$C16 -> Tiffon, OH | D13: ='\\ser\software\other\[POINTS NQS  2012.XLS]Stock Altered 1050'!$D16 -> NP | E13: ='\\ser\software\other\[POINTS NQS  2012.XLS]Stock Altered 1050'!$E16 -> 465 | F13: =IF('\\ser\software\other\[POINTS NQS  2012.XLS]Stock Altered 1050'!$F16=0," ",'\\ser\software\other\[POINTS NQS  2012.XLS]Stock Altered 1050'!$F16) -> Barnyard Bandit | G13: ='\\ser\software\other\[POINTS NQS  2012.XLS]Stock Altered 1050'!AA16 -> 47 | I13: ='\\ser\software\other\[POINTS NQS  2012.XLS]Stock Altered 1100'!$A16 -> 11 | J13: ='\\ser\software\other\[POINTS NQS  2012.XLS]Stock Altered 1100'!$B16 -> Tim Shaw | K13: ='\\ser\software\other\[POINTS NQS  2012.XLS]Stock Altered 1100'!$C16 -> Rockbridge, OH | L13: ='\\ser\software\other\[POINTS NQS  2012.XLS]Stock Altered 1100'!$D16 -> TV | M13: ='\\ser\software\other\[POINTS NQS  2012.XLS]Stock Altered 1100'!$E16 -> 454 | N13: =IF('\\ser\software\other\[POINTS NQS  2012.XLS]Stock Altered 1100'!$F16=0," ",'\\ser\software\other\[POINTS NQS  2012.XLS]Stock Altered 1100'!$F16) -> Heavy Hauler | O13: ='\\ser\software\other\[POINTS NQS  2012.XLS]Stock Altered 1100'!AA16 -> 55
A14: ='\\ser\software\other\[POINTS NQS  2012.XLS]Stock Altered 1050'!$A17 -> 12 | B14: ='\\ser\software\other\[POINTS NQS  2012.XLS]Stock Altered 1050'!$B17 -> Roger McKinney | C14: ='\\ser\software\other\[POINTS NQS  2012.XLS]Stock Altered 1050'!$C17 -> Lake Ariel, PA | D14: ='\\ser\software\other\[POINTS NQS  2012.XLS]Stock Altered 1050'!$D17 -> JRS | E14: ='\\ser\software\other\[POINTS NQS  2012.XLS]Stock Altered 1050'!$E17 -> 83 | F14: =IF('\\ser\software\other\[POINTS NQS  2012.XLS]Stock Altered 1050'!$F17=0," ",'\\ser\software\other\[POINTS NQS  2012.XLS]Stock Altered 1050'!$F17) -> Blue Thunder | G14: ='\\ser\software\other\[POINTS NQS  2012.XLS]Stock Altered 1050'!AA17 -> 48 | I14: ='\\ser\software\other\[POINTS NQS  2012.XLS]Stock Altered 1100'!$A17 -> 12 | J14: ='\\ser\software\other\[POINTS NQS  2012.XLS]Stock Altered 1100'!$B17 -> Colt Vorhees | K14: ='\\ser\software\other\[POINTS NQS  2012.XLS]Stock Altered 1100'!$C17 -> Rockbridge, OH | L14: ='\\ser\software\other\[POINTS NQS  2012.XLS]Stock Altered 1100'!$D17 -> TV | M14: ='\\ser\software\other\[POINTS NQS  2012.XLS]Stock Altered 1100'!$E17 -> 313 | N14: =IF('\\ser\software\other\[POINTS NQS  2012.XLS]Stock Altered 1100'!$F17=0," ",'\\ser\software\other\[POINTS NQS  2012.XLS]Stock Altered 1100'!$F17) -> Red Cadet | O14: ='\\ser\software\other\[POINTS NQS  2012.XLS]Stock Altered 1100'!AA17 -> 58
A15: ='\\ser\software\other\[POINTS NQS  2012.XLS]Stock Altered 1050'!$A18 -> 13 | B15: ='\\ser\software\other\[POINTS NQS  2012.XLS]Stock Altered 1050'!$B18 -> Kelly Nichols | C15: ='\\ser\software\other\[POINTS NQS  2012.XLS]Stock Altered 1050'!$C18 -> Lore City, OH | D15: ='\\ser\software\other\[POINTS NQS  2012.XLS]Stock Altered 1050'!$D18 -> NP | E15: ='\\ser\software\other\[POINTS NQS  2012.XLS]Stock Altered 1050'!$E18 -> 358 | F15: =IF('\\ser\software\other\[POINTS NQS  2012.XLS]Stock Altered 1050'!$F18=0," ",'\\ser\software\other\[POINTS NQS  2012.XLS]Stock Altered 1050'!$F18) -> Maxx'd Out | G15: ='\\ser\software\other\[POINTS NQS  2012.XLS]Stock Altered 1050'!AA18 -> 48 | I15: ='\\ser\software\other\[POINTS NQS  2012.XLS]Stock Altered 1100'!$A18 -> 13 | J15: ='\\ser\software\other\[POINTS NQS  2012.XLS]Stock Altered 1100'!$B18 -> Shane Hadley | K15: ='\\ser\software\other\[POINTS NQS  2012.XLS]Stock Altered 1100'!$C18 -> Marion, NY | L15: ='\\ser\software\other\[POINTS NQS  2012.XLS]Stock Altered 1100'!$D18 -> LR | M15: ='\\ser\software\other\[POINTS NQS  2012.XLS]Stock Altered 1100'!$E18 -> 442 | N15: =IF('\\ser\software\other\[POINTS NQS  2012.XLS]Stock Altered 1100'!$F18=0," ",'\\ser\software\other\[POINTS NQS  2012.XLS]Stock Altered 1100'!$F18) -> Foot Finder | O15: ='\\ser\software\other\[POINTS NQS  2012.XLS]Stock Altered 1100'!AA18 -> 59
A16: ='\\ser\software\other\[POINTS NQS  2012.XLS]Stock Altered 1050'!$A19 -> 14 | B16: ='\\ser\software\other\[POINTS NQS  2012.XLS]Stock Altered 1050'!$B19 -> Ed Kerner | C16: ='\\ser\software\other\[POINTS NQS  2012.XLS]Stock Altered 1050'!$C19 -> Kimball, MI | D16: ='\\ser\software\other\[POINTS NQS  2012.XLS]Stock Altered 1050'!$D19 -> NP | E16: ='\\ser\software\other\[POINTS NQS  2012.XLS]Stock Altered 1050'!$E19 -> 303 | F16: =IF('\\ser\software\other\[POINTS NQS  2012.XLS]Stock Altered 1050'!$F19=0," ",'\\ser\software\other\[POINTS NQS  2012.XLS]Stock Altered 1050'!$F19) -> Along for the Ride | G16: ='\\ser\software\other\[POINTS NQS  2012.XLS]Stock Altered 1050'!AA19 -> 49 | I16: ='\\ser\software\other\[POINTS NQS  2012.XLS]Stock Altered 1100'!$A19 -> 14 | J16: ='\\ser\software\other\[POINTS NQS  2012.XLS]Stock Altered 1100'!$B19 -> Lonnie Lewis | K16: ='\\ser\software\other\[POINTS NQS  2012.XLS]Stock Altered 1100'!$C19 -> Milford, OH | L16: ='\\ser\software\other\[POINTS NQS  2012.XLS]Stock Altered 1100'!$D19 -> TV | M16: ='\\ser\software\other\[POINTS NQS  2012.XLS]Stock Altered 1100'!$E19 -> 24 | N16: =IF('\\ser\software\other\[POINTS NQS  2012.XLS]Stock Altered 1100'!$F19=0," ",'\\ser\software\other\[POINTS NQS  2012.XLS]Stock Altered 1100'!$F19) -> Deuces Wild | O16: ='\\ser\software\other\[POINTS NQS  2012.XLS]Stock Altered 1100'!AA19 -> 64
A17: ='\\ser\software\other\[POINTS NQS  2012.XLS]Stock Altered 1050'!$A20 -> 15 | B17: ='\\ser\software\other\[POINTS NQS  2012.XLS]Stock Altered 1050'!$B20 -> Eli Zimmerman | C17: ='\\ser\software\other\[POINTS NQS  2012.XLS]Stock Altered 1050'!$C20 -> Allentown, PA | D17: ='\\ser\software\other\[POINTS NQS  2012.XLS]Stock Altered 1050'!$D20 -> NP | E17: ='\\ser\software\other\[POINTS NQS  2012.XLS]Stock Altered 1050'!$E20 -> 75 | F17: =IF('\\ser\software\other\[POINTS NQS  2012.XLS]Stock Altered 1050'!$F20=0," ",'\\ser\software\other\[POINTS NQS  2012.XLS]Stock Altered 1050'!$F20) -> Red Fever | G17: ='\\ser\software\other\[POINTS NQS  2012.XLS]Stock Altered 1050'!AA20 -> 53 | I17: ='\\ser\software\other\[POINTS NQS  2012.XLS]Stock Altered 1100'!$A20 -> 15 | J17: ='\\ser\software\other\[POINTS NQS  2012.XLS]Stock Altered 1100'!$B20 -> Dave Washburn | K17: ='\\ser\software\other\[POINTS NQS  2012.XLS]Stock Altered 1100'!$C20 -> Guysville, OH | L17: ='\\ser\software\other\[POINTS NQS  2012.XLS]Stock Altered 1100'!$D20 -> BJ | M17: ='\\ser\software\other\[POINTS NQS  2012.XLS]Stock Altered 1100'!$E20 -> 156 | N17: =IF('\\ser\software\other\[POINTS NQS  2012.XLS]Stock Altered 1100'!$F20=0," ",'\\ser\software\other\[POINTS NQS  2012.XLS]Stock Altered 1100'!$F20) -> Last Minute | O17: ='\\ser\software\other\[POINTS NQS  2012.XLS]Stock Altered 1100'!AA20 -> 64
A18: ='\\ser\software\other\[POINTS NQS  2012.XLS]Stock Altered 1050'!$A21 -> 16 | B18: ='\\ser\software\other\[POINTS NQS  2012.XLS]Stock Altered 1050'!$B21 -> Jamie Lewis | C18: ='\\ser\software\other\[POINTS NQS  2012.XLS]Stock Altered 1050'!$C21 -> Cincinnati, Oh | D18: ='\\ser\software\other\[POINTS NQS  2012.XLS]Stock Altered 1050'!$D21 -> TV | E18: ='\\ser\software\other\[POINTS NQS  2012.XLS]Stock Altered 1050'!$E21 -> 19 | F18: =IF('\\ser\software\other\[POINTS NQS  2012.XLS]Stock Altered 1050'!$F21=0," ",'\\ser\software\other\[POINTS NQS  2012.XLS]Stock Altered 1050'!$F21) -> Oh So Orange | G18: ='\\ser\software\other\[POINTS NQS  2012.XLS]Stock Altered 1050'!AA21 -> 54 | I18: ='\\ser\software\other\[POINTS NQS  2012.XLS]Stock Altered 1100'!$A21 -> 16 | J18: ='\\ser\software\other\[POINTS NQS  2012.XLS]Stock Altered 1100'!$B21 -> Gregory Vandervort | K18: ='\\ser\software\other\[POINTS NQS  2012.XLS]Stock Altered 1100'!$C21 -> Albion, PA | L18: ='\\ser\software\other\[POINTS NQS  2012.XLS]Stock Altered 1100'!$D21 -> TV | M18: ='\\ser\software\other\[POINTS NQS  2012.XLS]Stock Altered 1100'!$E21 -> 346 | N18: =IF('\\ser\software\other\[POINTS NQS  2012.XLS]Stock Altered 1100'!$F21=0," ",'\\ser\software\other\[POINTS NQS  2012.XLS]Stock Altered 1100'!$F21) -> Yellow Cub | O18: ='\\ser\software\other\[POINTS NQS  2012.XLS]Stock Altered 1100'!AA21 -> 76
A19: ='\\ser\software\other\[POINTS NQS  2012.XLS]Stock Altered 1050'!$A22 -> 17 | B19: ='\\ser\software\other\[POINTS NQS  2012.XLS]Stock Altered 1050'!$B22 -> Doug Seaman | C19: ='\\ser\software\other\[POINTS NQS  2012.XLS]Stock Altered 1050'!$C22 -> Vincent, OH | D19: ='\\ser\software\other\[POINTS NQS  2012.XLS]Stock Altered 1050'!$D22 -> BJ | E19: ='\\ser\software\other\[POINTS NQS  2012.XLS]Stock Altered 1050'!$E22 -> 192 | F19: =IF('\\ser\software\other\[POINTS NQS  2012.XLS]Stock Altered 1050'!$F22=0," ",'\\ser\software\other\[POINTS NQS  2012.XLS]Stock Altered 1050'!$F22) -> Massey Ferguson | G19: ='\\ser\software\other\[POINTS NQS  2012.XLS]Stock Altered 1050'!AA22 -> 56 | I19: ='\\ser\software\other\[POINTS NQS  2012.XLS]Stock Altered 1100'!$A22 -> 17 | J19: ='\\ser\software\other\[POINTS NQS  2012.XLS]Stock Altered 1100'!$B22 -> Rick James | K19: ='\\ser\software\other\[POINTS NQS  2012.XLS]Stock Altered 1100'!$C22 -> Lancaster, OH | L19: ='\\ser\software\other\[POINTS NQS  2012.XLS]Stock Altered 1100'!$D22 -> BJ | M19: ='\\ser\software\other\[POINTS NQS  2012.XLS]Stock Altered 1100'!$E22 -> 427 | N19: =IF('\\ser\software\other\[POINTS NQS  2012.XLS]Stock Altered 1100'!$F22=0," ",'\\ser\software\other\[POINTS NQS  2012.XLS]Stock Altered 1100'!$F22) -> James Gang III | O19: ='\\ser\software\other\[POINTS NQS  2012.XLS]Stock Altered 1100'!AA22 -> 77
A20: ='\\ser\software\other\[POINTS NQS  2012.XLS]Stock Altered 1050'!$A23 -> 18 | B20: ='\\ser\software\other\[POINTS NQS  2012.XLS]Stock Altered 1050'!$B23 -> Judy Lowe | C20: ='\\ser\software\other\[POINTS NQS  2012.XLS]Stock Altered 1050'!$C23 -> Urbana, OH | D20: ='\\ser\software\other\[POINTS NQS  2012.XLS]Stock Altered 1050'!$D23 -> TV | E20: ='\\ser\software\other\[POINTS NQS  2012.XLS]Stock Altered 1050'!$E23 -> 10 | F20: =IF('\\ser\software\other\[POINTS NQS  2012.XLS]Stock Altered 1050'!$F23=0," ",'\\ser\software\other\[POINTS NQS  2012.XLS]Stock Altered 1050'!$F23) -> SlowMotion | G20: ='\\ser\software\other\[POINTS NQS  2012.XLS]Stock Altered 1050'!AA23 -> 58 | I20: ='\\ser\software\other\[POINTS NQS  2012.XLS]Stock Altered 1100'!$A23 -> 18 | J20: ='\\ser\software\other\[POINTS NQS  2012.XLS]Stock Altered 1100'!$B23 -> Judy Lowe | K20: ='\\ser\software\other\[POINTS NQS  2012.XLS]Stock Altered 1100'!$C23 -> Urbana, OH | L20: ='\\ser\software\other\[POINTS NQS  2012.XLS]Stock Altered 1100'!$D23 -> TV | M20: ='\\ser\software\other\[POINTS NQS  2012.XLS]Stock Altered 1100'!$E23 -> 10 | N20: =IF('\\ser\software\other\[POINTS NQS  2012.XLS]Stock Altered 1100'!$F23=0," ",'\\ser\software\other\[POINTS NQS  2012.XLS]Stock Altered 1100'!$F23) -> SlowMotion | O20: ='\\ser\software\other\[POINTS NQS  2012.XLS]Stock Altered 1100'!AA23 -> 78
A21: ='\\ser\software\other\[POINTS NQS  2012.XLS]Stock Altered 1050'!$A24 -> 19 | B21: ='\\ser\software\other\[POINTS NQS  2012.XLS]Stock Altered 1050'!$B24 -> Ron Finch | C21: ='\\ser\software\other\[POINTS NQS  2012.XLS]Stock Altered 1050'!$C24 -> Milan, MI | D21: ='\\ser\software\other\[POINTS NQS  2012.XLS]Stock Altered 1050'!$D24 -> Woods | E21: ='\\ser\software\other\[POINTS NQS  2012.XLS]Stock Altered 1050'!$E24 -> 142 | F21: =IF('\\ser\software\other\[POINTS NQS  2012.XLS]Stock Altered 1050'!$F24=0," ",'\\ser\software\other\[POINTS NQS  2012.XLS]Stock Altered 1050'!$F24) -> Top Notch | G21: ='\\ser\software\other\[POINTS NQS  2012.XLS]Stock Altered 1050'!AA24 -> 58 | I21: ='\\ser\software\other\[POINTS NQS  2012.XLS]Stock Altered 1100'!$A24 -> 19 | J21: ='\\ser\software\other\[POINTS NQS  2012.XLS]Stock Altered 1100'!$B24 -> Randy Demers | K21: ='\\ser\software\other\[POINTS NQS  2012.XLS]Stock Altered 1100'!$C24 -> Columbia, NJ | L21: ='\\ser\software\other\[POINTS NQS  2012.XLS]Stock Altered 1100'!$D24 -> NP | M21: ='\\ser\software\other\[POINTS NQS  2012.XLS]Stock Altered 1100'!$E24 -> 84 | N21: =IF('\\ser\software\other\[POINTS NQS  2012.XLS]Stock Altered 1100'!$F24=0," ",'\\ser\software\other\[POINTS NQS  2012.XLS]Stock Altered 1100'!$F24) -> Bounty Hunter | O21: ='\\ser\software\other\[POINTS NQS  2012.XLS]Stock Altered 1100'!AA24 -> 78
A22: ='\\ser\software\other\[POINTS NQS  2012.XLS]Stock Altered 1050'!$A25 -> 20 | B22: ='\\ser\software\other\[POINTS NQS  2012.XLS]Stock Altered 1050'!$B25 -> Dave Washburn | C22: ='\\ser\software\other\[POINTS NQS  2012.XLS]Stock Altered 1050'!$C25 -> Guysville, OH | D22: ='\\ser\software\other\[POINTS NQS  2012.XLS]Stock Altered 1050'!$D25 -> BJ | E22: ='\\ser\software\other\[POINTS NQS  2012.XLS]Stock Altered 1050'!$E25 -> 156 | F22: =IF('\\ser\software\other\[POINTS NQS  2012.XLS]Stock Altered 1050'!$F25=0," ",'\\ser\software\other\[POINTS NQS  2012.XLS]Stock Altered 1050'!$F25) -> Last Minute | G22: ='\\ser\software\other\[POINTS NQS  2012.XLS]Stock Altered 1050'!AA25 -> 59 | I22: ='\\ser\software\other\[POINTS NQS  2012.XLS]Stock Altered 1100'!$A25 -> 20 | J22: ='\\ser\software\other\[POINTS NQS  2012.XLS]Stock Altered 1100'!$B25 -> Greg Watson | K22: ='\\ser\software\other\[POINTS NQS  2012.XLS]Stock Altered 1100'!$C25 -> Batavia, OH | L22: ='\\ser\software\other\[POINTS NQS  2012.XLS]Stock Altered 1100'!$D25 -> NP | M22: ='\\ser\software\other\[POINTS NQS  2012.XLS]Stock Altered 1100'!$E25 -> 327 | N22: =IF('\\ser\software\other\[POINTS NQS  2012.XLS]Stock Altered 1100'!$F25=0," ",'\\ser\software\other\[POINTS NQS  2012.XLS]Stock Altered 1100'!$F25) -> Road Warrior | O22: ='\\ser\software\other\[POINTS NQS  2012.XLS]Stock Altered 1100'!AA25 -> 83
A23: ='\\ser\software\other\[POINTS NQS  2012.XLS]Stock Altered 1050'!$A26 -> 21 | B23: ='\\ser\software\other\[POINTS NQS  2012.XLS]Stock Altered 1050'!$B26 -> Shane Hadley | C23: ='\\ser\software\other\[POINTS NQS  2012.XLS]Stock Altered 1050'!$C26 -> Marion, NY | D23: ='\\ser\software\other\[POINTS NQS  2012.XLS]Stock Altered 1050'!$D26 -> LR | E23: ='\\ser\software\other\[POINTS NQS  2012.XLS]Stock Altered 1050'!$E26 -> 442 | F23: =IF('\\ser\software\other\[POINTS NQS  2012.XLS]Stock Altered 1050'!$F26=0," ",'\\ser\software\other\[POINTS NQS  2012.XLS]Stock Altered 1050'!$F26) -> Foot Finder | G23: ='\\ser\software\other\[POINTS NQS  2012.XLS]Stock Altered 1050'!AA26 -> 59 | I23: ='\\ser\software\other\[POINTS NQS  2012.XLS]Stock Altered 1100'!$A26 -> 21 | J23: ='\\ser\software\other\[POINTS NQS  2012.XLS]Stock Altered 1100'!$B26 -> Kelly Nichols | K23: ='\\ser\software\other\[POINTS NQS  2012.XLS]Stock Altered 1100'!$C26 -> Lore City, OH | L23: ='\\ser\software\other\[POINTS NQS  2012.XLS]Stock Altered 1100'!$D26 -> NP | M23: ='\\ser\software\other\[POINTS NQS  2012.XLS]Stock Altered 1100'!$E26 -> 358 | N23: =IF('\\ser\software\other\[POINTS NQS  2012.XLS]Stock Altered 1100'!$F26=0," ",'\\ser\software\other\[POINTS NQS  2012.XLS]Stock Altered 1100'!$F26) -> Maxx'd Out | O23: ='\\ser\software\other\[POINTS NQS  2012.XLS]Stock Altered 1100'!AA26 -> 84
A24: ='\\ser\software\other\[POINTS NQS  2012.XLS]Stock Altered 1050'!$A27 -> 22 | B24: ='\\ser\software\other\[POINTS NQS  2012.XLS]Stock Altered 1050'!$B27 -> Donnie Herring | C24: ='\\ser\software\other\[POINTS NQS  2012.XLS]Stock Altered 1050'!$C27 -> Rockbridge, OH | D24: ='\\ser\software\other\[POINTS NQS  2012.XLS]Stock Altered 1050'!$D27 -> TV | E24: ='\\ser\software\other\[POINTS NQS  2012.XLS]Stock Altered 1050'!$E27 -> 331 | F24: =IF('\\ser\software\other\[POINTS NQS  2012.XLS]Stock Altered 1050'!$F27=0," ",'\\ser\software\other\[POINTS NQS  2012.XLS]Stock Altered 1050'!$F27) -> Pasttime | G24: ='\\ser\software\other\[POINTS NQS  2012.XLS]Stock Altered 1050'!AA27 -> 60 | I24: ='\\ser\software\other\[POINTS NQS  2012.XLS]Stock Altered 1100'!$A27 -> 22 | J24: ='\\ser\software\other\[POINTS NQS  2012.XLS]Stock Altered 1100'!$B27 -> Lee Dewald | K24: ='\\ser\software\other\[POINTS NQS  2012.XLS]Stock Altered 1100'!$C27 -> Tiffon, OH | L24: ='\\ser\software\other\[POINTS NQS  2012.XLS]Stock Altered 1100'!$D27 -> NP | M24: ='\\ser\software\other\[POINTS NQS  2012.XLS]Stock Altered 1100'!$E27 -> 465 | N24: =IF('\\ser\software\other\[POINTS NQS  2012.XLS]Stock Altered 1100'!$F27=0," ",'\\ser\software\other\[POINTS NQS  2012.XLS]Stock Altered 1100'!$F27) -> Barnyard Bandit | O24: ='\\ser\software\other\[POINTS NQS  2012.XLS]Stock Altered 1100'!AA27 -> 90
A25: ='\\ser\software\other\[POINTS NQS  2012.XLS]Stock Altered 1050'!$A28 -> 23 | B25: ='\\ser\software\other\[POINTS NQS  2012.XLS]Stock Altered 1050'!$B28 -> Les Salyers | C25: ='\\ser\software\other\[POINTS NQS  2012.XLS]Stock Altered 1050'!$C28 -> Sidney, OH | D25: ='\\ser\software\other\[POINTS NQS  2012.XLS]Stock Altered 1050'!$D28 -> TV | E25: ='\\ser\software\other\[POINTS NQS  2012.XLS]Stock Altered 1050'!$E28 -> 444 | F25: =IF('\\ser\software\other\[POINTS NQS  2012.XLS]Stock Altered 1050'!$F28=0," ",'\\ser\software\other\[POINTS NQS  2012.XLS]Stock Altered 1050'!$F28) -> Unfinished Business | G25: ='\\ser\software\other\[POINTS NQS  2012.XLS]Stock Altered 1050'!AA28 -> 61 | I25: ='\\ser\software\other\[POINTS NQS  2012.XLS]Stock Altered 1100'!$A28 -> 23 | J25: ='\\ser\software\other\[POINTS NQS  2012.XLS]Stock Altered 1100'!$B28 -> Jamie Lewis | K25: ='\\ser\software\other\[POINTS NQS  2012.XLS]Stock Altered 1100'!$C28 -> Cincinnati, oh | L25: ='\\ser\software\other\[POINTS NQS  2012.XLS]Stock Altered 1100'!$D28 -> TV | M25: ='\\ser\software\other\[POINTS NQS  2012.XLS]Stock Altered 1100'!$E28 -> 19 | N25: =IF('\\ser\software\other\[POINTS NQS  2012.XLS]Stock Altered 1100'!$F28=0," ",'\\ser\software\other\[POINTS NQS  2012.XLS]Stock Altered 1100'!$F28) -> Oh So Orange | O25: ='\\ser\software\other\[POINTS NQS  2012.XLS]Stock Altered 1100'!AA28 -> 94
A26: ='\\ser\software\other\[POINTS NQS  2012.XLS]Stock Altered 1050'!$A29 -> 24 | B26: ='\\ser\software\other\[POINTS NQS  2012.XLS]Stock Altered 1050'!$B29 -> Kenneth Smith | C26: ='\\ser\software\other\[POINTS NQS  2012.XLS]Stock Altered 1050'!$C29 -> Ashland, OH | D26: ='\\ser\software\other\[POINTS NQS  2012.XLS]Stock Altered 1050'!$D29 -> JRS | E26: ='\\ser\software\other\[POINTS NQS  2012.XLS]Stock Altered 1050'!$E29 -> 125 | F26: =IF('\\ser\software\other\[POINTS NQS  2012.XLS]Stock Altered 1050'!$F29=0," ",'\\ser\software\other\[POINTS NQS  2012.XLS]Stock Altered 1050'!$F29) -> Sidewinder | G26: ='\\ser\software\other\[POINTS NQS  2012.XLS]Stock Altered 1050'!AA29 -> 64 | I26: ='\\ser\software\other\[POINTS NQS  2012.XLS]Stock Altered 1100'!$A29 -> 24 | J26: ='\\ser\software\other\[POINTS NQS  2012.XLS]Stock Altered 1100'!$B29 -> Ron Finch | K26: ='\\ser\software\other\[POINTS NQS  2012.XLS]Stock Altered 1100'!$C29 -> Milan, MI | L26: ='\\ser\software\other\[POINTS NQS  2012.XLS]Stock Altered 1100'!$D29 -> Woods | M26: ='\\ser\software\other\[POINTS NQS  2012.XLS]Stock Altered 1100'!$E29 -> 142 | N26: =IF('\\ser\software\other\[POINTS NQS  2012.XLS]Stock Altered 1100'!$F29=0," ",'\\ser\software\other\[POINTS NQS  2012.XLS]Stock Altered 1100'!$F29) -> Key Chain | O26: ='\\ser\software\other\[POINTS NQS  2012.XLS]Stock Altered 1100'!AA29 -> 95
A27: ='\\ser\software\other\[POINTS NQS  2012.XLS]Stock Altered 1050'!$A30 -> 25 | B27: ='\\ser\software\other\[POINTS NQS  2012.XLS]Stock Altered 1050'!$B30 -> William Hart | C27: ='\\ser\software\other\[POINTS NQS  2012.XLS]Stock Altered 1050'!$C30 -> Athens, Oh | D27: ='\\ser\software\other\[POINTS NQS  2012.XLS]Stock Altered 1050'!$D30 -> JRS | E27: ='\\ser\software\other\[POINTS NQS  2012.XLS]Stock Altered 1050'!$E30 -> 470 | F27: =IF('\\ser\software\other\[POINTS NQS  2012.XLS]Stock Altered 1050'!$F30=0," ",'\\ser\software\other\[POINTS NQS  2012.XLS]Stock Altered 1050'!$F30) -> Marie La Veau | G27: ='\\ser\software\other\[POINTS NQS  2012.XLS]Stock Altered 1050'!AA30 -> 65 | I27: ='\\ser\software\other\[POINTS NQS  2012.XLS]Stock Altered 1100'!$A30 -> 25 | J27: ='\\ser\software\other\[POINTS NQS  2012.XLS]Stock Altered 1100'!$B30 -> Nevin Stitzer | K27: ='\\ser\software\other\[POINTS NQS  2012.XLS]Stock Altered 1100'!$C30 -> Spring Mills, PA | L27: ='\\ser\software\other\[POINTS NQS  2012.XLS]Stock Altered 1100'!$D30 -> BJ | M27: ='\\ser\software\other\[POINTS NQS  2012.XLS]Stock Altered 1100'!$E30 -> 447 | N27: =IF('\\ser\software\other\[POINTS NQS  2012.XLS]Stock Altered 1100'!$F30=0," ",'\\ser\software\other\[POINTS NQS  2012.XLS]Stock Altered 1100'!$F30) -> Thunder Road | O27: ='\\ser\software\other\[POINTS NQS  2012.XLS]Stock Altered 1100'!AA30 -> 95
A28: ='\\ser\software\other\[POINTS NQS  2012.XLS]Stock Altered 1050'!$A31 -> 26 | B28: ='\\ser\software\other\[POINTS NQS  2012.XLS]Stock Altered 1050'!$B31 -> John Dewald | C28: ='\\ser\software\other\[POINTS NQS  2012.XLS]Stock Altered 1050'!$C31 -> Tiffon, OH | D28: ='\\ser\software\other\[POINTS NQS  2012.XLS]Stock Altered 1050'!$D31 -> RPM | E28: ='\\ser\software\other\[POINTS NQS  2012.XLS]Stock Altered 1050'!$E31 -> 484 | F28: =IF('\\ser\software\other\[POINTS NQS  2012.XLS]Stock Altered 1050'!$F31=0," ",'\\ser\software\other\[POINTS NQS  2012.XLS]Stock Altered 1050'!$F31) -> Patience | G28: ='\\ser\software\other\[POINTS NQS  2012.XLS]Stock Altered 1050'!AA31 -> 74 | I28: ='\\ser\software\other\[POINTS NQS  2012.XLS]Stock Altered 1100'!$A31 -> 26 | J28: ='\\ser\software\other\[POINTS NQS  2012.XLS]Stock Altered 1100'!$B31 -> Kenneth Smith | K28: ='\\ser\software\other\[POINTS NQS  2012.XLS]Stock Altered 1100'!$C31 -> Ashland, OH | L28: ='\\ser\software\other\[POINTS NQS  2012.XLS]Stock Altered 1100'!$D31 -> JRS | M28: ='\\ser\software\other\[POINTS NQS  2012.XLS]Stock Altered 1100'!$E31 -> 125 | N28: =IF('\\ser\software\other\[POINTS NQS  2012.XLS]Stock Altered 1100'!$F31=0," ",'\\ser\software\other\[POINTS NQS  2012.XLS]Stock Altered 1100'!$F31) -> Sidewinder | O28: ='\\ser\software\other\[POINTS NQS  2012.XLS]Stock Altered 1100'!AA31 -> 99
A29: ='\\ser\software\other\[POINTS NQS  2012.XLS]Stock Altered 1050'!$A32 -> 27 | B29: ='\\ser\software\other\[POINTS NQS  2012.XLS]Stock Altered 1050'!$B32 -> Mark Peters | C29: ='\\ser\software\other\[POINTS NQS  2012.XLS]Stock Altered 1050'!$C32 -> McArthur, PA | D29: ='\\ser\software\other\[POINTS NQS  2012.XLS]Stock Altered 1050'!$D32 -> JRS | E29: ='\\ser\software\other\[POINTS NQS  2012.XLS]Stock Altered 1050'!$E32 -> 469 | F29: =IF('\\ser\software\other\[POINTS NQS  2012.XLS]Stock Altered 1050'!$F32=0," ",'\\ser\software\other\[POINTS NQS  2012.XLS]Stock Altered 1050'!$F32) -> American Ride | G29: ='\\ser\software\other\[POINTS NQS  2012.XLS]Stock Altered 1050'!AA32 -> 82 | I29: ='\\ser\software\other\[POINTS NQS  2012.XLS]Stock Altered 1100'!$A32 -> 27 | J29: ='\\ser\software\other\[POINTS NQS  2012.XLS]Stock Altered 1100'!$B32 -> Ed Kerner | K29: ='\\ser\software\other\[POINTS NQS  2012.XLS]Stock Altered 1100'!$C32 -> Kimball, MI | L29: ='\\ser\software\other\[POINTS NQS  2012.XLS]Stock Altered 1100'!$D32 -> NP | M29: ='\\ser\software\other\[POINTS NQS  2012.XLS]Stock Altered 1100'!$E32 -> 303 | N29: =IF('\\ser\software\other\[POINTS NQS  2012.XLS]Stock Altered 1100'!$F32=0," ",'\\ser\software\other\[POINTS NQS  2012.XLS]Stock Altered 1100'!$F32) -> Along for the Ride | O29: ='\\ser\software\other\[POINTS NQS  2012.XLS]Stock Altered 1100'!AA32 -> 103
A30: ='\\ser\software\other\[POINTS NQS  2012.XLS]Stock Altered 1050'!$A33 -> 28 | B30: ='\\ser\software\other\[POINTS NQS  2012.XLS]Stock Altered 1050'!$B33 -> Cody Costa | C30: ='\\ser\software\other\[POINTS NQS  2012.XLS]Stock Altered 1050'!$C33 -> Greencastle, PA | D30: ='\\ser\software\other\[POINTS NQS  2012.XLS]Stock Altered 1050'!$D33 -> NP | E30: ='\\ser\software\other\[POINTS NQS  2012.XLS]Stock Altered 1050'!$E33 -> 135 | F30: =IF('\\ser\software\other\[POINTS NQS  2012.XLS]Stock Altered 1050'!$F33=0," ",'\\ser\software\other\[POINTS NQS  2012.XLS]Stock Altered 1050'!$F33) -> Wild Child | G30: ='\\ser\software\other\[POINTS NQS  2012.XLS]Stock Altered 1050'!AA33 -> 87 | I30: ='\\ser\software\other\[POINTS NQS  2012.XLS]Stock Altered 1100'!$A33 -> 28 | J30: ='\\ser\software\other\[POINTS NQS  2012.XLS]Stock Altered 1100'!$B33 -> Bob Jones JR | K30: ='\\ser\software\other\[POINTS NQS  2012.XLS]Stock Altered 1100'!$C33 -> Hopewell, OH | L30: ='\\ser\software\other\[POINTS NQS  2012.XLS]Stock Altered 1100'!$D33 -> BJ | M30: ='\\ser\software\other\[POINTS NQS  2012.XLS]Stock Altered 1100'!$E33 -> 183 | N30: =IF('\\ser\software\other\[POINTS NQS  2012.XLS]Stock Altered 1100'!$F33=0," ",'\\ser\software\other\[POINTS NQS  2012.XLS]Stock Altered 1100'!$F33) -> Playdough | O30: ='\\ser\software\other\[POINTS NQS  2012.XLS]Stock Altered 1100'!AA33 -> 112
A31: ='\\ser\software\other\[POINTS NQS  2012.XLS]Stock Altered 1050'!$A34 -> 29 | B31: ='\\ser\software\other\[POINTS NQS  2012.XLS]Stock Altered 1050'!$B34 -> Nevin Stitzer | C31: ='\\ser\software\other\[POINTS NQS  2012.XLS]Stock Altered 1050'!$C34 -> Spring Mills, PA | D31: ='\\ser\software\other\[POINTS NQS  2012.XLS]Stock Altered 1050'!$D34 ->  | E31: ='\\ser\software\other\[POINTS NQS  2012.XLS]Stock Altered 1050'!$E34 -> 447 | F31: =IF('\\ser\software\other\[POINTS NQS  2012.XLS]Stock Altered 1050'!$F34=0," ",'\\ser\software\other\[POINTS NQS  2012.XLS]Stock Altered 1050'!$F34) -> Thunder Road | G31: ='\\ser\software\other\[POINTS NQS  2012.XLS]Stock Altered 1050'!AA34 -> 87 | I31: ='\\ser\software\other\[POINTS NQS  2012.XLS]Stock Altered 1100'!$A34 -> 29 | J31: ='\\ser\software\other\[POINTS NQS  2012.XLS]Stock Altered 1100'!$B34 -> William Hart | K31: ='\\ser\software\other\[POINTS NQS  2012.XLS]Stock Altered 1100'!$C34 -> Athens, Oh | L31: ='\\ser\software\other\[POINTS NQS  2012.XLS]Stock Altered 1100'!$D34 -> JRS | M31: ='\\ser\software\other\[POINTS NQS  2012.XLS]Stock Altered 1100'!$E34 -> 470 | N31: =IF('\\ser\software\other\[POINTS NQS  2012.XLS]Stock Altered 1100'!$F34=0," ",'\\ser\software\other\[POINTS NQS  2012.XLS]Stock Altered 1100'!$F34) -> Marie LaVeau | O31: ='\\ser\software\other\[POINTS NQS  2012.XLS]Stock Altered 1100'!AA34 -> 113
A32: ='\\ser\software\other\[POINTS NQS  2012.XLS]Stock Altered 1050'!$A35 -> 30 | B32: ='\\ser\software\other\[POINTS NQS  2012.XLS]Stock Altered 1050'!$B35 -> Rick James | C32: ='\\ser\software\other\[POINTS NQS  2012.XLS]Stock Altered 1050'!$C35 -> Lancaster, OH | D32: ='\\ser\software\other\[POINTS NQS  2012.XLS]Stock Altered 1050'!$D35 -> BJ | E32: ='\\ser\software\other\[POINTS NQS  2012.XLS]Stock Altered 1050'!$E35 -> 427 | F32: =IF('\\ser\software\other\[POINTS NQS  2012.XLS]Stock Altered 1050'!$F35=0," ",'\\ser\software\other\[POINTS NQS  2012.XLS]Stock Altered 1050'!$F35) -> James Gang III | G32: ='\\ser\software\other\[POINTS NQS  2012.XLS]Stock Altered 1050'!AA35 -> 91 | I32: ='\\ser\software\other\[POINTS NQS  2012.XLS]Stock Altered 1100'!$A35 -> 30 | J32: ='\\ser\software\other\[POINTS NQS  2012.XLS]Stock Altered 1100'!$B35 -> Roger McKinney | K32: ='\\ser\software\other\[POINTS NQS  2012.XLS]Stock Altered 1100'!$C35 -> Greenville, IL | L32: ='\\ser\software\other\[POINTS NQS  2012.XLS]Stock Altered 1100'!$D35 -> JRS | M32: ='\\ser\software\other\[POINTS NQS  2012.XLS]Stock Altered 1100'!$E35 -> 83 | N32: =IF('\\ser\software\other\[POINTS NQS  2012.XLS]Stock Altered 1100'!$F35=0," ",'\\ser\software\other\[POINTS NQS  2012.XLS]Stock Altered 1100'!$F35) -> Blue Thunder | O32: ='\\ser\software\other\[POINTS NQS  2012.XLS]Stock Altered 1100'!AA35 -> 114
A33: ='\\ser\software\other\[POINTS NQS  2012.XLS]Stock Altered 1050'!$A36 -> 31 | B33: ='\\ser\software\other\[POINTS NQS  2012.XLS]Stock Altered 1050'!$B36 -> Gary Seaman | C33: ='\\ser\software\other\[POINTS NQS  2012.XLS]Stock Altered 1050'!$C36 -> Fleming, OH | D33: ='\\ser\software\other\[POINTS NQS  2012.XLS]Stock Altered 1050'!$D36 -> BJ | E33: ='\\ser\software\other\[POINTS NQS  2012.XLS]Stock Altered 1050'!$E36 -> 191 | F33: =IF('\\ser\software\other\[POINTS NQS  2012.XLS]Stock Altered 1050'!$F36=0," ",'\\ser\software\other\[POINTS NQS  2012.XLS]Stock Altered 1050'!$F36) -> Farmer's Money | G33: ='\\ser\software\other\[POINTS NQS  2012.XLS]Stock Altered 1050'!AA36 -> 92 | I33: ='\\ser\software\other\[POINTS NQS  2012.XLS]Stock Altered 1100'!$A36 -> 31 | J33: ='\\ser\software\other\[POINTS NQS  2012.XLS]Stock Altered 1100'!$B36 -> Bobby Feldkamp | K33: ='\\ser\software\other\[POINTS NQS  2012.XLS]Stock Altered 1100'!$C36 -> Milan, MI | L33: ='\\ser\software\other\[POINTS NQS  2012.XLS]Stock Altered 1100'!$D36 -> Woods | M33: ='\\ser\software\other\[POINTS NQS  2012.XLS]Stock Altered 1100'!$E36 -> 501 | N33: =IF('\\ser\software\other\[POINTS NQS  2012.XLS]Stock Altered 1100'!$F36=0," ",'\\ser\software\other\[POINTS NQS  2012.XLS]Stock Altered 1100'!$F36) -> Incognito | O33: ='\\ser\software\other\[POINTS NQS  2012.XLS]Stock Altered 1100'!AA36 -> 117
A34: ='\\ser\software\other\[POINTS NQS  2012.XLS]Stock Altered 1050'!$A37 -> 32 | B34: ='\\ser\software\other\[POINTS NQS  2012.XLS]Stock Altered 1050'!$B37 -> Gregory Heifner | C34: ='\\ser\software\other\[POINTS NQS  2012.XLS]Stock Altered 1050'!$C37 -> Jeromesville, OH | D34: ='\\ser\software\other\[POINTS NQS  2012.XLS]Stock Altered 1050'!$D37 -> TH | E34: ='\\ser\software\other\[POINTS NQS  2012.XLS]Stock Altered 1050'!$E37 -> 231 | F34: =IF('\\ser\software\other\[POINTS NQS  2012.XLS]Stock Altered 1050'!$F37=0," ",'\\ser\software\other\[POINTS NQS  2012.XLS]Stock Altered 1050'!$F37) -> Instigator | G34: ='\\ser\software\other\[POINTS NQS  2012.XLS]Stock Altered 1050'!AA37 -> 98 | I34: ='\\ser\software\other\[POINTS NQS  2012.XLS]Stock Altered 1100'!$A37 -> 32 | J34: ='\\ser\software\other\[POINTS NQS  2012.XLS]Stock Altered 1100'!$B37 -> Randy Amstutz | K34: ='\\ser\software\other\[POINTS NQS  2012.XLS]Stock Altered 1100'!$C37 -> Berne, Ind | L34: ='\\ser\software\other\[POINTS NQS  2012.XLS]Stock Altered 1100'!$D37 -> Woods | M34: ='\\ser\software\other\[POINTS NQS  2012.XLS]Stock Altered 1100'!$E37 -> 533 | N34: =IF('\\ser\software\other\[POINTS NQS  2012.XLS]Stock Altered 1100'!$F37=0," ",'\\ser\software\other\[POINTS NQS  2012.XLS]Stock Altered 1100'!$F37) ->  | O34: ='\\ser\software\other\[POINTS NQS  2012.XLS]Stock Altered 1100'!AA37 -> 122
A35: ='\\ser\software\other\[POINTS NQS  2012.XLS]Stock Altered 1050'!$A38 -> 33 | B35: ='\\ser\software\other\[POINTS NQS  2012.XLS]Stock Altered 1050'!$B38 -> Randy Demers | C35: ='\\ser\software\other\[POINTS NQS  2012.XLS]Stock Altered 1050'!$C38 -> Columbia, NJ | D35: ='\\ser\software\other\[POINTS NQS  2012.XLS]Stock Altered 1050'!$D38 -> NP | E35: ='\\ser\software\other\[POINTS NQS  2012.XLS]Stock Altered 1050'!$E38 -> 84 | F35: =IF('\\ser\software\other\[POINTS NQS  2012.XLS]Stock Altered 1050'!$F38=0," ",'\\ser\software\other\[POINTS NQS  2012.XLS]Stock Altered 1050'!$F38) -> Bounty Hunter | G35: ='\\ser\software\other\[POINTS NQS  2012.XLS]Stock Altered 1050'!AA38 -> 100 | I35: ='\\ser\software\other\[POINTS NQS  2012.XLS]Stock Altered 1100'!$A38 -> 33 | J35: ='\\ser\software\other\[POINTS NQS  2012.XLS]Stock Altered 1100'!$B38 -> Tod Hinkle | K35: ='\\ser\software\other\[POINTS NQS  2012.XLS]Stock Altered 1100'!$C38 -> Dongola, IA | L35: ='\\ser\software\other\[POINTS NQS  2012.XLS]Stock Altered 1100'!$D38 -> JW | M35: ='\\ser\software\other\[POINTS NQS  2012.XLS]Stock Altered 1100'!$E38 -> 370 | N35: =IF('\\ser\software\other\[POINTS NQS  2012.XLS]Stock Altered 1100'!$F38=0," ",'\\ser\software\other\[POINTS NQS  2012.XLS]Stock Altered 1100'!$F38) -> Disturbed | O35: ='\\ser\software\other\[POINTS NQS  2012.XLS]Stock Altered 1100'!AA38 -> 129
A36: ='\\ser\software\other\[POINTS NQS  2012.XLS]Stock Altered 1050'!$A39 -> 34 | B36: ='\\ser\software\other\[POINTS NQS  2012.XLS]Stock Altered 1050'!$B39 -> Steve Chrisman | C36: ='\\ser\software\other\[POINTS NQS  2012.XLS]Stock Altered 1050'!$C39 -> Edinburg, IN | D36: ='\\ser\software\other\[POINTS NQS  2012.XLS]Stock Altered 1050'!$D39 -> Hackman | E36: ='\\ser\software\other\[POINTS NQS  2012.XLS]Stock Altered 1050'!$E39 -> 69 | F36: =IF('\\ser\software\other\[POINTS NQS  2012.XLS]Stock Altered 1050'!$F39=0," ",'\\ser\software\other\[POINTS NQS  2012.XLS]Stock Altered 1050'!$F39) -> Razmitaz | G36: ='\\ser\software\other\[POINTS NQS  2012.XLS]Stock Altered 1050'!AA39 -> 101 | I36: ='\\ser\software\other\[POINTS NQS  2012.XLS]Stock Altered 1100'!$A39 -> 34 | J36: ='\\ser\software\other\[POINTS NQS  2012.XLS]Stock Altered 1100'!$B39 -> Gregory Heifner | K36: ='\\ser\software\other\[POINTS NQS  2012.XLS]Stock Altered 1100'!$C39 -> Jeromesville, OH | L36: ='\\ser\software\other\[POINTS NQS  2012.XLS]Stock Altered 1100'!$D39 -> TH | M36: ='\\ser\software\other\[POINTS NQS  2012.XLS]Stock Altered 1100'!$E39 -> 231 | N36: =IF('\\ser\software\other\[POINTS NQS  2012.XLS]Stock Altered 1100'!$F39=0," ",'\\ser\software\other\[POINTS NQS  2012.XLS]Stock Altered 1100'!$F39) -> Instigator | O36: ='\\ser\software\other\[POINTS NQS  2012.XLS]Stock Altered 1100'!AA39 -> 137
A37: ='\\ser\software\other\[POINTS NQS  2012.XLS]Stock Altered 1050'!$A40 -> 35 | B37: ='\\ser\software\other\[POINTS NQS  2012.XLS]Stock Altered 1050'!$B40 -> Robin Cooper | C37: ='\\ser\software\other\[POINTS NQS  2012.XLS]Stock Altered 1050'!$C40 -> Westminster, MD | D37: ='\\ser\software\other\[POINTS NQS  2012.XLS]Stock Altered 1050'!$D40 -> JRS | E37: ='\\ser\software\other\[POINTS NQS  2012.XLS]Stock Altered 1050'!$E40 -> 73 | F37: =IF('\\ser\software\other\[POINTS NQS  2012.XLS]Stock Altered 1050'!$F40=0," ",'\\ser\software\other\[POINTS NQS  2012.XLS]Stock Altered 1050'!$F40) ->  | G37: ='\\ser\software\other\[POINTS NQS  2012.XLS]Stock Altered 1050'!AA40 -> 118 | I37: ='\\ser\software\other\[POINTS NQS  2012.XLS]Stock Altered 1100'!$A40 -> 35 | J37: ='\\ser\software\other\[POINTS NQS  2012.XLS]Stock Altered 1100'!$B40 -> Keith Frueh | K37: ='\\ser\software\other\[POINTS NQS  2012.XLS]Stock Altered 1100'!$C40 -> Greenville, IL | L37: ='\\ser\software\other\[POINTS NQS  2012.XLS]Stock Altered 1100'!$D40 -> JRS | M37: ='\\ser\software\other\[POINTS NQS  2012.XLS]Stock Altered 1100'!$E40 -> 453 | N37: =IF('\\ser\software\other\[POINTS NQS  2012.XLS]Stock Altered 1100'!$F40=0," ",'\\ser\software\other\[POINTS NQS  2012.XLS]Stock Altered 1100'!$F40) -> Haulin Harvester | O37: ='\\ser\software\other\[POINTS NQS  2012.XLS]Stock Altered 1100'!AA40 -> 138
A38: ='\\ser\software\other\[POINTS NQS  2012.XLS]Stock Altered 1050'!$A41 -> 36 | B38: ='\\ser\software\other\[POINTS NQS  2012.XLS]Stock Altered 1050'!$B41 -> Randy Amstutz | C38: ='\\ser\software\other\[POINTS NQS  2012.XLS]Stock Altered 1050'!$C41 -> Berne, Ind | D38: ='\\ser\software\other\[POINTS NQS  2012.XLS]Stock Altered 1050'!$D41 -> Woods | E38: ='\\ser\software\other\[POINTS NQS  2012.XLS]Stock Altered 1050'!$E41 -> 533 | F38: =IF('\\ser\software\other\[POINTS NQS  2012.XLS]Stock Altered 1050'!$F41=0," ",'\\ser\software\other\[POINTS NQS  2012.XLS]Stock Altered 1050'!$F41) ->  | G38: ='\\ser\software\other\[POINTS NQS  2012.XLS]Stock Altered 1050'!AA41 -> 120 | I38: ='\\ser\software\other\[POINTS NQS  2012.XLS]Stock Altered 1100'!$A41 -> 36 | J38: ='\\ser\software\other\[POINTS NQS  2012.XLS]Stock Altered 1100'!$B41 -> Steve Chrisman | K38: ='\\ser\software\other\[POINTS NQS  2012.XLS]Stock Altered 1100'!$C41 -> Edinburg, IN | L38: ='\\ser\software\other\[POINTS NQS  2012.XLS]Stock Altered 1100'!$D41 -> Hackman | M38: ='\\ser\software\other\[POINTS NQS  2012.XLS]Stock Altered 1100'!$E41 -> 69 | N38: =IF('\\ser\software\other\[POINTS NQS  2012.XLS]Stock Altered 1100'!$F41=0," ",'\\ser\software\other\[POINTS NQS  2012.XLS]Stock Altered 1100'!$F41) -> Razzmatazz | O38: ='\\ser\software\other\[POINTS NQS  2012.XLS]Stock Altered 1100'!AA41 -> 140
A39: ='\\ser\software\other\[POINTS NQS  2012.XLS]Stock Altered 1050'!$A42 -> 37 | B39: ='\\ser\software\other\[POINTS NQS  2012.XLS]Stock Altered 1050'!$B42 -> Keith Frueh | C39: ='\\ser\software\other\[POINTS NQS  2012.XLS]Stock Altered 1050'!$C42 -> Greenville, IL | D39: ='\\ser\software\other\[POINTS NQS  2012.XLS]Stock Altered 1050'!$D42 -> JRS | E39: ='\\ser\software\other\[POINTS NQS  2012.XLS]Stock Altered 1050'!$E42 -> 453 | F39: =IF('\\ser\software\other\[POINTS NQS  2012.XLS]Stock Altered 1050'!$F42=0," ",'\\ser\software\other\[POINTS NQS  2012.XLS]Stock Altered 1050'!$F42) -> Haulin Harvester | G39: ='\\ser\software\other\[POINTS NQS  2012.XLS]Stock Altered 1050'!AA42 -> 121 | I39: ='\\ser\software\other\[POINTS NQS  2012.XLS]Stock Altered 1100'!$A42 -> 37 | J39: ='\\ser\software\other\[POINTS NQS  2012.XLS]Stock Altered 1100'!$B42 -> Les Salyers | K39: ='\\ser\software\other\[POINTS NQS  2012.XLS]Stock Altered 1100'!$C42 -> Sidney, OH | L39: ='\\ser\software\other\[POINTS NQS  2012.XLS]Stock Altered 1100'!$D42 -> TV | M39: ='\\ser\software\other\[POINTS NQS  2012.XLS]Stock Altered 1100'!$E42 -> 444 | N39: =IF('\\ser\software\other\[POINTS NQS  2012.XLS]Stock Altered 1100'!$F42=0," ",'\\ser\software\other\[POINTS NQS  2012.XLS]Stock Altered 1100'!$F42) -> Unfinished Business | O39: ='\\ser\software\other\[POINTS NQS  2012.XLS]Stock Altered 1100'!AA42 -> 143
A40: ='\\ser\software\other\[POINTS NQS  2012.XLS]Stock Altered 1050'!$A43 -> 38 | B40: ='\\ser\software\other\[POINTS NQS  2012.XLS]Stock Altered 1050'!$B43 -> Carl Frueh | C40: ='\\ser\software\other\[POINTS NQS  2012.XLS]Stock Altered 1050'!$C43 -> Greenville, IL | D40: ='\\ser\software\other\[POINTS NQS  2012.XLS]Stock Altered 1050'!$D43 -> JRS | E40: ='\\ser\software\other\[POINTS NQS  2012.XLS]Stock Altered 1050'!$E43 -> 279 | F40: =IF('\\ser\software\other\[POINTS NQS  2012.XLS]Stock Altered 1050'!$F43=0," ",'\\ser\software\other\[POINTS NQS  2012.XLS]Stock Altered 1050'!$F43) -> Blue Thunder | G40: ='\\ser\software\other\[POINTS NQS  2012.XLS]Stock Altered 1050'!AA43 -> 122 | I40: ='\\ser\software\other\[POINTS NQS  2012.XLS]Stock Altered 1100'!$A43 -> 38 | J40: ='\\ser\software\other\[POINTS NQS  2012.XLS]Stock Altered 1100'!$B43 -> Gary Cunningham | K40: ='\\ser\software\other\[POINTS NQS  2012.XLS]Stock Altered 1100'!$C43 -> Brooksville, KY | L40: ='\\ser\software\other\[POINTS NQS  2012.XLS]Stock Altered 1100'!$D43 -> NP | M40: ='\\ser\software\other\[POINTS NQS  2012.XLS]Stock Altered 1100'!$E43 -> 62 | N40: =IF('\\ser\software\other\[POINTS NQS  2012.XLS]Stock Altered 1100'!$F43=0," ",'\\ser\software\other\[POINTS NQS  2012.XLS]Stock Altered 1100'!$F43) -> High Voltage | O40: ='\\ser\software\other\[POINTS NQS  2012.XLS]Stock Altered 1100'!AA43 -> 145
A41: ='\\ser\software\other\[POINTS NQS  2012.XLS]Stock Altered 1050'!$A44 -> 39 | B41: ='\\ser\software\other\[POINTS NQS  2012.XLS]Stock Altered 1050'!$B44 -> John Cress | C41: ='\\ser\software\other\[POINTS NQS  2012.XLS]Stock Altered 1050'!$C44 -> Strasburg, IL | D41: ='\\ser\software\other\[POINTS NQS  2012.XLS]Stock Altered 1050'!$D44 -> JRS | E41: ='\\ser\software\other\[POINTS NQS  2012.XLS]Stock Altered 1050'!$E44 -> 514 | F41: =IF('\\ser\software\other\[POINTS NQS  2012.XLS]Stock Altered 1050'!$F44=0," ",'\\ser\software\other\[POINTS NQS  2012.XLS]Stock Altered 1050'!$F44) -> Mini Blitzed | G41: ='\\ser\software\other\[POINTS NQS  2012.XLS]Stock Altered 1050'!AA44 -> 126 | I41: ='\\ser\software\other\[POINTS NQS  2012.XLS]Stock Altered 1100'!$A44 -> 39 | J41: ='\\ser\software\other\[POINTS NQS  2012.XLS]Stock Altered 1100'!$B44 -> Robin Cooper | K41: ='\\ser\software\other\[POINTS NQS  2012.XLS]Stock Altered 1100'!$C44 -> Westminster, Md | L41: ='\\ser\software\other\[POINTS NQS  2012.XLS]Stock Altered 1100'!$D44 -> JRS | M41: ='\\ser\software\other\[POINTS NQS  2012.XLS]Stock Altered 1100'!$E44 -> 73 | N41: =IF('\\ser\software\other\[POINTS NQS  2012.XLS]Stock Altered 1100'!$F44=0," ",'\\ser\software\other\[POINTS NQS  2012.XLS]Stock Altered 1100'!$F44) ->  | O41: ='\\ser\software\other\[POINTS NQS  2012.XLS]Stock Altered 1100'!AA44 -> 147
A42: ='\\ser\software\other\[POINTS NQS  2012.XLS]Stock Altered 1050'!$A45 -> 40 | B42: ='\\ser\software\other\[POINTS NQS  2012.XLS]Stock Altered 1050'!$B45 -> Chris Gegg | C42: ='\\ser\software\other\[POINTS NQS  2012.XLS]Stock Altered 1050'!$C45 -> Greenville, IL | D42: ='\\ser\software\other\[POINTS NQS  2012.XLS]Stock Altered 1050'!$D45 -> JRS | E42: ='\\ser\software\other\[POINTS NQS  2012.XLS]Stock Altered 1050'!$E45 -> 410 | F42: =IF('\\ser\software\other\[POINTS NQS  2012.XLS]Stock Altered 1050'!$F45=0," ",'\\ser\software\other\[POINTS NQS  2012.XLS]Stock Altered 1050'!$F45) -> Insane | G42: ='\\ser\software\other\[POINTS NQS  2012.XLS]Stock Altered 1050'!AA45 -> 131 | I42: ='\\ser\software\other\[POINTS NQS  2012.XLS]Stock Altered 1100'!$A45 -> 40 | J42: ='\\ser\software\other\[POINTS NQS  2012.XLS]Stock Altered 1100'!$B45 -> Brock Nelson | K42: ='\\ser\software\other\[POINTS NQS  2012.XLS]Stock Altered 1100'!$C45 -> Greenville, IL | L42: ='\\ser\software\other\[POINTS NQS  2012.XLS]Stock Altered 1100'!$D45 -> JRS | M42: ='\\ser\software\other\[POINTS NQS  2012.XLS]Stock Altered 1100'!$E45 -> 86 | N42: =IF('\\ser\software\other\[POINTS NQS  2012.XLS]Stock Altered 1100'!$F45=0," ",'\\ser\software\other\[POINTS NQS  2012.XLS]Stock Altered 1100'!$F45) -> Fearless | O42: ='\\ser\software\other\[POINTS NQS  2012.XLS]Stock Altered 1100'!AA45 -> 148
A43: ='\\ser\software\other\[POINTS NQS  2012.XLS]Stock Altered 1050'!$A46 -> 41 | B43: ='\\ser\software\other\[POINTS NQS  2012.XLS]Stock Altered 1050'!$B46 -> Keith Frueh | C43: ='\\ser\software\other\[POINTS NQS  2012.XLS]Stock Altered 1050'!$C46 -> Greenville, IL | D43: ='\\ser\software\other\[POINTS NQS  2012.XLS]Stock Altered 1050'!$D46 -> JRS | E43: ='\\ser\software\other\[POINTS NQS  2012.XLS]Stock Altered 1050'!$E46 -> 86 | F43: =IF('\\ser\software\other\[POINTS NQS  2012.XLS]Stock Altered 1050'!$F46=0," ",'\\ser\software\other\[POINTS NQS  2012.XLS]Stock Altered 1050'!$F46) -> Fearless | G43: ='\\ser\software\other\[POINTS NQS  2012.XLS]Stock Altered 1050'!AA46 -> 132 | I43: ='\\ser\software\other\[POINTS NQS  2012.XLS]Stock Altered 1100'!$A46 -> 41 | J43: ='\\ser\software\other\[POINTS NQS  2012.XLS]Stock Altered 1100'!$B46 -> Mark Rader | K43: ='\\ser\software\other\[POINTS NQS  2012.XLS]Stock Altered 1100'!$C46 -> Pataskala, Oh | L43: ='\\ser\software\other\[POINTS NQS  2012.XLS]Stock Altered 1100'!$D46 -> RPM | M43: ='\\ser\software\other\[POINTS NQS  2012.XLS]Stock Altered 1100'!$E46 -> 213 | N43: =IF('\\ser\software\other\[POINTS NQS  2012.XLS]Stock Altered 1100'!$F46=0," ",'\\ser\software\other\[POINTS NQS  2012.XLS]Stock Altered 1100'!$F46) -> Lethal Weapon | O43: ='\\ser\software\other\[POINTS NQS  2012.XLS]Stock Altered 1100'!AA46 -> 150
A44: ='\\ser\software\other\[POINTS NQS  2012.XLS]Stock Altered 1050'!$A47 -> 42 | B44: ='\\ser\software\other\[POINTS NQS  2012.XLS]Stock Altered 1050'!$B47 -> Gary Frank | C44: ='\\ser\software\other\[POINTS NQS  2012.XLS]Stock Altered 1050'!$C47 -> Amanda, OH | D44: ='\\ser\software\other\[POINTS NQS  2012.XLS]Stock Altered 1050'!$D47 -> TV | E44: ='\\ser\software\other\[POINTS NQS  2012.XLS]Stock Altered 1050'!$E47 -> 233 | F44: =IF('\\ser\software\other\[POINTS NQS  2012.XLS]Stock Altered 1050'!$F47=0," ",'\\ser\software\other\[POINTS NQS  2012.XLS]Stock Altered 1050'!$F47) -> Katies Toy | G44: ='\\ser\software\other\[POINTS NQS  2012.XLS]Stock Altered 1050'!AA47 -> 134 | I44: ='\\ser\software\other\[POINTS NQS  2012.XLS]Stock Altered 1100'!$A47 -> 42 | J44: ='\\ser\software\other\[POINTS NQS  2012.XLS]Stock Altered 1100'!$B47 -> Carl Frueh | K44: ='\\ser\software\other\[POINTS NQS  2012.XLS]Stock Altered 1100'!$C47 -> Greenville, IL | L44: ='\\ser\software\other\[POINTS NQS  2012.XLS]Stock Altered 1100'!$D47 -> JRS | M44: ='\\ser\software\other\[POINTS NQS  2012.XLS]Stock Altered 1100'!$E47 -> 279 | N44: =IF('\\ser\software\other\[POINTS NQS  2012.XLS]Stock Altered 1100'!$F47=0," ",'\\ser\software\other\[POINTS NQS  2012.XLS]Stock Altered 1100'!$F47) -> Blue Thunder | O44: ='\\ser\software\other\[POINTS NQS  2012.XLS]Stock Altered 1100'!AA47 -> 150
A45: ='\\ser\software\other\[POINTS NQS  2012.XLS]Stock Altered 1050'!$A48 -> 43 | B45: ='\\ser\software\other\[POINTS NQS  2012.XLS]Stock Altered 1050'!$B48 -> Bud Casale | C45: ='\\ser\software\other\[POINTS NQS  2012.XLS]Stock Altered 1050'!$C48 -> New Stanton, Pa | D45: ='\\ser\software\other\[POINTS NQS  2012.XLS]Stock Altered 1050'!$D48 -> 0 | E45: ='\\ser\software\other\[POINTS NQS  2012.XLS]Stock Altered 1050'!$E48 -> 403 | F45: =IF('\\ser\software\other\[POINTS NQS  2012.XLS]Stock Altered 1050'!$F48=0," ",'\\ser\software\other\[POINTS NQS  2012.XLS]Stock Altered 1050'!$F48) ->  | G45: ='\\ser\software\other\[POINTS NQS  2012.XLS]Stock Altered 1050'!AA48 -> 135 | I45: ='\\ser\software\other\[POINTS NQS  2012.XLS]Stock Altered 1100'!$A48 -> 43 | J45: ='\\ser\software\other\[POINTS NQS  2012.XLS]Stock Altered 1100'!$B48 -> Shawn Garman | K45: ='\\ser\software\other\[POINTS NQS  2012.XLS]Stock Altered 1100'!$C48 -> Jeromesville, OH | L45: ='\\ser\software\other\[POINTS NQS  2012.XLS]Stock Altered 1100'!$D48 -> JRS | M45: ='\\ser\software\other\[POINTS NQS  2012.XLS]Stock Altered 1100'!$E48 -> 391 | N45: =IF('\\ser\software\other\[POINTS NQS  2012.XLS]Stock Altered 1100'!$F48=0," ",'\\ser\software\other\[POINTS NQS  2012.XLS]Stock Altered 1100'!$F48) -> Jagmeister | O45: ='\\ser\software\other\[POINTS NQS  2012.XLS]Stock Altered 1100'!AA48 -> 151
A46: ='\\ser\software\other\[POINTS NQS  2012.XLS]Stock Altered 1050'!$A49 -> 44 | B46: ='\\ser\software\other\[POINTS NQS  2012.XLS]Stock Altered 1050'!$B49 -> Mike Yeley | C46: ='\\ser\software\other\[POINTS NQS  2012.XLS]Stock Altered 1050'!$C49 -> Hope, IN | D46: ='\\ser\software\other\[POINTS NQS  2012.XLS]Stock Altered 1050'!$D49 -> JW | E46: ='\\ser\software\other\[POINTS NQS  2012.XLS]Stock Altered 1050'!$E49 -> 55 | F46: =IF('\\ser\software\other\[POINTS NQS  2012.XLS]Stock Altered 1050'!$F49=0," ",'\\ser\software\other\[POINTS NQS  2012.XLS]Stock Altered 1050'!$F49) -> Outta Hope | G46: ='\\ser\software\other\[POINTS NQS  2012.XLS]Stock Altered 1050'!AA49 -> 137 | I46: ='\\ser\software\other\[POINTS NQS  2012.XLS]Stock Altered 1100'!$A49 -> 44 | J46: ='\\ser\software\other\[POINTS NQS  2012.XLS]Stock Altered 1100'!$B49 -> Waylan Nelson | K46: ='\\ser\software\other\[POINTS NQS  2012.XLS]Stock Altered 1100'!$C49 -> Shelby, IA | L46: ='\\ser\software\other\[POINTS NQS  2012.XLS]Stock Altered 1100'!$D49 -> Woods | M46: ='\\ser\software\other\[POINTS NQS  2012.XLS]Stock Altered 1100'!$E49 -> 500 | N46: =IF('\\ser\software\other\[POINTS NQS  2012.XLS]Stock Altered 1100'!$F49=0," ",'\\ser\software\other\[POINTS NQS  2012.XLS]Stock Altered 1100'!$F49) -> Butt Ugly | O46: ='\\ser\software\other\[POINTS NQS  2012.XLS]Stock Altered 1100'!AA49 -> 152
A47: ='\\ser\software\other\[POINTS NQS  2012.XLS]Stock Altered 1050'!$A50 -> 45 | B47: ='\\ser\software\other\[POINTS NQS  2012.XLS]Stock Altered 1050'!$B50 -> Roger Davis | C47: ='\\ser\software\other\[POINTS NQS  2012.XLS]Stock Altered 1050'!$C50 -> Lower Salem, Oh | D47: ='\\ser\software\other\[POINTS NQS  2012.XLS]Stock Altered 1050'!$D50 -> JRS | E47: ='\\ser\software\other\[POINTS NQS  2012.XLS]Stock Altered 1050'!$E50 -> 68 | F47: =IF('\\ser\software\other\[POINTS NQS  2012.XLS]Stock Altered 1050'!$F50=0," ",'\\ser\software\other\[POINTS NQS  2012.XLS]Stock Altered 1050'!$F50) -> Dusty Lady | G47: ='\\ser\software\other\[POINTS NQS  2012.XLS]Stock Altered 1050'!AA50 -> 140 | I47: ='\\ser\software\other\[POINTS NQS  2012.XLS]Stock Altered 1100'!$A50 -> 45 | J47: ='\\ser\software\other\[POINTS NQS  2012.XLS]Stock Altered 1100'!$B50 -> John Cress | K47: ='\\ser\software\other\[POINTS NQS  2012.XLS]Stock Altered 1100'!$C50 -> Strasburg, IL | L47: ='\\ser\software\other\[POINTS NQS  2012.XLS]Stock Altered 1100'!$D50 -> JRS | M47: ='\\ser\software\other\[POINTS NQS  2012.XLS]Stock Altered 1100'!$E50 -> 514 | N47: =IF('\\ser\software\other\[POINTS NQS  2012.XLS]Stock Altered 1100'!$F50=0," ",'\\ser\software\other\[POINTS NQS  2012.XLS]Stock Altered 1100'!$F50) -> Mini Blitzed | O47: ='\\ser\software\other\[POINTS NQS  2012.XLS]Stock Altered 1100'!AA50 -> 153
A48: ='\\ser\software\other\[POINTS NQS  2012.XLS]Stock Altered 1050'!$A51 -> 46 | B48: ='\\ser\software\other\[POINTS NQS  2012.XLS]Stock Altered 1050'!$B51 -> Brian Simpson | C48: ='\\ser\software\other\[POINTS NQS  2012.XLS]Stock Altered 1050'!$C51 -> Danville, Oh | D48: ='\\ser\software\other\[POINTS NQS  2012.XLS]Stock Altered 1050'!$D51 -> Woods | E48: ='\\ser\software\other\[POINTS NQS  2012.XLS]Stock Altered 1050'!$E51 -> 525 | F48: =IF('\\ser\software\other\[POINTS NQS  2012.XLS]Stock Altered 1050'!$F51=0," ",'\\ser\software\other\[POINTS NQS  2012.XLS]Stock Altered 1050'!$F51) -> Ramp Door Express | G48: ='\\ser\software\other\[POINTS NQS  2012.XLS]Stock Altered 1050'!AA51 -> 142 | I48: ='\\ser\software\other\[POINTS NQS  2012.XLS]Stock Altered 1100'!$A51 -> 46 | J48: ='\\ser\software\other\[POINTS NQS  2012.XLS]Stock Altered 1100'!$B51 -> Jerry Leonard | K48: ='\\ser\software\other\[POINTS NQS  2012.XLS]Stock Altered 1100'!$C51 -> Charleston, IL | L48: ='\\ser\software\other\[POINTS NQS  2012.XLS]Stock Altered 1100'!$D51 -> Vogel | M48: ='\\ser\software\other\[POINTS NQS  2012.XLS]Stock Altered 1100'!$E51 -> 308 | N48: =IF('\\ser\software\other\[POINTS NQS  2012.XLS]Stock Altered 1100'!$F51=0," ",'\\ser\software\other\[POINTS NQS  2012.XLS]Stock Altered 1100'!$F51) -> Histrung | O48: ='\\ser\software\other\[POINTS NQS  2012.XLS]Stock Altered 1100'!AA51 -> 155
A49: ='\\ser\software\other\[POINTS NQS  2012.XLS]Stock Altered 1050'!$A52 -> 47 | B49: ='\\ser\software\other\[POINTS NQS  2012.XLS]Stock Altered 1050'!$B52 -> John Elrod | C49: ='\\ser\software\other\[POINTS NQS  2012.XLS]Stock Altered 1050'!$C52 -> Salem, IN | D49: ='\\ser\software\other\[POINTS NQS  2012.XLS]Stock Altered 1050'!$D52 -> TV | E49: ='\\ser\software\other\[POINTS NQS  2012.XLS]Stock Altered 1050'!$E52 -> 20 | F49: =IF('\\ser\software\other\[POINTS NQS  2012.XLS]Stock Altered 1050'!$F52=0," ",'\\ser\software\other\[POINTS NQS  2012.XLS]Stock Altered 1050'!$F52) -> Bad Habit | G49: ='\\ser\software\other\[POINTS NQS  2012.XLS]Stock Altered 1050'!AA52 -> 143 | I49: ='\\ser\software\other\[POINTS NQS  2012.XLS]Stock Altered 1100'!$A52 -> 47 | J49: ='\\ser\software\other\[POINTS NQS  2012.XLS]Stock Altered 1100'!$B52 -> Bud Casale | K49: ='\\ser\software\other\[POINTS NQS  2012.XLS]Stock Altered 1100'!$C52 -> Stanton, Pa | L49: ='\\ser\software\other\[POINTS NQS  2012.XLS]Stock Altered 1100'!$D52 -> TV | M49: ='\\ser\software\other\[POINTS NQS  2012.XLS]Stock Altered 1100'!$E52 -> 403 | N49: =IF('\\ser\software\other\[POINTS NQS  2012.XLS]Stock Altered 1100'!$F52=0," ",'\\ser\software\other\[POINTS NQS  2012.XLS]Stock Altered 1100'!$F52) ->  | O49: ='\\ser\software\other\[POINTS NQS  2012.XLS]Stock Altered 1100'!AA52 -> 155
A50: ='\\ser\software\other\[POINTS NQS  2012.XLS]Stock Altered 1050'!$A53 -> 48 | B50: ='\\ser\software\other\[POINTS NQS  2012.XLS]Stock Altered 1050'!$B53 -> Tod Hinkle | C50: ='\\ser\software\other\[POINTS NQS  2012.XLS]Stock Altered 1050'!$C53 -> Dongola, IA | D50: ='\\ser\software\other\[POINTS NQS  2012.XLS]Stock Altered 1050'!$D53 -> JW | E50: ='\\ser\software\other\[POINTS NQS  2012.XLS]Stock Altered 1050'!$E53 -> 370 | F50: =IF('\\ser\software\other\[POINTS NQS  2012.XLS]Stock Altered 1050'!$F53=0," ",'\\ser\software\other\[POINTS NQS  2012.XLS]Stock Altered 1050'!$F53) -> Disturbed | G50: ='\\ser\software\other\[POINTS NQS  2012.XLS]Stock Altered 1050'!AA53 -> 143 | I50: ='\\ser\software\other\[POINTS NQS  2012.XLS]Stock Altered 1100'!$A53 -> 48 | J50: ='\\ser\software\other\[POINTS NQS  2012.XLS]Stock Altered 1100'!$B53 -> Chris Gegg | K50: ='\\ser\software\other\[POINTS NQS  2012.XLS]Stock Altered 1100'!$C53 -> Greenville, IL | L50: ='\\ser\software\other\[POINTS NQS  2012.XLS]Stock Altered 1100'!$D53 -> JRS | M50: ='\\ser\software\other\[POINTS NQS  2012.XLS]Stock Altered 1100'!$E53 -> 410 | N50: =IF('\\ser\software\other\[POINTS NQS  2012.XLS]Stock Altered 1100'!$F53=0," ",'\\ser\software\other\[POINTS NQS  2012.XLS]Stock Altered 1100'!$F53) -> Insane | O50: ='\\ser\software\other\[POINTS NQS  2012.XLS]Stock Altered 1100'!AA53 -> 155
A51: ='\\ser\software\other\[POINTS NQS  2012.XLS]Stock Altered 1050'!$A54 -> 49 | B51: ='\\ser\software\other\[POINTS NQS  2012.XLS]Stock Altered 1050'!$B54 -> Bobby Feldkamp | C51: ='\\ser\software\other\[POINTS NQS  2012.XLS]Stock Altered 1050'!$C54 -> Milan, MI | D51: ='\\ser\software\other\[POINTS NQS  2012.XLS]Stock Altered 1050'!$D54 -> Woods | E51: ='\\ser\software\other\[POINTS NQS  2012.XLS]Stock Altered 1050'!$E54 -> 501 | F51: =IF('\\ser\software\other\[POINTS NQS  2012.XLS]Stock Altered 1050'!$F54=0," ",'\\ser\software\other\[POINTS NQS  2012.XLS]Stock Altered 1050'!$F54) -> Incognito | G51: ='\\ser\software\other\[POINTS NQS  2012.XLS]Stock Altered 1050'!AA54 -> 143 | I51: ='\\ser\software\other\[POINTS NQS  2012.XLS]Stock Altered 1100'!$A54 -> 49 | J51: ='\\ser\software\other\[POINTS NQS  2012.XLS]Stock Altered 1100'!$B54 -> John Elrod | K51: ='\\ser\software\other\[POINTS NQS  2012.XLS]Stock Altered 1100'!$C54 -> Salem, IN | L51: ='\\ser\software\other\[POINTS NQS  2012.XLS]Stock Altered 1100'!$D54 -> TV | M51: ='\\ser\software\other\[POINTS NQS  2012.XLS]Stock Altered 1100'!$E54 -> 20 | N51: =IF('\\ser\software\other\[POINTS NQS  2012.XLS]Stock Altered 1100'!$F54=0," ",'\\ser\software\other\[POINTS NQS  2012.XLS]Stock Altered 1100'!$F54) -> Bad Habit | O51: ='\\ser\software\other\[POINTS NQS  2012.XLS]Stock Altered 1100'!AA54 -> 159
A52: ='\\ser\software\other\[POINTS NQS  2012.XLS]Stock Altered 1050'!$A55 -> 50 | B52: ='\\ser\software\other\[POINTS NQS  2012.XLS]Stock Altered 1050'!$B55 -> Brian Bell | C52: ='\\ser\software\other\[POINTS NQS  2012.XLS]Stock Altered 1050'!$C55 -> Cynthiene, KY | D52: ='\\ser\software\other\[POINTS NQS  2012.XLS]Stock Altered 1050'!$D55 -> NP | E52: ='\\ser\software\other\[POINTS NQS  2012.XLS]Stock Altered 1050'!$E55 -> 510 | F52: =IF('\\ser\software\other\[POINTS NQS  2012.XLS]Stock Altered 1050'!$F55=0," ",'\\ser\software\other\[POINTS NQS  2012.XLS]Stock Altered 1050'!$F55) -> Grim Reaper | G52: ='\\ser\software\other\[POINTS NQS  2012.XLS]Stock Altered 1050'!AA55 -> 143 | I52: ='\\ser\software\other\[POINTS NQS  2012.XLS]Stock Altered 1100'!$A55 -> 50 | J52: ='\\ser\software\other\[POINTS NQS  2012.XLS]Stock Altered 1100'!$B55 -> Gary Cunningham | K52: ='\\ser\software\other\[POINTS NQS  2012.XLS]Stock Altered 1100'!$C55 -> Brooksville, KY | L52: ='\\ser\software\other\[POINTS NQS  2012.XLS]Stock Altered 1100'!$D55 -> NP | M52: ='\\ser\software\other\[POINTS NQS  2012.XLS]Stock Altered 1100'!$E55 -> 162 | N52: =IF('\\ser\software\other\[POINTS NQS  2012.XLS]Stock Altered 1100'!$F55=0," ",'\\ser\software\other\[POINTS NQS  2012.XLS]Stock Altered 1100'!$F55) -> High Voltage | O52: ='\\ser\software\other\[POINTS NQS  2012.XLS]Stock Altered 1100'!AA55 -> 162
A53: ='\\ser\software\other\[POINTS NQS  2012.XLS]Stock Altered 1050'!$A56 -> 51 | B53: ='\\ser\software\other\[POINTS NQS  2012.XLS]Stock Altered 1050'!$B56 -> Mike Hall | C53: ='\\ser\software\other\[POINTS NQS  2012.XLS]Stock Altered 1050'!$C56 -> Perrysburg, Oh | D53: ='\\ser\software\other\[POINTS NQS  2012.XLS]Stock Altered 1050'!$D56 -> RPM | E53: ='\\ser\software\other\[POINTS NQS  2012.XLS]Stock Altered 1050'!$E56 -> 248 | F53: =IF('\\ser\software\other\[POINTS NQS  2012.XLS]Stock Altered 1050'!$F56=0," ",'\\ser\software\other\[POINTS NQS  2012.XLS]Stock Altered 1050'!$F56) -> Lethal Injection | G53: ='\\ser\software\other\[POINTS NQS  2012.XLS]Stock Altered 1050'!AA56 -> 144 | I53: ='\\ser\software\other\[POINTS NQS  2012.XLS]Stock Altered 1100'!$A56 -> 51 | J53: ='\\ser\software\other\[POINTS NQS  2012.XLS]Stock Altered 1100'!$B56 -> Randy Hazelbaker | K53: ='\\ser\software\other\[POINTS NQS  2012.XLS]Stock Altered 1100'!$C56 -> Winchester, Oh | L53: ='\\ser\software\other\[POINTS NQS  2012.XLS]Stock Altered 1100'!$D56 -> TV | M53: ='\\ser\software\other\[POINTS NQS  2012.XLS]Stock Altered 1100'!$E56 -> 87 | N53: =IF('\\ser\software\other\[POINTS NQS  2012.XLS]Stock Altered 1100'!$F56=0," ",'\\ser\software\other\[POINTS NQS  2012.XLS]Stock Altered 1100'!$F56) -> One Bad Buck | O53: ='\\ser\software\other\[POINTS NQS  2012.XLS]Stock Altered 1100'!AA56 -> 163
A54: ='\\ser\software\other\[POINTS NQS  2012.XLS]Stock Altered 1050'!$A57 -> 52 | B54: ='\\ser\software\other\[POINTS NQS  2012.XLS]Stock Altered 1050'!$B57 -> Mike McGaha | C54: ='\\ser\software\other\[POINTS NQS  2012.XLS]Stock Altered 1050'!$C57 -> Hope, IN | D54: ='\\ser\software\other\[POINTS NQS  2012.XLS]Stock Altered 1050'!$D57 -> JW | E54: ='\\ser\software\other\[POINTS NQS  2012.XLS]Stock Altered 1050'!$E57 -> 288 | F54: =IF('\\ser\software\other\[POINTS NQS  2012.XLS]Stock Altered 1050'!$F57=0," ",'\\ser\software\other\[POINTS NQS  2012.XLS]Stock Altered 1050'!$F57) -> Company Time | G54: ='\\ser\software\other\[POINTS NQS  2012.XLS]Stock Altered 1050'!AA57 -> 146 | I54: ='\\ser\software\other\[POINTS NQS  2012.XLS]Stock Altered 1100'!$A57 -> 52 | J54: ='\\ser\software\other\[POINTS NQS  2012.XLS]Stock Altered 1100'!$B57 -> Herb Houck | K54: ='\\ser\software\other\[POINTS NQS  2012.XLS]Stock Altered 1100'!$C57 -> Spruce Creek, Pa | L54: ='\\ser\software\other\[POINTS NQS  2012.XLS]Stock Altered 1100'!$D57 -> LR | M54: ='\\ser\software\other\[POINTS NQS  2012.XLS]Stock Altered 1100'!$E57 -> 545 | N54: =IF('\\ser\software\other\[POINTS NQS  2012.XLS]Stock Altered 1100'!$F57=0," ",'\\ser\software\other\[POINTS NQS  2012.XLS]Stock Altered 1100'!$F57) -> IH Express | O54: ='\\ser\software\other\[POINTS NQS  2012.XLS]Stock Altered 1100'!AA57 -> 166
A55: ='\\ser\software\other\[POINTS NQS  2012.XLS]Stock Altered 1050'!$A58 -> 53 | B55: ='\\ser\software\other\[POINTS NQS  2012.XLS]Stock Altered 1050'!$B58 -> Roger McKinney 3rd | C55: ='\\ser\software\other\[POINTS NQS  2012.XLS]Stock Altered 1050'!$C58 -> Lake Ariel, PA | D55: ='\\ser\software\other\[POINTS NQS  2012.XLS]Stock Altered 1050'!$D58 -> 0 | E55: ='\\ser\software\other\[POINTS NQS  2012.XLS]Stock Altered 1050'!$E58 -> 540 | F55: =IF('\\ser\software\other\[POINTS NQS  2012.XLS]Stock Altered 1050'!$F58=0," ",'\\ser\software\other\[POINTS NQS  2012.XLS]Stock Altered 1050'!$F58) -> Fireball | G55: ='\\ser\software\other\[POINTS NQS  2012.XLS]Stock Altered 1050'!AA58 -> 146 | I55: ='\\ser\software\other\[POINTS NQS  2012.XLS]Stock Altered 1100'!$A58 -> 53 | J55: ='\\ser\software\other\[POINTS NQS  2012.XLS]Stock Altered 1100'!$B58 -> Jared Riddle | K55: ='\\ser\software\other\[POINTS NQS  2012.XLS]Stock Altered 1100'!$C58 -> Montgomery City, PA | L55: ='\\ser\software\other\[POINTS NQS  2012.XLS]Stock Altered 1100'!$D58 ->  | M55: ='\\ser\software\other\[POINTS NQS  2012.XLS]Stock Altered 1100'!$E58 -> 471 | N55: =IF('\\ser\software\other\[POINTS NQS  2012.XLS]Stock Altered 1100'!$F58=0," ",'\\ser\software\other\[POINTS NQS  2012.XLS]Stock Altered 1100'!$F58) -> Williemakit | O55: ='\\ser\software\other\[POINTS NQS  2012.XLS]Stock Altered 1100'!AA58 -> 167
A56: ='\\ser\software\other\[POINTS NQS  2012.XLS]Stock Altered 1050'!$A59 -> 54 | B56: ='\\ser\software\other\[POINTS NQS  2012.XLS]Stock Altered 1050'!$B59 -> Jared Riddle | C56: ='\\ser\software\other\[POINTS NQS  2012.XLS]Stock Altered 1050'!$C59 -> Montgomery City, PA | D56: ='\\ser\software\other\[POINTS NQS  2012.XLS]Stock Altered 1050'!$D59 ->  | E56: ='\\ser\software\other\[POINTS NQS  2012.XLS]Stock Altered 1050'!$E59 -> 471 | F56: =IF('\\ser\software\other\[POINTS NQS  2012.XLS]Stock Altered 1050'!$F59=0," ",'\\ser\software\other\[POINTS NQS  2012.XLS]Stock Altered 1050'!$F59) -> Williemakit | G56: ='\\ser\software\other\[POINTS NQS  2012.XLS]Stock Altered 1050'!AA59 -> 148 | I56: ='\\ser\software\other\[POINTS NQS  2012.XLS]Stock Altered 1100'!$A59 -> 54 | J56: ='\\ser\software\other\[POINTS NQS  2012.XLS]Stock Altered 1100'!$B59 -> Bob Jones SR | K56: ='\\ser\software\other\[POINTS NQS  2012.XLS]Stock Altered 1100'!$C59 -> Hopewell, OH | L56: ='\\ser\software\other\[POINTS NQS  2012.XLS]Stock Altered 1100'!$D59 -> BJ | M56: ='\\ser\software\other\[POINTS NQS  2012.XLS]Stock Altered 1100'!$E59 -> 182 | N56: =IF('\\ser\software\other\[POINTS NQS  2012.XLS]Stock Altered 1100'!$F59=0," ",'\\ser\software\other\[POINTS NQS  2012.XLS]Stock Altered 1100'!$F59) -> Buckeye Binder | O56: ='\\ser\software\other\[POINTS NQS  2012.XLS]Stock Altered 1100'!AA59 -> 180
A57: ='\\ser\software\other\[POINTS NQS  2012.XLS]Stock Altered 1050'!$A60 -> 55 | B57: ='\\ser\software\other\[POINTS NQS  2012.XLS]Stock Altered 1050'!$B60 -> Gordon Lloyd | C57: ='\\ser\software\other\[POINTS NQS  2012.XLS]Stock Altered 1050'!$C60 -> Circleville, Oh | D57: ='\\ser\software\other\[POINTS NQS  2012.XLS]Stock Altered 1050'!$D60 -> 0 | E57: ='\\ser\software\other\[POINTS NQS  2012.XLS]Stock Altered 1050'!$E60 -> 549 | F57: =IF('\\ser\software\other\[POINTS NQS  2012.XLS]Stock Altered 1050'!$F60=0," ",'\\ser\software\other\[POINTS NQS  2012.XLS]Stock Altered 1050'!$F60) -> Project X | G57: ='\\ser\software\other\[POINTS NQS  2012.XLS]Stock Altered 1050'!AA60 -> 162 | I57: ='\\ser\software\other\[POINTS NQS  2012.XLS]Stock Altered 1100'!$A60 -> 55 | J57: ='\\ser\software\other\[POINTS NQS  2012.XLS]Stock Altered 1100'!$B60 -> Mike McGaha | K57: ='\\ser\software\other\[POINTS NQS  2012.XLS]Stock Altered 1100'!$C60 -> Hope, IN | L57: ='\\ser\software\other\[POINTS NQS  2012.XLS]Stock Altered 1100'!$D60 -> JW | M57: ='\\ser\software\other\[POINTS NQS  2012.XLS]Stock Altered 1100'!$E60 -> 288 | N57: =IF('\\ser\software\other\[POINTS NQS  2012.XLS]Stock Altered 1100'!$F60=0," ",'\\ser\software\other\[POINTS NQS  2012.XLS]Stock Altered 1100'!$F60) -> Company Time | O57: ='\\ser\software\other\[POINTS NQS  2012.XLS]Stock Altered 1100'!AA60 -> 180
A58: ='\\ser\software\other\[POINTS NQS  2012.XLS]Stock Altered 1050'!$A61 -> 56 | B58: ='\\ser\software\other\[POINTS NQS  2012.XLS]Stock Altered 1050'!$B61 -> Bill Elrod | C58: ='\\ser\software\other\[POINTS NQS  2012.XLS]Stock Altered 1050'!$C61 -> Salem, IN | D58: ='\\ser\software\other\[POINTS NQS  2012.XLS]Stock Altered 1050'!$D61 -> TV | E58: ='\\ser\software\other\[POINTS NQS  2012.XLS]Stock Altered 1050'!$E61 -> 21 | F58: =IF('\\ser\software\other\[POINTS NQS  2012.XLS]Stock Altered 1050'!$F61=0," ",'\\ser\software\other\[POINTS NQS  2012.XLS]Stock Altered 1050'!$F61) -> Pa Paw Toy | G58: ='\\ser\software\other\[POINTS NQS  2012.XLS]Stock Altered 1050'!AA61 -> 163 | I58: ='\\ser\software\other\[POINTS NQS  2012.XLS]Stock Altered 1100'!$A61 -> 56 | J58: ='\\ser\software\other\[POINTS NQS  2012.XLS]Stock Altered 1100'!$B61 -> Jeff Jager | K58: ='\\ser\software\other\[POINTS NQS  2012.XLS]Stock Altered 1100'!$C61 -> Sussex, NJ | L58: ='\\ser\software\other\[POINTS NQS  2012.XLS]Stock Altered 1100'!$D61 -> JRS | M58: ='\\ser\software\other\[POINTS NQS  2012.XLS]Stock Altered 1100'!$E61 -> 529 | N58: =IF('\\ser\software\other\[POINTS NQS  2012.XLS]Stock Altered 1100'!$F61=0," ",'\\ser\software\other\[POINTS NQS  2012.XLS]Stock Altered 1100'!$F61) -> Orange Crush | O58: ='\\ser\software\other\[POINTS NQS  2012.XLS]Stock Altered 1100'!AA61 -> 180
A59: ='\\ser\software\other\[POINTS NQS  2012.XLS]Stock Altered 1050'!$A62 -> 57 | B59: ='\\ser\software\other\[POINTS NQS  2012.XLS]Stock Altered 1050'!$B62 -> Shawn Garman | C59: ='\\ser\software\other\[POINTS NQS  2012.XLS]Stock Altered 1050'!$C62 -> Jeromesville, OH | D59: ='\\ser\software\other\[POINTS NQS  2012.XLS]Stock Altered 1050'!$D62 -> JRS | E59: ='\\ser\software\other\[POINTS NQS  2012.XLS]Stock Altered 1050'!$E62 -> 391 | F59: =IF('\\ser\software\other\[POINTS NQS  2012.XLS]Stock Altered 1050'!$F62=0," ",'\\ser\software\other\[POINTS NQS  2012.XLS]Stock Altered 1050'!$F62) -> Jagmeister | G59: ='\\ser\software\other\[POINTS NQS  2012.XLS]Stock Altered 1050'!AA62 -> 163 | I59: ='\\ser\software\other\[POINTS NQS  2012.XLS]Stock Altered 1100'!$A62 -> 57 | J59: ='\\ser\software\other\[POINTS NQS  2012.XLS]Stock Altered 1100'!$B62 -> Greg Myers | K59: ='\\ser\software\other\[POINTS NQS  2012.XLS]Stock Altered 1100'!$C62 -> Circleville, Oh | L59: ='\\ser\software\other\[POINTS NQS  2012.XLS]Stock Altered 1100'!$D62 -> 0 | M59: ='\\ser\software\other\[POINTS NQS  2012.XLS]Stock Altered 1100'!$E62 -> 496 | N59: =IF('\\ser\software\other\[POINTS NQS  2012.XLS]Stock Altered 1100'!$F62=0," ",'\\ser\software\other\[POINTS NQS  2012.XLS]Stock Altered 1100'!$F62) -> Gang Green | O59: ='\\ser\software\other\[POINTS NQS  2012.XLS]Stock Altered 1100'!AA62 -> 181
A60: ='\\ser\software\other\[POINTS NQS  2012.XLS]Stock Altered 1050'!$A63 -> 58 | B60: ='\\ser\software\other\[POINTS NQS  2012.XLS]Stock Altered 1050'!$B63 -> Jason Rogers | C60: ='\\ser\software\other\[POINTS NQS  2012.XLS]Stock Altered 1050'!$C63 -> Richmond, Ky | D60: ='\\ser\software\other\[POINTS NQS  2012.XLS]Stock Altered 1050'!$D63 -> NP | E60: ='\\ser\software\other\[POINTS NQS  2012.XLS]Stock Altered 1050'!$E63 -> 561 | F60: =IF('\\ser\software\other\[POINTS NQS  2012.XLS]Stock Altered 1050'!$F63=0," ",'\\ser\software\other\[POINTS NQS  2012.XLS]Stock Altered 1050'!$F63) -> Tinker Toy | G60: ='\\ser\software\other\[POINTS NQS  2012.XLS]Stock Altered 1050'!AA63 -> 163 | I60: ='\\ser\software\other\[POINTS NQS  2012.XLS]Stock Altered 1100'!$A63 -> 58 | J60: ='\\ser\software\other\[POINTS NQS  2012.XLS]Stock Altered 1100'!$B63 -> Brian Bell | K60: ='\\ser\software\other\[POINTS NQS  2012.XLS]Stock Altered 1100'!$C63 -> Cynthiene, KY | L60: ='\\ser\software\other\[POINTS NQS  2012.XLS]Stock Altered 1100'!$D63 -> NP | M60: ='\\ser\software\other\[POINTS NQS  2012.XLS]Stock Altered 1100'!$E63 -> 510 | N60: =IF('\\ser\software\other\[POINTS NQS  2012.XLS]Stock Altered 1100'!$F63=0," ",'\\ser\software\other\[POINTS NQS  2012.XLS]Stock Altered 1100'!$F63) -> Grim Reaper | O60: ='\\ser\software\other\[POINTS NQS  2012.XLS]Stock Altered 1100'!AA63 -> 181
A61: ='\\ser\software\other\[POINTS NQS  2012.XLS]Stock Altered 1050'!$A64 -> 59 | B61: ='\\ser\software\other\[POINTS NQS  2012.XLS]Stock Altered 1050'!$B64 -> Ron Finch | C61: ='\\ser\software\other\[POINTS NQS  2012.XLS]Stock Altered 1050'!$C64 -> Milan, MI | D61: ='\\ser\software\other\[POINTS NQS  2012.XLS]Stock Altered 1050'!$D64 -> Woods | E61: ='\\ser\software\other\[POINTS NQS  2012.XLS]Stock Altered 1050'!$E64 -> 143 | F61: =IF('\\ser\software\other\[POINTS NQS  2012.XLS]Stock Altered 1050'!$F64=0," ",'\\ser\software\other\[POINTS NQS  2012.XLS]Stock Altered 1050'!$F64) -> Keychain | G61: ='\\ser\software\other\[POINTS NQS  2012.XLS]Stock Altered 1050'!AA64 -> 164 | I61: ='\\ser\software\other\[POINTS NQS  2012.XLS]Stock Altered 1100'!$A64 -> 59 | J61: ='\\ser\software\other\[POINTS NQS  2012.XLS]Stock Altered 1100'!$B64 -> Brian Simpson | K61: ='\\ser\software\other\[POINTS NQS  2012.XLS]Stock Altered 1100'!$C64 -> Danville, Oh | L61: ='\\ser\software\other\[POINTS NQS  2012.XLS]Stock Altered 1100'!$D64 -> Woods | M61: ='\\ser\software\other\[POINTS NQS  2012.XLS]Stock Altered 1100'!$E64 -> 525 | N61: =IF('\\ser\software\other\[POINTS NQS  2012.XLS]Stock Altered 1100'!$F64=0," ",'\\ser\software\other\[POINTS NQS  2012.XLS]Stock Altered 1100'!$F64) -> Ramp Door Express | O61: ='\\ser\software\other\[POINTS NQS  2012.XLS]Stock Altered 1100'!AA64 -> 181
A62: ='\\ser\software\other\[POINTS NQS  2012.XLS]Stock Altered 1050'!$A65 -> 60 | B62: ='\\ser\software\other\[POINTS NQS  2012.XLS]Stock Altered 1050'!$B65 -> Gina McGaha | C62: ='\\ser\software\other\[POINTS NQS  2012.XLS]Stock Altered 1050'!$C65 -> Hope, IN | D62: ='\\ser\software\other\[POINTS NQS  2012.XLS]Stock Altered 1050'!$D65 -> JW | E62: ='\\ser\software\other\[POINTS NQS  2012.XLS]Stock Altered 1050'!$E65 -> 161 | F62: =IF('\\ser\software\other\[POINTS NQS  2012.XLS]Stock Altered 1050'!$F65=0," ",'\\ser\software\other\[POINTS NQS  2012.XLS]Stock Altered 1050'!$F65) -> Betty Stalker | G62: ='\\ser\software\other\[POINTS NQS  2012.XLS]Stock Altered 1050'!AA65 -> 164 | I62: ='\\ser\software\other\[POINTS NQS  2012.XLS]Stock Altered 1100'!$A65 -> 60 | J62: ='\\ser\software\other\[POINTS NQS  2012.XLS]Stock Altered 1100'!$B65 -> Jason Rogers | K62: ='\\ser\software\other\[POINTS NQS  2012.XLS]Stock Altered 1100'!$C65 -> Richmond, Ky | L62: ='\\ser\software\other\[POINTS NQS  2012.XLS]Stock Altered 1100'!$D65 -> NP | M62: ='\\ser\software\other\[POINTS NQS  2012.XLS]Stock Altered 1100'!$E65 -> 561 | N62: =IF('\\ser\software\other\[POINTS NQS  2012.XLS]Stock Altered 1100'!$F65=0," ",'\\ser\software\other\[POINTS NQS  2012.XLS]Stock Altered 1100'!$F65) -> Tinker Toy | O62: ='\\ser\software\other\[POINTS NQS  2012.XLS]Stock Altered 1100'!AA65 -> 181
A63: ='\\ser\software\other\[POINTS NQS  2012.XLS]Stock Altered 1050'!$A66 -> 61 | B63: ='\\ser\software\other\[POINTS NQS  2012.XLS]Stock Altered 1050'!$B66 -> Mark Rader | C63: ='\\ser\software\other\[POINTS NQS  2012.XLS]Stock Altered 1050'!$C66 -> Pataskala, Oh | D63: ='\\ser\software\other\[POINTS NQS  2012.XLS]Stock Altered 1050'!$D66 -> RPM | E63: ='\\ser\software\other\[POINTS NQS  2012.XLS]Stock Altered 1050'!$E66 -> 213 | F63: =IF('\\ser\software\other\[POINTS NQS  2012.XLS]Stock Altered 1050'!$F66=0," ",'\\ser\software\other\[POINTS NQS  2012.XLS]Stock Altered 1050'!$F66) -> Lethal Weapon | G63: ='\\ser\software\other\[POINTS NQS  2012.XLS]Stock Altered 1050'!AA66 -> 164 | I63: ='\\ser\software\other\[POINTS NQS  2012.XLS]Stock Altered 1100'!$A66 -> 61 | J63: ='\\ser\software\other\[POINTS NQS  2012.XLS]Stock Altered 1100'!$B66 -> Gina McGaha | K63: ='\\ser\software\other\[POINTS NQS  2012.XLS]Stock Altered 1100'!$C66 -> Hope, IN | L63: ='\\ser\software\other\[POINTS NQS  2012.XLS]Stock Altered 1100'!$D66 -> JW | M63: ='\\ser\software\other\[POINTS NQS  2012.XLS]Stock Altered 1100'!$E66 -> 161 | N63: =IF('\\ser\software\other\[POINTS NQS  2012.XLS]Stock Altered 1100'!$F66=0," ",'\\ser\software\other\[POINTS NQS  2012.XLS]Stock Altered 1100'!$F66) -> Betty Stalker | O63: ='\\ser\software\other\[POINTS NQS  2012.XLS]Stock Altered 1100'!AA66 -> 182
A64: ='\\ser\software\other\[POINTS NQS  2012.XLS]Stock Altered 1050'!$A67 -> 62 | B64: ='\\ser\software\other\[POINTS NQS  2012.XLS]Stock Altered 1050'!$B67 -> Austin Ernest | C64: ='\\ser\software\other\[POINTS NQS  2012.XLS]Stock Altered 1050'!$C67 -> Elesmere, Ky | D64: ='\\ser\software\other\[POINTS NQS  2012.XLS]Stock Altered 1050'!$D67 -> 0 | E64: ='\\ser\software\other\[POINTS NQS  2012.XLS]Stock Altered 1050'!$E67 -> 224 | F64: =IF('\\ser\software\other\[POINTS NQS  2012.XLS]Stock Altered 1050'!$F67=0," ",'\\ser\software\other\[POINTS NQS  2012.XLS]Stock Altered 1050'!$F67) ->  | G64: ='\\ser\software\other\[POINTS NQS  2012.XLS]Stock Altered 1050'!AA67 -> 164 | I64: ='\\ser\software\other\[POINTS NQS  2012.XLS]Stock Altered 1100'!$A67 -> 62 | J64: ='\\ser\software\other\[POINTS NQS  2012.XLS]Stock Altered 1100'!$B67 -> Gary Frank | K64: ='\\ser\software\other\[POINTS NQS  2012.XLS]Stock Altered 1100'!$C67 -> Amanda, OH | L64: ='\\ser\software\other\[POINTS NQS  2012.XLS]Stock Altered 1100'!$D67 -> TV | M64: ='\\ser\software\other\[POINTS NQS  2012.XLS]Stock Altered 1100'!$E67 -> 233 | N64: =IF('\\ser\software\other\[POINTS NQS  2012.XLS]Stock Altered 1100'!$F67=0," ",'\\ser\software\other\[POINTS NQS  2012.XLS]Stock Altered 1100'!$F67) -> Katies Toy | O64: ='\\ser\software\other\[POINTS NQS  2012.XLS]Stock Altered 1100'!AA67 -> 182
A65: ='\\ser\software\other\[POINTS NQS  2012.XLS]Stock Altered 1050'!$A68 -> 63 | B65: ='\\ser\software\other\[POINTS NQS  2012.XLS]Stock Altered 1050'!$B68 -> Suzanne McClain | C65: ='\\ser\software\other\[POINTS NQS  2012.XLS]Stock Altered 1050'!$C68 -> Hope, IN | D65: ='\\ser\software\other\[POINTS NQS  2012.XLS]Stock Altered 1050'!$D68 -> 0 | E65: ='\\ser\software\other\[POINTS NQS  2012.XLS]Stock Altered 1050'!$E68 -> 376 | F65: =IF('\\ser\software\other\[POINTS NQS  2012.XLS]Stock Altered 1050'!$F68=0," ",'\\ser\software\other\[POINTS NQS  2012.XLS]Stock Altered 1050'!$F68) ->  | G65: ='\\ser\software\other\[POINTS NQS  2012.XLS]Stock Altered 1050'!AA68 -> 164 | I65: ='\\ser\software\other\[POINTS NQS  2012.XLS]Stock Altered 1100'!$A68 -> 63 | J65: ='\\ser\software\other\[POINTS NQS  2012.XLS]Stock Altered 1100'!$B68 -> Waylan Nelson | K65: ='\\ser\software\other\[POINTS NQS  2012.XLS]Stock Altered 1100'!$C68 -> Shelby, IA | L65: ='\\ser\software\other\[POINTS NQS  2012.XLS]Stock Altered 1100'!$D68 -> Woods | M65: ='\\ser\software\other\[POINTS NQS  2012.XLS]Stock Altered 1100'!$E68 -> 499 | N65: =IF('\\ser\software\other\[POINTS NQS  2012.XLS]Stock Altered 1100'!$F68=0," ",'\\ser\software\other\[POINTS NQS  2012.XLS]Stock Altered 1100'!$F68) -> Close E Nuff | O65: ='\\ser\software\other\[POINTS NQS  2012.XLS]Stock Altered 1100'!AA68 -> 182
A66: ='\\ser\software\other\[POINTS NQS  2012.XLS]Stock Altered 1050'!$A69 -> 64 | B66: ='\\ser\software\other\[POINTS NQS  2012.XLS]Stock Altered 1050'!$B69 -> Clarence Bell | C66: ='\\ser\software\other\[POINTS NQS  2012.XLS]Stock Altered 1050'!$C69 -> West Salem, IL | D66: ='\\ser\software\other\[POINTS NQS  2012.XLS]Stock Altered 1050'!$D69 -> TC | E66: ='\\ser\software\other\[POINTS NQS  2012.XLS]Stock Altered 1050'!$E69 -> 466 | F66: =IF('\\ser\software\other\[POINTS NQS  2012.XLS]Stock Altered 1050'!$F69=0," ",'\\ser\software\other\[POINTS NQS  2012.XLS]Stock Altered 1050'!$F69) -> Money Pit | G66: ='\\ser\software\other\[POINTS NQS  2012.XLS]Stock Altered 1050'!AA69 -> 164 | I66: ='\\ser\software\other\[POINTS NQS  2012.XLS]Stock Altered 1100'!$A69 -> 64 | J66: ='\\ser\software\other\[POINTS NQS  2012.XLS]Stock Altered 1100'!$B69 -> Roger McKinney 3rd | K66: ='\\ser\software\other\[POINTS NQS  2012.XLS]Stock Altered 1100'!$C69 -> Lake Ariel, PA | L66: ='\\ser\software\other\[POINTS NQS  2012.XLS]Stock Altered 1100'!$D69 -> 0 | M66: ='\\ser\software\other\[POINTS NQS  2012.XLS]Stock Altered 1100'!$E69 -> 540 | N66: =IF('\\ser\software\other\[POINTS NQS  2012.XLS]Stock Altered 1100'!$F69=0," ",'\\ser\software\other\[POINTS NQS  2012.XLS]Stock Altered 1100'!$F69) -> Fireball | O66: ='\\ser\software\other\[POINTS NQS  2012.XLS]Stock Altered 1100'!AA69 -> 182
A67: ='\\ser\software\other\[POINTS NQS  2012.XLS]Stock Altered 1050'!$A70 -> 65 | B67: ='\\ser\software\other\[POINTS NQS  2012.XLS]Stock Altered 1050'!$B70 -> Greg Myers | C67: ='\\ser\software\other\[POINTS NQS  2012.XLS]Stock Altered 1050'!$C70 -> Circleville, Oh | D67: ='\\ser\software\other\[POINTS NQS  2012.XLS]Stock Altered 1050'!$D70 -> 0 | E67: ='\\ser\software\other\[POINTS NQS  2012.XLS]Stock Altered 1050'!$E70 -> 496 | F67: =IF('\\ser\software\other\[POINTS NQS  2012.XLS]Stock Altered 1050'!$F70=0," ",'\\ser\software\other\[POINTS NQS  2012.XLS]Stock Altered 1050'!$F70) -> Gang Green | G67: ='\\ser\software\other\[POINTS NQS  2012.XLS]Stock Altered 1050'!AA70 -> 164 | I67: ='\\ser\software\other\[POINTS NQS  2012.XLS]Stock Altered 1100'!$A70 -> 65 | J67: ='\\ser\software\other\[POINTS NQS  2012.XLS]Stock Altered 1100'!$B70 -> Roger Davis | K67: ='\\ser\software\other\[POINTS NQS  2012.XLS]Stock Altered 1100'!$C70 -> Whipple, Oh | L67: ='\\ser\software\other\[POINTS NQS  2012.XLS]Stock Altered 1100'!$D70 -> JRS | M67: ='\\ser\software\other\[POINTS NQS  2012.XLS]Stock Altered 1100'!$E70 -> 68 | N67: =IF('\\ser\software\other\[POINTS NQS  2012.XLS]Stock Altered 1100'!$F70=0," ",'\\ser\software\other\[POINTS NQS  2012.XLS]Stock Altered 1100'!$F70) -> Dusty Lady | O67: ='\\ser\software\other\[POINTS NQS  2012.XLS]Stock Altered 1100'!AA70 -> 183
A68: ='\\ser\software\other\[POINTS NQS  2012.XLS]Stock Altered 1050'!$A71 -> 66 | B68: ='\\ser\software\other\[POINTS NQS  2012.XLS]Stock Altered 1050'!$B71 -> Bob Jones SR | C68: ='\\ser\software\other\[POINTS NQS  2012.XLS]Stock Altered 1050'!$C71 -> Hopewell, OH | D68: ='\\ser\software\other\[POINTS NQS  2012.XLS]Stock Altered 1050'!$D71 -> BJ | E68: ='\\ser\software\other\[POINTS NQS  2012.XLS]Stock Altered 1050'!$E71 -> 182 | F68: =IF('\\ser\software\other\[POINTS NQS  2012.XLS]Stock Altered 1050'!$F71=0," ",'\\ser\software\other\[POINTS NQS  2012.XLS]Stock Altered 1050'!$F71) -> Buckeye Binder | G68: ='\\ser\software\other\[POINTS NQS  2012.XLS]Stock Altered 1050'!AA71 -> 165 | I68: ='\\ser\software\other\[POINTS NQS  2012.XLS]Stock Altered 1100'!$A71 -> 66 | J68: ='\\ser\software\other\[POINTS NQS  2012.XLS]Stock Altered 1100'!$B71 -> Mark Vaughn | K68: ='\\ser\software\other\[POINTS NQS  2012.XLS]Stock Altered 1100'!$C71 -> Loudonville, Oh | L68: ='\\ser\software\other\[POINTS NQS  2012.XLS]Stock Altered 1100'!$D71 -> Woods | M68: ='\\ser\software\other\[POINTS NQS  2012.XLS]Stock Altered 1100'!$E71 -> 523 | N68: =IF('\\ser\software\other\[POINTS NQS  2012.XLS]Stock Altered 1100'!$F71=0," ",'\\ser\software\other\[POINTS NQS  2012.XLS]Stock Altered 1100'!$F71) -> Cowen Truck Lines | O68: ='\\ser\software\other\[POINTS NQS  2012.XLS]Stock Altered 1100'!AA71 -> 183
A69: ='\\ser\software\other\[POINTS NQS  2012.XLS]Stock Altered 1050'!$A72 -> 67 | B69: ='\\ser\software\other\[POINTS NQS  2012.XLS]Stock Altered 1050'!$B72 -> Waylan Nelson | C69: ='\\ser\software\other\[POINTS NQS  2012.XLS]Stock Altered 1050'!$C72 -> Shelby, IA | D69: ='\\ser\software\other\[POINTS NQS  2012.XLS]Stock Altered 1050'!$D72 -> Woods | E69: ='\\ser\software\other\[POINTS NQS  2012.XLS]Stock Altered 1050'!$E72 -> 500 | F69: =IF('\\ser\software\other\[POINTS NQS  2012.XLS]Stock Altered 1050'!$F72=0," ",'\\ser\software\other\[POINTS NQS  2012.XLS]Stock Altered 1050'!$F72) -> Butt Ugly | G69: ='\\ser\software\other\[POINTS NQS  2012.XLS]Stock Altered 1050'!AA72 -> 165 | I69: ='\\ser\software\other\[POINTS NQS  2012.XLS]Stock Altered 1100'!$A72 -> 67 | J69: ='\\ser\software\other\[POINTS NQS  2012.XLS]Stock Altered 1100'!$B72 -> Bill Elrod | K69: ='\\ser\software\other\[POINTS NQS  2012.XLS]Stock Altered 1100'!$C72 -> Salem, IN | L69: ='\\ser\software\other\[POINTS NQS  2012.XLS]Stock Altered 1100'!$D72 -> TV | M69: ='\\ser\software\other\[POINTS NQS  2012.XLS]Stock Altered 1100'!$E72 -> 21 | N69: =IF('\\ser\software\other\[POINTS NQS  2012.XLS]Stock Altered 1100'!$F72=0," ",'\\ser\software\other\[POINTS NQS  2012.XLS]Stock Altered 1100'!$F72) -> Pa Paw Toy | O69: ='\\ser\software\other\[POINTS NQS  2012.XLS]Stock Altered 1100'!AA72 -> 184
A70: ='\\ser\software\other\[POINTS NQS  2012.XLS]Stock Altered 1050'!$A73 -> 68 | B70: ='\\ser\software\other\[POINTS NQS  2012.XLS]Stock Altered 1050'!$B73 -> Mark Vaughn | C70: ='\\ser\software\other\[POINTS NQS  2012.XLS]Stock Altered 1050'!$C73 -> Loudonville, Oh | D70: ='\\ser\software\other\[POINTS NQS  2012.XLS]Stock Altered 1050'!$D73 -> Woods | E70: ='\\ser\software\other\[POINTS NQS  2012.XLS]Stock Altered 1050'!$E73 -> 523 | F70: =IF('\\ser\software\other\[POINTS NQS  2012.XLS]Stock Altered 1050'!$F73=0," ",'\\ser\software\other\[POINTS NQS  2012.XLS]Stock Altered 1050'!$F73) -> Cowen Truck Lines | G70: ='\\ser\software\other\[POINTS NQS  2012.XLS]Stock Altered 1050'!AA73 -> 165 | I70: ='\\ser\software\other\[POINTS NQS  2012.XLS]Stock Altered 1100'!$A73 -> 68 | J70: ='\\ser\software\other\[POINTS NQS  2012.XLS]Stock Altered 1100'!$B73 -> Jeremy Pierce | K70: ='\\ser\software\other\[POINTS NQS  2012.XLS]Stock Altered 1100'!$C73 -> Flat Rock, IN | L70: ='\\ser\software\other\[POINTS NQS  2012.XLS]Stock Altered 1100'!$D73 -> JP | M70: ='\\ser\software\other\[POINTS NQS  2012.XLS]Stock Altered 1100'!$E73 -> 362 | N70: =IF('\\ser\software\other\[POINTS NQS  2012.XLS]Stock Altered 1100'!$F73=0," ",'\\ser\software\other\[POINTS NQS  2012.XLS]Stock Altered 1100'!$F73) -> LunchMoney | O70: ='\\ser\software\other\[POINTS NQS  2012.XLS]Stock Altered 1100'!AA73 -> 184
A71: ='\\ser\software\other\[POINTS NQS  2012.XLS]Stock Altered 1050'!$A74 -> 69 | B71: ='\\ser\software\other\[POINTS NQS  2012.XLS]Stock Altered 1050'!$B74 -> Jerry Leonard | C71: ='\\ser\software\other\[POINTS NQS  2012.XLS]Stock Altered 1050'!$C74 -> Charleston, IL | D71: ='\\ser\software\other\[POINTS NQS  2012.XLS]Stock Altered 1050'!$D74 -> Vogel | E71: ='\\ser\software\other\[POINTS NQS  2012.XLS]Stock Altered 1050'!$E74 -> 308 | F71: =IF('\\ser\software\other\[POINTS NQS  2012.XLS]Stock Altered 1050'!$F74=0," ",'\\ser\software\other\[POINTS NQS  2012.XLS]Stock Altered 1050'!$F74) -> Histrung | G71: ='\\ser\software\other\[POINTS NQS  2012.XLS]Stock Altered 1050'!AA74 -> 166 | I71: ='\\ser\software\other\[POINTS NQS  2012.XLS]Stock Altered 1100'!$A74 -> 69 | J71: ='\\ser\software\other\[POINTS NQS  2012.XLS]Stock Altered 1100'!$B74 -> Jim Hill | K71: ='\\ser\software\other\[POINTS NQS  2012.XLS]Stock Altered 1100'!$C74 -> Indianapolis, IN | L71: ='\\ser\software\other\[POINTS NQS  2012.XLS]Stock Altered 1100'!$D74 -> JW | M71: ='\\ser\software\other\[POINTS NQS  2012.XLS]Stock Altered 1100'!$E74 -> 515 | N71: =IF('\\ser\software\other\[POINTS NQS  2012.XLS]Stock Altered 1100'!$F74=0," ",'\\ser\software\other\[POINTS NQS  2012.XLS]Stock Altered 1100'!$F74) -> Run-N-Hot | O71: ='\\ser\software\other\[POINTS NQS  2012.XLS]Stock Altered 1100'!AA74 -> 184
A72: ='\\ser\software\other\[POINTS NQS  2012.XLS]Stock Altered 1050'!$A75 -> 70 | B72: ='\\ser\software\other\[POINTS NQS  2012.XLS]Stock Altered 1050'!$B75 -> Waylan Nelson | C72: ='\\ser\software\other\[POINTS NQS  2012.XLS]Stock Altered 1050'!$C75 -> Shelby, IA | D72: ='\\ser\software\other\[POINTS NQS  2012.XLS]Stock Altered 1050'!$D75 -> Woods | E72: ='\\ser\software\other\[POINTS NQS  2012.XLS]Stock Altered 1050'!$E75 -> 499 | F72: =IF('\\ser\software\other\[POINTS NQS  2012.XLS]Stock Altered 1050'!$F75=0," ",'\\ser\software\other\[POINTS NQS  2012.XLS]Stock Altered 1050'!$F75) -> Close E Nuff | G72: ='\\ser\software\other\[POINTS NQS  2012.XLS]Stock Altered 1050'!AA75 -> 166 | I72: ='\\ser\software\other\[POINTS NQS  2012.XLS]Stock Altered 1100'!$A75 -> 70 | J72: ='\\ser\software\other\[POINTS NQS  2012.XLS]Stock Altered 1100'!$B75 -> Bob Strawser | K72: ='\\ser\software\other\[POINTS NQS  2012.XLS]Stock Altered 1100'!$C75 -> Stoutsville, Oh | L72: ='\\ser\software\other\[POINTS NQS  2012.XLS]Stock Altered 1100'!$D75 -> 0 | M72: ='\\ser\software\other\[POINTS NQS  2012.XLS]Stock Altered 1100'!$E75 -> 548 | N72: =IF('\\ser\software\other\[POINTS NQS  2012.XLS]Stock Altered 1100'!$F75=0," ",'\\ser\software\other\[POINTS NQS  2012.XLS]Stock Altered 1100'!$F75) -> Funny Farmall | O72: ='\\ser\software\other\[POINTS NQS  2012.XLS]Stock Altered 1100'!AA75 -> 184
A73: ='\\ser\software\other\[POINTS NQS  2012.XLS]Stock Altered 1050'!$A76 -> 71 | B73: ='\\ser\software\other\[POINTS NQS  2012.XLS]Stock Altered 1050'!$B76 -> Herb Houck | C73: ='\\ser\software\other\[POINTS NQS  2012.XLS]Stock Altered 1050'!$C76 -> Spruce Creek, Pa | D73: ='\\ser\software\other\[POINTS NQS  2012.XLS]Stock Altered 1050'!$D76 -> LR | E73: ='\\ser\software\other\[POINTS NQS  2012.XLS]Stock Altered 1050'!$E76 -> 545 | F73: =IF('\\ser\software\other\[POINTS NQS  2012.XLS]Stock Altered 1050'!$F76=0," ",'\\ser\software\other\[POINTS NQS  2012.XLS]Stock Altered 1050'!$F76) -> IH Express | G73: ='\\ser\software\other\[POINTS NQS  2012.XLS]Stock Altered 1050'!AA76 -> 166 | I73: ='\\ser\software\other\[POINTS NQS  2012.XLS]Stock Altered 1100'!$A76 -> 71 | J73: ='\\ser\software\other\[POINTS NQS  2012.XLS]Stock Altered 1100'!$B76 -> Gordon Lloyd | K73: ='\\ser\software\other\[POINTS NQS  2012.XLS]Stock Altered 1100'!$C76 -> Circleville, Oh | L73: ='\\ser\software\other\[POINTS NQS  2012.XLS]Stock Altered 1100'!$D76 -> 0 | M73: ='\\ser\software\other\[POINTS NQS  2012.XLS]Stock Altered 1100'!$E76 -> 549 | N73: =IF('\\ser\software\other\[POINTS NQS  2012.XLS]Stock Altered 1100'!$F76=0," ",'\\ser\software\other\[POINTS NQS  2012.XLS]Stock Altered 1100'!$F76) -> Project X | O73: ='\\ser\software\other\[POINTS NQS  2012.XLS]Stock Altered 1100'!AA76 -> 184
A74: ='\\ser\software\other\[POINTS NQS  2012.XLS]Stock Altered 1050'!$A77 -> 72 | B74: ='\\ser\software\other\[POINTS NQS  2012.XLS]Stock Altered 1050'!$B77 -> Tim Bowling | C74: ='\\ser\software\other\[POINTS NQS  2012.XLS]Stock Altered 1050'!$C77 -> Syracuse, Ind | D74: ='\\ser\software\other\[POINTS NQS  2012.XLS]Stock Altered 1050'!$D77 -> LR | E74: ='\\ser\software\other\[POINTS NQS  2012.XLS]Stock Altered 1050'!$E77 -> 0 | F74: =IF('\\ser\software\other\[POINTS NQS  2012.XLS]Stock Altered 1050'!$F77=0," ",'\\ser\software\other\[POINTS NQS  2012.XLS]Stock Altered 1050'!$F77) -> Orange Cub | G74: ='\\ser\software\other\[POINTS NQS  2012.XLS]Stock Altered 1050'!AA77 -> 166 | I74: ='\\ser\software\other\[POINTS NQS  2012.XLS]Stock Altered 1100'!$A77 -> 72 | J74: ='\\ser\software\other\[POINTS NQS  2012.XLS]Stock Altered 1100'!$B77 -> Mike Yeley | K74: ='\\ser\software\other\[POINTS NQS  2012.XLS]Stock Altered 1100'!$C77 -> Hope, IN | L74: ='\\ser\software\other\[POINTS NQS  2012.XLS]Stock Altered 1100'!$D77 -> JW | M74: ='\\ser\software\other\[POINTS NQS  2012.XLS]Stock Altered 1100'!$E77 -> 55 | N74: =IF('\\ser\software\other\[POINTS NQS  2012.XLS]Stock Altered 1100'!$F77=0," ",'\\ser\software\other\[POINTS NQS  2012.XLS]Stock Altered 1100'!$F77) -> Outta Hope | O74: ='\\ser\software\other\[POINTS NQS  2012.XLS]Stock Altered 1100'!AA77 -> 185
A75: ='\\ser\software\other\[POINTS NQS  2012.XLS]Stock Altered 1050'!$A78 -> 73 | B75: ='\\ser\software\other\[POINTS NQS  2012.XLS]Stock Altered 1050'!$B78 -> Jeff Jager | C75: ='\\ser\software\other\[POINTS NQS  2012.XLS]Stock Altered 1050'!$C78 -> Sussex, NJ | D75: ='\\ser\software\other\[POINTS NQS  2012.XLS]Stock Altered 1050'!$D78 -> JRS | E75: ='\\ser\software\other\[POINTS NQS  2012.XLS]Stock Altered 1050'!$E78 -> 529 | F75: =IF('\\ser\software\other\[POINTS NQS  2012.XLS]Stock Altered 1050'!$F78=0," ",'\\ser\software\other\[POINTS NQS  2012.XLS]Stock Altered 1050'!$F78) -> Orange Crush | G75: ='\\ser\software\other\[POINTS NQS  2012.XLS]Stock Altered 1050'!AA78 -> 167 | I75: ='\\ser\software\other\[POINTS NQS  2012.XLS]Stock Altered 1100'!$A78 -> 73 | J75: ='\\ser\software\other\[POINTS NQS  2012.XLS]Stock Altered 1100'!$B78 -> Ron Feldkamp | K75: ='\\ser\software\other\[POINTS NQS  2012.XLS]Stock Altered 1100'!$C78 -> Saline, Mi | L75: ='\\ser\software\other\[POINTS NQS  2012.XLS]Stock Altered 1100'!$D78 -> Woods | M75: ='\\ser\software\other\[POINTS NQS  2012.XLS]Stock Altered 1100'!$E78 -> 143 | N75: =IF('\\ser\software\other\[POINTS NQS  2012.XLS]Stock Altered 1100'!$F78=0," ",'\\ser\software\other\[POINTS NQS  2012.XLS]Stock Altered 1100'!$F78) -> Top Notch | O75: ='\\ser\software\other\[POINTS NQS  2012.XLS]Stock Altered 1100'!AA78 -> 185
A76: ='\\ser\software\other\[POINTS NQS  2012.XLS]Stock Altered 1050'!$A79 -> 74 | B76: ='\\ser\software\other\[POINTS NQS  2012.XLS]Stock Altered 1050'!$B79 -> Gaylord Strine | C76: ='\\ser\software\other\[POINTS NQS  2012.XLS]Stock Altered 1050'!$C79 -> Ashland, OH | D76: ='\\ser\software\other\[POINTS NQS  2012.XLS]Stock Altered 1050'!$D79 -> JRS | E76: ='\\ser\software\other\[POINTS NQS  2012.XLS]Stock Altered 1050'!$E79 -> 492 | F76: =IF('\\ser\software\other\[POINTS NQS  2012.XLS]Stock Altered 1050'!$F79=0," ",'\\ser\software\other\[POINTS NQS  2012.XLS]Stock Altered 1050'!$F79) -> Giddy Up Go | G76: ='\\ser\software\other\[POINTS NQS  2012.XLS]Stock Altered 1050'!AA79 -> 168 | I76: ='\\ser\software\other\[POINTS NQS  2012.XLS]Stock Altered 1100'!$A79 -> 74 | J76: ='\\ser\software\other\[POINTS NQS  2012.XLS]Stock Altered 1100'!$B79 -> Gaylord Strine | K76: ='\\ser\software\other\[POINTS NQS  2012.XLS]Stock Altered 1100'!$C79 -> Ashland, OH | L76: ='\\ser\software\other\[POINTS NQS  2012.XLS]Stock Altered 1100'!$D79 -> JRS | M76: ='\\ser\software\other\[POINTS NQS  2012.XLS]Stock Altered 1100'!$E79 -> 492 | N76: =IF('\\ser\software\other\[POINTS NQS  2012.XLS]Stock Altered 1100'!$F79=0," ",'\\ser\software\other\[POINTS NQS  2012.XLS]Stock Altered 1100'!$F79) -> Giddy Up Go | O76: ='\\ser\software\other\[POINTS NQS  2012.XLS]Stock Altered 1100'!AA79 -> 185
A77: ='\\ser\software\other\[POINTS NQS  2012.XLS]Stock Altered 1050'!$A80 -> 75 | B77: ='\\ser\software\other\[POINTS NQS  2012.XLS]Stock Altered 1050'!$B80 -> Bob Strawser | C77: ='\\ser\software\other\[POINTS NQS  2012.XLS]Stock Altered 1050'!$C80 -> Stoutsville, Oh | D77: ='\\ser\software\other\[POINTS NQS  2012.XLS]Stock Altered 1050'!$D80 -> 0 | E77: ='\\ser\software\other\[POINTS NQS  2012.XLS]Stock Altered 1050'!$E80 -> 548 | F77: =IF('\\ser\software\other\[POINTS NQS  2012.XLS]Stock Altered 1050'!$F80=0," ",'\\ser\software\other\[POINTS NQS  2012.XLS]Stock Altered 1050'!$F80) -> Funny Farmall | G77: ='\\ser\software\other\[POINTS NQS  2012.XLS]Stock Altered 1050'!AA80 -> 169