B1: PRO | G1: Thru Tallmadge | I1: SUPER STOCK | O1: Thru Tallmadge
B2: Name | C2: City/State | D2: Eng | E2: NQS # | F2: Tractor | G2: Points Back | J2: Name | K2: City/State | L2: Eng. | M2: NQS # | N2: Tractor | O2: Points Back
A3: ='[POINTS NQS  2012.XLS]Pro Stock'!$A7 -> 1 | B3: ='[POINTS NQS  2012.XLS]Pro Stock'!$B7 -> Drew Burton | C3: ='[POINTS NQS  2012.XLS]Pro Stock'!$C7 -> Brookston, Ill | D3: ='[POINTS NQS  2012.XLS]Pro Stock'!$D7 -> NP | E3: ='[POINTS NQS  2012.XLS]Pro Stock'!$E7 -> 15 | F3: =IF('[POINTS NQS  2012.XLS]Pro Stock'!$F7=0," ",'[POINTS NQS  2012.XLS]Pro Stock'!$F7) -> Plain Nuts | G3: ='[POINTS NQS  2012.XLS]Pro Stock'!$AA7 -> 0 | I3: ='[POINTS NQS  2012.XLS]Super Stock'!$A7 -> 1 | J3: ='[POINTS NQS  2012.XLS]Super Stock'!$B7 -> Greg Curtsinger | K3: ='[POINTS NQS  2012.XLS]Super Stock'!$C7 -> Carlilse, KY | L3: ='[POINTS NQS  2012.XLS]Super Stock'!$D7 -> NP | M3: ='[POINTS NQS  2012.XLS]Super Stock'!$E7 -> 8 | N3: =IF('[POINTS NQS  2012.XLS]Super Stock'!$F7=0," ",'[POINTS NQS  2012.XLS]Super Stock'!$F7) -> Wicked Deere | O3: ='[POINTS NQS  2012.XLS]Super Stock'!$AA7 -> 0
A4: ='[POINTS NQS  2012.XLS]Pro Stock'!$A8 -> 2 | B4: ='[POINTS NQS  2012.XLS]Pro Stock'!$B8 -> Eli Zimmerman | C4: ='[POINTS NQS  2012.XLS]Pro Stock'!$C8 -> Allentown, Pa | D4: ='[POINTS NQS  2012.XLS]Pro Stock'!$D8 -> NP | E4: ='[POINTS NQS  2012.XLS]Pro Stock'!$E8 -> 456 | F4: =IF('[POINTS NQS  2012.XLS]Pro Stock'!$F8=0," ",'[POINTS NQS  2012.XLS]Pro Stock'!$F8) -> Lots of Nichols | G4: ='[POINTS NQS  2012.XLS]Pro Stock'!$AA8 -> 8 | I4: ='[POINTS NQS  2012.XLS]Super Stock'!$A8 -> 2 | J4: ='[POINTS NQS  2012.XLS]Super Stock'!$B8 -> Jerry Skuta | K4: ='[POINTS NQS  2012.XLS]Super Stock'!$C8 -> Kimball, MI | L4: ='[POINTS NQS  2012.XLS]Super Stock'!$D8 -> NP | M4: ='[POINTS NQS  2012.XLS]Super Stock'!$E8 -> 329 | N4: =IF('[POINTS NQS  2012.XLS]Super Stock'!$F8=0," ",'[POINTS NQS  2012.XLS]Super Stock'!$F8) -> Green Tractor | O4: ='[POINTS NQS  2012.XLS]Super Stock'!$AA8 -> 7
A5: ='[POINTS NQS  2012.XLS]Pro Stock'!$A9 -> 3 | B5: ='[POINTS NQS  2012.XLS]Pro Stock'!$B9 -> Steve Chrisman | C5: ='[POINTS NQS  2012.XLS]Pro Stock'!$C9 -> Edinburg, Ind | D5: ='[POINTS NQS  2012.XLS]Pro Stock'!$D9 -> Hackman | E5: ='[POINTS NQS  2012.XLS]Pro Stock'!$E9 -> 26 | F5: =IF('[POINTS NQS  2012.XLS]Pro Stock'!$F9=0," ",'[POINTS NQS  2012.XLS]Pro Stock'!$F9) -> JD | G5: ='[POINTS NQS  2012.XLS]Pro Stock'!$AA9 -> 11 | I5: ='[POINTS NQS  2012.XLS]Super Stock'!$A9 -> 3 | J5: ='[POINTS NQS  2012.XLS]Super Stock'!$B9 -> Eli Zimmerman | K5: ='[POINTS NQS  2012.XLS]Super Stock'!$C9 -> Allentown, PA | L5: ='[POINTS NQS  2012.XLS]Super Stock'!$D9 -> NP | M5: ='[POINTS NQS  2012.XLS]Super Stock'!$E9 -> 456 | N5: =IF('[POINTS NQS  2012.XLS]Super Stock'!$F9=0," ",'[POINTS NQS  2012.XLS]Super Stock'!$F9) -> Lot of Nichols | O5: ='[POINTS NQS  2012.XLS]Super Stock'!$AA9 -> 7
A6: ='[POINTS NQS  2012.XLS]Pro Stock'!$A10 -> 4 | B6: ='[POINTS NQS  2012.XLS]Pro Stock'!$B10 -> Jerry Skuta | C6: ='[POINTS NQS  2012.XLS]Pro Stock'!$C10 -> Kimball, Mich | D6: ='[POINTS NQS  2012.XLS]Pro Stock'!$D10 -> NP | E6: ='[POINTS NQS  2012.XLS]Pro Stock'!$E10 -> 329 | F6: =IF('[POINTS NQS  2012.XLS]Pro Stock'!$F10=0," ",'[POINTS NQS  2012.XLS]Pro Stock'!$F10) -> Green Tractor | G6: ='[POINTS NQS  2012.XLS]Pro Stock'!$AA10 -> 11 | I6: ='[POINTS NQS  2012.XLS]Super Stock'!$A10 -> 4 | J6: ='[POINTS NQS  2012.XLS]Super Stock'!$B10 -> David Gawatz | K6: ='[POINTS NQS  2012.XLS]Super Stock'!$C10 -> St. Joseph, MO | L6: ='[POINTS NQS  2012.XLS]Super Stock'!$D10 -> JW | M6: ='[POINTS NQS  2012.XLS]Super Stock'!$E10 -> 184 | N6: =IF('[POINTS NQS  2012.XLS]Super Stock'!$F10=0," ",'[POINTS NQS  2012.XLS]Super Stock'!$F10) -> Low Hung Buck | O6: ='[POINTS NQS  2012.XLS]Super Stock'!$AA10 -> 11
A7: ='[POINTS NQS  2012.XLS]Pro Stock'!$A11 -> 5 | B7: ='[POINTS NQS  2012.XLS]Pro Stock'!$B11 -> Kelly Nichols | C7: ='[POINTS NQS  2012.XLS]Pro Stock'!$C11 -> Lore City, Oh | D7: ='[POINTS NQS  2012.XLS]Pro Stock'!$D11 -> NP | E7: ='[POINTS NQS  2012.XLS]Pro Stock'!$E11 -> 70 | F7: =IF('[POINTS NQS  2012.XLS]Pro Stock'!$F11=0," ",'[POINTS NQS  2012.XLS]Pro Stock'!$F11) -> Wild One 2 | G7: ='[POINTS NQS  2012.XLS]Pro Stock'!$AA11 -> 12 | I7: ='[POINTS NQS  2012.XLS]Super Stock'!$A11 -> 5 | J7: ='[POINTS NQS  2012.XLS]Super Stock'!$B11 -> Drew Burton | K7: ='[POINTS NQS  2012.XLS]Super Stock'!$C11 -> Brookston, IN | L7: ='[POINTS NQS  2012.XLS]Super Stock'!$D11 -> NP | M7: ='[POINTS NQS  2012.XLS]Super Stock'!$E11 -> 14 | N7: =IF('[POINTS NQS  2012.XLS]Super Stock'!$F11=0," ",'[POINTS NQS  2012.XLS]Super Stock'!$F11) -> Bad Company | O7: ='[POINTS NQS  2012.XLS]Super Stock'!$AA11 -> 18
A8: ='[POINTS NQS  2012.XLS]Pro Stock'!$A12 -> 6 | B8: ='[POINTS NQS  2012.XLS]Pro Stock'!$B12 -> Tyler Hackman | C8: ='[POINTS NQS  2012.XLS]Pro Stock'!$C12 -> Seymour, Ind | D8: ='[POINTS NQS  2012.XLS]Pro Stock'!$D12 -> Hackman | E8: ='[POINTS NQS  2012.XLS]Pro Stock'!$E12 -> 504 | F8: =IF('[POINTS NQS  2012.XLS]Pro Stock'!$F12=0," ",'[POINTS NQS  2012.XLS]Pro Stock'!$F12) -> Green | G8: ='[POINTS NQS  2012.XLS]Pro Stock'!$AA12 -> 16 | I8: ='[POINTS NQS  2012.XLS]Super Stock'!$A12 -> 6 | J8: ='[POINTS NQS  2012.XLS]Super Stock'!$B12 -> Larry Curtsinger | K8: ='[POINTS NQS  2012.XLS]Super Stock'!$C12 -> Carlilse, KY | L8: ='[POINTS NQS  2012.XLS]Super Stock'!$D12 -> NP | M8: ='[POINTS NQS  2012.XLS]Super Stock'!$E12 -> 9 | N8: =IF('[POINTS NQS  2012.XLS]Super Stock'!$F12=0," ",'[POINTS NQS  2012.XLS]Super Stock'!$F12) -> Runaway Deere | O8: ='[POINTS NQS  2012.XLS]Super Stock'!$AA12 -> 19
A9: ='[POINTS NQS  2012.XLS]Pro Stock'!$A13 -> 7 | B9: ='[POINTS NQS  2012.XLS]Pro Stock'!$B13 -> Larry Fox | C9: ='[POINTS NQS  2012.XLS]Pro Stock'!$C13 -> Reynoldsburg, Oh | D9: ='[POINTS NQS  2012.XLS]Pro Stock'!$D13 -> JRS | E9: ='[POINTS NQS  2012.XLS]Pro Stock'!$E13 -> 7 | F9: =IF('[POINTS NQS  2012.XLS]Pro Stock'!$F13=0," ",'[POINTS NQS  2012.XLS]Pro Stock'!$F13) -> Intimidation | G9: ='[POINTS NQS  2012.XLS]Pro Stock'!$AA13 -> 21 | I9: ='[POINTS NQS  2012.XLS]Super Stock'!$A13 -> 7 | J9: ='[POINTS NQS  2012.XLS]Super Stock'!$B13 -> Kelly Nichols | K9: ='[POINTS NQS  2012.XLS]Super Stock'!$C13 -> Lore City, OH | L9: ='[POINTS NQS  2012.XLS]Super Stock'!$D13 -> NP | M9: ='[POINTS NQS  2012.XLS]Super Stock'!$E13 -> 70 | N9: =IF('[POINTS NQS  2012.XLS]Super Stock'!$F13=0," ",'[POINTS NQS  2012.XLS]Super Stock'!$F13) -> Wild One 2 | O9: ='[POINTS NQS  2012.XLS]Super Stock'!$AA13 -> 23
A10: ='[POINTS NQS  2012.XLS]Pro Stock'!$A14 -> 8 | B10: ='[POINTS NQS  2012.XLS]Pro Stock'!$B14 -> Eli Zimmerman | C10: ='[POINTS NQS  2012.XLS]Pro Stock'!$C14 -> Allentown, Pa | D10: ='[POINTS NQS  2012.XLS]Pro Stock'!$D14 -> NP | E10: ='[POINTS NQS  2012.XLS]Pro Stock'!$E14 -> 74 | F10: =IF('[POINTS NQS  2012.XLS]Pro Stock'!$F14=0," ",'[POINTS NQS  2012.XLS]Pro Stock'!$F14) -> Red Fever | G10: ='[POINTS NQS  2012.XLS]Pro Stock'!$AA14 -> 21 | I10: ='[POINTS NQS  2012.XLS]Super Stock'!$A14 -> 8 | J10: ='[POINTS NQS  2012.XLS]Super Stock'!$B14 -> Drew Burton | K10: ='[POINTS NQS  2012.XLS]Super Stock'!$C14 -> Brookston, IN | L10: ='[POINTS NQS  2012.XLS]Super Stock'!$D14 -> NP | M10: ='[POINTS NQS  2012.XLS]Super Stock'!$E14 -> 15 | N10: =IF('[POINTS NQS  2012.XLS]Super Stock'!$F14=0," ",'[POINTS NQS  2012.XLS]Super Stock'!$F14) -> Plain Nuts | O10: ='[POINTS NQS  2012.XLS]Super Stock'!$AA14 -> 25
A11: ='[POINTS NQS  2012.XLS]Pro Stock'!$A15 -> 9 | B11: ='[POINTS NQS  2012.XLS]Pro Stock'!$B15 -> Drew Burton | C11: ='[POINTS NQS  2012.XLS]Pro Stock'!$C15 -> Brookston,Ill | D11: ='[POINTS NQS  2012.XLS]Pro Stock'!$D15 -> NP | E11: ='[POINTS NQS  2012.XLS]Pro Stock'!$E15 -> 14 | F11: =IF('[POINTS NQS  2012.XLS]Pro Stock'!$F15=0," ",'[POINTS NQS  2012.XLS]Pro Stock'!$F15) -> Bad Company | G11: ='[POINTS NQS  2012.XLS]Pro Stock'!$AA15 -> 25 | I11: ='[POINTS NQS  2012.XLS]Super Stock'!$A15 -> 9 | J11: ='[POINTS NQS  2012.XLS]Super Stock'!$B15 -> Jerry Skuta | K11: ='[POINTS NQS  2012.XLS]Super Stock'!$C15 -> Kimball, MI | L11: ='[POINTS NQS  2012.XLS]Super Stock'!$D15 -> NP | M11: ='[POINTS NQS  2012.XLS]Super Stock'!$E15 -> 330 | N11: =IF('[POINTS NQS  2012.XLS]Super Stock'!$F15=0," ",'[POINTS NQS  2012.XLS]Super Stock'!$F15) -> Mental Health 2 | O11: ='[POINTS NQS  2012.XLS]Super Stock'!$AA15 -> 27
A12: ='[POINTS NQS  2012.XLS]Pro Stock'!$A16 -> 10 | B12: ='[POINTS NQS  2012.XLS]Pro Stock'!$B16 -> Greg Curtsinger | C12: ='[POINTS NQS  2012.XLS]Pro Stock'!$C16 -> Carlisle. Ky | D12: ='[POINTS NQS  2012.XLS]Pro Stock'!$D16 -> NP | E12: ='[POINTS NQS  2012.XLS]Pro Stock'!$E16 -> 8 | F12: =IF('[POINTS NQS  2012.XLS]Pro Stock'!$F16=0," ",'[POINTS NQS  2012.XLS]Pro Stock'!$F16) -> Wicked Deere | G12: ='[POINTS NQS  2012.XLS]Pro Stock'!$AA16 -> 27 | I12: ='[POINTS NQS  2012.XLS]Super Stock'!$A16 -> 10 | J12: ='[POINTS NQS  2012.XLS]Super Stock'!$B16 -> Jerry Binkley | K12: ='[POINTS NQS  2012.XLS]Super Stock'!$C16 -> Jefferson City, MO | L12: ='[POINTS NQS  2012.XLS]Super Stock'!$D16 -> MVP | M12: ='[POINTS NQS  2012.XLS]Super Stock'!$E16 -> 92 | N12: =IF('[POINTS NQS  2012.XLS]Super Stock'!$F16=0," ",'[POINTS NQS  2012.XLS]Super Stock'!$F16) -> Grandpa's Toy | O12: ='[POINTS NQS  2012.XLS]Super Stock'!$AA16 -> 28
A13: ='[POINTS NQS  2012.XLS]Pro Stock'!$A17 -> 11 | B13: ='[POINTS NQS  2012.XLS]Pro Stock'!$B17 -> Cody Costa | C13: ='[POINTS NQS  2012.XLS]Pro Stock'!$C17 -> Greencastle,Pa | D13: ='[POINTS NQS  2012.XLS]Pro Stock'!$D17 -> NP | E13: ='[POINTS NQS  2012.XLS]Pro Stock'!$E17 -> 397 | F13: =IF('[POINTS NQS  2012.XLS]Pro Stock'!$F17=0," ",'[POINTS NQS  2012.XLS]Pro Stock'!$F17) -> Crossthreaded | G13: ='[POINTS NQS  2012.XLS]Pro Stock'!$AA17 -> 31 | I13: ='[POINTS NQS  2012.XLS]Super Stock'!$A17 -> 11 | J13: ='[POINTS NQS  2012.XLS]Super Stock'!$B17 -> Mike Aschliman | K13: ='[POINTS NQS  2012.XLS]Super Stock'!$C17 -> Ridgeway, WI | L13: ='[POINTS NQS  2012.XLS]Super Stock'!$D17 -> MVP | M13: ='[POINTS NQS  2012.XLS]Super Stock'!$E17 -> 511 | N13: =IF('[POINTS NQS  2012.XLS]Super Stock'!$F17=0," ",'[POINTS NQS  2012.XLS]Super Stock'!$F17) -> Brother's Keeper | O13: ='[POINTS NQS  2012.XLS]Super Stock'!$AA17 -> 28
A14: ='[POINTS NQS  2012.XLS]Pro Stock'!$A18 -> 12 | B14: ='[POINTS NQS  2012.XLS]Pro Stock'!$B18 -> John Donavan | C14: ='[POINTS NQS  2012.XLS]Pro Stock'!$C18 -> Pataskala, Oh | D14: ='[POINTS NQS  2012.XLS]Pro Stock'!$D18 -> JRS | E14: ='[POINTS NQS  2012.XLS]Pro Stock'!$E18 -> 6 | F14: =IF('[POINTS NQS  2012.XLS]Pro Stock'!$F18=0," ",'[POINTS NQS  2012.XLS]Pro Stock'!$F18) -> John's Deere | G14: ='[POINTS NQS  2012.XLS]Pro Stock'!$AA18 -> 36 | I14: ='[POINTS NQS  2012.XLS]Super Stock'!$A18 -> 12 | J14: ='[POINTS NQS  2012.XLS]Super Stock'!$B18 -> Cody Costa | K14: ='[POINTS NQS  2012.XLS]Super Stock'!$C18 -> Greencastle, PA | L14: ='[POINTS NQS  2012.XLS]Super Stock'!$D18 -> NP | M14: ='[POINTS NQS  2012.XLS]Super Stock'!$E18 -> 397 | N14: =IF('[POINTS NQS  2012.XLS]Super Stock'!$F18=0," ",'[POINTS NQS  2012.XLS]Super Stock'!$F18) -> Crossthreaded | O14: ='[POINTS NQS  2012.XLS]Super Stock'!$AA18 -> 33
A15: ='[POINTS NQS  2012.XLS]Pro Stock'!$A19 -> 13 | B15: ='[POINTS NQS  2012.XLS]Pro Stock'!$B19 -> Steve Williford | C15: ='[POINTS NQS  2012.XLS]Pro Stock'!$C19 -> Englehard, NC | D15: ='[POINTS NQS  2012.XLS]Pro Stock'!$D19 -> MVP | E15: ='[POINTS NQS  2012.XLS]Pro Stock'!$E19 -> 176 | F15: =IF('[POINTS NQS  2012.XLS]Pro Stock'!$F19=0," ",'[POINTS NQS  2012.XLS]Pro Stock'!$F19) -> International | G15: ='[POINTS NQS  2012.XLS]Pro Stock'!$AA19 -> 44 | I15: ='[POINTS NQS  2012.XLS]Super Stock'!$A19 -> 13 | J15: ='[POINTS NQS  2012.XLS]Super Stock'!$B19 -> Scott Bye | K15: ='[POINTS NQS  2012.XLS]Super Stock'!$C19 -> Savannah, MO | L15: ='[POINTS NQS  2012.XLS]Super Stock'!$D19 -> NP | M15: ='[POINTS NQS  2012.XLS]Super Stock'!$E19 -> 365 | N15: =IF('[POINTS NQS  2012.XLS]Super Stock'!$F19=0," ",'[POINTS NQS  2012.XLS]Super Stock'!$F19) -> Fired Up | O15: ='[POINTS NQS  2012.XLS]Super Stock'!$AA19 -> 34
A16: ='[POINTS NQS  2012.XLS]Pro Stock'!$A20 -> 14 | B16: ='[POINTS NQS  2012.XLS]Pro Stock'!$B20 -> Scott Bye | C16: ='[POINTS NQS  2012.XLS]Pro Stock'!$C20 -> Savannah, Mo | D16: ='[POINTS NQS  2012.XLS]Pro Stock'!$D20 -> NP | E16: ='[POINTS NQS  2012.XLS]Pro Stock'!$E20 -> 365 | F16: =IF('[POINTS NQS  2012.XLS]Pro Stock'!$F20=0," ",'[POINTS NQS  2012.XLS]Pro Stock'!$F20) -> Fired Up | G16: ='[POINTS NQS  2012.XLS]Pro Stock'!$AA20 -> 45 | I16: ='[POINTS NQS  2012.XLS]Super Stock'!$A20 -> 14 | J16: ='[POINTS NQS  2012.XLS]Super Stock'!$B20 -> Don Vogt | K16: ='[POINTS NQS  2012.XLS]Super Stock'!$C20 -> Campbellsport, WI | L16: ='[POINTS NQS  2012.XLS]Super Stock'!$D20 -> MVP | M16: ='[POINTS NQS  2012.XLS]Super Stock'!$E20 -> 90 | N16: =IF('[POINTS NQS  2012.XLS]Super Stock'!$F20=0," ",'[POINTS NQS  2012.XLS]Super Stock'!$F20) -> Not A Nuff | O16: ='[POINTS NQS  2012.XLS]Super Stock'!$AA20 -> 35
A17: ='[POINTS NQS  2012.XLS]Pro Stock'!$A21 -> 15 | B17: ='[POINTS NQS  2012.XLS]Pro Stock'!$B21 -> Daryl Musser | C17: ='[POINTS NQS  2012.XLS]Pro Stock'!$C21 -> Greencastle, Pa | D17: ='[POINTS NQS  2012.XLS]Pro Stock'!$D21 -> NP | E17: ='[POINTS NQS  2012.XLS]Pro Stock'!$E21 -> 396 | F17: =IF('[POINTS NQS  2012.XLS]Pro Stock'!$F21=0," ",'[POINTS NQS  2012.XLS]Pro Stock'!$F21) -> 5 Cents | G17: ='[POINTS NQS  2012.XLS]Pro Stock'!$AA21 -> 47 | I17: ='[POINTS NQS  2012.XLS]Super Stock'!$A21 -> 15 | J17: ='[POINTS NQS  2012.XLS]Super Stock'!$B21 -> Steve Williford | K17: ='[POINTS NQS  2012.XLS]Super Stock'!$C21 -> Engelhard, NC | L17: ='[POINTS NQS  2012.XLS]Super Stock'!$D21 -> MVP | M17: ='[POINTS NQS  2012.XLS]Super Stock'!$E21 -> 276 | N17: =IF('[POINTS NQS  2012.XLS]Super Stock'!$F21=0," ",'[POINTS NQS  2012.XLS]Super Stock'!$F21) -> IH Express #1 | O17: ='[POINTS NQS  2012.XLS]Super Stock'!$AA21 -> 49
A18: ='[POINTS NQS  2012.XLS]Pro Stock'!$A22 -> 16 | B18: ='[POINTS NQS  2012.XLS]Pro Stock'!$B22 -> John Innerest | C18: ='[POINTS NQS  2012.XLS]Pro Stock'!$C22 -> Red Lion, Pa | D18: ='[POINTS NQS  2012.XLS]Pro Stock'!$D22 -> NP | E18: ='[POINTS NQS  2012.XLS]Pro Stock'!$E22 -> 252 | F18: =IF('[POINTS NQS  2012.XLS]Pro Stock'!$F22=0," ",'[POINTS NQS  2012.XLS]Pro Stock'!$F22) -> Mean N Nasty | G18: ='[POINTS NQS  2012.XLS]Pro Stock'!$AA22 -> 48 | I18: ='[POINTS NQS  2012.XLS]Super Stock'!$A22 -> 16 | J18: ='[POINTS NQS  2012.XLS]Super Stock'!$B22 -> Steve Williford | K18: ='[POINTS NQS  2012.XLS]Super Stock'!$C22 -> Engelhard, NC | L18: ='[POINTS NQS  2012.XLS]Super Stock'!$D22 -> MVP | M18: ='[POINTS NQS  2012.XLS]Super Stock'!$E22 -> 337 | N18: =IF('[POINTS NQS  2012.XLS]Super Stock'!$F22=0," ",'[POINTS NQS  2012.XLS]Super Stock'!$F22) -> IH Express #2 | O18: ='[POINTS NQS  2012.XLS]Super Stock'!$AA22 -> 52
A19: ='[POINTS NQS  2012.XLS]Pro Stock'!$A23 -> 17 | B19: ='[POINTS NQS  2012.XLS]Pro Stock'!$B23 -> Jerry Skuta | C19: ='[POINTS NQS  2012.XLS]Pro Stock'!$C23 -> Kimball, Mich | D19: ='[POINTS NQS  2012.XLS]Pro Stock'!$D23 -> NP | E19: ='[POINTS NQS  2012.XLS]Pro Stock'!$E23 -> 330 | F19: =IF('[POINTS NQS  2012.XLS]Pro Stock'!$F23=0," ",'[POINTS NQS  2012.XLS]Pro Stock'!$F23) -> Mental Health | G19: ='[POINTS NQS  2012.XLS]Pro Stock'!$AA23 -> 48 | I19: ='[POINTS NQS  2012.XLS]Super Stock'!$A23 -> 17 | J19: ='[POINTS NQS  2012.XLS]Super Stock'!$B23 -> Larry Fox | K19: ='[POINTS NQS  2012.XLS]Super Stock'!$C23 -> Etna, OH | L19: ='[POINTS NQS  2012.XLS]Super Stock'!$D23 -> JRS | M19: ='[POINTS NQS  2012.XLS]Super Stock'!$E23 -> 7 | N19: =IF('[POINTS NQS  2012.XLS]Super Stock'!$F23=0," ",'[POINTS NQS  2012.XLS]Super Stock'!$F23) -> Intimidation | O19: ='[POINTS NQS  2012.XLS]Super Stock'!$AA23 -> 53
A20: ='[POINTS NQS  2012.XLS]Pro Stock'!$A24 -> 18 | B20: ='[POINTS NQS  2012.XLS]Pro Stock'!$B24 -> Steve Williford | C20: ='[POINTS NQS  2012.XLS]Pro Stock'!$C24 -> Englehard, NC | D20: ='[POINTS NQS  2012.XLS]Pro Stock'!$D24 -> MVP | E20: ='[POINTS NQS  2012.XLS]Pro Stock'!$E24 -> 337 | F20: =IF('[POINTS NQS  2012.XLS]Pro Stock'!$F24=0," ",'[POINTS NQS  2012.XLS]Pro Stock'!$F24) -> IH Express 2 | G20: ='[POINTS NQS  2012.XLS]Pro Stock'!$AA24 -> 50 | I20: ='[POINTS NQS  2012.XLS]Super Stock'!$A24 -> 18 | J20: ='[POINTS NQS  2012.XLS]Super Stock'!$B24 -> Eli Zimmerman | K20: ='[POINTS NQS  2012.XLS]Super Stock'!$C24 -> Allentown, PA | L20: ='[POINTS NQS  2012.XLS]Super Stock'!$D24 -> NP | M20: ='[POINTS NQS  2012.XLS]Super Stock'!$E24 -> 74 | N20: =IF('[POINTS NQS  2012.XLS]Super Stock'!$F24=0," ",'[POINTS NQS  2012.XLS]Super Stock'!$F24) -> Red Fever | O20: ='[POINTS NQS  2012.XLS]Super Stock'!$AA24 -> 56
A21: ='[POINTS NQS  2012.XLS]Pro Stock'!$A25 -> 19 | B21: ='[POINTS NQS  2012.XLS]Pro Stock'!$B25 -> Steve Williford | C21: ='[POINTS NQS  2012.XLS]Pro Stock'!$C25 -> Englehard, NC | D21: ='[POINTS NQS  2012.XLS]Pro Stock'!$D25 -> MVP | E21: ='[POINTS NQS  2012.XLS]Pro Stock'!$E25 -> 177 | F21: =IF('[POINTS NQS  2012.XLS]Pro Stock'!$F25=0," ",'[POINTS NQS  2012.XLS]Pro Stock'!$F25) -> Williford Trucking IH | G21: ='[POINTS NQS  2012.XLS]Pro Stock'!$AA25 -> 52 | I21: ='[POINTS NQS  2012.XLS]Super Stock'!$A25 -> 19 | J21: ='[POINTS NQS  2012.XLS]Super Stock'!$B25 -> Steve Chrisman | K21: ='[POINTS NQS  2012.XLS]Super Stock'!$C25 -> Edinburgh, IN | L21: ='[POINTS NQS  2012.XLS]Super Stock'!$D25 -> Hackman | M21: ='[POINTS NQS  2012.XLS]Super Stock'!$E25 -> 26 | N21: =IF('[POINTS NQS  2012.XLS]Super Stock'!$F25=0," ",'[POINTS NQS  2012.XLS]Super Stock'!$F25) -> JD 330 | O21: ='[POINTS NQS  2012.XLS]Super Stock'!$AA25 -> 58
A22: ='[POINTS NQS  2012.XLS]Pro Stock'!$A26 -> 20 | B22: ='[POINTS NQS  2012.XLS]Pro Stock'!$B26 -> David Gawatz | C22: ='[POINTS NQS  2012.XLS]Pro Stock'!$C26 -> St Joseph, Mo | D22: ='[POINTS NQS  2012.XLS]Pro Stock'!$D26 -> JW | E22: ='[POINTS NQS  2012.XLS]Pro Stock'!$E26 -> 184 | F22: =IF('[POINTS NQS  2012.XLS]Pro Stock'!$F26=0," ",'[POINTS NQS  2012.XLS]Pro Stock'!$F26) -> Low Hung Buck | G22: ='[POINTS NQS  2012.XLS]Pro Stock'!$AA26 -> 53 | I22: ='[POINTS NQS  2012.XLS]Super Stock'!$A26 -> 20 | J22: ='[POINTS NQS  2012.XLS]Super Stock'!$B26 -> Steve Williford | K22: ='[POINTS NQS  2012.XLS]Super Stock'!$C26 -> Engelhard, NC | L22: ='[POINTS NQS  2012.XLS]Super Stock'!$D26 -> MVP | M22: ='[POINTS NQS  2012.XLS]Super Stock'!$E26 -> 177 | N22: =IF('[POINTS NQS  2012.XLS]Super Stock'!$F26=0," ",'[POINTS NQS  2012.XLS]Super Stock'!$F26) -> Williford Trucking IH | O22: ='[POINTS NQS  2012.XLS]Super Stock'!$AA26 -> 58
A23: ='[POINTS NQS  2012.XLS]Pro Stock'!$A27 -> 21 | B23: ='[POINTS NQS  2012.XLS]Pro Stock'!$B27 -> Ray Gentz | C23: ='[POINTS NQS  2012.XLS]Pro Stock'!$C27 -> Colon, Mich | D23: ='[POINTS NQS  2012.XLS]Pro Stock'!$D27 -> JRS | E23: ='[POINTS NQS  2012.XLS]Pro Stock'!$E27 -> 262 | F23: =IF('[POINTS NQS  2012.XLS]Pro Stock'!$F27=0," ",'[POINTS NQS  2012.XLS]Pro Stock'!$F27) -> Chaos | G23: ='[POINTS NQS  2012.XLS]Pro Stock'!$AA27 -> 53 | I23: ='[POINTS NQS  2012.XLS]Super Stock'!$A27 -> 21 | J23: ='[POINTS NQS  2012.XLS]Super Stock'!$B27 -> Daryl Musser | K23: ='[POINTS NQS  2012.XLS]Super Stock'!$C27 -> Greencastle, PA | L23: ='[POINTS NQS  2012.XLS]Super Stock'!$D27 -> NP | M23: ='[POINTS NQS  2012.XLS]Super Stock'!$E27 -> 396 | N23: =IF('[POINTS NQS  2012.XLS]Super Stock'!$F27=0," ",'[POINTS NQS  2012.XLS]Super Stock'!$F27) -> 5 Cents | O23: ='[POINTS NQS  2012.XLS]Super Stock'!$AA27 -> 58
A24: ='[POINTS NQS  2012.XLS]Pro Stock'!$A28 -> 22 | B24: ='[POINTS NQS  2012.XLS]Pro Stock'!$B28 -> Tyler Hackman | C24: ='[POINTS NQS  2012.XLS]Pro Stock'!$C28 -> Seymour, Ind | D24: ='[POINTS NQS  2012.XLS]Pro Stock'!$D28 -> Hackman | E24: ='[POINTS NQS  2012.XLS]Pro Stock'!$E28 -> 507 | F24: =IF('[POINTS NQS  2012.XLS]Pro Stock'!$F28=0," ",'[POINTS NQS  2012.XLS]Pro Stock'!$F28) -> Mad Hatter | G24: ='[POINTS NQS  2012.XLS]Pro Stock'!$AA28 -> 53 | I24: ='[POINTS NQS  2012.XLS]Super Stock'!$A28 -> 22 | J24: ='[POINTS NQS  2012.XLS]Super Stock'!$B28 -> Randy Demers | K24: ='[POINTS NQS  2012.XLS]Super Stock'!$C28 -> Columbia, NJ | L24: ='[POINTS NQS  2012.XLS]Super Stock'!$D28 -> NP | M24: ='[POINTS NQS  2012.XLS]Super Stock'!$E28 -> 85 | N24: =IF('[POINTS NQS  2012.XLS]Super Stock'!$F28=0," ",'[POINTS NQS  2012.XLS]Super Stock'!$F28) -> Widowmaker | O24: ='[POINTS NQS  2012.XLS]Super Stock'!$AA28 -> 59
A25: ='[POINTS NQS  2012.XLS]Pro Stock'!$A29 -> 23 | B25: ='[POINTS NQS  2012.XLS]Pro Stock'!$B29 -> Alex Naffe | C25: ='[POINTS NQS  2012.XLS]Pro Stock'!$C29 -> Edinburg, Ind | D25: ='[POINTS NQS  2012.XLS]Pro Stock'!$D29 -> Hackman | E25: ='[POINTS NQS  2012.XLS]Pro Stock'!$E29 -> 218 | F25: =IF('[POINTS NQS  2012.XLS]Pro Stock'!$F29=0," ",'[POINTS NQS  2012.XLS]Pro Stock'!$F29) -> Game On | G25: ='[POINTS NQS  2012.XLS]Pro Stock'!$AA29 -> 54 | I25: ='[POINTS NQS  2012.XLS]Super Stock'!$A29 -> 23 | J25: ='[POINTS NQS  2012.XLS]Super Stock'!$B29 -> Alex Naffe | K25: ='[POINTS NQS  2012.XLS]Super Stock'!$C29 -> Seymour, IN | L25: ='[POINTS NQS  2012.XLS]Super Stock'!$D29 -> Hackman | M25: ='[POINTS NQS  2012.XLS]Super Stock'!$E29 -> 218 | N25: =IF('[POINTS NQS  2012.XLS]Super Stock'!$F29=0," ",'[POINTS NQS  2012.XLS]Super Stock'!$F29) -> Game On Purple | O25: ='[POINTS NQS  2012.XLS]Super Stock'!$AA29 -> 62
A26: ='[POINTS NQS  2012.XLS]Pro Stock'!$A30 -> 24 | B26: ='[POINTS NQS  2012.XLS]Pro Stock'!$B30 -> Randy Demers | C26: ='[POINTS NQS  2012.XLS]Pro Stock'!$C30 -> Columbia, NJ | D26: ='[POINTS NQS  2012.XLS]Pro Stock'!$D30 -> NP | E26: ='[POINTS NQS  2012.XLS]Pro Stock'!$E30 -> 85 | F26: =IF('[POINTS NQS  2012.XLS]Pro Stock'!$F30=0," ",'[POINTS NQS  2012.XLS]Pro Stock'!$F30) -> Widowmaker | G26: ='[POINTS NQS  2012.XLS]Pro Stock'!$AA30 -> 55 | I26: ='[POINTS NQS  2012.XLS]Super Stock'!$A30 -> 24 | J26: ='[POINTS NQS  2012.XLS]Super Stock'!$B30 -> Elaine Fisher | K26: ='[POINTS NQS  2012.XLS]Super Stock'!$C30 -> Waterford, OH | L26: ='[POINTS NQS  2012.XLS]Super Stock'!$D30 -> VM | M26: ='[POINTS NQS  2012.XLS]Super Stock'!$E30 -> 80 | N26: =IF('[POINTS NQS  2012.XLS]Super Stock'!$F30=0," ",'[POINTS NQS  2012.XLS]Super Stock'!$F30) -> Blue Thunder | O26: ='[POINTS NQS  2012.XLS]Super Stock'!$AA30 -> 66
A27: ='[POINTS NQS  2012.XLS]Pro Stock'!$A31 -> 25 | B27: ='[POINTS NQS  2012.XLS]Pro Stock'!$B31 -> Ed Nichols | C27: ='[POINTS NQS  2012.XLS]Pro Stock'!$C31 -> Salvisa, Ky | D27: ='[POINTS NQS  2012.XLS]Pro Stock'!$D31 -> LR | E27: ='[POINTS NQS  2012.XLS]Pro Stock'!$E31 -> 124 | F27: =IF('[POINTS NQS  2012.XLS]Pro Stock'!$F31=0," ",'[POINTS NQS  2012.XLS]Pro Stock'!$F31) -> Track Attack | G27: ='[POINTS NQS  2012.XLS]Pro Stock'!$AA31 -> 55 | I27: ='[POINTS NQS  2012.XLS]Super Stock'!$A31 -> 25 | J27: ='[POINTS NQS  2012.XLS]Super Stock'!$B31 -> Tyler Hackman | K27: ='[POINTS NQS  2012.XLS]Super Stock'!$C31 -> Seymour, IN | L27: ='[POINTS NQS  2012.XLS]Super Stock'!$D31 -> Hackman | M27: ='[POINTS NQS  2012.XLS]Super Stock'!$E31 -> 507 | N27: =IF('[POINTS NQS  2012.XLS]Super Stock'!$F31=0," ",'[POINTS NQS  2012.XLS]Super Stock'!$F31) -> Mad Hatter | O27: ='[POINTS NQS  2012.XLS]Super Stock'!$AA31 -> 67
A28: ='[POINTS NQS  2012.XLS]Pro Stock'!$A32 -> 26 | B28: ='[POINTS NQS  2012.XLS]Pro Stock'!$B32 -> Greg Watson | C28: ='[POINTS NQS  2012.XLS]Pro Stock'!$C32 -> Batavia, OH | D28: ='[POINTS NQS  2012.XLS]Pro Stock'!$D32 -> LR | E28: ='[POINTS NQS  2012.XLS]Pro Stock'!$E32 -> 79 | F28: =IF('[POINTS NQS  2012.XLS]Pro Stock'!$F32=0," ",'[POINTS NQS  2012.XLS]Pro Stock'!$F32) -> Bearly Legal | G28: ='[POINTS NQS  2012.XLS]Pro Stock'!$AA32 -> 55 | I28: ='[POINTS NQS  2012.XLS]Super Stock'!$A32 -> 26 | J28: ='[POINTS NQS  2012.XLS]Super Stock'!$B32 -> Steve Williford | K28: ='[POINTS NQS  2012.XLS]Super Stock'!$C32 -> Engelhard, NC | L28: ='[POINTS NQS  2012.XLS]Super Stock'!$D32 -> MVP | M28: ='[POINTS NQS  2012.XLS]Super Stock'!$E32 -> 176 | N28: =IF('[POINTS NQS  2012.XLS]Super Stock'!$F32=0," ",'[POINTS NQS  2012.XLS]Super Stock'!$F32) -> International | O28: ='[POINTS NQS  2012.XLS]Super Stock'!$AA32 -> 68
A29: ='[POINTS NQS  2012.XLS]Pro Stock'!$A33 -> 27 | B29: ='[POINTS NQS  2012.XLS]Pro Stock'!$B33 -> Nathan Nichols | C29: ='[POINTS NQS  2012.XLS]Pro Stock'!$C33 -> Lawrenceburg, Ky | D29: ='[POINTS NQS  2012.XLS]Pro Stock'!$D33 -> LR | E29: ='[POINTS NQS  2012.XLS]Pro Stock'!$E33 -> 151 | F29: =IF('[POINTS NQS  2012.XLS]Pro Stock'!$F33=0," ",'[POINTS NQS  2012.XLS]Pro Stock'!$F33) -> Wild Streak | G29: ='[POINTS NQS  2012.XLS]Pro Stock'!$AA33 -> 58 | I29: ='[POINTS NQS  2012.XLS]Super Stock'!$A33 -> 27 | J29: ='[POINTS NQS  2012.XLS]Super Stock'!$B33 -> Ray Gentz | K29: ='[POINTS NQS  2012.XLS]Super Stock'!$C33 -> Colon, MI | L29: ='[POINTS NQS  2012.XLS]Super Stock'!$D33 -> VM | M29: ='[POINTS NQS  2012.XLS]Super Stock'!$E33 -> 34 | N29: =IF('[POINTS NQS  2012.XLS]Super Stock'!$F33=0," ",'[POINTS NQS  2012.XLS]Super Stock'!$F33) ->  | O29: ='[POINTS NQS  2012.XLS]Super Stock'!$AA33 -> 77
A30: ='[POINTS NQS  2012.XLS]Pro Stock'!$A34 -> 28 | B30: ='[POINTS NQS  2012.XLS]Pro Stock'!$B34 -> Larry Curtsinger | C30: ='[POINTS NQS  2012.XLS]Pro Stock'!$C34 -> Carlisle, KY | D30: ='[POINTS NQS  2012.XLS]Pro Stock'!$D34 -> NP | E30: ='[POINTS NQS  2012.XLS]Pro Stock'!$E34 -> 9 | F30: =IF('[POINTS NQS  2012.XLS]Pro Stock'!$F34=0," ",'[POINTS NQS  2012.XLS]Pro Stock'!$F34) -> Runaway Deere | G30: ='[POINTS NQS  2012.XLS]Pro Stock'!$AA34 -> 64 | I30: ='[POINTS NQS  2012.XLS]Super Stock'!$A34 -> 28 | J30: ='[POINTS NQS  2012.XLS]Super Stock'!$B34 -> Steve Chrisman | K30: ='[POINTS NQS  2012.XLS]Super Stock'!$C34 -> Edinburgh, IN | L30: ='[POINTS NQS  2012.XLS]Super Stock'!$D34 -> Hackman | M30: ='[POINTS NQS  2012.XLS]Super Stock'!$E34 -> 23 | N30: =IF('[POINTS NQS  2012.XLS]Super Stock'!$F34=0," ",'[POINTS NQS  2012.XLS]Super Stock'!$F34) -> Royal Pain | O30: ='[POINTS NQS  2012.XLS]Super Stock'!$AA34 -> 78
A31: ='[POINTS NQS  2012.XLS]Pro Stock'!$A35 -> 29 | B31: ='[POINTS NQS  2012.XLS]Pro Stock'!$B35 -> Logan Cessna | C31: ='[POINTS NQS  2012.XLS]Pro Stock'!$C35 -> Chambersburg, Pa | D31: ='[POINTS NQS  2012.XLS]Pro Stock'!$D35 -> NP | E31: ='[POINTS NQS  2012.XLS]Pro Stock'!$E35 -> 389 | F31: =IF('[POINTS NQS  2012.XLS]Pro Stock'!$F35=0," ",'[POINTS NQS  2012.XLS]Pro Stock'!$F35) -> Adrenaline | G31: ='[POINTS NQS  2012.XLS]Pro Stock'!$AA35 -> 67 | I31: ='[POINTS NQS  2012.XLS]Super Stock'!$A35 -> 29 | J31: ='[POINTS NQS  2012.XLS]Super Stock'!$B35 -> David Knapp | K31: ='[POINTS NQS  2012.XLS]Super Stock'!$C35 -> Hennepin, IL | L31: ='[POINTS NQS  2012.XLS]Super Stock'!$D35 -> MVP | M31: ='[POINTS NQS  2012.XLS]Super Stock'!$E35 -> 381 | N31: =IF('[POINTS NQS  2012.XLS]Super Stock'!$F35=0," ",'[POINTS NQS  2012.XLS]Super Stock'!$F35) -> Knapp Time | O31: ='[POINTS NQS  2012.XLS]Super Stock'!$AA35 -> 78
A32: ='[POINTS NQS  2012.XLS]Pro Stock'!$A36 -> 30 | B32: ='[POINTS NQS  2012.XLS]Pro Stock'!$B36 -> Mike Aschliman | C32: ='[POINTS NQS  2012.XLS]Pro Stock'!$C36 -> Bridgeway, Wisc | D32: ='[POINTS NQS  2012.XLS]Pro Stock'!$D36 -> MVP | E32: ='[POINTS NQS  2012.XLS]Pro Stock'!$E36 -> 511 | F32: =IF('[POINTS NQS  2012.XLS]Pro Stock'!$F36=0," ",'[POINTS NQS  2012.XLS]Pro Stock'!$F36) -> Brother's Keeper | G32: ='[POINTS NQS  2012.XLS]Pro Stock'!$AA36 -> 68 | I32: ='[POINTS NQS  2012.XLS]Super Stock'!$A36 -> 30 | J32: ='[POINTS NQS  2012.XLS]Super Stock'!$B36 -> Doug Diehl | K32: ='[POINTS NQS  2012.XLS]Super Stock'!$C36 -> Smithsburg, PA | L32: ='[POINTS NQS  2012.XLS]Super Stock'!$D36 -> NP | M32: ='[POINTS NQS  2012.XLS]Super Stock'!$E36 -> 441 | N32: =IF('[POINTS NQS  2012.XLS]Super Stock'!$F36=0," ",'[POINTS NQS  2012.XLS]Super Stock'!$F36) -> Excedrin | O32: ='[POINTS NQS  2012.XLS]Super Stock'!$AA36 -> 79
A33: ='[POINTS NQS  2012.XLS]Pro Stock'!$A37 -> 31 | B33: ='[POINTS NQS  2012.XLS]Pro Stock'!$B37 -> Matt Kaster | C33: ='[POINTS NQS  2012.XLS]Pro Stock'!$C37 -> Burlington, Wisc | D33: ='[POINTS NQS  2012.XLS]Pro Stock'!$D37 -> MVP | E33: ='[POINTS NQS  2012.XLS]Pro Stock'!$E37 -> 98 | F33: =IF('[POINTS NQS  2012.XLS]Pro Stock'!$F37=0," ",'[POINTS NQS  2012.XLS]Pro Stock'!$F37) -> Moose | G33: ='[POINTS NQS  2012.XLS]Pro Stock'!$AA37 -> 69 | I33: ='[POINTS NQS  2012.XLS]Super Stock'!$A37 -> 31 | J33: ='[POINTS NQS  2012.XLS]Super Stock'!$B37 -> Jake Gingerich | K33: ='[POINTS NQS  2012.XLS]Super Stock'!$C37 -> Montgomery, Ind | L33: ='[POINTS NQS  2012.XLS]Super Stock'!$D37 -> JW | M33: ='[POINTS NQS  2012.XLS]Super Stock'!$E37 -> 18 | N33: =IF('[POINTS NQS  2012.XLS]Super Stock'!$F37=0," ",'[POINTS NQS  2012.XLS]Super Stock'!$F37) -> Thumper | O33: ='[POINTS NQS  2012.XLS]Super Stock'!$AA37 -> 82
A34: ='[POINTS NQS  2012.XLS]Pro Stock'!$A38 -> 32 | B34: ='[POINTS NQS  2012.XLS]Pro Stock'!$B38 -> Todd Hammond | C34: ='[POINTS NQS  2012.XLS]Pro Stock'!$C38 -> Fallng Waters, WV | D34: ='[POINTS NQS  2012.XLS]Pro Stock'!$D38 -> JRS | E34: ='[POINTS NQS  2012.XLS]Pro Stock'!$E38 -> 301 | F34: =IF('[POINTS NQS  2012.XLS]Pro Stock'!$F38=0," ",'[POINTS NQS  2012.XLS]Pro Stock'!$F38) -> Punisher | G34: ='[POINTS NQS  2012.XLS]Pro Stock'!$AA38 -> 70 | I34: ='[POINTS NQS  2012.XLS]Super Stock'!$A38 -> 32 | J34: ='[POINTS NQS  2012.XLS]Super Stock'!$B38 -> Harrison Stahl | K34: ='[POINTS NQS  2012.XLS]Super Stock'!$C38 -> Dewitt, IA | L34: ='[POINTS NQS  2012.XLS]Super Stock'!$D38 -> MVP | M34: ='[POINTS NQS  2012.XLS]Super Stock'!$E38 -> 336 | N34: =IF('[POINTS NQS  2012.XLS]Super Stock'!$F38=0," ",'[POINTS NQS  2012.XLS]Super Stock'!$F38) -> MWSC # 4 | O34: ='[POINTS NQS  2012.XLS]Super Stock'!$AA38 -> 82
A35: ='[POINTS NQS  2012.XLS]Pro Stock'!$A39 -> 33 | B35: ='[POINTS NQS  2012.XLS]Pro Stock'!$B39 -> Harrison Stahl | C35: ='[POINTS NQS  2012.XLS]Pro Stock'!$C39 -> Welton, IA | D35: ='[POINTS NQS  2012.XLS]Pro Stock'!$D39 -> MVP | E35: ='[POINTS NQS  2012.XLS]Pro Stock'!$E39 -> 335 | F35: =IF('[POINTS NQS  2012.XLS]Pro Stock'!$F39=0," ",'[POINTS NQS  2012.XLS]Pro Stock'!$F39) -> MWSC #3 | G35: ='[POINTS NQS  2012.XLS]Pro Stock'!$AA39 -> 73 | I35: ='[POINTS NQS  2012.XLS]Super Stock'!$A39 -> 33 | J35: ='[POINTS NQS  2012.XLS]Super Stock'!$B39 -> Jake Gingerich | K35: ='[POINTS NQS  2012.XLS]Super Stock'!$C39 -> Montgomery, Ind | L35: ='[POINTS NQS  2012.XLS]Super Stock'!$D39 -> JW | M35: ='[POINTS NQS  2012.XLS]Super Stock'!$E39 -> 28 | N35: =IF('[POINTS NQS  2012.XLS]Super Stock'!$F39=0," ",'[POINTS NQS  2012.XLS]Super Stock'!$F39) -> Silver Fox | O35: ='[POINTS NQS  2012.XLS]Super Stock'!$AA39 -> 86
A36: ='[POINTS NQS  2012.XLS]Pro Stock'!$A40 -> 34 | B36: ='[POINTS NQS  2012.XLS]Pro Stock'!$B40 -> Todd Hammond | C36: ='[POINTS NQS  2012.XLS]Pro Stock'!$C40 -> Fallng Waters, WV | D36: ='[POINTS NQS  2012.XLS]Pro Stock'!$D40 -> JRS | E36: ='[POINTS NQS  2012.XLS]Pro Stock'!$E40 -> 241 | F36: =IF('[POINTS NQS  2012.XLS]Pro Stock'!$F40=0," ",'[POINTS NQS  2012.XLS]Pro Stock'!$F40) -> Problem Child | G36: ='[POINTS NQS  2012.XLS]Pro Stock'!$AA40 -> 76 | I36: ='[POINTS NQS  2012.XLS]Super Stock'!$A40 -> 34 | J36: ='[POINTS NQS  2012.XLS]Super Stock'!$B40 -> Brian Titzer | K36: ='[POINTS NQS  2012.XLS]Super Stock'!$C40 -> Evansville, IN | L36: ='[POINTS NQS  2012.XLS]Super Stock'!$D40 -> TC | M36: ='[POINTS NQS  2012.XLS]Super Stock'!$E40 -> 364 | N36: =IF('[POINTS NQS  2012.XLS]Super Stock'!$F40=0," ",'[POINTS NQS  2012.XLS]Super Stock'!$F40) -> Single Boys Toy | O36: ='[POINTS NQS  2012.XLS]Super Stock'!$AA40 -> 88
A37: ='[POINTS NQS  2012.XLS]Pro Stock'!$A41 -> 35 | B37: ='[POINTS NQS  2012.XLS]Pro Stock'!$B41 -> Jerry Binkley | C37: ='[POINTS NQS  2012.XLS]Pro Stock'!$C41 -> Jefferson City, Mo | D37: ='[POINTS NQS  2012.XLS]Pro Stock'!$D41 -> MVP | E37: ='[POINTS NQS  2012.XLS]Pro Stock'!$E41 -> 92 | F37: =IF('[POINTS NQS  2012.XLS]Pro Stock'!$F41=0," ",'[POINTS NQS  2012.XLS]Pro Stock'!$F41) -> Grandpa's Toy | G37: ='[POINTS NQS  2012.XLS]Pro Stock'!$AA41 -> 79 | I37: ='[POINTS NQS  2012.XLS]Super Stock'!$A41 -> 35 | J37: ='[POINTS NQS  2012.XLS]Super Stock'!$B41 -> Ron Marcine | K37: ='[POINTS NQS  2012.XLS]Super Stock'!$C41 -> Whitehouse Station, NJ | L37: ='[POINTS NQS  2012.XLS]Super Stock'!$D41 -> MVP | M37: ='[POINTS NQS  2012.XLS]Super Stock'!$E41 -> 245 | N37: =IF('[POINTS NQS  2012.XLS]Super Stock'!$F41=0," ",'[POINTS NQS  2012.XLS]Super Stock'!$F41) -> No Pressure | O37: ='[POINTS NQS  2012.XLS]Super Stock'!$AA41 -> 89
A38: ='[POINTS NQS  2012.XLS]Pro Stock'!$A42 -> 36 | B38: ='[POINTS NQS  2012.XLS]Pro Stock'!$B42 -> Julian Stahl | C38: ='[POINTS NQS  2012.XLS]Pro Stock'!$C42 -> Welton, IA | D38: ='[POINTS NQS  2012.XLS]Pro Stock'!$D42 -> MVP | E38: ='[POINTS NQS  2012.XLS]Pro Stock'!$E42 -> 1 | F38: =IF('[POINTS NQS  2012.XLS]Pro Stock'!$F42=0," ",'[POINTS NQS  2012.XLS]Pro Stock'!$F42) -> MWSC # 1 | G38: ='[POINTS NQS  2012.XLS]Pro Stock'!$AA42 -> 84 | I38: ='[POINTS NQS  2012.XLS]Super Stock'!$A42 -> 36 | J38: ='[POINTS NQS  2012.XLS]Super Stock'!$B42 -> John Innerest | K38: ='[POINTS NQS  2012.XLS]Super Stock'!$C42 -> Red Lion, PA | L38: ='[POINTS NQS  2012.XLS]Super Stock'!$D42 -> NP | M38: ='[POINTS NQS  2012.XLS]Super Stock'!$E42 -> 252 | N38: =IF('[POINTS NQS  2012.XLS]Super Stock'!$F42=0," ",'[POINTS NQS  2012.XLS]Super Stock'!$F42) -> Mean N Nasty | O38: ='[POINTS NQS  2012.XLS]Super Stock'!$AA42 -> 91
A39: ='[POINTS NQS  2012.XLS]Pro Stock'!$A43 -> 37 | B39: ='[POINTS NQS  2012.XLS]Pro Stock'!$B43 -> Ron Scroggins | C39: ='[POINTS NQS  2012.XLS]Pro Stock'!$C43 -> Neosho, Mo | D39: ='[POINTS NQS  2012.XLS]Pro Stock'!$D43 -> VM | E39: ='[POINTS NQS  2012.XLS]Pro Stock'!$E43 -> 110 | F39: =IF('[POINTS NQS  2012.XLS]Pro Stock'!$F43=0," ",'[POINTS NQS  2012.XLS]Pro Stock'!$F43) -> Dirt Dancer | G39: ='[POINTS NQS  2012.XLS]Pro Stock'!$AA43 -> 85 | I39: ='[POINTS NQS  2012.XLS]Super Stock'!$A43 -> 37 | J39: ='[POINTS NQS  2012.XLS]Super Stock'!$B43 -> Bruce Austin | K39: ='[POINTS NQS  2012.XLS]Super Stock'!$C43 -> St. Charles, IA | L39: ='[POINTS NQS  2012.XLS]Super Stock'!$D43 -> MVP | M39: ='[POINTS NQS  2012.XLS]Super Stock'!$E43 -> 338 | N39: =IF('[POINTS NQS  2012.XLS]Super Stock'!$F43=0," ",'[POINTS NQS  2012.XLS]Super Stock'!$F43) -> Hillbilly Headache | O39: ='[POINTS NQS  2012.XLS]Super Stock'!$AA43 -> 91
A40: ='[POINTS NQS  2012.XLS]Pro Stock'!$A44 -> 38 | B40: ='[POINTS NQS  2012.XLS]Pro Stock'!$B44 -> Ron Marcine | C40: ='[POINTS NQS  2012.XLS]Pro Stock'!$C44 -> Whitehouse Station, NJ | D40: ='[POINTS NQS  2012.XLS]Pro Stock'!$D44 -> JRS | E40: ='[POINTS NQS  2012.XLS]Pro Stock'!$E44 -> 245 | F40: =IF('[POINTS NQS  2012.XLS]Pro Stock'!$F44=0," ",'[POINTS NQS  2012.XLS]Pro Stock'!$F44) -> No Pressure | G40: ='[POINTS NQS  2012.XLS]Pro Stock'!$AA44 -> 87 | I40: ='[POINTS NQS  2012.XLS]Super Stock'!$A44 -> 38 | J40: ='[POINTS NQS  2012.XLS]Super Stock'!$B44 -> Charlie Korff | K40: ='[POINTS NQS  2012.XLS]Super Stock'!$C44 -> Evansville, IN | L40: ='[POINTS NQS  2012.XLS]Super Stock'!$D44 -> TC | M40: ='[POINTS NQS  2012.XLS]Super Stock'!$E44 -> 400 | N40: =IF('[POINTS NQS  2012.XLS]Super Stock'!$F44=0," ",'[POINTS NQS  2012.XLS]Super Stock'!$F44) -> No Fear Deer | O40: ='[POINTS NQS  2012.XLS]Super Stock'!$AA44 -> 92
A41: ='[POINTS NQS  2012.XLS]Pro Stock'!$A45 -> 39 | B41: ='[POINTS NQS  2012.XLS]Pro Stock'!$B45 -> Morgan Cessna | C41: ='[POINTS NQS  2012.XLS]Pro Stock'!$C45 -> Chambersburg, Pa | D41: ='[POINTS NQS  2012.XLS]Pro Stock'!$D45 -> NP | E41: ='[POINTS NQS  2012.XLS]Pro Stock'!$E45 -> 491 | F41: =IF('[POINTS NQS  2012.XLS]Pro Stock'!$F45=0," ",'[POINTS NQS  2012.XLS]Pro Stock'!$F45) -> Built for Business | G41: ='[POINTS NQS  2012.XLS]Pro Stock'!$AA45 -> 87 | I41: ='[POINTS NQS  2012.XLS]Super Stock'!$A45 -> 39 | J41: ='[POINTS NQS  2012.XLS]Super Stock'!$B45 -> Ron Scroggins | K41: ='[POINTS NQS  2012.XLS]Super Stock'!$C45 -> Neosho, MO | L41: ='[POINTS NQS  2012.XLS]Super Stock'!$D45 -> VM | M41: ='[POINTS NQS  2012.XLS]Super Stock'!$E45 -> 111 | N41: =IF('[POINTS NQS  2012.XLS]Super Stock'!$F45=0," ",'[POINTS NQS  2012.XLS]Super Stock'!$F45) -> Black out | O41: ='[POINTS NQS  2012.XLS]Super Stock'!$AA45 -> 93
A42: ='[POINTS NQS  2012.XLS]Pro Stock'!$A46 -> 40 | B42: ='[POINTS NQS  2012.XLS]Pro Stock'!$B46 -> Mike Silco | C42: ='[POINTS NQS  2012.XLS]Pro Stock'!$C46 -> Pittsford, NY | D42: ='[POINTS NQS  2012.XLS]Pro Stock'!$D46 -> LR | E42: ='[POINTS NQS  2012.XLS]Pro Stock'!$E46 -> 547 | F42: =IF('[POINTS NQS  2012.XLS]Pro Stock'!$F46=0," ",'[POINTS NQS  2012.XLS]Pro Stock'!$F46) -> 1466 Alcoholic | G42: ='[POINTS NQS  2012.XLS]Pro Stock'!$AA46 -> 89 | I42: ='[POINTS NQS  2012.XLS]Super Stock'!$A46 -> 40 | J42: ='[POINTS NQS  2012.XLS]Super Stock'!$B46 -> Nathan Nichols | K42: ='[POINTS NQS  2012.XLS]Super Stock'!$C46 -> Lawrenceburg, KY | L42: ='[POINTS NQS  2012.XLS]Super Stock'!$D46 -> LR | M42: ='[POINTS NQS  2012.XLS]Super Stock'!$E46 -> 151 | N42: =IF('[POINTS NQS  2012.XLS]Super Stock'!$F46=0," ",'[POINTS NQS  2012.XLS]Super Stock'!$F46) -> Wildstreak | O42: ='[POINTS NQS  2012.XLS]Super Stock'!$AA46 -> 95
A43: ='[POINTS NQS  2012.XLS]Pro Stock'!$A47 -> 41 | B43: ='[POINTS NQS  2012.XLS]Pro Stock'!$B47 -> Mark Conover | C43: ='[POINTS NQS  2012.XLS]Pro Stock'!$C47 -> Edinburg, Ind | D43: ='[POINTS NQS  2012.XLS]Pro Stock'!$D47 -> VM | E43: ='[POINTS NQS  2012.XLS]Pro Stock'!$E47 -> 360 | F43: =IF('[POINTS NQS  2012.XLS]Pro Stock'!$F47=0," ",'[POINTS NQS  2012.XLS]Pro Stock'!$F47) -> VuDoo Too | G43: ='[POINTS NQS  2012.XLS]Pro Stock'!$AA47 -> 90 | I43: ='[POINTS NQS  2012.XLS]Super Stock'!$A47 -> 41 | J43: ='[POINTS NQS  2012.XLS]Super Stock'!$B47 -> Matt Kaster | K43: ='[POINTS NQS  2012.XLS]Super Stock'!$C47 -> Burlington, WI | L43: ='[POINTS NQS  2012.XLS]Super Stock'!$D47 -> MVP | M43: ='[POINTS NQS  2012.XLS]Super Stock'!$E47 -> 98 | N43: =IF('[POINTS NQS  2012.XLS]Super Stock'!$F47=0," ",'[POINTS NQS  2012.XLS]Super Stock'!$F47) -> Moose on the Loose | O43: ='[POINTS NQS  2012.XLS]Super Stock'!$AA47 -> 96
A44: ='[POINTS NQS  2012.XLS]Pro Stock'!$A48 -> 42 | B44: ='[POINTS NQS  2012.XLS]Pro Stock'!$B48 -> Larry Korff | C44: ='[POINTS NQS  2012.XLS]Pro Stock'!$C48 -> Evansville, Ind | D44: ='[POINTS NQS  2012.XLS]Pro Stock'!$D48 -> TC | E44: ='[POINTS NQS  2012.XLS]Pro Stock'!$E48 -> 398 | F44: =IF('[POINTS NQS  2012.XLS]Pro Stock'!$F48=0," ",'[POINTS NQS  2012.XLS]Pro Stock'!$F48) -> Kryptonite | G44: ='[POINTS NQS  2012.XLS]Pro Stock'!$AA48 -> 90 | I44: ='[POINTS NQS  2012.XLS]Super Stock'!$A48 -> 42 | J44: ='[POINTS NQS  2012.XLS]Super Stock'!$B48 -> Ray Gentz | K44: ='[POINTS NQS  2012.XLS]Super Stock'!$C48 -> Colon, MI | L44: ='[POINTS NQS  2012.XLS]Super Stock'!$D48 -> JRS | M44: ='[POINTS NQS  2012.XLS]Super Stock'!$E48 -> 35 | N44: =IF('[POINTS NQS  2012.XLS]Super Stock'!$F48=0," ",'[POINTS NQS  2012.XLS]Super Stock'!$F48) -> B.U. Cub | O44: ='[POINTS NQS  2012.XLS]Super Stock'!$AA48 -> 97
A45: ='[POINTS NQS  2012.XLS]Pro Stock'!$A49 -> 43 | B45: ='[POINTS NQS  2012.XLS]Pro Stock'!$B49 -> Ron Scroggins | C45: ='[POINTS NQS  2012.XLS]Pro Stock'!$C49 -> Neosho, Mo | D45: ='[POINTS NQS  2012.XLS]Pro Stock'!$D49 -> VM | E45: ='[POINTS NQS  2012.XLS]Pro Stock'!$E49 -> 111 | F45: =IF('[POINTS NQS  2012.XLS]Pro Stock'!$F49=0," ",'[POINTS NQS  2012.XLS]Pro Stock'!$F49) -> Black Out | G45: ='[POINTS NQS  2012.XLS]Pro Stock'!$AA49 -> 91 | I45: ='[POINTS NQS  2012.XLS]Super Stock'!$A49 -> 43 | J45: ='[POINTS NQS  2012.XLS]Super Stock'!$B49 -> Ed Nichols | K45: ='[POINTS NQS  2012.XLS]Super Stock'!$C49 -> Salvisa, KY | L45: ='[POINTS NQS  2012.XLS]Super Stock'!$D49 -> LR | M45: ='[POINTS NQS  2012.XLS]Super Stock'!$E49 -> 124 | N45: =IF('[POINTS NQS  2012.XLS]Super Stock'!$F49=0," ",'[POINTS NQS  2012.XLS]Super Stock'!$F49) -> Track Attack | O45: ='[POINTS NQS  2012.XLS]Super Stock'!$AA49 -> 97
A46: ='[POINTS NQS  2012.XLS]Pro Stock'!$A50 -> 44 | B46: ='[POINTS NQS  2012.XLS]Pro Stock'!$B50 -> David Knapp | C46: ='[POINTS NQS  2012.XLS]Pro Stock'!$C50 -> Putnam, Ill | D46: ='[POINTS NQS  2012.XLS]Pro Stock'!$D50 -> MVP | E46: ='[POINTS NQS  2012.XLS]Pro Stock'!$E50 -> 381 | F46: =IF('[POINTS NQS  2012.XLS]Pro Stock'!$F50=0," ",'[POINTS NQS  2012.XLS]Pro Stock'!$F50) -> Knapp Time | G46: ='[POINTS NQS  2012.XLS]Pro Stock'!$AA50 -> 91 | I46: ='[POINTS NQS  2012.XLS]Super Stock'!$A50 -> 44 | J46: ='[POINTS NQS  2012.XLS]Super Stock'!$B50 -> Mark Davis | K46: ='[POINTS NQS  2012.XLS]Super Stock'!$C50 -> Lower Salem, Oh | L46: ='[POINTS NQS  2012.XLS]Super Stock'!$D50 -> JRS | M46: ='[POINTS NQS  2012.XLS]Super Stock'!$E50 -> 67 | N46: =IF('[POINTS NQS  2012.XLS]Super Stock'!$F50=0," ",'[POINTS NQS  2012.XLS]Super Stock'!$F50) -> No Limits | O46: ='[POINTS NQS  2012.XLS]Super Stock'!$AA50 -> 98
A47: ='[POINTS NQS  2012.XLS]Pro Stock'!$A51 -> 45 | B47: ='[POINTS NQS  2012.XLS]Pro Stock'!$B51 -> Darlene Sample | C47: ='[POINTS NQS  2012.XLS]Pro Stock'!$C51 -> Carrolton, OH | D47: ='[POINTS NQS  2012.XLS]Pro Stock'!$D51 -> LR | E47: ='[POINTS NQS  2012.XLS]Pro Stock'!$E51 -> 498 | F47: =IF('[POINTS NQS  2012.XLS]Pro Stock'!$F51=0," ",'[POINTS NQS  2012.XLS]Pro Stock'!$F51) -> Dr. Doom | G47: ='[POINTS NQS  2012.XLS]Pro Stock'!$AA51 -> 92 | I47: ='[POINTS NQS  2012.XLS]Super Stock'!$A51 -> 45 | J47: ='[POINTS NQS  2012.XLS]Super Stock'!$B51 -> Dan Schell | K47: ='[POINTS NQS  2012.XLS]Super Stock'!$C51 -> Darien, WI | L47: ='[POINTS NQS  2012.XLS]Super Stock'!$D51 -> MVP | M47: ='[POINTS NQS  2012.XLS]Super Stock'!$E51 -> 375 | N47: =IF('[POINTS NQS  2012.XLS]Super Stock'!$F51=0," ",'[POINTS NQS  2012.XLS]Super Stock'!$F51) -> Blind Ambition | O47: ='[POINTS NQS  2012.XLS]Super Stock'!$AA51 -> 98
A48: ='[POINTS NQS  2012.XLS]Pro Stock'!$A52 -> 46 | B48: ='[POINTS NQS  2012.XLS]Pro Stock'!$B52 -> Ray Gentz | C48: ='[POINTS NQS  2012.XLS]Pro Stock'!$C52 -> Colon, Mich | D48: ='[POINTS NQS  2012.XLS]Pro Stock'!$D52 -> VM | E48: ='[POINTS NQS  2012.XLS]Pro Stock'!$E52 -> 34 | F48: =IF('[POINTS NQS  2012.XLS]Pro Stock'!$F52=0," ",'[POINTS NQS  2012.XLS]Pro Stock'!$F52) ->  | G48: ='[POINTS NQS  2012.XLS]Pro Stock'!$AA52 -> 93 | I48: ='[POINTS NQS  2012.XLS]Super Stock'!$A52 -> 46 | J48: ='[POINTS NQS  2012.XLS]Super Stock'!$B52 -> Darlene Sample | K48: ='[POINTS NQS  2012.XLS]Super Stock'!$C52 -> Carrollton, OH | L48: ='[POINTS NQS  2012.XLS]Super Stock'!$D52 -> LR | M48: ='[POINTS NQS  2012.XLS]Super Stock'!$E52 -> 498 | N48: =IF('[POINTS NQS  2012.XLS]Super Stock'!$F52=0," ",'[POINTS NQS  2012.XLS]Super Stock'!$F52) -> Dr. Doom | O48: ='[POINTS NQS  2012.XLS]Super Stock'!$AA52 -> 102
A49: ='[POINTS NQS  2012.XLS]Pro Stock'!$A53 -> 47 | B49: ='[POINTS NQS  2012.XLS]Pro Stock'!$B53 -> Nevin Stitzer | C49: ='[POINTS NQS  2012.XLS]Pro Stock'!$C53 -> Spring Mills, PA | D49: ='[POINTS NQS  2012.XLS]Pro Stock'!$D53 ->  | E49: ='[POINTS NQS  2012.XLS]Pro Stock'!$E53 -> 447 | F49: =IF('[POINTS NQS  2012.XLS]Pro Stock'!$F53=0," ",'[POINTS NQS  2012.XLS]Pro Stock'!$F53) -> Thunder Road II | G49: ='[POINTS NQS  2012.XLS]Pro Stock'!$AA53 -> 94 | I49: ='[POINTS NQS  2012.XLS]Super Stock'!$A53 -> 47 | J49: ='[POINTS NQS  2012.XLS]Super Stock'!$B53 -> John Donavon | K49: ='[POINTS NQS  2012.XLS]Super Stock'!$C53 -> Pataskala, OH | L49: ='[POINTS NQS  2012.XLS]Super Stock'!$D53 -> JRS | M49: ='[POINTS NQS  2012.XLS]Super Stock'!$E53 -> 6 | N49: =IF('[POINTS NQS  2012.XLS]Super Stock'!$F53=0," ",'[POINTS NQS  2012.XLS]Super Stock'!$F53) -> John's Deere | O49: ='[POINTS NQS  2012.XLS]Super Stock'!$AA53 -> 103
A50: ='[POINTS NQS  2012.XLS]Pro Stock'!$A54 -> 48 | B50: ='[POINTS NQS  2012.XLS]Pro Stock'!$B54 -> David Mascher SR | C50: ='[POINTS NQS  2012.XLS]Pro Stock'!$C54 -> Mooresville, Ind | D50: ='[POINTS NQS  2012.XLS]Pro Stock'!$D54 -> Mascher | E50: ='[POINTS NQS  2012.XLS]Pro Stock'!$E54 -> 512 | F50: =IF('[POINTS NQS  2012.XLS]Pro Stock'!$F54=0," ",'[POINTS NQS  2012.XLS]Pro Stock'!$F54) ->  | G50: ='[POINTS NQS  2012.XLS]Pro Stock'!$AA54 -> 99 | I50: ='[POINTS NQS  2012.XLS]Super Stock'!$A54 -> 48 | J50: ='[POINTS NQS  2012.XLS]Super Stock'!$B54 -> Ray Gentz | K50: ='[POINTS NQS  2012.XLS]Super Stock'!$C54 -> Colon, MI | L50: ='[POINTS NQS  2012.XLS]Super Stock'!$D54 -> JRS | M50: ='[POINTS NQS  2012.XLS]Super Stock'!$E54 -> 262 | N50: =IF('[POINTS NQS  2012.XLS]Super Stock'!$F54=0," ",'[POINTS NQS  2012.XLS]Super Stock'!$F54) -> Chaos | O50: ='[POINTS NQS  2012.XLS]Super Stock'!$AA54 -> 103
A51: ='[POINTS NQS  2012.XLS]Pro Stock'!$A55 -> 49 | B51: ='[POINTS NQS  2012.XLS]Pro Stock'!$B55 -> Kevin Root | C51: ='[POINTS NQS  2012.XLS]Pro Stock'!$C55 -> Inola, Okla | D51: ='[POINTS NQS  2012.XLS]Pro Stock'!$D55 -> Root | E51: ='[POINTS NQS  2012.XLS]Pro Stock'!$E55 -> 117 | F51: =IF('[POINTS NQS  2012.XLS]Pro Stock'!$F55=0," ",'[POINTS NQS  2012.XLS]Pro Stock'!$F55) -> Right on the Money | G51: ='[POINTS NQS  2012.XLS]Pro Stock'!$AA55 -> 108 | I51: ='[POINTS NQS  2012.XLS]Super Stock'!$A55 -> 49 | J51: ='[POINTS NQS  2012.XLS]Super Stock'!$B55 -> David Mascher Jr | K51: ='[POINTS NQS  2012.XLS]Super Stock'!$C55 -> Beech Grove, IN | L51: ='[POINTS NQS  2012.XLS]Super Stock'!$D55 -> Mascher | M51: ='[POINTS NQS  2012.XLS]Super Stock'!$E55 -> 163 | N51: =IF('[POINTS NQS  2012.XLS]Super Stock'!$F55=0," ",'[POINTS NQS  2012.XLS]Super Stock'!$F55) -> Thunder Pumpkin | O51: ='[POINTS NQS  2012.XLS]Super Stock'!$AA55 -> 104
A52: ='[POINTS NQS  2012.XLS]Pro Stock'!$A56 -> 50 | B52: ='[POINTS NQS  2012.XLS]Pro Stock'!$B56 -> Nick Mishler | C52: ='[POINTS NQS  2012.XLS]Pro Stock'!$C56 -> E Peoria, Ill | D52: ='[POINTS NQS  2012.XLS]Pro Stock'!$D56 -> GTP | E52: ='[POINTS NQS  2012.XLS]Pro Stock'!$E56 -> 167 | F52: =IF('[POINTS NQS  2012.XLS]Pro Stock'!$F56=0," ",'[POINTS NQS  2012.XLS]Pro Stock'!$F56) -> Pulse | G52: ='[POINTS NQS  2012.XLS]Pro Stock'!$AA56 -> 108 | I52: ='[POINTS NQS  2012.XLS]Super Stock'!$A56 -> 50 | J52: ='[POINTS NQS  2012.XLS]Super Stock'!$B56 -> Mike Spencer | K52: ='[POINTS NQS  2012.XLS]Super Stock'!$C56 -> West Alexandria, OH | L52: ='[POINTS NQS  2012.XLS]Super Stock'!$D56 -> MVP | M52: ='[POINTS NQS  2012.XLS]Super Stock'!$E56 -> 517 | N52: =IF('[POINTS NQS  2012.XLS]Super Stock'!$F56=0," ",'[POINTS NQS  2012.XLS]Super Stock'!$F56) -> Half Pint | O52: ='[POINTS NQS  2012.XLS]Super Stock'!$AA56 -> 104
A53: ='[POINTS NQS  2012.XLS]Pro Stock'!$A57 -> 51 | B53: ='[POINTS NQS  2012.XLS]Pro Stock'!$B57 -> Charlie Korff | C53: ='[POINTS NQS  2012.XLS]Pro Stock'!$C57 -> Evansville, Ind | D53: ='[POINTS NQS  2012.XLS]Pro Stock'!$D57 -> TC | E53: ='[POINTS NQS  2012.XLS]Pro Stock'!$E57 -> 400 | F53: =IF('[POINTS NQS  2012.XLS]Pro Stock'!$F57=0," ",'[POINTS NQS  2012.XLS]Pro Stock'!$F57) -> No Fear Deere | G53: ='[POINTS NQS  2012.XLS]Pro Stock'!$AA57 -> 108 | I53: ='[POINTS NQS  2012.XLS]Super Stock'!$A57 -> 51 | J53: ='[POINTS NQS  2012.XLS]Super Stock'!$B57 -> Steve Williford | K53: ='[POINTS NQS  2012.XLS]Super Stock'!$C57 -> Engelhard, NC | L53: ='[POINTS NQS  2012.XLS]Super Stock'!$D57 -> MVP | M53: ='[POINTS NQS  2012.XLS]Super Stock'!$E57 -> 276 | N53: =IF('[POINTS NQS  2012.XLS]Super Stock'!$F57=0," ",'[POINTS NQS  2012.XLS]Super Stock'!$F57) -> IH Express #1 | O53: ='[POINTS NQS  2012.XLS]Super Stock'!$AA57 -> 108
A54: ='[POINTS NQS  2012.XLS]Pro Stock'!$A58 -> 52 | B54: ='[POINTS NQS  2012.XLS]Pro Stock'!$B58 -> Mike Dockhan | C54: ='[POINTS NQS  2012.XLS]Pro Stock'!$C58 -> Imlay City, Mich | D54: ='[POINTS NQS  2012.XLS]Pro Stock'!$D58 -> 0 | E54: ='[POINTS NQS  2012.XLS]Pro Stock'!$E58 -> 530 | F54: =IF('[POINTS NQS  2012.XLS]Pro Stock'!$F58=0," ",'[POINTS NQS  2012.XLS]Pro Stock'!$F58) -> Plain Blue | G54: ='[POINTS NQS  2012.XLS]Pro Stock'!$AA58 -> 108 | I54: ='[POINTS NQS  2012.XLS]Super Stock'!$A58 -> 52 | J54: ='[POINTS NQS  2012.XLS]Super Stock'!$B58 -> Julian Stahl | K54: ='[POINTS NQS  2012.XLS]Super Stock'!$C58 -> Welton, IA | L54: ='[POINTS NQS  2012.XLS]Super Stock'!$D58 -> MVP | M54: ='[POINTS NQS  2012.XLS]Super Stock'!$E58 -> 1 | N54: =IF('[POINTS NQS  2012.XLS]Super Stock'!$F58=0," ",'[POINTS NQS  2012.XLS]Super Stock'!$F58) -> MWSC # 1 | O54: ='[POINTS NQS  2012.XLS]Super Stock'!$AA58 -> 112
A55: ='[POINTS NQS  2012.XLS]Pro Stock'!$A59 -> 53 | B55: ='[POINTS NQS  2012.XLS]Pro Stock'!$B59 -> Steve Williford | C55: ='[POINTS NQS  2012.XLS]Pro Stock'!$C59 -> Englehard, NC | D55: ='[POINTS NQS  2012.XLS]Pro Stock'!$D59 -> MVP | E55: ='[POINTS NQS  2012.XLS]Pro Stock'!$E59 -> 273 | F55: =IF('[POINTS NQS  2012.XLS]Pro Stock'!$F59=0," ",'[POINTS NQS  2012.XLS]Pro Stock'!$F59) -> IH Express | G55: ='[POINTS NQS  2012.XLS]Pro Stock'!$AA59 -> 109 | I55: ='[POINTS NQS  2012.XLS]Super Stock'!$A59 -> 53 | J55: ='[POINTS NQS  2012.XLS]Super Stock'!$B59 -> Larry Frederick | K55: ='[POINTS NQS  2012.XLS]Super Stock'!$C59 -> New Castle, Pa | L55: ='[POINTS NQS  2012.XLS]Super Stock'!$D59 -> LR | M55: ='[POINTS NQS  2012.XLS]Super Stock'!$E59 -> 297 | N55: =IF('[POINTS NQS  2012.XLS]Super Stock'!$F59=0," ",'[POINTS NQS  2012.XLS]Super Stock'!$F59) -> Burnin U | O55: ='[POINTS NQS  2012.XLS]Super Stock'!$AA59 -> 112
A56: ='[POINTS NQS  2012.XLS]Pro Stock'!$A60 -> 54 | B56: ='[POINTS NQS  2012.XLS]Pro Stock'!$B60 -> Richard Lucanbaugh | C56: ='[POINTS NQS  2012.XLS]Pro Stock'!$C60 -> Glen Rock, Pa | D56: ='[POINTS NQS  2012.XLS]Pro Stock'!$D60 -> NP | E56: ='[POINTS NQS  2012.XLS]Pro Stock'!$E60 -> 494 | F56: =IF('[POINTS NQS  2012.XLS]Pro Stock'!$F60=0," ",'[POINTS NQS  2012.XLS]Pro Stock'!$F60) -> Cub | G56: ='[POINTS NQS  2012.XLS]Pro Stock'!$AA60 -> 109 | I56: ='[POINTS NQS  2012.XLS]Super Stock'!$A60 -> 54 | J56: ='[POINTS NQS  2012.XLS]Super Stock'!$B60 -> Todd Hammond | K56: ='[POINTS NQS  2012.XLS]Super Stock'!$C60 -> Falling Waters, WV | L56: ='[POINTS NQS  2012.XLS]Super Stock'!$D60 -> JRS | M56: ='[POINTS NQS  2012.XLS]Super Stock'!$E60 -> 301 | N56: =IF('[POINTS NQS  2012.XLS]Super Stock'!$F60=0," ",'[POINTS NQS  2012.XLS]Super Stock'!$F60) -> Punisher | O56: ='[POINTS NQS  2012.XLS]Super Stock'!$AA60 -> 112
A57: ='[POINTS NQS  2012.XLS]Pro Stock'!$A61 -> 55 | B57: ='[POINTS NQS  2012.XLS]Pro Stock'!$B61 -> Matt Dirksen | C57: ='[POINTS NQS  2012.XLS]Pro Stock'!$C61 -> Alma, Ont CDA | D57: ='[POINTS NQS  2012.XLS]Pro Stock'!$D61 -> MWSC | E57: ='[POINTS NQS  2012.XLS]Pro Stock'!$E61 -> 551 | F57: =IF('[POINTS NQS  2012.XLS]Pro Stock'!$F61=0," ",'[POINTS NQS  2012.XLS]Pro Stock'!$F61) -> Armed & Dangerous | G57: ='[POINTS NQS  2012.XLS]Pro Stock'!$AA61 -> 109 | I57: ='[POINTS NQS  2012.XLS]Super Stock'!$A61 -> 55 | J57: ='[POINTS NQS  2012.XLS]Super Stock'!$B61 -> Rick Slade | K57: ='[POINTS NQS  2012.XLS]Super Stock'!$C61 -> Harveyville, KY | L57: ='[POINTS NQS  2012.XLS]Super Stock'!$D61 -> JRS | M57: ='[POINTS NQS  2012.XLS]Super Stock'!$E61 -> 467 | N57: =IF('[POINTS NQS  2012.XLS]Super Stock'!$F61=0," ",'[POINTS NQS  2012.XLS]Super Stock'!$F61) -> Ricochet | O57: ='[POINTS NQS  2012.XLS]Super Stock'!$AA61 -> 112
A58: ='[POINTS NQS  2012.XLS]Pro Stock'!$A62 -> 56 | B58: ='[POINTS NQS  2012.XLS]Pro Stock'!$B62 -> Julian Stahl | C58: ='[POINTS NQS  2012.XLS]Pro Stock'!$C62 -> Welton, IA | D58: ='[POINTS NQS  2012.XLS]Pro Stock'!$D62 -> MVP | E58: ='[POINTS NQS  2012.XLS]Pro Stock'!$E62 -> 2 | F58: =IF('[POINTS NQS  2012.XLS]Pro Stock'!$F62=0," ",'[POINTS NQS  2012.XLS]Pro Stock'!$F62) -> MWSC #2 | G58: ='[POINTS NQS  2012.XLS]Pro Stock'!$AA62 -> 110 | I58: ='[POINTS NQS  2012.XLS]Super Stock'!$A62 -> 56 | J58: ='[POINTS NQS  2012.XLS]Super Stock'!$B62 -> Bill Nippe | K58: ='[POINTS NQS  2012.XLS]Super Stock'!$C62 -> Strasburg, IL | L58: ='[POINTS NQS  2012.XLS]Super Stock'!$D62 -> JW | M58: ='[POINTS NQS  2012.XLS]Super Stock'!$E62 -> 513 | N58: =IF('[POINTS NQS  2012.XLS]Super Stock'!$F62=0," ",'[POINTS NQS  2012.XLS]Super Stock'!$F62) -> Serious Business | O58: ='[POINTS NQS  2012.XLS]Super Stock'!$AA62 -> 112
A59: ='[POINTS NQS  2012.XLS]Pro Stock'!$A63 -> 57 | B59: ='[POINTS NQS  2012.XLS]Pro Stock'!$B63 -> Vicki Scroggins | C59: ='[POINTS NQS  2012.XLS]Pro Stock'!$C63 -> Neosho, Mo | D59: ='[POINTS NQS  2012.XLS]Pro Stock'!$D63 -> VM | E59: ='[POINTS NQS  2012.XLS]Pro Stock'!$E63 -> 112 | F59: =IF('[POINTS NQS  2012.XLS]Pro Stock'!$F63=0," ",'[POINTS NQS  2012.XLS]Pro Stock'!$F63) -> Lil' American | G59: ='[POINTS NQS  2012.XLS]Pro Stock'!$AA63 -> 110 | I59: ='[POINTS NQS  2012.XLS]Super Stock'!$A63 -> 57 | J59: ='[POINTS NQS  2012.XLS]Super Stock'!$B63 -> Jake Gingerich | K59: ='[POINTS NQS  2012.XLS]Super Stock'!$C63 -> Montgomery, Ind | L59: ='[POINTS NQS  2012.XLS]Super Stock'!$D63 -> JW | M59: ='[POINTS NQS  2012.XLS]Super Stock'!$E63 -> 17 | N59: =IF('[POINTS NQS  2012.XLS]Super Stock'!$F63=0," ",'[POINTS NQS  2012.XLS]Super Stock'!$F63) -> Silver Rocket | O59: ='[POINTS NQS  2012.XLS]Super Stock'!$AA63 -> 113
A60: ='[POINTS NQS  2012.XLS]Pro Stock'!$A64 -> 58 | B60: ='[POINTS NQS  2012.XLS]Pro Stock'!$B64 -> Larry Frederick | C60: ='[POINTS NQS  2012.XLS]Pro Stock'!$C64 -> New Castle, Pa | D60: ='[POINTS NQS  2012.XLS]Pro Stock'!$D64 -> LR | E60: ='[POINTS NQS  2012.XLS]Pro Stock'!$E64 -> 297 | F60: =IF('[POINTS NQS  2012.XLS]Pro Stock'!$F64=0," ",'[POINTS NQS  2012.XLS]Pro Stock'!$F64) -> Burning U | G60: ='[POINTS NQS  2012.XLS]Pro Stock'!$AA64 -> 110 | I60: ='[POINTS NQS  2012.XLS]Super Stock'!$A64 -> 58 | J60: ='[POINTS NQS  2012.XLS]Super Stock'!$B64 -> John Cress | K60: ='[POINTS NQS  2012.XLS]Super Stock'!$C64 -> Strasburg, IL | L60: ='[POINTS NQS  2012.XLS]Super Stock'!$D64 -> JW | M60: ='[POINTS NQS  2012.XLS]Super Stock'!$E64 -> 170 | N60: =IF('[POINTS NQS  2012.XLS]Super Stock'!$F64=0," ",'[POINTS NQS  2012.XLS]Super Stock'!$F64) -> Blitzed | O60: ='[POINTS NQS  2012.XLS]Super Stock'!$AA64 -> 113
A61: ='[POINTS NQS  2012.XLS]Pro Stock'!$A65 -> 59 | B61: ='[POINTS NQS  2012.XLS]Pro Stock'!$B65 -> Doug Diehl | C61: ='[POINTS NQS  2012.XLS]Pro Stock'!$C65 -> Smithsburg, Md | D61: ='[POINTS NQS  2012.XLS]Pro Stock'!$D65 -> NP | E61: ='[POINTS NQS  2012.XLS]Pro Stock'!$E65 -> 385 | F61: =IF('[POINTS NQS  2012.XLS]Pro Stock'!$F65=0," ",'[POINTS NQS  2012.XLS]Pro Stock'!$F65) -> Eliminator | G61: ='[POINTS NQS  2012.XLS]Pro Stock'!$AA65 -> 110 | I61: ='[POINTS NQS  2012.XLS]Super Stock'!$A65 -> 59 | J61: ='[POINTS NQS  2012.XLS]Super Stock'!$B65 -> John Cress | K61: ='[POINTS NQS  2012.XLS]Super Stock'!$C65 -> Strasburg, IL | L61: ='[POINTS NQS  2012.XLS]Super Stock'!$D65 -> JW | M61: ='[POINTS NQS  2012.XLS]Super Stock'!$E65 -> 172 | N61: =IF('[POINTS NQS  2012.XLS]Super Stock'!$F65=0," ",'[POINTS NQS  2012.XLS]Super Stock'!$F65) -> Full Tilt | O61: ='[POINTS NQS  2012.XLS]Super Stock'!$AA65 -> 113
A62: ='[POINTS NQS  2012.XLS]Pro Stock'!$A66 -> 60 | B62: ='[POINTS NQS  2012.XLS]Pro Stock'!$B66 -> Doug Diehl | C62: ='[POINTS NQS  2012.XLS]Pro Stock'!$C66 -> Smithsburg, Md | D62: ='[POINTS NQS  2012.XLS]Pro Stock'!$D66 -> NP | E62: ='[POINTS NQS  2012.XLS]Pro Stock'!$E66 -> 441 | F62: =IF('[POINTS NQS  2012.XLS]Pro Stock'!$F66=0," ",'[POINTS NQS  2012.XLS]Pro Stock'!$F66) -> Excedrin | G62: ='[POINTS NQS  2012.XLS]Pro Stock'!$AA66 -> 110 | I62: ='[POINTS NQS  2012.XLS]Super Stock'!$A66 -> 60 | J62: ='[POINTS NQS  2012.XLS]Super Stock'!$B66 -> Mark Conover | K62: ='[POINTS NQS  2012.XLS]Super Stock'!$C66 -> Edinburgh, IN | L62: ='[POINTS NQS  2012.XLS]Super Stock'!$D66 -> VM | M62: ='[POINTS NQS  2012.XLS]Super Stock'!$E66 -> 360 | N62: =IF('[POINTS NQS  2012.XLS]Super Stock'!$F66=0," ",'[POINTS NQS  2012.XLS]Super Stock'!$F66) -> VuDoo Too | O62: ='[POINTS NQS  2012.XLS]Super Stock'!$AA66 -> 113
A63: ='[POINTS NQS  2012.XLS]Pro Stock'!$A67 -> 61 | B63: ='[POINTS NQS  2012.XLS]Pro Stock'!$B67 -> Mark Davis | C63: ='[POINTS NQS  2012.XLS]Pro Stock'!$C67 -> Lower Salem, Oh | D63: ='[POINTS NQS  2012.XLS]Pro Stock'!$D67 -> JS | E63: ='[POINTS NQS  2012.XLS]Pro Stock'!$E67 -> 67 | F63: =IF('[POINTS NQS  2012.XLS]Pro Stock'!$F67=0," ",'[POINTS NQS  2012.XLS]Pro Stock'!$F67) -> No Limits | G63: ='[POINTS NQS  2012.XLS]Pro Stock'!$AA67 -> 111 | I63: ='[POINTS NQS  2012.XLS]Super Stock'!$A67 -> 61 | J63: ='[POINTS NQS  2012.XLS]Super Stock'!$B67 -> Vicki Scroggins | K63: ='[POINTS NQS  2012.XLS]Super Stock'!$C67 -> Neosho, MO | L63: ='[POINTS NQS  2012.XLS]Super Stock'!$D67 -> VM | M63: ='[POINTS NQS  2012.XLS]Super Stock'!$E67 -> 112 | N63: =IF('[POINTS NQS  2012.XLS]Super Stock'!$F67=0," ",'[POINTS NQS  2012.XLS]Super Stock'!$F67) -> Lil" American | O63: ='[POINTS NQS  2012.XLS]Super Stock'!$AA67 -> 114
A64: ='[POINTS NQS  2012.XLS]Pro Stock'!$A68 -> 62 | B64: ='[POINTS NQS  2012.XLS]Pro Stock'!$B68 -> Michael Sour | C64: ='[POINTS NQS  2012.XLS]Pro Stock'!$C68 -> Jeromesville, Oh | D64: ='[POINTS NQS  2012.XLS]Pro Stock'!$D68 -> TH | E64: ='[POINTS NQS  2012.XLS]Pro Stock'!$E68 -> 543 | F64: =IF('[POINTS NQS  2012.XLS]Pro Stock'!$F68=0," ",'[POINTS NQS  2012.XLS]Pro Stock'!$F68) -> Another Addiction | G64: ='[POINTS NQS  2012.XLS]Pro Stock'!$AA68 -> 111 | I64: ='[POINTS NQS  2012.XLS]Super Stock'!$A68 -> 62 | J64: ='[POINTS NQS  2012.XLS]Super Stock'!$B68 -> Mike Sours | K64: ='[POINTS NQS  2012.XLS]Super Stock'!$C68 -> Jeromesville, Oh | L64: ='[POINTS NQS  2012.XLS]Super Stock'!$D68 -> TH | M64: ='[POINTS NQS  2012.XLS]Super Stock'!$E68 -> 543 | N64: =IF('[POINTS NQS  2012.XLS]Super Stock'!$F68=0," ",'[POINTS NQS  2012.XLS]Super Stock'!$F68) -> Another Addiction | O64: ='[POINTS NQS  2012.XLS]Super Stock'!$AA68 -> 114
A65: ='[POINTS NQS  2012.XLS]Pro Stock'!$A69 -> 63 | B65: ='[POINTS NQS  2012.XLS]Pro Stock'!$B69 -> Michael Ciolino | C65: ='[POINTS NQS  2012.XLS]Pro Stock'!$C69 -> Hammond, LA | D65: ='[POINTS NQS  2012.XLS]Pro Stock'!$D69 -> MVP | E65: ='[POINTS NQS  2012.XLS]Pro Stock'!$E69 -> 146 | F65: =IF('[POINTS NQS  2012.XLS]Pro Stock'!$F69=0," ",'[POINTS NQS  2012.XLS]Pro Stock'!$F69) -> Mechanical Animal | G65: ='[POINTS NQS  2012.XLS]Pro Stock'!$AA69 -> 111 | I65: ='[POINTS NQS  2012.XLS]Super Stock'!$A69 -> 63 | J65: ='[POINTS NQS  2012.XLS]Super Stock'!$B69 -> Michael Ciolino | K65: ='[POINTS NQS  2012.XLS]Super Stock'!$C69 -> Peoria, IL | L65: ='[POINTS NQS  2012.XLS]Super Stock'!$D69 -> MVP | M65: ='[POINTS NQS  2012.XLS]Super Stock'!$E69 -> 146 | N65: =IF('[POINTS NQS  2012.XLS]Super Stock'!$F69=0," ",'[POINTS NQS  2012.XLS]Super Stock'!$F69) -> Mechanial Animal | O65: ='[POINTS NQS  2012.XLS]Super Stock'!$AA69 -> 114 | Q65: 0
A66: ='[POINTS NQS  2012.XLS]Pro Stock'!$A70 -> 64 | B66: ='[POINTS NQS  2012.XLS]Pro Stock'!$B70 -> Tooter Campbell | C66: ='[POINTS NQS  2012.XLS]Pro Stock'!$C70 -> Owensboro, Ky | D66: ='[POINTS NQS  2012.XLS]Pro Stock'!$D70 -> TC | E66: ='[POINTS NQS  2012.XLS]Pro Stock'!$E70 -> 473 | F66: =IF('[POINTS NQS  2012.XLS]Pro Stock'!$F70=0," ",'[POINTS NQS  2012.XLS]Pro Stock'!$F70) -> Tractor Trash | G66: ='[POINTS NQS  2012.XLS]Pro Stock'!$AA70 -> 111 | I66: ='[POINTS NQS  2012.XLS]Super Stock'!$A70 -> 64 | J66: ='[POINTS NQS  2012.XLS]Super Stock'!$B70 -> Clyde Mishler | K66: ='[POINTS NQS  2012.XLS]Super Stock'!$C70 -> Washington, IL | L66: ='[POINTS NQS  2012.XLS]Super Stock'!$D70 -> GTP | M66: ='[POINTS NQS  2012.XLS]Super Stock'!$E70 -> 168 | N66: =IF('[POINTS NQS  2012.XLS]Super Stock'!$F70=0," ",'[POINTS NQS  2012.XLS]Super Stock'!$F70) ->  | O66: ='[POINTS NQS  2012.XLS]Super Stock'!$AA70 -> 114
A67: ='[POINTS NQS  2012.XLS]Pro Stock'!$A71 -> 65 | B67: ='[POINTS NQS  2012.XLS]Pro Stock'!$B71 -> Clyde Mishler | C67: ='[POINTS NQS  2012.XLS]Pro Stock'!$C71 -> E Peoria, Ill | D67: ='[POINTS NQS  2012.XLS]Pro Stock'!$D71 -> GTP | E67: ='[POINTS NQS  2012.XLS]Pro Stock'!$E71 -> 168 | F67: =IF('[POINTS NQS  2012.XLS]Pro Stock'!$F71=0," ",'[POINTS NQS  2012.XLS]Pro Stock'!$F71) ->  | G67: ='[POINTS NQS  2012.XLS]Pro Stock'!$AA71 -> 112 | I67: ='[POINTS NQS  2012.XLS]Super Stock'!$A71 -> 65 | J67: ='[POINTS NQS  2012.XLS]Super Stock'!$B71 -> Doug Diehl | K67: ='[POINTS NQS  2012.XLS]Super Stock'!$C71 -> Smithsburg, PA | L67: ='[POINTS NQS  2012.XLS]Super Stock'!$D71 -> NP | M67: ='[POINTS NQS  2012.XLS]Super Stock'!$E71 -> 385 | N67: =IF('[POINTS NQS  2012.XLS]Super Stock'!$F71=0," ",'[POINTS NQS  2012.XLS]Super Stock'!$F71) -> Eliminator | O67: ='[POINTS NQS  2012.XLS]Super Stock'!$AA71 -> 114
A68: ='[POINTS NQS  2012.XLS]Pro Stock'!$A72 -> 66 | B68: ='[POINTS NQS  2012.XLS]Pro Stock'!$B72 -> Mike Kyle | C68: ='[POINTS NQS  2012.XLS]Pro Stock'!$C72 -> Edinburg, Ind | D68: ='[POINTS NQS  2012.XLS]Pro Stock'!$D72 -> VM | E68: ='[POINTS NQS  2012.XLS]Pro Stock'!$E72 -> 394 | F68: =IF('[POINTS NQS  2012.XLS]Pro Stock'!$F72=0," ",'[POINTS NQS  2012.XLS]Pro Stock'!$F72) ->  | G68: ='[POINTS NQS  2012.XLS]Pro Stock'!$AA72 -> 112 | I68: ='[POINTS NQS  2012.XLS]Super Stock'!$A72 -> 66 | J68: ='[POINTS NQS  2012.XLS]Super Stock'!$B72 -> Matt Dirksen | K68: ='[POINTS NQS  2012.XLS]Super Stock'!$C72 -> Alma, Ont CDA | L68: ='[POINTS NQS  2012.XLS]Super Stock'!$D72 -> MWSC | M68: ='[POINTS NQS  2012.XLS]Super Stock'!$E72 -> 551 | N68: =IF('[POINTS NQS  2012.XLS]Super Stock'!$F72=0," ",'[POINTS NQS  2012.XLS]Super Stock'!$F72) -> Armed & Dangerous | O68: ='[POINTS NQS  2012.XLS]Super Stock'!$AA72 -> 114
A69: ='[POINTS NQS  2012.XLS]Pro Stock'!$A73 -> 67 | B69: ='[POINTS NQS  2012.XLS]Pro Stock'!$B73 -> Bradley Corzine | C69: ='[POINTS NQS  2012.XLS]Pro Stock'!$C73 -> Dongola, ILL | D69: ='[POINTS NQS  2012.XLS]Pro Stock'!$D73 -> JW | E69: ='[POINTS NQS  2012.XLS]Pro Stock'!$E73 -> 477 | F69: =IF('[POINTS NQS  2012.XLS]Pro Stock'!$F73=0," ",'[POINTS NQS  2012.XLS]Pro Stock'!$F73) -> Black Cat | G69: ='[POINTS NQS  2012.XLS]Pro Stock'!$AA73 -> 112 | I69: ='[POINTS NQS  2012.XLS]Super Stock'!$A73 -> 67 | J69: ='[POINTS NQS  2012.XLS]Super Stock'!$B73 -> Julian Stahl | K69: ='[POINTS NQS  2012.XLS]Super Stock'!$C73 -> Welton, IA | L69: ='[POINTS NQS  2012.XLS]Super Stock'!$D73 -> MVP | M69: ='[POINTS NQS  2012.XLS]Super Stock'!$E73 -> 2 | N69: =IF('[POINTS NQS  2012.XLS]Super Stock'!$F73=0," ",'[POINTS NQS  2012.XLS]Super Stock'!$F73) -> MWSC # 2 | O69: ='[POINTS NQS  2012.XLS]Super Stock'!$AA73 -> 115
A70: ='[POINTS NQS  2012.XLS]Pro Stock'!$A74 -> 68 | B70: ='[POINTS NQS  2012.XLS]Pro Stock'!$B74 -> Dean Dubach | C70: ='[POINTS NQS  2012.XLS]Pro Stock'!$C74 -> Decatur, Ind | D70: ='[POINTS NQS  2012.XLS]Pro Stock'!$D74 -> LR | E70: ='[POINTS NQS  2012.XLS]Pro Stock'!$E74 -> 532 | F70: =IF('[POINTS NQS  2012.XLS]Pro Stock'!$F74=0," ",'[POINTS NQS  2012.XLS]Pro Stock'!$F74) -> Red Cub | G70: ='[POINTS NQS  2012.XLS]Pro Stock'!$AA74 -> 112 | I70: ='[POINTS NQS  2012.XLS]Super Stock'!$A74 -> 68 | J70: ='[POINTS NQS  2012.XLS]Super Stock'!$B74 -> Tyler Hackman | K70: ='[POINTS NQS  2012.XLS]Super Stock'!$C74 -> Seymour, IN | L70: ='[POINTS NQS  2012.XLS]Super Stock'!$D74 -> Hackman | M70: ='[POINTS NQS  2012.XLS]Super Stock'!$E74 -> 508 | N70: =IF('[POINTS NQS  2012.XLS]Super Stock'!$F74=0," ",'[POINTS NQS  2012.XLS]Super Stock'!$F74) -> Iron Will | O70: ='[POINTS NQS  2012.XLS]Super Stock'!$AA74 -> 115
A71: ='[POINTS NQS  2012.XLS]Pro Stock'!$A75 -> 69 | B71: ='[POINTS NQS  2012.XLS]Pro Stock'!$B75 -> Corey Gerber | C71: ='[POINTS NQS  2012.XLS]Pro Stock'!$C75 -> Apple Creek, Oh | D71: ='[POINTS NQS  2012.XLS]Pro Stock'!$D75 -> 0 | E71: ='[POINTS NQS  2012.XLS]Pro Stock'!$E75 -> 538 | F71: =IF('[POINTS NQS  2012.XLS]Pro Stock'!$F75=0," ",'[POINTS NQS  2012.XLS]Pro Stock'!$F75) -> Red Rascal | G71: ='[POINTS NQS  2012.XLS]Pro Stock'!$AA75 -> 112 | I71: ='[POINTS NQS  2012.XLS]Super Stock'!$A75 -> 69 | J71: ='[POINTS NQS  2012.XLS]Super Stock'!$B75 -> Dean Dubach | K71: ='[POINTS NQS  2012.XLS]Super Stock'!$C75 -> Decatur, Ind | L71: ='[POINTS NQS  2012.XLS]Super Stock'!$D75 -> LR | M71: ='[POINTS NQS  2012.XLS]Super Stock'!$E75 -> 532 | N71: =IF('[POINTS NQS  2012.XLS]Super Stock'!$F75=0," ",'[POINTS NQS  2012.XLS]Super Stock'!$F75) -> Red Cub | O71: ='[POINTS NQS  2012.XLS]Super Stock'!$AA75 -> 115
A72: ='[POINTS NQS  2012.XLS]Pro Stock'!$A76 -> 70 | B72: ='[POINTS NQS  2012.XLS]Pro Stock'!$B76 -> Michael Hunter | C72: ='[POINTS NQS  2012.XLS]Pro Stock'!$C76 -> Catawissa, Pa | D72: ='[POINTS NQS  2012.XLS]Pro Stock'!$D76 -> 0 | E72: ='[POINTS NQS  2012.XLS]Pro Stock'!$E76 -> 541 | F72: =IF('[POINTS NQS  2012.XLS]Pro Stock'!$F76=0," ",'[POINTS NQS  2012.XLS]Pro Stock'!$F76) ->  | G72: ='[POINTS NQS  2012.XLS]Pro Stock'!$AA76 -> 112 | I72: ='[POINTS NQS  2012.XLS]Super Stock'!$A76 -> 70 | J72: ='[POINTS NQS  2012.XLS]Super Stock'!$B76 -> Bruce Austin | K72: ='[POINTS NQS  2012.XLS]Super Stock'!$C76 -> St. Charles, IA | L72: ='[POINTS NQS  2012.XLS]Super Stock'!$D76 -> MVP | M72: ='[POINTS NQS  2012.XLS]Super Stock'!$E76 -> 277 | N72: =IF('[POINTS NQS  2012.XLS]Super Stock'!$F76=0," ",'[POINTS NQS  2012.XLS]Super Stock'!$F76) -> Cap'n Crunch | O72: ='[POINTS NQS  2012.XLS]Super Stock'!$AA76 -> 116
A73: ='[POINTS NQS  2012.XLS]Pro Stock'!$A77 -> 71 | B73: ='[POINTS NQS  2012.XLS]Pro Stock'!$B77 -> Charlie Ciolino | C73: ='[POINTS NQS  2012.XLS]Pro Stock'!$C77 -> Hammond, LA | D73: ='[POINTS NQS  2012.XLS]Pro Stock'!$D77 -> MVP | E73: ='[POINTS NQS  2012.XLS]Pro Stock'!$E77 -> 145 | F73: =IF('[POINTS NQS  2012.XLS]Pro Stock'!$F77=0," ",'[POINTS NQS  2012.XLS]Pro Stock'!$F77) -> Mechanical Nitemare | G73: ='[POINTS NQS  2012.XLS]Pro Stock'!$AA77 -> 113 | I73: ='[POINTS NQS  2012.XLS]Super Stock'!$A77 -> 71 | J73: ='[POINTS NQS  2012.XLS]Super Stock'!$B77 -> Harrison Stahl | K73: ='[POINTS NQS  2012.XLS]Super Stock'!$C77 -> Dewitt, IA | L73: ='[POINTS NQS  2012.XLS]Super Stock'!$D77 -> MVP | M73: ='[POINTS NQS  2012.XLS]Super Stock'!$E77 -> 335 | N73: =IF('[POINTS NQS  2012.XLS]Super Stock'!$F77=0," ",'[POINTS NQS  2012.XLS]Super Stock'!$F77) -> MWSC # 3 | O73: ='[POINTS NQS  2012.XLS]Super Stock'!$AA77 -> 116
A74: ='[POINTS NQS  2012.XLS]Pro Stock'!$A78 -> 72 | B74: ='[POINTS NQS  2012.XLS]Pro Stock'!$B78 -> Todd Brest | C74: ='[POINTS NQS  2012.XLS]Pro Stock'!$C78 -> Sharpsville, Pa | D74: ='[POINTS NQS  2012.XLS]Pro Stock'!$D78 -> 0 | E74: ='[POINTS NQS  2012.XLS]Pro Stock'!$E78 -> 272 | F74: =IF('[POINTS NQS  2012.XLS]Pro Stock'!$F78=0," ",'[POINTS NQS  2012.XLS]Pro Stock'!$F78) -> Cub | G74: ='[POINTS NQS  2012.XLS]Pro Stock'!$AA78 -> 113 | I74: ='[POINTS NQS  2012.XLS]Super Stock'!$A78 -> 72 | J74: ='[POINTS NQS  2012.XLS]Super Stock'!$B78 -> Logan Cessna | K74: ='[POINTS NQS  2012.XLS]Super Stock'!$C78 -> Chambersburg, Pa | L74: ='[POINTS NQS  2012.XLS]Super Stock'!$D78 -> NP | M74: ='[POINTS NQS  2012.XLS]Super Stock'!$E78 -> 388 | N74: =IF('[POINTS NQS  2012.XLS]Super Stock'!$F78=0," ",'[POINTS NQS  2012.XLS]Super Stock'!$F78) -> Adrenaline | O74: ='[POINTS NQS  2012.XLS]Super Stock'!$AA78 -> 116
A75: ='[POINTS NQS  2012.XLS]Pro Stock'!$A79 -> 73 | B75: ='[POINTS NQS  2012.XLS]Pro Stock'!$B79 -> Bruce Austin | C75: ='[POINTS NQS  2012.XLS]Pro Stock'!$C79 -> St Charles, IA | D75: ='[POINTS NQS  2012.XLS]Pro Stock'!$D79 -> MVP | E75: ='[POINTS NQS  2012.XLS]Pro Stock'!$E79 -> 277 | F75: =IF('[POINTS NQS  2012.XLS]Pro Stock'!$F79=0," ",'[POINTS NQS  2012.XLS]Pro Stock'!$F79) -> Cap'N Crunch | G75: ='[POINTS NQS  2012.XLS]Pro Stock'!$AA79 -> 113 | I75: ='[POINTS NQS  2012.XLS]Super Stock'!$A79 -> 73 | J75: ='[POINTS NQS  2012.XLS]Super Stock'!$B79 -> Larry Korff | K75: ='[POINTS NQS  2012.XLS]Super Stock'!$C79 -> Evansville, IN | L75: ='[POINTS NQS  2012.XLS]Super Stock'!$D79 -> TC | M75: ='[POINTS NQS  2012.XLS]Super Stock'!$E79 -> 398 | N75: =IF('[POINTS NQS  2012.XLS]Super Stock'!$F79=0," ",'[POINTS NQS  2012.XLS]Super Stock'!$F79) -> Kryptonite | O75: ='[POINTS NQS  2012.XLS]Super Stock'!$AA79 -> 116
A76: ='[POINTS NQS  2012.XLS]Pro Stock'!$A80 -> 74 | B76: ='[POINTS NQS  2012.XLS]Pro Stock'!$B80 -> Dave Fagin | C76: ='[POINTS NQS  2012.XLS]Pro Stock'!$C80 -> Sullivan, Oh | D76: ='[POINTS NQS  2012.XLS]Pro Stock'!$D80 -> 0 | E76: ='[POINTS NQS  2012.XLS]Pro Stock'!$E80 -> 555 | F76: =IF('[POINTS NQS  2012.XLS]Pro Stock'!$F80=0," ",'[POINTS NQS  2012.XLS]Pro Stock'!$F80) -> Plum Crazy | G76: ='[POINTS NQS  2012.XLS]Pro Stock'!$AA80 -> 113 | I76: ='[POINTS NQS  2012.XLS]Super Stock'!$A80 -> 74 | J76: ='[POINTS NQS  2012.XLS]Super Stock'!$B80 -> Mark Cessna | K76: ='[POINTS NQS  2012.XLS]Super Stock'!$C80 -> Chambersburg, Pa | L76: ='[POINTS NQS  2012.XLS]Super Stock'!$D80 -> 0 | M76: ='[POINTS NQS  2012.XLS]Super Stock'!$E80 -> 0 | N76: =IF('[POINTS NQS  2012.XLS]Super Stock'!$F80=0," ",'[POINTS NQS  2012.XLS]Super Stock'!$F80) -> Built for Business | O76: ='[POINTS NQS  2012.XLS]Super Stock'!$AA80 -> 116
A77: ='[POINTS NQS  2012.XLS]Pro Stock'!$A81 -> 75 | B77: ='[POINTS NQS  2012.XLS]Pro Stock'!$B81 -> Jeremy Jaspering | C77: ='[POINTS NQS  2012.XLS]Pro Stock'!$C81 -> Perry, MO | D77: ='[POINTS NQS  2012.XLS]Pro Stock'!$D81 -> LR | E77: ='[POINTS NQS  2012.XLS]Pro Stock'!$E81 -> 147 | F77: =IF('[POINTS NQS  2012.XLS]Pro Stock'!$F81=0," ",'[POINTS NQS  2012.XLS]Pro Stock'!$F81) -> Wicked | G77: ='[POINTS NQS  2012.XLS]Pro Stock'!$AA81 -> 114 | I77: ='[POINTS NQS  2012.XLS]Super Stock'!$A81 -> 75 | J77: ='[POINTS NQS  2012.XLS]Super Stock'!$B81 -> Nick Mishler | K77: ='[POINTS NQS  2012.XLS]Super Stock'!$C81 -> East Peoria, IL | L77: ='[POINTS NQS  2012.XLS]Super Stock'!$D81 -> GTP | M77: ='[POINTS NQS  2012.XLS]Super Stock'!$E81 -> 167 | N77: =IF('[POINTS NQS  2012.XLS]Super Stock'!$F81=0," ",'[POINTS NQS  2012.XLS]Super Stock'!$F81) -> Pulse | O77: ='[POINTS NQS  2012.XLS]Super Stock'!$AA81 -> 117
A78: ='[POINTS NQS  2012.XLS]Pro Stock'!$A82 -> 76 | B78: ='[POINTS NQS  2012.XLS]Pro Stock'!$B82 -> Harrison Stahl | C78: ='[POINTS NQS  2012.XLS]Pro Stock'!$C82 -> Welton, IA | D78: ='[POINTS NQS  2012.XLS]Pro Stock'!$D82 -> MVP | E78: ='[POINTS NQS  2012.XLS]Pro Stock'!$E82 -> 336 | F78: =IF('[POINTS NQS  2012.XLS]Pro Stock'!$F82=0," ",'[POINTS NQS  2012.XLS]Pro Stock'!$F82) -> MWSC # 4 | G78: ='[POINTS NQS  2012.XLS]Pro Stock'!$AA82 -> 114 | I78: ='[POINTS NQS  2012.XLS]Super Stock'!$A82 -> 76 | J78: ='[POINTS NQS  2012.XLS]Super Stock'!$B82 -> Todd Hammond | K78: ='[POINTS NQS  2012.XLS]Super Stock'!$C82 -> Falling Waters, WV | L78: ='[POINTS NQS  2012.XLS]Super Stock'!$D82 -> JRS | M78: ='[POINTS NQS  2012.XLS]Super Stock'!$E82 -> 241 | N78: =IF('[POINTS NQS  2012.XLS]Super Stock'!$F82=0," ",'[POINTS NQS  2012.XLS]Super Stock'!$F82) -> Problem Child | O78: ='[POINTS NQS  2012.XLS]Super Stock'!$AA82 -> 117
A79: ='[POINTS NQS  2012.XLS]Pro Stock'!$A83 -> 77 | B79: ='[POINTS NQS  2012.XLS]Pro Stock'!$B83 -> Brian Titzer | C79: ='[POINTS NQS  2012.XLS]Pro Stock'!$C83 -> Evansville, Ind | D79: ='[POINTS NQS  2012.XLS]Pro Stock'!$D83 -> TC | E79: ='[POINTS NQS  2012.XLS]Pro Stock'!$E83 -> 364 | F79: =IF('[POINTS NQS  2012.XLS]Pro Stock'!$F83=0," ",'[POINTS NQS  2012.XLS]Pro Stock'!$F83) -> Single Boys Toy | G79: ='[POINTS NQS  2012.XLS]Pro Stock'!$AA83 -> 114 | I79: ='[POINTS NQS  2012.XLS]Super Stock'!$A83 -> 77 | J79: ='[POINTS NQS  2012.XLS]Super Stock'!$B83 -> Corey Gerber | K79: ='[POINTS NQS  2012.XLS]Super Stock'!$C83 -> Apple Creek, Oh | L79: ='[POINTS NQS  2012.XLS]Super Stock'!$D83 -> 0 | M79: ='[POINTS NQS  2012.XLS]Super Stock'!$E83 -> 538 | N79: =IF('[POINTS NQS  2012.XLS]Super Stock'!$F83=0," ",'[POINTS NQS  2012.XLS]Super Stock'!$F83) -> Red Rascal | O79: ='[POINTS NQS  2012.XLS]Super Stock'!$AA83 -> 117
A80: ='[POINTS NQS  2012.XLS]Pro Stock'!$A84 -> 78 | B80: ='[POINTS NQS  2012.XLS]Pro Stock'!$B84 -> Mark Brest | C80: ='[POINTS NQS  2012.XLS]Pro Stock'!$C84 -> Sharpsville, Pa | D80: ='[POINTS NQS  2012.XLS]Pro Stock'!$D84 -> MVP | E80: ='[POINTS NQS  2012.XLS]Pro Stock'!$E84 -> 404 | F80: =IF('[POINTS NQS  2012.XLS]Pro Stock'!$F84=0," ",'[POINTS NQS  2012.XLS]Pro Stock'!$F84) -> Stage IV | G80: ='[POINTS NQS  2012.XLS]Pro Stock'!$AA84 -> 114 | I80: ='[POINTS NQS  2012.XLS]Super Stock'!$A84 -> 78 | J80: ='[POINTS NQS  2012.XLS]Super Stock'!$B84 -> Mike Silco | K80: ='[POINTS NQS  2012.XLS]Super Stock'!$C84 -> Pittsford, NY | L80: ='[POINTS NQS  2012.XLS]Super Stock'!$D84 -> LR | M80: ='[POINTS NQS  2012.XLS]Super Stock'!$E84 -> 547 | N80: =IF('[POINTS NQS  2012.XLS]Super Stock'!$F84=0," ",'[POINTS NQS  2012.XLS]Super Stock'!$F84) -> 1466 Alcoholic | O80: ='[POINTS NQS  2012.XLS]Super Stock'!$AA84 -> 117
A81: ='[POINTS NQS  2012.XLS]Pro Stock'!$A85 -> 79 | B81: ='[POINTS NQS  2012.XLS]Pro Stock'!$B85 -> Denns Chilcoat | C81: ='[POINTS NQS  2012.XLS]Pro Stock'!$C85 -> Seven Valley, Pa | D81: ='[POINTS NQS  2012.XLS]Pro Stock'!$D85 -> 0 | E81: ='[POINTS NQS  2012.XLS]Pro Stock'!$E85 -> 528 | F81: =IF('[POINTS NQS  2012.XLS]Pro Stock'!$F85=0," ",'[POINTS NQS  2012.XLS]Pro Stock'!$F85) ->  | G81: ='[POINTS NQS  2012.XLS]Pro Stock'!$AA85 -> 114 | I81: ='[POINTS NQS  2012.XLS]Super Stock'!$A85 -> 79 | J81: ='[POINTS NQS  2012.XLS]Super Stock'!$B85 -> Brandon Lohwinow | K81: ='[POINTS NQS  2012.XLS]Super Stock'!$C85 -> Feigus.Ont CDA | L81: ='[POINTS NQS  2012.XLS]Super Stock'!$D85 -> MWSC | M81: ='[POINTS NQS  2012.XLS]Super Stock'!$E85 -> 550 | N81: =IF('[POINTS NQS  2012.XLS]Super Stock'!$F85=0," ",'[POINTS NQS  2012.XLS]Super Stock'!$F85) -> Mistress | O81: ='[POINTS NQS  2012.XLS]Super Stock'!$AA85 -> 117
A82: ='[POINTS NQS  2012.XLS]Pro Stock'!$A86 -> 80 | B82: ='[POINTS NQS  2012.XLS]Pro Stock'!$B86 -> Ray Gentz | C82: ='[POINTS NQS  2012.XLS]Pro Stock'!$C86 -> Colon, Mich | D82: ='[POINTS NQS  2012.XLS]Pro Stock'!$D86 -> JRS | E82: ='[POINTS NQS  2012.XLS]Pro Stock'!$E86 -> 35 | F82: =IF('[POINTS NQS  2012.XLS]Pro Stock'!$F86=0," ",'[POINTS NQS  2012.XLS]Pro Stock'!$F86) -> B.U. Cub | G82: ='[POINTS NQS  2012.XLS]Pro Stock'!$AA86 -> 115 | I82: ='[POINTS NQS  2012.XLS]Super Stock'!$A86 -> 80 | J82: ='[POINTS NQS  2012.XLS]Super Stock'!$B86 -> Chad Vogler | K82: ='[POINTS NQS  2012.XLS]Super Stock'!$C86 -> Jasper, IN | L82: ='[POINTS NQS  2012.XLS]Super Stock'!$D86 -> JRS | M82: ='[POINTS NQS  2012.XLS]Super Stock'!$E86 -> 516 | N82: =IF('[POINTS NQS  2012.XLS]Super Stock'!$F86=0," ",'[POINTS NQS  2012.XLS]Super Stock'!$F86) -> Bandit | O82: ='[POINTS NQS  2012.XLS]Super Stock'!$AA86 -> 118
A83: ='[POINTS NQS  2012.XLS]Pro Stock'!$A87 -> 81 | B83: ='[POINTS NQS  2012.XLS]Pro Stock'!$B87 -> Kevin Root | C83: ='[POINTS NQS  2012.XLS]Pro Stock'!$C87 -> Inola, OKLA | D83: ='[POINTS NQS  2012.XLS]Pro Stock'!$D87 -> Root | E83: ='[POINTS NQS  2012.XLS]Pro Stock'!$E87 -> 118 | F83: =IF('[POINTS NQS  2012.XLS]Pro Stock'!$F87=0," ",'[POINTS NQS  2012.XLS]Pro Stock'!$F87) -> Slap Shot | G83: ='[POINTS NQS  2012.XLS]Pro Stock'!$AA87 -> 115 | I83: ='[POINTS NQS  2012.XLS]Super Stock'!$A87 -> 81 | J83: ='[POINTS NQS  2012.XLS]Super Stock'!$B87 -> Scott Larkins | K83: ='[POINTS NQS  2012.XLS]Super Stock'!$C87 -> Kearney, MO | L83: ='[POINTS NQS  2012.XLS]Super Stock'!$D87 -> JRS | M83: ='[POINTS NQS  2012.XLS]Super Stock'!$E87 -> 154 | N83: =IF('[POINTS NQS  2012.XLS]Super Stock'!$F87=0," ",'[POINTS NQS  2012.XLS]Super Stock'!$F87) -> Silver Sam | O83: ='[POINTS NQS  2012.XLS]Super Stock'!$AA87 -> 118
A84: ='[POINTS NQS  2012.XLS]Pro Stock'!$A88 -> 82 | B84: ='[POINTS NQS  2012.XLS]Pro Stock'!$B88 -> Rick Slade | C84: ='[POINTS NQS  2012.XLS]Pro Stock'!$C88 -> Harveyville, KS | D84: ='[POINTS NQS  2012.XLS]Pro Stock'!$D88 -> JRS | E84: ='[POINTS NQS  2012.XLS]Pro Stock'!$E88 -> 467 | F84: =IF('[POINTS NQS  2012.XLS]Pro Stock'!$F88=0," ",'[POINTS NQS  2012.XLS]Pro Stock'!$F88) -> Ricochet | G84: ='[POINTS NQS  2012.XLS]Pro Stock'!$AA88 -> 115 | I84: ='[POINTS NQS  2012.XLS]Super Stock'!$A88 -> 82 | J84: ='[POINTS NQS  2012.XLS]Super Stock'!$B88 -> Todd Brest | K84: ='[POINTS NQS  2012.XLS]Super Stock'!$C88 -> Sharpsville, Pa | L84: ='[POINTS NQS  2012.XLS]Super Stock'!$D88 -> 0 | M84: ='[POINTS NQS  2012.XLS]Super Stock'!$E88 -> 272 | N84: =IF('[POINTS NQS  2012.XLS]Super Stock'!$F88=0," ",'[POINTS NQS  2012.XLS]Super Stock'!$F88) -> Cub | O84: ='[POINTS NQS  2012.XLS]Super Stock'!$AA88 -> 118
A85: ='[POINTS NQS  2012.XLS]Pro Stock'!$A89 -> 83 | B85: ='[POINTS NQS  2012.XLS]Pro Stock'!$B89 -> Shane Hadley | C85: ='[POINTS NQS  2012.XLS]Pro Stock'!$C89 -> Marion, KY | D85: ='[POINTS NQS  2012.XLS]Pro Stock'!$D89 -> JRS | E85: ='[POINTS NQS  2012.XLS]Pro Stock'!$E89 -> 505 | F85: =IF('[POINTS NQS  2012.XLS]Pro Stock'!$F89=0," ",'[POINTS NQS  2012.XLS]Pro Stock'!$F89) ->  | G85: ='[POINTS NQS  2012.XLS]Pro Stock'!$AA89 -> 115 | I85: ='[POINTS NQS  2012.XLS]Super Stock'!$A89 -> 83 | J85: ='[POINTS NQS  2012.XLS]Super Stock'!$B89 -> Doug Diehl | K85: ='[POINTS NQS  2012.XLS]Super Stock'!$C89 -> Smithsburg, PA | L85: ='[POINTS NQS  2012.XLS]Super Stock'!$D89 -> NP | M85: ='[POINTS NQS  2012.XLS]Super Stock'!$E89 -> 544 | N85: =IF('[POINTS NQS  2012.XLS]Super Stock'!$F89=0," ",'[POINTS NQS  2012.XLS]Super Stock'!$F89) -> 1 Bad MF | O85: ='[POINTS NQS  2012.XLS]Super Stock'!$AA89 -> 118
A86: ='[POINTS NQS  2012.XLS]Pro Stock'!$A90 -> 84 | B86: ='[POINTS NQS  2012.XLS]Pro Stock'!$B90 -> Brad Corzine | C86: ='[POINTS NQS  2012.XLS]Pro Stock'!$C90 -> Dongola, ILL | D86: ='[POINTS NQS  2012.XLS]Pro Stock'!$D90 -> JW | E86: ='[POINTS NQS  2012.XLS]Pro Stock'!$E90 -> 509 | F86: =IF('[POINTS NQS  2012.XLS]Pro Stock'!$F90=0," ",'[POINTS NQS  2012.XLS]Pro Stock'!$F90) -> Just Black | G86: ='[POINTS NQS  2012.XLS]Pro Stock'!$AA90 -> 115 | I86: ='[POINTS NQS  2012.XLS]Super Stock'!$A90 -> 84 | J86: ='[POINTS NQS  2012.XLS]Super Stock'!$B90 -> Tooter Campbell | K86: ='[POINTS NQS  2012.XLS]Super Stock'!$C90 -> Owensboro, KY | L86: ='[POINTS NQS  2012.XLS]Super Stock'!$D90 -> TC | M86: ='[POINTS NQS  2012.XLS]Super Stock'!$E90 -> 473 | N86: =IF('[POINTS NQS  2012.XLS]Super Stock'!$F90=0," ",'[POINTS NQS  2012.XLS]Super Stock'!$F90) -> Tractor Trash | O86: ='[POINTS NQS  2012.XLS]Super Stock'!$AA90 -> 118
A87: ='[POINTS NQS  2012.XLS]Pro Stock'!$A91 -> 85 | B87: ='[POINTS NQS  2012.XLS]Pro Stock'!$B91 -> Kyle Hunter | C87: ='[POINTS NQS  2012.XLS]Pro Stock'!$C91 -> Montoursville, Pa | D87: ='[POINTS NQS  2012.XLS]Pro Stock'!$D91 -> 0 | E87: ='[POINTS NQS  2012.XLS]Pro Stock'!$E91 -> 542 | F87: =IF('[POINTS NQS  2012.XLS]Pro Stock'!$F91=0," ",'[POINTS NQS  2012.XLS]Pro Stock'!$F91) ->  | G87: ='[POINTS NQS  2012.XLS]Pro Stock'!$AA91 -> 115 | I87: ='[POINTS NQS  2012.XLS]Super Stock'!$A91 -> 85 | J87: ='[POINTS NQS  2012.XLS]Super Stock'!$B91 -> Michael Hunter | K87: ='[POINTS NQS  2012.XLS]Super Stock'!$C91 -> Catawissa, Pa | L87: ='[POINTS NQS  2012.XLS]Super Stock'!$D91 -> 0 | M87: ='[POINTS NQS  2012.XLS]Super Stock'!$E91 -> 541 | N87: =IF('[POINTS NQS  2012.XLS]Super Stock'!$F91=0," ",'[POINTS NQS  2012.XLS]Super Stock'!$F91) ->  | O87: ='[POINTS NQS  2012.XLS]Super Stock'!$AA91 -> 118
A88: ='[POINTS NQS  2012.XLS]Pro Stock'!$A92 -> 86 | B88: ='[POINTS NQS  2012.XLS]Pro Stock'!$B92 -> Brandon Lohwinow | C88: ='[POINTS NQS  2012.XLS]Pro Stock'!$C92 -> Feigus.Ont CDA | D88: ='[POINTS NQS  2012.XLS]Pro Stock'!$D92 -> MWSC | E88: ='[POINTS NQS  2012.XLS]Pro Stock'!$E92 -> 550 | F88: =IF('[POINTS NQS  2012.XLS]Pro Stock'!$F92=0," ",'[POINTS NQS  2012.XLS]Pro Stock'!$F92) -> Mistress | G88: ='[POINTS NQS  2012.XLS]Pro Stock'!$AA92 -> 115 | I88: ='[POINTS NQS  2012.XLS]Super Stock'!$A92 -> 86 | J88: ='[POINTS NQS  2012.XLS]Super Stock'!$B92 -> Shaun Vogler | K88: ='[POINTS NQS  2012.XLS]Super Stock'!$C92 -> Jasper, IN | L88: ='[POINTS NQS  2012.XLS]Super Stock'!$D92 -> JRS | M88: ='[POINTS NQS  2012.XLS]Super Stock'!$E92 -> 129 | N88: =IF('[POINTS NQS  2012.XLS]Super Stock'!$F92=0," ",'[POINTS NQS  2012.XLS]Super Stock'!$F92) -> Renegade | O88: ='[POINTS NQS  2012.XLS]Super Stock'!$AA92 -> 119
A89: ='[POINTS NQS  2012.XLS]Pro Stock'!$A93 -> 87 | B89: ='[POINTS NQS  2012.XLS]Pro Stock'!$B93 -> Tim Bowling | C89: ='[POINTS NQS  2012.XLS]Pro Stock'!$C93 -> Syracuse, Ind | D89: ='[POINTS NQS  2012.XLS]Pro Stock'!$D93 -> LR | E89: ='[POINTS NQS  2012.XLS]Pro Stock'!$E93 -> 559 | F89: =IF('[POINTS NQS  2012.XLS]Pro Stock'!$F93=0," ",'[POINTS NQS  2012.XLS]Pro Stock'!$F93) -> Red Cub | G89: ='[POINTS NQS  2012.XLS]Pro Stock'!$AA93 -> 115 | I89: ='[POINTS NQS  2012.XLS]Super Stock'!$A93 -> 87 | J89: ='[POINTS NQS  2012.XLS]Super Stock'!$B93 -> Jeff Yager | K89: ='[POINTS NQS  2012.XLS]Super Stock'!$C93 -> Kokomo, IN | L89: ='[POINTS NQS  2012.XLS]Super Stock'!$D93 -> 0 | M89: ='[POINTS NQS  2012.XLS]Super Stock'!$E93 -> 451 | N89: =IF('[POINTS NQS  2012.XLS]Super Stock'!$F93=0," ",'[POINTS NQS  2012.XLS]Super Stock'!$F93) ->  | O89: ='[POINTS NQS  2012.XLS]Super Stock'!$AA93 -> 119
A90: ='[POINTS NQS  2012.XLS]Pro Stock'!$A94 -> 88 | B90: ='[POINTS NQS  2012.XLS]Pro Stock'!$B94 -> Bruce Austin | C90: ='[POINTS NQS  2012.XLS]Pro Stock'!$C94 -> St Charles, IA | D90: ='[POINTS NQS  2012.XLS]Pro Stock'!$D94 -> MVP | E90: ='[POINTS NQS  2012.XLS]Pro Stock'!$E94 -> 338 | F90: =IF('[POINTS NQS  2012.XLS]Pro Stock'!$F94=0," ",'[POINTS NQS  2012.XLS]Pro Stock'!$F94) -> Hillbilly Headache | G90: ='[POINTS NQS  2012.XLS]Pro Stock'!$AA94 -> 116 | I90: ='[POINTS NQS  2012.XLS]Super Stock'!$A94 -> 88 | J90: ='[POINTS NQS  2012.XLS]Super Stock'!$B94 -> Steve Vogler | K90: ='[POINTS NQS  2012.XLS]Super Stock'!$C94 -> Jasper, IN | L90: ='[POINTS NQS  2012.XLS]Super Stock'!$D94 -> JRS | M90: ='[POINTS NQS  2012.XLS]Super Stock'!$E94 -> 476 | N90: =IF('[POINTS NQS  2012.XLS]Super Stock'!$F94=0," ",'[POINTS NQS  2012.XLS]Super Stock'!$F94) -> Outlaw Reloaded | O90: ='[POINTS NQS  2012.XLS]Super Stock'!$AA94 -> 119
A91: ='[POINTS NQS  2012.XLS]Pro Stock'!$A95 -> 89 | B91: ='[POINTS NQS  2012.XLS]Pro Stock'!$B95 -> Kevin Qeveselle | C91: ='[POINTS NQS  2012.XLS]Pro Stock'!$C95 -> Syracuse, Ind | D91: ='[POINTS NQS  2012.XLS]Pro Stock'!$D95 -> LR | E91: ='[POINTS NQS  2012.XLS]Pro Stock'!$E95 -> 554 | F91: =IF('[POINTS NQS  2012.XLS]Pro Stock'!$F95=0," ",'[POINTS NQS  2012.XLS]Pro Stock'!$F95) -> Farmall A | G91: ='[POINTS NQS  2012.XLS]Pro Stock'!$AA95 -> 116 | I91: ='[POINTS NQS  2012.XLS]Super Stock'!$A95 -> 89 | J91: ='[POINTS NQS  2012.XLS]Super Stock'!$B95 -> Richard Lucabaugh | K91: ='[POINTS NQS  2012.XLS]Super Stock'!$C95 -> Glen Rock, PA | L91: ='[POINTS NQS  2012.XLS]Super Stock'!$D95 -> NP | M91: ='[POINTS NQS  2012.XLS]Super Stock'!$E95 -> 494 | N91: =IF('[POINTS NQS  2012.XLS]Super Stock'!$F95=0," ",'[POINTS NQS  2012.XLS]Super Stock'!$F95) -> Cub | O91: ='[POINTS NQS  2012.XLS]Super Stock'!$AA95 -> 119
I92: ='[POINTS NQS  2012.XLS]Super Stock'!$A96 -> 90 | J92: ='[POINTS NQS  2012.XLS]Super Stock'!$B96 -> Mike Dockhan | K92: ='[POINTS NQS  2012.XLS]Super Stock'!$C96 -> Imlay City, Mich | L92: ='[POINTS NQS  2012.XLS]Super Stock'!$D96 -> 0 | M92: ='[POINTS NQS  2012.XLS]Super Stock'!$E96 -> 530 | N92: =IF('[POINTS NQS  2012.XLS]Super Stock'!$F96=0," ",'[POINTS NQS  2012.XLS]Super Stock'!$F96) -> Plain Blue | O92: ='[POINTS NQS  2012.XLS]Super Stock'!$AA96 -> 119
I93: ='[POINTS NQS  2012.XLS]Super Stock'!$A97 -> 91 | J93: ='[POINTS NQS  2012.XLS]Super Stock'!$B97 -> Kevin Root | K93: ='[POINTS NQS  2012.XLS]Super Stock'!$C97 -> Inola, OK | L93: ='[POINTS NQS  2012.XLS]Super Stock'!$D97 -> Root | M93: ='[POINTS NQS  2012.XLS]Super Stock'!$E97 -> 117 | N93: =IF('[POINTS NQS  2012.XLS]Super Stock'!$F97=0," ",'[POINTS NQS  2012.XLS]Super Stock'!$F97) -> Right on the Money | O93: ='[POINTS NQS  2012.XLS]Super Stock'!$AA97 -> 120
I94: ='[POINTS NQS  2012.XLS]Super Stock'!$A98 -> 92 | J94: ='[POINTS NQS  2012.XLS]Super Stock'!$B98 -> Dave Gawatz | K94: ='[POINTS NQS  2012.XLS]Super Stock'!$C98 -> St. Joseph, MO | L94: ='[POINTS NQS  2012.XLS]Super Stock'!$D98 -> LR | M94: ='[POINTS NQS  2012.XLS]Super Stock'!$E98 -> 367 | N94: =IF('[POINTS NQS  2012.XLS]Super Stock'!$F98=0," ",'[POINTS NQS  2012.XLS]Super Stock'!$F98) -> Lil' Sprout | O94: ='[POINTS NQS  2012.XLS]Super Stock'!$AA98 -> 120
I95: ='[POINTS NQS  2012.XLS]Super Stock'!$A99 -> 93 | J95: ='[POINTS NQS  2012.XLS]Super Stock'!$B99 -> Denis Chilcoat | K95: ='[POINTS NQS  2012.XLS]Super Stock'!$C99 -> Seven Valley, PA | L95: ='[POINTS NQS  2012.XLS]Super Stock'!$D99 -> 0 | M95: ='[POINTS NQS  2012.XLS]Super Stock'!$E99 -> 528 | N95: =IF('[POINTS NQS  2012.XLS]Super Stock'!$F99=0," ",'[POINTS NQS  2012.XLS]Super Stock'!$F99) ->  | O95: ='[POINTS NQS  2012.XLS]Super Stock'!$AA99 -> 120
I96: ='[POINTS NQS  2012.XLS]Super Stock'!$A100 -> 94 | J96: ='[POINTS NQS  2012.XLS]Super Stock'!$B100 -> Ron Scroggins | K96: ='[POINTS NQS  2012.XLS]Super Stock'!$C100 -> Neosho, MO | L96: ='[POINTS NQS  2012.XLS]Super Stock'!$D100 -> VM | M96: ='[POINTS NQS  2012.XLS]Super Stock'!$E100 -> 110 | N96: =IF('[POINTS NQS  2012.XLS]Super Stock'!$F100=0," ",'[POINTS NQS  2012.XLS]Super Stock'!$F100) -> Dirt Dancer | O96: ='[POINTS NQS  2012.XLS]Super Stock'!$AA100 -> 121
I97: ='[POINTS NQS  2012.XLS]Super Stock'!$A101 -> 95 | J97: ='[POINTS NQS  2012.XLS]Super Stock'!$B101 -> Jeff Chrisman | K97: ='[POINTS NQS  2012.XLS]Super Stock'!$C101 -> Edinburgh, IN | L97: ='[POINTS NQS  2012.XLS]Super Stock'!$D101 -> VM | M97: ='[POINTS NQS  2012.XLS]Super Stock'!$E101 -> 180 | N97: =IF('[POINTS NQS  2012.XLS]Super Stock'!$F101=0," ",'[POINTS NQS  2012.XLS]Super Stock'!$F101) ->  | O97: ='[POINTS NQS  2012.XLS]Super Stock'!$AA101 -> 121
I98: ='[POINTS NQS  2012.XLS]Super Stock'!$A102 -> 96 | J98: ='[POINTS NQS  2012.XLS]Super Stock'!$B102 -> Bradley Corzine | K98: ='[POINTS NQS  2012.XLS]Super Stock'!$C102 -> Dongola, IL | L98: ='[POINTS NQS  2012.XLS]Super Stock'!$D102 -> JW | M98: ='[POINTS NQS  2012.XLS]Super Stock'!$E102 -> 509 | N98: =IF('[POINTS NQS  2012.XLS]Super Stock'!$F102=0," ",'[POINTS NQS  2012.XLS]Super Stock'!$F102) -> Just Black | O98: ='[POINTS NQS  2012.XLS]Super Stock'!$AA102 -> 121
I99: ='[POINTS NQS  2012.XLS]Super Stock'!$A103 -> 97 | J99: ='[POINTS NQS  2012.XLS]Super Stock'!$B103 -> Phil Burton | K99: ='[POINTS NQS  2012.XLS]Super Stock'!$C103 -> Kokomo, IN | L99: ='[POINTS NQS  2012.XLS]Super Stock'!$D103 -> Jagerville | M99: ='[POINTS NQS  2012.XLS]Super Stock'!$E103 -> 519 | N99: =IF('[POINTS NQS  2012.XLS]Super Stock'!$F103=0," ",'[POINTS NQS  2012.XLS]Super Stock'!$F103) -> Goofy Express | O99: ='[POINTS NQS  2012.XLS]Super Stock'!$AA103 -> 121
I100: ='[POINTS NQS  2012.XLS]Super Stock'!$A104 -> 98 | J100: ='[POINTS NQS  2012.XLS]Super Stock'!$B104 -> Kyle Hunter | K100: ='[POINTS NQS  2012.XLS]Super Stock'!$C104 -> Montoursville, Pa | L100: ='[POINTS NQS  2012.XLS]Super Stock'!$D104 -> 0 | M100: ='[POINTS NQS  2012.XLS]Super Stock'!$E104 -> 542 | N100: =IF('[POINTS NQS  2012.XLS]Super Stock'!$F104=0," ",'[POINTS NQS  2012.XLS]Super Stock'!$F104) ->  | O100: ='[POINTS NQS  2012.XLS]Super Stock'!$AA104 -> 121
I101: ='[POINTS NQS  2012.XLS]Super Stock'!$A105 -> 99 | J101: ='[POINTS NQS  2012.XLS]Super Stock'!$B105 -> Max Burkhart | K101: ='[POINTS NQS  2012.XLS]Super Stock'!$C105 -> Otwell, IN | L101: ='[POINTS NQS  2012.XLS]Super Stock'!$D105 -> TC | M101: ='[POINTS NQS  2012.XLS]Super Stock'!$E105 -> 78 | N101: =IF('[POINTS NQS  2012.XLS]Super Stock'!$F105=0," ",'[POINTS NQS  2012.XLS]Super Stock'!$F105) -> Ground Pounder | O101: ='[POINTS NQS  2012.XLS]Super Stock'!$AA105 -> 122
I102: ='[POINTS NQS  2012.XLS]Super Stock'!$A106 -> 100 | J102: ='[POINTS NQS  2012.XLS]Super Stock'!$B106 -> Lee Blesch | K102: ='[POINTS NQS  2012.XLS]Super Stock'!$C106 -> Holland, IN | L102: ='[POINTS NQS  2012.XLS]Super Stock'!$D106 -> TC | M102: ='[POINTS NQS  2012.XLS]Super Stock'!$E106 -> 344 | N102: =IF('[POINTS NQS  2012.XLS]Super Stock'!$F106=0," ",'[POINTS NQS  2012.XLS]Super Stock'!$F106) -> Orange Blossom Special | O102: ='[POINTS NQS  2012.XLS]Super Stock'!$AA106 -> 122
I103: ='[POINTS NQS  2012.XLS]Super Stock'!$A107 -> 101 | J103: ='[POINTS NQS  2012.XLS]Super Stock'!$B107 -> Scott DeFabritis | K103: ='[POINTS NQS  2012.XLS]Super Stock'!$C107 -> Kokomo, IN | L103: ='[POINTS NQS  2012.XLS]Super Stock'!$D107 -> Jagerville | M103: ='[POINTS NQS  2012.XLS]Super Stock'!$E107 -> 518 | N103: =IF('[POINTS NQS  2012.XLS]Super Stock'!$F107=0," ",'[POINTS NQS  2012.XLS]Super Stock'!$F107) -> Back Yard Banshee | O103: ='[POINTS NQS  2012.XLS]Super Stock'!$AA107 -> 122
I104: ='[POINTS NQS  2012.XLS]Super Stock'!$A108 -> 102 | J104: ='[POINTS NQS  2012.XLS]Super Stock'!$B108 -> Nick Moeller | K104: ='[POINTS NQS  2012.XLS]Super Stock'!$C108 -> Effingham, IL | L104: ='[POINTS NQS  2012.XLS]Super Stock'!$D108 -> Moeller | M104: ='[POINTS NQS  2012.XLS]Super Stock'!$E108 -> 520 | N104: =IF('[POINTS NQS  2012.XLS]Super Stock'!$F108=0," ",'[POINTS NQS  2012.XLS]Super Stock'!$F108) -> Bull on IX | O104: ='[POINTS NQS  2012.XLS]Super Stock'!$AA108 -> 122
I105: ='[POINTS NQS  2012.XLS]Super Stock'!$A109 -> 103 | J105: ='[POINTS NQS  2012.XLS]Super Stock'!$B109 -> Kevin Root | K105: ='[POINTS NQS  2012.XLS]Super Stock'!$C109 -> Inola, OK | L105: ='[POINTS NQS  2012.XLS]Super Stock'!$D109 -> Root | M105: ='[POINTS NQS  2012.XLS]Super Stock'!$E109 -> 118 | N105: =IF('[POINTS NQS  2012.XLS]Super Stock'!$F109=0," ",'[POINTS NQS  2012.XLS]Super Stock'!$F109) -> Slap Shot | O105: ='[POINTS NQS  2012.XLS]Super Stock'!$AA109 -> 123
I106: ='[POINTS NQS  2012.XLS]Super Stock'!$A110 -> 104 | J106: ='[POINTS NQS  2012.XLS]Super Stock'!$B110 -> Bradley Corzine | K106: ='[POINTS NQS  2012.XLS]Super Stock'!$C110 -> Dongola, IL | L106: ='[POINTS NQS  2012.XLS]Super Stock'!$D110 -> JW | M106: ='[POINTS NQS  2012.XLS]Super Stock'!$E110 -> 477 | N106: =IF('[POINTS NQS  2012.XLS]Super Stock'!$F110=0," ",'[POINTS NQS  2012.XLS]Super Stock'!$F110) -> Black Cat's Revenge | O106: ='[POINTS NQS  2012.XLS]Super Stock'!$AA110 -> 123
I107: ='[POINTS NQS  2012.XLS]Super Stock'!$A111 -> 105 | J107: ='[POINTS NQS  2012.XLS]Super Stock'!$B111 -> Shane Hadley | K107: ='[POINTS NQS  2012.XLS]Super Stock'!$C111 -> Marion, NY | L107: ='[POINTS NQS  2012.XLS]Super Stock'!$D111 -> JRS | M107: ='[POINTS NQS  2012.XLS]Super Stock'!$E111 -> 505 | N107: =IF('[POINTS NQS  2012.XLS]Super Stock'!$F111=0," ",'[POINTS NQS  2012.XLS]Super Stock'!$F111) ->  | O107: ='[POINTS NQS  2012.XLS]Super Stock'!$AA111 -> 123
I108: ='[POINTS NQS  2012.XLS]Super Stock'!$A112 -> 106 | J108: ='[POINTS NQS  2012.XLS]Super Stock'!$B112 -> Charlie Ciolino | K108: ='[POINTS NQS  2012.XLS]Super Stock'!$C112 -> Hammond, LA | L108: ='[POINTS NQS  2012.XLS]Super Stock'!$D112 -> MVP | M108: ='[POINTS NQS  2012.XLS]Super Stock'!$E112 -> 145 | N108: =IF('[POINTS NQS  2012.XLS]Super Stock'!$F112=0," ",'[POINTS NQS  2012.XLS]Super Stock'!$F112) -> Mechanical Nightmare | O108: ='[POINTS NQS  2012.XLS]Super Stock'!$AA112 -> 124
I109: ='[POINTS NQS  2012.XLS]Super Stock'!$A113 -> 107 | J109: ='[POINTS NQS  2012.XLS]Super Stock'!$B113 -> Rick Massey | K109: ='[POINTS NQS  2012.XLS]Super Stock'!$C113 -> Ava, MO | L109: ='[POINTS NQS  2012.XLS]Super Stock'!$D113 -> 0 | M109: ='[POINTS NQS  2012.XLS]Super Stock'!$E113 -> 420 | N109: =IF('[POINTS NQS  2012.XLS]Super Stock'!$F113=0," ",'[POINTS NQS  2012.XLS]Super Stock'!$F113) -> Special Addiction | O109: ='[POINTS NQS  2012.XLS]Super Stock'!$AA113 -> 125
I110: ='[POINTS NQS  2012.XLS]Super Stock'!$A114 -> 108 | J110: ='[POINTS NQS  2012.XLS]Super Stock'!$B114 -> Mike Kyle | K110: ='[POINTS NQS  2012.XLS]Super Stock'!$C114 -> Edinburgh, IN | L110: ='[POINTS NQS  2012.XLS]Super Stock'!$D114 -> VM | M110: ='[POINTS NQS  2012.XLS]Super Stock'!$E114 -> 394 | N110: =IF('[POINTS NQS  2012.XLS]Super Stock'!$F114=0," ",'[POINTS NQS  2012.XLS]Super Stock'!$F114) ->  | O110: ='[POINTS NQS  2012.XLS]Super Stock'!$AA114 -> 135