B1: 30 Cube | F1: Thru Tallmadge | I1: Pro V Twin | N1: Thru Tallmadge
B2: Name | C2: City/State | D2: NQS # | E2: Tractor | F2: Points Back | J2: Name | K2: City/State | L2: NQS # | M2: Tractor | N2: Points Back
A3: ='[POINTS NQS  2012.XLS]30 Cube'!$A7 -> 1 | B3: ='[POINTS NQS  2012.XLS]30 Cube'!$B7 -> Greg Heifner | C3: ='[POINTS NQS  2012.XLS]30 Cube'!$C7 -> Jeromesville, OH | D3: ='[POINTS NQS  2012.XLS]30 Cube'!$D7 -> 114 | E3: =IF('[POINTS NQS  2012.XLS]30 Cube'!$E7=0," ",'[POINTS NQS  2012.XLS]30 Cube'!$E7) -> Twisted | F3: ='[POINTS NQS  2012.XLS]30 Cube'!$AA7 -> 0 | I3: ='[POINTS NQS  2012.XLS]Pro V Twin'!$A7 -> 1 | J3: ='[POINTS NQS  2012.XLS]Pro V Twin'!$B7 -> Harrison Stahl | K3: ='[POINTS NQS  2012.XLS]Pro V Twin'!$C7 -> Dewitt,IA | L3: ='[POINTS NQS  2012.XLS]Pro V Twin'!$D7 -> 4 | M3: =IF('[POINTS NQS  2012.XLS]Pro V Twin'!$E7=0," ",'[POINTS NQS  2012.XLS]Pro V Twin'!$E7) -> Tons of Fun | N3: ='[POINTS NQS  2012.XLS]Pro V Twin'!$AA7 -> 0
A4: ='[POINTS NQS  2012.XLS]30 Cube'!$A8 -> 2 | B4: ='[POINTS NQS  2012.XLS]30 Cube'!$B8 -> Tony Heifner | C4: ='[POINTS NQS  2012.XLS]30 Cube'!$C8 -> Jeromesville, OH | D4: ='[POINTS NQS  2012.XLS]30 Cube'!$D8 -> 116 | E4: =IF('[POINTS NQS  2012.XLS]30 Cube'!$E8=0," ",'[POINTS NQS  2012.XLS]30 Cube'!$E8) -> Heartbeat | F4: ='[POINTS NQS  2012.XLS]30 Cube'!$AA8 -> 2 | I4: ='[POINTS NQS  2012.XLS]Pro V Twin'!$A8 -> 2 | J4: ='[POINTS NQS  2012.XLS]Pro V Twin'!$B8 -> Kenny Cornelison | K4: ='[POINTS NQS  2012.XLS]Pro V Twin'!$C8 -> Richmond, KY | L4: ='[POINTS NQS  2012.XLS]Pro V Twin'!$D8 -> 149 | M4: =IF('[POINTS NQS  2012.XLS]Pro V Twin'!$E8=0," ",'[POINTS NQS  2012.XLS]Pro V Twin'!$E8) -> Storm Alert | N4: ='[POINTS NQS  2012.XLS]Pro V Twin'!$AA8 -> 4
A5: ='[POINTS NQS  2012.XLS]30 Cube'!$A9 -> 3 | B5: ='[POINTS NQS  2012.XLS]30 Cube'!$B9 -> Tony Lewis | C5: ='[POINTS NQS  2012.XLS]30 Cube'!$C9 -> Edinburgh, IN | D5: ='[POINTS NQS  2012.XLS]30 Cube'!$D9 -> 345 | E5: =IF('[POINTS NQS  2012.XLS]30 Cube'!$E9=0," ",'[POINTS NQS  2012.XLS]30 Cube'!$E9) -> Plain Jane | F5: ='[POINTS NQS  2012.XLS]30 Cube'!$AA9 -> 2 | I5: ='[POINTS NQS  2012.XLS]Pro V Twin'!$A9 -> 3 | J5: ='[POINTS NQS  2012.XLS]Pro V Twin'!$B9 -> Rob Wise | K5: ='[POINTS NQS  2012.XLS]Pro V Twin'!$C9 -> Greensburg, PA | L5: ='[POINTS NQS  2012.XLS]Pro V Twin'!$D9 -> 209 | M5: =IF('[POINTS NQS  2012.XLS]Pro V Twin'!$E9=0," ",'[POINTS NQS  2012.XLS]Pro V Twin'!$E9) -> Long Shot | N5: ='[POINTS NQS  2012.XLS]Pro V Twin'!$AA9 -> 5
A6: ='[POINTS NQS  2012.XLS]30 Cube'!$A10 -> 4 | B6: ='[POINTS NQS  2012.XLS]30 Cube'!$B10 -> Pat Roth | C6: ='[POINTS NQS  2012.XLS]30 Cube'!$C10 -> Idaville, IN | D6: ='[POINTS NQS  2012.XLS]30 Cube'!$D10 -> 61 | E6: =IF('[POINTS NQS  2012.XLS]30 Cube'!$E10=0," ",'[POINTS NQS  2012.XLS]30 Cube'!$E10) ->  | F6: ='[POINTS NQS  2012.XLS]30 Cube'!$AA10 -> 3 | I6: ='[POINTS NQS  2012.XLS]Pro V Twin'!$A10 -> 4 | J6: ='[POINTS NQS  2012.XLS]Pro V Twin'!$B10 -> Jim Hull | K6: ='[POINTS NQS  2012.XLS]Pro V Twin'!$C10 -> Brandon, WI | L6: ='[POINTS NQS  2012.XLS]Pro V Twin'!$D10 -> 334 | M6: =IF('[POINTS NQS  2012.XLS]Pro V Twin'!$E10=0," ",'[POINTS NQS  2012.XLS]Pro V Twin'!$E10) -> Simply Irresistable | N6: ='[POINTS NQS  2012.XLS]Pro V Twin'!$AA10 -> 7
A7: ='[POINTS NQS  2012.XLS]30 Cube'!$A11 -> 5 | B7: ='[POINTS NQS  2012.XLS]30 Cube'!$B11 -> Shawn Garman | C7: ='[POINTS NQS  2012.XLS]30 Cube'!$C11 -> Perrysville, Oh | D7: ='[POINTS NQS  2012.XLS]30 Cube'!$D11 -> 230 | E7: =IF('[POINTS NQS  2012.XLS]30 Cube'!$E11=0," ",'[POINTS NQS  2012.XLS]30 Cube'!$E11) -> Gun Slinger | F7: ='[POINTS NQS  2012.XLS]30 Cube'!$AA11 -> 29 | I7: ='[POINTS NQS  2012.XLS]Pro V Twin'!$A11 -> 5 | J7: ='[POINTS NQS  2012.XLS]Pro V Twin'!$B11 -> Mike Spencer | K7: ='[POINTS NQS  2012.XLS]Pro V Twin'!$C11 -> West Alexandria, WI | L7: ='[POINTS NQS  2012.XLS]Pro V Twin'!$D11 -> 278 | M7: =IF('[POINTS NQS  2012.XLS]Pro V Twin'!$E11=0," ",'[POINTS NQS  2012.XLS]Pro V Twin'!$E11) -> Long Shot | N7: ='[POINTS NQS  2012.XLS]Pro V Twin'!$AA11 -> 11
A8: ='[POINTS NQS  2012.XLS]30 Cube'!$A12 -> 6 | B8: ='[POINTS NQS  2012.XLS]30 Cube'!$B12 -> Doug Rood | C8: ='[POINTS NQS  2012.XLS]30 Cube'!$C12 -> Ypsilanti, MI | D8: ='[POINTS NQS  2012.XLS]30 Cube'!$D12 -> 354 | E8: =IF('[POINTS NQS  2012.XLS]30 Cube'!$E12=0," ",'[POINTS NQS  2012.XLS]30 Cube'!$E12) -> Blue Dawg | F8: ='[POINTS NQS  2012.XLS]30 Cube'!$AA12 -> 29 | I8: ='[POINTS NQS  2012.XLS]Pro V Twin'!$A12 -> 6 | J8: ='[POINTS NQS  2012.XLS]Pro V Twin'!$B12 -> Ryan Richter | K8: ='[POINTS NQS  2012.XLS]Pro V Twin'!$C12 -> Connellsville, PA | L8: ='[POINTS NQS  2012.XLS]Pro V Twin'!$D12 -> 502 | M8: =IF('[POINTS NQS  2012.XLS]Pro V Twin'!$E12=0," ",'[POINTS NQS  2012.XLS]Pro V Twin'!$E12) -> Radical Rat | N8: ='[POINTS NQS  2012.XLS]Pro V Twin'!$AA12 -> 11
A9: ='[POINTS NQS  2012.XLS]30 Cube'!$A13 -> 7 | B9: ='[POINTS NQS  2012.XLS]30 Cube'!$B13 -> Rick Massey | C9: ='[POINTS NQS  2012.XLS]30 Cube'!$C13 -> Ava, MO | D9: ='[POINTS NQS  2012.XLS]30 Cube'!$D13 -> 421 | E9: =IF('[POINTS NQS  2012.XLS]30 Cube'!$E13=0," ",'[POINTS NQS  2012.XLS]30 Cube'!$E13) -> Spare Parts | F9: ='[POINTS NQS  2012.XLS]30 Cube'!$AA13 -> 30 | I9: ='[POINTS NQS  2012.XLS]Pro V Twin'!$A13 -> 7 | J9: ='[POINTS NQS  2012.XLS]Pro V Twin'!$B13 -> Lowell Vis | K9: ='[POINTS NQS  2012.XLS]Pro V Twin'!$C13 -> Waupun, WI | L9: ='[POINTS NQS  2012.XLS]Pro V Twin'!$D13 -> 333 | M9: =IF('[POINTS NQS  2012.XLS]Pro V Twin'!$E13=0," ",'[POINTS NQS  2012.XLS]Pro V Twin'!$E13) -> Skittles | N9: ='[POINTS NQS  2012.XLS]Pro V Twin'!$AA13 -> 12
A10: ='[POINTS NQS  2012.XLS]30 Cube'!$A14 -> 8 | B10: ='[POINTS NQS  2012.XLS]30 Cube'!$B14 -> Randy Amstutz | C10: ='[POINTS NQS  2012.XLS]30 Cube'!$C14 -> Berne, In | D10: ='[POINTS NQS  2012.XLS]30 Cube'!$D14 -> 534 | E10: =IF('[POINTS NQS  2012.XLS]30 Cube'!$E14=0," ",'[POINTS NQS  2012.XLS]30 Cube'!$E14) ->  | F10: ='[POINTS NQS  2012.XLS]30 Cube'!$AA14 -> 31 | I10: ='[POINTS NQS  2012.XLS]Pro V Twin'!$A14 -> 8 | J10: ='[POINTS NQS  2012.XLS]Pro V Twin'!$B14 -> Kenny Cornelison | K10: ='[POINTS NQS  2012.XLS]Pro V Twin'!$C14 -> Richmond, KY | L10: ='[POINTS NQS  2012.XLS]Pro V Twin'!$D14 -> 536 | M10: =IF('[POINTS NQS  2012.XLS]Pro V Twin'!$E14=0," ",'[POINTS NQS  2012.XLS]Pro V Twin'!$E14) -> Storm X | N10: ='[POINTS NQS  2012.XLS]Pro V Twin'!$AA14 -> 32
A11: ='[POINTS NQS  2012.XLS]30 Cube'!$A15 -> 9 | B11: ='[POINTS NQS  2012.XLS]30 Cube'!$B15 -> George Bax | C11: ='[POINTS NQS  2012.XLS]30 Cube'!$C15 -> St. Thomas, MO | D11: ='[POINTS NQS  2012.XLS]30 Cube'!$D15 -> 422 | E11: =IF('[POINTS NQS  2012.XLS]30 Cube'!$E15=0," ",'[POINTS NQS  2012.XLS]30 Cube'!$E15) -> Plum Crazy | F11: ='[POINTS NQS  2012.XLS]30 Cube'!$AA15 -> 33 | I11: ='[POINTS NQS  2012.XLS]Pro V Twin'!$A15 -> 9 | J11: ='[POINTS NQS  2012.XLS]Pro V Twin'!$B15 -> Jerry Everhart | K11: ='[POINTS NQS  2012.XLS]Pro V Twin'!$C15 -> Springfield, OH | L11: ='[POINTS NQS  2012.XLS]Pro V Twin'!$D15 -> 483 | M11: =IF('[POINTS NQS  2012.XLS]Pro V Twin'!$E15=0," ",'[POINTS NQS  2012.XLS]Pro V Twin'!$E15) -> Orange Cart | N11: ='[POINTS NQS  2012.XLS]Pro V Twin'!$AA15 -> 36
A12: ='[POINTS NQS  2012.XLS]30 Cube'!$A16 -> 10 | B12: ='[POINTS NQS  2012.XLS]30 Cube'!$B16 -> Greg Block | C12: ='[POINTS NQS  2012.XLS]30 Cube'!$C16 -> Jefferson City, MO | D12: ='[POINTS NQS  2012.XLS]30 Cube'!$D16 -> 435 | E12: =IF('[POINTS NQS  2012.XLS]30 Cube'!$E16=0," ",'[POINTS NQS  2012.XLS]30 Cube'!$E16) -> Pocket Change | F12: ='[POINTS NQS  2012.XLS]30 Cube'!$AA16 -> 34 | I12: ='[POINTS NQS  2012.XLS]Pro V Twin'!$A16 -> 10 | J12: ='[POINTS NQS  2012.XLS]Pro V Twin'!$B16 -> Shawn Dukes | K12: ='[POINTS NQS  2012.XLS]Pro V Twin'!$C16 -> Cavert City, KY | L12: ='[POINTS NQS  2012.XLS]Pro V Twin'!$D16 -> 521 | M12: =IF('[POINTS NQS  2012.XLS]Pro V Twin'!$E16=0," ",'[POINTS NQS  2012.XLS]Pro V Twin'!$E16) -> Blown | N12: ='[POINTS NQS  2012.XLS]Pro V Twin'!$AA16 -> 37
A13: ='[POINTS NQS  2012.XLS]30 Cube'!$A17 -> 11 | B13: ='[POINTS NQS  2012.XLS]30 Cube'!$B17 -> Kole Larkins | C13: ='[POINTS NQS  2012.XLS]30 Cube'!$C17 -> Kearney, MO | D13: ='[POINTS NQS  2012.XLS]30 Cube'!$D17 -> 372 | E13: =IF('[POINTS NQS  2012.XLS]30 Cube'!$E17=0," ",'[POINTS NQS  2012.XLS]30 Cube'!$E17) -> Wound Up | F13: ='[POINTS NQS  2012.XLS]30 Cube'!$AA17 -> 35 | I13: ='[POINTS NQS  2012.XLS]Pro V Twin'!$A17 -> 11 | J13: ='[POINTS NQS  2012.XLS]Pro V Twin'!$B17 -> Matt Kaster | K13: ='[POINTS NQS  2012.XLS]Pro V Twin'!$C17 -> Burlington, IA | L13: ='[POINTS NQS  2012.XLS]Pro V Twin'!$D17 -> 99 | M13: =IF('[POINTS NQS  2012.XLS]Pro V Twin'!$E17=0," ",'[POINTS NQS  2012.XLS]Pro V Twin'!$E17) -> Sound of Madness | N13: ='[POINTS NQS  2012.XLS]Pro V Twin'!$AA17 -> 38
A14: ='[POINTS NQS  2012.XLS]30 Cube'!$A18 -> 12 | B14: ='[POINTS NQS  2012.XLS]30 Cube'!$B18 -> Ben Larkins | C14: ='[POINTS NQS  2012.XLS]30 Cube'!$C18 -> Kearney, MO | D14: ='[POINTS NQS  2012.XLS]30 Cube'!$D18 -> 137 | E14: =IF('[POINTS NQS  2012.XLS]30 Cube'!$E18=0," ",'[POINTS NQS  2012.XLS]30 Cube'!$E18) -> Indian Outlaw | F14: ='[POINTS NQS  2012.XLS]30 Cube'!$AA18 -> 36 | I14: ='[POINTS NQS  2012.XLS]Pro V Twin'!$A18 -> 12 | J14: ='[POINTS NQS  2012.XLS]Pro V Twin'!$B18 -> Ryan Shafer | K14: ='[POINTS NQS  2012.XLS]Pro V Twin'!$C18 -> Confluence, Pa | L14: ='[POINTS NQS  2012.XLS]Pro V Twin'!$D18 -> 445 | M14: =IF('[POINTS NQS  2012.XLS]Pro V Twin'!$E18=0," ",'[POINTS NQS  2012.XLS]Pro V Twin'!$E18) -> LabRat | N14: ='[POINTS NQS  2012.XLS]Pro V Twin'!$AA18 -> 38
B22: OPEN SUPER STOCK | F22: Thru Tallmage
B23: Name | C23: City/State | D23: NQS # | E23: Tractor | F23: Points Back
A24: ='[POINTS NQS  2012.XLS]Open Super Stock'!$A7 -> 1 | B24: ='[POINTS NQS  2012.XLS]Open Super Stock'!$B7 -> Julian Stahl | C24: ='[POINTS NQS  2012.XLS]Open Super Stock'!$C7 -> Welton, IA | D24: ='[POINTS NQS  2012.XLS]Open Super Stock'!$D7 -> 5 | E24: =IF('[POINTS NQS  2012.XLS]Open Super Stock'!$E7=0," ",'[POINTS NQS  2012.XLS]Open Super Stock'!$E7) -> Midwest Express | F24: ='[POINTS NQS  2012.XLS]Open Super Stock'!$AA7 -> 0
A25: ='[POINTS NQS  2012.XLS]Open Super Stock'!$A8 -> 2 | B25: ='[POINTS NQS  2012.XLS]Open Super Stock'!$B8 -> Harrison Stahl | C25: ='[POINTS NQS  2012.XLS]Open Super Stock'!$C8 -> Dewitt, IA | D25: ='[POINTS NQS  2012.XLS]Open Super Stock'!$D8 -> 4 | E25: =IF('[POINTS NQS  2012.XLS]Open Super Stock'!$E8=0," ",'[POINTS NQS  2012.XLS]Open Super Stock'!$E8) -> Ton of Fun | F25: ='[POINTS NQS  2012.XLS]Open Super Stock'!$AA8 -> 4
A26: ='[POINTS NQS  2012.XLS]Open Super Stock'!$A9 -> 3 | B26: ='[POINTS NQS  2012.XLS]Open Super Stock'!$B9 -> Julian Stahl | C26: ='[POINTS NQS  2012.XLS]Open Super Stock'!$C9 -> Welton, IA | D26: ='[POINTS NQS  2012.XLS]Open Super Stock'!$D9 -> 433 | E26: =IF('[POINTS NQS  2012.XLS]Open Super Stock'!$E9=0," ",'[POINTS NQS  2012.XLS]Open Super Stock'!$E9) -> Fully Charged | F26: ='[POINTS NQS  2012.XLS]Open Super Stock'!$AA9 -> 10
A27: ='[POINTS NQS  2012.XLS]Open Super Stock'!$A10 -> 4 | B27: ='[POINTS NQS  2012.XLS]Open Super Stock'!$B10 -> Ryan Richter | C27: ='[POINTS NQS  2012.XLS]Open Super Stock'!$C10 -> Connellsville, PA | D27: ='[POINTS NQS  2012.XLS]Open Super Stock'!$D10 -> 502 | E27: =IF('[POINTS NQS  2012.XLS]Open Super Stock'!$E10=0," ",'[POINTS NQS  2012.XLS]Open Super Stock'!$E10) -> Radical Rat | F27: ='[POINTS NQS  2012.XLS]Open Super Stock'!$AA10 -> 21
A28: ='[POINTS NQS  2012.XLS]Open Super Stock'!$A11 -> 5 | B28: ='[POINTS NQS  2012.XLS]Open Super Stock'!$B11 -> Ryan Shafer | C28: ='[POINTS NQS  2012.XLS]Open Super Stock'!$C11 -> Confluence, PA | D28: ='[POINTS NQS  2012.XLS]Open Super Stock'!$D11 -> 445 | E28: =IF('[POINTS NQS  2012.XLS]Open Super Stock'!$E11=0," ",'[POINTS NQS  2012.XLS]Open Super Stock'!$E11) -> Labrat | F28: ='[POINTS NQS  2012.XLS]Open Super Stock'!$AA11 -> 28
A29: ='[POINTS NQS  2012.XLS]Open Super Stock'!$A12 -> 6 | B29: ='[POINTS NQS  2012.XLS]Open Super Stock'!$B12 -> Calvin Becker | C29: ='[POINTS NQS  2012.XLS]Open Super Stock'!$C12 -> Whipple, Oh | D29: ='[POINTS NQS  2012.XLS]Open Super Stock'!$D12 -> 113 | E29: =IF('[POINTS NQS  2012.XLS]Open Super Stock'!$E12=0," ",'[POINTS NQS  2012.XLS]Open Super Stock'!$E12) -> Spike | F29: ='[POINTS NQS  2012.XLS]Open Super Stock'!$AA12 -> 61
A30: ='[POINTS NQS  2012.XLS]Open Super Stock'!$A13 -> 7 | B30: ='[POINTS NQS  2012.XLS]Open Super Stock'!$B13 -> Bill Jacobson | C30: ='[POINTS NQS  2012.XLS]Open Super Stock'!$C13 -> Washington, Mi | D30: ='[POINTS NQS  2012.XLS]Open Super Stock'!$D13 -> 531 | E30: =IF('[POINTS NQS  2012.XLS]Open Super Stock'!$E13=0," ",'[POINTS NQS  2012.XLS]Open Super Stock'!$E13) -> Smoker 1 | F30: ='[POINTS NQS  2012.XLS]Open Super Stock'!$AA13 -> 66
A31: ='[POINTS NQS  2012.XLS]Open Super Stock'!$A14 -> 8 | B31: ='[POINTS NQS  2012.XLS]Open Super Stock'!$B14 -> Bruce Austin | C31: ='[POINTS NQS  2012.XLS]Open Super Stock'!$C14 -> St. Charles, IA | D31: ='[POINTS NQS  2012.XLS]Open Super Stock'!$D14 -> 169 | E31: =IF('[POINTS NQS  2012.XLS]Open Super Stock'!$E14=0," ",'[POINTS NQS  2012.XLS]Open Super Stock'!$E14) -> Thundertaker | F31: ='[POINTS NQS  2012.XLS]Open Super Stock'!$AA14 -> 67
A32: ='[POINTS NQS  2012.XLS]Open Super Stock'!$A15 -> 9 | B32: ='[POINTS NQS  2012.XLS]Open Super Stock'!$B15 -> Jerry Everhart | C32: ='[POINTS NQS  2012.XLS]Open Super Stock'!$C15 -> Springfield, OH | D32: ='[POINTS NQS  2012.XLS]Open Super Stock'!$D15 -> 483 | E32: =IF('[POINTS NQS  2012.XLS]Open Super Stock'!$E15=0," ",'[POINTS NQS  2012.XLS]Open Super Stock'!$E15) ->  | F32: ='[POINTS NQS  2012.XLS]Open Super Stock'!$AA15 -> 68
A33: ='[POINTS NQS  2012.XLS]Open Super Stock'!$A16 -> 10 | B33: ='[POINTS NQS  2012.XLS]Open Super Stock'!$B16 -> Ken Lucious | C33: ='[POINTS NQS  2012.XLS]Open Super Stock'!$C16 -> Piro, Oh | D33: ='[POINTS NQS  2012.XLS]Open Super Stock'!$D16 -> 156 | E33: =IF('[POINTS NQS  2012.XLS]Open Super Stock'!$E16=0," ",'[POINTS NQS  2012.XLS]Open Super Stock'!$E16) ->  | F33: ='[POINTS NQS  2012.XLS]Open Super Stock'!$AA16 -> 72
A34: ='[POINTS NQS  2012.XLS]Open Super Stock'!$A17 -> 11 | B34: ='[POINTS NQS  2012.XLS]Open Super Stock'!$B17 -> Russ Nichols | C34: ='[POINTS NQS  2012.XLS]Open Super Stock'!$C17 -> Lore City, Oh | D34: ='[POINTS NQS  2012.XLS]Open Super Stock'!$D17 -> 552 | E34: =IF('[POINTS NQS  2012.XLS]Open Super Stock'!$E17=0," ",'[POINTS NQS  2012.XLS]Open Super Stock'!$E17) ->  | F34: ='[POINTS NQS  2012.XLS]Open Super Stock'!$AA17 -> 76
A35: ='[POINTS NQS  2012.XLS]Open Super Stock'!$A18 -> 12 | B35: ='[POINTS NQS  2012.XLS]Open Super Stock'!$B18 -> Greg Watson | C35: ='[POINTS NQS  2012.XLS]Open Super Stock'!$C18 -> Republic, Oh | D35: ='[POINTS NQS  2012.XLS]Open Super Stock'!$D18 -> 341 | E35: =IF('[POINTS NQS  2012.XLS]Open Super Stock'!$E18=0," ",'[POINTS NQS  2012.XLS]Open Super Stock'!$E18) -> Odd Couple | F35: ='[POINTS NQS  2012.XLS]Open Super Stock'!$AA18 -> 88
A36: ='[POINTS NQS  2012.XLS]Open Super Stock'!$A19 -> 13 | B36: ='[POINTS NQS  2012.XLS]Open Super Stock'!$B19 -> Shane Hadley | C36: ='[POINTS NQS  2012.XLS]Open Super Stock'!$C19 -> Marion, NY | D36: ='[POINTS NQS  2012.XLS]Open Super Stock'!$D19 -> 505 | E36: =IF('[POINTS NQS  2012.XLS]Open Super Stock'!$E19=0," ",'[POINTS NQS  2012.XLS]Open Super Stock'!$E19) ->  | F36: ='[POINTS NQS  2012.XLS]Open Super Stock'!$AA19 -> 91
A37: ='[POINTS NQS  2012.XLS]Open Super Stock'!$A20 -> 14 | B37: ='[POINTS NQS  2012.XLS]Open Super Stock'!$B20 -> Mike Spencer | C37: ='[POINTS NQS  2012.XLS]Open Super Stock'!$C20 -> West Alexandria, Oh | D37: ='[POINTS NQS  2012.XLS]Open Super Stock'!$D20 -> 278 | E37: =IF('[POINTS NQS  2012.XLS]Open Super Stock'!$E20=0," ",'[POINTS NQS  2012.XLS]Open Super Stock'!$E20) -> Longshot | F37: ='[POINTS NQS  2012.XLS]Open Super Stock'!$AA20 -> 93
A38: ='[POINTS NQS  2012.XLS]Open Super Stock'!$A21 -> 15 | B38: ='[POINTS NQS  2012.XLS]Open Super Stock'!$B21 -> Robert Kauffman | C38: ='[POINTS NQS  2012.XLS]Open Super Stock'!$C21 -> Ruffsdale, Pa | D38: ='[POINTS NQS  2012.XLS]Open Super Stock'!$D21 -> 560 | E38: =IF('[POINTS NQS  2012.XLS]Open Super Stock'!$E21=0," ",'[POINTS NQS  2012.XLS]Open Super Stock'!$E21) -> Red Blooded | F38: ='[POINTS NQS  2012.XLS]Open Super Stock'!$AA21 -> 96