A1: STOCK ALTERED 1050 | G1: Thru Tallmadge | I1: STOCK ALTERED 1100 | O1: Thru Tallmadge
B2: Name | C2: City/State | D2: Eng | E2: NQS # | F2: Tractor | G2: Points Back | J2: Name | K2: City | L2: Eng | M2: NQS# | N2: Tractor | O2: Points Back
A3: ='[POINTS NQS  2012.XLS]Stock Altered 1050'!$A6 -> 1 | B3: ='[POINTS NQS  2012.XLS]Stock Altered 1050'!$B6 -> Ron Hodge | C3: ='[POINTS NQS  2012.XLS]Stock Altered 1050'!$C6 -> Hillsboro, OH | D3: ='[POINTS NQS  2012.XLS]Stock Altered 1050'!$D6 -> TV | E3: ='[POINTS NQS  2012.XLS]Stock Altered 1050'!$E6 -> 71 | F3: =IF('[POINTS NQS  2012.XLS]Stock Altered 1050'!$F6=0," ",'[POINTS NQS  2012.XLS]Stock Altered 1050'!$F6) -> Take-N-Names | G3: ='[POINTS NQS  2012.XLS]Stock Altered 1050'!AA6 -> 0 | I3: ='[POINTS NQS  2012.XLS]Stock Altered 1100'!$A6 -> 1 | J3: ='[POINTS NQS  2012.XLS]Stock Altered 1100'!$B6 -> Matt Ronnebaum | K3: ='[POINTS NQS  2012.XLS]Stock Altered 1100'!$C6 -> Celina, OH | L3: ='[POINTS NQS  2012.XLS]Stock Altered 1100'!$D6 -> TV | M3: ='[POINTS NQS  2012.XLS]Stock Altered 1100'!$E6 -> 89 | N3: =IF('[POINTS NQS  2012.XLS]Stock Altered 1100'!$F6=0," ",'[POINTS NQS  2012.XLS]Stock Altered 1100'!$F6) -> Boys & Their Toys | O3: ='[POINTS NQS  2012.XLS]Stock Altered 1100'!AA6 -> 0
A4: ='[POINTS NQS  2012.XLS]Stock Altered 1050'!$A7 -> 2 | B4: ='[POINTS NQS  2012.XLS]Stock Altered 1050'!$B7 -> Colt Vorhees | C4: ='[POINTS NQS  2012.XLS]Stock Altered 1050'!$C7 -> Rockbridge, OH | D4: ='[POINTS NQS  2012.XLS]Stock Altered 1050'!$D7 -> TV | E4: ='[POINTS NQS  2012.XLS]Stock Altered 1050'!$E7 -> 313 | F4: =IF('[POINTS NQS  2012.XLS]Stock Altered 1050'!$F7=0," ",'[POINTS NQS  2012.XLS]Stock Altered 1050'!$F7) -> Red Cadet | G4: ='[POINTS NQS  2012.XLS]Stock Altered 1050'!AA7 -> 11 | I4: ='[POINTS NQS  2012.XLS]Stock Altered 1100'!$A7 -> 2 | J4: ='[POINTS NQS  2012.XLS]Stock Altered 1100'!$B7 -> Mark Peters | K4: ='[POINTS NQS  2012.XLS]Stock Altered 1100'!$C7 -> McArthur, PA | L4: ='[POINTS NQS  2012.XLS]Stock Altered 1100'!$D7 -> JRS | M4: ='[POINTS NQS  2012.XLS]Stock Altered 1100'!$E7 -> 469 | N4: =IF('[POINTS NQS  2012.XLS]Stock Altered 1100'!$F7=0," ",'[POINTS NQS  2012.XLS]Stock Altered 1100'!$F7) -> American Ride | O4: ='[POINTS NQS  2012.XLS]Stock Altered 1100'!AA7 -> 8
A5: ='[POINTS NQS  2012.XLS]Stock Altered 1050'!$A8 -> 3 | B5: ='[POINTS NQS  2012.XLS]Stock Altered 1050'!$B8 -> Greg Watson | C5: ='[POINTS NQS  2012.XLS]Stock Altered 1050'!$C8 -> Batavia, OH | D5: ='[POINTS NQS  2012.XLS]Stock Altered 1050'!$D8 -> NP | E5: ='[POINTS NQS  2012.XLS]Stock Altered 1050'!$E8 -> 327 | F5: =IF('[POINTS NQS  2012.XLS]Stock Altered 1050'!$F8=0," ",'[POINTS NQS  2012.XLS]Stock Altered 1050'!$F8) -> Road Warrior | G5: ='[POINTS NQS  2012.XLS]Stock Altered 1050'!AA8 -> 13 | I5: ='[POINTS NQS  2012.XLS]Stock Altered 1100'!$A8 -> 3 | J5: ='[POINTS NQS  2012.XLS]Stock Altered 1100'!$B8 -> Tim Shaw | K5: ='[POINTS NQS  2012.XLS]Stock Altered 1100'!$C8 -> Rockbridge, OH | L5: ='[POINTS NQS  2012.XLS]Stock Altered 1100'!$D8 -> TV | M5: ='[POINTS NQS  2012.XLS]Stock Altered 1100'!$E8 -> 454 | N5: =IF('[POINTS NQS  2012.XLS]Stock Altered 1100'!$F8=0," ",'[POINTS NQS  2012.XLS]Stock Altered 1100'!$F8) -> Heavy Hauler | O5: ='[POINTS NQS  2012.XLS]Stock Altered 1100'!AA8 -> 9
A6: ='[POINTS NQS  2012.XLS]Stock Altered 1050'!$A9 -> 4 | B6: ='[POINTS NQS  2012.XLS]Stock Altered 1050'!$B9 -> Gary Cunningham | C6: ='[POINTS NQS  2012.XLS]Stock Altered 1050'!$C9 -> Brooksville, KY | D6: ='[POINTS NQS  2012.XLS]Stock Altered 1050'!$D9 -> NP | E6: ='[POINTS NQS  2012.XLS]Stock Altered 1050'!$E9 -> 162 | F6: =IF('[POINTS NQS  2012.XLS]Stock Altered 1050'!$F9=0," ",'[POINTS NQS  2012.XLS]Stock Altered 1050'!$F9) -> High Voltage | G6: ='[POINTS NQS  2012.XLS]Stock Altered 1050'!AA9 -> 14 | I6: ='[POINTS NQS  2012.XLS]Stock Altered 1100'!$A9 -> 4 | J6: ='[POINTS NQS  2012.XLS]Stock Altered 1100'!$B9 -> Colt Vorhees | K6: ='[POINTS NQS  2012.XLS]Stock Altered 1100'!$C9 -> Rockbridge, OH | L6: ='[POINTS NQS  2012.XLS]Stock Altered 1100'!$D9 -> TV | M6: ='[POINTS NQS  2012.XLS]Stock Altered 1100'!$E9 -> 313 | N6: =IF('[POINTS NQS  2012.XLS]Stock Altered 1100'!$F9=0," ",'[POINTS NQS  2012.XLS]Stock Altered 1100'!$F9) -> Red Cadet | O6: ='[POINTS NQS  2012.XLS]Stock Altered 1100'!AA9 -> 13
A7: ='[POINTS NQS  2012.XLS]Stock Altered 1050'!$A10 -> 5 | B7: ='[POINTS NQS  2012.XLS]Stock Altered 1050'!$B10 -> Wayne Sams | C7: ='[POINTS NQS  2012.XLS]Stock Altered 1050'!$C10 -> Rockbridge, OH | D7: ='[POINTS NQS  2012.XLS]Stock Altered 1050'!$D10 -> TV | E7: ='[POINTS NQS  2012.XLS]Stock Altered 1050'!$E10 -> 82 | F7: =IF('[POINTS NQS  2012.XLS]Stock Altered 1050'!$F10=0," ",'[POINTS NQS  2012.XLS]Stock Altered 1050'!$F10) -> Gold Digger | G7: ='[POINTS NQS  2012.XLS]Stock Altered 1050'!AA10 -> 15 | I7: ='[POINTS NQS  2012.XLS]Stock Altered 1100'!$A10 -> 5 | J7: ='[POINTS NQS  2012.XLS]Stock Altered 1100'!$B10 -> Wayne Sams | K7: ='[POINTS NQS  2012.XLS]Stock Altered 1100'!$C10 -> Rockbridge, OH | L7: ='[POINTS NQS  2012.XLS]Stock Altered 1100'!$D10 -> TV | M7: ='[POINTS NQS  2012.XLS]Stock Altered 1100'!$E10 -> 82 | N7: =IF('[POINTS NQS  2012.XLS]Stock Altered 1100'!$F10=0," ",'[POINTS NQS  2012.XLS]Stock Altered 1100'!$F10) -> Gold Digger | O7: ='[POINTS NQS  2012.XLS]Stock Altered 1100'!AA10 -> 17
A8: ='[POINTS NQS  2012.XLS]Stock Altered 1050'!$A11 -> 6 | B8: ='[POINTS NQS  2012.XLS]Stock Altered 1050'!$B11 -> Kelly Nichols | C8: ='[POINTS NQS  2012.XLS]Stock Altered 1050'!$C11 -> Lore City, OH | D8: ='[POINTS NQS  2012.XLS]Stock Altered 1050'!$D11 -> NP | E8: ='[POINTS NQS  2012.XLS]Stock Altered 1050'!$E11 -> 358 | F8: =IF('[POINTS NQS  2012.XLS]Stock Altered 1050'!$F11=0," ",'[POINTS NQS  2012.XLS]Stock Altered 1050'!$F11) -> Maxx'd Out | G8: ='[POINTS NQS  2012.XLS]Stock Altered 1050'!AA11 -> 19 | I8: ='[POINTS NQS  2012.XLS]Stock Altered 1100'!$A11 -> 6 | J8: ='[POINTS NQS  2012.XLS]Stock Altered 1100'!$B11 -> Dave Washburn | K8: ='[POINTS NQS  2012.XLS]Stock Altered 1100'!$C11 -> Guysville, OH | L8: ='[POINTS NQS  2012.XLS]Stock Altered 1100'!$D11 -> BJ | M8: ='[POINTS NQS  2012.XLS]Stock Altered 1100'!$E11 -> 156 | N8: =IF('[POINTS NQS  2012.XLS]Stock Altered 1100'!$F11=0," ",'[POINTS NQS  2012.XLS]Stock Altered 1100'!$F11) -> Last Minute | O8: ='[POINTS NQS  2012.XLS]Stock Altered 1100'!AA11 -> 20
A9: ='[POINTS NQS  2012.XLS]Stock Altered 1050'!$A12 -> 7 | B9: ='[POINTS NQS  2012.XLS]Stock Altered 1050'!$B12 -> Roger McKinney | C9: ='[POINTS NQS  2012.XLS]Stock Altered 1050'!$C12 -> Lake Ariel, PA | D9: ='[POINTS NQS  2012.XLS]Stock Altered 1050'!$D12 -> JRS | E9: ='[POINTS NQS  2012.XLS]Stock Altered 1050'!$E12 -> 83 | F9: =IF('[POINTS NQS  2012.XLS]Stock Altered 1050'!$F12=0," ",'[POINTS NQS  2012.XLS]Stock Altered 1050'!$F12) -> Blue Thunder | G9: ='[POINTS NQS  2012.XLS]Stock Altered 1050'!AA12 -> 20 | I9: ='[POINTS NQS  2012.XLS]Stock Altered 1100'!$A12 -> 7 | J9: ='[POINTS NQS  2012.XLS]Stock Altered 1100'!$B12 -> Ron Hodge | K9: ='[POINTS NQS  2012.XLS]Stock Altered 1100'!$C12 -> Hillsboro, OH | L9: ='[POINTS NQS  2012.XLS]Stock Altered 1100'!$D12 -> TV | M9: ='[POINTS NQS  2012.XLS]Stock Altered 1100'!$E12 -> 71 | N9: =IF('[POINTS NQS  2012.XLS]Stock Altered 1100'!$F12=0," ",'[POINTS NQS  2012.XLS]Stock Altered 1100'!$F12) -> Take-N-Names | O9: ='[POINTS NQS  2012.XLS]Stock Altered 1100'!AA12 -> 24
A10: ='[POINTS NQS  2012.XLS]Stock Altered 1050'!$A13 -> 8 | B10: ='[POINTS NQS  2012.XLS]Stock Altered 1050'!$B13 -> Gregory Vandervort | C10: ='[POINTS NQS  2012.XLS]Stock Altered 1050'!$C13 -> Albion, PA | D10: ='[POINTS NQS  2012.XLS]Stock Altered 1050'!$D13 -> TV | E10: ='[POINTS NQS  2012.XLS]Stock Altered 1050'!$E13 -> 346 | F10: =IF('[POINTS NQS  2012.XLS]Stock Altered 1050'!$F13=0," ",'[POINTS NQS  2012.XLS]Stock Altered 1050'!$F13) -> Yellow Cub | G10: ='[POINTS NQS  2012.XLS]Stock Altered 1050'!AA13 -> 24 | I10: ='[POINTS NQS  2012.XLS]Stock Altered 1100'!$A13 -> 8 | J10: ='[POINTS NQS  2012.XLS]Stock Altered 1100'!$B13 -> Cody Costa | K10: ='[POINTS NQS  2012.XLS]Stock Altered 1100'!$C13 -> Greencastle, PA | L10: ='[POINTS NQS  2012.XLS]Stock Altered 1100'!$D13 -> NP | M10: ='[POINTS NQS  2012.XLS]Stock Altered 1100'!$E13 -> 135 | N10: =IF('[POINTS NQS  2012.XLS]Stock Altered 1100'!$F13=0," ",'[POINTS NQS  2012.XLS]Stock Altered 1100'!$F13) -> Wild Child | O10: ='[POINTS NQS  2012.XLS]Stock Altered 1100'!AA13 -> 26
A11: ='[POINTS NQS  2012.XLS]Stock Altered 1050'!$A14 -> 9 | B11: ='[POINTS NQS  2012.XLS]Stock Altered 1050'!$B14 -> Judy Lowe | C11: ='[POINTS NQS  2012.XLS]Stock Altered 1050'!$C14 -> Urbana, OH | D11: ='[POINTS NQS  2012.XLS]Stock Altered 1050'!$D14 -> TV | E11: ='[POINTS NQS  2012.XLS]Stock Altered 1050'!$E14 -> 10 | F11: =IF('[POINTS NQS  2012.XLS]Stock Altered 1050'!$F14=0," ",'[POINTS NQS  2012.XLS]Stock Altered 1050'!$F14) -> SlowMotion | G11: ='[POINTS NQS  2012.XLS]Stock Altered 1050'!AA14 -> 28 | I11: ='[POINTS NQS  2012.XLS]Stock Altered 1100'!$A14 -> 9 | J11: ='[POINTS NQS  2012.XLS]Stock Altered 1100'!$B14 -> Doug Seaman | K11: ='[POINTS NQS  2012.XLS]Stock Altered 1100'!$C14 -> Vincent, OH | L11: ='[POINTS NQS  2012.XLS]Stock Altered 1100'!$D14 -> BJ | M11: ='[POINTS NQS  2012.XLS]Stock Altered 1100'!$E14 -> 192 | N11: =IF('[POINTS NQS  2012.XLS]Stock Altered 1100'!$F14=0," ",'[POINTS NQS  2012.XLS]Stock Altered 1100'!$F14) -> Massey Ferguson | O11: ='[POINTS NQS  2012.XLS]Stock Altered 1100'!AA14 -> 28
A12: ='[POINTS NQS  2012.XLS]Stock Altered 1050'!$A15 -> 10 | B12: ='[POINTS NQS  2012.XLS]Stock Altered 1050'!$B15 -> Dave Washburn | C12: ='[POINTS NQS  2012.XLS]Stock Altered 1050'!$C15 -> Guysville, OH | D12: ='[POINTS NQS  2012.XLS]Stock Altered 1050'!$D15 -> BJ | E12: ='[POINTS NQS  2012.XLS]Stock Altered 1050'!$E15 -> 156 | F12: =IF('[POINTS NQS  2012.XLS]Stock Altered 1050'!$F15=0," ",'[POINTS NQS  2012.XLS]Stock Altered 1050'!$F15) -> Last Minute | G12: ='[POINTS NQS  2012.XLS]Stock Altered 1050'!AA15 -> 28 | I12: ='[POINTS NQS  2012.XLS]Stock Altered 1100'!$A15 -> 10 | J12: ='[POINTS NQS  2012.XLS]Stock Altered 1100'!$B15 -> Donnie Herring | K12: ='[POINTS NQS  2012.XLS]Stock Altered 1100'!$C15 -> Rockbridge, OH | L12: ='[POINTS NQS  2012.XLS]Stock Altered 1100'!$D15 -> TV | M12: ='[POINTS NQS  2012.XLS]Stock Altered 1100'!$E15 -> 331 | N12: =IF('[POINTS NQS  2012.XLS]Stock Altered 1100'!$F15=0," ",'[POINTS NQS  2012.XLS]Stock Altered 1100'!$F15) -> Pasttime | O12: ='[POINTS NQS  2012.XLS]Stock Altered 1100'!AA15 -> 28
A13: ='[POINTS NQS  2012.XLS]Stock Altered 1050'!$A16 -> 11 | B13: ='[POINTS NQS  2012.XLS]Stock Altered 1050'!$B16 -> Tim Shaw | C13: ='[POINTS NQS  2012.XLS]Stock Altered 1050'!$C16 -> Rockbridge, OH | D13: ='[POINTS NQS  2012.XLS]Stock Altered 1050'!$D16 -> TV | E13: ='[POINTS NQS  2012.XLS]Stock Altered 1050'!$E16 -> 454 | F13: =IF('[POINTS NQS  2012.XLS]Stock Altered 1050'!$F16=0," ",'[POINTS NQS  2012.XLS]Stock Altered 1050'!$F16) -> Heavy Hauler | G13: ='[POINTS NQS  2012.XLS]Stock Altered 1050'!AA16 -> 36 | I13: ='[POINTS NQS  2012.XLS]Stock Altered 1100'!$A16 -> 11 | J13: ='[POINTS NQS  2012.XLS]Stock Altered 1100'!$B16 -> Gary Seaman | K13: ='[POINTS NQS  2012.XLS]Stock Altered 1100'!$C16 -> Fleming, OH | L13: ='[POINTS NQS  2012.XLS]Stock Altered 1100'!$D16 -> BJ | M13: ='[POINTS NQS  2012.XLS]Stock Altered 1100'!$E16 -> 191 | N13: =IF('[POINTS NQS  2012.XLS]Stock Altered 1100'!$F16=0," ",'[POINTS NQS  2012.XLS]Stock Altered 1100'!$F16) -> Farmers Money | O13: ='[POINTS NQS  2012.XLS]Stock Altered 1100'!AA16 -> 35
A14: ='[POINTS NQS  2012.XLS]Stock Altered 1050'!$A17 -> 12 | B14: ='[POINTS NQS  2012.XLS]Stock Altered 1050'!$B17 -> Lee Dewald | C14: ='[POINTS NQS  2012.XLS]Stock Altered 1050'!$C17 -> Tiffon, OH | D14: ='[POINTS NQS  2012.XLS]Stock Altered 1050'!$D17 -> NP | E14: ='[POINTS NQS  2012.XLS]Stock Altered 1050'!$E17 -> 465 | F14: =IF('[POINTS NQS  2012.XLS]Stock Altered 1050'!$F17=0," ",'[POINTS NQS  2012.XLS]Stock Altered 1050'!$F17) -> Barnyard Bandit | G14: ='[POINTS NQS  2012.XLS]Stock Altered 1050'!AA17 -> 42 | I14: ='[POINTS NQS  2012.XLS]Stock Altered 1100'!$A17 -> 12 | J14: ='[POINTS NQS  2012.XLS]Stock Altered 1100'!$B17 -> Lonnie Lewis | K14: ='[POINTS NQS  2012.XLS]Stock Altered 1100'!$C17 -> Milford, OH | L14: ='[POINTS NQS  2012.XLS]Stock Altered 1100'!$D17 -> TV | M14: ='[POINTS NQS  2012.XLS]Stock Altered 1100'!$E17 -> 24 | N14: =IF('[POINTS NQS  2012.XLS]Stock Altered 1100'!$F17=0," ",'[POINTS NQS  2012.XLS]Stock Altered 1100'!$F17) -> Deuces Wild | O14: ='[POINTS NQS  2012.XLS]Stock Altered 1100'!AA17 -> 49
A15: ='[POINTS NQS  2012.XLS]Stock Altered 1050'!$A18 -> 13 | B15: ='[POINTS NQS  2012.XLS]Stock Altered 1050'!$B18 -> Lonnie Lewis | C15: ='[POINTS NQS  2012.XLS]Stock Altered 1050'!$C18 -> Milford, OH | D15: ='[POINTS NQS  2012.XLS]Stock Altered 1050'!$D18 -> TV | E15: ='[POINTS NQS  2012.XLS]Stock Altered 1050'!$E18 -> 24 | F15: =IF('[POINTS NQS  2012.XLS]Stock Altered 1050'!$F18=0," ",'[POINTS NQS  2012.XLS]Stock Altered 1050'!$F18) -> Deuces Wild | G15: ='[POINTS NQS  2012.XLS]Stock Altered 1050'!AA18 -> 44 | I15: ='[POINTS NQS  2012.XLS]Stock Altered 1100'!$A18 -> 13 | J15: ='[POINTS NQS  2012.XLS]Stock Altered 1100'!$B18 -> Judy Lowe | K15: ='[POINTS NQS  2012.XLS]Stock Altered 1100'!$C18 -> Urbana, OH | L15: ='[POINTS NQS  2012.XLS]Stock Altered 1100'!$D18 -> TV | M15: ='[POINTS NQS  2012.XLS]Stock Altered 1100'!$E18 -> 10 | N15: =IF('[POINTS NQS  2012.XLS]Stock Altered 1100'!$F18=0," ",'[POINTS NQS  2012.XLS]Stock Altered 1100'!$F18) -> SlowMotion | O15: ='[POINTS NQS  2012.XLS]Stock Altered 1100'!AA18 -> 51
A16: ='[POINTS NQS  2012.XLS]Stock Altered 1050'!$A19 -> 14 | B16: ='[POINTS NQS  2012.XLS]Stock Altered 1050'!$B19 -> Doug Seaman | C16: ='[POINTS NQS  2012.XLS]Stock Altered 1050'!$C19 -> Vincent, OH | D16: ='[POINTS NQS  2012.XLS]Stock Altered 1050'!$D19 -> BJ | E16: ='[POINTS NQS  2012.XLS]Stock Altered 1050'!$E19 -> 192 | F16: =IF('[POINTS NQS  2012.XLS]Stock Altered 1050'!$F19=0," ",'[POINTS NQS  2012.XLS]Stock Altered 1050'!$F19) -> Massey Ferguson | G16: ='[POINTS NQS  2012.XLS]Stock Altered 1050'!AA19 -> 45 | I16: ='[POINTS NQS  2012.XLS]Stock Altered 1100'!$A19 -> 14 | J16: ='[POINTS NQS  2012.XLS]Stock Altered 1100'!$B19 -> Eli Zimmerman | K16: ='[POINTS NQS  2012.XLS]Stock Altered 1100'!$C19 -> Allentown, PA | L16: ='[POINTS NQS  2012.XLS]Stock Altered 1100'!$D19 -> NP | M16: ='[POINTS NQS  2012.XLS]Stock Altered 1100'!$E19 -> 75 | N16: =IF('[POINTS NQS  2012.XLS]Stock Altered 1100'!$F19=0," ",'[POINTS NQS  2012.XLS]Stock Altered 1100'!$F19) -> Red Fever | O16: ='[POINTS NQS  2012.XLS]Stock Altered 1100'!AA19 -> 51
A17: ='[POINTS NQS  2012.XLS]Stock Altered 1050'!$A20 -> 15 | B17: ='[POINTS NQS  2012.XLS]Stock Altered 1050'!$B20 -> Matt Ronnebaum | C17: ='[POINTS NQS  2012.XLS]Stock Altered 1050'!$C20 -> Celina, OH | D17: ='[POINTS NQS  2012.XLS]Stock Altered 1050'!$D20 -> TV | E17: ='[POINTS NQS  2012.XLS]Stock Altered 1050'!$E20 -> 89 | F17: =IF('[POINTS NQS  2012.XLS]Stock Altered 1050'!$F20=0," ",'[POINTS NQS  2012.XLS]Stock Altered 1050'!$F20) -> Boys & Their Toys | G17: ='[POINTS NQS  2012.XLS]Stock Altered 1050'!AA20 -> 50 | I17: ='[POINTS NQS  2012.XLS]Stock Altered 1100'!$A20 -> 15 | J17: ='[POINTS NQS  2012.XLS]Stock Altered 1100'!$B20 -> John Dewald | K17: ='[POINTS NQS  2012.XLS]Stock Altered 1100'!$C20 -> Tiffon, OH | L17: ='[POINTS NQS  2012.XLS]Stock Altered 1100'!$D20 -> RPM | M17: ='[POINTS NQS  2012.XLS]Stock Altered 1100'!$E20 -> 484 | N17: =IF('[POINTS NQS  2012.XLS]Stock Altered 1100'!$F20=0," ",'[POINTS NQS  2012.XLS]Stock Altered 1100'!$F20) -> Patience | O17: ='[POINTS NQS  2012.XLS]Stock Altered 1100'!AA20 -> 52
A18: ='[POINTS NQS  2012.XLS]Stock Altered 1050'!$A21 -> 16 | B18: ='[POINTS NQS  2012.XLS]Stock Altered 1050'!$B21 -> Ron Finch | C18: ='[POINTS NQS  2012.XLS]Stock Altered 1050'!$C21 -> Milan, MI | D18: ='[POINTS NQS  2012.XLS]Stock Altered 1050'!$D21 -> Woods | E18: ='[POINTS NQS  2012.XLS]Stock Altered 1050'!$E21 -> 142 | F18: =IF('[POINTS NQS  2012.XLS]Stock Altered 1050'!$F21=0," ",'[POINTS NQS  2012.XLS]Stock Altered 1050'!$F21) -> Top Notch | G18: ='[POINTS NQS  2012.XLS]Stock Altered 1050'!AA21 -> 51 | I18: ='[POINTS NQS  2012.XLS]Stock Altered 1100'!$A21 -> 16 | J18: ='[POINTS NQS  2012.XLS]Stock Altered 1100'!$B21 -> Shane Hadley | K18: ='[POINTS NQS  2012.XLS]Stock Altered 1100'!$C21 -> Marion, NY | L18: ='[POINTS NQS  2012.XLS]Stock Altered 1100'!$D21 -> LR | M18: ='[POINTS NQS  2012.XLS]Stock Altered 1100'!$E21 -> 442 | N18: =IF('[POINTS NQS  2012.XLS]Stock Altered 1100'!$F21=0," ",'[POINTS NQS  2012.XLS]Stock Altered 1100'!$F21) -> Foot Finder | O18: ='[POINTS NQS  2012.XLS]Stock Altered 1100'!AA21 -> 53
A19: ='[POINTS NQS  2012.XLS]Stock Altered 1050'!$A22 -> 17 | B19: ='[POINTS NQS  2012.XLS]Stock Altered 1050'!$B22 -> Mark Peters | C19: ='[POINTS NQS  2012.XLS]Stock Altered 1050'!$C22 -> McArthur, PA | D19: ='[POINTS NQS  2012.XLS]Stock Altered 1050'!$D22 -> JRS | E19: ='[POINTS NQS  2012.XLS]Stock Altered 1050'!$E22 -> 469 | F19: =IF('[POINTS NQS  2012.XLS]Stock Altered 1050'!$F22=0," ",'[POINTS NQS  2012.XLS]Stock Altered 1050'!$F22) -> American Ride | G19: ='[POINTS NQS  2012.XLS]Stock Altered 1050'!AA22 -> 54 | I19: ='[POINTS NQS  2012.XLS]Stock Altered 1100'!$A22 -> 17 | J19: ='[POINTS NQS  2012.XLS]Stock Altered 1100'!$B22 -> Ed Kerner | K19: ='[POINTS NQS  2012.XLS]Stock Altered 1100'!$C22 -> Kimball, MI | L19: ='[POINTS NQS  2012.XLS]Stock Altered 1100'!$D22 -> NP | M19: ='[POINTS NQS  2012.XLS]Stock Altered 1100'!$E22 -> 303 | N19: =IF('[POINTS NQS  2012.XLS]Stock Altered 1100'!$F22=0," ",'[POINTS NQS  2012.XLS]Stock Altered 1100'!$F22) -> Along for the Ride | O19: ='[POINTS NQS  2012.XLS]Stock Altered 1100'!AA22 -> 57
A20: ='[POINTS NQS  2012.XLS]Stock Altered 1050'!$A23 -> 18 | B20: ='[POINTS NQS  2012.XLS]Stock Altered 1050'!$B23 -> Ed Kerner | C20: ='[POINTS NQS  2012.XLS]Stock Altered 1050'!$C23 -> Kimball, MI | D20: ='[POINTS NQS  2012.XLS]Stock Altered 1050'!$D23 -> NP | E20: ='[POINTS NQS  2012.XLS]Stock Altered 1050'!$E23 -> 303 | F20: =IF('[POINTS NQS  2012.XLS]Stock Altered 1050'!$F23=0," ",'[POINTS NQS  2012.XLS]Stock Altered 1050'!$F23) -> Along for the Ride | G20: ='[POINTS NQS  2012.XLS]Stock Altered 1050'!AA23 -> 55 | I20: ='[POINTS NQS  2012.XLS]Stock Altered 1100'!$A23 -> 18 | J20: ='[POINTS NQS  2012.XLS]Stock Altered 1100'!$B23 -> Greg Watson | K20: ='[POINTS NQS  2012.XLS]Stock Altered 1100'!$C23 -> Batavia, OH | L20: ='[POINTS NQS  2012.XLS]Stock Altered 1100'!$D23 -> NP | M20: ='[POINTS NQS  2012.XLS]Stock Altered 1100'!$E23 -> 327 | N20: =IF('[POINTS NQS  2012.XLS]Stock Altered 1100'!$F23=0," ",'[POINTS NQS  2012.XLS]Stock Altered 1100'!$F23) -> Road Warrior | O20: ='[POINTS NQS  2012.XLS]Stock Altered 1100'!AA23 -> 62
A21: ='[POINTS NQS  2012.XLS]Stock Altered 1050'!$A24 -> 19 | B21: ='[POINTS NQS  2012.XLS]Stock Altered 1050'!$B24 -> Bob Jones JR | C21: ='[POINTS NQS  2012.XLS]Stock Altered 1050'!$C24 -> Hopewell, OH | D21: ='[POINTS NQS  2012.XLS]Stock Altered 1050'!$D24 -> BJ | E21: ='[POINTS NQS  2012.XLS]Stock Altered 1050'!$E24 -> 183 | F21: =IF('[POINTS NQS  2012.XLS]Stock Altered 1050'!$F24=0," ",'[POINTS NQS  2012.XLS]Stock Altered 1050'!$F24) -> Playdough | G21: ='[POINTS NQS  2012.XLS]Stock Altered 1050'!AA24 -> 57 | I21: ='[POINTS NQS  2012.XLS]Stock Altered 1100'!$A24 -> 19 | J21: ='[POINTS NQS  2012.XLS]Stock Altered 1100'!$B24 -> Gregory Vandervort | K21: ='[POINTS NQS  2012.XLS]Stock Altered 1100'!$C24 -> Albion, PA | L21: ='[POINTS NQS  2012.XLS]Stock Altered 1100'!$D24 -> TV | M21: ='[POINTS NQS  2012.XLS]Stock Altered 1100'!$E24 -> 346 | N21: =IF('[POINTS NQS  2012.XLS]Stock Altered 1100'!$F24=0," ",'[POINTS NQS  2012.XLS]Stock Altered 1100'!$F24) -> Yellow Cub | O21: ='[POINTS NQS  2012.XLS]Stock Altered 1100'!AA24 -> 65
A22: ='[POINTS NQS  2012.XLS]Stock Altered 1050'!$A25 -> 20 | B22: ='[POINTS NQS  2012.XLS]Stock Altered 1050'!$B25 -> Gary Seaman | C22: ='[POINTS NQS  2012.XLS]Stock Altered 1050'!$C25 -> Fleming, OH | D22: ='[POINTS NQS  2012.XLS]Stock Altered 1050'!$D25 -> BJ | E22: ='[POINTS NQS  2012.XLS]Stock Altered 1050'!$E25 -> 191 | F22: =IF('[POINTS NQS  2012.XLS]Stock Altered 1050'!$F25=0," ",'[POINTS NQS  2012.XLS]Stock Altered 1050'!$F25) -> Farmer's Money | G22: ='[POINTS NQS  2012.XLS]Stock Altered 1050'!AA25 -> 61 | I22: ='[POINTS NQS  2012.XLS]Stock Altered 1100'!$A25 -> 20 | J22: ='[POINTS NQS  2012.XLS]Stock Altered 1100'!$B25 -> Rick James | K22: ='[POINTS NQS  2012.XLS]Stock Altered 1100'!$C25 -> Lancaster, OH | L22: ='[POINTS NQS  2012.XLS]Stock Altered 1100'!$D25 -> BJ | M22: ='[POINTS NQS  2012.XLS]Stock Altered 1100'!$E25 -> 427 | N22: =IF('[POINTS NQS  2012.XLS]Stock Altered 1100'!$F25=0," ",'[POINTS NQS  2012.XLS]Stock Altered 1100'!$F25) -> James Gang III | O22: ='[POINTS NQS  2012.XLS]Stock Altered 1100'!AA25 -> 65
A23: ='[POINTS NQS  2012.XLS]Stock Altered 1050'!$A26 -> 21 | B23: ='[POINTS NQS  2012.XLS]Stock Altered 1050'!$B26 -> Shane Hadley | C23: ='[POINTS NQS  2012.XLS]Stock Altered 1050'!$C26 -> Marion, NY | D23: ='[POINTS NQS  2012.XLS]Stock Altered 1050'!$D26 -> LR | E23: ='[POINTS NQS  2012.XLS]Stock Altered 1050'!$E26 -> 442 | F23: =IF('[POINTS NQS  2012.XLS]Stock Altered 1050'!$F26=0," ",'[POINTS NQS  2012.XLS]Stock Altered 1050'!$F26) -> Foot Finder | G23: ='[POINTS NQS  2012.XLS]Stock Altered 1050'!AA26 -> 60 | I23: ='[POINTS NQS  2012.XLS]Stock Altered 1100'!$A26 -> 21 | J23: ='[POINTS NQS  2012.XLS]Stock Altered 1100'!$B26 -> Randy Demers | K23: ='[POINTS NQS  2012.XLS]Stock Altered 1100'!$C26 -> Columbia, NJ | L23: ='[POINTS NQS  2012.XLS]Stock Altered 1100'!$D26 -> NP | M23: ='[POINTS NQS  2012.XLS]Stock Altered 1100'!$E26 -> 84 | N23: =IF('[POINTS NQS  2012.XLS]Stock Altered 1100'!$F26=0," ",'[POINTS NQS  2012.XLS]Stock Altered 1100'!$F26) -> Bounty Hunter | O23: ='[POINTS NQS  2012.XLS]Stock Altered 1100'!AA26 -> 66
A24: ='[POINTS NQS  2012.XLS]Stock Altered 1050'!$A27 -> 22 | B24: ='[POINTS NQS  2012.XLS]Stock Altered 1050'!$B27 -> Donnie Herring | C24: ='[POINTS NQS  2012.XLS]Stock Altered 1050'!$C27 -> Rockbridge, OH | D24: ='[POINTS NQS  2012.XLS]Stock Altered 1050'!$D27 -> TV | E24: ='[POINTS NQS  2012.XLS]Stock Altered 1050'!$E27 -> 331 | F24: =IF('[POINTS NQS  2012.XLS]Stock Altered 1050'!$F27=0," ",'[POINTS NQS  2012.XLS]Stock Altered 1050'!$F27) -> Pasttime | G24: ='[POINTS NQS  2012.XLS]Stock Altered 1050'!AA27 -> 63 | I24: ='[POINTS NQS  2012.XLS]Stock Altered 1100'!$A27 -> 22 | J24: ='[POINTS NQS  2012.XLS]Stock Altered 1100'!$B27 -> Roger McKinney | K24: ='[POINTS NQS  2012.XLS]Stock Altered 1100'!$C27 -> Greenville, IL | L24: ='[POINTS NQS  2012.XLS]Stock Altered 1100'!$D27 -> JRS | M24: ='[POINTS NQS  2012.XLS]Stock Altered 1100'!$E27 -> 83 | N24: =IF('[POINTS NQS  2012.XLS]Stock Altered 1100'!$F27=0," ",'[POINTS NQS  2012.XLS]Stock Altered 1100'!$F27) -> Blue Thunder | O24: ='[POINTS NQS  2012.XLS]Stock Altered 1100'!AA27 -> 68
A25: ='[POINTS NQS  2012.XLS]Stock Altered 1050'!$A28 -> 23 | B25: ='[POINTS NQS  2012.XLS]Stock Altered 1050'!$B28 -> John Dewald | C25: ='[POINTS NQS  2012.XLS]Stock Altered 1050'!$C28 -> Tiffon, OH | D25: ='[POINTS NQS  2012.XLS]Stock Altered 1050'!$D28 -> RPM | E25: ='[POINTS NQS  2012.XLS]Stock Altered 1050'!$E28 -> 484 | F25: =IF('[POINTS NQS  2012.XLS]Stock Altered 1050'!$F28=0," ",'[POINTS NQS  2012.XLS]Stock Altered 1050'!$F28) -> Patience | G25: ='[POINTS NQS  2012.XLS]Stock Altered 1050'!AA28 -> 65 | I25: ='[POINTS NQS  2012.XLS]Stock Altered 1100'!$A28 -> 23 | J25: ='[POINTS NQS  2012.XLS]Stock Altered 1100'!$B28 -> Bob Jones JR | K25: ='[POINTS NQS  2012.XLS]Stock Altered 1100'!$C28 -> Hopewell, OH | L25: ='[POINTS NQS  2012.XLS]Stock Altered 1100'!$D28 -> BJ | M25: ='[POINTS NQS  2012.XLS]Stock Altered 1100'!$E28 -> 183 | N25: =IF('[POINTS NQS  2012.XLS]Stock Altered 1100'!$F28=0," ",'[POINTS NQS  2012.XLS]Stock Altered 1100'!$F28) -> Playdough | O25: ='[POINTS NQS  2012.XLS]Stock Altered 1100'!AA28 -> 68
A26: ='[POINTS NQS  2012.XLS]Stock Altered 1050'!$A29 -> 24 | B26: ='[POINTS NQS  2012.XLS]Stock Altered 1050'!$B29 -> Eli Zimmerman | C26: ='[POINTS NQS  2012.XLS]Stock Altered 1050'!$C29 -> Allentown, PA | D26: ='[POINTS NQS  2012.XLS]Stock Altered 1050'!$D29 -> NP | E26: ='[POINTS NQS  2012.XLS]Stock Altered 1050'!$E29 -> 75 | F26: =IF('[POINTS NQS  2012.XLS]Stock Altered 1050'!$F29=0," ",'[POINTS NQS  2012.XLS]Stock Altered 1050'!$F29) -> Red Fever | G26: ='[POINTS NQS  2012.XLS]Stock Altered 1050'!AA29 -> 66 | I26: ='[POINTS NQS  2012.XLS]Stock Altered 1100'!$A29 -> 24 | J26: ='[POINTS NQS  2012.XLS]Stock Altered 1100'!$B29 -> Lee Dewald | K26: ='[POINTS NQS  2012.XLS]Stock Altered 1100'!$C29 -> Tiffon, OH | L26: ='[POINTS NQS  2012.XLS]Stock Altered 1100'!$D29 -> NP | M26: ='[POINTS NQS  2012.XLS]Stock Altered 1100'!$E29 -> 465 | N26: =IF('[POINTS NQS  2012.XLS]Stock Altered 1100'!$F29=0," ",'[POINTS NQS  2012.XLS]Stock Altered 1100'!$F29) -> Barnyard Bandit | O26: ='[POINTS NQS  2012.XLS]Stock Altered 1100'!AA29 -> 70
A27: ='[POINTS NQS  2012.XLS]Stock Altered 1050'!$A30 -> 25 | B27: ='[POINTS NQS  2012.XLS]Stock Altered 1050'!$B30 -> Robin Cooper | C27: ='[POINTS NQS  2012.XLS]Stock Altered 1050'!$C30 -> Westminster, MD | D27: ='[POINTS NQS  2012.XLS]Stock Altered 1050'!$D30 -> JRS | E27: ='[POINTS NQS  2012.XLS]Stock Altered 1050'!$E30 -> 73 | F27: =IF('[POINTS NQS  2012.XLS]Stock Altered 1050'!$F30=0," ",'[POINTS NQS  2012.XLS]Stock Altered 1050'!$F30) ->  | G27: ='[POINTS NQS  2012.XLS]Stock Altered 1050'!AA30 -> 67 | I27: ='[POINTS NQS  2012.XLS]Stock Altered 1100'!$A30 -> 25 | J27: ='[POINTS NQS  2012.XLS]Stock Altered 1100'!$B30 -> Keith Frueh | K27: ='[POINTS NQS  2012.XLS]Stock Altered 1100'!$C30 -> Greenville, IL | L27: ='[POINTS NQS  2012.XLS]Stock Altered 1100'!$D30 -> JRS | M27: ='[POINTS NQS  2012.XLS]Stock Altered 1100'!$E30 -> 453 | N27: =IF('[POINTS NQS  2012.XLS]Stock Altered 1100'!$F30=0," ",'[POINTS NQS  2012.XLS]Stock Altered 1100'!$F30) -> Haulin Harvester | O27: ='[POINTS NQS  2012.XLS]Stock Altered 1100'!AA30 -> 71
A28: ='[POINTS NQS  2012.XLS]Stock Altered 1050'!$A31 -> 26 | B28: ='[POINTS NQS  2012.XLS]Stock Altered 1050'!$B31 -> Kenneth Smith | C28: ='[POINTS NQS  2012.XLS]Stock Altered 1050'!$C31 -> Ashland, OH | D28: ='[POINTS NQS  2012.XLS]Stock Altered 1050'!$D31 -> JRS | E28: ='[POINTS NQS  2012.XLS]Stock Altered 1050'!$E31 -> 125 | F28: =IF('[POINTS NQS  2012.XLS]Stock Altered 1050'!$F31=0," ",'[POINTS NQS  2012.XLS]Stock Altered 1050'!$F31) -> Sidewinder | G28: ='[POINTS NQS  2012.XLS]Stock Altered 1050'!AA31 -> 67 | I28: ='[POINTS NQS  2012.XLS]Stock Altered 1100'!$A31 -> 26 | J28: ='[POINTS NQS  2012.XLS]Stock Altered 1100'!$B31 -> Jamie Lewis | K28: ='[POINTS NQS  2012.XLS]Stock Altered 1100'!$C31 -> Cincinnati, oh | L28: ='[POINTS NQS  2012.XLS]Stock Altered 1100'!$D31 -> TV | M28: ='[POINTS NQS  2012.XLS]Stock Altered 1100'!$E31 -> 19 | N28: =IF('[POINTS NQS  2012.XLS]Stock Altered 1100'!$F31=0," ",'[POINTS NQS  2012.XLS]Stock Altered 1100'!$F31) -> Oh So Orange | O28: ='[POINTS NQS  2012.XLS]Stock Altered 1100'!AA31 -> 72
A29: ='[POINTS NQS  2012.XLS]Stock Altered 1050'!$A32 -> 27 | B29: ='[POINTS NQS  2012.XLS]Stock Altered 1050'!$B32 -> Keith Frueh | C29: ='[POINTS NQS  2012.XLS]Stock Altered 1050'!$C32 -> Greenville, IL | D29: ='[POINTS NQS  2012.XLS]Stock Altered 1050'!$D32 -> JRS | E29: ='[POINTS NQS  2012.XLS]Stock Altered 1050'!$E32 -> 453 | F29: =IF('[POINTS NQS  2012.XLS]Stock Altered 1050'!$F32=0," ",'[POINTS NQS  2012.XLS]Stock Altered 1050'!$F32) -> Haulin Harvester | G29: ='[POINTS NQS  2012.XLS]Stock Altered 1050'!AA32 -> 70 | I29: ='[POINTS NQS  2012.XLS]Stock Altered 1100'!$A32 -> 27 | J29: ='[POINTS NQS  2012.XLS]Stock Altered 1100'!$B32 -> Kenneth Smith | K29: ='[POINTS NQS  2012.XLS]Stock Altered 1100'!$C32 -> Ashland, OH | L29: ='[POINTS NQS  2012.XLS]Stock Altered 1100'!$D32 -> JRS | M29: ='[POINTS NQS  2012.XLS]Stock Altered 1100'!$E32 -> 125 | N29: =IF('[POINTS NQS  2012.XLS]Stock Altered 1100'!$F32=0," ",'[POINTS NQS  2012.XLS]Stock Altered 1100'!$F32) -> Sidewinder | O29: ='[POINTS NQS  2012.XLS]Stock Altered 1100'!AA32 -> 72
A30: ='[POINTS NQS  2012.XLS]Stock Altered 1050'!$A33 -> 28 | B30: ='[POINTS NQS  2012.XLS]Stock Altered 1050'!$B33 -> Randy Demers | C30: ='[POINTS NQS  2012.XLS]Stock Altered 1050'!$C33 -> Columbia, NJ | D30: ='[POINTS NQS  2012.XLS]Stock Altered 1050'!$D33 -> NP | E30: ='[POINTS NQS  2012.XLS]Stock Altered 1050'!$E33 -> 84 | F30: =IF('[POINTS NQS  2012.XLS]Stock Altered 1050'!$F33=0," ",'[POINTS NQS  2012.XLS]Stock Altered 1050'!$F33) -> Bounty Hunter | G30: ='[POINTS NQS  2012.XLS]Stock Altered 1050'!AA33 -> 71 | I30: ='[POINTS NQS  2012.XLS]Stock Altered 1100'!$A33 -> 28 | J30: ='[POINTS NQS  2012.XLS]Stock Altered 1100'!$B33 -> Kelly Nichols | K30: ='[POINTS NQS  2012.XLS]Stock Altered 1100'!$C33 -> Lore City, OH | L30: ='[POINTS NQS  2012.XLS]Stock Altered 1100'!$D33 -> NP | M30: ='[POINTS NQS  2012.XLS]Stock Altered 1100'!$E33 -> 358 | N30: =IF('[POINTS NQS  2012.XLS]Stock Altered 1100'!$F33=0," ",'[POINTS NQS  2012.XLS]Stock Altered 1100'!$F33) -> Maxx'd Out | O30: ='[POINTS NQS  2012.XLS]Stock Altered 1100'!AA33 -> 72
A31: ='[POINTS NQS  2012.XLS]Stock Altered 1050'!$A34 -> 29 | B31: ='[POINTS NQS  2012.XLS]Stock Altered 1050'!$B34 -> Carl Frueh | C31: ='[POINTS NQS  2012.XLS]Stock Altered 1050'!$C34 -> Greenville, IL | D31: ='[POINTS NQS  2012.XLS]Stock Altered 1050'!$D34 -> JRS | E31: ='[POINTS NQS  2012.XLS]Stock Altered 1050'!$E34 -> 279 | F31: =IF('[POINTS NQS  2012.XLS]Stock Altered 1050'!$F34=0," ",'[POINTS NQS  2012.XLS]Stock Altered 1050'!$F34) -> Blue Thunder | G31: ='[POINTS NQS  2012.XLS]Stock Altered 1050'!AA34 -> 71 | I31: ='[POINTS NQS  2012.XLS]Stock Altered 1100'!$A34 -> 29 | J31: ='[POINTS NQS  2012.XLS]Stock Altered 1100'!$B34 -> Nevin Stitzer | K31: ='[POINTS NQS  2012.XLS]Stock Altered 1100'!$C34 -> Spring Mills, PA | L31: ='[POINTS NQS  2012.XLS]Stock Altered 1100'!$D34 -> BJ | M31: ='[POINTS NQS  2012.XLS]Stock Altered 1100'!$E34 -> 447 | N31: =IF('[POINTS NQS  2012.XLS]Stock Altered 1100'!$F34=0," ",'[POINTS NQS  2012.XLS]Stock Altered 1100'!$F34) -> Thunder Road | O31: ='[POINTS NQS  2012.XLS]Stock Altered 1100'!AA34 -> 74
A32: ='[POINTS NQS  2012.XLS]Stock Altered 1050'!$A35 -> 30 | B32: ='[POINTS NQS  2012.XLS]Stock Altered 1050'!$B35 -> William Hart | C32: ='[POINTS NQS  2012.XLS]Stock Altered 1050'!$C35 -> Athens, Oh | D32: ='[POINTS NQS  2012.XLS]Stock Altered 1050'!$D35 -> JRS | E32: ='[POINTS NQS  2012.XLS]Stock Altered 1050'!$E35 -> 470 | F32: =IF('[POINTS NQS  2012.XLS]Stock Altered 1050'!$F35=0," ",'[POINTS NQS  2012.XLS]Stock Altered 1050'!$F35) -> Marie La Veau | G32: ='[POINTS NQS  2012.XLS]Stock Altered 1050'!AA35 -> 72 | I32: ='[POINTS NQS  2012.XLS]Stock Altered 1100'!$A35 -> 30 | J32: ='[POINTS NQS  2012.XLS]Stock Altered 1100'!$B35 -> Randy Amstutz | K32: ='[POINTS NQS  2012.XLS]Stock Altered 1100'!$C35 -> Berne, Ind | L32: ='[POINTS NQS  2012.XLS]Stock Altered 1100'!$D35 -> Woods | M32: ='[POINTS NQS  2012.XLS]Stock Altered 1100'!$E35 -> 533 | N32: =IF('[POINTS NQS  2012.XLS]Stock Altered 1100'!$F35=0," ",'[POINTS NQS  2012.XLS]Stock Altered 1100'!$F35) ->  | O32: ='[POINTS NQS  2012.XLS]Stock Altered 1100'!AA35 -> 76
A33: ='[POINTS NQS  2012.XLS]Stock Altered 1050'!$A36 -> 31 | B33: ='[POINTS NQS  2012.XLS]Stock Altered 1050'!$B36 -> Jamie Lewis | C33: ='[POINTS NQS  2012.XLS]Stock Altered 1050'!$C36 -> Cincinnati, Oh | D33: ='[POINTS NQS  2012.XLS]Stock Altered 1050'!$D36 -> TV | E33: ='[POINTS NQS  2012.XLS]Stock Altered 1050'!$E36 -> 19 | F33: =IF('[POINTS NQS  2012.XLS]Stock Altered 1050'!$F36=0," ",'[POINTS NQS  2012.XLS]Stock Altered 1050'!$F36) -> Oh So Orange | G33: ='[POINTS NQS  2012.XLS]Stock Altered 1050'!AA36 -> 73 | I33: ='[POINTS NQS  2012.XLS]Stock Altered 1100'!$A36 -> 31 | J33: ='[POINTS NQS  2012.XLS]Stock Altered 1100'!$B36 -> Gary Cunningham | K33: ='[POINTS NQS  2012.XLS]Stock Altered 1100'!$C36 -> Brooksville, KY | L33: ='[POINTS NQS  2012.XLS]Stock Altered 1100'!$D36 -> NP | M33: ='[POINTS NQS  2012.XLS]Stock Altered 1100'!$E36 -> 62 | N33: =IF('[POINTS NQS  2012.XLS]Stock Altered 1100'!$F36=0," ",'[POINTS NQS  2012.XLS]Stock Altered 1100'!$F36) -> High Voltage | O33: ='[POINTS NQS  2012.XLS]Stock Altered 1100'!AA36 -> 78
A34: ='[POINTS NQS  2012.XLS]Stock Altered 1050'!$A37 -> 32 | B34: ='[POINTS NQS  2012.XLS]Stock Altered 1050'!$B37 -> Les Salyers | C34: ='[POINTS NQS  2012.XLS]Stock Altered 1050'!$C37 -> Sidney, OH | D34: ='[POINTS NQS  2012.XLS]Stock Altered 1050'!$D37 -> TV | E34: ='[POINTS NQS  2012.XLS]Stock Altered 1050'!$E37 -> 444 | F34: =IF('[POINTS NQS  2012.XLS]Stock Altered 1050'!$F37=0," ",'[POINTS NQS  2012.XLS]Stock Altered 1050'!$F37) -> Unfinished Business | G34: ='[POINTS NQS  2012.XLS]Stock Altered 1050'!AA37 -> 75 | I34: ='[POINTS NQS  2012.XLS]Stock Altered 1100'!$A37 -> 32 | J34: ='[POINTS NQS  2012.XLS]Stock Altered 1100'!$B37 -> Robin Cooper | K34: ='[POINTS NQS  2012.XLS]Stock Altered 1100'!$C37 -> Westminster, Md | L34: ='[POINTS NQS  2012.XLS]Stock Altered 1100'!$D37 -> JRS | M34: ='[POINTS NQS  2012.XLS]Stock Altered 1100'!$E37 -> 73 | N34: =IF('[POINTS NQS  2012.XLS]Stock Altered 1100'!$F37=0," ",'[POINTS NQS  2012.XLS]Stock Altered 1100'!$F37) ->  | O34: ='[POINTS NQS  2012.XLS]Stock Altered 1100'!AA37 -> 80
A35: ='[POINTS NQS  2012.XLS]Stock Altered 1050'!$A38 -> 33 | B35: ='[POINTS NQS  2012.XLS]Stock Altered 1050'!$B38 -> John Cress | C35: ='[POINTS NQS  2012.XLS]Stock Altered 1050'!$C38 -> Strasburg, IL | D35: ='[POINTS NQS  2012.XLS]Stock Altered 1050'!$D38 -> JRS | E35: ='[POINTS NQS  2012.XLS]Stock Altered 1050'!$E38 -> 514 | F35: =IF('[POINTS NQS  2012.XLS]Stock Altered 1050'!$F38=0," ",'[POINTS NQS  2012.XLS]Stock Altered 1050'!$F38) -> Mini Blitzed | G35: ='[POINTS NQS  2012.XLS]Stock Altered 1050'!AA38 -> 75 | I35: ='[POINTS NQS  2012.XLS]Stock Altered 1100'!$A38 -> 33 | J35: ='[POINTS NQS  2012.XLS]Stock Altered 1100'!$B38 -> Brock Nelson | K35: ='[POINTS NQS  2012.XLS]Stock Altered 1100'!$C38 -> Greenville, IL | L35: ='[POINTS NQS  2012.XLS]Stock Altered 1100'!$D38 -> JRS | M35: ='[POINTS NQS  2012.XLS]Stock Altered 1100'!$E38 -> 86 | N35: =IF('[POINTS NQS  2012.XLS]Stock Altered 1100'!$F38=0," ",'[POINTS NQS  2012.XLS]Stock Altered 1100'!$F38) -> Fearless | O35: ='[POINTS NQS  2012.XLS]Stock Altered 1100'!AA38 -> 81
A36: ='[POINTS NQS  2012.XLS]Stock Altered 1050'!$A39 -> 34 | B36: ='[POINTS NQS  2012.XLS]Stock Altered 1050'!$B39 -> Chris Gegg | C36: ='[POINTS NQS  2012.XLS]Stock Altered 1050'!$C39 -> Greenville, IL | D36: ='[POINTS NQS  2012.XLS]Stock Altered 1050'!$D39 -> JRS | E36: ='[POINTS NQS  2012.XLS]Stock Altered 1050'!$E39 -> 410 | F36: =IF('[POINTS NQS  2012.XLS]Stock Altered 1050'!$F39=0," ",'[POINTS NQS  2012.XLS]Stock Altered 1050'!$F39) -> Insane | G36: ='[POINTS NQS  2012.XLS]Stock Altered 1050'!AA39 -> 80 | I36: ='[POINTS NQS  2012.XLS]Stock Altered 1100'!$A39 -> 34 | J36: ='[POINTS NQS  2012.XLS]Stock Altered 1100'!$B39 -> Mark Rader | K36: ='[POINTS NQS  2012.XLS]Stock Altered 1100'!$C39 -> Pataskala, Oh | L36: ='[POINTS NQS  2012.XLS]Stock Altered 1100'!$D39 -> RPM | M36: ='[POINTS NQS  2012.XLS]Stock Altered 1100'!$E39 -> 213 | N36: =IF('[POINTS NQS  2012.XLS]Stock Altered 1100'!$F39=0," ",'[POINTS NQS  2012.XLS]Stock Altered 1100'!$F39) -> Lethal Weapon | O36: ='[POINTS NQS  2012.XLS]Stock Altered 1100'!AA39 -> 83
A37: ='[POINTS NQS  2012.XLS]Stock Altered 1050'!$A40 -> 35 | B37: ='[POINTS NQS  2012.XLS]Stock Altered 1050'!$B40 -> Keith Frueh | C37: ='[POINTS NQS  2012.XLS]Stock Altered 1050'!$C40 -> Greenville, IL | D37: ='[POINTS NQS  2012.XLS]Stock Altered 1050'!$D40 -> JRS | E37: ='[POINTS NQS  2012.XLS]Stock Altered 1050'!$E40 -> 86 | F37: =IF('[POINTS NQS  2012.XLS]Stock Altered 1050'!$F40=0," ",'[POINTS NQS  2012.XLS]Stock Altered 1050'!$F40) -> Fearless | G37: ='[POINTS NQS  2012.XLS]Stock Altered 1050'!AA40 -> 81 | I37: ='[POINTS NQS  2012.XLS]Stock Altered 1100'!$A40 -> 35 | J37: ='[POINTS NQS  2012.XLS]Stock Altered 1100'!$B40 -> Carl Frueh | K37: ='[POINTS NQS  2012.XLS]Stock Altered 1100'!$C40 -> Greenville, IL | L37: ='[POINTS NQS  2012.XLS]Stock Altered 1100'!$D40 -> JRS | M37: ='[POINTS NQS  2012.XLS]Stock Altered 1100'!$E40 -> 279 | N37: =IF('[POINTS NQS  2012.XLS]Stock Altered 1100'!$F40=0," ",'[POINTS NQS  2012.XLS]Stock Altered 1100'!$F40) -> Blue Thunder | O37: ='[POINTS NQS  2012.XLS]Stock Altered 1100'!AA40 -> 83
A38: ='[POINTS NQS  2012.XLS]Stock Altered 1050'!$A41 -> 36 | B38: ='[POINTS NQS  2012.XLS]Stock Altered 1050'!$B41 -> Gary Frank | C38: ='[POINTS NQS  2012.XLS]Stock Altered 1050'!$C41 -> Amanda, OH | D38: ='[POINTS NQS  2012.XLS]Stock Altered 1050'!$D41 -> TV | E38: ='[POINTS NQS  2012.XLS]Stock Altered 1050'!$E41 -> 233 | F38: =IF('[POINTS NQS  2012.XLS]Stock Altered 1050'!$F41=0," ",'[POINTS NQS  2012.XLS]Stock Altered 1050'!$F41) -> Katies Toy | G38: ='[POINTS NQS  2012.XLS]Stock Altered 1050'!AA41 -> 83 | I38: ='[POINTS NQS  2012.XLS]Stock Altered 1100'!$A41 -> 36 | J38: ='[POINTS NQS  2012.XLS]Stock Altered 1100'!$B41 -> Shawn Garman | K38: ='[POINTS NQS  2012.XLS]Stock Altered 1100'!$C41 -> Jeromesville, OH | L38: ='[POINTS NQS  2012.XLS]Stock Altered 1100'!$D41 -> JRS | M38: ='[POINTS NQS  2012.XLS]Stock Altered 1100'!$E41 -> 391 | N38: =IF('[POINTS NQS  2012.XLS]Stock Altered 1100'!$F41=0," ",'[POINTS NQS  2012.XLS]Stock Altered 1100'!$F41) -> Jagmeister | O38: ='[POINTS NQS  2012.XLS]Stock Altered 1100'!AA41 -> 84
A39: ='[POINTS NQS  2012.XLS]Stock Altered 1050'!$A42 -> 37 | B39: ='[POINTS NQS  2012.XLS]Stock Altered 1050'!$B42 -> Mike Yeley | C39: ='[POINTS NQS  2012.XLS]Stock Altered 1050'!$C42 -> Hope, IN | D39: ='[POINTS NQS  2012.XLS]Stock Altered 1050'!$D42 -> JW | E39: ='[POINTS NQS  2012.XLS]Stock Altered 1050'!$E42 -> 55 | F39: =IF('[POINTS NQS  2012.XLS]Stock Altered 1050'!$F42=0," ",'[POINTS NQS  2012.XLS]Stock Altered 1050'!$F42) -> Outta Hope | G39: ='[POINTS NQS  2012.XLS]Stock Altered 1050'!AA42 -> 86 | I39: ='[POINTS NQS  2012.XLS]Stock Altered 1100'!$A42 -> 37 | J39: ='[POINTS NQS  2012.XLS]Stock Altered 1100'!$B42 -> Ron Finch | K39: ='[POINTS NQS  2012.XLS]Stock Altered 1100'!$C42 -> Milan, MI | L39: ='[POINTS NQS  2012.XLS]Stock Altered 1100'!$D42 -> Woods | M39: ='[POINTS NQS  2012.XLS]Stock Altered 1100'!$E42 -> 142 | N39: =IF('[POINTS NQS  2012.XLS]Stock Altered 1100'!$F42=0," ",'[POINTS NQS  2012.XLS]Stock Altered 1100'!$F42) -> Key Chain | O39: ='[POINTS NQS  2012.XLS]Stock Altered 1100'!AA42 -> 85
A40: ='[POINTS NQS  2012.XLS]Stock Altered 1050'!$A43 -> 38 | B40: ='[POINTS NQS  2012.XLS]Stock Altered 1050'!$B43 -> Roger Davis | C40: ='[POINTS NQS  2012.XLS]Stock Altered 1050'!$C43 -> Lower Salem, Oh | D40: ='[POINTS NQS  2012.XLS]Stock Altered 1050'!$D43 -> JRS | E40: ='[POINTS NQS  2012.XLS]Stock Altered 1050'!$E43 -> 68 | F40: =IF('[POINTS NQS  2012.XLS]Stock Altered 1050'!$F43=0," ",'[POINTS NQS  2012.XLS]Stock Altered 1050'!$F43) -> Dusty Lady | G40: ='[POINTS NQS  2012.XLS]Stock Altered 1050'!AA43 -> 89 | I40: ='[POINTS NQS  2012.XLS]Stock Altered 1100'!$A43 -> 38 | J40: ='[POINTS NQS  2012.XLS]Stock Altered 1100'!$B43 -> Waylan Nelson | K40: ='[POINTS NQS  2012.XLS]Stock Altered 1100'!$C43 -> Shelby, IA | L40: ='[POINTS NQS  2012.XLS]Stock Altered 1100'!$D43 -> Woods | M40: ='[POINTS NQS  2012.XLS]Stock Altered 1100'!$E43 -> 500 | N40: =IF('[POINTS NQS  2012.XLS]Stock Altered 1100'!$F43=0," ",'[POINTS NQS  2012.XLS]Stock Altered 1100'!$F43) -> Butt Ugly | O40: ='[POINTS NQS  2012.XLS]Stock Altered 1100'!AA43 -> 85
A41: ='[POINTS NQS  2012.XLS]Stock Altered 1050'!$A44 -> 39 | B41: ='[POINTS NQS  2012.XLS]Stock Altered 1050'!$B44 -> Cody Costa | C41: ='[POINTS NQS  2012.XLS]Stock Altered 1050'!$C44 -> Greencastle, PA | D41: ='[POINTS NQS  2012.XLS]Stock Altered 1050'!$D44 -> NP | E41: ='[POINTS NQS  2012.XLS]Stock Altered 1050'!$E44 -> 135 | F41: =IF('[POINTS NQS  2012.XLS]Stock Altered 1050'!$F44=0," ",'[POINTS NQS  2012.XLS]Stock Altered 1050'!$F44) -> Wild Child | G41: ='[POINTS NQS  2012.XLS]Stock Altered 1050'!AA44 -> 89 | I41: ='[POINTS NQS  2012.XLS]Stock Altered 1100'!$A44 -> 39 | J41: ='[POINTS NQS  2012.XLS]Stock Altered 1100'!$B44 -> John Cress | K41: ='[POINTS NQS  2012.XLS]Stock Altered 1100'!$C44 -> Strasburg, IL | L41: ='[POINTS NQS  2012.XLS]Stock Altered 1100'!$D44 -> JRS | M41: ='[POINTS NQS  2012.XLS]Stock Altered 1100'!$E44 -> 514 | N41: =IF('[POINTS NQS  2012.XLS]Stock Altered 1100'!$F44=0," ",'[POINTS NQS  2012.XLS]Stock Altered 1100'!$F44) -> Mini Blitzed | O41: ='[POINTS NQS  2012.XLS]Stock Altered 1100'!AA44 -> 86
A42: ='[POINTS NQS  2012.XLS]Stock Altered 1050'!$A45 -> 40 | B42: ='[POINTS NQS  2012.XLS]Stock Altered 1050'!$B45 -> Rick James | C42: ='[POINTS NQS  2012.XLS]Stock Altered 1050'!$C45 -> Lancaster, OH | D42: ='[POINTS NQS  2012.XLS]Stock Altered 1050'!$D45 -> BJ | E42: ='[POINTS NQS  2012.XLS]Stock Altered 1050'!$E45 -> 427 | F42: =IF('[POINTS NQS  2012.XLS]Stock Altered 1050'!$F45=0," ",'[POINTS NQS  2012.XLS]Stock Altered 1050'!$F45) -> James Gang III | G42: ='[POINTS NQS  2012.XLS]Stock Altered 1050'!AA45 -> 91 | I42: ='[POINTS NQS  2012.XLS]Stock Altered 1100'!$A45 -> 40 | J42: ='[POINTS NQS  2012.XLS]Stock Altered 1100'!$B45 -> Jerry Leonard | K42: ='[POINTS NQS  2012.XLS]Stock Altered 1100'!$C45 -> Charleston, IL | L42: ='[POINTS NQS  2012.XLS]Stock Altered 1100'!$D45 -> Vogel | M42: ='[POINTS NQS  2012.XLS]Stock Altered 1100'!$E45 -> 308 | N42: =IF('[POINTS NQS  2012.XLS]Stock Altered 1100'!$F45=0," ",'[POINTS NQS  2012.XLS]Stock Altered 1100'!$F45) -> Histrung | O42: ='[POINTS NQS  2012.XLS]Stock Altered 1100'!AA45 -> 88
A43: ='[POINTS NQS  2012.XLS]Stock Altered 1050'!$A46 -> 41 | B43: ='[POINTS NQS  2012.XLS]Stock Altered 1050'!$B46 -> Brian Simpson | C43: ='[POINTS NQS  2012.XLS]Stock Altered 1050'!$C46 -> Danville, Oh | D43: ='[POINTS NQS  2012.XLS]Stock Altered 1050'!$D46 -> Woods | E43: ='[POINTS NQS  2012.XLS]Stock Altered 1050'!$E46 -> 525 | F43: =IF('[POINTS NQS  2012.XLS]Stock Altered 1050'!$F46=0," ",'[POINTS NQS  2012.XLS]Stock Altered 1050'!$F46) -> Ramp Door Express | G43: ='[POINTS NQS  2012.XLS]Stock Altered 1050'!AA46 -> 91 | I43: ='[POINTS NQS  2012.XLS]Stock Altered 1100'!$A46 -> 41 | J43: ='[POINTS NQS  2012.XLS]Stock Altered 1100'!$B46 -> Chris Gegg | K43: ='[POINTS NQS  2012.XLS]Stock Altered 1100'!$C46 -> Greenville, IL | L43: ='[POINTS NQS  2012.XLS]Stock Altered 1100'!$D46 -> JRS | M43: ='[POINTS NQS  2012.XLS]Stock Altered 1100'!$E46 -> 410 | N43: =IF('[POINTS NQS  2012.XLS]Stock Altered 1100'!$F46=0," ",'[POINTS NQS  2012.XLS]Stock Altered 1100'!$F46) -> Insane | O43: ='[POINTS NQS  2012.XLS]Stock Altered 1100'!AA46 -> 88
A44: ='[POINTS NQS  2012.XLS]Stock Altered 1050'!$A47 -> 42 | B44: ='[POINTS NQS  2012.XLS]Stock Altered 1050'!$B47 -> Bobby Feldkamp | C44: ='[POINTS NQS  2012.XLS]Stock Altered 1050'!$C47 -> Milan, MI | D44: ='[POINTS NQS  2012.XLS]Stock Altered 1050'!$D47 -> Woods | E44: ='[POINTS NQS  2012.XLS]Stock Altered 1050'!$E47 -> 501 | F44: =IF('[POINTS NQS  2012.XLS]Stock Altered 1050'!$F47=0," ",'[POINTS NQS  2012.XLS]Stock Altered 1050'!$F47) -> Incognito | G44: ='[POINTS NQS  2012.XLS]Stock Altered 1050'!AA47 -> 92 | I44: ='[POINTS NQS  2012.XLS]Stock Altered 1100'!$A47 -> 42 | J44: ='[POINTS NQS  2012.XLS]Stock Altered 1100'!$B47 -> Steve Chrisman | K44: ='[POINTS NQS  2012.XLS]Stock Altered 1100'!$C47 -> Edinburg, IN | L44: ='[POINTS NQS  2012.XLS]Stock Altered 1100'!$D47 -> Hackman | M44: ='[POINTS NQS  2012.XLS]Stock Altered 1100'!$E47 -> 69 | N44: =IF('[POINTS NQS  2012.XLS]Stock Altered 1100'!$F47=0," ",'[POINTS NQS  2012.XLS]Stock Altered 1100'!$F47) -> Razzmatazz | O44: ='[POINTS NQS  2012.XLS]Stock Altered 1100'!AA47 -> 93
A45: ='[POINTS NQS  2012.XLS]Stock Altered 1050'!$A48 -> 43 | B45: ='[POINTS NQS  2012.XLS]Stock Altered 1050'!$B48 -> Randy Amstutz | C45: ='[POINTS NQS  2012.XLS]Stock Altered 1050'!$C48 -> Berne, Ind | D45: ='[POINTS NQS  2012.XLS]Stock Altered 1050'!$D48 -> Woods | E45: ='[POINTS NQS  2012.XLS]Stock Altered 1050'!$E48 -> 533 | F45: =IF('[POINTS NQS  2012.XLS]Stock Altered 1050'!$F48=0," ",'[POINTS NQS  2012.XLS]Stock Altered 1050'!$F48) ->  | G45: ='[POINTS NQS  2012.XLS]Stock Altered 1050'!AA48 -> 92 | I45: ='[POINTS NQS  2012.XLS]Stock Altered 1100'!$A48 -> 43 | J45: ='[POINTS NQS  2012.XLS]Stock Altered 1100'!$B48 -> Gregory Heifner | K45: ='[POINTS NQS  2012.XLS]Stock Altered 1100'!$C48 -> Jeromesville, OH | L45: ='[POINTS NQS  2012.XLS]Stock Altered 1100'!$D48 -> TH | M45: ='[POINTS NQS  2012.XLS]Stock Altered 1100'!$E48 -> 231 | N45: =IF('[POINTS NQS  2012.XLS]Stock Altered 1100'!$F48=0," ",'[POINTS NQS  2012.XLS]Stock Altered 1100'!$F48) -> Instigator | O45: ='[POINTS NQS  2012.XLS]Stock Altered 1100'!AA48 -> 93
A46: ='[POINTS NQS  2012.XLS]Stock Altered 1050'!$A49 -> 44 | B46: ='[POINTS NQS  2012.XLS]Stock Altered 1050'!$B49 -> Steve Chrisman | C46: ='[POINTS NQS  2012.XLS]Stock Altered 1050'!$C49 -> Edinburg, IN | D46: ='[POINTS NQS  2012.XLS]Stock Altered 1050'!$D49 -> Hackman | E46: ='[POINTS NQS  2012.XLS]Stock Altered 1050'!$E49 -> 69 | F46: =IF('[POINTS NQS  2012.XLS]Stock Altered 1050'!$F49=0," ",'[POINTS NQS  2012.XLS]Stock Altered 1050'!$F49) -> Razmitaz | G46: ='[POINTS NQS  2012.XLS]Stock Altered 1050'!AA49 -> 93 | I46: ='[POINTS NQS  2012.XLS]Stock Altered 1100'!$A49 -> 44 | J46: ='[POINTS NQS  2012.XLS]Stock Altered 1100'!$B49 -> Bobby Feldkamp | K46: ='[POINTS NQS  2012.XLS]Stock Altered 1100'!$C49 -> Milan, MI | L46: ='[POINTS NQS  2012.XLS]Stock Altered 1100'!$D49 -> Woods | M46: ='[POINTS NQS  2012.XLS]Stock Altered 1100'!$E49 -> 501 | N46: =IF('[POINTS NQS  2012.XLS]Stock Altered 1100'!$F49=0," ",'[POINTS NQS  2012.XLS]Stock Altered 1100'!$F49) -> Incognito | O46: ='[POINTS NQS  2012.XLS]Stock Altered 1100'!AA49 -> 96
A47: ='[POINTS NQS  2012.XLS]Stock Altered 1050'!$A50 -> 45 | B47: ='[POINTS NQS  2012.XLS]Stock Altered 1050'!$B50 -> Mike Hall | C47: ='[POINTS NQS  2012.XLS]Stock Altered 1050'!$C50 -> Perrysburg, Oh | D47: ='[POINTS NQS  2012.XLS]Stock Altered 1050'!$D50 -> RPM | E47: ='[POINTS NQS  2012.XLS]Stock Altered 1050'!$E50 -> 248 | F47: =IF('[POINTS NQS  2012.XLS]Stock Altered 1050'!$F50=0," ",'[POINTS NQS  2012.XLS]Stock Altered 1050'!$F50) -> Lethal Injection | G47: ='[POINTS NQS  2012.XLS]Stock Altered 1050'!AA50 -> 93 | I47: ='[POINTS NQS  2012.XLS]Stock Altered 1100'!$A50 -> 45 | J47: ='[POINTS NQS  2012.XLS]Stock Altered 1100'!$B50 -> Les Salyers | K47: ='[POINTS NQS  2012.XLS]Stock Altered 1100'!$C50 -> Sidney, OH | L47: ='[POINTS NQS  2012.XLS]Stock Altered 1100'!$D50 -> TV | M47: ='[POINTS NQS  2012.XLS]Stock Altered 1100'!$E50 -> 444 | N47: =IF('[POINTS NQS  2012.XLS]Stock Altered 1100'!$F50=0," ",'[POINTS NQS  2012.XLS]Stock Altered 1100'!$F50) -> Unfinished Business | O47: ='[POINTS NQS  2012.XLS]Stock Altered 1100'!AA50 -> 99
A48: ='[POINTS NQS  2012.XLS]Stock Altered 1050'!$A51 -> 46 | B48: ='[POINTS NQS  2012.XLS]Stock Altered 1050'!$B51 -> Gregory Heifner | C48: ='[POINTS NQS  2012.XLS]Stock Altered 1050'!$C51 -> Jeromesville, OH | D48: ='[POINTS NQS  2012.XLS]Stock Altered 1050'!$D51 -> TH | E48: ='[POINTS NQS  2012.XLS]Stock Altered 1050'!$E51 -> 231 | F48: =IF('[POINTS NQS  2012.XLS]Stock Altered 1050'!$F51=0," ",'[POINTS NQS  2012.XLS]Stock Altered 1050'!$F51) -> Instigator | G48: ='[POINTS NQS  2012.XLS]Stock Altered 1050'!AA51 -> 95 | I48: ='[POINTS NQS  2012.XLS]Stock Altered 1100'!$A51 -> 46 | J48: ='[POINTS NQS  2012.XLS]Stock Altered 1100'!$B51 -> Herb Houck | K48: ='[POINTS NQS  2012.XLS]Stock Altered 1100'!$C51 -> Spruce Creek, Pa | L48: ='[POINTS NQS  2012.XLS]Stock Altered 1100'!$D51 -> LR | M48: ='[POINTS NQS  2012.XLS]Stock Altered 1100'!$E51 -> 545 | N48: =IF('[POINTS NQS  2012.XLS]Stock Altered 1100'!$F51=0," ",'[POINTS NQS  2012.XLS]Stock Altered 1100'!$F51) -> IH Express | O48: ='[POINTS NQS  2012.XLS]Stock Altered 1100'!AA51 -> 99
A49: ='[POINTS NQS  2012.XLS]Stock Altered 1050'!$A52 -> 47 | B49: ='[POINTS NQS  2012.XLS]Stock Altered 1050'!$B52 -> Mike McGaha | C49: ='[POINTS NQS  2012.XLS]Stock Altered 1050'!$C52 -> Hope, IN | D49: ='[POINTS NQS  2012.XLS]Stock Altered 1050'!$D52 -> JW | E49: ='[POINTS NQS  2012.XLS]Stock Altered 1050'!$E52 -> 288 | F49: =IF('[POINTS NQS  2012.XLS]Stock Altered 1050'!$F52=0," ",'[POINTS NQS  2012.XLS]Stock Altered 1050'!$F52) -> Company Time | G49: ='[POINTS NQS  2012.XLS]Stock Altered 1050'!AA52 -> 95 | I49: ='[POINTS NQS  2012.XLS]Stock Altered 1100'!$A52 -> 47 | J49: ='[POINTS NQS  2012.XLS]Stock Altered 1100'!$B52 -> Jared Riddle | K49: ='[POINTS NQS  2012.XLS]Stock Altered 1100'!$C52 -> Montgomery City, PA | L49: ='[POINTS NQS  2012.XLS]Stock Altered 1100'!$D52 ->  | M49: ='[POINTS NQS  2012.XLS]Stock Altered 1100'!$E52 -> 471 | N49: =IF('[POINTS NQS  2012.XLS]Stock Altered 1100'!$F52=0," ",'[POINTS NQS  2012.XLS]Stock Altered 1100'!$F52) -> Williemakit | O49: ='[POINTS NQS  2012.XLS]Stock Altered 1100'!AA52 -> 100
A50: ='[POINTS NQS  2012.XLS]Stock Altered 1050'!$A53 -> 48 | B50: ='[POINTS NQS  2012.XLS]Stock Altered 1050'!$B53 -> Roger McKinney 3rd | C50: ='[POINTS NQS  2012.XLS]Stock Altered 1050'!$C53 -> Lake Ariel, PA | D50: ='[POINTS NQS  2012.XLS]Stock Altered 1050'!$D53 -> 0 | E50: ='[POINTS NQS  2012.XLS]Stock Altered 1050'!$E53 -> 540 | F50: =IF('[POINTS NQS  2012.XLS]Stock Altered 1050'!$F53=0," ",'[POINTS NQS  2012.XLS]Stock Altered 1050'!$F53) -> Fireball | G50: ='[POINTS NQS  2012.XLS]Stock Altered 1050'!AA53 -> 95 | I50: ='[POINTS NQS  2012.XLS]Stock Altered 1100'!$A53 -> 48 | J50: ='[POINTS NQS  2012.XLS]Stock Altered 1100'!$B53 -> John Elrod | K50: ='[POINTS NQS  2012.XLS]Stock Altered 1100'!$C53 -> Salem, IN | L50: ='[POINTS NQS  2012.XLS]Stock Altered 1100'!$D53 -> TV | M50: ='[POINTS NQS  2012.XLS]Stock Altered 1100'!$E53 -> 20 | N50: =IF('[POINTS NQS  2012.XLS]Stock Altered 1100'!$F53=0," ",'[POINTS NQS  2012.XLS]Stock Altered 1100'!$F53) -> Bad Habit | O50: ='[POINTS NQS  2012.XLS]Stock Altered 1100'!AA53 -> 113
A51: ='[POINTS NQS  2012.XLS]Stock Altered 1050'!$A54 -> 49 | B51: ='[POINTS NQS  2012.XLS]Stock Altered 1050'!$B54 -> Nevin Stitzer | C51: ='[POINTS NQS  2012.XLS]Stock Altered 1050'!$C54 -> Spring Mills, PA | D51: ='[POINTS NQS  2012.XLS]Stock Altered 1050'!$D54 ->  | E51: ='[POINTS NQS  2012.XLS]Stock Altered 1050'!$E54 -> 447 | F51: =IF('[POINTS NQS  2012.XLS]Stock Altered 1050'!$F54=0," ",'[POINTS NQS  2012.XLS]Stock Altered 1050'!$F54) -> Thunder Road | G51: ='[POINTS NQS  2012.XLS]Stock Altered 1050'!AA54 -> 96 | I51: ='[POINTS NQS  2012.XLS]Stock Altered 1100'!$A54 -> 49 | J51: ='[POINTS NQS  2012.XLS]Stock Altered 1100'!$B54 -> Bob Jones SR | K51: ='[POINTS NQS  2012.XLS]Stock Altered 1100'!$C54 -> Hopewell, OH | L51: ='[POINTS NQS  2012.XLS]Stock Altered 1100'!$D54 -> BJ | M51: ='[POINTS NQS  2012.XLS]Stock Altered 1100'!$E54 -> 182 | N51: =IF('[POINTS NQS  2012.XLS]Stock Altered 1100'!$F54=0," ",'[POINTS NQS  2012.XLS]Stock Altered 1100'!$F54) -> Buckeye Binder | O51: ='[POINTS NQS  2012.XLS]Stock Altered 1100'!AA54 -> 113
A52: ='[POINTS NQS  2012.XLS]Stock Altered 1050'!$A55 -> 50 | B52: ='[POINTS NQS  2012.XLS]Stock Altered 1050'!$B55 -> Jared Riddle | C52: ='[POINTS NQS  2012.XLS]Stock Altered 1050'!$C55 -> Montgomery City, PA | D52: ='[POINTS NQS  2012.XLS]Stock Altered 1050'!$D55 ->  | E52: ='[POINTS NQS  2012.XLS]Stock Altered 1050'!$E55 -> 471 | F52: =IF('[POINTS NQS  2012.XLS]Stock Altered 1050'!$F55=0," ",'[POINTS NQS  2012.XLS]Stock Altered 1050'!$F55) -> Williemakit | G52: ='[POINTS NQS  2012.XLS]Stock Altered 1050'!AA55 -> 97 | I52: ='[POINTS NQS  2012.XLS]Stock Altered 1100'!$A55 -> 50 | J52: ='[POINTS NQS  2012.XLS]Stock Altered 1100'!$B55 -> Mike McGaha | K52: ='[POINTS NQS  2012.XLS]Stock Altered 1100'!$C55 -> Hope, IN | L52: ='[POINTS NQS  2012.XLS]Stock Altered 1100'!$D55 -> JW | M52: ='[POINTS NQS  2012.XLS]Stock Altered 1100'!$E55 -> 288 | N52: =IF('[POINTS NQS  2012.XLS]Stock Altered 1100'!$F55=0," ",'[POINTS NQS  2012.XLS]Stock Altered 1100'!$F55) -> Company Time | O52: ='[POINTS NQS  2012.XLS]Stock Altered 1100'!AA55 -> 113
A53: ='[POINTS NQS  2012.XLS]Stock Altered 1050'!$A56 -> 51 | B53: ='[POINTS NQS  2012.XLS]Stock Altered 1050'!$B56 -> John Elrod | C53: ='[POINTS NQS  2012.XLS]Stock Altered 1050'!$C56 -> Salem, IN | D53: ='[POINTS NQS  2012.XLS]Stock Altered 1050'!$D56 -> TV | E53: ='[POINTS NQS  2012.XLS]Stock Altered 1050'!$E56 -> 20 | F53: =IF('[POINTS NQS  2012.XLS]Stock Altered 1050'!$F56=0," ",'[POINTS NQS  2012.XLS]Stock Altered 1050'!$F56) -> Bad Habit | G53: ='[POINTS NQS  2012.XLS]Stock Altered 1050'!AA56 -> 111 | I53: ='[POINTS NQS  2012.XLS]Stock Altered 1100'!$A56 -> 51 | J53: ='[POINTS NQS  2012.XLS]Stock Altered 1100'!$B56 -> Jeff Jager | K53: ='[POINTS NQS  2012.XLS]Stock Altered 1100'!$C56 -> Sussex, NJ | L53: ='[POINTS NQS  2012.XLS]Stock Altered 1100'!$D56 -> JRS | M53: ='[POINTS NQS  2012.XLS]Stock Altered 1100'!$E56 -> 529 | N53: =IF('[POINTS NQS  2012.XLS]Stock Altered 1100'!$F56=0," ",'[POINTS NQS  2012.XLS]Stock Altered 1100'!$F56) -> Orange Crush | O53: ='[POINTS NQS  2012.XLS]Stock Altered 1100'!AA56 -> 113
A54: ='[POINTS NQS  2012.XLS]Stock Altered 1050'!$A57 -> 52 | B54: ='[POINTS NQS  2012.XLS]Stock Altered 1050'!$B57 -> Gordon Lloyd | C54: ='[POINTS NQS  2012.XLS]Stock Altered 1050'!$C57 -> Circleville, Oh | D54: ='[POINTS NQS  2012.XLS]Stock Altered 1050'!$D57 -> 0 | E54: ='[POINTS NQS  2012.XLS]Stock Altered 1050'!$E57 -> 549 | F54: =IF('[POINTS NQS  2012.XLS]Stock Altered 1050'!$F57=0," ",'[POINTS NQS  2012.XLS]Stock Altered 1050'!$F57) -> Project X | G54: ='[POINTS NQS  2012.XLS]Stock Altered 1050'!AA57 -> 111 | I54: ='[POINTS NQS  2012.XLS]Stock Altered 1100'!$A57 -> 52 | J54: ='[POINTS NQS  2012.XLS]Stock Altered 1100'!$B57 -> William Hart | K54: ='[POINTS NQS  2012.XLS]Stock Altered 1100'!$C57 -> Athens, Oh | L54: ='[POINTS NQS  2012.XLS]Stock Altered 1100'!$D57 -> JRS | M54: ='[POINTS NQS  2012.XLS]Stock Altered 1100'!$E57 -> 470 | N54: =IF('[POINTS NQS  2012.XLS]Stock Altered 1100'!$F57=0," ",'[POINTS NQS  2012.XLS]Stock Altered 1100'!$F57) -> Marie LaVeau | O54: ='[POINTS NQS  2012.XLS]Stock Altered 1100'!AA57 -> 114
A55: ='[POINTS NQS  2012.XLS]Stock Altered 1050'!$A58 -> 53 | B55: ='[POINTS NQS  2012.XLS]Stock Altered 1050'!$B58 -> Bill Elrod | C55: ='[POINTS NQS  2012.XLS]Stock Altered 1050'!$C58 -> Salem, IN | D55: ='[POINTS NQS  2012.XLS]Stock Altered 1050'!$D58 -> TV | E55: ='[POINTS NQS  2012.XLS]Stock Altered 1050'!$E58 -> 21 | F55: =IF('[POINTS NQS  2012.XLS]Stock Altered 1050'!$F58=0," ",'[POINTS NQS  2012.XLS]Stock Altered 1050'!$F58) -> Pa Paw Toy | G55: ='[POINTS NQS  2012.XLS]Stock Altered 1050'!AA58 -> 112 | I55: ='[POINTS NQS  2012.XLS]Stock Altered 1100'!$A58 -> 53 | J55: ='[POINTS NQS  2012.XLS]Stock Altered 1100'!$B58 -> Greg Myers | K55: ='[POINTS NQS  2012.XLS]Stock Altered 1100'!$C58 -> Circleville, Oh | L55: ='[POINTS NQS  2012.XLS]Stock Altered 1100'!$D58 -> 0 | M55: ='[POINTS NQS  2012.XLS]Stock Altered 1100'!$E58 -> 496 | N55: =IF('[POINTS NQS  2012.XLS]Stock Altered 1100'!$F58=0," ",'[POINTS NQS  2012.XLS]Stock Altered 1100'!$F58) -> Gang Green | O55: ='[POINTS NQS  2012.XLS]Stock Altered 1100'!AA58 -> 114
A56: ='[POINTS NQS  2012.XLS]Stock Altered 1050'!$A59 -> 54 | B56: ='[POINTS NQS  2012.XLS]Stock Altered 1050'!$B59 -> Shawn Garman | C56: ='[POINTS NQS  2012.XLS]Stock Altered 1050'!$C59 -> Jeromesville, OH | D56: ='[POINTS NQS  2012.XLS]Stock Altered 1050'!$D59 -> JRS | E56: ='[POINTS NQS  2012.XLS]Stock Altered 1050'!$E59 -> 391 | F56: =IF('[POINTS NQS  2012.XLS]Stock Altered 1050'!$F59=0," ",'[POINTS NQS  2012.XLS]Stock Altered 1050'!$F59) -> Jagmeister | G56: ='[POINTS NQS  2012.XLS]Stock Altered 1050'!AA59 -> 112 | I56: ='[POINTS NQS  2012.XLS]Stock Altered 1100'!$A59 -> 54 | J56: ='[POINTS NQS  2012.XLS]Stock Altered 1100'!$B59 -> Brian Bell | K56: ='[POINTS NQS  2012.XLS]Stock Altered 1100'!$C59 -> Cynthiene, KY | L56: ='[POINTS NQS  2012.XLS]Stock Altered 1100'!$D59 -> NP | M56: ='[POINTS NQS  2012.XLS]Stock Altered 1100'!$E59 -> 510 | N56: =IF('[POINTS NQS  2012.XLS]Stock Altered 1100'!$F59=0," ",'[POINTS NQS  2012.XLS]Stock Altered 1100'!$F59) -> Grim Reaper | O56: ='[POINTS NQS  2012.XLS]Stock Altered 1100'!AA59 -> 114
A57: ='[POINTS NQS  2012.XLS]Stock Altered 1050'!$A60 -> 55 | B57: ='[POINTS NQS  2012.XLS]Stock Altered 1050'!$B60 -> Gina McGaha | C57: ='[POINTS NQS  2012.XLS]Stock Altered 1050'!$C60 -> Hope, IN | D57: ='[POINTS NQS  2012.XLS]Stock Altered 1050'!$D60 -> JW | E57: ='[POINTS NQS  2012.XLS]Stock Altered 1050'!$E60 -> 161 | F57: =IF('[POINTS NQS  2012.XLS]Stock Altered 1050'!$F60=0," ",'[POINTS NQS  2012.XLS]Stock Altered 1050'!$F60) -> Betty Stalker | G57: ='[POINTS NQS  2012.XLS]Stock Altered 1050'!AA60 -> 113 | I57: ='[POINTS NQS  2012.XLS]Stock Altered 1100'!$A60 -> 55 | J57: ='[POINTS NQS  2012.XLS]Stock Altered 1100'!$B60 -> Brian Simpson | K57: ='[POINTS NQS  2012.XLS]Stock Altered 1100'!$C60 -> Danville, Oh | L57: ='[POINTS NQS  2012.XLS]Stock Altered 1100'!$D60 -> Woods | M57: ='[POINTS NQS  2012.XLS]Stock Altered 1100'!$E60 -> 525 | N57: =IF('[POINTS NQS  2012.XLS]Stock Altered 1100'!$F60=0," ",'[POINTS NQS  2012.XLS]Stock Altered 1100'!$F60) -> Ramp Door Express | O57: ='[POINTS NQS  2012.XLS]Stock Altered 1100'!AA60 -> 114
A58: ='[POINTS NQS  2012.XLS]Stock Altered 1050'!$A61 -> 56 | B58: ='[POINTS NQS  2012.XLS]Stock Altered 1050'!$B61 -> Mark Rader | C58: ='[POINTS NQS  2012.XLS]Stock Altered 1050'!$C61 -> Pataskala, Oh | D58: ='[POINTS NQS  2012.XLS]Stock Altered 1050'!$D61 -> RPM | E58: ='[POINTS NQS  2012.XLS]Stock Altered 1050'!$E61 -> 213 | F58: =IF('[POINTS NQS  2012.XLS]Stock Altered 1050'!$F61=0," ",'[POINTS NQS  2012.XLS]Stock Altered 1050'!$F61) -> Lethal Weapon | G58: ='[POINTS NQS  2012.XLS]Stock Altered 1050'!AA61 -> 113 | I58: ='[POINTS NQS  2012.XLS]Stock Altered 1100'!$A61 -> 56 | J58: ='[POINTS NQS  2012.XLS]Stock Altered 1100'!$B61 -> Gina McGaha | K58: ='[POINTS NQS  2012.XLS]Stock Altered 1100'!$C61 -> Hope, IN | L58: ='[POINTS NQS  2012.XLS]Stock Altered 1100'!$D61 -> JW | M58: ='[POINTS NQS  2012.XLS]Stock Altered 1100'!$E61 -> 161 | N58: =IF('[POINTS NQS  2012.XLS]Stock Altered 1100'!$F61=0," ",'[POINTS NQS  2012.XLS]Stock Altered 1100'!$F61) -> Betty Stalker | O58: ='[POINTS NQS  2012.XLS]Stock Altered 1100'!AA61 -> 115
A59: ='[POINTS NQS  2012.XLS]Stock Altered 1050'!$A62 -> 57 | B59: ='[POINTS NQS  2012.XLS]Stock Altered 1050'!$B62 -> Clarence Bell | C59: ='[POINTS NQS  2012.XLS]Stock Altered 1050'!$C62 -> West Salem, IL | D59: ='[POINTS NQS  2012.XLS]Stock Altered 1050'!$D62 -> TC | E59: ='[POINTS NQS  2012.XLS]Stock Altered 1050'!$E62 -> 466 | F59: =IF('[POINTS NQS  2012.XLS]Stock Altered 1050'!$F62=0," ",'[POINTS NQS  2012.XLS]Stock Altered 1050'!$F62) -> Money Pit | G59: ='[POINTS NQS  2012.XLS]Stock Altered 1050'!AA62 -> 113 | I59: ='[POINTS NQS  2012.XLS]Stock Altered 1100'!$A62 -> 57 | J59: ='[POINTS NQS  2012.XLS]Stock Altered 1100'!$B62 -> Gary Frank | K59: ='[POINTS NQS  2012.XLS]Stock Altered 1100'!$C62 -> Amanda, OH | L59: ='[POINTS NQS  2012.XLS]Stock Altered 1100'!$D62 -> TV | M59: ='[POINTS NQS  2012.XLS]Stock Altered 1100'!$E62 -> 233 | N59: =IF('[POINTS NQS  2012.XLS]Stock Altered 1100'!$F62=0," ",'[POINTS NQS  2012.XLS]Stock Altered 1100'!$F62) -> Katies Toy | O59: ='[POINTS NQS  2012.XLS]Stock Altered 1100'!AA62 -> 115
A60: ='[POINTS NQS  2012.XLS]Stock Altered 1050'!$A63 -> 58 | B60: ='[POINTS NQS  2012.XLS]Stock Altered 1050'!$B63 -> Greg Myers | C60: ='[POINTS NQS  2012.XLS]Stock Altered 1050'!$C63 -> Circleville, Oh | D60: ='[POINTS NQS  2012.XLS]Stock Altered 1050'!$D63 -> 0 | E60: ='[POINTS NQS  2012.XLS]Stock Altered 1050'!$E63 -> 496 | F60: =IF('[POINTS NQS  2012.XLS]Stock Altered 1050'!$F63=0," ",'[POINTS NQS  2012.XLS]Stock Altered 1050'!$F63) -> Gang Green | G60: ='[POINTS NQS  2012.XLS]Stock Altered 1050'!AA63 -> 113 | I60: ='[POINTS NQS  2012.XLS]Stock Altered 1100'!$A63 -> 58 | J60: ='[POINTS NQS  2012.XLS]Stock Altered 1100'!$B63 -> Waylan Nelson | K60: ='[POINTS NQS  2012.XLS]Stock Altered 1100'!$C63 -> Shelby, IA | L60: ='[POINTS NQS  2012.XLS]Stock Altered 1100'!$D63 -> Woods | M60: ='[POINTS NQS  2012.XLS]Stock Altered 1100'!$E63 -> 499 | N60: =IF('[POINTS NQS  2012.XLS]Stock Altered 1100'!$F63=0," ",'[POINTS NQS  2012.XLS]Stock Altered 1100'!$F63) -> Close E Nuff | O60: ='[POINTS NQS  2012.XLS]Stock Altered 1100'!AA63 -> 115
A61: ='[POINTS NQS  2012.XLS]Stock Altered 1050'!$A64 -> 59 | B61: ='[POINTS NQS  2012.XLS]Stock Altered 1050'!$B64 -> Bob Jones SR | C61: ='[POINTS NQS  2012.XLS]Stock Altered 1050'!$C64 -> Hopewell, OH | D61: ='[POINTS NQS  2012.XLS]Stock Altered 1050'!$D64 -> BJ | E61: ='[POINTS NQS  2012.XLS]Stock Altered 1050'!$E64 -> 182 | F61: =IF('[POINTS NQS  2012.XLS]Stock Altered 1050'!$F64=0," ",'[POINTS NQS  2012.XLS]Stock Altered 1050'!$F64) -> Buckeye Binder | G61: ='[POINTS NQS  2012.XLS]Stock Altered 1050'!AA64 -> 114 | I61: ='[POINTS NQS  2012.XLS]Stock Altered 1100'!$A64 -> 59 | J61: ='[POINTS NQS  2012.XLS]Stock Altered 1100'!$B64 -> Roger McKinney 3rd | K61: ='[POINTS NQS  2012.XLS]Stock Altered 1100'!$C64 -> Lake Ariel, PA | L61: ='[POINTS NQS  2012.XLS]Stock Altered 1100'!$D64 -> 0 | M61: ='[POINTS NQS  2012.XLS]Stock Altered 1100'!$E64 -> 540 | N61: =IF('[POINTS NQS  2012.XLS]Stock Altered 1100'!$F64=0," ",'[POINTS NQS  2012.XLS]Stock Altered 1100'!$F64) -> Fireball | O61: ='[POINTS NQS  2012.XLS]Stock Altered 1100'!AA64 -> 115
A62: ='[POINTS NQS  2012.XLS]Stock Altered 1050'!$A65 -> 60 | B62: ='[POINTS NQS  2012.XLS]Stock Altered 1050'!$B65 -> Waylan Nelson | C62: ='[POINTS NQS  2012.XLS]Stock Altered 1050'!$C65 -> Shelby, IA | D62: ='[POINTS NQS  2012.XLS]Stock Altered 1050'!$D65 -> Woods | E62: ='[POINTS NQS  2012.XLS]Stock Altered 1050'!$E65 -> 500 | F62: =IF('[POINTS NQS  2012.XLS]Stock Altered 1050'!$F65=0," ",'[POINTS NQS  2012.XLS]Stock Altered 1050'!$F65) -> Butt Ugly | G62: ='[POINTS NQS  2012.XLS]Stock Altered 1050'!AA65 -> 114 | I62: ='[POINTS NQS  2012.XLS]Stock Altered 1100'!$A65 -> 60 | J62: ='[POINTS NQS  2012.XLS]Stock Altered 1100'!$B65 -> Roger Davis | K62: ='[POINTS NQS  2012.XLS]Stock Altered 1100'!$C65 -> Whipple, Oh | L62: ='[POINTS NQS  2012.XLS]Stock Altered 1100'!$D65 -> JRS | M62: ='[POINTS NQS  2012.XLS]Stock Altered 1100'!$E65 -> 68 | N62: =IF('[POINTS NQS  2012.XLS]Stock Altered 1100'!$F65=0," ",'[POINTS NQS  2012.XLS]Stock Altered 1100'!$F65) -> Dusty Lady | O62: ='[POINTS NQS  2012.XLS]Stock Altered 1100'!AA65 -> 116
A63: ='[POINTS NQS  2012.XLS]Stock Altered 1050'!$A66 -> 61 | B63: ='[POINTS NQS  2012.XLS]Stock Altered 1050'!$B66 -> Brian Bell | C63: ='[POINTS NQS  2012.XLS]Stock Altered 1050'!$C66 -> Cynthiene, KY | D63: ='[POINTS NQS  2012.XLS]Stock Altered 1050'!$D66 -> NP | E63: ='[POINTS NQS  2012.XLS]Stock Altered 1050'!$E66 -> 510 | F63: =IF('[POINTS NQS  2012.XLS]Stock Altered 1050'!$F66=0," ",'[POINTS NQS  2012.XLS]Stock Altered 1050'!$F66) -> Grim Reaper | G63: ='[POINTS NQS  2012.XLS]Stock Altered 1050'!AA66 -> 114 | I63: ='[POINTS NQS  2012.XLS]Stock Altered 1100'!$A66 -> 61 | J63: ='[POINTS NQS  2012.XLS]Stock Altered 1100'!$B66 -> Mark Vaughn | K63: ='[POINTS NQS  2012.XLS]Stock Altered 1100'!$C66 -> Loudonville, Oh | L63: ='[POINTS NQS  2012.XLS]Stock Altered 1100'!$D66 -> Woods | M63: ='[POINTS NQS  2012.XLS]Stock Altered 1100'!$E66 -> 523 | N63: =IF('[POINTS NQS  2012.XLS]Stock Altered 1100'!$F66=0," ",'[POINTS NQS  2012.XLS]Stock Altered 1100'!$F66) -> Cowen Truck Lines | O63: ='[POINTS NQS  2012.XLS]Stock Altered 1100'!AA66 -> 116
A64: ='[POINTS NQS  2012.XLS]Stock Altered 1050'!$A67 -> 62 | B64: ='[POINTS NQS  2012.XLS]Stock Altered 1050'!$B67 -> Mark Vaughn | C64: ='[POINTS NQS  2012.XLS]Stock Altered 1050'!$C67 -> Loudonville, Oh | D64: ='[POINTS NQS  2012.XLS]Stock Altered 1050'!$D67 -> Woods | E64: ='[POINTS NQS  2012.XLS]Stock Altered 1050'!$E67 -> 523 | F64: =IF('[POINTS NQS  2012.XLS]Stock Altered 1050'!$F67=0," ",'[POINTS NQS  2012.XLS]Stock Altered 1050'!$F67) -> Cowen Truck Lines | G64: ='[POINTS NQS  2012.XLS]Stock Altered 1050'!AA67 -> 114 | I64: ='[POINTS NQS  2012.XLS]Stock Altered 1100'!$A67 -> 62 | J64: ='[POINTS NQS  2012.XLS]Stock Altered 1100'!$B67 -> Bill Elrod | K64: ='[POINTS NQS  2012.XLS]Stock Altered 1100'!$C67 -> Salem, IN | L64: ='[POINTS NQS  2012.XLS]Stock Altered 1100'!$D67 -> TV | M64: ='[POINTS NQS  2012.XLS]Stock Altered 1100'!$E67 -> 21 | N64: =IF('[POINTS NQS  2012.XLS]Stock Altered 1100'!$F67=0," ",'[POINTS NQS  2012.XLS]Stock Altered 1100'!$F67) -> Pa Paw Toy | O64: ='[POINTS NQS  2012.XLS]Stock Altered 1100'!AA67 -> 117
A65: ='[POINTS NQS  2012.XLS]Stock Altered 1050'!$A68 -> 63 | B65: ='[POINTS NQS  2012.XLS]Stock Altered 1050'!$B68 -> Jerry Leonard | C65: ='[POINTS NQS  2012.XLS]Stock Altered 1050'!$C68 -> Charleston, IL | D65: ='[POINTS NQS  2012.XLS]Stock Altered 1050'!$D68 -> Vogel | E65: ='[POINTS NQS  2012.XLS]Stock Altered 1050'!$E68 -> 308 | F65: =IF('[POINTS NQS  2012.XLS]Stock Altered 1050'!$F68=0," ",'[POINTS NQS  2012.XLS]Stock Altered 1050'!$F68) -> Histrung | G65: ='[POINTS NQS  2012.XLS]Stock Altered 1050'!AA68 -> 115 | I65: ='[POINTS NQS  2012.XLS]Stock Altered 1100'!$A68 -> 63 | J65: ='[POINTS NQS  2012.XLS]Stock Altered 1100'!$B68 -> Gary Cunningham | K65: ='[POINTS NQS  2012.XLS]Stock Altered 1100'!$C68 -> Brooksville, KY | L65: ='[POINTS NQS  2012.XLS]Stock Altered 1100'!$D68 -> NP | M65: ='[POINTS NQS  2012.XLS]Stock Altered 1100'!$E68 -> 162 | N65: =IF('[POINTS NQS  2012.XLS]Stock Altered 1100'!$F68=0," ",'[POINTS NQS  2012.XLS]Stock Altered 1100'!$F68) -> High Voltage | O65: ='[POINTS NQS  2012.XLS]Stock Altered 1100'!AA68 -> 117
A66: ='[POINTS NQS  2012.XLS]Stock Altered 1050'!$A69 -> 64 | B66: ='[POINTS NQS  2012.XLS]Stock Altered 1050'!$B69 -> Tod Hinkle | C66: ='[POINTS NQS  2012.XLS]Stock Altered 1050'!$C69 -> Dongola, IA | D66: ='[POINTS NQS  2012.XLS]Stock Altered 1050'!$D69 -> JW | E66: ='[POINTS NQS  2012.XLS]Stock Altered 1050'!$E69 -> 370 | F66: =IF('[POINTS NQS  2012.XLS]Stock Altered 1050'!$F69=0," ",'[POINTS NQS  2012.XLS]Stock Altered 1050'!$F69) -> Disturbed | G66: ='[POINTS NQS  2012.XLS]Stock Altered 1050'!AA69 -> 115 | I66: ='[POINTS NQS  2012.XLS]Stock Altered 1100'!$A69 -> 64 | J66: ='[POINTS NQS  2012.XLS]Stock Altered 1100'!$B69 -> Jeremy Pierce | K66: ='[POINTS NQS  2012.XLS]Stock Altered 1100'!$C69 -> Flat Rock, IN | L66: ='[POINTS NQS  2012.XLS]Stock Altered 1100'!$D69 -> JP | M66: ='[POINTS NQS  2012.XLS]Stock Altered 1100'!$E69 -> 362 | N66: =IF('[POINTS NQS  2012.XLS]Stock Altered 1100'!$F69=0," ",'[POINTS NQS  2012.XLS]Stock Altered 1100'!$F69) -> LunchMoney | O66: ='[POINTS NQS  2012.XLS]Stock Altered 1100'!AA69 -> 117
A67: ='[POINTS NQS  2012.XLS]Stock Altered 1050'!$A70 -> 65 | B67: ='[POINTS NQS  2012.XLS]Stock Altered 1050'!$B70 -> Waylan Nelson | C67: ='[POINTS NQS  2012.XLS]Stock Altered 1050'!$C70 -> Shelby, IA | D67: ='[POINTS NQS  2012.XLS]Stock Altered 1050'!$D70 -> Woods | E67: ='[POINTS NQS  2012.XLS]Stock Altered 1050'!$E70 -> 499 | F67: =IF('[POINTS NQS  2012.XLS]Stock Altered 1050'!$F70=0," ",'[POINTS NQS  2012.XLS]Stock Altered 1050'!$F70) -> Close E Nuff | G67: ='[POINTS NQS  2012.XLS]Stock Altered 1050'!AA70 -> 115 | I67: ='[POINTS NQS  2012.XLS]Stock Altered 1100'!$A70 -> 65 | J67: ='[POINTS NQS  2012.XLS]Stock Altered 1100'!$B70 -> Tod Hinkle | K67: ='[POINTS NQS  2012.XLS]Stock Altered 1100'!$C70 -> Dongola, IA | L67: ='[POINTS NQS  2012.XLS]Stock Altered 1100'!$D70 -> JW | M67: ='[POINTS NQS  2012.XLS]Stock Altered 1100'!$E70 -> 370 | N67: =IF('[POINTS NQS  2012.XLS]Stock Altered 1100'!$F70=0," ",'[POINTS NQS  2012.XLS]Stock Altered 1100'!$F70) -> Disturbed | O67: ='[POINTS NQS  2012.XLS]Stock Altered 1100'!AA70 -> 117
A68: ='[POINTS NQS  2012.XLS]Stock Altered 1050'!$A71 -> 66 | B68: ='[POINTS NQS  2012.XLS]Stock Altered 1050'!$B71 -> Herb Houck | C68: ='[POINTS NQS  2012.XLS]Stock Altered 1050'!$C71 -> Spruce Creek, Pa | D68: ='[POINTS NQS  2012.XLS]Stock Altered 1050'!$D71 -> LR | E68: ='[POINTS NQS  2012.XLS]Stock Altered 1050'!$E71 -> 545 | F68: =IF('[POINTS NQS  2012.XLS]Stock Altered 1050'!$F71=0," ",'[POINTS NQS  2012.XLS]Stock Altered 1050'!$F71) -> IH Express | G68: ='[POINTS NQS  2012.XLS]Stock Altered 1050'!AA71 -> 115 | I68: ='[POINTS NQS  2012.XLS]Stock Altered 1100'!$A71 -> 66 | J68: ='[POINTS NQS  2012.XLS]Stock Altered 1100'!$B71 -> Jim Hill | K68: ='[POINTS NQS  2012.XLS]Stock Altered 1100'!$C71 -> Indianapolis, IN | L68: ='[POINTS NQS  2012.XLS]Stock Altered 1100'!$D71 -> JW | M68: ='[POINTS NQS  2012.XLS]Stock Altered 1100'!$E71 -> 515 | N68: =IF('[POINTS NQS  2012.XLS]Stock Altered 1100'!$F71=0," ",'[POINTS NQS  2012.XLS]Stock Altered 1100'!$F71) -> Run-N-Hot | O68: ='[POINTS NQS  2012.XLS]Stock Altered 1100'!AA71 -> 117
A69: ='[POINTS NQS  2012.XLS]Stock Altered 1050'!$A72 -> 67 | B69: ='[POINTS NQS  2012.XLS]Stock Altered 1050'!$B72 -> Tim Bowling | C69: ='[POINTS NQS  2012.XLS]Stock Altered 1050'!$C72 -> Syracuse, Ind | D69: ='[POINTS NQS  2012.XLS]Stock Altered 1050'!$D72 -> LR | E69: ='[POINTS NQS  2012.XLS]Stock Altered 1050'!$E72 -> 0 | F69: =IF('[POINTS NQS  2012.XLS]Stock Altered 1050'!$F72=0," ",'[POINTS NQS  2012.XLS]Stock Altered 1050'!$F72) -> Orange Cub | G69: ='[POINTS NQS  2012.XLS]Stock Altered 1050'!AA72 -> 115 | I69: ='[POINTS NQS  2012.XLS]Stock Altered 1100'!$A72 -> 67 | J69: ='[POINTS NQS  2012.XLS]Stock Altered 1100'!$B72 -> Bob Strawser | K69: ='[POINTS NQS  2012.XLS]Stock Altered 1100'!$C72 -> Stoutsville, Oh | L69: ='[POINTS NQS  2012.XLS]Stock Altered 1100'!$D72 -> 0 | M69: ='[POINTS NQS  2012.XLS]Stock Altered 1100'!$E72 -> 548 | N69: =IF('[POINTS NQS  2012.XLS]Stock Altered 1100'!$F72=0," ",'[POINTS NQS  2012.XLS]Stock Altered 1100'!$F72) -> Funny Farmall | O69: ='[POINTS NQS  2012.XLS]Stock Altered 1100'!AA72 -> 117
A70: ='[POINTS NQS  2012.XLS]Stock Altered 1050'!$A73 -> 68 | B70: ='[POINTS NQS  2012.XLS]Stock Altered 1050'!$B73 -> Jeff Jager | C70: ='[POINTS NQS  2012.XLS]Stock Altered 1050'!$C73 -> Sussex, NJ | D70: ='[POINTS NQS  2012.XLS]Stock Altered 1050'!$D73 -> JRS | E70: ='[POINTS NQS  2012.XLS]Stock Altered 1050'!$E73 -> 529 | F70: =IF('[POINTS NQS  2012.XLS]Stock Altered 1050'!$F73=0," ",'[POINTS NQS  2012.XLS]Stock Altered 1050'!$F73) -> Orange Crush | G70: ='[POINTS NQS  2012.XLS]Stock Altered 1050'!AA73 -> 116 | I70: ='[POINTS NQS  2012.XLS]Stock Altered 1100'!$A73 -> 68 | J70: ='[POINTS NQS  2012.XLS]Stock Altered 1100'!$B73 -> Gordon Lloyd | K70: ='[POINTS NQS  2012.XLS]Stock Altered 1100'!$C73 -> Circleville, Oh | L70: ='[POINTS NQS  2012.XLS]Stock Altered 1100'!$D73 -> 0 | M70: ='[POINTS NQS  2012.XLS]Stock Altered 1100'!$E73 -> 549 | N70: =IF('[POINTS NQS  2012.XLS]Stock Altered 1100'!$F73=0," ",'[POINTS NQS  2012.XLS]Stock Altered 1100'!$F73) -> Project X | O70: ='[POINTS NQS  2012.XLS]Stock Altered 1100'!AA73 -> 117
A71: ='[POINTS NQS  2012.XLS]Stock Altered 1050'!$A74 -> 69 | B71: ='[POINTS NQS  2012.XLS]Stock Altered 1050'!$B74 -> Gaylord Strine | C71: ='[POINTS NQS  2012.XLS]Stock Altered 1050'!$C74 -> Ashland, OH | D71: ='[POINTS NQS  2012.XLS]Stock Altered 1050'!$D74 -> JRS | E71: ='[POINTS NQS  2012.XLS]Stock Altered 1050'!$E74 -> 492 | F71: =IF('[POINTS NQS  2012.XLS]Stock Altered 1050'!$F74=0," ",'[POINTS NQS  2012.XLS]Stock Altered 1050'!$F74) -> Giddy Up Go | G71: ='[POINTS NQS  2012.XLS]Stock Altered 1050'!AA74 -> 117 | I71: ='[POINTS NQS  2012.XLS]Stock Altered 1100'!$A74 -> 69 | J71: ='[POINTS NQS  2012.XLS]Stock Altered 1100'!$B74 -> Mike Yeley | K71: ='[POINTS NQS  2012.XLS]Stock Altered 1100'!$C74 -> Hope, IN | L71: ='[POINTS NQS  2012.XLS]Stock Altered 1100'!$D74 -> JW | M71: ='[POINTS NQS  2012.XLS]Stock Altered 1100'!$E74 -> 55 | N71: =IF('[POINTS NQS  2012.XLS]Stock Altered 1100'!$F74=0," ",'[POINTS NQS  2012.XLS]Stock Altered 1100'!$F74) -> Outta Hope | O71: ='[POINTS NQS  2012.XLS]Stock Altered 1100'!AA74 -> 118
A72: ='[POINTS NQS  2012.XLS]Stock Altered 1050'!$A75 -> 70 | B72: ='[POINTS NQS  2012.XLS]Stock Altered 1050'!$B75 -> Bob Strawser | C72: ='[POINTS NQS  2012.XLS]Stock Altered 1050'!$C75 -> Stoutsville, Oh | D72: ='[POINTS NQS  2012.XLS]Stock Altered 1050'!$D75 -> 0 | E72: ='[POINTS NQS  2012.XLS]Stock Altered 1050'!$E75 -> 548 | F72: =IF('[POINTS NQS  2012.XLS]Stock Altered 1050'!$F75=0," ",'[POINTS NQS  2012.XLS]Stock Altered 1050'!$F75) -> Funny Farmall | G72: ='[POINTS NQS  2012.XLS]Stock Altered 1050'!AA75 -> 118 | I72: ='[POINTS NQS  2012.XLS]Stock Altered 1100'!$A75 -> 70 | J72: ='[POINTS NQS  2012.XLS]Stock Altered 1100'!$B75 -> Ron Feldkamp | K72: ='[POINTS NQS  2012.XLS]Stock Altered 1100'!$C75 -> Saline, Mi | L72: ='[POINTS NQS  2012.XLS]Stock Altered 1100'!$D75 -> Woods | M72: ='[POINTS NQS  2012.XLS]Stock Altered 1100'!$E75 -> 143 | N72: =IF('[POINTS NQS  2012.XLS]Stock Altered 1100'!$F75=0," ",'[POINTS NQS  2012.XLS]Stock Altered 1100'!$F75) -> Top Notch | O72: ='[POINTS NQS  2012.XLS]Stock Altered 1100'!AA75 -> 118
A73: ='[POINTS NQS  2012.XLS]Stock Altered 1050'!$A76 -> 0 | B73: ='[POINTS NQS  2012.XLS]Stock Altered 1050'!$B76 -> 0 | C73: ='[POINTS NQS  2012.XLS]Stock Altered 1050'!$C76 -> 0 | D73: ='[POINTS NQS  2012.XLS]Stock Altered 1050'!$D76 -> 0 | E73: ='[POINTS NQS  2012.XLS]Stock Altered 1050'!$E76 -> 0 | F73: =IF('[POINTS NQS  2012.XLS]Stock Altered 1050'!$F76=0," ",'[POINTS NQS  2012.XLS]Stock Altered 1050'!$F76) ->  | G73: ='[POINTS NQS  2012.XLS]Stock Altered 1050'!AA76 -> 0 | I73: ='[POINTS NQS  2012.XLS]Stock Altered 1100'!$A76 -> 71 | J73: ='[POINTS NQS  2012.XLS]Stock Altered 1100'!$B76 -> Gaylord Strine | K73: ='[POINTS NQS  2012.XLS]Stock Altered 1100'!$C76 -> Ashland, OH | L73: ='[POINTS NQS  2012.XLS]Stock Altered 1100'!$D76 -> JRS | M73: ='[POINTS NQS  2012.XLS]Stock Altered 1100'!$E76 -> 492 | N73: =IF('[POINTS NQS  2012.XLS]Stock Altered 1100'!$F76=0," ",'[POINTS NQS  2012.XLS]Stock Altered 1100'!$F76) -> Giddy Up Go | O73: ='[POINTS NQS  2012.XLS]Stock Altered 1100'!AA76 -> 118