B1: PRO OUTLAW | F1: Thru Tallmadge | H1: LITE PRO | M1: Thru Tallmadge
B2: Name | C2: City | D2: NQS # | E2: Tractor | F2: Points Back | I2: Name | J2: City/State | K2: NQS # | L2: Tractor | M2: Points Back
A3: ='[POINTS NQS  2012.XLS]Pro Outlaw'!$A7 -> 1 | B3: ='[POINTS NQS  2012.XLS]Pro Outlaw'!$B7 -> Harrision Stahl | C3: ='[POINTS NQS  2012.XLS]Pro Outlaw'!$C7 -> Dewitt, IA | D3: ='[POINTS NQS  2012.XLS]Pro Outlaw'!$D7 -> 4 | E3: =IF('[POINTS NQS  2012.XLS]Pro Outlaw'!E7=0," ",'[POINTS NQS  2012.XLS]Pro Outlaw'!E7) -> Tons of Fun | F3: ='[POINTS NQS  2012.XLS]Pro Outlaw'!$AA7 -> 0 | H3: ='[POINTS NQS  2012.XLS]Light Pro'!$A7 -> 1 | I3: ='[POINTS NQS  2012.XLS]Light Pro'!$B7 -> David Gawatz | J3: ='[POINTS NQS  2012.XLS]Light Pro'!$C7 -> St. Joseph, MO | K3: ='[POINTS NQS  2012.XLS]Light Pro'!$D7 -> 462 | L3: =IF('[POINTS NQS  2012.XLS]Light Pro'!E7=0," ",'[POINTS NQS  2012.XLS]Light Pro'!E7) -> Fear The Deere | M3: ='[POINTS NQS  2012.XLS]Light Pro'!$AA7 -> 0
A4: ='[POINTS NQS  2012.XLS]Pro Outlaw'!$A8 -> 2 | B4: ='[POINTS NQS  2012.XLS]Pro Outlaw'!$B8 -> Russ Nichols | C4: ='[POINTS NQS  2012.XLS]Pro Outlaw'!$C8 -> Lore city, OH | D4: ='[POINTS NQS  2012.XLS]Pro Outlaw'!$D8 -> 70 | E4: =IF('[POINTS NQS  2012.XLS]Pro Outlaw'!E8=0," ",'[POINTS NQS  2012.XLS]Pro Outlaw'!E8) -> Wild One II | F4: ='[POINTS NQS  2012.XLS]Pro Outlaw'!$AA8 -> 3 | H4: ='[POINTS NQS  2012.XLS]Light Pro'!$A8 -> 2 | I4: ='[POINTS NQS  2012.XLS]Light Pro'!$B8 -> Matt Kaster | J4: ='[POINTS NQS  2012.XLS]Light Pro'!$C8 -> Burlington, WI | K4: ='[POINTS NQS  2012.XLS]Light Pro'!$D8 -> 332 | L4: =IF('[POINTS NQS  2012.XLS]Light Pro'!E8=0," ",'[POINTS NQS  2012.XLS]Light Pro'!E8) -> Hog Wash | M4: ='[POINTS NQS  2012.XLS]Light Pro'!$AA8 -> 1
A5: ='[POINTS NQS  2012.XLS]Pro Outlaw'!$A9 -> 3 | B5: ='[POINTS NQS  2012.XLS]Pro Outlaw'!$B9 -> Russ Nichols | C5: ='[POINTS NQS  2012.XLS]Pro Outlaw'!$C9 -> Lore City, OH | D5: ='[POINTS NQS  2012.XLS]Pro Outlaw'!$D9 -> 8 | E5: =IF('[POINTS NQS  2012.XLS]Pro Outlaw'!E9=0," ",'[POINTS NQS  2012.XLS]Pro Outlaw'!E9) -> Wicked Deere | F5: ='[POINTS NQS  2012.XLS]Pro Outlaw'!$AA9 -> 6 | H5: ='[POINTS NQS  2012.XLS]Light Pro'!$A9 -> 3 | I5: ='[POINTS NQS  2012.XLS]Light Pro'!$B9 -> Lora Feldkamp | J5: ='[POINTS NQS  2012.XLS]Light Pro'!$C9 -> Britton, MI | K5: ='[POINTS NQS  2012.XLS]Light Pro'!$D9 -> 475 | L5: =IF('[POINTS NQS  2012.XLS]Light Pro'!E9=0," ",'[POINTS NQS  2012.XLS]Light Pro'!E9) ->  | M5: ='[POINTS NQS  2012.XLS]Light Pro'!$AA9 -> 1
A6: ='[POINTS NQS  2012.XLS]Pro Outlaw'!$A10 -> 4 | B6: ='[POINTS NQS  2012.XLS]Pro Outlaw'!$B10 -> Drew Burton | C6: ='[POINTS NQS  2012.XLS]Pro Outlaw'!$C10 -> Brookston, IN | D6: ='[POINTS NQS  2012.XLS]Pro Outlaw'!$D10 -> 14 | E6: =IF('[POINTS NQS  2012.XLS]Pro Outlaw'!E10=0," ",'[POINTS NQS  2012.XLS]Pro Outlaw'!E10) -> Bad Company | F6: ='[POINTS NQS  2012.XLS]Pro Outlaw'!$AA10 -> 7 | H6: ='[POINTS NQS  2012.XLS]Light Pro'!$A10 -> 4 | I6: ='[POINTS NQS  2012.XLS]Light Pro'!$B10 -> Gregory Vandevort | J6: ='[POINTS NQS  2012.XLS]Light Pro'!$C10 -> Albion, PA | K6: ='[POINTS NQS  2012.XLS]Light Pro'!$D10 -> 506 | L6: =IF('[POINTS NQS  2012.XLS]Light Pro'!E10=0," ",'[POINTS NQS  2012.XLS]Light Pro'!E10) -> Shockwave | M6: ='[POINTS NQS  2012.XLS]Light Pro'!$AA10 -> 9
A7: ='[POINTS NQS  2012.XLS]Pro Outlaw'!$A11 -> 5 | B7: ='[POINTS NQS  2012.XLS]Pro Outlaw'!$B11 -> Elaine Fisher | C7: ='[POINTS NQS  2012.XLS]Pro Outlaw'!$C11 -> Waterford, OH | D7: ='[POINTS NQS  2012.XLS]Pro Outlaw'!$D11 -> 80 | E7: =IF('[POINTS NQS  2012.XLS]Pro Outlaw'!E11=0," ",'[POINTS NQS  2012.XLS]Pro Outlaw'!E11) -> Blue Thunder | F7: ='[POINTS NQS  2012.XLS]Pro Outlaw'!$AA11 -> 19 | H7: ='[POINTS NQS  2012.XLS]Light Pro'!$A11 -> 5 | I7: ='[POINTS NQS  2012.XLS]Light Pro'!$B11 -> Jerry Sweet | J7: ='[POINTS NQS  2012.XLS]Light Pro'!$C11 -> Clymer, NY | K7: ='[POINTS NQS  2012.XLS]Light Pro'!$D11 -> 284 | L7: =IF('[POINTS NQS  2012.XLS]Light Pro'!E11=0," ",'[POINTS NQS  2012.XLS]Light Pro'!E11) -> Phat Ride | M7: ='[POINTS NQS  2012.XLS]Light Pro'!$AA11 -> 10
A8: ='[POINTS NQS  2012.XLS]Pro Outlaw'!$A12 -> 6 | B8: ='[POINTS NQS  2012.XLS]Pro Outlaw'!$B12 -> Don Vogt | C8: ='[POINTS NQS  2012.XLS]Pro Outlaw'!$C12 -> Campbellsport, WI | D8: ='[POINTS NQS  2012.XLS]Pro Outlaw'!$D12 -> 90 | E8: =IF('[POINTS NQS  2012.XLS]Pro Outlaw'!E12=0," ",'[POINTS NQS  2012.XLS]Pro Outlaw'!E12) -> Not A Nuff | F8: ='[POINTS NQS  2012.XLS]Pro Outlaw'!$AA12 -> 21 | H8: ='[POINTS NQS  2012.XLS]Light Pro'!$A12 -> 6 | I8: ='[POINTS NQS  2012.XLS]Light Pro'!$B12 -> Nick Ferguson | J8: ='[POINTS NQS  2012.XLS]Light Pro'!$C12 -> Elkhorn, WI | K8: ='[POINTS NQS  2012.XLS]Light Pro'!$D12 -> 100 | L8: =IF('[POINTS NQS  2012.XLS]Light Pro'!E12=0," ",'[POINTS NQS  2012.XLS]Light Pro'!E12) -> Raisin Cane | M8: ='[POINTS NQS  2012.XLS]Light Pro'!$AA12 -> 18
A9: ='[POINTS NQS  2012.XLS]Pro Outlaw'!$A13 -> 7 | B9: ='[POINTS NQS  2012.XLS]Pro Outlaw'!$B13 -> Christopher Wise | C9: ='[POINTS NQS  2012.XLS]Pro Outlaw'!$C13 -> Greensburg, PA | D9: ='[POINTS NQS  2012.XLS]Pro Outlaw'!$D13 -> 209 | E9: =IF('[POINTS NQS  2012.XLS]Pro Outlaw'!E13=0," ",'[POINTS NQS  2012.XLS]Pro Outlaw'!E13) -> Longshot | F9: ='[POINTS NQS  2012.XLS]Pro Outlaw'!$AA13 -> 21 | H9: ='[POINTS NQS  2012.XLS]Light Pro'!$A13 -> 7 | I9: ='[POINTS NQS  2012.XLS]Light Pro'!$B13 -> Bobby Feldkamp | J9: ='[POINTS NQS  2012.XLS]Light Pro'!$C13 -> Milan, Mi | K9: ='[POINTS NQS  2012.XLS]Light Pro'!$D13 -> 474 | L9: =IF('[POINTS NQS  2012.XLS]Light Pro'!E13=0," ",'[POINTS NQS  2012.XLS]Light Pro'!E13) -> Driftwod | M9: ='[POINTS NQS  2012.XLS]Light Pro'!$AA13 -> 27
A10: ='[POINTS NQS  2012.XLS]Pro Outlaw'!$A14 -> 8 | B10: ='[POINTS NQS  2012.XLS]Pro Outlaw'!$B14 -> Daryl Musser | C10: ='[POINTS NQS  2012.XLS]Pro Outlaw'!$C14 -> Greencastle, PA | D10: ='[POINTS NQS  2012.XLS]Pro Outlaw'!$D14 -> 396 | E10: =IF('[POINTS NQS  2012.XLS]Pro Outlaw'!E14=0," ",'[POINTS NQS  2012.XLS]Pro Outlaw'!E14) -> 5 Cents | F10: ='[POINTS NQS  2012.XLS]Pro Outlaw'!$AA14 -> 21 | H10: ='[POINTS NQS  2012.XLS]Light Pro'!$A14 -> 8 | I10: ='[POINTS NQS  2012.XLS]Light Pro'!$B14 -> Scott Bye | J10: ='[POINTS NQS  2012.XLS]Light Pro'!$C14 -> Savannah, MO | K10: ='[POINTS NQS  2012.XLS]Light Pro'!$D14 -> 539 | L10: =IF('[POINTS NQS  2012.XLS]Light Pro'!E14=0," ",'[POINTS NQS  2012.XLS]Light Pro'!E14) -> Jacked Up | M10: ='[POINTS NQS  2012.XLS]Light Pro'!$AA14 -> 31
A11: ='[POINTS NQS  2012.XLS]Pro Outlaw'!$A15 -> 9 | B11: ='[POINTS NQS  2012.XLS]Pro Outlaw'!$B15 -> Steve Williford | C11: ='[POINTS NQS  2012.XLS]Pro Outlaw'!$C15 -> Engelhard, NC | D11: ='[POINTS NQS  2012.XLS]Pro Outlaw'!$D15 -> 276 | E11: =IF('[POINTS NQS  2012.XLS]Pro Outlaw'!E15=0," ",'[POINTS NQS  2012.XLS]Pro Outlaw'!E15) -> IH Express | F11: ='[POINTS NQS  2012.XLS]Pro Outlaw'!$AA15 -> 39 | H11: ='[POINTS NQS  2012.XLS]Light Pro'!$A15 -> 9 | I11: ='[POINTS NQS  2012.XLS]Light Pro'!$B15 -> Scott Bye | J11: ='[POINTS NQS  2012.XLS]Light Pro'!$C15 -> Savannah, MO | K11: ='[POINTS NQS  2012.XLS]Light Pro'!$D15 -> 187 | L11: =IF('[POINTS NQS  2012.XLS]Light Pro'!E15=0," ",'[POINTS NQS  2012.XLS]Light Pro'!E15) -> Revved Up | M11: ='[POINTS NQS  2012.XLS]Light Pro'!$AA15 -> 32
A12: ='[POINTS NQS  2012.XLS]Pro Outlaw'!$A16 -> 10 | B12: ='[POINTS NQS  2012.XLS]Pro Outlaw'!$B16 -> Jim Hull | C12: ='[POINTS NQS  2012.XLS]Pro Outlaw'!$C16 -> Brandon, WI | D12: ='[POINTS NQS  2012.XLS]Pro Outlaw'!$D16 -> 334 | E12: =IF('[POINTS NQS  2012.XLS]Pro Outlaw'!E16=0," ",'[POINTS NQS  2012.XLS]Pro Outlaw'!E16) -> Simply Irresistable | F12: ='[POINTS NQS  2012.XLS]Pro Outlaw'!$AA16 -> 50 | H12: ='[POINTS NQS  2012.XLS]Light Pro'!$A16 -> 10 | I12: ='[POINTS NQS  2012.XLS]Light Pro'!$B16 -> Scott Bye | J12: ='[POINTS NQS  2012.XLS]Light Pro'!$C16 -> Savannah, MO | K12: ='[POINTS NQS  2012.XLS]Light Pro'!$D16 -> 365 | L12: =IF('[POINTS NQS  2012.XLS]Light Pro'!E16=0," ",'[POINTS NQS  2012.XLS]Light Pro'!E16) -> Fired Up | M12: ='[POINTS NQS  2012.XLS]Light Pro'!$AA16 -> 32
A13: ='[POINTS NQS  2012.XLS]Pro Outlaw'!$A17 -> 11 | B13: ='[POINTS NQS  2012.XLS]Pro Outlaw'!$B17 -> Drew Burton | C13: ='[POINTS NQS  2012.XLS]Pro Outlaw'!$C17 -> Brookston, IN | D13: ='[POINTS NQS  2012.XLS]Pro Outlaw'!$D17 -> 15 | E13: =IF('[POINTS NQS  2012.XLS]Pro Outlaw'!E17=0," ",'[POINTS NQS  2012.XLS]Pro Outlaw'!E17) -> Plain Nuts | F13: ='[POINTS NQS  2012.XLS]Pro Outlaw'!$AA17 -> 58 | H13: ='[POINTS NQS  2012.XLS]Light Pro'!$A17 -> 11 | I13: ='[POINTS NQS  2012.XLS]Light Pro'!$B17 -> Chris Gegg | J13: ='[POINTS NQS  2012.XLS]Light Pro'!$C17 -> Greeneville, IL | K13: ='[POINTS NQS  2012.XLS]Light Pro'!$D17 -> 410 | L13: =IF('[POINTS NQS  2012.XLS]Light Pro'!E17=0," ",'[POINTS NQS  2012.XLS]Light Pro'!E17) -> Insane | M13: ='[POINTS NQS  2012.XLS]Light Pro'!$AA17 -> 33
A14: ='[POINTS NQS  2012.XLS]Pro Outlaw'!$A18 -> 12 | B14: ='[POINTS NQS  2012.XLS]Pro Outlaw'!$B18 -> David Knapp | C14: ='[POINTS NQS  2012.XLS]Pro Outlaw'!$C18 -> Hennepin, IL | D14: ='[POINTS NQS  2012.XLS]Pro Outlaw'!$D18 -> 381 | E14: =IF('[POINTS NQS  2012.XLS]Pro Outlaw'!E18=0," ",'[POINTS NQS  2012.XLS]Pro Outlaw'!E18) -> Knapp Time | F14: ='[POINTS NQS  2012.XLS]Pro Outlaw'!$AA18 -> 61 | H14: ='[POINTS NQS  2012.XLS]Light Pro'!$A18 -> 12 | I14: ='[POINTS NQS  2012.XLS]Light Pro'!$B18 -> Bob Cooper | J14: ='[POINTS NQS  2012.XLS]Light Pro'!$C18 -> Westminster, Md | K14: ='[POINTS NQS  2012.XLS]Light Pro'!$D18 -> 522 | L14: =IF('[POINTS NQS  2012.XLS]Light Pro'!E18=0," ",'[POINTS NQS  2012.XLS]Light Pro'!E18) -> Just Business | M14: ='[POINTS NQS  2012.XLS]Light Pro'!$AA18 -> 33
A15: ='[POINTS NQS  2012.XLS]Pro Outlaw'!$A19 -> 13 | B15: ='[POINTS NQS  2012.XLS]Pro Outlaw'!$B19 -> Lowell Vis | C15: ='[POINTS NQS  2012.XLS]Pro Outlaw'!$C19 -> Waupun, WI | D15: ='[POINTS NQS  2012.XLS]Pro Outlaw'!$D19 -> 333 | E15: =IF('[POINTS NQS  2012.XLS]Pro Outlaw'!E19=0," ",'[POINTS NQS  2012.XLS]Pro Outlaw'!E19) -> Skittles | F15: ='[POINTS NQS  2012.XLS]Pro Outlaw'!$AA19 -> 67 | H15: ='[POINTS NQS  2012.XLS]Light Pro'!$A19 -> 13 | I15: ='[POINTS NQS  2012.XLS]Light Pro'!$B19 -> Dave Wise | J15: ='[POINTS NQS  2012.XLS]Light Pro'!$C19 -> New Stanton, Pa | K15: ='[POINTS NQS  2012.XLS]Light Pro'!$D19 -> 403 | L15: =IF('[POINTS NQS  2012.XLS]Light Pro'!E19=0," ",'[POINTS NQS  2012.XLS]Light Pro'!E19) ->  | M15: ='[POINTS NQS  2012.XLS]Light Pro'!$AA19 -> 34
A16: ='[POINTS NQS  2012.XLS]Pro Outlaw'!$A20 -> 14 | B16: ='[POINTS NQS  2012.XLS]Pro Outlaw'!$B20 -> Harrison Stahl | C16: ='[POINTS NQS  2012.XLS]Pro Outlaw'!$C20 -> Dewitt, IA | D16: ='[POINTS NQS  2012.XLS]Pro Outlaw'!$D20 -> 336 | E16: =IF('[POINTS NQS  2012.XLS]Pro Outlaw'!E20=0," ",'[POINTS NQS  2012.XLS]Pro Outlaw'!E20) -> MWSC#4 | F16: ='[POINTS NQS  2012.XLS]Pro Outlaw'!$AA20 -> 67 | H16: ='[POINTS NQS  2012.XLS]Light Pro'!$A20 -> 14 | I16: ='[POINTS NQS  2012.XLS]Light Pro'!$B20 -> Aaron Scroggins | J16: ='[POINTS NQS  2012.XLS]Light Pro'!$C20 -> Neosho, MO | K16: ='[POINTS NQS  2012.XLS]Light Pro'!$D20 -> 419 | L16: =IF('[POINTS NQS  2012.XLS]Light Pro'!E20=0," ",'[POINTS NQS  2012.XLS]Light Pro'!E20) -> Gambler | M16: ='[POINTS NQS  2012.XLS]Light Pro'!$AA20 -> 34
A17: ='[POINTS NQS  2012.XLS]Pro Outlaw'!$A21 -> 15 | B17: ='[POINTS NQS  2012.XLS]Pro Outlaw'!$B21 -> Cody Costa | C17: ='[POINTS NQS  2012.XLS]Pro Outlaw'!$C21 -> Greencastle, PA | D17: ='[POINTS NQS  2012.XLS]Pro Outlaw'!$D21 -> 397 | E17: =IF('[POINTS NQS  2012.XLS]Pro Outlaw'!E21=0," ",'[POINTS NQS  2012.XLS]Pro Outlaw'!E21) -> Crossthreaded | F17: ='[POINTS NQS  2012.XLS]Pro Outlaw'!$AA21 -> 69 | H17: ='[POINTS NQS  2012.XLS]Light Pro'!$A21 -> 15 | I17: ='[POINTS NQS  2012.XLS]Light Pro'!$B21 -> Eli Yurkovich | J17: ='[POINTS NQS  2012.XLS]Light Pro'!$C21 -> Prosperty, Pa | K17: ='[POINTS NQS  2012.XLS]Light Pro'!$D21 -> 556 | L17: =IF('[POINTS NQS  2012.XLS]Light Pro'!E21=0," ",'[POINTS NQS  2012.XLS]Light Pro'!E21) -> Covered Bridge | M17: ='[POINTS NQS  2012.XLS]Light Pro'!$AA21 -> 35
A18: ='[POINTS NQS  2012.XLS]Pro Outlaw'!$A22 -> 16 | B18: ='[POINTS NQS  2012.XLS]Pro Outlaw'!$B22 -> Nick Mischler | C18: ='[POINTS NQS  2012.XLS]Pro Outlaw'!$C22 -> Deer Creek, IL | D18: ='[POINTS NQS  2012.XLS]Pro Outlaw'!$D22 -> 167 | E18: =IF('[POINTS NQS  2012.XLS]Pro Outlaw'!E22=0," ",'[POINTS NQS  2012.XLS]Pro Outlaw'!E22) -> Pulse | F18: ='[POINTS NQS  2012.XLS]Pro Outlaw'!$AA22 -> 71 | H18: ='[POINTS NQS  2012.XLS]Light Pro'!$A22 -> 16 | I18: ='[POINTS NQS  2012.XLS]Light Pro'!$B22 -> Wesley Briant | J18: ='[POINTS NQS  2012.XLS]Light Pro'!$C22 -> Washington, Pa | K18: ='[POINTS NQS  2012.XLS]Light Pro'!$D22 -> 553 | L18: =IF('[POINTS NQS  2012.XLS]Light Pro'!E22=0," ",'[POINTS NQS  2012.XLS]Light Pro'!E22) -> Cub n Debt | M18: ='[POINTS NQS  2012.XLS]Light Pro'!$AA22 -> 37
A19: ='[POINTS NQS  2012.XLS]Pro Outlaw'!$A23 -> 17 | B19: ='[POINTS NQS  2012.XLS]Pro Outlaw'!$B23 -> Scott Bye | C19: ='[POINTS NQS  2012.XLS]Pro Outlaw'!$C23 -> Savannah, Mo | D19: ='[POINTS NQS  2012.XLS]Pro Outlaw'!$D23 -> 365 | E19: =IF('[POINTS NQS  2012.XLS]Pro Outlaw'!E23=0," ",'[POINTS NQS  2012.XLS]Pro Outlaw'!E23) -> Fired Up | F19: ='[POINTS NQS  2012.XLS]Pro Outlaw'!$AA23 -> 73 | H19: ='[POINTS NQS  2012.XLS]Light Pro'!$A23 -> 17 | I19: ='[POINTS NQS  2012.XLS]Light Pro'!$B23 -> Bob Jones Jr | J19: ='[POINTS NQS  2012.XLS]Light Pro'!$C23 -> Dresden, oh | K19: ='[POINTS NQS  2012.XLS]Light Pro'!$D23 -> 183 | L19: =IF('[POINTS NQS  2012.XLS]Light Pro'!E23=0," ",'[POINTS NQS  2012.XLS]Light Pro'!E23) -> Playdough | M19: ='[POINTS NQS  2012.XLS]Light Pro'!$AA23 -> 39
A20: ='[POINTS NQS  2012.XLS]Pro Outlaw'!$A24 -> 18 | B20: ='[POINTS NQS  2012.XLS]Pro Outlaw'!$B24 -> Julian Stahl | C20: ='[POINTS NQS  2012.XLS]Pro Outlaw'!$C24 -> Welton, IA | D20: ='[POINTS NQS  2012.XLS]Pro Outlaw'!$D24 -> 1 | E20: =IF('[POINTS NQS  2012.XLS]Pro Outlaw'!E24=0," ",'[POINTS NQS  2012.XLS]Pro Outlaw'!E24) -> MWSC#1 | F20: ='[POINTS NQS  2012.XLS]Pro Outlaw'!$AA24 -> 74 | H20: ='[POINTS NQS  2012.XLS]Light Pro'!$A24 -> 18 | I20: ='[POINTS NQS  2012.XLS]Light Pro'!$B24 -> Bud Casale | J20: ='[POINTS NQS  2012.XLS]Light Pro'!$C24 -> New Castle, Pa | K20: ='[POINTS NQS  2012.XLS]Light Pro'!$D24 -> 535 | L20: =IF('[POINTS NQS  2012.XLS]Light Pro'!E24=0," ",'[POINTS NQS  2012.XLS]Light Pro'!E24) ->  | M20: ='[POINTS NQS  2012.XLS]Light Pro'!$AA24 -> 41
A21: ='[POINTS NQS  2012.XLS]Pro Outlaw'!$A25 -> 19 | B21: ='[POINTS NQS  2012.XLS]Pro Outlaw'!$B25 -> Bradley Corzine | C21: ='[POINTS NQS  2012.XLS]Pro Outlaw'!$C25 -> Dongola, IL | D21: ='[POINTS NQS  2012.XLS]Pro Outlaw'!$D25 -> 509 | E21: =IF('[POINTS NQS  2012.XLS]Pro Outlaw'!E25=0," ",'[POINTS NQS  2012.XLS]Pro Outlaw'!E25) -> Just Black | F21: ='[POINTS NQS  2012.XLS]Pro Outlaw'!$AA25 -> 76 | H21: ='[POINTS NQS  2012.XLS]Light Pro'!$A25 -> 19 | I21: ='[POINTS NQS  2012.XLS]Light Pro'!$B25 -> Pat Roth | J21: ='[POINTS NQS  2012.XLS]Light Pro'!$C25 -> Idaville, ind | K21: ='[POINTS NQS  2012.XLS]Light Pro'!$D25 -> 450 | L21: =IF('[POINTS NQS  2012.XLS]Light Pro'!E25=0," ",'[POINTS NQS  2012.XLS]Light Pro'!E25) -> Alcohol Abuse | M21: ='[POINTS NQS  2012.XLS]Light Pro'!$AA25 -> 42
A22: ='[POINTS NQS  2012.XLS]Pro Outlaw'!$A26 -> 20 | B22: ='[POINTS NQS  2012.XLS]Pro Outlaw'!$B26 -> Kenny Cornelison | C22: ='[POINTS NQS  2012.XLS]Pro Outlaw'!$C26 -> Richmond, KY | D22: ='[POINTS NQS  2012.XLS]Pro Outlaw'!$D26 -> 149 | E22: =IF('[POINTS NQS  2012.XLS]Pro Outlaw'!E26=0," ",'[POINTS NQS  2012.XLS]Pro Outlaw'!E26) -> Storm Alert | F22: ='[POINTS NQS  2012.XLS]Pro Outlaw'!$AA26 -> 83 | H22: ='[POINTS NQS  2012.XLS]Light Pro'!$A26 -> 20 | I22: ='[POINTS NQS  2012.XLS]Light Pro'!$B26 -> Austin Yurkovich | J22: ='[POINTS NQS  2012.XLS]Light Pro'!$C26 -> Prosperty, Pa | K22: ='[POINTS NQS  2012.XLS]Light Pro'!$D26 -> 557 | L22: =IF('[POINTS NQS  2012.XLS]Light Pro'!E26=0," ",'[POINTS NQS  2012.XLS]Light Pro'!E26) -> Sled Stretcher | M22: ='[POINTS NQS  2012.XLS]Light Pro'!$AA26 -> 43
A23: ='[POINTS NQS  2012.XLS]Pro Outlaw'!$A27 -> 21 | B23: ='[POINTS NQS  2012.XLS]Pro Outlaw'!$B27 -> Doug Diehl | C23: ='[POINTS NQS  2012.XLS]Pro Outlaw'!$C27 -> Smithsburg, Md | D23: ='[POINTS NQS  2012.XLS]Pro Outlaw'!$D27 -> 440 | E23: =IF('[POINTS NQS  2012.XLS]Pro Outlaw'!E27=0," ",'[POINTS NQS  2012.XLS]Pro Outlaw'!E27) -> 1 Bad MF | F23: ='[POINTS NQS  2012.XLS]Pro Outlaw'!$AA27 -> 84 | H23: ='[POINTS NQS  2012.XLS]Light Pro'!$A27 -> 21 | I23: ='[POINTS NQS  2012.XLS]Light Pro'!$B27 -> Larry Frederick | J23: ='[POINTS NQS  2012.XLS]Light Pro'!$C27 -> New Castle, Pa | K23: ='[POINTS NQS  2012.XLS]Light Pro'!$D27 -> 526 | L23: =IF('[POINTS NQS  2012.XLS]Light Pro'!E27=0," ",'[POINTS NQS  2012.XLS]Light Pro'!E27) -> Burnin U2 | M23: ='[POINTS NQS  2012.XLS]Light Pro'!$AA27 -> 44
A24: ='[POINTS NQS  2012.XLS]Pro Outlaw'!$A28 -> 22 | B24: ='[POINTS NQS  2012.XLS]Pro Outlaw'!$B28 -> Mike Spencer | C24: ='[POINTS NQS  2012.XLS]Pro Outlaw'!$C28 -> Weest Alex, OH | D24: ='[POINTS NQS  2012.XLS]Pro Outlaw'!$D28 -> 278 | E24: =IF('[POINTS NQS  2012.XLS]Pro Outlaw'!E28=0," ",'[POINTS NQS  2012.XLS]Pro Outlaw'!E28) -> Longshot | F24: ='[POINTS NQS  2012.XLS]Pro Outlaw'!$AA28 -> 85 | H24: ='[POINTS NQS  2012.XLS]Light Pro'!$A28 -> 22 | I24: ='[POINTS NQS  2012.XLS]Light Pro'!$B28 -> Bob Jones Sr | J24: ='[POINTS NQS  2012.XLS]Light Pro'!$C28 -> Hopewell, Oh | K24: ='[POINTS NQS  2012.XLS]Light Pro'!$D28 -> 182 | L24: =IF('[POINTS NQS  2012.XLS]Light Pro'!E28=0," ",'[POINTS NQS  2012.XLS]Light Pro'!E28) -> Buckeye Binder | M24: ='[POINTS NQS  2012.XLS]Light Pro'!$AA28 -> 57
A25: ='[POINTS NQS  2012.XLS]Pro Outlaw'!$A29 -> 23 | B25: ='[POINTS NQS  2012.XLS]Pro Outlaw'!$B29 -> David Mascher JR | C25: ='[POINTS NQS  2012.XLS]Pro Outlaw'!$C29 -> Beech Grove, IN | D25: ='[POINTS NQS  2012.XLS]Pro Outlaw'!$D29 -> 163 | E25: =IF('[POINTS NQS  2012.XLS]Pro Outlaw'!E29=0," ",'[POINTS NQS  2012.XLS]Pro Outlaw'!E29) -> Thunder Pumpkin | F25: ='[POINTS NQS  2012.XLS]Pro Outlaw'!$AA29 -> 88
A26: ='[POINTS NQS  2012.XLS]Pro Outlaw'!$A30 -> 24 | B26: ='[POINTS NQS  2012.XLS]Pro Outlaw'!$B30 -> Dan Schell | C26: ='[POINTS NQS  2012.XLS]Pro Outlaw'!$C30 -> Darien, WI | D26: ='[POINTS NQS  2012.XLS]Pro Outlaw'!$D30 -> 375 | E26: =IF('[POINTS NQS  2012.XLS]Pro Outlaw'!E30=0," ",'[POINTS NQS  2012.XLS]Pro Outlaw'!E30) -> Blind Ambition | F26: ='[POINTS NQS  2012.XLS]Pro Outlaw'!$AA30 -> 88
A27: ='[POINTS NQS  2012.XLS]Pro Outlaw'!$A31 -> 25 | B27: ='[POINTS NQS  2012.XLS]Pro Outlaw'!$B31 -> Dave Gawatz | C27: ='[POINTS NQS  2012.XLS]Pro Outlaw'!$C31 -> St. Joseph, MO | D27: ='[POINTS NQS  2012.XLS]Pro Outlaw'!$D31 -> 367 | E27: =IF('[POINTS NQS  2012.XLS]Pro Outlaw'!E31=0," ",'[POINTS NQS  2012.XLS]Pro Outlaw'!E31) -> Lil' Sprout | F27: ='[POINTS NQS  2012.XLS]Pro Outlaw'!$AA31 -> 89
A28: ='[POINTS NQS  2012.XLS]Pro Outlaw'!$A32 -> 26 | B28: ='[POINTS NQS  2012.XLS]Pro Outlaw'!$B32 -> Ryan Richter | C28: ='[POINTS NQS  2012.XLS]Pro Outlaw'!$C32 -> Connellsville, PA | D28: ='[POINTS NQS  2012.XLS]Pro Outlaw'!$D32 -> 502 | E28: =IF('[POINTS NQS  2012.XLS]Pro Outlaw'!E32=0," ",'[POINTS NQS  2012.XLS]Pro Outlaw'!E32) -> Radical Rat | F28: ='[POINTS NQS  2012.XLS]Pro Outlaw'!$AA32 -> 90
A29: ='[POINTS NQS  2012.XLS]Pro Outlaw'!$A33 -> 27 | B29: ='[POINTS NQS  2012.XLS]Pro Outlaw'!$B33 -> Michael Ciolino | C29: ='[POINTS NQS  2012.XLS]Pro Outlaw'!$C33 -> Peoria, IL | D29: ='[POINTS NQS  2012.XLS]Pro Outlaw'!$D33 -> 146 | E29: =IF('[POINTS NQS  2012.XLS]Pro Outlaw'!E33=0," ",'[POINTS NQS  2012.XLS]Pro Outlaw'!E33) -> Mechanical Animal | F29: ='[POINTS NQS  2012.XLS]Pro Outlaw'!$AA33 -> 104
A30: ='[POINTS NQS  2012.XLS]Pro Outlaw'!$A34 -> 28 | B30: ='[POINTS NQS  2012.XLS]Pro Outlaw'!$B34 -> Aaron Scroggins | C30: ='[POINTS NQS  2012.XLS]Pro Outlaw'!$C34 -> Neosho, OH | D30: ='[POINTS NQS  2012.XLS]Pro Outlaw'!$D34 -> 111 | E30: =IF('[POINTS NQS  2012.XLS]Pro Outlaw'!E34=0," ",'[POINTS NQS  2012.XLS]Pro Outlaw'!E34) -> Blackout | F30: ='[POINTS NQS  2012.XLS]Pro Outlaw'!$AA34 -> 105
A31: ='[POINTS NQS  2012.XLS]Pro Outlaw'!$A35 -> 29 | B31: ='[POINTS NQS  2012.XLS]Pro Outlaw'!$B35 -> Jeff Chrisman | C31: ='[POINTS NQS  2012.XLS]Pro Outlaw'!$C35 -> Edinburgh, IN | D31: ='[POINTS NQS  2012.XLS]Pro Outlaw'!$D35 -> 180 | E31: =IF('[POINTS NQS  2012.XLS]Pro Outlaw'!E35=0," ",'[POINTS NQS  2012.XLS]Pro Outlaw'!E35) ->  | F31: ='[POINTS NQS  2012.XLS]Pro Outlaw'!$AA35 -> 105
A32: ='[POINTS NQS  2012.XLS]Pro Outlaw'!$A36 -> 30 | B32: ='[POINTS NQS  2012.XLS]Pro Outlaw'!$B36 -> Dean Dubach | C32: ='[POINTS NQS  2012.XLS]Pro Outlaw'!$C36 -> Decatur, In | D32: ='[POINTS NQS  2012.XLS]Pro Outlaw'!$D36 -> 532 | E32: =IF('[POINTS NQS  2012.XLS]Pro Outlaw'!E36=0," ",'[POINTS NQS  2012.XLS]Pro Outlaw'!E36) -> Red Cub | F32: ='[POINTS NQS  2012.XLS]Pro Outlaw'!$AA36 -> 105 | H32: LITE OUTLAW | M32: Thru Tallmadge
A33: ='[POINTS NQS  2012.XLS]Pro Outlaw'!$A37 -> 31 | B33: ='[POINTS NQS  2012.XLS]Pro Outlaw'!$B37 -> Kenny Cornelison | C33: ='[POINTS NQS  2012.XLS]Pro Outlaw'!$C37 -> Richmond, KY | D33: ='[POINTS NQS  2012.XLS]Pro Outlaw'!$D37 -> 536 | E33: =IF('[POINTS NQS  2012.XLS]Pro Outlaw'!E37=0," ",'[POINTS NQS  2012.XLS]Pro Outlaw'!E37) -> Storm X | F33: ='[POINTS NQS  2012.XLS]Pro Outlaw'!$AA37 -> 105 | I33: Name | J33: City | K33: NQS # | L33: Tractor | M33: Points Back
A34: ='[POINTS NQS  2012.XLS]Pro Outlaw'!$A38 -> 32 | B34: ='[POINTS NQS  2012.XLS]Pro Outlaw'!$B38 -> Julian Stahl | C34: ='[POINTS NQS  2012.XLS]Pro Outlaw'!$C38 -> Welton, IA | D34: ='[POINTS NQS  2012.XLS]Pro Outlaw'!$D38 -> 2 | E34: =IF('[POINTS NQS  2012.XLS]Pro Outlaw'!E38=0," ",'[POINTS NQS  2012.XLS]Pro Outlaw'!E38) -> MWSC#2 | F34: ='[POINTS NQS  2012.XLS]Pro Outlaw'!$AA38 -> 107 | H34: ='[POINTS NQS  2012.XLS]Lite Outlaw'!$A7 -> 1 | I34: ='[POINTS NQS  2012.XLS]Lite Outlaw'!$B7 -> Matt Kaster | J34: ='[POINTS NQS  2012.XLS]Lite Outlaw'!$C7 -> Burlington, WI | K34: ='[POINTS NQS  2012.XLS]Lite Outlaw'!$D7 -> 332 | L34: =IF('[POINTS NQS  2012.XLS]Lite Outlaw'!E7=0," ",'[POINTS NQS  2012.XLS]Lite Outlaw'!E7) -> Hog Wash | M34: ='[POINTS NQS  2012.XLS]Lite Outlaw'!$AA7 -> 0
A35: ='[POINTS NQS  2012.XLS]Pro Outlaw'!$A39 -> 33 | B35: ='[POINTS NQS  2012.XLS]Pro Outlaw'!$B39 -> Steve Vogler | C35: ='[POINTS NQS  2012.XLS]Pro Outlaw'!$C39 -> Jasper, IN | D35: ='[POINTS NQS  2012.XLS]Pro Outlaw'!$D39 -> 476 | E35: =IF('[POINTS NQS  2012.XLS]Pro Outlaw'!E39=0," ",'[POINTS NQS  2012.XLS]Pro Outlaw'!E39) -> Outlaw Reloaded | F35: ='[POINTS NQS  2012.XLS]Pro Outlaw'!$AA39 -> 108 | H35: ='[POINTS NQS  2012.XLS]Lite Outlaw'!$A8 -> 2 | I35: ='[POINTS NQS  2012.XLS]Lite Outlaw'!$B8 -> Gregory Vandevort | J35: ='[POINTS NQS  2012.XLS]Lite Outlaw'!$C8 -> Albion, PA | K35: ='[POINTS NQS  2012.XLS]Lite Outlaw'!$D8 -> 506 | L35: =IF('[POINTS NQS  2012.XLS]Lite Outlaw'!E8=0," ",'[POINTS NQS  2012.XLS]Lite Outlaw'!E8) -> Shockwave | M35: ='[POINTS NQS  2012.XLS]Lite Outlaw'!$AA8 -> 0
A36: ='[POINTS NQS  2012.XLS]Pro Outlaw'!$A40 -> 34 | B36: ='[POINTS NQS  2012.XLS]Pro Outlaw'!$B40 -> Tyler Hackman | C36: ='[POINTS NQS  2012.XLS]Pro Outlaw'!$C40 -> Seymour, ind | D36: ='[POINTS NQS  2012.XLS]Pro Outlaw'!$D40 -> 508 | E36: =IF('[POINTS NQS  2012.XLS]Pro Outlaw'!E40=0," ",'[POINTS NQS  2012.XLS]Pro Outlaw'!E40) -> Iron Will | F36: ='[POINTS NQS  2012.XLS]Pro Outlaw'!$AA40 -> 108 | H36: ='[POINTS NQS  2012.XLS]Lite Outlaw'!$A9 -> 3 | I36: ='[POINTS NQS  2012.XLS]Lite Outlaw'!$B9 -> Scott Bye | J36: ='[POINTS NQS  2012.XLS]Lite Outlaw'!$C9 -> Savannah, MO | K36: ='[POINTS NQS  2012.XLS]Lite Outlaw'!$D9 -> 187 | L36: =IF('[POINTS NQS  2012.XLS]Lite Outlaw'!E9=0," ",'[POINTS NQS  2012.XLS]Lite Outlaw'!E9) -> Revved Up | M36: ='[POINTS NQS  2012.XLS]Lite Outlaw'!$AA9 -> 7
A37: ='[POINTS NQS  2012.XLS]Pro Outlaw'!$A41 -> 35 | B37: ='[POINTS NQS  2012.XLS]Pro Outlaw'!$B41 -> Ryan Shafer | C37: ='[POINTS NQS  2012.XLS]Pro Outlaw'!$C41 -> Confluence, pa | D37: ='[POINTS NQS  2012.XLS]Pro Outlaw'!$D41 -> 445 | E37: =IF('[POINTS NQS  2012.XLS]Pro Outlaw'!E41=0," ",'[POINTS NQS  2012.XLS]Pro Outlaw'!E41) -> LabRat | F37: ='[POINTS NQS  2012.XLS]Pro Outlaw'!$AA41 -> 109 | H37: ='[POINTS NQS  2012.XLS]Lite Outlaw'!$A10 -> 4 | I37: ='[POINTS NQS  2012.XLS]Lite Outlaw'!$B10 -> David Gawatz | J37: ='[POINTS NQS  2012.XLS]Lite Outlaw'!$C10 -> St. Joseph, MO | K37: ='[POINTS NQS  2012.XLS]Lite Outlaw'!$D10 -> 462 | L37: =IF('[POINTS NQS  2012.XLS]Lite Outlaw'!E10=0," ",'[POINTS NQS  2012.XLS]Lite Outlaw'!E10) -> Fear The Deere | M37: ='[POINTS NQS  2012.XLS]Lite Outlaw'!$AA10 -> 8
A38: ='[POINTS NQS  2012.XLS]Pro Outlaw'!$A42 -> 36 | B38: ='[POINTS NQS  2012.XLS]Pro Outlaw'!$B42 -> Jerry Everhart | C38: ='[POINTS NQS  2012.XLS]Pro Outlaw'!$C42 -> Springfield, OH | D38: ='[POINTS NQS  2012.XLS]Pro Outlaw'!$D42 -> 483 | E38: =IF('[POINTS NQS  2012.XLS]Pro Outlaw'!E42=0," ",'[POINTS NQS  2012.XLS]Pro Outlaw'!E42) -> Orange Cart | F38: ='[POINTS NQS  2012.XLS]Pro Outlaw'!$AA42 -> 109 | H38: ='[POINTS NQS  2012.XLS]Lite Outlaw'!$A11 -> 5 | I38: ='[POINTS NQS  2012.XLS]Lite Outlaw'!$B11 -> Lora Feldkamp | J38: ='[POINTS NQS  2012.XLS]Lite Outlaw'!$C11 -> Britton, WI | K38: ='[POINTS NQS  2012.XLS]Lite Outlaw'!$D11 -> 475 | L38: =IF('[POINTS NQS  2012.XLS]Lite Outlaw'!E11=0," ",'[POINTS NQS  2012.XLS]Lite Outlaw'!E11) ->  | M38: ='[POINTS NQS  2012.XLS]Lite Outlaw'!$AA11 -> 8
A39: ='[POINTS NQS  2012.XLS]Pro Outlaw'!$A43 -> 37 | B39: ='[POINTS NQS  2012.XLS]Pro Outlaw'!$B43 -> Kevin Root | C39: ='[POINTS NQS  2012.XLS]Pro Outlaw'!$C43 -> Inola, OK | D39: ='[POINTS NQS  2012.XLS]Pro Outlaw'!$D43 -> 118 | E39: =IF('[POINTS NQS  2012.XLS]Pro Outlaw'!E43=0," ",'[POINTS NQS  2012.XLS]Pro Outlaw'!E43) -> Slapshot | F39: ='[POINTS NQS  2012.XLS]Pro Outlaw'!$AA43 -> 110 | H39: ='[POINTS NQS  2012.XLS]Lite Outlaw'!$A12 -> 6 | I39: ='[POINTS NQS  2012.XLS]Lite Outlaw'!$B12 -> Nick Ferguson | J39: ='[POINTS NQS  2012.XLS]Lite Outlaw'!$C12 -> Elkhorn, WI | K39: ='[POINTS NQS  2012.XLS]Lite Outlaw'!$D12 -> 100 | L39: =IF('[POINTS NQS  2012.XLS]Lite Outlaw'!E12=0," ",'[POINTS NQS  2012.XLS]Lite Outlaw'!E12) -> Raisin Cane | M39: ='[POINTS NQS  2012.XLS]Lite Outlaw'!$AA12 -> 9
A40: ='[POINTS NQS  2012.XLS]Pro Outlaw'!$A44 -> 38 | B40: ='[POINTS NQS  2012.XLS]Pro Outlaw'!$B44 -> Matt Kaster | C40: ='[POINTS NQS  2012.XLS]Pro Outlaw'!$C44 -> Burlington, WI | D40: ='[POINTS NQS  2012.XLS]Pro Outlaw'!$D44 -> 99 | E40: =IF('[POINTS NQS  2012.XLS]Pro Outlaw'!E44=0," ",'[POINTS NQS  2012.XLS]Pro Outlaw'!E44) -> Sound of Madness | F40: ='[POINTS NQS  2012.XLS]Pro Outlaw'!$AA44 -> 111 | H40: ='[POINTS NQS  2012.XLS]Lite Outlaw'!$A13 -> 7 | I40: ='[POINTS NQS  2012.XLS]Lite Outlaw'!$B13 -> Jerry Sweet | J40: ='[POINTS NQS  2012.XLS]Lite Outlaw'!$C13 -> Clymer, NY | K40: ='[POINTS NQS  2012.XLS]Lite Outlaw'!$D13 -> 284 | L40: =IF('[POINTS NQS  2012.XLS]Lite Outlaw'!E13=0," ",'[POINTS NQS  2012.XLS]Lite Outlaw'!E13) -> Phat Ride | M40: ='[POINTS NQS  2012.XLS]Lite Outlaw'!$AA13 -> 10
A41: ='[POINTS NQS  2012.XLS]Pro Outlaw'!$A45 -> 39 | B41: ='[POINTS NQS  2012.XLS]Pro Outlaw'!$B45 -> Scott Larkins | C41: ='[POINTS NQS  2012.XLS]Pro Outlaw'!$C45 -> Kearney, MO | D41: ='[POINTS NQS  2012.XLS]Pro Outlaw'!$D45 -> 154 | E41: =IF('[POINTS NQS  2012.XLS]Pro Outlaw'!E45=0," ",'[POINTS NQS  2012.XLS]Pro Outlaw'!E45) -> Silver Sam | F41: ='[POINTS NQS  2012.XLS]Pro Outlaw'!$AA45 -> 111 | H41: ='[POINTS NQS  2012.XLS]Lite Outlaw'!$A14 -> 8 | I41: ='[POINTS NQS  2012.XLS]Lite Outlaw'!$B14 -> Bobby Feldkamp | J41: ='[POINTS NQS  2012.XLS]Lite Outlaw'!$C14 -> Milan, Mi | K41: ='[POINTS NQS  2012.XLS]Lite Outlaw'!$D14 -> 474 | L41: =IF('[POINTS NQS  2012.XLS]Lite Outlaw'!E14=0," ",'[POINTS NQS  2012.XLS]Lite Outlaw'!E14) -> Driftwood | M41: ='[POINTS NQS  2012.XLS]Lite Outlaw'!$AA14 -> 25
A42: ='[POINTS NQS  2012.XLS]Pro Outlaw'!$A46 -> 40 | B42: ='[POINTS NQS  2012.XLS]Pro Outlaw'!$B46 -> Kevin Root | C42: ='[POINTS NQS  2012.XLS]Pro Outlaw'!$C46 -> Inola, OK | D42: ='[POINTS NQS  2012.XLS]Pro Outlaw'!$D46 -> 117 | E42: =IF('[POINTS NQS  2012.XLS]Pro Outlaw'!E46=0," ",'[POINTS NQS  2012.XLS]Pro Outlaw'!E46) -> Right on the Money | F42: ='[POINTS NQS  2012.XLS]Pro Outlaw'!$AA46 -> 112 | H42: ='[POINTS NQS  2012.XLS]Lite Outlaw'!$A15 -> 9 | I42: ='[POINTS NQS  2012.XLS]Lite Outlaw'!$B15 -> Bob Cooper | J42: ='[POINTS NQS  2012.XLS]Lite Outlaw'!$C15 -> Westminster, Md | K42: ='[POINTS NQS  2012.XLS]Lite Outlaw'!$D15 -> 522 | L42: =IF('[POINTS NQS  2012.XLS]Lite Outlaw'!E15=0," ",'[POINTS NQS  2012.XLS]Lite Outlaw'!E15) -> Just Business | M42: ='[POINTS NQS  2012.XLS]Lite Outlaw'!$AA15 -> 26
A43: ='[POINTS NQS  2012.XLS]Pro Outlaw'!$A47 -> 41 | B43: ='[POINTS NQS  2012.XLS]Pro Outlaw'!$B47 -> Charlie Ciolino | C43: ='[POINTS NQS  2012.XLS]Pro Outlaw'!$C47 -> Hammond, LA | D43: ='[POINTS NQS  2012.XLS]Pro Outlaw'!$D47 -> 145 | E43: =IF('[POINTS NQS  2012.XLS]Pro Outlaw'!E47=0," ",'[POINTS NQS  2012.XLS]Pro Outlaw'!E47) -> Mechanical Nightmare | F43: ='[POINTS NQS  2012.XLS]Pro Outlaw'!$AA47 -> 112 | H43: ='[POINTS NQS  2012.XLS]Lite Outlaw'!$A16 -> 10 | I43: ='[POINTS NQS  2012.XLS]Lite Outlaw'!$B16 -> Scott Bye | J43: ='[POINTS NQS  2012.XLS]Lite Outlaw'!$C16 -> Savannah, MO | K43: ='[POINTS NQS  2012.XLS]Lite Outlaw'!$D16 -> 539 | L43: =IF('[POINTS NQS  2012.XLS]Lite Outlaw'!E16=0," ",'[POINTS NQS  2012.XLS]Lite Outlaw'!E16) -> Jacked Up | M43: ='[POINTS NQS  2012.XLS]Lite Outlaw'!$AA16 -> 28
A44: ='[POINTS NQS  2012.XLS]Pro Outlaw'!$A48 -> 42 | B44: ='[POINTS NQS  2012.XLS]Pro Outlaw'!$B48 -> Eric Varner | C44: ='[POINTS NQS  2012.XLS]Pro Outlaw'!$C48 -> Versailles, KY | D44: ='[POINTS NQS  2012.XLS]Pro Outlaw'!$D48 -> 482 | E44: =IF('[POINTS NQS  2012.XLS]Pro Outlaw'!E48=0," ",'[POINTS NQS  2012.XLS]Pro Outlaw'!E48) -> Extreme Addiction | F44: ='[POINTS NQS  2012.XLS]Pro Outlaw'!$AA48 -> 113 | H44: ='[POINTS NQS  2012.XLS]Lite Outlaw'!$A17 -> 11 | I44: ='[POINTS NQS  2012.XLS]Lite Outlaw'!$B17 -> Chris Gegg | J44: ='[POINTS NQS  2012.XLS]Lite Outlaw'!$C17 -> Greenville, IL | K44: ='[POINTS NQS  2012.XLS]Lite Outlaw'!$D17 -> 410 | L44: =IF('[POINTS NQS  2012.XLS]Lite Outlaw'!E17=0," ",'[POINTS NQS  2012.XLS]Lite Outlaw'!E17) -> Insane | M44: ='[POINTS NQS  2012.XLS]Lite Outlaw'!$AA17 -> 29
A45: ='[POINTS NQS  2012.XLS]Pro Outlaw'!$A49 -> 43 | B45: ='[POINTS NQS  2012.XLS]Pro Outlaw'!$B49 -> Mike Kyle | C45: ='[POINTS NQS  2012.XLS]Pro Outlaw'!$C49 -> Edinburgh, IN | D45: ='[POINTS NQS  2012.XLS]Pro Outlaw'!$D49 -> 394 | E45: =IF('[POINTS NQS  2012.XLS]Pro Outlaw'!E49=0," ",'[POINTS NQS  2012.XLS]Pro Outlaw'!E49) ->  | F45: ='[POINTS NQS  2012.XLS]Pro Outlaw'!$AA49 -> 114 | H45: ='[POINTS NQS  2012.XLS]Lite Outlaw'!$A18 -> 12 | I45: ='[POINTS NQS  2012.XLS]Lite Outlaw'!$B18 -> Aaron Scroggins | J45: ='[POINTS NQS  2012.XLS]Lite Outlaw'!$C18 -> Neosho, MO | K45: ='[POINTS NQS  2012.XLS]Lite Outlaw'!$D18 -> 419 | L45: =IF('[POINTS NQS  2012.XLS]Lite Outlaw'!E18=0," ",'[POINTS NQS  2012.XLS]Lite Outlaw'!E18) -> Gambler | M45: ='[POINTS NQS  2012.XLS]Lite Outlaw'!$AA18 -> 30
A46: ='[POINTS NQS  2012.XLS]Pro Outlaw'!$A50 -> 44 | B46: ='[POINTS NQS  2012.XLS]Pro Outlaw'!$B50 -> Harrison Stahl | C46: ='[POINTS NQS  2012.XLS]Pro Outlaw'!$C50 -> Dewitt, IA | D46: ='[POINTS NQS  2012.XLS]Pro Outlaw'!$D50 -> 335 | E46: =IF('[POINTS NQS  2012.XLS]Pro Outlaw'!E50=0," ",'[POINTS NQS  2012.XLS]Pro Outlaw'!E50) -> MWSC#3 | F46: ='[POINTS NQS  2012.XLS]Pro Outlaw'!$AA50 -> 115 | H46: ='[POINTS NQS  2012.XLS]Lite Outlaw'!$A19 -> 13 | I46: ='[POINTS NQS  2012.XLS]Lite Outlaw'!$B19 -> Bob Jones Sr | J46: ='[POINTS NQS  2012.XLS]Lite Outlaw'!$C19 -> Hopewell, Oh | K46: ='[POINTS NQS  2012.XLS]Lite Outlaw'!$D19 -> 182 | L46: =IF('[POINTS NQS  2012.XLS]Lite Outlaw'!E19=0," ",'[POINTS NQS  2012.XLS]Lite Outlaw'!E19) -> Buckeye Binder | M46: ='[POINTS NQS  2012.XLS]Lite Outlaw'!$AA19 -> 31
H47: ='[POINTS NQS  2012.XLS]Lite Outlaw'!$A20 -> 14 | I47: ='[POINTS NQS  2012.XLS]Lite Outlaw'!$B20 -> Dave Wise | J47: ='[POINTS NQS  2012.XLS]Lite Outlaw'!$C20 -> Hunker, pa | K47: ='[POINTS NQS  2012.XLS]Lite Outlaw'!$D20 -> 403 | L47: =IF('[POINTS NQS  2012.XLS]Lite Outlaw'!E20=0," ",'[POINTS NQS  2012.XLS]Lite Outlaw'!E20) ->  | M47: ='[POINTS NQS  2012.XLS]Lite Outlaw'!$AA20 -> 33
H48: ='[POINTS NQS  2012.XLS]Lite Outlaw'!$A21 -> 15 | I48: ='[POINTS NQS  2012.XLS]Lite Outlaw'!$B21 -> Wesley Briant | J48: ='[POINTS NQS  2012.XLS]Lite Outlaw'!$C21 -> Washington, pa | K48: ='[POINTS NQS  2012.XLS]Lite Outlaw'!$D21 -> 533 | L48: =IF('[POINTS NQS  2012.XLS]Lite Outlaw'!E21=0," ",'[POINTS NQS  2012.XLS]Lite Outlaw'!E21) -> Cub N Debt | M48: ='[POINTS NQS  2012.XLS]Lite Outlaw'!$AA21 -> 35
H49: ='[POINTS NQS  2012.XLS]Lite Outlaw'!$A22 -> 16 | I49: ='[POINTS NQS  2012.XLS]Lite Outlaw'!$B22 -> Eli Yurkovich | J49: ='[POINTS NQS  2012.XLS]Lite Outlaw'!$C22 -> Prosperty, Pa | K49: ='[POINTS NQS  2012.XLS]Lite Outlaw'!$D22 -> 556 | L49: =IF('[POINTS NQS  2012.XLS]Lite Outlaw'!E22=0," ",'[POINTS NQS  2012.XLS]Lite Outlaw'!E22) -> Covered Bridge Exp | M49: ='[POINTS NQS  2012.XLS]Lite Outlaw'!$AA22 -> 38
H50: ='[POINTS NQS  2012.XLS]Lite Outlaw'!$A23 -> 17 | I50: ='[POINTS NQS  2012.XLS]Lite Outlaw'!$B23 -> Austin Yurkovich | J50: ='[POINTS NQS  2012.XLS]Lite Outlaw'!$C23 -> Prosperty, Pa | K50: ='[POINTS NQS  2012.XLS]Lite Outlaw'!$D23 -> 557 | L50: =IF('[POINTS NQS  2012.XLS]Lite Outlaw'!E23=0," ",'[POINTS NQS  2012.XLS]Lite Outlaw'!E23) -> Sled Stretcher | M50: ='[POINTS NQS  2012.XLS]Lite Outlaw'!$AA23 -> 38
B59: BUILDERS CUP
B60: PRO/SS ENGINE BUILDERS | E60: SA ENGINE BUILDERS
B62: ='[POINTS NQS  2012.XLS]Builders Cup'!A4 -> NP = NICHOLS PERFORMANCE | C62: ='[POINTS NQS  2012.XLS]Builders Cup'!U4 -> 160 | E62: ='[POINTS NQS  2012.XLS]Builders Cup'!A23 -> TV = TODD VORHEES | F62: ='[POINTS NQS  2012.XLS]Builders Cup'!U23 -> 160
B63: ='[POINTS NQS  2012.XLS]Builders Cup'!A13 -> HACKMAN = GREG HACKMAN | C63: ='[POINTS NQS  2012.XLS]Builders Cup'!U13 -> 138 | E63: ='[POINTS NQS  2012.XLS]Builders Cup'!A21 -> JRS = JIM MORGANSTERN | F63: ='[POINTS NQS  2012.XLS]Builders Cup'!U21 -> 143
B64: ='[POINTS NQS  2012.XLS]Builders Cup'!A5 -> MVP = MVP RACING | C64: ='[POINTS NQS  2012.XLS]Builders Cup'!U5 -> 137 | E64: ='[POINTS NQS  2012.XLS]Builders Cup'!A22 -> NP = NICHOLS PERFORMANCE | F64: ='[POINTS NQS  2012.XLS]Builders Cup'!U22 -> 140
B65: ='[POINTS NQS  2012.XLS]Builders Cup'!A6 -> JRS = JIM MORGANSTERN | C65: ='[POINTS NQS  2012.XLS]Builders Cup'!U6 -> 109 | E65: ='[POINTS NQS  2012.XLS]Builders Cup'!A20 -> BJ = BOB JONES | F65: ='[POINTS NQS  2012.XLS]Builders Cup'!U20 -> 111
B66: ='[POINTS NQS  2012.XLS]Builders Cup'!A8 -> JW = JOE WHITWORTH | C66: ='[POINTS NQS  2012.XLS]Builders Cup'!U8 -> 102 | E66: ='[POINTS NQS  2012.XLS]Builders Cup'!A26 -> WOODS = DAVE WOODS | F66: ='[POINTS NQS  2012.XLS]Builders Cup'!U26 -> 96
B67: ='[POINTS NQS  2012.XLS]Builders Cup'!A9 -> VM = VOGEL MFG | C67: ='[POINTS NQS  2012.XLS]Builders Cup'!U9 -> 46 | E67: ='[POINTS NQS  2012.XLS]Builders Cup'!A28 -> LR = LAKOTA RACING | F67: ='[POINTS NQS  2012.XLS]Builders Cup'!U28 -> 60
B68: ='[POINTS NQS  2012.XLS]Builders Cup'!A10 -> TC = TOOTER CAMPBELL | C68: ='[POINTS NQS  2012.XLS]Builders Cup'!U10 -> 36 | E68: ='[POINTS NQS  2012.XLS]Builders Cup'!A24 -> RPM = RADER | F68: ='[POINTS NQS  2012.XLS]Builders Cup'!U24 -> 58
B69: ='[POINTS NQS  2012.XLS]Builders Cup'!A7 -> LR = LAKOTA RACING | C69: ='[POINTS NQS  2012.XLS]Builders Cup'!U7 -> 30 | E69: ='[POINTS NQS  2012.XLS]Builders Cup'!A27 -> VM = VOGEL MFG | F69: ='[POINTS NQS  2012.XLS]Builders Cup'!U27 -> 22
E70: ='[POINTS NQS  2012.XLS]Builders Cup'!A25 -> JW = JOE WHITWORTH | F70: ='[POINTS NQS  2012.XLS]Builders Cup'!U25 -> 20