B1: 30 Cube | F1: Thru Sturgis | I1: Pro V Twin | N1: Thru Sturgis
B2: Name | C2: City/State | D2: NQS # | E2: Tractor | F2: Points Back | J2: Name | K2: City/State | L2: NQS # | M2: Tractor | N2: Points Back
A3: ='\\SER\Software\other\[POINTS NQS  2012.XLS]30 Cube'!A7 -> 1 | B3: ='\\SER\Software\other\[POINTS NQS  2012.XLS]30 Cube'!B7 -> Tony Heifner | C3: ='\\SER\Software\other\[POINTS NQS  2012.XLS]30 Cube'!C7 -> Jeromesville, OH | D3: ='\\SER\Software\other\[POINTS NQS  2012.XLS]30 Cube'!D7 -> 114 | E3: =IF('\\SER\Software\other\[POINTS NQS  2012.XLS]30 Cube'!E7=0,"",'\\SER\Software\other\[POINTS NQS  2012.XLS]30 Cube'!E7) -> Twisted | F3: ='\\SER\Software\other\[POINTS NQS  2012.XLS]30 Cube'!AA7 -> 0 | I3: ='\\SER\Software\other\[POINTS NQS  2012.XLS]Pro V Twin'!A7 -> 1 | J3: ='\\SER\Software\other\[POINTS NQS  2012.XLS]Pro V Twin'!B7 -> Harrison Stahl | K3: ='\\SER\Software\other\[POINTS NQS  2012.XLS]Pro V Twin'!C7 -> Dewitt,IA | L3: ='\\SER\Software\other\[POINTS NQS  2012.XLS]Pro V Twin'!D7 -> 4 | M3: =IF('\\SER\Software\other\[POINTS NQS  2012.XLS]Pro V Twin'!E7=0,"",'\\SER\Software\other\[POINTS NQS  2012.XLS]Pro V Twin'!E7) -> Tons of Fun | N3: ='\\SER\Software\other\[POINTS NQS  2012.XLS]Pro V Twin'!AA7 -> 0
A4: ='\\SER\Software\other\[POINTS NQS  2012.XLS]30 Cube'!A8 -> 2 | B4: ='\\SER\Software\other\[POINTS NQS  2012.XLS]30 Cube'!B8 -> Pat Roth | C4: ='\\SER\Software\other\[POINTS NQS  2012.XLS]30 Cube'!C8 -> Idaville, IN | D4: ='\\SER\Software\other\[POINTS NQS  2012.XLS]30 Cube'!D8 -> 61 | E4: =IF('\\SER\Software\other\[POINTS NQS  2012.XLS]30 Cube'!E8=0,"",'\\SER\Software\other\[POINTS NQS  2012.XLS]30 Cube'!E8) ->  | F4: ='\\SER\Software\other\[POINTS NQS  2012.XLS]30 Cube'!AA8 -> 1 | I4: ='\\SER\Software\other\[POINTS NQS  2012.XLS]Pro V Twin'!A8 -> 2 | J4: ='\\SER\Software\other\[POINTS NQS  2012.XLS]Pro V Twin'!B8 -> Rob Wise | K4: ='\\SER\Software\other\[POINTS NQS  2012.XLS]Pro V Twin'!C8 -> Greensburg, PA | L4: ='\\SER\Software\other\[POINTS NQS  2012.XLS]Pro V Twin'!D8 -> 209 | M4: =IF('\\SER\Software\other\[POINTS NQS  2012.XLS]Pro V Twin'!E8=0,"",'\\SER\Software\other\[POINTS NQS  2012.XLS]Pro V Twin'!E8) -> Long Shot | N4: ='\\SER\Software\other\[POINTS NQS  2012.XLS]Pro V Twin'!AA8 -> 1
A5: ='\\SER\Software\other\[POINTS NQS  2012.XLS]30 Cube'!A9 -> 3 | B5: ='\\SER\Software\other\[POINTS NQS  2012.XLS]30 Cube'!B9 -> Doug Rood | C5: ='\\SER\Software\other\[POINTS NQS  2012.XLS]30 Cube'!C9 -> Ypsilanti, MI | D5: ='\\SER\Software\other\[POINTS NQS  2012.XLS]30 Cube'!D9 -> 354 | E5: =IF('\\SER\Software\other\[POINTS NQS  2012.XLS]30 Cube'!E9=0,"",'\\SER\Software\other\[POINTS NQS  2012.XLS]30 Cube'!E9) -> Blue Dawg | F5: ='\\SER\Software\other\[POINTS NQS  2012.XLS]30 Cube'!AA9 -> 2 | I5: ='\\SER\Software\other\[POINTS NQS  2012.XLS]Pro V Twin'!A9 -> 3 | J5: ='\\SER\Software\other\[POINTS NQS  2012.XLS]Pro V Twin'!B9 -> Jim Hull | K5: ='\\SER\Software\other\[POINTS NQS  2012.XLS]Pro V Twin'!C9 -> Brandon, WI | L5: ='\\SER\Software\other\[POINTS NQS  2012.XLS]Pro V Twin'!D9 -> 334 | M5: =IF('\\SER\Software\other\[POINTS NQS  2012.XLS]Pro V Twin'!E9=0,"",'\\SER\Software\other\[POINTS NQS  2012.XLS]Pro V Twin'!E9) -> Simply Irresistable | N5: ='\\SER\Software\other\[POINTS NQS  2012.XLS]Pro V Twin'!AA9 -> 2
A6: ='\\SER\Software\other\[POINTS NQS  2012.XLS]30 Cube'!A10 -> 4 | B6: ='\\SER\Software\other\[POINTS NQS  2012.XLS]30 Cube'!B10 -> Rick Massey | C6: ='\\SER\Software\other\[POINTS NQS  2012.XLS]30 Cube'!C10 -> Ava, MO | D6: ='\\SER\Software\other\[POINTS NQS  2012.XLS]30 Cube'!D10 -> 421 | E6: =IF('\\SER\Software\other\[POINTS NQS  2012.XLS]30 Cube'!E10=0,"",'\\SER\Software\other\[POINTS NQS  2012.XLS]30 Cube'!E10) -> Spare Parts | F6: ='\\SER\Software\other\[POINTS NQS  2012.XLS]30 Cube'!AA10 -> 3 | I6: ='\\SER\Software\other\[POINTS NQS  2012.XLS]Pro V Twin'!A10 -> 4 | J6: ='\\SER\Software\other\[POINTS NQS  2012.XLS]Pro V Twin'!B10 -> Kenny Cornelison | K6: ='\\SER\Software\other\[POINTS NQS  2012.XLS]Pro V Twin'!C10 -> Richmond, KY | L6: ='\\SER\Software\other\[POINTS NQS  2012.XLS]Pro V Twin'!D10 -> 149 | M6: =IF('\\SER\Software\other\[POINTS NQS  2012.XLS]Pro V Twin'!E10=0,"",'\\SER\Software\other\[POINTS NQS  2012.XLS]Pro V Twin'!E10) -> Storm Alert | N6: ='\\SER\Software\other\[POINTS NQS  2012.XLS]Pro V Twin'!AA10 -> 3
A7: ='\\SER\Software\other\[POINTS NQS  2012.XLS]30 Cube'!A11 -> 5 | B7: ='\\SER\Software\other\[POINTS NQS  2012.XLS]30 Cube'!B11 -> Tony Heifner | C7: ='\\SER\Software\other\[POINTS NQS  2012.XLS]30 Cube'!C11 -> Jeromesville, OH | D7: ='\\SER\Software\other\[POINTS NQS  2012.XLS]30 Cube'!D11 -> 116 | E7: =IF('\\SER\Software\other\[POINTS NQS  2012.XLS]30 Cube'!E11=0,"",'\\SER\Software\other\[POINTS NQS  2012.XLS]30 Cube'!E11) -> Heartbeat | F7: ='\\SER\Software\other\[POINTS NQS  2012.XLS]30 Cube'!AA11 -> 4 | I7: ='\\SER\Software\other\[POINTS NQS  2012.XLS]Pro V Twin'!A11 -> 5 | J7: ='\\SER\Software\other\[POINTS NQS  2012.XLS]Pro V Twin'!B11 -> Mike Spencer | K7: ='\\SER\Software\other\[POINTS NQS  2012.XLS]Pro V Twin'!C11 -> West Alexandria, WI | L7: ='\\SER\Software\other\[POINTS NQS  2012.XLS]Pro V Twin'!D11 -> 278 | M7: =IF('\\SER\Software\other\[POINTS NQS  2012.XLS]Pro V Twin'!E11=0,"",'\\SER\Software\other\[POINTS NQS  2012.XLS]Pro V Twin'!E11) -> Long Shot | N7: ='\\SER\Software\other\[POINTS NQS  2012.XLS]Pro V Twin'!AA11 -> 4
A8: ='\\SER\Software\other\[POINTS NQS  2012.XLS]30 Cube'!A12 -> 6 | B8: ='\\SER\Software\other\[POINTS NQS  2012.XLS]30 Cube'!B12 -> Tony Lewis | C8: ='\\SER\Software\other\[POINTS NQS  2012.XLS]30 Cube'!C12 -> Edinburgh, IN | D8: ='\\SER\Software\other\[POINTS NQS  2012.XLS]30 Cube'!D12 -> 345 | E8: =IF('\\SER\Software\other\[POINTS NQS  2012.XLS]30 Cube'!E12=0,"",'\\SER\Software\other\[POINTS NQS  2012.XLS]30 Cube'!E12) -> Plain Jane | F8: ='\\SER\Software\other\[POINTS NQS  2012.XLS]30 Cube'!AA12 -> 5 | I8: ='\\SER\Software\other\[POINTS NQS  2012.XLS]Pro V Twin'!A12 -> 6 | J8: ='\\SER\Software\other\[POINTS NQS  2012.XLS]Pro V Twin'!B12 -> Ryan Richter | K8: ='\\SER\Software\other\[POINTS NQS  2012.XLS]Pro V Twin'!C12 -> Connellsville, PA | L8: ='\\SER\Software\other\[POINTS NQS  2012.XLS]Pro V Twin'!D12 -> 502 | M8: =IF('\\SER\Software\other\[POINTS NQS  2012.XLS]Pro V Twin'!E12=0,"",'\\SER\Software\other\[POINTS NQS  2012.XLS]Pro V Twin'!E12) -> Radical Rat | N8: ='\\SER\Software\other\[POINTS NQS  2012.XLS]Pro V Twin'!AA12 -> 5
A9: ='\\SER\Software\other\[POINTS NQS  2012.XLS]30 Cube'!A13 -> 7 | B9: ='\\SER\Software\other\[POINTS NQS  2012.XLS]30 Cube'!B13 -> George Bax | C9: ='\\SER\Software\other\[POINTS NQS  2012.XLS]30 Cube'!C13 -> St. Thomas, MO | D9: ='\\SER\Software\other\[POINTS NQS  2012.XLS]30 Cube'!D13 -> 422 | E9: =IF('\\SER\Software\other\[POINTS NQS  2012.XLS]30 Cube'!E13=0,"",'\\SER\Software\other\[POINTS NQS  2012.XLS]30 Cube'!E13) -> Plum Crazy | F9: ='\\SER\Software\other\[POINTS NQS  2012.XLS]30 Cube'!AA13 -> 6 | I9: ='\\SER\Software\other\[POINTS NQS  2012.XLS]Pro V Twin'!A13 -> 7 | J9: ='\\SER\Software\other\[POINTS NQS  2012.XLS]Pro V Twin'!B13 -> Jerry Everhart | K9: ='\\SER\Software\other\[POINTS NQS  2012.XLS]Pro V Twin'!C13 -> Springfield, OH | L9: ='\\SER\Software\other\[POINTS NQS  2012.XLS]Pro V Twin'!D13 -> 483 | M9: =IF('\\SER\Software\other\[POINTS NQS  2012.XLS]Pro V Twin'!E13=0,"",'\\SER\Software\other\[POINTS NQS  2012.XLS]Pro V Twin'!E13) -> Orange Cart | N9: ='\\SER\Software\other\[POINTS NQS  2012.XLS]Pro V Twin'!AA13 -> 6
A10: ='\\SER\Software\other\[POINTS NQS  2012.XLS]30 Cube'!A14 -> 8 | B10: ='\\SER\Software\other\[POINTS NQS  2012.XLS]30 Cube'!B14 -> Greg Block | C10: ='\\SER\Software\other\[POINTS NQS  2012.XLS]30 Cube'!C14 -> Jefferson City, MO | D10: ='\\SER\Software\other\[POINTS NQS  2012.XLS]30 Cube'!D14 -> 435 | E10: =IF('\\SER\Software\other\[POINTS NQS  2012.XLS]30 Cube'!E14=0,"",'\\SER\Software\other\[POINTS NQS  2012.XLS]30 Cube'!E14) -> Pocket Change | F10: ='\\SER\Software\other\[POINTS NQS  2012.XLS]30 Cube'!AA14 -> 7 | I10: ='\\SER\Software\other\[POINTS NQS  2012.XLS]Pro V Twin'!A14 -> 8 | J10: ='\\SER\Software\other\[POINTS NQS  2012.XLS]Pro V Twin'!B14 -> Shawn Dukes | K10: ='\\SER\Software\other\[POINTS NQS  2012.XLS]Pro V Twin'!C14 -> Cavert City, KY | L10: ='\\SER\Software\other\[POINTS NQS  2012.XLS]Pro V Twin'!D14 -> 521 | M10: =IF('\\SER\Software\other\[POINTS NQS  2012.XLS]Pro V Twin'!E14=0,"",'\\SER\Software\other\[POINTS NQS  2012.XLS]Pro V Twin'!E14) -> Blown | N10: ='\\SER\Software\other\[POINTS NQS  2012.XLS]Pro V Twin'!AA14 -> 7
A11: ='\\SER\Software\other\[POINTS NQS  2012.XLS]30 Cube'!A15 -> 9 | B11: ='\\SER\Software\other\[POINTS NQS  2012.XLS]30 Cube'!B15 -> Kole Larkins | C11: ='\\SER\Software\other\[POINTS NQS  2012.XLS]30 Cube'!C15 -> Kearney, MO | D11: ='\\SER\Software\other\[POINTS NQS  2012.XLS]30 Cube'!D15 -> 342 | E11: =IF('\\SER\Software\other\[POINTS NQS  2012.XLS]30 Cube'!E15=0,"",'\\SER\Software\other\[POINTS NQS  2012.XLS]30 Cube'!E15) -> Wound Up | F11: ='\\SER\Software\other\[POINTS NQS  2012.XLS]30 Cube'!AA15 -> 8 | I11: ='\\SER\Software\other\[POINTS NQS  2012.XLS]Pro V Twin'!A15 -> 9 | J11: ='\\SER\Software\other\[POINTS NQS  2012.XLS]Pro V Twin'!B15 -> Matt Kaster | K11: ='\\SER\Software\other\[POINTS NQS  2012.XLS]Pro V Twin'!C15 -> Burlington, IA | L11: ='\\SER\Software\other\[POINTS NQS  2012.XLS]Pro V Twin'!D15 -> 99 | M11: =IF('\\SER\Software\other\[POINTS NQS  2012.XLS]Pro V Twin'!E15=0,"",'\\SER\Software\other\[POINTS NQS  2012.XLS]Pro V Twin'!E15) -> Super Freak | N11: ='\\SER\Software\other\[POINTS NQS  2012.XLS]Pro V Twin'!AA15 -> 8
A12: ='\\SER\Software\other\[POINTS NQS  2012.XLS]30 Cube'!A16 -> 10 | B12: ='\\SER\Software\other\[POINTS NQS  2012.XLS]30 Cube'!B16 -> Ben Larkins | C12: ='\\SER\Software\other\[POINTS NQS  2012.XLS]30 Cube'!C16 -> Kearney, MO | D12: ='\\SER\Software\other\[POINTS NQS  2012.XLS]30 Cube'!D16 -> 137 | E12: =IF('\\SER\Software\other\[POINTS NQS  2012.XLS]30 Cube'!E16=0,"",'\\SER\Software\other\[POINTS NQS  2012.XLS]30 Cube'!E16) -> Indian Outlaw | F12: ='\\SER\Software\other\[POINTS NQS  2012.XLS]30 Cube'!AA16 -> 9 | I12: ='\\SER\Software\other\[POINTS NQS  2012.XLS]Pro V Twin'!A16 -> 10 | J12: ='\\SER\Software\other\[POINTS NQS  2012.XLS]Pro V Twin'!B16 -> Lowell Vis | K12: ='\\SER\Software\other\[POINTS NQS  2012.XLS]Pro V Twin'!C16 -> Waupun, WI | L12: ='\\SER\Software\other\[POINTS NQS  2012.XLS]Pro V Twin'!D16 -> 333 | M12: =IF('\\SER\Software\other\[POINTS NQS  2012.XLS]Pro V Twin'!E16=0,"",'\\SER\Software\other\[POINTS NQS  2012.XLS]Pro V Twin'!E16) -> Skittles | N12: ='\\SER\Software\other\[POINTS NQS  2012.XLS]Pro V Twin'!AA16 -> 9
B21: OPEN SUPER STOCK | F21: Thru Sturgis
B22: Name | C22: City/State | D22: NQS # | E22: Tractor | F22: Points Back
A23: ='\\SER\Software\other\[POINTS NQS  2012.XLS]Open Super Stock'!A7 -> 1 | B23: ='\\SER\Software\other\[POINTS NQS  2012.XLS]Open Super Stock'!B7 -> Harrison Stahl | C23: ='\\SER\Software\other\[POINTS NQS  2012.XLS]Open Super Stock'!C7 -> Dewitt, IA | D23: ='\\SER\Software\other\[POINTS NQS  2012.XLS]Open Super Stock'!D7 -> 4 | E23: =IF('\\SER\Software\other\[POINTS NQS  2012.XLS]Open Super Stock'!E7=0,"",'\\SER\Software\other\[POINTS NQS  2012.XLS]Open Super Stock'!E7) -> Ton of Fun | F23: ='\\SER\Software\other\[POINTS NQS  2012.XLS]Open Super Stock'!AA7 -> 0
A24: ='\\SER\Software\other\[POINTS NQS  2012.XLS]Open Super Stock'!A8 -> 2 | B24: ='\\SER\Software\other\[POINTS NQS  2012.XLS]Open Super Stock'!B8 -> Julian Stahl | C24: ='\\SER\Software\other\[POINTS NQS  2012.XLS]Open Super Stock'!C8 -> Welton, IA | D24: ='\\SER\Software\other\[POINTS NQS  2012.XLS]Open Super Stock'!D8 -> 5 | E24: =IF('\\SER\Software\other\[POINTS NQS  2012.XLS]Open Super Stock'!E8=0,"",'\\SER\Software\other\[POINTS NQS  2012.XLS]Open Super Stock'!E8) -> Midwest Express | F24: ='\\SER\Software\other\[POINTS NQS  2012.XLS]Open Super Stock'!AA8 -> 0
A25: ='\\SER\Software\other\[POINTS NQS  2012.XLS]Open Super Stock'!A9 -> 3 | B25: ='\\SER\Software\other\[POINTS NQS  2012.XLS]Open Super Stock'!B9 -> Julian Stahl | C25: ='\\SER\Software\other\[POINTS NQS  2012.XLS]Open Super Stock'!C9 -> Welton, IA | D25: ='\\SER\Software\other\[POINTS NQS  2012.XLS]Open Super Stock'!D9 -> 433 | E25: =IF('\\SER\Software\other\[POINTS NQS  2012.XLS]Open Super Stock'!E9=0,"",'\\SER\Software\other\[POINTS NQS  2012.XLS]Open Super Stock'!E9) -> Fully Charged | F25: ='\\SER\Software\other\[POINTS NQS  2012.XLS]Open Super Stock'!AA9 -> 3
A26: ='\\SER\Software\other\[POINTS NQS  2012.XLS]Open Super Stock'!A10 -> 4 | B26: ='\\SER\Software\other\[POINTS NQS  2012.XLS]Open Super Stock'!B10 -> Bruce Austin | C26: ='\\SER\Software\other\[POINTS NQS  2012.XLS]Open Super Stock'!C10 -> St. Charles, IA | D26: ='\\SER\Software\other\[POINTS NQS  2012.XLS]Open Super Stock'!D10 -> 169 | E26: =IF('\\SER\Software\other\[POINTS NQS  2012.XLS]Open Super Stock'!E10=0,"",'\\SER\Software\other\[POINTS NQS  2012.XLS]Open Super Stock'!E10) -> Thundertaker | F26: ='\\SER\Software\other\[POINTS NQS  2012.XLS]Open Super Stock'!AA10 -> 8
A27: ='\\SER\Software\other\[POINTS NQS  2012.XLS]Open Super Stock'!A11 -> 5 | B27: ='\\SER\Software\other\[POINTS NQS  2012.XLS]Open Super Stock'!B11 -> Jerry Everhart | C27: ='\\SER\Software\other\[POINTS NQS  2012.XLS]Open Super Stock'!C11 -> Springfield, OH | D27: ='\\SER\Software\other\[POINTS NQS  2012.XLS]Open Super Stock'!D11 -> 483 | E27: =IF('\\SER\Software\other\[POINTS NQS  2012.XLS]Open Super Stock'!E11=0,"",'\\SER\Software\other\[POINTS NQS  2012.XLS]Open Super Stock'!E11) ->  | F27: ='\\SER\Software\other\[POINTS NQS  2012.XLS]Open Super Stock'!AA11 -> 9
A28: ='\\SER\Software\other\[POINTS NQS  2012.XLS]Open Super Stock'!A12 -> 6 | B28: ='\\SER\Software\other\[POINTS NQS  2012.XLS]Open Super Stock'!B12 -> Ryan Richter | C28: ='\\SER\Software\other\[POINTS NQS  2012.XLS]Open Super Stock'!C12 -> Connellsville, PA | D28: ='\\SER\Software\other\[POINTS NQS  2012.XLS]Open Super Stock'!D12 -> 502 | E28: =IF('\\SER\Software\other\[POINTS NQS  2012.XLS]Open Super Stock'!E12=0,"",'\\SER\Software\other\[POINTS NQS  2012.XLS]Open Super Stock'!E12) -> Radical Rat | F28: ='\\SER\Software\other\[POINTS NQS  2012.XLS]Open Super Stock'!AA12 -> 10
A29: ='\\SER\Software\other\[POINTS NQS  2012.XLS]Open Super Stock'!A13 -> 7 | B29: ='\\SER\Software\other\[POINTS NQS  2012.XLS]Open Super Stock'!B13 -> Ryan Shafer | C29: ='\\SER\Software\other\[POINTS NQS  2012.XLS]Open Super Stock'!C13 -> Confluence, PA | D29: ='\\SER\Software\other\[POINTS NQS  2012.XLS]Open Super Stock'!D13 -> 445 | E29: =IF('\\SER\Software\other\[POINTS NQS  2012.XLS]Open Super Stock'!E13=0,"",'\\SER\Software\other\[POINTS NQS  2012.XLS]Open Super Stock'!E13) -> Labrat | F29: ='\\SER\Software\other\[POINTS NQS  2012.XLS]Open Super Stock'!AA13 -> 12
A30: ='\\SER\Software\other\[POINTS NQS  2012.XLS]Open Super Stock'!A14 -> 8 | B30: ='\\SER\Software\other\[POINTS NQS  2012.XLS]Open Super Stock'!B14 -> Shane Hadley | C30: ='\\SER\Software\other\[POINTS NQS  2012.XLS]Open Super Stock'!C14 -> Marion, NY | D30: ='\\SER\Software\other\[POINTS NQS  2012.XLS]Open Super Stock'!D14 -> 505 | E30: =IF('\\SER\Software\other\[POINTS NQS  2012.XLS]Open Super Stock'!E14=0,"",'\\SER\Software\other\[POINTS NQS  2012.XLS]Open Super Stock'!E14) ->  | F30: ='\\SER\Software\other\[POINTS NQS  2012.XLS]Open Super Stock'!AA14 -> 32