A1: STOCK ALTERED 1050 | G1: Thru Sturgis | I1: STOCK ALTERED 1100 | O1: Thru Sturgis
B2: Name | C2: City/State | D2: Eng | E2: NQS # | F2: Tractor | G2: Points Back | J2: Name | K2: City | L2: Eng | M2: NQS# | N2: Tractor | O2: Points Back
A3: ='\\SER\Software\other\[POINTS NQS  2012.XLS]Stock Altered 1050'!A6 -> 1 | B3: ='\\SER\Software\other\[POINTS NQS  2012.XLS]Stock Altered 1050'!B6 -> Wayne Sams | C3: ='\\SER\Software\other\[POINTS NQS  2012.XLS]Stock Altered 1050'!C6 -> Rockbridge, OH | D3: ='\\SER\Software\other\[POINTS NQS  2012.XLS]Stock Altered 1050'!D6 -> TV | E3: ='\\SER\Software\other\[POINTS NQS  2012.XLS]Stock Altered 1050'!E6 -> 82 | F3: =IF('\\SER\Software\other\[POINTS NQS  2012.XLS]Stock Altered 1050'!F6=0," ",'\\SER\Software\other\[POINTS NQS  2012.XLS]Stock Altered 1050'!F6) -> Gold Digger | G3: ='\\SER\Software\other\[POINTS NQS  2012.XLS]Stock Altered 1050'!AA6 -> 0 | I3: ='\\SER\Software\other\[POINTS NQS  2012.XLS]Stock Altered 1100'!A6 -> 1 | J3: ='\\SER\Software\other\[POINTS NQS  2012.XLS]Stock Altered 1100'!B6 -> Matt Ronnebaum | K3: ='\\SER\Software\other\[POINTS NQS  2012.XLS]Stock Altered 1100'!C6 -> Celina, OH | L3: ='\\SER\Software\other\[POINTS NQS  2012.XLS]Stock Altered 1100'!D6 -> TV | M3: ='\\SER\Software\other\[POINTS NQS  2012.XLS]Stock Altered 1100'!E6 -> 89 | N3: =IF('\\SER\Software\other\[POINTS NQS  2012.XLS]Stock Altered 1100'!F6=0," ",'\\SER\Software\other\[POINTS NQS  2012.XLS]Stock Altered 1100'!F6) -> Boys & Their Toys | O3: ='\\SER\Software\other\[POINTS NQS  2012.XLS]Stock Altered 1100'!AA6 -> 0
A4: ='\\SER\Software\other\[POINTS NQS  2012.XLS]Stock Altered 1050'!A7 -> 2 | B4: ='\\SER\Software\other\[POINTS NQS  2012.XLS]Stock Altered 1050'!B7 -> Ron Hodge | C4: ='\\SER\Software\other\[POINTS NQS  2012.XLS]Stock Altered 1050'!C7 -> Hillsboro, OH | D4: ='\\SER\Software\other\[POINTS NQS  2012.XLS]Stock Altered 1050'!D7 -> TV | E4: ='\\SER\Software\other\[POINTS NQS  2012.XLS]Stock Altered 1050'!E7 -> 71 | F4: =IF('\\SER\Software\other\[POINTS NQS  2012.XLS]Stock Altered 1050'!F7=0," ",'\\SER\Software\other\[POINTS NQS  2012.XLS]Stock Altered 1050'!F7) -> Take-N-Names | G4: ='\\SER\Software\other\[POINTS NQS  2012.XLS]Stock Altered 1050'!AA7 -> 1 | I4: ='\\SER\Software\other\[POINTS NQS  2012.XLS]Stock Altered 1100'!A7 -> 2 | J4: ='\\SER\Software\other\[POINTS NQS  2012.XLS]Stock Altered 1100'!B7 -> Mark Peters | K4: ='\\SER\Software\other\[POINTS NQS  2012.XLS]Stock Altered 1100'!C7 -> McArthur, PA | L4: ='\\SER\Software\other\[POINTS NQS  2012.XLS]Stock Altered 1100'!D7 -> JRS | M4: ='\\SER\Software\other\[POINTS NQS  2012.XLS]Stock Altered 1100'!E7 -> 469 | N4: =IF('\\SER\Software\other\[POINTS NQS  2012.XLS]Stock Altered 1100'!F7=0," ",'\\SER\Software\other\[POINTS NQS  2012.XLS]Stock Altered 1100'!F7) -> American Ride | O4: ='\\SER\Software\other\[POINTS NQS  2012.XLS]Stock Altered 1100'!AA7 -> 1
A5: ='\\SER\Software\other\[POINTS NQS  2012.XLS]Stock Altered 1050'!A8 -> 3 | B5: ='\\SER\Software\other\[POINTS NQS  2012.XLS]Stock Altered 1050'!B8 -> Colt Vorhees | C5: ='\\SER\Software\other\[POINTS NQS  2012.XLS]Stock Altered 1050'!C8 -> Rockbridge, OH | D5: ='\\SER\Software\other\[POINTS NQS  2012.XLS]Stock Altered 1050'!D8 -> TV | E5: ='\\SER\Software\other\[POINTS NQS  2012.XLS]Stock Altered 1050'!E8 -> 313 | F5: =IF('\\SER\Software\other\[POINTS NQS  2012.XLS]Stock Altered 1050'!F8=0," ",'\\SER\Software\other\[POINTS NQS  2012.XLS]Stock Altered 1050'!F8) -> Red Cadet | G5: ='\\SER\Software\other\[POINTS NQS  2012.XLS]Stock Altered 1050'!AA8 -> 2 | I5: ='\\SER\Software\other\[POINTS NQS  2012.XLS]Stock Altered 1100'!A8 -> 3 | J5: ='\\SER\Software\other\[POINTS NQS  2012.XLS]Stock Altered 1100'!B8 -> Wayne Sams | K5: ='\\SER\Software\other\[POINTS NQS  2012.XLS]Stock Altered 1100'!C8 -> Rockbridge, OH | L5: ='\\SER\Software\other\[POINTS NQS  2012.XLS]Stock Altered 1100'!D8 -> TV | M5: ='\\SER\Software\other\[POINTS NQS  2012.XLS]Stock Altered 1100'!E8 -> 82 | N5: =IF('\\SER\Software\other\[POINTS NQS  2012.XLS]Stock Altered 1100'!F8=0," ",'\\SER\Software\other\[POINTS NQS  2012.XLS]Stock Altered 1100'!F8) -> Gold Digger | O5: ='\\SER\Software\other\[POINTS NQS  2012.XLS]Stock Altered 1100'!AA8 -> 5
A6: ='\\SER\Software\other\[POINTS NQS  2012.XLS]Stock Altered 1050'!A9 -> 4 | B6: ='\\SER\Software\other\[POINTS NQS  2012.XLS]Stock Altered 1050'!B9 -> Kelly Nichols | C6: ='\\SER\Software\other\[POINTS NQS  2012.XLS]Stock Altered 1050'!C9 -> Lore City, OH | D6: ='\\SER\Software\other\[POINTS NQS  2012.XLS]Stock Altered 1050'!D9 -> NP | E6: ='\\SER\Software\other\[POINTS NQS  2012.XLS]Stock Altered 1050'!E9 -> 358 | F6: =IF('\\SER\Software\other\[POINTS NQS  2012.XLS]Stock Altered 1050'!F9=0," ",'\\SER\Software\other\[POINTS NQS  2012.XLS]Stock Altered 1050'!F9) -> Maxx'd Out | G6: ='\\SER\Software\other\[POINTS NQS  2012.XLS]Stock Altered 1050'!AA9 -> 4 | I6: ='\\SER\Software\other\[POINTS NQS  2012.XLS]Stock Altered 1100'!A9 -> 4 | J6: ='\\SER\Software\other\[POINTS NQS  2012.XLS]Stock Altered 1100'!B9 -> Keith Frueh | K6: ='\\SER\Software\other\[POINTS NQS  2012.XLS]Stock Altered 1100'!C9 -> Greenville, IL | L6: ='\\SER\Software\other\[POINTS NQS  2012.XLS]Stock Altered 1100'!D9 -> JRS | M6: ='\\SER\Software\other\[POINTS NQS  2012.XLS]Stock Altered 1100'!E9 -> 453 | N6: =IF('\\SER\Software\other\[POINTS NQS  2012.XLS]Stock Altered 1100'!F9=0," ",'\\SER\Software\other\[POINTS NQS  2012.XLS]Stock Altered 1100'!F9) -> Haulin Harvester | O6: ='\\SER\Software\other\[POINTS NQS  2012.XLS]Stock Altered 1100'!AA9 -> 5
A7: ='\\SER\Software\other\[POINTS NQS  2012.XLS]Stock Altered 1050'!A10 -> 5 | B7: ='\\SER\Software\other\[POINTS NQS  2012.XLS]Stock Altered 1050'!B10 -> Keith Frueh | C7: ='\\SER\Software\other\[POINTS NQS  2012.XLS]Stock Altered 1050'!C10 -> Greenville, IL | D7: ='\\SER\Software\other\[POINTS NQS  2012.XLS]Stock Altered 1050'!D10 -> JRS | E7: ='\\SER\Software\other\[POINTS NQS  2012.XLS]Stock Altered 1050'!E10 -> 453 | F7: =IF('\\SER\Software\other\[POINTS NQS  2012.XLS]Stock Altered 1050'!F10=0," ",'\\SER\Software\other\[POINTS NQS  2012.XLS]Stock Altered 1050'!F10) -> Haulin Harvester | G7: ='\\SER\Software\other\[POINTS NQS  2012.XLS]Stock Altered 1050'!AA10 -> 5 | I7: ='\\SER\Software\other\[POINTS NQS  2012.XLS]Stock Altered 1100'!A10 -> 5 | J7: ='\\SER\Software\other\[POINTS NQS  2012.XLS]Stock Altered 1100'!B10 -> Eli Zimmerman | K7: ='\\SER\Software\other\[POINTS NQS  2012.XLS]Stock Altered 1100'!C10 -> Allentown, PA | L7: ='\\SER\Software\other\[POINTS NQS  2012.XLS]Stock Altered 1100'!D10 -> NP | M7: ='\\SER\Software\other\[POINTS NQS  2012.XLS]Stock Altered 1100'!E10 -> 75 | N7: =IF('\\SER\Software\other\[POINTS NQS  2012.XLS]Stock Altered 1100'!F10=0," ",'\\SER\Software\other\[POINTS NQS  2012.XLS]Stock Altered 1100'!F10) -> Red Fever | O7: ='\\SER\Software\other\[POINTS NQS  2012.XLS]Stock Altered 1100'!AA10 -> 6
A8: ='\\SER\Software\other\[POINTS NQS  2012.XLS]Stock Altered 1050'!A11 -> 6 | B8: ='\\SER\Software\other\[POINTS NQS  2012.XLS]Stock Altered 1050'!B11 -> Gary Cunningham | C8: ='\\SER\Software\other\[POINTS NQS  2012.XLS]Stock Altered 1050'!C11 -> Brooksville, KY | D8: ='\\SER\Software\other\[POINTS NQS  2012.XLS]Stock Altered 1050'!D11 -> NP | E8: ='\\SER\Software\other\[POINTS NQS  2012.XLS]Stock Altered 1050'!E11 -> 62 | F8: =IF('\\SER\Software\other\[POINTS NQS  2012.XLS]Stock Altered 1050'!F11=0," ",'\\SER\Software\other\[POINTS NQS  2012.XLS]Stock Altered 1050'!F11) -> High Voltage | G8: ='\\SER\Software\other\[POINTS NQS  2012.XLS]Stock Altered 1050'!AA11 -> 6 | I8: ='\\SER\Software\other\[POINTS NQS  2012.XLS]Stock Altered 1100'!A11 -> 6 | J8: ='\\SER\Software\other\[POINTS NQS  2012.XLS]Stock Altered 1100'!B11 -> Cody Costa | K8: ='\\SER\Software\other\[POINTS NQS  2012.XLS]Stock Altered 1100'!C11 -> Greencastle, PA | L8: ='\\SER\Software\other\[POINTS NQS  2012.XLS]Stock Altered 1100'!D11 -> NP | M8: ='\\SER\Software\other\[POINTS NQS  2012.XLS]Stock Altered 1100'!E11 -> 135 | N8: =IF('\\SER\Software\other\[POINTS NQS  2012.XLS]Stock Altered 1100'!F11=0," ",'\\SER\Software\other\[POINTS NQS  2012.XLS]Stock Altered 1100'!F11) -> Wild Child | O8: ='\\SER\Software\other\[POINTS NQS  2012.XLS]Stock Altered 1100'!AA11 -> 6
A9: ='\\SER\Software\other\[POINTS NQS  2012.XLS]Stock Altered 1050'!A12 -> 7 | B9: ='\\SER\Software\other\[POINTS NQS  2012.XLS]Stock Altered 1050'!B12 -> Carl Frueh | C9: ='\\SER\Software\other\[POINTS NQS  2012.XLS]Stock Altered 1050'!C12 -> Greenville, IL | D9: ='\\SER\Software\other\[POINTS NQS  2012.XLS]Stock Altered 1050'!D12 -> JRS | E9: ='\\SER\Software\other\[POINTS NQS  2012.XLS]Stock Altered 1050'!E12 -> 279 | F9: =IF('\\SER\Software\other\[POINTS NQS  2012.XLS]Stock Altered 1050'!F12=0," ",'\\SER\Software\other\[POINTS NQS  2012.XLS]Stock Altered 1050'!F12) -> Blue Thunder | G9: ='\\SER\Software\other\[POINTS NQS  2012.XLS]Stock Altered 1050'!AA12 -> 6 | I9: ='\\SER\Software\other\[POINTS NQS  2012.XLS]Stock Altered 1100'!A12 -> 7 | J9: ='\\SER\Software\other\[POINTS NQS  2012.XLS]Stock Altered 1100'!B12 -> Tim Shaw/Colt Vorhees | K9: ='\\SER\Software\other\[POINTS NQS  2012.XLS]Stock Altered 1100'!C12 -> Rockbridge, OH | L9: ='\\SER\Software\other\[POINTS NQS  2012.XLS]Stock Altered 1100'!D12 -> TV | M9: ='\\SER\Software\other\[POINTS NQS  2012.XLS]Stock Altered 1100'!E12 -> 454 | N9: =IF('\\SER\Software\other\[POINTS NQS  2012.XLS]Stock Altered 1100'!F12=0," ",'\\SER\Software\other\[POINTS NQS  2012.XLS]Stock Altered 1100'!F12) -> Heavy Hauler | O9: ='\\SER\Software\other\[POINTS NQS  2012.XLS]Stock Altered 1100'!AA12 -> 7
A10: ='\\SER\Software\other\[POINTS NQS  2012.XLS]Stock Altered 1050'!A13 -> 8 | B10: ='\\SER\Software\other\[POINTS NQS  2012.XLS]Stock Altered 1050'!B13 -> Matt Ronnebaum | C10: ='\\SER\Software\other\[POINTS NQS  2012.XLS]Stock Altered 1050'!C13 -> Celina, OH | D10: ='\\SER\Software\other\[POINTS NQS  2012.XLS]Stock Altered 1050'!D13 -> TV | E10: ='\\SER\Software\other\[POINTS NQS  2012.XLS]Stock Altered 1050'!E13 -> 89 | F10: =IF('\\SER\Software\other\[POINTS NQS  2012.XLS]Stock Altered 1050'!F13=0," ",'\\SER\Software\other\[POINTS NQS  2012.XLS]Stock Altered 1050'!F13) -> Boys & Their Toys | G10: ='\\SER\Software\other\[POINTS NQS  2012.XLS]Stock Altered 1050'!AA13 -> 8 | I10: ='\\SER\Software\other\[POINTS NQS  2012.XLS]Stock Altered 1100'!A13 -> 8 | J10: ='\\SER\Software\other\[POINTS NQS  2012.XLS]Stock Altered 1100'!B13 -> Donnie Herring | K10: ='\\SER\Software\other\[POINTS NQS  2012.XLS]Stock Altered 1100'!C13 -> Rockbridge, OH | L10: ='\\SER\Software\other\[POINTS NQS  2012.XLS]Stock Altered 1100'!D13 -> TV | M10: ='\\SER\Software\other\[POINTS NQS  2012.XLS]Stock Altered 1100'!E13 -> 331 | N10: =IF('\\SER\Software\other\[POINTS NQS  2012.XLS]Stock Altered 1100'!F13=0," ",'\\SER\Software\other\[POINTS NQS  2012.XLS]Stock Altered 1100'!F13) -> Pasttime | O10: ='\\SER\Software\other\[POINTS NQS  2012.XLS]Stock Altered 1100'!AA13 -> 8
A11: ='\\SER\Software\other\[POINTS NQS  2012.XLS]Stock Altered 1050'!A14 -> 9 | B11: ='\\SER\Software\other\[POINTS NQS  2012.XLS]Stock Altered 1050'!B14 -> John Cress | C11: ='\\SER\Software\other\[POINTS NQS  2012.XLS]Stock Altered 1050'!C14 -> Strasburg, IL | D11: ='\\SER\Software\other\[POINTS NQS  2012.XLS]Stock Altered 1050'!D14 -> JRS | E11: ='\\SER\Software\other\[POINTS NQS  2012.XLS]Stock Altered 1050'!E14 -> 170 | F11: =IF('\\SER\Software\other\[POINTS NQS  2012.XLS]Stock Altered 1050'!F14=0," ",'\\SER\Software\other\[POINTS NQS  2012.XLS]Stock Altered 1050'!F14) -> Mini Blitzed | G11: ='\\SER\Software\other\[POINTS NQS  2012.XLS]Stock Altered 1050'!AA14 -> 10 | I11: ='\\SER\Software\other\[POINTS NQS  2012.XLS]Stock Altered 1100'!A14 -> 9 | J11: ='\\SER\Software\other\[POINTS NQS  2012.XLS]Stock Altered 1100'!B14 -> Dave Washburn | K11: ='\\SER\Software\other\[POINTS NQS  2012.XLS]Stock Altered 1100'!C14 -> Guysville, OH | L11: ='\\SER\Software\other\[POINTS NQS  2012.XLS]Stock Altered 1100'!D14 -> BJ | M11: ='\\SER\Software\other\[POINTS NQS  2012.XLS]Stock Altered 1100'!E14 -> 156 | N11: =IF('\\SER\Software\other\[POINTS NQS  2012.XLS]Stock Altered 1100'!F14=0," ",'\\SER\Software\other\[POINTS NQS  2012.XLS]Stock Altered 1100'!F14) -> Last Minute | O11: ='\\SER\Software\other\[POINTS NQS  2012.XLS]Stock Altered 1100'!AA14 -> 9
A12: ='\\SER\Software\other\[POINTS NQS  2012.XLS]Stock Altered 1050'!A15 -> 10 | B12: ='\\SER\Software\other\[POINTS NQS  2012.XLS]Stock Altered 1050'!B15 -> Ed Kerner | C12: ='\\SER\Software\other\[POINTS NQS  2012.XLS]Stock Altered 1050'!C15 -> Kimball, MI | D12: ='\\SER\Software\other\[POINTS NQS  2012.XLS]Stock Altered 1050'!D15 -> NP | E12: ='\\SER\Software\other\[POINTS NQS  2012.XLS]Stock Altered 1050'!E15 -> 303 | F12: =IF('\\SER\Software\other\[POINTS NQS  2012.XLS]Stock Altered 1050'!F15=0," ",'\\SER\Software\other\[POINTS NQS  2012.XLS]Stock Altered 1050'!F15) -> Along for the Ride | G12: ='\\SER\Software\other\[POINTS NQS  2012.XLS]Stock Altered 1050'!AA15 -> 10 | I12: ='\\SER\Software\other\[POINTS NQS  2012.XLS]Stock Altered 1100'!A15 -> 10 | J12: ='\\SER\Software\other\[POINTS NQS  2012.XLS]Stock Altered 1100'!B15 -> Gary Cunningham | K12: ='\\SER\Software\other\[POINTS NQS  2012.XLS]Stock Altered 1100'!C15 -> Brooksville, KY | L12: ='\\SER\Software\other\[POINTS NQS  2012.XLS]Stock Altered 1100'!D15 -> NP | M12: ='\\SER\Software\other\[POINTS NQS  2012.XLS]Stock Altered 1100'!E15 -> 62 | N12: =IF('\\SER\Software\other\[POINTS NQS  2012.XLS]Stock Altered 1100'!F15=0," ",'\\SER\Software\other\[POINTS NQS  2012.XLS]Stock Altered 1100'!F15) -> High Voltage | O12: ='\\SER\Software\other\[POINTS NQS  2012.XLS]Stock Altered 1100'!AA15 -> 12
A13: ='\\SER\Software\other\[POINTS NQS  2012.XLS]Stock Altered 1050'!A16 -> 11 | B13: ='\\SER\Software\other\[POINTS NQS  2012.XLS]Stock Altered 1050'!B16 -> Gregory Vandervort | C13: ='\\SER\Software\other\[POINTS NQS  2012.XLS]Stock Altered 1050'!C16 -> Albion, PA | D13: ='\\SER\Software\other\[POINTS NQS  2012.XLS]Stock Altered 1050'!D16 -> TV | E13: ='\\SER\Software\other\[POINTS NQS  2012.XLS]Stock Altered 1050'!E16 -> 346 | F13: =IF('\\SER\Software\other\[POINTS NQS  2012.XLS]Stock Altered 1050'!F16=0," ",'\\SER\Software\other\[POINTS NQS  2012.XLS]Stock Altered 1050'!F16) -> Yellow Cub | G13: ='\\SER\Software\other\[POINTS NQS  2012.XLS]Stock Altered 1050'!AA16 -> 10 | I13: ='\\SER\Software\other\[POINTS NQS  2012.XLS]Stock Altered 1100'!A16 -> 11 | J13: ='\\SER\Software\other\[POINTS NQS  2012.XLS]Stock Altered 1100'!B16 -> Doug Seaman | K13: ='\\SER\Software\other\[POINTS NQS  2012.XLS]Stock Altered 1100'!C16 -> Vincent, OH | L13: ='\\SER\Software\other\[POINTS NQS  2012.XLS]Stock Altered 1100'!D16 -> BJ | M13: ='\\SER\Software\other\[POINTS NQS  2012.XLS]Stock Altered 1100'!E16 -> 192 | N13: =IF('\\SER\Software\other\[POINTS NQS  2012.XLS]Stock Altered 1100'!F16=0," ",'\\SER\Software\other\[POINTS NQS  2012.XLS]Stock Altered 1100'!F16) -> Massey Ferguson | O13: ='\\SER\Software\other\[POINTS NQS  2012.XLS]Stock Altered 1100'!AA16 -> 12
A14: ='\\SER\Software\other\[POINTS NQS  2012.XLS]Stock Altered 1050'!A17 -> 12 | B14: ='\\SER\Software\other\[POINTS NQS  2012.XLS]Stock Altered 1050'!B17 -> Greg Watson | C14: ='\\SER\Software\other\[POINTS NQS  2012.XLS]Stock Altered 1050'!C17 -> Batavia, OH | D14: ='\\SER\Software\other\[POINTS NQS  2012.XLS]Stock Altered 1050'!D17 -> NP | E14: ='\\SER\Software\other\[POINTS NQS  2012.XLS]Stock Altered 1050'!E17 -> 327 | F14: =IF('\\SER\Software\other\[POINTS NQS  2012.XLS]Stock Altered 1050'!F17=0," ",'\\SER\Software\other\[POINTS NQS  2012.XLS]Stock Altered 1050'!F17) -> Road Warrior | G14: ='\\SER\Software\other\[POINTS NQS  2012.XLS]Stock Altered 1050'!AA17 -> 11 | I14: ='\\SER\Software\other\[POINTS NQS  2012.XLS]Stock Altered 1100'!A17 -> 12 | J14: ='\\SER\Software\other\[POINTS NQS  2012.XLS]Stock Altered 1100'!B17 -> Colt Vorhees | K14: ='\\SER\Software\other\[POINTS NQS  2012.XLS]Stock Altered 1100'!C17 -> Rockbridge, OH | L14: ='\\SER\Software\other\[POINTS NQS  2012.XLS]Stock Altered 1100'!D17 -> TV | M14: ='\\SER\Software\other\[POINTS NQS  2012.XLS]Stock Altered 1100'!E17 -> 313 | N14: =IF('\\SER\Software\other\[POINTS NQS  2012.XLS]Stock Altered 1100'!F17=0," ",'\\SER\Software\other\[POINTS NQS  2012.XLS]Stock Altered 1100'!F17) -> Red Cadet | O14: ='\\SER\Software\other\[POINTS NQS  2012.XLS]Stock Altered 1100'!AA17 -> 14
A15: ='\\SER\Software\other\[POINTS NQS  2012.XLS]Stock Altered 1050'!A18 -> 13 | B15: ='\\SER\Software\other\[POINTS NQS  2012.XLS]Stock Altered 1050'!B18 -> Chris Gegg | C15: ='\\SER\Software\other\[POINTS NQS  2012.XLS]Stock Altered 1050'!C18 -> Greenville, IL | D15: ='\\SER\Software\other\[POINTS NQS  2012.XLS]Stock Altered 1050'!D18 -> JRS | E15: ='\\SER\Software\other\[POINTS NQS  2012.XLS]Stock Altered 1050'!E18 -> 410 | F15: =IF('\\SER\Software\other\[POINTS NQS  2012.XLS]Stock Altered 1050'!F18=0," ",'\\SER\Software\other\[POINTS NQS  2012.XLS]Stock Altered 1050'!F18) -> Insane | G15: ='\\SER\Software\other\[POINTS NQS  2012.XLS]Stock Altered 1050'!AA18 -> 15 | I15: ='\\SER\Software\other\[POINTS NQS  2012.XLS]Stock Altered 1100'!A18 -> 13 | J15: ='\\SER\Software\other\[POINTS NQS  2012.XLS]Stock Altered 1100'!B18 -> Brock Nelson | K15: ='\\SER\Software\other\[POINTS NQS  2012.XLS]Stock Altered 1100'!C18 -> Greenville, IL | L15: ='\\SER\Software\other\[POINTS NQS  2012.XLS]Stock Altered 1100'!D18 -> JRS | M15: ='\\SER\Software\other\[POINTS NQS  2012.XLS]Stock Altered 1100'!E18 -> 86 | N15: =IF('\\SER\Software\other\[POINTS NQS  2012.XLS]Stock Altered 1100'!F18=0," ",'\\SER\Software\other\[POINTS NQS  2012.XLS]Stock Altered 1100'!F18) -> Fearless | O15: ='\\SER\Software\other\[POINTS NQS  2012.XLS]Stock Altered 1100'!AA18 -> 15
A16: ='\\SER\Software\other\[POINTS NQS  2012.XLS]Stock Altered 1050'!A19 -> 14 | B16: ='\\SER\Software\other\[POINTS NQS  2012.XLS]Stock Altered 1050'!B19 -> Keith Frueh | C16: ='\\SER\Software\other\[POINTS NQS  2012.XLS]Stock Altered 1050'!C19 -> Greenville, IL | D16: ='\\SER\Software\other\[POINTS NQS  2012.XLS]Stock Altered 1050'!D19 -> JRS | E16: ='\\SER\Software\other\[POINTS NQS  2012.XLS]Stock Altered 1050'!E19 -> 86 | F16: =IF('\\SER\Software\other\[POINTS NQS  2012.XLS]Stock Altered 1050'!F19=0," ",'\\SER\Software\other\[POINTS NQS  2012.XLS]Stock Altered 1050'!F19) -> Fearless | G16: ='\\SER\Software\other\[POINTS NQS  2012.XLS]Stock Altered 1050'!AA19 -> 16 | I16: ='\\SER\Software\other\[POINTS NQS  2012.XLS]Stock Altered 1100'!A19 -> 14 | J16: ='\\SER\Software\other\[POINTS NQS  2012.XLS]Stock Altered 1100'!B19 -> Carl Frueh | K16: ='\\SER\Software\other\[POINTS NQS  2012.XLS]Stock Altered 1100'!C19 -> Greenville, IL | L16: ='\\SER\Software\other\[POINTS NQS  2012.XLS]Stock Altered 1100'!D19 -> JRS | M16: ='\\SER\Software\other\[POINTS NQS  2012.XLS]Stock Altered 1100'!E19 -> 279 | N16: =IF('\\SER\Software\other\[POINTS NQS  2012.XLS]Stock Altered 1100'!F19=0," ",'\\SER\Software\other\[POINTS NQS  2012.XLS]Stock Altered 1100'!F19) -> Blue Thunder | O16: ='\\SER\Software\other\[POINTS NQS  2012.XLS]Stock Altered 1100'!AA19 -> 17
A17: ='\\SER\Software\other\[POINTS NQS  2012.XLS]Stock Altered 1050'!A20 -> 15 | B17: ='\\SER\Software\other\[POINTS NQS  2012.XLS]Stock Altered 1050'!B20 -> Tim Shaw/Colt Vorhees | C17: ='\\SER\Software\other\[POINTS NQS  2012.XLS]Stock Altered 1050'!C20 -> Rockbridge, OH | D17: ='\\SER\Software\other\[POINTS NQS  2012.XLS]Stock Altered 1050'!D20 -> TV | E17: ='\\SER\Software\other\[POINTS NQS  2012.XLS]Stock Altered 1050'!E20 -> 454 | F17: =IF('\\SER\Software\other\[POINTS NQS  2012.XLS]Stock Altered 1050'!F20=0," ",'\\SER\Software\other\[POINTS NQS  2012.XLS]Stock Altered 1050'!F20) -> Heavy Hauler | G17: ='\\SER\Software\other\[POINTS NQS  2012.XLS]Stock Altered 1050'!AA20 -> 16 | I17: ='\\SER\Software\other\[POINTS NQS  2012.XLS]Stock Altered 1100'!A20 -> 15 | J17: ='\\SER\Software\other\[POINTS NQS  2012.XLS]Stock Altered 1100'!B20 -> Waylan Nelson | K17: ='\\SER\Software\other\[POINTS NQS  2012.XLS]Stock Altered 1100'!C20 -> Shelby, IA | L17: ='\\SER\Software\other\[POINTS NQS  2012.XLS]Stock Altered 1100'!D20 -> Woods | M17: ='\\SER\Software\other\[POINTS NQS  2012.XLS]Stock Altered 1100'!E20 -> 500 | N17: =IF('\\SER\Software\other\[POINTS NQS  2012.XLS]Stock Altered 1100'!F20=0," ",'\\SER\Software\other\[POINTS NQS  2012.XLS]Stock Altered 1100'!F20) -> Butt Ugly | O17: ='\\SER\Software\other\[POINTS NQS  2012.XLS]Stock Altered 1100'!AA20 -> 19
A18: ='\\SER\Software\other\[POINTS NQS  2012.XLS]Stock Altered 1050'!A21 -> 16 | B18: ='\\SER\Software\other\[POINTS NQS  2012.XLS]Stock Altered 1050'!B21 -> Shane Hadley | C18: ='\\SER\Software\other\[POINTS NQS  2012.XLS]Stock Altered 1050'!C21 -> Marion, NY | D18: ='\\SER\Software\other\[POINTS NQS  2012.XLS]Stock Altered 1050'!D21 -> LR | E18: ='\\SER\Software\other\[POINTS NQS  2012.XLS]Stock Altered 1050'!E21 -> 442 | F18: =IF('\\SER\Software\other\[POINTS NQS  2012.XLS]Stock Altered 1050'!F21=0," ",'\\SER\Software\other\[POINTS NQS  2012.XLS]Stock Altered 1050'!F21) -> Foot Finder | G18: ='\\SER\Software\other\[POINTS NQS  2012.XLS]Stock Altered 1050'!AA21 -> 17 | I18: ='\\SER\Software\other\[POINTS NQS  2012.XLS]Stock Altered 1100'!A21 -> 16 | J18: ='\\SER\Software\other\[POINTS NQS  2012.XLS]Stock Altered 1100'!B21 -> John Cress | K18: ='\\SER\Software\other\[POINTS NQS  2012.XLS]Stock Altered 1100'!C21 -> Strasburg, IL | L18: ='\\SER\Software\other\[POINTS NQS  2012.XLS]Stock Altered 1100'!D21 -> JRS | M18: ='\\SER\Software\other\[POINTS NQS  2012.XLS]Stock Altered 1100'!E21 -> 170 | N18: =IF('\\SER\Software\other\[POINTS NQS  2012.XLS]Stock Altered 1100'!F21=0," ",'\\SER\Software\other\[POINTS NQS  2012.XLS]Stock Altered 1100'!F21) -> Mini Blitzed | O18: ='\\SER\Software\other\[POINTS NQS  2012.XLS]Stock Altered 1100'!AA21 -> 20
A19: ='\\SER\Software\other\[POINTS NQS  2012.XLS]Stock Altered 1050'!A22 -> 17 | B19: ='\\SER\Software\other\[POINTS NQS  2012.XLS]Stock Altered 1050'!B22 -> Gary Frank | C19: ='\\SER\Software\other\[POINTS NQS  2012.XLS]Stock Altered 1050'!C22 -> Amanda, OH | D19: ='\\SER\Software\other\[POINTS NQS  2012.XLS]Stock Altered 1050'!D22 -> TV | E19: ='\\SER\Software\other\[POINTS NQS  2012.XLS]Stock Altered 1050'!E22 -> 233 | F19: =IF('\\SER\Software\other\[POINTS NQS  2012.XLS]Stock Altered 1050'!F22=0," ",'\\SER\Software\other\[POINTS NQS  2012.XLS]Stock Altered 1050'!F22) -> Katies Toy | G19: ='\\SER\Software\other\[POINTS NQS  2012.XLS]Stock Altered 1050'!AA22 -> 18 | I19: ='\\SER\Software\other\[POINTS NQS  2012.XLS]Stock Altered 1100'!A22 -> 17 | J19: ='\\SER\Software\other\[POINTS NQS  2012.XLS]Stock Altered 1100'!B22 -> Rick James | K19: ='\\SER\Software\other\[POINTS NQS  2012.XLS]Stock Altered 1100'!C22 -> Lancaster, OH | L19: ='\\SER\Software\other\[POINTS NQS  2012.XLS]Stock Altered 1100'!D22 -> BJ | M19: ='\\SER\Software\other\[POINTS NQS  2012.XLS]Stock Altered 1100'!E22 -> 427 | N19: =IF('\\SER\Software\other\[POINTS NQS  2012.XLS]Stock Altered 1100'!F22=0," ",'\\SER\Software\other\[POINTS NQS  2012.XLS]Stock Altered 1100'!F22) -> James Gang III | O19: ='\\SER\Software\other\[POINTS NQS  2012.XLS]Stock Altered 1100'!AA22 -> 21
A20: ='\\SER\Software\other\[POINTS NQS  2012.XLS]Stock Altered 1050'!A23 -> 18 | B20: ='\\SER\Software\other\[POINTS NQS  2012.XLS]Stock Altered 1050'!B23 -> Donnie Herring | C20: ='\\SER\Software\other\[POINTS NQS  2012.XLS]Stock Altered 1050'!C23 -> Rockbridge, OH | D20: ='\\SER\Software\other\[POINTS NQS  2012.XLS]Stock Altered 1050'!D23 -> TV | E20: ='\\SER\Software\other\[POINTS NQS  2012.XLS]Stock Altered 1050'!E23 -> 331 | F20: =IF('\\SER\Software\other\[POINTS NQS  2012.XLS]Stock Altered 1050'!F23=0," ",'\\SER\Software\other\[POINTS NQS  2012.XLS]Stock Altered 1050'!F23) -> Pasttime | G20: ='\\SER\Software\other\[POINTS NQS  2012.XLS]Stock Altered 1050'!AA23 -> 20 | I20: ='\\SER\Software\other\[POINTS NQS  2012.XLS]Stock Altered 1100'!A23 -> 18 | J20: ='\\SER\Software\other\[POINTS NQS  2012.XLS]Stock Altered 1100'!B23 -> Gary Seaman | K20: ='\\SER\Software\other\[POINTS NQS  2012.XLS]Stock Altered 1100'!C23 -> Fleming, OH | L20: ='\\SER\Software\other\[POINTS NQS  2012.XLS]Stock Altered 1100'!D23 -> BJ | M20: ='\\SER\Software\other\[POINTS NQS  2012.XLS]Stock Altered 1100'!E23 -> 191 | N20: =IF('\\SER\Software\other\[POINTS NQS  2012.XLS]Stock Altered 1100'!F23=0," ",'\\SER\Software\other\[POINTS NQS  2012.XLS]Stock Altered 1100'!F23) -> Farmers Money | O20: ='\\SER\Software\other\[POINTS NQS  2012.XLS]Stock Altered 1100'!AA23 -> 22
A21: ='\\SER\Software\other\[POINTS NQS  2012.XLS]Stock Altered 1050'!A24 -> 19 | B21: ='\\SER\Software\other\[POINTS NQS  2012.XLS]Stock Altered 1050'!B24 -> Mike Yeley | C21: ='\\SER\Software\other\[POINTS NQS  2012.XLS]Stock Altered 1050'!C24 -> Hope, IN | D21: ='\\SER\Software\other\[POINTS NQS  2012.XLS]Stock Altered 1050'!D24 -> JW | E21: ='\\SER\Software\other\[POINTS NQS  2012.XLS]Stock Altered 1050'!E24 -> 55 | F21: =IF('\\SER\Software\other\[POINTS NQS  2012.XLS]Stock Altered 1050'!F24=0," ",'\\SER\Software\other\[POINTS NQS  2012.XLS]Stock Altered 1050'!F24) -> Papas Ride | G21: ='\\SER\Software\other\[POINTS NQS  2012.XLS]Stock Altered 1050'!AA24 -> 21 | I21: ='\\SER\Software\other\[POINTS NQS  2012.XLS]Stock Altered 1100'!A24 -> 19 | J21: ='\\SER\Software\other\[POINTS NQS  2012.XLS]Stock Altered 1100'!B24 -> Jerry Leonard | K21: ='\\SER\Software\other\[POINTS NQS  2012.XLS]Stock Altered 1100'!C24 -> Charleston, IL | L21: ='\\SER\Software\other\[POINTS NQS  2012.XLS]Stock Altered 1100'!D24 -> Vogel | M21: ='\\SER\Software\other\[POINTS NQS  2012.XLS]Stock Altered 1100'!E24 -> 308 | N21: =IF('\\SER\Software\other\[POINTS NQS  2012.XLS]Stock Altered 1100'!F24=0," ",'\\SER\Software\other\[POINTS NQS  2012.XLS]Stock Altered 1100'!F24) -> Histrung | O21: ='\\SER\Software\other\[POINTS NQS  2012.XLS]Stock Altered 1100'!AA24 -> 22
A22: ='\\SER\Software\other\[POINTS NQS  2012.XLS]Stock Altered 1050'!A25 -> 20 | B22: ='\\SER\Software\other\[POINTS NQS  2012.XLS]Stock Altered 1050'!B25 -> Eli Zimmerman | C22: ='\\SER\Software\other\[POINTS NQS  2012.XLS]Stock Altered 1050'!C25 -> Allentown, PA | D22: ='\\SER\Software\other\[POINTS NQS  2012.XLS]Stock Altered 1050'!D25 -> NP | E22: ='\\SER\Software\other\[POINTS NQS  2012.XLS]Stock Altered 1050'!E25 -> 75 | F22: =IF('\\SER\Software\other\[POINTS NQS  2012.XLS]Stock Altered 1050'!F25=0," ",'\\SER\Software\other\[POINTS NQS  2012.XLS]Stock Altered 1050'!F25) -> Red Fever | G22: ='\\SER\Software\other\[POINTS NQS  2012.XLS]Stock Altered 1050'!AA25 -> 22 | I22: ='\\SER\Software\other\[POINTS NQS  2012.XLS]Stock Altered 1100'!A25 -> 20 | J22: ='\\SER\Software\other\[POINTS NQS  2012.XLS]Stock Altered 1100'!B25 -> Gregory Vandervort | K22: ='\\SER\Software\other\[POINTS NQS  2012.XLS]Stock Altered 1100'!C25 -> Albion, PA | L22: ='\\SER\Software\other\[POINTS NQS  2012.XLS]Stock Altered 1100'!D25 -> TV | M22: ='\\SER\Software\other\[POINTS NQS  2012.XLS]Stock Altered 1100'!E25 -> 346 | N22: =IF('\\SER\Software\other\[POINTS NQS  2012.XLS]Stock Altered 1100'!F25=0," ",'\\SER\Software\other\[POINTS NQS  2012.XLS]Stock Altered 1100'!F25) -> Yellow Cub | O22: ='\\SER\Software\other\[POINTS NQS  2012.XLS]Stock Altered 1100'!AA25 -> 22
A23: ='\\SER\Software\other\[POINTS NQS  2012.XLS]Stock Altered 1050'!A26 -> 21 | B23: ='\\SER\Software\other\[POINTS NQS  2012.XLS]Stock Altered 1050'!B26 -> Roger McKinney | C23: ='\\SER\Software\other\[POINTS NQS  2012.XLS]Stock Altered 1050'!C26 -> Lake Ariel, PA | D23: ='\\SER\Software\other\[POINTS NQS  2012.XLS]Stock Altered 1050'!D26 -> JRS | E23: ='\\SER\Software\other\[POINTS NQS  2012.XLS]Stock Altered 1050'!E26 -> 83 | F23: =IF('\\SER\Software\other\[POINTS NQS  2012.XLS]Stock Altered 1050'!F26=0," ",'\\SER\Software\other\[POINTS NQS  2012.XLS]Stock Altered 1050'!F26) -> Blue Thunder | G23: ='\\SER\Software\other\[POINTS NQS  2012.XLS]Stock Altered 1050'!AA26 -> 22 | I23: ='\\SER\Software\other\[POINTS NQS  2012.XLS]Stock Altered 1100'!A26 -> 21 | J23: ='\\SER\Software\other\[POINTS NQS  2012.XLS]Stock Altered 1100'!B26 -> Chris Gegg | K23: ='\\SER\Software\other\[POINTS NQS  2012.XLS]Stock Altered 1100'!C26 -> Greenville, IL | L23: ='\\SER\Software\other\[POINTS NQS  2012.XLS]Stock Altered 1100'!D26 -> JRS | M23: ='\\SER\Software\other\[POINTS NQS  2012.XLS]Stock Altered 1100'!E26 -> 410 | N23: =IF('\\SER\Software\other\[POINTS NQS  2012.XLS]Stock Altered 1100'!F26=0," ",'\\SER\Software\other\[POINTS NQS  2012.XLS]Stock Altered 1100'!F26) -> Insane | O23: ='\\SER\Software\other\[POINTS NQS  2012.XLS]Stock Altered 1100'!AA26 -> 22
A24: ='\\SER\Software\other\[POINTS NQS  2012.XLS]Stock Altered 1050'!A27 -> 22 | B24: ='\\SER\Software\other\[POINTS NQS  2012.XLS]Stock Altered 1050'!B27 -> Dave Washburn | C24: ='\\SER\Software\other\[POINTS NQS  2012.XLS]Stock Altered 1050'!C27 -> Guysville, OH | D24: ='\\SER\Software\other\[POINTS NQS  2012.XLS]Stock Altered 1050'!D27 -> BJ | E24: ='\\SER\Software\other\[POINTS NQS  2012.XLS]Stock Altered 1050'!E27 -> 156 | F24: =IF('\\SER\Software\other\[POINTS NQS  2012.XLS]Stock Altered 1050'!F27=0," ",'\\SER\Software\other\[POINTS NQS  2012.XLS]Stock Altered 1050'!F27) -> Last Minute | G24: ='\\SER\Software\other\[POINTS NQS  2012.XLS]Stock Altered 1050'!AA27 -> 24 | I24: ='\\SER\Software\other\[POINTS NQS  2012.XLS]Stock Altered 1100'!A27 -> 22 | J24: ='\\SER\Software\other\[POINTS NQS  2012.XLS]Stock Altered 1100'!B27 -> Judy Lowe | K24: ='\\SER\Software\other\[POINTS NQS  2012.XLS]Stock Altered 1100'!C27 -> Urbana, OH | L24: ='\\SER\Software\other\[POINTS NQS  2012.XLS]Stock Altered 1100'!D27 -> TV | M24: ='\\SER\Software\other\[POINTS NQS  2012.XLS]Stock Altered 1100'!E27 -> 10 | N24: =IF('\\SER\Software\other\[POINTS NQS  2012.XLS]Stock Altered 1100'!F27=0," ",'\\SER\Software\other\[POINTS NQS  2012.XLS]Stock Altered 1100'!F27) -> SlowMotion | O24: ='\\SER\Software\other\[POINTS NQS  2012.XLS]Stock Altered 1100'!AA27 -> 27
A25: ='\\SER\Software\other\[POINTS NQS  2012.XLS]Stock Altered 1050'!A28 -> 23 | B25: ='\\SER\Software\other\[POINTS NQS  2012.XLS]Stock Altered 1050'!B28 -> Judy Lowe | C25: ='\\SER\Software\other\[POINTS NQS  2012.XLS]Stock Altered 1050'!C28 -> Urbana, OH | D25: ='\\SER\Software\other\[POINTS NQS  2012.XLS]Stock Altered 1050'!D28 -> TV | E25: ='\\SER\Software\other\[POINTS NQS  2012.XLS]Stock Altered 1050'!E28 -> 10 | F25: =IF('\\SER\Software\other\[POINTS NQS  2012.XLS]Stock Altered 1050'!F28=0," ",'\\SER\Software\other\[POINTS NQS  2012.XLS]Stock Altered 1050'!F28) -> SlowMotion | G25: ='\\SER\Software\other\[POINTS NQS  2012.XLS]Stock Altered 1050'!AA28 -> 25 | I25: ='\\SER\Software\other\[POINTS NQS  2012.XLS]Stock Altered 1100'!A28 -> 23 | J25: ='\\SER\Software\other\[POINTS NQS  2012.XLS]Stock Altered 1100'!B28 -> Ron Hodge | K25: ='\\SER\Software\other\[POINTS NQS  2012.XLS]Stock Altered 1100'!C28 -> Hillsboro, OH | L25: ='\\SER\Software\other\[POINTS NQS  2012.XLS]Stock Altered 1100'!D28 -> TV | M25: ='\\SER\Software\other\[POINTS NQS  2012.XLS]Stock Altered 1100'!E28 -> 71 | N25: =IF('\\SER\Software\other\[POINTS NQS  2012.XLS]Stock Altered 1100'!F28=0," ",'\\SER\Software\other\[POINTS NQS  2012.XLS]Stock Altered 1100'!F28) -> Take-N-Names | O25: ='\\SER\Software\other\[POINTS NQS  2012.XLS]Stock Altered 1100'!AA28 -> 27
A26: ='\\SER\Software\other\[POINTS NQS  2012.XLS]Stock Altered 1050'!A29 -> 24 | B26: ='\\SER\Software\other\[POINTS NQS  2012.XLS]Stock Altered 1050'!B29 -> Doug Seaman | C26: ='\\SER\Software\other\[POINTS NQS  2012.XLS]Stock Altered 1050'!C29 -> Vincent, OH | D26: ='\\SER\Software\other\[POINTS NQS  2012.XLS]Stock Altered 1050'!D29 -> BJ | E26: ='\\SER\Software\other\[POINTS NQS  2012.XLS]Stock Altered 1050'!E29 -> 192 | F26: =IF('\\SER\Software\other\[POINTS NQS  2012.XLS]Stock Altered 1050'!F29=0," ",'\\SER\Software\other\[POINTS NQS  2012.XLS]Stock Altered 1050'!F29) -> Massey Ferguson | G26: ='\\SER\Software\other\[POINTS NQS  2012.XLS]Stock Altered 1050'!AA29 -> 26 | I26: ='\\SER\Software\other\[POINTS NQS  2012.XLS]Stock Altered 1100'!A29 -> 24 | J26: ='\\SER\Software\other\[POINTS NQS  2012.XLS]Stock Altered 1100'!B29 -> Nevin Stitzer | K26: ='\\SER\Software\other\[POINTS NQS  2012.XLS]Stock Altered 1100'!C29 -> Spring Mills, PA | L26: ='\\SER\Software\other\[POINTS NQS  2012.XLS]Stock Altered 1100'!D29 -> BJ | M26: ='\\SER\Software\other\[POINTS NQS  2012.XLS]Stock Altered 1100'!E29 -> 447 | N26: =IF('\\SER\Software\other\[POINTS NQS  2012.XLS]Stock Altered 1100'!F29=0," ",'\\SER\Software\other\[POINTS NQS  2012.XLS]Stock Altered 1100'!F29) -> Thunder Road | O26: ='\\SER\Software\other\[POINTS NQS  2012.XLS]Stock Altered 1100'!AA29 -> 27
A27: ='\\SER\Software\other\[POINTS NQS  2012.XLS]Stock Altered 1050'!A30 -> 25 | B27: ='\\SER\Software\other\[POINTS NQS  2012.XLS]Stock Altered 1050'!B30 -> Randy Demers | C27: ='\\SER\Software\other\[POINTS NQS  2012.XLS]Stock Altered 1050'!C30 -> Columbia, NJ | D27: ='\\SER\Software\other\[POINTS NQS  2012.XLS]Stock Altered 1050'!D30 -> NP | E27: ='\\SER\Software\other\[POINTS NQS  2012.XLS]Stock Altered 1050'!E30 -> 84 | F27: =IF('\\SER\Software\other\[POINTS NQS  2012.XLS]Stock Altered 1050'!F30=0," ",'\\SER\Software\other\[POINTS NQS  2012.XLS]Stock Altered 1050'!F30) -> Bounty Hunter | G27: ='\\SER\Software\other\[POINTS NQS  2012.XLS]Stock Altered 1050'!AA30 -> 29 | I27: ='\\SER\Software\other\[POINTS NQS  2012.XLS]Stock Altered 1100'!A30 -> 25 | J27: ='\\SER\Software\other\[POINTS NQS  2012.XLS]Stock Altered 1100'!B30 -> Lee Dewald | K27: ='\\SER\Software\other\[POINTS NQS  2012.XLS]Stock Altered 1100'!C30 -> Tiffon, OH | L27: ='\\SER\Software\other\[POINTS NQS  2012.XLS]Stock Altered 1100'!D30 -> NP | M27: ='\\SER\Software\other\[POINTS NQS  2012.XLS]Stock Altered 1100'!E30 -> 465 | N27: =IF('\\SER\Software\other\[POINTS NQS  2012.XLS]Stock Altered 1100'!F30=0," ",'\\SER\Software\other\[POINTS NQS  2012.XLS]Stock Altered 1100'!F30) -> Barnyard Bandit | O27: ='\\SER\Software\other\[POINTS NQS  2012.XLS]Stock Altered 1100'!AA30 -> 27
A28: ='\\SER\Software\other\[POINTS NQS  2012.XLS]Stock Altered 1050'!A31 -> 26 | B28: ='\\SER\Software\other\[POINTS NQS  2012.XLS]Stock Altered 1050'!B31 -> Les Salyers | C28: ='\\SER\Software\other\[POINTS NQS  2012.XLS]Stock Altered 1050'!C31 -> Sidney, OH | D28: ='\\SER\Software\other\[POINTS NQS  2012.XLS]Stock Altered 1050'!D31 -> TV | E28: ='\\SER\Software\other\[POINTS NQS  2012.XLS]Stock Altered 1050'!E31 -> 444 | F28: =IF('\\SER\Software\other\[POINTS NQS  2012.XLS]Stock Altered 1050'!F31=0," ",'\\SER\Software\other\[POINTS NQS  2012.XLS]Stock Altered 1050'!F31) -> Unfinished Business | G28: ='\\SER\Software\other\[POINTS NQS  2012.XLS]Stock Altered 1050'!AA31 -> 29 | I28: ='\\SER\Software\other\[POINTS NQS  2012.XLS]Stock Altered 1100'!A31 -> 26 | J28: ='\\SER\Software\other\[POINTS NQS  2012.XLS]Stock Altered 1100'!B31 -> Shane Hadley | K28: ='\\SER\Software\other\[POINTS NQS  2012.XLS]Stock Altered 1100'!C31 -> Marion, NY | L28: ='\\SER\Software\other\[POINTS NQS  2012.XLS]Stock Altered 1100'!D31 -> LR | M28: ='\\SER\Software\other\[POINTS NQS  2012.XLS]Stock Altered 1100'!E31 -> 442 | N28: =IF('\\SER\Software\other\[POINTS NQS  2012.XLS]Stock Altered 1100'!F31=0," ",'\\SER\Software\other\[POINTS NQS  2012.XLS]Stock Altered 1100'!F31) -> Foot Finder | O28: ='\\SER\Software\other\[POINTS NQS  2012.XLS]Stock Altered 1100'!AA31 -> 28
A29: ='\\SER\Software\other\[POINTS NQS  2012.XLS]Stock Altered 1050'!A32 -> 27 | B29: ='\\SER\Software\other\[POINTS NQS  2012.XLS]Stock Altered 1050'!B32 -> Mike McGaha | C29: ='\\SER\Software\other\[POINTS NQS  2012.XLS]Stock Altered 1050'!C32 -> Hope, IN | D29: ='\\SER\Software\other\[POINTS NQS  2012.XLS]Stock Altered 1050'!D32 -> JW | E29: ='\\SER\Software\other\[POINTS NQS  2012.XLS]Stock Altered 1050'!E32 -> 288 | F29: =IF('\\SER\Software\other\[POINTS NQS  2012.XLS]Stock Altered 1050'!F32=0," ",'\\SER\Software\other\[POINTS NQS  2012.XLS]Stock Altered 1050'!F32) -> Company Time | G29: ='\\SER\Software\other\[POINTS NQS  2012.XLS]Stock Altered 1050'!AA32 -> 30 | I29: ='\\SER\Software\other\[POINTS NQS  2012.XLS]Stock Altered 1100'!A32 -> 27 | J29: ='\\SER\Software\other\[POINTS NQS  2012.XLS]Stock Altered 1100'!B32 -> Kelly Nichols | K29: ='\\SER\Software\other\[POINTS NQS  2012.XLS]Stock Altered 1100'!C32 -> Lore City, OH | L29: ='\\SER\Software\other\[POINTS NQS  2012.XLS]Stock Altered 1100'!D32 -> NP | M29: ='\\SER\Software\other\[POINTS NQS  2012.XLS]Stock Altered 1100'!E32 -> 358 | N29: =IF('\\SER\Software\other\[POINTS NQS  2012.XLS]Stock Altered 1100'!F32=0," ",'\\SER\Software\other\[POINTS NQS  2012.XLS]Stock Altered 1100'!F32) -> Maxx'd Out | O29: ='\\SER\Software\other\[POINTS NQS  2012.XLS]Stock Altered 1100'!AA32 -> 29
A30: ='\\SER\Software\other\[POINTS NQS  2012.XLS]Stock Altered 1050'!A33 -> 28 | B30: ='\\SER\Software\other\[POINTS NQS  2012.XLS]Stock Altered 1050'!B33 -> Lee Dewald | C30: ='\\SER\Software\other\[POINTS NQS  2012.XLS]Stock Altered 1050'!C33 -> Tiffon, OH | D30: ='\\SER\Software\other\[POINTS NQS  2012.XLS]Stock Altered 1050'!D33 -> NP | E30: ='\\SER\Software\other\[POINTS NQS  2012.XLS]Stock Altered 1050'!E33 -> 465 | F30: =IF('\\SER\Software\other\[POINTS NQS  2012.XLS]Stock Altered 1050'!F33=0," ",'\\SER\Software\other\[POINTS NQS  2012.XLS]Stock Altered 1050'!F33) -> Barnyard Bandit | G30: ='\\SER\Software\other\[POINTS NQS  2012.XLS]Stock Altered 1050'!AA33 -> 31 | I30: ='\\SER\Software\other\[POINTS NQS  2012.XLS]Stock Altered 1100'!A33 -> 28 | J30: ='\\SER\Software\other\[POINTS NQS  2012.XLS]Stock Altered 1100'!B33 -> John Dewald | K30: ='\\SER\Software\other\[POINTS NQS  2012.XLS]Stock Altered 1100'!C33 -> Tiffon, OH | L30: ='\\SER\Software\other\[POINTS NQS  2012.XLS]Stock Altered 1100'!D33 -> RPM | M30: ='\\SER\Software\other\[POINTS NQS  2012.XLS]Stock Altered 1100'!E33 -> 484 | N30: =IF('\\SER\Software\other\[POINTS NQS  2012.XLS]Stock Altered 1100'!F33=0," ",'\\SER\Software\other\[POINTS NQS  2012.XLS]Stock Altered 1100'!F33) -> Patience | O30: ='\\SER\Software\other\[POINTS NQS  2012.XLS]Stock Altered 1100'!AA33 -> 32
A31: ='\\SER\Software\other\[POINTS NQS  2012.XLS]Stock Altered 1050'!A34 -> 29 | B31: ='\\SER\Software\other\[POINTS NQS  2012.XLS]Stock Altered 1050'!B34 -> John Elrod | C31: ='\\SER\Software\other\[POINTS NQS  2012.XLS]Stock Altered 1050'!C34 -> Salem, IN | D31: ='\\SER\Software\other\[POINTS NQS  2012.XLS]Stock Altered 1050'!D34 -> TV | E31: ='\\SER\Software\other\[POINTS NQS  2012.XLS]Stock Altered 1050'!E34 -> 20 | F31: =IF('\\SER\Software\other\[POINTS NQS  2012.XLS]Stock Altered 1050'!F34=0," ",'\\SER\Software\other\[POINTS NQS  2012.XLS]Stock Altered 1050'!F34) -> Bad Habit | G31: ='\\SER\Software\other\[POINTS NQS  2012.XLS]Stock Altered 1050'!AA34 -> 46 | I31: ='\\SER\Software\other\[POINTS NQS  2012.XLS]Stock Altered 1100'!A34 -> 29 | J31: ='\\SER\Software\other\[POINTS NQS  2012.XLS]Stock Altered 1100'!B34 -> John Elrod | K31: ='\\SER\Software\other\[POINTS NQS  2012.XLS]Stock Altered 1100'!C34 -> Salem, IN | L31: ='\\SER\Software\other\[POINTS NQS  2012.XLS]Stock Altered 1100'!D34 -> TV | M31: ='\\SER\Software\other\[POINTS NQS  2012.XLS]Stock Altered 1100'!E34 -> 20 | N31: =IF('\\SER\Software\other\[POINTS NQS  2012.XLS]Stock Altered 1100'!F34=0," ",'\\SER\Software\other\[POINTS NQS  2012.XLS]Stock Altered 1100'!F34) -> Bad Habit | O31: ='\\SER\Software\other\[POINTS NQS  2012.XLS]Stock Altered 1100'!AA34 -> 47
A32: ='\\SER\Software\other\[POINTS NQS  2012.XLS]Stock Altered 1050'!A35 -> 30 | B32: ='\\SER\Software\other\[POINTS NQS  2012.XLS]Stock Altered 1050'!B35 -> Lonnie Lewis | C32: ='\\SER\Software\other\[POINTS NQS  2012.XLS]Stock Altered 1050'!C35 -> Milford, OH | D32: ='\\SER\Software\other\[POINTS NQS  2012.XLS]Stock Altered 1050'!D35 -> TV | E32: ='\\SER\Software\other\[POINTS NQS  2012.XLS]Stock Altered 1050'!E35 -> 24 | F32: =IF('\\SER\Software\other\[POINTS NQS  2012.XLS]Stock Altered 1050'!F35=0," ",'\\SER\Software\other\[POINTS NQS  2012.XLS]Stock Altered 1050'!F35) -> Deuces Wild | G32: ='\\SER\Software\other\[POINTS NQS  2012.XLS]Stock Altered 1050'!AA35 -> 46 | I32: ='\\SER\Software\other\[POINTS NQS  2012.XLS]Stock Altered 1100'!A35 -> 30 | J32: ='\\SER\Software\other\[POINTS NQS  2012.XLS]Stock Altered 1100'!B35 -> Roger McKinney | K32: ='\\SER\Software\other\[POINTS NQS  2012.XLS]Stock Altered 1100'!C35 -> Greenville, IL | L32: ='\\SER\Software\other\[POINTS NQS  2012.XLS]Stock Altered 1100'!D35 -> JRS | M32: ='\\SER\Software\other\[POINTS NQS  2012.XLS]Stock Altered 1100'!E35 -> 83 | N32: =IF('\\SER\Software\other\[POINTS NQS  2012.XLS]Stock Altered 1100'!F35=0," ",'\\SER\Software\other\[POINTS NQS  2012.XLS]Stock Altered 1100'!F35) -> Blue Thunder | O32: ='\\SER\Software\other\[POINTS NQS  2012.XLS]Stock Altered 1100'!AA35 -> 47
A33: ='\\SER\Software\other\[POINTS NQS  2012.XLS]Stock Altered 1050'!A36 -> 31 | B33: ='\\SER\Software\other\[POINTS NQS  2012.XLS]Stock Altered 1050'!B36 -> Cody Costa | C33: ='\\SER\Software\other\[POINTS NQS  2012.XLS]Stock Altered 1050'!C36 -> Greencastle, PA | D33: ='\\SER\Software\other\[POINTS NQS  2012.XLS]Stock Altered 1050'!D36 -> NP | E33: ='\\SER\Software\other\[POINTS NQS  2012.XLS]Stock Altered 1050'!E36 -> 135 | F33: =IF('\\SER\Software\other\[POINTS NQS  2012.XLS]Stock Altered 1050'!F36=0," ",'\\SER\Software\other\[POINTS NQS  2012.XLS]Stock Altered 1050'!F36) -> Wild Child | G33: ='\\SER\Software\other\[POINTS NQS  2012.XLS]Stock Altered 1050'!AA36 -> 46 | I33: ='\\SER\Software\other\[POINTS NQS  2012.XLS]Stock Altered 1100'!A36 -> 31 | J33: ='\\SER\Software\other\[POINTS NQS  2012.XLS]Stock Altered 1100'!B36 -> Bob Jones SR | K33: ='\\SER\Software\other\[POINTS NQS  2012.XLS]Stock Altered 1100'!C36 -> Hopewell, OH | L33: ='\\SER\Software\other\[POINTS NQS  2012.XLS]Stock Altered 1100'!D36 -> BJ | M33: ='\\SER\Software\other\[POINTS NQS  2012.XLS]Stock Altered 1100'!E36 -> 182 | N33: =IF('\\SER\Software\other\[POINTS NQS  2012.XLS]Stock Altered 1100'!F36=0," ",'\\SER\Software\other\[POINTS NQS  2012.XLS]Stock Altered 1100'!F36) -> Buckeye Binder | O33: ='\\SER\Software\other\[POINTS NQS  2012.XLS]Stock Altered 1100'!AA36 -> 47
A34: ='\\SER\Software\other\[POINTS NQS  2012.XLS]Stock Altered 1050'!A37 -> 32 | B34: ='\\SER\Software\other\[POINTS NQS  2012.XLS]Stock Altered 1050'!B37 -> Bobby Feldkamp | C34: ='\\SER\Software\other\[POINTS NQS  2012.XLS]Stock Altered 1050'!C37 -> Milan, MI | D34: ='\\SER\Software\other\[POINTS NQS  2012.XLS]Stock Altered 1050'!D37 -> Woods | E34: ='\\SER\Software\other\[POINTS NQS  2012.XLS]Stock Altered 1050'!E37 -> 287 | F34: =IF('\\SER\Software\other\[POINTS NQS  2012.XLS]Stock Altered 1050'!F37=0," ",'\\SER\Software\other\[POINTS NQS  2012.XLS]Stock Altered 1050'!F37) -> Incognito | G34: ='\\SER\Software\other\[POINTS NQS  2012.XLS]Stock Altered 1050'!AA37 -> 46 | I34: ='\\SER\Software\other\[POINTS NQS  2012.XLS]Stock Altered 1100'!A37 -> 32 | J34: ='\\SER\Software\other\[POINTS NQS  2012.XLS]Stock Altered 1100'!B37 -> Bob Jones JR | K34: ='\\SER\Software\other\[POINTS NQS  2012.XLS]Stock Altered 1100'!C37 -> Hopewell, OH | L34: ='\\SER\Software\other\[POINTS NQS  2012.XLS]Stock Altered 1100'!D37 -> BJ | M34: ='\\SER\Software\other\[POINTS NQS  2012.XLS]Stock Altered 1100'!E37 -> 183 | N34: =IF('\\SER\Software\other\[POINTS NQS  2012.XLS]Stock Altered 1100'!F37=0," ",'\\SER\Software\other\[POINTS NQS  2012.XLS]Stock Altered 1100'!F37) -> Playdough | O34: ='\\SER\Software\other\[POINTS NQS  2012.XLS]Stock Altered 1100'!AA37 -> 47
A35: ='\\SER\Software\other\[POINTS NQS  2012.XLS]Stock Altered 1050'!A38 -> 33 | B35: ='\\SER\Software\other\[POINTS NQS  2012.XLS]Stock Altered 1050'!B38 -> Bill Elrod | C35: ='\\SER\Software\other\[POINTS NQS  2012.XLS]Stock Altered 1050'!C38 -> Salem, IN | D35: ='\\SER\Software\other\[POINTS NQS  2012.XLS]Stock Altered 1050'!D38 -> TV | E35: ='\\SER\Software\other\[POINTS NQS  2012.XLS]Stock Altered 1050'!E38 -> 21 | F35: =IF('\\SER\Software\other\[POINTS NQS  2012.XLS]Stock Altered 1050'!F38=0," ",'\\SER\Software\other\[POINTS NQS  2012.XLS]Stock Altered 1050'!F38) -> Pa Paw Toy | G35: ='\\SER\Software\other\[POINTS NQS  2012.XLS]Stock Altered 1050'!AA38 -> 47 | I35: ='\\SER\Software\other\[POINTS NQS  2012.XLS]Stock Altered 1100'!A38 -> 33 | J35: ='\\SER\Software\other\[POINTS NQS  2012.XLS]Stock Altered 1100'!B38 -> Mike McGaha | K35: ='\\SER\Software\other\[POINTS NQS  2012.XLS]Stock Altered 1100'!C38 -> Hope, IN | L35: ='\\SER\Software\other\[POINTS NQS  2012.XLS]Stock Altered 1100'!D38 -> JW | M35: ='\\SER\Software\other\[POINTS NQS  2012.XLS]Stock Altered 1100'!E38 -> 288 | N35: =IF('\\SER\Software\other\[POINTS NQS  2012.XLS]Stock Altered 1100'!F38=0," ",'\\SER\Software\other\[POINTS NQS  2012.XLS]Stock Altered 1100'!F38) -> Company Time | O35: ='\\SER\Software\other\[POINTS NQS  2012.XLS]Stock Altered 1100'!AA38 -> 47
A36: ='\\SER\Software\other\[POINTS NQS  2012.XLS]Stock Altered 1050'!A39 -> 34 | B36: ='\\SER\Software\other\[POINTS NQS  2012.XLS]Stock Altered 1050'!B39 -> Bob Jones JR | C36: ='\\SER\Software\other\[POINTS NQS  2012.XLS]Stock Altered 1050'!C39 -> Hopewell, OH | D36: ='\\SER\Software\other\[POINTS NQS  2012.XLS]Stock Altered 1050'!D39 -> BJ | E36: ='\\SER\Software\other\[POINTS NQS  2012.XLS]Stock Altered 1050'!E39 -> 183 | F36: =IF('\\SER\Software\other\[POINTS NQS  2012.XLS]Stock Altered 1050'!F39=0," ",'\\SER\Software\other\[POINTS NQS  2012.XLS]Stock Altered 1050'!F39) -> Playdough | G36: ='\\SER\Software\other\[POINTS NQS  2012.XLS]Stock Altered 1050'!AA39 -> 47 | I36: ='\\SER\Software\other\[POINTS NQS  2012.XLS]Stock Altered 1100'!A39 -> 34 | J36: ='\\SER\Software\other\[POINTS NQS  2012.XLS]Stock Altered 1100'!B39 -> Steve Chrisman | K36: ='\\SER\Software\other\[POINTS NQS  2012.XLS]Stock Altered 1100'!C39 -> Edinburg, IN | L36: ='\\SER\Software\other\[POINTS NQS  2012.XLS]Stock Altered 1100'!D39 -> Hackman | M36: ='\\SER\Software\other\[POINTS NQS  2012.XLS]Stock Altered 1100'!E39 -> 22 | N36: =IF('\\SER\Software\other\[POINTS NQS  2012.XLS]Stock Altered 1100'!F39=0," ",'\\SER\Software\other\[POINTS NQS  2012.XLS]Stock Altered 1100'!F39) -> Razzmatazz | O36: ='\\SER\Software\other\[POINTS NQS  2012.XLS]Stock Altered 1100'!AA39 -> 48
A37: ='\\SER\Software\other\[POINTS NQS  2012.XLS]Stock Altered 1050'!A40 -> 35 | B37: ='\\SER\Software\other\[POINTS NQS  2012.XLS]Stock Altered 1050'!B40 -> Mark Peters | C37: ='\\SER\Software\other\[POINTS NQS  2012.XLS]Stock Altered 1050'!C40 -> McArthur, PA | D37: ='\\SER\Software\other\[POINTS NQS  2012.XLS]Stock Altered 1050'!D40 -> JRS | E37: ='\\SER\Software\other\[POINTS NQS  2012.XLS]Stock Altered 1050'!E40 -> 469 | F37: =IF('\\SER\Software\other\[POINTS NQS  2012.XLS]Stock Altered 1050'!F40=0," ",'\\SER\Software\other\[POINTS NQS  2012.XLS]Stock Altered 1050'!F40) -> American Ride | G37: ='\\SER\Software\other\[POINTS NQS  2012.XLS]Stock Altered 1050'!AA40 -> 47 | I37: ='\\SER\Software\other\[POINTS NQS  2012.XLS]Stock Altered 1100'!A40 -> 35 | J37: ='\\SER\Software\other\[POINTS NQS  2012.XLS]Stock Altered 1100'!B40 -> Gregory Heifner | K37: ='\\SER\Software\other\[POINTS NQS  2012.XLS]Stock Altered 1100'!C40 -> Jeromesville, OH | L37: ='\\SER\Software\other\[POINTS NQS  2012.XLS]Stock Altered 1100'!D40 -> TH | M37: ='\\SER\Software\other\[POINTS NQS  2012.XLS]Stock Altered 1100'!E40 -> 231 | N37: =IF('\\SER\Software\other\[POINTS NQS  2012.XLS]Stock Altered 1100'!F40=0," ",'\\SER\Software\other\[POINTS NQS  2012.XLS]Stock Altered 1100'!F40) -> Instigator | O37: ='\\SER\Software\other\[POINTS NQS  2012.XLS]Stock Altered 1100'!AA40 -> 48
A38: ='\\SER\Software\other\[POINTS NQS  2012.XLS]Stock Altered 1050'!A41 -> 36 | B38: ='\\SER\Software\other\[POINTS NQS  2012.XLS]Stock Altered 1050'!B41 -> John Dewald | C38: ='\\SER\Software\other\[POINTS NQS  2012.XLS]Stock Altered 1050'!C41 -> Tiffon, OH | D38: ='\\SER\Software\other\[POINTS NQS  2012.XLS]Stock Altered 1050'!D41 -> RPM | E38: ='\\SER\Software\other\[POINTS NQS  2012.XLS]Stock Altered 1050'!E41 -> 484 | F38: =IF('\\SER\Software\other\[POINTS NQS  2012.XLS]Stock Altered 1050'!F41=0," ",'\\SER\Software\other\[POINTS NQS  2012.XLS]Stock Altered 1050'!F41) -> Patience | G38: ='\\SER\Software\other\[POINTS NQS  2012.XLS]Stock Altered 1050'!AA41 -> 47 | I38: ='\\SER\Software\other\[POINTS NQS  2012.XLS]Stock Altered 1100'!A41 -> 36 | J38: ='\\SER\Software\other\[POINTS NQS  2012.XLS]Stock Altered 1100'!B41 -> Brian Bell | K38: ='\\SER\Software\other\[POINTS NQS  2012.XLS]Stock Altered 1100'!C41 -> Cynthiene, KY | L38: ='\\SER\Software\other\[POINTS NQS  2012.XLS]Stock Altered 1100'!D41 -> NP | M38: ='\\SER\Software\other\[POINTS NQS  2012.XLS]Stock Altered 1100'!E41 -> 510 | N38: =IF('\\SER\Software\other\[POINTS NQS  2012.XLS]Stock Altered 1100'!F41=0," ",'\\SER\Software\other\[POINTS NQS  2012.XLS]Stock Altered 1100'!F41) -> Grim Reaper | O38: ='\\SER\Software\other\[POINTS NQS  2012.XLS]Stock Altered 1100'!AA41 -> 48
A39: ='\\SER\Software\other\[POINTS NQS  2012.XLS]Stock Altered 1050'!A42 -> 37 | B39: ='\\SER\Software\other\[POINTS NQS  2012.XLS]Stock Altered 1050'!B42 -> Steve Chrisman | C39: ='\\SER\Software\other\[POINTS NQS  2012.XLS]Stock Altered 1050'!C42 -> Edinburg, IN | D39: ='\\SER\Software\other\[POINTS NQS  2012.XLS]Stock Altered 1050'!D42 -> Hackman | E39: ='\\SER\Software\other\[POINTS NQS  2012.XLS]Stock Altered 1050'!E42 -> 22 | F39: =IF('\\SER\Software\other\[POINTS NQS  2012.XLS]Stock Altered 1050'!F42=0," ",'\\SER\Software\other\[POINTS NQS  2012.XLS]Stock Altered 1050'!F42) -> Razzmatazz | G39: ='\\SER\Software\other\[POINTS NQS  2012.XLS]Stock Altered 1050'!AA42 -> 48 | I39: ='\\SER\Software\other\[POINTS NQS  2012.XLS]Stock Altered 1100'!A42 -> 37 | J39: ='\\SER\Software\other\[POINTS NQS  2012.XLS]Stock Altered 1100'!B42 -> Kenneth Smith | K39: ='\\SER\Software\other\[POINTS NQS  2012.XLS]Stock Altered 1100'!C42 -> Ashland, OH | L39: ='\\SER\Software\other\[POINTS NQS  2012.XLS]Stock Altered 1100'!D42 -> JRS | M39: ='\\SER\Software\other\[POINTS NQS  2012.XLS]Stock Altered 1100'!E42 -> 125 | N39: =IF('\\SER\Software\other\[POINTS NQS  2012.XLS]Stock Altered 1100'!F42=0," ",'\\SER\Software\other\[POINTS NQS  2012.XLS]Stock Altered 1100'!F42) -> Sidewinder | O39: ='\\SER\Software\other\[POINTS NQS  2012.XLS]Stock Altered 1100'!AA42 -> 49
A40: ='\\SER\Software\other\[POINTS NQS  2012.XLS]Stock Altered 1050'!A43 -> 38 | B40: ='\\SER\Software\other\[POINTS NQS  2012.XLS]Stock Altered 1050'!B43 -> Kenneth Smith | C40: ='\\SER\Software\other\[POINTS NQS  2012.XLS]Stock Altered 1050'!C43 -> Ashland, OH | D40: ='\\SER\Software\other\[POINTS NQS  2012.XLS]Stock Altered 1050'!D43 -> JRS | E40: ='\\SER\Software\other\[POINTS NQS  2012.XLS]Stock Altered 1050'!E43 -> 125 | F40: =IF('\\SER\Software\other\[POINTS NQS  2012.XLS]Stock Altered 1050'!F43=0," ",'\\SER\Software\other\[POINTS NQS  2012.XLS]Stock Altered 1050'!F43) -> Sidewinder | G40: ='\\SER\Software\other\[POINTS NQS  2012.XLS]Stock Altered 1050'!AA43 -> 48 | I40: ='\\SER\Software\other\[POINTS NQS  2012.XLS]Stock Altered 1100'!A43 -> 38 | J40: ='\\SER\Software\other\[POINTS NQS  2012.XLS]Stock Altered 1100'!B43 -> Gina McGaha | K40: ='\\SER\Software\other\[POINTS NQS  2012.XLS]Stock Altered 1100'!C43 -> Hope, IN | L40: ='\\SER\Software\other\[POINTS NQS  2012.XLS]Stock Altered 1100'!D43 -> JW | M40: ='\\SER\Software\other\[POINTS NQS  2012.XLS]Stock Altered 1100'!E43 -> 161 | N40: =IF('\\SER\Software\other\[POINTS NQS  2012.XLS]Stock Altered 1100'!F43=0," ",'\\SER\Software\other\[POINTS NQS  2012.XLS]Stock Altered 1100'!F43) -> Betty Stalker | O40: ='\\SER\Software\other\[POINTS NQS  2012.XLS]Stock Altered 1100'!AA43 -> 49
A41: ='\\SER\Software\other\[POINTS NQS  2012.XLS]Stock Altered 1050'!A44 -> 39 | B41: ='\\SER\Software\other\[POINTS NQS  2012.XLS]Stock Altered 1050'!B44 -> Gina McGaha | C41: ='\\SER\Software\other\[POINTS NQS  2012.XLS]Stock Altered 1050'!C44 -> Hope, IN | D41: ='\\SER\Software\other\[POINTS NQS  2012.XLS]Stock Altered 1050'!D44 -> JW | E41: ='\\SER\Software\other\[POINTS NQS  2012.XLS]Stock Altered 1050'!E44 -> 161 | F41: =IF('\\SER\Software\other\[POINTS NQS  2012.XLS]Stock Altered 1050'!F44=0," ",'\\SER\Software\other\[POINTS NQS  2012.XLS]Stock Altered 1050'!F44) -> Betty Stalker | G41: ='\\SER\Software\other\[POINTS NQS  2012.XLS]Stock Altered 1050'!AA44 -> 48 | I41: ='\\SER\Software\other\[POINTS NQS  2012.XLS]Stock Altered 1100'!A44 -> 39 | J41: ='\\SER\Software\other\[POINTS NQS  2012.XLS]Stock Altered 1100'!B44 -> Gary Frank | K41: ='\\SER\Software\other\[POINTS NQS  2012.XLS]Stock Altered 1100'!C44 -> Amanda, OH | L41: ='\\SER\Software\other\[POINTS NQS  2012.XLS]Stock Altered 1100'!D44 -> TV | M41: ='\\SER\Software\other\[POINTS NQS  2012.XLS]Stock Altered 1100'!E44 -> 233 | N41: =IF('\\SER\Software\other\[POINTS NQS  2012.XLS]Stock Altered 1100'!F44=0," ",'\\SER\Software\other\[POINTS NQS  2012.XLS]Stock Altered 1100'!F44) -> Katies Toy | O41: ='\\SER\Software\other\[POINTS NQS  2012.XLS]Stock Altered 1100'!AA44 -> 49
A42: ='\\SER\Software\other\[POINTS NQS  2012.XLS]Stock Altered 1050'!A45 -> 40 | B42: ='\\SER\Software\other\[POINTS NQS  2012.XLS]Stock Altered 1050'!B45 -> Clarence Bell | C42: ='\\SER\Software\other\[POINTS NQS  2012.XLS]Stock Altered 1050'!C45 -> West Salem, IL | D42: ='\\SER\Software\other\[POINTS NQS  2012.XLS]Stock Altered 1050'!D45 -> TC | E42: ='\\SER\Software\other\[POINTS NQS  2012.XLS]Stock Altered 1050'!E45 -> 466 | F42: =IF('\\SER\Software\other\[POINTS NQS  2012.XLS]Stock Altered 1050'!F45=0," ",'\\SER\Software\other\[POINTS NQS  2012.XLS]Stock Altered 1050'!F45) -> Money Pit | G42: ='\\SER\Software\other\[POINTS NQS  2012.XLS]Stock Altered 1050'!AA45 -> 48 | I42: ='\\SER\Software\other\[POINTS NQS  2012.XLS]Stock Altered 1100'!A45 -> 40 | J42: ='\\SER\Software\other\[POINTS NQS  2012.XLS]Stock Altered 1100'!B45 -> Waylan Nelson | K42: ='\\SER\Software\other\[POINTS NQS  2012.XLS]Stock Altered 1100'!C45 -> Shelby, IA | L42: ='\\SER\Software\other\[POINTS NQS  2012.XLS]Stock Altered 1100'!D45 -> Woods | M42: ='\\SER\Software\other\[POINTS NQS  2012.XLS]Stock Altered 1100'!E45 -> 499 | N42: =IF('\\SER\Software\other\[POINTS NQS  2012.XLS]Stock Altered 1100'!F45=0," ",'\\SER\Software\other\[POINTS NQS  2012.XLS]Stock Altered 1100'!F45) -> Close E Nuff | O42: ='\\SER\Software\other\[POINTS NQS  2012.XLS]Stock Altered 1100'!AA45 -> 49
A43: ='\\SER\Software\other\[POINTS NQS  2012.XLS]Stock Altered 1050'!A46 -> 41 | B43: ='\\SER\Software\other\[POINTS NQS  2012.XLS]Stock Altered 1050'!B46 -> Bob Jones SR | C43: ='\\SER\Software\other\[POINTS NQS  2012.XLS]Stock Altered 1050'!C46 -> Hopewell, OH | D43: ='\\SER\Software\other\[POINTS NQS  2012.XLS]Stock Altered 1050'!D46 -> BJ | E43: ='\\SER\Software\other\[POINTS NQS  2012.XLS]Stock Altered 1050'!E46 -> 182 | F43: =IF('\\SER\Software\other\[POINTS NQS  2012.XLS]Stock Altered 1050'!F46=0," ",'\\SER\Software\other\[POINTS NQS  2012.XLS]Stock Altered 1050'!F46) -> Buckeye Binder | G43: ='\\SER\Software\other\[POINTS NQS  2012.XLS]Stock Altered 1050'!AA46 -> 49 | I43: ='\\SER\Software\other\[POINTS NQS  2012.XLS]Stock Altered 1100'!A46 -> 41 | J43: ='\\SER\Software\other\[POINTS NQS  2012.XLS]Stock Altered 1100'!B46 -> Randy Demers | K43: ='\\SER\Software\other\[POINTS NQS  2012.XLS]Stock Altered 1100'!C46 -> Columbia, NJ | L43: ='\\SER\Software\other\[POINTS NQS  2012.XLS]Stock Altered 1100'!D46 -> NP | M43: ='\\SER\Software\other\[POINTS NQS  2012.XLS]Stock Altered 1100'!E46 -> 84 | N43: =IF('\\SER\Software\other\[POINTS NQS  2012.XLS]Stock Altered 1100'!F46=0," ",'\\SER\Software\other\[POINTS NQS  2012.XLS]Stock Altered 1100'!F46) -> Bounty Hunter | O43: ='\\SER\Software\other\[POINTS NQS  2012.XLS]Stock Altered 1100'!AA46 -> 50
A44: ='\\SER\Software\other\[POINTS NQS  2012.XLS]Stock Altered 1050'!A47 -> 42 | B44: ='\\SER\Software\other\[POINTS NQS  2012.XLS]Stock Altered 1050'!B47 -> Rick James | C44: ='\\SER\Software\other\[POINTS NQS  2012.XLS]Stock Altered 1050'!C47 -> Lancaster, OH | D44: ='\\SER\Software\other\[POINTS NQS  2012.XLS]Stock Altered 1050'!D47 -> BJ | E44: ='\\SER\Software\other\[POINTS NQS  2012.XLS]Stock Altered 1050'!E47 -> 427 | F44: =IF('\\SER\Software\other\[POINTS NQS  2012.XLS]Stock Altered 1050'!F47=0," ",'\\SER\Software\other\[POINTS NQS  2012.XLS]Stock Altered 1050'!F47) -> James Gang III | G44: ='\\SER\Software\other\[POINTS NQS  2012.XLS]Stock Altered 1050'!AA47 -> 49 | I44: ='\\SER\Software\other\[POINTS NQS  2012.XLS]Stock Altered 1100'!A47 -> 42 | J44: ='\\SER\Software\other\[POINTS NQS  2012.XLS]Stock Altered 1100'!B47 -> Bobby Feldkamp | K44: ='\\SER\Software\other\[POINTS NQS  2012.XLS]Stock Altered 1100'!C47 -> Milan, MI | L44: ='\\SER\Software\other\[POINTS NQS  2012.XLS]Stock Altered 1100'!D47 -> Woods | M44: ='\\SER\Software\other\[POINTS NQS  2012.XLS]Stock Altered 1100'!E47 -> 287 | N44: =IF('\\SER\Software\other\[POINTS NQS  2012.XLS]Stock Altered 1100'!F47=0," ",'\\SER\Software\other\[POINTS NQS  2012.XLS]Stock Altered 1100'!F47) -> Incognito | O44: ='\\SER\Software\other\[POINTS NQS  2012.XLS]Stock Altered 1100'!AA47 -> 50
A45: ='\\SER\Software\other\[POINTS NQS  2012.XLS]Stock Altered 1050'!A48 -> 43 | B45: ='\\SER\Software\other\[POINTS NQS  2012.XLS]Stock Altered 1050'!B48 -> Waylan Nelson | C45: ='\\SER\Software\other\[POINTS NQS  2012.XLS]Stock Altered 1050'!C48 -> Shelby, IA | D45: ='\\SER\Software\other\[POINTS NQS  2012.XLS]Stock Altered 1050'!D48 -> Woods | E45: ='\\SER\Software\other\[POINTS NQS  2012.XLS]Stock Altered 1050'!E48 -> 500 | F45: =IF('\\SER\Software\other\[POINTS NQS  2012.XLS]Stock Altered 1050'!F48=0," ",'\\SER\Software\other\[POINTS NQS  2012.XLS]Stock Altered 1050'!F48) -> Butt Ugly | G45: ='\\SER\Software\other\[POINTS NQS  2012.XLS]Stock Altered 1050'!AA48 -> 49 | I45: ='\\SER\Software\other\[POINTS NQS  2012.XLS]Stock Altered 1100'!A48 -> 43 | J45: ='\\SER\Software\other\[POINTS NQS  2012.XLS]Stock Altered 1100'!B48 -> Ed Kerner | K45: ='\\SER\Software\other\[POINTS NQS  2012.XLS]Stock Altered 1100'!C48 -> Kimball, MI | L45: ='\\SER\Software\other\[POINTS NQS  2012.XLS]Stock Altered 1100'!D48 -> NP | M45: ='\\SER\Software\other\[POINTS NQS  2012.XLS]Stock Altered 1100'!E48 -> 303 | N45: =IF('\\SER\Software\other\[POINTS NQS  2012.XLS]Stock Altered 1100'!F48=0," ",'\\SER\Software\other\[POINTS NQS  2012.XLS]Stock Altered 1100'!F48) -> Along for the Ride | O45: ='\\SER\Software\other\[POINTS NQS  2012.XLS]Stock Altered 1100'!AA48 -> 50
A46: ='\\SER\Software\other\[POINTS NQS  2012.XLS]Stock Altered 1050'!A49 -> 44 | B46: ='\\SER\Software\other\[POINTS NQS  2012.XLS]Stock Altered 1050'!B49 -> Brian Bell | C46: ='\\SER\Software\other\[POINTS NQS  2012.XLS]Stock Altered 1050'!C49 -> Cynthiene, KY | D46: ='\\SER\Software\other\[POINTS NQS  2012.XLS]Stock Altered 1050'!D49 -> NP | E46: ='\\SER\Software\other\[POINTS NQS  2012.XLS]Stock Altered 1050'!E49 -> 510 | F46: =IF('\\SER\Software\other\[POINTS NQS  2012.XLS]Stock Altered 1050'!F49=0," ",'\\SER\Software\other\[POINTS NQS  2012.XLS]Stock Altered 1050'!F49) -> Grim Reaper | G46: ='\\SER\Software\other\[POINTS NQS  2012.XLS]Stock Altered 1050'!AA49 -> 49 | I46: ='\\SER\Software\other\[POINTS NQS  2012.XLS]Stock Altered 1100'!A49 -> 44 | J46: ='\\SER\Software\other\[POINTS NQS  2012.XLS]Stock Altered 1100'!B49 -> Jill Chrisman | K46: ='\\SER\Software\other\[POINTS NQS  2012.XLS]Stock Altered 1100'!C49 -> Edinburgh,IN | L46: ='\\SER\Software\other\[POINTS NQS  2012.XLS]Stock Altered 1100'!D49 -> VM | M46: ='\\SER\Software\other\[POINTS NQS  2012.XLS]Stock Altered 1100'!E49 -> 179 | N46: =IF('\\SER\Software\other\[POINTS NQS  2012.XLS]Stock Altered 1100'!F49=0," ",'\\SER\Software\other\[POINTS NQS  2012.XLS]Stock Altered 1100'!F49) ->  | O46: ='\\SER\Software\other\[POINTS NQS  2012.XLS]Stock Altered 1100'!AA49 -> 50
A47: ='\\SER\Software\other\[POINTS NQS  2012.XLS]Stock Altered 1050'!A50 -> 45 | B47: ='\\SER\Software\other\[POINTS NQS  2012.XLS]Stock Altered 1050'!B50 -> Jerry Leonard | C47: ='\\SER\Software\other\[POINTS NQS  2012.XLS]Stock Altered 1050'!C50 -> Charleston, IL | D47: ='\\SER\Software\other\[POINTS NQS  2012.XLS]Stock Altered 1050'!D50 -> Vogel | E47: ='\\SER\Software\other\[POINTS NQS  2012.XLS]Stock Altered 1050'!E50 -> 308 | F47: =IF('\\SER\Software\other\[POINTS NQS  2012.XLS]Stock Altered 1050'!F50=0," ",'\\SER\Software\other\[POINTS NQS  2012.XLS]Stock Altered 1050'!F50) -> Histrung | G47: ='\\SER\Software\other\[POINTS NQS  2012.XLS]Stock Altered 1050'!AA50 -> 50 | I47: ='\\SER\Software\other\[POINTS NQS  2012.XLS]Stock Altered 1100'!A50 -> 45 | J47: ='\\SER\Software\other\[POINTS NQS  2012.XLS]Stock Altered 1100'!B50 -> Bill Elrod | K47: ='\\SER\Software\other\[POINTS NQS  2012.XLS]Stock Altered 1100'!C50 -> Salem, IN | L47: ='\\SER\Software\other\[POINTS NQS  2012.XLS]Stock Altered 1100'!D50 -> TV | M47: ='\\SER\Software\other\[POINTS NQS  2012.XLS]Stock Altered 1100'!E50 -> 21 | N47: =IF('\\SER\Software\other\[POINTS NQS  2012.XLS]Stock Altered 1100'!F50=0," ",'\\SER\Software\other\[POINTS NQS  2012.XLS]Stock Altered 1100'!F50) -> Pa Paw Toy | O47: ='\\SER\Software\other\[POINTS NQS  2012.XLS]Stock Altered 1100'!AA50 -> 51
A48: ='\\SER\Software\other\[POINTS NQS  2012.XLS]Stock Altered 1050'!A51 -> 46 | B48: ='\\SER\Software\other\[POINTS NQS  2012.XLS]Stock Altered 1050'!B51 -> Tod Hinkle | C48: ='\\SER\Software\other\[POINTS NQS  2012.XLS]Stock Altered 1050'!C51 -> Dongola, IA | D48: ='\\SER\Software\other\[POINTS NQS  2012.XLS]Stock Altered 1050'!D51 -> JW | E48: ='\\SER\Software\other\[POINTS NQS  2012.XLS]Stock Altered 1050'!E51 -> 370 | F48: =IF('\\SER\Software\other\[POINTS NQS  2012.XLS]Stock Altered 1050'!F51=0," ",'\\SER\Software\other\[POINTS NQS  2012.XLS]Stock Altered 1050'!F51) -> Disturbed | G48: ='\\SER\Software\other\[POINTS NQS  2012.XLS]Stock Altered 1050'!AA51 -> 50 | I48: ='\\SER\Software\other\[POINTS NQS  2012.XLS]Stock Altered 1100'!A51 -> 46 | J48: ='\\SER\Software\other\[POINTS NQS  2012.XLS]Stock Altered 1100'!B51 -> Jeremy Pierce | K48: ='\\SER\Software\other\[POINTS NQS  2012.XLS]Stock Altered 1100'!C51 -> Flat Rock, IN | L48: ='\\SER\Software\other\[POINTS NQS  2012.XLS]Stock Altered 1100'!D51 -> JP | M48: ='\\SER\Software\other\[POINTS NQS  2012.XLS]Stock Altered 1100'!E51 -> 362 | N48: =IF('\\SER\Software\other\[POINTS NQS  2012.XLS]Stock Altered 1100'!F51=0," ",'\\SER\Software\other\[POINTS NQS  2012.XLS]Stock Altered 1100'!F51) -> LunchMoney | O48: ='\\SER\Software\other\[POINTS NQS  2012.XLS]Stock Altered 1100'!AA51 -> 51
A49: ='\\SER\Software\other\[POINTS NQS  2012.XLS]Stock Altered 1050'!A52 -> 47 | B49: ='\\SER\Software\other\[POINTS NQS  2012.XLS]Stock Altered 1050'!B52 -> Jared Riddle | C49: ='\\SER\Software\other\[POINTS NQS  2012.XLS]Stock Altered 1050'!C52 -> Montgomery City, PA | D49: ='\\SER\Software\other\[POINTS NQS  2012.XLS]Stock Altered 1050'!D52 ->  | E49: ='\\SER\Software\other\[POINTS NQS  2012.XLS]Stock Altered 1050'!E52 -> 471 | F49: =IF('\\SER\Software\other\[POINTS NQS  2012.XLS]Stock Altered 1050'!F52=0," ",'\\SER\Software\other\[POINTS NQS  2012.XLS]Stock Altered 1050'!F52) -> Williemakit | G49: ='\\SER\Software\other\[POINTS NQS  2012.XLS]Stock Altered 1050'!AA52 -> 50 | I49: ='\\SER\Software\other\[POINTS NQS  2012.XLS]Stock Altered 1100'!A52 -> 47 | J49: ='\\SER\Software\other\[POINTS NQS  2012.XLS]Stock Altered 1100'!B52 -> Tod Hinkle | K49: ='\\SER\Software\other\[POINTS NQS  2012.XLS]Stock Altered 1100'!C52 -> Dongola, IA | L49: ='\\SER\Software\other\[POINTS NQS  2012.XLS]Stock Altered 1100'!D52 -> JW | M49: ='\\SER\Software\other\[POINTS NQS  2012.XLS]Stock Altered 1100'!E52 -> 370 | N49: =IF('\\SER\Software\other\[POINTS NQS  2012.XLS]Stock Altered 1100'!F52=0," ",'\\SER\Software\other\[POINTS NQS  2012.XLS]Stock Altered 1100'!F52) -> Disturbed | O49: ='\\SER\Software\other\[POINTS NQS  2012.XLS]Stock Altered 1100'!AA52 -> 51
A50: ='\\SER\Software\other\[POINTS NQS  2012.XLS]Stock Altered 1050'!A53 -> 48 | B50: ='\\SER\Software\other\[POINTS NQS  2012.XLS]Stock Altered 1050'!B53 -> Waylan Nelson | C50: ='\\SER\Software\other\[POINTS NQS  2012.XLS]Stock Altered 1050'!C53 -> Shelby, IA | D50: ='\\SER\Software\other\[POINTS NQS  2012.XLS]Stock Altered 1050'!D53 -> Woods | E50: ='\\SER\Software\other\[POINTS NQS  2012.XLS]Stock Altered 1050'!E53 -> 499 | F50: =IF('\\SER\Software\other\[POINTS NQS  2012.XLS]Stock Altered 1050'!F53=0," ",'\\SER\Software\other\[POINTS NQS  2012.XLS]Stock Altered 1050'!F53) -> Close E Nuff | G50: ='\\SER\Software\other\[POINTS NQS  2012.XLS]Stock Altered 1050'!AA53 -> 50 | I50: ='\\SER\Software\other\[POINTS NQS  2012.XLS]Stock Altered 1100'!A53 -> 48 | J50: ='\\SER\Software\other\[POINTS NQS  2012.XLS]Stock Altered 1100'!B53 -> Jim Hill | K50: ='\\SER\Software\other\[POINTS NQS  2012.XLS]Stock Altered 1100'!C53 -> Indianapolis, IN | L50: ='\\SER\Software\other\[POINTS NQS  2012.XLS]Stock Altered 1100'!D53 -> JW | M50: ='\\SER\Software\other\[POINTS NQS  2012.XLS]Stock Altered 1100'!E53 -> 515 | N50: =IF('\\SER\Software\other\[POINTS NQS  2012.XLS]Stock Altered 1100'!F53=0," ",'\\SER\Software\other\[POINTS NQS  2012.XLS]Stock Altered 1100'!F53) -> Run-N-Hot | O50: ='\\SER\Software\other\[POINTS NQS  2012.XLS]Stock Altered 1100'!AA53 -> 51
A51: ='\\SER\Software\other\[POINTS NQS  2012.XLS]Stock Altered 1050'!A54 -> 49 | B51: ='\\SER\Software\other\[POINTS NQS  2012.XLS]Stock Altered 1050'!B54 -> Gary Seaman | C51: ='\\SER\Software\other\[POINTS NQS  2012.XLS]Stock Altered 1050'!C54 -> Fleming, OH | D51: ='\\SER\Software\other\[POINTS NQS  2012.XLS]Stock Altered 1050'!D54 -> BJ | E51: ='\\SER\Software\other\[POINTS NQS  2012.XLS]Stock Altered 1050'!E54 -> 191 | F51: =IF('\\SER\Software\other\[POINTS NQS  2012.XLS]Stock Altered 1050'!F54=0," ",'\\SER\Software\other\[POINTS NQS  2012.XLS]Stock Altered 1050'!F54) -> Farmer's Money | G51: ='\\SER\Software\other\[POINTS NQS  2012.XLS]Stock Altered 1050'!AA54 -> 51 | I51: ='\\SER\Software\other\[POINTS NQS  2012.XLS]Stock Altered 1100'!A54 -> 49 | J51: ='\\SER\Software\other\[POINTS NQS  2012.XLS]Stock Altered 1100'!B54 -> Mike Yeley | K51: ='\\SER\Software\other\[POINTS NQS  2012.XLS]Stock Altered 1100'!C54 -> Hope, IN | L51: ='\\SER\Software\other\[POINTS NQS  2012.XLS]Stock Altered 1100'!D54 -> JW | M51: ='\\SER\Software\other\[POINTS NQS  2012.XLS]Stock Altered 1100'!E54 -> 55 | N51: =IF('\\SER\Software\other\[POINTS NQS  2012.XLS]Stock Altered 1100'!F54=0," ",'\\SER\Software\other\[POINTS NQS  2012.XLS]Stock Altered 1100'!F54) -> Outta Hope | O51: ='\\SER\Software\other\[POINTS NQS  2012.XLS]Stock Altered 1100'!AA54 -> 52
A52: ='\\SER\Software\other\[POINTS NQS  2012.XLS]Stock Altered 1050'!A55 -> 50 | B52: ='\\SER\Software\other\[POINTS NQS  2012.XLS]Stock Altered 1050'!B55 -> Gregory Heifner | C52: ='\\SER\Software\other\[POINTS NQS  2012.XLS]Stock Altered 1050'!C55 -> Jeromesville, OH | D52: ='\\SER\Software\other\[POINTS NQS  2012.XLS]Stock Altered 1050'!D55 -> TH | E52: ='\\SER\Software\other\[POINTS NQS  2012.XLS]Stock Altered 1050'!E55 -> 231 | F52: =IF('\\SER\Software\other\[POINTS NQS  2012.XLS]Stock Altered 1050'!F55=0," ",'\\SER\Software\other\[POINTS NQS  2012.XLS]Stock Altered 1050'!F55) -> Instigator | G52: ='\\SER\Software\other\[POINTS NQS  2012.XLS]Stock Altered 1050'!AA55 -> 51 | I52: ='\\SER\Software\other\[POINTS NQS  2012.XLS]Stock Altered 1100'!A55 -> 50 | J52: ='\\SER\Software\other\[POINTS NQS  2012.XLS]Stock Altered 1100'!B55 -> Greg Watson | K52: ='\\SER\Software\other\[POINTS NQS  2012.XLS]Stock Altered 1100'!C55 -> Batavia, OH | L52: ='\\SER\Software\other\[POINTS NQS  2012.XLS]Stock Altered 1100'!D55 -> NP | M52: ='\\SER\Software\other\[POINTS NQS  2012.XLS]Stock Altered 1100'!E55 -> 327 | N52: =IF('\\SER\Software\other\[POINTS NQS  2012.XLS]Stock Altered 1100'!F55=0," ",'\\SER\Software\other\[POINTS NQS  2012.XLS]Stock Altered 1100'!F55) -> Road Warrior | O52: ='\\SER\Software\other\[POINTS NQS  2012.XLS]Stock Altered 1100'!AA55 -> 52
A53: ='\\SER\Software\other\[POINTS NQS  2012.XLS]Stock Altered 1050'!A56 -> 51 | B53: ='\\SER\Software\other\[POINTS NQS  2012.XLS]Stock Altered 1050'!B56 -> Nevin Stitzer | C53: ='\\SER\Software\other\[POINTS NQS  2012.XLS]Stock Altered 1050'!C56 -> Spring Mills, PA | D53: ='\\SER\Software\other\[POINTS NQS  2012.XLS]Stock Altered 1050'!D56 ->  | E53: ='\\SER\Software\other\[POINTS NQS  2012.XLS]Stock Altered 1050'!E56 -> 447 | F53: =IF('\\SER\Software\other\[POINTS NQS  2012.XLS]Stock Altered 1050'!F56=0," ",'\\SER\Software\other\[POINTS NQS  2012.XLS]Stock Altered 1050'!F56) -> Thunder Road | G53: ='\\SER\Software\other\[POINTS NQS  2012.XLS]Stock Altered 1050'!AA56 -> 51 | I53: ='\\SER\Software\other\[POINTS NQS  2012.XLS]Stock Altered 1100'!A56 -> 51 | J53: ='\\SER\Software\other\[POINTS NQS  2012.XLS]Stock Altered 1100'!B56 -> Jared Riddle | K53: ='\\SER\Software\other\[POINTS NQS  2012.XLS]Stock Altered 1100'!C56 -> Montgomery City, PA | L53: ='\\SER\Software\other\[POINTS NQS  2012.XLS]Stock Altered 1100'!D56 ->  | M53: ='\\SER\Software\other\[POINTS NQS  2012.XLS]Stock Altered 1100'!E56 -> 471 | N53: =IF('\\SER\Software\other\[POINTS NQS  2012.XLS]Stock Altered 1100'!F56=0," ",'\\SER\Software\other\[POINTS NQS  2012.XLS]Stock Altered 1100'!F56) -> Williemakit | O53: ='\\SER\Software\other\[POINTS NQS  2012.XLS]Stock Altered 1100'!AA56 -> 52
A54: ='\\SER\Software\other\[POINTS NQS  2012.XLS]Stock Altered 1050'!A57 -> 52 | B54: ='\\SER\Software\other\[POINTS NQS  2012.XLS]Stock Altered 1050'!B57 -> Ron Finch | C54: ='\\SER\Software\other\[POINTS NQS  2012.XLS]Stock Altered 1050'!C57 -> Milan, MI | D54: ='\\SER\Software\other\[POINTS NQS  2012.XLS]Stock Altered 1050'!D57 -> Woods | E54: ='\\SER\Software\other\[POINTS NQS  2012.XLS]Stock Altered 1050'!E57 -> 142 | F54: =IF('\\SER\Software\other\[POINTS NQS  2012.XLS]Stock Altered 1050'!F57=0," ",'\\SER\Software\other\[POINTS NQS  2012.XLS]Stock Altered 1050'!F57) -> Top Notch | G54: ='\\SER\Software\other\[POINTS NQS  2012.XLS]Stock Altered 1050'!AA57 -> 52 | I54: ='\\SER\Software\other\[POINTS NQS  2012.XLS]Stock Altered 1100'!A57 -> 52 | J54: ='\\SER\Software\other\[POINTS NQS  2012.XLS]Stock Altered 1100'!B57 -> Lonnie Lewis | K54: ='\\SER\Software\other\[POINTS NQS  2012.XLS]Stock Altered 1100'!C57 -> Milford, OH | L54: ='\\SER\Software\other\[POINTS NQS  2012.XLS]Stock Altered 1100'!D57 -> TV | M54: ='\\SER\Software\other\[POINTS NQS  2012.XLS]Stock Altered 1100'!E57 -> 24 | N54: =IF('\\SER\Software\other\[POINTS NQS  2012.XLS]Stock Altered 1100'!F57=0," ",'\\SER\Software\other\[POINTS NQS  2012.XLS]Stock Altered 1100'!F57) -> Deuces Wild | O54: ='\\SER\Software\other\[POINTS NQS  2012.XLS]Stock Altered 1100'!AA57 -> 53
I55: ='\\SER\Software\other\[POINTS NQS  2012.XLS]Stock Altered 1100'!A58 -> 53 | J55: ='\\SER\Software\other\[POINTS NQS  2012.XLS]Stock Altered 1100'!B58 -> Les Salyers | K55: ='\\SER\Software\other\[POINTS NQS  2012.XLS]Stock Altered 1100'!C58 -> Sidney, OH | L55: ='\\SER\Software\other\[POINTS NQS  2012.XLS]Stock Altered 1100'!D58 -> TV | M55: ='\\SER\Software\other\[POINTS NQS  2012.XLS]Stock Altered 1100'!E58 -> 444 | N55: ='\\SER\Software\other\[POINTS NQS  2012.XLS]Stock Altered 1100'!F58 -> Unfinished Business | O55: ='\\SER\Software\other\[POINTS NQS  2012.XLS]Stock Altered 1100'!AA58 -> 53