B1: PRO OUTLAW | F1: Thru Sturgis | H1: LITE PRO | M1: Thru Sturgis
B2: Name | C2: City | D2: NQS # | E2: Tractor | F2: Points Back | I2: Name | J2: City/State | K2: NQS # | L2: Tractor | M2: Points Back
A3: ='\\SER\Software\other\[POINTS NQS  2012.XLS]Pro Outlaw'!A7 -> 1 | B3: ='\\SER\Software\other\[POINTS NQS  2012.XLS]Pro Outlaw'!B7 -> Harrision Stahl | C3: ='\\SER\Software\other\[POINTS NQS  2012.XLS]Pro Outlaw'!C7 -> Dewitt, IA | D3: ='\\SER\Software\other\[POINTS NQS  2012.XLS]Pro Outlaw'!D7 -> 4 | E3: =IF('\\SER\Software\other\[POINTS NQS  2012.XLS]Pro Outlaw'!E7=0,"",'\\SER\Software\other\[POINTS NQS  2012.XLS]Pro Outlaw'!E7) -> Tons of Fun | F3: ='\\SER\Software\other\[POINTS NQS  2012.XLS]Pro Outlaw'!AA7 -> 0 | H3: ='\\SER\Software\other\[POINTS NQS  2012.XLS]Light Pro'!A7 -> 1 | I3: ='\\SER\Software\other\[POINTS NQS  2012.XLS]Light Pro'!B7 -> David Gawatz | J3: ='\\SER\Software\other\[POINTS NQS  2012.XLS]Light Pro'!C7 -> St. Joseph, MO | K3: ='\\SER\Software\other\[POINTS NQS  2012.XLS]Light Pro'!D7 -> 462 | L3: =IF('\\SER\Software\other\[POINTS NQS  2012.XLS]Light Pro'!E7=0,"",'\\SER\Software\other\[POINTS NQS  2012.XLS]Light Pro'!E7) -> Fear The Deere | M3: ='\\SER\Software\other\[POINTS NQS  2012.XLS]Light Pro'!AA7 -> 0
A4: ='\\SER\Software\other\[POINTS NQS  2012.XLS]Pro Outlaw'!A8 -> 2 | B4: ='\\SER\Software\other\[POINTS NQS  2012.XLS]Pro Outlaw'!B8 -> Russ Nichols | C4: ='\\SER\Software\other\[POINTS NQS  2012.XLS]Pro Outlaw'!C8 -> Lore city, OH | D4: ='\\SER\Software\other\[POINTS NQS  2012.XLS]Pro Outlaw'!D8 -> 70 | E4: =IF('\\SER\Software\other\[POINTS NQS  2012.XLS]Pro Outlaw'!E8=0,"",'\\SER\Software\other\[POINTS NQS  2012.XLS]Pro Outlaw'!E8) -> Wild One II | F4: ='\\SER\Software\other\[POINTS NQS  2012.XLS]Pro Outlaw'!AA8 -> 0 | H4: ='\\SER\Software\other\[POINTS NQS  2012.XLS]Light Pro'!A8 -> 2 | I4: ='\\SER\Software\other\[POINTS NQS  2012.XLS]Light Pro'!B8 -> Gregory Vandevort | J4: ='\\SER\Software\other\[POINTS NQS  2012.XLS]Light Pro'!C8 -> Albion, PA | K4: ='\\SER\Software\other\[POINTS NQS  2012.XLS]Light Pro'!D8 -> 506 | L4: =IF('\\SER\Software\other\[POINTS NQS  2012.XLS]Light Pro'!E8=0,"",'\\SER\Software\other\[POINTS NQS  2012.XLS]Light Pro'!E8) -> Shockwave | M4: ='\\SER\Software\other\[POINTS NQS  2012.XLS]Light Pro'!AA8 -> 1
A5: ='\\SER\Software\other\[POINTS NQS  2012.XLS]Pro Outlaw'!A9 -> 3 | B5: ='\\SER\Software\other\[POINTS NQS  2012.XLS]Pro Outlaw'!B9 -> Elaine Fisher | C5: ='\\SER\Software\other\[POINTS NQS  2012.XLS]Pro Outlaw'!C9 -> Waterford, OH | D5: ='\\SER\Software\other\[POINTS NQS  2012.XLS]Pro Outlaw'!D9 -> 80 | E5: =IF('\\SER\Software\other\[POINTS NQS  2012.XLS]Pro Outlaw'!E9=0,"",'\\SER\Software\other\[POINTS NQS  2012.XLS]Pro Outlaw'!E9) -> Blue Thunder | F5: ='\\SER\Software\other\[POINTS NQS  2012.XLS]Pro Outlaw'!AA9 -> 4 | H5: ='\\SER\Software\other\[POINTS NQS  2012.XLS]Light Pro'!A9 -> 3 | I5: ='\\SER\Software\other\[POINTS NQS  2012.XLS]Light Pro'!B9 -> Lora Feldkamp | J5: ='\\SER\Software\other\[POINTS NQS  2012.XLS]Light Pro'!C9 -> Britton, MI | K5: ='\\SER\Software\other\[POINTS NQS  2012.XLS]Light Pro'!D9 -> 475 | L5: =IF('\\SER\Software\other\[POINTS NQS  2012.XLS]Light Pro'!E9=0,"",'\\SER\Software\other\[POINTS NQS  2012.XLS]Light Pro'!E9) ->  | M5: ='\\SER\Software\other\[POINTS NQS  2012.XLS]Light Pro'!AA9 -> 2
A6: ='\\SER\Software\other\[POINTS NQS  2012.XLS]Pro Outlaw'!A10 -> 4 | B6: ='\\SER\Software\other\[POINTS NQS  2012.XLS]Pro Outlaw'!B10 -> Steve Williford | C6: ='\\SER\Software\other\[POINTS NQS  2012.XLS]Pro Outlaw'!C10 -> Engelhard, NC | D6: ='\\SER\Software\other\[POINTS NQS  2012.XLS]Pro Outlaw'!D10 -> 337 | E6: =IF('\\SER\Software\other\[POINTS NQS  2012.XLS]Pro Outlaw'!E10=0,"",'\\SER\Software\other\[POINTS NQS  2012.XLS]Pro Outlaw'!E10) -> IH Express | F6: ='\\SER\Software\other\[POINTS NQS  2012.XLS]Pro Outlaw'!AA10 -> 4 | H6: ='\\SER\Software\other\[POINTS NQS  2012.XLS]Light Pro'!A10 -> 4 | I6: ='\\SER\Software\other\[POINTS NQS  2012.XLS]Light Pro'!B10 -> Matt Kaster | J6: ='\\SER\Software\other\[POINTS NQS  2012.XLS]Light Pro'!C10 -> Burlington, WI | K6: ='\\SER\Software\other\[POINTS NQS  2012.XLS]Light Pro'!D10 -> 332 | L6: =IF('\\SER\Software\other\[POINTS NQS  2012.XLS]Light Pro'!E10=0,"",'\\SER\Software\other\[POINTS NQS  2012.XLS]Light Pro'!E10) -> Hog Wash | M6: ='\\SER\Software\other\[POINTS NQS  2012.XLS]Light Pro'!AA10 -> 3
A7: ='\\SER\Software\other\[POINTS NQS  2012.XLS]Pro Outlaw'!A11 -> 5 | B7: ='\\SER\Software\other\[POINTS NQS  2012.XLS]Pro Outlaw'!B11 -> Russ Nichols | C7: ='\\SER\Software\other\[POINTS NQS  2012.XLS]Pro Outlaw'!C11 -> Lore City, OH | D7: ='\\SER\Software\other\[POINTS NQS  2012.XLS]Pro Outlaw'!D11 -> 8 | E7: =IF('\\SER\Software\other\[POINTS NQS  2012.XLS]Pro Outlaw'!E11=0,"",'\\SER\Software\other\[POINTS NQS  2012.XLS]Pro Outlaw'!E11) -> Wicked Deere | F7: ='\\SER\Software\other\[POINTS NQS  2012.XLS]Pro Outlaw'!AA11 -> 6 | H7: ='\\SER\Software\other\[POINTS NQS  2012.XLS]Light Pro'!A11 -> 5 | I7: ='\\SER\Software\other\[POINTS NQS  2012.XLS]Light Pro'!B11 -> Jerry Sweet | J7: ='\\SER\Software\other\[POINTS NQS  2012.XLS]Light Pro'!C11 -> Clymer, NY | K7: ='\\SER\Software\other\[POINTS NQS  2012.XLS]Light Pro'!D11 -> 284 | L7: =IF('\\SER\Software\other\[POINTS NQS  2012.XLS]Light Pro'!E11=0,"",'\\SER\Software\other\[POINTS NQS  2012.XLS]Light Pro'!E11) -> Phat Ride | M7: ='\\SER\Software\other\[POINTS NQS  2012.XLS]Light Pro'!AA11 -> 4
A8: ='\\SER\Software\other\[POINTS NQS  2012.XLS]Pro Outlaw'!A12 -> 6 | B8: ='\\SER\Software\other\[POINTS NQS  2012.XLS]Pro Outlaw'!B12 -> Drew Burton | C8: ='\\SER\Software\other\[POINTS NQS  2012.XLS]Pro Outlaw'!C12 -> Brookston, IN | D8: ='\\SER\Software\other\[POINTS NQS  2012.XLS]Pro Outlaw'!D12 -> 14 | E8: =IF('\\SER\Software\other\[POINTS NQS  2012.XLS]Pro Outlaw'!E12=0,"",'\\SER\Software\other\[POINTS NQS  2012.XLS]Pro Outlaw'!E12) -> Bad Company | F8: ='\\SER\Software\other\[POINTS NQS  2012.XLS]Pro Outlaw'!AA12 -> 6 | H8: ='\\SER\Software\other\[POINTS NQS  2012.XLS]Light Pro'!A12 -> 6 | I8: ='\\SER\Software\other\[POINTS NQS  2012.XLS]Light Pro'!B12 -> Scott Bye | J8: ='\\SER\Software\other\[POINTS NQS  2012.XLS]Light Pro'!C12 -> Savannah, MO | K8: ='\\SER\Software\other\[POINTS NQS  2012.XLS]Light Pro'!D12 -> 365 | L8: =IF('\\SER\Software\other\[POINTS NQS  2012.XLS]Light Pro'!E12=0,"",'\\SER\Software\other\[POINTS NQS  2012.XLS]Light Pro'!E12) -> REVV UP | M8: ='\\SER\Software\other\[POINTS NQS  2012.XLS]Light Pro'!AA12 -> 5
A9: ='\\SER\Software\other\[POINTS NQS  2012.XLS]Pro Outlaw'!A13 -> 7 | B9: ='\\SER\Software\other\[POINTS NQS  2012.XLS]Pro Outlaw'!B13 -> Harrison Stahl | C9: ='\\SER\Software\other\[POINTS NQS  2012.XLS]Pro Outlaw'!C13 -> Dewitt, IA | D9: ='\\SER\Software\other\[POINTS NQS  2012.XLS]Pro Outlaw'!D13 -> 336 | E9: =IF('\\SER\Software\other\[POINTS NQS  2012.XLS]Pro Outlaw'!E13=0,"",'\\SER\Software\other\[POINTS NQS  2012.XLS]Pro Outlaw'!E13) -> MWSC#4 | F9: ='\\SER\Software\other\[POINTS NQS  2012.XLS]Pro Outlaw'!AA13 -> 9 | H9: ='\\SER\Software\other\[POINTS NQS  2012.XLS]Light Pro'!A13 -> 7 | I9: ='\\SER\Software\other\[POINTS NQS  2012.XLS]Light Pro'!B13 -> Chris Gegg | J9: ='\\SER\Software\other\[POINTS NQS  2012.XLS]Light Pro'!C13 -> Greeneville, IL | K9: ='\\SER\Software\other\[POINTS NQS  2012.XLS]Light Pro'!D13 -> 410 | L9: =IF('\\SER\Software\other\[POINTS NQS  2012.XLS]Light Pro'!E13=0,"",'\\SER\Software\other\[POINTS NQS  2012.XLS]Light Pro'!E13) -> Insane | M9: ='\\SER\Software\other\[POINTS NQS  2012.XLS]Light Pro'!AA13 -> 6
A10: ='\\SER\Software\other\[POINTS NQS  2012.XLS]Pro Outlaw'!A14 -> 8 | B10: ='\\SER\Software\other\[POINTS NQS  2012.XLS]Pro Outlaw'!B14 -> Daryl Musser | C10: ='\\SER\Software\other\[POINTS NQS  2012.XLS]Pro Outlaw'!C14 -> Greencastle, PA | D10: ='\\SER\Software\other\[POINTS NQS  2012.XLS]Pro Outlaw'!D14 -> 396 | E10: =IF('\\SER\Software\other\[POINTS NQS  2012.XLS]Pro Outlaw'!E14=0,"",'\\SER\Software\other\[POINTS NQS  2012.XLS]Pro Outlaw'!E14) -> 5 Cents | F10: ='\\SER\Software\other\[POINTS NQS  2012.XLS]Pro Outlaw'!AA14 -> 9 | H10: ='\\SER\Software\other\[POINTS NQS  2012.XLS]Light Pro'!A14 -> 8 | I10: ='\\SER\Software\other\[POINTS NQS  2012.XLS]Light Pro'!B14 -> Aaron Scroggins | J10: ='\\SER\Software\other\[POINTS NQS  2012.XLS]Light Pro'!C14 -> Neosho, MO | K10: ='\\SER\Software\other\[POINTS NQS  2012.XLS]Light Pro'!D14 -> 419 | L10: =IF('\\SER\Software\other\[POINTS NQS  2012.XLS]Light Pro'!E14=0,"",'\\SER\Software\other\[POINTS NQS  2012.XLS]Light Pro'!E14) -> Gambler | M10: ='\\SER\Software\other\[POINTS NQS  2012.XLS]Light Pro'!AA14 -> 7
A11: ='\\SER\Software\other\[POINTS NQS  2012.XLS]Pro Outlaw'!A15 -> 9 | B11: ='\\SER\Software\other\[POINTS NQS  2012.XLS]Pro Outlaw'!B15 -> Christopher Wise | C11: ='\\SER\Software\other\[POINTS NQS  2012.XLS]Pro Outlaw'!C15 -> Greensburg, PA | D11: ='\\SER\Software\other\[POINTS NQS  2012.XLS]Pro Outlaw'!D15 -> 209 | E11: =IF('\\SER\Software\other\[POINTS NQS  2012.XLS]Pro Outlaw'!E15=0,"",'\\SER\Software\other\[POINTS NQS  2012.XLS]Pro Outlaw'!E15) -> Longshot | F11: ='\\SER\Software\other\[POINTS NQS  2012.XLS]Pro Outlaw'!AA15 -> 10 | H11: ='\\SER\Software\other\[POINTS NQS  2012.XLS]Light Pro'!A15 -> 9 | I11: ='\\SER\Software\other\[POINTS NQS  2012.XLS]Light Pro'!B15 -> Nick Ferguson | J11: ='\\SER\Software\other\[POINTS NQS  2012.XLS]Light Pro'!C15 -> Elkhorn, WI | K11: ='\\SER\Software\other\[POINTS NQS  2012.XLS]Light Pro'!D15 -> 100 | L11: =IF('\\SER\Software\other\[POINTS NQS  2012.XLS]Light Pro'!E15=0,"",'\\SER\Software\other\[POINTS NQS  2012.XLS]Light Pro'!E15) -> Raisin Cane | M11: ='\\SER\Software\other\[POINTS NQS  2012.XLS]Light Pro'!AA15 -> 8
A12: ='\\SER\Software\other\[POINTS NQS  2012.XLS]Pro Outlaw'!A16 -> 10 | B12: ='\\SER\Software\other\[POINTS NQS  2012.XLS]Pro Outlaw'!B16 -> Don Vogt | C12: ='\\SER\Software\other\[POINTS NQS  2012.XLS]Pro Outlaw'!C16 -> Campbellsport, WI | D12: ='\\SER\Software\other\[POINTS NQS  2012.XLS]Pro Outlaw'!D16 -> 90 | E12: =IF('\\SER\Software\other\[POINTS NQS  2012.XLS]Pro Outlaw'!E16=0,"",'\\SER\Software\other\[POINTS NQS  2012.XLS]Pro Outlaw'!E16) -> Not A Nuff | F12: ='\\SER\Software\other\[POINTS NQS  2012.XLS]Pro Outlaw'!AA16 -> 12
A13: ='\\SER\Software\other\[POINTS NQS  2012.XLS]Pro Outlaw'!A17 -> 11 | B13: ='\\SER\Software\other\[POINTS NQS  2012.XLS]Pro Outlaw'!B17 -> Jim Hull | C13: ='\\SER\Software\other\[POINTS NQS  2012.XLS]Pro Outlaw'!C17 -> Brandon, WI | D13: ='\\SER\Software\other\[POINTS NQS  2012.XLS]Pro Outlaw'!D17 -> 334 | E13: =IF('\\SER\Software\other\[POINTS NQS  2012.XLS]Pro Outlaw'!E17=0,"",'\\SER\Software\other\[POINTS NQS  2012.XLS]Pro Outlaw'!E17) -> Simply Irresistable | F13: ='\\SER\Software\other\[POINTS NQS  2012.XLS]Pro Outlaw'!AA17 -> 12
A14: ='\\SER\Software\other\[POINTS NQS  2012.XLS]Pro Outlaw'!A18 -> 12 | B14: ='\\SER\Software\other\[POINTS NQS  2012.XLS]Pro Outlaw'!B18 -> Nick Mischler | C14: ='\\SER\Software\other\[POINTS NQS  2012.XLS]Pro Outlaw'!C18 -> Deer Creek, IL | D14: ='\\SER\Software\other\[POINTS NQS  2012.XLS]Pro Outlaw'!D18 -> 167 | E14: =IF('\\SER\Software\other\[POINTS NQS  2012.XLS]Pro Outlaw'!E18=0,"",'\\SER\Software\other\[POINTS NQS  2012.XLS]Pro Outlaw'!E18) -> Pulse | F14: ='\\SER\Software\other\[POINTS NQS  2012.XLS]Pro Outlaw'!AA18 -> 13
A15: ='\\SER\Software\other\[POINTS NQS  2012.XLS]Pro Outlaw'!A19 -> 13 | B15: ='\\SER\Software\other\[POINTS NQS  2012.XLS]Pro Outlaw'!B19 -> Julian Stahl | C15: ='\\SER\Software\other\[POINTS NQS  2012.XLS]Pro Outlaw'!C19 -> Welton, IA | D15: ='\\SER\Software\other\[POINTS NQS  2012.XLS]Pro Outlaw'!D19 -> 1 | E15: =IF('\\SER\Software\other\[POINTS NQS  2012.XLS]Pro Outlaw'!E19=0,"",'\\SER\Software\other\[POINTS NQS  2012.XLS]Pro Outlaw'!E19) -> MWSC#1 | F15: ='\\SER\Software\other\[POINTS NQS  2012.XLS]Pro Outlaw'!AA19 -> 16
A16: ='\\SER\Software\other\[POINTS NQS  2012.XLS]Pro Outlaw'!A20 -> 14 | B16: ='\\SER\Software\other\[POINTS NQS  2012.XLS]Pro Outlaw'!B20 -> Bradley Corzine | C16: ='\\SER\Software\other\[POINTS NQS  2012.XLS]Pro Outlaw'!C20 -> Dongola, IL | D16: ='\\SER\Software\other\[POINTS NQS  2012.XLS]Pro Outlaw'!D20 -> 509 | E16: =IF('\\SER\Software\other\[POINTS NQS  2012.XLS]Pro Outlaw'!E20=0,"",'\\SER\Software\other\[POINTS NQS  2012.XLS]Pro Outlaw'!E20) -> Just Black | F16: ='\\SER\Software\other\[POINTS NQS  2012.XLS]Pro Outlaw'!AA20 -> 18
A17: ='\\SER\Software\other\[POINTS NQS  2012.XLS]Pro Outlaw'!A21 -> 15 | B17: ='\\SER\Software\other\[POINTS NQS  2012.XLS]Pro Outlaw'!B21 -> Michael Ciolino | C17: ='\\SER\Software\other\[POINTS NQS  2012.XLS]Pro Outlaw'!C21 -> Peoria, IL | D17: ='\\SER\Software\other\[POINTS NQS  2012.XLS]Pro Outlaw'!D21 -> 146 | E17: =IF('\\SER\Software\other\[POINTS NQS  2012.XLS]Pro Outlaw'!E21=0,"",'\\SER\Software\other\[POINTS NQS  2012.XLS]Pro Outlaw'!E21) -> Mechanical Animal | F17: ='\\SER\Software\other\[POINTS NQS  2012.XLS]Pro Outlaw'!AA21 -> 46
A18: ='\\SER\Software\other\[POINTS NQS  2012.XLS]Pro Outlaw'!A22 -> 16 | B18: ='\\SER\Software\other\[POINTS NQS  2012.XLS]Pro Outlaw'!B22 -> Kenny Cornelison | C18: ='\\SER\Software\other\[POINTS NQS  2012.XLS]Pro Outlaw'!C22 -> Richmond, KY | D18: ='\\SER\Software\other\[POINTS NQS  2012.XLS]Pro Outlaw'!D22 -> 149 | E18: =IF('\\SER\Software\other\[POINTS NQS  2012.XLS]Pro Outlaw'!E22=0,"",'\\SER\Software\other\[POINTS NQS  2012.XLS]Pro Outlaw'!E22) -> Storm Alert | F18: ='\\SER\Software\other\[POINTS NQS  2012.XLS]Pro Outlaw'!AA22 -> 46
A19: ='\\SER\Software\other\[POINTS NQS  2012.XLS]Pro Outlaw'!A23 -> 17 | B19: ='\\SER\Software\other\[POINTS NQS  2012.XLS]Pro Outlaw'!B23 -> Aaron Scroggins | C19: ='\\SER\Software\other\[POINTS NQS  2012.XLS]Pro Outlaw'!C23 -> Neosho, OH | D19: ='\\SER\Software\other\[POINTS NQS  2012.XLS]Pro Outlaw'!D23 -> 111 | E19: =IF('\\SER\Software\other\[POINTS NQS  2012.XLS]Pro Outlaw'!E23=0,"",'\\SER\Software\other\[POINTS NQS  2012.XLS]Pro Outlaw'!E23) -> Blackout | F19: ='\\SER\Software\other\[POINTS NQS  2012.XLS]Pro Outlaw'!AA23 -> 47
A20: ='\\SER\Software\other\[POINTS NQS  2012.XLS]Pro Outlaw'!A24 -> 18 | B20: ='\\SER\Software\other\[POINTS NQS  2012.XLS]Pro Outlaw'!B24 -> Jeff Chrisman | C20: ='\\SER\Software\other\[POINTS NQS  2012.XLS]Pro Outlaw'!C24 -> Edinburgh, IN | D20: ='\\SER\Software\other\[POINTS NQS  2012.XLS]Pro Outlaw'!D24 -> 180 | E20: =IF('\\SER\Software\other\[POINTS NQS  2012.XLS]Pro Outlaw'!E24=0,"",'\\SER\Software\other\[POINTS NQS  2012.XLS]Pro Outlaw'!E24) ->  | F20: ='\\SER\Software\other\[POINTS NQS  2012.XLS]Pro Outlaw'!AA24 -> 47
A21: ='\\SER\Software\other\[POINTS NQS  2012.XLS]Pro Outlaw'!A25 -> 19 | B21: ='\\SER\Software\other\[POINTS NQS  2012.XLS]Pro Outlaw'!B25 -> Dave Gawatz | C21: ='\\SER\Software\other\[POINTS NQS  2012.XLS]Pro Outlaw'!C25 -> St. Joseph, MO | D21: ='\\SER\Software\other\[POINTS NQS  2012.XLS]Pro Outlaw'!D25 -> 367 | E21: =IF('\\SER\Software\other\[POINTS NQS  2012.XLS]Pro Outlaw'!E25=0,"",'\\SER\Software\other\[POINTS NQS  2012.XLS]Pro Outlaw'!E25) -> Lil' Sprout | F21: ='\\SER\Software\other\[POINTS NQS  2012.XLS]Pro Outlaw'!AA25 -> 48
A22: ='\\SER\Software\other\[POINTS NQS  2012.XLS]Pro Outlaw'!A26 -> 20 | B22: ='\\SER\Software\other\[POINTS NQS  2012.XLS]Pro Outlaw'!B26 -> David Knapp | C22: ='\\SER\Software\other\[POINTS NQS  2012.XLS]Pro Outlaw'!C26 -> Hennepin, IL | D22: ='\\SER\Software\other\[POINTS NQS  2012.XLS]Pro Outlaw'!D26 -> 381 | E22: =IF('\\SER\Software\other\[POINTS NQS  2012.XLS]Pro Outlaw'!E26=0,"",'\\SER\Software\other\[POINTS NQS  2012.XLS]Pro Outlaw'!E26) -> Knapp Time | F22: ='\\SER\Software\other\[POINTS NQS  2012.XLS]Pro Outlaw'!AA26 -> 48
A23: ='\\SER\Software\other\[POINTS NQS  2012.XLS]Pro Outlaw'!A27 -> 21 | B23: ='\\SER\Software\other\[POINTS NQS  2012.XLS]Pro Outlaw'!B27 -> Julian Stahl | C23: ='\\SER\Software\other\[POINTS NQS  2012.XLS]Pro Outlaw'!C27 -> Welton, IA | D23: ='\\SER\Software\other\[POINTS NQS  2012.XLS]Pro Outlaw'!D27 -> 2 | E23: =IF('\\SER\Software\other\[POINTS NQS  2012.XLS]Pro Outlaw'!E27=0,"",'\\SER\Software\other\[POINTS NQS  2012.XLS]Pro Outlaw'!E27) -> MWSC#2 | F23: ='\\SER\Software\other\[POINTS NQS  2012.XLS]Pro Outlaw'!AA27 -> 49
A24: ='\\SER\Software\other\[POINTS NQS  2012.XLS]Pro Outlaw'!A28 -> 22 | B24: ='\\SER\Software\other\[POINTS NQS  2012.XLS]Pro Outlaw'!B28 -> David Mascher JR | C24: ='\\SER\Software\other\[POINTS NQS  2012.XLS]Pro Outlaw'!C28 -> Beech Grove, IN | D24: ='\\SER\Software\other\[POINTS NQS  2012.XLS]Pro Outlaw'!D28 -> 163 | E24: =IF('\\SER\Software\other\[POINTS NQS  2012.XLS]Pro Outlaw'!E28=0,"",'\\SER\Software\other\[POINTS NQS  2012.XLS]Pro Outlaw'!E28) -> Thunder Pumpkin | F24: ='\\SER\Software\other\[POINTS NQS  2012.XLS]Pro Outlaw'!AA28 -> 49
A25: ='\\SER\Software\other\[POINTS NQS  2012.XLS]Pro Outlaw'!A29 -> 23 | B25: ='\\SER\Software\other\[POINTS NQS  2012.XLS]Pro Outlaw'!B29 -> Mike Spencer | C25: ='\\SER\Software\other\[POINTS NQS  2012.XLS]Pro Outlaw'!C29 -> Weest Alex, OH | D25: ='\\SER\Software\other\[POINTS NQS  2012.XLS]Pro Outlaw'!D29 -> 278 | E25: =IF('\\SER\Software\other\[POINTS NQS  2012.XLS]Pro Outlaw'!E29=0,"",'\\SER\Software\other\[POINTS NQS  2012.XLS]Pro Outlaw'!E29) -> Longshot | F25: ='\\SER\Software\other\[POINTS NQS  2012.XLS]Pro Outlaw'!AA29 -> 50
A26: ='\\SER\Software\other\[POINTS NQS  2012.XLS]Pro Outlaw'!A30 -> 24 | B26: ='\\SER\Software\other\[POINTS NQS  2012.XLS]Pro Outlaw'!B30 -> Steve Vogler | C26: ='\\SER\Software\other\[POINTS NQS  2012.XLS]Pro Outlaw'!C30 -> Jasper, IN | D26: ='\\SER\Software\other\[POINTS NQS  2012.XLS]Pro Outlaw'!D30 -> 476 | E26: =IF('\\SER\Software\other\[POINTS NQS  2012.XLS]Pro Outlaw'!E30=0,"",'\\SER\Software\other\[POINTS NQS  2012.XLS]Pro Outlaw'!E30) -> Outlaw Reloaded | F26: ='\\SER\Software\other\[POINTS NQS  2012.XLS]Pro Outlaw'!AA30 -> 50 | H26: LITE OUTLAW | M26: Thru Sturgis
A27: ='\\SER\Software\other\[POINTS NQS  2012.XLS]Pro Outlaw'!A31 -> 25 | B27: ='\\SER\Software\other\[POINTS NQS  2012.XLS]Pro Outlaw'!B31 -> Dan Schell | C27: ='\\SER\Software\other\[POINTS NQS  2012.XLS]Pro Outlaw'!C31 -> Darien, WI | D27: ='\\SER\Software\other\[POINTS NQS  2012.XLS]Pro Outlaw'!D31 -> 375 | E27: =IF('\\SER\Software\other\[POINTS NQS  2012.XLS]Pro Outlaw'!E31=0,"",'\\SER\Software\other\[POINTS NQS  2012.XLS]Pro Outlaw'!E31) -> Blind Ambition | F27: ='\\SER\Software\other\[POINTS NQS  2012.XLS]Pro Outlaw'!AA31 -> 51 | I27: Name | J27: City | K27: NQS # | L27: Tractor | M27: Points Back
A28: ='\\SER\Software\other\[POINTS NQS  2012.XLS]Pro Outlaw'!A32 -> 26 | B28: ='\\SER\Software\other\[POINTS NQS  2012.XLS]Pro Outlaw'!B32 -> Jerry Everhart | C28: ='\\SER\Software\other\[POINTS NQS  2012.XLS]Pro Outlaw'!C32 -> Springfield, OH | D28: ='\\SER\Software\other\[POINTS NQS  2012.XLS]Pro Outlaw'!D32 -> 483 | E28: =IF('\\SER\Software\other\[POINTS NQS  2012.XLS]Pro Outlaw'!E32=0,"",'\\SER\Software\other\[POINTS NQS  2012.XLS]Pro Outlaw'!E32) -> Orange Cart | F28: ='\\SER\Software\other\[POINTS NQS  2012.XLS]Pro Outlaw'!AA32 -> 51 | H28: ='\\SER\Software\other\[POINTS NQS  2012.XLS]Lite Outlaw'!A7 -> 1 | I28: ='\\SER\Software\other\[POINTS NQS  2012.XLS]Lite Outlaw'!B7 -> Scott Bye | J28: ='\\SER\Software\other\[POINTS NQS  2012.XLS]Lite Outlaw'!C7 -> Savannah, MO | K28: ='\\SER\Software\other\[POINTS NQS  2012.XLS]Lite Outlaw'!D7 -> 365 | L28: =IF('\\SER\Software\other\[POINTS NQS  2012.XLS]Lite Outlaw'!E7=0,"",'\\SER\Software\other\[POINTS NQS  2012.XLS]Lite Outlaw'!E7) -> REVV UP | M28: ='\\SER\Software\other\[POINTS NQS  2012.XLS]Lite Outlaw'!AA7 -> 0
A29: ='\\SER\Software\other\[POINTS NQS  2012.XLS]Pro Outlaw'!A33 -> 27 | B29: ='\\SER\Software\other\[POINTS NQS  2012.XLS]Pro Outlaw'!B33 -> Kevin Root | C29: ='\\SER\Software\other\[POINTS NQS  2012.XLS]Pro Outlaw'!C33 -> Inola, OK | D29: ='\\SER\Software\other\[POINTS NQS  2012.XLS]Pro Outlaw'!D33 -> 118 | E29: =IF('\\SER\Software\other\[POINTS NQS  2012.XLS]Pro Outlaw'!E33=0,"",'\\SER\Software\other\[POINTS NQS  2012.XLS]Pro Outlaw'!E33) -> Slapshot | F29: ='\\SER\Software\other\[POINTS NQS  2012.XLS]Pro Outlaw'!AA33 -> 52 | H29: ='\\SER\Software\other\[POINTS NQS  2012.XLS]Lite Outlaw'!A8 -> 2 | I29: ='\\SER\Software\other\[POINTS NQS  2012.XLS]Lite Outlaw'!B8 -> Gregory Vandevort | J29: ='\\SER\Software\other\[POINTS NQS  2012.XLS]Lite Outlaw'!C8 -> Albion, PA | K29: ='\\SER\Software\other\[POINTS NQS  2012.XLS]Lite Outlaw'!D8 -> 506 | L29: =IF('\\SER\Software\other\[POINTS NQS  2012.XLS]Lite Outlaw'!E8=0,"",'\\SER\Software\other\[POINTS NQS  2012.XLS]Lite Outlaw'!E8) -> Shockwave | M29: ='\\SER\Software\other\[POINTS NQS  2012.XLS]Lite Outlaw'!AA8 -> 1
A30: ='\\SER\Software\other\[POINTS NQS  2012.XLS]Pro Outlaw'!A34 -> 28 | B30: ='\\SER\Software\other\[POINTS NQS  2012.XLS]Pro Outlaw'!B34 -> Ryan Richter | C30: ='\\SER\Software\other\[POINTS NQS  2012.XLS]Pro Outlaw'!C34 -> Connellsville, PA | D30: ='\\SER\Software\other\[POINTS NQS  2012.XLS]Pro Outlaw'!D34 -> 502 | E30: =IF('\\SER\Software\other\[POINTS NQS  2012.XLS]Pro Outlaw'!E34=0,"",'\\SER\Software\other\[POINTS NQS  2012.XLS]Pro Outlaw'!E34) -> Radical Rat | F30: ='\\SER\Software\other\[POINTS NQS  2012.XLS]Pro Outlaw'!AA34 -> 52 | H30: ='\\SER\Software\other\[POINTS NQS  2012.XLS]Lite Outlaw'!A9 -> 3 | I30: ='\\SER\Software\other\[POINTS NQS  2012.XLS]Lite Outlaw'!B9 -> Lora Feldkamp | J30: ='\\SER\Software\other\[POINTS NQS  2012.XLS]Lite Outlaw'!C9 -> Britton, WI | K30: ='\\SER\Software\other\[POINTS NQS  2012.XLS]Lite Outlaw'!D9 -> 475 | L30: =IF('\\SER\Software\other\[POINTS NQS  2012.XLS]Lite Outlaw'!E9=0,"",'\\SER\Software\other\[POINTS NQS  2012.XLS]Lite Outlaw'!E9) ->  | M30: ='\\SER\Software\other\[POINTS NQS  2012.XLS]Lite Outlaw'!AA9 -> 2
A31: ='\\SER\Software\other\[POINTS NQS  2012.XLS]Pro Outlaw'!A35 -> 29 | B31: ='\\SER\Software\other\[POINTS NQS  2012.XLS]Pro Outlaw'!B35 -> Matt Kaster | C31: ='\\SER\Software\other\[POINTS NQS  2012.XLS]Pro Outlaw'!C35 -> Burlington, WI | D31: ='\\SER\Software\other\[POINTS NQS  2012.XLS]Pro Outlaw'!D35 -> 99 | E31: =IF('\\SER\Software\other\[POINTS NQS  2012.XLS]Pro Outlaw'!E35=0,"",'\\SER\Software\other\[POINTS NQS  2012.XLS]Pro Outlaw'!E35) -> Sound of Madness | F31: ='\\SER\Software\other\[POINTS NQS  2012.XLS]Pro Outlaw'!AA35 -> 53 | H31: ='\\SER\Software\other\[POINTS NQS  2012.XLS]Lite Outlaw'!A10 -> 4 | I31: ='\\SER\Software\other\[POINTS NQS  2012.XLS]Lite Outlaw'!B10 -> Matt Kaster | J31: ='\\SER\Software\other\[POINTS NQS  2012.XLS]Lite Outlaw'!C10 -> Burlington, WI | K31: ='\\SER\Software\other\[POINTS NQS  2012.XLS]Lite Outlaw'!D10 -> 332 | L31: =IF('\\SER\Software\other\[POINTS NQS  2012.XLS]Lite Outlaw'!E10=0,"",'\\SER\Software\other\[POINTS NQS  2012.XLS]Lite Outlaw'!E10) -> Hog Wash | M31: ='\\SER\Software\other\[POINTS NQS  2012.XLS]Lite Outlaw'!AA10 -> 3
A32: ='\\SER\Software\other\[POINTS NQS  2012.XLS]Pro Outlaw'!A36 -> 30 | B32: ='\\SER\Software\other\[POINTS NQS  2012.XLS]Pro Outlaw'!B36 -> Scott Larkins | C32: ='\\SER\Software\other\[POINTS NQS  2012.XLS]Pro Outlaw'!C36 -> Kearney, MO | D32: ='\\SER\Software\other\[POINTS NQS  2012.XLS]Pro Outlaw'!D36 -> 154 | E32: =IF('\\SER\Software\other\[POINTS NQS  2012.XLS]Pro Outlaw'!E36=0,"",'\\SER\Software\other\[POINTS NQS  2012.XLS]Pro Outlaw'!E36) -> Silver Sam | F32: ='\\SER\Software\other\[POINTS NQS  2012.XLS]Pro Outlaw'!AA36 -> 53 | H32: ='\\SER\Software\other\[POINTS NQS  2012.XLS]Lite Outlaw'!A11 -> 5 | I32: ='\\SER\Software\other\[POINTS NQS  2012.XLS]Lite Outlaw'!B11 -> Chris Gegg | J32: ='\\SER\Software\other\[POINTS NQS  2012.XLS]Lite Outlaw'!C11 -> Greenville, IL | K32: ='\\SER\Software\other\[POINTS NQS  2012.XLS]Lite Outlaw'!D11 -> 410 | L32: =IF('\\SER\Software\other\[POINTS NQS  2012.XLS]Lite Outlaw'!E11=0,"",'\\SER\Software\other\[POINTS NQS  2012.XLS]Lite Outlaw'!E11) -> Insane | M32: ='\\SER\Software\other\[POINTS NQS  2012.XLS]Lite Outlaw'!AA11 -> 4
A33: ='\\SER\Software\other\[POINTS NQS  2012.XLS]Pro Outlaw'!A37 -> 31 | B33: ='\\SER\Software\other\[POINTS NQS  2012.XLS]Pro Outlaw'!B37 -> Kevin Root | C33: ='\\SER\Software\other\[POINTS NQS  2012.XLS]Pro Outlaw'!C37 -> Inola, OK | D33: ='\\SER\Software\other\[POINTS NQS  2012.XLS]Pro Outlaw'!D37 -> 117 | E33: =IF('\\SER\Software\other\[POINTS NQS  2012.XLS]Pro Outlaw'!E37=0,"",'\\SER\Software\other\[POINTS NQS  2012.XLS]Pro Outlaw'!E37) -> Right on the Money | F33: ='\\SER\Software\other\[POINTS NQS  2012.XLS]Pro Outlaw'!AA37 -> 54 | H33: ='\\SER\Software\other\[POINTS NQS  2012.XLS]Lite Outlaw'!A12 -> 6 | I33: ='\\SER\Software\other\[POINTS NQS  2012.XLS]Lite Outlaw'!B12 -> Aaron Scroggins | J33: ='\\SER\Software\other\[POINTS NQS  2012.XLS]Lite Outlaw'!C12 -> Neosho, MO | K33: ='\\SER\Software\other\[POINTS NQS  2012.XLS]Lite Outlaw'!D12 -> 419 | L33: =IF('\\SER\Software\other\[POINTS NQS  2012.XLS]Lite Outlaw'!E12=0,"",'\\SER\Software\other\[POINTS NQS  2012.XLS]Lite Outlaw'!E12) -> Gambler | M33: ='\\SER\Software\other\[POINTS NQS  2012.XLS]Lite Outlaw'!AA12 -> 5
A34: ='\\SER\Software\other\[POINTS NQS  2012.XLS]Pro Outlaw'!A38 -> 32 | B34: ='\\SER\Software\other\[POINTS NQS  2012.XLS]Pro Outlaw'!B38 -> Charlie Ciolino | C34: ='\\SER\Software\other\[POINTS NQS  2012.XLS]Pro Outlaw'!C38 -> Hammond, LA | D34: ='\\SER\Software\other\[POINTS NQS  2012.XLS]Pro Outlaw'!D38 -> 145 | E34: =IF('\\SER\Software\other\[POINTS NQS  2012.XLS]Pro Outlaw'!E38=0,"",'\\SER\Software\other\[POINTS NQS  2012.XLS]Pro Outlaw'!E38) -> Mechanical Nightmare | F34: ='\\SER\Software\other\[POINTS NQS  2012.XLS]Pro Outlaw'!AA38 -> 54 | H34: ='\\SER\Software\other\[POINTS NQS  2012.XLS]Lite Outlaw'!A13 -> 7 | I34: ='\\SER\Software\other\[POINTS NQS  2012.XLS]Lite Outlaw'!B13 -> Jerry Sweet | J34: ='\\SER\Software\other\[POINTS NQS  2012.XLS]Lite Outlaw'!C13 -> Clymer, NY | K34: ='\\SER\Software\other\[POINTS NQS  2012.XLS]Lite Outlaw'!D13 -> 284 | L34: =IF('\\SER\Software\other\[POINTS NQS  2012.XLS]Lite Outlaw'!E13=0,"",'\\SER\Software\other\[POINTS NQS  2012.XLS]Lite Outlaw'!E13) -> Phat Ride | M34: ='\\SER\Software\other\[POINTS NQS  2012.XLS]Lite Outlaw'!AA13 -> 6
A35: ='\\SER\Software\other\[POINTS NQS  2012.XLS]Pro Outlaw'!A39 -> 33 | B35: ='\\SER\Software\other\[POINTS NQS  2012.XLS]Pro Outlaw'!B39 -> Cody Costa | C35: ='\\SER\Software\other\[POINTS NQS  2012.XLS]Pro Outlaw'!C39 -> Greencastle, PA | D35: ='\\SER\Software\other\[POINTS NQS  2012.XLS]Pro Outlaw'!D39 -> 397 | E35: =IF('\\SER\Software\other\[POINTS NQS  2012.XLS]Pro Outlaw'!E39=0,"",'\\SER\Software\other\[POINTS NQS  2012.XLS]Pro Outlaw'!E39) -> Crossthreaded | F35: ='\\SER\Software\other\[POINTS NQS  2012.XLS]Pro Outlaw'!AA39 -> 55 | H35: ='\\SER\Software\other\[POINTS NQS  2012.XLS]Lite Outlaw'!A14 -> 8 | I35: ='\\SER\Software\other\[POINTS NQS  2012.XLS]Lite Outlaw'!B14 -> Nick Ferguson | J35: ='\\SER\Software\other\[POINTS NQS  2012.XLS]Lite Outlaw'!C14 -> Elkhorn, WI | K35: ='\\SER\Software\other\[POINTS NQS  2012.XLS]Lite Outlaw'!D14 -> 100 | L35: =IF('\\SER\Software\other\[POINTS NQS  2012.XLS]Lite Outlaw'!E14=0,"",'\\SER\Software\other\[POINTS NQS  2012.XLS]Lite Outlaw'!E14) -> Raisin Cane | M35: ='\\SER\Software\other\[POINTS NQS  2012.XLS]Lite Outlaw'!AA14 -> 7
A36: ='\\SER\Software\other\[POINTS NQS  2012.XLS]Pro Outlaw'!A40 -> 34 | B36: ='\\SER\Software\other\[POINTS NQS  2012.XLS]Pro Outlaw'!B40 -> Eric Varner | C36: ='\\SER\Software\other\[POINTS NQS  2012.XLS]Pro Outlaw'!C40 -> Versailles, KY | D36: ='\\SER\Software\other\[POINTS NQS  2012.XLS]Pro Outlaw'!D40 -> 482 | E36: =IF('\\SER\Software\other\[POINTS NQS  2012.XLS]Pro Outlaw'!E40=0,"",'\\SER\Software\other\[POINTS NQS  2012.XLS]Pro Outlaw'!E40) -> Extreme Addiction | F36: ='\\SER\Software\other\[POINTS NQS  2012.XLS]Pro Outlaw'!AA40 -> 55 | H36: ='\\SER\Software\other\[POINTS NQS  2012.XLS]Lite Outlaw'!A15 -> 9 | I36: ='\\SER\Software\other\[POINTS NQS  2012.XLS]Lite Outlaw'!B15 -> David Gawatz | J36: ='\\SER\Software\other\[POINTS NQS  2012.XLS]Lite Outlaw'!C15 -> St. Joseph, MO | K36: ='\\SER\Software\other\[POINTS NQS  2012.XLS]Lite Outlaw'!D15 -> 462 | L36: =IF('\\SER\Software\other\[POINTS NQS  2012.XLS]Lite Outlaw'!E15=0,"",'\\SER\Software\other\[POINTS NQS  2012.XLS]Lite Outlaw'!E15) -> Fear The Deere | M36: ='\\SER\Software\other\[POINTS NQS  2012.XLS]Lite Outlaw'!AA15 -> 8
A37: ='\\SER\Software\other\[POINTS NQS  2012.XLS]Pro Outlaw'!A41 -> 35 | B37: ='\\SER\Software\other\[POINTS NQS  2012.XLS]Pro Outlaw'!B41 -> Lowell Vis | C37: ='\\SER\Software\other\[POINTS NQS  2012.XLS]Pro Outlaw'!C41 -> Waupun, WI | D37: ='\\SER\Software\other\[POINTS NQS  2012.XLS]Pro Outlaw'!D41 -> 333 | E37: =IF('\\SER\Software\other\[POINTS NQS  2012.XLS]Pro Outlaw'!E41=0,"",'\\SER\Software\other\[POINTS NQS  2012.XLS]Pro Outlaw'!E41) -> Skittles | F37: ='\\SER\Software\other\[POINTS NQS  2012.XLS]Pro Outlaw'!AA41 -> 56
A38: ='\\SER\Software\other\[POINTS NQS  2012.XLS]Pro Outlaw'!A42 -> 36 | B38: ='\\SER\Software\other\[POINTS NQS  2012.XLS]Pro Outlaw'!B42 -> Mike Kyle | C38: ='\\SER\Software\other\[POINTS NQS  2012.XLS]Pro Outlaw'!C42 -> Edinburgh, IN | D38: ='\\SER\Software\other\[POINTS NQS  2012.XLS]Pro Outlaw'!D42 -> 394 | E38: =IF('\\SER\Software\other\[POINTS NQS  2012.XLS]Pro Outlaw'!E42=0,"",'\\SER\Software\other\[POINTS NQS  2012.XLS]Pro Outlaw'!E42) ->  | F38: ='\\SER\Software\other\[POINTS NQS  2012.XLS]Pro Outlaw'!AA42 -> 56
A39: ='\\SER\Software\other\[POINTS NQS  2012.XLS]Pro Outlaw'!A43 -> 37 | B39: ='\\SER\Software\other\[POINTS NQS  2012.XLS]Pro Outlaw'!B43 -> Drew Burton | C39: ='\\SER\Software\other\[POINTS NQS  2012.XLS]Pro Outlaw'!C43 -> Brookston, IN | D39: ='\\SER\Software\other\[POINTS NQS  2012.XLS]Pro Outlaw'!D43 -> 15 | E39: =IF('\\SER\Software\other\[POINTS NQS  2012.XLS]Pro Outlaw'!E43=0,"",'\\SER\Software\other\[POINTS NQS  2012.XLS]Pro Outlaw'!E43) -> Plain Nuts | F39: ='\\SER\Software\other\[POINTS NQS  2012.XLS]Pro Outlaw'!AA43 -> 57
A40: ='\\SER\Software\other\[POINTS NQS  2012.XLS]Pro Outlaw'!A44 -> 38 | B40: ='\\SER\Software\other\[POINTS NQS  2012.XLS]Pro Outlaw'!B44 -> Harrison Stahl | C40: ='\\SER\Software\other\[POINTS NQS  2012.XLS]Pro Outlaw'!C44 -> Dewitt, IA | D40: ='\\SER\Software\other\[POINTS NQS  2012.XLS]Pro Outlaw'!D44 -> 335 | E40: =IF('\\SER\Software\other\[POINTS NQS  2012.XLS]Pro Outlaw'!E44=0,"",'\\SER\Software\other\[POINTS NQS  2012.XLS]Pro Outlaw'!E44) -> MWSC#3 | F40: ='\\SER\Software\other\[POINTS NQS  2012.XLS]Pro Outlaw'!AA44 -> 57
B63: BUILDERS CUP
B64: PRO/SS ENGINE BUILDERS | E64: SA ENGINE BUILDERS
B66: ='\\SER\Software\other\[POINTS NQS  2012.XLS]Builders Cup'!A4 -> NP = NICHOLS PERFORMANCE | C66: ='\\SER\Software\other\[POINTS NQS  2012.XLS]Builders Cup'!U4 -> 80 | E66: ='\\SER\Software\other\[POINTS NQS  2012.XLS]Builders Cup'!A23 -> TV = TODD VORHEES | F66: ='\\SER\Software\other\[POINTS NQS  2012.XLS]Builders Cup'!U23 -> 80
B67: ='\\SER\Software\other\[POINTS NQS  2012.XLS]Builders Cup'!A8 -> JW = JOE WHITWORTH | C67: ='\\SER\Software\other\[POINTS NQS  2012.XLS]Builders Cup'!U8 -> 70 | E67: ='\\SER\Software\other\[POINTS NQS  2012.XLS]Builders Cup'!A22 -> NP = NICHOLS PERFORMANCE | F67: ='\\SER\Software\other\[POINTS NQS  2012.XLS]Builders Cup'!U22 -> 74
B68: ='\\SER\Software\other\[POINTS NQS  2012.XLS]Builders Cup'!A5 -> MVP = MVP RACING | C68: ='\\SER\Software\other\[POINTS NQS  2012.XLS]Builders Cup'!U5 -> 68 | E68: ='\\SER\Software\other\[POINTS NQS  2012.XLS]Builders Cup'!A21 -> JRS = JIMS REPAIR SERVICE | F68: ='\\SER\Software\other\[POINTS NQS  2012.XLS]Builders Cup'!U21 -> 73
B69: ='\\SER\Software\other\[POINTS NQS  2012.XLS]Builders Cup'!A13 -> HACKMAN = GREG HACKMAN | C69: ='\\SER\Software\other\[POINTS NQS  2012.XLS]Builders Cup'!U13 -> 66 | E69: ='\\SER\Software\other\[POINTS NQS  2012.XLS]Builders Cup'!A20 -> BJ = BOB JONES | F69: ='\\SER\Software\other\[POINTS NQS  2012.XLS]Builders Cup'!U20 -> 51
B70: ='\\SER\Software\other\[POINTS NQS  2012.XLS]Builders Cup'!A9 -> VM = VOGEL MFG | C70: ='\\SER\Software\other\[POINTS NQS  2012.XLS]Builders Cup'!U9 -> 46 | E70: ='\\SER\Software\other\[POINTS NQS  2012.XLS]Builders Cup'!A28 -> LR = LAKOTA RACING | F70: ='\\SER\Software\other\[POINTS NQS  2012.XLS]Builders Cup'!U28 -> 46
B71: ='\\SER\Software\other\[POINTS NQS  2012.XLS]Builders Cup'!A6 -> JRS = JIMS REPAIR SERVICE | C71: ='\\SER\Software\other\[POINTS NQS  2012.XLS]Builders Cup'!U6 -> 41 | E71: ='\\SER\Software\other\[POINTS NQS  2012.XLS]Builders Cup'!A26 -> WOODS = DAVE WOODS | F71: ='\\SER\Software\other\[POINTS NQS  2012.XLS]Builders Cup'!U26 -> 26
B72: ='\\SER\Software\other\[POINTS NQS  2012.XLS]Builders Cup'!A10 -> TC = TOOTER CAMPBELL | C72: ='\\SER\Software\other\[POINTS NQS  2012.XLS]Builders Cup'!U10 -> 36 | E72: ='\\SER\Software\other\[POINTS NQS  2012.XLS]Builders Cup'!A27 -> VM = VOGEL MFG | F72: ='\\SER\Software\other\[POINTS NQS  2012.XLS]Builders Cup'!U27 -> 22
B73: ='\\SER\Software\other\[POINTS NQS  2012.XLS]Builders Cup'!A7 -> LR = LAKOTA RACING | C73: ='\\SER\Software\other\[POINTS NQS  2012.XLS]Builders Cup'!U7 -> 0 | E73: ='\\SER\Software\other\[POINTS NQS  2012.XLS]Builders Cup'!A25 -> JW = JOE WHITWORTH | F73: ='\\SER\Software\other\[POINTS NQS  2012.XLS]Builders Cup'!U25 -> 20
B74: ='\\SER\Software\other\[POINTS NQS  2012.XLS]Builders Cup'!A11 -> GTP = MISHLER | C74: ='\\SER\Software\other\[POINTS NQS  2012.XLS]Builders Cup'!U11 -> 0 | E74: ='\\SER\Software\other\[POINTS NQS  2012.XLS]Builders Cup'!A24 -> RPM = RADER | F74: ='\\SER\Software\other\[POINTS NQS  2012.XLS]Builders Cup'!U24 -> 14
B75: ='\\SER\Software\other\[POINTS NQS  2012.XLS]Builders Cup'!A12 -> ROOT = KEVIN ROOT | C75: ='\\SER\Software\other\[POINTS NQS  2012.XLS]Builders Cup'!U12 -> 0 | E75: ='\\SER\Software\other\[POINTS NQS  2012.XLS]Builders Cup'!A29 -> MVP = MVP RACING | F75: ='\\SER\Software\other\[POINTS NQS  2012.XLS]Builders Cup'!U29 -> 0
E76: ='\\SER\Software\other\[POINTS NQS  2012.XLS]Builders Cup'!A30 -> TH = TONY HEIFNER | F76: ='\\SER\Software\other\[POINTS NQS  2012.XLS]Builders Cup'!U30 -> 0