B1: PRO | G1: Thru Sturgis | I1: SUPER STOCK | O1: Thru Sturgis
B2: Name | C2: City/State | D2: Eng | E2: NQS # | F2: Tractor | G2: Points Back | J2: Name | K2: City/State | L2: Eng. | M2: NQS # | N2: Tractor | O2: Points Back
A3: ='\\SER\Software\other\[POINTS NQS  2012.XLS]Pro Stock'!A7 -> 1 | B3: ='\\SER\Software\other\[POINTS NQS  2012.XLS]Pro Stock'!B7 -> Jerry Skuta | C3: ='\\SER\Software\other\[POINTS NQS  2012.XLS]Pro Stock'!C7 -> Kimball, Mich | D3: ='\\SER\Software\other\[POINTS NQS  2012.XLS]Pro Stock'!D7 -> NP | E3: ='\\SER\Software\other\[POINTS NQS  2012.XLS]Pro Stock'!E7 -> 329 | F3: =IF('\\SER\Software\other\[POINTS NQS  2012.XLS]Pro Stock'!F7=0," ",'\\SER\Software\other\[POINTS NQS  2012.XLS]Pro Stock'!F7) -> Green Tractor | G3: ='\\SER\Software\other\[POINTS NQS  2012.XLS]Pro Stock'!AA7 -> 0 | I3: ='\\SER\Software\other\[POINTS NQS  2012.XLS]Super Stock'!A7 -> 1 | J3: ='\\SER\Software\other\[POINTS NQS  2012.XLS]Super Stock'!B7 -> Drew Burton | K3: ='\\SER\Software\other\[POINTS NQS  2012.XLS]Super Stock'!C7 -> Brookston, IN | L3: ='\\SER\Software\other\[POINTS NQS  2012.XLS]Super Stock'!D7 -> NP | M3: ='\\SER\Software\other\[POINTS NQS  2012.XLS]Super Stock'!E7 -> 14 | N3: =IF('\\SER\Software\other\[POINTS NQS  2012.XLS]Super Stock'!F7=0," ",'\\SER\Software\other\[POINTS NQS  2012.XLS]Super Stock'!F7) -> Bad Company | O3: ='\\SER\Software\other\[POINTS NQS  2012.XLS]Super Stock'!AA7 -> 0
A4: ='\\SER\Software\other\[POINTS NQS  2012.XLS]Pro Stock'!A8 -> 2 | B4: ='\\SER\Software\other\[POINTS NQS  2012.XLS]Pro Stock'!B8 -> Tyler Hackman | C4: ='\\SER\Software\other\[POINTS NQS  2012.XLS]Pro Stock'!C8 -> Seymour, Ind | D4: ='\\SER\Software\other\[POINTS NQS  2012.XLS]Pro Stock'!D8 -> Hackman | E4: ='\\SER\Software\other\[POINTS NQS  2012.XLS]Pro Stock'!E8 -> 504 | F4: =IF('\\SER\Software\other\[POINTS NQS  2012.XLS]Pro Stock'!F8=0," ",'\\SER\Software\other\[POINTS NQS  2012.XLS]Pro Stock'!F8) -> Green | G4: ='\\SER\Software\other\[POINTS NQS  2012.XLS]Pro Stock'!AA8 -> 2 | I4: ='\\SER\Software\other\[POINTS NQS  2012.XLS]Super Stock'!A8 -> 2 | J4: ='\\SER\Software\other\[POINTS NQS  2012.XLS]Super Stock'!B8 -> Kelly Nichols | K4: ='\\SER\Software\other\[POINTS NQS  2012.XLS]Super Stock'!C8 -> Lore City, OH | L4: ='\\SER\Software\other\[POINTS NQS  2012.XLS]Super Stock'!D8 -> NP | M4: ='\\SER\Software\other\[POINTS NQS  2012.XLS]Super Stock'!E8 -> 70 | N4: =IF('\\SER\Software\other\[POINTS NQS  2012.XLS]Super Stock'!F8=0," ",'\\SER\Software\other\[POINTS NQS  2012.XLS]Super Stock'!F8) -> Wild One 2 | O4: ='\\SER\Software\other\[POINTS NQS  2012.XLS]Super Stock'!AA8 -> 1
A5: ='\\SER\Software\other\[POINTS NQS  2012.XLS]Pro Stock'!A9 -> 3 | B5: ='\\SER\Software\other\[POINTS NQS  2012.XLS]Pro Stock'!B9 -> Drew Burton | C5: ='\\SER\Software\other\[POINTS NQS  2012.XLS]Pro Stock'!C9 -> Brookston, Ill | D5: ='\\SER\Software\other\[POINTS NQS  2012.XLS]Pro Stock'!D9 -> NP | E5: ='\\SER\Software\other\[POINTS NQS  2012.XLS]Pro Stock'!E9 -> 15 | F5: =IF('\\SER\Software\other\[POINTS NQS  2012.XLS]Pro Stock'!F9=0," ",'\\SER\Software\other\[POINTS NQS  2012.XLS]Pro Stock'!F9) -> Plain Nuts | G5: ='\\SER\Software\other\[POINTS NQS  2012.XLS]Pro Stock'!AA9 -> 4 | I5: ='\\SER\Software\other\[POINTS NQS  2012.XLS]Super Stock'!A9 -> 3 | J5: ='\\SER\Software\other\[POINTS NQS  2012.XLS]Super Stock'!B9 -> Greg Curtsinger | K5: ='\\SER\Software\other\[POINTS NQS  2012.XLS]Super Stock'!C9 -> Carlilse, KY | L5: ='\\SER\Software\other\[POINTS NQS  2012.XLS]Super Stock'!D9 -> NP | M5: ='\\SER\Software\other\[POINTS NQS  2012.XLS]Super Stock'!E9 -> 8 | N5: =IF('\\SER\Software\other\[POINTS NQS  2012.XLS]Super Stock'!F9=0," ",'\\SER\Software\other\[POINTS NQS  2012.XLS]Super Stock'!F9) -> Wicked Deere | O5: ='\\SER\Software\other\[POINTS NQS  2012.XLS]Super Stock'!AA9 -> 2
A6: ='\\SER\Software\other\[POINTS NQS  2012.XLS]Pro Stock'!A10 -> 4 | B6: ='\\SER\Software\other\[POINTS NQS  2012.XLS]Pro Stock'!B10 -> Drew Burton | C6: ='\\SER\Software\other\[POINTS NQS  2012.XLS]Pro Stock'!C10 -> Brookston,Ill | D6: ='\\SER\Software\other\[POINTS NQS  2012.XLS]Pro Stock'!D10 -> NP | E6: ='\\SER\Software\other\[POINTS NQS  2012.XLS]Pro Stock'!E10 -> 14 | F6: =IF('\\SER\Software\other\[POINTS NQS  2012.XLS]Pro Stock'!F10=0," ",'\\SER\Software\other\[POINTS NQS  2012.XLS]Pro Stock'!F10) -> Bad Company | G6: ='\\SER\Software\other\[POINTS NQS  2012.XLS]Pro Stock'!AA10 -> 5 | I6: ='\\SER\Software\other\[POINTS NQS  2012.XLS]Super Stock'!A10 -> 4 | J6: ='\\SER\Software\other\[POINTS NQS  2012.XLS]Super Stock'!B10 -> Larry Curtsinger | K6: ='\\SER\Software\other\[POINTS NQS  2012.XLS]Super Stock'!C10 -> Carlilse, KY | L6: ='\\SER\Software\other\[POINTS NQS  2012.XLS]Super Stock'!D10 -> NP | M6: ='\\SER\Software\other\[POINTS NQS  2012.XLS]Super Stock'!E10 -> 9 | N6: =IF('\\SER\Software\other\[POINTS NQS  2012.XLS]Super Stock'!F10=0," ",'\\SER\Software\other\[POINTS NQS  2012.XLS]Super Stock'!F10) -> Runaway Deere | O6: ='\\SER\Software\other\[POINTS NQS  2012.XLS]Super Stock'!AA10 -> 3
A7: ='\\SER\Software\other\[POINTS NQS  2012.XLS]Pro Stock'!A11 -> 5 | B7: ='\\SER\Software\other\[POINTS NQS  2012.XLS]Pro Stock'!B11 -> Eli Zimmerman | C7: ='\\SER\Software\other\[POINTS NQS  2012.XLS]Pro Stock'!C11 -> Allentown, Pa | D7: ='\\SER\Software\other\[POINTS NQS  2012.XLS]Pro Stock'!D11 -> NP | E7: ='\\SER\Software\other\[POINTS NQS  2012.XLS]Pro Stock'!E11 -> 74 | F7: =IF('\\SER\Software\other\[POINTS NQS  2012.XLS]Pro Stock'!F11=0," ",'\\SER\Software\other\[POINTS NQS  2012.XLS]Pro Stock'!F11) -> Red Fever | G7: ='\\SER\Software\other\[POINTS NQS  2012.XLS]Pro Stock'!AA11 -> 5 | I7: ='\\SER\Software\other\[POINTS NQS  2012.XLS]Super Stock'!A11 -> 5 | J7: ='\\SER\Software\other\[POINTS NQS  2012.XLS]Super Stock'!B11 -> David Gawatz | K7: ='\\SER\Software\other\[POINTS NQS  2012.XLS]Super Stock'!C11 -> St. Joseph, MO | L7: ='\\SER\Software\other\[POINTS NQS  2012.XLS]Super Stock'!D11 -> JW | M7: ='\\SER\Software\other\[POINTS NQS  2012.XLS]Super Stock'!E11 -> 184 | N7: =IF('\\SER\Software\other\[POINTS NQS  2012.XLS]Super Stock'!F11=0," ",'\\SER\Software\other\[POINTS NQS  2012.XLS]Super Stock'!F11) -> Low Hung Buck | O7: ='\\SER\Software\other\[POINTS NQS  2012.XLS]Super Stock'!AA11 -> 3
A8: ='\\SER\Software\other\[POINTS NQS  2012.XLS]Pro Stock'!A12 -> 6 | B8: ='\\SER\Software\other\[POINTS NQS  2012.XLS]Pro Stock'!B12 -> Cody Costa | C8: ='\\SER\Software\other\[POINTS NQS  2012.XLS]Pro Stock'!C12 -> Greencastle,Pa | D8: ='\\SER\Software\other\[POINTS NQS  2012.XLS]Pro Stock'!D12 -> NP | E8: ='\\SER\Software\other\[POINTS NQS  2012.XLS]Pro Stock'!E12 -> 397 | F8: =IF('\\SER\Software\other\[POINTS NQS  2012.XLS]Pro Stock'!F12=0," ",'\\SER\Software\other\[POINTS NQS  2012.XLS]Pro Stock'!F12) -> Crossthreaded | G8: ='\\SER\Software\other\[POINTS NQS  2012.XLS]Pro Stock'!AA12 -> 6 | I8: ='\\SER\Software\other\[POINTS NQS  2012.XLS]Super Stock'!A12 -> 6 | J8: ='\\SER\Software\other\[POINTS NQS  2012.XLS]Super Stock'!B12 -> Jerry Binkley | K8: ='\\SER\Software\other\[POINTS NQS  2012.XLS]Super Stock'!C12 -> Jefferson City, MO | L8: ='\\SER\Software\other\[POINTS NQS  2012.XLS]Super Stock'!D12 -> MVP | M8: ='\\SER\Software\other\[POINTS NQS  2012.XLS]Super Stock'!E12 -> 92 | N8: =IF('\\SER\Software\other\[POINTS NQS  2012.XLS]Super Stock'!F12=0," ",'\\SER\Software\other\[POINTS NQS  2012.XLS]Super Stock'!F12) -> Grandpa's Toy | O8: ='\\SER\Software\other\[POINTS NQS  2012.XLS]Super Stock'!AA12 -> 6
A9: ='\\SER\Software\other\[POINTS NQS  2012.XLS]Pro Stock'!A13 -> 7 | B9: ='\\SER\Software\other\[POINTS NQS  2012.XLS]Pro Stock'!B13 -> Jerry Skuta | C9: ='\\SER\Software\other\[POINTS NQS  2012.XLS]Pro Stock'!C13 -> Kimball, Mich | D9: ='\\SER\Software\other\[POINTS NQS  2012.XLS]Pro Stock'!D13 -> NP | E9: ='\\SER\Software\other\[POINTS NQS  2012.XLS]Pro Stock'!E13 -> 330 | F9: =IF('\\SER\Software\other\[POINTS NQS  2012.XLS]Pro Stock'!F13=0," ",'\\SER\Software\other\[POINTS NQS  2012.XLS]Pro Stock'!F13) -> Mental Health | G9: ='\\SER\Software\other\[POINTS NQS  2012.XLS]Pro Stock'!AA13 -> 7 | I9: ='\\SER\Software\other\[POINTS NQS  2012.XLS]Super Stock'!A13 -> 7 | J9: ='\\SER\Software\other\[POINTS NQS  2012.XLS]Super Stock'!B13 -> Cody Costa | K9: ='\\SER\Software\other\[POINTS NQS  2012.XLS]Super Stock'!C13 -> Greencastle, PA | L9: ='\\SER\Software\other\[POINTS NQS  2012.XLS]Super Stock'!D13 -> NP | M9: ='\\SER\Software\other\[POINTS NQS  2012.XLS]Super Stock'!E13 -> 397 | N9: =IF('\\SER\Software\other\[POINTS NQS  2012.XLS]Super Stock'!F13=0," ",'\\SER\Software\other\[POINTS NQS  2012.XLS]Super Stock'!F13) -> Crossthreaded | O9: ='\\SER\Software\other\[POINTS NQS  2012.XLS]Super Stock'!AA13 -> 6
A10: ='\\SER\Software\other\[POINTS NQS  2012.XLS]Pro Stock'!A14 -> 8 | B10: ='\\SER\Software\other\[POINTS NQS  2012.XLS]Pro Stock'!B14 -> Steve Williford | C10: ='\\SER\Software\other\[POINTS NQS  2012.XLS]Pro Stock'!C14 -> Englehard, NC | D10: ='\\SER\Software\other\[POINTS NQS  2012.XLS]Pro Stock'!D14 -> MVP | E10: ='\\SER\Software\other\[POINTS NQS  2012.XLS]Pro Stock'!E14 -> 177 | F10: =IF('\\SER\Software\other\[POINTS NQS  2012.XLS]Pro Stock'!F14=0," ",'\\SER\Software\other\[POINTS NQS  2012.XLS]Pro Stock'!F14) -> Williford Trucking IH | G10: ='\\SER\Software\other\[POINTS NQS  2012.XLS]Pro Stock'!AA14 -> 9 | I10: ='\\SER\Software\other\[POINTS NQS  2012.XLS]Super Stock'!A14 -> 8 | J10: ='\\SER\Software\other\[POINTS NQS  2012.XLS]Super Stock'!B14 -> Drew Burton | K10: ='\\SER\Software\other\[POINTS NQS  2012.XLS]Super Stock'!C14 -> Brookston, IN | L10: ='\\SER\Software\other\[POINTS NQS  2012.XLS]Super Stock'!D14 -> NP | M10: ='\\SER\Software\other\[POINTS NQS  2012.XLS]Super Stock'!E14 -> 15 | N10: =IF('\\SER\Software\other\[POINTS NQS  2012.XLS]Super Stock'!F14=0," ",'\\SER\Software\other\[POINTS NQS  2012.XLS]Super Stock'!F14) -> Plain Nuts | O10: ='\\SER\Software\other\[POINTS NQS  2012.XLS]Super Stock'!AA14 -> 8
A11: ='\\SER\Software\other\[POINTS NQS  2012.XLS]Pro Stock'!A15 -> 9 | B11: ='\\SER\Software\other\[POINTS NQS  2012.XLS]Pro Stock'!B15 -> John Innerest | C11: ='\\SER\Software\other\[POINTS NQS  2012.XLS]Pro Stock'!C15 -> Red Lion, Pa | D11: ='\\SER\Software\other\[POINTS NQS  2012.XLS]Pro Stock'!D15 -> NP | E11: ='\\SER\Software\other\[POINTS NQS  2012.XLS]Pro Stock'!E15 -> 252 | F11: =IF('\\SER\Software\other\[POINTS NQS  2012.XLS]Pro Stock'!F15=0," ",'\\SER\Software\other\[POINTS NQS  2012.XLS]Pro Stock'!F15) -> Mean N Nasty | G11: ='\\SER\Software\other\[POINTS NQS  2012.XLS]Pro Stock'!AA15 -> 9 | I11: ='\\SER\Software\other\[POINTS NQS  2012.XLS]Super Stock'!A15 -> 9 | J11: ='\\SER\Software\other\[POINTS NQS  2012.XLS]Super Stock'!B15 -> Eli Zimmerman | K11: ='\\SER\Software\other\[POINTS NQS  2012.XLS]Super Stock'!C15 -> Allentown, PA | L11: ='\\SER\Software\other\[POINTS NQS  2012.XLS]Super Stock'!D15 -> NP | M11: ='\\SER\Software\other\[POINTS NQS  2012.XLS]Super Stock'!E15 -> 456 | N11: =IF('\\SER\Software\other\[POINTS NQS  2012.XLS]Super Stock'!F15=0," ",'\\SER\Software\other\[POINTS NQS  2012.XLS]Super Stock'!F15) -> Lot of Nichols | O11: ='\\SER\Software\other\[POINTS NQS  2012.XLS]Super Stock'!AA15 -> 9
A12: ='\\SER\Software\other\[POINTS NQS  2012.XLS]Pro Stock'!A16 -> 10 | B12: ='\\SER\Software\other\[POINTS NQS  2012.XLS]Pro Stock'!B16 -> Harrison Stahl | C12: ='\\SER\Software\other\[POINTS NQS  2012.XLS]Pro Stock'!C16 -> Welton, IA | D12: ='\\SER\Software\other\[POINTS NQS  2012.XLS]Pro Stock'!D16 -> MVP | E12: ='\\SER\Software\other\[POINTS NQS  2012.XLS]Pro Stock'!E16 -> 335 | F12: =IF('\\SER\Software\other\[POINTS NQS  2012.XLS]Pro Stock'!F16=0," ",'\\SER\Software\other\[POINTS NQS  2012.XLS]Pro Stock'!F16) -> MWSC #3 | G12: ='\\SER\Software\other\[POINTS NQS  2012.XLS]Pro Stock'!AA16 -> 11 | I12: ='\\SER\Software\other\[POINTS NQS  2012.XLS]Super Stock'!A16 -> 10 | J12: ='\\SER\Software\other\[POINTS NQS  2012.XLS]Super Stock'!B16 -> Jerry Skuta | K12: ='\\SER\Software\other\[POINTS NQS  2012.XLS]Super Stock'!C16 -> Kimball, MI | L12: ='\\SER\Software\other\[POINTS NQS  2012.XLS]Super Stock'!D16 -> NP | M12: ='\\SER\Software\other\[POINTS NQS  2012.XLS]Super Stock'!E16 -> 329 | N12: =IF('\\SER\Software\other\[POINTS NQS  2012.XLS]Super Stock'!F16=0," ",'\\SER\Software\other\[POINTS NQS  2012.XLS]Super Stock'!F16) -> Green Tractor | O12: ='\\SER\Software\other\[POINTS NQS  2012.XLS]Super Stock'!AA16 -> 10
A13: ='\\SER\Software\other\[POINTS NQS  2012.XLS]Pro Stock'!A17 -> 11 | B13: ='\\SER\Software\other\[POINTS NQS  2012.XLS]Pro Stock'!B17 -> Larry Fox | C13: ='\\SER\Software\other\[POINTS NQS  2012.XLS]Pro Stock'!C17 -> Reynoldsburg, Oh | D13: ='\\SER\Software\other\[POINTS NQS  2012.XLS]Pro Stock'!D17 -> JRS | E13: ='\\SER\Software\other\[POINTS NQS  2012.XLS]Pro Stock'!E17 -> 7 | F13: =IF('\\SER\Software\other\[POINTS NQS  2012.XLS]Pro Stock'!F17=0," ",'\\SER\Software\other\[POINTS NQS  2012.XLS]Pro Stock'!F17) -> Intimidation | G13: ='\\SER\Software\other\[POINTS NQS  2012.XLS]Pro Stock'!AA17 -> 12 | I13: ='\\SER\Software\other\[POINTS NQS  2012.XLS]Super Stock'!A17 -> 11 | J13: ='\\SER\Software\other\[POINTS NQS  2012.XLS]Super Stock'!B17 -> Steve Williford | K13: ='\\SER\Software\other\[POINTS NQS  2012.XLS]Super Stock'!C17 -> Engelhard, NC | L13: ='\\SER\Software\other\[POINTS NQS  2012.XLS]Super Stock'!D17 -> MVP | M13: ='\\SER\Software\other\[POINTS NQS  2012.XLS]Super Stock'!E17 -> 177 | N13: =IF('\\SER\Software\other\[POINTS NQS  2012.XLS]Super Stock'!F17=0," ",'\\SER\Software\other\[POINTS NQS  2012.XLS]Super Stock'!F17) -> Williford Trucking IH | O13: ='\\SER\Software\other\[POINTS NQS  2012.XLS]Super Stock'!AA17 -> 14
A14: ='\\SER\Software\other\[POINTS NQS  2012.XLS]Pro Stock'!A18 -> 12 | B14: ='\\SER\Software\other\[POINTS NQS  2012.XLS]Pro Stock'!B18 -> Kelly Nichols | C14: ='\\SER\Software\other\[POINTS NQS  2012.XLS]Pro Stock'!C18 -> Lore City, Oh | D14: ='\\SER\Software\other\[POINTS NQS  2012.XLS]Pro Stock'!D18 -> NP | E14: ='\\SER\Software\other\[POINTS NQS  2012.XLS]Pro Stock'!E18 -> 70 | F14: =IF('\\SER\Software\other\[POINTS NQS  2012.XLS]Pro Stock'!F18=0," ",'\\SER\Software\other\[POINTS NQS  2012.XLS]Pro Stock'!F18) -> Wild One 2 | G14: ='\\SER\Software\other\[POINTS NQS  2012.XLS]Pro Stock'!AA18 -> 12 | I14: ='\\SER\Software\other\[POINTS NQS  2012.XLS]Super Stock'!A18 -> 12 | J14: ='\\SER\Software\other\[POINTS NQS  2012.XLS]Super Stock'!B18 -> Elaine Fisher | K14: ='\\SER\Software\other\[POINTS NQS  2012.XLS]Super Stock'!C18 -> Waterford, OH | L14: ='\\SER\Software\other\[POINTS NQS  2012.XLS]Super Stock'!D18 -> VM | M14: ='\\SER\Software\other\[POINTS NQS  2012.XLS]Super Stock'!E18 -> 80 | N14: =IF('\\SER\Software\other\[POINTS NQS  2012.XLS]Super Stock'!F18=0," ",'\\SER\Software\other\[POINTS NQS  2012.XLS]Super Stock'!F18) -> Blue Thunder | O14: ='\\SER\Software\other\[POINTS NQS  2012.XLS]Super Stock'!AA18 -> 15
A15: ='\\SER\Software\other\[POINTS NQS  2012.XLS]Pro Stock'!A19 -> 13 | B15: ='\\SER\Software\other\[POINTS NQS  2012.XLS]Pro Stock'!B19 -> Alex Naffe | C15: ='\\SER\Software\other\[POINTS NQS  2012.XLS]Pro Stock'!C19 -> Edinburg, Ind | D15: ='\\SER\Software\other\[POINTS NQS  2012.XLS]Pro Stock'!D19 -> Hackman | E15: ='\\SER\Software\other\[POINTS NQS  2012.XLS]Pro Stock'!E19 -> 218 | F15: =IF('\\SER\Software\other\[POINTS NQS  2012.XLS]Pro Stock'!F19=0," ",'\\SER\Software\other\[POINTS NQS  2012.XLS]Pro Stock'!F19) -> Game On | G15: ='\\SER\Software\other\[POINTS NQS  2012.XLS]Pro Stock'!AA19 -> 12 | I15: ='\\SER\Software\other\[POINTS NQS  2012.XLS]Super Stock'!A19 -> 13 | J15: ='\\SER\Software\other\[POINTS NQS  2012.XLS]Super Stock'!B19 -> Alex Naffe | K15: ='\\SER\Software\other\[POINTS NQS  2012.XLS]Super Stock'!C19 -> Seymour, IN | L15: ='\\SER\Software\other\[POINTS NQS  2012.XLS]Super Stock'!D19 -> Hackman | M15: ='\\SER\Software\other\[POINTS NQS  2012.XLS]Super Stock'!E19 -> 218 | N15: =IF('\\SER\Software\other\[POINTS NQS  2012.XLS]Super Stock'!F19=0," ",'\\SER\Software\other\[POINTS NQS  2012.XLS]Super Stock'!F19) -> Game On | O15: ='\\SER\Software\other\[POINTS NQS  2012.XLS]Super Stock'!AA19 -> 15
A16: ='\\SER\Software\other\[POINTS NQS  2012.XLS]Pro Stock'!A20 -> 14 | B16: ='\\SER\Software\other\[POINTS NQS  2012.XLS]Pro Stock'!B20 -> Eli Zimmerman | C16: ='\\SER\Software\other\[POINTS NQS  2012.XLS]Pro Stock'!C20 -> Allentown, Pa | D16: ='\\SER\Software\other\[POINTS NQS  2012.XLS]Pro Stock'!D20 -> NP | E16: ='\\SER\Software\other\[POINTS NQS  2012.XLS]Pro Stock'!E20 -> 456 | F16: =IF('\\SER\Software\other\[POINTS NQS  2012.XLS]Pro Stock'!F20=0," ",'\\SER\Software\other\[POINTS NQS  2012.XLS]Pro Stock'!F20) -> Lots of Nichols | G16: ='\\SER\Software\other\[POINTS NQS  2012.XLS]Pro Stock'!AA20 -> 13 | I16: ='\\SER\Software\other\[POINTS NQS  2012.XLS]Super Stock'!A20 -> 14 | J16: ='\\SER\Software\other\[POINTS NQS  2012.XLS]Super Stock'!B20 -> Daryl Musser | K16: ='\\SER\Software\other\[POINTS NQS  2012.XLS]Super Stock'!C20 -> Greencastle, PA | L16: ='\\SER\Software\other\[POINTS NQS  2012.XLS]Super Stock'!D20 -> NP | M16: ='\\SER\Software\other\[POINTS NQS  2012.XLS]Super Stock'!E20 -> 396 | N16: =IF('\\SER\Software\other\[POINTS NQS  2012.XLS]Super Stock'!F20=0," ",'\\SER\Software\other\[POINTS NQS  2012.XLS]Super Stock'!F20) -> 5 Cents | O16: ='\\SER\Software\other\[POINTS NQS  2012.XLS]Super Stock'!AA20 -> 15
A17: ='\\SER\Software\other\[POINTS NQS  2012.XLS]Pro Stock'!A21 -> 15 | B17: ='\\SER\Software\other\[POINTS NQS  2012.XLS]Pro Stock'!B21 -> David Gawatz | C17: ='\\SER\Software\other\[POINTS NQS  2012.XLS]Pro Stock'!C21 -> St Joseph, Mo | D17: ='\\SER\Software\other\[POINTS NQS  2012.XLS]Pro Stock'!D21 -> JW | E17: ='\\SER\Software\other\[POINTS NQS  2012.XLS]Pro Stock'!E21 -> 184 | F17: =IF('\\SER\Software\other\[POINTS NQS  2012.XLS]Pro Stock'!F21=0," ",'\\SER\Software\other\[POINTS NQS  2012.XLS]Pro Stock'!F21) -> Low Hung Buck | G17: ='\\SER\Software\other\[POINTS NQS  2012.XLS]Pro Stock'!AA21 -> 14 | I17: ='\\SER\Software\other\[POINTS NQS  2012.XLS]Super Stock'!A21 -> 15 | J17: ='\\SER\Software\other\[POINTS NQS  2012.XLS]Super Stock'!B21 -> Harrison Stahl | K17: ='\\SER\Software\other\[POINTS NQS  2012.XLS]Super Stock'!C21 -> Dewitt, IA | L17: ='\\SER\Software\other\[POINTS NQS  2012.XLS]Super Stock'!D21 -> MVP | M17: ='\\SER\Software\other\[POINTS NQS  2012.XLS]Super Stock'!E21 -> 336 | N17: =IF('\\SER\Software\other\[POINTS NQS  2012.XLS]Super Stock'!F21=0," ",'\\SER\Software\other\[POINTS NQS  2012.XLS]Super Stock'!F21) -> MWSC # 4 | O17: ='\\SER\Software\other\[POINTS NQS  2012.XLS]Super Stock'!AA21 -> 16
A18: ='\\SER\Software\other\[POINTS NQS  2012.XLS]Pro Stock'!A22 -> 16 | B18: ='\\SER\Software\other\[POINTS NQS  2012.XLS]Pro Stock'!B22 -> Steve Chrisman | C18: ='\\SER\Software\other\[POINTS NQS  2012.XLS]Pro Stock'!C22 -> Edinburg, Ind | D18: ='\\SER\Software\other\[POINTS NQS  2012.XLS]Pro Stock'!D22 -> Hackman | E18: ='\\SER\Software\other\[POINTS NQS  2012.XLS]Pro Stock'!E22 -> 26 | F18: =IF('\\SER\Software\other\[POINTS NQS  2012.XLS]Pro Stock'!F22=0," ",'\\SER\Software\other\[POINTS NQS  2012.XLS]Pro Stock'!F22) -> JD | G18: ='\\SER\Software\other\[POINTS NQS  2012.XLS]Pro Stock'!AA22 -> 18 | I18: ='\\SER\Software\other\[POINTS NQS  2012.XLS]Super Stock'!A22 -> 16 | J18: ='\\SER\Software\other\[POINTS NQS  2012.XLS]Super Stock'!B22 -> Don Vogt | K18: ='\\SER\Software\other\[POINTS NQS  2012.XLS]Super Stock'!C22 -> Campbellsport, WI | L18: ='\\SER\Software\other\[POINTS NQS  2012.XLS]Super Stock'!D22 -> MVP | M18: ='\\SER\Software\other\[POINTS NQS  2012.XLS]Super Stock'!E22 -> 90 | N18: =IF('\\SER\Software\other\[POINTS NQS  2012.XLS]Super Stock'!F22=0," ",'\\SER\Software\other\[POINTS NQS  2012.XLS]Super Stock'!F22) -> Not A Nuff | O18: ='\\SER\Software\other\[POINTS NQS  2012.XLS]Super Stock'!AA22 -> 18
A19: ='\\SER\Software\other\[POINTS NQS  2012.XLS]Pro Stock'!A23 -> 17 | B19: ='\\SER\Software\other\[POINTS NQS  2012.XLS]Pro Stock'!B23 -> Greg Curtsinger | C19: ='\\SER\Software\other\[POINTS NQS  2012.XLS]Pro Stock'!C23 -> Carlisle. Ky | D19: ='\\SER\Software\other\[POINTS NQS  2012.XLS]Pro Stock'!D23 -> NP | E19: ='\\SER\Software\other\[POINTS NQS  2012.XLS]Pro Stock'!E23 -> 8 | F19: =IF('\\SER\Software\other\[POINTS NQS  2012.XLS]Pro Stock'!F23=0," ",'\\SER\Software\other\[POINTS NQS  2012.XLS]Pro Stock'!F23) -> Wicked Deere | G19: ='\\SER\Software\other\[POINTS NQS  2012.XLS]Pro Stock'!AA23 -> 19 | I19: ='\\SER\Software\other\[POINTS NQS  2012.XLS]Super Stock'!A23 -> 17 | J19: ='\\SER\Software\other\[POINTS NQS  2012.XLS]Super Stock'!B23 -> Steve Williford | K19: ='\\SER\Software\other\[POINTS NQS  2012.XLS]Super Stock'!C23 -> Engelhard, NC | L19: ='\\SER\Software\other\[POINTS NQS  2012.XLS]Super Stock'!D23 -> MVP | M19: ='\\SER\Software\other\[POINTS NQS  2012.XLS]Super Stock'!E23 -> 276 | N19: =IF('\\SER\Software\other\[POINTS NQS  2012.XLS]Super Stock'!F23=0," ",'\\SER\Software\other\[POINTS NQS  2012.XLS]Super Stock'!F23) -> IH Express #1 | O19: ='\\SER\Software\other\[POINTS NQS  2012.XLS]Super Stock'!AA23 -> 18
A20: ='\\SER\Software\other\[POINTS NQS  2012.XLS]Pro Stock'!A24 -> 18 | B20: ='\\SER\Software\other\[POINTS NQS  2012.XLS]Pro Stock'!B24 -> Mike Aschliman | C20: ='\\SER\Software\other\[POINTS NQS  2012.XLS]Pro Stock'!C24 -> Bridgeway, Wisc | D20: ='\\SER\Software\other\[POINTS NQS  2012.XLS]Pro Stock'!D24 -> MVP | E20: ='\\SER\Software\other\[POINTS NQS  2012.XLS]Pro Stock'!E24 -> 511 | F20: =IF('\\SER\Software\other\[POINTS NQS  2012.XLS]Pro Stock'!F24=0," ",'\\SER\Software\other\[POINTS NQS  2012.XLS]Pro Stock'!F24) -> Brother's Keeper | G20: ='\\SER\Software\other\[POINTS NQS  2012.XLS]Pro Stock'!AA24 -> 20 | I20: ='\\SER\Software\other\[POINTS NQS  2012.XLS]Super Stock'!A24 -> 18 | J20: ='\\SER\Software\other\[POINTS NQS  2012.XLS]Super Stock'!B24 -> Steve Williford | K20: ='\\SER\Software\other\[POINTS NQS  2012.XLS]Super Stock'!C24 -> Engelhard, NC | L20: ='\\SER\Software\other\[POINTS NQS  2012.XLS]Super Stock'!D24 -> MVP | M20: ='\\SER\Software\other\[POINTS NQS  2012.XLS]Super Stock'!E24 -> 176 | N20: =IF('\\SER\Software\other\[POINTS NQS  2012.XLS]Super Stock'!F24=0," ",'\\SER\Software\other\[POINTS NQS  2012.XLS]Super Stock'!F24) -> International | O20: ='\\SER\Software\other\[POINTS NQS  2012.XLS]Super Stock'!AA24 -> 22
A21: ='\\SER\Software\other\[POINTS NQS  2012.XLS]Pro Stock'!A25 -> 19 | B21: ='\\SER\Software\other\[POINTS NQS  2012.XLS]Pro Stock'!B25 -> Julian Stahl | C21: ='\\SER\Software\other\[POINTS NQS  2012.XLS]Pro Stock'!C25 -> Welton, IA | D21: ='\\SER\Software\other\[POINTS NQS  2012.XLS]Pro Stock'!D25 -> MVP | E21: ='\\SER\Software\other\[POINTS NQS  2012.XLS]Pro Stock'!E25 -> 1 | F21: =IF('\\SER\Software\other\[POINTS NQS  2012.XLS]Pro Stock'!F25=0," ",'\\SER\Software\other\[POINTS NQS  2012.XLS]Pro Stock'!F25) -> MWSC # 1 | G21: ='\\SER\Software\other\[POINTS NQS  2012.XLS]Pro Stock'!AA25 -> 22 | I21: ='\\SER\Software\other\[POINTS NQS  2012.XLS]Super Stock'!A25 -> 19 | J21: ='\\SER\Software\other\[POINTS NQS  2012.XLS]Super Stock'!B25 -> Brian Titzer | K21: ='\\SER\Software\other\[POINTS NQS  2012.XLS]Super Stock'!C25 -> Evansville, IN | L21: ='\\SER\Software\other\[POINTS NQS  2012.XLS]Super Stock'!D25 -> TC | M21: ='\\SER\Software\other\[POINTS NQS  2012.XLS]Super Stock'!E25 -> 364 | N21: =IF('\\SER\Software\other\[POINTS NQS  2012.XLS]Super Stock'!F25=0," ",'\\SER\Software\other\[POINTS NQS  2012.XLS]Super Stock'!F25) -> Single Boys Toy | O21: ='\\SER\Software\other\[POINTS NQS  2012.XLS]Super Stock'!AA25 -> 22
A22: ='\\SER\Software\other\[POINTS NQS  2012.XLS]Pro Stock'!A26 -> 20 | B22: ='\\SER\Software\other\[POINTS NQS  2012.XLS]Pro Stock'!B26 -> Steve Williford | C22: ='\\SER\Software\other\[POINTS NQS  2012.XLS]Pro Stock'!C26 -> Englehard, NC | D22: ='\\SER\Software\other\[POINTS NQS  2012.XLS]Pro Stock'!D26 -> MVP | E22: ='\\SER\Software\other\[POINTS NQS  2012.XLS]Pro Stock'!E26 -> 176 | F22: =IF('\\SER\Software\other\[POINTS NQS  2012.XLS]Pro Stock'!F26=0," ",'\\SER\Software\other\[POINTS NQS  2012.XLS]Pro Stock'!F26) -> International | G22: ='\\SER\Software\other\[POINTS NQS  2012.XLS]Pro Stock'!AA26 -> 22 | I22: ='\\SER\Software\other\[POINTS NQS  2012.XLS]Super Stock'!A26 -> 20 | J22: ='\\SER\Software\other\[POINTS NQS  2012.XLS]Super Stock'!B26 -> Mike Aschliman | K22: ='\\SER\Software\other\[POINTS NQS  2012.XLS]Super Stock'!C26 -> Ridgeway, WI | L22: ='\\SER\Software\other\[POINTS NQS  2012.XLS]Super Stock'!D26 -> MVP | M22: ='\\SER\Software\other\[POINTS NQS  2012.XLS]Super Stock'!E26 -> 511 | N22: =IF('\\SER\Software\other\[POINTS NQS  2012.XLS]Super Stock'!F26=0," ",'\\SER\Software\other\[POINTS NQS  2012.XLS]Super Stock'!F26) -> Brother's Keeper | O22: ='\\SER\Software\other\[POINTS NQS  2012.XLS]Super Stock'!AA26 -> 22
A23: ='\\SER\Software\other\[POINTS NQS  2012.XLS]Pro Stock'!A27 -> 21 | B23: ='\\SER\Software\other\[POINTS NQS  2012.XLS]Pro Stock'!B27 -> Ron Scroggins | C23: ='\\SER\Software\other\[POINTS NQS  2012.XLS]Pro Stock'!C27 -> Neosho, Mo | D23: ='\\SER\Software\other\[POINTS NQS  2012.XLS]Pro Stock'!D27 -> VM | E23: ='\\SER\Software\other\[POINTS NQS  2012.XLS]Pro Stock'!E27 -> 110 | F23: =IF('\\SER\Software\other\[POINTS NQS  2012.XLS]Pro Stock'!F27=0," ",'\\SER\Software\other\[POINTS NQS  2012.XLS]Pro Stock'!F27) -> Dirt Dancer | G23: ='\\SER\Software\other\[POINTS NQS  2012.XLS]Pro Stock'!AA27 -> 23 | I23: ='\\SER\Software\other\[POINTS NQS  2012.XLS]Super Stock'!A27 -> 21 | J23: ='\\SER\Software\other\[POINTS NQS  2012.XLS]Super Stock'!B27 -> Tyler Hackman | K23: ='\\SER\Software\other\[POINTS NQS  2012.XLS]Super Stock'!C27 -> Seymour, IN | L23: ='\\SER\Software\other\[POINTS NQS  2012.XLS]Super Stock'!D27 -> Hackman | M23: ='\\SER\Software\other\[POINTS NQS  2012.XLS]Super Stock'!E27 -> 507 | N23: =IF('\\SER\Software\other\[POINTS NQS  2012.XLS]Super Stock'!F27=0," ",'\\SER\Software\other\[POINTS NQS  2012.XLS]Super Stock'!F27) -> Mad Hatter | O23: ='\\SER\Software\other\[POINTS NQS  2012.XLS]Super Stock'!AA27 -> 23
A24: ='\\SER\Software\other\[POINTS NQS  2012.XLS]Pro Stock'!A28 -> 22 | B24: ='\\SER\Software\other\[POINTS NQS  2012.XLS]Pro Stock'!B28 -> Scott Bye | C24: ='\\SER\Software\other\[POINTS NQS  2012.XLS]Pro Stock'!C28 -> Savannah, Mo | D24: ='\\SER\Software\other\[POINTS NQS  2012.XLS]Pro Stock'!D28 -> NP | E24: ='\\SER\Software\other\[POINTS NQS  2012.XLS]Pro Stock'!E28 -> 365 | F24: =IF('\\SER\Software\other\[POINTS NQS  2012.XLS]Pro Stock'!F28=0," ",'\\SER\Software\other\[POINTS NQS  2012.XLS]Pro Stock'!F28) -> Fired Up | G24: ='\\SER\Software\other\[POINTS NQS  2012.XLS]Pro Stock'!AA28 -> 24 | I24: ='\\SER\Software\other\[POINTS NQS  2012.XLS]Super Stock'!A28 -> 22 | J24: ='\\SER\Software\other\[POINTS NQS  2012.XLS]Super Stock'!B28 -> Bruce Austin | K24: ='\\SER\Software\other\[POINTS NQS  2012.XLS]Super Stock'!C28 -> St. Charles, IA | L24: ='\\SER\Software\other\[POINTS NQS  2012.XLS]Super Stock'!D28 -> MVP | M24: ='\\SER\Software\other\[POINTS NQS  2012.XLS]Super Stock'!E28 -> 338 | N24: =IF('\\SER\Software\other\[POINTS NQS  2012.XLS]Super Stock'!F28=0," ",'\\SER\Software\other\[POINTS NQS  2012.XLS]Super Stock'!F28) -> Hillbilly Headache | O24: ='\\SER\Software\other\[POINTS NQS  2012.XLS]Super Stock'!AA28 -> 25
A25: ='\\SER\Software\other\[POINTS NQS  2012.XLS]Pro Stock'!A29 -> 23 | B25: ='\\SER\Software\other\[POINTS NQS  2012.XLS]Pro Stock'!B29 -> Matt Kaster | C25: ='\\SER\Software\other\[POINTS NQS  2012.XLS]Pro Stock'!C29 -> Burlington, Wisc | D25: ='\\SER\Software\other\[POINTS NQS  2012.XLS]Pro Stock'!D29 -> MVP | E25: ='\\SER\Software\other\[POINTS NQS  2012.XLS]Pro Stock'!E29 -> 98 | F25: =IF('\\SER\Software\other\[POINTS NQS  2012.XLS]Pro Stock'!F29=0," ",'\\SER\Software\other\[POINTS NQS  2012.XLS]Pro Stock'!F29) -> Moose | G25: ='\\SER\Software\other\[POINTS NQS  2012.XLS]Pro Stock'!AA29 -> 25 | I25: ='\\SER\Software\other\[POINTS NQS  2012.XLS]Super Stock'!A29 -> 23 | J25: ='\\SER\Software\other\[POINTS NQS  2012.XLS]Super Stock'!B29 -> Jerry Skuta | K25: ='\\SER\Software\other\[POINTS NQS  2012.XLS]Super Stock'!C29 -> Kimball, MI | L25: ='\\SER\Software\other\[POINTS NQS  2012.XLS]Super Stock'!D29 -> NP | M25: ='\\SER\Software\other\[POINTS NQS  2012.XLS]Super Stock'!E29 -> 330 | N25: =IF('\\SER\Software\other\[POINTS NQS  2012.XLS]Super Stock'!F29=0," ",'\\SER\Software\other\[POINTS NQS  2012.XLS]Super Stock'!F29) -> Mental Health 2 | O25: ='\\SER\Software\other\[POINTS NQS  2012.XLS]Super Stock'!AA29 -> 26
A26: ='\\SER\Software\other\[POINTS NQS  2012.XLS]Pro Stock'!A30 -> 24 | B26: ='\\SER\Software\other\[POINTS NQS  2012.XLS]Pro Stock'!B30 -> John Donavan | C26: ='\\SER\Software\other\[POINTS NQS  2012.XLS]Pro Stock'!C30 -> Pataskala, Oh | D26: ='\\SER\Software\other\[POINTS NQS  2012.XLS]Pro Stock'!D30 -> JRS | E26: ='\\SER\Software\other\[POINTS NQS  2012.XLS]Pro Stock'!E30 -> 6 | F26: =IF('\\SER\Software\other\[POINTS NQS  2012.XLS]Pro Stock'!F30=0," ",'\\SER\Software\other\[POINTS NQS  2012.XLS]Pro Stock'!F30) -> John's Deere | G26: ='\\SER\Software\other\[POINTS NQS  2012.XLS]Pro Stock'!AA30 -> 26 | I26: ='\\SER\Software\other\[POINTS NQS  2012.XLS]Super Stock'!A30 -> 24 | J26: ='\\SER\Software\other\[POINTS NQS  2012.XLS]Super Stock'!B30 -> Charlie Korff | K26: ='\\SER\Software\other\[POINTS NQS  2012.XLS]Super Stock'!C30 -> Evansville, IN | L26: ='\\SER\Software\other\[POINTS NQS  2012.XLS]Super Stock'!D30 -> TC | M26: ='\\SER\Software\other\[POINTS NQS  2012.XLS]Super Stock'!E30 -> 400 | N26: =IF('\\SER\Software\other\[POINTS NQS  2012.XLS]Super Stock'!F30=0," ",'\\SER\Software\other\[POINTS NQS  2012.XLS]Super Stock'!F30) -> No Fear Deer | O26: ='\\SER\Software\other\[POINTS NQS  2012.XLS]Super Stock'!AA30 -> 26
A27: ='\\SER\Software\other\[POINTS NQS  2012.XLS]Pro Stock'!A31 -> 25 | B27: ='\\SER\Software\other\[POINTS NQS  2012.XLS]Pro Stock'!B31 -> Randy Demers | C27: ='\\SER\Software\other\[POINTS NQS  2012.XLS]Pro Stock'!C31 -> Columbia, NJ | D27: ='\\SER\Software\other\[POINTS NQS  2012.XLS]Pro Stock'!D31 -> NP | E27: ='\\SER\Software\other\[POINTS NQS  2012.XLS]Pro Stock'!E31 -> 85 | F27: =IF('\\SER\Software\other\[POINTS NQS  2012.XLS]Pro Stock'!F31=0," ",'\\SER\Software\other\[POINTS NQS  2012.XLS]Pro Stock'!F31) -> Widowmaker | G27: ='\\SER\Software\other\[POINTS NQS  2012.XLS]Pro Stock'!AA31 -> 28 | I27: ='\\SER\Software\other\[POINTS NQS  2012.XLS]Super Stock'!A31 -> 25 | J27: ='\\SER\Software\other\[POINTS NQS  2012.XLS]Super Stock'!B31 -> Ron Scroggins | K27: ='\\SER\Software\other\[POINTS NQS  2012.XLS]Super Stock'!C31 -> Neosho, MO | L27: ='\\SER\Software\other\[POINTS NQS  2012.XLS]Super Stock'!D31 -> VM | M27: ='\\SER\Software\other\[POINTS NQS  2012.XLS]Super Stock'!E31 -> 111 | N27: =IF('\\SER\Software\other\[POINTS NQS  2012.XLS]Super Stock'!F31=0," ",'\\SER\Software\other\[POINTS NQS  2012.XLS]Super Stock'!F31) -> Black out | O27: ='\\SER\Software\other\[POINTS NQS  2012.XLS]Super Stock'!AA31 -> 27
A28: ='\\SER\Software\other\[POINTS NQS  2012.XLS]Pro Stock'!A32 -> 26 | B28: ='\\SER\Software\other\[POINTS NQS  2012.XLS]Pro Stock'!B32 -> Mark Conover | C28: ='\\SER\Software\other\[POINTS NQS  2012.XLS]Pro Stock'!C32 -> Edinburg, Ind | D28: ='\\SER\Software\other\[POINTS NQS  2012.XLS]Pro Stock'!D32 -> VM | E28: ='\\SER\Software\other\[POINTS NQS  2012.XLS]Pro Stock'!E32 -> 360 | F28: =IF('\\SER\Software\other\[POINTS NQS  2012.XLS]Pro Stock'!F32=0," ",'\\SER\Software\other\[POINTS NQS  2012.XLS]Pro Stock'!F32) -> VuDoo Too | G28: ='\\SER\Software\other\[POINTS NQS  2012.XLS]Pro Stock'!AA32 -> 28 | I28: ='\\SER\Software\other\[POINTS NQS  2012.XLS]Super Stock'!A32 -> 26 | J28: ='\\SER\Software\other\[POINTS NQS  2012.XLS]Super Stock'!B32 -> Matt Kaster | K28: ='\\SER\Software\other\[POINTS NQS  2012.XLS]Super Stock'!C32 -> Burlington, WI | L28: ='\\SER\Software\other\[POINTS NQS  2012.XLS]Super Stock'!D32 -> MVP | M28: ='\\SER\Software\other\[POINTS NQS  2012.XLS]Super Stock'!E32 -> 98 | N28: =IF('\\SER\Software\other\[POINTS NQS  2012.XLS]Super Stock'!F32=0," ",'\\SER\Software\other\[POINTS NQS  2012.XLS]Super Stock'!F32) -> Moose on the Loose | O28: ='\\SER\Software\other\[POINTS NQS  2012.XLS]Super Stock'!AA32 -> 30
A29: ='\\SER\Software\other\[POINTS NQS  2012.XLS]Pro Stock'!A33 -> 27 | B29: ='\\SER\Software\other\[POINTS NQS  2012.XLS]Pro Stock'!B33 -> Larry Korff | C29: ='\\SER\Software\other\[POINTS NQS  2012.XLS]Pro Stock'!C33 -> Evansville, Ind | D29: ='\\SER\Software\other\[POINTS NQS  2012.XLS]Pro Stock'!D33 -> TC | E29: ='\\SER\Software\other\[POINTS NQS  2012.XLS]Pro Stock'!E33 -> 398 | F29: =IF('\\SER\Software\other\[POINTS NQS  2012.XLS]Pro Stock'!F33=0," ",'\\SER\Software\other\[POINTS NQS  2012.XLS]Pro Stock'!F33) -> Kryptonite | G29: ='\\SER\Software\other\[POINTS NQS  2012.XLS]Pro Stock'!AA33 -> 28 | I29: ='\\SER\Software\other\[POINTS NQS  2012.XLS]Super Stock'!A33 -> 27 | J29: ='\\SER\Software\other\[POINTS NQS  2012.XLS]Super Stock'!B33 -> Ray Gentz | K29: ='\\SER\Software\other\[POINTS NQS  2012.XLS]Super Stock'!C33 -> Colon, MI | L29: ='\\SER\Software\other\[POINTS NQS  2012.XLS]Super Stock'!D33 -> JRS | M29: ='\\SER\Software\other\[POINTS NQS  2012.XLS]Super Stock'!E33 -> 35 | N29: =IF('\\SER\Software\other\[POINTS NQS  2012.XLS]Super Stock'!F33=0," ",'\\SER\Software\other\[POINTS NQS  2012.XLS]Super Stock'!F33) -> B.U. Cub | O29: ='\\SER\Software\other\[POINTS NQS  2012.XLS]Super Stock'!AA33 -> 31
A30: ='\\SER\Software\other\[POINTS NQS  2012.XLS]Pro Stock'!A34 -> 28 | B30: ='\\SER\Software\other\[POINTS NQS  2012.XLS]Pro Stock'!B34 -> Ron Scroggins | C30: ='\\SER\Software\other\[POINTS NQS  2012.XLS]Pro Stock'!C34 -> Neosho, Mo | D30: ='\\SER\Software\other\[POINTS NQS  2012.XLS]Pro Stock'!D34 -> VM | E30: ='\\SER\Software\other\[POINTS NQS  2012.XLS]Pro Stock'!E34 -> 111 | F30: =IF('\\SER\Software\other\[POINTS NQS  2012.XLS]Pro Stock'!F34=0," ",'\\SER\Software\other\[POINTS NQS  2012.XLS]Pro Stock'!F34) -> Black Out | G30: ='\\SER\Software\other\[POINTS NQS  2012.XLS]Pro Stock'!AA34 -> 29 | I30: ='\\SER\Software\other\[POINTS NQS  2012.XLS]Super Stock'!A34 -> 28 | J30: ='\\SER\Software\other\[POINTS NQS  2012.XLS]Super Stock'!B34 -> Scott Bye | K30: ='\\SER\Software\other\[POINTS NQS  2012.XLS]Super Stock'!C34 -> Savannah, MO | L30: ='\\SER\Software\other\[POINTS NQS  2012.XLS]Super Stock'!D34 -> NP | M30: ='\\SER\Software\other\[POINTS NQS  2012.XLS]Super Stock'!E34 -> 365 | N30: =IF('\\SER\Software\other\[POINTS NQS  2012.XLS]Super Stock'!F34=0," ",'\\SER\Software\other\[POINTS NQS  2012.XLS]Super Stock'!F34) -> Fired Up | O30: ='\\SER\Software\other\[POINTS NQS  2012.XLS]Super Stock'!AA34 -> 21
A31: ='\\SER\Software\other\[POINTS NQS  2012.XLS]Pro Stock'!A35 -> 29 | B31: ='\\SER\Software\other\[POINTS NQS  2012.XLS]Pro Stock'!B35 -> Jerry Binkley | C31: ='\\SER\Software\other\[POINTS NQS  2012.XLS]Pro Stock'!C35 -> Jefferson City, Mo | D31: ='\\SER\Software\other\[POINTS NQS  2012.XLS]Pro Stock'!D35 -> MVP | E31: ='\\SER\Software\other\[POINTS NQS  2012.XLS]Pro Stock'!E35 -> 92 | F31: =IF('\\SER\Software\other\[POINTS NQS  2012.XLS]Pro Stock'!F35=0," ",'\\SER\Software\other\[POINTS NQS  2012.XLS]Pro Stock'!F35) -> Grandpa's Toy | G31: ='\\SER\Software\other\[POINTS NQS  2012.XLS]Pro Stock'!AA35 -> 46 | I31: ='\\SER\Software\other\[POINTS NQS  2012.XLS]Super Stock'!A35 -> 29 | J31: ='\\SER\Software\other\[POINTS NQS  2012.XLS]Super Stock'!B35 -> Julian Stahl | K31: ='\\SER\Software\other\[POINTS NQS  2012.XLS]Super Stock'!C35 -> Welton, IA | L31: ='\\SER\Software\other\[POINTS NQS  2012.XLS]Super Stock'!D35 -> MVP | M31: ='\\SER\Software\other\[POINTS NQS  2012.XLS]Super Stock'!E35 -> 1 | N31: =IF('\\SER\Software\other\[POINTS NQS  2012.XLS]Super Stock'!F35=0," ",'\\SER\Software\other\[POINTS NQS  2012.XLS]Super Stock'!F35) -> MWSC # 1 | O31: ='\\SER\Software\other\[POINTS NQS  2012.XLS]Super Stock'!AA35 -> 46
A32: ='\\SER\Software\other\[POINTS NQS  2012.XLS]Pro Stock'!A36 -> 30 | B32: ='\\SER\Software\other\[POINTS NQS  2012.XLS]Pro Stock'!B36 -> Kevin Root | C32: ='\\SER\Software\other\[POINTS NQS  2012.XLS]Pro Stock'!C36 -> Inola, Okla | D32: ='\\SER\Software\other\[POINTS NQS  2012.XLS]Pro Stock'!D36 -> Root | E32: ='\\SER\Software\other\[POINTS NQS  2012.XLS]Pro Stock'!E36 -> 117 | F32: =IF('\\SER\Software\other\[POINTS NQS  2012.XLS]Pro Stock'!F36=0," ",'\\SER\Software\other\[POINTS NQS  2012.XLS]Pro Stock'!F36) -> Right on the Money | G32: ='\\SER\Software\other\[POINTS NQS  2012.XLS]Pro Stock'!AA36 -> 46 | I32: ='\\SER\Software\other\[POINTS NQS  2012.XLS]Super Stock'!A36 -> 30 | J32: ='\\SER\Software\other\[POINTS NQS  2012.XLS]Super Stock'!B36 -> Eli Zimmerman | K32: ='\\SER\Software\other\[POINTS NQS  2012.XLS]Super Stock'!C36 -> Allentown, PA | L32: ='\\SER\Software\other\[POINTS NQS  2012.XLS]Super Stock'!D36 -> NP | M32: ='\\SER\Software\other\[POINTS NQS  2012.XLS]Super Stock'!E36 -> 74 | N32: =IF('\\SER\Software\other\[POINTS NQS  2012.XLS]Super Stock'!F36=0," ",'\\SER\Software\other\[POINTS NQS  2012.XLS]Super Stock'!F36) -> Red Fever | O32: ='\\SER\Software\other\[POINTS NQS  2012.XLS]Super Stock'!AA36 -> 46
A33: ='\\SER\Software\other\[POINTS NQS  2012.XLS]Pro Stock'!A37 -> 31 | B33: ='\\SER\Software\other\[POINTS NQS  2012.XLS]Pro Stock'!B37 -> Nick Mishler | C33: ='\\SER\Software\other\[POINTS NQS  2012.XLS]Pro Stock'!C37 -> E Peoria, Ill | D33: ='\\SER\Software\other\[POINTS NQS  2012.XLS]Pro Stock'!D37 -> GTP | E33: ='\\SER\Software\other\[POINTS NQS  2012.XLS]Pro Stock'!E37 -> 167 | F33: =IF('\\SER\Software\other\[POINTS NQS  2012.XLS]Pro Stock'!F37=0," ",'\\SER\Software\other\[POINTS NQS  2012.XLS]Pro Stock'!F37) -> Pulse | G33: ='\\SER\Software\other\[POINTS NQS  2012.XLS]Pro Stock'!AA37 -> 46 | I33: ='\\SER\Software\other\[POINTS NQS  2012.XLS]Super Stock'!A37 -> 31 | J33: ='\\SER\Software\other\[POINTS NQS  2012.XLS]Super Stock'!B37 -> Rick Slade | K33: ='\\SER\Software\other\[POINTS NQS  2012.XLS]Super Stock'!C37 -> Harveyville, KY | L33: ='\\SER\Software\other\[POINTS NQS  2012.XLS]Super Stock'!D37 -> JRS | M33: ='\\SER\Software\other\[POINTS NQS  2012.XLS]Super Stock'!E37 -> 467 | N33: =IF('\\SER\Software\other\[POINTS NQS  2012.XLS]Super Stock'!F37=0," ",'\\SER\Software\other\[POINTS NQS  2012.XLS]Super Stock'!F37) -> Ricochet | O33: ='\\SER\Software\other\[POINTS NQS  2012.XLS]Super Stock'!AA37 -> 46
A34: ='\\SER\Software\other\[POINTS NQS  2012.XLS]Pro Stock'!A38 -> 32 | B34: ='\\SER\Software\other\[POINTS NQS  2012.XLS]Pro Stock'!B38 -> Charlie Korff | C34: ='\\SER\Software\other\[POINTS NQS  2012.XLS]Pro Stock'!C38 -> Evansville, Ind | D34: ='\\SER\Software\other\[POINTS NQS  2012.XLS]Pro Stock'!D38 -> TC | E34: ='\\SER\Software\other\[POINTS NQS  2012.XLS]Pro Stock'!E38 -> 400 | F34: =IF('\\SER\Software\other\[POINTS NQS  2012.XLS]Pro Stock'!F38=0," ",'\\SER\Software\other\[POINTS NQS  2012.XLS]Pro Stock'!F38) -> No Fear Deer | G34: ='\\SER\Software\other\[POINTS NQS  2012.XLS]Pro Stock'!AA38 -> 46 | I34: ='\\SER\Software\other\[POINTS NQS  2012.XLS]Super Stock'!A38 -> 32 | J34: ='\\SER\Software\other\[POINTS NQS  2012.XLS]Super Stock'!B38 -> Bill Nippe | K34: ='\\SER\Software\other\[POINTS NQS  2012.XLS]Super Stock'!C38 -> Strasburg, IL | L34: ='\\SER\Software\other\[POINTS NQS  2012.XLS]Super Stock'!D38 -> JW | M34: ='\\SER\Software\other\[POINTS NQS  2012.XLS]Super Stock'!E38 -> 513 | N34: =IF('\\SER\Software\other\[POINTS NQS  2012.XLS]Super Stock'!F38=0," ",'\\SER\Software\other\[POINTS NQS  2012.XLS]Super Stock'!F38) -> Serious Business | O34: ='\\SER\Software\other\[POINTS NQS  2012.XLS]Super Stock'!AA38 -> 46
A35: ='\\SER\Software\other\[POINTS NQS  2012.XLS]Pro Stock'!A39 -> 33 | B35: ='\\SER\Software\other\[POINTS NQS  2012.XLS]Pro Stock'!B39 -> Ed Nichols | C35: ='\\SER\Software\other\[POINTS NQS  2012.XLS]Pro Stock'!C39 -> Salvisa, Ky | D35: ='\\SER\Software\other\[POINTS NQS  2012.XLS]Pro Stock'!D39 -> LR | E35: ='\\SER\Software\other\[POINTS NQS  2012.XLS]Pro Stock'!E39 -> 124 | F35: =IF('\\SER\Software\other\[POINTS NQS  2012.XLS]Pro Stock'!F39=0," ",'\\SER\Software\other\[POINTS NQS  2012.XLS]Pro Stock'!F39) -> Track Attack | G35: ='\\SER\Software\other\[POINTS NQS  2012.XLS]Pro Stock'!AA39 -> 47 | I35: ='\\SER\Software\other\[POINTS NQS  2012.XLS]Super Stock'!A39 -> 33 | J35: ='\\SER\Software\other\[POINTS NQS  2012.XLS]Super Stock'!B39 -> John Cress | K35: ='\\SER\Software\other\[POINTS NQS  2012.XLS]Super Stock'!C39 -> Strasburg, IL | L35: ='\\SER\Software\other\[POINTS NQS  2012.XLS]Super Stock'!D39 -> JW | M35: ='\\SER\Software\other\[POINTS NQS  2012.XLS]Super Stock'!E39 -> 170 | N35: =IF('\\SER\Software\other\[POINTS NQS  2012.XLS]Super Stock'!F39=0," ",'\\SER\Software\other\[POINTS NQS  2012.XLS]Super Stock'!F39) -> Blitzed | O35: ='\\SER\Software\other\[POINTS NQS  2012.XLS]Super Stock'!AA39 -> 47
A36: ='\\SER\Software\other\[POINTS NQS  2012.XLS]Pro Stock'!A40 -> 34 | B36: ='\\SER\Software\other\[POINTS NQS  2012.XLS]Pro Stock'!B40 -> Ray Gentz | C36: ='\\SER\Software\other\[POINTS NQS  2012.XLS]Pro Stock'!C40 -> Colon, Mich | D36: ='\\SER\Software\other\[POINTS NQS  2012.XLS]Pro Stock'!D40 -> JRS | E36: ='\\SER\Software\other\[POINTS NQS  2012.XLS]Pro Stock'!E40 -> 262 | F36: =IF('\\SER\Software\other\[POINTS NQS  2012.XLS]Pro Stock'!F40=0," ",'\\SER\Software\other\[POINTS NQS  2012.XLS]Pro Stock'!F40) -> Chaos | G36: ='\\SER\Software\other\[POINTS NQS  2012.XLS]Pro Stock'!AA40 -> 47 | I36: ='\\SER\Software\other\[POINTS NQS  2012.XLS]Super Stock'!A40 -> 34 | J36: ='\\SER\Software\other\[POINTS NQS  2012.XLS]Super Stock'!B40 -> John Cress | K36: ='\\SER\Software\other\[POINTS NQS  2012.XLS]Super Stock'!C40 -> Strasburg, IL | L36: ='\\SER\Software\other\[POINTS NQS  2012.XLS]Super Stock'!D40 -> JW | M36: ='\\SER\Software\other\[POINTS NQS  2012.XLS]Super Stock'!E40 -> 172 | N36: =IF('\\SER\Software\other\[POINTS NQS  2012.XLS]Super Stock'!F40=0," ",'\\SER\Software\other\[POINTS NQS  2012.XLS]Super Stock'!F40) -> Full Tilt | O36: ='\\SER\Software\other\[POINTS NQS  2012.XLS]Super Stock'!AA40 -> 47
A37: ='\\SER\Software\other\[POINTS NQS  2012.XLS]Pro Stock'!A41 -> 35 | B37: ='\\SER\Software\other\[POINTS NQS  2012.XLS]Pro Stock'!B41 -> Steve Williford | C37: ='\\SER\Software\other\[POINTS NQS  2012.XLS]Pro Stock'!C41 -> Englehard, NC | D37: ='\\SER\Software\other\[POINTS NQS  2012.XLS]Pro Stock'!D41 -> MVP | E37: ='\\SER\Software\other\[POINTS NQS  2012.XLS]Pro Stock'!E41 -> 337 | F37: =IF('\\SER\Software\other\[POINTS NQS  2012.XLS]Pro Stock'!F41=0," ",'\\SER\Software\other\[POINTS NQS  2012.XLS]Pro Stock'!F41) -> IH Express 2 | G37: ='\\SER\Software\other\[POINTS NQS  2012.XLS]Pro Stock'!AA41 -> 47 | I37: ='\\SER\Software\other\[POINTS NQS  2012.XLS]Super Stock'!A41 -> 35 | J37: ='\\SER\Software\other\[POINTS NQS  2012.XLS]Super Stock'!B41 -> Steve Williford | K37: ='\\SER\Software\other\[POINTS NQS  2012.XLS]Super Stock'!C41 -> Engelhard, NC | L37: ='\\SER\Software\other\[POINTS NQS  2012.XLS]Super Stock'!D41 -> MVP | M37: ='\\SER\Software\other\[POINTS NQS  2012.XLS]Super Stock'!E41 -> 337 | N37: =IF('\\SER\Software\other\[POINTS NQS  2012.XLS]Super Stock'!F41=0," ",'\\SER\Software\other\[POINTS NQS  2012.XLS]Super Stock'!F41) -> IH Express #2 | O37: ='\\SER\Software\other\[POINTS NQS  2012.XLS]Super Stock'!AA41 -> 47
A38: ='\\SER\Software\other\[POINTS NQS  2012.XLS]Pro Stock'!A42 -> 36 | B38: ='\\SER\Software\other\[POINTS NQS  2012.XLS]Pro Stock'!B42 -> Daryl Musser | C38: ='\\SER\Software\other\[POINTS NQS  2012.XLS]Pro Stock'!C42 -> Greencastle, Pa | D38: ='\\SER\Software\other\[POINTS NQS  2012.XLS]Pro Stock'!D42 -> NP | E38: ='\\SER\Software\other\[POINTS NQS  2012.XLS]Pro Stock'!E42 -> 396 | F38: =IF('\\SER\Software\other\[POINTS NQS  2012.XLS]Pro Stock'!F42=0," ",'\\SER\Software\other\[POINTS NQS  2012.XLS]Pro Stock'!F42) -> 5 Cents | G38: ='\\SER\Software\other\[POINTS NQS  2012.XLS]Pro Stock'!AA42 -> 47 | I38: ='\\SER\Software\other\[POINTS NQS  2012.XLS]Super Stock'!A42 -> 36 | J38: ='\\SER\Software\other\[POINTS NQS  2012.XLS]Super Stock'!B42 -> Mark Conover | K38: ='\\SER\Software\other\[POINTS NQS  2012.XLS]Super Stock'!C42 -> Edinburgh, IN | L38: ='\\SER\Software\other\[POINTS NQS  2012.XLS]Super Stock'!D42 -> VM | M38: ='\\SER\Software\other\[POINTS NQS  2012.XLS]Super Stock'!E42 -> 360 | N38: =IF('\\SER\Software\other\[POINTS NQS  2012.XLS]Super Stock'!F42=0," ",'\\SER\Software\other\[POINTS NQS  2012.XLS]Super Stock'!F42) -> VuDoo Too | O38: ='\\SER\Software\other\[POINTS NQS  2012.XLS]Super Stock'!AA42 -> 47
A39: ='\\SER\Software\other\[POINTS NQS  2012.XLS]Pro Stock'!A43 -> 37 | B39: ='\\SER\Software\other\[POINTS NQS  2012.XLS]Pro Stock'!B43 -> Darlene Sample | C39: ='\\SER\Software\other\[POINTS NQS  2012.XLS]Pro Stock'!C43 -> Carrolton, OH | D39: ='\\SER\Software\other\[POINTS NQS  2012.XLS]Pro Stock'!D43 -> LR | E39: ='\\SER\Software\other\[POINTS NQS  2012.XLS]Pro Stock'!E43 -> 498 | F39: =IF('\\SER\Software\other\[POINTS NQS  2012.XLS]Pro Stock'!F43=0," ",'\\SER\Software\other\[POINTS NQS  2012.XLS]Pro Stock'!F43) -> Dr. Doom | G39: ='\\SER\Software\other\[POINTS NQS  2012.XLS]Pro Stock'!AA43 -> 47 | I39: ='\\SER\Software\other\[POINTS NQS  2012.XLS]Super Stock'!A43 -> 37 | J39: ='\\SER\Software\other\[POINTS NQS  2012.XLS]Super Stock'!B43 -> Vicki Scroggins | K39: ='\\SER\Software\other\[POINTS NQS  2012.XLS]Super Stock'!C43 -> Neosho, MO | L39: ='\\SER\Software\other\[POINTS NQS  2012.XLS]Super Stock'!D43 -> VM | M39: ='\\SER\Software\other\[POINTS NQS  2012.XLS]Super Stock'!E43 -> 112 | N39: =IF('\\SER\Software\other\[POINTS NQS  2012.XLS]Super Stock'!F43=0," ",'\\SER\Software\other\[POINTS NQS  2012.XLS]Super Stock'!F43) -> Lil" American | O39: ='\\SER\Software\other\[POINTS NQS  2012.XLS]Super Stock'!AA43 -> 48
A40: ='\\SER\Software\other\[POINTS NQS  2012.XLS]Pro Stock'!A44 -> 38 | B40: ='\\SER\Software\other\[POINTS NQS  2012.XLS]Pro Stock'!B44 -> Julian Stahl | C40: ='\\SER\Software\other\[POINTS NQS  2012.XLS]Pro Stock'!C44 -> Welton, IA | D40: ='\\SER\Software\other\[POINTS NQS  2012.XLS]Pro Stock'!D44 -> MVP | E40: ='\\SER\Software\other\[POINTS NQS  2012.XLS]Pro Stock'!E44 -> 2 | F40: =IF('\\SER\Software\other\[POINTS NQS  2012.XLS]Pro Stock'!F44=0," ",'\\SER\Software\other\[POINTS NQS  2012.XLS]Pro Stock'!F44) -> MWSC #2 | G40: ='\\SER\Software\other\[POINTS NQS  2012.XLS]Pro Stock'!AA44 -> 48 | I40: ='\\SER\Software\other\[POINTS NQS  2012.XLS]Super Stock'!A44 -> 38 | J40: ='\\SER\Software\other\[POINTS NQS  2012.XLS]Super Stock'!B44 -> Michael Ciolino | K40: ='\\SER\Software\other\[POINTS NQS  2012.XLS]Super Stock'!C44 -> Peoria, IL | L40: ='\\SER\Software\other\[POINTS NQS  2012.XLS]Super Stock'!D44 -> MVP | M40: ='\\SER\Software\other\[POINTS NQS  2012.XLS]Super Stock'!E44 -> 146 | N40: =IF('\\SER\Software\other\[POINTS NQS  2012.XLS]Super Stock'!F44=0," ",'\\SER\Software\other\[POINTS NQS  2012.XLS]Super Stock'!F44) -> Mechanial Animal | O40: ='\\SER\Software\other\[POINTS NQS  2012.XLS]Super Stock'!AA44 -> 48
A41: ='\\SER\Software\other\[POINTS NQS  2012.XLS]Pro Stock'!A45 -> 39 | B41: ='\\SER\Software\other\[POINTS NQS  2012.XLS]Pro Stock'!B45 -> Vicki Scroggins | C41: ='\\SER\Software\other\[POINTS NQS  2012.XLS]Pro Stock'!C45 -> Neosho, Mo | D41: ='\\SER\Software\other\[POINTS NQS  2012.XLS]Pro Stock'!D45 -> VM | E41: ='\\SER\Software\other\[POINTS NQS  2012.XLS]Pro Stock'!E45 -> 112 | F41: =IF('\\SER\Software\other\[POINTS NQS  2012.XLS]Pro Stock'!F45=0," ",'\\SER\Software\other\[POINTS NQS  2012.XLS]Pro Stock'!F45) -> Lil' American | G41: ='\\SER\Software\other\[POINTS NQS  2012.XLS]Pro Stock'!AA45 -> 48 | I41: ='\\SER\Software\other\[POINTS NQS  2012.XLS]Super Stock'!A45 -> 39 | J41: ='\\SER\Software\other\[POINTS NQS  2012.XLS]Super Stock'!B45 -> Clyde Mishler | K41: ='\\SER\Software\other\[POINTS NQS  2012.XLS]Super Stock'!C45 -> Washington, IL | L41: ='\\SER\Software\other\[POINTS NQS  2012.XLS]Super Stock'!D45 -> GTP | M41: ='\\SER\Software\other\[POINTS NQS  2012.XLS]Super Stock'!E45 -> 168 | N41: =IF('\\SER\Software\other\[POINTS NQS  2012.XLS]Super Stock'!F45=0," ",'\\SER\Software\other\[POINTS NQS  2012.XLS]Super Stock'!F45) ->  | O41: ='\\SER\Software\other\[POINTS NQS  2012.XLS]Super Stock'!AA45 -> 48
A42: ='\\SER\Software\other\[POINTS NQS  2012.XLS]Pro Stock'!A47 -> 41 | B42: ='\\SER\Software\other\[POINTS NQS  2012.XLS]Pro Stock'!B47 -> Michael Ciolino | C42: ='\\SER\Software\other\[POINTS NQS  2012.XLS]Pro Stock'!C47 -> Hammond, LA | D42: ='\\SER\Software\other\[POINTS NQS  2012.XLS]Pro Stock'!D47 -> MVP | E42: ='\\SER\Software\other\[POINTS NQS  2012.XLS]Pro Stock'!E47 -> 146 | F42: =IF('\\SER\Software\other\[POINTS NQS  2012.XLS]Pro Stock'!F46=0," ",'\\SER\Software\other\[POINTS NQS  2012.XLS]Pro Stock'!F46) -> IH Express | G42: ='\\SER\Software\other\[POINTS NQS  2012.XLS]Pro Stock'!AA47 -> 49 | I42: ='\\SER\Software\other\[POINTS NQS  2012.XLS]Super Stock'!A46 -> 40 | J42: ='\\SER\Software\other\[POINTS NQS  2012.XLS]Super Stock'!B46 -> John Innerest | K42: ='\\SER\Software\other\[POINTS NQS  2012.XLS]Super Stock'!C46 -> Red Lion, PA | L42: ='\\SER\Software\other\[POINTS NQS  2012.XLS]Super Stock'!D46 -> NP | M42: ='\\SER\Software\other\[POINTS NQS  2012.XLS]Super Stock'!E46 -> 252 | N42: =IF('\\SER\Software\other\[POINTS NQS  2012.XLS]Super Stock'!F46=0," ",'\\SER\Software\other\[POINTS NQS  2012.XLS]Super Stock'!F46) -> Mean N Nasty | O42: ='\\SER\Software\other\[POINTS NQS  2012.XLS]Super Stock'!AA46 -> 48
A43: ='\\SER\Software\other\[POINTS NQS  2012.XLS]Pro Stock'!A46 -> 40 | B43: ='\\SER\Software\other\[POINTS NQS  2012.XLS]Pro Stock'!B46 -> Steve Williford | C43: ='\\SER\Software\other\[POINTS NQS  2012.XLS]Pro Stock'!C46 -> Englehard, NC | D43: ='\\SER\Software\other\[POINTS NQS  2012.XLS]Pro Stock'!D46 -> MVP | E43: ='\\SER\Software\other\[POINTS NQS  2012.XLS]Pro Stock'!E46 -> 276 | F43: =IF('\\SER\Software\other\[POINTS NQS  2012.XLS]Pro Stock'!F47=0," ",'\\SER\Software\other\[POINTS NQS  2012.XLS]Pro Stock'!F47) -> Mechanical Animal | G43: ='\\SER\Software\other\[POINTS NQS  2012.XLS]Pro Stock'!AA46 -> 48 | I43: ='\\SER\Software\other\[POINTS NQS  2012.XLS]Super Stock'!A47 -> 41 | J43: ='\\SER\Software\other\[POINTS NQS  2012.XLS]Super Stock'!B47 -> Julian Stahl | K43: ='\\SER\Software\other\[POINTS NQS  2012.XLS]Super Stock'!C47 -> Welton, IA | L43: ='\\SER\Software\other\[POINTS NQS  2012.XLS]Super Stock'!D47 -> MVP | M43: ='\\SER\Software\other\[POINTS NQS  2012.XLS]Super Stock'!E47 -> 2 | N43: =IF('\\SER\Software\other\[POINTS NQS  2012.XLS]Super Stock'!F47=0," ",'\\SER\Software\other\[POINTS NQS  2012.XLS]Super Stock'!F47) -> MWSC # 2 | O43: ='\\SER\Software\other\[POINTS NQS  2012.XLS]Super Stock'!AA47 -> 49
A44: ='\\SER\Software\other\[POINTS NQS  2012.XLS]Pro Stock'!A48 -> 42 | B44: ='\\SER\Software\other\[POINTS NQS  2012.XLS]Pro Stock'!B48 -> Nathan Nichols | C44: ='\\SER\Software\other\[POINTS NQS  2012.XLS]Pro Stock'!C48 -> Lawrenceburg, Ky | D44: ='\\SER\Software\other\[POINTS NQS  2012.XLS]Pro Stock'!D48 -> LR | E44: ='\\SER\Software\other\[POINTS NQS  2012.XLS]Pro Stock'!E48 -> 151 | F44: =IF('\\SER\Software\other\[POINTS NQS  2012.XLS]Pro Stock'!F48=0," ",'\\SER\Software\other\[POINTS NQS  2012.XLS]Pro Stock'!F48) -> Wild Streak | G44: ='\\SER\Software\other\[POINTS NQS  2012.XLS]Pro Stock'!AA48 -> 49 | I44: ='\\SER\Software\other\[POINTS NQS  2012.XLS]Super Stock'!A48 -> 42 | J44: ='\\SER\Software\other\[POINTS NQS  2012.XLS]Super Stock'!B48 -> Larry Fox | K44: ='\\SER\Software\other\[POINTS NQS  2012.XLS]Super Stock'!C48 -> Etna, OH | L44: ='\\SER\Software\other\[POINTS NQS  2012.XLS]Super Stock'!D48 -> JRS | M44: ='\\SER\Software\other\[POINTS NQS  2012.XLS]Super Stock'!E48 -> 7 | N44: =IF('\\SER\Software\other\[POINTS NQS  2012.XLS]Super Stock'!F48=0," ",'\\SER\Software\other\[POINTS NQS  2012.XLS]Super Stock'!F48) -> Intimidation | O44: ='\\SER\Software\other\[POINTS NQS  2012.XLS]Super Stock'!AA48 -> 49
A45: ='\\SER\Software\other\[POINTS NQS  2012.XLS]Pro Stock'!A49 -> 43 | B45: ='\\SER\Software\other\[POINTS NQS  2012.XLS]Pro Stock'!B49 -> Tooter Campbell | C45: ='\\SER\Software\other\[POINTS NQS  2012.XLS]Pro Stock'!C49 -> Owensboro, Ky | D45: ='\\SER\Software\other\[POINTS NQS  2012.XLS]Pro Stock'!D49 -> TC | E45: ='\\SER\Software\other\[POINTS NQS  2012.XLS]Pro Stock'!E49 -> 473 | F45: =IF('\\SER\Software\other\[POINTS NQS  2012.XLS]Pro Stock'!F49=0," ",'\\SER\Software\other\[POINTS NQS  2012.XLS]Pro Stock'!F49) -> Tractor Trash | G45: ='\\SER\Software\other\[POINTS NQS  2012.XLS]Pro Stock'!AA49 -> 49 | I45: ='\\SER\Software\other\[POINTS NQS  2012.XLS]Super Stock'!A49 -> 43 | J45: ='\\SER\Software\other\[POINTS NQS  2012.XLS]Super Stock'!B49 -> Randy Demers | K45: ='\\SER\Software\other\[POINTS NQS  2012.XLS]Super Stock'!C49 -> Columbia, NJ | L45: ='\\SER\Software\other\[POINTS NQS  2012.XLS]Super Stock'!D49 -> NP | M45: ='\\SER\Software\other\[POINTS NQS  2012.XLS]Super Stock'!E49 -> 85 | N45: =IF('\\SER\Software\other\[POINTS NQS  2012.XLS]Super Stock'!F49=0," ",'\\SER\Software\other\[POINTS NQS  2012.XLS]Super Stock'!F49) -> Widowmaker | O45: ='\\SER\Software\other\[POINTS NQS  2012.XLS]Super Stock'!AA49 -> 49
A46: ='\\SER\Software\other\[POINTS NQS  2012.XLS]Pro Stock'!A50 -> 44 | B46: ='\\SER\Software\other\[POINTS NQS  2012.XLS]Pro Stock'!B50 -> Tyler Hackman | C46: ='\\SER\Software\other\[POINTS NQS  2012.XLS]Pro Stock'!C50 -> Seymour, Ind | D46: ='\\SER\Software\other\[POINTS NQS  2012.XLS]Pro Stock'!D50 -> Hackman | E46: ='\\SER\Software\other\[POINTS NQS  2012.XLS]Pro Stock'!E50 -> 507 | F46: =IF('\\SER\Software\other\[POINTS NQS  2012.XLS]Pro Stock'!F50=0," ",'\\SER\Software\other\[POINTS NQS  2012.XLS]Pro Stock'!F50) -> Mad Hatter | G46: ='\\SER\Software\other\[POINTS NQS  2012.XLS]Pro Stock'!AA50 -> 49 | I46: ='\\SER\Software\other\[POINTS NQS  2012.XLS]Super Stock'!A50 -> 44 | J46: ='\\SER\Software\other\[POINTS NQS  2012.XLS]Super Stock'!B50 -> Tyler Hackman | K46: ='\\SER\Software\other\[POINTS NQS  2012.XLS]Super Stock'!C50 -> Seymour, IN | L46: ='\\SER\Software\other\[POINTS NQS  2012.XLS]Super Stock'!D50 -> Hackman | M46: ='\\SER\Software\other\[POINTS NQS  2012.XLS]Super Stock'!E50 -> 508 | N46: =IF('\\SER\Software\other\[POINTS NQS  2012.XLS]Super Stock'!F50=0," ",'\\SER\Software\other\[POINTS NQS  2012.XLS]Super Stock'!F50) -> Iron Will | O46: ='\\SER\Software\other\[POINTS NQS  2012.XLS]Super Stock'!AA50 -> 49
A47: ='\\SER\Software\other\[POINTS NQS  2012.XLS]Pro Stock'!A51 -> 45 | B47: ='\\SER\Software\other\[POINTS NQS  2012.XLS]Pro Stock'!B51 -> Clyde Mishler | C47: ='\\SER\Software\other\[POINTS NQS  2012.XLS]Pro Stock'!C51 -> E Peoria, Ill | D47: ='\\SER\Software\other\[POINTS NQS  2012.XLS]Pro Stock'!D51 -> GTP | E47: ='\\SER\Software\other\[POINTS NQS  2012.XLS]Pro Stock'!E51 -> 168 | F47: =IF('\\SER\Software\other\[POINTS NQS  2012.XLS]Pro Stock'!F51=0," ",'\\SER\Software\other\[POINTS NQS  2012.XLS]Pro Stock'!F51) ->  | G47: ='\\SER\Software\other\[POINTS NQS  2012.XLS]Pro Stock'!AA51 -> 50 | I47: ='\\SER\Software\other\[POINTS NQS  2012.XLS]Super Stock'!A51 -> 45 | J47: ='\\SER\Software\other\[POINTS NQS  2012.XLS]Super Stock'!B51 -> Steve Chrisman | K47: ='\\SER\Software\other\[POINTS NQS  2012.XLS]Super Stock'!C51 -> Edinburg, IN | L47: ='\\SER\Software\other\[POINTS NQS  2012.XLS]Super Stock'!D51 -> Hackman | M47: ='\\SER\Software\other\[POINTS NQS  2012.XLS]Super Stock'!E51 -> 26 | N47: =IF('\\SER\Software\other\[POINTS NQS  2012.XLS]Super Stock'!F51=0," ",'\\SER\Software\other\[POINTS NQS  2012.XLS]Super Stock'!F51) -> JD | O47: ='\\SER\Software\other\[POINTS NQS  2012.XLS]Super Stock'!AA51 -> 50
A48: ='\\SER\Software\other\[POINTS NQS  2012.XLS]Pro Stock'!A52 -> 46 | B48: ='\\SER\Software\other\[POINTS NQS  2012.XLS]Pro Stock'!B52 -> Mike Kyle | C48: ='\\SER\Software\other\[POINTS NQS  2012.XLS]Pro Stock'!C52 -> Edinburg, Ind | D48: ='\\SER\Software\other\[POINTS NQS  2012.XLS]Pro Stock'!D52 -> VM | E48: ='\\SER\Software\other\[POINTS NQS  2012.XLS]Pro Stock'!E52 -> 394 | F48: =IF('\\SER\Software\other\[POINTS NQS  2012.XLS]Pro Stock'!F52=0," ",'\\SER\Software\other\[POINTS NQS  2012.XLS]Pro Stock'!F52) ->  | G48: ='\\SER\Software\other\[POINTS NQS  2012.XLS]Pro Stock'!AA52 -> 50 | I48: ='\\SER\Software\other\[POINTS NQS  2012.XLS]Super Stock'!A52 -> 46 | J48: ='\\SER\Software\other\[POINTS NQS  2012.XLS]Super Stock'!B52 -> Bruce Austin | K48: ='\\SER\Software\other\[POINTS NQS  2012.XLS]Super Stock'!C52 -> St. Charles, IA | L48: ='\\SER\Software\other\[POINTS NQS  2012.XLS]Super Stock'!D52 -> MVP | M48: ='\\SER\Software\other\[POINTS NQS  2012.XLS]Super Stock'!E52 -> 277 | N48: =IF('\\SER\Software\other\[POINTS NQS  2012.XLS]Super Stock'!F52=0," ",'\\SER\Software\other\[POINTS NQS  2012.XLS]Super Stock'!F52) -> Cap'n Crunch | O48: ='\\SER\Software\other\[POINTS NQS  2012.XLS]Super Stock'!AA52 -> 50
A49: ='\\SER\Software\other\[POINTS NQS  2012.XLS]Pro Stock'!A53 -> 47 | B49: ='\\SER\Software\other\[POINTS NQS  2012.XLS]Pro Stock'!B53 -> Nevin Stitzer | C49: ='\\SER\Software\other\[POINTS NQS  2012.XLS]Pro Stock'!C53 -> Spring Mills, PA | D49: ='\\SER\Software\other\[POINTS NQS  2012.XLS]Pro Stock'!D53 ->  | E49: ='\\SER\Software\other\[POINTS NQS  2012.XLS]Pro Stock'!E53 -> 447 | F49: =IF('\\SER\Software\other\[POINTS NQS  2012.XLS]Pro Stock'!F53=0," ",'\\SER\Software\other\[POINTS NQS  2012.XLS]Pro Stock'!F53) -> Thunder Road II | G49: ='\\SER\Software\other\[POINTS NQS  2012.XLS]Pro Stock'!AA53 -> 50 | I49: ='\\SER\Software\other\[POINTS NQS  2012.XLS]Super Stock'!A53 -> 47 | J49: ='\\SER\Software\other\[POINTS NQS  2012.XLS]Super Stock'!B53 -> Harrison Stahl | K49: ='\\SER\Software\other\[POINTS NQS  2012.XLS]Super Stock'!C53 -> Dewitt, IA | L49: ='\\SER\Software\other\[POINTS NQS  2012.XLS]Super Stock'!D53 -> MVP | M49: ='\\SER\Software\other\[POINTS NQS  2012.XLS]Super Stock'!E53 -> 335 | N49: =IF('\\SER\Software\other\[POINTS NQS  2012.XLS]Super Stock'!F53=0," ",'\\SER\Software\other\[POINTS NQS  2012.XLS]Super Stock'!F53) -> MWSC # 3 | O49: ='\\SER\Software\other\[POINTS NQS  2012.XLS]Super Stock'!AA53 -> 50
A50: ='\\SER\Software\other\[POINTS NQS  2012.XLS]Pro Stock'!A54 -> 48 | B50: ='\\SER\Software\other\[POINTS NQS  2012.XLS]Pro Stock'!B54 -> Bradley Corzine | C50: ='\\SER\Software\other\[POINTS NQS  2012.XLS]Pro Stock'!C54 -> Dongola, ILL | D50: ='\\SER\Software\other\[POINTS NQS  2012.XLS]Pro Stock'!D54 -> JW | E50: ='\\SER\Software\other\[POINTS NQS  2012.XLS]Pro Stock'!E54 -> 477 | F50: =IF('\\SER\Software\other\[POINTS NQS  2012.XLS]Pro Stock'!F54=0," ",'\\SER\Software\other\[POINTS NQS  2012.XLS]Pro Stock'!F54) -> Black Cat | G50: ='\\SER\Software\other\[POINTS NQS  2012.XLS]Pro Stock'!AA54 -> 50 | I50: ='\\SER\Software\other\[POINTS NQS  2012.XLS]Super Stock'!A54 -> 48 | J50: ='\\SER\Software\other\[POINTS NQS  2012.XLS]Super Stock'!B54 -> Larry Korff | K50: ='\\SER\Software\other\[POINTS NQS  2012.XLS]Super Stock'!C54 -> Evansville, IN | L50: ='\\SER\Software\other\[POINTS NQS  2012.XLS]Super Stock'!D54 -> TC | M50: ='\\SER\Software\other\[POINTS NQS  2012.XLS]Super Stock'!E54 -> 398 | N50: =IF('\\SER\Software\other\[POINTS NQS  2012.XLS]Super Stock'!F54=0," ",'\\SER\Software\other\[POINTS NQS  2012.XLS]Super Stock'!F54) -> Kryptonite | O50: ='\\SER\Software\other\[POINTS NQS  2012.XLS]Super Stock'!AA54 -> 50
A51: ='\\SER\Software\other\[POINTS NQS  2012.XLS]Pro Stock'!A55 -> 49 | B51: ='\\SER\Software\other\[POINTS NQS  2012.XLS]Pro Stock'!B55 -> Ray Gentz | C51: ='\\SER\Software\other\[POINTS NQS  2012.XLS]Pro Stock'!C55 -> Colon, Mich | D51: ='\\SER\Software\other\[POINTS NQS  2012.XLS]Pro Stock'!D55 -> VM | E51: ='\\SER\Software\other\[POINTS NQS  2012.XLS]Pro Stock'!E55 -> 34 | F51: =IF('\\SER\Software\other\[POINTS NQS  2012.XLS]Pro Stock'!F55=0," ",'\\SER\Software\other\[POINTS NQS  2012.XLS]Pro Stock'!F55) -> Just Enough | G51: ='\\SER\Software\other\[POINTS NQS  2012.XLS]Pro Stock'!AA55 -> 51 | I51: ='\\SER\Software\other\[POINTS NQS  2012.XLS]Super Stock'!A55 -> 49 | J51: ='\\SER\Software\other\[POINTS NQS  2012.XLS]Super Stock'!B55 -> Ray Gentz | K51: ='\\SER\Software\other\[POINTS NQS  2012.XLS]Super Stock'!C55 -> Colon, MI | L51: ='\\SER\Software\other\[POINTS NQS  2012.XLS]Super Stock'!D55 -> VM | M51: ='\\SER\Software\other\[POINTS NQS  2012.XLS]Super Stock'!E55 -> 34 | N51: =IF('\\SER\Software\other\[POINTS NQS  2012.XLS]Super Stock'!F55=0," ",'\\SER\Software\other\[POINTS NQS  2012.XLS]Super Stock'!F55) -> Just Enough | O51: ='\\SER\Software\other\[POINTS NQS  2012.XLS]Super Stock'!AA55 -> 51
A52: ='\\SER\Software\other\[POINTS NQS  2012.XLS]Pro Stock'!A56 -> 50 | B52: ='\\SER\Software\other\[POINTS NQS  2012.XLS]Pro Stock'!B56 -> Greg Watson | C52: ='\\SER\Software\other\[POINTS NQS  2012.XLS]Pro Stock'!C56 -> Batavia, OH | D52: ='\\SER\Software\other\[POINTS NQS  2012.XLS]Pro Stock'!D56 -> LR | E52: ='\\SER\Software\other\[POINTS NQS  2012.XLS]Pro Stock'!E56 -> 79 | F52: =IF('\\SER\Software\other\[POINTS NQS  2012.XLS]Pro Stock'!F56=0," ",'\\SER\Software\other\[POINTS NQS  2012.XLS]Pro Stock'!F56) -> Bearly Legal | G52: ='\\SER\Software\other\[POINTS NQS  2012.XLS]Pro Stock'!AA56 -> 51 | I52: ='\\SER\Software\other\[POINTS NQS  2012.XLS]Super Stock'!A56 -> 50 | J52: ='\\SER\Software\other\[POINTS NQS  2012.XLS]Super Stock'!B56 -> Nathan Nichols | K52: ='\\SER\Software\other\[POINTS NQS  2012.XLS]Super Stock'!C56 -> Lawrenceburg, KY | L52: ='\\SER\Software\other\[POINTS NQS  2012.XLS]Super Stock'!D56 -> LR | M52: ='\\SER\Software\other\[POINTS NQS  2012.XLS]Super Stock'!E56 -> 151 | N52: =IF('\\SER\Software\other\[POINTS NQS  2012.XLS]Super Stock'!F56=0," ",'\\SER\Software\other\[POINTS NQS  2012.XLS]Super Stock'!F56) -> Wildstreak | O52: ='\\SER\Software\other\[POINTS NQS  2012.XLS]Super Stock'!AA56 -> 51
A53: ='\\SER\Software\other\[POINTS NQS  2012.XLS]Pro Stock'!A58 -> 52 | B53: ='\\SER\Software\other\[POINTS NQS  2012.XLS]Pro Stock'!B58 -> Bruce Austin | C53: ='\\SER\Software\other\[POINTS NQS  2012.XLS]Pro Stock'!C58 -> St Charles, IA | D53: ='\\SER\Software\other\[POINTS NQS  2012.XLS]Pro Stock'!D58 -> MVP | E53: ='\\SER\Software\other\[POINTS NQS  2012.XLS]Pro Stock'!E58 -> 277 | F53: =IF('\\SER\Software\other\[POINTS NQS  2012.XLS]Pro Stock'!F57=0," ",'\\SER\Software\other\[POINTS NQS  2012.XLS]Pro Stock'!F57) -> Mechanical Nitemare | G53: ='\\SER\Software\other\[POINTS NQS  2012.XLS]Pro Stock'!AA58 -> 51 | I53: ='\\SER\Software\other\[POINTS NQS  2012.XLS]Super Stock'!A57 -> 51 | J53: ='\\SER\Software\other\[POINTS NQS  2012.XLS]Super Stock'!B57 -> Nick Mishler | K53: ='\\SER\Software\other\[POINTS NQS  2012.XLS]Super Stock'!C57 -> East Peoria, IL | L53: ='\\SER\Software\other\[POINTS NQS  2012.XLS]Super Stock'!D57 -> GTP | M53: ='\\SER\Software\other\[POINTS NQS  2012.XLS]Super Stock'!E57 -> 167 | N53: =IF('\\SER\Software\other\[POINTS NQS  2012.XLS]Super Stock'!F57=0," ",'\\SER\Software\other\[POINTS NQS  2012.XLS]Super Stock'!F57) -> Pulse | O53: ='\\SER\Software\other\[POINTS NQS  2012.XLS]Super Stock'!AA57 -> 51
A54: ='\\SER\Software\other\[POINTS NQS  2012.XLS]Pro Stock'!A57 -> 51 | B54: ='\\SER\Software\other\[POINTS NQS  2012.XLS]Pro Stock'!B57 -> Charlie Ciolino | C54: ='\\SER\Software\other\[POINTS NQS  2012.XLS]Pro Stock'!C57 -> Hammond, LA | D54: ='\\SER\Software\other\[POINTS NQS  2012.XLS]Pro Stock'!D57 -> MVP | E54: ='\\SER\Software\other\[POINTS NQS  2012.XLS]Pro Stock'!E57 -> 145 | F54: =IF('\\SER\Software\other\[POINTS NQS  2012.XLS]Pro Stock'!F58=0," ",'\\SER\Software\other\[POINTS NQS  2012.XLS]Pro Stock'!F58) -> Cap'N Crunch | G54: ='\\SER\Software\other\[POINTS NQS  2012.XLS]Pro Stock'!AA57 -> 51 | I54: ='\\SER\Software\other\[POINTS NQS  2012.XLS]Super Stock'!A58 -> 52 | J54: ='\\SER\Software\other\[POINTS NQS  2012.XLS]Super Stock'!B58 -> Dan Schell | K54: ='\\SER\Software\other\[POINTS NQS  2012.XLS]Super Stock'!C58 -> Darien, WI | L54: ='\\SER\Software\other\[POINTS NQS  2012.XLS]Super Stock'!D58 -> MVP | M54: ='\\SER\Software\other\[POINTS NQS  2012.XLS]Super Stock'!E58 -> 375 | N54: =IF('\\SER\Software\other\[POINTS NQS  2012.XLS]Super Stock'!F58=0," ",'\\SER\Software\other\[POINTS NQS  2012.XLS]Super Stock'!F58) -> Blind Ambition | O54: ='\\SER\Software\other\[POINTS NQS  2012.XLS]Super Stock'!AA58 -> 51
A55: ='\\SER\Software\other\[POINTS NQS  2012.XLS]Pro Stock'!A59 -> 53 | B55: ='\\SER\Software\other\[POINTS NQS  2012.XLS]Pro Stock'!B59 -> Jeremy Jaspering | C55: ='\\SER\Software\other\[POINTS NQS  2012.XLS]Pro Stock'!C59 -> Perry, MO | D55: ='\\SER\Software\other\[POINTS NQS  2012.XLS]Pro Stock'!D59 -> LR | E55: ='\\SER\Software\other\[POINTS NQS  2012.XLS]Pro Stock'!E59 -> 147 | F55: =IF('\\SER\Software\other\[POINTS NQS  2012.XLS]Pro Stock'!F59=0," ",'\\SER\Software\other\[POINTS NQS  2012.XLS]Pro Stock'!F59) -> Wicked | G55: ='\\SER\Software\other\[POINTS NQS  2012.XLS]Pro Stock'!AA59 -> 52 | I55: ='\\SER\Software\other\[POINTS NQS  2012.XLS]Super Stock'!A59 -> 53 | J55: ='\\SER\Software\other\[POINTS NQS  2012.XLS]Super Stock'!B59 -> Ed Nichols | K55: ='\\SER\Software\other\[POINTS NQS  2012.XLS]Super Stock'!C59 -> Salvisa, KY | L55: ='\\SER\Software\other\[POINTS NQS  2012.XLS]Super Stock'!D59 -> LR | M55: ='\\SER\Software\other\[POINTS NQS  2012.XLS]Super Stock'!E59 -> 124 | N55: =IF('\\SER\Software\other\[POINTS NQS  2012.XLS]Super Stock'!F59=0," ",'\\SER\Software\other\[POINTS NQS  2012.XLS]Super Stock'!F59) -> Track Attack | O55: ='\\SER\Software\other\[POINTS NQS  2012.XLS]Super Stock'!AA59 -> 52
A56: ='\\SER\Software\other\[POINTS NQS  2012.XLS]Pro Stock'!A60 -> 54 | B56: ='\\SER\Software\other\[POINTS NQS  2012.XLS]Pro Stock'!B60 -> Harrison Stahl | C56: ='\\SER\Software\other\[POINTS NQS  2012.XLS]Pro Stock'!C60 -> Welton, IA | D56: ='\\SER\Software\other\[POINTS NQS  2012.XLS]Pro Stock'!D60 -> MVP | E56: ='\\SER\Software\other\[POINTS NQS  2012.XLS]Pro Stock'!E60 -> 336 | F56: =IF('\\SER\Software\other\[POINTS NQS  2012.XLS]Pro Stock'!F60=0," ",'\\SER\Software\other\[POINTS NQS  2012.XLS]Pro Stock'!F60) -> MWSC # 4 | G56: ='\\SER\Software\other\[POINTS NQS  2012.XLS]Pro Stock'!AA60 -> 52 | I56: ='\\SER\Software\other\[POINTS NQS  2012.XLS]Super Stock'!A60 -> 54 | J56: ='\\SER\Software\other\[POINTS NQS  2012.XLS]Super Stock'!B60 -> Chad Vogler | K56: ='\\SER\Software\other\[POINTS NQS  2012.XLS]Super Stock'!C60 -> Jasper, IN | L56: ='\\SER\Software\other\[POINTS NQS  2012.XLS]Super Stock'!D60 -> JRS | M56: ='\\SER\Software\other\[POINTS NQS  2012.XLS]Super Stock'!E60 -> 130 | N56: =IF('\\SER\Software\other\[POINTS NQS  2012.XLS]Super Stock'!F60=0," ",'\\SER\Software\other\[POINTS NQS  2012.XLS]Super Stock'!F60) -> Bandit | O56: ='\\SER\Software\other\[POINTS NQS  2012.XLS]Super Stock'!AA60 -> 52
A57: ='\\SER\Software\other\[POINTS NQS  2012.XLS]Pro Stock'!A61 -> 55 | B57: ='\\SER\Software\other\[POINTS NQS  2012.XLS]Pro Stock'!B61 -> Brian Titzer | C57: ='\\SER\Software\other\[POINTS NQS  2012.XLS]Pro Stock'!C61 -> Evansville, Ind | D57: ='\\SER\Software\other\[POINTS NQS  2012.XLS]Pro Stock'!D61 -> TC | E57: ='\\SER\Software\other\[POINTS NQS  2012.XLS]Pro Stock'!E61 -> 364 | F57: =IF('\\SER\Software\other\[POINTS NQS  2012.XLS]Pro Stock'!F61=0," ",'\\SER\Software\other\[POINTS NQS  2012.XLS]Pro Stock'!F61) -> Single Boys Toy | G57: ='\\SER\Software\other\[POINTS NQS  2012.XLS]Pro Stock'!AA61 -> 52 | I57: ='\\SER\Software\other\[POINTS NQS  2012.XLS]Super Stock'!A61 -> 55 | J57: ='\\SER\Software\other\[POINTS NQS  2012.XLS]Super Stock'!B61 -> Scott Larkins | K57: ='\\SER\Software\other\[POINTS NQS  2012.XLS]Super Stock'!C61 -> Kearney, MO | L57: ='\\SER\Software\other\[POINTS NQS  2012.XLS]Super Stock'!D61 -> JRS | M57: ='\\SER\Software\other\[POINTS NQS  2012.XLS]Super Stock'!E61 -> 154 | N57: =IF('\\SER\Software\other\[POINTS NQS  2012.XLS]Super Stock'!F61=0," ",'\\SER\Software\other\[POINTS NQS  2012.XLS]Super Stock'!F61) -> Silver Sam | O57: ='\\SER\Software\other\[POINTS NQS  2012.XLS]Super Stock'!AA61 -> 52
A58: ='\\SER\Software\other\[POINTS NQS  2012.XLS]Pro Stock'!A62 -> 56 | B58: ='\\SER\Software\other\[POINTS NQS  2012.XLS]Pro Stock'!B62 -> David Knapp | C58: ='\\SER\Software\other\[POINTS NQS  2012.XLS]Pro Stock'!C62 -> Putnam, Ill | D58: ='\\SER\Software\other\[POINTS NQS  2012.XLS]Pro Stock'!D62 -> MVP | E58: ='\\SER\Software\other\[POINTS NQS  2012.XLS]Pro Stock'!E62 -> 381 | F58: =IF('\\SER\Software\other\[POINTS NQS  2012.XLS]Pro Stock'!F62=0," ",'\\SER\Software\other\[POINTS NQS  2012.XLS]Pro Stock'!F62) -> Knapp Time | G58: ='\\SER\Software\other\[POINTS NQS  2012.XLS]Pro Stock'!AA62 -> 52 | I58: ='\\SER\Software\other\[POINTS NQS  2012.XLS]Super Stock'!A62 -> 56 | J58: ='\\SER\Software\other\[POINTS NQS  2012.XLS]Super Stock'!B62 -> Tooter Campbell | K58: ='\\SER\Software\other\[POINTS NQS  2012.XLS]Super Stock'!C62 -> Owensboro, KY | L58: ='\\SER\Software\other\[POINTS NQS  2012.XLS]Super Stock'!D62 -> TC | M58: ='\\SER\Software\other\[POINTS NQS  2012.XLS]Super Stock'!E62 -> 473 | N58: =IF('\\SER\Software\other\[POINTS NQS  2012.XLS]Super Stock'!F62=0," ",'\\SER\Software\other\[POINTS NQS  2012.XLS]Super Stock'!F62) -> Tractor Trash | O58: ='\\SER\Software\other\[POINTS NQS  2012.XLS]Super Stock'!AA62 -> 52
A59: ='\\SER\Software\other\[POINTS NQS  2012.XLS]Pro Stock'!A63 -> 57 | B59: ='\\SER\Software\other\[POINTS NQS  2012.XLS]Pro Stock'!B63 -> Ray Gentz | C59: ='\\SER\Software\other\[POINTS NQS  2012.XLS]Pro Stock'!C63 -> Colon, Mich | D59: ='\\SER\Software\other\[POINTS NQS  2012.XLS]Pro Stock'!D63 -> JRS | E59: ='\\SER\Software\other\[POINTS NQS  2012.XLS]Pro Stock'!E63 -> 35 | F59: =IF('\\SER\Software\other\[POINTS NQS  2012.XLS]Pro Stock'!F63=0," ",'\\SER\Software\other\[POINTS NQS  2012.XLS]Pro Stock'!F63) -> B.U. Cub | G59: ='\\SER\Software\other\[POINTS NQS  2012.XLS]Pro Stock'!AA63 -> 53 | I59: ='\\SER\Software\other\[POINTS NQS  2012.XLS]Super Stock'!A63 -> 57 | J59: ='\\SER\Software\other\[POINTS NQS  2012.XLS]Super Stock'!B63 -> Shaun Vogler | K59: ='\\SER\Software\other\[POINTS NQS  2012.XLS]Super Stock'!C63 -> Jasper, IN | L59: ='\\SER\Software\other\[POINTS NQS  2012.XLS]Super Stock'!D63 -> JRS | M59: ='\\SER\Software\other\[POINTS NQS  2012.XLS]Super Stock'!E63 -> 129 | N59: =IF('\\SER\Software\other\[POINTS NQS  2012.XLS]Super Stock'!F63=0," ",'\\SER\Software\other\[POINTS NQS  2012.XLS]Super Stock'!F63) -> Renegade | O59: ='\\SER\Software\other\[POINTS NQS  2012.XLS]Super Stock'!AA63 -> 53
A60: ='\\SER\Software\other\[POINTS NQS  2012.XLS]Pro Stock'!A64 -> 58 | B60: ='\\SER\Software\other\[POINTS NQS  2012.XLS]Pro Stock'!B64 -> Kevin Root | C60: ='\\SER\Software\other\[POINTS NQS  2012.XLS]Pro Stock'!C64 -> Inola, OKLA | D60: ='\\SER\Software\other\[POINTS NQS  2012.XLS]Pro Stock'!D64 -> Root | E60: ='\\SER\Software\other\[POINTS NQS  2012.XLS]Pro Stock'!E64 -> 118 | F60: =IF('\\SER\Software\other\[POINTS NQS  2012.XLS]Pro Stock'!F64=0," ",'\\SER\Software\other\[POINTS NQS  2012.XLS]Pro Stock'!F64) -> Slap Shot | G60: ='\\SER\Software\other\[POINTS NQS  2012.XLS]Pro Stock'!AA64 -> 53 | I60: ='\\SER\Software\other\[POINTS NQS  2012.XLS]Super Stock'!A64 -> 58 | J60: ='\\SER\Software\other\[POINTS NQS  2012.XLS]Super Stock'!B64 -> David Mascher Jr | K60: ='\\SER\Software\other\[POINTS NQS  2012.XLS]Super Stock'!C64 -> Beech Grove, IN | L60: ='\\SER\Software\other\[POINTS NQS  2012.XLS]Super Stock'!D64 -> Mascher | M60: ='\\SER\Software\other\[POINTS NQS  2012.XLS]Super Stock'!E64 -> 163 | N60: =IF('\\SER\Software\other\[POINTS NQS  2012.XLS]Super Stock'!F64=0," ",'\\SER\Software\other\[POINTS NQS  2012.XLS]Super Stock'!F64) -> Thunder Pumpkin | O60: ='\\SER\Software\other\[POINTS NQS  2012.XLS]Super Stock'!AA64 -> 53
A61: ='\\SER\Software\other\[POINTS NQS  2012.XLS]Pro Stock'!A65 -> 59 | B61: ='\\SER\Software\other\[POINTS NQS  2012.XLS]Pro Stock'!B65 -> Rick Slade | C61: ='\\SER\Software\other\[POINTS NQS  2012.XLS]Pro Stock'!C65 -> Harveyville, KS | D61: ='\\SER\Software\other\[POINTS NQS  2012.XLS]Pro Stock'!D65 -> JRS | E61: ='\\SER\Software\other\[POINTS NQS  2012.XLS]Pro Stock'!E65 -> 467 | F61: =IF('\\SER\Software\other\[POINTS NQS  2012.XLS]Pro Stock'!F65=0," ",'\\SER\Software\other\[POINTS NQS  2012.XLS]Pro Stock'!F65) -> Ricochet | G61: ='\\SER\Software\other\[POINTS NQS  2012.XLS]Pro Stock'!AA65 -> 53 | I61: ='\\SER\Software\other\[POINTS NQS  2012.XLS]Super Stock'!A65 -> 59 | J61: ='\\SER\Software\other\[POINTS NQS  2012.XLS]Super Stock'!B65 -> Steve Vogler | K61: ='\\SER\Software\other\[POINTS NQS  2012.XLS]Super Stock'!C65 -> Jasper, IN | L61: ='\\SER\Software\other\[POINTS NQS  2012.XLS]Super Stock'!D65 -> JRS | M61: ='\\SER\Software\other\[POINTS NQS  2012.XLS]Super Stock'!E65 -> 476 | N61: =IF('\\SER\Software\other\[POINTS NQS  2012.XLS]Super Stock'!F65=0," ",'\\SER\Software\other\[POINTS NQS  2012.XLS]Super Stock'!F65) -> Outlaw Reloaded | O61: ='\\SER\Software\other\[POINTS NQS  2012.XLS]Super Stock'!AA65 -> 53
A62: ='\\SER\Software\other\[POINTS NQS  2012.XLS]Pro Stock'!A66 -> 60 | B62: ='\\SER\Software\other\[POINTS NQS  2012.XLS]Pro Stock'!B66 -> Shane Hadley | C62: ='\\SER\Software\other\[POINTS NQS  2012.XLS]Pro Stock'!C66 -> Marion, KY | D62: ='\\SER\Software\other\[POINTS NQS  2012.XLS]Pro Stock'!D66 -> JRS | E62: ='\\SER\Software\other\[POINTS NQS  2012.XLS]Pro Stock'!E66 -> 505 | F62: =IF('\\SER\Software\other\[POINTS NQS  2012.XLS]Pro Stock'!F66=0," ",'\\SER\Software\other\[POINTS NQS  2012.XLS]Pro Stock'!F66) ->  | G62: ='\\SER\Software\other\[POINTS NQS  2012.XLS]Pro Stock'!AA66 -> 53 | I62: ='\\SER\Software\other\[POINTS NQS  2012.XLS]Super Stock'!A66 -> 60 | J62: ='\\SER\Software\other\[POINTS NQS  2012.XLS]Super Stock'!B66 -> Darlene Sample | K62: ='\\SER\Software\other\[POINTS NQS  2012.XLS]Super Stock'!C66 -> Carrollton, OH | L62: ='\\SER\Software\other\[POINTS NQS  2012.XLS]Super Stock'!D66 -> LR | M62: ='\\SER\Software\other\[POINTS NQS  2012.XLS]Super Stock'!E66 -> 498 | N62: =IF('\\SER\Software\other\[POINTS NQS  2012.XLS]Super Stock'!F66=0," ",'\\SER\Software\other\[POINTS NQS  2012.XLS]Super Stock'!F66) -> Dr. Doom | O62: ='\\SER\Software\other\[POINTS NQS  2012.XLS]Super Stock'!AA66 -> 53
A63: ='\\SER\Software\other\[POINTS NQS  2012.XLS]Pro Stock'!A67 -> 61 | B63: ='\\SER\Software\other\[POINTS NQS  2012.XLS]Pro Stock'!B67 -> Brad Corzine | C63: ='\\SER\Software\other\[POINTS NQS  2012.XLS]Pro Stock'!C67 -> Dongola, ILL | D63: ='\\SER\Software\other\[POINTS NQS  2012.XLS]Pro Stock'!D67 -> JW | E63: ='\\SER\Software\other\[POINTS NQS  2012.XLS]Pro Stock'!E67 -> 509 | F63: =IF('\\SER\Software\other\[POINTS NQS  2012.XLS]Pro Stock'!F67=0," ",'\\SER\Software\other\[POINTS NQS  2012.XLS]Pro Stock'!F67) -> Just Black | G63: ='\\SER\Software\other\[POINTS NQS  2012.XLS]Pro Stock'!AA67 -> 53 | I63: ='\\SER\Software\other\[POINTS NQS  2012.XLS]Super Stock'!A67 -> 61 | J63: ='\\SER\Software\other\[POINTS NQS  2012.XLS]Super Stock'!B67 -> Kevin Root | K63: ='\\SER\Software\other\[POINTS NQS  2012.XLS]Super Stock'!C67 -> Inola, OK | L63: ='\\SER\Software\other\[POINTS NQS  2012.XLS]Super Stock'!D67 -> Root | M63: ='\\SER\Software\other\[POINTS NQS  2012.XLS]Super Stock'!E67 -> 117 | N63: =IF('\\SER\Software\other\[POINTS NQS  2012.XLS]Super Stock'!F67=0," ",'\\SER\Software\other\[POINTS NQS  2012.XLS]Super Stock'!F67) -> Right on the Money | O63: ='\\SER\Software\other\[POINTS NQS  2012.XLS]Super Stock'!AA67 -> 54
A64: ='\\SER\Software\other\[POINTS NQS  2012.XLS]Pro Stock'!A68 -> 62 | B64: ='\\SER\Software\other\[POINTS NQS  2012.XLS]Pro Stock'!B68 -> Larry Curtsinger | C64: ='\\SER\Software\other\[POINTS NQS  2012.XLS]Pro Stock'!C68 -> Carlisle, KY | D64: ='\\SER\Software\other\[POINTS NQS  2012.XLS]Pro Stock'!D68 -> NP | E64: ='\\SER\Software\other\[POINTS NQS  2012.XLS]Pro Stock'!E68 -> 9 | F64: =IF('\\SER\Software\other\[POINTS NQS  2012.XLS]Pro Stock'!F68=0," ",'\\SER\Software\other\[POINTS NQS  2012.XLS]Pro Stock'!F68) -> Runaway Deere | G64: ='\\SER\Software\other\[POINTS NQS  2012.XLS]Pro Stock'!AA68 -> 54 | I64: ='\\SER\Software\other\[POINTS NQS  2012.XLS]Super Stock'!A68 -> 62 | J64: ='\\SER\Software\other\[POINTS NQS  2012.XLS]Super Stock'!B68 -> Dave Gawatz | K64: ='\\SER\Software\other\[POINTS NQS  2012.XLS]Super Stock'!C68 -> St. Joseph, MO | L64: ='\\SER\Software\other\[POINTS NQS  2012.XLS]Super Stock'!D68 -> LR | M64: ='\\SER\Software\other\[POINTS NQS  2012.XLS]Super Stock'!E68 -> 367 | N64: =IF('\\SER\Software\other\[POINTS NQS  2012.XLS]Super Stock'!F68=0," ",'\\SER\Software\other\[POINTS NQS  2012.XLS]Super Stock'!F68) -> Lil' Sprout | O64: ='\\SER\Software\other\[POINTS NQS  2012.XLS]Super Stock'!AA68 -> 54
A65: ='\\SER\Software\other\[POINTS NQS  2012.XLS]Pro Stock'!A69 -> 63 | B65: ='\\SER\Software\other\[POINTS NQS  2012.XLS]Pro Stock'!B69 -> Bruce Austin | C65: ='\\SER\Software\other\[POINTS NQS  2012.XLS]Pro Stock'!C69 -> St Charles, IA | D65: ='\\SER\Software\other\[POINTS NQS  2012.XLS]Pro Stock'!D69 -> MVP | E65: ='\\SER\Software\other\[POINTS NQS  2012.XLS]Pro Stock'!E69 -> 338 | F65: =IF('\\SER\Software\other\[POINTS NQS  2012.XLS]Pro Stock'!F69=0," ",'\\SER\Software\other\[POINTS NQS  2012.XLS]Pro Stock'!F69) -> Hillbilly Headache | G65: ='\\SER\Software\other\[POINTS NQS  2012.XLS]Pro Stock'!AA69 -> 54 | I65: ='\\SER\Software\other\[POINTS NQS  2012.XLS]Super Stock'!A69 -> 63 | J65: ='\\SER\Software\other\[POINTS NQS  2012.XLS]Super Stock'!B69 -> David Knapp | K65: ='\\SER\Software\other\[POINTS NQS  2012.XLS]Super Stock'!C69 -> Hennepin, IL | L65: ='\\SER\Software\other\[POINTS NQS  2012.XLS]Super Stock'!D69 -> MVP | M65: ='\\SER\Software\other\[POINTS NQS  2012.XLS]Super Stock'!E69 -> 381 | N65: =IF('\\SER\Software\other\[POINTS NQS  2012.XLS]Super Stock'!F69=0," ",'\\SER\Software\other\[POINTS NQS  2012.XLS]Super Stock'!F69) -> Knapp Time | O65: ='\\SER\Software\other\[POINTS NQS  2012.XLS]Super Stock'!AA69 -> 54 | Q65: 0
A66: ='\\SER\Software\other\[POINTS NQS  2012.XLS]Pro Stock'!A70 -> 64 | B66: ='\\SER\Software\other\[POINTS NQS  2012.XLS]Pro Stock'!B70 -> David Mascher SR | C66: ='\\SER\Software\other\[POINTS NQS  2012.XLS]Pro Stock'!C70 -> Mooresville, Ind | D66: ='\\SER\Software\other\[POINTS NQS  2012.XLS]Pro Stock'!D70 -> Mascher | E66: ='\\SER\Software\other\[POINTS NQS  2012.XLS]Pro Stock'!E70 -> 512 | F66: =IF('\\SER\Software\other\[POINTS NQS  2012.XLS]Pro Stock'!F70=0," ",'\\SER\Software\other\[POINTS NQS  2012.XLS]Pro Stock'!F70) ->  | G66: ='\\SER\Software\other\[POINTS NQS  2012.XLS]Pro Stock'!AA70 -> 54 | I66: ='\\SER\Software\other\[POINTS NQS  2012.XLS]Super Stock'!A70 -> 64 | J66: ='\\SER\Software\other\[POINTS NQS  2012.XLS]Super Stock'!B70 -> Mike Spencer | K66: ='\\SER\Software\other\[POINTS NQS  2012.XLS]Super Stock'!C70 -> West Alexandria, OH | L66: ='\\SER\Software\other\[POINTS NQS  2012.XLS]Super Stock'!D70 -> MVP | M66: ='\\SER\Software\other\[POINTS NQS  2012.XLS]Super Stock'!E70 -> 517 | N66: =IF('\\SER\Software\other\[POINTS NQS  2012.XLS]Super Stock'!F70=0," ",'\\SER\Software\other\[POINTS NQS  2012.XLS]Super Stock'!F70) -> Half Pint | O66: ='\\SER\Software\other\[POINTS NQS  2012.XLS]Super Stock'!AA70 -> 54
I67: ='\\SER\Software\other\[POINTS NQS  2012.XLS]Super Stock'!A71 -> 65 | J67: ='\\SER\Software\other\[POINTS NQS  2012.XLS]Super Stock'!B71 -> Ron Scroggins | K67: ='\\SER\Software\other\[POINTS NQS  2012.XLS]Super Stock'!C71 -> Neosho, MO | L67: ='\\SER\Software\other\[POINTS NQS  2012.XLS]Super Stock'!D71 -> VM | M67: ='\\SER\Software\other\[POINTS NQS  2012.XLS]Super Stock'!E71 -> 110 | N67: =IF('\\SER\Software\other\[POINTS NQS  2012.XLS]Super Stock'!F71=0," ",'\\SER\Software\other\[POINTS NQS  2012.XLS]Super Stock'!F71) -> Dirt Dancer | O67: ='\\SER\Software\other\[POINTS NQS  2012.XLS]Super Stock'!AA71 -> 55
I68: ='\\SER\Software\other\[POINTS NQS  2012.XLS]Super Stock'!A72 -> 66 | J68: ='\\SER\Software\other\[POINTS NQS  2012.XLS]Super Stock'!B72 -> Jeff Chrisman | K68: ='\\SER\Software\other\[POINTS NQS  2012.XLS]Super Stock'!C72 -> Edinburgh, IN | L68: ='\\SER\Software\other\[POINTS NQS  2012.XLS]Super Stock'!D72 -> VM | M68: ='\\SER\Software\other\[POINTS NQS  2012.XLS]Super Stock'!E72 -> 180 | N68: =IF('\\SER\Software\other\[POINTS NQS  2012.XLS]Super Stock'!F72=0," ",'\\SER\Software\other\[POINTS NQS  2012.XLS]Super Stock'!F72) ->  | O68: ='\\SER\Software\other\[POINTS NQS  2012.XLS]Super Stock'!AA72 -> 55
I69: ='\\SER\Software\other\[POINTS NQS  2012.XLS]Super Stock'!A73 -> 67 | J69: ='\\SER\Software\other\[POINTS NQS  2012.XLS]Super Stock'!B73 -> Bradley Corzine | K69: ='\\SER\Software\other\[POINTS NQS  2012.XLS]Super Stock'!C73 -> Dongola, IL | L69: ='\\SER\Software\other\[POINTS NQS  2012.XLS]Super Stock'!D73 -> JW | M69: ='\\SER\Software\other\[POINTS NQS  2012.XLS]Super Stock'!E73 -> 509 | N69: =IF('\\SER\Software\other\[POINTS NQS  2012.XLS]Super Stock'!F73=0," ",'\\SER\Software\other\[POINTS NQS  2012.XLS]Super Stock'!F73) -> Just Black | O69: ='\\SER\Software\other\[POINTS NQS  2012.XLS]Super Stock'!AA73 -> 55
I70: ='\\SER\Software\other\[POINTS NQS  2012.XLS]Super Stock'!A74 -> 68 | J70: ='\\SER\Software\other\[POINTS NQS  2012.XLS]Super Stock'!B74 -> Phil Burton | K70: ='\\SER\Software\other\[POINTS NQS  2012.XLS]Super Stock'!C74 -> Kokomo, IN | L70: ='\\SER\Software\other\[POINTS NQS  2012.XLS]Super Stock'!D74 -> Jagerville | M70: ='\\SER\Software\other\[POINTS NQS  2012.XLS]Super Stock'!E74 -> 519 | N70: =IF('\\SER\Software\other\[POINTS NQS  2012.XLS]Super Stock'!F74=0," ",'\\SER\Software\other\[POINTS NQS  2012.XLS]Super Stock'!F74) -> Goofy Express | O70: ='\\SER\Software\other\[POINTS NQS  2012.XLS]Super Stock'!AA74 -> 55
I71: ='\\SER\Software\other\[POINTS NQS  2012.XLS]Super Stock'!A75 -> 69 | J71: ='\\SER\Software\other\[POINTS NQS  2012.XLS]Super Stock'!B75 -> Max Burkhart | K71: ='\\SER\Software\other\[POINTS NQS  2012.XLS]Super Stock'!C75 -> Otwell, IN | L71: ='\\SER\Software\other\[POINTS NQS  2012.XLS]Super Stock'!D75 -> TC | M71: ='\\SER\Software\other\[POINTS NQS  2012.XLS]Super Stock'!E75 -> 78 | N71: =IF('\\SER\Software\other\[POINTS NQS  2012.XLS]Super Stock'!F75=0," ",'\\SER\Software\other\[POINTS NQS  2012.XLS]Super Stock'!F75) -> Ground Pounder | O71: ='\\SER\Software\other\[POINTS NQS  2012.XLS]Super Stock'!AA75 -> 56
I72: ='\\SER\Software\other\[POINTS NQS  2012.XLS]Super Stock'!A76 -> 70 | J72: ='\\SER\Software\other\[POINTS NQS  2012.XLS]Super Stock'!B76 -> Lee Blesch | K72: ='\\SER\Software\other\[POINTS NQS  2012.XLS]Super Stock'!C76 -> Holland, IN | L72: ='\\SER\Software\other\[POINTS NQS  2012.XLS]Super Stock'!D76 -> TC | M72: ='\\SER\Software\other\[POINTS NQS  2012.XLS]Super Stock'!E76 -> 344 | N72: =IF('\\SER\Software\other\[POINTS NQS  2012.XLS]Super Stock'!F76=0," ",'\\SER\Software\other\[POINTS NQS  2012.XLS]Super Stock'!F76) -> Orange Blossom Special | O72: ='\\SER\Software\other\[POINTS NQS  2012.XLS]Super Stock'!AA76 -> 56
I73: ='\\SER\Software\other\[POINTS NQS  2012.XLS]Super Stock'!A77 -> 71 | J73: ='\\SER\Software\other\[POINTS NQS  2012.XLS]Super Stock'!B77 -> Scott DeFabritis | K73: ='\\SER\Software\other\[POINTS NQS  2012.XLS]Super Stock'!C77 -> Kokomo, IN | L73: ='\\SER\Software\other\[POINTS NQS  2012.XLS]Super Stock'!D77 -> Jagerville | M73: ='\\SER\Software\other\[POINTS NQS  2012.XLS]Super Stock'!E77 -> 518 | N73: =IF('\\SER\Software\other\[POINTS NQS  2012.XLS]Super Stock'!F77=0," ",'\\SER\Software\other\[POINTS NQS  2012.XLS]Super Stock'!F77) -> Back Yard Banshee | O73: ='\\SER\Software\other\[POINTS NQS  2012.XLS]Super Stock'!AA77 -> 56
I74: ='\\SER\Software\other\[POINTS NQS  2012.XLS]Super Stock'!A78 -> 72 | J74: ='\\SER\Software\other\[POINTS NQS  2012.XLS]Super Stock'!B78 -> Nick Moeller | K74: ='\\SER\Software\other\[POINTS NQS  2012.XLS]Super Stock'!C78 -> Effingham, IL | L74: ='\\SER\Software\other\[POINTS NQS  2012.XLS]Super Stock'!D78 -> Moeller | M74: ='\\SER\Software\other\[POINTS NQS  2012.XLS]Super Stock'!E78 -> 520 | N74: =IF('\\SER\Software\other\[POINTS NQS  2012.XLS]Super Stock'!F78=0," ",'\\SER\Software\other\[POINTS NQS  2012.XLS]Super Stock'!F78) -> Bull on IX | O74: ='\\SER\Software\other\[POINTS NQS  2012.XLS]Super Stock'!AA78 -> 56
I75: ='\\SER\Software\other\[POINTS NQS  2012.XLS]Super Stock'!A79 -> 73 | J75: ='\\SER\Software\other\[POINTS NQS  2012.XLS]Super Stock'!B79 -> John Donavon | K75: ='\\SER\Software\other\[POINTS NQS  2012.XLS]Super Stock'!C79 -> Pataskala, OH | L75: ='\\SER\Software\other\[POINTS NQS  2012.XLS]Super Stock'!D79 -> JRS | M75: ='\\SER\Software\other\[POINTS NQS  2012.XLS]Super Stock'!E79 -> 6 | N75: =IF('\\SER\Software\other\[POINTS NQS  2012.XLS]Super Stock'!F79=0," ",'\\SER\Software\other\[POINTS NQS  2012.XLS]Super Stock'!F79) -> John's Deere | O75: ='\\SER\Software\other\[POINTS NQS  2012.XLS]Super Stock'!AA79 -> 57
I76: ='\\SER\Software\other\[POINTS NQS  2012.XLS]Super Stock'!A80 -> 74 | J76: ='\\SER\Software\other\[POINTS NQS  2012.XLS]Super Stock'!B80 -> Kevin Root | K76: ='\\SER\Software\other\[POINTS NQS  2012.XLS]Super Stock'!C80 -> Inola, OK | L76: ='\\SER\Software\other\[POINTS NQS  2012.XLS]Super Stock'!D80 -> Root | M76: ='\\SER\Software\other\[POINTS NQS  2012.XLS]Super Stock'!E80 -> 118 | N76: =IF('\\SER\Software\other\[POINTS NQS  2012.XLS]Super Stock'!F80=0," ",'\\SER\Software\other\[POINTS NQS  2012.XLS]Super Stock'!F80) -> Slap Shot | O76: ='\\SER\Software\other\[POINTS NQS  2012.XLS]Super Stock'!AA80 -> 57
I77: ='\\SER\Software\other\[POINTS NQS  2012.XLS]Super Stock'!A81 -> 75 | J77: ='\\SER\Software\other\[POINTS NQS  2012.XLS]Super Stock'!B81 -> Bradley Corzine | K77: ='\\SER\Software\other\[POINTS NQS  2012.XLS]Super Stock'!C81 -> Dongola, IL | L77: ='\\SER\Software\other\[POINTS NQS  2012.XLS]Super Stock'!D81 -> JW | M77: ='\\SER\Software\other\[POINTS NQS  2012.XLS]Super Stock'!E81 -> 477 | N77: =IF('\\SER\Software\other\[POINTS NQS  2012.XLS]Super Stock'!F81=0," ",'\\SER\Software\other\[POINTS NQS  2012.XLS]Super Stock'!F81) -> Black Cat's Revenge | O77: ='\\SER\Software\other\[POINTS NQS  2012.XLS]Super Stock'!AA81 -> 57
I78: ='\\SER\Software\other\[POINTS NQS  2012.XLS]Super Stock'!A82 -> 76 | J78: ='\\SER\Software\other\[POINTS NQS  2012.XLS]Super Stock'!B82 -> Shane Hadley | K78: ='\\SER\Software\other\[POINTS NQS  2012.XLS]Super Stock'!C82 -> Marion, NY | L78: ='\\SER\Software\other\[POINTS NQS  2012.XLS]Super Stock'!D82 -> JRS | M78: ='\\SER\Software\other\[POINTS NQS  2012.XLS]Super Stock'!E82 -> 505 | N78: =IF('\\SER\Software\other\[POINTS NQS  2012.XLS]Super Stock'!F82=0," ",'\\SER\Software\other\[POINTS NQS  2012.XLS]Super Stock'!F82) ->  | O78: ='\\SER\Software\other\[POINTS NQS  2012.XLS]Super Stock'!AA82 -> 57
I79: ='\\SER\Software\other\[POINTS NQS  2012.XLS]Super Stock'!A83 -> 77 | J79: ='\\SER\Software\other\[POINTS NQS  2012.XLS]Super Stock'!B83 -> Charlie Ciolino | K79: ='\\SER\Software\other\[POINTS NQS  2012.XLS]Super Stock'!C83 -> Hammond, LA | L79: ='\\SER\Software\other\[POINTS NQS  2012.XLS]Super Stock'!D83 -> MVP | M79: ='\\SER\Software\other\[POINTS NQS  2012.XLS]Super Stock'!E83 -> 145 | N79: =IF('\\SER\Software\other\[POINTS NQS  2012.XLS]Super Stock'!F83=0," ",'\\SER\Software\other\[POINTS NQS  2012.XLS]Super Stock'!F83) -> Mechanical Nightmare | O79: ='\\SER\Software\other\[POINTS NQS  2012.XLS]Super Stock'!AA83 -> 58
I80: ='\\SER\Software\other\[POINTS NQS  2012.XLS]Super Stock'!A84 -> 78 | J80: ='\\SER\Software\other\[POINTS NQS  2012.XLS]Super Stock'!B84 -> Ray Gentz | K80: ='\\SER\Software\other\[POINTS NQS  2012.XLS]Super Stock'!C84 -> Colon, MI | L80: ='\\SER\Software\other\[POINTS NQS  2012.XLS]Super Stock'!D84 -> JRS | M80: ='\\SER\Software\other\[POINTS NQS  2012.XLS]Super Stock'!E84 -> 262 | N80: =IF('\\SER\Software\other\[POINTS NQS  2012.XLS]Super Stock'!F84=0," ",'\\SER\Software\other\[POINTS NQS  2012.XLS]Super Stock'!F84) -> Chaos | O80: ='\\SER\Software\other\[POINTS NQS  2012.XLS]Super Stock'!AA84 -> 58
I81: ='\\SER\Software\other\[POINTS NQS  2012.XLS]Super Stock'!A85 -> 79 | J81: ='\\SER\Software\other\[POINTS NQS  2012.XLS]Super Stock'!B85 -> Rick Massey | K81: ='\\SER\Software\other\[POINTS NQS  2012.XLS]Super Stock'!C85 -> Ava, MO | L81: ='\\SER\Software\other\[POINTS NQS  2012.XLS]Super Stock'!D85 -> 0 | M81: ='\\SER\Software\other\[POINTS NQS  2012.XLS]Super Stock'!E85 -> 420 | N81: =IF('\\SER\Software\other\[POINTS NQS  2012.XLS]Super Stock'!F85=0," ",'\\SER\Software\other\[POINTS NQS  2012.XLS]Super Stock'!F85) -> Special Addiction | O81: ='\\SER\Software\other\[POINTS NQS  2012.XLS]Super Stock'!AA85 -> 59
I82: ='\\SER\Software\other\[POINTS NQS  2012.XLS]Super Stock'!A86 -> 80 | J82: ='\\SER\Software\other\[POINTS NQS  2012.XLS]Super Stock'!B86 -> Mike Kyle | K82: ='\\SER\Software\other\[POINTS NQS  2012.XLS]Super Stock'!C86 -> Edinburgh, IN | L82: ='\\SER\Software\other\[POINTS NQS  2012.XLS]Super Stock'!D86 -> VM | M82: ='\\SER\Software\other\[POINTS NQS  2012.XLS]Super Stock'!E86 -> 394 | N82: =IF('\\SER\Software\other\[POINTS NQS  2012.XLS]Super Stock'!F86=0," ",'\\SER\Software\other\[POINTS NQS  2012.XLS]Super Stock'!F86) ->  | O82: ='\\SER\Software\other\[POINTS NQS  2012.XLS]Super Stock'!AA86 -> 69